CRASH DATE,CRASH TIME,LATITUDE,LONGITUDE,BOROUGH,NUMBER OF PERSONS INJURED,NUMBER OF PERSONS KILLED,NUMBER OF PEDESTRIANS INJURED,NUMBER OF PEDESTRIANS KILLED,NUMBER OF CYCLIST INJURED,NUMBER OF CYCLIST KILLED,NUMBER OF MOTORIST INJURED,NUMBER OF MOTORIST KILLED,COLLISION_ID,datetime,iso_datetime,year,month,temperature,precipitation,weather_condition
01/07/2023,13:00,40.857857,-73.86678,BRONX,1.0,0.0,0,0,0,0,1,0,4596330,2023-01-07 13:00:00,2023-01-07T13:00,2023,1,8.0,0.0,Clear
06/24/2023,15:00,40.820858,-73.912575,BRONX,1.0,0.0,0,0,0,0,1,0,4649047,2023-06-24 15:00:00,2023-06-24T15:00,2023,6,24.4,0.0,Cloudy
11/06/2023,18:00,40.815754,-73.89529,BRONX,2.0,0.0,0,0,0,0,2,0,4677225,2023-11-06 18:00:00,2023-11-06T18:00,2023,11,7.0,0.0,Clear
04/07/2023,17:00,40.875458,-73.85485,BRONX,3.0,0.0,0,0,0,0,3,0,4620386,2023-04-07 17:00:00,2023-04-07T17:00,2023,4,10.5,0.0,Cloudy
08/01/2023,0:00,40.85574,-73.84023,BRONX,1.0,0.0,0,0,1,0,0,0,4653273,2023-08-01 00:00:00,2023-08-01T00:00,2023,8,18.9,0.0,Cloudy
08/07/2023,20:00,40.817116,-73.88307,BRONX,1.0,0.0,1,0,0,0,0,0,4652628,2023-08-07 20:00:00,2023-08-07T20:00,2023,8,23.3,4.8,Heavy Rain
05/06/2023,21:00,40.81645,-73.91918,BRONX,1.0,0.0,0,0,0,0,1,0,4629298,2023-05-06 21:00:00,2023-05-06T21:00,2023,5,13.4,0.0,Clear
02/13/2023,15:00,40.806065,-73.90905,BRONX,1.0,0.0,0,0,0,0,1,0,4606299,2023-02-13 15:00:00,2023-02-13T15:00,2023,2,12.7,0.0,Clear
08/05/2023,13:00,40.82596,-73.91167,BRONX,1.0,0.0,1,0,0,0,0,0,4651697,2023-08-05 13:00:00,2023-08-05T13:00,2023,8,29.6,0.0,Cloudy
03/19/2023,5:00,40.860996,-73.89643,BRONX,0.0,0.0,0,0,0,0,0,0,4614118,2023-03-19 05:00:00,2023-03-19T05:00,2023,3,-1.9,0.0,Clear
08/22/2023,18:00,40.84809,-73.856285,BRONX,1.0,0.0,0,0,0,0,0,0,4656335,2023-08-22 18:00:00,2023-08-22T18:00,2023,8,23.6,0.0,Cloudy
05/18/2023,7:00,40.81922,-73.91062,BRONX,1.0,0.0,0,0,1,0,0,0,4630190,2023-05-18 07:00:00,2023-05-18T07:00,2023,5,9.3,0.0,Clear
11/19/2023,16:00,40.86027,-73.82459,BRONX,2.0,0.0,0,0,0,0,2,0,4680305,2023-11-19 16:00:00,2023-11-19T16:00,2023,11,11.0,0.0,Clear
09/29/2023,11:00,40.8262,-73.821686,BRONX,1.0,0.0,1,0,0,0,0,0,4666372,2023-09-29 11:00:00,2023-09-29T11:00,2023,9,14.6,10.6,Heavy Rain
11/11/2023,18:00,40.868626,-73.902176,BRONX,1.0,0.0,0,0,1,0,0,0,4679235,2023-11-11 18:00:00,2023-11-11T18:00,2023,11,7.5,0.0,Cloudy
07/26/2023,23:00,40.81464,-73.885574,BRONX,0.0,0.0,0,0,0,0,0,0,4651287,2023-07-26 23:00:00,2023-07-26T23:00,2023,7,23.2,0.0,Cloudy
02/14/2023,13:00,40.89481,-73.86183,BRONX,1.0,0.0,0,0,0,0,1,0,4607116,2023-02-14 13:00:00,2023-02-14T13:00,2023,2,10.0,0.0,Clear
01/20/2023,0:00,40.831264,-73.87885,BRONX,1.0,0.0,1,0,0,0,0,0,4600469,2023-01-20 00:00:00,2023-01-20T00:00,2023,1,4.6,0.3,Drizzle
03/23/2023,16:00,40.820187,-73.890686,BRONX,0.0,0.0,0,0,0,0,0,0,4615179,2023-03-23 16:00:00,2023-03-23T16:00,2023,3,14.5,0.0,Cloudy
08/08/2023,11:00,40.83908,-73.82077,BRONX,0.0,0.0,0,0,0,0,0,0,4653617,2023-08-08 11:00:00,2023-08-08T11:00,2023,8,25.8,0.1,Drizzle
07/16/2023,1:00,40.814186,-73.92125,BRONX,1.0,0.0,0,0,1,0,0,0,4652689,2023-07-16 01:00:00,2023-07-16T01:00,2023,7,21.4,3.7,Heavy Rain
01/25/2023,22:00,40.814934,-73.91496,BRONX,1.0,0.0,1,0,0,0,0,0,4600615,2023-01-25 22:00:00,2023-01-25T22:00,2023,1,11.2,2.6,Heavy Rain
10/10/2023,8:00,40.81304,-73.908165,BRONX,1.0,0.0,1,0,0,0,0,0,4670944,2023-10-10 08:00:00,2023-10-10T08:00,2023,10,12.4,0.0,Cloudy
08/11/2023,16:00,40.838844,-73.87817,BRONX,1.0,0.0,0,0,0,0,1,0,4655285,2023-08-11 16:00:00,2023-08-11T16:00,2023,8,28.5,0.0,Clear
08/10/2023,0:00,40.82082,-73.91562,BRONX,1.0,0.0,0,0,0,0,1,0,4654572,2023-08-10 00:00:00,2023-08-10T00:00,2023,8,20.4,0.0,Clear
07/04/2023,14:00,40.83722,-73.818016,BRONX,0.0,0.0,0,0,0,0,0,0,4646236,2023-07-04 14:00:00,2023-07-04T14:00,2023,7,28.6,0.2,Drizzle
04/10/2023,9:00,40.844177,-73.89744,BRONX,1.0,0.0,0,0,0,0,1,0,4620444,2023-04-10 09:00:00,2023-04-10T09:00,2023,4,9.8,0.0,Clear
12/15/2023,8:00,40.83516,-73.85714,BRONX,0.0,0.0,0,0,0,0,0,0,4687367,2023-12-15 08:00:00,2023-12-15T08:00,2023,12,0.7,0.0,Clear
09/07/2023,9:00,40.877308,-73.90595,BRONX,2.0,0.0,0,0,0,0,2,0,4663028,2023-09-07 09:00:00,2023-09-07T09:00,2023,9,29.6,0.0,Clear
01/30/2023,5:00,40.87835,-73.870346,BRONX,1.0,0.0,1,0,0,0,0,0,4601789,2023-01-30 05:00:00,2023-01-30T05:00,2023,1,1.9,0.0,Cloudy
02/21/2023,17:00,40.881344,-73.870476,BRONX,1.0,0.0,0,0,0,0,1,0,4613019,2023-02-21 17:00:00,2023-02-21T17:00,2023,2,5.8,1.1,Drizzle
05/30/2023,13:00,40.821644,-73.84548,BRONX,0.0,0.0,0,0,0,0,0,0,4635156,2023-05-30 13:00:00,2023-05-30T13:00,2023,5,21.2,0.0,Clear
03/11/2023,20:00,40.872875,-73.85101,BRONX,1.0,0.0,0,0,0,0,1,0,4611918,2023-03-11 20:00:00,2023-03-11T20:00,2023,3,2.3,0.0,Cloudy
10/16/2023,0:00,40.81844,-73.824066,BRONX,1.0,0.0,1,0,0,0,0,0,4671229,2023-10-16 00:00:00,2023-10-16T00:00,2023,10,8.9,0.0,Clear
02/24/2023,19:00,40.863476,-73.89017,BRONX,0.0,0.0,0,0,0,0,0,0,4608176,2023-02-24 19:00:00,2023-02-24T19:00,2023,2,-0.3,0.0,Cloudy
12/06/2023,17:00,40.827812,-73.925934,BRONX,1.0,0.0,0,0,0,0,1,0,4685980,2023-12-06 17:00:00,2023-12-06T17:00,2023,12,3.1,0.0,Cloudy
01/29/2023,14:00,40.871506,-73.869995,BRONX,0.0,0.0,0,0,0,0,0,0,4601788,2023-01-29 14:00:00,2023-01-29T14:00,2023,1,9.7,0.0,Cloudy
01/01/2023,5:00,40.844177,-73.89744,BRONX,2.0,0.0,0,0,0,0,2,0,4691624,2023-01-01 05:00:00,2023-01-01T05:00,2023,1,8.8,0.0,Cloudy
09/01/2023,0:00,40.896687,-73.84511,BRONX,1.0,0.0,0,0,0,0,1,0,4658895,2023-09-01 00:00:00,2023-09-01T00:00,2023,9,16.5,0.0,Clear
05/30/2023,0:00,40.895596,-73.85617,BRONX,0.0,0.0,0,0,0,0,0,0,4633387,2023-05-30 00:00:00,2023-05-30T00:00,2023,5,13.1,0.0,Clear
05/03/2023,21:00,40.819004,-73.89479,BRONX,0.0,0.0,0,0,0,0,0,0,4627928,2023-05-03 21:00:00,2023-05-03T21:00,2023,5,9.1,0.0,Cloudy
10/02/2023,9:00,40.827812,-73.925934,BRONX,0.0,0.0,0,0,0,0,0,0,4667921,2023-10-02 09:00:00,2023-10-02T09:00,2023,10,20.8,0.0,Clear
07/26/2023,22:00,40.885544,-73.82896,BRONX,6.0,0.0,0,0,0,0,6,0,4649148,2023-07-26 22:00:00,2023-07-26T22:00,2023,7,23.9,0.0,Cloudy
02/11/2023,19:00,40.843975,-73.913864,BRONX,1.0,0.0,0,0,0,0,1,0,4606099,2023-02-11 19:00:00,2023-02-11T19:00,2023,2,0.6,0.0,Cloudy
04/28/2023,0:00,40.89341,-73.85737,BRONX,1.0,0.0,0,0,0,0,1,0,4625395,2023-04-28 00:00:00,2023-04-28T00:00,2023,4,5.9,0.0,Cloudy
03/09/2023,14:00,40.826153,-73.920265,BRONX,1.0,0.0,1,0,0,0,0,0,4611609,2023-03-09 14:00:00,2023-03-09T14:00,2023,3,10.6,0.0,Cloudy
01/05/2023,11:00,40.819016,-73.84804,BRONX,1.0,0.0,1,0,0,0,0,0,4595741,2023-01-05 11:00:00,2023-01-05T11:00,2023,1,10.1,0.0,Cloudy
04/23/2023,13:00,40.853558,-73.887665,BRONX,1.0,0.0,0,0,0,0,1,0,4624137,2023-04-23 13:00:00,2023-04-23T13:00,2023,4,17.4,0.1,Drizzle
10/02/2023,22:00,40.836346,-73.85222,BRONX,1.0,0.0,0,0,0,0,1,0,4668961,2023-10-02 22:00:00,2023-10-02T22:00,2023,10,15.3,0.0,Clear
03/01/2023,15:00,40.824345,-73.90954,BRONX,2.0,0.0,0,0,0,0,2,0,4609656,2023-03-01 15:00:00,2023-03-01T15:00,2023,3,5.2,0.0,Cloudy
04/22/2023,12:00,40.808716,-73.88497,BRONX,1.0,0.0,0,0,0,0,1,0,4622565,2023-04-22 12:00:00,2023-04-22T12:00,2023,4,19.6,0.0,Cloudy
11/10/2023,11:00,40.884495,-73.83265,BRONX,0.0,0.0,0,0,0,0,0,0,4684467,2023-11-10 11:00:00,2023-11-10T11:00,2023,11,10.7,0.0,Cloudy
06/21/2023,19:00,40.87892,-73.90479,BRONX,2.0,0.0,2,0,0,0,0,0,4658306,2023-06-21 19:00:00,2023-06-21T19:00,2023,6,19.3,0.0,Cloudy
06/28/2023,16:00,40.858707,-73.9037,BRONX,1.0,0.0,1,0,0,0,0,0,4643627,2023-06-28 16:00:00,2023-06-28T16:00,2023,6,25.2,0.2,Drizzle
04/29/2023,0:00,40.868748,-73.83172,BRONX,0.0,0.0,0,0,0,0,0,0,4625062,2023-04-29 00:00:00,2023-04-29T00:00,2023,4,8.7,5.5,Heavy Rain
11/30/2023,16:00,40.816532,-73.92822,BRONX,1.0,0.0,0,0,0,0,1,0,4683843,2023-11-30 16:00:00,2023-11-30T16:00,2023,11,7.8,0.0,Clear
08/28/2023,21:00,40.87754,-73.90026,BRONX,2.0,0.0,0,0,0,0,2,0,4657872,2023-08-28 21:00:00,2023-08-28T21:00,2023,8,20.5,0.0,Cloudy
06/17/2023,20:00,40.80938,-73.925644,BRONX,1.0,0.0,0,0,0,0,1,0,4641385,2023-06-17 20:00:00,2023-06-17T20:00,2023,6,19.3,0.0,Cloudy
09/24/2023,20:00,40.82097,-73.892296,BRONX,1.0,0.0,0,0,1,0,0,0,4666138,2023-09-24 20:00:00,2023-09-24T20:00,2023,9,16.9,0.3,Drizzle
04/29/2023,20:00,40.85706,-73.90469,BRONX,1.0,0.0,1,0,0,0,0,0,4624985,2023-04-29 20:00:00,2023-04-29T20:00,2023,4,10.3,0.6,Drizzle
11/12/2023,1:00,40.81793,-73.9053,BRONX,1.0,0.0,0,0,0,0,1,0,4678685,2023-11-12 01:00:00,2023-11-12T01:00,2023,11,1.9,0.0,Clear
09/24/2023,16:00,40.858368,-73.903915,BRONX,1.0,0.0,0,0,0,0,1,0,4665188,2023-09-24 16:00:00,2023-09-24T16:00,2023,9,17.0,1.7,Light Rain
10/23/2023,2:00,40.844177,-73.90292,BRONX,2.0,0.0,0,0,0,0,2,0,4672792,2023-10-23 02:00:00,2023-10-23T02:00,2023,10,8.6,0.0,Cloudy
07/12/2023,20:00,40.880157,-73.848076,BRONX,0.0,0.0,0,0,0,0,0,0,4645104,2023-07-12 20:00:00,2023-07-12T20:00,2023,7,27.3,0.0,Clear
07/19/2023,8:00,40.868317,-73.88189,BRONX,1.0,0.0,0,0,0,0,1,0,4646810,2023-07-19 08:00:00,2023-07-19T08:00,2023,7,23.7,0.0,Cloudy
11/11/2023,1:00,40.854504,-73.867714,BRONX,1.0,0.0,0,0,0,0,1,0,4678128,2023-11-11 01:00:00,2023-11-11T01:00,2023,11,5.3,0.0,Clear
10/31/2023,8:00,40.865875,-73.82323,BRONX,0.0,0.0,0,0,0,0,0,0,4675295,2023-10-31 08:00:00,2023-10-31T08:00,2023,10,7.6,0.0,Clear
07/05/2023,12:00,40.820747,-73.86766,BRONX,2.0,0.0,0,0,0,0,2,0,4643214,2023-07-05 12:00:00,2023-07-05T12:00,2023,7,30.6,0.0,Clear
10/23/2023,12:00,40.844234,-73.92363,BRONX,1.0,0.0,0,0,0,0,1,0,4673203,2023-10-23 12:00:00,2023-10-23T12:00,2023,10,14.5,0.0,Clear
12/29/2023,13:00,40.838497,-73.86366,BRONX,1.0,0.0,1,0,0,0,0,0,4691438,2023-12-29 13:00:00,2023-12-29T13:00,2023,12,12.6,0.1,Drizzle
10/13/2023,19:00,40.882767,-73.8886,BRONX,1.0,0.0,0,0,0,0,1,0,4672330,2023-10-13 19:00:00,2023-10-13T19:00,2023,10,11.3,0.0,Cloudy
06/19/2023,18:00,40.859615,-73.89524,BRONX,1.0,0.0,1,0,0,0,0,0,4639173,2023-06-19 18:00:00,2023-06-19T18:00,2023,6,22.6,0.0,Cloudy
10/03/2023,17:00,40.8308,-73.85313,BRONX,1.0,0.0,0,0,0,0,1,0,4671566,2023-10-03 17:00:00,2023-10-03T17:00,2023,10,23.8,0.0,Clear
07/16/2023,1:00,40.821068,-73.89894,BRONX,2.0,0.0,0,0,0,0,2,0,4646869,2023-07-16 01:00:00,2023-07-16T01:00,2023,7,21.4,3.7,Heavy Rain
04/17/2023,11:00,40.838196,-73.901184,BRONX,1.0,0.0,1,0,0,0,0,0,4621221,2023-04-17 11:00:00,2023-04-17T11:00,2023,4,15.1,0.0,Cloudy
05/25/2023,14:00,40.88462,-73.831825,BRONX,2.0,0.0,0,0,0,0,2,0,4633686,2023-05-25 14:00:00,2023-05-25T14:00,2023,5,18.6,0.0,Clear
05/17/2023,22:00,40.84442,-73.92505,BRONX,0.0,0.0,0,0,0,0,0,0,4634299,2023-05-17 22:00:00,2023-05-17T22:00,2023,5,9.8,0.0,Clear
07/29/2023,23:00,40.88452,-73.87762,BRONX,1.0,0.0,0,0,1,0,0,0,4650777,2023-07-29 23:00:00,2023-07-29T23:00,2023,7,20.3,0.0,Clear
09/17/2023,16:00,40.809208,-73.92311,BRONX,0.0,0.0,0,0,0,0,0,0,4663238,2023-09-17 16:00:00,2023-09-17T16:00,2023,9,21.3,0.0,Cloudy
03/13/2023,0:00,40.850307,-73.88644,BRONX,1.0,0.0,0,0,0,0,1,0,4612946,2023-03-13 00:00:00,2023-03-13T00:00,2023,3,4.0,0.0,Cloudy
10/08/2023,10:00,40.824776,-73.82361,BRONX,1.0,0.0,0,0,0,0,1,0,4669834,2023-10-08 10:00:00,2023-10-08T10:00,2023,10,15.0,0.0,Clear
10/17/2023,12:00,40.84059,-73.86637,BRONX,2.0,0.0,0,0,0,0,2,0,4672509,2023-10-17 12:00:00,2023-10-17T12:00,2023,10,16.3,0.0,Cloudy
05/01/2023,7:00,40.861862,-73.91275,BRONX,1.0,0.0,0,0,1,0,0,0,4625810,2023-05-01 07:00:00,2023-05-01T07:00,2023,5,10.8,0.0,Clear
08/09/2023,17:00,40.858303,-73.868004,BRONX,2.0,0.0,0,0,0,0,2,0,4652828,2023-08-09 17:00:00,2023-08-09T17:00,2023,8,28.3,0.0,Clear
04/11/2023,20:00,40.89265,-73.85223,BRONX,2.0,0.0,0,0,0,0,2,0,4620116,2023-04-11 20:00:00,2023-04-11T20:00,2023,4,16.7,0.0,Cloudy
01/18/2023,15:00,40.8164,-73.85141,BRONX,0.0,0.0,0,0,0,0,0,0,4599053,2023-01-18 15:00:00,2023-01-18T15:00,2023,1,10.2,0.0,Clear
01/10/2023,16:00,40.850475,-73.915436,BRONX,1.0,0.0,0,0,0,0,1,0,4596919,2023-01-10 16:00:00,2023-01-10T16:00,2023,1,5.5,0.0,Cloudy
01/31/2023,7:00,40.818798,-73.89213,BRONX,1.0,0.0,0,0,0,0,1,0,4602026,2023-01-31 07:00:00,2023-01-31T07:00,2023,1,1.8,0.2,Drizzle
12/20/2023,7:00,40.81165,-73.91448,BRONX,1.0,0.0,0,0,0,0,0,0,4689288,2023-12-20 07:00:00,2023-12-20T07:00,2023,12,-4.0,0.0,Clear
06/28/2023,18:00,40.82615,-73.87766,BRONX,1.0,0.0,0,0,0,0,0,0,4645433,2023-06-28 18:00:00,2023-06-28T18:00,2023,6,23.7,0.1,Drizzle
05/29/2023,19:00,40.830135,-73.90316,BRONX,1.0,0.0,1,0,0,0,0,0,4635663,2023-05-29 19:00:00,2023-05-29T19:00,2023,5,17.4,0.0,Clear
04/30/2023,10:00,40.837315,-73.92331,BRONX,1.0,0.0,0,0,0,0,1,0,4624558,2023-04-30 10:00:00,2023-04-30T10:00,2023,4,13.0,1.3,Light Rain
05/24/2023,13:00,40.88093,-73.90987,BRONX,1.0,0.0,0,0,0,0,1,0,4632463,2023-05-24 13:00:00,2023-05-24T13:00,2023,5,22.7,0.0,Clear
03/23/2023,21:00,40.862705,-73.90284,BRONX,1.0,0.0,0,0,0,0,1,0,4615618,2023-03-23 21:00:00,2023-03-23T21:00,2023,3,13.6,0.0,Cloudy
07/04/2023,12:00,40.81373,-73.9221,BRONX,1.0,0.0,0,0,0,0,0,0,4647162,2023-07-04 12:00:00,2023-07-04T12:00,2023,7,27.7,0.3,Drizzle
10/02/2023,0:00,40.82811,-73.87622,BRONX,1.0,0.0,1,0,0,0,0,0,4671561,2023-10-02 00:00:00,2023-10-02T00:00,2023,10,17.5,0.0,Clear
09/06/2023,8:00,40.804256,-73.9193,BRONX,1.0,0.0,1,0,0,0,0,0,4659989,2023-09-06 08:00:00,2023-09-06T08:00,2023,9,27.1,0.0,Clear
04/21/2023,15:00,40.820747,-73.906006,BRONX,3.0,0.0,0,0,0,0,3,0,4626040,2023-04-21 15:00:00,2023-04-21T15:00,2023,4,18.6,0.0,Clear
06/20/2023,13:00,40.855595,-73.89601,BRONX,1.0,0.0,0,0,0,0,0,0,4639213,2023-06-20 13:00:00,2023-06-20T13:00,2023,6,24.2,0.0,Cloudy
12/21/2023,10:00,40.876724,-73.90303,BRONX,0.0,0.0,0,0,0,0,0,0,4690693,2023-12-21 10:00:00,2023-12-21T10:00,2023,12,2.3,0.0,Clear
01/26/2023,5:00,40.844017,-73.83614,BRONX,1.0,0.0,1,0,0,0,0,0,4601630,2023-01-26 05:00:00,2023-01-26T05:00,2023,1,8.6,0.7,Drizzle
04/09/2023,17:00,40.84921,-73.90011,BRONX,1.0,0.0,0,0,0,0,1,0,4619743,2023-04-09 17:00:00,2023-04-09T17:00,2023,4,8.7,0.0,Clear
01/23/2023,2:00,40.830284,-73.88512,BRONX,3.0,0.0,0,0,0,0,3,0,4599856,2023-01-23 02:00:00,2023-01-23T02:00,2023,1,3.0,1.2,Drizzle
07/14/2023,18:00,40.813095,-73.89827,BRONX,1.0,0.0,0,0,0,0,1,0,4646638,2023-07-14 18:00:00,2023-07-14T18:00,2023,7,25.8,0.0,Cloudy
12/17/2023,15:00,40.85094,-73.881935,BRONX,1.0,0.0,0,0,0,0,1,0,4688189,2023-12-17 15:00:00,2023-12-17T15:00,2023,12,10.4,1.8,Light Rain
03/20/2023,15:00,40.834595,-73.861015,BRONX,1.0,0.0,1,0,0,0,0,0,4616866,2023-03-20 15:00:00,2023-03-20T15:00,2023,3,8.7,0.0,Clear
11/14/2023,9:00,40.873013,-73.85061,BRONX,1.0,0.0,1,0,0,0,0,0,4679050,2023-11-14 09:00:00,2023-11-14T09:00,2023,11,9.0,0.0,Clear
07/01/2023,12:00,40.820133,-73.91307,BRONX,1.0,0.0,0,0,1,0,0,0,4651152,2023-07-01 12:00:00,2023-07-01T12:00,2023,7,26.9,0.0,Cloudy
03/21/2023,8:00,40.854477,-73.8667,BRONX,0.0,0.0,0,0,0,0,0,0,4614469,2023-03-21 08:00:00,2023-03-21T08:00,2023,3,4.4,0.0,Clear
12/26/2023,19:00,40.84756,-73.89474,BRONX,1.0,0.0,1,0,0,0,0,0,4690728,2023-12-26 19:00:00,2023-12-26T19:00,2023,12,6.1,0.0,Cloudy
01/26/2023,17:00,40.892754,-73.85774,BRONX,1.0,0.0,0,0,0,0,1,0,4601392,2023-01-26 17:00:00,2023-01-26T17:00,2023,1,5.8,0.0,Cloudy
06/15/2023,16:00,40.861862,-73.91275,BRONX,1.0,0.0,0,0,0,0,1,0,4638019,2023-06-15 16:00:00,2023-06-15T16:00,2023,6,25.9,0.0,Cloudy
12/13/2023,0:00,40.883858,-73.855896,BRONX,2.0,0.0,0,0,0,0,2,0,4688839,2023-12-13 00:00:00,2023-12-13T00:00,2023,12,1.8,0.0,Clear
03/18/2023,14:00,40.887802,-73.86046,BRONX,1.0,0.0,1,0,0,0,0,0,4616774,2023-03-18 14:00:00,2023-03-18T14:00,2023,3,10.4,0.0,Cloudy
09/05/2023,0:00,40.88599,-73.82792,BRONX,1.0,0.0,0,0,0,0,1,0,4665840,2023-09-05 00:00:00,2023-09-05T00:00,2023,9,22.9,0.0,Clear
07/20/2023,12:00,40.85159,-73.867805,BRONX,1.0,0.0,0,0,0,0,0,0,4647161,2023-07-20 12:00:00,2023-07-20T12:00,2023,7,28.3,0.1,Drizzle
02/18/2023,19:00,40.83862,-73.92708,BRONX,0.0,0.0,0,0,0,0,0,0,4607631,2023-02-18 19:00:00,2023-02-18T19:00,2023,2,2.4,0.0,Clear
11/14/2023,15:00,40.82029,-73.89214,BRONX,1.0,0.0,0,0,0,0,0,0,4679347,2023-11-14 15:00:00,2023-11-14T15:00,2023,11,10.1,0.0,Cloudy
02/24/2023,19:00,40.854588,-73.90187,BRONX,1.0,0.0,0,0,0,0,1,0,4608752,2023-02-24 19:00:00,2023-02-24T19:00,2023,2,-0.3,0.0,Cloudy
09/27/2023,21:00,40.865925,-73.88594,BRONX,3.0,0.0,0,0,0,0,3,0,4665965,2023-09-27 21:00:00,2023-09-27T21:00,2023,9,14.5,0.0,Clear
11/24/2023,9:00,40.895374,-73.86356,BRONX,2.0,0.0,0,0,0,0,2,0,4681722,2023-11-24 09:00:00,2023-11-24T09:00,2023,11,7.8,0.0,Clear
12/08/2023,19:00,40.848133,-73.88885,BRONX,1.0,0.0,1,0,0,0,0,0,4686246,2023-12-08 19:00:00,2023-12-08T19:00,2023,12,4.6,0.0,Clear
03/30/2023,9:00,40.847836,-73.86136,BRONX,0.0,0.0,0,0,0,0,0,0,4616795,2023-03-30 09:00:00,2023-03-30T09:00,2023,3,1.8,0.0,Clear
12/31/2023,2:00,40.837402,-73.84896,BRONX,0.0,0.0,0,0,0,0,0,0,4691661,2023-12-31 02:00:00,2023-12-31T02:00,2023,12,1.0,0.0,Clear
05/23/2023,21:00,40.85598,-73.89576,BRONX,1.0,0.0,1,0,0,0,0,0,4631571,2023-05-23 21:00:00,2023-05-23T21:00,2023,5,11.4,0.0,Clear
05/11/2023,4:00,40.809574,-73.91806,BRONX,1.0,0.0,1,0,0,0,0,0,4635699,2023-05-11 04:00:00,2023-05-11T04:00,2023,5,10.3,0.0,Clear
05/04/2023,14:00,40.828964,-73.8371,BRONX,1.0,0.0,0,0,0,0,1,0,4627616,2023-05-04 14:00:00,2023-05-04T14:00,2023,5,13.7,0.0,Cloudy
04/12/2023,6:00,40.825287,-73.88646,BRONX,1.0,0.0,0,0,0,0,1,0,4620133,2023-04-12 06:00:00,2023-04-12T06:00,2023,4,15.7,0.0,Cloudy
05/24/2023,0:00,40.850475,-73.915436,BRONX,1.0,0.0,0,0,0,0,1,0,4631911,2023-05-24 00:00:00,2023-05-24T00:00,2023,5,11.9,0.0,Clear
01/20/2023,13:00,40.82813,-73.81859,BRONX,1.0,0.0,0,0,0,0,1,0,4599862,2023-01-20 13:00:00,2023-01-20T13:00,2023,1,7.7,0.1,Drizzle
03/28/2023,20:00,40.825985,-73.8246,BRONX,1.0,0.0,0,0,1,0,0,0,4617805,2023-03-28 20:00:00,2023-03-28T20:00,2023,3,7.9,0.0,Cloudy
09/11/2023,19:00,40.822575,-73.90321,BRONX,1.0,0.0,1,0,0,0,0,0,4672556,2023-09-11 19:00:00,2023-09-11T19:00,2023,9,22.5,0.0,Cloudy
06/28/2023,0:00,40.861862,-73.91275,BRONX,1.0,0.0,0,0,0,0,1,0,4641514,2023-06-28 00:00:00,2023-06-28T00:00,2023,6,19.7,0.0,Cloudy
10/28/2023,22:00,40.875683,-73.90839,BRONX,1.0,0.0,0,0,0,0,1,0,4675516,2023-10-28 22:00:00,2023-10-28T22:00,2023,10,17.5,0.0,Cloudy
03/03/2023,19:00,40.830353,-73.90347,BRONX,1.0,0.0,1,0,0,0,0,0,4610563,2023-03-03 19:00:00,2023-03-03T19:00,2023,3,3.8,0.1,Drizzle
11/21/2023,7:00,40.89417,-73.856964,BRONX,1.0,0.0,0,0,0,0,1,0,4680946,2023-11-21 07:00:00,2023-11-21T07:00,2023,11,-0.8,0.0,Cloudy
10/14/2023,8:00,40.865406,-73.85353,BRONX,1.0,0.0,0,0,0,0,1,0,4670810,2023-10-14 08:00:00,2023-10-14T08:00,2023,10,11.2,0.2,Drizzle
10/16/2023,19:00,40.80694,-73.91376,BRONX,1.0,0.0,0,0,0,0,1,0,4671896,2023-10-16 19:00:00,2023-10-16T19:00,2023,10,12.4,0.0,Clear
09/21/2023,0:00,40.86609,-73.88268,BRONX,1.0,0.0,0,0,0,0,1,0,4665126,2023-09-21 00:00:00,2023-09-21T00:00,2023,9,14.5,0.0,Clear
09/08/2023,1:00,40.84543,-73.91399,BRONX,1.0,0.0,0,0,0,0,1,0,4662834,2023-09-08 01:00:00,2023-09-08T01:00,2023,9,21.7,0.0,Cloudy
09/30/2023,20:00,40.879807,-73.906586,BRONX,2.0,0.0,0,0,0,0,2,0,4667830,2023-09-30 20:00:00,2023-09-30T20:00,2023,9,16.5,0.0,Cloudy
09/11/2023,0:00,40.88599,-73.82792,BRONX,1.0,0.0,0,0,0,0,1,0,4661891,2023-09-11 00:00:00,2023-09-11T00:00,2023,9,20.0,0.2,Drizzle
11/27/2023,0:00,40.859562,-73.86743,BRONX,1.0,0.0,0,0,0,0,1,0,4682895,2023-11-27 00:00:00,2023-11-27T00:00,2023,11,12.2,3.9,Heavy Rain
11/23/2023,5:00,40.89341,-73.85737,BRONX,1.0,0.0,0,0,0,0,1,0,4682260,2023-11-23 05:00:00,2023-11-23T05:00,2023,11,6.5,0.0,Clear
04/02/2023,4:00,40.820984,-73.891624,BRONX,2.0,0.0,0,0,0,0,2,0,4617795,2023-04-02 04:00:00,2023-04-02T04:00,2023,4,5.1,0.0,Cloudy
05/15/2023,0:00,40.82874,-73.877304,BRONX,1.0,0.0,1,0,0,0,0,0,4636208,2023-05-15 00:00:00,2023-05-15T00:00,2023,5,12.7,0.0,Clear
03/29/2023,5:00,40.81478,-73.88465,BRONX,2.0,0.0,0,0,0,0,2,0,4618137,2023-03-29 05:00:00,2023-03-29T05:00,2023,3,0.4,0.0,Cloudy
09/16/2023,5:00,40.835777,-73.91648,BRONX,1.0,0.0,0,0,0,0,1,0,4663719,2023-09-16 05:00:00,2023-09-16T05:00,2023,9,15.5,0.0,Cloudy
01/30/2023,0:00,40.88459,-73.912315,BRONX,1.0,0.0,0,0,0,0,1,0,4602336,2023-01-30 00:00:00,2023-01-30T00:00,2023,1,4.2,0.0,Cloudy
02/17/2023,8:00,40.82052,-73.92136,BRONX,0.0,0.0,0,0,0,0,0,0,4606298,2023-02-17 08:00:00,2023-02-17T08:00,2023,2,13.8,1.1,Drizzle
12/11/2023,0:00,40.86551,-73.85962,BRONX,1.0,0.0,1,0,0,0,0,0,4686533,2023-12-11 00:00:00,2023-12-11T00:00,2023,12,8.3,5.6,Heavy Rain
01/26/2023,17:00,40.81655,-73.91955,BRONX,0.0,0.0,0,0,0,0,0,0,4618884,2023-01-26 17:00:00,2023-01-26T17:00,2023,1,5.9,0.0,Cloudy
07/12/2023,16:00,40.905735,-73.849396,BRONX,1.0,0.0,1,0,0,0,0,0,4645102,2023-07-12 16:00:00,2023-07-12T16:00,2023,7,31.2,0.0,Cloudy
04/15/2023,17:00,40.844868,-73.89707,BRONX,1.0,0.0,0,0,0,0,0,0,4621678,2023-04-15 17:00:00,2023-04-15T17:00,2023,4,17.2,0.1,Drizzle
07/11/2023,0:00,40.879917,-73.87609,BRONX,1.0,0.0,0,0,0,0,1,0,4645576,2023-07-11 00:00:00,2023-07-11T00:00,2023,7,19.2,0.0,Clear
03/21/2023,16:00,40.87384,-73.90892,BRONX,2.0,0.0,0,0,0,0,2,0,4614840,2023-03-21 16:00:00,2023-03-21T16:00,2023,3,14.7,0.0,Clear
08/14/2023,14:00,40.86514,-73.801544,BRONX,1.0,0.0,0,0,0,0,1,0,4654313,2023-08-14 14:00:00,2023-08-14T14:00,2023,8,30.4,0.0,Clear
12/01/2023,17:00,40.830738,-73.9105,BRONX,1.0,0.0,1,0,0,0,0,0,4689261,2023-12-01 17:00:00,2023-12-01T17:00,2023,12,7.3,0.2,Drizzle
08/18/2023,7:00,40.827602,-73.925285,BRONX,1.0,0.0,0,0,0,0,1,0,4659408,2023-08-18 07:00:00,2023-08-18T07:00,2023,8,23.4,0.0,Clear
05/25/2023,19:00,40.867474,-73.89741,BRONX,1.0,0.0,1,0,0,0,0,0,4633829,2023-05-25 19:00:00,2023-05-25T19:00,2023,5,14.5,0.0,Cloudy
06/27/2023,20:00,40.862717,-73.9023,BRONX,0.0,0.0,0,0,0,0,0,0,4641513,2023-06-27 20:00:00,2023-06-27T20:00,2023,6,20.1,1.6,Light Rain
12/22/2023,9:00,40.864254,-73.88813,BRONX,1.0,0.0,0,0,0,0,1,0,4689278,2023-12-22 09:00:00,2023-12-22T09:00,2023,12,-3.4,0.0,Cloudy
04/17/2023,18:00,40.85809,-73.901924,BRONX,1.0,0.0,1,0,0,0,0,0,4621346,2023-04-17 18:00:00,2023-04-17T18:00,2023,4,16.9,0.0,Clear
06/16/2023,16:00,40.88385,-73.83435,BRONX,1.0,0.0,0,0,0,0,1,0,4638629,2023-06-16 16:00:00,2023-06-16T16:00,2023,6,18.9,0.9,Drizzle
11/26/2023,21:00,40.862747,-73.90494,BRONX,1.0,0.0,1,0,0,0,0,0,4682456,2023-11-26 21:00:00,2023-11-26T21:00,2023,11,9.8,0.6,Drizzle
01/05/2023,7:00,40.82415,-73.9108,BRONX,0.0,0.0,0,0,0,0,0,0,4595586,2023-01-05 07:00:00,2023-01-05T07:00,2023,1,7.4,0.0,Cloudy
04/09/2023,0:00,40.862812,-73.907555,BRONX,1.0,0.0,0,0,1,0,0,0,4619490,2023-04-09 00:00:00,2023-04-09T00:00,2023,4,3.7,0.0,Cloudy
01/02/2023,8:00,40.847263,-73.89388,BRONX,4.0,0.0,0,0,0,0,4,0,4594993,2023-01-02 08:00:00,2023-01-02T08:00,2023,1,5.6,0.0,Cloudy
06/21/2023,8:00,40.84409,-73.829666,BRONX,2.0,0.0,0,0,2,0,0,0,4639592,2023-06-21 08:00:00,2023-06-21T08:00,2023,6,17.9,0.0,Cloudy
06/06/2023,14:00,40.822567,-73.85411,BRONX,1.0,0.0,0,0,0,0,0,0,4635724,2023-06-06 14:00:00,2023-06-06T14:00,2023,6,22.2,0.0,Clear
04/11/2023,16:00,40.85061,-73.863045,BRONX,1.0,0.0,0,0,0,0,1,0,4620497,2023-04-11 16:00:00,2023-04-11T16:00,2023,4,21.9,0.0,Cloudy
02/04/2023,20:00,40.8212,-73.89871,BRONX,0.0,0.0,0,0,0,0,0,0,4605301,2023-02-04 20:00:00,2023-02-04T20:00,2023,2,-5.0,0.0,Clear
05/26/2023,0:00,40.858418,-73.88514,BRONX,1.0,0.0,0,0,0,0,1,0,4633176,2023-05-26 00:00:00,2023-05-26T00:00,2023,5,11.0,0.0,Clear
08/08/2023,11:00,40.825043,-73.85259,BRONX,2.0,0.0,0,0,0,0,2,0,4652822,2023-08-08 11:00:00,2023-08-08T11:00,2023,8,25.9,0.1,Drizzle
11/30/2023,0:00,40.830658,-73.86323,BRONX,0.0,0.0,0,0,0,0,0,0,4683451,2023-11-30 00:00:00,2023-11-30T00:00,2023,11,-0.1,0.0,Clear
07/30/2023,19:00,40.895264,-73.85501,BRONX,0.0,0.0,0,0,0,0,0,0,4651709,2023-07-30 19:00:00,2023-07-30T19:00,2023,7,22.2,0.0,Clear
05/07/2023,4:00,40.84316,-73.88655,BRONX,1.0,0.0,1,0,0,0,0,0,4628804,2023-05-07 04:00:00,2023-05-07T04:00,2023,5,8.9,0.0,Clear
10/14/2023,20:00,40.84766,-73.830536,BRONX,1.0,0.0,1,0,0,0,0,0,4672953,2023-10-14 20:00:00,2023-10-14T20:00,2023,10,10.0,0.1,Drizzle
10/05/2023,8:00,40.86536,-73.87043,BRONX,2.0,0.0,0,0,0,0,2,0,4668408,2023-10-05 08:00:00,2023-10-05T08:00,2023,10,15.1,0.0,Cloudy
12/28/2023,13:00,40.8262,-73.821686,BRONX,1.0,0.0,1,0,0,0,0,0,4691745,2023-12-28 13:00:00,2023-12-28T13:00,2023,12,11.3,0.3,Drizzle
05/26/2023,18:00,40.849754,-73.86578,BRONX,0.0,0.0,0,0,0,0,0,0,4632369,2023-05-26 18:00:00,2023-05-26T18:00,2023,5,20.1,0.0,Clear
11/15/2023,21:00,40.825146,-73.823875,BRONX,0.0,0.0,0,0,0,0,0,0,4684434,2023-11-15 21:00:00,2023-11-15T21:00,2023,11,8.1,0.0,Cloudy
12/06/2023,12:00,40.822304,-73.91485,BRONX,1.0,0.0,1,0,0,0,0,0,4690405,2023-12-06 12:00:00,2023-12-06T12:00,2023,12,4.4,0.0,Cloudy
04/07/2023,16:00,40.839844,-73.87464,BRONX,2.0,0.0,1,0,0,0,1,0,4619579,2023-04-07 16:00:00,2023-04-07T16:00,2023,4,11.8,0.0,Cloudy
08/03/2023,20:00,40.887352,-73.90534,BRONX,0.0,0.0,0,0,0,0,0,0,4651340,2023-08-03 20:00:00,2023-08-03T20:00,2023,8,21.1,0.0,Clear
01/25/2023,10:00,40.811695,-73.89488,BRONX,1.0,0.0,0,0,0,0,1,0,4604086,2023-01-25 10:00:00,2023-01-25T10:00,2023,1,2.0,0.0,Cloudy
08/18/2023,20:00,40.82294,-73.91451,BRONX,4.0,0.0,0,0,0,0,4,0,4658617,2023-08-18 20:00:00,2023-08-18T20:00,2023,8,21.1,0.0,Clear
06/29/2023,19:00,40.876183,-73.854454,BRONX,0.0,0.0,0,0,0,0,0,0,4642005,2023-06-29 19:00:00,2023-06-29T19:00,2023,6,23.1,0.0,Clear
04/04/2023,16:00,40.828224,-73.823944,BRONX,1.0,0.0,1,0,0,0,0,0,4618959,2023-04-04 16:00:00,2023-04-04T16:00,2023,4,14.5,0.0,Cloudy
08/17/2023,0:00,40.83209,-73.85538,BRONX,0.0,0.0,0,0,0,0,0,0,4655883,2023-08-17 00:00:00,2023-08-17T00:00,2023,8,21.1,0.3,Drizzle
07/13/2023,12:00,40.862297,-73.89842,BRONX,1.0,0.0,0,0,1,0,0,0,4645151,2023-07-13 12:00:00,2023-07-13T12:00,2023,7,30.2,0.0,Cloudy
09/22/2023,0:00,40.89105,-73.84992,BRONX,1.0,0.0,1,0,0,0,0,0,4664939,2023-09-22 00:00:00,2023-09-22T00:00,2023,9,13.9,0.0,Cloudy
05/01/2023,8:00,40.855595,-73.89601,BRONX,1.0,0.0,1,0,0,0,0,0,4625223,2023-05-01 08:00:00,2023-05-01T08:00,2023,5,12.1,0.0,Clear
12/28/2023,18:00,40.832626,-73.925385,BRONX,1.0,0.0,0,0,0,0,1,0,4691397,2023-12-28 18:00:00,2023-12-28T18:00,2023,12,9.6,0.2,Drizzle
02/28/2023,15:00,40.86581,-73.88922,BRONX,1.0,0.0,0,0,0,0,1,0,4609638,2023-02-28 15:00:00,2023-02-28T15:00,2023,2,1.7,0.3,Drizzle
01/31/2023,8:00,40.86782,-73.86345,BRONX,1.0,0.0,0,0,0,0,1,0,4601923,2023-01-31 08:00:00,2023-01-31T08:00,2023,1,1.3,0.7,Heavy Snow
10/10/2023,23:00,40.834354,-73.82623,BRONX,1.0,0.0,0,0,0,0,1,0,4671273,2023-10-10 23:00:00,2023-10-10T23:00,2023,10,11.4,0.0,Clear
11/01/2023,8:00,40.815437,-73.924,BRONX,1.0,0.0,0,0,0,0,1,0,4680620,2023-11-01 08:00:00,2023-11-01T08:00,2023,11,5.2,0.3,Drizzle
05/09/2023,10:00,40.852947,-73.8421,BRONX,0.0,0.0,0,0,0,0,0,0,4627888,2023-05-09 10:00:00,2023-05-09T10:00,2023,5,17.0,0.0,Cloudy
09/30/2023,16:00,40.806065,-73.90905,BRONX,2.0,0.0,0,0,0,0,2,0,4670223,2023-09-30 16:00:00,2023-09-30T16:00,2023,9,20.6,0.0,Cloudy
07/27/2023,21:00,40.858387,-73.90279,BRONX,1.0,0.0,1,0,0,0,0,0,4650174,2023-07-27 21:00:00,2023-07-27T21:00,2023,7,26.3,0.0,Cloudy
10/12/2023,8:00,40.821285,-73.90095,BRONX,1.0,0.0,1,0,0,0,0,0,4671198,2023-10-12 08:00:00,2023-10-12T08:00,2023,10,13.3,0.0,Clear
10/05/2023,23:00,40.82748,-73.86027,BRONX,1.0,0.0,0,0,0,0,1,0,4668921,2023-10-05 23:00:00,2023-10-05T23:00,2023,10,17.4,0.0,Cloudy
05/15/2023,3:00,40.830875,-73.88496,BRONX,1.0,0.0,0,0,0,0,1,0,4628981,2023-05-15 03:00:00,2023-05-15T03:00,2023,5,10.3,0.0,Clear
08/03/2023,8:00,40.810658,-73.920555,BRONX,0.0,0.0,0,0,0,0,0,0,4651297,2023-08-03 08:00:00,2023-08-03T08:00,2023,8,21.9,0.0,Clear
05/02/2023,15:00,40.8205,-73.891075,BRONX,1.0,0.0,1,0,0,0,0,0,4626034,2023-05-02 15:00:00,2023-05-02T15:00,2023,5,13.3,0.0,Cloudy
05/27/2023,10:00,40.834778,-73.864525,BRONX,1.0,0.0,0,0,0,0,1,0,4636209,2023-05-27 10:00:00,2023-05-27T10:00,2023,5,21.9,0.0,Cloudy
11/21/2023,8:00,40.83533,-73.927,BRONX,1.0,0.0,1,0,0,0,0,0,4681634,2023-11-21 08:00:00,2023-11-21T08:00,2023,11,1.0,0.0,Cloudy
07/04/2023,16:00,40.83091,-73.92047,BRONX,1.0,0.0,0,0,1,0,0,0,4643718,2023-07-04 16:00:00,2023-07-04T16:00,2023,7,25.6,0.4,Drizzle
02/21/2023,11:00,40.816067,-73.91765,BRONX,1.0,0.0,0,0,0,0,0,0,4610354,2023-02-21 11:00:00,2023-02-21T11:00,2023,2,4.3,0.0,Cloudy
05/24/2023,19:00,40.83091,-73.92047,BRONX,1.0,0.0,1,0,0,0,0,0,4632321,2023-05-24 19:00:00,2023-05-24T19:00,2023,5,17.3,0.1,Drizzle
04/26/2023,9:00,40.84118,-73.8461,BRONX,1.0,0.0,0,0,0,0,1,0,4631710,2023-04-26 09:00:00,2023-04-26T09:00,2023,4,12.5,0.0,Cloudy
07/17/2023,4:00,40.818714,-73.88759,BRONX,0.0,0.0,0,0,0,0,0,0,4647188,2023-07-17 04:00:00,2023-07-17T04:00,2023,7,20.6,0.0,Clear
06/21/2023,13:00,40.860733,-73.88954,BRONX,2.0,0.0,0,0,0,0,2,0,4641001,2023-06-21 13:00:00,2023-06-21T13:00,2023,6,20.9,0.0,Cloudy
01/22/2023,23:00,40.861298,-73.906265,BRONX,0.0,0.0,0,0,0,0,0,0,4599672,2023-01-22 23:00:00,2023-01-22T23:00,2023,1,2.1,1.8,Light Rain
01/18/2023,12:00,40.8283,-73.88296,BRONX,1.0,0.0,0,0,0,0,1,0,4598672,2023-01-18 12:00:00,2023-01-18T12:00,2023,1,10.9,0.0,Cloudy
08/04/2023,9:00,40.875042,-73.91228,BRONX,1.0,0.0,1,0,0,0,0,0,4651473,2023-08-04 09:00:00,2023-08-04T09:00,2023,8,23.6,0.2,Drizzle
07/02/2023,12:00,40.862442,-73.91119,BRONX,0.0,0.0,0,0,0,0,0,0,4646424,2023-07-02 12:00:00,2023-07-02T12:00,2023,7,29.2,0.1,Drizzle
03/01/2023,0:00,40.829754,-73.87374,BRONX,1.0,0.0,0,0,0,0,1,0,4609769,2023-03-01 00:00:00,2023-03-01T00:00,2023,3,-0.3,0.0,Cloudy
03/02/2023,12:00,40.825413,-73.923485,BRONX,1.0,0.0,1,0,0,0,0,0,4609814,2023-03-02 12:00:00,2023-03-02T12:00,2023,3,9.9,0.0,Cloudy
12/17/2023,17:00,40.85713,-73.8808,BRONX,1.0,0.0,0,0,0,0,1,0,4688194,2023-12-17 17:00:00,2023-12-17T17:00,2023,12,10.4,1.2,Drizzle
07/19/2023,18:00,40.87485,-73.89465,BRONX,1.0,0.0,0,0,1,0,0,0,4647025,2023-07-19 18:00:00,2023-07-19T18:00,2023,7,24.1,0.5,Drizzle
07/04/2023,15:00,40.83142,-73.92643,BRONX,1.0,0.0,0,0,1,0,0,0,4647953,2023-07-04 15:00:00,2023-07-04T15:00,2023,7,27.3,0.6,Drizzle
05/15/2023,20:00,40.90987,-73.90328,BRONX,1.0,0.0,0,0,0,0,1,0,4632269,2023-05-15 20:00:00,2023-05-15T20:00,2023,5,17.8,0.0,Clear
08/17/2023,0:00,40.85615,-73.84395,BRONX,1.0,0.0,0,0,0,0,1,0,4655066,2023-08-17 00:00:00,2023-08-17T00:00,2023,8,21.1,0.2,Drizzle
10/30/2023,0:00,40.877033,-73.846375,BRONX,1.0,0.0,1,0,0,0,0,0,4685824,2023-10-30 00:00:00,2023-10-30T00:00,2023,10,12.2,0.5,Drizzle
01/04/2023,12:00,40.85809,-73.901924,BRONX,1.0,0.0,1,0,0,0,0,0,4595555,2023-01-04 12:00:00,2023-01-04T12:00,2023,1,16.8,0.0,Cloudy
04/25/2023,20:00,40.853813,-73.90734,BRONX,1.0,0.0,0,0,0,0,0,0,4623564,2023-04-25 20:00:00,2023-04-25T20:00,2023,4,11.1,0.0,Cloudy
03/23/2023,16:00,40.816383,-73.91885,BRONX,1.0,0.0,0,0,0,0,1,0,4615117,2023-03-23 16:00:00,2023-03-23T16:00,2023,3,14.5,0.0,Cloudy
09/11/2023,11:00,40.856777,-73.891106,BRONX,1.0,0.0,0,0,0,0,1,0,4661833,2023-09-11 11:00:00,2023-09-11T11:00,2023,9,25.8,0.0,Cloudy
04/07/2023,10:00,40.8283,-73.88296,BRONX,1.0,0.0,0,0,0,0,1,0,4618953,2023-04-07 10:00:00,2023-04-07T10:00,2023,4,12.4,0.0,Cloudy
04/26/2023,16:00,0.0,0.0,BRONX,3.0,0.0,0,0,0,0,3,0,4623823,2023-04-26 16:00:00,2023-04-26T16:00,2023,4,26.2,0.0,Cloudy
03/30/2023,20:00,40.86505,-73.83001,BRONX,1.0,0.0,1,0,0,0,0,0,4617077,2023-03-30 20:00:00,2023-03-30T20:00,2023,3,1.3,0.0,Clear
02/12/2023,13:00,40.81327,-73.905136,BRONX,0.0,0.0,0,0,0,0,0,0,4605406,2023-02-12 13:00:00,2023-02-12T13:00,2023,2,6.9,0.0,Cloudy
09/16/2023,23:00,40.825912,-73.83647,BRONX,3.0,0.0,0,0,0,0,3,0,4665369,2023-09-16 23:00:00,2023-09-16T23:00,2023,9,15.7,0.0,Clear
08/02/2023,18:00,40.881607,-73.83784,BRONX,1.0,0.0,0,0,0,0,1,0,4652176,2023-08-02 18:00:00,2023-08-02T18:00,2023,8,23.7,0.0,Clear
08/09/2023,13:00,40.874985,-73.858925,BRONX,1.0,0.0,0,0,0,0,1,0,4654022,2023-08-09 13:00:00,2023-08-09T13:00,2023,8,28.3,0.0,Clear
01/07/2023,17:00,40.844788,-73.88989,BRONX,1.0,0.0,1,0,0,0,0,0,4601983,2023-01-07 17:00:00,2023-01-07T17:00,2023,1,5.2,0.0,Cloudy
05/06/2023,0:00,40.668076,-73.93595,BROOKLYN,0.0,0.0,0,0,0,0,0,0,4628045,2023-05-06 00:00:00,2023-05-06T00:00,2023,5,9.2,0.0,Clear
12/11/2023,18:00,40.610977,-73.922646,BROOKLYN,1.0,0.0,1,0,0,0,0,0,4687104,2023-12-11 18:00:00,2023-12-11T18:00,2023,12,4.7,0.0,Clear
01/12/2023,22:00,40.710785,-73.95995,BROOKLYN,1.0,0.0,0,0,1,0,0,0,4597636,2023-01-12 22:00:00,2023-01-12T22:00,2023,1,10.9,0.1,Drizzle
04/18/2023,13:00,40.593002,-73.98874,BROOKLYN,0.0,0.0,0,0,0,0,0,0,4626179,2023-04-18 13:00:00,2023-04-18T13:00,2023,4,14.9,0.1,Drizzle
04/22/2023,17:00,40.70239,-73.98598,BROOKLYN,0.0,0.0,0,0,0,0,0,0,4624010,2023-04-22 17:00:00,2023-04-22T17:00,2023,4,15.1,1.5,Light Rain
04/30/2023,11:00,40.678585,-73.906136,BROOKLYN,0.0,0.0,0,0,0,0,0,0,4626402,2023-04-30 11:00:00,2023-04-30T11:00,2023,4,13.6,2.5,Heavy Rain
06/01/2023,17:00,40.57957,-73.96221,BROOKLYN,1.0,0.0,1,0,0,0,0,0,4633975,2023-06-01 17:00:00,2023-06-01T17:00,2023,6,20.3,0.0,Clear
01/30/2023,15:00,40.680016,-73.87743,BROOKLYN,2.0,0.0,0,0,0,0,2,0,4602057,2023-01-30 15:00:00,2023-01-30T15:00,2023,1,9.7,0.0,Clear
01/12/2023,16:00,40.625076,-73.99733,BROOKLYN,1.0,0.0,0,0,1,0,0,0,4597501,2023-01-12 16:00:00,2023-01-12T16:00,2023,1,9.7,0.0,Cloudy
10/29/2023,0:00,40.728695,-73.95158,BROOKLYN,1.0,0.0,0,0,1,0,0,0,4674678,2023-10-29 00:00:00,2023-10-29T00:00,2023,10,15.0,0.0,Cloudy
11/12/2023,20:00,40.640556,-73.976875,BROOKLYN,1.0,0.0,1,0,0,0,0,0,4678608,2023-11-12 20:00:00,2023-11-12T20:00,2023,11,0.6,0.0,Clear
06/03/2023,11:00,40.650528,-73.95583,BROOKLYN,1.0,0.0,0,0,1,0,0,0,4636625,2023-06-03 11:00:00,2023-06-03T11:00,2023,6,19.3,0.0,Cloudy
09/13/2023,18:00,40.650806,-73.94958,BROOKLYN,1.0,0.0,0,0,0,0,1,0,4662861,2023-09-13 18:00:00,2023-09-13T18:00,2023,9,22.9,0.1,Drizzle
07/08/2023,16:00,40.677063,-73.90248,BROOKLYN,1.0,0.0,0,0,0,0,1,0,4644124,2023-07-08 16:00:00,2023-07-08T16:00,2023,7,27.2,0.0,Cloudy
10/13/2023,0:00,40.699665,-73.95115,BROOKLYN,1.0,0.0,0,0,0,0,0,0,4670514,2023-10-13 00:00:00,2023-10-13T00:00,2023,10,11.9,0.0,Clear
03/26/2023,21:00,40.710262,-73.953865,BROOKLYN,0.0,0.0,0,0,0,0,0,0,4616060,2023-03-26 21:00:00,2023-03-26T21:00,2023,3,8.4,0.0,Clear
06/12/2023,20:00,40.685696,-73.87161,BROOKLYN,1.0,0.0,0,0,0,0,0,0,4637344,2023-06-12 20:00:00,2023-06-12T20:00,2023,6,19.2,1.7,Light Rain
10/05/2023,15:00,40.607094,-73.99925,BROOKLYN,1.0,0.0,1,0,0,0,0,0,4668608,2023-10-05 15:00:00,2023-10-05T15:00,2023,10,20.1,0.0,Clear
03/07/2023,5:00,40.685795,-73.92158,BROOKLYN,0.0,0.0,0,0,0,0,0,0,4611395,2023-03-07 05:00:00,2023-03-07T05:00,2023,3,1.7,0.0,Cloudy
04/22/2023,0:00,40.668354,-73.8892,BROOKLYN,1.0,0.0,0,0,0,0,1,0,4622875,2023-04-22 00:00:00,2023-04-22T00:00,2023,4,10.0,0.0,Cloudy
11/26/2023,13:00,40.59519,-73.94767,BROOKLYN,1.0,0.0,0,0,0,0,1,0,4682338,2023-11-26 13:00:00,2023-11-26T13:00,2023,11,10.0,0.0,Cloudy
02/09/2023,18:00,40.720795,-73.94496,BROOKLYN,1.0,0.0,0,0,0,0,1,0,4607727,2023-02-09 18:00:00,2023-02-09T18:00,2023,2,9.9,0.0,Cloudy
02/07/2023,10:00,40.65463,-73.92201,BROOKLYN,1.0,0.0,0,0,0,0,1,0,4604030,2023-02-07 10:00:00,2023-02-07T10:00,2023,2,0.7,0.0,Cloudy
08/10/2023,19:00,40.634815,-73.98876,BROOKLYN,1.0,0.0,0,0,0,0,1,0,4653180,2023-08-10 19:00:00,2023-08-10T19:00,2023,8,21.5,0.0,Cloudy
06/02/2023,15:00,40.63193,-74.03644,BROOKLYN,2.0,0.0,0,0,0,0,2,0,4634262,2023-06-02 15:00:00,2023-06-02T15:00,2023,6,24.7,0.0,Clear
06/29/2023,21:00,40.657608,-73.94232,BROOKLYN,0.0,0.0,0,0,0,0,0,0,4642768,2023-06-29 21:00:00,2023-06-29T21:00,2023,6,20.4,0.0,Clear
02/23/2023,16:00,40.662674,-73.89738,BROOKLYN,1.0,0.0,0,0,0,0,1,0,4608826,2023-02-23 16:00:00,2023-02-23T16:00,2023,2,8.0,0.0,Clear
01/13/2023,12:00,40.685047,-73.92825,BROOKLYN,0.0,0.0,0,0,0,0,0,0,4615958,2023-01-13 12:00:00,2023-01-13T12:00,2023,1,12.2,0.1,Drizzle
01/31/2023,19:00,40.612556,-74.0361,BROOKLYN,0.0,0.0,0,0,0,0,0,0,4602150,2023-01-31 19:00:00,2023-01-31T19:00,2023,1,2.8,0.0,Cloudy
11/08/2023,17:00,40.64932,-73.904175,BROOKLYN,1.0,0.0,0,0,0,0,0,0,4678276,2023-11-08 17:00:00,2023-11-08T17:00,2023,11,7.3,0.0,Cloudy
04/25/2023,11:00,40.68752,-73.999535,BROOKLYN,0.0,0.0,0,0,0,0,0,0,4623623,2023-04-25 11:00:00,2023-04-25T11:00,2023,4,12.7,0.0,Clear
10/09/2023,7:00,40.655262,-73.91359,BROOKLYN,1.0,0.0,0,0,0,0,1,0,4669106,2023-10-09 07:00:00,2023-10-09T07:00,2023,10,9.0,0.0,Clear
08/31/2023,12:00,40.68345,-73.875534,BROOKLYN,1.0,0.0,0,0,0,0,1,0,4658854,2023-08-31 12:00:00,2023-08-31T12:00,2023,8,23.7,0.0,Cloudy
03/08/2023,16:00,40.698246,-73.98055,BROOKLYN,1.0,0.0,0,0,1,0,0,0,4611231,2023-03-08 16:00:00,2023-03-08T16:00,2023,3,8.0,0.0,Clear
01/23/2023,15:00,40.623356,-74.00784,BROOKLYN,2.0,0.0,0,0,0,0,2,0,4599903,2023-01-23 15:00:00,2023-01-23T15:00,2023,1,2.6,0.9,Light Snow
11/10/2023,16:00,40.634483,-73.91886,BROOKLYN,2.0,0.0,0,0,0,0,2,0,4678012,2023-11-10 16:00:00,2023-11-10T16:00,2023,11,9.8,0.0,Cloudy
10/22/2023,0:00,40.592495,-73.98444,BROOKLYN,0.0,0.0,0,0,0,0,0,0,4672565,2023-10-22 00:00:00,2023-10-22T00:00,2023,10,12.6,0.0,Clear
12/30/2023,15:00,40.61475,-74.00024,BROOKLYN,1.0,0.0,0,0,0,0,1,0,4691562,2023-12-30 15:00:00,2023-12-30T15:00,2023,12,7.9,0.0,Cloudy
06/30/2023,14:00,40.587303,-73.96036,BROOKLYN,1.0,0.0,1,0,0,0,0,0,4651205,2023-06-30 14:00:00,2023-06-30T14:00,2023,6,24.7,0.0,Cloudy
05/04/2023,20:00,40.64213,-73.92936,BROOKLYN,1.0,0.0,0,0,0,0,1,0,4632043,2023-05-04 20:00:00,2023-05-04T20:00,2023,5,10.5,0.0,Cloudy
02/14/2023,12:00,40.719246,-73.95407,BROOKLYN,0.0,0.0,0,0,0,0,0,0,4606773,2023-02-14 12:00:00,2023-02-14T12:00,2023,2,9.3,0.0,Clear
11/07/2023,0:00,40.68789,-73.936035,BROOKLYN,1.0,0.0,1,0,0,0,0,0,4678237,2023-11-07 00:00:00,2023-11-07T00:00,2023,11,12.3,0.0,Cloudy
03/07/2023,17:00,40.647243,-73.96048,BROOKLYN,2.0,0.0,0,0,0,0,2,0,4611291,2023-03-07 17:00:00,2023-03-07T17:00,2023,3,3.6,0.0,Clear
06/14/2023,16:00,40.64322,-74.004166,BROOKLYN,1.0,0.0,1,0,0,0,0,0,4637960,2023-06-14 16:00:00,2023-06-14T16:00,2023,6,20.3,1.6,Light Rain
11/21/2023,0:00,40.592766,-73.96971,BROOKLYN,1.0,0.0,0,0,0,0,1,0,4681135,2023-11-21 00:00:00,2023-11-21T00:00,2023,11,2.8,0.0,Clear
05/05/2023,10:00,40.700703,-73.98868,BROOKLYN,1.0,0.0,0,0,0,0,1,0,4626992,2023-05-05 10:00:00,2023-05-05T10:00,2023,5,14.3,0.0,Clear
12/21/2023,21:00,40.673588,-73.96296,BROOKLYN,1.0,0.0,1,0,0,0,0,0,4689328,2023-12-21 21:00:00,2023-12-21T21:00,2023,12,-2.2,0.0,Clear
06/04/2023,0:00,40.70304,-73.94719,BROOKLYN,2.0,0.0,0,0,0,0,0,0,4634616,2023-06-04 00:00:00,2023-06-04T00:00,2023,6,12.2,0.0,Cloudy
04/14/2023,23:00,40.67821,-73.97323,BROOKLYN,2.0,0.0,0,0,0,0,2,0,4620708,2023-04-14 23:00:00,2023-04-14T23:00,2023,4,19.0,0.0,Cloudy
01/13/2023,20:00,40.688976,-73.9132,BROOKLYN,1.0,0.0,1,0,0,0,0,0,4597757,2023-01-13 20:00:00,2023-01-13T20:00,2023,1,4.0,0.0,Cloudy
09/11/2023,13:00,40.64957,-73.93887,BROOKLYN,0.0,0.0,0,0,0,0,0,0,4663121,2023-09-11 13:00:00,2023-09-11T13:00,2023,9,26.5,0.2,Drizzle
12/03/2023,17:00,40.634613,-73.93796,BROOKLYN,1.0,0.0,1,0,0,0,0,0,4684216,2023-12-03 17:00:00,2023-12-03T17:00,2023,12,9.9,0.1,Drizzle
10/17/2023,14:00,40.665714,-73.898445,BROOKLYN,0.0,0.0,0,0,0,0,0,0,4671608,2023-10-17 14:00:00,2023-10-17T14:00,2023,10,16.6,0.1,Drizzle
04/30/2023,13:00,40.659813,-73.926476,BROOKLYN,1.0,0.0,1,0,0,0,0,0,4624620,2023-04-30 13:00:00,2023-04-30T13:00,2023,4,14.0,0.5,Drizzle
01/09/2023,8:00,40.595413,-73.983055,BROOKLYN,1.0,0.0,0,0,1,0,0,0,4596488,2023-01-09 08:00:00,2023-01-09T08:00,2023,1,2.8,0.2,Drizzle
02/09/2023,0:00,40.70572,-73.953354,BROOKLYN,1.0,0.0,1,0,0,0,0,0,4605617,2023-02-09 00:00:00,2023-02-09T00:00,2023,2,0.3,0.0,Cloudy
06/24/2023,16:00,40.66638,-73.9244,BROOKLYN,1.0,0.0,0,0,0,0,0,0,4640542,2023-06-24 16:00:00,2023-06-24T16:00,2023,6,22.0,0.0,Cloudy
09/18/2023,1:00,40.66309,-73.962395,BROOKLYN,1.0,0.0,0,0,0,0,1,0,4663566,2023-09-18 01:00:00,2023-09-18T01:00,2023,9,19.3,0.1,Drizzle
10/05/2023,0:00,40.592514,-73.95231,BROOKLYN,1.0,0.0,0,0,1,0,0,0,4668388,2023-10-05 00:00:00,2023-10-05T00:00,2023,10,15.3,0.0,Clear
07/23/2023,2:00,40.68197,-73.99095,BROOKLYN,0.0,0.0,0,0,0,0,0,0,4647693,2023-07-23 02:00:00,2023-07-23T02:00,2023,7,18.4,0.0,Clear
05/16/2023,13:00,40.675144,-73.98133,BROOKLYN,1.0,0.0,1,0,0,0,0,0,4629492,2023-05-16 13:00:00,2023-05-16T13:00,2023,5,24.8,0.0,Cloudy
08/04/2023,10:00,40.666153,-73.89542,BROOKLYN,2.0,0.0,0,0,0,0,2,0,4651756,2023-08-04 10:00:00,2023-08-04T10:00,2023,8,25.4,0.0,Cloudy
05/08/2023,3:00,40.663685,-73.88893,BROOKLYN,1.0,0.0,0,0,0,0,1,0,4627882,2023-05-08 03:00:00,2023-05-08T03:00,2023,5,13.5,0.0,Cloudy
12/13/2023,20:00,40.642384,-73.92539,BROOKLYN,1.0,0.0,0,0,0,0,1,0,4688756,2023-12-13 20:00:00,2023-12-13T20:00,2023,12,1.4,0.0,Clear
05/04/2023,0:00,40.6461,-73.95808,BROOKLYN,1.0,0.0,1,0,0,0,0,0,4626443,2023-05-04 00:00:00,2023-05-04T00:00,2023,5,7.4,0.0,Clear
02/06/2023,12:00,40.729168,-73.95749,BROOKLYN,1.0,0.0,0,0,0,0,1,0,4603602,2023-02-06 12:00:00,2023-02-06T12:00,2023,2,9.7,0.0,Clear
11/07/2023,13:00,40.64811,-73.891655,BROOKLYN,1.0,0.0,0,0,0,0,0,0,4677259,2023-11-07 13:00:00,2023-11-07T13:00,2023,11,18.8,0.0,Cloudy
03/21/2023,9:00,40.693874,-73.91777,BROOKLYN,1.0,0.0,1,0,0,0,0,0,4614343,2023-03-21 09:00:00,2023-03-21T09:00,2023,3,6.9,0.0,Clear
08/06/2023,4:00,40.658722,-73.90407,BROOKLYN,0.0,0.0,0,0,0,0,0,0,4652255,2023-08-06 04:00:00,2023-08-06T04:00,2023,8,18.6,0.0,Clear
03/15/2023,18:00,40.61847,-74.021225,BROOKLYN,1.0,0.0,1,0,0,0,0,0,4613109,2023-03-15 18:00:00,2023-03-15T18:00,2023,3,5.6,0.0,Clear
05/06/2023,19:00,40.63524,-73.967636,BROOKLYN,5.0,0.0,0,0,0,0,5,0,4628392,2023-05-06 19:00:00,2023-05-06T19:00,2023,5,15.0,0.0,Cloudy
06/09/2023,16:00,40.69808,-73.92536,BROOKLYN,1.0,0.0,0,0,1,0,0,0,4636555,2023-06-09 16:00:00,2023-06-09T16:00,2023,6,19.1,0.0,Cloudy
07/07/2023,17:00,40.713634,-73.94595,BROOKLYN,3.0,0.0,0,0,0,0,3,0,4643559,2023-07-07 17:00:00,2023-07-07T17:00,2023,7,26.4,0.0,Cloudy
08/24/2023,6:00,40.65822,-73.89146,BROOKLYN,0.0,0.0,0,0,0,0,0,0,4657157,2023-08-24 06:00:00,2023-08-24T06:00,2023,8,21.0,0.0,Cloudy
05/13/2023,2:00,40.72585,-73.93335,BROOKLYN,1.0,0.0,0,0,0,0,1,0,4628438,2023-05-13 02:00:00,2023-05-13T02:00,2023,5,18.6,0.0,Cloudy
01/12/2023,16:00,40.675735,-73.89686,BROOKLYN,1.0,0.0,0,0,0,0,1,0,4598213,2023-01-12 16:00:00,2023-01-12T16:00,2023,1,9.9,0.0,Cloudy
01/13/2023,19:00,40.62765,-73.981674,BROOKLYN,0.0,0.0,0,0,0,0,0,0,4598423,2023-01-13 19:00:00,2023-01-13T19:00,2023,1,4.2,0.0,Cloudy
08/24/2023,18:00,40.68767,-73.931366,BROOKLYN,1.0,0.0,1,0,0,0,0,0,4657751,2023-08-24 18:00:00,2023-08-24T18:00,2023,8,21.9,0.5,Drizzle
08/22/2023,9:00,40.617443,-74.028404,BROOKLYN,1.0,0.0,0,0,0,0,1,0,4656079,2023-08-22 09:00:00,2023-08-22T09:00,2023,8,21.4,0.0,Cloudy
07/28/2023,13:00,40.715103,-73.96278,BROOKLYN,1.0,0.0,0,0,0,0,1,0,4649879,2023-07-28 13:00:00,2023-07-28T13:00,2023,7,33.5,0.0,Clear
03/09/2023,10:00,40.637024,-74.02552,BROOKLYN,0.0,0.0,0,0,0,0,0,0,4611676,2023-03-09 10:00:00,2023-03-09T10:00,2023,3,6.8,0.0,Clear
10/24/2023,19:00,40.65777,-73.93962,BROOKLYN,1.0,0.0,1,0,0,0,0,0,4674025,2023-10-24 19:00:00,2023-10-24T19:00,2023,10,13.4,0.0,Clear
05/19/2023,0:00,40.657482,-73.92141,BROOKLYN,1.0,0.0,0,0,1,0,0,0,4631417,2023-05-19 00:00:00,2023-05-19T00:00,2023,5,11.4,0.0,Clear
03/28/2023,0:00,40.637196,-73.89759,BROOKLYN,1.0,0.0,1,0,0,0,0,0,4616167,2023-03-28 00:00:00,2023-03-28T00:00,2023,3,4.1,0.0,Clear
11/21/2023,9:00,40.651688,-73.88877,BROOKLYN,1.0,0.0,0,0,0,0,1,0,4680991,2023-11-21 09:00:00,2023-11-21T09:00,2023,11,3.3,0.0,Cloudy
02/21/2023,14:00,40.62909,-74.00982,BROOKLYN,1.0,0.0,0,0,0,0,1,0,4607394,2023-02-21 14:00:00,2023-02-21T14:00,2023,2,6.1,0.0,Cloudy
11/07/2023,17:00,40.678154,-73.94416,BROOKLYN,2.0,1.0,0,0,0,0,2,1,4678116,2023-11-07 17:00:00,2023-11-07T17:00,2023,11,16.7,0.0,Clear
02/18/2023,19:00,40.656063,-73.93957,BROOKLYN,0.0,0.0,0,0,0,0,0,0,4609522,2023-02-18 19:00:00,2023-02-18T19:00,2023,2,3.1,0.0,Clear
04/12/2023,10:00,40.687935,-73.9154,BROOKLYN,1.0,0.0,0,0,0,0,1,0,4620757,2023-04-12 10:00:00,2023-04-12T10:00,2023,4,22.4,0.0,Cloudy
05/02/2023,19:00,40.66172,-73.914536,BROOKLYN,1.0,0.0,0,0,0,0,1,0,4626405,2023-05-02 19:00:00,2023-05-02T19:00,2023,5,10.9,0.0,Clear
07/15/2023,16:00,40.692226,-73.930916,BROOKLYN,1.0,0.0,0,0,0,0,0,0,4646145,2023-07-15 16:00:00,2023-07-15T16:00,2023,7,27.3,0.0,Cloudy
09/21/2023,19:00,40.68494,-73.922485,BROOKLYN,2.0,0.0,0,0,0,0,2,0,4664814,2023-09-21 19:00:00,2023-09-21T19:00,2023,9,18.0,0.0,Cloudy
09/28/2023,13:00,40.669712,-73.94774,BROOKLYN,1.0,0.0,0,0,0,0,1,0,4666404,2023-09-28 13:00:00,2023-09-28T13:00,2023,9,17.8,0.0,Cloudy
06/24/2023,22:00,40.71148,-73.9456,BROOKLYN,1.0,0.0,0,0,0,0,1,0,4640475,2023-06-24 22:00:00,2023-06-24T22:00,2023,6,21.3,0.0,Cloudy
04/30/2023,2:00,40.605675,-73.966965,BROOKLYN,1.0,0.0,0,0,0,0,1,0,4625006,2023-04-30 02:00:00,2023-04-30T02:00,2023,4,11.3,0.0,Cloudy
05/17/2023,14:00,40.673843,-73.92509,BROOKLYN,1.0,0.0,1,0,0,0,0,0,4630552,2023-05-17 14:00:00,2023-05-17T14:00,2023,5,17.5,0.0,Clear
09/17/2023,23:00,40.63997,-73.99434,BROOKLYN,1.0,0.0,1,0,0,0,0,0,4665366,2023-09-17 23:00:00,2023-09-17T23:00,2023,9,18.9,0.0,Cloudy
01/06/2023,15:00,40.69268,-73.93998,BROOKLYN,1.0,0.0,0,0,0,0,1,0,4599540,2023-01-06 15:00:00,2023-01-06T15:00,2023,1,8.4,0.0,Clear
09/21/2023,9:00,40.67146,-73.99103,BROOKLYN,2.0,0.0,0,0,0,0,2,0,4664388,2023-09-21 09:00:00,2023-09-21T09:00,2023,9,17.2,0.0,Clear
08/16/2023,16:00,40.65753,-73.89797,BROOKLYN,1.0,0.0,0,0,0,0,0,0,4654783,2023-08-16 16:00:00,2023-08-16T16:00,2023,8,24.8,0.2,Drizzle
10/26/2023,13:00,40.598923,-73.97657,BROOKLYN,0.0,0.0,0,0,0,0,0,0,4674048,2023-10-26 13:00:00,2023-10-26T13:00,2023,10,22.5,0.0,Clear
07/05/2023,1:00,40.648384,-73.95225,BROOKLYN,1.0,0.0,0,0,0,0,1,0,4642730,2023-07-05 01:00:00,2023-07-05T01:00,2023,7,22.4,0.0,Clear
08/11/2023,15:00,40.67562,-73.88826,BROOKLYN,1.0,0.0,0,0,0,0,1,0,4653633,2023-08-11 15:00:00,2023-08-11T15:00,2023,8,29.2,0.0,Cloudy
01/01/2023,17:00,40.628414,-73.94139,BROOKLYN,0.0,0.0,0,0,0,0,0,0,4595304,2023-01-01 17:00:00,2023-01-01T17:00,2023,1,7.9,0.0,Clear
04/06/2023,15:00,40.64991,-73.97225,BROOKLYN,1.0,0.0,0,0,0,0,1,0,4619028,2023-04-06 15:00:00,2023-04-06T15:00,2023,4,18.3,0.0,Cloudy
09/21/2023,23:00,40.609886,-73.98556,BROOKLYN,1.0,0.0,0,0,0,0,1,0,4664305,2023-09-21 23:00:00,2023-09-21T23:00,2023,9,15.7,0.0,Cloudy
03/10/2023,8:00,40.572628,-73.99485,BROOKLYN,0.0,0.0,0,0,0,0,0,0,4612355,2023-03-10 08:00:00,2023-03-10T08:00,2023,3,1.5,0.0,Cloudy
11/28/2023,20:00,40.685112,-73.94717,BROOKLYN,2.0,0.0,0,0,0,0,2,0,4683058,2023-11-28 20:00:00,2023-11-28T20:00,2023,11,-1.0,0.0,Clear
05/17/2023,23:00,40.669262,-73.91356,BROOKLYN,2.0,0.0,0,0,0,0,2,0,4630816,2023-05-17 23:00:00,2023-05-17T23:00,2023,5,9.8,0.0,Clear
05/21/2023,18:00,40.68628,-73.88028,BROOKLYN,1.0,0.0,0,0,0,0,1,0,4630960,2023-05-21 18:00:00,2023-05-21T18:00,2023,5,19.9,0.0,Clear
05/11/2023,15:00,40.689583,-73.972145,BROOKLYN,0.0,0.0,0,0,0,0,0,0,4631416,2023-05-11 15:00:00,2023-05-11T15:00,2023,5,19.8,0.0,Clear
03/31/2023,7:00,40.64521,-73.94784,BROOKLYN,0.0,0.0,0,0,0,0,0,0,4617487,2023-03-31 07:00:00,2023-03-31T07:00,2023,3,3.0,0.0,Cloudy
01/08/2023,15:00,40.63944,-73.90508,BROOKLYN,1.0,0.0,1,0,0,0,0,0,4596194,2023-01-08 15:00:00,2023-01-08T15:00,2023,1,3.8,0.0,Cloudy
11/03/2023,0:00,40.59098,-73.966194,BROOKLYN,0.0,0.0,0,0,0,0,0,0,4676144,2023-11-03 00:00:00,2023-11-03T00:00,2023,11,6.7,0.0,Clear
03/26/2023,21:00,40.70523,-73.95668,BROOKLYN,1.0,0.0,1,0,0,0,0,0,4616246,2023-03-26 21:00:00,2023-03-26T21:00,2023,3,8.3,0.0,Clear
03/05/2023,18:00,40.60084,-73.93812,BROOKLYN,1.0,0.0,1,0,0,0,0,0,4610618,2023-03-05 18:00:00,2023-03-05T18:00,2023,3,8.4,0.0,Clear
11/10/2023,14:00,40.700092,-73.98753,BROOKLYN,1.0,0.0,0,0,0,0,1,0,4678416,2023-11-10 14:00:00,2023-11-10T14:00,2023,11,10.6,0.1,Drizzle
03/02/2023,19:00,40.675655,-73.87928,BROOKLYN,1.0,0.0,0,0,0,0,1,0,4610182,2023-03-02 19:00:00,2023-03-02T19:00,2023,3,7.3,0.0,Cloudy
05/05/2023,5:00,40.587902,-73.98954,BROOKLYN,0.0,0.0,0,0,0,0,0,0,4627834,2023-05-05 05:00:00,2023-05-05T05:00,2023,5,7.6,0.0,Clear
09/08/2023,23:00,40.634834,-73.96753,BROOKLYN,1.0,0.0,1,0,0,0,0,0,4660894,2023-09-08 23:00:00,2023-09-08T23:00,2023,9,21.7,0.0,Cloudy
06/14/2023,15:00,40.663334,-73.960236,BROOKLYN,2.0,0.0,2,0,0,0,0,0,4637857,2023-06-14 15:00:00,2023-06-14T15:00,2023,6,17.7,0.4,Drizzle
04/09/2023,1:00,40.66841,-73.90167,BROOKLYN,1.0,0.0,0,0,0,0,0,0,4619459,2023-04-09 01:00:00,2023-04-09T01:00,2023,4,3.9,0.0,Clear
01/05/2023,11:00,0.0,0.0,BROOKLYN,1.0,0.0,1,0,0,0,0,0,4596528,2023-01-05 11:00:00,2023-01-05T11:00,2023,1,26.4,0.2,Drizzle
08/27/2023,23:00,40.713478,-73.9476,BROOKLYN,3.0,0.0,0,0,0,0,3,0,4659209,2023-08-27 23:00:00,2023-08-27T23:00,2023,8,20.8,0.0,Cloudy
12/14/2023,10:00,40.62427,-73.99255,BROOKLYN,1.0,0.0,0,0,1,0,0,0,4688982,2023-12-14 10:00:00,2023-12-14T10:00,2023,12,2.1,0.0,Clear
08/09/2023,0:00,40.665062,-73.90281,BROOKLYN,2.0,0.0,0,0,0,0,2,0,4654762,2023-08-09 00:00:00,2023-08-09T00:00,2023,8,21.5,0.0,Clear
03/24/2023,12:00,40.661385,-74.004196,BROOKLYN,0.0,0.0,0,0,0,0,0,0,4615342,2023-03-24 12:00:00,2023-03-24T12:00,2023,3,7.8,0.0,Cloudy
04/04/2023,9:00,40.655987,-74.002686,BROOKLYN,0.0,0.0,0,0,0,0,0,0,4618974,2023-04-04 09:00:00,2023-04-04T09:00,2023,4,13.9,0.0,Clear
05/09/2023,15:00,40.6918,-73.98732,BROOKLYN,1.0,0.0,0,0,0,0,1,0,4628529,2023-05-09 15:00:00,2023-05-09T15:00,2023,5,16.1,0.0,Cloudy
07/27/2023,0:00,40.662743,-73.921936,BROOKLYN,1.0,0.0,0,0,0,0,0,0,4649861,2023-07-27 00:00:00,2023-07-27T00:00,2023,7,23.0,0.0,Clear
04/21/2023,21:00,40.65805,-73.88236,BROOKLYN,2.0,0.0,0,0,0,0,2,0,4622874,2023-04-21 21:00:00,2023-04-21T21:00,2023,4,10.4,0.0,Cloudy
01/18/2023,17:00,40.713917,-73.93275,BROOKLYN,1.0,0.0,0,0,0,0,1,0,4599225,2023-01-18 17:00:00,2023-01-18T17:00,2023,1,7.6,0.0,Cloudy
01/21/2023,20:00,40.624844,-74.027504,BROOKLYN,1.0,0.0,0,0,0,0,0,0,4600053,2023-01-21 20:00:00,2023-01-21T20:00,2023,1,0.5,0.0,Clear
08/10/2023,14:00,40.627632,-73.93652,BROOKLYN,1.0,0.0,0,0,0,0,1,0,4654344,2023-08-10 14:00:00,2023-08-10T14:00,2023,8,22.8,1.5,Light Rain
12/22/2023,22:00,40.72647,-73.94561,BROOKLYN,0.0,0.0,0,0,0,0,0,0,4689740,2023-12-22 22:00:00,2023-12-22T22:00,2023,12,-2.3,0.0,Cloudy
03/29/2023,10:00,40.730587,-73.95772,BROOKLYN,1.0,0.0,0,0,0,0,1,0,4616740,2023-03-29 10:00:00,2023-03-29T10:00,2023,3,7.9,0.0,Clear
08/18/2023,7:00,40.643284,-73.89251,BROOKLYN,1.0,0.0,0,0,0,0,1,0,4655049,2023-08-18 07:00:00,2023-08-18T07:00,2023,8,23.8,0.0,Clear
02/13/2023,13:00,40.58667,-73.966156,BROOKLYN,1.0,0.0,0,0,0,0,1,0,4606719,2023-02-13 13:00:00,2023-02-13T13:00,2023,2,10.3,0.0,Clear
04/20/2023,17:00,40.679665,-73.93634,BROOKLYN,1.0,0.0,0,0,0,0,1,0,4625067,2023-04-20 17:00:00,2023-04-20T17:00,2023,4,11.9,0.0,Clear
08/26/2023,21:00,40.673603,-73.99973,BROOKLYN,1.0,0.0,1,0,0,0,0,0,4657217,2023-08-26 21:00:00,2023-08-26T21:00,2023,8,23.0,0.0,Clear
05/13/2023,0:00,40.68336,-73.91167,BROOKLYN,1.0,0.0,0,0,1,0,0,0,4628663,2023-05-13 00:00:00,2023-05-13T00:00,2023,5,19.9,0.0,Cloudy
07/22/2023,12:00,40.672832,-73.96908,BROOKLYN,1.0,0.0,0,0,0,0,0,0,4650103,2023-07-22 12:00:00,2023-07-22T12:00,2023,7,26.8,0.0,Cloudy
05/20/2023,11:00,40.680016,-73.87743,BROOKLYN,3.0,0.0,0,0,0,0,3,0,4632373,2023-05-20 11:00:00,2023-05-20T11:00,2023,5,16.4,1.4,Light Rain
11/25/2023,17:00,40.59793,-73.9855,BROOKLYN,1.0,0.0,1,0,0,0,0,0,4681901,2023-11-25 17:00:00,2023-11-25T17:00,2023,11,3.5,0.0,Clear
05/04/2023,0:00,40.62987,-73.92198,BROOKLYN,2.0,0.0,0,0,0,0,2,0,4626050,2023-05-04 00:00:00,2023-05-04T00:00,2023,5,7.6,0.0,Clear
10/26/2023,21:00,40.586784,-73.94415,BROOKLYN,1.0,0.0,0,0,1,0,0,0,4676014,2023-10-26 21:00:00,2023-10-26T21:00,2023,10,17.9,0.0,Cloudy
05/12/2023,0:00,40.64938,-73.905556,BROOKLYN,0.0,0.0,0,0,0,0,0,0,4630420,2023-05-12 00:00:00,2023-05-12T00:00,2023,5,15.6,0.0,Cloudy
11/30/2023,11:00,40.64456,-73.98836,BROOKLYN,1.0,0.0,0,0,0,0,1,0,4683877,2023-11-30 11:00:00,2023-11-30T11:00,2023,11,5.9,0.0,Clear
07/14/2023,0:00,40.650703,-74.00449,BROOKLYN,1.0,0.0,0,0,0,0,0,0,4646295,2023-07-14 00:00:00,2023-07-14T00:00,2023,7,24.0,0.0,Cloudy
02/03/2023,10:00,40.655884,-73.942535,BROOKLYN,1.0,0.0,0,0,0,0,1,0,4604555,2023-02-03 10:00:00,2023-02-03T10:00,2023,2,-4.4,0.0,Cloudy
05/14/2023,8:00,40.591667,-73.986534,BROOKLYN,1.0,0.0,0,0,0,0,1,0,4628476,2023-05-14 08:00:00,2023-05-14T08:00,2023,5,16.8,0.0,Cloudy
03/26/2023,15:00,40.682873,-73.914474,BROOKLYN,3.0,0.0,0,0,2,0,1,0,4616851,2023-03-26 15:00:00,2023-03-26T15:00,2023,3,14.8,0.0,Clear
08/15/2023,11:00,40.610516,-73.99889,BROOKLYN,1.0,0.0,1,0,0,0,0,0,4654364,2023-08-15 11:00:00,2023-08-15T11:00,2023,8,26.1,0.1,Drizzle
02/19/2023,23:00,40.64316,-74.01922,BROOKLYN,2.0,0.0,0,0,0,0,2,0,4607074,2023-02-19 23:00:00,2023-02-19T23:00,2023,2,7.4,0.0,Cloudy
05/16/2023,12:00,40.676773,-73.97218,BROOKLYN,1.0,0.0,0,0,0,0,0,0,4629484,2023-05-16 12:00:00,2023-05-16T12:00,2023,5,24.9,0.0,Cloudy
12/17/2023,22:00,40.609554,-73.96631,BROOKLYN,1.0,0.0,0,0,0,0,1,0,4688023,2023-12-17 22:00:00,2023-12-17T22:00,2023,12,13.0,0.9,Drizzle
01/18/2023,0:00,40.589985,-73.95568,BROOKLYN,0.0,0.0,0,0,0,0,0,0,4598751,2023-01-18 00:00:00,2023-01-18T00:00,2023,1,4.3,0.0,Clear
01/13/2023,17:00,40.717022,-73.96527,BROOKLYN,1.0,0.0,0,0,1,0,0,0,4597635,2023-01-13 17:00:00,2023-01-13T17:00,2023,1,6.0,0.0,Cloudy
03/22/2023,13:00,40.69309,-73.94296,BROOKLYN,1.0,0.0,0,0,1,0,0,0,4615349,2023-03-22 13:00:00,2023-03-22T13:00,2023,3,11.7,0.0,Cloudy
07/11/2023,8:00,40.615017,-73.95854,BROOKLYN,0.0,0.0,0,0,0,0,0,0,4646290,2023-07-11 08:00:00,2023-07-11T08:00,2023,7,24.2,0.0,Clear
06/09/2023,10:00,40.668373,-73.92264,BROOKLYN,1.0,0.0,0,0,1,0,0,0,4638535,2023-06-09 10:00:00,2023-06-09T10:00,2023,6,19.3,0.0,Clear
01/01/2023,5:00,40.65944,-73.93018,BROOKLYN,1.0,0.0,0,0,0,0,1,0,4596157,2023-01-01 05:00:00,2023-01-01T05:00,2023,1,8.7,0.0,Cloudy
02/13/2023,11:00,40.621635,-74.009636,BROOKLYN,0.0,0.0,0,0,0,0,0,0,4605314,2023-02-13 11:00:00,2023-02-13T11:00,2023,2,7.6,0.0,Clear
07/18/2023,10:00,40.648705,-74.010254,BROOKLYN,1.0,0.0,0,0,1,0,0,0,4646875,2023-07-18 10:00:00,2023-07-18T10:00,2023,7,28.5,0.0,Clear
02/09/2023,8:00,40.69388,-73.971,BROOKLYN,0.0,0.0,0,0,0,0,0,0,4604285,2023-02-09 08:00:00,2023-02-09T08:00,2023,2,2.5,0.0,Cloudy
10/29/2023,13:00,40.600895,-73.98031,BROOKLYN,1.0,0.0,0,0,0,0,1,0,4674818,2023-10-29 13:00:00,2023-10-29T13:00,2023,10,13.0,0.5,Drizzle
12/21/2023,19:00,40.661167,-73.87969,BROOKLYN,0.0,0.0,0,0,0,0,0,0,4690163,2023-12-21 19:00:00,2023-12-21T19:00,2023,12,-1.8,0.0,Clear
01/19/2023,17:00,40.633385,-73.97552,BROOKLYN,2.0,0.0,2,0,0,0,0,0,4599255,2023-01-19 17:00:00,2023-01-19T17:00,2023,1,5.9,0.8,Drizzle
10/03/2023,21:00,40.662014,-73.886826,BROOKLYN,2.0,0.0,0,0,0,0,2,0,4667625,2023-10-03 21:00:00,2023-10-03T21:00,2023,10,18.6,0.0,Clear
10/23/2023,11:00,40.63531,-73.999016,BROOKLYN,0.0,0.0,0,0,0,0,0,0,4673447,2023-10-23 11:00:00,2023-10-23T11:00,2023,10,13.5,0.0,Clear
05/04/2023,9:00,40.649643,-73.95289,BROOKLYN,0.0,0.0,0,0,0,0,0,0,4627769,2023-05-04 09:00:00,2023-05-04T09:00,2023,5,11.0,0.0,Cloudy
06/11/2023,19:00,40.70354,-73.96048,BROOKLYN,1.0,0.0,1,0,0,0,0,0,4636846,2023-06-11 19:00:00,2023-06-11T19:00,2023,6,20.9,0.0,Cloudy
10/05/2023,14:00,40.645016,-73.950874,BROOKLYN,1.0,0.0,1,0,0,0,0,0,4668560,2023-10-05 14:00:00,2023-10-05T14:00,2023,10,21.6,0.0,Cloudy
05/18/2023,0:00,40.658875,-74.002945,BROOKLYN,1.0,0.0,0,0,0,0,1,0,4629925,2023-05-18 00:00:00,2023-05-18T00:00,2023,5,9.2,0.0,Clear
06/05/2023,17:00,40.630512,-73.957306,BROOKLYN,1.0,0.0,0,0,0,0,1,0,4635295,2023-06-05 17:00:00,2023-06-05T17:00,2023,6,20.9,0.0,Clear
08/31/2023,13:00,40.65064,-73.910835,BROOKLYN,0.0,0.0,0,0,0,0,0,0,4658520,2023-08-31 13:00:00,2023-08-31T13:00,2023,8,24.5,0.0,Clear
04/04/2023,23:00,40.634605,-73.98539,BROOKLYN,1.0,0.0,1,0,0,0,0,0,4618450,2023-04-04 23:00:00,2023-04-04T23:00,2023,4,12.6,0.0,Clear
06/25/2023,0:00,40.684963,-73.935455,BROOKLYN,0.0,0.0,0,0,0,0,0,0,4644723,2023-06-25 00:00:00,2023-06-25T00:00,2023,6,20.9,0.0,Cloudy
05/03/2023,17:00,40.61951,-73.914635,BROOKLYN,1.0,0.0,0,0,0,0,1,0,4626048,2023-05-03 17:00:00,2023-05-03T17:00,2023,5,11.4,0.3,Drizzle
04/19/2023,10:00,40.615406,-73.97983,BROOKLYN,0.0,0.0,0,0,0,0,0,0,4622448,2023-04-19 10:00:00,2023-04-19T10:00,2023,4,10.6,0.0,Cloudy
02/05/2023,22:00,40.639793,-73.929115,BROOKLYN,1.0,0.0,0,0,0,0,1,0,4604024,2023-02-05 22:00:00,2023-02-05T22:00,2023,2,2.4,0.0,Cloudy
03/28/2023,17:00,40.648365,-74.015755,BROOKLYN,0.0,0.0,0,0,0,0,0,0,4616406,2023-03-28 17:00:00,2023-03-28T17:00,2023,3,10.7,0.0,Clear
04/08/2023,13:00,40.65474,-73.90693,BROOKLYN,1.0,0.0,1,0,0,0,0,0,4619974,2023-04-08 13:00:00,2023-04-08T13:00,2023,4,8.8,0.0,Cloudy
06/01/2023,23:00,40.588173,-73.95246,BROOKLYN,0.0,0.0,0,0,0,0,0,0,4634076,2023-06-01 23:00:00,2023-06-01T23:00,2023,6,17.8,0.0,Clear
07/26/2023,1:00,40.66545,-73.88939,BROOKLYN,1.0,0.0,0,0,1,0,0,0,4649081,2023-07-26 01:00:00,2023-07-26T01:00,2023,7,18.7,0.0,Clear
05/23/2023,18:00,40.6756,-73.90069,BROOKLYN,1.0,0.0,1,0,0,0,0,0,4631756,2023-05-23 18:00:00,2023-05-23T18:00,2023,5,14.2,0.0,Cloudy
12/30/2023,14:00,40.652126,-73.97401,BROOKLYN,0.0,0.0,0,0,0,0,0,0,4691827,2023-12-30 14:00:00,2023-12-30T14:00,2023,12,7.8,0.0,Cloudy
07/07/2023,7:00,40.643574,-73.97166,BROOKLYN,1.0,0.0,0,0,0,0,1,0,4643655,2023-07-07 07:00:00,2023-07-07T07:00,2023,7,24.0,0.0,Cloudy
07/07/2023,14:00,40.6306,-73.97031,BROOKLYN,1.0,0.0,0,0,1,0,0,0,4643996,2023-07-07 14:00:00,2023-07-07T14:00,2023,7,25.7,0.0,Clear
06/19/2023,15:00,40.683514,-73.97596,BROOKLYN,2.0,0.0,0,0,0,0,2,0,4639459,2023-06-19 15:00:00,2023-06-19T15:00,2023,6,22.9,0.0,Cloudy
01/23/2023,10:00,40.682907,-73.86732,BROOKLYN,1.0,0.0,1,0,0,0,0,0,4599995,2023-01-23 10:00:00,2023-01-23T10:00,2023,1,3.2,0.1,Drizzle
11/03/2023,17:00,40.609123,-73.9503,BROOKLYN,3.0,0.0,0,0,0,0,3,0,4677638,2023-11-03 17:00:00,2023-11-03T17:00,2023,11,11.2,0.0,Clear
10/02/2023,9:00,40.665775,-73.86532,BROOKLYN,0.0,0.0,0,0,0,0,0,0,4667183,2023-10-02 09:00:00,2023-10-02T09:00,2023,10,20.6,0.0,Clear
11/16/2023,14:00,40.6568,-73.928,BROOKLYN,1.0,0.0,1,0,0,0,0,0,4680484,2023-11-16 14:00:00,2023-11-16T14:00,2023,11,16.8,0.0,Clear
07/12/2023,13:00,40.618385,-73.95669,BROOKLYN,0.0,0.0,0,0,0,0,0,0,4645064,2023-07-12 13:00:00,2023-07-12T13:00,2023,7,31.0,0.0,Cloudy
08/01/2023,18:00,40.607082,-73.94607,BROOKLYN,1.0,0.0,0,0,0,0,1,0,4651184,2023-08-01 18:00:00,2023-08-01T18:00,2023,8,24.6,0.0,Clear
04/23/2023,18:00,40.699802,-73.94032,BROOKLYN,1.0,0.0,0,0,0,0,1,0,4623733,2023-04-23 18:00:00,2023-04-23T18:00,2023,4,16.8,0.0,Clear
10/24/2023,7:00,40.68152,-73.98327,BROOKLYN,1.0,0.0,0,0,0,0,1,0,4673329,2023-10-24 07:00:00,2023-10-24T07:00,2023,10,6.6,0.0,Clear
12/04/2023,18:00,40.707,-73.9673,BROOKLYN,1.0,0.0,0,0,0,0,1,0,4685146,2023-12-04 18:00:00,2023-12-04T18:00,2023,12,7.2,0.0,Cloudy
01/19/2023,16:00,40.70166,-73.961464,BROOKLYN,2.0,0.0,0,0,0,0,2,0,4599813,2023-01-19 16:00:00,2023-01-19T16:00,2023,1,5.7,0.8,Drizzle
04/06/2023,16:00,40.67816,-73.897484,BROOKLYN,1.0,0.0,0,0,0,0,1,0,4618996,2023-04-06 16:00:00,2023-04-06T16:00,2023,4,15.3,0.0,Cloudy
07/03/2023,21:00,40.59557,-73.93318,BROOKLYN,1.0,0.0,1,0,0,0,0,0,4644024,2023-07-03 21:00:00,2023-07-03T21:00,2023,7,26.0,0.0,Cloudy
05/09/2023,9:00,40.651695,-73.94968,BROOKLYN,1.0,0.0,1,0,0,0,0,0,4627767,2023-05-09 09:00:00,2023-05-09T09:00,2023,5,16.2,0.0,Cloudy
04/25/2023,14:00,40.659744,-73.87428,BROOKLYN,3.0,0.0,0,0,0,0,3,0,4623789,2023-04-25 14:00:00,2023-04-25T14:00,2023,4,14.6,0.0,Cloudy
04/20/2023,22:00,40.635777,-73.88665,BROOKLYN,1.0,0.0,0,0,1,0,0,0,4622344,2023-04-20 22:00:00,2023-04-20T22:00,2023,4,9.8,0.0,Cloudy
11/13/2023,23:00,40.66255,-73.90893,BROOKLYN,1.0,0.0,0,0,0,0,1,0,4679403,2023-11-13 23:00:00,2023-11-13T23:00,2023,11,3.6,0.0,Clear
06/05/2023,23:00,40.59501,-74.00104,BROOKLYN,1.0,0.0,1,0,0,0,0,0,4635603,2023-06-05 23:00:00,2023-06-05T23:00,2023,6,17.9,0.0,Cloudy
12/03/2023,18:00,40.680244,-73.87661,BROOKLYN,1.0,0.0,0,0,0,0,1,0,4685044,2023-12-03 18:00:00,2023-12-03T18:00,2023,12,9.8,0.0,Cloudy
06/02/2023,22:00,40.584152,-73.95627,BROOKLYN,0.0,0.0,0,0,0,0,0,0,4634852,2023-06-02 22:00:00,2023-06-02T22:00,2023,6,17.2,0.0,Clear
10/01/2023,16:00,40.65997,-73.88739,BROOKLYN,1.0,0.0,0,0,0,0,1,0,4666885,2023-10-01 16:00:00,2023-10-01T16:00,2023,10,24.2,0.0,Clear
10/20/2023,13:00,40.66323,-73.93161,BROOKLYN,1.0,0.0,0,0,0,0,1,0,4674741,2023-10-20 13:00:00,2023-10-20T13:00,2023,10,17.2,0.5,Drizzle
03/01/2023,20:00,40.683514,-73.97596,BROOKLYN,1.0,0.0,1,0,0,0,0,0,4619828,2023-03-01 20:00:00,2023-03-01T20:00,2023,3,4.3,0.1,Drizzle
04/28/2023,15:00,40.669754,-73.98923,BROOKLYN,1.0,0.0,0,0,1,0,0,0,4624818,2023-04-28 15:00:00,2023-04-28T15:00,2023,4,11.3,0.0,Cloudy
04/29/2023,6:00,40.643204,-73.90929,BROOKLYN,2.0,0.0,0,0,0,0,2,0,4628617,2023-04-29 06:00:00,2023-04-29T06:00,2023,4,10.2,2.2,Light Rain
06/21/2023,11:00,40.637493,-73.9102,BROOKLYN,0.0,0.0,0,0,0,0,0,0,4639631,2023-06-21 11:00:00,2023-06-21T11:00,2023,6,21.4,0.0,Cloudy
07/10/2023,4:00,40.664894,-73.875946,BROOKLYN,1.0,0.0,0,0,0,0,1,0,4645565,2023-07-10 04:00:00,2023-07-10T04:00,2023,7,21.7,0.0,Cloudy
05/11/2023,15:00,40.684227,-73.974014,BROOKLYN,0.0,0.0,0,0,0,0,0,0,4628947,2023-05-11 15:00:00,2023-05-11T15:00,2023,5,19.8,0.0,Clear
06/26/2023,16:00,40.708424,-73.95791,BROOKLYN,1.0,0.0,0,0,0,0,1,0,4642554,2023-06-26 16:00:00,2023-06-26T16:00,2023,6,23.8,0.0,Cloudy
05/31/2023,0:00,40.661983,-73.95079,BROOKLYN,1.0,0.0,1,0,0,0,0,0,4633802,2023-05-31 00:00:00,2023-05-31T00:00,2023,5,10.9,0.0,Clear
07/17/2023,0:00,40.646313,-74.00479,BROOKLYN,1.0,0.0,0,0,0,0,1,0,4646876,2023-07-17 00:00:00,2023-07-17T00:00,2023,7,21.3,0.0,Clear
04/03/2023,20:00,40.63802,-73.88764,BROOKLYN,0.0,0.0,0,0,0,0,0,0,4618469,2023-04-03 20:00:00,2023-04-03T20:00,2023,4,9.8,0.0,Cloudy
09/24/2023,23:00,40.644806,-73.92383,BROOKLYN,2.0,0.0,0,0,0,0,2,0,4665831,2023-09-24 23:00:00,2023-09-24T23:00,2023,9,17.1,0.3,Drizzle
06/02/2023,15:00,40.715973,-73.95922,BROOKLYN,0.0,0.0,0,0,0,0,0,0,4635017,2023-06-02 15:00:00,2023-06-02T15:00,2023,6,28.1,0.0,Clear
01/31/2023,13:00,40.64453,-73.94599,BROOKLYN,1.0,0.0,0,0,0,0,1,0,4602593,2023-01-31 13:00:00,2023-01-31T13:00,2023,1,3.3,0.0,Cloudy
04/09/2023,11:00,40.64856,-73.91524,BROOKLYN,1.0,0.0,0,0,0,0,1,0,4619724,2023-04-09 11:00:00,2023-04-09T11:00,2023,4,10.9,0.0,Clear
11/21/2023,20:00,40.63529,-73.958206,BROOKLYN,1.0,0.0,1,0,0,0,0,0,4682078,2023-11-21 20:00:00,2023-11-21T20:00,2023,11,7.9,1.0,Drizzle
04/19/2023,6:00,40.7091,-73.94009,BROOKLYN,1.0,0.0,0,0,0,0,1,0,4621754,2023-04-19 06:00:00,2023-04-19T06:00,2023,4,5.1,0.0,Clear
01/28/2023,23:00,40.68978,-73.98139,BROOKLYN,0.0,0.0,0,0,0,0,0,0,4674601,2023-01-28 23:00:00,2023-01-28T23:00,2023,1,4.5,0.0,Cloudy
12/04/2023,7:00,40.589043,-73.98381,BROOKLYN,1.0,0.0,0,0,0,0,1,0,4684411,2023-12-04 07:00:00,2023-12-04T07:00,2023,12,5.7,0.0,Clear
05/18/2023,13:00,40.68504,-73.97819,BROOKLYN,0.0,0.0,0,0,0,0,0,0,4630370,2023-05-18 13:00:00,2023-05-18T13:00,2023,5,13.6,0.0,Clear
10/10/2023,20:00,40.66682,-73.88166,BROOKLYN,1.0,0.0,0,0,0,0,1,0,4670120,2023-10-10 20:00:00,2023-10-10T20:00,2023,10,15.3,0.0,Cloudy
07/05/2023,5:00,40.678722,-73.952995,BROOKLYN,1.0,0.0,0,0,0,0,1,0,4642948,2023-07-05 05:00:00,2023-07-05T05:00,2023,7,21.3,0.0,Cloudy
04/14/2023,12:00,40.65622,-73.913155,BROOKLYN,0.0,0.0,0,0,0,0,0,0,4620989,2023-04-14 12:00:00,2023-04-14T12:00,2023,4,27.7,0.0,Cloudy
03/28/2023,0:00,40.661167,-73.87969,BROOKLYN,1.0,0.0,0,0,0,0,1,0,4616305,2023-03-28 00:00:00,2023-03-28T00:00,2023,3,4.1,0.0,Clear
03/06/2023,14:00,40.700718,-73.929794,BROOKLYN,1.0,0.0,0,0,1,0,0,0,4610724,2023-03-06 14:00:00,2023-03-06T14:00,2023,3,10.3,0.0,Cloudy
06/14/2023,16:00,40.64803,-73.966675,BROOKLYN,1.0,0.0,0,0,0,0,1,0,4639440,2023-06-14 16:00:00,2023-06-14T16:00,2023,6,19.3,0.0,Cloudy
07/29/2023,0:00,40.579197,-73.98195,BROOKLYN,2.0,0.0,0,0,0,0,2,0,4649706,2023-07-29 00:00:00,2023-07-29T00:00,2023,7,26.4,0.0,Cloudy
03/18/2023,21:00,40.707577,-73.92884,BROOKLYN,1.0,0.0,0,0,0,0,1,0,4614409,2023-03-18 21:00:00,2023-03-18T21:00,2023,3,3.9,0.0,Clear
11/14/2023,18:00,40.673267,-73.98952,BROOKLYN,8.0,0.0,0,0,0,0,8,0,4679112,2023-11-14 18:00:00,2023-11-14T18:00,2023,11,5.9,0.0,Clear
01/31/2023,13:00,40.690544,-73.995445,BROOKLYN,0.0,0.0,0,0,0,0,0,0,4602675,2023-01-31 13:00:00,2023-01-31T13:00,2023,1,3.2,0.0,Cloudy
07/17/2023,21:00,40.712463,-73.96598,BROOKLYN,1.0,0.0,0,0,0,0,1,0,4652321,2023-07-17 21:00:00,2023-07-17T21:00,2023,7,24.5,0.0,Clear
10/13/2023,7:00,40.61505,-73.90465,BROOKLYN,1.0,0.0,0,0,0,0,1,0,4670180,2023-10-13 07:00:00,2023-10-13T07:00,2023,10,10.6,0.0,Clear
03/05/2023,10:00,40.622757,-74.03777,BROOKLYN,0.0,0.0,0,0,0,0,0,0,4610222,2023-03-05 10:00:00,2023-03-05T10:00,2023,3,7.0,0.0,Clear
06/27/2023,18:00,40.66222,-73.89725,BROOKLYN,1.0,0.0,1,0,0,0,0,0,4642102,2023-06-27 18:00:00,2023-06-27T18:00,2023,6,23.1,0.0,Cloudy
03/11/2023,21:00,40.649395,-73.9609,BROOKLYN,1.0,0.0,0,0,1,0,0,0,4612094,2023-03-11 21:00:00,2023-03-11T21:00,2023,3,2.7,0.0,Cloudy
12/21/2023,11:00,40.647472,-73.99912,BROOKLYN,0.0,0.0,0,0,0,0,0,0,4689385,2023-12-21 11:00:00,2023-12-21T11:00,2023,12,3.1,0.0,Clear
02/15/2023,16:00,40.67189,-73.895874,BROOKLYN,1.0,0.0,0,0,0,0,1,0,4605910,2023-02-15 16:00:00,2023-02-15T16:00,2023,2,15.4,0.0,Cloudy
04/28/2023,9:00,40.70483,-73.96633,BROOKLYN,1.0,0.0,1,0,0,0,0,0,4624318,2023-04-28 09:00:00,2023-04-28T09:00,2023,4,11.8,0.0,Cloudy
09/16/2023,17:00,40.62397,-73.95021,BROOKLYN,2.0,0.0,0,0,2,0,0,0,4663199,2023-09-16 17:00:00,2023-09-16T17:00,2023,9,23.7,0.0,Clear
05/14/2023,12:00,40.69212,-73.98435,BROOKLYN,1.0,0.0,1,0,0,0,0,0,4630707,2023-05-14 12:00:00,2023-05-14T12:00,2023,5,20.6,0.0,Clear
02/27/2023,8:00,40.64077,-73.99408,BROOKLYN,0.0,0.0,0,0,0,0,0,0,4608927,2023-02-27 08:00:00,2023-02-27T08:00,2023,2,0.6,0.0,Cloudy
09/01/2023,10:00,40.629974,-74.00813,BROOKLYN,1.0,0.0,1,0,0,0,0,0,4658674,2023-09-01 10:00:00,2023-09-01T10:00,2023,9,21.1,0.0,Clear
01/24/2023,15:00,40.652767,-73.8863,BROOKLYN,1.0,0.0,0,0,0,0,1,0,4601067,2023-01-24 15:00:00,2023-01-24T15:00,2023,1,7.3,0.0,Clear
06/05/2023,19:00,40.655457,-73.961975,BROOKLYN,1.0,0.0,0,0,0,0,1,0,4640742,2023-06-05 19:00:00,2023-06-05T19:00,2023,6,18.1,0.0,Clear
09/09/2023,2:00,40.67955,-73.88586,BROOKLYN,3.0,0.0,2,0,0,0,1,0,4662423,2023-09-09 02:00:00,2023-09-09T02:00,2023,9,21.3,0.0,Cloudy
05/19/2023,10:00,40.690895,-73.99406,BROOKLYN,1.0,0.0,1,0,0,0,0,0,4631583,2023-05-19 10:00:00,2023-05-19T10:00,2023,5,18.0,0.0,Cloudy
06/13/2023,18:00,40.655655,-73.87344,BROOKLYN,1.0,0.0,1,0,0,0,0,0,4637456,2023-06-13 18:00:00,2023-06-13T18:00,2023,6,24.4,0.0,Clear
11/08/2023,0:00,40.677414,-73.93033,BROOKLYN,1.0,0.0,0,0,0,0,1,0,4678023,2023-11-08 00:00:00,2023-11-08T00:00,2023,11,10.0,0.0,Clear
03/24/2023,7:00,40.60553,-73.92917,BROOKLYN,1.0,0.0,1,0,0,0,0,0,4615168,2023-03-24 07:00:00,2023-03-24T07:00,2023,3,7.1,0.0,Cloudy
03/22/2023,4:00,40.6752,-73.950005,BROOKLYN,2.0,0.0,0,0,0,0,2,0,4614757,2023-03-22 04:00:00,2023-03-22T04:00,2023,3,2.6,0.0,Cloudy
06/24/2023,11:00,40.610443,-73.96246,BROOKLYN,1.0,0.0,0,0,0,0,0,0,4640358,2023-06-24 11:00:00,2023-06-24T11:00,2023,6,22.8,0.1,Drizzle
05/06/2023,13:00,40.636463,-73.9118,BROOKLYN,1.0,0.0,0,0,0,0,1,0,4630419,2023-05-06 13:00:00,2023-05-06T13:00,2023,5,20.2,0.0,Cloudy
10/20/2023,0:00,40.60263,-73.965,BROOKLYN,1.0,0.0,0,0,0,0,1,0,4672292,2023-10-20 00:00:00,2023-10-20T00:00,2023,10,14.9,0.0,Cloudy
03/12/2023,0:00,40.676342,-73.910934,BROOKLYN,1.0,0.0,0,0,0,0,1,0,4611916,2023-03-12 00:00:00,2023-03-12T00:00,2023,3,1.5,0.0,Clear
08/13/2023,0:00,40.611588,-73.99303,BROOKLYN,1.0,0.0,1,0,0,0,0,0,4653741,2023-08-13 00:00:00,2023-08-13T00:00,2023,8,21.9,0.0,Cloudy
11/24/2023,16:00,40.70421,-73.96123,BROOKLYN,2.0,0.0,1,0,1,0,0,0,4683008,2023-11-24 16:00:00,2023-11-24T16:00,2023,11,7.1,0.0,Cloudy
04/10/2023,12:00,0.0,0.0,BROOKLYN,1.0,0.0,0,0,0,0,1,0,4619603,2023-04-10 12:00:00,2023-04-10T12:00,2023,4,28.1,0.0,Clear
04/08/2023,19:00,40.647713,-73.96058,BROOKLYN,1.0,0.0,0,0,1,0,0,0,4619515,2023-04-08 19:00:00,2023-04-08T19:00,2023,4,6.3,0.0,Cloudy
12/01/2023,15:00,40.609043,-73.96219,BROOKLYN,1.0,0.0,0,0,0,0,1,0,4684845,2023-12-01 15:00:00,2023-12-01T15:00,2023,12,9.1,0.0,Cloudy
07/27/2023,0:00,40.760937,-73.971245,MANHATTAN,1.0,0.0,0,0,0,0,1,0,4649295,2023-07-27 00:00:00,2023-07-27T00:00,2023,7,22.3,0.0,Clear
08/15/2023,12:00,40.799976,-73.94274,MANHATTAN,1.0,0.0,0,0,0,0,1,0,4654790,2023-08-15 12:00:00,2023-08-15T12:00,2023,8,25.1,0.0,Cloudy
03/09/2023,0:00,40.717194,-73.98411,MANHATTAN,1.0,0.0,0,0,0,0,1,0,4611610,2023-03-09 00:00:00,2023-03-09T00:00,2023,3,1.4,0.0,Cloudy
02/17/2023,11:00,40.76542,-73.980125,MANHATTAN,1.0,0.0,0,0,0,0,1,0,4609865,2023-02-17 11:00:00,2023-02-17T11:00,2023,2,13.6,0.5,Drizzle
09/09/2023,18:00,40.82034,-73.940025,MANHATTAN,1.0,0.0,0,0,1,0,0,0,4665079,2023-09-09 18:00:00,2023-09-09T18:00,2023,9,23.5,0.0,Cloudy
12/08/2023,0:00,40.72882,-74.0053,MANHATTAN,2.0,0.0,0,0,0,0,2,0,4686316,2023-12-08 00:00:00,2023-12-08T00:00,2023,12,-1.6,0.0,Clear
09/20/2023,22:00,40.765884,-73.95357,MANHATTAN,0.0,0.0,0,0,0,0,0,0,4664122,2023-09-20 22:00:00,2023-09-20T22:00,2023,9,15.0,0.0,Clear
08/29/2023,16:00,40.850075,-73.93,MANHATTAN,0.0,0.0,0,0,0,0,0,0,4658975,2023-08-29 16:00:00,2023-08-29T16:00,2023,8,24.9,0.0,Cloudy
01/25/2023,16:00,40.799286,-73.945366,MANHATTAN,1.0,0.0,1,0,0,0,0,0,4601779,2023-01-25 16:00:00,2023-01-25T16:00,2023,1,2.2,1.2,Light Snow
04/06/2023,6:00,40.754128,-73.98834,MANHATTAN,1.0,0.0,1,0,0,0,0,0,4619790,2023-04-06 06:00:00,2023-04-06T06:00,2023,4,11.1,0.0,Cloudy
06/28/2023,17:00,40.71504,-73.99681,MANHATTAN,1.0,0.0,0,0,1,0,0,0,4642276,2023-06-28 17:00:00,2023-06-28T17:00,2023,6,24.6,0.7,Drizzle
03/28/2023,13:00,40.801914,-73.95348,MANHATTAN,0.0,0.0,0,0,0,0,0,0,4618763,2023-03-28 13:00:00,2023-03-28T13:00,2023,3,9.4,0.0,Cloudy
06/17/2023,18:00,40.761173,-73.9951,MANHATTAN,1.0,0.0,0,0,1,0,0,0,4639296,2023-06-17 18:00:00,2023-06-17T18:00,2023,6,22.9,0.0,Clear
05/02/2023,12:00,40.719322,-73.99731,MANHATTAN,1.0,0.0,1,0,0,0,0,0,4625508,2023-05-02 12:00:00,2023-05-02T12:00,2023,5,12.5,0.0,Cloudy
06/29/2023,21:00,40.76229,-73.986115,MANHATTAN,1.0,0.0,1,0,0,0,0,0,4642965,2023-06-29 21:00:00,2023-06-29T21:00,2023,6,20.4,0.0,Clear
02/04/2023,0:00,40.842957,-73.93468,MANHATTAN,1.0,0.0,0,0,0,0,1,0,4603109,2023-02-04 00:00:00,2023-02-04T00:00,2023,2,-12.0,0.0,Cloudy
03/06/2023,13:00,40.734673,-73.99459,MANHATTAN,1.0,0.0,0,0,1,0,0,0,4611017,2023-03-06 13:00:00,2023-03-06T13:00,2023,3,10.1,0.0,Cloudy
02/02/2023,15:00,40.73555,-73.979355,MANHATTAN,1.0,0.0,0,0,0,0,1,0,4603428,2023-02-02 15:00:00,2023-02-02T15:00,2023,2,4.1,0.0,Clear
03/29/2023,10:00,40.74321,-74.00862,MANHATTAN,0.0,0.0,0,0,0,0,0,0,4616589,2023-03-29 10:00:00,2023-03-29T10:00,2023,3,8.2,0.0,Clear
10/22/2023,18:00,40.73656,-74.0011,MANHATTAN,1.0,0.0,0,0,1,0,0,0,4672983,2023-10-22 18:00:00,2023-10-22T18:00,2023,10,10.3,0.0,Cloudy
06/13/2023,12:00,40.715237,-74.01339,MANHATTAN,1.0,0.0,0,0,1,0,0,0,4641057,2023-06-13 12:00:00,2023-06-13T12:00,2023,6,24.8,0.0,Clear
09/17/2023,18:00,40.810173,-73.937416,MANHATTAN,1.0,0.0,0,0,0,0,0,0,4663212,2023-09-17 18:00:00,2023-09-17T18:00,2023,9,20.2,0.0,Cloudy
10/11/2023,15:00,40.758633,-73.96579,MANHATTAN,1.0,0.0,0,0,1,0,0,0,4673354,2023-10-11 15:00:00,2023-10-11T15:00,2023,10,20.4,0.0,Clear
06/29/2023,0:00,40.82481,-73.93679,MANHATTAN,1.0,0.0,0,0,0,0,1,0,4643958,2023-06-29 00:00:00,2023-06-29T00:00,2023,6,18.7,0.0,Clear
10/11/2023,13:00,40.741272,-73.97535,MANHATTAN,1.0,0.0,0,0,0,0,1,0,4670073,2023-10-11 13:00:00,2023-10-11T13:00,2023,10,20.1,0.0,Clear
06/25/2023,2:00,40.799305,-73.94324,MANHATTAN,2.0,0.0,0,0,0,0,2,0,4640649,2023-06-25 02:00:00,2023-06-25T02:00,2023,6,19.7,0.0,Clear
05/26/2023,0:00,40.808426,-73.95108,MANHATTAN,0.0,0.0,0,0,0,0,0,0,4632981,2023-05-26 00:00:00,2023-05-26T00:00,2023,5,10.5,0.0,Clear
09/11/2023,18:00,40.79079,-73.94282,MANHATTAN,1.0,0.0,1,0,0,0,0,0,4665381,2023-09-11 18:00:00,2023-09-11T18:00,2023,9,23.5,1.6,Light Rain
03/08/2023,18:00,40.801956,-73.94952,MANHATTAN,1.0,0.0,0,0,0,0,1,0,4611434,2023-03-08 18:00:00,2023-03-08T18:00,2023,3,5.4,0.0,Clear
03/28/2023,0:00,40.818245,-73.93786,MANHATTAN,1.0,0.0,0,0,1,0,0,0,4618917,2023-03-28 00:00:00,2023-03-28T00:00,2023,3,3.9,0.0,Clear
06/06/2023,0:00,40.76614,-73.97166,MANHATTAN,1.0,0.0,0,0,1,0,0,0,4635636,2023-06-06 00:00:00,2023-06-06T00:00,2023,6,16.7,0.0,Cloudy
08/21/2023,17:00,40.83406,-73.944885,MANHATTAN,1.0,0.0,0,0,1,0,0,0,4656558,2023-08-21 17:00:00,2023-08-21T17:00,2023,8,30.5,0.0,Cloudy
02/15/2023,11:00,40.734837,-73.98312,MANHATTAN,1.0,0.0,0,0,0,0,1,0,4608064,2023-02-15 11:00:00,2023-02-15T11:00,2023,2,12.3,0.0,Cloudy
03/13/2023,14:00,40.733288,-74.005,MANHATTAN,0.0,0.0,0,0,0,0,0,0,4612719,2023-03-13 14:00:00,2023-03-13T14:00,2023,3,5.5,0.4,Drizzle
08/14/2023,12:00,40.76051,-73.97155,MANHATTAN,0.0,0.0,0,0,0,0,0,0,4656315,2023-08-14 12:00:00,2023-08-14T12:00,2023,8,29.2,0.1,Drizzle
07/30/2023,19:00,40.78202,-73.97173,MANHATTAN,2.0,0.0,0,0,0,0,2,0,4650154,2023-07-30 19:00:00,2023-07-30T19:00,2023,7,22.7,0.0,Clear
01/25/2023,9:00,40.748158,-73.97033,MANHATTAN,1.0,0.0,0,0,1,0,0,0,4600707,2023-01-25 09:00:00,2023-01-25T09:00,2023,1,0.5,0.0,Cloudy
08/03/2023,21:00,40.76428,-73.97302,MANHATTAN,3.0,0.0,0,0,0,0,3,0,4651257,2023-08-03 21:00:00,2023-08-03T21:00,2023,8,21.4,0.0,Clear
07/20/2023,16:00,40.717327,-73.99946,MANHATTAN,1.0,0.0,1,0,0,0,0,0,4648111,2023-07-20 16:00:00,2023-07-20T16:00,2023,7,27.3,0.0,Cloudy
11/29/2023,13:00,40.72543,-73.99678,MANHATTAN,1.0,0.0,0,0,0,0,1,0,4683224,2023-11-29 13:00:00,2023-11-29T13:00,2023,11,2.4,0.0,Clear
10/24/2023,15:00,40.726818,-73.983,MANHATTAN,1.0,0.0,0,0,0,0,1,0,4674727,2023-10-24 15:00:00,2023-10-24T15:00,2023,10,17.7,0.0,Clear
11/27/2023,0:00,40.72032,-73.99405,MANHATTAN,1.0,0.0,0,0,0,0,1,0,4683180,2023-11-27 00:00:00,2023-11-27T00:00,2023,11,12.8,1.0,Drizzle
08/01/2023,18:00,40.864807,-73.91937,MANHATTAN,1.0,0.0,0,0,0,0,1,0,4650674,2023-08-01 18:00:00,2023-08-01T18:00,2023,8,24.1,0.0,Clear
07/22/2023,3:00,40.759644,-73.98064,MANHATTAN,1.0,0.0,0,0,0,0,1,0,4647626,2023-07-22 03:00:00,2023-07-22T03:00,2023,7,19.0,0.0,Clear
01/26/2023,19:00,40.86676,-73.920616,MANHATTAN,1.0,0.0,0,0,0,0,1,0,4601973,2023-01-26 19:00:00,2023-01-26T19:00,2023,1,5.0,0.0,Cloudy
04/12/2023,21:00,40.76172,-73.98281,MANHATTAN,1.0,0.0,0,0,1,0,0,0,4621536,2023-04-12 21:00:00,2023-04-12T21:00,2023,4,19.6,0.0,Clear
11/21/2023,18:00,40.769268,-73.96937,MANHATTAN,1.0,0.0,1,0,0,0,0,0,4683334,2023-11-21 18:00:00,2023-11-21T18:00,2023,11,6.8,0.9,Drizzle
07/05/2023,23:00,40.715622,-73.99428,MANHATTAN,1.0,0.0,0,0,1,0,0,0,4643318,2023-07-05 23:00:00,2023-07-05T23:00,2023,7,23.5,0.0,Clear
01/22/2023,15:00,40.762024,-74.00116,MANHATTAN,1.0,0.0,0,0,0,0,1,0,4599706,2023-01-22 15:00:00,2023-01-22T15:00,2023,1,5.7,0.0,Cloudy
08/21/2023,16:00,40.710175,-74.001144,MANHATTAN,1.0,0.0,1,0,0,0,0,0,4655988,2023-08-21 16:00:00,2023-08-21T16:00,2023,8,31.1,0.0,Cloudy
10/05/2023,17:00,40.808277,-73.9388,MANHATTAN,1.0,0.0,0,0,0,0,1,0,4668232,2023-10-05 17:00:00,2023-10-05T17:00,2023,10,19.7,0.0,Cloudy
12/22/2023,13:00,40.814774,-73.94038,MANHATTAN,1.0,0.0,0,0,1,0,0,0,4691971,2023-12-22 13:00:00,2023-12-22T13:00,2023,12,2.0,0.0,Cloudy
03/11/2023,3:00,40.721207,-73.983955,MANHATTAN,1.0,0.0,0,0,0,0,1,0,4615130,2023-03-11 03:00:00,2023-03-11T03:00,2023,3,3.6,0.4,Drizzle
02/11/2023,21:00,40.744186,-73.991875,MANHATTAN,0.0,0.0,0,0,0,0,0,0,4604833,2023-02-11 21:00:00,2023-02-11T21:00,2023,2,1.6,0.0,Cloudy
05/06/2023,16:00,40.72454,-73.9938,MANHATTAN,2.0,0.0,0,0,0,0,2,0,4626958,2023-05-06 16:00:00,2023-05-06T16:00,2023,5,20.9,0.0,Cloudy
07/07/2023,9:00,40.717278,-74.00672,MANHATTAN,1.0,0.0,0,0,1,0,0,0,4644716,2023-07-07 09:00:00,2023-07-07T09:00,2023,7,27.3,0.1,Drizzle
04/03/2023,20:00,40.82694,-73.9402,MANHATTAN,0.0,0.0,0,0,0,0,0,0,4620063,2023-04-03 20:00:00,2023-04-03T20:00,2023,4,9.3,0.0,Cloudy
04/30/2023,19:00,40.796665,-73.96852,MANHATTAN,0.0,0.0,0,0,0,0,0,0,4625431,2023-04-30 19:00:00,2023-04-30T19:00,2023,4,13.9,1.8,Light Rain
05/11/2023,16:00,40.72178,-73.995834,MANHATTAN,1.0,0.0,1,0,0,0,0,0,4629270,2023-05-11 16:00:00,2023-05-11T16:00,2023,5,21.8,0.0,Clear
08/24/2023,13:00,40.77202,-73.956024,MANHATTAN,1.0,0.0,1,0,0,0,0,0,4657533,2023-08-24 13:00:00,2023-08-24T13:00,2023,8,23.2,0.0,Cloudy
08/19/2023,0:00,40.770412,-73.987625,MANHATTAN,1.0,0.0,0,0,1,0,0,0,4655879,2023-08-19 00:00:00,2023-08-19T00:00,2023,8,17.6,0.0,Clear
06/14/2023,0:00,40.83817,-73.93814,MANHATTAN,2.0,0.0,0,0,0,0,2,0,4637548,2023-06-14 00:00:00,2023-06-14T00:00,2023,6,15.2,0.0,Clear
03/18/2023,1:00,40.71787,-73.997116,MANHATTAN,1.0,0.0,0,0,0,0,1,0,4613829,2023-03-18 01:00:00,2023-03-18T01:00,2023,3,10.3,0.4,Drizzle
12/13/2023,7:00,40.76104,-73.97538,MANHATTAN,1.0,0.0,0,0,1,0,0,0,4692360,2023-12-13 07:00:00,2023-12-13T07:00,2023,12,-0.4,0.0,Clear
08/15/2023,17:00,40.769634,-73.94841,MANHATTAN,0.0,0.0,0,0,0,0,0,0,4654444,2023-08-15 17:00:00,2023-08-15T17:00,2023,8,26.2,0.0,Clear
02/17/2023,13:00,40.78169,-73.94897,MANHATTAN,1.0,0.0,0,0,1,0,0,0,4606591,2023-02-17 13:00:00,2023-02-17T13:00,2023,2,15.6,0.6,Drizzle
04/05/2023,11:00,40.714745,-73.98261,MANHATTAN,1.0,0.0,1,0,0,0,0,0,4618525,2023-04-05 11:00:00,2023-04-05T11:00,2023,4,13.2,0.1,Drizzle
06/25/2023,15:00,40.797432,-73.93283,MANHATTAN,2.0,0.0,0,0,0,0,2,0,4640641,2023-06-25 15:00:00,2023-06-25T15:00,2023,6,25.6,0.0,Cloudy
11/15/2023,7:00,40.766445,-73.98333,MANHATTAN,1.0,0.0,1,0,0,0,0,0,4679384,2023-11-15 07:00:00,2023-11-15T07:00,2023,11,-1.0,0.0,Clear
11/08/2023,0:00,40.748974,-73.999535,MANHATTAN,0.0,0.0,0,0,0,0,0,0,4677760,2023-11-08 00:00:00,2023-11-08T00:00,2023,11,10.0,0.0,Clear
08/07/2023,14:00,40.810276,-73.94738,MANHATTAN,1.0,0.0,0,0,0,0,1,0,4652186,2023-08-07 14:00:00,2023-08-07T14:00,2023,8,26.9,0.8,Drizzle
03/25/2023,6:00,40.8068,-73.94993,MANHATTAN,2.0,0.0,0,0,0,0,2,0,4618438,2023-03-25 06:00:00,2023-03-25T06:00,2023,3,6.0,0.0,Cloudy
09/28/2023,21:00,40.74406,-74.00682,MANHATTAN,2.0,0.0,0,0,0,0,1,0,4666674,2023-09-28 21:00:00,2023-09-28T21:00,2023,9,15.3,0.0,Clear
02/11/2023,13:00,40.769753,-73.95458,MANHATTAN,1.0,0.0,0,0,0,0,1,0,4605036,2023-02-11 13:00:00,2023-02-11T13:00,2023,2,5.9,0.0,Clear
10/28/2023,0:00,40.815403,-73.93992,MANHATTAN,1.0,0.0,0,0,0,0,0,0,4674889,2023-10-28 00:00:00,2023-10-28T00:00,2023,10,16.8,0.0,Clear
09/01/2023,18:00,40.720623,-73.99498,MANHATTAN,2.0,0.0,0,0,0,0,2,0,4659600,2023-09-01 18:00:00,2023-09-01T18:00,2023,9,20.9,0.0,Clear
02/04/2023,11:00,40.718395,-73.9978,MANHATTAN,1.0,0.0,1,0,0,0,0,0,4606017,2023-02-04 11:00:00,2023-02-04T11:00,2023,2,-9.4,0.0,Clear
08/13/2023,19:00,40.850906,-73.93829,MANHATTAN,3.0,0.0,0,0,0,0,3,0,4654941,2023-08-13 19:00:00,2023-08-13T19:00,2023,8,25.5,0.0,Clear
05/05/2023,16:00,40.751522,-73.99396,MANHATTAN,1.0,0.0,0,0,0,0,1,0,4627514,2023-05-05 16:00:00,2023-05-05T16:00,2023,5,16.9,0.0,Cloudy
02/20/2023,18:00,40.783337,-73.970764,MANHATTAN,0.0,0.0,0,0,0,0,0,0,4607455,2023-02-20 18:00:00,2023-02-20T18:00,2023,2,10.1,0.0,Cloudy
12/16/2023,7:00,40.807343,-73.942406,MANHATTAN,0.0,0.0,0,0,0,0,0,0,4689086,2023-12-16 07:00:00,2023-12-16T07:00,2023,12,1.8,0.0,Clear
04/21/2023,0:00,40.726395,-73.98617,MANHATTAN,0.0,0.0,0,0,0,0,0,0,4623010,2023-04-21 00:00:00,2023-04-21T00:00,2023,4,9.8,0.0,Cloudy
02/26/2023,17:00,40.8044,-73.94168,MANHATTAN,1.0,0.0,1,0,0,0,0,0,4609117,2023-02-26 17:00:00,2023-02-26T17:00,2023,2,8.4,0.0,Clear
11/02/2023,16:00,40.722324,-74.01176,MANHATTAN,1.0,0.0,1,0,0,0,0,0,4676340,2023-11-02 16:00:00,2023-11-02T16:00,2023,11,9.0,0.0,Clear
08/20/2023,23:00,40.799984,-73.944855,MANHATTAN,1.0,0.0,0,0,0,0,1,0,4656220,2023-08-20 23:00:00,2023-08-20T23:00,2023,8,20.8,0.0,Clear
05/25/2023,23:00,40.757103,-73.9862,MANHATTAN,1.0,0.0,0,0,0,0,1,0,4634699,2023-05-25 23:00:00,2023-05-25T23:00,2023,5,11.7,0.0,Clear
08/02/2023,14:00,40.774227,-73.98112,MANHATTAN,1.0,0.0,0,0,0,0,1,0,4650944,2023-08-02 14:00:00,2023-08-02T14:00,2023,8,27.4,0.0,Cloudy
07/19/2023,9:00,40.75603,-73.979034,MANHATTAN,1.0,0.0,0,0,0,0,1,0,4646912,2023-07-19 09:00:00,2023-07-19T09:00,2023,7,24.4,0.0,Cloudy
05/23/2023,10:00,40.87022,-73.9147,MANHATTAN,1.0,0.0,0,0,0,0,1,0,4635050,2023-05-23 10:00:00,2023-05-23T10:00,2023,5,17.9,0.0,Cloudy
06/20/2023,18:00,40.751625,-73.99419,MANHATTAN,0.0,0.0,0,0,0,0,0,0,4639566,2023-06-20 18:00:00,2023-06-20T18:00,2023,6,20.8,0.0,Cloudy
08/30/2023,10:00,40.731163,-73.99193,MANHATTAN,1.0,0.0,0,0,0,0,1,0,4659916,2023-08-30 10:00:00,2023-08-30T10:00,2023,8,24.1,0.0,Clear
01/21/2023,19:00,40.810276,-73.94738,MANHATTAN,0.0,0.0,0,0,0,0,0,0,4602012,2023-01-21 19:00:00,2023-01-21T19:00,2023,1,-0.4,0.0,Cloudy
12/29/2023,23:00,40.75791,-73.97766,MANHATTAN,1.0,0.0,0,0,1,0,0,0,4693640,2023-12-29 23:00:00,2023-12-29T23:00,2023,12,7.4,0.0,Cloudy
04/23/2023,1:00,40.72663,-73.985985,MANHATTAN,0.0,0.0,0,0,0,0,0,0,4622710,2023-04-23 01:00:00,2023-04-23T01:00,2023,4,13.3,1.6,Light Rain
10/10/2023,13:00,40.75889,-73.98968,MANHATTAN,1.0,0.0,1,0,0,0,0,0,4672482,2023-10-10 13:00:00,2023-10-10T13:00,2023,10,17.8,0.0,Clear
11/28/2023,0:00,40.755787,-73.9742,MANHATTAN,1.0,0.0,0,0,1,0,0,0,4684731,2023-11-28 00:00:00,2023-11-28T00:00,2023,11,1.0,0.0,Clear
03/17/2023,14:00,40.718227,-74.00347,MANHATTAN,0.0,0.0,0,0,0,0,0,0,4616222,2023-03-17 14:00:00,2023-03-17T14:00,2023,3,11.9,0.0,Cloudy
07/09/2023,12:00,40.77599,-73.95532,MANHATTAN,0.0,0.0,0,0,0,0,0,0,4646474,2023-07-09 12:00:00,2023-07-09T12:00,2023,7,25.1,1.4,Light Rain
01/04/2023,17:00,40.74608,-73.974945,MANHATTAN,1.0,0.0,0,0,0,0,1,0,4598283,2023-01-04 17:00:00,2023-01-04T17:00,2023,1,12.3,0.3,Drizzle
10/24/2023,11:00,40.76385,-73.96042,MANHATTAN,0.0,0.0,0,0,0,0,0,0,4673352,2023-10-24 11:00:00,2023-10-24T11:00,2023,10,15.1,0.0,Clear
10/14/2023,8:00,40.766544,-73.95102,MANHATTAN,2.0,0.0,0,0,0,0,2,0,4670686,2023-10-14 08:00:00,2023-10-14T08:00,2023,10,11.4,0.0,Cloudy
12/18/2023,15:00,40.781387,-73.95213,MANHATTAN,1.0,0.0,1,0,0,0,0,0,4693430,2023-12-18 15:00:00,2023-12-18T15:00,2023,12,8.3,0.2,Drizzle
02/21/2023,6:00,40.755207,-73.99666,MANHATTAN,0.0,0.0,0,0,0,0,0,0,4608295,2023-02-21 06:00:00,2023-02-21T06:00,2023,2,2.3,0.4,Drizzle
09/03/2023,14:00,40.82031,-73.95864,MANHATTAN,0.0,0.0,0,0,0,0,0,0,4659937,2023-09-03 14:00:00,2023-09-03T14:00,2023,9,30.9,0.1,Drizzle
01/15/2023,0:00,40.798504,-73.96713,MANHATTAN,1.0,0.0,0,0,0,0,0,0,4597984,2023-01-15 00:00:00,2023-01-15T00:00,2023,1,-1.7,0.0,Cloudy
08/23/2023,14:00,40.820965,-73.939575,MANHATTAN,2.0,0.0,0,0,1,0,1,0,4659669,2023-08-23 14:00:00,2023-08-23T14:00,2023,8,25.3,0.0,Cloudy
01/19/2023,23:00,40.75441,-73.96551,MANHATTAN,1.0,0.0,1,0,0,0,0,0,4599269,2023-01-19 23:00:00,2023-01-19T23:00,2023,1,4.8,1.4,Light Rain
02/06/2023,13:00,40.751793,-73.97688,MANHATTAN,2.0,0.0,1,0,0,0,1,0,4604892,2023-02-06 13:00:00,2023-02-06T13:00,2023,2,9.3,0.0,Clear
01/29/2023,11:00,40.74817,-73.9898,MANHATTAN,1.0,0.0,0,0,0,0,0,0,4602157,2023-01-29 11:00:00,2023-01-29T11:00,2023,1,8.5,0.0,Cloudy
08/12/2023,19:00,40.714054,-73.9828,MANHATTAN,1.0,0.0,0,0,0,0,0,0,4653509,2023-08-12 19:00:00,2023-08-12T19:00,2023,8,23.5,0.0,Cloudy
10/20/2023,0:00,40.81909,-73.94093,MANHATTAN,3.0,0.0,0,0,0,0,3,0,4672124,2023-10-20 00:00:00,2023-10-20T00:00,2023,10,13.7,0.0,Cloudy
02/02/2023,8:00,40.76228,-73.99356,MANHATTAN,1.0,0.0,1,0,0,0,0,0,4607923,2023-02-02 08:00:00,2023-02-02T08:00,2023,2,-1.9,0.0,Cloudy
05/26/2023,19:00,40.766087,-73.97724,MANHATTAN,1.0,0.0,0,0,1,0,0,0,4632399,2023-05-26 19:00:00,2023-05-26T19:00,2023,5,17.4,0.0,Clear
04/29/2023,7:00,40.751656,-73.99014,MANHATTAN,1.0,0.0,1,0,0,0,0,0,4625609,2023-04-29 07:00:00,2023-04-29T07:00,2023,4,9.9,1.9,Light Rain
07/07/2023,10:00,40.82803,-73.934845,MANHATTAN,2.0,0.0,0,0,0,0,2,0,4643977,2023-07-07 10:00:00,2023-07-07T10:00,2023,7,28.4,0.0,Clear
11/08/2023,1:00,40.713745,-73.99395,MANHATTAN,1.0,0.0,0,0,0,0,1,0,4677291,2023-11-08 01:00:00,2023-11-08T01:00,2023,11,9.1,0.0,Clear
10/20/2023,8:00,40.766712,-73.98289,MANHATTAN,1.0,0.0,1,0,0,0,0,0,4675248,2023-10-20 08:00:00,2023-10-20T08:00,2023,10,15.4,9.8,Heavy Rain
06/24/2023,7:00,40.749706,-73.99157,MANHATTAN,2.0,0.0,0,0,0,0,2,0,4640431,2023-06-24 07:00:00,2023-06-24T07:00,2023,6,19.3,1.5,Light Rain
09/27/2023,2:00,40.74412,-73.982124,MANHATTAN,1.0,0.0,0,0,0,0,1,0,4666083,2023-09-27 02:00:00,2023-09-27T02:00,2023,9,10.1,0.0,Clear
01/16/2023,6:00,40.762177,-73.96613,MANHATTAN,3.0,0.0,0,0,0,0,3,0,4599712,2023-01-16 06:00:00,2023-01-16T06:00,2023,1,-2.6,0.0,Clear
07/25/2023,1:00,40.868248,-73.916145,MANHATTAN,3.0,0.0,0,0,0,0,3,0,4649204,2023-07-25 01:00:00,2023-07-25T01:00,2023,7,21.9,0.0,Clear
01/13/2023,2:00,40.800087,-73.9511,MANHATTAN,0.0,0.0,0,0,0,0,0,0,4597462,2023-01-13 02:00:00,2023-01-13T02:00,2023,1,11.9,0.2,Drizzle
01/26/2023,13:00,40.768154,-73.992966,MANHATTAN,1.0,0.0,0,0,0,0,1,0,4600830,2023-01-26 13:00:00,2023-01-26T13:00,2023,1,7.9,0.0,Cloudy
10/23/2023,7:00,40.781033,-73.95132,MANHATTAN,0.0,0.0,0,0,0,0,0,0,4673013,2023-10-23 07:00:00,2023-10-23T07:00,2023,10,7.6,0.0,Clear
04/14/2023,23:00,40.822166,-73.94242,MANHATTAN,1.0,0.0,1,0,0,0,0,0,4621568,2023-04-14 23:00:00,2023-04-14T23:00,2023,4,19.1,0.0,Cloudy
03/15/2023,9:00,40.71983,-73.98755,MANHATTAN,1.0,0.0,0,0,1,0,0,0,4613009,2023-03-15 09:00:00,2023-03-15T09:00,2023,3,2.3,0.0,Cloudy
12/28/2023,22:00,40.866062,-73.92251,MANHATTAN,1.0,0.0,0,0,0,0,1,0,4692197,2023-12-28 22:00:00,2023-12-28T22:00,2023,12,8.8,1.1,Drizzle
10/05/2023,11:00,40.725082,-73.99534,MANHATTAN,1.0,0.0,0,0,0,0,1,0,4668897,2023-10-05 11:00:00,2023-10-05T11:00,2023,10,22.5,0.0,Clear
01/19/2023,16:00,40.8076,-73.93719,MANHATTAN,1.0,0.0,0,0,0,0,1,0,4599929,2023-01-19 16:00:00,2023-01-19T16:00,2023,1,5.4,1.2,Drizzle
01/10/2023,7:00,40.7067,-74.01605,MANHATTAN,0.0,0.0,0,0,0,0,0,0,4596961,2023-01-10 07:00:00,2023-01-10T07:00,2023,1,0.4,0.0,Cloudy
07/30/2023,21:00,40.74347,-74.00724,MANHATTAN,1.0,0.0,0,0,1,0,0,0,4650399,2023-07-30 21:00:00,2023-07-30T21:00,2023,7,20.0,0.0,Clear
01/02/2023,22:00,40.71997,-73.992905,MANHATTAN,1.0,0.0,0,0,0,0,0,0,4595060,2023-01-02 22:00:00,2023-01-02T22:00,2023,1,8.6,0.3,Drizzle
11/11/2023,9:00,40.777504,-73.954956,MANHATTAN,0.0,0.0,0,0,0,0,0,0,4679412,2023-11-11 09:00:00,2023-11-11T09:00,2023,11,8.6,0.0,Clear
05/07/2023,22:00,40.717922,-73.988525,MANHATTAN,1.0,0.0,1,0,0,0,0,0,4627912,2023-05-07 22:00:00,2023-05-07T22:00,2023,5,16.2,0.0,Cloudy
06/02/2023,10:00,40.73539,-73.99828,MANHATTAN,0.0,0.0,0,0,0,0,0,0,4634595,2023-06-02 10:00:00,2023-06-02T10:00,2023,6,28.7,0.0,Clear
05/18/2023,16:00,40.82059,-73.936134,MANHATTAN,0.0,0.0,0,0,0,0,0,0,4631289,2023-05-18 16:00:00,2023-05-18T16:00,2023,5,14.2,0.0,Clear
09/15/2023,0:00,40.778164,-73.98862,MANHATTAN,1.0,0.0,0,0,1,0,0,0,4662542,2023-09-15 00:00:00,2023-09-15T00:00,2023,9,15.7,0.0,Clear
07/28/2023,13:00,40.80118,-73.93975,MANHATTAN,1.0,0.0,0,0,0,0,1,0,4650344,2023-07-28 13:00:00,2023-07-28T13:00,2023,7,32.9,0.0,Clear
05/03/2023,0:00,40.7603,-73.99499,MANHATTAN,1.0,0.0,0,0,1,0,0,0,4625730,2023-05-03 00:00:00,2023-05-03T00:00,2023,5,7.8,0.0,Cloudy
05/09/2023,0:00,40.80607,-73.9404,MANHATTAN,0.0,0.0,0,0,0,0,0,0,4627760,2023-05-09 00:00:00,2023-05-09T00:00,2023,5,12.6,0.0,Cloudy
09/14/2023,1:00,40.809875,-73.93674,MANHATTAN,1.0,0.0,1,0,0,0,0,0,4662182,2023-09-14 01:00:00,2023-09-14T01:00,2023,9,18.9,0.0,Clear
11/22/2023,13:00,40.718452,-73.99008,MANHATTAN,2.0,0.0,0,0,0,0,2,0,4681424,2023-11-22 13:00:00,2023-11-22T13:00,2023,11,14.1,0.0,Cloudy
01/19/2023,0:00,40.717724,-73.98577,MANHATTAN,1.0,0.0,0,0,0,0,1,0,4599123,2023-01-19 00:00:00,2023-01-19T00:00,2023,1,2.7,0.0,Cloudy
03/08/2023,19:00,40.74649,-74.001335,MANHATTAN,1.0,0.0,0,0,0,0,0,0,4612125,2023-03-08 19:00:00,2023-03-08T19:00,2023,3,4.2,0.0,Clear
07/26/2023,0:00,40.718655,-73.98233,MANHATTAN,1.0,0.0,1,0,0,0,0,0,4649027,2023-07-26 00:00:00,2023-07-26T00:00,2023,7,19.0,0.0,Clear
06/28/2023,0:00,40.72937,-73.98401,MANHATTAN,1.0,0.0,0,0,1,0,0,0,4642016,2023-06-28 00:00:00,2023-06-28T00:00,2023,6,19.8,0.0,Cloudy
04/17/2023,0:00,40.76172,-73.98281,MANHATTAN,1.0,0.0,0,0,0,0,1,0,4621225,2023-04-17 00:00:00,2023-04-17T00:00,2023,4,11.8,0.0,Cloudy
12/23/2023,20:00,40.71997,-73.992905,MANHATTAN,1.0,0.0,1,0,0,0,0,0,4690522,2023-12-23 20:00:00,2023-12-23T20:00,2023,12,1.9,0.0,Cloudy
02/11/2023,0:00,40.821636,-73.93909,MANHATTAN,1.0,0.0,1,0,0,0,0,0,4605049,2023-02-11 00:00:00,2023-02-11T00:00,2023,2,5.2,0.0,Clear
10/22/2023,23:00,40.76788,-73.9815,MANHATTAN,1.0,0.0,0,0,0,0,1,0,4673212,2023-10-22 23:00:00,2023-10-22T23:00,2023,10,8.5,0.0,Clear
06/09/2023,0:00,40.72828,-73.98789,MANHATTAN,1.0,0.0,1,0,0,0,0,0,4637060,2023-06-09 00:00:00,2023-06-09T00:00,2023,6,13.4,0.0,Clear
07/25/2023,1:00,40.71997,-73.992905,MANHATTAN,2.0,0.0,0,0,0,0,0,0,4648417,2023-07-25 01:00:00,2023-07-25T01:00,2023,7,21.1,0.0,Clear
05/14/2023,4:00,40.807545,-73.95681,MANHATTAN,1.0,0.0,0,0,1,0,0,0,4629120,2023-05-14 04:00:00,2023-05-14T04:00,2023,5,13.1,0.0,Cloudy
11/12/2023,23:00,40.71431,-73.987175,MANHATTAN,1.0,0.0,1,0,0,0,0,0,4681422,2023-11-12 23:00:00,2023-11-12T23:00,2023,11,0.2,0.0,Clear
02/22/2023,0:00,40.75866,-73.98715,MANHATTAN,0.0,0.0,0,0,0,0,0,0,4607816,2023-02-22 00:00:00,2023-02-22T00:00,2023,2,1.9,0.0,Clear
09/19/2023,11:00,40.749294,-73.98457,MANHATTAN,1.0,0.0,0,0,0,0,1,0,4666071,2023-09-19 11:00:00,2023-09-19T11:00,2023,9,21.3,0.0,Clear
10/08/2023,21:00,40.729767,-73.98974,MANHATTAN,1.0,0.0,0,0,0,0,1,0,4668904,2023-10-08 21:00:00,2023-10-08T21:00,2023,10,11.6,0.0,Cloudy
07/01/2023,1:00,40.81686,-73.93951,MANHATTAN,0.0,0.0,0,0,0,0,0,0,4644209,2023-07-01 01:00:00,2023-07-01T01:00,2023,7,18.7,0.0,Clear
05/09/2023,20:00,40.752895,-73.98925,MANHATTAN,1.0,0.0,0,0,1,0,0,0,4627392,2023-05-09 20:00:00,2023-05-09T20:00,2023,5,11.0,0.0,Clear
04/08/2023,0:00,40.80776,-73.951485,MANHATTAN,3.0,0.0,0,0,0,0,3,0,4619605,2023-04-08 00:00:00,2023-04-08T00:00,2023,4,4.6,0.0,Cloudy
03/08/2023,7:00,40.732594,-73.97442,MANHATTAN,1.0,0.0,1,0,0,0,0,0,4611010,2023-03-08 07:00:00,2023-03-08T07:00,2023,3,-0.8,0.0,Clear
01/17/2023,10:00,40.782753,-73.94818,MANHATTAN,1.0,0.0,0,0,0,0,1,0,4598479,2023-01-17 10:00:00,2023-01-17T10:00,2023,1,2.9,0.0,Cloudy
07/31/2023,0:00,40.840195,-73.94307,MANHATTAN,1.0,0.0,0,0,1,0,0,0,4650453,2023-07-31 00:00:00,2023-07-31T00:00,2023,7,16.7,0.0,Clear
08/17/2023,19:00,40.727818,-73.99476,MANHATTAN,1.0,0.0,1,0,0,0,0,0,4656641,2023-08-17 19:00:00,2023-08-17T19:00,2023,8,22.6,0.0,Clear
05/16/2023,17:00,40.713646,-74.00361,MANHATTAN,1.0,0.0,0,0,1,0,0,0,4629386,2023-05-16 17:00:00,2023-05-16T17:00,2023,5,26.1,0.0,Cloudy
12/01/2023,20:00,40.753994,-73.9742,MANHATTAN,1.0,0.0,1,0,0,0,0,0,4685960,2023-12-01 20:00:00,2023-12-01T20:00,2023,12,6.7,1.9,Light Rain
08/21/2023,11:00,40.787045,-73.97759,MANHATTAN,0.0,0.0,0,0,0,0,0,0,4656325,2023-08-21 11:00:00,2023-08-21T11:00,2023,8,29.3,0.0,Cloudy
10/15/2023,1:00,40.785713,-73.950554,MANHATTAN,1.0,0.0,1,0,0,0,0,0,4670879,2023-10-15 01:00:00,2023-10-15T01:00,2023,10,10.0,0.4,Drizzle
12/25/2023,19:00,40.719,-73.97577,MANHATTAN,2.0,0.0,0,0,0,0,2,0,4690366,2023-12-25 19:00:00,2023-12-25T19:00,2023,12,5.7,0.0,Cloudy
05/12/2023,10:00,40.753975,-73.98604,MANHATTAN,1.0,0.0,0,0,1,0,0,0,4629330,2023-05-12 10:00:00,2023-05-12T10:00,2023,5,25.5,0.0,Cloudy
01/12/2023,8:00,40.71278,-74.01169,MANHATTAN,0.0,0.0,0,0,0,0,0,0,4597738,2023-01-12 08:00:00,2023-01-12T08:00,2023,1,3.8,0.4,Drizzle
04/11/2023,22:00,40.864113,-73.92126,MANHATTAN,1.0,0.0,0,0,0,0,0,0,4620297,2023-04-11 22:00:00,2023-04-11T22:00,2023,4,16.9,0.0,Cloudy
05/10/2023,5:00,40.762966,-73.973976,MANHATTAN,1.0,0.0,0,0,0,0,1,0,4627957,2023-05-10 05:00:00,2023-05-10T05:00,2023,5,7.8,0.0,Clear
11/08/2023,0:00,40.719933,-73.97876,MANHATTAN,2.0,0.0,0,0,0,0,2,0,4677961,2023-11-08 00:00:00,2023-11-08T00:00,2023,11,10.0,0.0,Clear
01/05/2023,0:00,40.823257,-73.94293,MANHATTAN,1.0,0.0,1,0,0,0,0,0,4595642,2023-01-05 00:00:00,2023-01-05T00:00,2023,1,10.6,0.0,Cloudy
05/07/2023,17:00,40.78519,-73.94934,MANHATTAN,1.0,0.0,0,0,1,0,0,0,4626740,2023-05-07 17:00:00,2023-05-07T17:00,2023,5,18.3,0.0,Cloudy
07/31/2023,17:00,40.769947,-73.96469,MANHATTAN,0.0,0.0,0,0,0,0,0,0,4650316,2023-07-31 17:00:00,2023-07-31T17:00,2023,7,24.9,0.0,Cloudy
11/22/2023,0:00,40.81636,-73.954094,MANHATTAN,1.0,0.0,0,0,0,0,1,0,4681128,2023-11-22 00:00:00,2023-11-22T00:00,2023,11,9.1,3.5,Heavy Rain
10/27/2023,8:00,40.74616,-73.97913,MANHATTAN,1.0,0.0,0,0,0,0,1,0,4674381,2023-10-27 08:00:00,2023-10-27T08:00,2023,10,15.9,0.0,Cloudy
12/08/2023,7:00,40.72032,-73.99405,MANHATTAN,1.0,0.0,1,0,0,0,0,0,4686168,2023-12-08 07:00:00,2023-12-08T07:00,2023,12,-1.4,0.0,Cloudy
02/10/2023,14:00,40.807735,-73.93707,MANHATTAN,1.0,0.0,0,0,1,0,0,0,4604946,2023-02-10 14:00:00,2023-02-10T14:00,2023,2,13.6,0.0,Clear
07/30/2023,1:00,40.75866,-73.98875,MANHATTAN,0.0,0.0,0,0,0,0,0,0,4649839,2023-07-30 01:00:00,2023-07-30T01:00,2023,7,21.0,0.0,Cloudy
04/03/2023,22:00,40.756645,-73.998116,MANHATTAN,1.0,0.0,1,0,0,0,0,0,4618381,2023-04-03 22:00:00,2023-04-03T22:00,2023,4,9.8,0.0,Clear
04/04/2023,14:00,40.75991,-73.95882,MANHATTAN,1.0,0.0,0,0,1,0,0,0,4620168,2023-04-04 14:00:00,2023-04-04T14:00,2023,4,17.9,0.0,Cloudy
08/15/2023,0:00,40.74518,-73.982735,MANHATTAN,1.0,0.0,0,0,1,0,0,0,4655299,2023-08-15 00:00:00,2023-08-15T00:00,2023,8,23.4,0.1,Drizzle
09/15/2023,8:00,40.73602,-73.98228,MANHATTAN,1.0,0.0,0,0,1,0,0,0,4665346,2023-09-15 08:00:00,2023-09-15T08:00,2023,9,15.6,0.0,Clear
10/22/2023,12:00,40.848118,-73.93089,MANHATTAN,2.0,0.0,0,0,0,0,2,0,4673027,2023-10-22 12:00:00,2023-10-22T12:00,2023,10,12.8,0.0,Cloudy
05/08/2023,0:00,40.805386,-73.965645,MANHATTAN,0.0,0.0,0,0,0,0,0,0,4627010,2023-05-08 00:00:00,2023-05-08T00:00,2023,5,14.7,0.0,Cloudy
11/21/2023,20:00,40.796005,-73.93542,MANHATTAN,1.0,0.0,0,0,0,0,0,0,4682775,2023-11-21 20:00:00,2023-11-21T20:00,2023,11,7.0,1.2,Drizzle
06/23/2023,5:00,40.820766,-73.939064,MANHATTAN,0.0,0.0,0,0,0,0,0,0,4640599,2023-06-23 05:00:00,2023-06-23T05:00,2023,6,16.6,0.0,Cloudy
03/06/2023,22:00,40.83022,-73.94769,MANHATTAN,0.0,0.0,0,0,0,0,0,0,4611211,2023-03-06 22:00:00,2023-03-06T22:00,2023,3,5.6,0.0,Cloudy
06/08/2023,20:00,40.764988,-73.96116,MANHATTAN,1.0,0.0,0,0,1,0,0,0,4636147,2023-06-08 20:00:00,2023-06-08T20:00,2023,6,17.0,0.0,Clear
11/05/2023,8:00,40.821636,-73.93909,MANHATTAN,1.0,0.0,1,0,0,0,0,0,4677564,2023-11-05 08:00:00,2023-11-05T08:00,2023,11,8.8,0.0,Cloudy
08/01/2023,17:00,40.726524,-73.99585,MANHATTAN,1.0,0.0,0,0,1,0,0,0,4650982,2023-08-01 17:00:00,2023-08-01T17:00,2023,8,26.4,0.0,Clear
12/12/2023,16:00,40.718708,-74.000946,MANHATTAN,1.0,0.0,0,0,1,0,0,0,4686836,2023-12-12 16:00:00,2023-12-12T16:00,2023,12,5.1,0.0,Clear
11/06/2023,17:00,40.774197,-73.95304,MANHATTAN,1.0,0.0,0,0,0,0,1,0,4677692,2023-11-06 17:00:00,2023-11-06T17:00,2023,11,8.4,0.0,Clear
08/13/2023,10:00,40.706993,-74.012344,MANHATTAN,1.0,0.0,1,0,0,0,0,0,4657334,2023-08-13 10:00:00,2023-08-13T10:00,2023,8,27.0,0.0,Clear
01/02/2023,19:00,40.733303,-73.985115,MANHATTAN,0.0,0.0,0,0,0,0,0,0,4595243,2023-01-02 19:00:00,2023-01-02T19:00,2023,1,7.6,0.0,Clear
01/01/2023,9:00,40.74581,-74.00554,MANHATTAN,0.0,0.0,0,0,0,0,0,0,4594442,2023-01-01 09:00:00,2023-01-01T09:00,2023,1,9.6,0.0,Clear
01/06/2023,8:00,40.760155,-73.9988,MANHATTAN,1.0,0.0,1,0,0,0,0,0,4596025,2023-01-06 08:00:00,2023-01-06T08:00,2023,1,5.9,0.2,Drizzle
09/05/2023,5:00,40.726116,-74.0016,MANHATTAN,0.0,0.0,0,0,0,0,0,0,4663645,2023-09-05 05:00:00,2023-09-05T05:00,2023,9,22.1,0.0,Cloudy
11/18/2023,8:00,40.76161,-73.99418,MANHATTAN,1.0,0.0,0,0,0,0,1,0,4680815,2023-11-18 08:00:00,2023-11-18T08:00,2023,11,11.7,0.2,Drizzle
09/04/2023,20:00,40.73543,-73.98271,MANHATTAN,1.0,0.0,1,0,0,0,0,0,4660434,2023-09-04 20:00:00,2023-09-04T20:00,2023,9,26.3,0.0,Cloudy
11/22/2023,6:00,40.73937,-73.99753,MANHATTAN,0.0,0.0,0,0,0,0,0,0,4682463,2023-11-22 06:00:00,2023-11-22T06:00,2023,11,12.9,0.0,Cloudy
12/17/2023,8:00,40.75831,-73.96294,MANHATTAN,1.0,0.0,0,0,1,0,0,0,4693902,2023-12-17 08:00:00,2023-12-17T08:00,2023,12,7.2,0.0,Cloudy
03/04/2023,21:00,40.759525,-73.99925,MANHATTAN,1.0,0.0,0,0,0,0,1,0,4610093,2023-03-04 21:00:00,2023-03-04T21:00,2023,3,3.6,0.0,Cloudy
04/15/2023,15:00,40.754684,-73.984245,MANHATTAN,1.0,0.0,1,0,0,0,0,0,4620928,2023-04-15 15:00:00,2023-04-15T15:00,2023,4,18.0,0.0,Cloudy
08/11/2023,12:00,40.840664,-73.936356,MANHATTAN,1.0,0.0,0,0,0,0,1,0,4653908,2023-08-11 12:00:00,2023-08-11T12:00,2023,8,26.9,0.1,Drizzle
08/02/2023,0:00,40.802486,-73.95679,MANHATTAN,2.0,0.0,1,0,0,0,1,0,4651408,2023-08-02 00:00:00,2023-08-02T00:00,2023,8,16.9,0.0,Clear
09/04/2023,8:00,40.757233,-73.97605,MANHATTAN,1.0,0.0,0,0,0,0,1,0,4659760,2023-09-04 08:00:00,2023-09-04T08:00,2023,9,26.1,0.0,Cloudy
09/02/2023,20:00,40.811836,-73.95109,MANHATTAN,1.0,0.0,1,0,0,0,0,0,4661456,2023-09-02 20:00:00,2023-09-02T20:00,2023,9,19.3,0.0,Cloudy
10/03/2023,14:00,40.789684,-73.94815,MANHATTAN,5.0,0.0,0,0,0,0,5,0,4669817,2023-10-03 14:00:00,2023-10-03T14:00,2023,10,26.7,0.0,Clear
05/18/2023,14:00,40.714497,-74.01561,MANHATTAN,1.0,0.0,0,0,1,0,0,0,4633161,2023-05-18 14:00:00,2023-05-18T14:00,2023,5,14.0,0.0,Clear
07/06/2023,2:00,40.721024,-73.981094,MANHATTAN,1.0,0.0,0,0,1,0,0,0,4643801,2023-07-06 02:00:00,2023-07-06T02:00,2023,7,22.5,0.0,Clear
08/17/2023,13:00,40.797886,-73.973465,MANHATTAN,1.0,0.0,0,0,1,0,0,0,4657455,2023-08-17 13:00:00,2023-08-17T13:00,2023,8,25.5,0.1,Drizzle
07/07/2023,14:00,40.76285,-73.967735,MANHATTAN,1.0,0.0,0,0,1,0,0,0,4644674,2023-07-07 14:00:00,2023-07-07T14:00,2023,7,27.9,0.0,Clear
06/14/2023,19:00,40.751114,-73.98692,MANHATTAN,1.0,0.0,1,0,0,0,0,0,4639556,2023-06-14 19:00:00,2023-06-14T19:00,2023,6,18.6,0.0,Clear
03/14/2023,15:00,40.73339,-73.98711,MANHATTAN,1.0,0.0,0,0,0,0,0,0,4613318,2023-03-14 15:00:00,2023-03-14T15:00,2023,3,2.9,0.2,Light Snow
01/26/2023,13:00,40.716812,-73.99777,MANHATTAN,1.0,0.0,1,0,0,0,0,0,4600897,2023-01-26 13:00:00,2023-01-26T13:00,2023,1,7.9,0.0,Cloudy
11/16/2023,13:00,40.78123,-73.94786,MANHATTAN,1.0,0.0,1,0,0,0,0,0,4679686,2023-11-16 13:00:00,2023-11-16T13:00,2023,11,16.7,0.0,Clear
02/08/2023,22:00,40.75831,-73.96294,MANHATTAN,1.0,0.0,1,0,0,0,0,0,4607132,2023-02-08 22:00:00,2023-02-08T22:00,2023,2,1.1,0.0,Cloudy
06/28/2023,0:00,40.75117,-73.98513,MANHATTAN,1.0,0.0,0,0,0,0,1,0,4645824,2023-06-28 00:00:00,2023-06-28T00:00,2023,6,19.5,0.0,Cloudy
02/12/2023,14:00,40.764286,-73.95562,MANHATTAN,2.0,0.0,0,0,0,0,2,0,4604904,2023-02-12 14:00:00,2023-02-12T14:00,2023,2,6.7,0.0,Cloudy
01/22/2023,19:00,40.723274,-73.99122,MANHATTAN,0.0,0.0,0,0,0,0,0,0,4599878,2023-01-22 19:00:00,2023-01-22T19:00,2023,1,1.8,0.6,Drizzle
09/26/2023,10:00,40.778183,-73.948425,MANHATTAN,1.0,0.0,1,0,0,0,0,0,4665598,2023-09-26 10:00:00,2023-09-26T10:00,2023,9,15.1,0.1,Drizzle
04/30/2023,10:00,40.86357,-73.92602,MANHATTAN,1.0,0.0,0,0,0,0,1,0,4631434,2023-04-30 10:00:00,2023-04-30T10:00,2023,4,12.6,0.6,Drizzle
09/30/2023,4:00,40.72323,-73.989624,MANHATTAN,1.0,0.0,0,0,0,0,1,0,4667187,2023-09-30 04:00:00,2023-09-30T04:00,2023,9,13.0,0.0,Clear
02/24/2023,8:00,40.776897,-73.975464,MANHATTAN,1.0,0.0,1,0,0,0,0,0,4608816,2023-02-24 08:00:00,2023-02-24T08:00,2023,2,6.2,0.0,Clear
09/15/2023,0:00,40.747295,-73.97405,MANHATTAN,1.0,0.0,1,0,0,0,0,0,4663074,2023-09-15 00:00:00,2023-09-15T00:00,2023,9,15.4,0.0,Clear
12/14/2023,13:00,40.71991,-73.809044,QUEENS,1.0,0.0,1,0,0,0,0,0,4687263,2023-12-14 13:00:00,2023-12-14T13:00,2023,12,3.7,0.0,Clear
12/03/2023,21:00,40.712883,-73.76597,QUEENS,1.0,0.0,0,0,0,0,1,0,4684297,2023-12-03 21:00:00,2023-12-03T21:00,2023,12,8.5,0.1,Drizzle
09/20/2023,17:00,40.682426,-73.74716,QUEENS,5.0,0.0,0,0,0,0,5,0,4663904,2023-09-20 17:00:00,2023-09-20T17:00,2023,9,21.4,0.0,Clear
06/06/2023,8:00,40.689842,-73.850075,QUEENS,1.0,0.0,0,0,1,0,0,0,4635608,2023-06-06 08:00:00,2023-06-06T08:00,2023,6,19.8,0.0,Cloudy
03/12/2023,4:00,40.770496,-73.87481,QUEENS,1.0,0.0,0,0,0,0,1,0,4612198,2023-03-12 04:00:00,2023-03-12T04:00,2023,3,-0.5,0.0,Clear
11/13/2023,17:00,40.719624,-73.91132,QUEENS,0.0,0.0,0,0,0,0,0,0,4680188,2023-11-13 17:00:00,2023-11-13T17:00,2023,11,7.1,0.0,Cloudy
01/16/2023,1:00,40.74872,-73.89625,QUEENS,1.0,0.0,0,0,0,0,1,0,4598160,2023-01-16 01:00:00,2023-01-16T01:00,2023,1,-2.7,0.0,Cloudy
06/12/2023,15:00,40.766357,-73.88756,QUEENS,1.0,0.0,1,0,0,0,0,0,4637404,2023-06-12 15:00:00,2023-06-12T15:00,2023,6,24.1,0.0,Cloudy
12/22/2023,9:00,40.6998,-73.74679,QUEENS,1.0,0.0,0,0,0,0,1,0,4689470,2023-12-22 09:00:00,2023-12-22T09:00,2023,12,-3.4,0.0,Cloudy
01/20/2023,17:00,40.760307,-73.87582,QUEENS,1.0,0.0,0,0,1,0,0,0,4599405,2023-01-20 17:00:00,2023-01-20T17:00,2023,1,6.6,0.0,Cloudy
11/17/2023,6:00,40.719215,-73.75475,QUEENS,0.0,0.0,0,0,0,0,0,0,4679766,2023-11-17 06:00:00,2023-11-17T06:00,2023,11,7.0,0.0,Clear
07/22/2023,8:00,40.755203,-73.871,QUEENS,1.0,0.0,0,0,0,0,1,0,4648124,2023-07-22 08:00:00,2023-07-22T08:00,2023,7,22.5,0.0,Clear
12/10/2023,5:00,40.69756,-73.85275,QUEENS,0.0,0.0,0,0,0,0,0,0,4691545,2023-12-10 05:00:00,2023-12-10T05:00,2023,12,9.9,0.0,Cloudy
02/03/2023,13:00,40.718887,-73.8416,QUEENS,1.0,0.0,1,0,0,0,0,0,4602863,2023-02-03 13:00:00,2023-02-03T13:00,2023,2,-4.8,0.0,Clear
07/26/2023,17:00,40.788555,-73.8291,QUEENS,1.0,0.0,0,0,0,0,1,0,4648923,2023-07-26 17:00:00,2023-07-26T17:00,2023,7,26.7,0.0,Clear
12/07/2023,15:00,40.777084,-73.90258,QUEENS,1.0,0.0,0,0,0,0,1,0,4685545,2023-12-07 15:00:00,2023-12-07T15:00,2023,12,3.3,0.0,Cloudy
04/25/2023,8:00,40.676586,-73.78686,QUEENS,5.0,0.0,0,0,0,0,5,0,4623453,2023-04-25 08:00:00,2023-04-25T08:00,2023,4,10.5,0.0,Clear
09/23/2023,23:00,40.7029,-73.90997,QUEENS,1.0,0.0,1,0,0,0,0,0,4664866,2023-09-23 23:00:00,2023-09-23T23:00,2023,9,16.7,0.0,Cloudy
04/22/2023,11:00,40.744347,-73.92891,QUEENS,1.0,0.0,0,0,0,0,1,0,4622541,2023-04-22 11:00:00,2023-04-22T11:00,2023,4,19.1,0.0,Cloudy
08/21/2023,0:00,40.76314,-73.793236,QUEENS,2.0,0.0,0,0,0,0,2,0,4655886,2023-08-21 00:00:00,2023-08-21T00:00,2023,8,20.6,0.0,Clear
08/07/2023,20:00,40.59656,-73.792206,QUEENS,0.0,0.0,0,0,0,0,0,0,4652582,2023-08-07 20:00:00,2023-08-07T20:00,2023,8,23.6,7.6,Heavy Rain
05/09/2023,20:00,40.742573,-73.8947,QUEENS,1.0,0.0,0,0,0,0,1,0,4627684,2023-05-09 20:00:00,2023-05-09T20:00,2023,5,11.1,0.0,Clear
03/03/2023,9:00,40.744602,-73.85562,QUEENS,1.0,0.0,1,0,0,0,0,0,4610125,2023-03-03 09:00:00,2023-03-03T09:00,2023,3,4.2,0.0,Cloudy
04/06/2023,17:00,40.703312,-73.83008,QUEENS,0.0,0.0,0,0,0,0,0,0,4619132,2023-04-06 17:00:00,2023-04-06T17:00,2023,4,16.3,0.0,Cloudy
01/26/2023,8:00,40.681656,-73.72783,QUEENS,1.0,0.0,0,0,0,0,1,0,4600695,2023-01-26 08:00:00,2023-01-26T08:00,2023,1,6.3,0.0,Clear
07/23/2023,0:00,40.765182,-73.81414,QUEENS,1.0,0.0,0,0,0,0,1,0,4648355,2023-07-23 00:00:00,2023-07-23T00:00,2023,7,19.4,0.0,Clear
07/20/2023,15:00,40.781574,-73.9136,QUEENS,2.0,0.0,0,0,0,0,2,0,4647604,2023-07-20 15:00:00,2023-07-20T15:00,2023,7,27.1,0.3,Drizzle
08/04/2023,18:00,40.68957,-73.77892,QUEENS,1.0,0.0,0,0,0,0,1,0,4653792,2023-08-04 18:00:00,2023-08-04T18:00,2023,8,23.1,0.0,Clear
05/21/2023,10:00,40.719673,-73.85748,QUEENS,1.0,0.0,0,0,1,0,0,0,4630955,2023-05-21 10:00:00,2023-05-21T10:00,2023,5,18.4,0.0,Cloudy
09/01/2023,18:00,40.75974,-73.93195,QUEENS,1.0,0.0,0,0,0,0,1,0,4658961,2023-09-01 18:00:00,2023-09-01T18:00,2023,9,20.4,0.0,Clear
09/18/2023,15:00,40.725403,-73.86287,QUEENS,0.0,0.0,0,0,0,0,0,0,4663322,2023-09-18 15:00:00,2023-09-18T15:00,2023,9,20.7,0.0,Cloudy
01/13/2023,20:00,40.712204,-73.88638,QUEENS,1.0,0.0,0,0,0,0,1,0,4600412,2023-01-13 20:00:00,2023-01-13T20:00,2023,1,3.7,0.0,Cloudy
07/23/2023,13:00,40.67013,-73.80938,QUEENS,1.0,0.0,1,0,0,0,0,0,4647917,2023-07-23 13:00:00,2023-07-23T13:00,2023,7,27.8,0.1,Drizzle
07/06/2023,17:00,40.679035,-73.83351,QUEENS,0.0,0.0,0,0,0,0,0,0,4643419,2023-07-06 17:00:00,2023-07-06T17:00,2023,7,25.7,0.0,Clear
09/05/2023,16:00,40.74356,-73.85574,QUEENS,1.0,0.0,1,0,0,0,0,0,4660955,2023-09-05 16:00:00,2023-09-05T16:00,2023,9,35.4,0.0,Cloudy
06/30/2023,3:00,40.749054,-73.95222,QUEENS,1.0,0.0,0,0,1,0,0,0,4642479,2023-06-30 03:00:00,2023-06-30T03:00,2023,6,18.9,0.0,Cloudy
10/14/2023,0:00,40.68599,-73.750656,QUEENS,1.0,0.0,0,0,0,0,1,0,4671486,2023-10-14 00:00:00,2023-10-14T00:00,2023,10,9.3,0.0,Clear
02/20/2023,16:00,40.760098,-73.8593,QUEENS,7.0,0.0,0,0,0,0,7,0,4608797,2023-02-20 16:00:00,2023-02-20T16:00,2023,2,14.4,0.0,Clear
06/06/2023,9:00,40.749615,-73.76853,QUEENS,1.0,0.0,0,0,0,0,1,0,4635337,2023-06-06 09:00:00,2023-06-06T09:00,2023,6,20.7,0.0,Clear
03/31/2023,8:00,40.71824,-73.764,QUEENS,0.0,0.0,0,0,0,0,0,0,4617708,2023-03-31 08:00:00,2023-03-31T08:00,2023,3,4.8,0.0,Cloudy
04/03/2023,13:00,40.729153,-73.84946,QUEENS,1.0,0.0,1,0,0,0,0,0,4617858,2023-04-03 13:00:00,2023-04-03T13:00,2023,4,11.7,0.0,Clear
02/01/2023,16:00,40.706753,-73.75384,QUEENS,1.0,0.0,1,0,0,0,0,0,4604252,2023-02-01 16:00:00,2023-02-01T16:00,2023,2,2.6,0.0,Clear
05/05/2023,18:00,40.71077,-73.852806,QUEENS,1.0,0.0,0,0,0,0,1,0,4627280,2023-05-05 18:00:00,2023-05-05T18:00,2023,5,12.3,0.0,Clear
03/27/2023,8:00,40.7044,-73.79686,QUEENS,1.0,0.0,1,0,0,0,0,0,4616239,2023-03-27 08:00:00,2023-03-27T08:00,2023,3,8.0,0.0,Clear
01/13/2023,12:00,40.74893,-73.951645,QUEENS,1.0,0.0,0,0,1,0,0,0,4597593,2023-01-13 12:00:00,2023-01-13T12:00,2023,1,12.3,0.0,Cloudy
10/22/2023,9:00,40.732647,-73.91895,QUEENS,0.0,0.0,0,0,0,0,0,0,4672526,2023-10-22 09:00:00,2023-10-22T09:00,2023,10,12.8,0.0,Cloudy
11/12/2023,16:00,40.698986,-73.804886,QUEENS,1.0,0.0,1,0,0,0,0,0,4678663,2023-11-12 16:00:00,2023-11-12T16:00,2023,11,5.8,0.0,Clear
05/12/2023,14:00,40.715782,-73.746414,QUEENS,1.0,0.0,0,0,0,0,1,0,4628378,2023-05-12 14:00:00,2023-05-12T14:00,2023,5,26.2,0.0,Cloudy
07/09/2023,6:00,40.715153,-73.87532,QUEENS,0.0,0.0,0,0,0,0,0,0,4643911,2023-07-09 06:00:00,2023-07-09T06:00,2023,7,22.2,0.0,Cloudy
01/09/2023,19:00,40.7856,-73.83936,QUEENS,1.0,0.0,0,0,0,0,0,0,4597131,2023-01-09 19:00:00,2023-01-09T19:00,2023,1,1.4,0.0,Clear
09/05/2023,20:00,40.764122,-73.812775,QUEENS,1.0,0.0,0,0,0,0,1,0,4661043,2023-09-05 20:00:00,2023-09-05T20:00,2023,9,27.9,0.0,Cloudy
10/07/2023,12:00,40.76085,-73.923004,QUEENS,1.0,0.0,0,0,0,0,0,0,4669860,2023-10-07 12:00:00,2023-10-07T12:00,2023,10,20.5,0.4,Drizzle
06/20/2023,20:00,40.595978,-73.75409,QUEENS,1.0,0.0,0,0,0,0,1,0,4639565,2023-06-20 20:00:00,2023-06-20T20:00,2023,6,17.5,0.0,Cloudy
01/01/2023,20:00,40.747864,-73.873985,QUEENS,2.0,0.0,0,0,0,0,2,0,4596592,2023-01-01 20:00:00,2023-01-01T20:00,2023,1,5.7,0.0,Clear
07/02/2023,14:00,40.744236,-73.92798,QUEENS,1.0,0.0,0,0,0,0,1,0,4644884,2023-07-02 14:00:00,2023-07-02T14:00,2023,7,27.2,0.0,Cloudy
12/10/2023,4:00,40.752487,-73.8269,QUEENS,3.0,0.0,0,0,0,0,3,0,4685707,2023-12-10 04:00:00,2023-12-10T04:00,2023,12,9.0,0.0,Cloudy
01/04/2023,14:00,40.580738,-73.83031,QUEENS,0.0,0.0,0,0,0,0,0,0,4595525,2023-01-04 14:00:00,2023-01-04T14:00,2023,1,12.8,0.0,Cloudy
01/18/2023,15:00,40.735596,-73.89901,QUEENS,2.0,0.0,0,0,0,0,2,0,4598725,2023-01-18 15:00:00,2023-01-18T15:00,2023,1,10.2,0.0,Clear
01/31/2023,7:00,40.717678,-73.81713,QUEENS,1.0,0.0,1,0,0,0,0,0,4602470,2023-01-31 07:00:00,2023-01-31T07:00,2023,1,2.0,0.2,Drizzle
11/09/2023,8:00,40.751957,-73.93475,QUEENS,0.0,0.0,0,0,0,0,0,0,4678052,2023-11-09 08:00:00,2023-11-09T08:00,2023,11,11.5,0.0,Cloudy
02/27/2023,10:00,40.71371,-73.919014,QUEENS,0.0,0.0,0,0,0,0,0,0,4608949,2023-02-27 10:00:00,2023-02-27T10:00,2023,2,3.0,0.0,Cloudy
03/13/2023,0:00,40.712116,-73.81219,QUEENS,1.0,0.0,0,0,0,0,1,0,4612578,2023-03-13 00:00:00,2023-03-13T00:00,2023,3,4.2,0.0,Cloudy
12/20/2023,18:00,40.66528,-73.73562,QUEENS,2.0,0.0,0,0,0,0,2,0,4688944,2023-12-20 18:00:00,2023-12-20T18:00,2023,12,1.8,0.0,Clear
02/27/2023,0:00,40.740276,-73.92782,QUEENS,2.0,0.0,0,0,0,0,2,0,4608768,2023-02-27 00:00:00,2023-02-27T00:00,2023,2,-0.5,0.0,Clear
10/19/2023,8:00,40.74386,-73.94175,QUEENS,2.0,0.0,0,0,0,0,2,0,4675277,2023-10-19 08:00:00,2023-10-19T08:00,2023,10,10.3,0.0,Cloudy
09/27/2023,0:00,40.690914,-73.72819,QUEENS,5.0,0.0,0,0,0,0,5,0,4665891,2023-09-27 00:00:00,2023-09-27T00:00,2023,9,12.3,0.0,Clear
01/04/2023,19:00,40.768257,-73.93203,QUEENS,1.0,0.0,1,0,0,0,0,0,4595493,2023-01-04 19:00:00,2023-01-04T19:00,2023,1,10.7,1.0,Drizzle
05/31/2023,12:00,40.69314,-73.74486,QUEENS,1.0,0.0,0,0,0,0,1,0,4633647,2023-05-31 12:00:00,2023-05-31T12:00,2023,5,19.6,0.0,Clear
12/30/2023,19:00,40.69756,-73.85275,QUEENS,1.0,0.0,0,0,0,0,1,0,4691517,2023-12-30 19:00:00,2023-12-30T19:00,2023,12,6.0,0.2,Drizzle
04/08/2023,14:00,40.59298,-73.789055,QUEENS,2.0,0.0,0,0,0,0,2,0,4619796,2023-04-08 14:00:00,2023-04-08T14:00,2023,4,8.5,0.0,Cloudy
04/25/2023,21:00,40.695858,-73.80054,QUEENS,0.0,0.0,0,0,0,0,0,0,4623468,2023-04-25 21:00:00,2023-04-25T21:00,2023,4,9.8,0.0,Clear
04/08/2023,21:00,40.702267,-73.78047,QUEENS,1.0,0.0,1,0,0,0,0,0,4622930,2023-04-08 21:00:00,2023-04-08T21:00,2023,4,5.7,0.0,Cloudy
06/25/2023,1:00,40.748352,-73.870346,QUEENS,1.0,0.0,0,0,0,0,0,0,4640538,2023-06-25 01:00:00,2023-06-25T01:00,2023,6,20.7,0.0,Clear
09/06/2023,10:00,40.693268,-73.81431,QUEENS,1.0,0.0,1,0,0,0,0,0,4661326,2023-09-06 10:00:00,2023-09-06T10:00,2023,9,30.7,0.0,Clear
04/02/2023,3:00,40.7632,-73.92109,QUEENS,1.0,0.0,0,0,0,0,0,0,4618355,2023-04-02 03:00:00,2023-04-02T03:00,2023,4,6.0,0.0,Clear
07/30/2023,21:00,40.679897,-73.74757,QUEENS,2.0,0.0,0,0,0,0,2,0,4650163,2023-07-30 21:00:00,2023-07-30T21:00,2023,7,20.0,0.0,Clear
04/24/2023,14:00,40.66549,-73.819534,QUEENS,1.0,0.0,0,0,0,0,1,0,4623203,2023-04-24 14:00:00,2023-04-24T14:00,2023,4,13.6,0.0,Clear
01/11/2023,19:00,40.726482,-73.79824,QUEENS,1.0,0.0,1,0,0,0,0,0,4597356,2023-01-11 19:00:00,2023-01-11T19:00,2023,1,0.6,0.0,Cloudy
02/26/2023,17:00,40.722897,-73.91386,QUEENS,0.0,0.0,0,0,0,0,0,0,4609256,2023-02-26 17:00:00,2023-02-26T17:00,2023,2,8.5,0.0,Clear
03/27/2023,19:00,40.70377,-73.80522,QUEENS,1.0,0.0,0,0,0,0,1,0,4616231,2023-03-27 19:00:00,2023-03-27T19:00,2023,3,6.7,1.0,Drizzle
11/30/2023,20:00,40.68272,-73.82912,QUEENS,1.0,0.0,1,0,0,0,0,0,4683883,2023-11-30 20:00:00,2023-11-30T20:00,2023,11,7.5,0.0,Cloudy
12/12/2023,8:00,40.68599,-73.777855,QUEENS,1.0,0.0,0,0,0,0,1,0,4687970,2023-12-12 08:00:00,2023-12-12T08:00,2023,12,0.4,0.0,Clear
10/06/2023,14:00,40.692886,-73.801605,QUEENS,1.0,0.0,0,0,0,0,1,0,4668308,2023-10-06 14:00:00,2023-10-06T14:00,2023,10,21.3,0.1,Drizzle
06/06/2023,9:00,40.7272,-73.74922,QUEENS,1.0,0.0,0,0,0,0,1,0,4635372,2023-06-06 09:00:00,2023-06-06T09:00,2023,6,20.5,0.0,Clear
05/05/2023,15:00,40.70476,-73.784424,QUEENS,1.0,0.0,0,0,1,0,0,0,4626236,2023-05-05 15:00:00,2023-05-05T15:00,2023,5,15.1,1.3,Light Rain
06/19/2023,18:00,40.738014,-73.807556,QUEENS,0.0,0.0,0,0,0,0,0,0,4639065,2023-06-19 18:00:00,2023-06-19T18:00,2023,6,20.8,0.0,Cloudy
11/17/2023,2:00,40.74917,-73.86923,QUEENS,3.0,0.0,0,0,0,0,3,0,4679706,2023-11-17 02:00:00,2023-11-17T02:00,2023,11,4.8,0.0,Clear
03/23/2023,22:00,40.666393,-73.75177,QUEENS,0.0,0.0,0,0,0,0,0,0,4615026,2023-03-23 22:00:00,2023-03-23T22:00,2023,3,14.0,0.0,Cloudy
11/21/2023,22:00,40.75396,-73.924164,QUEENS,1.0,0.0,1,0,0,0,0,0,4682796,2023-11-21 22:00:00,2023-11-21T22:00,2023,11,8.7,2.0,Light Rain
12/31/2023,11:00,40.768105,-73.804825,QUEENS,1.0,0.0,0,0,0,0,1,0,4691722,2023-12-31 11:00:00,2023-12-31T11:00,2023,12,5.4,0.0,Cloudy
07/14/2023,0:00,40.711483,-73.764175,QUEENS,1.0,0.0,0,0,0,0,1,0,4646184,2023-07-14 00:00:00,2023-07-14T00:00,2023,7,23.4,0.0,Cloudy
04/16/2023,18:00,40.737896,-73.92355,QUEENS,1.0,0.0,1,0,0,0,0,0,4621298,2023-04-16 18:00:00,2023-04-16T18:00,2023,4,13.8,0.0,Cloudy
04/03/2023,18:00,40.718735,-73.85101,QUEENS,1.0,0.0,0,0,0,0,1,0,4618088,2023-04-03 18:00:00,2023-04-03T18:00,2023,4,9.8,0.0,Cloudy
02/12/2023,11:00,40.74847,-73.870026,QUEENS,0.0,0.0,0,0,0,0,0,0,4604876,2023-02-12 11:00:00,2023-02-12T11:00,2023,2,5.0,0.0,Cloudy
08/28/2023,0:00,40.773293,-73.90668,QUEENS,1.0,0.0,0,0,0,0,1,0,4658369,2023-08-28 00:00:00,2023-08-28T00:00,2023,8,19.5,0.0,Cloudy
04/06/2023,8:00,40.683994,-73.83895,QUEENS,1.0,0.0,0,0,1,0,0,0,4618851,2023-04-06 08:00:00,2023-04-06T08:00,2023,4,13.7,0.0,Cloudy
02/15/2023,18:00,40.745205,-73.858765,QUEENS,0.0,0.0,0,0,0,0,0,0,4606003,2023-02-15 18:00:00,2023-02-15T18:00,2023,2,13.3,0.0,Cloudy
11/13/2023,8:00,40.774952,-73.912125,QUEENS,1.0,0.0,1,0,0,0,0,0,4679718,2023-11-13 08:00:00,2023-11-13T08:00,2023,11,1.1,0.0,Clear
05/20/2023,5:00,40.67172,-73.850975,QUEENS,1.0,0.0,0,0,0,0,1,0,4630753,2023-05-20 05:00:00,2023-05-20T05:00,2023,5,14.1,0.8,Drizzle
01/23/2023,17:00,40.740425,-73.89671,QUEENS,0.0,0.0,0,0,0,0,0,0,4600875,2023-01-23 17:00:00,2023-01-23T17:00,2023,1,2.6,0.1,Drizzle
12/13/2023,9:00,40.745594,-73.9034,QUEENS,1.0,0.0,1,0,0,0,0,0,4687079,2023-12-13 09:00:00,2023-12-13T09:00,2023,12,3.6,0.0,Clear
01/22/2023,15:00,40.726063,-73.8597,QUEENS,0.0,0.0,0,0,0,0,0,0,4599798,2023-01-22 15:00:00,2023-01-22T15:00,2023,1,5.3,0.0,Cloudy
06/17/2023,21:00,40.701103,-73.89078,QUEENS,1.0,0.0,1,0,0,0,0,0,4639940,2023-06-17 21:00:00,2023-06-17T21:00,2023,6,18.4,0.0,Cloudy
10/10/2023,21:00,0.0,0.0,QUEENS,1.0,0.0,0,0,0,0,1,0,4669431,2023-10-10 21:00:00,2023-10-10T21:00,2023,10,25.6,0.0,Cloudy
12/16/2023,18:00,40.737076,-73.87495,QUEENS,1.0,0.0,1,0,0,0,0,0,4688076,2023-12-16 18:00:00,2023-12-16T18:00,2023,12,4.9,0.0,Cloudy
09/15/2023,13:00,40.697163,-73.90685,QUEENS,1.0,0.0,0,0,0,0,1,0,4663053,2023-09-15 13:00:00,2023-09-15T13:00,2023,9,20.9,0.0,Cloudy
04/02/2023,20:00,40.686184,-73.829865,QUEENS,0.0,0.0,0,0,0,0,0,0,4617619,2023-04-02 20:00:00,2023-04-02T20:00,2023,4,5.3,0.0,Clear
02/20/2023,22:00,40.757774,-73.87239,QUEENS,1.0,0.0,0,0,0,0,1,0,4607842,2023-02-20 22:00:00,2023-02-20T22:00,2023,2,7.8,0.0,Cloudy
03/31/2023,0:00,40.704063,-73.75653,QUEENS,0.0,0.0,0,0,0,0,0,0,4617074,2023-03-31 00:00:00,2023-03-31T00:00,2023,3,1.5,0.0,Cloudy
10/29/2023,9:00,40.699017,-73.80696,QUEENS,1.0,0.0,0,0,0,0,1,0,4674862,2023-10-29 09:00:00,2023-10-29T09:00,2023,10,13.4,0.1,Drizzle
11/07/2023,7:00,40.758743,-73.89069,QUEENS,1.0,0.0,0,0,0,0,0,0,4677187,2023-11-07 07:00:00,2023-11-07T07:00,2023,11,12.0,2.0,Light Rain
10/18/2023,20:00,40.69377,-73.73578,QUEENS,1.0,0.0,1,0,0,0,0,0,4672258,2023-10-18 20:00:00,2023-10-18T20:00,2023,10,14.0,0.0,Clear
08/25/2023,13:00,40.72266,-73.86767,QUEENS,1.0,0.0,0,0,0,0,1,0,4657486,2023-08-25 13:00:00,2023-08-25T13:00,2023,8,27.0,0.0,Clear
12/17/2023,3:00,40.70237,-73.90696,QUEENS,1.0,0.0,1,0,0,0,0,0,4688540,2023-12-17 03:00:00,2023-12-17T03:00,2023,12,8.6,0.0,Cloudy
03/18/2023,0:00,40.69955,-73.747734,QUEENS,0.0,0.0,0,0,0,0,0,0,4614061,2023-03-18 00:00:00,2023-03-18T00:00,2023,3,10.1,0.2,Drizzle
11/19/2023,2:00,40.676334,-73.741104,QUEENS,3.0,0.0,0,0,0,0,3,0,4680039,2023-11-19 02:00:00,2023-11-19T02:00,2023,11,2.8,0.0,Clear
10/06/2023,14:00,40.670757,-73.84173,QUEENS,1.0,0.0,0,0,1,0,0,0,4668701,2023-10-06 14:00:00,2023-10-06T14:00,2023,10,21.4,0.1,Drizzle
07/19/2023,13:00,40.691647,-73.7571,QUEENS,1.0,0.0,0,0,0,0,1,0,4647171,2023-07-19 13:00:00,2023-07-19T13:00,2023,7,25.9,0.0,Clear
11/22/2023,0:00,40.7672,-73.887825,QUEENS,1.0,0.0,1,0,0,0,0,0,4682855,2023-11-22 00:00:00,2023-11-22T00:00,2023,11,9.6,3.2,Heavy Rain
08/11/2023,10:00,40.733498,-73.87038,QUEENS,1.0,0.0,0,0,0,0,1,0,4658033,2023-08-11 10:00:00,2023-08-11T10:00,2023,8,25.2,0.1,Drizzle
07/16/2023,12:00,40.697247,-73.84302,QUEENS,3.0,0.0,0,0,0,0,3,0,4645762,2023-07-16 12:00:00,2023-07-16T12:00,2023,7,24.2,0.2,Drizzle
01/25/2023,6:00,40.73197,-73.81079,QUEENS,0.0,0.0,0,0,0,0,0,0,4600560,2023-01-25 06:00:00,2023-01-25T06:00,2023,1,-2.0,0.0,Cloudy
05/07/2023,9:00,40.76906,-73.92848,QUEENS,1.0,0.0,0,0,1,0,0,0,4626711,2023-05-07 09:00:00,2023-05-07T09:00,2023,5,18.2,0.0,Clear
05/25/2023,14:00,40.751972,-73.93197,QUEENS,1.0,0.0,0,0,0,0,1,0,4632772,2023-05-25 14:00:00,2023-05-25T14:00,2023,5,18.6,0.0,Clear
02/12/2023,13:00,40.763348,-73.88395,QUEENS,1.0,0.0,1,0,0,0,0,0,4604936,2023-02-12 13:00:00,2023-02-12T13:00,2023,2,6.9,0.0,Cloudy
03/29/2023,8:00,40.66561,-73.73568,QUEENS,3.0,0.0,0,0,0,0,3,0,4616572,2023-03-29 08:00:00,2023-03-29T08:00,2023,3,5.2,0.0,Clear
08/11/2023,16:00,40.713814,-73.920845,QUEENS,3.0,0.0,0,0,0,0,3,0,4655023,2023-08-11 16:00:00,2023-08-11T16:00,2023,8,29.0,0.0,Clear
08/30/2023,14:00,40.74855,-73.89582,QUEENS,1.0,0.0,0,0,0,0,1,0,4658342,2023-08-30 14:00:00,2023-08-30T14:00,2023,8,29.2,0.0,Clear
10/18/2023,11:00,40.748913,-73.9374,QUEENS,1.0,0.0,0,0,0,0,1,0,4671584,2023-10-18 11:00:00,2023-10-18T11:00,2023,10,16.9,0.1,Drizzle
01/13/2023,7:00,40.683323,-73.80648,QUEENS,0.0,0.0,0,0,0,0,0,0,4597992,2023-01-13 07:00:00,2023-01-13T07:00,2023,1,10.3,0.1,Drizzle
04/28/2023,9:00,40.736565,-73.888565,QUEENS,1.0,0.0,0,0,0,0,0,0,4624753,2023-04-28 09:00:00,2023-04-28T09:00,2023,4,11.7,0.0,Cloudy
02/09/2023,21:00,40.65821,-73.768906,QUEENS,2.0,0.0,2,0,0,0,0,0,4606178,2023-02-09 21:00:00,2023-02-09T21:00,2023,2,10.9,0.0,Cloudy
03/25/2023,10:00,40.76059,-73.86423,QUEENS,0.0,0.0,0,0,0,0,0,0,4615835,2023-03-25 10:00:00,2023-03-25T10:00,2023,3,5.8,0.2,Drizzle
06/28/2023,23:00,40.671097,-73.82558,QUEENS,0.0,0.0,0,0,0,0,0,0,4641743,2023-06-28 23:00:00,2023-06-28T23:00,2023,6,19.9,0.0,Clear
12/21/2023,19:00,40.755978,-73.939095,QUEENS,0.0,0.0,0,0,0,0,0,0,4689409,2023-12-21 19:00:00,2023-12-21T19:00,2023,12,-2.1,0.0,Clear
09/30/2023,21:00,40.757225,-73.869514,QUEENS,1.0,0.0,0,0,0,0,1,0,4667219,2023-09-30 21:00:00,2023-09-30T21:00,2023,9,16.3,0.0,Clear
08/08/2023,13:00,40.78228,-73.914604,QUEENS,2.0,0.0,0,0,0,0,2,0,4653402,2023-08-08 13:00:00,2023-08-08T13:00,2023,8,26.9,0.0,Cloudy
06/19/2023,19:00,40.675312,-73.84331,QUEENS,1.0,0.0,0,0,1,0,0,0,4639103,2023-06-19 19:00:00,2023-06-19T19:00,2023,6,19.3,0.0,Cloudy
04/20/2023,0:00,40.69595,-73.75288,QUEENS,3.0,0.0,0,0,0,0,3,0,4622197,2023-04-20 00:00:00,2023-04-20T00:00,2023,4,7.0,0.0,Cloudy
12/20/2023,18:00,40.66662,-73.81047,QUEENS,1.0,0.0,0,0,0,0,1,0,4689226,2023-12-20 18:00:00,2023-12-20T18:00,2023,12,1.8,0.0,Clear
05/14/2023,15:00,40.701237,-73.79465,QUEENS,0.0,0.0,0,0,0,0,0,0,4628778,2023-05-14 15:00:00,2023-05-14T15:00,2023,5,19.6,0.0,Clear
03/25/2023,16:00,40.683144,-73.76859,QUEENS,2.0,0.0,0,0,0,0,2,0,4615978,2023-03-25 16:00:00,2023-03-25T16:00,2023,3,7.4,0.8,Drizzle
06/10/2023,10:00,40.75714,-73.8271,QUEENS,1.0,0.0,0,0,1,0,0,0,4636609,2023-06-10 10:00:00,2023-06-10T10:00,2023,6,21.0,0.0,Clear
08/13/2023,4:00,40.679558,-73.81769,QUEENS,0.0,0.0,0,0,0,0,0,0,4653531,2023-08-13 04:00:00,2023-08-13T04:00,2023,8,22.2,0.0,Clear
10/05/2023,22:00,40.702736,-73.80229,QUEENS,2.0,0.0,0,0,0,0,2,0,4668311,2023-10-05 22:00:00,2023-10-05T22:00,2023,10,17.2,0.0,Cloudy
07/30/2023,14:00,40.713463,-73.73635,QUEENS,1.0,0.0,1,0,0,0,0,0,4649744,2023-07-30 14:00:00,2023-07-30T14:00,2023,7,25.3,0.0,Cloudy
03/06/2023,7:00,40.737064,-73.70232,QUEENS,0.0,0.0,0,0,0,0,0,0,4610625,2023-03-06 07:00:00,2023-03-06T07:00,2023,3,1.7,0.0,Clear
03/05/2023,3:00,40.69366,-73.85217,QUEENS,1.0,0.0,1,0,0,0,0,0,4610727,2023-03-05 03:00:00,2023-03-05T03:00,2023,3,0.5,0.0,Clear
09/15/2023,10:00,40.755505,-73.92291,QUEENS,1.0,0.0,0,0,0,0,1,0,4662811,2023-09-15 10:00:00,2023-09-15T10:00,2023,9,17.9,0.0,Cloudy
05/13/2023,20:00,40.6749,-73.83633,QUEENS,2.0,0.0,0,0,0,0,2,0,4628729,2023-05-13 20:00:00,2023-05-13T20:00,2023,5,19.7,0.0,Cloudy
03/30/2023,0:00,40.74248,-73.9129,QUEENS,0.0,0.0,0,0,0,0,0,0,4617100,2023-03-30 00:00:00,2023-03-30T00:00,2023,3,5.4,0.0,Cloudy
07/20/2023,1:00,40.744057,-73.88348,QUEENS,0.0,0.0,0,0,0,0,0,0,4647301,2023-07-20 01:00:00,2023-07-20T01:00,2023,7,20.6,0.0,Clear
02/13/2023,5:00,40.72199,-73.90401,QUEENS,1.0,0.0,0,0,0,0,1,0,4605111,2023-02-13 05:00:00,2023-02-13T05:00,2023,2,3.7,0.0,Cloudy
03/30/2023,15:00,40.73091,-73.86084,QUEENS,1.0,0.0,0,0,0,0,1,0,4617012,2023-03-30 15:00:00,2023-03-30T15:00,2023,3,7.2,0.0,Clear
08/01/2023,10:00,40.596096,-73.76976,QUEENS,2.0,0.0,0,0,0,0,2,0,4650883,2023-08-01 10:00:00,2023-08-01T10:00,2023,8,24.5,0.0,Clear
06/22/2023,10:00,40.738853,-73.858444,QUEENS,2.0,0.0,0,0,0,0,2,0,4640154,2023-06-22 10:00:00,2023-06-22T10:00,2023,6,18.4,0.0,Cloudy
07/15/2023,3:00,40.65616,-73.76736,QUEENS,4.0,0.0,0,0,0,0,4,0,4645483,2023-07-15 03:00:00,2023-07-15T03:00,2023,7,21.4,0.0,Clear
12/09/2023,0:00,40.666332,-73.81056,QUEENS,3.0,0.0,0,0,0,0,3,0,4685914,2023-12-09 00:00:00,2023-12-09T00:00,2023,12,7.9,0.0,Clear
03/18/2023,12:00,40.67033,-73.79428,QUEENS,0.0,0.0,0,0,0,0,0,0,4619893,2023-03-18 12:00:00,2023-03-18T12:00,2023,3,9.5,0.0,Cloudy
02/01/2023,16:00,40.753895,-73.79827,QUEENS,1.0,0.0,0,0,0,0,1,0,4602395,2023-02-01 16:00:00,2023-02-01T16:00,2023,2,2.6,0.0,Clear
05/19/2023,18:00,40.68779,-73.820175,QUEENS,1.0,0.0,1,0,0,0,0,0,4630751,2023-05-19 18:00:00,2023-05-19T18:00,2023,5,15.1,0.0,Clear
07/27/2023,13:00,40.752754,-73.89434,QUEENS,1.0,0.0,0,0,1,0,0,0,4649150,2023-07-27 13:00:00,2023-07-27T13:00,2023,7,31.8,0.0,Cloudy
04/24/2023,0:00,40.752434,-73.88956,QUEENS,6.0,0.0,0,0,0,0,6,0,4623347,2023-04-24 00:00:00,2023-04-24T00:00,2023,4,8.8,0.0,Clear
08/22/2023,19:00,40.75473,-73.7537,QUEENS,1.0,0.0,0,0,0,0,1,0,4656189,2023-08-22 19:00:00,2023-08-22T19:00,2023,8,20.9,0.0,Cloudy
06/16/2023,0:00,40.75203,-73.92915,QUEENS,1.0,0.0,0,0,0,0,1,0,4638399,2023-06-16 00:00:00,2023-06-16T00:00,2023,6,17.5,0.0,Clear
06/15/2023,19:00,40.67598,-73.75347,QUEENS,1.0,0.0,0,0,0,0,1,0,4638221,2023-06-15 19:00:00,2023-06-15T19:00,2023,6,21.8,0.0,Clear
06/18/2023,17:00,40.679337,-73.78212,QUEENS,2.0,0.0,0,0,0,0,2,0,4642229,2023-06-18 17:00:00,2023-06-18T17:00,2023,6,23.0,0.0,Cloudy
11/22/2023,23:00,40.75663,-73.875145,QUEENS,1.0,0.0,1,0,0,0,0,0,4682595,2023-11-22 23:00:00,2023-11-22T23:00,2023,11,8.7,0.0,Cloudy
07/08/2023,18:00,40.711452,-73.91987,QUEENS,2.0,0.0,0,0,0,0,2,0,4644702,2023-07-08 18:00:00,2023-07-08T18:00,2023,7,25.4,0.0,Cloudy
09/23/2023,4:00,40.748215,-73.87846,QUEENS,1.0,0.0,1,0,0,0,0,0,4665040,2023-09-23 04:00:00,2023-09-23T04:00,2023,9,15.3,0.9,Drizzle
02/28/2023,19:00,40.713875,-73.87528,QUEENS,1.0,0.0,1,0,0,0,0,0,4609403,2023-02-28 19:00:00,2023-02-28T19:00,2023,2,1.9,0.0,Clear
06/10/2023,9:00,40.66405,-73.84211,QUEENS,1.0,0.0,0,0,1,0,0,0,4636800,2023-06-10 09:00:00,2023-06-10T09:00,2023,6,19.5,0.0,Clear
10/17/2023,5:00,40.70678,-73.85472,QUEENS,3.0,0.0,0,0,0,0,3,0,4673452,2023-10-17 05:00:00,2023-10-17T05:00,2023,10,8.4,0.0,Cloudy
08/03/2023,20:00,40.665257,-73.73926,QUEENS,2.0,0.0,0,0,0,0,2,0,4651225,2023-08-03 20:00:00,2023-08-03T20:00,2023,8,21.9,0.0,Cloudy
07/05/2023,16:00,40.65616,-73.76736,QUEENS,1.0,0.0,0,0,0,0,1,0,4643498,2023-07-05 16:00:00,2023-07-05T16:00,2023,7,26.7,0.0,Clear
10/18/2023,8:00,40.74893,-73.951645,QUEENS,1.0,0.0,0,0,1,0,0,0,4671583,2023-10-18 08:00:00,2023-10-18T08:00,2023,10,11.9,0.0,Clear
02/19/2023,9:00,40.76042,-73.928856,QUEENS,1.0,0.0,0,0,0,0,1,0,4607456,2023-02-19 09:00:00,2023-02-19T09:00,2023,2,3.5,0.0,Cloudy
08/10/2023,19:00,40.70887,-73.81871,QUEENS,1.0,0.0,0,0,0,0,0,0,4653023,2023-08-10 19:00:00,2023-08-10T19:00,2023,8,21.2,0.0,Cloudy
04/05/2023,16:00,40.685776,-73.76095,QUEENS,1.0,0.0,1,0,0,0,0,0,4619441,2023-04-05 16:00:00,2023-04-05T16:00,2023,4,11.9,0.0,Cloudy
06/27/2023,16:00,40.661198,-73.770966,QUEENS,3.0,0.0,0,0,0,0,3,0,4641214,2023-06-27 16:00:00,2023-06-27T16:00,2023,6,23.2,0.0,Cloudy
04/13/2023,15:00,40.681362,-73.766,QUEENS,1.0,0.0,0,0,1,0,0,0,4621799,2023-04-13 15:00:00,2023-04-13T15:00,2023,4,23.0,0.0,Clear
01/14/2023,3:00,40.692516,-73.85911,QUEENS,0.0,0.0,0,0,0,0,0,0,4598095,2023-01-14 03:00:00,2023-01-14T03:00,2023,1,1.4,0.0,Cloudy
09/22/2023,15:00,40.704853,-73.791664,QUEENS,1.0,0.0,1,0,0,0,0,0,4665801,2023-09-22 15:00:00,2023-09-22T15:00,2023,9,20.7,0.0,Cloudy
09/05/2023,14:00,40.714935,-73.81636,QUEENS,2.0,0.0,0,0,0,0,2,0,4659777,2023-09-05 14:00:00,2023-09-05T14:00,2023,9,33.9,0.0,Cloudy
05/09/2023,12:00,40.769653,-73.91857,QUEENS,1.0,0.0,1,0,0,0,0,0,4627712,2023-05-09 12:00:00,2023-05-09T12:00,2023,5,18.5,0.0,Cloudy
06/13/2023,14:00,40.73274,-73.86836,QUEENS,1.0,0.0,1,0,0,0,0,0,4639928,2023-06-13 14:00:00,2023-06-13T14:00,2023,6,26.8,0.0,Clear
05/09/2023,20:00,40.739964,-73.89424,QUEENS,1.0,0.0,0,0,0,0,1,0,4627548,2023-05-09 20:00:00,2023-05-09T20:00,2023,5,11.2,0.0,Clear
04/10/2023,2:00,40.66477,-73.84944,QUEENS,0.0,0.0,0,0,0,0,0,0,4619689,2023-04-10 02:00:00,2023-04-10T02:00,2023,4,2.1,0.0,Clear
12/10/2023,1:00,40.72106,-73.75945,QUEENS,1.0,0.0,0,0,0,0,1,0,4686184,2023-12-10 01:00:00,2023-12-10T01:00,2023,12,8.3,0.0,Clear
04/17/2023,11:00,40.7608,-73.7657,QUEENS,1.0,0.0,1,0,0,0,0,0,4621227,2023-04-17 11:00:00,2023-04-17T11:00,2023,4,15.2,0.0,Cloudy
01/21/2023,21:00,40.67852,-73.75441,QUEENS,5.0,0.0,0,0,0,0,5,0,4599360,2023-01-21 21:00:00,2023-01-21T21:00,2023,1,-1.4,0.0,Clear
08/17/2023,7:00,40.75119,-73.90203,QUEENS,2.0,0.0,0,0,0,0,2,0,4654915,2023-08-17 07:00:00,2023-08-17T07:00,2023,8,22.1,0.0,Cloudy
10/11/2023,20:00,40.734894,-73.803856,QUEENS,1.0,0.0,0,0,0,0,1,0,4669762,2023-10-11 20:00:00,2023-10-11T20:00,2023,10,13.0,0.0,Cloudy
01/25/2023,13:00,40.7145,-73.77114,QUEENS,1.0,0.0,0,0,0,0,1,0,4600735,2023-01-25 13:00:00,2023-01-25T13:00,2023,1,4.1,0.2,Drizzle
01/31/2023,23:00,40.74581,-73.788795,QUEENS,1.0,0.0,0,0,0,0,1,0,4602688,2023-01-31 23:00:00,2023-01-31T23:00,2023,1,0.2,0.0,Cloudy
05/16/2023,0:00,40.66607,-73.76175,QUEENS,0.0,0.0,0,0,0,0,0,0,4629439,2023-05-16 00:00:00,2023-05-16T00:00,2023,5,15.8,0.0,Clear
02/10/2023,6:00,40.746033,-73.93441,QUEENS,1.0,0.0,0,0,0,0,1,0,4604678,2023-02-10 06:00:00,2023-02-10T06:00,2023,2,12.2,0.0,Clear
07/16/2023,12:00,40.675312,-73.840576,QUEENS,0.0,0.0,0,0,0,0,0,0,4645660,2023-07-16 12:00:00,2023-07-16T12:00,2023,7,24.2,0.2,Drizzle
02/14/2023,16:00,40.704403,-73.814445,QUEENS,0.0,0.0,0,0,0,0,0,0,4605670,2023-02-14 16:00:00,2023-02-14T16:00,2023,2,10.9,0.0,Clear
04/27/2023,8:00,40.75476,-73.863174,QUEENS,0.0,0.0,0,0,0,0,0,0,4625998,2023-04-27 08:00:00,2023-04-27T08:00,2023,4,12.1,0.0,Cloudy
10/20/2023,21:00,40.759815,-73.933235,QUEENS,1.0,0.0,0,0,0,0,1,0,4672445,2023-10-20 21:00:00,2023-10-20T21:00,2023,10,15.0,0.1,Drizzle
02/09/2023,20:00,40.745632,-73.82931,QUEENS,1.0,0.0,0,0,0,0,1,0,4604613,2023-02-09 20:00:00,2023-02-09T20:00,2023,2,10.7,0.0,Cloudy
08/30/2023,4:00,40.767735,-73.9185,QUEENS,1.0,0.0,0,0,0,0,1,0,4658096,2023-08-30 04:00:00,2023-08-30T04:00,2023,8,22.0,0.1,Drizzle
07/24/2023,9:00,40.675446,-73.759514,QUEENS,1.0,0.0,0,0,0,0,1,0,4648587,2023-07-24 09:00:00,2023-07-24T09:00,2023,7,24.8,0.0,Cloudy
04/13/2023,12:00,40.768353,-73.93528,QUEENS,1.0,0.0,1,0,0,0,0,0,4622662,2023-04-13 12:00:00,2023-04-13T12:00,2023,4,28.9,0.0,Clear
06/16/2023,0:00,40.746193,-73.94204,QUEENS,1.0,0.0,0,0,0,0,1,0,4638486,2023-06-16 00:00:00,2023-06-16T00:00,2023,6,17.6,0.0,Clear
02/09/2023,19:00,40.75775,-73.78339,QUEENS,1.0,0.0,0,0,0,0,0,0,4606154,2023-02-09 19:00:00,2023-02-09T19:00,2023,2,9.7,0.0,Cloudy
06/16/2023,0:00,40.753147,-73.86339,QUEENS,1.0,0.0,0,0,0,0,1,0,4639289,2023-06-16 00:00:00,2023-06-16T00:00,2023,6,17.5,0.0,Clear
01/21/2023,1:00,40.759182,-73.86883,QUEENS,1.0,0.0,0,0,1,0,0,0,4600582,2023-01-21 01:00:00,2023-01-21T01:00,2023,1,2.9,0.0,Cloudy
10/06/2023,16:00,40.713985,-73.73812,QUEENS,1.0,0.0,0,0,0,0,1,0,4668349,2023-10-06 16:00:00,2023-10-06T16:00,2023,10,20.8,0.0,Cloudy
02/22/2023,15:00,40.681923,-73.831924,QUEENS,1.0,0.0,0,0,0,0,1,0,4607703,2023-02-22 15:00:00,2023-02-22T15:00,2023,2,4.4,0.5,Drizzle
11/22/2023,21:00,40.70375,-73.79916,QUEENS,1.0,0.0,0,0,0,0,1,0,4681450,2023-11-22 21:00:00,2023-11-22T21:00,2023,11,6.7,0.0,Cloudy
09/26/2023,6:00,40.71464,-73.742935,QUEENS,1.0,0.0,0,0,0,0,1,0,4665591,2023-09-26 06:00:00,2023-09-26T06:00,2023,9,14.3,0.3,Drizzle
02/09/2023,6:00,40.725677,-73.89033,QUEENS,0.0,0.0,0,0,0,0,0,0,4604272,2023-02-09 06:00:00,2023-02-09T06:00,2023,2,-0.8,0.0,Cloudy
07/09/2023,18:00,40.735634,-73.87602,QUEENS,1.0,0.0,1,0,0,0,0,0,4647299,2023-07-09 18:00:00,2023-07-09T18:00,2023,7,22.4,1.3,Light Rain
11/13/2023,18:00,40.728863,-73.82755,QUEENS,1.0,0.0,1,0,0,0,0,0,4678824,2023-11-13 18:00:00,2023-11-13T18:00,2023,11,6.5,0.0,Cloudy
01/29/2023,20:00,40.749825,-73.80354,QUEENS,0.0,0.0,0,0,0,0,0,0,4601827,2023-01-29 20:00:00,2023-01-29T20:00,2023,1,7.9,0.0,Cloudy
02/09/2023,13:00,40.78794,-73.84289,QUEENS,1.0,0.0,0,0,0,0,1,0,4604386,2023-02-09 13:00:00,2023-02-09T13:00,2023,2,8.8,0.0,Cloudy
02/16/2023,14:00,40.598087,-73.758385,QUEENS,2.0,0.0,0,0,0,0,2,0,4606125,2023-02-16 14:00:00,2023-02-16T14:00,2023,2,8.2,0.0,Cloudy
09/29/2023,0:00,40.73675,-73.87768,QUEENS,1.0,0.0,1,0,0,0,0,0,4674091,2023-09-29 00:00:00,2023-09-29T00:00,2023,9,15.1,0.0,Cloudy
12/17/2023,2:00,40.768963,-73.911705,QUEENS,0.0,0.0,0,0,0,0,0,0,4687698,2023-12-17 02:00:00,2023-12-17T02:00,2023,12,6.8,0.0,Cloudy
10/31/2023,9:00,40.72368,-73.89961,QUEENS,2.0,0.0,0,0,0,0,2,0,4675814,2023-10-31 09:00:00,2023-10-31T09:00,2023,10,8.5,0.0,Cloudy
05/16/2023,10:00,40.748955,-73.8997,QUEENS,1.0,0.0,0,0,0,0,1,0,4634795,2023-05-16 10:00:00,2023-05-16T10:00,2023,5,22.6,0.0,Clear
01/20/2023,10:00,40.65616,-73.76736,QUEENS,1.0,0.0,0,0,0,0,1,0,4599238,2023-01-20 10:00:00,2023-01-20T10:00,2023,1,7.8,0.0,Clear
09/07/2023,6:00,40.721485,-73.86658,QUEENS,0.0,0.0,0,0,0,0,0,0,4660574,2023-09-07 06:00:00,2023-09-07T06:00,2023,9,22.2,0.0,Clear
02/24/2023,0:00,40.751328,-73.885544,QUEENS,1.0,0.0,0,0,0,0,1,0,4608722,2023-02-24 00:00:00,2023-02-24T00:00,2023,2,5.0,0.0,Cloudy
02/13/2023,19:00,40.728024,-73.74764,QUEENS,1.0,0.0,1,0,0,0,0,0,4605390,2023-02-13 19:00:00,2023-02-13T19:00,2023,2,6.7,0.0,Clear
07/25/2023,5:00,40.698677,-73.90954,QUEENS,1.0,0.0,1,0,0,0,0,0,4650258,2023-07-25 05:00:00,2023-07-25T05:00,2023,7,19.5,0.0,Clear
09/03/2023,4:00,40.76464,-73.916595,QUEENS,1.0,0.0,0,0,0,0,1,0,4660787,2023-09-03 04:00:00,2023-09-03T04:00,2023,9,18.3,0.0,Cloudy
04/07/2023,15:00,40.74413,-73.88498,QUEENS,1.0,0.0,0,0,1,0,0,0,4620587,2023-04-07 15:00:00,2023-04-07T15:00,2023,4,11.9,0.0,Cloudy
12/20/2023,18:00,40.70636,-73.792534,QUEENS,2.0,0.0,0,0,0,0,2,0,4689925,2023-12-20 18:00:00,2023-12-20T18:00,2023,12,2.6,0.0,Clear
04/24/2023,15:00,40.757847,-73.89922,QUEENS,0.0,0.0,0,0,0,0,0,0,4626002,2023-04-24 15:00:00,2023-04-24T15:00,2023,4,15.1,0.0,Cloudy
03/20/2023,15:00,40.686447,-73.85485,QUEENS,2.0,0.0,0,0,0,0,2,0,4614304,2023-03-20 15:00:00,2023-03-20T15:00,2023,3,5.7,0.0,Clear
12/13/2023,14:00,40.768776,-73.792465,QUEENS,1.0,0.0,0,0,0,0,1,0,4687011,2023-12-13 14:00:00,2023-12-13T14:00,2023,12,7.1,0.0,Clear
05/10/2023,0:00,40.582287,-73.8286,QUEENS,1.0,0.0,0,0,0,0,1,0,4627742,2023-05-10 00:00:00,2023-05-10T00:00,2023,5,10.9,0.0,Clear
12/09/2023,2:00,40.71893,-73.73439,QUEENS,2.0,0.0,0,0,0,0,2,0,4685538,2023-12-09 02:00:00,2023-12-09T02:00,2023,12,4.0,0.0,Cloudy
08/02/2023,12:00,40.74894,-73.85448,QUEENS,1.0,0.0,0,0,0,0,1,0,4660944,2023-08-02 12:00:00,2023-08-02T12:00,2023,8,25.3,0.0,Cloudy
09/03/2023,22:00,40.673847,-73.795715,QUEENS,1.0,0.0,0,0,0,0,1,0,4659699,2023-09-03 22:00:00,2023-09-03T22:00,2023,9,24.0,0.0,Clear
11/21/2023,8:00,40.699146,-73.84307,QUEENS,1.0,0.0,0,0,0,0,1,0,4680952,2023-11-21 08:00:00,2023-11-21T08:00,2023,11,1.6,0.0,Cloudy
11/06/2023,7:00,40.70269,-73.839485,QUEENS,1.0,0.0,0,0,0,0,1,0,4677146,2023-11-06 07:00:00,2023-11-06T07:00,2023,11,4.7,0.0,Clear
02/15/2023,13:00,40.72096,-73.84698,QUEENS,1.0,0.0,1,0,0,0,0,0,4605986,2023-02-15 13:00:00,2023-02-15T13:00,2023,2,13.0,0.0,Clear
11/02/2023,17:00,40.75204,-73.93064,QUEENS,1.0,0.0,1,0,0,0,0,0,4676298,2023-11-02 17:00:00,2023-11-02T17:00,2023,11,6.3,0.0,Clear
05/12/2023,6:00,40.605114,-73.81973,QUEENS,2.0,0.0,0,0,0,0,2,0,4628095,2023-05-12 06:00:00,2023-05-12T06:00,2023,5,15.2,0.0,Cloudy
06/04/2023,21:00,40.69469,-73.90252,QUEENS,1.0,0.0,1,0,0,0,0,0,4635795,2023-06-04 21:00:00,2023-06-04T21:00,2023,6,14.1,0.0,Cloudy
12/28/2023,22:00,40.754868,-73.82399,QUEENS,1.0,0.0,1,0,0,0,0,0,4691325,2023-12-28 22:00:00,2023-12-28T22:00,2023,12,9.0,0.1,Drizzle
01/14/2023,18:00,40.7226,-73.86762,QUEENS,0.0,0.0,0,0,0,0,0,0,4598003,2023-01-14 18:00:00,2023-01-14T18:00,2023,1,0.4,0.0,Cloudy
12/30/2023,3:00,40.748993,-73.89687,QUEENS,1.0,0.0,0,0,0,0,1,0,4691157,2023-12-30 03:00:00,2023-12-30T03:00,2023,12,4.8,0.0,Cloudy
08/05/2023,0:00,40.746243,-73.75979,QUEENS,2.0,0.0,0,0,0,0,2,0,4651887,2023-08-05 00:00:00,2023-08-05T00:00,2023,8,19.9,0.0,Cloudy
07/11/2023,18:00,40.687225,-73.821625,QUEENS,1.0,0.0,1,0,0,0,0,0,4644812,2023-07-11 18:00:00,2023-07-11T18:00,2023,7,25.0,0.0,Clear
08/31/2023,12:00,40.66411,-73.74045,QUEENS,1.0,0.0,0,0,0,0,1,0,4658470,2023-08-31 12:00:00,2023-08-31T12:00,2023,8,23.1,0.0,Cloudy
10/19/2023,11:00,40.596226,-73.75414,QUEENS,1.0,0.0,1,0,0,0,0,0,4672178,2023-10-19 11:00:00,2023-10-19T11:00,2023,10,14.7,0.0,Clear
12/05/2023,0:00,40.751434,-73.94725,QUEENS,1.0,0.0,0,0,0,0,1,0,4684759,2023-12-05 00:00:00,2023-12-05T00:00,2023,12,3.6,0.0,Clear
08/13/2023,3:00,40.66641,-73.78467,QUEENS,1.0,0.0,0,0,0,0,1,0,4654123,2023-08-13 03:00:00,2023-08-13T03:00,2023,8,22.2,0.2,Drizzle
11/07/2023,15:00,40.71599,-73.87209,QUEENS,1.0,0.0,0,0,0,0,0,0,4677359,2023-11-07 15:00:00,2023-11-07T15:00,2023,11,19.8,0.0,Clear
06/05/2023,15:00,40.705887,-73.74952,QUEENS,1.0,0.0,1,0,0,0,0,0,4635244,2023-06-05 15:00:00,2023-06-05T15:00,2023,6,23.4,0.0,Cloudy
10/28/2023,23:00,40.69011,-73.81206,QUEENS,1.0,0.0,0,0,0,0,1,0,4674712,2023-10-28 23:00:00,2023-10-28T23:00,2023,10,16.8,0.0,Cloudy
08/10/2023,20:00,40.688934,-73.73225,QUEENS,2.0,0.0,0,0,0,0,2,0,4653162,2023-08-10 20:00:00,2023-08-10T20:00,2023,8,21.4,0.0,Clear
09/06/2023,17:00,40.749504,-73.76236,QUEENS,0.0,0.0,0,0,0,0,0,0,4660077,2023-09-06 17:00:00,2023-09-06T17:00,2023,9,28.9,0.0,Clear
05/25/2023,15:00,40.718437,-73.87262,QUEENS,2.0,0.0,0,0,0,0,2,0,4633186,2023-05-25 15:00:00,2023-05-25T15:00,2023,5,18.8,0.0,Clear
03/25/2023,0:00,40.751575,-73.85584,QUEENS,0.0,0.0,0,0,0,0,0,0,4615275,2023-03-25 00:00:00,2023-03-25T00:00,2023,3,4.6,0.0,Clear
06/19/2023,15:00,40.769302,-73.772255,QUEENS,1.0,0.0,0,0,0,0,1,0,4641197,2023-06-19 15:00:00,2023-06-19T15:00,2023,6,23.7,0.1,Drizzle
08/02/2023,0:00,40.756664,-73.78282,QUEENS,1.0,0.0,0,0,1,0,0,0,4650873,2023-08-02 00:00:00,2023-08-02T00:00,2023,8,16.6,0.0,Clear
04/05/2023,15:00,40.751972,-73.93197,QUEENS,1.0,0.0,0,0,0,0,1,0,4619401,2023-04-05 15:00:00,2023-04-05T15:00,2023,4,12.9,0.0,Cloudy
02/07/2023,21:00,40.682564,-73.82112,QUEENS,1.0,0.0,0,0,0,0,1,0,4603850,2023-02-07 21:00:00,2023-02-07T21:00,2023,2,3.8,0.5,Drizzle
07/19/2023,9:00,40.67102,-73.74893,QUEENS,1.0,0.0,0,0,0,0,1,0,4646893,2023-07-19 09:00:00,2023-07-19T09:00,2023,7,24.2,0.0,Cloudy
02/27/2023,9:00,40.768166,-73.82422,QUEENS,1.0,0.0,0,0,0,0,1,0,4608750,2023-02-27 09:00:00,2023-02-27T09:00,2023,2,2.2,0.0,Cloudy
05/19/2023,6:00,40.677876,-73.77909,QUEENS,1.0,0.0,0,0,0,0,1,0,4630173,2023-05-19 06:00:00,2023-05-19T06:00,2023,5,13.1,0.0,Cloudy
10/05/2023,10:00,40.695995,-73.782776,QUEENS,1.0,0.0,0,0,0,0,1,0,4669647,2023-10-05 10:00:00,2023-10-05T10:00,2023,10,20.5,0.0,Clear
06/29/2023,15:00,40.7494,-73.87573,QUEENS,1.0,0.0,1,0,0,0,0,0,4643151,2023-06-29 15:00:00,2023-06-29T15:00,2023,6,28.3,0.0,Clear
03/21/2023,10:00,40.716164,-73.74477,QUEENS,1.0,0.0,1,0,0,0,0,0,4614413,2023-03-21 10:00:00,2023-03-21T10:00,2023,3,10.2,0.0,Clear
08/14/2023,12:00,40.65736,-73.84046,QUEENS,1.0,0.0,0,0,1,0,0,0,4654138,2023-08-14 12:00:00,2023-08-14T12:00,2023,8,27.8,0.1,Drizzle
12/04/2023,2:00,40.68762,-73.72789,QUEENS,0.0,0.0,0,0,0,0,0,0,4684407,2023-12-04 02:00:00,2023-12-04T02:00,2023,12,6.8,0.0,Clear
06/18/2023,18:00,40.74456,-73.93076,QUEENS,1.0,0.0,0,0,0,0,1,0,4639108,2023-06-18 18:00:00,2023-06-18T18:00,2023,6,25.3,0.0,Cloudy
10/31/2023,8:00,40.74826,-73.86989,QUEENS,0.0,0.0,0,0,0,0,0,0,4675397,2023-10-31 08:00:00,2023-10-31T08:00,2023,10,7.5,0.0,Clear
02/02/2023,0:00,40.756287,-73.860725,QUEENS,2.0,0.0,0,0,0,0,2,0,4603217,2023-02-02 00:00:00,2023-02-02T00:00,2023,2,-3.4,0.0,Cloudy
03/20/2023,16:00,40.697258,-73.80575,QUEENS,1.0,0.0,0,0,0,0,1,0,4614227,2023-03-20 16:00:00,2023-03-20T16:00,2023,3,5.9,0.0,Clear
03/12/2023,12:00,40.770313,-73.87603,QUEENS,0.0,0.0,0,0,0,0,0,0,4612219,2023-03-12 12:00:00,2023-03-12T12:00,2023,3,7.0,0.0,Cloudy
05/30/2023,16:00,40.747944,-73.8809,QUEENS,2.0,0.0,0,0,0,0,0,0,4633780,2023-05-30 16:00:00,2023-05-30T16:00,2023,5,19.1,0.0,Clear
06/10/2023,9:00,40.708183,-73.80684,QUEENS,0.0,0.0,0,0,0,0,0,0,4636384,2023-06-10 09:00:00,2023-06-10T09:00,2023,6,19.4,0.0,Clear
08/03/2023,17:00,40.71251,-73.8957,QUEENS,1.0,0.0,0,0,1,0,0,0,4651242,2023-08-03 17:00:00,2023-08-03T17:00,2023,8,23.7,0.0,Clear
01/04/2023,12:00,0.0,0.0,STATEN ISLAND,2.0,0.0,0,0,0,0,2,0,4595323,2023-01-04 12:00:00,2023-01-04T12:00,2023,1,27.5,0.0,Cloudy
11/21/2023,9:00,40.617832,-74.08627,STATEN ISLAND,1.0,0.0,0,0,0,0,1,0,4681325,2023-11-21 09:00:00,2023-11-21T09:00,2023,11,3.8,0.0,Cloudy
03/29/2023,12:00,40.556534,-74.12813,STATEN ISLAND,1.0,0.0,0,0,0,0,1,0,4616616,2023-03-29 12:00:00,2023-03-29T12:00,2023,3,9.4,0.0,Clear
09/21/2023,14:00,40.591022,-74.100914,STATEN ISLAND,1.0,0.0,0,0,0,0,1,0,4664437,2023-09-21 14:00:00,2023-09-21T14:00,2023,9,22.2,0.0,Clear
05/19/2023,23:00,40.543335,-74.164276,STATEN ISLAND,1.0,0.0,0,0,0,0,1,0,4631349,2023-05-19 23:00:00,2023-05-19T23:00,2023,5,13.9,0.0,Cloudy
03/24/2023,21:00,40.58001,-74.11398,STATEN ISLAND,1.0,0.0,0,0,0,0,1,0,4615812,2023-03-24 21:00:00,2023-03-24T21:00,2023,3,6.1,0.0,Cloudy
01/20/2023,20:00,40.610886,-74.09164,STATEN ISLAND,1.0,0.0,0,0,0,0,1,0,4600711,2023-01-20 20:00:00,2023-01-20T20:00,2023,1,4.9,0.0,Clear
09/26/2023,15:00,40.553314,-74.1634,STATEN ISLAND,2.0,0.0,0,0,0,0,2,0,4665773,2023-09-26 15:00:00,2023-09-26T15:00,2023,9,16.6,0.0,Cloudy
04/20/2023,0:00,40.576405,-74.127075,STATEN ISLAND,0.0,0.0,0,0,0,0,0,0,4625285,2023-04-20 00:00:00,2023-04-20T00:00,2023,4,8.8,0.0,Cloudy
09/01/2023,21:00,40.516724,-74.196884,STATEN ISLAND,2.0,0.0,0,0,0,0,2,0,4659505,2023-09-01 21:00:00,2023-09-01T21:00,2023,9,17.7,0.0,Clear
06/20/2023,17:00,40.565945,-74.11431,STATEN ISLAND,1.0,0.0,0,0,0,0,1,0,4639550,2023-06-20 17:00:00,2023-06-20T17:00,2023,6,19.8,0.0,Cloudy
01/07/2023,12:00,40.575306,-74.121124,STATEN ISLAND,2.0,0.0,0,0,0,0,2,0,4596502,2023-01-07 12:00:00,2023-01-07T12:00,2023,1,6.8,0.0,Clear
03/29/2023,16:00,40.608757,-74.07579,STATEN ISLAND,0.0,0.0,0,0,0,0,0,0,4617380,2023-03-29 16:00:00,2023-03-29T16:00,2023,3,7.1,0.0,Cloudy
03/04/2023,8:00,40.619648,-74.08266,STATEN ISLAND,0.0,0.0,0,0,0,0,0,0,4610493,2023-03-04 08:00:00,2023-03-04T08:00,2023,3,4.5,0.1,Drizzle
07/06/2023,16:00,40.59688,-74.12416,STATEN ISLAND,1.0,0.0,1,0,0,0,0,0,4643385,2023-07-06 16:00:00,2023-07-06T16:00,2023,7,29.2,0.0,Clear
02/13/2023,11:00,40.624523,-74.11702,STATEN ISLAND,2.0,0.0,0,0,0,0,2,0,4606024,2023-02-13 11:00:00,2023-02-13T11:00,2023,2,7.7,0.0,Clear
01/04/2023,15:00,40.5413,-74.21586,STATEN ISLAND,0.0,0.0,0,0,0,0,0,0,4600957,2023-01-04 15:00:00,2023-01-04T15:00,2023,1,15.5,0.0,Cloudy
05/31/2023,16:00,40.631096,-74.113754,STATEN ISLAND,1.0,0.0,0,0,0,0,1,0,4634128,2023-05-31 16:00:00,2023-05-31T16:00,2023,5,18.6,0.0,Clear
10/28/2023,14:00,40.618916,-74.08369,STATEN ISLAND,1.0,0.0,0,0,0,0,1,0,4675492,2023-10-28 14:00:00,2023-10-28T14:00,2023,10,26.6,0.0,Cloudy
07/13/2023,10:00,40.595596,-74.063126,STATEN ISLAND,1.0,0.0,0,0,0,0,1,0,4645260,2023-07-13 10:00:00,2023-07-13T10:00,2023,7,30.4,0.0,Cloudy
07/09/2023,11:00,40.58286,-74.102196,STATEN ISLAND,0.0,0.0,0,0,0,0,0,0,4646133,2023-07-09 11:00:00,2023-07-09T11:00,2023,7,25.5,0.1,Drizzle
11/26/2023,0:00,40.525227,-74.20962,STATEN ISLAND,0.0,0.0,0,0,0,0,0,0,4682759,2023-11-26 00:00:00,2023-11-26T00:00,2023,11,-0.7,0.0,Cloudy
07/13/2023,0:00,40.59022,-74.06676,STATEN ISLAND,0.0,0.0,0,0,0,0,0,0,4645262,2023-07-13 00:00:00,2023-07-13T00:00,2023,7,24.3,0.0,Clear
11/08/2023,16:00,40.61578,-74.07373,STATEN ISLAND,1.0,0.0,0,0,0,0,1,0,4678953,2023-11-08 16:00:00,2023-11-08T16:00,2023,11,9.2,0.0,Cloudy
06/02/2023,17:00,40.589287,-74.08719,STATEN ISLAND,1.0,0.0,0,0,0,0,1,0,4634548,2023-06-02 17:00:00,2023-06-02T17:00,2023,6,21.9,0.0,Cloudy
10/11/2023,23:00,40.549374,-74.152664,STATEN ISLAND,2.0,0.0,0,0,0,0,2,0,4670128,2023-10-11 23:00:00,2023-10-11T23:00,2023,10,10.2,0.0,Clear
12/04/2023,20:00,40.6372,-74.125656,STATEN ISLAND,1.0,0.0,0,0,0,0,1,0,4684942,2023-12-04 20:00:00,2023-12-04T20:00,2023,12,6.1,0.0,Clear
10/17/2023,19:00,40.610172,-74.12146,STATEN ISLAND,1.0,0.0,1,0,0,0,0,0,4671521,2023-10-17 19:00:00,2023-10-17T19:00,2023,10,11.7,0.0,Clear
10/10/2023,20:00,40.636623,-74.08179,STATEN ISLAND,1.0,0.0,0,0,0,0,1,0,4669578,2023-10-10 20:00:00,2023-10-10T20:00,2023,10,13.8,0.0,Cloudy
03/21/2023,0:00,40.623722,-74.082405,STATEN ISLAND,1.0,0.0,0,0,0,0,1,0,4615892,2023-03-21 00:00:00,2023-03-21T00:00,2023,3,3.2,0.0,Clear
01/25/2023,16:00,40.568214,-74.11204,STATEN ISLAND,1.0,0.0,0,0,0,0,1,0,4600540,2023-01-25 16:00:00,2023-01-25T16:00,2023,1,5.1,0.8,Drizzle
03/15/2023,8:00,40.562195,-74.12305,STATEN ISLAND,1.0,0.0,0,0,0,0,1,0,4613028,2023-03-15 08:00:00,2023-03-15T08:00,2023,3,1.8,0.0,Cloudy
01/14/2023,20:00,40.579174,-74.11483,STATEN ISLAND,1.0,0.0,1,0,0,0,0,0,4598504,2023-01-14 20:00:00,2023-01-14T20:00,2023,1,0.2,0.0,Cloudy
06/22/2023,22:00,40.557346,-74.16622,STATEN ISLAND,2.0,0.0,0,0,0,0,2,0,4640122,2023-06-22 22:00:00,2023-06-22T22:00,2023,6,18.3,0.0,Cloudy
03/16/2023,14:00,40.571583,-74.10864,STATEN ISLAND,1.0,0.0,0,0,0,0,1,0,4613372,2023-03-16 14:00:00,2023-03-16T14:00,2023,3,11.8,0.0,Clear
11/19/2023,12:00,40.550938,-74.164795,STATEN ISLAND,2.0,0.0,0,0,0,0,2,0,4680605,2023-11-19 12:00:00,2023-11-19T12:00,2023,11,11.6,0.0,Clear
08/20/2023,9:00,40.55119,-74.18957,STATEN ISLAND,1.0,0.0,0,0,0,0,1,0,4655733,2023-08-20 09:00:00,2023-08-20T09:00,2023,8,23.9,0.0,Clear
04/08/2023,14:00,40.624397,-74.0802,STATEN ISLAND,1.0,0.0,0,0,0,0,1,0,4619222,2023-04-08 14:00:00,2023-04-08T14:00,2023,4,8.6,0.0,Cloudy
09/19/2023,16:00,40.616817,-74.06814,STATEN ISLAND,0.0,0.0,0,0,0,0,0,0,4663742,2023-09-19 16:00:00,2023-09-19T16:00,2023,9,23.4,0.0,Clear
08/12/2023,15:00,40.603962,-74.083664,STATEN ISLAND,0.0,0.0,0,0,0,0,0,0,4653319,2023-08-12 15:00:00,2023-08-12T15:00,2023,8,27.0,1.0,Drizzle
04/08/2023,0:00,40.628822,-74.07428,STATEN ISLAND,0.0,0.0,0,0,0,0,0,0,4619268,2023-04-08 00:00:00,2023-04-08T00:00,2023,4,5.5,0.0,Cloudy
04/05/2023,9:00,40.515606,-74.19679,STATEN ISLAND,1.0,0.0,0,0,0,0,1,0,4618725,2023-04-05 09:00:00,2023-04-05T09:00,2023,4,11.2,0.0,Cloudy
10/28/2023,14:00,40.539898,-74.16103,STATEN ISLAND,1.0,0.0,0,0,0,0,1,0,4675549,2023-10-28 14:00:00,2023-10-28T14:00,2023,10,26.8,0.0,Cloudy
06/13/2023,12:00,40.535168,-74.196175,STATEN ISLAND,3.0,0.0,0,0,0,0,3,0,4637324,2023-06-13 12:00:00,2023-06-13T12:00,2023,6,25.0,0.0,Clear
01/13/2023,17:00,40.54653,-74.180435,STATEN ISLAND,1.0,0.0,0,0,0,0,1,0,4598404,2023-01-13 17:00:00,2023-01-13T17:00,2023,1,5.9,0.0,Cloudy
07/27/2023,22:00,40.520916,-74.235115,STATEN ISLAND,1.0,0.0,0,0,0,0,1,0,4649968,2023-07-27 22:00:00,2023-07-27T22:00,2023,7,25.5,0.0,Clear
06/14/2023,14:00,40.598934,-74.06377,STATEN ISLAND,1.0,0.0,0,0,0,0,1,0,4639262,2023-06-14 14:00:00,2023-06-14T14:00,2023,6,18.3,1.6,Light Rain
06/14/2023,11:00,40.54909,-74.22084,STATEN ISLAND,1.0,0.0,0,0,0,0,1,0,4637619,2023-06-14 11:00:00,2023-06-14T11:00,2023,6,22.5,0.2,Drizzle
07/13/2023,20:00,40.56895,-74.12491,STATEN ISLAND,1.0,0.0,0,0,0,0,1,0,4646006,2023-07-13 20:00:00,2023-07-13T20:00,2023,7,27.1,0.0,Cloudy
09/19/2023,15:00,40.53041,-74.189026,STATEN ISLAND,1.0,0.0,0,0,0,0,1,0,4663664,2023-09-19 15:00:00,2023-09-19T15:00,2023,9,23.6,0.0,Clear
07/29/2023,16:00,40.59075,-74.08837,STATEN ISLAND,1.0,0.0,0,0,0,0,1,0,4649769,2023-07-29 16:00:00,2023-07-29T16:00,2023,7,34.2,0.1,Drizzle
08/23/2023,13:00,40.636692,-74.085884,STATEN ISLAND,1.0,0.0,0,0,1,0,0,0,4656498,2023-08-23 13:00:00,2023-08-23T13:00,2023,8,25.2,0.0,Clear
12/27/2023,16:00,40.538986,-74.16365,STATEN ISLAND,1.0,0.0,0,0,0,0,1,0,4690989,2023-12-27 16:00:00,2023-12-27T16:00,2023,12,7.9,0.3,Drizzle
08/14/2023,4:00,40.56527,-74.134605,STATEN ISLAND,1.0,0.0,0,0,0,0,1,0,4653944,2023-08-14 04:00:00,2023-08-14T04:00,2023,8,19.8,0.0,Cloudy
07/11/2023,20:00,40.52524,-74.208206,STATEN ISLAND,1.0,0.0,1,0,0,0,0,0,4645066,2023-07-11 20:00:00,2023-07-11T20:00,2023,7,25.1,0.0,Clear
10/07/2023,4:00,40.644726,-74.08113,STATEN ISLAND,0.0,0.0,0,0,0,0,0,0,4669274,2023-10-07 04:00:00,2023-10-07T04:00,2023,10,17.2,8.7,Heavy Rain
02/19/2023,2:00,40.630856,-74.10334,STATEN ISLAND,1.0,0.0,1,0,0,0,0,0,4607023,2023-02-19 02:00:00,2023-02-19T02:00,2023,2,1.1,0.0,Cloudy
10/27/2023,4:00,40.629425,-74.074615,STATEN ISLAND,1.0,0.0,1,0,0,0,0,0,4679259,2023-10-27 04:00:00,2023-10-27T04:00,2023,10,14.3,0.0,Cloudy
12/25/2023,0:00,40.56373,-74.18829,STATEN ISLAND,0.0,0.0,0,0,0,0,0,0,4690250,2023-12-25 00:00:00,2023-12-25T00:00,2023,12,2.6,0.0,Cloudy
04/03/2023,15:00,40.637875,-74.12357,STATEN ISLAND,1.0,0.0,0,0,0,0,1,0,4618430,2023-04-03 15:00:00,2023-04-03T15:00,2023,4,10.6,0.0,Clear
09/28/2023,18:00,40.519127,-74.19714,STATEN ISLAND,1.0,0.0,1,0,0,0,0,0,4666308,2023-09-28 18:00:00,2023-09-28T18:00,2023,9,17.9,0.0,Cloudy
07/15/2023,18:00,40.637783,-74.07695,STATEN ISLAND,0.0,0.0,0,0,0,0,0,0,4648993,2023-07-15 18:00:00,2023-07-15T18:00,2023,7,27.2,0.0,Cloudy
08/01/2023,18:00,40.638214,-74.07589,STATEN ISLAND,0.0,0.0,0,0,0,0,0,0,4651074,2023-08-01 18:00:00,2023-08-01T18:00,2023,8,25.6,0.0,Clear
09/29/2023,6:00,40.58524,-74.08807,STATEN ISLAND,1.0,0.0,1,0,0,0,0,0,4666424,2023-09-29 06:00:00,2023-09-29T06:00,2023,9,14.0,5.2,Heavy Rain
08/14/2023,12:00,40.613075,-74.12257,STATEN ISLAND,2.0,0.0,0,0,0,0,2,0,4654080,2023-08-14 12:00:00,2023-08-14T12:00,2023,8,29.5,0.0,Cloudy
04/24/2023,13:00,40.636448,-74.08531,STATEN ISLAND,0.0,0.0,0,0,0,0,0,0,4623625,2023-04-24 13:00:00,2023-04-24T13:00,2023,4,16.0,0.0,Clear
05/05/2023,18:00,40.64375,-74.07634,STATEN ISLAND,1.0,0.0,0,0,1,0,0,0,4626283,2023-05-05 18:00:00,2023-05-05T18:00,2023,5,12.0,1.9,Light Rain
12/12/2023,8:00,40.5604,-74.16977,STATEN ISLAND,1.0,0.0,0,0,0,0,1,0,4686656,2023-12-12 08:00:00,2023-12-12T08:00,2023,12,0.1,0.0,Clear
