CRASH DATE,CRASH TIME,LATITUDE,LONGITUDE,BOROUGH,NUMBER OF PERSONS INJURED,NUMBER OF PERSONS KILLED,NUMBER OF PEDESTRIANS INJURED,NUMBER OF PEDESTRIANS KILLED,NUMBER OF CYCLIST INJURED,NUMBER OF CYCLIST KILLED,NUMBER OF MOTORIST INJURED,NUMBER OF MOTORIST KILLED,COLLISION_ID,datetime,iso_datetime,year,month,temperature,precipitation,weather_condition
03/17/2024,1:00,40.862755,-73.901085,BRONX,1.0,0.0,0,0,0,0,1,0,4711491,2024-03-17 01:00:00,2024-03-17T01:00,2024,3,7.7,0.0,Cloudy
02/12/2024,0:00,40.904243,-73.852165,BRONX,2.0,0.0,0,0,0,0,2,0,4702550,2024-02-12 00:00:00,2024-02-12T00:00,2024,2,3.3,0.0,Cloudy
03/17/2024,10:00,40.866577,-73.867325,BRONX,1.0,0.0,1,0,0,0,0,0,4710755,2024-03-17 10:00:00,2024-03-17T10:00,2024,3,12.4,0.0,Clear
09/10/2024,0:00,40.87634,-73.863205,BRONX,1.0,0.0,0,0,0,0,1,0,4754452,2024-09-10 00:00:00,2024-09-10T00:00,2024,9,15.9,0.0,Clear
05/11/2024,0:00,40.890076,-73.819855,BRONX,1.0,0.0,0,0,0,0,0,0,4727594,2024-05-11 00:00:00,2024-05-11T00:00,2024,5,9.0,0.0,Cloudy
02/15/2024,18:00,40.867256,-73.88363,BRONX,1.0,0.0,1,0,0,0,0,0,4703154,2024-02-15 18:00:00,2024-02-15T18:00,2024,2,0.5,0.0,Cloudy
04/09/2024,0:00,40.845142,-73.91105,BRONX,1.0,0.0,0,0,0,0,1,0,4715909,2024-04-09 00:00:00,2024-04-09T00:00,2024,4,6.6,0.0,Clear
08/03/2024,0:00,40.881977,-73.8287,BRONX,1.0,0.0,0,0,0,0,1,0,4746189,2024-08-03 00:00:00,2024-08-03T00:00,2024,8,24.2,0.0,Cloudy
01/27/2024,12:00,40.88144,-73.864,BRONX,1.0,0.0,1,0,0,0,0,0,4698349,2024-01-27 12:00:00,2024-01-27T12:00,2024,1,8.0,0.0,Cloudy
09/24/2024,21:00,40.860508,-73.88915,BRONX,1.0,0.0,1,0,0,0,0,0,4758831,2024-09-24 21:00:00,2024-09-24T21:00,2024,9,16.0,0.0,Cloudy
04/08/2024,3:00,40.817806,-73.92764,BRONX,1.0,0.0,1,0,0,0,0,0,4716357,2024-04-08 03:00:00,2024-04-08T03:00,2024,4,1.9,0.0,Clear
09/27/2024,1:00,40.8824,-73.90802,BRONX,0.0,0.0,0,0,0,0,0,0,4761989,2024-09-27 01:00:00,2024-09-27T01:00,2024,9,19.9,0.1,Drizzle
07/22/2024,11:00,40.811043,-73.88073,BRONX,2.0,0.0,0,0,0,0,2,0,4743224,2024-07-22 11:00:00,2024-07-22T11:00,2024,7,27.4,0.5,Drizzle
08/26/2024,10:00,40.880135,-73.903946,BRONX,2.0,0.0,0,0,0,0,2,0,4751837,2024-08-26 10:00:00,2024-08-26T10:00,2024,8,26.1,0.0,Clear
02/09/2024,19:00,40.882515,-73.88093,BRONX,1.0,0.0,0,0,1,0,0,0,4701934,2024-02-09 19:00:00,2024-02-09T19:00,2024,2,4.3,0.0,Cloudy
08/03/2024,13:00,40.833286,-73.914085,BRONX,1.0,0.0,1,0,0,0,0,0,4747479,2024-08-03 13:00:00,2024-08-03T13:00,2024,8,33.1,0.0,Cloudy
10/20/2024,21:00,40.825413,-73.820816,BRONX,1.0,0.0,0,0,0,0,1,0,4765189,2024-10-20 21:00:00,2024-10-20T21:00,2024,10,14.4,0.0,Clear
10/27/2024,12:00,40.89696,-73.85435,BRONX,1.0,0.0,0,0,0,0,1,0,4767043,2024-10-27 12:00:00,2024-10-27T12:00,2024,10,13.1,0.0,Clear
07/30/2024,22:00,40.836384,-73.87039,BRONX,2.0,0.0,0,0,0,0,2,0,4746300,2024-07-30 22:00:00,2024-07-30T22:00,2024,7,24.4,0.0,Cloudy
07/08/2024,5:00,40.85686,-73.893196,BRONX,0.0,0.0,0,0,0,0,0,0,4738995,2024-07-08 05:00:00,2024-07-08T05:00,2024,7,23.0,0.0,Clear
11/29/2024,15:00,40.862446,-73.89714,BRONX,1.0,0.0,1,0,0,0,0,0,4775638,2024-11-29 15:00:00,2024-11-29T15:00,2024,11,5.4,0.0,Cloudy
01/29/2024,13:00,40.82399,-73.85876,BRONX,1.0,0.0,0,0,0,0,1,0,4698877,2024-01-29 13:00:00,2024-01-29T13:00,2024,1,5.2,0.0,Clear
06/21/2024,0:00,40.849922,-73.90563,BRONX,2.0,0.0,0,0,0,0,2,0,4735294,2024-06-21 00:00:00,2024-06-21T00:00,2024,6,24.0,0.0,Cloudy
07/25/2024,14:00,40.865368,-73.85197,BRONX,1.0,0.0,1,0,0,0,0,0,4744552,2024-07-25 14:00:00,2024-07-25T14:00,2024,7,29.0,0.0,Cloudy
09/08/2024,20:00,40.815754,-73.89529,BRONX,1.0,0.0,0,0,0,0,0,0,4757160,2024-09-08 20:00:00,2024-09-08T20:00,2024,9,16.2,0.0,Clear
04/07/2024,19:00,40.82923,-73.87551,BRONX,1.0,0.0,0,0,1,0,0,0,4715669,2024-04-07 19:00:00,2024-04-07T19:00,2024,4,8.9,0.0,Clear
04/09/2024,4:00,40.830135,-73.891884,BRONX,1.0,0.0,1,0,0,0,0,0,4716392,2024-04-09 04:00:00,2024-04-09T04:00,2024,4,7.9,0.0,Cloudy
05/22/2024,14:00,40.82389,-73.89585,BRONX,2.0,0.0,2,0,0,0,0,0,4726692,2024-05-22 14:00:00,2024-05-22T14:00,2024,5,24.8,0.0,Clear
03/11/2024,22:00,40.81637,-73.9188,BRONX,1.0,0.0,0,0,1,0,0,0,4710432,2024-03-11 22:00:00,2024-03-11T22:00,2024,3,5.5,0.0,Clear
07/12/2024,9:00,40.827656,-73.8861,BRONX,3.0,0.0,0,0,0,0,3,0,4742184,2024-07-12 09:00:00,2024-07-12T09:00,2024,7,26.6,0.0,Cloudy
08/02/2024,0:00,40.881264,-73.83875,BRONX,0.0,0.0,0,0,0,0,0,0,4746089,2024-08-02 00:00:00,2024-08-02T00:00,2024,8,24.3,0.0,Cloudy
04/20/2024,11:00,40.876873,-73.84135,BRONX,1.0,0.0,0,0,0,0,1,0,4720651,2024-04-20 11:00:00,2024-04-20T11:00,2024,4,15.9,0.0,Cloudy
07/21/2024,18:00,40.82751,-73.92495,BRONX,1.0,0.0,0,0,1,0,0,0,4744882,2024-07-21 18:00:00,2024-07-21T18:00,2024,7,28.3,0.0,Clear
11/21/2024,22:00,40.85147,-73.88241,BRONX,1.0,0.0,0,0,0,0,0,0,4773224,2024-11-21 22:00:00,2024-11-21T22:00,2024,11,5.4,4.3,Heavy Rain
12/05/2024,11:00,0.0,0.0,BRONX,1.0,0.0,0,0,0,0,1,0,4778233,2024-12-05 11:00:00,2024-12-05T11:00,2024,12,27.5,0.0,Cloudy
10/24/2024,11:00,40.881607,-73.83783,BRONX,1.0,0.0,0,0,0,0,1,0,4773012,2024-10-24 11:00:00,2024-10-24T11:00,2024,10,18.5,0.0,Clear
10/22/2024,9:00,40.84893,-73.88815,BRONX,1.0,0.0,0,0,1,0,0,0,4771978,2024-10-22 09:00:00,2024-10-22T09:00,2024,10,20.0,0.0,Clear
01/06/2024,13:00,40.815964,-73.88688,BRONX,1.0,0.0,0,0,0,0,1,0,4693479,2024-01-06 13:00:00,2024-01-06T13:00,2024,1,2.4,0.0,Cloudy
10/04/2024,20:00,40.890648,-73.84875,BRONX,1.0,0.0,1,0,0,0,0,0,4763444,2024-10-04 20:00:00,2024-10-04T20:00,2024,10,17.8,0.0,Cloudy
11/21/2024,17:00,40.83142,-73.92642,BRONX,1.0,0.0,1,0,0,0,0,0,4776178,2024-11-21 17:00:00,2024-11-21T17:00,2024,11,8.5,0.4,Drizzle
10/01/2024,19:00,40.8355,-73.90123,BRONX,1.0,0.0,0,0,0,0,1,0,4760879,2024-10-01 19:00:00,2024-10-01T19:00,2024,10,16.1,0.0,Clear
10/16/2024,14:00,40.8687,-73.85843,BRONX,1.0,0.0,0,0,0,0,1,0,4765946,2024-10-16 14:00:00,2024-10-16T14:00,2024,10,14.7,0.0,Cloudy
02/10/2024,18:00,40.86607,-73.89439,BRONX,1.0,0.0,0,0,0,0,0,0,4701943,2024-02-10 18:00:00,2024-02-10T18:00,2024,2,11.8,0.0,Cloudy
01/25/2024,21:00,40.8352,-73.86599,BRONX,1.0,0.0,1,0,0,0,0,0,4701164,2024-01-25 21:00:00,2024-01-25T21:00,2024,1,8.5,0.0,Cloudy
04/28/2024,19:00,40.825577,-73.918465,BRONX,1.0,0.0,0,0,0,0,1,0,4721909,2024-04-28 19:00:00,2024-04-28T19:00,2024,4,17.0,0.3,Drizzle
12/01/2024,18:00,40.860897,-73.89193,BRONX,1.0,0.0,1,0,0,0,0,0,4776428,2024-12-01 18:00:00,2024-12-01T18:00,2024,12,0.0,0.0,Clear
03/19/2024,16:00,40.844177,-73.89744,BRONX,0.0,0.0,0,0,0,0,0,0,4711224,2024-03-19 16:00:00,2024-03-19T16:00,2024,3,6.1,0.0,Cloudy
03/12/2024,0:00,40.863884,-73.88975,BRONX,0.0,0.0,0,0,0,0,0,0,4709239,2024-03-12 00:00:00,2024-03-12T00:00,2024,3,4.8,0.0,Clear
08/09/2024,23:00,40.844177,-73.89744,BRONX,1.0,0.0,0,0,0,0,1,0,4748508,2024-08-09 23:00:00,2024-08-09T23:00,2024,8,23.5,0.4,Drizzle
04/01/2024,19:00,40.82689,-73.858894,BRONX,0.0,0.0,0,0,0,0,0,0,4715204,2024-04-01 19:00:00,2024-04-01T19:00,2024,4,8.1,0.0,Clear
03/26/2024,19:00,40.85419,-73.90699,BRONX,1.0,0.0,1,0,0,0,0,0,4712858,2024-03-26 19:00:00,2024-03-26T19:00,2024,3,7.3,0.0,Cloudy
07/19/2024,21:00,40.832233,-73.85427,BRONX,1.0,0.0,0,0,1,0,0,0,4743185,2024-07-19 21:00:00,2024-07-19T21:00,2024,7,22.9,0.0,Clear
12/13/2024,6:00,40.808437,-73.90472,BRONX,0.0,0.0,0,0,0,0,0,0,4786365,2024-12-13 06:00:00,2024-12-13T06:00,2024,12,-3.4,0.0,Clear
04/10/2024,0:00,40.88698,-73.84745,BRONX,1.0,0.0,0,0,0,0,1,0,4717451,2024-04-10 00:00:00,2024-04-10T00:00,2024,4,10.7,0.0,Cloudy
11/12/2024,16:00,40.816067,-73.91764,BRONX,0.0,0.0,0,0,0,0,0,0,4771146,2024-11-12 16:00:00,2024-11-12T16:00,2024,11,9.8,0.0,Clear
09/06/2024,20:00,40.856045,-73.84395,BRONX,1.0,0.0,1,0,0,0,0,0,4753558,2024-09-06 20:00:00,2024-09-06T20:00,2024,9,20.5,0.1,Drizzle
05/19/2024,13:00,40.831642,-73.899536,BRONX,0.0,0.0,0,0,0,0,0,0,4726042,2024-05-19 13:00:00,2024-05-19T13:00,2024,5,22.6,0.0,Cloudy
02/08/2024,9:00,40.856327,-73.84392,BRONX,1.0,0.0,1,0,0,0,0,0,4701061,2024-02-08 09:00:00,2024-02-08T09:00,2024,2,2.5,0.0,Clear
08/13/2024,11:00,40.849106,-73.89495,BRONX,1.0,0.0,0,0,1,0,0,0,4748334,2024-08-13 11:00:00,2024-08-13T11:00,2024,8,24.9,0.0,Clear
03/01/2024,14:00,40.813095,-73.89827,BRONX,0.0,0.0,0,0,0,0,0,0,4707624,2024-03-01 14:00:00,2024-03-01T14:00,2024,3,5.5,0.0,Clear
02/19/2024,11:00,40.814545,-73.90764,BRONX,0.0,0.0,0,0,0,0,0,0,4703820,2024-02-19 11:00:00,2024-02-19T11:00,2024,2,3.6,0.0,Clear
04/28/2024,16:00,40.826874,-73.90539,BRONX,1.0,0.0,0,0,0,0,0,0,4723043,2024-04-28 16:00:00,2024-04-28T16:00,2024,4,20.1,0.0,Cloudy
11/15/2024,6:00,40.841026,-73.853294,BRONX,0.0,0.0,0,0,0,0,0,0,4774264,2024-11-15 06:00:00,2024-11-15T06:00,2024,11,3.7,0.0,Cloudy
08/04/2024,0:00,40.852768,-73.89217,BRONX,1.0,0.0,1,0,0,0,0,0,4745607,2024-08-04 00:00:00,2024-08-04T00:00,2024,8,23.1,0.0,Cloudy
01/26/2024,19:00,40.848755,-73.898705,BRONX,1.0,0.0,0,0,0,0,1,0,4698030,2024-01-26 19:00:00,2024-01-26T19:00,2024,1,4.3,0.0,Cloudy
05/15/2024,23:00,40.817116,-73.88307,BRONX,1.0,0.0,0,0,0,0,1,0,4726886,2024-05-15 23:00:00,2024-05-15T23:00,2024,5,15.3,0.1,Drizzle
06/05/2024,0:00,40.88377,-73.8294,BRONX,0.0,0.0,0,0,0,0,0,0,4735277,2024-06-05 00:00:00,2024-06-05T00:00,2024,6,15.8,0.0,Cloudy
07/10/2024,0:00,40.824207,-73.87529,BRONX,1.0,0.0,0,0,0,0,1,0,4739567,2024-07-10 00:00:00,2024-07-10T00:00,2024,7,26.6,0.0,Cloudy
05/13/2024,22:00,40.83394,-73.9087,BRONX,1.0,0.0,1,0,0,0,0,0,4724727,2024-05-13 22:00:00,2024-05-13T22:00,2024,5,12.8,0.0,Clear
12/02/2024,0:00,40.841724,-73.90175,BRONX,0.0,0.0,0,0,0,0,0,0,4775675,2024-12-02 00:00:00,2024-12-02T00:00,2024,12,-1.4,0.0,Clear
08/07/2024,7:00,40.842075,-73.834724,BRONX,2.0,0.0,0,0,0,0,2,0,4746943,2024-08-07 07:00:00,2024-08-07T07:00,2024,8,19.9,0.1,Drizzle
12/10/2024,10:00,40.852135,-73.83719,BRONX,1.0,0.0,1,0,0,0,0,0,4778548,2024-12-10 10:00:00,2024-12-10T10:00,2024,12,7.0,0.0,Cloudy
09/04/2024,0:00,40.857483,-73.909676,BRONX,1.0,0.0,0,0,1,0,0,0,4754638,2024-09-04 00:00:00,2024-09-04T00:00,2024,9,14.2,0.0,Clear
10/31/2024,18:00,40.833607,-73.858635,BRONX,1.0,0.0,0,0,1,0,0,0,4768128,2024-10-31 18:00:00,2024-10-31T18:00,2024,10,21.7,0.0,Cloudy
04/19/2024,17:00,40.82406,-73.92815,BRONX,1.0,0.0,0,0,0,0,1,0,4720324,2024-04-19 17:00:00,2024-04-19T17:00,2024,4,10.2,0.0,Cloudy
07/30/2024,0:00,40.834057,-73.88973,BRONX,1.0,0.0,0,0,0,0,1,0,4744295,2024-07-30 00:00:00,2024-07-30T00:00,2024,7,22.7,0.0,Cloudy
12/31/2024,20:00,40.88846,-73.841965,BRONX,1.0,0.0,1,0,0,0,0,0,4783860,2024-12-31 20:00:00,2024-12-31T20:00,2024,12,7.1,0.0,Cloudy
03/12/2024,18:00,40.817387,-73.92277,BRONX,1.0,0.0,0,0,1,0,0,0,4709289,2024-03-12 18:00:00,2024-03-12T18:00,2024,3,12.3,0.0,Cloudy
03/08/2024,0:00,40.887333,-73.86072,BRONX,1.0,0.0,0,0,0,0,1,0,4709352,2024-03-08 00:00:00,2024-03-08T00:00,2024,3,4.1,0.0,Clear
05/17/2024,1:00,40.80801,-73.88961,BRONX,3.0,0.0,0,0,0,0,3,0,4725738,2024-05-17 01:00:00,2024-05-17T01:00,2024,5,13.5,0.0,Clear
01/31/2024,16:00,40.865353,-73.89494,BRONX,1.0,0.0,1,0,0,0,0,0,4699334,2024-01-31 16:00:00,2024-01-31T16:00,2024,1,3.5,0.0,Cloudy
12/19/2024,13:00,40.835857,-73.87212,BRONX,1.0,0.0,0,0,0,0,1,0,4784052,2024-12-19 13:00:00,2024-12-19T13:00,2024,12,6.6,0.0,Cloudy
02/15/2024,8:00,40.837784,-73.852486,BRONX,1.0,0.0,0,0,0,0,0,0,4704426,2024-02-15 08:00:00,2024-02-15T08:00,2024,2,-5.7,0.0,Clear
12/30/2024,0:00,40.879948,-73.82338,BRONX,1.0,0.0,1,0,0,0,0,0,4785485,2024-12-30 00:00:00,2024-12-30T00:00,2024,12,13.2,0.3,Drizzle
11/08/2024,14:00,40.83602,-73.9243,BRONX,0.0,0.0,0,0,0,0,0,0,4770113,2024-11-08 14:00:00,2024-11-08T14:00,2024,11,20.5,0.0,Clear
10/12/2024,12:00,40.85038,-73.90699,BRONX,5.0,0.0,0,0,0,0,5,0,4763424,2024-10-12 12:00:00,2024-10-12T12:00,2024,10,21.9,0.0,Clear
04/22/2024,9:00,40.89848,-73.89844,BRONX,1.0,0.0,0,0,0,0,1,0,4722915,2024-04-22 09:00:00,2024-04-22T09:00,2024,4,10.1,0.0,Clear
08/13/2024,2:00,40.83174,-73.886925,BRONX,0.0,0.0,0,0,0,0,0,0,4748290,2024-08-13 02:00:00,2024-08-13T02:00,2024,8,16.8,0.0,Clear
06/12/2024,0:00,40.863605,-73.88888,BRONX,1.0,0.0,0,0,0,0,1,0,4733109,2024-06-12 00:00:00,2024-06-12T00:00,2024,6,15.7,0.0,Cloudy
03/31/2024,15:00,40.84271,-73.885666,BRONX,1.0,0.0,1,0,0,0,0,0,4714828,2024-03-31 15:00:00,2024-03-31T15:00,2024,3,15.6,0.0,Cloudy
07/26/2024,10:00,40.833664,-73.8981,BRONX,1.0,0.0,0,0,0,0,0,0,4744141,2024-07-26 10:00:00,2024-07-26T10:00,2024,7,24.9,0.0,Clear
03/04/2024,0:00,40.84987,-73.88991,BRONX,1.0,0.0,0,0,1,0,0,0,4707130,2024-03-04 00:00:00,2024-03-04T00:00,2024,3,6.6,0.0,Clear
05/12/2024,5:00,40.844234,-73.92363,BRONX,0.0,0.0,0,0,0,0,0,0,4725206,2024-05-12 05:00:00,2024-05-12T05:00,2024,5,9.1,0.2,Drizzle
04/01/2024,4:00,40.818146,-73.89929,BRONX,1.0,0.0,0,0,1,0,0,0,4717778,2024-04-01 04:00:00,2024-04-01T04:00,2024,4,5.7,0.0,Cloudy
02/26/2024,7:00,40.82612,-73.8909,BRONX,1.0,0.0,0,0,0,0,1,0,4705221,2024-02-26 07:00:00,2024-02-26T07:00,2024,2,-1.0,0.0,Clear
12/21/2024,0:00,40.873283,-73.87038,BRONX,2.0,0.0,0,0,0,0,2,0,4780674,2024-12-21 00:00:00,2024-12-21T00:00,2024,12,0.4,0.1,Light Snow
06/10/2024,22:00,40.876648,-73.82986,BRONX,1.0,0.0,1,0,0,0,0,0,4734101,2024-06-10 22:00:00,2024-06-10T22:00,2024,6,17.3,0.0,Clear
03/01/2024,15:00,40.88424,-73.84928,BRONX,4.0,0.0,0,0,0,0,4,0,4707891,2024-03-01 15:00:00,2024-03-01T15:00,2024,3,5.1,0.0,Clear
03/07/2024,15:00,40.875492,-73.86052,BRONX,2.0,0.0,0,0,0,0,2,0,4708400,2024-03-07 15:00:00,2024-03-07T15:00,2024,3,11.4,0.0,Cloudy
08/01/2024,20:00,40.85194,-73.84815,BRONX,0.0,0.0,0,0,0,0,0,0,4744751,2024-08-01 20:00:00,2024-08-01T20:00,2024,8,26.3,0.0,Clear
03/20/2024,13:00,40.827812,-73.925934,BRONX,4.0,0.0,0,0,0,0,4,0,4711548,2024-03-20 13:00:00,2024-03-20T13:00,2024,3,9.8,1.1,Drizzle
06/01/2024,21:00,40.869423,-73.825745,BRONX,3.0,0.0,0,0,0,0,3,0,4734043,2024-06-01 21:00:00,2024-06-01T21:00,2024,6,19.6,0.0,Cloudy
08/10/2024,17:00,40.82518,-73.88872,BRONX,1.0,0.0,0,0,0,0,1,0,4747399,2024-08-10 17:00:00,2024-08-10T17:00,2024,8,28.3,0.0,Clear
06/05/2024,18:00,40.815228,-73.89736,BRONX,1.0,0.0,0,0,0,0,1,0,4731604,2024-06-05 18:00:00,2024-06-05T18:00,2024,6,22.2,0.0,Cloudy
02/20/2024,20:00,40.85707,-73.893715,BRONX,3.0,0.0,0,0,0,0,3,0,4704518,2024-02-20 20:00:00,2024-02-20T20:00,2024,2,-4.0,0.0,Clear
03/08/2024,18:00,40.885693,-73.86165,BRONX,1.0,0.0,0,0,0,0,1,0,4709094,2024-03-08 18:00:00,2024-03-08T18:00,2024,3,6.0,0.0,Cloudy
03/29/2024,16:00,40.87781,-73.886856,BRONX,0.0,0.0,0,0,0,0,0,0,4716639,2024-03-29 16:00:00,2024-03-29T16:00,2024,3,10.3,0.0,Clear
11/03/2024,19:00,40.84029,-73.92146,BRONX,1.0,0.0,1,0,0,0,0,0,4770106,2024-11-03 19:00:00,2024-11-03T19:00,2024,11,7.3,0.0,Clear
01/21/2024,0:00,40.889458,-73.90008,BRONX,1.0,0.0,1,0,0,0,0,0,4696998,2024-01-21 00:00:00,2024-01-21T00:00,2024,1,-7.4,0.0,Cloudy
01/22/2024,0:00,40.869534,-73.9001,BRONX,2.0,0.0,0,0,0,0,2,0,4699422,2024-01-22 00:00:00,2024-01-22T00:00,2024,1,-5.7,0.0,Clear
06/23/2024,14:00,40.883465,-73.91699,BRONX,1.0,0.0,0,0,0,0,1,0,4735267,2024-06-23 14:00:00,2024-06-23T14:00,2024,6,34.5,0.0,Cloudy
04/28/2024,3:00,40.833755,-73.86175,BRONX,1.0,0.0,0,0,1,0,0,0,4723450,2024-04-28 03:00:00,2024-04-28T03:00,2024,4,9.5,0.0,Cloudy
09/10/2024,19:00,40.845375,-73.86543,BRONX,0.0,0.0,0,0,0,0,0,0,4754767,2024-09-10 19:00:00,2024-09-10T19:00,2024,9,19.3,0.0,Clear
02/28/2024,0:00,40.835968,-73.87,BRONX,1.0,0.0,0,0,0,0,1,0,4707231,2024-02-28 00:00:00,2024-02-28T00:00,2024,2,10.3,0.1,Drizzle
10/27/2024,21:00,40.862244,-73.89791,BRONX,3.0,0.0,0,0,0,0,3,0,4767033,2024-10-27 21:00:00,2024-10-27T21:00,2024,10,7.0,0.0,Cloudy
05/09/2024,8:00,40.8369,-73.89058,BRONX,1.0,0.0,0,0,1,0,0,0,4728065,2024-05-09 08:00:00,2024-05-09T08:00,2024,5,17.5,0.0,Cloudy
11/19/2024,8:00,40.865513,-73.85961,BRONX,1.0,0.0,1,0,0,0,0,0,4772718,2024-11-19 08:00:00,2024-11-19T08:00,2024,11,7.9,0.0,Cloudy
09/01/2024,19:00,40.886173,-73.845116,BRONX,0.0,0.0,0,0,0,0,0,0,4752457,2024-09-01 19:00:00,2024-09-01T19:00,2024,9,23.9,0.0,Clear
02/18/2024,0:00,40.839214,-73.85884,BRONX,1.0,0.0,1,0,0,0,0,0,4703586,2024-02-18 00:00:00,2024-02-18T00:00,2024,2,-5.4,0.0,Clear
12/08/2024,13:00,40.849453,-73.906,BRONX,1.0,0.0,1,0,0,0,0,0,4777088,2024-12-08 13:00:00,2024-12-08T13:00,2024,12,10.7,0.0,Cloudy
08/26/2024,15:00,40.86778,-73.86096,BRONX,0.0,0.0,0,0,0,0,0,0,4750863,2024-08-26 15:00:00,2024-08-26T15:00,2024,8,29.4,0.0,Clear
02/12/2024,9:00,40.84468,-73.863075,BRONX,0.0,0.0,0,0,0,0,0,0,4702246,2024-02-12 09:00:00,2024-02-12T09:00,2024,2,2.3,0.0,Cloudy
09/16/2024,11:00,40.844063,-73.921,BRONX,1.0,0.0,1,0,0,0,0,0,4756458,2024-09-16 11:00:00,2024-09-16T11:00,2024,9,22.8,0.0,Cloudy
03/05/2024,14:00,40.82853,-73.879974,BRONX,1.0,0.0,1,0,0,0,0,0,4707512,2024-03-05 14:00:00,2024-03-05T14:00,2024,3,6.9,0.9,Drizzle
07/21/2024,4:00,40.84604,-73.89062,BRONX,1.0,0.0,0,0,0,0,1,0,4742865,2024-07-21 04:00:00,2024-07-21T04:00,2024,7,19.8,0.0,Clear
09/08/2024,20:00,40.86185,-73.89206,BRONX,1.0,0.0,0,0,1,0,0,0,4760954,2024-09-08 20:00:00,2024-09-08T20:00,2024,9,16.4,0.0,Clear
04/14/2024,10:00,40.813663,-73.931244,BRONX,1.0,0.0,0,0,0,0,1,0,4723258,2024-04-14 10:00:00,2024-04-14T10:00,2024,4,16.0,0.0,Cloudy
07/13/2024,0:00,40.82048,-73.81809,BRONX,1.0,0.0,0,0,1,0,0,0,4740128,2024-07-13 00:00:00,2024-07-13T00:00,2024,7,22.9,0.8,Drizzle
04/06/2024,0:00,40.849453,-73.906006,BRONX,1.0,0.0,1,0,0,0,0,0,4715898,2024-04-06 00:00:00,2024-04-06T00:00,2024,4,3.6,0.0,Cloudy
01/24/2024,11:00,40.818977,-73.927124,BRONX,2.0,0.0,0,0,0,0,2,0,4697913,2024-01-24 11:00:00,2024-01-24T11:00,2024,1,5.3,0.1,Drizzle
11/03/2024,0:00,40.86788,-73.893,BRONX,1.0,0.0,1,0,0,0,0,0,4768684,2024-11-03 00:00:00,2024-11-03T00:00,2024,11,6.2,0.0,Clear
05/18/2024,20:00,40.88219,-73.85066,BRONX,1.0,0.0,0,0,1,0,0,0,4725697,2024-05-18 20:00:00,2024-05-18T20:00,2024,5,14.9,0.2,Drizzle
09/11/2024,0:00,40.88144,-73.864,BRONX,1.0,0.0,0,0,0,0,0,0,4754945,2024-09-11 00:00:00,2024-09-11T00:00,2024,9,15.2,0.0,Clear
04/26/2024,7:00,40.816833,-73.89568,BRONX,1.0,0.0,0,0,1,0,0,0,4720084,2024-04-26 07:00:00,2024-04-26T07:00,2024,4,6.2,0.0,Clear
01/07/2024,8:00,40.887306,-73.85893,BRONX,1.0,0.0,0,0,0,0,1,0,4693150,2024-01-07 08:00:00,2024-01-07T08:00,2024,1,2.2,0.1,Drizzle
04/06/2024,19:00,40.831924,-73.86616,BRONX,1.0,0.0,0,0,1,0,0,0,4715199,2024-04-06 19:00:00,2024-04-06T19:00,2024,4,6.8,0.0,Clear
02/07/2024,16:00,40.879765,-73.831955,BRONX,1.0,0.0,1,0,0,0,0,0,4702809,2024-02-07 16:00:00,2024-02-07T16:00,2024,2,7.5,0.0,Clear
01/10/2024,16:00,40.878193,-73.86974,BRONX,0.0,0.0,0,0,0,0,0,0,4694493,2024-01-10 16:00:00,2024-01-10T16:00,2024,1,8.0,0.0,Cloudy
01/03/2024,0:00,40.817795,-73.89319,BRONX,4.0,0.0,0,0,0,0,4,0,4692655,2024-01-03 00:00:00,2024-01-03T00:00,2024,1,-1.9,0.0,Cloudy
03/13/2024,15:00,40.869274,-73.886406,BRONX,1.0,0.0,1,0,0,0,0,0,4712665,2024-03-13 15:00:00,2024-03-13T15:00,2024,3,14.7,0.0,Clear
08/14/2024,20:00,40.88271,-73.881256,BRONX,1.0,0.0,1,0,0,0,0,0,4750692,2024-08-14 20:00:00,2024-08-14T20:00,2024,8,21.3,0.0,Clear
12/14/2024,9:00,40.87829,-73.870056,BRONX,1.0,0.0,0,0,0,0,1,0,4780691,2024-12-14 09:00:00,2024-12-14T09:00,2024,12,-3.8,0.0,Clear
08/06/2024,10:00,40.82384,-73.89188,BRONX,1.0,0.0,0,0,1,0,0,0,4747369,2024-08-06 10:00:00,2024-08-06T10:00,2024,8,30.0,0.2,Drizzle
06/26/2024,13:00,40.883575,-73.86281,BRONX,1.0,0.0,0,0,0,0,1,0,4737376,2024-06-26 13:00:00,2024-06-26T13:00,2024,6,33.9,0.0,Cloudy
10/16/2024,14:00,40.847404,-73.90481,BRONX,0.0,0.0,0,0,0,0,0,0,4766040,2024-10-16 14:00:00,2024-10-16T14:00,2024,10,14.7,0.0,Cloudy
07/24/2024,11:00,40.87038,-73.88689,BRONX,1.0,0.0,0,0,0,0,1,0,4743966,2024-07-24 11:00:00,2024-07-24T11:00,2024,7,24.0,0.1,Drizzle
07/07/2024,19:00,40.895103,-73.85642,BRONX,1.0,0.0,0,0,0,0,0,0,4739258,2024-07-07 19:00:00,2024-07-07T19:00,2024,7,27.6,0.0,Clear
05/09/2024,0:00,40.812634,-73.88313,BRONX,1.0,0.0,0,0,0,0,1,0,4725085,2024-05-09 00:00:00,2024-05-09T00:00,2024,5,15.2,0.0,Cloudy
09/02/2024,16:00,40.863247,-73.865486,BRONX,1.0,0.0,0,0,0,0,1,0,4752818,2024-09-02 16:00:00,2024-09-02T16:00,2024,9,24.7,0.0,Clear
08/05/2024,17:00,40.849228,-73.87118,BRONX,1.0,0.0,0,0,0,0,1,0,4745929,2024-08-05 17:00:00,2024-08-05T17:00,2024,8,29.0,0.0,Cloudy
06/14/2024,12:00,40.8604,-73.90705,BRONX,1.0,0.0,0,0,0,0,1,0,4733126,2024-06-14 12:00:00,2024-06-14T12:00,2024,6,28.2,0.0,Cloudy
12/18/2024,16:00,40.86029,-73.84343,BRONX,1.0,0.0,0,0,0,0,0,0,4780361,2024-12-18 16:00:00,2024-12-18T16:00,2024,12,8.5,0.0,Cloudy
09/06/2024,19:00,40.879948,-73.82339,BRONX,1.0,0.0,0,0,0,0,0,0,4757316,2024-09-06 19:00:00,2024-09-06T19:00,2024,9,21.2,0.0,Clear
01/22/2024,0:00,40.845966,-73.89224,BRONX,1.0,0.0,0,0,1,0,0,0,4697120,2024-01-22 00:00:00,2024-01-22T00:00,2024,1,-5.6,0.0,Clear
08/21/2024,0:00,40.87719,-73.906075,BRONX,1.0,0.0,1,0,0,0,0,0,4750288,2024-08-21 00:00:00,2024-08-21T00:00,2024,8,15.2,0.0,Clear
02/08/2024,19:00,40.81437,-73.896706,BRONX,2.0,0.0,1,0,0,0,1,0,4701480,2024-02-08 19:00:00,2024-02-08T19:00,2024,2,2.1,0.0,Cloudy
12/15/2024,17:00,40.86085,-73.892,BRONX,4.0,0.0,0,0,0,0,4,0,4782918,2024-12-15 17:00:00,2024-12-15T17:00,2024,12,2.0,0.0,Cloudy
10/02/2024,0:00,40.831512,-73.877,BRONX,1.0,0.0,0,0,0,0,1,0,4760678,2024-10-02 00:00:00,2024-10-02T00:00,2024,10,14.2,0.0,Clear
07/28/2024,22:00,40.87934,-73.85999,BRONX,0.0,0.0,0,0,0,0,0,0,4746095,2024-07-28 22:00:00,2024-07-28T22:00,2024,7,21.8,0.0,Cloudy
10/11/2024,0:00,40.8841,-73.829865,BRONX,1.0,0.0,0,0,0,0,1,0,4763129,2024-10-11 00:00:00,2024-10-11T00:00,2024,10,8.3,0.0,Clear
08/18/2024,0:00,40.842236,-73.87175,BRONX,1.0,0.0,0,0,0,0,1,0,4749937,2024-08-18 00:00:00,2024-08-18T00:00,2024,8,21.9,0.1,Drizzle
08/01/2024,8:00,40.845848,-73.868126,BRONX,1.0,0.0,1,0,0,0,0,0,4744760,2024-08-01 08:00:00,2024-08-01T08:00,2024,8,26.9,0.0,Clear
07/21/2024,0:00,40.817795,-73.89319,BRONX,1.0,0.0,0,0,0,0,1,0,4742140,2024-07-21 00:00:00,2024-07-21T00:00,2024,7,23.7,0.0,Cloudy
03/08/2024,0:00,40.861923,-73.89357,BRONX,1.0,0.0,1,0,0,0,0,0,4709480,2024-03-08 00:00:00,2024-03-08T00:00,2024,3,4.2,0.0,Clear
01/02/2024,22:00,40.88874,-73.839836,BRONX,1.0,0.0,1,0,0,0,0,0,4692328,2024-01-02 22:00:00,2024-01-02T22:00,2024,1,-0.2,0.0,Clear
03/15/2024,23:00,40.82386,-73.91941,BRONX,6.0,0.0,0,0,0,0,6,0,4710377,2024-03-15 23:00:00,2024-03-15T23:00,2024,3,7.2,0.0,Clear
09/21/2024,13:00,40.88432,-73.86872,BRONX,1.0,0.0,0,0,0,0,1,0,4757807,2024-09-21 13:00:00,2024-09-21T13:00,2024,9,25.8,0.0,Cloudy
06/18/2024,23:00,40.82794,-73.87904,BRONX,1.0,0.0,0,0,0,0,1,0,4734326,2024-06-18 23:00:00,2024-06-18T23:00,2024,6,22.2,0.0,Cloudy
02/02/2024,23:00,40.810726,-73.92465,BRONX,0.0,0.0,0,0,0,0,0,0,4700730,2024-02-02 23:00:00,2024-02-02T23:00,2024,2,0.7,0.0,Clear
03/30/2024,20:00,40.884815,-73.89971,BRONX,1.0,0.0,0,0,0,0,1,0,4730317,2024-03-30 20:00:00,2024-03-30T20:00,2024,3,11.6,0.0,Cloudy
12/26/2024,19:00,40.831196,-73.8784,BRONX,1.0,0.0,0,0,0,0,1,0,4784445,2024-12-26 19:00:00,2024-12-26T19:00,2024,12,-4.9,0.0,Clear
05/31/2024,0:00,40.899628,-73.84435,BRONX,1.0,0.0,0,0,0,0,1,0,4731268,2024-05-31 00:00:00,2024-05-31T00:00,2024,5,13.6,0.0,Clear
12/27/2024,9:00,40.876926,-73.85678,BRONX,1.0,0.0,0,0,0,0,1,0,4782118,2024-12-27 09:00:00,2024-12-27T09:00,2024,12,-5.6,0.0,Cloudy
05/03/2024,12:00,40.875313,-73.85097,BRONX,1.0,0.0,1,0,0,0,0,0,4722070,2024-05-03 12:00:00,2024-05-03T12:00,2024,5,15.6,0.0,Cloudy
06/26/2024,12:00,40.85527,-73.84383,BRONX,1.0,0.0,0,0,0,0,1,0,4735894,2024-06-26 12:00:00,2024-06-26T12:00,2024,6,33.4,0.0,Cloudy
06/21/2024,13:00,40.89487,-73.85657,BRONX,1.0,0.0,1,0,0,0,0,0,4734926,2024-06-21 13:00:00,2024-06-21T13:00,2024,6,34.5,0.0,Cloudy
03/06/2024,20:00,40.8278,-73.865425,BRONX,1.0,0.0,1,0,0,0,0,0,4707756,2024-03-06 20:00:00,2024-03-06T20:00,2024,3,7.1,4.2,Heavy Rain
11/12/2024,13:00,40.840343,-73.86725,BRONX,1.0,0.0,0,0,0,0,1,0,4771313,2024-11-12 13:00:00,2024-11-12T13:00,2024,11,10.9,0.0,Clear
03/06/2024,20:00,40.880474,-73.91064,BRONX,1.0,0.0,0,0,1,0,0,0,4707990,2024-03-06 20:00:00,2024-03-06T20:00,2024,3,7.1,4.3,Heavy Rain
12/09/2024,12:00,40.854588,-73.90186,BRONX,1.0,0.0,1,0,0,0,0,0,4778430,2024-12-09 12:00:00,2024-12-09T12:00,2024,12,10.0,0.0,Cloudy
08/05/2024,8:00,40.8705,-73.870575,BRONX,2.0,0.0,0,0,0,0,2,0,4745924,2024-08-05 08:00:00,2024-08-05T08:00,2024,8,25.9,0.0,Clear
09/01/2024,0:00,40.850018,-73.9107,BRONX,1.0,0.0,0,0,0,0,0,0,4752399,2024-09-01 00:00:00,2024-09-01T00:00,2024,9,21.3,0.0,Cloudy
08/02/2024,7:00,40.862946,-73.85344,BRONX,1.0,0.0,0,0,0,0,1,0,4745075,2024-08-02 07:00:00,2024-08-02T07:00,2024,8,25.8,0.0,Clear
09/03/2024,5:00,40.842537,-73.88531,BRONX,2.0,0.0,0,0,0,0,2,0,4753510,2024-09-03 05:00:00,2024-09-03T05:00,2024,9,12.3,0.0,Clear
08/26/2024,17:00,40.815754,-73.89529,BRONX,1.0,0.0,0,0,0,0,1,0,4751058,2024-08-26 17:00:00,2024-08-26T17:00,2024,8,22.4,0.8,Drizzle
05/19/2024,6:00,40.83299,-73.8176,BRONX,0.0,0.0,0,0,0,0,0,0,4726911,2024-05-19 06:00:00,2024-05-19T06:00,2024,5,13.7,0.0,Cloudy
10/25/2024,22:00,40.88997,-73.8435,BRONX,1.0,0.0,0,0,0,0,1,0,4769018,2024-10-25 22:00:00,2024-10-25T22:00,2024,10,12.1,0.0,Clear
01/22/2024,0:00,40.84047,-73.886116,BRONX,2.0,0.0,0,0,0,0,2,0,4697322,2024-01-22 00:00:00,2024-01-22T00:00,2024,1,-5.8,0.0,Clear
11/02/2024,14:00,40.883686,-73.82964,BRONX,1.0,0.0,0,0,0,0,1,0,4770012,2024-11-02 14:00:00,2024-11-02T14:00,2024,11,15.5,0.0,Clear
04/29/2024,11:00,40.845287,-73.858665,BRONX,1.0,0.0,0,0,0,0,1,0,4720720,2024-04-29 11:00:00,2024-04-29T11:00,2024,4,25.8,0.0,Clear
02/05/2024,0:00,40.81979,-73.87995,BRONX,1.0,0.0,0,0,0,0,1,0,4701683,2024-02-05 00:00:00,2024-02-05T00:00,2024,2,-1.6,0.0,Clear
02/25/2024,2:00,40.84446,-73.90416,BRONX,1.0,0.0,1,0,0,0,0,0,4704779,2024-02-25 02:00:00,2024-02-25T02:00,2024,2,-6.0,0.0,Clear
04/25/2024,17:00,40.8753,-73.86813,BRONX,1.0,0.0,0,0,1,0,0,0,4720634,2024-04-25 17:00:00,2024-04-25T17:00,2024,4,9.3,0.0,Cloudy
11/14/2024,19:00,40.82117,-73.91355,BRONX,0.0,0.0,0,0,0,0,0,0,4772191,2024-11-14 19:00:00,2024-11-14T19:00,2024,11,6.6,0.0,Cloudy
04/01/2024,12:00,40.823467,-73.92447,BRONX,1.0,0.0,0,0,0,0,1,0,4714096,2024-04-01 12:00:00,2024-04-01T12:00,2024,4,8.8,0.6,Drizzle
07/27/2024,23:00,40.815437,-73.924,BRONX,1.0,0.0,0,0,0,0,1,0,4746352,2024-07-27 23:00:00,2024-07-27T23:00,2024,7,21.4,0.0,Clear
04/30/2024,5:00,40.800114,-73.875496,BRONX,1.0,0.0,0,0,0,0,1,0,4724277,2024-04-30 05:00:00,2024-04-30T05:00,2024,4,11.5,0.0,Cloudy
08/10/2024,0:00,40.8617,-73.89139,BRONX,1.0,0.0,1,0,0,0,0,0,4747298,2024-08-10 00:00:00,2024-08-10T00:00,2024,8,23.0,1.6,Light Rain
10/27/2024,0:00,40.851315,-73.91728,BRONX,1.0,0.0,1,0,0,0,0,0,4767035,2024-10-27 00:00:00,2024-10-27T00:00,2024,10,9.1,0.0,Cloudy
07/09/2024,8:00,40.868004,-73.88425,BRONX,1.0,0.0,1,0,0,0,0,0,4739221,2024-07-09 08:00:00,2024-07-09T08:00,2024,7,26.2,0.0,Cloudy
09/26/2024,23:00,40.83393,-73.905426,BRONX,1.0,0.0,0,0,0,0,1,0,4759787,2024-09-26 23:00:00,2024-09-26T23:00,2024,9,21.1,0.0,Cloudy
08/05/2024,0:00,40.86543,-73.86737,BRONX,1.0,0.0,1,0,0,0,0,0,4746076,2024-08-05 00:00:00,2024-08-05T00:00,2024,8,23.0,0.0,Clear
11/05/2024,17:00,40.87742,-73.866,BRONX,1.0,0.0,1,0,0,0,0,0,4769217,2024-11-05 17:00:00,2024-11-05T17:00,2024,11,19.4,0.0,Clear
04/15/2024,0:00,40.848644,-73.866875,BRONX,1.0,0.0,0,0,0,0,1,0,4717639,2024-04-15 00:00:00,2024-04-15T00:00,2024,4,15.1,0.0,Cloudy
11/08/2024,11:00,40.843826,-73.89249,BRONX,1.0,0.0,1,0,0,0,0,0,4770456,2024-11-08 11:00:00,2024-11-08T11:00,2024,11,16.8,0.0,Clear
02/04/2024,14:00,40.842915,-73.84949,BRONX,1.0,0.0,0,0,0,0,1,0,4700216,2024-02-04 14:00:00,2024-02-04T14:00,2024,2,7.0,0.0,Clear
03/07/2024,20:00,40.85809,-73.901924,BRONX,0.0,0.0,0,0,0,0,0,0,4712948,2024-03-07 20:00:00,2024-03-07T20:00,2024,3,7.8,0.0,Cloudy
04/09/2024,18:00,40.82805,-73.911285,BRONX,1.0,0.0,1,0,0,0,0,0,4716129,2024-04-09 18:00:00,2024-04-09T18:00,2024,4,14.6,0.0,Cloudy
11/23/2024,19:00,40.867474,-73.8974,BRONX,1.0,0.0,1,0,0,0,0,0,4774688,2024-11-23 19:00:00,2024-11-23T19:00,2024,11,6.3,0.0,Cloudy
09/15/2024,0:00,40.824654,-73.89194,BRONX,1.0,0.0,1,0,0,0,0,0,4756276,2024-09-15 00:00:00,2024-09-15T00:00,2024,9,17.7,0.0,Clear
03/06/2024,20:00,40.865974,-73.89859,BRONX,1.0,0.0,0,0,0,0,1,0,4707734,2024-03-06 20:00:00,2024-03-06T20:00,2024,3,7.0,4.3,Heavy Rain
08/09/2024,6:00,40.830135,-73.891884,BRONX,1.0,0.0,1,0,0,0,0,0,4747936,2024-08-09 06:00:00,2024-08-09T06:00,2024,8,22.5,0.3,Drizzle
06/14/2024,12:00,40.82186,-73.88834,BRONX,1.0,0.0,0,0,0,0,0,0,4732709,2024-06-14 12:00:00,2024-06-14T12:00,2024,6,28.4,0.0,Cloudy
10/24/2024,18:00,40.8344,-73.87275,BRONX,0.0,0.0,0,0,0,0,0,0,4766949,2024-10-24 18:00:00,2024-10-24T18:00,2024,10,14.8,0.0,Clear
06/01/2024,18:00,40.867874,-73.86627,BRONX,1.0,0.0,0,0,0,0,1,0,4730230,2024-06-01 18:00:00,2024-06-01T18:00,2024,6,25.1,0.0,Clear
12/03/2024,22:00,40.876926,-73.85678,BRONX,1.0,0.0,0,0,0,0,1,0,4776157,2024-12-03 22:00:00,2024-12-03T22:00,2024,12,-0.7,0.0,Clear
02/19/2024,14:00,40.890144,-73.86357,BRONX,0.0,0.0,0,0,0,0,0,0,4703767,2024-02-19 14:00:00,2024-02-19T14:00,2024,2,3.9,0.0,Clear
01/24/2024,8:00,40.824207,-73.858795,BRONX,1.0,0.0,0,0,0,0,1,0,4697657,2024-01-24 08:00:00,2024-01-24T08:00,2024,1,1.8,0.1,Drizzle
09/01/2024,11:00,40.84434,-73.91475,BRONX,1.0,0.0,0,0,0,0,1,0,4755710,2024-09-01 11:00:00,2024-09-01T11:00,2024,9,25.7,0.3,Drizzle
11/16/2024,23:00,40.851902,-73.91644,BRONX,1.0,0.0,0,0,0,0,1,0,4771927,2024-11-16 23:00:00,2024-11-16T23:00,2024,11,9.5,0.0,Clear
05/17/2024,8:00,40.849075,-73.88289,BRONX,1.0,0.0,0,0,1,0,0,0,4728386,2024-05-17 08:00:00,2024-05-17T08:00,2024,5,17.0,0.0,Cloudy
08/30/2024,14:00,40.88271,-73.881256,BRONX,1.0,0.0,1,0,0,0,0,0,4752319,2024-08-30 14:00:00,2024-08-30T14:00,2024,8,24.5,0.0,Cloudy
11/21/2024,13:00,40.876476,-73.90449,BRONX,1.0,0.0,0,0,0,0,1,0,4777481,2024-11-21 13:00:00,2024-11-21T13:00,2024,11,8.6,0.3,Drizzle
04/24/2024,16:00,40.83349,-73.85145,BRONX,0.0,0.0,0,0,0,0,0,0,4720017,2024-04-24 16:00:00,2024-04-24T16:00,2024,4,18.0,0.0,Clear
08/26/2024,18:00,40.90304,-73.849556,BRONX,1.0,0.0,1,0,0,0,0,0,4750823,2024-08-26 18:00:00,2024-08-26T18:00,2024,8,21.7,0.0,Clear
12/26/2024,0:00,40.832302,-73.86264,BRONX,3.0,0.0,0,0,0,0,3,0,4781731,2024-12-26 00:00:00,2024-12-26T00:00,2024,12,-5.4,0.0,Cloudy
07/07/2024,1:00,40.878284,-73.90803,BRONX,1.0,0.0,1,0,0,0,0,0,4738852,2024-07-07 01:00:00,2024-07-07T01:00,2024,7,23.5,0.0,Clear
09/19/2024,17:00,40.842922,-73.90957,BRONX,1.0,0.0,1,0,0,0,0,0,4757283,2024-09-19 17:00:00,2024-09-19T17:00,2024,9,28.5,0.0,Cloudy
11/04/2024,10:00,40.881104,-73.90676,BRONX,0.0,0.0,0,0,0,0,0,0,4771966,2024-11-04 10:00:00,2024-11-04T10:00,2024,11,11.8,0.0,Cloudy
05/06/2024,7:00,40.87805,-73.83482,BRONX,1.0,0.0,0,0,0,0,1,0,4722906,2024-05-06 07:00:00,2024-05-06T07:00,2024,5,13.1,0.0,Cloudy
06/12/2024,7:00,40.82317,-73.9275,BRONX,1.0,0.0,1,0,0,0,0,0,4732186,2024-06-12 07:00:00,2024-06-12T07:00,2024,6,17.7,0.0,Clear
04/24/2024,18:00,40.85106,-73.84969,BRONX,2.0,0.0,0,0,0,0,2,0,4720013,2024-04-24 18:00:00,2024-04-24T18:00,2024,4,14.9,0.0,Clear
07/05/2024,17:00,40.82444,-73.843,BRONX,1.0,0.0,1,0,0,0,0,0,4739924,2024-07-05 17:00:00,2024-07-05T17:00,2024,7,25.4,8.2,Heavy Rain
01/17/2024,19:00,40.87379,-73.87669,BRONX,1.0,0.0,1,0,0,0,0,0,4696138,2024-01-17 19:00:00,2024-01-17T19:00,2024,1,-5.9,0.0,Clear
07/03/2024,11:00,40.840225,-73.91769,BRONX,1.0,0.0,1,0,0,0,0,0,4739279,2024-07-03 11:00:00,2024-07-03T11:00,2024,7,27.7,0.0,Clear
03/30/2024,2:00,40.8262,-73.821686,BRONX,3.0,0.0,0,0,0,0,3,0,4713755,2024-03-30 02:00:00,2024-03-30T02:00,2024,3,3.2,0.0,Cloudy
07/20/2024,17:00,40.84045,-73.873886,BRONX,2.0,0.0,1,0,0,0,1,0,4742873,2024-07-20 17:00:00,2024-07-20T17:00,2024,7,27.3,0.0,Cloudy
08/23/2024,10:00,40.834595,-73.861015,BRONX,1.0,0.0,1,0,0,0,0,0,4750064,2024-08-23 10:00:00,2024-08-23T10:00,2024,8,24.8,0.0,Clear
08/02/2024,14:00,40.828102,-73.88524,BRONX,1.0,0.0,0,0,1,0,0,0,4746290,2024-08-02 14:00:00,2024-08-02T14:00,2024,8,31.2,0.0,Cloudy
05/13/2024,13:00,40.8518,-73.909225,BRONX,1.0,0.0,0,0,0,0,1,0,4725121,2024-05-13 13:00:00,2024-05-13T13:00,2024,5,18.5,0.0,Cloudy
07/16/2024,0:00,40.844177,-73.90292,BRONX,0.0,0.0,0,0,0,0,0,0,4744119,2024-07-16 00:00:00,2024-07-16T00:00,2024,7,26.0,0.0,Clear
12/07/2024,18:00,40.86551,-73.86352,BRONX,1.0,0.0,1,0,0,0,0,0,4777913,2024-12-07 18:00:00,2024-12-07T18:00,2024,12,2.1,0.0,Cloudy
11/01/2024,22:00,40.87123,-73.85603,BRONX,1.0,0.0,0,0,0,0,1,0,4770000,2024-11-01 22:00:00,2024-11-01T22:00,2024,11,14.6,0.0,Clear
09/04/2024,18:00,40.8499,-73.91806,BRONX,1.0,0.0,1,0,0,0,0,0,4754163,2024-09-04 18:00:00,2024-09-04T18:00,2024,9,20.5,0.0,Clear
02/05/2024,16:00,40.87739,-73.8665,BRONX,5.0,0.0,0,0,0,0,5,0,4702551,2024-02-05 16:00:00,2024-02-05T16:00,2024,2,5.2,0.0,Clear
12/29/2024,0:00,40.876183,-73.85445,BRONX,1.0,0.0,0,0,1,0,0,0,4783787,2024-12-29 00:00:00,2024-12-29T00:00,2024,12,5.6,0.0,Cloudy
09/12/2024,15:00,40.84796,-73.91444,BRONX,1.0,0.0,1,0,0,0,0,0,4755249,2024-09-12 15:00:00,2024-09-12T15:00,2024,9,25.8,0.0,Clear
02/25/2024,20:00,40.85487,-73.88619,BRONX,1.0,0.0,0,0,0,0,1,0,4705504,2024-02-25 20:00:00,2024-02-25T20:00,2024,2,-0.7,0.0,Cloudy
01/26/2024,16:00,40.8919,-73.85265,BRONX,1.0,0.0,0,0,0,0,1,0,4698347,2024-01-26 16:00:00,2024-01-26T16:00,2024,1,7.3,0.0,Cloudy
03/17/2024,15:00,40.881363,-73.90939,BRONX,1.0,0.0,0,0,0,0,1,0,4710848,2024-03-17 15:00:00,2024-03-17T15:00,2024,3,14.6,0.0,Clear
09/02/2024,21:00,40.89708,-73.8547,BRONX,0.0,0.0,0,0,0,0,0,0,4752508,2024-09-02 21:00:00,2024-09-02T21:00,2024,9,18.4,0.0,Clear
10/02/2024,16:00,40.868008,-73.84073,BRONX,0.0,0.0,0,0,0,0,0,0,4761189,2024-10-02 16:00:00,2024-10-02T16:00,2024,10,18.9,0.0,Cloudy
10/03/2024,10:00,40.82881,-73.90828,BRONX,0.0,0.0,0,0,0,0,0,0,4760880,2024-10-03 10:00:00,2024-10-03T10:00,2024,10,20.2,0.0,Cloudy
12/17/2024,9:00,40.87226,-73.900154,BRONX,0.0,0.0,0,0,0,0,0,0,4779668,2024-12-17 09:00:00,2024-12-17T09:00,2024,12,10.4,0.0,Cloudy
04/19/2024,18:00,40.845642,-73.90211,BRONX,1.0,0.0,0,0,0,0,1,0,4719393,2024-04-19 18:00:00,2024-04-19T18:00,2024,4,9.7,0.0,Cloudy
08/17/2024,0:00,40.834644,-73.8709,BRONX,2.0,0.0,0,0,0,0,2,0,4748625,2024-08-17 00:00:00,2024-08-17T00:00,2024,8,21.0,0.0,Clear
05/24/2024,12:00,40.658577,-73.89063,BROOKLYN,2.0,0.0,0,0,0,0,2,0,4727359,2024-05-24 12:00:00,2024-05-24T12:00,2024,5,27.8,0.0,Clear
12/12/2024,0:00,40.641716,-73.936104,BROOKLYN,1.0,0.0,1,0,0,0,0,0,4780084,2024-12-12 00:00:00,2024-12-12T00:00,2024,12,5.2,0.0,Clear
11/27/2024,12:00,40.675438,-73.97796,BROOKLYN,1.0,0.0,1,0,0,0,0,0,4774556,2024-11-27 12:00:00,2024-11-27T12:00,2024,11,9.1,0.0,Clear
03/22/2024,23:00,40.60518,-73.98018,BROOKLYN,3.0,0.0,0,0,0,0,3,0,4711743,2024-03-22 23:00:00,2024-03-22T23:00,2024,3,4.3,0.0,Cloudy
03/27/2024,16:00,40.663776,-73.889915,BROOKLYN,4.0,0.0,0,0,0,0,4,0,4713131,2024-03-27 16:00:00,2024-03-27T16:00,2024,3,11.1,0.0,Cloudy
05/28/2024,20:00,40.667313,-73.87451,BROOKLYN,1.0,0.0,0,0,0,0,1,0,4728584,2024-05-28 20:00:00,2024-05-28T20:00,2024,5,20.2,0.1,Drizzle
12/17/2024,16:00,40.680008,-73.89031,BROOKLYN,1.0,0.0,1,0,0,0,0,0,4780715,2024-12-17 16:00:00,2024-12-17T16:00,2024,12,13.9,0.0,Clear
01/12/2024,15:00,40.66618,-73.95669,BROOKLYN,1.0,0.0,1,0,0,0,0,0,4694684,2024-01-12 15:00:00,2024-01-12T15:00,2024,1,6.7,0.0,Cloudy
02/27/2024,13:00,40.69024,-73.99437,BROOKLYN,1.0,0.0,0,0,0,0,1,0,4705574,2024-02-27 13:00:00,2024-02-27T13:00,2024,2,11.4,0.0,Cloudy
07/06/2024,0:00,40.599907,-73.94664,BROOKLYN,3.0,0.0,0,0,0,0,3,0,4738571,2024-07-06 00:00:00,2024-07-06T00:00,2024,7,22.4,0.0,Cloudy
01/12/2024,12:00,40.65637,-73.94832,BROOKLYN,1.0,0.0,0,0,0,0,1,0,4694685,2024-01-12 12:00:00,2024-01-12T12:00,2024,1,7.5,0.0,Cloudy
06/24/2024,0:00,40.6646,-73.89502,BROOKLYN,0.0,0.0,0,0,0,0,0,0,4735272,2024-06-24 00:00:00,2024-06-24T00:00,2024,6,26.4,0.0,Clear
12/09/2024,13:00,40.68609,-73.98266,BROOKLYN,1.0,0.0,0,0,0,0,1,0,4778815,2024-12-09 13:00:00,2024-12-09T13:00,2024,12,10.8,0.3,Drizzle
12/06/2024,11:00,40.695065,-73.986374,BROOKLYN,0.0,0.0,0,0,0,0,0,0,4776964,2024-12-06 11:00:00,2024-12-06T11:00,2024,12,-0.7,0.0,Cloudy
11/17/2024,11:00,40.605515,-73.95463,BROOKLYN,0.0,0.0,0,0,0,0,0,0,4772433,2024-11-17 11:00:00,2024-11-17T11:00,2024,11,14.0,0.0,Cloudy
03/30/2024,21:00,40.606556,-73.973625,BROOKLYN,1.0,0.0,0,0,0,0,0,0,4713708,2024-03-30 21:00:00,2024-03-30T21:00,2024,3,9.6,0.1,Drizzle
03/26/2024,0:00,40.65766,-73.89705,BROOKLYN,3.0,0.0,0,0,0,0,3,0,4712909,2024-03-26 00:00:00,2024-03-26T00:00,2024,3,2.2,0.0,Clear
12/08/2024,6:00,40.660595,-73.91133,BROOKLYN,1.0,0.0,0,0,0,0,1,0,4777572,2024-12-08 06:00:00,2024-12-08T06:00,2024,12,3.5,0.0,Cloudy
09/22/2024,23:00,40.66475,-73.89405,BROOKLYN,1.0,0.0,0,0,0,0,1,0,4758361,2024-09-22 23:00:00,2024-09-22T23:00,2024,9,16.3,0.0,Clear
11/08/2024,9:00,40.654316,-73.92216,BROOKLYN,1.0,0.0,0,0,0,0,1,0,4770043,2024-11-08 09:00:00,2024-11-08T09:00,2024,11,12.3,0.0,Clear
10/16/2024,15:00,40.65621,-73.914665,BROOKLYN,1.0,0.0,0,0,0,0,0,0,4765949,2024-10-16 15:00:00,2024-10-16T15:00,2024,10,15.6,0.0,Clear
07/06/2024,0:00,40.650288,-73.9978,BROOKLYN,1.0,0.0,0,0,0,0,1,0,4738709,2024-07-06 00:00:00,2024-07-06T00:00,2024,7,23.0,0.0,Cloudy
02/27/2024,15:00,40.6442,-73.96595,BROOKLYN,1.0,0.0,0,0,0,0,0,0,4705568,2024-02-27 15:00:00,2024-02-27T15:00,2024,2,11.8,0.0,Cloudy
02/23/2024,15:00,40.68419,-73.8703,BROOKLYN,1.0,0.0,0,0,1,0,0,0,4704960,2024-02-23 15:00:00,2024-02-23T15:00,2024,2,8.3,0.1,Drizzle
09/24/2024,10:00,40.70455,-73.91662,BROOKLYN,0.0,0.0,0,0,0,0,0,0,4758971,2024-09-24 10:00:00,2024-09-24T10:00,2024,9,18.1,0.0,Cloudy
03/18/2024,14:00,40.663303,-73.960625,BROOKLYN,1.0,0.0,0,0,0,0,1,0,4711600,2024-03-18 14:00:00,2024-03-18T14:00,2024,3,8.7,0.0,Cloudy
04/15/2024,8:00,40.645615,-74.02056,BROOKLYN,0.0,0.0,0,0,0,0,0,0,4717723,2024-04-15 08:00:00,2024-04-15T08:00,2024,4,18.1,0.0,Cloudy
01/28/2024,15:00,40.66425,-73.922104,BROOKLYN,1.0,0.0,0,0,0,0,0,0,4699371,2024-01-28 15:00:00,2024-01-28T15:00,2024,1,3.4,0.8,Drizzle
01/24/2024,8:00,40.7012,-73.93992,BROOKLYN,1.0,0.0,1,0,0,0,0,0,4699041,2024-01-24 08:00:00,2024-01-24T08:00,2024,1,3.1,0.2,Drizzle
02/29/2024,13:00,40.641212,-73.96444,BROOKLYN,1.0,0.0,1,0,0,0,0,0,4706470,2024-02-29 13:00:00,2024-02-29T13:00,2024,2,3.3,0.0,Cloudy
04/14/2024,18:00,40.681206,-73.972786,BROOKLYN,1.0,0.0,1,0,0,0,0,0,4717551,2024-04-14 18:00:00,2024-04-14T18:00,2024,4,17.8,0.0,Cloudy
02/15/2024,12:00,40.592518,-73.932625,BROOKLYN,0.0,0.0,0,0,0,0,0,0,4702818,2024-02-15 12:00:00,2024-02-15T12:00,2024,2,1.7,0.0,Cloudy
11/21/2024,17:00,40.620117,-73.93418,BROOKLYN,1.0,0.0,0,0,0,0,1,0,4773300,2024-11-21 17:00:00,2024-11-21T17:00,2024,11,8.6,3.5,Heavy Rain
03/22/2024,0:00,40.577007,-73.99026,BROOKLYN,0.0,0.0,0,0,0,0,0,0,4711972,2024-03-22 00:00:00,2024-03-22T00:00,2024,3,-1.2,0.0,Clear
12/31/2024,22:00,40.67616,-73.96361,BROOKLYN,1.0,0.0,0,0,1,0,0,0,4782958,2024-12-31 22:00:00,2024-12-31T22:00,2024,12,8.5,3.4,Heavy Rain
02/25/2024,0:00,40.639153,-73.99142,BROOKLYN,1.0,0.0,0,0,0,0,0,0,4704902,2024-02-25 00:00:00,2024-02-25T00:00,2024,2,-4.6,0.0,Clear
05/03/2024,20:00,40.659782,-73.882935,BROOKLYN,1.0,0.0,1,0,0,0,0,0,4722035,2024-05-03 20:00:00,2024-05-03T20:00,2024,5,10.5,0.0,Cloudy
11/25/2024,3:00,40.590492,-73.97363,BROOKLYN,1.0,0.0,0,0,0,0,1,0,4773926,2024-11-25 03:00:00,2024-11-25T03:00,2024,11,5.3,0.0,Clear
07/13/2024,0:00,40.704964,-73.928116,BROOKLYN,0.0,0.0,0,0,0,0,0,0,4740349,2024-07-13 00:00:00,2024-07-13T00:00,2024,7,24.1,1.7,Light Rain
08/27/2024,0:00,40.62424,-73.95735,BROOKLYN,1.0,0.0,0,0,0,0,1,0,4751582,2024-08-27 00:00:00,2024-08-27T00:00,2024,8,19.5,0.0,Clear
09/08/2024,17:00,40.710705,-73.95107,BROOKLYN,1.0,0.0,1,0,0,0,0,0,4754155,2024-09-08 17:00:00,2024-09-08T17:00,2024,9,21.2,0.0,Clear
04/15/2024,16:00,40.664112,-73.94777,BROOKLYN,1.0,0.0,1,0,0,0,0,0,4717462,2024-04-15 16:00:00,2024-04-15T16:00,2024,4,22.8,0.0,Clear
12/06/2024,7:00,40.70047,-73.934525,BROOKLYN,0.0,0.0,0,0,0,0,0,0,4776921,2024-12-06 07:00:00,2024-12-06T07:00,2024,12,-1.7,0.0,Cloudy
03/07/2024,19:00,40.629654,-73.96509,BROOKLYN,1.0,0.0,1,0,0,0,0,0,4708263,2024-03-07 19:00:00,2024-03-07T19:00,2024,3,10.6,0.0,Cloudy
04/26/2024,18:00,40.586384,-73.95499,BROOKLYN,1.0,0.0,0,0,0,0,1,0,4720625,2024-04-26 18:00:00,2024-04-26T18:00,2024,4,9.1,0.0,Clear
05/31/2024,15:00,40.61901,-73.92588,BROOKLYN,1.0,0.0,1,0,0,0,0,0,4730509,2024-05-31 15:00:00,2024-05-31T15:00,2024,5,23.1,0.0,Cloudy
02/14/2024,19:00,40.594852,-73.95566,BROOKLYN,1.0,0.0,1,0,0,0,0,0,4708596,2024-02-14 19:00:00,2024-02-14T19:00,2024,2,-1.5,0.0,Clear
04/23/2024,17:00,40.7145,-73.957565,BROOKLYN,1.0,0.0,0,0,1,0,0,0,4719768,2024-04-23 17:00:00,2024-04-23T17:00,2024,4,10.8,0.0,Cloudy
03/14/2024,12:00,40.704124,-73.93757,BROOKLYN,0.0,0.0,0,0,0,0,0,0,4710396,2024-03-14 12:00:00,2024-03-14T12:00,2024,3,19.8,0.0,Clear
06/02/2024,18:00,40.627968,-73.97121,BROOKLYN,0.0,0.0,0,0,0,0,0,0,4730977,2024-06-02 18:00:00,2024-06-02T18:00,2024,6,22.3,0.0,Cloudy
04/29/2024,9:00,40.64381,-73.983986,BROOKLYN,0.0,0.0,0,0,0,0,0,0,4720675,2024-04-29 09:00:00,2024-04-29T09:00,2024,4,23.2,0.0,Cloudy
07/10/2024,17:00,40.626976,-73.914024,BROOKLYN,3.0,0.0,0,0,0,0,3,0,4739785,2024-07-10 17:00:00,2024-07-10T17:00,2024,7,26.8,0.0,Clear
01/09/2024,0:00,40.615448,-73.98875,BROOKLYN,0.0,0.0,0,0,0,0,0,0,4694324,2024-01-09 00:00:00,2024-01-09T00:00,2024,1,-0.3,0.0,Clear
07/11/2024,23:00,40.63701,-73.91495,BROOKLYN,2.0,0.0,0,0,0,0,2,0,4741084,2024-07-11 23:00:00,2024-07-11T23:00,2024,7,24.0,0.0,Clear
09/24/2024,14:00,40.67247,-73.90083,BROOKLYN,0.0,0.0,0,0,0,0,0,0,4773698,2024-09-24 14:00:00,2024-09-24T14:00,2024,9,19.9,0.0,Cloudy
05/14/2024,15:00,40.59651,-73.90788,BROOKLYN,1.0,0.0,0,0,0,0,1,0,4725227,2024-05-14 15:00:00,2024-05-14T15:00,2024,5,17.2,0.1,Drizzle
09/18/2024,8:00,40.665627,-73.909706,BROOKLYN,1.0,0.0,1,0,0,0,0,0,4757082,2024-09-18 08:00:00,2024-09-18T08:00,2024,9,20.5,0.0,Cloudy
06/14/2024,0:00,40.70547,-73.95024,BROOKLYN,1.0,0.0,0,0,0,0,1,0,4733730,2024-06-14 00:00:00,2024-06-14T00:00,2024,6,20.7,0.0,Clear
06/26/2024,0:00,40.637936,-73.983376,BROOKLYN,1.0,0.0,1,0,0,0,0,0,4735889,2024-06-26 00:00:00,2024-06-26T00:00,2024,6,24.6,0.0,Cloudy
05/27/2024,2:00,40.66777,-73.86049,BROOKLYN,1.0,0.0,1,0,0,0,0,0,4728275,2024-05-27 02:00:00,2024-05-27T02:00,2024,5,16.5,0.1,Drizzle
10/24/2024,0:00,40.652447,-73.925446,BROOKLYN,3.0,0.0,0,0,0,0,3,0,4766635,2024-10-24 00:00:00,2024-10-24T00:00,2024,10,15.6,0.0,Clear
02/01/2024,20:00,40.671803,-73.99957,BROOKLYN,1.0,0.0,0,0,0,0,1,0,4699514,2024-02-01 20:00:00,2024-02-01T20:00,2024,2,3.9,0.0,Cloudy
01/10/2024,20:00,40.634483,-73.91886,BROOKLYN,1.0,0.0,1,0,0,0,0,0,4694079,2024-01-10 20:00:00,2024-01-10T20:00,2024,1,6.8,0.0,Clear
11/06/2024,20:00,40.60195,-73.99381,BROOKLYN,1.0,0.0,0,0,1,0,0,0,4770317,2024-11-06 20:00:00,2024-11-06T20:00,2024,11,22.0,0.0,Clear
09/29/2024,15:00,40.58382,-73.970856,BROOKLYN,1.0,0.0,0,0,0,0,1,0,4760142,2024-09-29 15:00:00,2024-09-29T15:00,2024,9,19.2,0.0,Cloudy
05/15/2024,13:00,40.57799,-73.9872,BROOKLYN,0.0,0.0,0,0,0,0,0,0,4727051,2024-05-15 13:00:00,2024-05-15T13:00,2024,5,17.7,0.2,Drizzle
08/16/2024,2:00,40.61578,-73.99995,BROOKLYN,1.0,0.0,0,0,0,0,1,0,4749561,2024-08-16 02:00:00,2024-08-16T02:00,2024,8,20.9,0.0,Clear
01/04/2024,14:00,40.603573,-73.99653,BROOKLYN,1.0,0.0,0,0,0,0,1,0,4692958,2024-01-04 14:00:00,2024-01-04T14:00,2024,1,6.7,0.0,Cloudy
08/13/2024,18:00,40.700123,-73.947136,BROOKLYN,1.0,0.0,1,0,0,0,0,0,4749727,2024-08-13 18:00:00,2024-08-13T18:00,2024,8,25.9,0.0,Clear
11/21/2024,19:00,40.662052,-73.93148,BROOKLYN,1.0,0.0,1,0,0,0,0,0,4774183,2024-11-21 19:00:00,2024-11-21T19:00,2024,11,7.0,4.5,Heavy Rain
03/18/2024,15:00,40.611286,-73.920204,BROOKLYN,2.0,0.0,0,0,0,0,2,0,4710685,2024-03-18 15:00:00,2024-03-18T15:00,2024,3,9.1,0.0,Cloudy
04/20/2024,22:00,40.638382,-73.98863,BROOKLYN,8.0,0.0,0,0,0,0,8,0,4718929,2024-04-20 22:00:00,2024-04-20T22:00,2024,4,8.4,0.0,Clear
07/07/2024,12:00,40.64982,-73.88673,BROOKLYN,0.0,0.0,0,0,0,0,0,0,4738515,2024-07-07 12:00:00,2024-07-07T12:00,2024,7,30.4,0.2,Drizzle
07/03/2024,12:00,40.69889,-73.91753,BROOKLYN,2.0,0.0,2,0,0,0,0,0,4737619,2024-07-03 12:00:00,2024-07-03T12:00,2024,7,26.2,0.0,Cloudy
08/29/2024,18:00,40.63714,-74.00426,BROOKLYN,0.0,0.0,0,0,0,0,0,0,4751708,2024-08-29 18:00:00,2024-08-29T18:00,2024,8,22.0,0.0,Cloudy
01/11/2024,8:00,40.659832,-73.897606,BROOKLYN,1.0,0.0,0,0,0,0,1,0,4694962,2024-01-11 08:00:00,2024-01-11T08:00,2024,1,3.1,0.0,Clear
12/13/2024,14:00,40.70826,-73.91996,BROOKLYN,1.0,0.0,0,0,0,0,1,0,4778679,2024-12-13 14:00:00,2024-12-13T14:00,2024,12,0.2,0.0,Clear
12/24/2024,16:00,40.642384,-73.925385,BROOKLYN,1.0,0.0,0,0,0,0,1,0,4782157,2024-12-24 16:00:00,2024-12-24T16:00,2024,12,0.5,0.0,Clear
09/11/2024,12:00,40.61651,-74.02666,BROOKLYN,1.0,0.0,0,0,0,0,1,0,4756911,2024-09-11 12:00:00,2024-09-11T12:00,2024,9,24.3,0.0,Cloudy
03/20/2024,0:00,40.697716,-73.967735,BROOKLYN,1.0,0.0,0,0,1,0,0,0,4712591,2024-03-20 00:00:00,2024-03-20T00:00,2024,3,2.4,0.0,Cloudy
02/21/2024,14:00,40.649193,-73.88768,BROOKLYN,2.0,0.0,0,0,0,0,2,0,4705592,2024-02-21 14:00:00,2024-02-21T14:00,2024,2,4.4,0.0,Cloudy
04/01/2024,21:00,40.65264,-73.949776,BROOKLYN,1.0,0.0,1,0,0,0,0,0,4715285,2024-04-01 21:00:00,2024-04-01T21:00,2024,4,9.2,0.0,Cloudy
03/07/2024,8:00,40.708424,-73.95791,BROOKLYN,0.0,0.0,0,0,0,0,0,0,4709449,2024-03-07 08:00:00,2024-03-07T08:00,2024,3,9.6,0.0,Cloudy
06/04/2024,10:00,40.65836,-73.930084,BROOKLYN,1.0,0.0,0,0,0,0,1,0,4732370,2024-06-04 10:00:00,2024-06-04T10:00,2024,6,22.3,0.0,Clear
10/19/2024,16:00,40.69768,-73.91637,BROOKLYN,1.0,0.0,0,0,1,0,0,0,4767009,2024-10-19 16:00:00,2024-10-19T16:00,2024,10,18.6,0.0,Clear
08/08/2024,14:00,40.72977,-73.95863,BROOKLYN,1.0,0.0,0,0,1,0,0,0,4747047,2024-08-08 14:00:00,2024-08-08T14:00,2024,8,23.2,0.0,Cloudy
11/20/2024,15:00,40.667976,-73.9873,BROOKLYN,0.0,0.0,0,0,0,0,0,0,4775609,2024-11-20 15:00:00,2024-11-20T15:00,2024,11,14.0,0.0,Cloudy
01/12/2024,16:00,40.613895,-74.01051,BROOKLYN,1.0,0.0,0,0,0,0,1,0,4695141,2024-01-12 16:00:00,2024-01-12T16:00,2024,1,6.3,0.0,Cloudy
02/05/2024,19:00,40.635586,-73.91715,BROOKLYN,0.0,0.0,0,0,0,0,0,0,4700943,2024-02-05 19:00:00,2024-02-05T19:00,2024,2,1.4,0.0,Clear
06/07/2024,14:00,40.63465,-73.91232,BROOKLYN,2.0,0.0,0,0,0,0,2,0,4730812,2024-06-07 14:00:00,2024-06-07T14:00,2024,6,27.2,0.0,Cloudy
01/21/2024,0:00,40.61914,-74.008644,BROOKLYN,1.0,0.0,1,0,0,0,0,0,4696564,2024-01-21 00:00:00,2024-01-21T00:00,2024,1,-6.9,0.0,Cloudy
03/05/2024,0:00,40.62893,-73.89039,BROOKLYN,1.0,0.0,0,0,0,0,1,0,4707903,2024-03-05 00:00:00,2024-03-05T00:00,2024,3,6.6,0.0,Cloudy
01/04/2024,13:00,40.668373,-73.92264,BROOKLYN,1.0,0.0,0,0,0,0,0,0,4692906,2024-01-04 13:00:00,2024-01-04T13:00,2024,1,6.6,0.0,Cloudy
09/09/2024,1:00,40.57997,-73.97466,BROOKLYN,1.0,0.0,1,0,0,0,0,0,4755667,2024-09-09 01:00:00,2024-09-09T01:00,2024,9,14.7,0.0,Clear
03/28/2024,14:00,40.68244,-73.924866,BROOKLYN,1.0,0.0,0,0,0,0,1,0,4713565,2024-03-28 14:00:00,2024-03-28T14:00,2024,3,9.9,0.7,Drizzle
05/18/2024,2:00,40.67649,-73.890915,BROOKLYN,1.0,0.0,0,0,0,0,1,0,4725524,2024-05-18 02:00:00,2024-05-18T02:00,2024,5,13.1,0.0,Cloudy
06/22/2024,12:00,40.6762,-73.951775,BROOKLYN,1.0,0.0,0,0,0,0,1,0,4736177,2024-06-22 12:00:00,2024-06-22T12:00,2024,6,31.6,0.0,Cloudy
04/24/2024,0:00,40.588886,-73.965645,BROOKLYN,2.0,0.0,0,0,0,0,2,0,4719601,2024-04-24 00:00:00,2024-04-24T00:00,2024,4,8.9,0.0,Cloudy
10/06/2024,12:00,40.67412,-73.88081,BROOKLYN,1.0,0.0,0,0,1,0,0,0,4761269,2024-10-06 12:00:00,2024-10-06T12:00,2024,10,20.5,0.0,Clear
07/17/2024,13:00,40.68126,-73.91554,BROOKLYN,1.0,0.0,1,0,0,0,0,0,4741028,2024-07-17 13:00:00,2024-07-17T13:00,2024,7,30.2,0.0,Clear
11/19/2024,13:00,40.67122,-73.92388,BROOKLYN,0.0,0.0,0,0,0,0,0,0,4773731,2024-11-19 13:00:00,2024-11-19T13:00,2024,11,13.6,0.0,Cloudy
08/22/2024,13:00,40.72286,-73.93904,BROOKLYN,1.0,0.0,0,0,1,0,0,0,4750833,2024-08-22 13:00:00,2024-08-22T13:00,2024,8,24.1,0.0,Cloudy
12/13/2024,8:00,40.620922,-73.912834,BROOKLYN,1.0,0.0,1,0,0,0,0,0,4779696,2024-12-13 08:00:00,2024-12-13T08:00,2024,12,-2.5,0.0,Clear
03/08/2024,15:00,40.62677,-74.01501,BROOKLYN,1.0,0.0,0,0,0,0,0,0,4708115,2024-03-08 15:00:00,2024-03-08T15:00,2024,3,9.2,0.0,Cloudy
01/18/2024,19:00,40.70005,-73.95032,BROOKLYN,2.0,0.0,0,0,0,0,2,0,4696156,2024-01-18 19:00:00,2024-01-18T19:00,2024,1,-0.9,0.0,Cloudy
07/09/2024,16:00,40.700726,-73.94194,BROOKLYN,1.0,0.0,0,0,1,0,0,0,4740913,2024-07-09 16:00:00,2024-07-09T16:00,2024,7,27.6,0.0,Cloudy
11/01/2024,6:00,40.730988,-73.95126,BROOKLYN,1.0,0.0,0,0,0,0,1,0,4770347,2024-11-01 06:00:00,2024-11-01T06:00,2024,11,19.3,0.0,Cloudy
11/25/2024,0:00,40.651466,-73.93617,BROOKLYN,1.0,0.0,1,0,0,0,0,0,4776162,2024-11-25 00:00:00,2024-11-25T00:00,2024,11,6.4,0.0,Clear
03/21/2024,14:00,40.710938,-73.92671,BROOKLYN,1.0,0.0,0,0,1,0,0,0,4712035,2024-03-21 14:00:00,2024-03-21T14:00,2024,3,5.0,0.0,Clear
09/13/2024,0:00,40.593323,-73.964645,BROOKLYN,1.0,0.0,0,0,1,0,0,0,4755547,2024-09-13 00:00:00,2024-09-13T00:00,2024,9,19.6,0.0,Clear
03/23/2024,21:00,40.692318,-73.98966,BROOKLYN,1.0,0.0,0,0,1,0,0,0,4712033,2024-03-23 21:00:00,2024-03-23T21:00,2024,3,2.6,0.0,Cloudy
06/07/2024,12:00,40.66639,-73.88779,BROOKLYN,0.0,0.0,0,0,0,0,0,0,4731131,2024-06-07 12:00:00,2024-06-07T12:00,2024,6,27.3,0.0,Clear
11/23/2024,12:00,40.634354,-73.94201,BROOKLYN,1.0,0.0,1,0,0,0,0,0,4780522,2024-11-23 12:00:00,2024-11-23T12:00,2024,11,7.4,0.0,Cloudy
07/01/2024,14:00,40.610176,-74.026794,BROOKLYN,0.0,0.0,0,0,0,0,0,0,4738392,2024-07-01 14:00:00,2024-07-01T14:00,2024,7,27.1,0.0,Clear
05/07/2024,7:00,40.698463,-73.960205,BROOKLYN,1.0,0.0,0,0,1,0,0,0,4724161,2024-05-07 07:00:00,2024-05-07T07:00,2024,5,15.3,0.0,Clear
04/16/2024,17:00,40.640835,-73.95014,BROOKLYN,3.0,0.0,0,0,0,0,3,0,4717940,2024-04-16 17:00:00,2024-04-16T17:00,2024,4,19.9,0.0,Clear
09/22/2024,18:00,40.64531,-73.94608,BROOKLYN,1.0,0.0,0,0,0,0,1,0,4758047,2024-09-22 18:00:00,2024-09-22T18:00,2024,9,21.2,0.0,Clear
04/09/2024,7:00,40.636368,-73.88574,BROOKLYN,0.0,0.0,0,0,0,0,0,0,4717792,2024-04-09 07:00:00,2024-04-09T07:00,2024,4,9.1,0.0,Cloudy
05/07/2024,16:00,40.665474,-73.89811,BROOKLYN,1.0,0.0,0,0,0,0,1,0,4725540,2024-05-07 16:00:00,2024-05-07T16:00,2024,5,23.2,0.0,Clear
11/14/2024,21:00,40.72396,-73.94803,BROOKLYN,2.0,0.0,0,0,0,0,2,0,4772185,2024-11-14 21:00:00,2024-11-14T21:00,2024,11,5.4,0.0,Cloudy
06/24/2024,0:00,40.65414,-73.88732,BROOKLYN,0.0,0.0,0,0,0,0,0,0,4735562,2024-06-24 00:00:00,2024-06-24T00:00,2024,6,26.4,0.0,Clear
02/09/2024,10:00,40.68405,-73.97746,BROOKLYN,1.0,0.0,0,0,0,0,1,0,4701905,2024-02-09 10:00:00,2024-02-09T10:00,2024,2,7.4,0.0,Cloudy
08/03/2024,0:00,40.67786,-73.93863,BROOKLYN,2.0,0.0,0,0,0,0,2,0,4745287,2024-08-03 00:00:00,2024-08-03T00:00,2024,8,24.2,0.0,Cloudy
01/15/2024,13:00,40.70064,-73.93647,BROOKLYN,0.0,0.0,0,0,0,0,0,0,4695286,2024-01-15 13:00:00,2024-01-15T13:00,2024,1,-1.3,0.0,Cloudy
10/20/2024,0:00,40.687077,-73.92355,BROOKLYN,1.0,0.0,0,0,1,0,0,0,4764881,2024-10-20 00:00:00,2024-10-20T00:00,2024,10,9.5,0.0,Clear
05/30/2024,13:00,40.619843,-73.93787,BROOKLYN,0.0,0.0,0,0,0,0,0,0,4728943,2024-05-30 13:00:00,2024-05-30T13:00,2024,5,20.7,0.0,Clear
11/24/2024,0:00,40.637337,-74.000465,BROOKLYN,1.0,0.0,0,0,1,0,0,0,4773816,2024-11-24 00:00:00,2024-11-24T00:00,2024,11,7.2,0.0,Clear
12/19/2024,8:00,40.58877,-73.98596,BROOKLYN,1.0,0.0,0,0,0,0,1,0,4779999,2024-12-19 08:00:00,2024-12-19T08:00,2024,12,4.7,0.0,Clear
10/20/2024,20:00,40.609665,-73.96231,BROOKLYN,1.0,0.0,0,0,0,0,1,0,4765634,2024-10-20 20:00:00,2024-10-20T20:00,2024,10,16.0,0.0,Clear
04/01/2024,16:00,40.680355,-73.8834,BROOKLYN,2.0,0.0,0,0,0,0,2,0,4714051,2024-04-01 16:00:00,2024-04-01T16:00,2024,4,11.3,0.0,Cloudy
09/30/2024,22:00,40.71977,-73.96232,BROOKLYN,1.0,0.0,0,0,0,0,0,0,4760691,2024-09-30 22:00:00,2024-09-30T22:00,2024,9,16.0,0.0,Cloudy
08/01/2024,10:00,40.666134,-73.99224,BROOKLYN,1.0,0.0,0,0,1,0,0,0,4745323,2024-08-01 10:00:00,2024-08-01T10:00,2024,8,31.1,0.0,Clear
03/29/2024,0:00,40.644657,-73.95664,BROOKLYN,1.0,0.0,0,0,0,0,1,0,4713431,2024-03-29 00:00:00,2024-03-29T00:00,2024,3,5.1,0.2,Drizzle
06/23/2024,19:00,40.57505,-73.99957,BROOKLYN,0.0,0.0,0,0,0,0,0,0,4735737,2024-06-23 19:00:00,2024-06-23T19:00,2024,6,31.4,0.0,Cloudy
11/22/2024,18:00,40.616516,-73.91624,BROOKLYN,1.0,0.0,1,0,0,0,0,0,4774020,2024-11-22 18:00:00,2024-11-22T18:00,2024,11,4.5,0.6,Drizzle
11/21/2024,0:00,40.64503,-73.919975,BROOKLYN,1.0,0.0,1,0,0,0,0,0,4775118,2024-11-21 00:00:00,2024-11-21T00:00,2024,11,12.3,0.0,Cloudy
09/03/2024,21:00,40.60175,-73.950806,BROOKLYN,1.0,0.0,0,0,1,0,0,0,4753261,2024-09-03 21:00:00,2024-09-03T21:00,2024,9,18.5,0.0,Clear
05/01/2024,16:00,40.59137,-73.93728,BROOKLYN,1.0,0.0,0,0,0,0,1,0,4724067,2024-05-01 16:00:00,2024-05-01T16:00,2024,5,15.7,0.0,Cloudy
07/07/2024,16:00,40.66278,-73.88086,BROOKLYN,2.0,0.0,0,0,0,0,2,0,4739593,2024-07-07 16:00:00,2024-07-07T16:00,2024,7,30.1,0.0,Clear
11/18/2024,17:00,40.697178,-73.94664,BROOKLYN,1.0,0.0,1,0,0,0,0,0,4775551,2024-11-18 17:00:00,2024-11-18T17:00,2024,11,16.2,0.0,Cloudy
06/07/2024,13:00,40.59039,-73.99155,BROOKLYN,3.0,0.0,0,0,0,0,3,0,4732324,2024-06-07 13:00:00,2024-06-07T13:00,2024,6,25.8,0.1,Drizzle
05/02/2024,19:00,40.62492,-73.97843,BROOKLYN,1.0,0.0,1,0,0,0,0,0,4721658,2024-05-02 19:00:00,2024-05-02T19:00,2024,5,22.5,0.0,Clear
10/06/2024,1:00,40.652435,-74.006355,BROOKLYN,1.0,0.0,0,0,1,0,0,0,4761649,2024-10-06 01:00:00,2024-10-06T01:00,2024,10,12.9,0.0,Clear
03/20/2024,9:00,40.651512,-74.00734,BROOKLYN,1.0,0.0,0,0,1,0,0,0,4711608,2024-03-20 09:00:00,2024-03-20T09:00,2024,3,7.1,0.0,Cloudy
07/22/2024,15:00,40.633347,-73.99387,BROOKLYN,1.0,0.0,1,0,0,0,0,0,4742650,2024-07-22 15:00:00,2024-07-22T15:00,2024,7,26.2,0.0,Cloudy
06/21/2024,18:00,40.701077,-73.94043,BROOKLYN,1.0,0.0,1,0,0,0,0,0,4737782,2024-06-21 18:00:00,2024-06-21T18:00,2024,6,25.8,0.0,Cloudy
10/17/2024,23:00,40.67398,-73.899315,BROOKLYN,1.0,0.0,0,0,0,0,1,0,4766224,2024-10-17 23:00:00,2024-10-17T23:00,2024,10,8.2,0.0,Clear
07/20/2024,19:00,40.62143,-74.02299,BROOKLYN,1.0,0.0,0,0,1,0,0,0,4741638,2024-07-20 19:00:00,2024-07-20T19:00,2024,7,25.3,0.0,Cloudy
07/08/2024,11:00,40.650658,-74.018,BROOKLYN,0.0,0.0,0,0,0,0,0,0,4738834,2024-07-08 11:00:00,2024-07-08T11:00,2024,7,31.3,0.0,Cloudy
03/22/2024,14:00,40.68227,-74.00716,BROOKLYN,1.0,0.0,0,0,0,0,1,0,4711658,2024-03-22 14:00:00,2024-03-22T14:00,2024,3,4.4,0.0,Clear
05/05/2024,5:00,40.66545,-73.88939,BROOKLYN,1.0,0.0,0,0,0,0,1,0,4722038,2024-05-05 05:00:00,2024-05-05T05:00,2024,5,9.2,0.1,Drizzle
01/07/2024,18:00,40.625607,-73.96244,BROOKLYN,1.0,0.0,0,0,1,0,0,0,4694909,2024-01-07 18:00:00,2024-01-07T18:00,2024,1,1.7,0.0,Cloudy
10/23/2024,14:00,40.635506,-73.913284,BROOKLYN,3.0,0.0,0,0,0,0,3,0,4766053,2024-10-23 14:00:00,2024-10-23T14:00,2024,10,22.2,0.0,Clear
01/09/2024,22:00,40.642372,-73.957466,BROOKLYN,1.0,0.0,1,0,0,0,0,0,4693910,2024-01-09 22:00:00,2024-01-09T22:00,2024,1,12.6,5.4,Heavy Rain
06/21/2024,0:00,40.661835,-73.893105,BROOKLYN,1.0,0.0,0,0,0,0,1,0,4734895,2024-06-21 00:00:00,2024-06-21T00:00,2024,6,24.4,0.0,Cloudy
10/11/2024,13:00,40.631836,-73.94463,BROOKLYN,1.0,0.0,1,0,0,0,0,0,4764729,2024-10-11 13:00:00,2024-10-11T13:00,2024,10,20.2,0.0,Clear
11/09/2024,2:00,40.590633,-73.94975,BROOKLYN,1.0,0.0,0,0,0,0,1,0,4770323,2024-11-09 02:00:00,2024-11-09T02:00,2024,11,8.8,0.0,Clear
09/20/2024,14:00,40.67374,-73.88341,BROOKLYN,1.0,0.0,0,0,0,0,1,0,4757667,2024-09-20 14:00:00,2024-09-20T14:00,2024,9,27.8,0.0,Clear
06/25/2024,12:00,40.61403,-73.974,BROOKLYN,1.0,0.0,1,0,0,0,0,0,4735684,2024-06-25 12:00:00,2024-06-25T12:00,2024,6,30.9,0.0,Cloudy
09/06/2024,13:00,40.62334,-73.95595,BROOKLYN,1.0,0.0,1,0,0,0,0,0,4754469,2024-09-06 13:00:00,2024-09-06T13:00,2024,9,24.1,0.0,Cloudy
01/25/2024,19:00,40.68342,-73.97552,BROOKLYN,1.0,0.0,0,0,1,0,0,0,4698156,2024-01-25 19:00:00,2024-01-25T19:00,2024,1,8.8,0.0,Cloudy
03/14/2024,14:00,40.67536,-73.969696,BROOKLYN,0.0,0.0,0,0,0,0,0,0,4711245,2024-03-14 14:00:00,2024-03-14T14:00,2024,3,19.4,0.0,Cloudy
11/19/2024,19:00,40.712307,-73.939766,BROOKLYN,1.0,0.0,0,0,0,0,1,0,4772698,2024-11-19 19:00:00,2024-11-19T19:00,2024,11,11.5,0.0,Cloudy
04/28/2024,17:00,40.64544,-73.994484,BROOKLYN,0.0,0.0,0,0,0,0,0,0,4721047,2024-04-28 17:00:00,2024-04-28T17:00,2024,4,15.5,0.0,Cloudy
08/12/2024,20:00,40.61716,-73.96775,BROOKLYN,1.0,0.0,1,0,0,0,0,0,4747433,2024-08-12 20:00:00,2024-08-12T20:00,2024,8,22.1,0.0,Clear
09/05/2024,10:00,40.644253,-73.929596,BROOKLYN,1.0,0.0,0,0,0,0,1,0,4753987,2024-09-05 10:00:00,2024-09-05T10:00,2024,9,23.1,0.0,Clear
05/31/2024,17:00,40.67665,-73.98029,BROOKLYN,1.0,0.0,0,0,0,0,0,0,4729156,2024-05-31 17:00:00,2024-05-31T17:00,2024,5,24.0,0.0,Clear
12/13/2024,0:00,40.653625,-73.9209,BROOKLYN,2.0,0.0,0,0,0,0,2,0,4778695,2024-12-13 00:00:00,2024-12-13T00:00,2024,12,-2.5,0.0,Clear
07/21/2024,0:00,40.651604,-73.933304,BROOKLYN,2.0,0.0,0,0,0,0,2,0,4741974,2024-07-21 00:00:00,2024-07-21T00:00,2024,7,23.5,0.0,Cloudy
11/27/2024,13:00,40.64077,-73.99408,BROOKLYN,1.0,0.0,0,0,0,0,1,0,4774667,2024-11-27 13:00:00,2024-11-27T13:00,2024,11,9.8,0.0,Clear
03/30/2024,19:00,40.70213,-73.936134,BROOKLYN,2.0,0.0,0,0,0,0,2,0,4713788,2024-03-30 19:00:00,2024-03-30T19:00,2024,3,11.5,0.0,Cloudy
03/15/2024,20:00,40.672745,-73.90766,BROOKLYN,1.0,0.0,0,0,1,0,0,0,4710281,2024-03-15 20:00:00,2024-03-15T20:00,2024,3,10.6,0.0,Cloudy
02/28/2024,17:00,40.683018,-73.95885,BROOKLYN,1.0,0.0,0,0,0,0,1,0,4706036,2024-02-28 17:00:00,2024-02-28T17:00,2024,2,14.2,0.7,Drizzle
03/25/2024,7:00,40.702953,-73.91706,BROOKLYN,0.0,0.0,0,0,0,0,0,0,4713093,2024-03-25 07:00:00,2024-03-25T07:00,2024,3,0.6,0.0,Clear
09/13/2024,0:00,40.656258,-73.87813,BROOKLYN,1.0,0.0,0,0,1,0,0,0,4755400,2024-09-13 00:00:00,2024-09-13T00:00,2024,9,18.2,0.0,Clear
10/16/2024,1:00,40.706123,-73.922134,BROOKLYN,1.0,0.0,0,0,0,0,1,0,4764007,2024-10-16 01:00:00,2024-10-16T01:00,2024,10,6.7,0.0,Clear
09/01/2024,11:00,40.701958,-73.9239,BROOKLYN,1.0,0.0,0,0,1,0,0,0,4754609,2024-09-01 11:00:00,2024-09-01T11:00,2024,9,26.5,0.1,Drizzle
09/12/2024,18:00,40.67713,-74.01407,BROOKLYN,0.0,0.0,0,0,0,0,0,0,4755339,2024-09-12 18:00:00,2024-09-12T18:00,2024,9,20.5,0.0,Clear
04/04/2024,21:00,40.637012,-73.92492,BROOKLYN,0.0,0.0,0,0,0,0,0,0,4714928,2024-04-04 21:00:00,2024-04-04T21:00,2024,4,4.4,0.1,Drizzle
07/17/2024,16:00,40.68986,-73.95147,BROOKLYN,1.0,0.0,0,0,0,0,1,0,4742312,2024-07-17 16:00:00,2024-07-17T16:00,2024,7,26.6,19.8,Heavy Rain
06/07/2024,23:00,40.674953,-73.91484,BROOKLYN,1.0,0.0,0,0,0,0,1,0,4731325,2024-06-07 23:00:00,2024-06-07T23:00,2024,6,17.3,0.0,Clear
07/24/2024,11:00,40.687504,-73.91465,BROOKLYN,1.0,0.0,0,0,1,0,0,0,4743068,2024-07-24 11:00:00,2024-07-24T11:00,2024,7,26.2,0.1,Drizzle
12/16/2024,0:00,40.674725,-73.90524,BROOKLYN,0.0,0.0,0,0,0,0,0,0,4780549,2024-12-16 00:00:00,2024-12-16T00:00,2024,12,3.9,0.6,Drizzle
05/25/2024,23:00,40.65591,-73.89191,BROOKLYN,1.0,0.0,0,0,0,0,1,0,4727373,2024-05-25 23:00:00,2024-05-25T23:00,2024,5,15.7,0.0,Cloudy
11/18/2024,0:00,40.660873,-73.90946,BROOKLYN,1.0,0.0,0,0,1,0,0,0,4774557,2024-11-18 00:00:00,2024-11-18T00:00,2024,11,9.5,0.0,Cloudy
06/12/2024,15:00,40.66523,-73.931465,BROOKLYN,0.0,0.0,0,0,0,0,0,0,4732494,2024-06-12 15:00:00,2024-06-12T15:00,2024,6,22.7,0.0,Cloudy
12/05/2024,12:00,40.588886,-73.96564,BROOKLYN,2.0,0.0,0,0,0,0,2,0,4776489,2024-12-05 12:00:00,2024-12-05T12:00,2024,12,4.5,0.0,Clear
01/16/2024,0:00,40.606136,-73.94783,BROOKLYN,1.0,0.0,0,0,0,0,1,0,4695766,2024-01-16 00:00:00,2024-01-16T00:00,2024,1,-3.5,0.8,Heavy Snow
02/29/2024,15:00,40.625774,-74.016495,BROOKLYN,1.0,0.0,1,0,0,0,0,0,4706207,2024-02-29 15:00:00,2024-02-29T15:00,2024,2,4.3,0.0,Clear
01/31/2024,19:00,40.66775,-73.90625,BROOKLYN,1.0,0.0,0,0,1,0,0,0,4699487,2024-01-31 19:00:00,2024-01-31T19:00,2024,1,2.1,0.0,Clear
08/20/2024,0:00,40.60679,-73.97151,BROOKLYN,1.0,0.0,0,0,0,0,1,0,4749500,2024-08-20 00:00:00,2024-08-20T00:00,2024,8,19.1,0.0,Cloudy
10/20/2024,13:00,40.669064,-73.86557,BROOKLYN,3.0,0.0,0,0,0,0,3,0,4765317,2024-10-20 13:00:00,2024-10-20T13:00,2024,10,21.5,0.0,Clear
01/29/2024,0:00,40.66387,-73.94271,BROOKLYN,0.0,0.0,0,0,0,0,0,0,4699004,2024-01-29 00:00:00,2024-01-29T00:00,2024,1,2.3,0.0,Cloudy
09/18/2024,18:00,40.633755,-73.96373,BROOKLYN,1.0,0.0,0,0,0,0,1,0,4758042,2024-09-18 18:00:00,2024-09-18T18:00,2024,9,22.2,0.0,Cloudy
02/05/2024,15:00,40.627094,-73.99568,BROOKLYN,1.0,0.0,1,0,0,0,0,0,4700467,2024-02-05 15:00:00,2024-02-05T15:00,2024,2,6.9,0.0,Clear
04/22/2024,14:00,40.6756,-73.90069,BROOKLYN,0.0,0.0,0,0,0,0,0,0,4720353,2024-04-22 14:00:00,2024-04-22T14:00,2024,4,14.5,0.0,Clear
10/25/2024,16:00,40.69603,-73.94353,BROOKLYN,1.0,0.0,0,0,0,0,1,0,4766300,2024-10-25 16:00:00,2024-10-25T16:00,2024,10,16.3,0.0,Clear
08/23/2024,23:00,40.691563,-73.96953,BROOKLYN,1.0,0.0,0,0,1,0,0,0,4751806,2024-08-23 23:00:00,2024-08-23T23:00,2024,8,18.4,0.0,Cloudy
03/10/2024,12:00,40.64503,-73.91998,BROOKLYN,1.0,0.0,0,0,1,0,0,0,4709053,2024-03-10 12:00:00,2024-03-10T12:00,2024,3,10.6,0.0,Cloudy
12/18/2024,21:00,40.617928,-73.93173,BROOKLYN,1.0,0.0,1,0,0,0,0,0,4781027,2024-12-18 21:00:00,2024-12-18T21:00,2024,12,7.9,2.6,Heavy Rain
09/17/2024,10:00,40.595707,-73.94297,BROOKLYN,1.0,0.0,0,0,0,0,1,0,4756723,2024-09-17 10:00:00,2024-09-17T10:00,2024,9,22.6,0.0,Cloudy
10/07/2024,19:00,40.5763,-73.96854,BROOKLYN,1.0,0.0,0,0,1,0,0,0,4761735,2024-10-07 19:00:00,2024-10-07T19:00,2024,10,18.7,0.0,Clear
08/19/2024,14:00,40.63757,-74.01457,BROOKLYN,1.0,0.0,0,0,0,0,1,0,4749921,2024-08-19 14:00:00,2024-08-19T14:00,2024,8,27.9,0.2,Drizzle
03/21/2024,8:00,40.6688,-73.867424,BROOKLYN,1.0,0.0,0,0,0,0,1,0,4711433,2024-03-21 08:00:00,2024-03-21T08:00,2024,3,-0.2,0.0,Cloudy
10/13/2024,17:00,40.631668,-73.99563,BROOKLYN,0.0,0.0,0,0,0,0,0,0,4763432,2024-10-13 17:00:00,2024-10-13T17:00,2024,10,21.0,0.0,Cloudy
03/25/2024,13:00,40.62058,-73.95056,BROOKLYN,1.0,0.0,0,0,0,0,0,0,4712475,2024-03-25 13:00:00,2024-03-25T13:00,2024,3,8.5,0.0,Clear
05/17/2024,17:00,40.649967,-74.006325,BROOKLYN,0.0,0.0,0,0,0,0,0,0,4725692,2024-05-17 17:00:00,2024-05-17T17:00,2024,5,21.0,0.0,Cloudy
02/05/2024,14:00,40.60419,-73.97699,BROOKLYN,1.0,0.0,1,0,0,0,0,0,4700492,2024-02-05 14:00:00,2024-02-05T14:00,2024,2,6.5,0.0,Clear
06/03/2024,21:00,40.700146,-73.947014,BROOKLYN,0.0,0.0,0,0,0,0,0,0,4731163,2024-06-03 21:00:00,2024-06-03T21:00,2024,6,19.9,0.0,Clear
06/06/2024,12:00,40.65399,-73.96416,BROOKLYN,1.0,0.0,0,0,0,0,1,0,4730770,2024-06-06 12:00:00,2024-06-06T12:00,2024,6,27.0,0.3,Drizzle
01/20/2024,19:00,40.582966,-73.986336,BROOKLYN,3.0,0.0,0,0,0,0,3,0,4697355,2024-01-20 19:00:00,2024-01-20T19:00,2024,1,-6.3,0.0,Cloudy
11/19/2024,19:00,40.673546,-73.86667,BROOKLYN,1.0,0.0,0,0,0,0,1,0,4772685,2024-11-19 19:00:00,2024-11-19T19:00,2024,11,12.2,0.0,Cloudy
06/01/2024,3:00,40.669926,-73.89149,BROOKLYN,4.0,0.0,0,0,0,0,4,0,4729013,2024-06-01 03:00:00,2024-06-01T03:00,2024,6,13.0,0.0,Clear
11/07/2024,17:00,40.640583,-73.95572,BROOKLYN,1.0,0.0,0,0,0,0,0,0,4769693,2024-11-07 17:00:00,2024-11-07T17:00,2024,11,18.5,0.0,Clear
09/19/2024,7:00,40.63358,-73.97115,BROOKLYN,0.0,0.0,0,0,0,0,0,0,4758061,2024-09-19 07:00:00,2024-09-19T07:00,2024,9,18.2,0.0,Cloudy
03/03/2024,1:00,40.67816,-73.897484,BROOKLYN,1.0,0.0,0,0,0,0,1,0,4706599,2024-03-03 01:00:00,2024-03-03T01:00,2024,3,8.2,0.0,Cloudy
12/11/2024,7:00,40.589565,-73.9398,BROOKLYN,2.0,0.0,2,0,0,0,0,0,4778313,2024-12-11 07:00:00,2024-12-11T07:00,2024,12,12.6,0.9,Drizzle
06/07/2024,12:00,40.65452,-73.882225,BROOKLYN,1.0,0.0,0,0,0,0,1,0,4731127,2024-06-07 12:00:00,2024-06-07T12:00,2024,6,27.3,0.0,Clear
09/16/2024,11:00,40.623756,-73.985535,BROOKLYN,1.0,0.0,0,0,0,0,1,0,4756266,2024-09-16 11:00:00,2024-09-16T11:00,2024,9,23.2,0.0,Cloudy
07/26/2024,1:00,40.610516,-73.99889,BROOKLYN,1.0,0.0,0,0,1,0,0,0,4743091,2024-07-26 01:00:00,2024-07-26T01:00,2024,7,20.9,0.0,Clear
12/14/2024,0:00,40.69334,-73.96688,BROOKLYN,1.0,0.0,1,0,0,0,0,0,4779171,2024-12-14 00:00:00,2024-12-14T00:00,2024,12,-3.0,0.0,Clear
08/16/2024,9:00,40.615604,-74.031296,BROOKLYN,5.0,0.0,0,0,0,0,5,0,4749733,2024-08-16 09:00:00,2024-08-16T09:00,2024,8,26.3,0.0,Clear
02/10/2024,19:00,40.650295,-73.9172,BROOKLYN,2.0,0.0,0,0,0,0,2,0,4701767,2024-02-10 19:00:00,2024-02-10T19:00,2024,2,10.7,0.0,Cloudy
09/03/2024,20:00,40.598648,-73.95801,BROOKLYN,1.0,0.0,0,0,1,0,0,0,4753650,2024-09-03 20:00:00,2024-09-03T20:00,2024,9,18.9,0.0,Clear
08/02/2024,10:00,40.625324,-73.91789,BROOKLYN,1.0,0.0,0,0,1,0,0,0,4744942,2024-08-02 10:00:00,2024-08-02T10:00,2024,8,28.1,0.0,Cloudy
10/14/2024,19:00,0.0,0.0,BROOKLYN,1.0,0.0,0,0,0,0,1,0,4768398,2024-10-14 19:00:00,2024-10-14T19:00,2024,10,25.9,0.0,Cloudy
08/12/2024,11:00,40.70317,-73.9327,BROOKLYN,1.0,0.0,0,0,0,0,1,0,4747440,2024-08-12 11:00:00,2024-08-12T11:00,2024,8,25.5,0.0,Clear
03/09/2024,0:00,40.643425,-73.94588,BROOKLYN,1.0,0.0,0,0,0,0,0,0,4708411,2024-03-09 00:00:00,2024-03-09T00:00,2024,3,4.3,0.0,Cloudy
12/10/2024,15:00,40.691647,-73.96753,BROOKLYN,1.0,0.0,0,0,1,0,0,0,4778242,2024-12-10 15:00:00,2024-12-10T15:00,2024,12,10.3,0.1,Drizzle
04/18/2024,13:00,40.598606,-73.97893,BROOKLYN,1.0,0.0,0,0,0,0,1,0,4719027,2024-04-18 13:00:00,2024-04-18T13:00,2024,4,9.6,0.0,Cloudy
12/05/2024,19:00,40.661568,-73.888405,BROOKLYN,0.0,0.0,0,0,0,0,0,0,4777357,2024-12-05 19:00:00,2024-12-05T19:00,2024,12,0.9,0.0,Cloudy
09/01/2024,13:00,40.60216,-73.94707,BROOKLYN,0.0,0.0,0,0,0,0,0,0,4752105,2024-09-01 13:00:00,2024-09-01T13:00,2024,9,26.5,0.0,Cloudy
09/21/2024,12:00,40.668125,-73.90358,BROOKLYN,3.0,0.0,0,0,0,0,3,0,4757870,2024-09-21 12:00:00,2024-09-21T12:00,2024,9,25.6,0.0,Cloudy
12/01/2024,0:00,40.688698,-73.94208,BROOKLYN,3.0,0.0,0,0,0,0,3,0,4775591,2024-12-01 00:00:00,2024-12-01T00:00,2024,12,-1.9,0.0,Clear
06/29/2024,21:00,40.656204,-73.886696,BROOKLYN,0.0,0.0,0,0,0,0,0,0,4738500,2024-06-29 21:00:00,2024-06-29T21:00,2024,6,23.1,0.0,Cloudy
10/20/2024,11:00,40.58227,-73.98612,BROOKLYN,2.0,0.0,0,0,0,0,2,0,4766841,2024-10-20 11:00:00,2024-10-20T11:00,2024,10,19.1,0.0,Clear
01/07/2024,14:00,40.625835,-73.935356,BROOKLYN,2.0,0.0,0,0,0,0,2,0,4693997,2024-01-07 14:00:00,2024-01-07T14:00,2024,1,3.1,0.0,Cloudy
10/06/2024,23:00,40.611008,-73.98743,BROOKLYN,0.0,0.0,0,0,0,0,0,0,4761930,2024-10-06 23:00:00,2024-10-06T23:00,2024,10,17.6,0.0,Cloudy
09/14/2024,13:00,40.69336,-73.97585,BROOKLYN,0.0,0.0,0,0,0,0,0,0,4756427,2024-09-14 13:00:00,2024-09-14T13:00,2024,9,28.4,0.0,Clear
08/15/2024,0:00,40.64123,-73.90841,BROOKLYN,3.0,0.0,0,0,0,0,3,0,4750530,2024-08-15 00:00:00,2024-08-15T00:00,2024,8,19.6,0.0,Clear
10/22/2024,18:00,40.702343,-73.94239,BROOKLYN,1.0,0.0,1,0,0,0,0,0,4770329,2024-10-22 18:00:00,2024-10-22T18:00,2024,10,17.8,0.0,Clear
08/08/2024,17:00,40.606064,-74.00392,BROOKLYN,1.0,0.0,1,0,0,0,0,0,4748333,2024-08-08 17:00:00,2024-08-08T17:00,2024,8,23.5,0.2,Drizzle
02/03/2024,19:00,40.609043,-73.95098,BROOKLYN,1.0,0.0,0,0,0,0,1,0,4700299,2024-02-03 19:00:00,2024-02-03T19:00,2024,2,1.7,0.0,Clear
08/27/2024,16:00,40.71135,-73.96143,BROOKLYN,1.0,0.0,1,0,0,0,0,0,4753282,2024-08-27 16:00:00,2024-08-27T16:00,2024,8,28.1,0.0,Clear
02/18/2024,13:00,40.640522,-73.96139,BROOKLYN,2.0,0.0,0,0,0,0,2,0,4703570,2024-02-18 13:00:00,2024-02-18T13:00,2024,2,1.8,0.0,Clear
10/27/2024,0:00,40.623325,-73.99712,BROOKLYN,1.0,0.0,0,0,0,0,1,0,4767106,2024-10-27 00:00:00,2024-10-27T00:00,2024,10,10.1,0.0,Cloudy
10/12/2024,16:00,40.67722,-73.89708,BROOKLYN,0.0,0.0,0,0,0,0,0,0,4763089,2024-10-12 16:00:00,2024-10-12T16:00,2024,10,22.3,0.0,Cloudy
01/17/2024,14:00,40.634357,-74.01075,BROOKLYN,1.0,0.0,1,0,0,0,0,0,4695861,2024-01-17 14:00:00,2024-01-17T14:00,2024,1,-4.3,0.0,Clear
12/31/2024,17:00,40.71337,-73.93481,BROOKLYN,1.0,0.0,0,0,0,0,1,0,4782998,2024-12-31 17:00:00,2024-12-31T17:00,2024,12,8.0,0.0,Cloudy
11/15/2024,17:00,40.64803,-73.96667,BROOKLYN,1.0,0.0,0,0,0,0,1,0,4771774,2024-11-15 17:00:00,2024-11-15T17:00,2024,11,13.1,0.0,Clear
10/30/2024,9:00,40.608284,-73.969986,BROOKLYN,1.0,0.0,0,0,0,0,0,0,4767937,2024-10-30 09:00:00,2024-10-30T09:00,2024,10,15.1,0.0,Cloudy
11/14/2024,21:00,40.645546,-73.91274,BROOKLYN,3.0,0.0,0,0,0,0,3,0,4771416,2024-11-14 21:00:00,2024-11-14T21:00,2024,11,6.0,0.0,Cloudy
10/03/2024,7:00,40.697998,-73.974525,BROOKLYN,1.0,0.0,0,0,1,0,0,0,4761654,2024-10-03 07:00:00,2024-10-03T07:00,2024,10,15.9,0.0,Cloudy
12/06/2024,8:00,40.719246,-73.95406,BROOKLYN,1.0,0.0,0,0,0,0,1,0,4776674,2024-12-06 08:00:00,2024-12-06T08:00,2024,12,-0.9,0.0,Cloudy
09/27/2024,10:00,40.625664,-73.99638,BROOKLYN,1.0,0.0,1,0,0,0,0,0,4761278,2024-09-27 10:00:00,2024-09-27T10:00,2024,9,20.5,0.0,Cloudy
07/04/2024,21:00,40.67776,-73.89349,BROOKLYN,1.0,0.0,0,0,0,0,1,0,4740473,2024-07-04 21:00:00,2024-07-04T21:00,2024,7,23.1,1.4,Light Rain
09/19/2024,14:00,40.633644,-73.907425,BROOKLYN,1.0,0.0,0,0,0,0,1,0,4757254,2024-09-19 14:00:00,2024-09-19T14:00,2024,9,30.2,0.0,Cloudy
11/23/2024,22:00,40.672813,-73.86157,BROOKLYN,0.0,0.0,0,0,0,0,0,0,4773718,2024-11-23 22:00:00,2024-11-23T22:00,2024,11,8.1,0.0,Clear
10/06/2024,15:00,40.65602,-73.94032,BROOKLYN,1.0,0.0,0,0,1,0,0,0,4762167,2024-10-06 15:00:00,2024-10-06T15:00,2024,10,20.1,0.0,Clear
10/07/2024,14:00,40.695847,-73.908806,BROOKLYN,0.0,0.0,0,0,0,0,0,0,4761803,2024-10-07 14:00:00,2024-10-07T14:00,2024,10,23.8,0.0,Clear
04/15/2024,8:00,40.70362,-73.953156,BROOKLYN,0.0,0.0,0,0,0,0,0,0,4719306,2024-04-15 08:00:00,2024-04-15T08:00,2024,4,17.6,0.0,Cloudy
07/21/2024,20:00,40.645355,-74.004715,BROOKLYN,0.0,0.0,0,0,0,0,0,0,4742028,2024-07-21 20:00:00,2024-07-21T20:00,2024,7,24.9,0.1,Drizzle
05/18/2024,22:00,40.618324,-73.95719,BROOKLYN,1.0,0.0,1,0,0,0,0,0,4725489,2024-05-18 22:00:00,2024-05-18T22:00,2024,5,14.4,0.1,Drizzle
09/15/2024,14:00,40.581745,-73.95382,BROOKLYN,1.0,0.0,0,0,0,0,1,0,4756489,2024-09-15 14:00:00,2024-09-15T14:00,2024,9,23.5,0.0,Clear
06/20/2024,0:00,40.655563,-73.87974,BROOKLYN,1.0,0.0,0,0,0,0,1,0,4734430,2024-06-20 00:00:00,2024-06-20T00:00,2024,6,21.6,0.0,Cloudy
01/31/2024,16:00,40.67164,-73.95034,BROOKLYN,1.0,0.0,0,0,0,0,1,0,4699255,2024-01-31 16:00:00,2024-01-31T16:00,2024,1,3.7,0.0,Cloudy
09/17/2024,17:00,40.721344,-73.93656,BROOKLYN,0.0,0.0,0,0,0,0,0,0,4757699,2024-09-17 17:00:00,2024-09-17T17:00,2024,9,24.2,0.0,Cloudy
07/17/2024,11:00,40.651512,-74.00734,BROOKLYN,1.0,0.0,0,0,1,0,0,0,4741585,2024-07-17 11:00:00,2024-07-17T11:00,2024,7,31.4,0.0,Clear
01/13/2024,1:00,40.720074,-73.988365,MANHATTAN,1.0,0.0,1,0,0,0,0,0,4694601,2024-01-13 01:00:00,2024-01-13T01:00,2024,1,8.7,3.5,Heavy Rain
07/24/2024,0:00,40.75834,-73.996414,MANHATTAN,1.0,0.0,0,0,0,0,1,0,4742805,2024-07-24 00:00:00,2024-07-24T00:00,2024,7,22.5,0.0,Cloudy
09/19/2024,1:00,40.7395,-73.98267,MANHATTAN,1.0,0.0,0,0,1,0,0,0,4759154,2024-09-19 01:00:00,2024-09-19T01:00,2024,9,18.4,0.0,Cloudy
03/17/2024,4:00,40.73426,-73.98356,MANHATTAN,1.0,0.0,0,0,0,0,0,0,4712057,2024-03-17 04:00:00,2024-03-17T04:00,2024,3,9.3,0.0,Cloudy
04/07/2024,3:00,40.84817,-73.93779,MANHATTAN,0.0,0.0,0,0,0,0,0,0,4715997,2024-04-07 03:00:00,2024-04-07T03:00,2024,4,1.7,0.0,Clear
04/02/2024,19:00,40.762966,-73.9819,MANHATTAN,1.0,0.0,1,0,0,0,0,0,4714464,2024-04-02 19:00:00,2024-04-02T19:00,2024,4,6.3,0.4,Drizzle
08/26/2024,16:00,40.75112,-73.97127,MANHATTAN,1.0,0.0,0,0,0,0,0,0,4750784,2024-08-26 16:00:00,2024-08-26T16:00,2024,8,27.6,0.2,Drizzle
12/31/2024,10:00,40.755684,-73.96628,MANHATTAN,0.0,0.0,0,0,0,0,0,0,4782892,2024-12-31 10:00:00,2024-12-31T10:00,2024,12,5.9,0.0,Clear
04/10/2024,15:00,40.735077,-73.98294,MANHATTAN,0.0,0.0,0,0,0,0,0,0,4716453,2024-04-10 15:00:00,2024-04-10T15:00,2024,4,15.9,0.0,Cloudy
08/05/2024,10:00,40.79546,-73.94604,MANHATTAN,1.0,0.0,0,0,1,0,0,0,4746210,2024-08-05 10:00:00,2024-08-05T10:00,2024,8,29.8,0.0,Clear
11/17/2024,0:00,40.785534,-73.984,MANHATTAN,1.0,0.0,0,0,0,0,1,0,4772318,2024-11-17 00:00:00,2024-11-17T00:00,2024,11,9.0,0.0,Clear
06/13/2024,0:00,40.819416,-73.94168,MANHATTAN,0.0,0.0,0,0,0,0,0,0,4733626,2024-06-13 00:00:00,2024-06-13T00:00,2024,6,15.7,0.0,Clear
06/24/2024,14:00,40.75112,-73.97127,MANHATTAN,1.0,0.0,0,0,0,0,1,0,4735525,2024-06-24 14:00:00,2024-06-24T14:00,2024,6,26.6,0.0,Cloudy
08/12/2024,0:00,40.717648,-73.98868,MANHATTAN,1.0,0.0,0,0,0,0,0,0,4747357,2024-08-12 00:00:00,2024-08-12T00:00,2024,8,19.5,0.0,Clear
04/10/2024,0:00,40.79793,-73.934,MANHATTAN,1.0,0.0,1,0,0,0,0,0,4717594,2024-04-10 00:00:00,2024-04-10T00:00,2024,4,10.6,0.0,Cloudy
02/02/2024,9:00,40.75587,-73.972824,MANHATTAN,1.0,0.0,1,0,0,0,0,0,4699604,2024-02-02 09:00:00,2024-02-02T09:00,2024,2,3.9,0.2,Drizzle
12/22/2024,18:00,40.745953,-73.99801,MANHATTAN,1.0,0.0,1,0,0,0,0,0,4781507,2024-12-22 18:00:00,2024-12-22T18:00,2024,12,-10.7,0.0,Clear
02/17/2024,6:00,40.804375,-73.93742,MANHATTAN,1.0,0.0,0,0,0,0,1,0,4703308,2024-02-17 06:00:00,2024-02-17T06:00,2024,2,-1.4,0.5,Heavy Snow
08/17/2024,20:00,40.7591,-73.99214,MANHATTAN,1.0,0.0,1,0,0,0,0,0,4748707,2024-08-17 20:00:00,2024-08-17T20:00,2024,8,22.6,0.0,Cloudy
06/08/2024,16:00,40.841225,-73.93594,MANHATTAN,1.0,0.0,0,0,1,0,0,0,4731840,2024-06-08 16:00:00,2024-06-08T16:00,2024,6,24.7,0.0,Clear
03/06/2024,0:00,40.817116,-73.94801,MANHATTAN,1.0,0.0,1,0,0,0,0,0,4707809,2024-03-06 00:00:00,2024-03-06T00:00,2024,3,6.0,0.0,Cloudy
09/30/2024,0:00,40.78461,-73.96984,MANHATTAN,1.0,0.0,0,0,1,0,0,0,4761903,2024-09-30 00:00:00,2024-09-30T00:00,2024,9,16.2,0.0,Cloudy
07/02/2024,12:00,40.7736,-73.98158,MANHATTAN,1.0,0.0,0,0,0,0,1,0,4741736,2024-07-02 12:00:00,2024-07-02T12:00,2024,7,26.9,0.0,Clear
12/09/2024,16:00,40.751404,-74.00517,MANHATTAN,1.0,0.0,1,0,0,0,0,0,4781103,2024-12-09 16:00:00,2024-12-09T16:00,2024,12,9.0,1.4,Light Rain
04/17/2024,5:00,40.71647,-74.004364,MANHATTAN,1.0,0.0,0,0,0,0,1,0,4717977,2024-04-17 05:00:00,2024-04-17T05:00,2024,4,7.3,0.0,Clear
12/08/2024,14:00,40.717724,-73.98576,MANHATTAN,2.0,0.0,0,0,0,0,2,0,4777131,2024-12-08 14:00:00,2024-12-08T14:00,2024,12,11.1,0.0,Cloudy
01/09/2024,18:00,40.782475,-73.98082,MANHATTAN,1.0,0.0,1,0,0,0,0,0,4694306,2024-01-09 18:00:00,2024-01-09T18:00,2024,1,9.3,2.9,Heavy Rain
08/02/2024,19:00,40.780754,-73.95258,MANHATTAN,1.0,0.0,0,0,1,0,0,0,4744848,2024-08-02 19:00:00,2024-08-02T19:00,2024,8,24.9,0.1,Drizzle
12/20/2024,17:00,40.73082,-73.981705,MANHATTAN,1.0,0.0,0,0,0,0,1,0,4781330,2024-12-20 17:00:00,2024-12-20T17:00,2024,12,1.5,0.2,Drizzle
09/14/2024,3:00,40.722042,-73.98736,MANHATTAN,1.0,0.0,0,0,0,0,1,0,4755664,2024-09-14 03:00:00,2024-09-14T03:00,2024,9,15.8,0.0,Cloudy
10/23/2024,14:00,40.729717,-74.01063,MANHATTAN,0.0,0.0,0,0,0,0,0,0,4765899,2024-10-23 14:00:00,2024-10-23T14:00,2024,10,25.4,0.0,Clear
10/24/2024,23:00,40.85139,-73.941216,MANHATTAN,1.0,0.0,0,0,0,0,1,0,4769576,2024-10-24 23:00:00,2024-10-24T23:00,2024,10,10.0,0.0,Clear
03/10/2024,17:00,40.74623,-73.98525,MANHATTAN,1.0,0.0,1,0,0,0,0,0,4708487,2024-03-10 17:00:00,2024-03-10T17:00,2024,3,6.7,0.0,Cloudy
07/11/2024,19:00,40.73064,-73.980804,MANHATTAN,1.0,0.0,0,0,1,0,0,0,4740017,2024-07-11 19:00:00,2024-07-11T19:00,2024,7,28.9,0.0,Clear
02/25/2024,4:00,40.76788,-73.9815,MANHATTAN,1.0,0.0,0,0,0,0,1,0,4706935,2024-02-25 04:00:00,2024-02-25T04:00,2024,2,-7.1,0.0,Clear
11/26/2024,9:00,40.8658,-73.92,MANHATTAN,1.0,0.0,1,0,0,0,0,0,4774999,2024-11-26 09:00:00,2024-11-26T09:00,2024,11,12.6,1.2,Drizzle
05/28/2024,13:00,40.704758,-74.01497,MANHATTAN,1.0,0.0,1,0,0,0,0,0,4728652,2024-05-28 13:00:00,2024-05-28T13:00,2024,5,27.1,0.0,Clear
09/26/2024,12:00,40.719215,-74.00162,MANHATTAN,1.0,0.0,1,0,0,0,0,0,4759749,2024-09-26 12:00:00,2024-09-26T12:00,2024,9,21.5,0.9,Drizzle
10/22/2024,14:00,40.784534,-73.9736,MANHATTAN,1.0,0.0,0,0,1,0,0,0,4766478,2024-10-22 14:00:00,2024-10-22T14:00,2024,10,27.2,0.0,Clear
10/08/2024,1:00,40.73656,-74.0011,MANHATTAN,1.0,0.0,0,0,0,0,1,0,4762345,2024-10-08 01:00:00,2024-10-08T01:00,2024,10,12.9,0.0,Clear
08/29/2024,0:00,40.743263,-73.98202,MANHATTAN,1.0,0.0,1,0,0,0,0,0,4752008,2024-08-29 00:00:00,2024-08-29T00:00,2024,8,24.6,0.0,Clear
06/16/2024,17:00,40.798584,-73.93353,MANHATTAN,1.0,0.0,0,0,0,0,1,0,4733365,2024-06-16 17:00:00,2024-06-16T17:00,2024,6,21.8,0.0,Cloudy
06/06/2024,23:00,40.745422,-73.99291,MANHATTAN,0.0,0.0,0,0,0,0,0,0,4732050,2024-06-06 23:00:00,2024-06-06T23:00,2024,6,21.3,0.2,Drizzle
08/22/2024,16:00,40.71531,-73.99323,MANHATTAN,1.0,0.0,0,0,1,0,0,0,4750495,2024-08-22 16:00:00,2024-08-22T16:00,2024,8,24.2,0.0,Clear
09/20/2024,8:00,40.724136,-73.992615,MANHATTAN,0.0,0.0,0,0,0,0,0,0,4759804,2024-09-20 08:00:00,2024-09-20T08:00,2024,9,20.9,0.0,Clear
12/04/2024,23:00,40.758537,-73.9772,MANHATTAN,0.0,0.0,0,0,0,0,0,0,4789511,2024-12-04 23:00:00,2024-12-04T23:00,2024,12,3.6,0.0,Cloudy
03/18/2024,15:00,40.73841,-73.976204,MANHATTAN,1.0,0.0,1,0,0,0,0,0,4710763,2024-03-18 15:00:00,2024-03-18T15:00,2024,3,9.0,0.0,Cloudy
09/05/2024,10:00,40.756607,-73.9765,MANHATTAN,1.0,0.0,0,0,1,0,0,0,4776035,2024-09-05 10:00:00,2024-09-05T10:00,2024,9,22.5,0.0,Clear
05/22/2024,17:00,40.75592,-73.9749,MANHATTAN,1.0,0.0,1,0,0,0,0,0,4736208,2024-05-22 17:00:00,2024-05-22T17:00,2024,5,18.3,0.0,Clear
04/02/2024,10:00,40.753677,-73.97342,MANHATTAN,1.0,0.0,1,0,0,0,0,0,4714929,2024-04-02 10:00:00,2024-04-02T10:00,2024,4,7.5,0.5,Drizzle
08/13/2024,18:00,40.721474,-73.98383,MANHATTAN,1.0,0.0,1,0,0,0,0,0,4747913,2024-08-13 18:00:00,2024-08-13T18:00,2024,8,25.1,0.0,Clear
03/17/2024,19:00,40.75954,-73.984375,MANHATTAN,1.0,0.0,0,0,1,0,0,0,4734000,2024-03-17 19:00:00,2024-03-17T19:00,2024,3,9.2,0.0,Cloudy
03/15/2024,10:00,40.80777,-73.94549,MANHATTAN,1.0,0.0,1,0,0,0,0,0,4709997,2024-03-15 10:00:00,2024-03-15T10:00,2024,3,18.0,0.0,Cloudy
02/13/2024,7:00,40.746475,-73.9839,MANHATTAN,1.0,0.0,1,0,0,0,0,0,4702456,2024-02-13 07:00:00,2024-02-13T07:00,2024,2,-0.6,2.4,Heavy Snow
06/10/2024,11:00,40.78838,-73.94701,MANHATTAN,2.0,0.0,2,0,0,0,0,0,4735802,2024-06-10 11:00:00,2024-06-10T11:00,2024,6,21.5,0.0,Cloudy
09/16/2024,5:00,40.761356,-73.99052,MANHATTAN,1.0,0.0,1,0,0,0,0,0,4756282,2024-09-16 05:00:00,2024-09-16T05:00,2024,9,13.0,0.0,Clear
03/16/2024,16:00,40.72639,-73.991806,MANHATTAN,1.0,0.0,1,0,0,0,0,0,4711651,2024-03-16 16:00:00,2024-03-16T16:00,2024,3,12.6,0.0,Cloudy
09/22/2024,20:00,40.817173,-73.94607,MANHATTAN,1.0,0.0,0,0,1,0,0,0,4759760,2024-09-22 20:00:00,2024-09-22T20:00,2024,9,18.5,0.0,Clear
01/03/2024,2:00,40.74763,-73.986664,MANHATTAN,1.0,0.0,1,0,0,0,0,0,4692222,2024-01-03 02:00:00,2024-01-03T02:00,2024,1,-2.2,0.0,Clear
12/29/2024,7:00,40.816376,-73.94836,MANHATTAN,1.0,0.0,0,0,0,0,1,0,4782017,2024-12-29 07:00:00,2024-12-29T07:00,2024,12,5.2,1.0,Drizzle
06/18/2024,10:00,40.70909,-74.005516,MANHATTAN,0.0,0.0,0,0,0,0,0,0,4737132,2024-06-18 10:00:00,2024-06-18T10:00,2024,6,28.5,0.0,Cloudy
09/21/2024,0:00,40.77303,-73.96631,MANHATTAN,1.0,0.0,1,0,0,0,0,0,4757972,2024-09-21 00:00:00,2024-09-21T00:00,2024,9,17.8,0.0,Clear
02/05/2024,19:00,40.791557,-73.93866,MANHATTAN,1.0,0.0,0,0,1,0,0,0,4700819,2024-02-05 19:00:00,2024-02-05T19:00,2024,2,1.3,0.0,Clear
10/25/2024,3:00,40.762184,-73.993614,MANHATTAN,1.0,0.0,0,0,1,0,0,0,4767017,2024-10-25 03:00:00,2024-10-25T03:00,2024,10,7.8,0.0,Clear
09/17/2024,8:00,40.8651,-73.92189,MANHATTAN,1.0,0.0,0,0,0,0,1,0,4756583,2024-09-17 08:00:00,2024-09-17T08:00,2024,9,18.4,0.0,Cloudy
04/16/2024,10:00,40.715,-74.00663,MANHATTAN,0.0,0.0,0,0,0,0,0,0,4718415,2024-04-16 10:00:00,2024-04-16T10:00,2024,4,16.7,0.0,Clear
08/05/2024,21:00,40.750843,-73.99026,MANHATTAN,1.0,0.0,1,0,0,0,0,0,4745903,2024-08-05 21:00:00,2024-08-05T21:00,2024,8,26.0,0.0,Cloudy
07/02/2024,21:00,40.831135,-73.94126,MANHATTAN,1.0,0.0,0,0,1,0,0,0,4738076,2024-07-02 21:00:00,2024-07-02T21:00,2024,7,20.6,0.0,Cloudy
06/28/2024,0:00,40.743103,-73.99638,MANHATTAN,1.0,0.0,0,0,0,0,1,0,4737554,2024-06-28 00:00:00,2024-06-28T00:00,2024,6,19.2,0.0,Clear
06/03/2024,19:00,40.70808,-74.01445,MANHATTAN,0.0,0.0,0,0,0,0,0,0,4729746,2024-06-03 19:00:00,2024-06-03T19:00,2024,6,24.1,0.0,Cloudy
04/12/2024,22:00,40.81269,-73.95313,MANHATTAN,0.0,0.0,0,0,0,0,0,0,4717065,2024-04-12 22:00:00,2024-04-12T22:00,2024,4,12.4,0.0,Clear
07/18/2024,13:00,40.81728,-73.938545,MANHATTAN,1.0,0.0,1,0,0,0,0,0,4741382,2024-07-18 13:00:00,2024-07-18T13:00,2024,7,29.4,0.0,Cloudy
08/30/2024,20:00,40.840485,-73.93837,MANHATTAN,1.0,0.0,1,0,0,0,0,0,4752885,2024-08-30 20:00:00,2024-08-30T20:00,2024,8,19.5,0.0,Cloudy
11/13/2024,10:00,40.81666,-73.93899,MANHATTAN,1.0,0.0,0,0,0,0,1,0,4771342,2024-11-13 10:00:00,2024-11-13T10:00,2024,11,5.4,0.0,Clear
04/28/2024,0:00,40.84802,-73.940445,MANHATTAN,0.0,0.0,0,0,0,0,0,0,4720960,2024-04-28 00:00:00,2024-04-28T00:00,2024,4,8.6,0.0,Cloudy
02/21/2024,15:00,40.75507,-73.98464,MANHATTAN,1.0,0.0,0,0,1,0,0,0,4704296,2024-02-21 15:00:00,2024-02-21T15:00,2024,2,3.8,0.0,Cloudy
12/02/2024,9:00,40.79586,-73.943474,MANHATTAN,1.0,0.0,1,0,0,0,0,0,4776207,2024-12-02 09:00:00,2024-12-02T09:00,2024,12,-0.5,0.0,Clear
01/19/2024,23:00,40.718555,-73.988205,MANHATTAN,1.0,0.0,0,0,0,0,1,0,4696318,2024-01-19 23:00:00,2024-01-19T23:00,2024,1,-4.0,0.0,Clear
09/22/2024,16:00,40.79676,-73.9451,MANHATTAN,1.0,0.0,0,0,1,0,0,0,4758861,2024-09-22 16:00:00,2024-09-22T16:00,2024,9,22.5,0.0,Clear
12/25/2024,16:00,40.74979,-73.98777,MANHATTAN,8.0,0.0,7,0,0,0,1,0,4781404,2024-12-25 16:00:00,2024-12-25T16:00,2024,12,-2.1,0.0,Clear
05/06/2024,0:00,40.75533,-73.99119,MANHATTAN,1.0,0.0,0,0,1,0,0,0,4723898,2024-05-06 00:00:00,2024-05-06T00:00,2024,5,11.8,0.1,Drizzle
02/18/2024,8:00,40.745636,-73.97967,MANHATTAN,0.0,0.0,0,0,0,0,0,0,4794106,2024-02-18 08:00:00,2024-02-18T08:00,2024,2,-4.8,0.0,Clear
08/08/2024,10:00,40.743153,-73.997375,MANHATTAN,0.0,0.0,0,0,0,0,0,0,4746946,2024-08-08 10:00:00,2024-08-08T10:00,2024,8,21.2,0.4,Drizzle
02/11/2024,17:00,40.71137,-73.99678,MANHATTAN,1.0,0.0,1,0,0,0,0,0,4702413,2024-02-11 17:00:00,2024-02-11T17:00,2024,2,8.2,0.0,Cloudy
03/06/2024,20:00,40.718056,-73.98753,MANHATTAN,1.0,0.0,0,0,0,0,1,0,4707887,2024-03-06 20:00:00,2024-03-06T20:00,2024,3,7.5,4.4,Heavy Rain
11/21/2024,18:00,40.82803,-73.93484,MANHATTAN,2.0,0.0,0,0,0,0,2,0,4775162,2024-11-21 18:00:00,2024-11-21T18:00,2024,11,8.4,2.8,Heavy Rain
11/13/2024,14:00,40.74305,-74.00233,MANHATTAN,1.0,0.0,1,0,0,0,0,0,4772262,2024-11-13 14:00:00,2024-11-13T14:00,2024,11,9.1,0.0,Clear
09/24/2024,20:00,40.791557,-73.93866,MANHATTAN,1.0,0.0,1,0,0,0,0,0,4758637,2024-09-24 20:00:00,2024-09-24T20:00,2024,9,16.9,0.0,Cloudy
04/25/2024,17:00,40.84784,-73.93953,MANHATTAN,1.0,0.0,0,0,0,0,1,0,4720958,2024-04-25 17:00:00,2024-04-25T17:00,2024,4,9.7,0.0,Clear
08/18/2024,4:00,40.796413,-73.93853,MANHATTAN,1.0,0.0,0,0,0,0,1,0,4749291,2024-08-18 04:00:00,2024-08-18T04:00,2024,8,21.9,0.3,Drizzle
06/05/2024,13:00,40.778477,-73.98546,MANHATTAN,0.0,0.0,0,0,0,0,0,0,4731415,2024-06-05 13:00:00,2024-06-05T13:00,2024,6,26.5,0.0,Cloudy
09/14/2024,7:00,40.727947,-74.00315,MANHATTAN,0.0,0.0,0,0,0,0,0,0,4758187,2024-09-14 07:00:00,2024-09-14T07:00,2024,9,17.5,0.0,Clear
05/04/2024,19:00,40.754177,-73.984604,MANHATTAN,2.0,0.0,2,0,0,0,0,0,4728611,2024-05-04 19:00:00,2024-05-04T19:00,2024,5,10.5,0.0,Cloudy
12/20/2024,14:00,40.808956,-73.94869,MANHATTAN,2.0,0.0,1,0,0,0,1,0,4782448,2024-12-20 14:00:00,2024-12-20T14:00,2024,12,2.6,0.2,Drizzle
10/28/2024,19:00,40.796005,-73.93541,MANHATTAN,1.0,0.0,1,0,0,0,0,0,4768136,2024-10-28 19:00:00,2024-10-28T19:00,2024,10,10.8,0.0,Cloudy
11/09/2024,11:00,40.75671,-73.98646,MANHATTAN,1.0,0.0,1,0,0,0,0,0,4769861,2024-11-09 11:00:00,2024-11-09T11:00,2024,11,9.6,0.0,Clear
01/16/2024,0:00,40.805508,-73.96201,MANHATTAN,1.0,0.0,1,0,0,0,0,0,4695580,2024-01-16 00:00:00,2024-01-16T00:00,2024,1,-4.2,0.6,Heavy Snow
10/21/2024,10:00,40.719204,-73.99037,MANHATTAN,1.0,0.0,1,0,0,0,0,0,4765333,2024-10-21 10:00:00,2024-10-21T10:00,2024,10,21.3,0.0,Clear
08/01/2024,0:00,40.71659,-73.98637,MANHATTAN,1.0,0.0,0,0,0,0,1,0,4746238,2024-08-01 00:00:00,2024-08-01T00:00,2024,8,23.3,0.0,Clear
01/29/2024,12:00,40.759403,-73.98511,MANHATTAN,1.0,0.0,0,0,1,0,0,0,4698998,2024-01-29 12:00:00,2024-01-29T12:00,2024,1,4.4,0.0,Cloudy
12/16/2024,8:00,40.847427,-73.9314,MANHATTAN,0.0,0.0,0,0,0,0,0,0,4781267,2024-12-16 08:00:00,2024-12-16T08:00,2024,12,3.0,0.8,Drizzle
02/29/2024,0:00,40.752815,-73.98138,MANHATTAN,1.0,0.0,1,0,0,0,0,0,4709588,2024-02-29 00:00:00,2024-02-29T00:00,2024,2,4.7,0.0,Clear
08/03/2024,21:00,40.763115,-73.99966,MANHATTAN,1.0,0.0,0,0,0,0,1,0,4745566,2024-08-03 21:00:00,2024-08-03T21:00,2024,8,24.3,0.0,Cloudy
11/06/2024,13:00,40.75206,-74.000984,MANHATTAN,1.0,0.0,0,0,0,0,1,0,4769972,2024-11-06 13:00:00,2024-11-06T13:00,2024,11,26.2,0.0,Clear
06/09/2024,3:00,40.730476,-73.9885,MANHATTAN,1.0,0.0,0,0,0,0,1,0,4731891,2024-06-09 03:00:00,2024-06-09T03:00,2024,6,14.5,0.0,Cloudy
01/21/2024,18:00,40.73548,-73.97545,MANHATTAN,0.0,0.0,0,0,0,0,0,0,4700321,2024-01-21 18:00:00,2024-01-21T18:00,2024,1,-4.3,0.0,Clear
09/02/2024,16:00,40.720707,-73.981316,MANHATTAN,1.0,0.0,0,0,0,0,0,0,4752918,2024-09-02 16:00:00,2024-09-02T16:00,2024,9,25.4,0.0,Clear
05/17/2024,0:00,40.774708,-73.97469,MANHATTAN,1.0,0.0,0,0,1,0,0,0,4725357,2024-05-17 00:00:00,2024-05-17T00:00,2024,5,13.8,0.0,Clear
07/19/2024,20:00,40.718143,-73.993835,MANHATTAN,1.0,0.0,0,0,1,0,0,0,4741608,2024-07-19 20:00:00,2024-07-19T20:00,2024,7,23.6,0.0,Clear
01/17/2024,15:00,40.815304,-73.94371,MANHATTAN,1.0,0.0,0,0,0,0,1,0,4696151,2024-01-17 15:00:00,2024-01-17T15:00,2024,1,-4.2,0.0,Clear
10/05/2024,8:00,40.752262,-73.97547,MANHATTAN,1.0,0.0,1,0,0,0,0,0,4761162,2024-10-05 08:00:00,2024-10-05T08:00,2024,10,17.3,0.0,Clear
03/24/2024,16:00,40.732754,-73.99004,MANHATTAN,1.0,0.0,0,0,0,0,1,0,4714570,2024-03-24 16:00:00,2024-03-24T16:00,2024,3,8.5,0.0,Clear
12/19/2024,22:00,40.755432,-73.98974,MANHATTAN,1.0,0.0,0,0,1,0,0,0,4781399,2024-12-19 22:00:00,2024-12-19T22:00,2024,12,0.6,0.0,Cloudy
07/25/2024,8:00,40.754974,-73.976524,MANHATTAN,1.0,0.0,0,0,1,0,0,0,4745549,2024-07-25 08:00:00,2024-07-25T08:00,2024,7,24.5,0.0,Cloudy
09/04/2024,14:00,40.817287,-73.93468,MANHATTAN,0.0,0.0,0,0,0,0,0,0,4753409,2024-09-04 14:00:00,2024-09-04T14:00,2024,9,25.3,0.0,Clear
12/23/2024,13:00,40.773876,-73.98222,MANHATTAN,1.0,0.0,1,0,0,0,0,0,4781005,2024-12-23 13:00:00,2024-12-23T13:00,2024,12,-6.7,0.0,Cloudy
05/25/2024,15:00,40.832764,-73.94583,MANHATTAN,1.0,0.0,0,0,0,0,1,0,4728421,2024-05-25 15:00:00,2024-05-25T15:00,2024,5,24.3,0.0,Cloudy
10/02/2024,17:00,40.78838,-73.94701,MANHATTAN,1.0,0.0,0,0,0,0,1,0,4760577,2024-10-02 17:00:00,2024-10-02T17:00,2024,10,18.7,0.0,Clear
03/25/2024,9:00,40.828896,-73.94646,MANHATTAN,0.0,0.0,0,0,0,0,0,0,4712298,2024-03-25 09:00:00,2024-03-25T09:00,2024,3,3.8,0.0,Clear
12/22/2024,17:00,40.787323,-73.94292,MANHATTAN,0.0,0.0,0,0,0,0,0,0,4781333,2024-12-22 17:00:00,2024-12-22T17:00,2024,12,-8.7,0.0,Clear
03/31/2024,20:00,40.74913,-73.98824,MANHATTAN,1.0,0.0,0,0,1,0,0,0,4714166,2024-03-31 20:00:00,2024-03-31T20:00,2024,3,10.0,0.0,Cloudy
11/21/2024,10:00,40.773876,-73.98222,MANHATTAN,1.0,0.0,1,0,0,0,0,0,4773076,2024-11-21 10:00:00,2024-11-21T10:00,2024,11,8.1,0.5,Drizzle
08/08/2024,8:00,40.75134,-73.96985,MANHATTAN,1.0,0.0,0,0,1,0,0,0,4746550,2024-08-08 08:00:00,2024-08-08T08:00,2024,8,19.7,0.0,Cloudy
06/09/2024,16:00,40.749195,-73.98236,MANHATTAN,0.0,0.0,0,0,0,0,0,0,4731828,2024-06-09 16:00:00,2024-06-09T16:00,2024,6,24.7,0.0,Clear
12/01/2024,17:00,40.797005,-73.937775,MANHATTAN,2.0,0.0,0,0,0,0,2,0,4775684,2024-12-01 17:00:00,2024-12-01T17:00,2024,12,0.4,0.0,Clear
10/30/2024,19:00,40.841076,-73.939766,MANHATTAN,1.0,0.0,1,0,0,0,0,0,4769279,2024-10-30 19:00:00,2024-10-30T19:00,2024,10,19.3,0.0,Cloudy
08/27/2024,11:00,40.736004,-73.99362,MANHATTAN,1.0,0.0,1,0,0,0,0,0,4755799,2024-08-27 11:00:00,2024-08-27T11:00,2024,8,28.2,0.0,Clear
04/18/2024,13:00,40.743782,-73.97352,MANHATTAN,1.0,0.0,1,0,0,0,0,0,4718379,2024-04-18 13:00:00,2024-04-18T13:00,2024,4,9.0,0.0,Cloudy
07/17/2024,0:00,40.81574,-73.95456,MANHATTAN,1.0,0.0,0,0,0,0,1,0,4741798,2024-07-17 00:00:00,2024-07-17T00:00,2024,7,26.4,0.0,Cloudy
05/15/2024,0:00,40.770412,-73.987625,MANHATTAN,1.0,0.0,1,0,0,0,0,0,4726581,2024-05-15 00:00:00,2024-05-15T00:00,2024,5,14.4,0.1,Drizzle
01/03/2024,0:00,40.72029,-73.987305,MANHATTAN,1.0,0.0,0,0,0,0,0,0,4692453,2024-01-03 00:00:00,2024-01-03T00:00,2024,1,-1.6,0.0,Cloudy
08/23/2024,17:00,40.83789,-73.93997,MANHATTAN,1.0,0.0,1,0,0,0,0,0,4750483,2024-08-23 17:00:00,2024-08-23T17:00,2024,8,26.6,0.0,Cloudy
04/07/2024,14:00,40.763023,-73.97815,MANHATTAN,1.0,0.0,0,0,1,0,0,0,4717342,2024-04-07 14:00:00,2024-04-07T14:00,2024,4,11.5,0.0,Cloudy
12/27/2024,8:00,40.794052,-73.97037,MANHATTAN,0.0,0.0,0,0,0,0,0,0,4782033,2024-12-27 08:00:00,2024-12-27T08:00,2024,12,-8.4,0.0,Cloudy
07/28/2024,8:00,40.813934,-73.96005,MANHATTAN,0.0,0.0,0,0,0,0,0,0,4743806,2024-07-28 08:00:00,2024-07-28T08:00,2024,7,24.6,0.0,Clear
08/14/2024,20:00,40.729824,-74.010605,MANHATTAN,1.0,0.0,0,0,0,0,1,0,4749315,2024-08-14 20:00:00,2024-08-14T20:00,2024,8,22.3,0.0,Clear
01/19/2024,9:00,40.726383,-73.9893,MANHATTAN,1.0,0.0,0,0,0,0,1,0,4697721,2024-01-19 09:00:00,2024-01-19T09:00,2024,1,-2.3,0.2,Light Snow
08/05/2024,0:00,40.7171,-74.01269,MANHATTAN,2.0,0.0,0,0,0,0,2,0,4745803,2024-08-05 00:00:00,2024-08-05T00:00,2024,8,23.3,0.0,Clear
06/08/2024,21:00,40.800556,-73.94021,MANHATTAN,3.0,0.0,0,0,0,0,3,0,4731451,2024-06-08 21:00:00,2024-06-08T21:00,2024,6,19.3,0.0,Clear
02/25/2024,8:00,40.724495,-74.006035,MANHATTAN,0.0,0.0,0,0,0,0,0,0,4706098,2024-02-25 08:00:00,2024-02-25T08:00,2024,2,-4.5,0.0,Clear
06/23/2024,0:00,40.74347,-74.00724,MANHATTAN,0.0,0.0,0,0,0,0,0,0,4736032,2024-06-23 00:00:00,2024-06-23T00:00,2024,6,22.9,0.0,Cloudy
12/28/2024,0:00,40.76998,-73.994644,MANHATTAN,4.0,0.0,0,0,0,0,4,0,4785658,2024-12-28 00:00:00,2024-12-28T00:00,2024,12,2.5,0.0,Cloudy
09/19/2024,19:00,40.75702,-74.00494,MANHATTAN,1.0,0.0,0,0,0,0,0,0,4757755,2024-09-19 19:00:00,2024-09-19T19:00,2024,9,23.5,0.0,Cloudy
10/10/2024,13:00,40.71671,-73.98917,MANHATTAN,1.0,0.0,1,0,0,0,0,0,4762681,2024-10-10 13:00:00,2024-10-10T13:00,2024,10,17.6,0.0,Clear
01/12/2024,0:00,40.801765,-73.93723,MANHATTAN,1.0,0.0,1,0,0,0,0,0,4694425,2024-01-12 00:00:00,2024-01-12T00:00,2024,1,2.5,0.0,Clear
05/28/2024,3:00,40.723816,-73.9937,MANHATTAN,1.0,0.0,0,0,0,0,1,0,4728303,2024-05-28 03:00:00,2024-05-28T03:00,2024,5,18.4,0.0,Cloudy
10/18/2024,22:00,40.792812,-73.937744,MANHATTAN,1.0,0.0,0,0,1,0,0,0,4766422,2024-10-18 22:00:00,2024-10-18T22:00,2024,10,9.0,0.0,Clear
05/21/2024,13:00,40.772964,-73.95827,MANHATTAN,1.0,0.0,1,0,0,0,0,0,4726591,2024-05-21 13:00:00,2024-05-21T13:00,2024,5,24.5,0.0,Clear
04/10/2024,6:00,40.704155,-74.00642,MANHATTAN,1.0,0.0,0,0,1,0,0,0,4716623,2024-04-10 06:00:00,2024-04-10T06:00,2024,4,8.6,0.0,Cloudy
12/03/2024,15:00,40.794487,-73.949234,MANHATTAN,0.0,0.0,0,0,0,0,0,0,4777097,2024-12-03 15:00:00,2024-12-03T15:00,2024,12,4.8,0.0,Clear
08/07/2024,11:00,40.74433,-73.99178,MANHATTAN,1.0,0.0,0,0,1,0,0,0,4746479,2024-08-07 11:00:00,2024-08-07T11:00,2024,8,21.1,0.0,Cloudy
08/26/2024,13:00,40.717194,-73.98411,MANHATTAN,1.0,0.0,0,0,0,0,1,0,4750744,2024-08-26 13:00:00,2024-08-26T13:00,2024,8,29.6,0.0,Clear
07/12/2024,3:00,40.789307,-73.943405,MANHATTAN,1.0,0.0,0,0,0,0,1,0,4739694,2024-07-12 03:00:00,2024-07-12T03:00,2024,7,21.5,0.0,Cloudy
09/09/2024,18:00,40.80778,-73.95293,MANHATTAN,1.0,0.0,1,0,0,0,0,0,4754525,2024-09-09 18:00:00,2024-09-09T18:00,2024,9,21.8,0.0,Clear
07/18/2024,12:00,40.746834,-74.00217,MANHATTAN,1.0,0.0,1,0,0,0,0,0,4742818,2024-07-18 12:00:00,2024-07-18T12:00,2024,7,29.1,0.0,Cloudy
05/07/2024,9:00,40.727867,-73.99315,MANHATTAN,1.0,0.0,0,0,0,0,0,0,4722643,2024-05-07 09:00:00,2024-05-07T09:00,2024,5,20.2,0.0,Clear
05/21/2024,12:00,40.81967,-73.94424,MANHATTAN,1.0,0.0,1,0,0,0,0,0,4727472,2024-05-21 12:00:00,2024-05-21T12:00,2024,5,25.7,0.0,Clear
05/26/2024,19:00,40.789684,-73.95446,MANHATTAN,2.0,0.0,2,0,0,0,0,0,4727890,2024-05-26 19:00:00,2024-05-26T19:00,2024,5,18.6,0.0,Cloudy
02/02/2024,8:00,40.7591,-73.99214,MANHATTAN,2.0,0.0,1,0,1,0,0,0,4700426,2024-02-02 08:00:00,2024-02-02T08:00,2024,2,3.9,0.0,Cloudy
12/16/2024,8:00,40.743214,-74.00861,MANHATTAN,1.0,0.0,0,0,0,0,1,0,4781164,2024-12-16 08:00:00,2024-12-16T08:00,2024,12,3.5,1.6,Light Rain
04/06/2024,12:00,40.81098,-73.953094,MANHATTAN,1.0,0.0,1,0,0,0,0,0,4718295,2024-04-06 12:00:00,2024-04-06T12:00,2024,4,9.8,0.0,Cloudy
06/24/2024,19:00,40.722816,-73.993095,MANHATTAN,2.0,0.0,0,0,1,0,1,0,4735868,2024-06-24 19:00:00,2024-06-24T19:00,2024,6,23.6,0.0,Clear
02/15/2024,23:00,40.72293,-73.98865,MANHATTAN,1.0,0.0,1,0,0,0,0,0,4703062,2024-02-15 23:00:00,2024-02-15T23:00,2024,2,-0.3,0.0,Clear
08/26/2024,17:00,40.724655,-74.00776,MANHATTAN,1.0,0.0,1,0,0,0,0,0,4750923,2024-08-26 17:00:00,2024-08-26T17:00,2024,8,24.8,0.8,Drizzle
12/16/2024,0:00,40.731167,-73.99192,MANHATTAN,1.0,0.0,0,0,0,0,0,0,4781510,2024-12-16 00:00:00,2024-12-16T00:00,2024,12,2.0,0.5,Drizzle
02/22/2024,10:00,40.81339,-73.95627,MANHATTAN,1.0,0.0,0,0,0,0,1,0,4704394,2024-02-22 10:00:00,2024-02-22T10:00,2024,2,3.8,0.0,Clear
08/07/2024,3:00,40.77242,-73.97873,MANHATTAN,1.0,0.0,0,0,0,0,1,0,4746962,2024-08-07 03:00:00,2024-08-07T03:00,2024,8,21.9,0.0,Cloudy
01/27/2024,10:00,40.723648,-73.98529,MANHATTAN,1.0,0.0,1,0,0,0,0,0,4699213,2024-01-27 10:00:00,2024-01-27T10:00,2024,1,6.8,0.0,Cloudy
09/23/2024,16:00,40.780663,-73.96183,MANHATTAN,0.0,0.0,0,0,0,0,0,0,4758436,2024-09-23 16:00:00,2024-09-23T16:00,2024,9,20.3,0.0,Cloudy
12/20/2024,5:00,40.75767,-73.99483,MANHATTAN,1.0,0.0,1,0,0,0,0,0,4780916,2024-12-20 05:00:00,2024-12-20T05:00,2024,12,-0.7,0.0,Cloudy
09/21/2024,0:00,40.820095,-73.955086,MANHATTAN,2.0,0.0,0,0,0,0,2,0,4758186,2024-09-21 00:00:00,2024-09-21T00:00,2024,9,17.5,0.0,Clear
03/12/2024,21:00,40.770542,-73.99198,MANHATTAN,0.0,0.0,0,0,0,0,0,0,4709883,2024-03-12 21:00:00,2024-03-12T21:00,2024,3,8.0,0.0,Clear
02/15/2024,0:00,40.810173,-73.937416,MANHATTAN,1.0,0.0,0,0,1,0,0,0,4703029,2024-02-15 00:00:00,2024-02-15T00:00,2024,2,-3.2,0.0,Clear
11/06/2024,0:00,40.77048,-73.98386,MANHATTAN,1.0,0.0,0,0,1,0,0,0,4769795,2024-11-06 00:00:00,2024-11-06T00:00,2024,11,17.0,0.0,Clear
07/20/2024,22:00,40.70745,-74.011955,MANHATTAN,1.0,0.0,1,0,0,0,0,0,4743196,2024-07-20 22:00:00,2024-07-20T22:00,2024,7,23.9,0.0,Cloudy
08/12/2024,19:00,40.80506,-73.94117,MANHATTAN,1.0,0.0,1,0,0,0,0,0,4747593,2024-08-12 19:00:00,2024-08-12T19:00,2024,8,22.9,0.0,Clear
02/13/2024,11:00,40.759983,-73.964806,MANHATTAN,1.0,0.0,0,0,1,0,0,0,4705335,2024-02-13 11:00:00,2024-02-13T11:00,2024,2,0.5,2.3,Heavy Snow
02/07/2024,16:00,40.72315,-73.99128,MANHATTAN,0.0,0.0,0,0,0,0,0,0,4701218,2024-02-07 16:00:00,2024-02-07T16:00,2024,2,8.0,0.0,Cloudy
12/24/2024,20:00,40.862926,-73.927765,MANHATTAN,1.0,0.0,1,0,0,0,0,0,4781513,2024-12-24 20:00:00,2024-12-24T20:00,2024,12,0.3,0.0,Cloudy
01/27/2024,13:00,40.761875,-74.00085,MANHATTAN,1.0,0.0,1,0,0,0,0,0,4698309,2024-01-27 13:00:00,2024-01-27T13:00,2024,1,8.3,0.0,Cloudy
10/31/2024,18:00,40.758724,-73.974014,MANHATTAN,1.0,0.0,0,0,0,0,0,0,4769099,2024-10-31 18:00:00,2024-10-31T18:00,2024,10,18.8,0.0,Cloudy
11/06/2024,14:00,40.76099,-73.97331,MANHATTAN,0.0,0.0,0,0,0,0,0,0,4784315,2024-11-06 14:00:00,2024-11-06T14:00,2024,11,24.9,0.0,Clear
06/30/2024,14:00,40.754234,-73.98033,MANHATTAN,1.0,0.0,0,0,0,0,0,0,4737072,2024-06-30 14:00:00,2024-06-30T14:00,2024,6,32.3,0.0,Cloudy
10/23/2024,0:00,40.797306,-73.93446,MANHATTAN,1.0,0.0,1,0,0,0,0,0,4766852,2024-10-23 00:00:00,2024-10-23T00:00,2024,10,14.4,0.0,Clear
12/27/2024,10:00,40.86676,-73.92061,MANHATTAN,1.0,0.0,0,0,0,0,1,0,4782786,2024-12-27 10:00:00,2024-12-27T10:00,2024,12,-2.7,0.0,Cloudy
11/05/2024,9:00,40.749157,-73.972694,MANHATTAN,1.0,0.0,1,0,0,0,0,0,4769028,2024-11-05 09:00:00,2024-11-05T09:00,2024,11,14.2,0.0,Cloudy
11/03/2024,18:00,40.733234,-73.97505,MANHATTAN,1.0,0.0,0,0,0,0,1,0,4768877,2024-11-03 18:00:00,2024-11-03T18:00,2024,11,9.6,0.0,Clear
09/19/2024,13:00,40.768684,-73.99161,MANHATTAN,1.0,0.0,1,0,0,0,0,0,4758171,2024-09-19 13:00:00,2024-09-19T13:00,2024,9,29.2,0.0,Cloudy
08/08/2024,22:00,40.76889,-73.9821,MANHATTAN,1.0,0.0,1,0,0,0,0,0,4746961,2024-08-08 22:00:00,2024-08-08T22:00,2024,8,20.8,0.4,Drizzle
09/25/2024,13:00,40.86571,-73.923485,MANHATTAN,1.0,0.0,1,0,0,0,0,0,4758811,2024-09-25 13:00:00,2024-09-25T13:00,2024,9,19.7,0.0,Cloudy
10/09/2024,7:00,40.79894,-73.93326,MANHATTAN,1.0,0.0,1,0,0,0,0,0,4762369,2024-10-09 07:00:00,2024-10-09T07:00,2024,10,11.4,0.0,Cloudy
01/09/2024,18:00,40.75202,-74.00473,MANHATTAN,1.0,0.0,1,0,0,0,0,0,4693962,2024-01-09 18:00:00,2024-01-09T18:00,2024,1,9.6,3.6,Heavy Rain
07/13/2024,7:00,40.762184,-73.993614,MANHATTAN,1.0,0.0,0,0,0,0,1,0,4742748,2024-07-13 07:00:00,2024-07-13T07:00,2024,7,22.7,0.3,Drizzle
02/27/2024,19:00,40.733612,-73.999565,MANHATTAN,1.0,0.0,1,0,0,0,0,0,4706512,2024-02-27 19:00:00,2024-02-27T19:00,2024,2,11.6,1.0,Drizzle
10/14/2024,12:00,40.750988,-73.99063,MANHATTAN,1.0,0.0,1,0,0,0,0,0,4763528,2024-10-14 12:00:00,2024-10-14T12:00,2024,10,19.2,0.0,Clear
07/25/2024,20:00,40.720234,-73.98448,MANHATTAN,1.0,0.0,0,0,1,0,0,0,4748362,2024-07-25 20:00:00,2024-07-25T20:00,2024,7,23.6,0.0,Cloudy
05/05/2024,6:00,40.73695,-74.007385,MANHATTAN,0.0,0.0,0,0,0,0,0,0,4722283,2024-05-05 06:00:00,2024-05-05T06:00,2024,5,9.4,0.0,Cloudy
06/08/2024,16:00,40.76593,-73.99088,MANHATTAN,1.0,0.0,1,0,0,0,0,0,4734011,2024-06-08 16:00:00,2024-06-08T16:00,2024,6,25.3,0.0,Clear
05/22/2024,19:00,40.71997,-73.992905,MANHATTAN,1.0,0.0,1,0,0,0,0,0,4727017,2024-05-22 19:00:00,2024-05-22T19:00,2024,5,23.1,0.0,Cloudy
11/11/2024,13:00,40.78201,-73.95166,MANHATTAN,2.0,0.0,0,0,0,0,2,0,4770645,2024-11-11 13:00:00,2024-11-11T13:00,2024,11,20.7,0.0,Clear
04/13/2024,20:00,40.736034,-73.99781,MANHATTAN,1.0,0.0,1,0,0,0,0,0,4717670,2024-04-13 20:00:00,2024-04-13T20:00,2024,4,9.6,0.0,Clear
07/09/2024,21:00,40.76573,-73.926445,QUEENS,1.0,0.0,0,0,0,0,1,0,4739351,2024-07-09 21:00:00,2024-07-09T21:00,2024,7,27.1,0.0,Cloudy
05/11/2024,22:00,40.76307,-73.924484,QUEENS,1.0,0.0,0,0,0,0,1,0,4725584,2024-05-11 22:00:00,2024-05-11T22:00,2024,5,9.9,0.0,Cloudy
12/16/2024,15:00,40.72667,-73.72914,QUEENS,5.0,0.0,0,0,0,0,5,0,4779537,2024-12-16 15:00:00,2024-12-16T15:00,2024,12,8.9,0.2,Drizzle
08/23/2024,20:00,40.74539,-73.90559,QUEENS,1.0,0.0,0,0,1,0,0,0,4750305,2024-08-23 20:00:00,2024-08-23T20:00,2024,8,20.8,0.0,Clear
05/07/2024,19:00,40.682404,-73.75181,QUEENS,4.0,0.0,0,0,0,0,4,0,4722849,2024-05-07 19:00:00,2024-05-07T19:00,2024,5,16.4,0.0,Cloudy
07/03/2024,19:00,40.727596,-73.718124,QUEENS,0.0,0.0,0,0,0,0,0,0,4738295,2024-07-03 19:00:00,2024-07-03T19:00,2024,7,21.0,0.0,Cloudy
09/27/2024,12:00,40.69226,-73.84653,QUEENS,2.0,0.0,2,0,0,0,0,0,4759108,2024-09-27 12:00:00,2024-09-27T12:00,2024,9,21.6,0.0,Cloudy
12/05/2024,7:00,40.741703,-73.91692,QUEENS,0.0,0.0,0,0,0,0,0,0,4779309,2024-12-05 07:00:00,2024-12-05T07:00,2024,12,2.9,0.5,Drizzle
03/01/2024,0:00,40.749054,-73.95222,QUEENS,0.0,0.0,0,0,0,0,0,0,4706817,2024-03-01 00:00:00,2024-03-01T00:00,2024,3,-2.6,0.0,Clear
07/28/2024,21:00,40.592735,-73.76405,QUEENS,1.0,0.0,1,0,0,0,0,0,4743569,2024-07-28 21:00:00,2024-07-28T21:00,2024,7,22.9,0.0,Cloudy
01/09/2024,11:00,40.773827,-73.93631,QUEENS,0.0,0.0,0,0,0,0,0,0,4695057,2024-01-09 11:00:00,2024-01-09T11:00,2024,1,5.4,0.1,Drizzle
03/24/2024,14:00,40.73376,-73.93743,QUEENS,1.0,0.0,0,0,0,0,0,0,4712276,2024-03-24 14:00:00,2024-03-24T14:00,2024,3,7.8,0.0,Clear
07/04/2024,22:00,40.698627,-73.7913,QUEENS,1.0,0.0,1,0,0,0,0,0,4738222,2024-07-04 22:00:00,2024-07-04T22:00,2024,7,21.7,1.0,Drizzle
03/12/2024,13:00,40.738777,-73.87057,QUEENS,1.0,0.0,0,0,0,0,1,0,4709038,2024-03-12 13:00:00,2024-03-12T13:00,2024,3,16.0,0.0,Clear
01/13/2024,19:00,40.754974,-73.89095,QUEENS,1.0,0.0,0,0,0,0,1,0,4694696,2024-01-13 19:00:00,2024-01-13T19:00,2024,1,3.0,0.0,Clear
07/09/2024,14:00,40.77241,-73.89594,QUEENS,1.0,0.0,0,0,0,0,1,0,4739506,2024-07-09 14:00:00,2024-07-09T14:00,2024,7,30.1,0.0,Cloudy
01/22/2024,21:00,40.69595,-73.86237,QUEENS,1.0,0.0,1,0,0,0,0,0,4697085,2024-01-22 21:00:00,2024-01-22T21:00,2024,1,-0.7,0.0,Cloudy
02/12/2024,15:00,40.75761,-73.87408,QUEENS,1.0,0.0,1,0,0,0,0,0,4702128,2024-02-12 15:00:00,2024-02-12T15:00,2024,2,8.4,0.0,Cloudy
08/16/2024,19:00,40.730927,-73.77478,QUEENS,1.0,0.0,1,0,0,0,0,0,4748484,2024-08-16 19:00:00,2024-08-16T19:00,2024,8,22.9,0.0,Cloudy
01/28/2024,11:00,40.750725,-73.87037,QUEENS,2.0,0.0,0,0,0,0,2,0,4698696,2024-01-28 11:00:00,2024-01-28T11:00,2024,1,4.1,0.2,Drizzle
11/12/2024,16:00,40.71343,-73.78059,QUEENS,1.0,0.0,1,0,0,0,0,0,4770905,2024-11-12 16:00:00,2024-11-12T16:00,2024,11,9.9,0.0,Clear
11/17/2024,11:00,40.66637,-73.779594,QUEENS,1.0,0.0,0,0,1,0,0,0,4772202,2024-11-17 11:00:00,2024-11-17T11:00,2024,11,13.4,0.0,Clear
06/14/2024,13:00,40.741028,-73.93432,QUEENS,1.0,0.0,0,0,0,0,1,0,4733244,2024-06-14 13:00:00,2024-06-14T13:00,2024,6,25.6,0.0,Cloudy
05/26/2024,7:00,40.72773,-73.90674,QUEENS,1.0,0.0,0,0,0,0,1,0,4727716,2024-05-26 07:00:00,2024-05-26T07:00,2024,5,17.8,0.0,Cloudy
05/25/2024,13:00,40.598522,-73.764465,QUEENS,3.0,0.0,0,0,0,0,3,0,4729792,2024-05-25 13:00:00,2024-05-25T13:00,2024,5,17.5,0.0,Clear
02/27/2024,19:00,40.759327,-73.82597,QUEENS,1.0,0.0,1,0,0,0,0,0,4705650,2024-02-27 19:00:00,2024-02-27T19:00,2024,2,10.3,0.0,Cloudy
11/25/2024,2:00,40.7561,-73.8625,QUEENS,3.0,0.0,0,0,0,0,3,0,4774143,2024-11-25 02:00:00,2024-11-25T02:00,2024,11,4.6,0.0,Clear
05/06/2024,8:00,40.696648,-73.7693,QUEENS,1.0,0.0,0,0,0,0,1,0,4724036,2024-05-06 08:00:00,2024-05-06T08:00,2024,5,14.9,0.0,Cloudy
01/23/2024,0:00,40.672455,-73.846176,QUEENS,0.0,0.0,0,0,0,0,0,0,4697941,2024-01-23 00:00:00,2024-01-23T00:00,2024,1,-0.3,0.0,Cloudy
11/05/2024,8:00,40.67172,-73.85097,QUEENS,2.0,0.0,0,0,0,0,2,0,4769176,2024-11-05 08:00:00,2024-11-05T08:00,2024,11,12.9,0.0,Clear
09/03/2024,16:00,40.697952,-73.83541,QUEENS,1.0,0.0,0,0,1,0,0,0,4752790,2024-09-03 16:00:00,2024-09-03T16:00,2024,9,22.4,0.0,Clear
05/27/2024,8:00,40.74734,-73.88673,QUEENS,1.0,0.0,0,0,1,0,0,0,4727881,2024-05-27 08:00:00,2024-05-27T08:00,2024,5,19.9,0.1,Drizzle
01/05/2024,15:00,40.739883,-73.868996,QUEENS,1.0,0.0,0,0,0,0,1,0,4692929,2024-01-05 15:00:00,2024-01-05T15:00,2024,1,2.8,0.0,Clear
10/05/2024,17:00,40.70636,-73.792534,QUEENS,1.0,0.0,1,0,0,0,0,0,4761332,2024-10-05 17:00:00,2024-10-05T17:00,2024,10,20.5,0.0,Clear
06/15/2024,0:00,40.76193,-73.77212,QUEENS,0.0,0.0,0,0,0,0,0,0,4734377,2024-06-15 00:00:00,2024-06-15T00:00,2024,6,19.2,0.0,Cloudy
02/16/2024,2:00,40.681923,-73.831924,QUEENS,0.0,0.0,0,0,0,0,0,0,4703807,2024-02-16 02:00:00,2024-02-16T02:00,2024,2,1.5,0.0,Clear
07/05/2024,14:00,40.680183,-73.8459,QUEENS,1.0,0.0,0,0,0,0,1,0,4738844,2024-07-05 14:00:00,2024-07-05T14:00,2024,7,26.3,0.0,Cloudy
06/03/2024,15:00,40.658913,-73.75661,QUEENS,1.0,0.0,1,0,0,0,0,0,4729758,2024-06-03 15:00:00,2024-06-03T15:00,2024,6,24.3,0.0,Cloudy
03/24/2024,17:00,40.679344,-73.859535,QUEENS,1.0,0.0,0,0,0,0,1,0,4713802,2024-03-24 17:00:00,2024-03-24T17:00,2024,3,7.4,0.0,Clear
02/16/2024,0:00,40.752098,-73.74142,QUEENS,2.0,0.0,0,0,0,0,2,0,4704353,2024-02-16 00:00:00,2024-02-16T00:00,2024,2,0.5,0.0,Clear
12/07/2024,21:00,40.585194,-73.82392,QUEENS,0.0,0.0,0,0,0,0,0,0,4777838,2024-12-07 21:00:00,2024-12-07T21:00,2024,12,2.8,0.0,Cloudy
12/09/2024,16:00,40.704845,-73.813446,QUEENS,2.0,0.0,0,0,0,0,2,0,4777474,2024-12-09 16:00:00,2024-12-09T16:00,2024,12,10.2,1.5,Light Rain
06/06/2024,0:00,40.77446,-73.84668,QUEENS,0.0,0.0,0,0,0,0,0,0,4730749,2024-06-06 00:00:00,2024-06-06T00:00,2024,6,19.6,0.2,Drizzle
09/11/2024,12:00,40.741302,-73.91719,QUEENS,0.0,0.0,0,0,0,0,0,0,4755019,2024-09-11 12:00:00,2024-09-11T12:00,2024,9,24.9,0.0,Cloudy
05/20/2024,16:00,40.68614,-73.84618,QUEENS,1.0,0.0,0,0,0,0,1,0,4726137,2024-05-20 16:00:00,2024-05-20T16:00,2024,5,17.6,0.0,Cloudy
09/06/2024,14:00,40.749985,-73.81843,QUEENS,0.0,0.0,0,0,0,0,0,0,4755604,2024-09-06 14:00:00,2024-09-06T14:00,2024,9,25.5,0.2,Drizzle
11/18/2024,12:00,40.742256,-73.86552,QUEENS,0.0,0.0,0,0,0,0,0,0,4772632,2024-11-18 12:00:00,2024-11-18T12:00,2024,11,16.7,0.0,Clear
07/03/2024,8:00,40.66675,-73.779945,QUEENS,1.0,0.0,0,0,0,0,1,0,4737775,2024-07-03 08:00:00,2024-07-03T08:00,2024,7,22.7,0.0,Cloudy
09/10/2024,17:00,40.711998,-73.78942,QUEENS,0.0,0.0,0,0,0,0,0,0,4755150,2024-09-10 17:00:00,2024-09-10T17:00,2024,9,24.4,0.0,Clear
06/14/2024,0:00,40.71423,-73.81633,QUEENS,1.0,0.0,0,0,0,0,1,0,4732689,2024-06-14 00:00:00,2024-06-14T00:00,2024,6,20.1,0.0,Clear
02/08/2024,22:00,40.689384,-73.81794,QUEENS,1.0,0.0,0,0,0,0,1,0,4701246,2024-02-08 22:00:00,2024-02-08T22:00,2024,2,4.4,0.0,Cloudy
10/15/2024,11:00,40.734753,-73.863464,QUEENS,1.0,0.0,0,0,0,0,1,0,4763842,2024-10-15 11:00:00,2024-10-15T11:00,2024,10,13.2,0.0,Clear
01/18/2024,10:00,40.76558,-73.80517,QUEENS,2.0,0.0,0,0,0,0,2,0,4695979,2024-01-18 10:00:00,2024-01-18T10:00,2024,1,-3.0,0.1,Light Snow
08/17/2024,23:00,40.678417,-73.729225,QUEENS,3.0,0.0,0,0,0,0,3,0,4749489,2024-08-17 23:00:00,2024-08-17T23:00,2024,8,22.3,0.0,Cloudy
02/05/2024,11:00,40.776894,-73.90976,QUEENS,1.0,0.0,1,0,0,0,0,0,4701411,2024-02-05 11:00:00,2024-02-05T11:00,2024,2,3.3,0.0,Clear
09/24/2024,10:00,40.736813,-73.80577,QUEENS,1.0,0.0,0,0,0,0,0,0,4758522,2024-09-24 10:00:00,2024-09-24T10:00,2024,9,17.9,0.0,Cloudy
05/04/2024,10:00,40.68511,-73.78654,QUEENS,0.0,0.0,0,0,0,0,0,0,4722213,2024-05-04 10:00:00,2024-05-04T10:00,2024,5,15.0,0.0,Cloudy
11/21/2024,14:00,40.70253,-73.81429,QUEENS,1.0,0.0,0,0,0,0,1,0,4774295,2024-11-21 14:00:00,2024-11-21T14:00,2024,11,9.4,0.9,Drizzle
06/23/2024,0:00,40.560757,-73.91044,QUEENS,1.0,0.0,0,0,1,0,0,0,4738157,2024-06-23 00:00:00,2024-06-23T00:00,2024,6,21.9,0.0,Cloudy
07/27/2024,6:00,40.713642,-73.80694,QUEENS,0.0,0.0,0,0,0,0,0,0,4743276,2024-07-27 06:00:00,2024-07-27T06:00,2024,7,19.4,0.0,Clear
06/26/2024,0:00,40.699924,-73.78863,QUEENS,1.0,0.0,1,0,0,0,0,0,4735844,2024-06-26 00:00:00,2024-06-26T00:00,2024,6,23.8,0.0,Cloudy
04/02/2024,0:00,40.664597,-73.76331,QUEENS,1.0,0.0,0,0,0,0,0,0,4714268,2024-04-02 00:00:00,2024-04-02T00:00,2024,4,8.3,0.0,Cloudy
04/15/2024,0:00,40.718506,-73.793304,QUEENS,1.0,0.0,0,0,0,0,1,0,4718003,2024-04-15 00:00:00,2024-04-15T00:00,2024,4,15.6,0.0,Clear
12/31/2024,9:00,40.75595,-73.881645,QUEENS,1.0,0.0,1,0,0,0,0,0,4784109,2024-12-31 09:00:00,2024-12-31T09:00,2024,12,3.8,0.0,Clear
01/17/2024,21:00,40.694107,-73.863144,QUEENS,2.0,0.0,0,0,0,0,2,0,4696875,2024-01-17 21:00:00,2024-01-17T21:00,2024,1,-5.7,0.0,Clear
11/13/2024,21:00,40.731777,-73.77011,QUEENS,1.0,0.0,0,0,0,0,1,0,4771160,2024-11-13 21:00:00,2024-11-13T21:00,2024,11,4.9,0.0,Clear
06/16/2024,4:00,40.669876,-73.8172,QUEENS,1.0,0.0,0,0,0,0,1,0,4733285,2024-06-16 04:00:00,2024-06-16T04:00,2024,6,15.2,0.0,Cloudy
12/16/2024,12:00,40.70058,-73.80774,QUEENS,1.0,0.0,1,0,0,0,0,0,4779981,2024-12-16 12:00:00,2024-12-16T12:00,2024,12,8.2,0.3,Drizzle
04/16/2024,16:00,40.74428,-73.861786,QUEENS,1.0,0.0,0,0,0,0,0,0,4718411,2024-04-16 16:00:00,2024-04-16T16:00,2024,4,20.2,0.0,Clear
09/27/2024,21:00,40.689953,-73.826004,QUEENS,1.0,0.0,1,0,0,0,0,0,4759172,2024-09-27 21:00:00,2024-09-27T21:00,2024,9,18.6,0.1,Drizzle
05/09/2024,8:00,40.743855,-73.82221,QUEENS,1.0,0.0,1,0,0,0,0,0,4723514,2024-05-09 08:00:00,2024-05-09T08:00,2024,5,17.3,0.0,Cloudy
04/02/2024,11:00,40.771534,-73.91428,QUEENS,1.0,0.0,0,0,0,0,1,0,4714689,2024-04-02 11:00:00,2024-04-02T11:00,2024,4,7.8,0.6,Drizzle
05/21/2024,8:00,40.757225,-73.869514,QUEENS,1.0,0.0,0,0,0,0,0,0,4726719,2024-05-21 08:00:00,2024-05-21T08:00,2024,5,18.3,0.0,Clear
01/28/2024,23:00,40.76942,-73.880295,QUEENS,1.0,0.0,0,0,0,0,1,0,4698954,2024-01-28 23:00:00,2024-01-28T23:00,2024,1,2.7,0.1,Drizzle
03/19/2024,17:00,40.7495,-73.94667,QUEENS,1.0,0.0,0,0,0,0,1,0,4711597,2024-03-19 17:00:00,2024-03-19T17:00,2024,3,6.3,0.0,Cloudy
11/06/2024,11:00,40.74694,-73.88942,QUEENS,2.0,0.0,1,0,0,0,1,0,4771206,2024-11-06 11:00:00,2024-11-06T11:00,2024,11,23.6,0.0,Clear
03/10/2024,18:00,40.671413,-73.789215,QUEENS,0.0,0.0,0,0,0,0,0,0,4709424,2024-03-10 18:00:00,2024-03-10T18:00,2024,3,6.2,0.0,Cloudy
09/12/2024,14:00,40.677883,-73.74561,QUEENS,2.0,0.0,0,0,0,0,2,0,4755903,2024-09-12 14:00:00,2024-09-12T14:00,2024,9,23.1,0.0,Clear
08/21/2024,7:00,40.720024,-73.8132,QUEENS,0.0,0.0,0,0,0,0,0,0,4749644,2024-08-21 07:00:00,2024-08-21T07:00,2024,8,14.8,0.0,Clear
11/15/2024,14:00,40.753326,-73.871796,QUEENS,1.0,0.0,1,0,0,0,0,0,4771540,2024-11-15 14:00:00,2024-11-15T14:00,2024,11,13.8,0.0,Clear
04/15/2024,9:00,40.7258,-73.81069,QUEENS,1.0,0.0,0,0,0,0,1,0,4717353,2024-04-15 09:00:00,2024-04-15T09:00,2024,4,20.1,0.0,Cloudy
02/14/2024,17:00,40.726707,-73.74752,QUEENS,2.0,0.0,0,0,0,0,2,0,4702588,2024-02-14 17:00:00,2024-02-14T17:00,2024,2,-0.2,0.0,Clear
05/19/2024,0:00,40.742657,-73.91006,QUEENS,1.0,0.0,1,0,0,0,0,0,4726486,2024-05-19 00:00:00,2024-05-19T00:00,2024,5,13.3,0.0,Cloudy
03/04/2024,10:00,40.754974,-73.93106,QUEENS,1.0,0.0,0,0,0,0,1,0,4707145,2024-03-04 10:00:00,2024-03-04T10:00,2024,3,12.6,0.0,Cloudy
03/17/2024,3:00,40.78643,-73.793274,QUEENS,1.0,0.0,0,0,0,0,1,0,4710225,2024-03-17 03:00:00,2024-03-17T03:00,2024,3,8.2,0.9,Drizzle
04/21/2024,21:00,40.69648,-73.836975,QUEENS,0.0,0.0,0,0,0,0,0,0,4720598,2024-04-21 21:00:00,2024-04-21T21:00,2024,4,6.7,0.0,Cloudy
03/16/2024,23:00,40.764584,-73.815834,QUEENS,1.0,0.0,0,0,1,0,0,0,4710226,2024-03-16 23:00:00,2024-03-16T23:00,2024,3,7.6,0.0,Clear
02/06/2024,0:00,40.755688,-73.84211,QUEENS,1.0,0.0,0,0,0,0,1,0,4700523,2024-02-06 00:00:00,2024-02-06T00:00,2024,2,-2.7,0.0,Clear
02/19/2024,15:00,40.69165,-73.779205,QUEENS,2.0,0.0,0,0,0,0,2,0,4704020,2024-02-19 15:00:00,2024-02-19T15:00,2024,2,3.7,0.0,Clear
12/23/2024,9:00,40.711372,-73.850334,QUEENS,1.0,0.0,1,0,0,0,0,0,4780874,2024-12-23 09:00:00,2024-12-23T09:00,2024,12,-11.1,0.0,Clear
11/28/2024,19:00,40.654358,-73.73197,QUEENS,5.0,0.0,0,0,0,0,5,0,4776266,2024-11-28 19:00:00,2024-11-28T19:00,2024,11,6.1,0.0,Cloudy
09/25/2024,0:00,40.7609,-73.87018,QUEENS,1.0,0.0,0,0,0,0,1,0,4758990,2024-09-25 00:00:00,2024-09-25T00:00,2024,9,16.7,0.0,Cloudy
09/28/2024,19:00,40.71461,-73.80255,QUEENS,0.0,0.0,0,0,0,0,0,0,4759297,2024-09-28 19:00:00,2024-09-28T19:00,2024,9,18.0,0.0,Cloudy
08/05/2024,5:00,40.754963,-73.864105,QUEENS,1.0,0.0,0,0,0,0,1,0,4745581,2024-08-05 05:00:00,2024-08-05T05:00,2024,8,21.0,0.0,Clear
02/13/2024,9:00,40.7178,-73.80358,QUEENS,1.0,0.0,1,0,0,0,0,0,4702280,2024-02-13 09:00:00,2024-02-13T09:00,2024,2,0.4,2.6,Heavy Snow
01/28/2024,19:00,40.722683,-73.8197,QUEENS,1.0,0.0,1,0,0,0,0,0,4698423,2024-01-28 19:00:00,2024-01-28T19:00,2024,1,2.6,0.3,Drizzle
09/18/2024,19:00,40.75962,-73.882324,QUEENS,3.0,0.0,0,0,0,0,3,0,4759072,2024-09-18 19:00:00,2024-09-18T19:00,2024,9,21.8,0.0,Cloudy
06/30/2024,16:00,40.760128,-73.73159,QUEENS,1.0,0.0,0,0,0,0,1,0,4737152,2024-06-30 16:00:00,2024-06-30T16:00,2024,6,27.9,0.2,Drizzle
10/26/2024,22:00,40.749165,-73.8899,QUEENS,2.0,0.0,0,0,0,0,2,0,4767850,2024-10-26 22:00:00,2024-10-26T22:00,2024,10,11.1,0.0,Clear
11/02/2024,0:00,40.761192,-73.76212,QUEENS,2.0,0.0,0,0,0,0,2,0,4768206,2024-11-02 00:00:00,2024-11-02T00:00,2024,11,13.1,0.0,Clear
07/24/2024,16:00,40.751316,-73.885544,QUEENS,1.0,0.0,0,0,1,0,0,0,4742980,2024-07-24 16:00:00,2024-07-24T16:00,2024,7,26.7,0.0,Cloudy
02/17/2024,7:00,40.596703,-73.77835,QUEENS,0.0,0.0,0,0,0,0,0,0,4703203,2024-02-17 07:00:00,2024-02-17T07:00,2024,2,0.1,0.3,Heavy Snow
04/13/2024,23:00,40.70276,-73.88894,QUEENS,1.0,0.0,0,0,0,0,1,0,4717612,2024-04-13 23:00:00,2024-04-13T23:00,2024,4,8.5,0.0,Clear
11/04/2024,9:00,40.718876,-73.81336,QUEENS,1.0,0.0,1,0,0,0,0,0,4768805,2024-11-04 09:00:00,2024-11-04T09:00,2024,11,10.3,0.0,Cloudy
12/24/2024,0:00,40.74219,-73.86594,QUEENS,1.0,0.0,1,0,0,0,0,0,4782836,2024-12-24 00:00:00,2024-12-24T00:00,2024,12,-3.1,0.0,Cloudy
01/13/2024,22:00,40.74668,-73.81478,QUEENS,1.0,0.0,0,0,0,0,1,0,4694721,2024-01-13 22:00:00,2024-01-13T22:00,2024,1,2.0,0.0,Clear
01/23/2024,7:00,40.757515,-73.81857,QUEENS,0.0,0.0,0,0,0,0,0,0,4697319,2024-01-23 07:00:00,2024-01-23T07:00,2024,1,-0.7,0.0,Cloudy
07/18/2024,16:00,40.7146,-73.74023,QUEENS,1.0,0.0,0,0,1,0,0,0,4744910,2024-07-18 16:00:00,2024-07-18T16:00,2024,7,30.5,0.0,Cloudy
10/10/2024,14:00,40.75967,-73.92725,QUEENS,2.0,0.0,0,0,1,0,1,0,4763001,2024-10-10 14:00:00,2024-10-10T14:00,2024,10,18.1,0.0,Clear
07/25/2024,16:00,40.739876,-73.90315,QUEENS,1.0,0.0,0,0,0,0,1,0,4743036,2024-07-25 16:00:00,2024-07-25T16:00,2024,7,30.8,0.0,Cloudy
08/14/2024,19:00,40.709846,-73.806335,QUEENS,3.0,0.0,0,0,0,0,3,0,4748012,2024-08-14 19:00:00,2024-08-14T19:00,2024,8,24.3,0.0,Clear
10/24/2024,17:00,40.67054,-73.820885,QUEENS,1.0,0.0,1,0,0,0,0,0,4766126,2024-10-24 17:00:00,2024-10-24T17:00,2024,10,16.6,0.0,Clear
11/08/2024,22:00,40.66632,-73.80168,QUEENS,1.0,0.0,0,0,0,0,1,0,4770319,2024-11-08 22:00:00,2024-11-08T22:00,2024,11,13.8,0.0,Clear
06/08/2024,17:00,40.7686,-73.79343,QUEENS,0.0,0.0,0,0,0,0,0,0,4731066,2024-06-08 17:00:00,2024-06-08T17:00,2024,6,24.6,0.0,Clear
07/24/2024,15:00,40.709866,-73.81642,QUEENS,1.0,0.0,0,0,0,0,0,0,4742774,2024-07-24 15:00:00,2024-07-24T15:00,2024,7,27.1,0.0,Cloudy
09/04/2024,14:00,40.707203,-73.79488,QUEENS,1.0,0.0,1,0,0,0,0,0,4754051,2024-09-04 14:00:00,2024-09-04T14:00,2024,9,24.0,0.0,Clear
05/10/2024,3:00,40.752995,-73.87161,QUEENS,1.0,0.0,1,0,0,0,0,0,4723680,2024-05-10 03:00:00,2024-05-10T03:00,2024,5,10.5,0.9,Drizzle
09/10/2024,11:00,40.71035,-73.7939,QUEENS,1.0,0.0,0,0,0,0,1,0,4754972,2024-09-10 11:00:00,2024-09-10T11:00,2024,9,23.0,0.0,Clear
09/23/2024,17:00,40.708447,-73.800224,QUEENS,1.0,0.0,0,0,0,0,1,0,4758221,2024-09-23 17:00:00,2024-09-23T17:00,2024,9,19.2,0.0,Cloudy
11/02/2024,14:00,40.734272,-73.862595,QUEENS,1.0,0.0,0,0,0,0,1,0,4768320,2024-11-02 14:00:00,2024-11-02T14:00,2024,11,16.1,0.0,Clear
10/21/2024,10:00,40.67817,-73.7352,QUEENS,1.0,0.0,0,0,0,0,1,0,4765696,2024-10-21 10:00:00,2024-10-21T10:00,2024,10,19.6,0.0,Clear
09/15/2024,19:00,40.659115,-73.74221,QUEENS,5.0,0.0,0,0,0,0,5,0,4757156,2024-09-15 19:00:00,2024-09-15T19:00,2024,9,19.0,0.0,Clear
04/04/2024,0:00,40.76444,-73.88132,QUEENS,0.0,0.0,0,0,0,0,0,0,4715657,2024-04-04 00:00:00,2024-04-04T00:00,2024,4,4.9,2.5,Heavy Rain
06/26/2024,13:00,40.753345,-73.7068,QUEENS,1.0,0.0,0,0,0,0,1,0,4736173,2024-06-26 13:00:00,2024-06-26T13:00,2024,6,28.4,0.0,Clear
03/19/2024,17:00,40.685894,-73.86524,QUEENS,1.0,0.0,0,0,0,0,1,0,4711064,2024-03-19 17:00:00,2024-03-19T17:00,2024,3,6.4,0.0,Cloudy
11/17/2024,5:00,40.74823,-73.88327,QUEENS,1.0,0.0,0,0,0,0,1,0,4772020,2024-11-17 05:00:00,2024-11-17T05:00,2024,11,6.7,0.0,Clear
02/18/2024,11:00,40.740837,-73.7583,QUEENS,1.0,0.0,0,0,0,0,1,0,4703335,2024-02-18 11:00:00,2024-02-18T11:00,2024,2,-0.9,0.0,Clear
06/21/2024,17:00,40.75464,-73.882355,QUEENS,1.0,0.0,0,0,0,0,1,0,4735991,2024-06-21 17:00:00,2024-06-21T17:00,2024,6,29.0,0.0,Clear
07/21/2024,8:00,40.697857,-73.80417,QUEENS,1.0,0.0,0,0,1,0,0,0,4742008,2024-07-21 08:00:00,2024-07-21T08:00,2024,7,26.1,0.0,Clear
09/20/2024,18:00,40.66743,-73.76676,QUEENS,1.0,0.0,0,0,0,0,1,0,4758938,2024-09-20 18:00:00,2024-09-20T18:00,2024,9,23.3,0.0,Clear
01/12/2024,0:00,40.742374,-73.85527,QUEENS,1.0,0.0,0,0,1,0,0,0,4694610,2024-01-12 00:00:00,2024-01-12T00:00,2024,1,2.4,0.0,Clear
07/27/2024,19:00,40.763447,-73.8153,QUEENS,1.0,0.0,0,0,0,0,1,0,4743497,2024-07-27 19:00:00,2024-07-27T19:00,2024,7,24.2,0.0,Clear
08/07/2024,8:00,40.75397,-73.726,QUEENS,1.0,0.0,1,0,0,0,0,0,4746156,2024-08-07 08:00:00,2024-08-07T08:00,2024,8,19.8,0.2,Drizzle
12/19/2024,16:00,40.760513,-73.82913,QUEENS,0.0,0.0,0,0,0,0,0,0,4780442,2024-12-19 16:00:00,2024-12-19T16:00,2024,12,5.2,0.0,Cloudy
08/24/2024,7:00,40.689243,-73.84501,QUEENS,1.0,0.0,0,0,0,0,1,0,4750603,2024-08-24 07:00:00,2024-08-24T07:00,2024,8,18.3,0.0,Clear
03/30/2024,23:00,40.74617,-73.89021,QUEENS,1.0,0.0,0,0,1,0,0,0,4714316,2024-03-30 23:00:00,2024-03-30T23:00,2024,3,8.7,0.0,Cloudy
11/06/2024,9:00,40.70382,-73.89105,QUEENS,1.0,0.0,0,0,1,0,0,0,4769371,2024-11-06 09:00:00,2024-11-06T09:00,2024,11,20.4,0.0,Clear
10/19/2024,22:00,40.726376,-73.73598,QUEENS,0.0,0.0,0,0,0,0,0,0,4764908,2024-10-19 22:00:00,2024-10-19T22:00,2024,10,10.3,0.0,Clear
12/26/2024,13:00,40.753113,-73.71526,QUEENS,1.0,0.0,0,0,0,0,1,0,4781589,2024-12-26 13:00:00,2024-12-26T13:00,2024,12,-0.2,0.0,Clear
09/17/2024,0:00,40.766552,-73.870155,QUEENS,0.0,0.0,0,0,0,0,0,0,4760695,2024-09-17 00:00:00,2024-09-17T00:00,2024,9,16.3,0.0,Cloudy
07/18/2024,23:00,40.66857,-73.798355,QUEENS,2.0,0.0,0,0,0,0,2,0,4742730,2024-07-18 23:00:00,2024-07-18T23:00,2024,7,22.8,0.0,Clear
09/30/2024,9:00,40.76144,-73.84253,QUEENS,1.0,0.0,0,0,1,0,0,0,4760294,2024-09-30 09:00:00,2024-09-30T09:00,2024,9,19.3,0.0,Cloudy
11/28/2024,9:00,40.74826,-73.81654,QUEENS,1.0,0.0,0,0,0,0,1,0,4774876,2024-11-28 09:00:00,2024-11-28T09:00,2024,11,9.2,1.5,Light Rain
01/02/2024,15:00,40.674557,-73.859604,QUEENS,1.0,0.0,0,0,0,0,1,0,4692137,2024-01-02 15:00:00,2024-01-02T15:00,2024,1,5.2,0.0,Clear
09/24/2024,3:00,40.747665,-73.94506,QUEENS,1.0,0.0,0,0,1,0,0,0,4758862,2024-09-24 03:00:00,2024-09-24T03:00,2024,9,16.1,0.0,Cloudy
08/28/2024,11:00,40.758274,-73.93336,QUEENS,0.0,0.0,0,0,0,0,0,0,4753074,2024-08-28 11:00:00,2024-08-28T11:00,2024,8,32.4,0.0,Clear
02/22/2024,0:00,40.759274,-73.82273,QUEENS,1.0,0.0,1,0,0,0,0,0,4704874,2024-02-22 00:00:00,2024-02-22T00:00,2024,2,-2.8,0.0,Cloudy
03/03/2024,15:00,40.753014,-73.87164,QUEENS,1.0,0.0,0,0,1,0,0,0,4706624,2024-03-03 15:00:00,2024-03-03T15:00,2024,3,18.6,0.0,Clear
05/05/2024,0:00,40.681026,-73.76689,QUEENS,1.0,0.0,0,0,0,0,1,0,4722856,2024-05-05 00:00:00,2024-05-05T00:00,2024,5,9.5,0.0,Cloudy
04/04/2024,15:00,40.671684,-73.75647,QUEENS,0.0,0.0,0,0,0,0,0,0,4714849,2024-04-04 15:00:00,2024-04-04T15:00,2024,4,8.7,0.0,Cloudy
03/10/2024,19:00,40.714306,-73.818184,QUEENS,1.0,0.0,0,0,1,0,0,0,4710269,2024-03-10 19:00:00,2024-03-10T19:00,2024,3,4.7,0.0,Cloudy
09/18/2024,20:00,40.69296,-73.77164,QUEENS,1.0,0.0,0,0,0,0,1,0,4757465,2024-09-18 20:00:00,2024-09-18T20:00,2024,9,21.2,0.0,Cloudy
08/22/2024,14:00,40.753304,-73.912575,QUEENS,1.0,0.0,0,0,0,0,0,0,4750318,2024-08-22 14:00:00,2024-08-22T14:00,2024,8,24.2,0.0,Cloudy
07/11/2024,23:00,40.717594,-73.73247,QUEENS,0.0,0.0,0,0,0,0,0,0,4742615,2024-07-11 23:00:00,2024-07-11T23:00,2024,7,23.2,0.0,Clear
10/17/2024,11:00,40.636044,-73.740265,QUEENS,1.0,0.0,0,0,0,0,1,0,4764164,2024-10-17 11:00:00,2024-10-17T11:00,2024,10,12.9,0.0,Clear
10/14/2024,20:00,40.703278,-73.73621,QUEENS,3.0,0.0,0,0,0,0,3,0,4763975,2024-10-14 20:00:00,2024-10-14T20:00,2024,10,9.6,0.0,Clear
07/20/2024,22:00,40.746075,-73.86408,QUEENS,1.0,0.0,0,0,0,0,1,0,4741697,2024-07-20 22:00:00,2024-07-20T22:00,2024,7,24.8,0.0,Cloudy
05/28/2024,11:00,40.770313,-73.87603,QUEENS,1.0,0.0,0,0,0,0,1,0,4728042,2024-05-28 11:00:00,2024-05-28T11:00,2024,5,24.8,0.0,Clear
07/27/2024,12:00,40.70439,-73.796875,QUEENS,1.0,0.0,0,0,0,0,1,0,4744785,2024-07-27 12:00:00,2024-07-27T12:00,2024,7,29.2,0.0,Cloudy
12/06/2024,19:00,40.711224,-73.7809,QUEENS,1.0,0.0,0,0,1,0,0,0,4779012,2024-12-06 19:00:00,2024-12-06T19:00,2024,12,-2.3,0.0,Cloudy
05/23/2024,8:00,40.69317,-73.75688,QUEENS,2.0,0.0,0,0,0,0,2,0,4726880,2024-05-23 08:00:00,2024-05-23T08:00,2024,5,19.9,2.4,Light Rain
05/31/2024,14:00,40.75463,-73.92557,QUEENS,0.0,1.0,0,0,0,0,0,1,4729469,2024-05-31 14:00:00,2024-05-31T14:00,2024,5,23.1,0.0,Cloudy
06/06/2024,1:00,40.754955,-73.85384,QUEENS,1.0,0.0,0,0,0,0,1,0,4731050,2024-06-06 01:00:00,2024-06-06T01:00,2024,6,19.4,1.9,Light Rain
11/17/2024,19:00,40.752052,-73.830696,QUEENS,1.0,0.0,1,0,0,0,0,0,4771982,2024-11-17 19:00:00,2024-11-17T19:00,2024,11,13.4,0.0,Cloudy
08/23/2024,1:00,40.68947,-73.86515,QUEENS,3.0,0.0,0,0,0,0,3,0,4750000,2024-08-23 01:00:00,2024-08-23T01:00,2024,8,16.7,0.0,Clear
05/17/2024,16:00,40.66851,-73.76626,QUEENS,1.0,0.0,1,0,0,0,0,0,4728325,2024-05-17 16:00:00,2024-05-17T16:00,2024,5,19.7,0.0,Cloudy
07/24/2024,13:00,40.719624,-73.91132,QUEENS,1.0,0.0,0,0,0,0,0,0,4743653,2024-07-24 13:00:00,2024-07-24T13:00,2024,7,28.8,0.0,Cloudy
12/17/2024,18:00,40.75487,-73.82398,QUEENS,1.0,0.0,1,0,0,0,0,0,4782401,2024-12-17 18:00:00,2024-12-17T18:00,2024,12,11.2,0.0,Clear
12/01/2024,6:00,40.698692,-73.83407,QUEENS,4.0,0.0,0,0,0,0,4,0,4775526,2024-12-01 06:00:00,2024-12-01T06:00,2024,12,-2.9,0.0,Clear
02/04/2024,23:00,40.69005,-73.79809,QUEENS,2.0,0.0,1,0,0,0,1,0,4700254,2024-02-04 23:00:00,2024-02-04T23:00,2024,2,-0.9,0.0,Clear
10/05/2024,3:00,40.74159,-73.86186,QUEENS,1.0,0.0,1,0,0,0,0,0,4761543,2024-10-05 03:00:00,2024-10-05T03:00,2024,10,16.8,0.0,Clear
02/12/2024,19:00,40.689884,-73.858116,QUEENS,1.0,0.0,1,0,0,0,0,0,4703576,2024-02-12 19:00:00,2024-02-12T19:00,2024,2,4.6,0.0,Cloudy
08/03/2024,17:00,40.7494,-73.87573,QUEENS,0.0,0.0,0,0,0,0,0,0,4746002,2024-08-03 17:00:00,2024-08-03T17:00,2024,8,29.1,0.1,Drizzle
05/20/2024,16:00,40.752068,-73.926476,QUEENS,1.0,0.0,0,0,0,0,0,0,4726159,2024-05-20 16:00:00,2024-05-20T16:00,2024,5,19.5,0.0,Cloudy
06/04/2024,8:00,40.692345,-73.804695,QUEENS,1.0,0.0,1,0,0,0,0,0,4730538,2024-06-04 08:00:00,2024-06-04T08:00,2024,6,21.1,0.0,Clear
03/01/2024,7:00,40.75067,-73.863106,QUEENS,1.0,0.0,1,0,0,0,0,0,4706385,2024-03-01 07:00:00,2024-03-01T07:00,2024,3,-3.6,0.0,Clear
04/30/2024,19:00,40.74806,-73.87997,QUEENS,1.0,0.0,0,0,0,0,1,0,4721228,2024-04-30 19:00:00,2024-04-30T19:00,2024,4,14.8,0.0,Cloudy
09/26/2024,15:00,40.691315,-73.86722,QUEENS,2.0,0.0,2,0,0,0,0,0,4759002,2024-09-26 15:00:00,2024-09-26T15:00,2024,9,22.3,0.3,Drizzle
07/31/2024,19:00,40.74572,-73.95055,QUEENS,0.0,0.0,0,0,0,0,0,0,4744993,2024-07-31 19:00:00,2024-07-31T19:00,2024,7,24.9,0.0,Clear
10/14/2024,0:00,40.606026,-73.822044,QUEENS,0.0,0.0,0,0,0,0,0,0,4763277,2024-10-14 00:00:00,2024-10-14T00:00,2024,10,20.2,0.0,Clear
08/06/2024,13:00,40.78167,-73.83152,QUEENS,1.0,0.0,0,0,0,0,0,0,4746016,2024-08-06 13:00:00,2024-08-06T13:00,2024,8,29.4,4.1,Heavy Rain
05/05/2024,13:00,40.701767,-73.807,QUEENS,1.0,0.0,1,0,0,0,0,0,4723109,2024-05-05 13:00:00,2024-05-05T13:00,2024,5,10.9,0.3,Drizzle
06/04/2024,18:00,40.76315,-73.81261,QUEENS,1.0,0.0,1,0,0,0,0,0,4730113,2024-06-04 18:00:00,2024-06-04T18:00,2024,6,19.6,0.0,Cloudy
05/03/2024,8:00,40.731277,-73.871574,QUEENS,1.0,0.0,0,0,0,0,1,0,4721861,2024-05-03 08:00:00,2024-05-03T08:00,2024,5,14.0,0.0,Cloudy
09/03/2024,12:00,40.687153,-73.847305,QUEENS,1.0,0.0,0,0,0,0,1,0,4752787,2024-09-03 12:00:00,2024-09-03T12:00,2024,9,22.1,0.0,Clear
11/28/2024,3:00,40.75444,-73.83028,QUEENS,0.0,0.0,0,0,0,0,0,0,4778373,2024-11-28 03:00:00,2024-11-28T03:00,2024,11,5.2,0.5,Drizzle
09/09/2024,18:00,40.72792,-73.87101,QUEENS,1.0,0.0,0,0,0,0,1,0,4755131,2024-09-09 18:00:00,2024-09-09T18:00,2024,9,22.3,0.0,Clear
05/26/2024,0:00,40.682377,-73.767166,QUEENS,4.0,0.0,0,0,0,0,4,0,4727785,2024-05-26 00:00:00,2024-05-26T00:00,2024,5,15.4,0.0,Cloudy
06/20/2024,9:00,40.758755,-73.8417,QUEENS,2.0,0.0,2,0,0,0,0,0,4735328,2024-06-20 09:00:00,2024-06-20T09:00,2024,6,27.5,0.0,Cloudy
03/17/2024,9:00,40.687046,-73.792114,QUEENS,1.0,0.0,0,0,0,0,1,0,4710406,2024-03-17 09:00:00,2024-03-17T09:00,2024,3,11.6,0.0,Cloudy
03/15/2024,11:00,40.699856,-73.84063,QUEENS,2.0,0.0,0,0,0,0,2,0,4709830,2024-03-15 11:00:00,2024-03-15T11:00,2024,3,19.1,0.0,Cloudy
03/16/2024,15:00,40.52128,-74.23946,STATEN ISLAND,1.0,0.0,0,0,0,0,1,0,4710202,2024-03-16 15:00:00,2024-03-16T15:00,2024,3,15.2,0.0,Clear
07/08/2024,21:00,40.640907,-74.08134,STATEN ISLAND,1.0,0.0,0,0,0,0,1,0,4739024,2024-07-08 21:00:00,2024-07-08T21:00,2024,7,24.3,0.0,Cloudy
12/18/2024,12:00,40.62016,-74.07696,STATEN ISLAND,1.0,0.0,1,0,0,0,0,0,4779917,2024-12-18 12:00:00,2024-12-18T12:00,2024,12,8.9,0.0,Clear
06/25/2024,8:00,40.57123,-74.1323,STATEN ISLAND,0.0,0.0,0,0,0,0,0,0,4737249,2024-06-25 08:00:00,2024-06-25T08:00,2024,6,25.8,0.0,Clear
12/17/2024,11:00,40.579178,-74.11482,STATEN ISLAND,1.0,0.0,0,0,0,0,1,0,4780232,2024-12-17 11:00:00,2024-12-17T11:00,2024,12,12.1,0.0,Cloudy
04/05/2024,15:00,40.639652,-74.07551,STATEN ISLAND,1.0,0.0,0,0,0,0,1,0,4715910,2024-04-05 15:00:00,2024-04-05T15:00,2024,4,9.3,0.0,Cloudy
10/13/2024,0:00,40.50429,-74.24434,STATEN ISLAND,2.0,0.0,0,0,0,0,2,0,4763333,2024-10-13 00:00:00,2024-10-13T00:00,2024,10,11.7,0.0,Cloudy
12/30/2024,16:00,40.5953,-74.11038,STATEN ISLAND,2.0,0.0,0,0,0,0,2,0,4782712,2024-12-30 16:00:00,2024-12-30T16:00,2024,12,10.5,0.0,Clear
12/02/2024,14:00,40.527668,-74.23023,STATEN ISLAND,1.0,0.0,0,0,0,0,1,0,4775825,2024-12-02 14:00:00,2024-12-02T14:00,2024,12,4.0,0.0,Cloudy
03/16/2024,14:00,40.58124,-74.09845,STATEN ISLAND,0.0,0.0,0,0,0,0,0,0,4710222,2024-03-16 14:00:00,2024-03-16T14:00,2024,3,12.9,0.0,Clear
07/12/2024,23:00,40.53275,-74.238976,STATEN ISLAND,0.0,0.0,0,0,0,0,0,0,4740675,2024-07-12 23:00:00,2024-07-12T23:00,2024,7,23.5,0.0,Cloudy
01/01/2024,1:00,40.564323,-74.098434,STATEN ISLAND,1.0,0.0,1,0,0,0,0,0,4692058,2024-01-01 01:00:00,2024-01-01T01:00,2024,1,3.2,0.0,Cloudy
12/08/2024,6:00,40.509674,-74.247475,STATEN ISLAND,0.0,0.0,0,0,0,0,0,0,4777049,2024-12-08 06:00:00,2024-12-08T06:00,2024,12,3.4,0.0,Cloudy
08/03/2024,19:00,40.528,-74.23547,STATEN ISLAND,0.0,0.0,0,0,0,0,0,0,4747700,2024-08-03 19:00:00,2024-08-03T19:00,2024,8,25.0,0.0,Cloudy
05/25/2024,12:00,40.52503,-74.23927,STATEN ISLAND,1.0,0.0,0,0,0,0,1,0,4727593,2024-05-25 12:00:00,2024-05-25T12:00,2024,5,23.7,0.0,Cloudy
05/08/2024,21:00,40.499672,-74.237915,STATEN ISLAND,1.0,0.0,0,0,0,0,1,0,4723310,2024-05-08 21:00:00,2024-05-08T21:00,2024,5,23.3,0.0,Cloudy
08/06/2024,17:00,40.54754,-74.14409,STATEN ISLAND,1.0,0.0,0,0,1,0,0,0,4746120,2024-08-06 17:00:00,2024-08-06T17:00,2024,8,26.0,2.6,Heavy Rain
04/02/2024,12:00,40.54547,-74.1603,STATEN ISLAND,0.0,0.0,0,0,0,0,0,0,4714428,2024-04-02 12:00:00,2024-04-02T12:00,2024,4,7.4,1.4,Light Rain
01/11/2024,16:00,40.58734,-74.09217,STATEN ISLAND,1.0,0.0,0,0,0,0,1,0,4694675,2024-01-11 16:00:00,2024-01-11T16:00,2024,1,7.5,0.0,Clear
01/30/2024,8:00,40.63277,-74.09004,STATEN ISLAND,2.0,0.0,0,0,0,0,2,0,4698890,2024-01-30 08:00:00,2024-01-30T08:00,2024,1,-2.1,0.0,Clear
10/10/2024,10:00,40.62343,-74.08924,STATEN ISLAND,1.0,0.0,1,0,0,0,0,0,4762387,2024-10-10 10:00:00,2024-10-10T10:00,2024,10,12.6,0.0,Clear
07/09/2024,16:00,40.58124,-74.09845,STATEN ISLAND,4.0,0.0,0,0,0,0,4,0,4739446,2024-07-09 16:00:00,2024-07-09T16:00,2024,7,27.7,0.2,Drizzle
11/26/2024,17:00,40.606846,-74.07586,STATEN ISLAND,0.0,0.0,0,0,0,0,0,0,4775995,2024-11-26 17:00:00,2024-11-26T17:00,2024,11,12.6,0.0,Clear
09/09/2024,22:00,40.524,-74.186104,STATEN ISLAND,2.0,0.0,0,0,0,0,2,0,4754741,2024-09-09 22:00:00,2024-09-09T22:00,2024,9,17.2,0.0,Cloudy
08/03/2024,4:00,40.60574,-74.08353,STATEN ISLAND,1.0,0.0,0,0,0,0,1,0,4744954,2024-08-03 04:00:00,2024-08-03T04:00,2024,8,23.6,0.0,Cloudy
03/06/2024,8:00,40.63878,-74.07575,STATEN ISLAND,1.0,0.0,0,0,1,0,0,0,4707468,2024-03-06 08:00:00,2024-03-06T08:00,2024,3,6.8,0.0,Cloudy
10/10/2024,17:00,40.55613,-74.13963,STATEN ISLAND,1.0,0.0,1,0,0,0,0,0,4762850,2024-10-10 17:00:00,2024-10-10T17:00,2024,10,15.6,0.0,Clear
09/30/2024,22:00,40.5377,-74.15002,STATEN ISLAND,1.0,0.0,1,0,0,0,0,0,4760613,2024-09-30 22:00:00,2024-09-30T22:00,2024,9,17.4,0.0,Cloudy
06/22/2024,11:00,40.555473,-74.180756,STATEN ISLAND,2.0,0.0,0,0,0,0,2,0,4734805,2024-06-22 11:00:00,2024-06-22T11:00,2024,6,33.3,0.0,Clear
01/25/2024,19:00,40.505188,-74.24654,STATEN ISLAND,0.0,0.0,0,0,0,0,0,0,4697924,2024-01-25 19:00:00,2024-01-25T19:00,2024,1,8.8,0.0,Cloudy
07/12/2024,21:00,40.644466,-74.07686,STATEN ISLAND,1.0,0.0,0,0,1,0,0,0,4742320,2024-07-12 21:00:00,2024-07-12T21:00,2024,7,24.1,0.4,Drizzle
09/13/2024,7:00,40.5377,-74.15002,STATEN ISLAND,0.0,0.0,0,0,0,0,0,0,4756110,2024-09-13 07:00:00,2024-09-13T07:00,2024,9,16.2,0.0,Clear
01/08/2024,17:00,40.608727,-74.08839,STATEN ISLAND,1.0,0.0,0,0,0,0,1,0,4693686,2024-01-08 17:00:00,2024-01-08T17:00,2024,1,5.0,0.0,Clear
06/29/2024,10:00,40.626842,-74.075745,STATEN ISLAND,1.0,0.0,0,0,0,0,0,0,4737580,2024-06-29 10:00:00,2024-06-29T10:00,2024,6,25.1,0.2,Drizzle
10/30/2024,15:00,40.622623,-74.11017,STATEN ISLAND,1.0,0.0,1,0,0,0,0,0,4768093,2024-10-30 15:00:00,2024-10-30T15:00,2024,10,24.7,0.0,Cloudy
06/25/2024,14:00,40.621,-74.11946,STATEN ISLAND,1.0,0.0,0,0,0,0,1,0,4735536,2024-06-25 14:00:00,2024-06-25T14:00,2024,6,32.8,0.0,Cloudy
12/18/2024,15:00,40.589157,-74.078575,STATEN ISLAND,0.0,0.0,0,0,0,0,0,0,4779890,2024-12-18 15:00:00,2024-12-18T15:00,2024,12,9.3,0.0,Cloudy
07/05/2024,21:00,40.565186,-74.10265,STATEN ISLAND,4.0,0.0,0,0,0,0,4,0,4738191,2024-07-05 21:00:00,2024-07-05T21:00,2024,7,26.0,0.0,Cloudy
02/11/2024,10:00,40.628807,-74.0745,STATEN ISLAND,1.0,0.0,1,0,0,0,0,0,4702295,2024-02-11 10:00:00,2024-02-11T10:00,2024,2,7.8,0.0,Cloudy
07/16/2024,16:00,40.630978,-74.07786,STATEN ISLAND,1.0,0.0,0,0,1,0,0,0,4742309,2024-07-16 16:00:00,2024-07-16T16:00,2024,7,27.5,0.1,Drizzle
03/04/2024,14:00,40.57592,-74.130035,STATEN ISLAND,1.0,0.0,0,0,0,0,1,0,4707246,2024-03-04 14:00:00,2024-03-04T14:00,2024,3,10.6,0.0,Cloudy
07/08/2024,0:00,40.538334,-74.15956,STATEN ISLAND,0.0,0.0,0,0,0,0,0,0,4739751,2024-07-08 00:00:00,2024-07-08T00:00,2024,7,22.8,0.0,Cloudy
09/10/2024,18:00,40.57811,-74.111206,STATEN ISLAND,4.0,0.0,0,0,0,0,4,0,4754929,2024-09-10 18:00:00,2024-09-10T18:00,2024,9,23.6,0.0,Clear
02/25/2024,8:00,40.52418,-74.2348,STATEN ISLAND,1.0,0.0,0,0,0,0,1,0,4705052,2024-02-25 08:00:00,2024-02-25T08:00,2024,2,-4.2,0.0,Clear
05/13/2024,21:00,40.624603,-74.079605,STATEN ISLAND,2.0,0.0,0,0,0,0,2,0,4724762,2024-05-13 21:00:00,2024-05-13T21:00,2024,5,14.5,0.0,Clear
08/12/2024,15:00,40.610996,-74.09581,STATEN ISLAND,1.0,0.0,0,0,1,0,0,0,4747562,2024-08-12 15:00:00,2024-08-12T15:00,2024,8,26.1,0.2,Drizzle
09/13/2024,8:00,40.55057,-74.16758,STATEN ISLAND,2.0,0.0,0,0,0,0,2,0,4756097,2024-09-13 08:00:00,2024-09-13T08:00,2024,9,18.5,0.0,Clear
