CRASH DATE,CRASH TIME,LATITUDE,LONGITUDE,BOROUGH,NUMBER OF PERSONS INJURED,NUMBER OF PERSONS KILLED,NUMBER OF PEDESTRIANS INJURED,NUMBER OF PEDESTRIANS KILLED,NUMBER OF CYCLIST INJURED,NUMBER OF CYCLIST KILLED,NUMBER OF MOTORIST INJURED,NUMBER OF MOTORIST KILLED,COLLISION_ID,datetime,iso_datetime,year,month,temperature,precipitation,weather_condition
04/14/2016,11:00,40.816803,-73.92306,BRONX,1.0,0.0,0,0,0,0,1,0,3411156,2016-04-14 11:00:00,2016-04-14T11:00,2016,4,11.2,0.0,Clear
11/14/2016,20:00,40.860893,-73.84321,BRONX,1.0,0.0,0,0,0,0,1,0,3560662,2016-11-14 20:00:00,2016-11-14T20:00,2016,11,10.6,0.0,Cloudy
08/22/2016,18:00,40.875202,-73.8767,BRONX,3.0,0.0,2,0,0,0,1,0,3505284,2016-08-22 18:00:00,2016-08-22T18:00,2016,8,22.3,0.0,Clear
08/18/2016,1:00,40.861107,-73.89028,BRONX,0.0,0.0,0,0,0,0,0,0,3503916,2016-08-18 01:00:00,2016-08-18T01:00,2016,8,23.8,0.5,Drizzle
08/21/2016,4:00,40.833595,-73.90253,BRONX,0.0,0.0,0,0,0,0,0,0,3503884,2016-08-21 04:00:00,2016-08-21T04:00,2016,8,21.9,0.0,Clear
02/03/2016,14:00,40.8071531,-73.9082053,BRONX,3.0,0.0,0,0,0,0,3,0,3382748,2016-02-03 14:00:00,2016-02-03T14:00,2016,2,11.2,2.1,Light Rain
09/12/2016,17:00,40.82463,-73.91059,BRONX,1.0,0.0,1,0,0,0,0,0,3519978,2016-09-12 17:00:00,2016-09-12T17:00,2016,9,22.8,0.0,Clear
07/18/2016,12:00,40.82858,-73.87918,BRONX,1.0,0.0,1,0,0,0,0,0,3484385,2016-07-18 12:00:00,2016-07-18T12:00,2016,7,33.3,0.0,Cloudy
09/17/2016,0:00,40.835716,-73.8775,BRONX,1.0,0.0,0,0,0,0,1,0,3522371,2016-09-17 00:00:00,2016-09-17T00:00,2016,9,15.7,0.0,Cloudy
01/21/2016,19:00,40.8441075,-73.8861506,BRONX,1.0,0.0,0,0,0,0,1,0,3375278,2016-01-21 19:00:00,2016-01-21T19:00,2016,1,-2.3,0.0,Clear
12/25/2016,4:00,40.856155,-73.88357,BRONX,0.0,0.0,0,0,0,0,0,0,3586331,2016-12-25 04:00:00,2016-12-25T04:00,2016,12,0.1,0.0,Clear
07/20/2016,16:00,40.893845,-73.858826,BRONX,0.0,0.0,0,0,0,0,0,0,3506808,2016-07-20 16:00:00,2016-07-20T16:00,2016,7,28.1,0.0,Cloudy
08/15/2016,14:00,40.858597,-73.89349,BRONX,1.0,0.0,1,0,0,0,0,0,3500158,2016-08-15 14:00:00,2016-08-15T14:00,2016,8,31.7,0.0,Clear
11/13/2016,14:00,40.8237,-73.86256,BRONX,0.0,0.0,0,0,0,0,0,0,3560608,2016-11-13 14:00:00,2016-11-13T14:00,2016,11,15.2,0.0,Clear
05/21/2016,0:00,40.81632,-73.89622,BRONX,1.0,0.0,0,0,0,0,1,0,3448955,2016-05-21 00:00:00,2016-05-21T00:00,2016,5,12.9,0.0,Cloudy
10/13/2016,15:00,40.853813,-73.85184,BRONX,0.0,0.0,0,0,0,0,0,0,3539472,2016-10-13 15:00:00,2016-10-13T15:00,2016,10,17.6,0.2,Drizzle
12/04/2016,14:00,40.81792,-73.90532,BRONX,1.0,0.0,0,0,1,0,0,0,3573360,2016-12-04 14:00:00,2016-12-04T14:00,2016,12,6.8,0.0,Clear
05/16/2016,7:00,40.84434,-73.91475,BRONX,1.0,0.0,1,0,0,0,0,0,3443177,2016-05-16 07:00:00,2016-05-16T07:00,2016,5,6.8,0.0,Clear
06/05/2016,2:00,40.872677,-73.86218,BRONX,0.0,0.0,0,0,0,0,0,0,3455368,2016-06-05 02:00:00,2016-06-05T02:00,2016,6,18.9,0.0,Cloudy
05/30/2016,21:00,40.834934,-73.845436,BRONX,2.0,0.0,0,0,0,0,2,0,3455918,2016-05-30 21:00:00,2016-05-30T21:00,2016,5,21.2,0.0,Cloudy
04/26/2016,18:00,40.844254,-73.84826,BRONX,1.0,0.0,1,0,0,0,0,0,3440581,2016-04-26 18:00:00,2016-04-26T18:00,2016,4,11.7,0.0,Cloudy
08/03/2016,23:00,40.86876,-73.8452,BRONX,0.0,0.0,0,0,0,0,0,0,3533067,2016-08-03 23:00:00,2016-08-03T23:00,2016,8,20.0,0.0,Clear
04/30/2016,0:00,40.81312,-73.85957,BRONX,0.0,0.0,0,0,0,0,0,0,3431727,2016-04-30 00:00:00,2016-04-30T00:00,2016,4,7.4,0.0,Cloudy
09/19/2016,15:00,40.84744,-73.89968,BRONX,0.0,0.0,0,0,0,0,0,0,3528630,2016-09-19 15:00:00,2016-09-19T15:00,2016,9,21.9,1.5,Light Rain
01/23/2016,6:00,40.844371,-73.8890163,BRONX,1.0,0.0,0,0,0,0,1,0,3376169,2016-01-23 06:00:00,2016-01-23T06:00,2016,1,-3.8,2.3,Heavy Snow
10/24/2016,13:00,40.845142,-73.91106,BRONX,1.0,0.0,0,0,0,0,1,0,3546580,2016-10-24 13:00:00,2016-10-24T13:00,2016,10,15.0,0.0,Clear
07/28/2016,9:00,40.885693,-73.86165,BRONX,1.0,0.0,0,0,0,0,1,0,3492758,2016-07-28 09:00:00,2016-07-28T09:00,2016,7,29.8,0.0,Cloudy
04/19/2016,22:00,40.880196,-73.83816,BRONX,0.0,0.0,0,0,0,0,0,0,3413466,2016-04-19 22:00:00,2016-04-19T22:00,2016,4,10.5,0.0,Clear
06/18/2016,17:00,40.89466,-73.86137,BRONX,3.0,0.0,0,0,0,0,3,0,3470527,2016-06-18 17:00:00,2016-06-18T17:00,2016,6,26.4,0.0,Clear
06/06/2016,19:00,40.901283,-73.865036,BRONX,0.0,0.0,0,0,0,0,0,0,3456868,2016-06-06 19:00:00,2016-06-06T19:00,2016,6,24.5,0.0,Cloudy
04/23/2016,8:00,40.849712,-73.83038,BRONX,1.0,0.0,0,0,0,0,1,0,3412764,2016-04-23 08:00:00,2016-04-23T08:00,2016,4,15.1,0.1,Drizzle
10/28/2016,17:00,40.881584,-73.87488,BRONX,1.0,0.0,0,0,0,0,1,0,3549686,2016-10-28 17:00:00,2016-10-28T17:00,2016,10,7.7,0.0,Clear
12/31/2016,17:00,40.834183,-73.87857,BRONX,1.0,0.0,0,0,1,0,0,0,3590604,2016-12-31 17:00:00,2016-12-31T17:00,2016,12,4.5,0.0,Cloudy
05/17/2016,14:00,40.874,-73.90886,BRONX,0.0,0.0,0,0,0,0,0,0,3444383,2016-05-17 14:00:00,2016-05-17T14:00,2016,5,17.3,0.1,Drizzle
11/07/2016,21:00,40.879883,-73.880486,BRONX,0.0,0.0,0,0,0,0,0,0,3556650,2016-11-07 21:00:00,2016-11-07T21:00,2016,11,6.2,0.0,Clear
03/17/2016,8:00,40.7136,-74.0091,BRONX,1.0,0.0,0,0,0,0,1,0,3412814,2016-03-17 08:00:00,2016-03-17T08:00,2016,3,6.7,0.0,Cloudy
12/19/2016,20:00,40.86879,-73.83168,BRONX,0.0,0.0,0,0,0,0,0,0,3583889,2016-12-19 20:00:00,2016-12-19T20:00,2016,12,-4.0,0.0,Cloudy
01/12/2016,16:00,40.885219,-73.8793644,BRONX,0.0,0.0,0,0,0,0,0,0,3369294,2016-01-12 16:00:00,2016-01-12T16:00,2016,1,3.3,0.1,Light Snow
05/07/2016,22:00,40.852634,-73.88427,BRONX,1.0,0.0,1,0,0,0,0,0,3439886,2016-05-07 22:00:00,2016-05-07T22:00,2016,5,10.1,0.0,Cloudy
08/13/2016,0:00,40.897865,-73.84651,BRONX,1.0,0.0,1,0,0,0,0,0,3500139,2016-08-13 00:00:00,2016-08-13T00:00,2016,8,27.0,0.0,Cloudy
08/26/2016,0:00,40.87641,-73.88467,BRONX,0.0,0.0,0,0,0,0,0,0,3509864,2016-08-26 00:00:00,2016-08-26T00:00,2016,8,23.1,0.0,Cloudy
06/20/2016,16:00,40.819542,-73.91353,BRONX,0.0,0.0,0,0,0,0,0,0,3473036,2016-06-20 16:00:00,2016-06-20T16:00,2016,6,27.6,0.0,Cloudy
07/13/2016,16:00,40.84744,-73.89968,BRONX,1.0,0.0,0,0,0,0,1,0,3479086,2016-07-13 16:00:00,2016-07-13T16:00,2016,7,26.2,0.0,Cloudy
09/02/2016,16:00,40.817753,-73.888664,BRONX,1.0,0.0,1,0,0,0,0,0,3533319,2016-09-02 16:00:00,2016-09-02T16:00,2016,9,25.5,0.0,Cloudy
09/19/2016,13:00,40.880196,-73.83816,BRONX,1.0,0.0,0,0,0,0,1,0,3527516,2016-09-19 13:00:00,2016-09-19T13:00,2016,9,22.0,0.7,Drizzle
01/04/2016,20:00,40.8138832,-73.9118122,BRONX,1.0,0.0,0,0,0,0,1,0,3365180,2016-01-04 20:00:00,2016-01-04T20:00,2016,1,-6.8,0.0,Clear
09/12/2016,0:00,40.81503,-73.86149,BRONX,1.0,0.0,0,0,1,0,0,0,3518455,2016-09-12 00:00:00,2016-09-12T00:00,2016,9,18.6,0.0,Clear
03/11/2016,9:00,40.8729592,-73.8749391,BRONX,0.0,0.0,0,0,0,0,0,0,3403513,2016-03-11 09:00:00,2016-03-11T09:00,2016,3,11.2,0.0,Cloudy
05/25/2016,0:00,40.905132,-73.901596,BRONX,0.0,0.0,0,0,0,0,0,0,3449538,2016-05-25 00:00:00,2016-05-25T00:00,2016,5,12.6,0.0,Clear
12/09/2016,11:00,40.866325,-73.88837,BRONX,0.0,0.0,0,0,0,0,0,0,3576513,2016-12-09 11:00:00,2016-12-09T11:00,2016,12,2.7,0.0,Cloudy
07/30/2016,2:00,40.838196,-73.87173,BRONX,0.0,0.0,0,0,0,0,0,0,3491748,2016-07-30 02:00:00,2016-07-30T02:00,2016,7,22.6,0.0,Clear
03/29/2016,18:00,40.80948,-73.90302,BRONX,1.0,0.0,0,0,0,0,1,0,4022113,2016-03-29 18:00:00,2016-03-29T18:00,2016,3,8.0,0.0,Clear
11/20/2016,1:00,40.817387,-73.92277,BRONX,1.0,0.0,1,0,0,0,0,0,3565356,2016-11-20 01:00:00,2016-11-20T01:00,2016,11,3.6,2.0,Light Rain
12/23/2016,4:00,40.813175,-73.89845,BRONX,2.0,0.0,0,0,0,0,2,0,3586168,2016-12-23 04:00:00,2016-12-23T04:00,2016,12,-1.0,0.0,Cloudy
09/22/2016,17:00,40.814144,-73.919205,BRONX,1.0,0.0,0,0,1,0,0,0,3527077,2016-09-22 17:00:00,2016-09-22T17:00,2016,9,24.9,0.0,Clear
10/03/2016,19:00,40.867878,-73.893005,BRONX,1.0,0.0,0,0,0,0,1,0,3532197,2016-10-03 19:00:00,2016-10-03T19:00,2016,10,17.6,0.0,Clear
12/28/2016,16:00,40.831264,-73.90645,BRONX,1.0,0.0,1,0,0,0,0,0,3588527,2016-12-28 16:00:00,2016-12-28T16:00,2016,12,3.5,0.0,Clear
07/15/2016,9:00,40.810192,-73.88632,BRONX,1.0,0.0,0,0,0,0,1,0,3485358,2016-07-15 09:00:00,2016-07-15T09:00,2016,7,28.7,0.0,Clear
07/20/2016,21:00,40.833126,-73.828285,BRONX,1.0,0.0,0,0,0,0,1,0,3493363,2016-07-20 21:00:00,2016-07-20T21:00,2016,7,23.0,0.0,Clear
09/23/2016,14:00,40.83511,-73.91945,BRONX,1.0,0.0,1,0,0,0,0,0,3526505,2016-09-23 14:00:00,2016-09-23T14:00,2016,9,29.2,0.0,Clear
07/18/2016,17:00,40.88564,-73.905975,BRONX,0.0,0.0,0,0,0,0,0,0,3488815,2016-07-18 17:00:00,2016-07-18T17:00,2016,7,28.3,0.0,Cloudy
05/11/2016,16:00,40.835236,-73.88481,BRONX,0.0,0.0,0,0,0,0,0,0,3439836,2016-05-11 16:00:00,2016-05-11T16:00,2016,5,21.1,0.0,Cloudy
04/04/2016,14:00,40.842075,-73.847015,BRONX,1.0,0.0,1,0,0,0,0,0,4022139,2016-04-04 14:00:00,2016-04-04T14:00,2016,4,7.7,1.4,Light Rain
02/29/2016,19:00,40.8363929,-73.9158697,BRONX,1.0,0.0,1,0,0,0,0,0,3397238,2016-02-29 19:00:00,2016-02-29T19:00,2016,2,8.5,0.0,Clear
08/27/2016,14:00,40.833076,-73.89731,BRONX,1.0,0.0,0,0,0,0,1,0,3508998,2016-08-27 14:00:00,2016-08-27T14:00,2016,8,30.0,0.0,Cloudy
12/09/2016,17:00,40.887226,-73.86518,BRONX,1.0,0.0,0,0,0,0,1,0,3578242,2016-12-09 17:00:00,2016-12-09T17:00,2016,12,0.9,0.0,Clear
05/08/2016,19:00,40.874702,-73.85803,BRONX,1.0,0.0,0,0,1,0,0,0,3437953,2016-05-08 19:00:00,2016-05-08T19:00,2016,5,12.8,0.0,Clear
06/20/2016,23:00,40.806828,-73.88448,BRONX,1.0,0.0,0,0,0,0,1,0,3466599,2016-06-20 23:00:00,2016-06-20T23:00,2016,6,24.5,0.0,Clear
02/16/2016,16:00,40.8678804,-73.8930012,BRONX,2.0,0.0,0,0,0,0,2,0,3390110,2016-02-16 16:00:00,2016-02-16T16:00,2016,2,9.3,1.8,Light Rain
09/24/2016,22:00,40.886314,-73.85581,BRONX,0.0,0.0,0,0,0,0,0,0,3532082,2016-09-24 22:00:00,2016-09-24T22:00,2016,9,14.6,0.0,Clear
04/18/2016,16:00,40.893,-73.88386,BRONX,1.0,0.0,0,0,0,0,1,0,3433695,2016-04-18 16:00:00,2016-04-18T16:00,2016,4,23.7,0.0,Cloudy
08/24/2016,20:00,40.807556,-73.919235,BRONX,1.0,0.0,1,0,0,0,0,0,3508959,2016-08-24 20:00:00,2016-08-24T20:00,2016,8,23.8,0.0,Clear
07/11/2016,21:00,40.855785,-73.90558,BRONX,1.0,0.0,0,0,0,0,1,0,3478319,2016-07-11 21:00:00,2016-07-11T21:00,2016,7,20.6,0.0,Cloudy
03/02/2016,13:00,40.8294457,-73.901533,BRONX,1.0,0.0,0,0,0,0,1,0,3398644,2016-03-02 13:00:00,2016-03-02T13:00,2016,3,5.3,0.0,Clear
12/21/2016,8:00,40.86358,-73.86642,BRONX,0.0,0.0,0,0,0,0,0,0,3584599,2016-12-21 08:00:00,2016-12-21T08:00,2016,12,-3.6,0.0,Cloudy
06/07/2016,17:00,40.81505,-73.92427,BRONX,1.0,0.0,0,0,0,0,1,0,3457643,2016-06-07 17:00:00,2016-06-07T17:00,2016,6,25.0,0.0,Clear
12/23/2016,15:00,40.88285,-73.82603,BRONX,2.0,0.0,0,0,0,0,2,0,3586480,2016-12-23 15:00:00,2016-12-23T15:00,2016,12,6.9,0.0,Cloudy
07/04/2016,0:00,40.883858,-73.855896,BRONX,3.0,0.0,0,0,0,0,3,0,3476207,2016-07-04 00:00:00,2016-07-04T00:00,2016,7,20.2,0.0,Cloudy
10/28/2016,10:00,40.84047,-73.886116,BRONX,0.0,0.0,0,0,0,0,0,0,3549256,2016-10-28 10:00:00,2016-10-28T10:00,2016,10,7.6,0.0,Cloudy
04/08/2016,15:00,40.83455,-73.829414,BRONX,0.0,0.0,0,0,0,0,0,0,3412645,2016-04-08 15:00:00,2016-04-08T15:00,2016,4,9.2,0.0,Cloudy
06/03/2016,22:00,40.838535,-73.84459,BRONX,3.0,0.0,0,0,0,0,3,0,3464249,2016-06-03 22:00:00,2016-06-03T22:00,2016,6,17.9,0.0,Cloudy
05/09/2016,8:00,40.89682,-73.84456,BRONX,0.0,0.0,0,0,0,0,0,0,3437967,2016-05-09 08:00:00,2016-05-09T08:00,2016,5,12.9,0.0,Clear
04/20/2016,8:00,40.82955,-73.88133,BRONX,0.0,0.0,0,0,0,0,0,0,3412090,2016-04-20 08:00:00,2016-04-20T08:00,2016,4,10.8,0.0,Clear
12/29/2016,0:00,40.833286,-73.914085,BRONX,0.0,0.0,0,0,0,0,0,0,3589279,2016-12-29 00:00:00,2016-12-29T00:00,2016,12,-1.6,0.0,Cloudy
07/30/2016,2:00,40.880245,-73.85494,BRONX,2.0,0.0,0,0,0,0,2,0,3492772,2016-07-30 02:00:00,2016-07-30T02:00,2016,7,22.7,0.0,Clear
11/25/2016,3:00,40.85673,-73.90279,BRONX,1.0,0.0,0,0,0,0,1,0,3567195,2016-11-25 03:00:00,2016-11-25T03:00,2016,11,5.7,0.0,Cloudy
04/21/2016,12:00,40.813957,-73.93134,BRONX,0.0,0.0,0,0,0,0,0,0,3411246,2016-04-21 12:00:00,2016-04-21T12:00,2016,4,19.5,0.0,Cloudy
07/09/2016,22:00,40.848343,-73.81788,BRONX,0.0,0.0,0,0,0,0,0,0,3477550,2016-07-09 22:00:00,2016-07-09T22:00,2016,7,20.5,0.5,Drizzle
05/07/2016,11:00,40.831085,-73.86909,BRONX,1.0,0.0,0,0,1,0,0,0,3437769,2016-05-07 11:00:00,2016-05-07T11:00,2016,5,12.5,0.0,Cloudy
07/05/2016,23:00,40.85574,-73.88103,BRONX,2.0,0.0,0,0,0,0,2,0,3476214,2016-07-05 23:00:00,2016-07-05T23:00,2016,7,24.2,0.0,Clear
11/02/2016,13:00,40.88353,-73.89768,BRONX,0.0,0.0,0,0,0,0,0,0,3553094,2016-11-02 13:00:00,2016-11-02T13:00,2016,11,18.6,0.0,Cloudy
03/10/2016,19:00,40.8447051,-73.8939854,BRONX,1.0,0.0,1,0,0,0,0,0,3403489,2016-03-10 19:00:00,2016-03-10T19:00,2016,3,18.3,0.0,Cloudy
12/27/2016,3:00,40.844734,-73.89935,BRONX,0.0,0.0,0,0,0,0,0,0,3587307,2016-12-27 03:00:00,2016-12-27T03:00,2016,12,9.7,0.0,Cloudy
05/07/2016,10:00,40.826138,-73.87781,BRONX,1.0,0.0,1,0,0,0,0,0,3437771,2016-05-07 10:00:00,2016-05-07T10:00,2016,5,11.5,0.0,Cloudy
02/13/2016,15:00,40.8523395,-73.8639241,BRONX,1.0,0.0,0,0,0,0,1,0,3388904,2016-02-13 15:00:00,2016-02-13T15:00,2016,2,-9.7,0.0,Clear
07/20/2016,14:00,40.888058,-73.831314,BRONX,0.0,0.0,0,0,0,0,0,0,3519855,2016-07-20 14:00:00,2016-07-20T14:00,2016,7,28.3,0.0,Cloudy
11/22/2016,21:00,40.88243,-73.902306,BRONX,0.0,0.0,0,0,0,0,0,0,3565938,2016-11-22 21:00:00,2016-11-22T21:00,2016,11,1.3,0.0,Cloudy
02/25/2016,3:00,40.8402259,-73.9176827,BRONX,1.0,0.0,0,0,0,0,1,0,3394707,2016-02-25 03:00:00,2016-02-25T03:00,2016,2,12.9,0.0,Cloudy
11/03/2016,23:00,40.816864,-73.882744,BRONX,0.0,0.0,0,0,0,0,0,0,3554379,2016-11-03 23:00:00,2016-11-03T23:00,2016,11,11.4,0.0,Cloudy
04/24/2016,20:00,40.830555,-73.87677,BRONX,1.0,0.0,1,0,0,0,0,0,3431686,2016-04-24 20:00:00,2016-04-24T20:00,2016,4,11.7,0.0,Clear
05/17/2016,16:00,40.820824,-73.91562,BRONX,1.0,0.0,1,0,0,0,0,0,3443818,2016-05-17 16:00:00,2016-05-17T16:00,2016,5,14.1,0.0,Cloudy
10/07/2016,15:00,0.0,0.0,BRONX,1.0,0.0,1,0,0,0,0,0,3546912,2016-10-07 15:00:00,2016-10-07T15:00,2016,10,25.5,0.0,Clear
06/26/2016,7:00,40.831085,-73.86909,BRONX,0.0,0.0,0,0,0,0,0,0,3471304,2016-06-26 07:00:00,2016-06-26T07:00,2016,6,21.6,0.0,Clear
04/21/2016,14:00,40.887447,-73.90723,BRONX,1.0,0.0,0,0,1,0,0,0,3414110,2016-04-21 14:00:00,2016-04-21T14:00,2016,4,20.7,0.0,Cloudy
09/27/2016,14:00,40.822945,-73.90177,BRONX,0.0,0.0,0,0,0,0,0,0,3529022,2016-09-27 14:00:00,2016-09-27T14:00,2016,9,22.3,0.0,Cloudy
04/17/2016,12:00,40.84071,-73.850075,BRONX,0.0,0.0,0,0,0,0,0,0,3412706,2016-04-17 12:00:00,2016-04-17T12:00,2016,4,16.3,0.0,Clear
04/20/2016,0:00,40.84294,-73.83871,BRONX,0.0,0.0,0,0,0,0,0,0,3431927,2016-04-20 00:00:00,2016-04-20T00:00,2016,4,9.3,0.0,Clear
12/23/2016,18:00,40.861862,-73.91282,BRONX,4.0,0.0,0,0,0,0,0,0,3585923,2016-12-23 18:00:00,2016-12-23T18:00,2016,12,2.8,0.0,Cloudy
08/23/2016,16:00,40.815075,-73.90347,BRONX,0.0,0.0,0,0,0,0,0,0,3507423,2016-08-23 16:00:00,2016-08-23T16:00,2016,8,26.8,0.0,Clear
09/26/2016,10:00,40.85554,-73.91413,BRONX,1.0,0.0,0,0,0,0,1,0,3527713,2016-09-26 10:00:00,2016-09-26T10:00,2016,9,19.0,0.0,Clear
08/14/2016,3:00,40.879745,-73.88467,BRONX,1.0,0.0,0,0,0,0,1,0,3500186,2016-08-14 03:00:00,2016-08-14T03:00,2016,8,25.9,0.0,Cloudy
09/05/2016,4:00,40.807556,-73.919235,BRONX,1.0,0.0,0,0,1,0,0,0,3513847,2016-09-05 04:00:00,2016-09-05T04:00,2016,9,17.3,0.0,Cloudy
02/05/2016,15:00,40.820189,-73.8906752,BRONX,1.0,0.0,0,0,0,0,1,0,3389392,2016-02-05 15:00:00,2016-02-05T15:00,2016,2,2.8,0.0,Clear
10/22/2016,0:00,40.896263,-73.89816,BRONX,0.0,0.0,0,0,0,0,0,0,3545675,2016-10-22 00:00:00,2016-10-22T00:00,2016,10,16.7,0.2,Drizzle
12/16/2016,9:00,40.880272,-73.83404,BRONX,1.0,0.0,1,0,0,0,0,0,3581717,2016-12-16 09:00:00,2016-12-16T09:00,2016,12,-6.4,0.0,Cloudy
05/16/2016,19:00,40.880585,-73.883896,BRONX,1.0,0.0,1,0,0,0,0,0,3443913,2016-05-16 19:00:00,2016-05-16T19:00,2016,5,14.3,0.0,Clear
06/08/2016,12:00,40.892475,-73.8545,BRONX,1.0,0.0,0,0,0,0,1,0,3458487,2016-06-08 12:00:00,2016-06-08T12:00,2016,6,17.2,1.8,Light Rain
09/17/2016,0:00,40.85911,-73.89372,BRONX,1.0,0.0,0,0,0,0,1,0,3522072,2016-09-17 00:00:00,2016-09-17T00:00,2016,9,15.7,0.0,Cloudy
06/17/2016,0:00,40.88271,-73.881256,BRONX,1.0,0.0,0,0,1,0,0,0,3465842,2016-06-17 00:00:00,2016-06-17T00:00,2016,6,18.6,0.0,Cloudy
07/19/2016,20:00,40.831287,-73.88173,BRONX,1.0,0.0,0,0,0,0,1,0,3484392,2016-07-19 20:00:00,2016-07-19T20:00,2016,7,23.1,0.0,Clear
05/06/2016,9:00,40.839863,-73.888145,BRONX,0.0,0.0,0,0,0,0,0,0,3435785,2016-05-06 09:00:00,2016-05-06T09:00,2016,5,9.0,1.2,Drizzle
03/26/2016,18:00,40.7136,-74.0091,BRONX,0.0,0.0,0,0,0,0,0,0,3411811,2016-03-26 18:00:00,2016-03-26T18:00,2016,3,7.4,0.0,Clear
05/30/2016,16:00,40.855762,-73.79149,BRONX,1.0,0.0,0,0,0,0,1,0,3453238,2016-05-30 16:00:00,2016-05-30T16:00,2016,5,25.4,0.0,Cloudy
01/12/2016,11:00,40.815755,-73.8952779,BRONX,1.0,0.0,0,0,0,0,1,0,3369216,2016-01-12 11:00:00,2016-01-12T11:00,2016,1,2.9,0.0,Cloudy
04/19/2016,10:00,40.880337,-73.87873,BRONX,0.0,0.0,0,0,0,0,0,0,3414417,2016-04-19 10:00:00,2016-04-19T10:00,2016,4,16.6,0.0,Clear
08/19/2016,17:00,40.862404,-73.89799,BRONX,1.0,0.0,0,0,0,0,1,0,3503511,2016-08-19 17:00:00,2016-08-19T17:00,2016,8,26.9,0.3,Drizzle
08/04/2016,23:00,40.889923,-73.85931,BRONX,1.0,0.0,0,0,1,0,0,0,3533195,2016-08-04 23:00:00,2016-08-04T23:00,2016,8,19.6,0.0,Clear
12/10/2016,3:00,40.843765,-73.88546,BRONX,3.0,0.0,0,0,0,0,3,0,3577742,2016-12-10 03:00:00,2016-12-10T03:00,2016,12,-3.2,0.0,Clear
04/25/2016,17:00,40.845543,-73.91391,BRONX,0.0,0.0,0,0,0,0,0,0,3412461,2016-04-25 17:00:00,2016-04-25T17:00,2016,4,17.0,0.0,Cloudy
06/26/2016,19:00,40.838264,-73.8328,BRONX,1.0,0.0,0,0,1,0,0,0,3475567,2016-06-26 19:00:00,2016-06-26T19:00,2016,6,22.8,0.0,Cloudy
04/27/2016,11:00,40.843945,-73.8858,BRONX,0.0,0.0,0,0,0,0,0,0,3431860,2016-04-27 11:00:00,2016-04-27T11:00,2016,4,11.9,0.0,Cloudy
03/20/2016,23:00,40.674053,-73.87211,BRONX,0.0,0.0,0,0,0,0,0,0,3411548,2016-03-20 23:00:00,2016-03-20T23:00,2016,3,0.9,0.8,Heavy Snow
03/03/2016,9:00,40.8185601,-73.9273161,BRONX,0.0,0.0,0,0,0,0,0,0,3398650,2016-03-03 09:00:00,2016-03-03T09:00,2016,3,-1.6,0.0,Clear
08/03/2016,16:00,40.817863,-73.905014,BRONX,0.0,0.0,0,0,0,0,0,0,3493983,2016-08-03 16:00:00,2016-08-03T16:00,2016,8,24.7,0.0,Clear
11/18/2016,13:00,40.88709,-73.87803,BRONX,1.0,0.0,0,0,0,0,1,0,3562839,2016-11-18 13:00:00,2016-11-18T13:00,2016,11,15.2,0.0,Clear
10/18/2016,15:00,40.853336,-73.9196,BRONX,1.0,0.0,0,0,0,0,1,0,3542909,2016-10-18 15:00:00,2016-10-18T15:00,2016,10,26.4,0.0,Clear
03/08/2016,16:00,40.8326953,-73.8636644,BRONX,1.0,0.0,0,0,0,0,1,0,3402882,2016-03-08 16:00:00,2016-03-08T16:00,2016,3,13.1,0.0,Clear
12/15/2016,17:00,40.81346,-73.90605,BRONX,1.0,0.0,0,0,0,0,1,0,3582742,2016-12-15 17:00:00,2016-12-15T17:00,2016,12,-5.3,0.0,Cloudy
09/20/2016,21:00,40.883152,-73.856285,BRONX,1.0,0.0,1,0,0,0,0,0,3524379,2016-09-20 21:00:00,2016-09-20T21:00,2016,9,21.6,0.0,Cloudy
09/01/2016,0:00,40.846367,-73.86066,BRONX,0.0,0.0,0,0,0,0,0,0,3511261,2016-09-01 00:00:00,2016-09-01T00:00,2016,9,24.6,0.0,Cloudy
10/11/2016,15:00,40.822693,-73.908226,BRONX,1.0,0.0,0,0,0,0,1,0,3548452,2016-10-11 15:00:00,2016-10-11T15:00,2016,10,15.8,0.0,Clear
06/23/2016,16:00,40.83121,-73.850876,BRONX,0.0,0.0,0,0,0,0,0,0,3468775,2016-06-23 16:00:00,2016-06-23T16:00,2016,6,26.6,0.0,Cloudy
02/12/2016,9:00,40.8514695,-73.8955651,BRONX,1.0,0.0,0,0,0,0,1,0,3388378,2016-02-12 09:00:00,2016-02-12T09:00,2016,2,-10.7,0.0,Clear
11/18/2016,16:00,40.86177,-73.89868,BRONX,0.0,0.0,0,0,0,0,0,0,3562929,2016-11-18 16:00:00,2016-11-18T16:00,2016,11,15.5,0.0,Clear
04/02/2016,15:00,40.86218,-73.89552,BRONX,3.0,0.0,0,0,0,0,3,0,3412973,2016-04-02 15:00:00,2016-04-02T15:00,2016,4,11.8,0.0,Cloudy
06/16/2016,9:00,40.878956,-73.8812,BRONX,0.0,0.0,0,0,0,0,0,0,3462069,2016-06-16 09:00:00,2016-06-16T09:00,2016,6,21.9,0.0,Cloudy
04/11/2016,15:00,40.87602,-73.90301,BRONX,0.0,0.0,0,0,0,0,0,0,3414071,2016-04-11 15:00:00,2016-04-11T15:00,2016,4,15.5,0.0,Cloudy
06/09/2016,11:00,40.88867,-73.83861,BRONX,1.0,0.0,0,0,1,0,0,0,3458500,2016-06-09 11:00:00,2016-06-09T11:00,2016,6,17.9,0.0,Clear
06/16/2016,17:00,40.839935,-73.87655,BRONX,1.0,0.0,1,0,0,0,0,0,3468804,2016-06-16 17:00:00,2016-06-16T17:00,2016,6,24.6,0.0,Cloudy
06/24/2016,15:00,40.83378,-73.84832,BRONX,1.0,0.0,0,0,1,0,0,0,3468767,2016-06-24 15:00:00,2016-06-24T15:00,2016,6,26.2,0.0,Cloudy
09/24/2016,11:00,40.883575,-73.86281,BRONX,0.0,0.0,0,0,0,0,0,0,3527989,2016-09-24 11:00:00,2016-09-24T11:00,2016,9,17.2,0.0,Clear
04/18/2016,11:00,40.849354,-73.91078,BRONX,0.0,0.0,0,0,0,0,0,0,3413029,2016-04-18 11:00:00,2016-04-18T11:00,2016,4,21.1,0.0,Cloudy
11/10/2016,13:00,40.83241,-73.89072,BRONX,0.0,0.0,0,0,0,0,0,0,3557563,2016-11-10 13:00:00,2016-11-10T13:00,2016,11,11.5,0.0,Cloudy
06/24/2016,19:00,40.82303,-73.90449,BRONX,2.0,0.0,0,0,0,0,2,0,3467698,2016-06-24 19:00:00,2016-06-24T19:00,2016,6,22.1,0.0,Clear
04/14/2016,18:00,40.88868,-73.85542,BRONX,0.0,0.0,0,0,0,0,0,0,3413398,2016-04-14 18:00:00,2016-04-14T18:00,2016,4,11.7,0.0,Clear
07/11/2016,16:00,40.862793,-73.89689,BRONX,1.0,0.0,0,0,1,0,0,0,3478401,2016-07-11 16:00:00,2016-07-11T16:00,2016,7,25.3,0.0,Clear
09/17/2016,4:00,40.83852,-73.92619,BRONX,1.0,0.0,0,0,1,0,0,0,3521822,2016-09-17 04:00:00,2016-09-17T04:00,2016,9,16.5,0.0,Cloudy
01/06/2016,18:00,40.820189,-73.8906752,BRONX,2.0,0.0,0,0,0,0,2,0,3366510,2016-01-06 18:00:00,2016-01-06T18:00,2016,1,-0.9,0.0,Clear
06/01/2016,12:00,40.816204,-73.91423,BRONX,2.0,0.0,0,0,0,0,2,0,3453117,2016-06-01 12:00:00,2016-06-01T12:00,2016,6,26.7,0.0,Cloudy
11/06/2016,18:00,40.88471,-73.83131,BRONX,0.0,0.0,0,0,0,0,0,0,3555459,2016-11-06 18:00:00,2016-11-06T18:00,2016,11,8.4,0.0,Clear
03/24/2016,18:00,40.82735,-73.82301,BRONX,1.0,0.0,1,0,0,0,0,0,3412538,2016-03-24 18:00:00,2016-03-24T18:00,2016,3,8.2,0.0,Cloudy
12/01/2016,18:00,40.866383,-73.88515,BRONX,0.0,0.0,0,0,0,0,0,0,3571654,2016-12-01 18:00:00,2016-12-01T18:00,2016,12,7.9,0.0,Cloudy
04/13/2016,0:00,40.8305,-73.85055,BRONX,1.0,0.0,0,0,0,0,1,0,3412019,2016-04-13 00:00:00,2016-04-13T00:00,2016,4,3.3,0.0,Clear
04/13/2016,13:00,40.845737,-73.91377,BRONX,2.0,0.0,0,0,0,0,2,0,3412990,2016-04-13 13:00:00,2016-04-13T13:00,2016,4,11.2,0.0,Clear
09/26/2016,8:00,40.893677,-73.84016,BRONX,1.0,0.0,1,0,0,0,0,0,3528438,2016-09-26 08:00:00,2016-09-26T08:00,2016,9,16.0,0.0,Clear
11/24/2016,15:00,40.856983,-73.881096,BRONX,1.0,0.0,0,0,0,0,1,0,3567275,2016-11-24 15:00:00,2016-11-24T15:00,2016,11,9.3,0.0,Cloudy
09/23/2016,8:00,40.814934,-73.89765,BRONX,0.0,0.0,0,0,0,0,0,0,3530821,2016-09-23 08:00:00,2016-09-23T08:00,2016,9,18.9,0.0,Cloudy
07/13/2016,20:00,40.81866,-73.81812,BRONX,2.0,0.0,0,0,0,0,2,0,3479730,2016-07-13 20:00:00,2016-07-13T20:00,2016,7,23.3,0.0,Cloudy
09/29/2016,7:00,40.817158,-73.90154,BRONX,1.0,0.0,1,0,0,0,0,0,3530820,2016-09-29 07:00:00,2016-09-29T07:00,2016,9,15.7,0.0,Cloudy
04/10/2016,20:00,40.898594,-73.897095,BRONX,6.0,0.0,0,0,0,0,6,0,3414077,2016-04-10 20:00:00,2016-04-10T20:00,2016,4,4.9,0.0,Clear
02/21/2016,19:00,40.8699149,-73.8451734,BRONX,1.0,0.0,1,0,0,0,0,0,3392822,2016-02-21 19:00:00,2016-02-21T19:00,2016,2,7.2,0.0,Cloudy
02/15/2016,10:00,40.8317477,-73.815797,BRONX,0.0,0.0,0,0,0,0,0,0,3389412,2016-02-15 10:00:00,2016-02-15T10:00,2016,2,-5.0,0.0,Cloudy
12/17/2016,21:00,40.89725,-73.855255,BRONX,1.0,0.0,0,0,0,0,1,0,3582877,2016-12-17 21:00:00,2016-12-17T21:00,2016,12,0.7,0.0,Cloudy
09/18/2016,0:00,40.86749,-73.88323,BRONX,0.0,0.0,0,0,0,0,0,0,3522233,2016-09-18 00:00:00,2016-09-18T00:00,2016,9,20.0,0.0,Cloudy
04/10/2016,1:00,40.82453,-73.91019,BRONX,1.0,0.0,0,0,0,0,1,0,3411675,2016-04-10 01:00:00,2016-04-10T01:00,2016,4,0.8,0.0,Clear
10/02/2016,0:00,40.82692,-73.87199,BRONX,1.0,0.0,1,0,0,0,0,0,3531561,2016-10-02 00:00:00,2016-10-02T00:00,2016,10,14.9,0.0,Cloudy
10/07/2016,18:00,40.85602,-73.88846,BRONX,1.0,0.0,0,0,0,0,1,0,3537733,2016-10-07 18:00:00,2016-10-07T18:00,2016,10,17.2,0.0,Clear
07/12/2016,17:00,40.862755,-73.901085,BRONX,1.0,0.0,0,0,0,0,1,0,3479036,2016-07-12 17:00:00,2016-07-12T17:00,2016,7,24.6,0.0,Cloudy
12/21/2016,0:00,40.887096,-73.86087,BRONX,1.0,0.0,1,0,0,0,0,0,3583997,2016-12-21 00:00:00,2016-12-21T00:00,2016,12,-3.5,0.0,Cloudy
03/07/2016,12:00,40.8035936,-73.9197796,BRONX,0.0,0.0,0,0,0,0,0,0,3401537,2016-03-07 12:00:00,2016-03-07T12:00,2016,3,9.7,0.0,Cloudy
05/21/2016,20:00,40.89534,-73.85528,BRONX,2.0,0.0,0,0,0,0,2,0,3449282,2016-05-21 20:00:00,2016-05-21T20:00,2016,5,13.6,0.0,Cloudy
05/05/2016,19:00,40.879807,-73.906586,BRONX,1.0,0.0,0,0,0,0,1,0,3438056,2016-05-05 19:00:00,2016-05-05T19:00,2016,5,11.3,0.0,Cloudy
01/14/2016,12:00,40.8680065,-73.8842405,BRONX,0.0,0.0,0,0,0,0,0,0,3370660,2016-01-14 12:00:00,2016-01-14T12:00,2016,1,0.8,0.0,Clear
02/04/2016,14:00,40.8700429,-73.8926325,BRONX,0.0,0.0,0,0,0,0,0,0,3384061,2016-02-04 14:00:00,2016-02-04T14:00,2016,2,10.5,0.0,Cloudy
06/26/2016,3:00,40.83265,-73.86366,BRONX,0.0,0.0,0,0,0,0,0,0,3468782,2016-06-26 03:00:00,2016-06-26T03:00,2016,6,18.4,0.0,Clear
06/10/2016,0:00,40.845985,-73.884476,BRONX,2.0,0.0,0,0,0,0,2,0,4022573,2016-06-10 00:00:00,2016-06-10T00:00,2016,6,13.1,0.0,Clear
02/17/2016,10:00,40.8624442,-73.8971422,BRONX,1.0,0.0,1,0,0,0,0,0,3390116,2016-02-17 10:00:00,2016-02-17T10:00,2016,2,3.3,0.0,Cloudy
04/15/2016,16:00,40.901775,-73.90175,BRONX,0.0,0.0,0,0,0,0,0,0,3414096,2016-04-15 16:00:00,2016-04-15T16:00,2016,4,15.5,0.0,Clear
10/27/2016,21:00,40.818226,-73.916794,BRONX,0.0,0.0,0,0,0,0,0,0,3550583,2016-10-27 21:00:00,2016-10-27T21:00,2016,10,12.8,1.2,Drizzle
05/06/2016,5:00,40.861862,-73.91282,BRONX,2.0,0.0,0,0,0,0,2,0,3435787,2016-05-06 05:00:00,2016-05-06T05:00,2016,5,8.6,0.7,Drizzle
05/31/2016,14:00,40.89608,-73.86692,BRONX,2.0,0.0,0,0,0,0,2,0,3455993,2016-05-31 14:00:00,2016-05-31T14:00,2016,5,28.6,0.0,Clear
07/25/2016,17:00,40.824135,-73.89295,BRONX,1.0,0.0,1,0,0,0,0,0,3498582,2016-07-25 17:00:00,2016-07-25T17:00,2016,7,29.8,6.8,Heavy Rain
01/22/2016,16:00,40.8468268,-73.8970434,BRONX,5.0,0.0,0,0,0,0,5,0,3375289,2016-01-22 16:00:00,2016-01-22T16:00,2016,1,-1.6,0.0,Cloudy
10/29/2016,9:00,40.890648,-73.84875,BRONX,1.0,0.0,0,0,0,0,1,0,3551037,2016-10-29 09:00:00,2016-10-29T09:00,2016,10,7.3,0.0,Cloudy
06/29/2016,17:00,40.83389,-73.85466,BRONX,5.0,0.0,1,0,0,0,4,0,3473601,2016-06-29 17:00:00,2016-06-29T17:00,2016,6,27.7,0.0,Clear
01/06/2016,8:00,40.8612759,-73.8636528,BRONX,2.0,0.0,2,0,0,0,0,0,3365960,2016-01-06 08:00:00,2016-01-06T08:00,2016,1,-5.5,0.0,Clear
10/31/2016,20:00,40.805557,-73.91047,BRONX,2.0,0.0,0,0,0,0,2,0,3553603,2016-10-31 20:00:00,2016-10-31T20:00,2016,10,6.6,0.0,Cloudy
12/29/2016,13:00,40.839806,-73.88113,BRONX,4.0,0.0,0,0,0,0,4,0,3589200,2016-12-29 13:00:00,2016-12-29T13:00,2016,12,6.3,1.3,Light Rain
07/16/2016,0:00,40.877033,-73.846375,BRONX,2.0,0.0,0,0,0,0,2,0,3484470,2016-07-16 00:00:00,2016-07-16T00:00,2016,7,24.7,0.0,Clear
12/23/2016,23:00,40.819042,-73.81724,BRONX,0.0,0.0,0,0,0,0,0,0,3592013,2016-12-23 23:00:00,2016-12-23T23:00,2016,12,1.8,0.0,Cloudy
01/18/2016,16:00,40.8519037,-73.9164465,BRONX,1.0,0.0,0,0,0,0,1,0,3373263,2016-01-18 16:00:00,2016-01-18T16:00,2016,1,-4.0,0.0,Cloudy
04/20/2016,18:00,40.869904,-73.89981,BRONX,1.0,0.0,1,0,0,0,0,0,3433672,2016-04-20 18:00:00,2016-04-20T18:00,2016,4,14.7,0.0,Clear
08/01/2016,8:00,40.898994,-73.85573,BRONX,0.0,0.0,0,0,0,0,0,0,3492792,2016-08-01 08:00:00,2016-08-01T08:00,2016,8,20.9,0.0,Cloudy
10/09/2016,1:00,40.82249,-73.868095,BRONX,1.0,0.0,1,0,0,0,0,0,3539250,2016-10-09 01:00:00,2016-10-09T01:00,2016,10,16.8,0.8,Drizzle
05/16/2016,8:00,40.834866,-73.908165,BRONX,0.0,0.0,0,0,0,0,0,0,3443160,2016-05-16 08:00:00,2016-05-16T08:00,2016,5,8.0,0.0,Clear
08/16/2016,17:00,40.870544,-73.89162,BRONX,0.0,0.0,0,0,0,0,0,0,3502378,2016-08-16 17:00:00,2016-08-16T17:00,2016,8,28.4,0.0,Cloudy
10/13/2016,22:00,40.830605,-73.89322,BRONX,1.0,0.0,1,0,0,0,0,0,3539724,2016-10-13 22:00:00,2016-10-13T22:00,2016,10,12.6,0.0,Clear
04/23/2016,13:00,40.86001,-73.89847,BRONX,1.0,0.0,1,0,0,0,0,0,3413066,2016-04-23 13:00:00,2016-04-23T13:00,2016,4,19.2,0.0,Cloudy
08/02/2016,18:00,40.861862,-73.91282,BRONX,1.0,0.0,0,0,0,0,1,0,3620677,2016-08-02 18:00:00,2016-08-02T18:00,2016,8,22.8,0.0,Cloudy
08/14/2016,16:00,40.874737,-73.855255,BRONX,2.0,0.0,0,0,0,0,2,0,3500148,2016-08-14 16:00:00,2016-08-14T16:00,2016,8,32.3,0.0,Cloudy
12/27/2016,11:00,40.85971,-73.85736,BRONX,1.0,0.0,0,0,0,0,1,0,3589069,2016-12-27 11:00:00,2016-12-27T11:00,2016,12,12.0,0.0,Cloudy
07/31/2016,15:00,40.842297,-73.89823,BRONX,0.0,0.0,0,0,0,0,0,0,3491734,2016-07-31 15:00:00,2016-07-31T15:00,2016,7,24.6,1.8,Light Rain
05/07/2016,5:00,40.86847,-73.849976,BRONX,0.0,0.0,0,0,0,0,0,0,3438019,2016-05-07 05:00:00,2016-05-07T05:00,2016,5,9.2,0.3,Drizzle
03/19/2016,17:00,40.88245,-73.90547,BRONX,1.0,0.0,0,0,0,0,1,0,3413949,2016-03-19 17:00:00,2016-03-19T17:00,2016,3,7.4,0.0,Cloudy
07/23/2016,16:00,40.871334,-73.86139,BRONX,1.0,0.0,0,0,1,0,0,0,3491843,2016-07-23 16:00:00,2016-07-23T16:00,2016,7,33.6,0.0,Clear
12/30/2016,15:00,40.865448,-73.86635,BRONX,1.0,0.0,1,0,0,0,0,0,3590852,2016-12-30 15:00:00,2016-12-30T15:00,2016,12,3.8,0.0,Clear
10/26/2016,13:00,40.828873,-73.83707,BRONX,1.0,0.0,0,0,0,0,1,0,3548352,2016-10-26 13:00:00,2016-10-26T13:00,2016,10,10.1,0.0,Cloudy
11/26/2016,4:00,40.866573,-73.83876,BRONX,1.0,0.0,0,0,0,0,1,0,3572428,2016-11-26 04:00:00,2016-11-26T04:00,2016,11,5.7,0.0,Cloudy
06/14/2016,0:00,40.869335,-73.8255,BRONX,0.0,0.0,0,0,0,0,0,0,3462745,2016-06-14 00:00:00,2016-06-14T00:00,2016,6,15.6,0.0,Clear
06/17/2016,8:00,40.88208,-73.828354,BRONX,5.0,0.0,0,0,0,0,5,0,3462762,2016-06-17 08:00:00,2016-06-17T08:00,2016,6,21.4,0.0,Cloudy
05/07/2016,18:00,40.876503,-73.904564,BRONX,1.0,0.0,0,0,0,0,1,0,3438064,2016-05-07 18:00:00,2016-05-07T18:00,2016,5,12.6,0.0,Cloudy
01/19/2016,9:00,40.8408817,-73.8393681,BRONX,1.0,0.0,1,0,0,0,0,0,3373258,2016-01-19 09:00:00,2016-01-19T09:00,2016,1,-7.1,0.0,Clear
11/21/2016,0:00,40.833504,-73.88815,BRONX,1.0,0.0,1,0,0,0,0,0,3564969,2016-11-21 00:00:00,2016-11-21T00:00,2016,11,1.8,0.0,Cloudy
02/28/2016,23:00,40.9096277,-73.8965952,BRONX,1.0,0.0,0,0,0,0,1,0,3396563,2016-02-28 23:00:00,2016-02-28T23:00,2016,2,6.7,0.0,Clear
07/22/2016,14:00,40.874615,-73.90472,BRONX,3.0,0.0,0,0,0,0,3,0,3489422,2016-07-22 14:00:00,2016-07-22T14:00,2016,7,34.5,0.0,Clear
07/20/2016,14:00,40.866634,-73.86088,BRONX,0.0,0.0,0,0,0,0,0,0,3484499,2016-07-20 14:00:00,2016-07-20T14:00,2016,7,28.3,0.0,Cloudy
06/30/2016,10:00,40.81899,-73.8867,BRONX,1.0,0.0,0,0,0,0,1,0,3472686,2016-06-30 10:00:00,2016-06-30T10:00,2016,6,25.7,0.0,Clear
07/21/2016,19:00,40.861107,-73.89028,BRONX,1.0,0.0,1,0,0,0,0,0,3485467,2016-07-21 19:00:00,2016-07-21T19:00,2016,7,26.6,0.0,Cloudy
04/26/2016,9:00,40.71356,-74.00904,BRONX,1.0,0.0,0,0,0,0,1,0,3413530,2016-04-26 09:00:00,2016-04-26T09:00,2016,4,15.0,0.0,Cloudy
07/21/2016,20:00,40.845985,-73.884476,BRONX,1.0,0.0,0,0,0,0,1,0,3486816,2016-07-21 20:00:00,2016-07-21T20:00,2016,7,25.8,0.0,Cloudy
12/22/2016,8:00,40.822315,-73.81918,BRONX,0.0,0.0,0,0,0,0,0,0,3591433,2016-12-22 08:00:00,2016-12-22T08:00,2016,12,2.6,0.0,Cloudy
05/31/2016,8:00,40.865772,-73.901855,BRONX,1.0,0.0,0,0,0,0,1,0,3455387,2016-05-31 08:00:00,2016-05-31T08:00,2016,5,23.6,0.0,Cloudy
11/04/2016,18:00,40.815426,-73.898476,BRONX,1.0,0.0,0,0,0,0,1,0,3554386,2016-11-04 18:00:00,2016-11-04T18:00,2016,11,10.6,0.0,Clear
07/28/2016,23:00,40.873356,-73.90556,BRONX,1.0,0.0,0,0,1,0,0,0,3490075,2016-07-28 23:00:00,2016-07-28T23:00,2016,7,26.0,0.7,Drizzle
06/12/2016,18:00,40.814545,-73.910645,BRONX,0.0,0.0,0,0,0,0,0,0,3460328,2016-06-12 18:00:00,2016-06-12T18:00,2016,6,20.7,0.0,Clear
05/03/2016,13:00,40.880295,-73.90275,BRONX,1.0,0.0,0,0,0,0,1,0,3434702,2016-05-03 13:00:00,2016-05-03T13:00,2016,5,11.9,0.0,Cloudy
05/11/2016,16:00,40.815,-73.89402,BRONX,1.0,0.0,0,0,0,0,1,0,3439831,2016-05-11 16:00:00,2016-05-11T16:00,2016,5,21.2,0.0,Cloudy
09/16/2016,13:00,40.85071,-73.89408,BRONX,1.0,0.0,0,0,1,0,0,0,3521463,2016-09-16 13:00:00,2016-09-16T13:00,2016,9,22.2,0.0,Cloudy
01/24/2016,13:00,40.8701843,-73.8855166,BRONX,2.0,0.0,0,0,0,0,2,0,3376595,2016-01-24 13:00:00,2016-01-24T13:00,2016,1,-3.2,0.0,Clear
03/24/2016,21:00,40.849407,-73.900894,BRONX,2.0,0.0,0,0,0,0,2,0,3412857,2016-03-24 21:00:00,2016-03-24T21:00,2016,3,6.5,0.0,Cloudy
08/11/2016,0:00,40.8168,-73.89705,BRONX,1.0,0.0,0,0,0,0,1,0,3498581,2016-08-11 00:00:00,2016-08-11T00:00,2016,8,24.6,0.0,Cloudy
05/21/2016,14:00,40.828823,-73.888214,BRONX,1.0,0.0,0,0,1,0,0,0,3453145,2016-05-21 14:00:00,2016-05-21T14:00,2016,5,16.1,0.0,Cloudy
06/01/2016,18:00,40.88429,-73.86509,BRONX,0.0,0.0,0,0,0,0,0,0,3453282,2016-06-01 18:00:00,2016-06-01T18:00,2016,6,22.5,0.0,Clear
04/10/2016,14:00,40.83598,-73.88366,BRONX,1.0,0.0,0,0,0,0,1,0,3411636,2016-04-10 14:00:00,2016-04-10T14:00,2016,4,8.4,0.0,Clear
11/04/2016,21:00,40.840855,-73.875015,BRONX,6.0,0.0,0,0,0,0,6,0,3554172,2016-11-04 21:00:00,2016-11-04T21:00,2016,11,7.9,0.0,Clear
05/15/2016,19:00,40.870552,-73.84641,BRONX,2.0,0.0,0,0,0,0,2,0,3442339,2016-05-15 19:00:00,2016-05-15T19:00,2016,5,10.7,0.0,Clear
10/29/2016,18:00,40.887802,-73.86046,BRONX,1.0,0.0,0,0,0,0,1,0,3552790,2016-10-29 18:00:00,2016-10-29T18:00,2016,10,14.2,0.0,Cloudy
03/03/2016,7:00,40.8794193,-73.9057948,BRONX,1.0,0.0,0,0,0,0,1,0,3398695,2016-03-03 07:00:00,2016-03-03T07:00,2016,3,-3.5,0.0,Clear
12/17/2016,2:00,40.86976,-73.857254,BRONX,1.0,0.0,0,0,0,0,1,0,3583991,2016-12-17 02:00:00,2016-12-17T02:00,2016,12,-3.9,0.1,Light Snow
07/09/2016,2:00,40.904552,-73.847824,BRONX,4.0,0.0,0,0,0,0,4,0,3483706,2016-07-09 02:00:00,2016-07-09T02:00,2016,7,18.7,0.0,Cloudy
05/02/2016,16:00,40.837006,-73.83409,BRONX,1.0,0.0,1,0,0,0,0,0,3434621,2016-05-02 16:00:00,2016-05-02T16:00,2016,5,13.7,0.0,Cloudy
11/16/2016,9:00,40.854218,-73.89004,BRONX,1.0,0.0,0,0,0,0,1,0,3561772,2016-11-16 09:00:00,2016-11-16T09:00,2016,11,9.4,0.0,Clear
09/07/2016,12:00,40.814266,-73.912964,BRONX,2.0,0.0,0,0,0,0,2,0,3515269,2016-09-07 12:00:00,2016-09-07T12:00,2016,9,26.9,0.0,Clear
08/19/2016,8:00,40.861862,-73.91282,BRONX,2.0,0.0,0,0,0,0,2,0,3503515,2016-08-19 08:00:00,2016-08-19T08:00,2016,8,25.2,0.0,Clear
05/06/2016,16:00,40.829685,-73.8253,BRONX,1.0,0.0,0,0,0,0,1,0,3437840,2016-05-06 16:00:00,2016-05-06T16:00,2016,5,11.6,0.0,Cloudy
08/08/2016,4:00,40.830776,-73.85295,BRONX,1.0,0.0,0,0,0,0,1,0,3497967,2016-08-08 04:00:00,2016-08-08T04:00,2016,8,18.8,0.0,Clear
07/30/2016,20:00,40.863518,-73.888985,BRONX,1.0,0.0,0,0,0,0,1,0,3493421,2016-07-30 20:00:00,2016-07-30T20:00,2016,7,23.5,1.5,Light Rain
12/25/2016,18:00,40.833046,-73.89648,BRONX,1.0,0.0,1,0,0,0,0,0,3586596,2016-12-25 18:00:00,2016-12-25T18:00,2016,12,3.7,0.0,Clear
11/16/2016,11:00,40.889427,-73.86295,BRONX,0.0,0.0,0,0,0,0,0,0,3561609,2016-11-16 11:00:00,2016-11-16T11:00,2016,11,12.8,0.0,Clear
03/10/2016,21:00,40.8177952,-73.8931829,BRONX,1.0,0.0,0,0,0,0,1,0,3404646,2016-03-10 21:00:00,2016-03-10T21:00,2016,3,16.9,0.0,Cloudy
07/27/2016,12:00,40.905346,-73.89746,BRONX,0.0,0.0,0,0,0,0,0,0,3490068,2016-07-27 12:00:00,2016-07-27T12:00,2016,7,31.5,0.0,Cloudy
05/18/2016,14:00,40.869114,-73.90224,BRONX,0.0,0.0,0,0,0,0,0,0,3456048,2016-05-18 14:00:00,2016-05-18T14:00,2016,5,18.5,0.0,Clear
06/24/2016,9:00,40.892513,-73.84543,BRONX,3.0,0.0,0,0,0,0,3,0,3472069,2016-06-24 09:00:00,2016-06-24T09:00,2016,6,24.1,0.0,Clear
11/24/2016,0:00,40.846577,-73.913155,BRONX,3.0,0.0,0,0,0,0,3,0,3567268,2016-11-24 00:00:00,2016-11-24T00:00,2016,11,2.5,0.0,Cloudy
08/20/2016,3:00,40.868015,-73.89997,BRONX,2.0,0.0,0,0,0,0,2,0,3505290,2016-08-20 03:00:00,2016-08-20T03:00,2016,8,23.2,0.0,Clear
06/17/2016,16:00,40.872128,-73.88248,BRONX,1.0,0.0,1,0,0,0,0,0,3465840,2016-06-17 16:00:00,2016-06-17T16:00,2016,6,23.3,0.0,Clear
01/10/2016,15:00,40.8246333,-73.9105876,BRONX,2.0,0.0,0,0,0,0,2,0,3369219,2016-01-10 15:00:00,2016-01-10T15:00,2016,1,13.1,0.0,Cloudy
07/18/2016,6:00,40.878204,-73.82817,BRONX,1.0,0.0,0,0,0,0,1,0,3485384,2016-07-18 06:00:00,2016-07-18T06:00,2016,7,23.9,0.0,Clear
12/23/2016,20:00,40.879356,-73.86004,BRONX,0.0,0.0,0,0,0,0,0,0,3586390,2016-12-23 20:00:00,2016-12-23T20:00,2016,12,1.5,0.0,Cloudy
12/20/2016,0:00,40.898273,-73.8505,BRONX,0.0,0.0,0,0,0,0,0,0,3584043,2016-12-20 00:00:00,2016-12-20T00:00,2016,12,-4.9,0.0,Cloudy
10/11/2016,0:00,40.87751,-73.88071,BRONX,1.0,0.0,1,0,0,0,0,0,3543962,2016-10-11 00:00:00,2016-10-11T00:00,2016,10,8.0,0.0,Clear
04/03/2016,6:00,40.86488,-73.90171,BRONX,0.0,0.0,0,0,0,0,0,0,3414278,2016-04-03 06:00:00,2016-04-03T06:00,2016,4,1.0,0.3,Light Snow
07/30/2016,22:00,40.87307,-73.84424,BRONX,1.0,0.0,1,0,0,0,0,0,3492782,2016-07-30 22:00:00,2016-07-30T22:00,2016,7,22.8,0.2,Drizzle
12/01/2016,19:00,40.837994,-73.86915,BRONX,2.0,0.0,0,0,0,0,2,0,3571274,2016-12-01 19:00:00,2016-12-01T19:00,2016,12,7.1,0.0,Cloudy
12/12/2016,9:00,40.88599,-73.82775,BRONX,1.0,0.0,0,0,0,0,1,0,3578246,2016-12-12 09:00:00,2016-12-12T09:00,2016,12,5.9,0.3,Drizzle
01/31/2016,4:00,40.8341346,-73.9166422,BRONX,1.0,0.0,1,0,0,0,0,0,3381999,2016-01-31 04:00:00,2016-01-31T04:00,2016,1,-3.8,0.0,Clear
11/14/2016,16:00,40.87679,-73.905334,BRONX,0.0,0.0,0,0,0,0,0,0,3561372,2016-11-14 16:00:00,2016-11-14T16:00,2016,11,13.6,0.0,Cloudy
12/09/2016,3:00,40.86406,-73.900085,BRONX,1.0,0.0,0,0,0,0,1,0,3576232,2016-12-09 03:00:00,2016-12-09T03:00,2016,12,-0.5,0.0,Clear
11/17/2016,15:00,40.840378,-73.86264,BRONX,0.0,0.0,0,0,0,0,0,0,3562502,2016-11-17 15:00:00,2016-11-17T15:00,2016,11,15.0,0.0,Clear
09/27/2016,18:00,40.87802,-73.90241,BRONX,1.0,0.0,1,0,0,0,0,0,3528963,2016-09-27 18:00:00,2016-09-27T18:00,2016,9,19.6,0.0,Clear
02/19/2016,12:00,40.8560468,-73.9007778,BRONX,1.0,0.0,0,0,0,0,1,0,3391775,2016-02-19 12:00:00,2016-02-19T12:00,2016,2,1.6,0.0,Cloudy
07/24/2016,15:00,40.859875,-73.89323,BRONX,0.0,0.0,0,0,0,0,0,0,3490049,2016-07-24 15:00:00,2016-07-24T15:00,2016,7,34.0,0.0,Cloudy
06/10/2016,18:00,40.830246,-73.852646,BRONX,0.0,0.0,0,0,0,0,0,0,3460369,2016-06-10 18:00:00,2016-06-10T18:00,2016,6,22.8,0.0,Cloudy
10/27/2016,15:00,40.859875,-73.89323,BRONX,4.0,0.0,0,0,0,0,4,0,3553318,2016-10-27 15:00:00,2016-10-27T15:00,2016,10,8.7,0.6,Drizzle
02/29/2016,8:00,40.8730592,-73.8786343,BRONX,1.0,0.0,1,0,0,0,0,0,3397301,2016-02-29 08:00:00,2016-02-29T08:00,2016,2,7.8,0.0,Clear
08/21/2016,3:00,40.825726,-73.82112,BRONX,2.0,0.0,0,0,0,0,2,0,3506792,2016-08-21 03:00:00,2016-08-21T03:00,2016,8,22.8,0.0,Clear
07/26/2016,22:00,40.900833,-73.846725,BRONX,1.0,0.0,0,0,0,0,1,0,3491820,2016-07-26 22:00:00,2016-07-26T22:00,2016,7,25.6,0.0,Cloudy
12/20/2016,19:00,40.843765,-73.8656,BRONX,1.0,0.0,1,0,0,0,0,0,3584074,2016-12-20 19:00:00,2016-12-20T19:00,2016,12,-3.1,0.0,Clear
02/10/2016,18:00,40.8895505,-73.8452326,BRONX,1.0,0.0,0,0,0,0,1,0,3386728,2016-02-10 18:00:00,2016-02-10T18:00,2016,2,0.6,0.0,Cloudy
09/30/2016,10:00,40.856243,-73.85363,BRONX,0.0,0.0,0,0,0,0,0,0,3530271,2016-09-30 10:00:00,2016-09-30T10:00,2016,9,13.6,1.0,Drizzle
12/20/2016,18:00,40.87707,-73.84624,BRONX,0.0,0.0,0,0,0,0,0,0,3583990,2016-12-20 18:00:00,2016-12-20T18:00,2016,12,-2.6,0.0,Clear
04/11/2016,13:00,40.827,-73.88341,BRONX,1.0,0.0,0,0,0,0,1,0,3412003,2016-04-11 13:00:00,2016-04-11T13:00,2016,4,13.0,0.0,Clear
12/06/2016,13:00,40.87167,-73.897804,BRONX,0.0,0.0,0,0,0,0,0,0,3574952,2016-12-06 13:00:00,2016-12-06T13:00,2016,12,6.4,0.0,Cloudy
11/08/2016,15:00,40.82417,-73.90031,BRONX,0.0,0.0,0,0,0,0,0,0,3556596,2016-11-08 15:00:00,2016-11-08T15:00,2016,11,17.5,0.0,Clear
01/01/2016,5:00,40.8456427,-73.9020981,BRONX,1.0,0.0,0,0,0,0,1,0,3363443,2016-01-01 05:00:00,2016-01-01T05:00,2016,1,2.1,0.0,Cloudy
08/27/2016,0:00,40.851967,-73.897095,BRONX,0.0,0.0,0,0,0,0,0,0,3509841,2016-08-27 00:00:00,2016-08-27T00:00,2016,8,23.1,0.0,Clear
10/18/2016,17:00,40.899227,-73.862114,BRONX,1.0,0.0,1,0,0,0,0,0,3542925,2016-10-18 17:00:00,2016-10-18T17:00,2016,10,23.0,0.0,Clear
12/24/2016,19:00,40.815845,-73.89544,BRONX,2.0,0.0,0,0,0,0,2,0,3585997,2016-12-24 19:00:00,2016-12-24T19:00,2016,12,2.9,0.0,Cloudy
10/22/2016,21:00,40.832623,-73.92537,BRONX,0.0,0.0,0,0,0,0,0,0,3544847,2016-10-22 21:00:00,2016-10-22T21:00,2016,10,8.8,0.0,Cloudy
03/08/2016,13:00,40.8595649,-73.8674268,BRONX,1.0,0.0,1,0,0,0,0,0,3401615,2016-03-08 13:00:00,2016-03-08T13:00,2016,3,15.5,0.0,Clear
09/13/2016,15:00,40.829002,-73.91557,BRONX,1.0,0.0,0,0,1,0,0,0,3519453,2016-09-13 15:00:00,2016-09-13T15:00,2016,9,25.7,0.0,Cloudy
04/05/2016,15:00,40.722,-73.982,BRONX,3.0,0.0,0,0,0,0,3,0,3411611,2016-04-05 15:00:00,2016-04-05T15:00,2016,4,4.8,0.0,Clear
05/25/2016,17:00,40.813232,-73.90908,BRONX,0.0,0.0,0,0,0,0,0,0,3448893,2016-05-25 17:00:00,2016-05-25T17:00,2016,5,28.8,0.0,Clear
11/29/2016,14:00,40.861862,-73.91282,BRONX,1.0,0.0,0,0,0,0,1,0,3569615,2016-11-29 14:00:00,2016-11-29T14:00,2016,11,12.5,5.6,Heavy Rain
09/27/2016,17:00,40.85366,-73.86774,BRONX,3.0,0.0,1,0,0,0,2,0,3528674,2016-09-27 17:00:00,2016-09-27T17:00,2016,9,21.1,0.0,Clear
11/15/2016,8:00,40.855633,-73.84047,BRONX,1.0,0.0,0,0,0,0,1,0,3561489,2016-11-15 08:00:00,2016-11-15T08:00,2016,11,8.2,4.1,Heavy Rain
09/17/2016,13:00,40.842766,-73.84594,BRONX,0.0,0.0,0,0,0,0,0,0,3527633,2016-09-17 13:00:00,2016-09-17T13:00,2016,9,24.9,0.0,Cloudy
05/14/2016,16:00,40.862453,-73.897705,BRONX,1.0,0.0,0,0,0,0,1,0,3442353,2016-05-14 16:00:00,2016-05-14T16:00,2016,5,18.4,0.0,Cloudy
10/20/2016,0:00,40.7093,-74.0029,BRONX,2.0,0.0,0,0,0,0,2,0,3545036,2016-10-20 00:00:00,2016-10-20T00:00,2016,10,15.7,0.0,Cloudy
10/31/2016,8:00,40.81231,-73.91648,BRONX,0.0,0.0,0,0,0,0,0,0,3553600,2016-10-31 08:00:00,2016-10-31T08:00,2016,10,7.9,0.0,Clear
09/10/2016,14:00,40.868282,-73.90107,BRONX,1.0,0.0,1,0,0,0,0,0,3516957,2016-09-10 14:00:00,2016-09-10T14:00,2016,9,31.8,0.0,Cloudy
10/01/2016,11:00,40.87892,-73.90479,BRONX,1.0,0.0,0,0,1,0,0,0,3531184,2016-10-01 11:00:00,2016-10-01T11:00,2016,10,16.2,0.0,Cloudy
09/22/2016,18:00,40.828407,-73.84392,BRONX,6.0,0.0,0,0,0,0,6,0,3525410,2016-09-22 18:00:00,2016-09-22T18:00,2016,9,22.8,0.0,Clear
12/03/2016,18:00,40.83511,-73.91945,BRONX,1.0,0.0,1,0,0,0,0,0,3575658,2016-12-03 18:00:00,2016-12-03T18:00,2016,12,5.0,0.0,Clear
05/27/2016,8:00,40.862953,-73.89796,BRONX,1.0,0.0,0,0,0,0,1,0,3446376,2016-05-27 08:00:00,2016-05-27T08:00,2016,5,24.0,0.0,Cloudy
04/19/2016,18:00,40.87582,-73.8327,BRONX,0.0,0.0,0,0,0,0,0,0,3412746,2016-04-19 18:00:00,2016-04-19T18:00,2016,4,16.1,0.0,Cloudy
04/18/2016,17:00,40.889782,-73.8594,BRONX,1.0,0.0,1,0,0,0,0,0,3433626,2016-04-18 17:00:00,2016-04-18T17:00,2016,4,21.5,0.0,Cloudy
07/05/2016,3:00,40.824467,-73.90155,BRONX,0.0,0.0,0,0,0,0,0,0,3474843,2016-07-05 03:00:00,2016-07-05T03:00,2016,7,20.4,1.1,Drizzle
04/01/2016,18:00,40.82793,-73.81587,BRONX,1.0,0.0,1,0,0,0,0,0,3412597,2016-04-01 18:00:00,2016-04-01T18:00,2016,4,18.3,0.7,Drizzle
05/09/2016,23:00,40.844334,-73.89816,BRONX,1.0,0.0,0,0,1,0,0,0,3437994,2016-05-09 23:00:00,2016-05-09T23:00,2016,5,10.0,0.0,Clear
06/07/2016,19:00,40.894543,-73.84146,BRONX,0.0,0.0,0,0,0,0,0,0,3457703,2016-06-07 19:00:00,2016-06-07T19:00,2016,6,22.7,0.0,Clear
09/21/2016,23:00,40.831287,-73.88173,BRONX,3.0,0.0,0,0,0,0,3,0,3525494,2016-09-21 23:00:00,2016-09-21T23:00,2016,9,18.4,0.0,Cloudy
05/06/2016,6:00,40.828125,-73.84105,BRONX,1.0,0.0,0,0,0,0,1,0,3437836,2016-05-06 06:00:00,2016-05-06T06:00,2016,5,8.6,1.3,Light Rain
03/14/2016,22:00,40.865406,-73.86884,BRONX,1.0,0.0,0,0,0,0,1,0,3413842,2016-03-14 22:00:00,2016-03-14T22:00,2016,3,5.7,0.0,Cloudy
04/08/2016,18:00,40.848793,-73.91495,BRONX,1.0,0.0,0,0,1,0,0,0,3412953,2016-04-08 18:00:00,2016-04-08T18:00,2016,4,7.9,0.0,Cloudy
03/26/2016,16:00,40.854107,-73.8843,BRONX,1.0,0.0,1,0,0,0,0,0,3413637,2016-03-26 16:00:00,2016-03-26T16:00,2016,3,10.7,0.0,Cloudy
03/06/2016,12:00,40.8209989,-73.8968919,BRONX,1.0,0.0,0,0,1,0,0,0,3400478,2016-03-06 12:00:00,2016-03-06T12:00,2016,3,5.0,0.0,Cloudy
08/18/2016,9:00,40.80556,-73.914505,BRONX,1.0,0.0,1,0,0,0,0,0,3502966,2016-08-18 09:00:00,2016-08-18T09:00,2016,8,25.0,0.0,Cloudy
03/21/2016,6:00,40.840168,-73.91756,BRONX,1.0,0.0,0,0,0,0,1,0,3412184,2016-03-21 06:00:00,2016-03-21T06:00,2016,3,0.3,0.0,Light Snow
07/17/2016,15:00,40.87993,-73.89786,BRONX,0.0,0.0,0,0,0,0,0,0,3483743,2016-07-17 15:00:00,2016-07-17T15:00,2016,7,30.8,0.0,Clear
10/20/2016,0:00,40.808296,-73.91199,BRONX,7.0,0.0,0,0,0,0,7,0,3545686,2016-10-20 00:00:00,2016-10-20T00:00,2016,10,15.4,0.0,Cloudy
09/21/2016,9:00,40.866997,-73.902084,BRONX,2.0,0.0,0,0,0,0,2,0,3524798,2016-09-21 09:00:00,2016-09-21T09:00,2016,9,23.1,0.0,Cloudy
10/28/2016,16:00,40.848366,-73.855644,BRONX,0.0,0.0,0,0,0,0,0,0,3551453,2016-10-28 16:00:00,2016-10-28T16:00,2016,10,9.0,0.0,Clear
06/13/2016,9:00,40.829002,-73.91557,BRONX,1.0,0.0,0,0,0,0,1,0,3461213,2016-06-13 09:00:00,2016-06-13T09:00,2016,6,18.5,0.0,Cloudy
04/25/2016,0:00,40.852947,-73.78976,BRONX,0.0,0.0,0,0,0,0,0,0,3412785,2016-04-25 00:00:00,2016-04-25T00:00,2016,4,9.9,0.0,Clear
07/17/2016,15:00,40.842155,-73.85604,BRONX,0.0,0.0,0,0,0,0,0,0,3481999,2016-07-17 15:00:00,2016-07-17T15:00,2016,7,31.2,0.0,Clear
02/08/2016,10:00,40.8186158,-73.8510915,BRONX,1.0,0.0,0,0,0,0,1,0,3386125,2016-02-08 10:00:00,2016-02-08T10:00,2016,2,-0.4,0.3,Heavy Snow
04/05/2016,11:00,40.810696,-73.931366,BRONX,2.0,0.0,0,0,0,0,2,0,3411060,2016-04-05 11:00:00,2016-04-05T11:00,2016,4,1.8,0.0,Clear
05/14/2016,5:00,40.80843,-73.923386,BRONX,0.0,0.0,0,0,0,0,0,0,3442157,2016-05-14 05:00:00,2016-05-14T05:00,2016,5,10.5,0.0,Clear
07/21/2016,13:00,40.831085,-73.86909,BRONX,2.0,0.0,0,0,0,0,2,0,3485373,2016-07-21 13:00:00,2016-07-21T13:00,2016,7,31.4,0.0,Cloudy
08/21/2016,2:00,40.86786,-73.84123,BRONX,1.0,0.0,0,0,0,0,1,0,3504592,2016-08-21 02:00:00,2016-08-21T02:00,2016,8,23.1,0.0,Clear
03/08/2016,12:00,40.8952213,-73.8800407,BRONX,1.0,0.0,0,0,0,0,1,0,3402327,2016-03-08 12:00:00,2016-03-08T12:00,2016,3,15.0,0.0,Clear
06/14/2016,23:00,40.88302,-73.85325,BRONX,0.0,0.0,0,0,0,0,0,0,4023309,2016-06-14 23:00:00,2016-06-14T23:00,2016,6,17.5,0.0,Clear
08/05/2016,0:00,40.84497,-73.90247,BRONX,1.0,0.0,0,0,1,0,0,0,3496416,2016-08-05 00:00:00,2016-08-05T00:00,2016,8,18.8,0.0,Clear
06/10/2016,8:00,40.83708,-73.90365,BRONX,1.0,0.0,0,0,0,0,1,0,3460350,2016-06-10 08:00:00,2016-06-10T08:00,2016,6,16.3,0.0,Clear
08/06/2016,15:00,40.859978,-73.90293,BRONX,2.0,0.0,0,0,0,0,2,0,3498042,2016-08-06 15:00:00,2016-08-06T15:00,2016,8,29.6,0.8,Drizzle
11/18/2016,21:00,40.65049,-73.87257,BROOKLYN,0.0,0.0,0,0,0,0,0,0,3563092,2016-11-18 21:00:00,2016-11-18T21:00,2016,11,9.1,0.0,Clear
08/21/2016,14:00,40.633858,-73.911446,BROOKLYN,1.0,0.0,0,0,0,0,1,0,3504683,2016-08-21 14:00:00,2016-08-21T14:00,2016,8,29.4,0.0,Cloudy
07/06/2016,12:00,40.623035,-74.00458,BROOKLYN,0.0,0.0,0,0,0,0,0,0,3475674,2016-07-06 12:00:00,2016-07-06T12:00,2016,7,31.5,0.0,Cloudy
12/09/2016,17:00,40.654625,-73.94227,BROOKLYN,1.0,0.0,0,0,0,0,1,0,3582114,2016-12-09 17:00:00,2016-12-09T17:00,2016,12,1.3,0.0,Clear
04/19/2016,16:00,40.69488,-73.9404,BROOKLYN,2.0,0.0,0,0,0,0,2,0,3420195,2016-04-19 16:00:00,2016-04-19T16:00,2016,4,19.2,0.0,Clear
11/22/2016,9:00,40.68783,-73.93004,BROOKLYN,1.0,0.0,1,0,0,0,0,0,3571298,2016-11-22 09:00:00,2016-11-22T09:00,2016,11,2.1,0.0,Cloudy
07/17/2016,13:00,40.62853,-73.9221,BROOKLYN,1.0,0.0,0,0,0,0,1,0,3482159,2016-07-17 13:00:00,2016-07-17T13:00,2016,7,31.3,0.0,Clear
05/27/2016,10:00,40.607628,-73.9639,BROOKLYN,1.0,0.0,0,0,0,0,1,0,3449754,2016-05-27 10:00:00,2016-05-27T10:00,2016,5,27.2,0.0,Cloudy
12/01/2016,19:00,40.6114,-74.033035,BROOKLYN,1.0,0.0,0,0,0,0,1,0,3571091,2016-12-01 19:00:00,2016-12-01T19:00,2016,12,7.3,0.0,Clear
08/29/2016,22:00,40.670887,-73.93649,BROOKLYN,1.0,0.0,1,0,0,0,0,0,3510686,2016-08-29 22:00:00,2016-08-29T22:00,2016,8,24.5,0.0,Clear
08/13/2016,0:00,40.58672,-73.97234,BROOKLYN,1.0,0.0,0,0,0,0,1,0,3500204,2016-08-13 00:00:00,2016-08-13T00:00,2016,8,27.6,0.0,Cloudy
07/04/2016,17:00,40.600838,-73.98125,BROOKLYN,1.0,0.0,0,0,0,0,1,0,3474937,2016-07-04 17:00:00,2016-07-04T17:00,2016,7,25.0,0.0,Cloudy
10/01/2016,20:00,40.632027,-74.033455,BROOKLYN,0.0,0.0,0,0,0,0,0,0,3531249,2016-10-01 20:00:00,2016-10-01T20:00,2016,10,15.9,0.0,Cloudy
06/27/2016,12:00,40.629135,-74.00541,BROOKLYN,1.0,0.0,1,0,0,0,0,0,3472207,2016-06-27 12:00:00,2016-06-27T12:00,2016,6,27.5,0.0,Cloudy
01/04/2016,19:00,40.6506684,-73.9524697,BROOKLYN,1.0,0.0,1,0,0,0,0,0,3365338,2016-01-04 19:00:00,2016-01-04T19:00,2016,1,-6.2,0.0,Clear
04/23/2016,11:00,40.69283,-73.98624,BROOKLYN,0.0,0.0,0,0,0,0,0,0,3420995,2016-04-23 11:00:00,2016-04-23T11:00,2016,4,18.8,0.0,Cloudy
08/27/2016,0:00,40.657215,-73.88962,BROOKLYN,1.0,0.0,1,0,0,0,0,0,3509287,2016-08-27 00:00:00,2016-08-27T00:00,2016,8,23.9,0.0,Clear
08/09/2016,17:00,40.617065,-73.9157,BROOKLYN,1.0,0.0,0,0,0,0,1,0,3498074,2016-08-09 17:00:00,2016-08-09T17:00,2016,8,27.5,0.0,Clear
08/29/2016,18:00,40.644615,-73.962166,BROOKLYN,1.0,0.0,0,0,1,0,0,0,3509965,2016-08-29 18:00:00,2016-08-29T18:00,2016,8,30.2,0.0,Clear
07/08/2016,14:00,40.708317,-73.96705,BROOKLYN,0.0,0.0,0,0,0,0,0,0,3477891,2016-07-08 14:00:00,2016-07-08T14:00,2016,7,26.6,2.5,Heavy Rain
01/04/2016,18:00,40.6196711,-73.9671199,BROOKLYN,1.0,0.0,0,0,0,0,1,0,3365320,2016-01-04 18:00:00,2016-01-04T18:00,2016,1,-4.9,0.0,Clear
08/23/2016,11:00,40.62158,-73.94975,BROOKLYN,1.0,0.0,1,0,0,0,0,0,3506204,2016-08-23 11:00:00,2016-08-23T11:00,2016,8,24.6,0.0,Clear
06/26/2016,14:00,40.655563,-73.87974,BROOKLYN,2.0,0.0,0,0,0,0,2,0,3469818,2016-06-26 14:00:00,2016-06-26T14:00,2016,6,28.2,0.0,Cloudy
12/31/2016,21:00,40.680298,-73.93031,BROOKLYN,0.0,0.0,0,0,0,0,0,0,3591668,2016-12-31 21:00:00,2016-12-31T21:00,2016,12,4.9,0.0,Cloudy
03/13/2016,4:00,40.6960346,-73.9845292,BROOKLYN,0.0,0.0,0,0,0,0,0,0,3404834,2016-03-13 04:00:00,2016-03-13T04:00,2016,3,6.8,0.0,Cloudy
01/12/2016,4:00,40.5875431,-73.958196,BROOKLYN,1.0,0.0,1,0,0,0,0,0,3369304,2016-01-12 04:00:00,2016-01-12T04:00,2016,1,-5.2,0.0,Clear
11/06/2016,1:00,40.596756,-73.93342,BROOKLYN,1.0,0.0,0,0,0,0,1,0,3555445,2016-11-06 01:00:00,2016-11-06T01:00,2016,11,9.7,0.0,Cloudy
06/30/2016,17:00,40.71453,-73.9444,BROOKLYN,1.0,0.0,0,0,0,0,1,0,3472395,2016-06-30 17:00:00,2016-06-30T17:00,2016,6,26.5,0.0,Cloudy
11/01/2016,21:00,40.678867,-73.87087,BROOKLYN,0.0,0.0,0,0,0,0,0,0,3552446,2016-11-01 21:00:00,2016-11-01T21:00,2016,11,11.0,0.0,Cloudy
11/20/2016,18:00,40.6816,-73.95794,BROOKLYN,1.0,0.0,1,0,0,0,0,0,3565636,2016-11-20 18:00:00,2016-11-20T18:00,2016,11,3.9,0.0,Cloudy
04/15/2016,20:00,40.687668,-73.951035,BROOKLYN,1.0,0.0,0,0,0,0,1,0,3420171,2016-04-15 20:00:00,2016-04-15T20:00,2016,4,9.4,0.0,Clear
11/14/2016,16:00,40.5807,-73.96165,BROOKLYN,0.0,0.0,0,0,0,0,0,0,3563745,2016-11-14 16:00:00,2016-11-14T16:00,2016,11,14.4,0.0,Cloudy
08/30/2016,9:00,40.637615,-73.99941,BROOKLYN,0.0,0.0,0,0,0,0,0,0,3511321,2016-08-30 09:00:00,2016-08-30T09:00,2016,8,24.6,0.0,Cloudy
03/07/2016,16:00,40.6933597,-73.9758464,BROOKLYN,1.0,0.0,0,0,0,0,1,0,3401842,2016-03-07 16:00:00,2016-03-07T16:00,2016,3,13.8,0.0,Clear
02/02/2016,9:00,40.7036649,-73.9470508,BROOKLYN,1.0,0.0,0,0,1,0,0,0,3383008,2016-02-02 09:00:00,2016-02-02T09:00,2016,2,0.8,0.0,Clear
08/25/2016,21:00,40.701946,-73.92623,BROOKLYN,0.0,0.0,0,0,0,0,0,0,3507678,2016-08-25 21:00:00,2016-08-25T21:00,2016,8,25.2,0.0,Clear
09/30/2016,17:00,40.67344,-73.90298,BROOKLYN,2.0,0.0,0,0,0,0,2,0,3531349,2016-09-30 17:00:00,2016-09-30T17:00,2016,9,15.2,0.0,Cloudy
11/21/2016,0:00,40.61549,-74.00412,BROOKLYN,4.0,0.0,0,0,0,0,4,0,3565268,2016-11-21 00:00:00,2016-11-21T00:00,2016,11,2.3,0.0,Cloudy
12/22/2016,0:00,40.645535,-73.911896,BROOKLYN,1.0,0.0,0,0,0,0,1,0,3585179,2016-12-22 00:00:00,2016-12-22T00:00,2016,12,-1.7,0.0,Cloudy
04/07/2016,17:00,40.678856,-73.9577,BROOKLYN,1.0,0.0,1,0,0,0,0,0,3419610,2016-04-07 17:00:00,2016-04-07T17:00,2016,4,12.8,0.0,Cloudy
04/25/2016,20:00,40.69124,-73.913155,BROOKLYN,2.0,0.0,0,0,0,0,2,0,3438668,2016-04-25 20:00:00,2016-04-25T20:00,2016,4,12.6,0.0,Cloudy
07/29/2016,1:00,40.675632,-73.89878,BROOKLYN,2.0,0.0,0,0,0,0,2,0,3492166,2016-07-29 01:00:00,2016-07-29T01:00,2016,7,24.7,3.5,Heavy Rain
07/03/2016,7:00,40.69496,-73.98717,BROOKLYN,1.0,0.0,0,0,1,0,0,0,3473123,2016-07-03 07:00:00,2016-07-03T07:00,2016,7,20.7,0.0,Cloudy
05/24/2016,0:00,40.67887,-73.92165,BROOKLYN,1.0,0.0,0,0,0,0,1,0,3450876,2016-05-24 00:00:00,2016-05-24T00:00,2016,5,14.1,0.1,Drizzle
05/06/2016,14:00,40.66895,-73.9339,BROOKLYN,0.0,0.0,0,0,0,0,0,0,3438574,2016-05-06 14:00:00,2016-05-06T14:00,2016,5,11.1,0.2,Drizzle
04/19/2016,20:00,40.668797,-73.93113,BROOKLYN,1.0,0.0,1,0,0,0,0,0,3417864,2016-04-19 20:00:00,2016-04-19T20:00,2016,4,12.9,0.0,Cloudy
06/28/2016,15:00,40.646946,-73.91347,BROOKLYN,0.0,0.0,0,0,0,0,0,0,3470659,2016-06-28 15:00:00,2016-06-28T15:00,2016,6,23.2,0.2,Drizzle
01/22/2016,18:00,40.638606,-73.9482662,BROOKLYN,1.0,0.0,0,0,0,0,1,0,3376220,2016-01-22 18:00:00,2016-01-22T18:00,2016,1,-1.9,0.0,Cloudy
06/17/2016,15:00,40.6697,-73.87494,BROOKLYN,2.0,0.0,0,0,0,0,2,0,3465142,2016-06-17 15:00:00,2016-06-17T15:00,2016,6,23.4,0.0,Clear
12/11/2016,19:00,40.62731,-73.941826,BROOKLYN,0.0,0.0,0,0,0,0,0,0,3583189,2016-12-11 19:00:00,2016-12-11T19:00,2016,12,-0.2,0.1,Light Snow
05/20/2016,15:00,40.622894,-74.02239,BROOKLYN,1.0,0.0,0,0,0,0,1,0,3450110,2016-05-20 15:00:00,2016-05-20T15:00,2016,5,22.4,0.0,Cloudy
05/11/2016,13:00,40.65317,-73.866875,BROOKLYN,1.0,0.0,0,0,0,0,1,0,3454570,2016-05-11 13:00:00,2016-05-11T13:00,2016,5,20.7,0.0,Cloudy
05/06/2016,18:00,40.65743,-73.9451,BROOKLYN,1.0,0.0,1,0,0,0,0,0,3438391,2016-05-06 18:00:00,2016-05-06T18:00,2016,5,10.9,0.0,Cloudy
09/01/2016,12:00,40.64166,-73.93705,BROOKLYN,1.0,0.0,0,0,0,0,1,0,3514058,2016-09-01 12:00:00,2016-09-01T12:00,2016,9,24.8,0.1,Drizzle
05/11/2016,15:00,40.691597,-73.991455,BROOKLYN,1.0,0.0,1,0,0,0,0,0,3459411,2016-05-11 15:00:00,2016-05-11T15:00,2016,5,21.3,0.0,Cloudy
03/09/2016,16:00,40.6226369,-74.0372835,BROOKLYN,1.0,0.0,1,0,0,0,0,0,3402397,2016-03-09 16:00:00,2016-03-09T16:00,2016,3,21.5,0.0,Cloudy
03/18/2016,14:00,40.72972,-73.95925,BROOKLYN,2.0,0.0,0,0,0,0,2,0,3421658,2016-03-18 14:00:00,2016-03-18T14:00,2016,3,13.4,0.0,Cloudy
07/03/2016,16:00,40.61143,-74.03485,BROOKLYN,1.0,0.0,1,0,0,0,0,0,4023715,2016-07-03 16:00:00,2016-07-03T16:00,2016,7,26.3,0.0,Cloudy
02/25/2016,12:00,40.6368247,-74.0117603,BROOKLYN,1.0,0.0,0,0,0,0,1,0,3394837,2016-02-25 12:00:00,2016-02-25T12:00,2016,2,8.0,0.0,Cloudy
08/12/2016,15:00,40.650387,-73.95872,BROOKLYN,2.0,0.0,0,0,0,0,2,0,3502430,2016-08-12 15:00:00,2016-08-12T15:00,2016,8,34.3,0.0,Cloudy
10/20/2016,12:00,40.676716,-73.87199,BROOKLYN,0.0,0.0,0,0,0,0,0,0,3544054,2016-10-20 12:00:00,2016-10-20T12:00,2016,10,20.5,0.0,Cloudy
07/14/2016,22:00,40.70379,-73.94802,BROOKLYN,1.0,0.0,0,0,0,0,1,0,3480564,2016-07-14 22:00:00,2016-07-14T22:00,2016,7,26.2,0.0,Clear
10/11/2016,13:00,40.64281,-73.90887,BROOKLYN,1.0,0.0,0,0,1,0,0,0,3538568,2016-10-11 13:00:00,2016-10-11T13:00,2016,10,15.8,0.0,Clear
05/27/2016,9:00,40.641422,-73.94086,BROOKLYN,2.0,0.0,0,0,0,0,2,0,3456164,2016-05-27 09:00:00,2016-05-27T09:00,2016,5,25.4,0.0,Cloudy
07/15/2016,22:00,40.634945,-73.9325,BROOKLYN,1.0,0.0,0,0,0,0,1,0,3482248,2016-07-15 22:00:00,2016-07-15T22:00,2016,7,26.9,0.0,Clear
08/14/2016,17:00,40.69312,-73.91969,BROOKLYN,1.0,0.0,1,0,0,0,0,0,3500456,2016-08-14 17:00:00,2016-08-14T17:00,2016,8,32.6,0.0,Clear
01/15/2016,17:00,40.6755367,-73.870994,BROOKLYN,1.0,0.0,1,0,0,0,0,0,3373468,2016-01-15 17:00:00,2016-01-15T17:00,2016,1,6.9,0.0,Cloudy
12/06/2016,18:00,40.58667,-73.966156,BROOKLYN,1.0,0.0,1,0,0,0,0,0,3607517,2016-12-06 18:00:00,2016-12-06T18:00,2016,12,5.8,0.3,Drizzle
05/30/2016,18:00,40.63554,-73.92284,BROOKLYN,0.0,0.0,0,0,0,0,0,0,3449898,2016-05-30 18:00:00,2016-05-30T18:00,2016,5,23.1,0.0,Cloudy
07/11/2016,16:00,40.6486,-73.91397,BROOKLYN,1.0,0.0,0,0,1,0,0,0,3482176,2016-07-11 16:00:00,2016-07-11T16:00,2016,7,25.6,0.0,Clear
11/11/2016,13:00,40.70213,-73.94432,BROOKLYN,1.0,0.0,0,0,1,0,0,0,3558587,2016-11-11 13:00:00,2016-11-11T13:00,2016,11,14.7,0.0,Clear
03/10/2016,22:00,40.6887855,-73.9835718,BROOKLYN,1.0,0.0,1,0,0,0,0,0,3403682,2016-03-10 22:00:00,2016-03-10T22:00,2016,3,16.4,0.0,Cloudy
03/12/2016,8:00,40.5911607,-73.9449724,BROOKLYN,2.0,0.0,0,0,0,0,2,0,3404208,2016-03-12 08:00:00,2016-03-12T08:00,2016,3,5.6,0.0,Clear
01/25/2016,16:00,40.6670963,-73.9227518,BROOKLYN,0.0,0.0,0,0,0,0,0,0,3377599,2016-01-25 16:00:00,2016-01-25T16:00,2016,1,-0.7,0.0,Cloudy
01/08/2016,19:00,40.6631828,-73.9624487,BROOKLYN,1.0,0.0,0,0,0,0,1,0,3367684,2016-01-08 19:00:00,2016-01-08T19:00,2016,1,3.7,0.0,Cloudy
11/14/2016,0:00,40.711166,-73.9489,BROOKLYN,1.0,0.0,0,0,0,0,1,0,3560827,2016-11-14 00:00:00,2016-11-14T00:00,2016,11,5.4,0.0,Clear
07/02/2016,18:00,40.64024,-73.91947,BROOKLYN,1.0,0.0,0,0,0,0,1,0,3474340,2016-07-02 18:00:00,2016-07-02T18:00,2016,7,25.1,0.0,Clear
10/31/2016,15:00,40.60784,-73.961975,BROOKLYN,1.0,0.0,0,0,0,0,1,0,3553536,2016-10-31 15:00:00,2016-10-31T15:00,2016,10,12.2,0.0,Clear
09/02/2016,14:00,40.656216,-73.882515,BROOKLYN,1.0,0.0,0,0,0,0,1,0,3512825,2016-09-02 14:00:00,2016-09-02T14:00,2016,9,26.1,0.0,Cloudy
07/17/2016,17:00,40.705887,-73.94297,BROOKLYN,1.0,0.0,0,0,0,0,1,0,3482466,2016-07-17 17:00:00,2016-07-17T17:00,2016,7,31.6,0.0,Clear
01/08/2016,17:00,40.6513333,-74.0145955,BROOKLYN,0.0,0.0,0,0,0,0,0,0,3367688,2016-01-08 17:00:00,2016-01-08T17:00,2016,1,4.7,0.0,Cloudy
04/18/2016,17:00,40.658447,-73.96248,BROOKLYN,2.0,0.0,0,0,2,0,0,0,4022261,2016-04-18 17:00:00,2016-04-18T17:00,2016,4,21.4,0.0,Cloudy
01/22/2016,3:00,40.7077437,-73.9536048,BROOKLYN,1.0,0.0,0,0,0,0,1,0,3375483,2016-01-22 03:00:00,2016-01-22T03:00,2016,1,-5.4,0.0,Clear
08/29/2016,11:00,40.627365,-73.96371,BROOKLYN,1.0,0.0,0,0,0,0,1,0,3509958,2016-08-29 11:00:00,2016-08-29T11:00,2016,8,30.7,0.0,Clear
04/27/2016,17:00,40.63112,-73.98715,BROOKLYN,0.0,0.0,0,0,0,0,0,0,3432096,2016-04-27 17:00:00,2016-04-27T17:00,2016,4,13.7,0.0,Cloudy
03/06/2016,10:00,40.6693877,-73.9038853,BROOKLYN,0.0,0.0,0,0,0,0,0,0,3400631,2016-03-06 10:00:00,2016-03-06T10:00,2016,3,3.0,0.0,Clear
12/01/2016,11:00,40.61785,-73.988075,BROOKLYN,1.0,0.0,0,0,0,0,1,0,3570853,2016-12-01 11:00:00,2016-12-01T11:00,2016,12,10.5,0.0,Clear
01/08/2016,15:00,40.6263625,-73.9506605,BROOKLYN,0.0,0.0,0,0,0,0,0,0,3367681,2016-01-08 15:00:00,2016-01-08T15:00,2016,1,6.5,0.0,Cloudy
06/15/2016,22:00,40.67828,-73.958855,BROOKLYN,1.0,0.0,0,0,1,0,0,0,3462901,2016-06-15 22:00:00,2016-06-15T22:00,2016,6,22.1,0.0,Cloudy
10/22/2016,20:00,40.643063,-73.95166,BROOKLYN,1.0,0.0,0,0,0,0,1,0,3547071,2016-10-22 20:00:00,2016-10-22T20:00,2016,10,9.6,0.0,Cloudy
05/20/2016,10:00,40.691525,-73.94554,BROOKLYN,1.0,0.0,0,0,0,0,1,0,3444748,2016-05-20 10:00:00,2016-05-20T10:00,2016,5,20.1,0.0,Clear
12/28/2016,10:00,40.674435,-73.919464,BROOKLYN,0.0,0.0,0,0,0,0,0,0,3588821,2016-12-28 10:00:00,2016-12-28T10:00,2016,12,3.4,0.0,Cloudy
07/10/2016,16:00,40.632847,-73.928375,BROOKLYN,1.0,0.0,0,0,0,0,1,0,3478442,2016-07-10 16:00:00,2016-07-10T16:00,2016,7,27.3,0.0,Cloudy
04/01/2016,9:00,40.70483,-73.93391,BROOKLYN,0.0,0.0,0,0,0,0,0,0,3421391,2016-04-01 09:00:00,2016-04-01T09:00,2016,4,16.0,0.0,Cloudy
05/29/2016,0:00,40.580482,-73.95984,BROOKLYN,1.0,0.0,0,0,1,0,0,0,3453359,2016-05-29 00:00:00,2016-05-29T00:00,2016,5,22.3,0.0,Clear
01/10/2016,17:00,40.6820056,-73.96869,BROOKLYN,3.0,0.0,0,0,0,0,3,0,3368251,2016-01-10 17:00:00,2016-01-10T17:00,2016,1,11.4,0.3,Drizzle
01/11/2016,15:00,40.6448523,-73.9600159,BROOKLYN,1.0,0.0,0,0,0,0,1,0,3369388,2016-01-11 15:00:00,2016-01-11T15:00,2016,1,0.8,0.0,Clear
11/12/2016,8:00,40.669228,-73.97634,BROOKLYN,1.0,0.0,0,0,0,0,1,0,3559324,2016-11-12 08:00:00,2016-11-12T08:00,2016,11,2.4,0.0,Clear
08/27/2016,14:00,40.61122,-73.9203,BROOKLYN,0.0,0.0,0,0,0,0,0,0,3509918,2016-08-27 14:00:00,2016-08-27T14:00,2016,8,30.1,0.0,Cloudy
04/23/2016,22:00,40.71718,-73.956276,BROOKLYN,2.0,0.0,0,0,0,0,2,0,3421916,2016-04-23 22:00:00,2016-04-23T22:00,2016,4,12.1,0.0,Clear
05/22/2016,6:00,40.643005,-73.95263,BROOKLYN,0.0,0.0,0,0,0,0,0,0,3450012,2016-05-22 06:00:00,2016-05-22T06:00,2016,5,12.1,0.0,Cloudy
12/26/2016,19:00,40.67509,-73.89187,BROOKLYN,2.0,0.0,0,0,0,0,2,0,3587359,2016-12-26 19:00:00,2016-12-26T19:00,2016,12,7.3,0.0,Cloudy
09/04/2016,14:00,40.67903,-73.9246,BROOKLYN,2.0,0.0,0,0,0,0,2,0,3515533,2016-09-04 14:00:00,2016-09-04T14:00,2016,9,25.5,0.0,Clear
05/23/2016,7:00,40.664227,-73.94547,BROOKLYN,2.0,0.0,0,0,0,0,2,0,3450327,2016-05-23 07:00:00,2016-05-23T07:00,2016,5,14.2,0.0,Cloudy
07/05/2016,14:00,40.661446,-73.92829,BROOKLYN,0.0,0.0,0,0,0,0,0,0,3477684,2016-07-05 14:00:00,2016-07-05T14:00,2016,7,28.3,0.0,Cloudy
07/28/2016,14:00,40.62392,-73.9216,BROOKLYN,0.0,0.0,0,0,0,0,0,0,3491973,2016-07-28 14:00:00,2016-07-28T14:00,2016,7,31.7,0.0,Cloudy
03/11/2016,13:00,40.6005903,-73.961364,BROOKLYN,0.0,0.0,0,0,0,0,0,0,3403530,2016-03-11 13:00:00,2016-03-11T13:00,2016,3,15.5,0.0,Clear
03/13/2016,14:00,40.6566109,-73.9309021,BROOKLYN,0.0,0.0,0,0,0,0,0,0,3405086,2016-03-13 14:00:00,2016-03-13T14:00,2016,3,14.8,0.0,Cloudy
01/16/2016,18:00,40.6872122,-73.9180447,BROOKLYN,1.0,0.0,0,0,0,0,1,0,3371880,2016-01-16 18:00:00,2016-01-16T18:00,2016,1,6.7,0.0,Cloudy
09/05/2016,21:00,40.638428,-73.95308,BROOKLYN,1.0,0.0,0,0,1,0,0,0,3515411,2016-09-05 21:00:00,2016-09-05T21:00,2016,9,23.4,0.0,Cloudy
07/14/2016,18:00,40.654137,-73.91234,BROOKLYN,1.0,0.0,0,0,0,0,1,0,3483086,2016-07-14 18:00:00,2016-07-14T18:00,2016,7,27.7,0.0,Clear
11/15/2016,16:00,40.664913,-73.9766,BROOKLYN,0.0,0.0,0,0,0,0,0,0,3561247,2016-11-15 16:00:00,2016-11-15T16:00,2016,11,8.5,0.0,Cloudy
05/26/2016,12:00,40.674946,-73.87502,BROOKLYN,1.0,0.0,0,0,0,0,1,0,3446406,2016-05-26 12:00:00,2016-05-26T12:00,2016,5,29.3,0.0,Cloudy
08/17/2016,8:00,40.66237,-73.87514,BROOKLYN,0.0,0.0,0,0,0,0,0,0,3501850,2016-08-17 08:00:00,2016-08-17T08:00,2016,8,25.7,0.0,Cloudy
05/20/2016,8:00,40.677338,-73.927536,BROOKLYN,1.0,0.0,0,0,0,0,1,0,3450864,2016-05-20 08:00:00,2016-05-20T08:00,2016,5,17.2,0.0,Clear
09/02/2016,0:00,40.67448,-74.00202,BROOKLYN,0.0,0.0,0,0,0,0,0,0,3513574,2016-09-02 00:00:00,2016-09-02T00:00,2016,9,20.5,0.0,Clear
12/12/2016,18:00,40.57629,-73.968544,BROOKLYN,2.0,0.0,2,0,0,0,0,0,3579247,2016-12-12 18:00:00,2016-12-12T18:00,2016,12,3.4,0.0,Clear
07/25/2016,15:00,40.62521,-73.9804,BROOKLYN,0.0,0.0,0,0,0,0,0,0,3488284,2016-07-25 15:00:00,2016-07-25T15:00,2016,7,33.5,0.0,Cloudy
10/02/2016,17:00,40.620323,-74.02723,BROOKLYN,3.0,0.0,0,0,0,0,3,0,3531378,2016-10-02 17:00:00,2016-10-02T17:00,2016,10,17.4,0.0,Cloudy
05/08/2016,13:00,40.631905,-73.94339,BROOKLYN,0.0,0.0,0,0,0,0,0,0,3440699,2016-05-08 13:00:00,2016-05-08T13:00,2016,5,16.0,0.0,Clear
09/03/2016,0:00,40.644306,-73.95179,BROOKLYN,3.0,0.0,0,0,0,0,3,0,3514038,2016-09-03 00:00:00,2016-09-03T00:00,2016,9,20.4,0.0,Cloudy
01/04/2016,9:00,40.7043102,-73.9192319,BROOKLYN,1.0,0.0,1,0,0,0,0,0,3365470,2016-01-04 09:00:00,2016-01-04T09:00,2016,1,-0.4,0.0,Cloudy
02/08/2016,12:00,40.6923571,-73.9428082,BROOKLYN,1.0,0.0,1,0,0,0,0,0,3385774,2016-02-08 12:00:00,2016-02-08T12:00,2016,2,-0.7,0.2,Light Snow
12/22/2016,8:00,40.680267,-73.9747,BROOKLYN,1.0,0.0,0,0,0,0,1,0,3584985,2016-12-22 08:00:00,2016-12-22T08:00,2016,12,2.1,0.0,Cloudy
11/22/2016,20:00,40.679802,-73.93892,BROOKLYN,3.0,0.0,0,0,0,0,3,0,3566348,2016-11-22 20:00:00,2016-11-22T20:00,2016,11,1.4,0.0,Clear
05/23/2016,13:00,40.59598,-73.94054,BROOKLYN,1.0,0.0,1,0,0,0,0,0,3445905,2016-05-23 13:00:00,2016-05-23T13:00,2016,5,21.4,0.0,Cloudy
08/12/2016,15:00,40.63421,-73.88905,BROOKLYN,1.0,0.0,1,0,0,0,0,0,3500284,2016-08-12 15:00:00,2016-08-12T15:00,2016,8,34.7,0.0,Cloudy
01/25/2016,8:00,40.7265374,-73.9543927,BROOKLYN,0.0,0.0,0,0,0,0,0,0,3377698,2016-01-25 08:00:00,2016-01-25T08:00,2016,1,-7.9,0.0,Clear
05/07/2016,22:00,40.639736,-73.906746,BROOKLYN,1.0,0.0,1,0,0,0,0,0,3440746,2016-05-07 22:00:00,2016-05-07T22:00,2016,5,10.1,0.0,Cloudy
09/24/2016,13:00,40.678078,-73.91359,BROOKLYN,3.0,0.0,0,0,0,0,3,0,3531143,2016-09-24 13:00:00,2016-09-24T13:00,2016,9,19.2,0.0,Clear
10/17/2016,4:00,40.644455,-74.0183,BROOKLYN,0.0,0.0,0,0,0,0,0,0,3541751,2016-10-17 04:00:00,2016-10-17T04:00,2016,10,15.5,0.0,Cloudy
05/25/2016,19:00,40.630566,-73.91846,BROOKLYN,0.0,0.0,0,0,0,0,0,0,3446386,2016-05-25 19:00:00,2016-05-25T19:00,2016,5,24.3,0.0,Clear
11/29/2016,9:00,40.665375,-73.934235,BROOKLYN,1.0,0.0,0,0,0,0,1,0,3570706,2016-11-29 09:00:00,2016-11-29T09:00,2016,11,12.9,0.2,Drizzle
08/21/2016,1:00,40.708424,-73.95791,BROOKLYN,1.0,0.0,1,0,0,0,0,0,3511430,2016-08-21 01:00:00,2016-08-21T01:00,2016,8,23.1,0.0,Clear
05/30/2016,0:00,40.647068,-73.993935,BROOKLYN,2.0,0.0,0,0,0,0,2,0,3449980,2016-05-30 00:00:00,2016-05-30T00:00,2016,5,20.6,0.4,Drizzle
12/18/2016,6:00,40.725433,-73.951744,BROOKLYN,1.0,0.0,0,0,1,0,0,0,3582100,2016-12-18 06:00:00,2016-12-18T06:00,2016,12,10.0,0.0,Cloudy
01/18/2016,13:00,40.6450432,-73.9996397,BROOKLYN,0.0,0.0,0,0,0,0,0,0,3372910,2016-01-18 13:00:00,2016-01-18T13:00,2016,1,-2.5,0.0,Cloudy
10/23/2016,14:00,40.67069,-73.91703,BROOKLYN,0.0,0.0,0,0,0,0,0,0,3546405,2016-10-23 14:00:00,2016-10-23T14:00,2016,10,15.7,0.0,Cloudy
08/26/2016,19:00,40.67671,-74.00477,BROOKLYN,1.0,0.0,0,0,1,0,0,0,3508454,2016-08-26 19:00:00,2016-08-26T19:00,2016,8,28.7,0.0,Clear
11/27/2016,4:00,40.632664,-73.93128,BROOKLYN,3.0,0.0,0,0,0,0,3,0,3569298,2016-11-27 04:00:00,2016-11-27T04:00,2016,11,3.4,0.0,Cloudy
12/23/2016,14:00,40.724926,-73.94438,BROOKLYN,1.0,0.0,0,0,0,0,1,0,3586419,2016-12-23 14:00:00,2016-12-23T14:00,2016,12,7.2,0.0,Cloudy
09/28/2016,7:00,40.715065,-73.94217,BROOKLYN,1.0,0.0,1,0,0,0,0,0,3528901,2016-09-28 07:00:00,2016-09-28T07:00,2016,9,16.8,0.0,Cloudy
07/28/2016,19:00,40.67148,-73.86334,BROOKLYN,1.0,0.0,0,0,0,0,1,0,3492160,2016-07-28 19:00:00,2016-07-28T19:00,2016,7,27.5,0.0,Cloudy
10/20/2016,17:00,40.69848,-73.941765,BROOKLYN,2.0,0.0,0,0,0,0,2,0,3544338,2016-10-20 17:00:00,2016-10-20T17:00,2016,10,19.2,0.2,Drizzle
04/18/2016,20:00,40.621643,-73.98662,BROOKLYN,1.0,0.0,0,0,0,0,1,0,3416147,2016-04-18 20:00:00,2016-04-18T20:00,2016,4,14.1,0.0,Cloudy
04/06/2016,15:00,40.697105,-73.95372,BROOKLYN,1.0,0.0,0,0,1,0,0,0,3420115,2016-04-06 15:00:00,2016-04-06T15:00,2016,4,8.2,0.0,Clear
05/07/2016,11:00,40.679638,-73.91655,BROOKLYN,0.0,0.0,0,0,0,0,0,0,3438474,2016-05-07 11:00:00,2016-05-07T11:00,2016,5,12.7,0.2,Drizzle
04/17/2016,22:00,40.653492,-74.00304,BROOKLYN,1.0,0.0,0,0,0,0,1,0,3418182,2016-04-17 22:00:00,2016-04-17T22:00,2016,4,9.5,0.0,Clear
01/10/2016,15:00,40.6194848,-73.9182647,BROOKLYN,1.0,0.0,0,0,0,0,1,0,3368688,2016-01-10 15:00:00,2016-01-10T15:00,2016,1,14.0,0.0,Cloudy
12/19/2016,20:00,40.60195,-73.99506,BROOKLYN,0.0,0.0,0,0,0,0,0,0,3584222,2016-12-19 20:00:00,2016-12-19T20:00,2016,12,-2.9,0.0,Cloudy
04/23/2016,12:00,40.67622,-73.95209,BROOKLYN,1.0,0.0,0,0,0,0,1,0,3419663,2016-04-23 12:00:00,2016-04-23T12:00,2016,4,19.3,0.0,Cloudy
03/10/2016,19:00,40.6112575,-73.9745147,BROOKLYN,1.0,0.0,0,0,0,0,1,0,3403535,2016-03-10 19:00:00,2016-03-10T19:00,2016,3,18.9,0.0,Cloudy
05/05/2016,2:00,40.640945,-73.94852,BROOKLYN,1.0,0.0,1,0,0,0,0,0,3483059,2016-05-05 02:00:00,2016-05-05T02:00,2016,5,8.1,0.0,Cloudy
08/04/2016,20:00,40.650948,-73.94668,BROOKLYN,1.0,0.0,0,0,1,0,0,0,3500995,2016-08-04 20:00:00,2016-08-04T20:00,2016,8,21.7,0.0,Clear
02/10/2016,19:00,40.6130524,-73.949118,BROOKLYN,2.0,0.0,0,0,0,0,2,0,3387327,2016-02-10 19:00:00,2016-02-10T19:00,2016,2,-0.2,0.0,Clear
05/16/2016,18:00,40.650208,-73.959984,BROOKLYN,1.0,0.0,1,0,0,0,0,0,3443954,2016-05-16 18:00:00,2016-05-16T18:00,2016,5,16.8,0.0,Clear
02/21/2016,15:00,40.7075935,-73.9555418,BROOKLYN,1.0,0.0,0,0,1,0,0,0,3393647,2016-02-21 15:00:00,2016-02-21T15:00,2016,2,11.6,0.0,Cloudy
05/17/2016,9:00,40.617287,-73.97786,BROOKLYN,1.0,0.0,1,0,0,0,0,0,3443932,2016-05-17 09:00:00,2016-05-17T09:00,2016,5,14.0,0.0,Cloudy
08/15/2016,16:00,40.605606,-73.99723,BROOKLYN,0.0,0.0,0,0,0,0,0,0,3500971,2016-08-15 16:00:00,2016-08-15T16:00,2016,8,32.0,0.0,Cloudy
03/01/2016,9:00,40.649656,-74.0163429,BROOKLYN,0.0,0.0,0,0,0,0,0,0,3397438,2016-03-01 09:00:00,2016-03-01T09:00,2016,3,3.8,0.0,Clear
02/29/2016,19:00,40.6802132,-73.9462762,BROOKLYN,0.0,0.0,0,0,0,0,0,0,3396694,2016-02-29 19:00:00,2016-02-29T19:00,2016,2,9.0,0.0,Clear
05/12/2016,5:00,40.607605,-73.99706,BROOKLYN,0.0,0.0,0,0,0,0,0,0,3440641,2016-05-12 05:00:00,2016-05-12T05:00,2016,5,9.3,0.0,Clear
08/12/2016,23:00,40.70518,-73.95934,BROOKLYN,0.0,0.0,0,0,0,0,0,0,3501200,2016-08-12 23:00:00,2016-08-12T23:00,2016,8,27.3,0.0,Cloudy
08/18/2016,23:00,40.69879,-73.95326,BROOKLYN,2.0,0.0,0,0,0,0,2,0,3503217,2016-08-18 23:00:00,2016-08-18T23:00,2016,8,24.4,0.0,Cloudy
06/10/2016,13:00,40.69336,-73.99062,BROOKLYN,1.0,0.0,1,0,0,0,0,0,4022566,2016-06-10 13:00:00,2016-06-10T13:00,2016,6,22.7,0.0,Clear
08/05/2016,15:00,40.685555,-73.95936,BROOKLYN,1.0,0.0,0,0,1,0,0,0,3494619,2016-08-05 15:00:00,2016-08-05T15:00,2016,8,26.6,0.0,Cloudy
07/28/2016,14:00,40.642906,-73.95438,BROOKLYN,4.0,0.0,0,0,0,0,4,0,3492073,2016-07-28 14:00:00,2016-07-28T14:00,2016,7,31.7,0.0,Clear
04/19/2016,17:00,40.576492,-73.976524,BROOKLYN,0.0,0.0,0,0,0,0,0,0,3414672,2016-04-19 17:00:00,2016-04-19T17:00,2016,4,18.9,0.0,Clear
10/25/2016,0:00,40.677296,-73.87682,BROOKLYN,0.0,0.0,0,0,0,0,0,0,3547831,2016-10-25 00:00:00,2016-10-25T00:00,2016,10,8.0,0.0,Clear
12/29/2016,13:00,40.629684,-73.90052,BROOKLYN,1.0,0.0,0,0,0,0,1,0,3589139,2016-12-29 13:00:00,2016-12-29T13:00,2016,12,7.3,1.3,Light Rain
02/08/2016,20:00,40.5763857,-73.96717,BROOKLYN,1.0,0.0,1,0,0,0,0,0,3386197,2016-02-08 20:00:00,2016-02-08T20:00,2016,2,-1.7,0.2,Light Snow
03/21/2016,15:00,40.665718,-73.95687,BROOKLYN,8.0,0.0,0,0,0,0,8,0,3417666,2016-03-21 15:00:00,2016-03-21T15:00,2016,3,9.1,0.0,Cloudy
06/22/2016,13:00,40.692936,-73.91051,BROOKLYN,0.0,0.0,0,0,0,0,0,0,3469061,2016-06-22 13:00:00,2016-06-22T13:00,2016,6,30.5,0.0,Clear
12/19/2016,17:00,40.65141,-73.913414,BROOKLYN,1.0,0.0,0,0,0,0,1,0,3583454,2016-12-19 17:00:00,2016-12-19T17:00,2016,12,-2.6,0.0,Cloudy
05/17/2016,13:00,40.629974,-74.00813,BROOKLYN,3.0,0.0,0,0,0,0,3,0,3450105,2016-05-17 13:00:00,2016-05-17T13:00,2016,5,17.2,0.0,Cloudy
02/06/2016,10:00,40.6872294,-73.941785,BROOKLYN,2.0,0.0,0,0,0,0,2,0,3385194,2016-02-06 10:00:00,2016-02-06T10:00,2016,2,-2.6,0.0,Cloudy
05/23/2016,15:00,40.669434,-73.9255,BROOKLYN,0.0,0.0,0,0,0,0,0,0,3453646,2016-05-23 15:00:00,2016-05-23T15:00,2016,5,22.0,0.0,Cloudy
09/20/2016,0:00,40.696198,-73.98869,BROOKLYN,0.0,0.0,0,0,0,0,0,0,3524114,2016-09-20 00:00:00,2016-09-20T00:00,2016,9,20.3,0.0,Cloudy
04/26/2016,10:00,40.64734,-73.91388,BROOKLYN,1.0,0.0,0,0,0,0,1,0,3432141,2016-04-26 10:00:00,2016-04-26T10:00,2016,4,18.4,0.0,Cloudy
10/15/2016,21:00,40.69958,-73.94136,BROOKLYN,1.0,0.0,0,0,0,0,1,0,3540806,2016-10-15 21:00:00,2016-10-15T21:00,2016,10,11.9,0.0,Clear
03/15/2016,18:00,40.68159,-73.96701,BROOKLYN,2.0,0.0,0,0,0,0,2,0,3419447,2016-03-15 18:00:00,2016-03-15T18:00,2016,3,10.9,0.0,Cloudy
01/23/2016,1:00,40.6335165,-73.9693901,BROOKLYN,0.0,0.0,0,0,0,0,0,0,3378368,2016-01-23 01:00:00,2016-01-23T01:00,2016,1,-2.6,0.6,Heavy Snow
07/02/2016,4:00,40.59768,-73.99824,BROOKLYN,1.0,0.0,1,0,0,0,0,0,3473746,2016-07-02 04:00:00,2016-07-02T04:00,2016,7,19.9,0.0,Clear
05/31/2016,11:00,40.65249,-73.95267,BROOKLYN,0.0,0.0,0,0,0,0,0,0,3483060,2016-05-31 11:00:00,2016-05-31T11:00,2016,5,27.2,0.0,Clear
06/03/2016,19:00,40.606674,-73.99252,BROOKLYN,2.0,0.0,0,0,0,0,2,0,3454990,2016-06-03 19:00:00,2016-06-03T19:00,2016,6,19.2,0.0,Cloudy
12/13/2016,20:00,40.63896,-74.03061,BROOKLYN,0.0,0.0,0,0,0,0,0,0,3586286,2016-12-13 20:00:00,2016-12-13T20:00,2016,12,3.2,0.0,Cloudy
07/03/2016,4:00,40.615795,-73.99834,BROOKLYN,0.0,0.0,0,0,0,0,0,0,3473751,2016-07-03 04:00:00,2016-07-03T04:00,2016,7,17.4,0.0,Cloudy
06/28/2016,12:00,40.7196,-73.94391,BROOKLYN,0.0,0.0,0,0,0,0,0,0,3470871,2016-06-28 12:00:00,2016-06-28T12:00,2016,6,23.4,0.0,Cloudy
04/10/2016,14:00,40.611763,-73.92472,BROOKLYN,1.0,0.0,0,0,0,0,1,0,3415766,2016-04-10 14:00:00,2016-04-10T14:00,2016,4,8.5,0.0,Clear
12/23/2016,14:00,40.641537,-73.981766,BROOKLYN,0.0,0.0,0,0,0,0,0,0,3585894,2016-12-23 14:00:00,2016-12-23T14:00,2016,12,7.2,0.0,Cloudy
01/13/2016,9:00,40.6359617,-73.952264,BROOKLYN,0.0,0.0,0,0,0,0,0,0,3370103,2016-01-13 09:00:00,2016-01-13T09:00,2016,1,-4.1,0.0,Cloudy
10/03/2016,16:00,40.580658,-73.985664,BROOKLYN,1.0,0.0,0,0,0,0,1,0,3534059,2016-10-03 16:00:00,2016-10-03T16:00,2016,10,21.3,0.0,Clear
12/23/2016,12:00,40.69012,-73.92318,BROOKLYN,0.0,0.0,0,0,0,0,0,0,3588744,2016-12-23 12:00:00,2016-12-23T12:00,2016,12,5.5,0.0,Cloudy
05/13/2016,9:00,40.68762,-73.95804,BROOKLYN,1.0,0.0,0,0,0,0,1,0,3442535,2016-05-13 09:00:00,2016-05-13T09:00,2016,5,17.1,0.0,Cloudy
03/05/2016,10:00,40.6398568,-73.8978024,BROOKLYN,1.0,0.0,0,0,0,0,1,0,3399998,2016-03-05 10:00:00,2016-03-05T10:00,2016,3,1.4,0.0,Cloudy
01/06/2016,22:00,40.6306618,-74.0310589,BROOKLYN,2.0,0.0,0,0,0,0,2,0,3366037,2016-01-06 22:00:00,2016-01-06T22:00,2016,1,-3.1,0.0,Clear
04/18/2016,19:00,40.69726,-73.95233,BROOKLYN,0.0,0.0,0,0,0,0,0,0,3420187,2016-04-18 19:00:00,2016-04-18T19:00,2016,4,15.4,0.0,Cloudy
01/23/2016,6:00,40.6492697,-74.0096651,BROOKLYN,1.0,0.0,0,0,0,0,1,0,3375850,2016-01-23 06:00:00,2016-01-23T06:00,2016,1,-3.2,2.3,Heavy Snow
11/25/2016,8:00,40.674904,-73.94447,BROOKLYN,1.0,0.0,0,0,0,0,1,0,3569852,2016-11-25 08:00:00,2016-11-25T08:00,2016,11,6.3,0.0,Cloudy
04/14/2016,9:00,40.657486,-73.9252,BROOKLYN,1.0,0.0,0,0,0,0,1,0,3483058,2016-04-14 09:00:00,2016-04-14T09:00,2016,4,8.3,0.0,Clear
06/01/2016,10:00,40.661137,-73.89699,BROOKLYN,1.0,0.0,0,0,1,0,0,0,3453630,2016-06-01 10:00:00,2016-06-01T10:00,2016,6,25.4,0.0,Cloudy
09/11/2016,1:00,40.675735,-73.89686,BROOKLYN,2.0,0.0,0,0,0,0,2,0,3517828,2016-09-11 01:00:00,2016-09-11T01:00,2016,9,24.5,0.0,Clear
08/31/2016,17:00,40.681675,-73.879135,BROOKLYN,0.0,0.0,0,0,0,0,0,0,3512065,2016-08-31 17:00:00,2016-08-31T17:00,2016,8,28.1,0.0,Cloudy
06/17/2016,18:00,40.601402,-73.95399,BROOKLYN,1.0,0.0,0,0,1,0,0,0,3464373,2016-06-17 18:00:00,2016-06-17T18:00,2016,6,20.8,0.0,Clear
06/01/2016,15:00,40.597923,-73.9872,BROOKLYN,1.0,0.0,1,0,0,0,0,0,3454968,2016-06-01 15:00:00,2016-06-01T15:00,2016,6,25.9,0.0,Cloudy
10/10/2016,13:00,40.587383,-73.95422,BROOKLYN,1.0,0.0,1,0,0,0,0,0,3538400,2016-10-10 13:00:00,2016-10-10T13:00,2016,10,15.3,0.0,Clear
11/02/2016,16:00,40.66475,-73.89405,BROOKLYN,1.0,0.0,0,0,0,0,1,0,3552914,2016-11-02 16:00:00,2016-11-02T16:00,2016,11,19.5,0.0,Cloudy
04/15/2016,8:00,40.69154,-73.90833,BROOKLYN,0.0,0.0,0,0,0,0,0,0,3420612,2016-04-15 08:00:00,2016-04-15T08:00,2016,4,7.7,0.0,Clear
01/13/2016,7:00,40.6259834,-74.0015202,BROOKLYN,0.0,0.0,0,0,0,0,0,0,3371842,2016-01-13 07:00:00,2016-01-13T07:00,2016,1,-4.7,0.0,Clear
12/07/2016,20:00,40.635303,-74.00617,BROOKLYN,0.0,0.0,0,0,0,0,0,0,3575630,2016-12-07 20:00:00,2016-12-07T20:00,2016,12,5.5,0.0,Cloudy
04/02/2016,23:00,40.666412,-73.96156,BROOKLYN,1.0,0.0,0,0,0,0,1,0,3417744,2016-04-02 23:00:00,2016-04-02T23:00,2016,4,8.0,0.0,Cloudy
01/28/2016,11:00,40.6129575,-73.9590769,BROOKLYN,1.0,0.0,0,0,0,0,1,0,3381456,2016-01-28 11:00:00,2016-01-28T11:00,2016,1,-2.0,0.0,Clear
01/19/2016,12:00,40.6407694,-73.9940763,BROOKLYN,1.0,0.0,1,0,0,0,0,0,3373369,2016-01-19 12:00:00,2016-01-19T12:00,2016,1,-3.9,0.0,Clear
10/25/2016,17:00,40.710785,-73.95995,BROOKLYN,1.0,0.0,0,0,0,0,1,0,3547132,2016-10-25 17:00:00,2016-10-25T17:00,2016,10,9.6,0.0,Clear
05/31/2016,22:00,40.67992,-73.94077,BROOKLYN,0.0,0.0,0,0,0,0,0,0,3453507,2016-05-31 22:00:00,2016-05-31T22:00,2016,5,20.2,0.0,Cloudy
11/05/2016,19:00,40.664413,-73.901634,BROOKLYN,0.0,0.0,0,0,0,0,0,0,3554398,2016-11-05 19:00:00,2016-11-05T19:00,2016,11,10.6,0.0,Clear
01/29/2016,20:00,40.6352888,-73.9581985,BROOKLYN,0.0,0.0,0,0,0,0,0,0,3380826,2016-01-29 20:00:00,2016-01-29T20:00,2016,1,-1.2,0.0,Clear
09/13/2016,19:00,40.72682,-73.947556,BROOKLYN,1.0,0.0,0,0,0,0,1,0,3519434,2016-09-13 19:00:00,2016-09-13T19:00,2016,9,21.8,0.0,Clear
06/25/2016,18:00,40.713245,-73.942474,BROOKLYN,1.0,0.0,0,0,0,0,1,0,3469108,2016-06-25 18:00:00,2016-06-25T18:00,2016,6,24.3,0.0,Clear
10/08/2016,16:00,40.68444,-73.97772,BROOKLYN,0.0,0.0,0,0,0,0,0,0,3536862,2016-10-08 16:00:00,2016-10-08T16:00,2016,10,19.1,0.2,Drizzle
12/12/2016,6:00,40.651733,-73.93039,BROOKLYN,1.0,0.0,1,0,0,0,0,0,3578902,2016-12-12 06:00:00,2016-12-12T06:00,2016,12,5.0,2.0,Light Rain
05/08/2016,3:00,40.608746,-73.95829,BROOKLYN,0.0,0.0,0,0,0,0,0,0,3439994,2016-05-08 03:00:00,2016-05-08T03:00,2016,5,8.9,0.0,Cloudy
08/04/2016,20:00,40.64076,-73.97502,BROOKLYN,1.0,0.0,1,0,0,0,0,0,3532979,2016-08-04 20:00:00,2016-08-04T20:00,2016,8,21.9,0.0,Clear
06/02/2016,12:00,40.67034,-73.98873,BROOKLYN,1.0,0.0,1,0,0,0,0,0,3456321,2016-06-02 12:00:00,2016-06-02T12:00,2016,6,22.9,0.0,Cloudy
06/15/2016,14:00,40.63701,-73.91495,BROOKLYN,1.0,0.0,0,0,0,0,1,0,3462142,2016-06-15 14:00:00,2016-06-15T14:00,2016,6,28.3,0.0,Cloudy
12/20/2016,14:00,40.619484,-73.918274,BROOKLYN,2.0,0.0,0,0,0,0,2,0,3583814,2016-12-20 14:00:00,2016-12-20T14:00,2016,12,-0.1,0.0,Clear
05/17/2016,10:00,40.667973,-73.987305,BROOKLYN,1.0,0.0,0,0,1,0,0,0,3450741,2016-05-17 10:00:00,2016-05-17T10:00,2016,5,15.1,0.0,Cloudy
02/06/2016,23:00,40.6753551,-73.9527693,BROOKLYN,2.0,0.0,0,0,0,0,2,0,3385180,2016-02-06 23:00:00,2016-02-06T23:00,2016,2,-3.6,0.0,Cloudy
07/17/2016,20:00,40.621803,-73.92013,BROOKLYN,1.0,0.0,0,0,0,0,1,0,3482151,2016-07-17 20:00:00,2016-07-17T20:00,2016,7,28.3,0.0,Clear
01/29/2016,15:00,40.6301285,-73.944807,BROOKLYN,1.0,0.0,1,0,0,0,0,0,3380825,2016-01-29 15:00:00,2016-01-29T15:00,2016,1,3.2,0.0,Cloudy
02/18/2016,18:00,40.6854052,-73.9752435,BROOKLYN,0.0,0.0,0,0,0,0,0,0,3391406,2016-02-18 18:00:00,2016-02-18T18:00,2016,2,-1.2,0.0,Clear
04/23/2016,15:00,40.63247,-74.00454,BROOKLYN,1.0,0.0,0,0,0,0,1,0,3416202,2016-04-23 15:00:00,2016-04-23T15:00,2016,4,19.3,0.0,Cloudy
11/24/2016,0:00,40.63633,-73.94705,BROOKLYN,0.0,0.0,0,0,0,0,0,0,3568105,2016-11-24 00:00:00,2016-11-24T00:00,2016,11,3.5,0.0,Cloudy
02/11/2016,4:00,40.6576643,-73.8970434,BROOKLYN,1.0,0.0,0,0,0,0,1,0,3387406,2016-02-11 04:00:00,2016-02-11T04:00,2016,2,-3.3,0.0,Cloudy
11/19/2016,23:00,40.7263,-73.94913,BROOKLYN,1.0,0.0,1,0,0,0,0,0,3563957,2016-11-19 23:00:00,2016-11-19T23:00,2016,11,8.3,1.0,Drizzle
03/15/2016,11:00,40.68034,-73.94851,BROOKLYN,1.0,0.0,1,0,0,0,0,0,3419977,2016-03-15 11:00:00,2016-03-15T11:00,2016,3,9.2,0.0,Cloudy
06/22/2016,19:00,40.652752,-73.88629,BROOKLYN,0.0,0.0,0,0,0,0,0,0,3469008,2016-06-22 19:00:00,2016-06-22T19:00,2016,6,27.1,0.0,Clear
05/08/2016,16:00,40.66955,-73.94497,BROOKLYN,0.0,0.0,0,0,0,0,0,0,3438408,2016-05-08 16:00:00,2016-05-08T16:00,2016,5,16.8,0.0,Clear
03/10/2016,10:00,40.6981895,-73.9618989,BROOKLYN,2.0,0.0,0,0,0,0,2,0,3403096,2016-03-10 10:00:00,2016-03-10T10:00,2016,3,18.6,0.0,Clear
08/23/2016,15:00,40.582962,-73.9864,BROOKLYN,1.0,0.0,0,0,0,0,1,0,3506024,2016-08-23 15:00:00,2016-08-23T15:00,2016,8,27.2,0.0,Clear
01/05/2016,12:00,40.6497805,-73.9494648,BROOKLYN,0.0,0.0,0,0,0,0,0,0,3366025,2016-01-05 12:00:00,2016-01-05T12:00,2016,1,-3.3,0.0,Clear
09/09/2016,12:00,40.6476,-73.881485,BROOKLYN,1.0,0.0,0,0,0,0,1,0,3517846,2016-09-09 12:00:00,2016-09-09T12:00,2016,9,31.3,0.0,Cloudy
09/24/2016,2:00,40.671715,-73.97757,BROOKLYN,3.0,0.0,0,0,0,0,3,0,3527127,2016-09-24 02:00:00,2016-09-24T02:00,2016,9,17.5,0.8,Drizzle
12/02/2016,14:00,40.616714,-73.971855,BROOKLYN,0.0,0.0,0,0,0,0,0,0,3572176,2016-12-02 14:00:00,2016-12-02T14:00,2016,12,10.1,0.0,Cloudy
07/11/2016,8:00,40.704716,-73.92875,BROOKLYN,2.0,0.0,2,0,0,0,0,0,3478565,2016-07-11 08:00:00,2016-07-11T08:00,2016,7,21.0,0.0,Cloudy
11/13/2016,14:00,40.62748,-74.00714,BROOKLYN,0.0,0.0,0,0,0,0,0,0,3560356,2016-11-13 14:00:00,2016-11-13T14:00,2016,11,14.9,0.0,Clear
03/13/2016,15:00,40.662175,-73.9537014,BROOKLYN,1.0,0.0,0,0,0,0,1,0,3405096,2016-03-13 15:00:00,2016-03-13T15:00,2016,3,14.5,0.0,Cloudy
02/03/2016,18:00,40.5781084,-73.9926239,BROOKLYN,1.0,0.0,0,0,0,0,1,0,3384063,2016-02-03 18:00:00,2016-02-03T18:00,2016,2,12.1,1.9,Light Rain
09/27/2016,13:00,40.640556,-73.976875,BROOKLYN,0.0,0.0,0,0,0,0,0,0,3529423,2016-09-27 13:00:00,2016-09-27T13:00,2016,9,21.2,0.0,Cloudy
12/22/2016,9:00,40.64953,-73.91633,BROOKLYN,2.0,0.0,0,0,0,0,2,0,3586189,2016-12-22 09:00:00,2016-12-22T09:00,2016,12,4.1,0.0,Cloudy
10/13/2016,17:00,40.64952,-73.955795,BROOKLYN,1.0,0.0,0,0,1,0,0,0,3541703,2016-10-13 17:00:00,2016-10-13T17:00,2016,10,17.2,0.0,Clear
04/15/2016,21:00,40.704346,-73.94398,BROOKLYN,2.0,0.0,1,0,0,0,1,0,3421545,2016-04-15 21:00:00,2016-04-15T21:00,2016,4,7.9,0.0,Clear
11/11/2016,0:00,40.68311,-73.89056,BROOKLYN,0.0,0.0,0,0,0,0,0,0,3559596,2016-11-11 00:00:00,2016-11-11T00:00,2016,11,8.3,0.0,Clear
07/31/2016,4:00,40.69365,-73.98333,BROOKLYN,3.0,0.0,0,0,0,0,3,0,3491235,2016-07-31 04:00:00,2016-07-31T04:00,2016,7,22.8,0.8,Drizzle
11/02/2016,20:00,40.69613,-73.987114,BROOKLYN,1.0,0.0,1,0,0,0,0,0,3552890,2016-11-02 20:00:00,2016-11-02T20:00,2016,11,15.3,0.0,Clear
12/15/2016,20:00,40.651363,-73.96345,BROOKLYN,1.0,0.0,0,0,1,0,0,0,3582249,2016-12-15 20:00:00,2016-12-15T20:00,2016,12,-6.1,0.0,Clear
05/20/2016,22:00,40.58667,-73.966156,BROOKLYN,1.0,0.0,0,0,0,0,1,0,3449624,2016-05-20 22:00:00,2016-05-20T22:00,2016,5,14.8,0.0,Cloudy
10/21/2016,0:00,40.634026,-73.95023,BROOKLYN,1.0,0.0,0,0,0,0,1,0,3545182,2016-10-21 00:00:00,2016-10-21T00:00,2016,10,19.4,0.0,Cloudy
08/31/2016,12:00,40.681927,-73.87072,BROOKLYN,0.0,0.0,0,0,0,0,0,0,3512053,2016-08-31 12:00:00,2016-08-31T12:00,2016,8,29.3,0.0,Cloudy
12/29/2016,16:00,40.678272,-73.944626,BROOKLYN,2.0,0.0,0,0,0,0,2,0,3590900,2016-12-29 16:00:00,2016-12-29T16:00,2016,12,4.6,1.3,Light Rain
11/14/2016,19:00,40.608032,-74.01303,BROOKLYN,1.0,0.0,1,0,0,0,0,0,3560969,2016-11-14 19:00:00,2016-11-14T19:00,2016,11,11.1,0.0,Cloudy
08/27/2016,18:00,40.69225,-73.92792,BROOKLYN,1.0,0.0,0,0,0,0,1,0,3509341,2016-08-27 18:00:00,2016-08-27T18:00,2016,8,26.9,0.0,Cloudy
01/26/2016,16:00,40.7242379,-73.9561548,BROOKLYN,1.0,0.0,0,0,0,0,1,0,3378494,2016-01-26 16:00:00,2016-01-26T16:00,2016,1,4.8,0.0,Cloudy
12/25/2016,9:00,40.641254,-73.9964,BROOKLYN,0.0,0.0,0,0,0,0,0,0,3586780,2016-12-25 09:00:00,2016-12-25T09:00,2016,12,1.7,0.0,Clear
04/17/2016,20:00,40.6401,-73.9669,BROOKLYN,1.0,0.0,1,0,0,0,0,0,4022245,2016-04-17 20:00:00,2016-04-17T20:00,2016,4,11.7,0.0,Clear
09/16/2016,16:00,40.66059,-73.931335,BROOKLYN,0.0,0.0,0,0,0,0,0,0,3522830,2016-09-16 16:00:00,2016-09-16T16:00,2016,9,21.1,0.0,Clear
03/24/2016,17:00,40.674847,-73.95005,BROOKLYN,0.0,0.0,0,0,0,0,0,0,3419490,2016-03-24 17:00:00,2016-03-24T17:00,2016,3,9.6,0.0,Cloudy
09/23/2016,8:00,40.69334,-73.96689,BROOKLYN,2.0,0.0,0,0,0,0,2,0,3525798,2016-09-23 08:00:00,2016-09-23T08:00,2016,9,19.2,0.0,Cloudy
07/07/2016,13:00,40.654312,-73.91759,BROOKLYN,1.0,0.0,0,0,0,0,1,0,3482223,2016-07-07 13:00:00,2016-07-07T13:00,2016,7,30.8,0.6,Drizzle
11/02/2016,23:00,40.65067,-73.95248,BROOKLYN,1.0,0.0,1,0,0,0,0,0,3553282,2016-11-02 23:00:00,2016-11-02T23:00,2016,11,13.9,0.0,Clear
09/10/2016,21:00,40.630165,-73.89978,BROOKLYN,1.0,0.0,0,0,0,0,1,0,3517768,2016-09-10 21:00:00,2016-09-10T21:00,2016,9,25.8,0.0,Cloudy
05/20/2016,19:00,40.63787,-73.90963,BROOKLYN,1.0,0.0,0,0,1,0,0,0,3450178,2016-05-20 19:00:00,2016-05-20T19:00,2016,5,16.9,0.0,Cloudy
02/03/2016,14:00,40.6894904,-73.9220696,BROOKLYN,1.0,0.0,1,0,0,0,0,0,3382979,2016-02-03 14:00:00,2016-02-03T14:00,2016,2,11.8,2.1,Light Rain
08/15/2016,13:00,40.699482,-73.96104,BROOKLYN,0.0,0.0,0,0,0,0,0,0,3501212,2016-08-15 13:00:00,2016-08-15T13:00,2016,8,32.0,0.0,Clear
08/09/2016,16:00,40.65249,-73.95267,BROOKLYN,1.0,0.0,0,0,0,0,1,0,3497304,2016-08-09 16:00:00,2016-08-09T16:00,2016,8,28.0,0.0,Cloudy
05/16/2016,9:00,40.660576,-73.99065,BROOKLYN,0.0,0.0,0,0,0,0,0,0,3443341,2016-05-16 09:00:00,2016-05-16T09:00,2016,5,9.1,0.0,Cloudy
06/12/2016,11:00,40.70398,-73.94005,BROOKLYN,0.0,0.0,0,0,0,0,0,0,3533232,2016-06-12 11:00:00,2016-06-12T11:00,2016,6,27.1,0.0,Clear
11/14/2016,20:00,40.587303,-73.96036,BROOKLYN,1.0,0.0,0,0,0,0,1,0,3561803,2016-11-14 20:00:00,2016-11-14T20:00,2016,11,10.0,0.0,Cloudy
06/19/2016,17:00,40.633907,-73.97047,BROOKLYN,1.0,0.0,0,0,1,0,0,0,3468181,2016-06-19 17:00:00,2016-06-19T17:00,2016,6,23.3,0.0,Cloudy
10/26/2016,21:00,40.685406,-73.97525,BROOKLYN,1.0,0.0,0,0,0,0,1,0,3548544,2016-10-26 21:00:00,2016-10-26T21:00,2016,10,4.5,0.0,Cloudy
06/15/2016,18:00,40.646984,-74.02273,BROOKLYN,0.0,0.0,0,0,0,0,0,0,3464482,2016-06-15 18:00:00,2016-06-15T18:00,2016,6,26.2,0.0,Cloudy
04/03/2016,20:00,40.649254,-73.96357,BROOKLYN,1.0,0.0,0,0,0,0,1,0,3417445,2016-04-03 20:00:00,2016-04-03T20:00,2016,4,3.6,0.0,Clear
04/03/2016,5:00,40.669117,-73.98966,BROOKLYN,1.0,0.0,0,0,0,0,1,0,3419809,2016-04-03 05:00:00,2016-04-03T05:00,2016,4,1.9,0.9,Light Snow
02/12/2016,16:00,40.7011037,-73.9223843,BROOKLYN,1.0,0.0,0,0,0,0,1,0,3390243,2016-02-12 16:00:00,2016-02-12T16:00,2016,2,-4.5,0.0,Cloudy
08/24/2016,10:00,40.68969,-73.99237,BROOKLYN,0.0,0.0,0,0,0,0,0,0,3506956,2016-08-24 10:00:00,2016-08-24T10:00,2016,8,26.7,0.0,Clear
07/05/2016,1:00,40.635494,-74.00957,BROOKLYN,1.0,0.0,0,0,0,0,1,0,3474446,2016-07-05 01:00:00,2016-07-05T01:00,2016,7,20.3,0.6,Drizzle
08/11/2016,10:00,40.730015,-73.95929,BROOKLYN,0.0,0.0,0,0,0,0,0,0,3498204,2016-08-11 10:00:00,2016-08-11T10:00,2016,8,28.7,0.0,Cloudy
02/10/2016,19:00,40.6873091,-73.947601,BROOKLYN,1.0,0.0,1,0,0,0,0,0,3387442,2016-02-10 19:00:00,2016-02-10T19:00,2016,2,-0.5,0.0,Clear
11/30/2016,0:00,40.67239,-73.87463,BROOKLYN,1.0,0.0,1,0,0,0,0,0,3570321,2016-11-30 00:00:00,2016-11-30T00:00,2016,11,13.6,0.0,Cloudy
05/10/2016,21:00,40.604996,-73.97858,BROOKLYN,0.0,0.0,0,0,0,0,0,0,3438232,2016-05-10 21:00:00,2016-05-10T21:00,2016,5,11.1,0.0,Clear
06/30/2016,13:00,40.65894,-73.95337,BROOKLYN,2.0,0.0,0,0,0,0,2,0,3477736,2016-06-30 13:00:00,2016-06-30T13:00,2016,6,28.6,0.0,Cloudy
02/03/2016,19:00,40.6116055,-73.9197042,BROOKLYN,1.0,0.0,0,0,0,0,1,0,3383496,2016-02-03 19:00:00,2016-02-03T19:00,2016,2,12.5,1.3,Light Rain
05/14/2016,17:00,40.59606,-73.99274,BROOKLYN,1.0,0.0,0,0,0,0,1,0,3443246,2016-05-14 17:00:00,2016-05-14T17:00,2016,5,18.9,0.0,Cloudy
03/15/2016,19:00,40.657787,-73.94084,BROOKLYN,1.0,0.0,1,0,0,0,0,0,3417228,2016-03-15 19:00:00,2016-03-15T19:00,2016,3,9.6,0.0,Cloudy
05/29/2016,8:00,40.67351,-73.95205,BROOKLYN,1.0,0.0,1,0,0,0,0,0,3457141,2016-05-29 08:00:00,2016-05-29T08:00,2016,5,24.4,0.0,Cloudy
12/20/2016,13:00,40.688633,-73.9621,BROOKLYN,0.0,0.0,0,0,0,0,0,0,3583736,2016-12-20 13:00:00,2016-12-20T13:00,2016,12,-0.1,0.0,Clear
07/26/2016,0:00,40.641727,-73.99265,BROOKLYN,1.0,0.0,0,0,1,0,0,0,3488293,2016-07-26 00:00:00,2016-07-26T00:00,2016,7,25.5,0.0,Clear
10/08/2016,19:00,40.669975,-73.91988,BROOKLYN,1.0,0.0,1,0,0,0,0,0,3537193,2016-10-08 19:00:00,2016-10-08T19:00,2016,10,18.0,0.2,Drizzle
02/29/2016,17:00,40.6524906,-73.9217849,BROOKLYN,0.0,0.0,0,0,0,0,0,0,3397371,2016-02-29 17:00:00,2016-02-29T17:00,2016,2,12.5,0.0,Clear
08/18/2016,20:00,40.69003,-73.911,BROOKLYN,1.0,0.0,0,0,1,0,0,0,3503598,2016-08-18 20:00:00,2016-08-18T20:00,2016,8,26.2,0.0,Clear
05/16/2016,16:00,40.662468,-73.99226,BROOKLYN,1.0,0.0,0,0,0,0,1,0,3443344,2016-05-16 16:00:00,2016-05-16T16:00,2016,5,18.0,0.0,Clear
05/15/2016,18:00,40.636005,-73.99827,BROOKLYN,1.0,0.0,1,0,0,0,0,0,3443273,2016-05-15 18:00:00,2016-05-15T18:00,2016,5,12.1,0.0,Clear
04/27/2016,10:00,40.599457,-73.99639,BROOKLYN,0.0,0.0,0,0,0,0,0,0,3433747,2016-04-27 10:00:00,2016-04-27T10:00,2016,4,10.7,0.0,Cloudy
12/23/2016,23:00,40.716305,-73.935005,BROOKLYN,0.0,0.0,0,0,0,0,0,0,3586870,2016-12-23 23:00:00,2016-12-23T23:00,2016,12,1.8,0.0,Cloudy
03/08/2016,12:00,40.5834322,-73.9604775,BROOKLYN,1.0,0.0,0,0,0,0,1,0,3401645,2016-03-08 12:00:00,2016-03-08T12:00,2016,3,14.4,0.0,Clear
04/18/2016,11:00,40.661366,-73.90612,BROOKLYN,0.0,0.0,0,0,0,0,0,0,3418496,2016-04-18 11:00:00,2016-04-18T11:00,2016,4,20.9,0.0,Cloudy
03/06/2016,23:00,40.6773573,-73.8962163,BROOKLYN,0.0,0.0,0,0,0,0,0,0,3401784,2016-03-06 23:00:00,2016-03-06T23:00,2016,3,-0.3,0.0,Clear
09/08/2016,13:00,40.642174,-74.02064,BROOKLYN,1.0,0.0,0,0,1,0,0,0,3516103,2016-09-08 13:00:00,2016-09-08T13:00,2016,9,29.3,0.0,Cloudy
05/20/2016,19:00,40.673763,-73.95013,BROOKLYN,1.0,0.0,0,0,0,0,1,0,3445067,2016-05-20 19:00:00,2016-05-20T19:00,2016,5,17.0,0.0,Cloudy
02/29/2016,14:00,40.636833,-73.911255,BROOKLYN,1.0,0.0,0,0,0,0,1,0,3417041,2016-02-29 14:00:00,2016-02-29T14:00,2016,2,13.2,0.0,Clear
10/12/2016,15:00,40.711067,-73.961624,BROOKLYN,2.0,0.0,0,0,2,0,0,0,3540425,2016-10-12 15:00:00,2016-10-12T15:00,2016,10,17.8,0.0,Cloudy
11/06/2016,0:00,40.677917,-73.93861,BROOKLYN,1.0,0.0,0,0,0,0,1,0,3555215,2016-11-06 00:00:00,2016-11-06T00:00,2016,11,8.8,0.0,Cloudy
01/23/2016,1:00,40.6830499,-73.9737625,BROOKLYN,0.0,0.0,0,0,0,0,0,0,3375887,2016-01-23 01:00:00,2016-01-23T01:00,2016,1,-2.8,0.6,Heavy Snow
07/02/2016,4:00,40.683224,-73.95611,BROOKLYN,1.0,0.0,0,0,1,0,0,0,4023693,2016-07-02 04:00:00,2016-07-02T04:00,2016,7,19.2,0.0,Clear
08/16/2016,16:00,40.61061,-73.95671,BROOKLYN,0.0,0.0,0,0,0,0,0,0,3501705,2016-08-16 16:00:00,2016-08-16T16:00,2016,8,29.5,0.0,Cloudy
08/10/2016,13:00,40.68954,-73.971146,BROOKLYN,1.0,0.0,0,0,1,0,0,0,3498185,2016-08-10 13:00:00,2016-08-10T13:00,2016,8,29.4,1.3,Light Rain
06/08/2016,15:00,40.685448,-73.9831,BROOKLYN,0.0,0.0,0,0,0,0,0,0,3458649,2016-06-08 15:00:00,2016-06-08T15:00,2016,6,13.4,0.5,Drizzle
11/14/2016,10:00,40.619396,-73.969574,BROOKLYN,1.0,0.0,0,0,0,0,1,0,3560328,2016-11-14 10:00:00,2016-11-14T10:00,2016,11,10.3,0.0,Clear
04/30/2016,8:00,40.678356,-73.89706,BROOKLYN,1.0,0.0,0,0,0,0,1,0,3432443,2016-04-30 08:00:00,2016-04-30T08:00,2016,4,8.9,0.0,Cloudy
06/27/2016,21:00,40.6224,-73.936646,BROOKLYN,1.0,0.0,0,0,0,0,1,0,3469715,2016-06-27 21:00:00,2016-06-27T21:00,2016,6,21.8,0.6,Drizzle
01/06/2016,16:00,40.6932048,-73.95399,BROOKLYN,0.0,0.0,0,0,0,0,0,0,3366121,2016-01-06 16:00:00,2016-01-06T16:00,2016,1,2.2,0.0,Clear
02/04/2016,13:00,40.5791996,-73.9819392,BROOKLYN,1.0,0.0,0,0,0,0,1,0,3384628,2016-02-04 13:00:00,2016-02-04T13:00,2016,2,11.4,0.0,Cloudy
11/11/2016,16:00,40.70431,-73.955086,BROOKLYN,1.0,0.0,1,0,0,0,0,0,3558580,2016-11-11 16:00:00,2016-11-11T16:00,2016,11,11.7,0.0,Clear
09/21/2016,17:00,40.669098,-73.93666,BROOKLYN,1.0,0.0,1,0,0,0,0,0,3524448,2016-09-21 17:00:00,2016-09-21T17:00,2016,9,25.7,0.0,Cloudy
06/01/2016,9:00,40.713318,-73.94925,BROOKLYN,1.0,0.0,0,0,0,0,1,0,3453761,2016-06-01 09:00:00,2016-06-01T09:00,2016,6,24.3,0.0,Cloudy
10/28/2016,22:00,40.63347,-74.02102,BROOKLYN,1.0,0.0,0,0,0,0,1,0,3549241,2016-10-28 22:00:00,2016-10-28T22:00,2016,10,5.6,0.0,Cloudy
10/21/2016,11:00,40.67743,-73.97662,BROOKLYN,0.0,0.0,0,0,0,0,0,0,3545895,2016-10-21 11:00:00,2016-10-21T11:00,2016,10,20.2,0.9,Drizzle
05/17/2016,19:00,40.607765,-73.98255,BROOKLYN,0.0,0.0,0,0,0,0,0,0,4022406,2016-05-17 19:00:00,2016-05-17T19:00,2016,5,12.2,0.0,Cloudy
09/02/2016,20:00,40.6865,-73.98787,BROOKLYN,1.0,0.0,0,0,1,0,0,0,3512873,2016-09-02 20:00:00,2016-09-02T20:00,2016,9,22.0,0.0,Cloudy
03/30/2016,22:00,40.683464,-73.97569,BROOKLYN,0.0,0.0,0,0,0,0,0,0,3419787,2016-03-30 22:00:00,2016-03-30T22:00,2016,3,6.1,0.0,Clear
10/02/2016,12:00,40.663948,-73.91025,BROOKLYN,1.0,0.0,0,0,0,0,1,0,3533634,2016-10-02 12:00:00,2016-10-02T12:00,2016,10,17.1,0.3,Drizzle
07/29/2016,16:00,40.677025,-73.95268,BROOKLYN,1.0,0.0,0,0,1,0,0,0,3496577,2016-07-29 16:00:00,2016-07-29T16:00,2016,7,28.8,0.0,Clear
03/04/2016,11:00,40.6874155,-73.9597127,BROOKLYN,0.0,0.0,0,0,0,0,0,0,3399518,2016-03-04 11:00:00,2016-03-04T11:00,2016,3,0.7,0.3,Heavy Snow
08/04/2016,13:00,40.660656,-73.885796,BROOKLYN,0.0,0.0,0,0,0,0,0,0,3495083,2016-08-04 13:00:00,2016-08-04T13:00,2016,8,25.8,0.0,Clear
08/12/2016,23:00,40.650806,-73.94958,BROOKLYN,1.0,0.0,0,0,0,0,1,0,3506125,2016-08-12 23:00:00,2016-08-12T23:00,2016,8,27.4,0.0,Cloudy
06/03/2016,7:00,40.71138,-73.96645,BROOKLYN,1.0,0.0,1,0,0,0,0,0,3454632,2016-06-03 07:00:00,2016-06-03T07:00,2016,6,17.0,1.5,Light Rain
01/05/2016,22:00,40.6878322,-73.9300332,BROOKLYN,0.0,0.0,0,0,0,0,0,0,3366128,2016-01-05 22:00:00,2016-01-05T22:00,2016,1,-4.7,0.0,Clear
05/26/2016,18:00,40.61758,-74.03049,BROOKLYN,1.0,0.0,0,0,0,0,1,0,3450147,2016-05-26 18:00:00,2016-05-26T18:00,2016,5,25.6,0.0,Cloudy
09/05/2016,22:00,40.670277,-73.92542,BROOKLYN,0.0,0.0,0,0,0,0,0,0,3516166,2016-09-05 22:00:00,2016-09-05T22:00,2016,9,22.3,0.0,Cloudy
05/12/2016,15:00,40.6804645,-73.9746,BROOKLYN,1.0,0.0,1,0,0,0,0,0,3442520,2016-05-12 15:00:00,2016-05-12T15:00,2016,5,22.6,0.0,Cloudy
02/25/2016,15:00,40.6674789,-73.9562246,BROOKLYN,0.0,0.0,0,0,0,0,0,0,3395491,2016-02-25 15:00:00,2016-02-25T15:00,2016,2,7.7,0.0,Cloudy
06/10/2016,18:00,40.679516,-73.91109,BROOKLYN,2.0,0.0,0,0,0,0,2,0,3463236,2016-06-10 18:00:00,2016-06-10T18:00,2016,6,23.0,0.0,Cloudy
04/14/2016,19:00,40.695644,-73.9468,BROOKLYN,1.0,0.0,1,0,0,0,0,0,3420160,2016-04-14 19:00:00,2016-04-14T19:00,2016,4,9.1,0.0,Clear
09/29/2016,20:00,40.612614,-74.00085,BROOKLYN,1.0,0.0,0,0,0,0,1,0,3531045,2016-09-29 20:00:00,2016-09-29T20:00,2016,9,15.4,0.4,Drizzle
04/15/2016,17:00,40.689014,-73.92395,BROOKLYN,0.0,0.0,0,0,0,0,0,0,3420362,2016-04-15 17:00:00,2016-04-15T17:00,2016,4,14.0,0.0,Clear
10/16/2016,0:00,40.653805,-73.93061,BROOKLYN,1.0,0.0,0,0,0,0,1,0,3551611,2016-10-16 00:00:00,2016-10-16T00:00,2016,10,10.2,0.0,Clear
09/26/2016,15:00,40.66077,-73.91975,BROOKLYN,6.0,0.0,0,0,0,0,6,0,3528063,2016-09-26 15:00:00,2016-09-26T15:00,2016,9,20.8,0.0,Cloudy
07/09/2016,0:00,40.668144,-73.88197,BROOKLYN,5.0,0.0,0,0,0,0,5,0,3477783,2016-07-09 00:00:00,2016-07-09T00:00,2016,7,20.3,0.0,Cloudy
01/09/2016,3:00,40.6774056,-73.9830482,BROOKLYN,1.0,0.0,0,0,1,0,0,0,3367727,2016-01-09 03:00:00,2016-01-09T03:00,2016,1,2.8,0.0,Cloudy
04/19/2016,7:00,40.693638,-73.905045,BROOKLYN,1.0,0.0,1,0,0,0,0,0,3420633,2016-04-19 07:00:00,2016-04-19T07:00,2016,4,13.7,0.0,Cloudy
08/23/2016,20:00,40.668667,-73.868324,BROOKLYN,1.0,0.0,1,0,0,0,0,0,3512015,2016-08-23 20:00:00,2016-08-23T20:00,2016,8,23.1,0.0,Clear
09/30/2016,18:00,40.587017,-73.962975,BROOKLYN,2.0,0.0,0,0,0,0,2,0,3531796,2016-09-30 18:00:00,2016-09-30T18:00,2016,9,15.5,0.0,Cloudy
10/01/2016,13:00,40.68227,-73.92262,BROOKLYN,1.0,0.0,0,0,1,0,0,0,3531216,2016-10-01 13:00:00,2016-10-01T13:00,2016,10,17.4,0.2,Drizzle
09/22/2016,18:00,40.607258,-74.00265,BROOKLYN,1.0,0.0,0,0,0,0,1,0,3527688,2016-09-22 18:00:00,2016-09-22T18:00,2016,9,22.7,0.0,Clear
11/09/2016,13:00,40.669098,-73.93666,BROOKLYN,1.0,0.0,0,0,0,0,1,0,3556905,2016-11-09 13:00:00,2016-11-09T13:00,2016,11,13.1,0.4,Drizzle
06/29/2016,9:00,40.60238,-74.005356,BROOKLYN,0.0,0.0,0,0,0,0,0,0,3470621,2016-06-29 09:00:00,2016-06-29T09:00,2016,6,23.7,0.0,Cloudy
01/10/2016,22:00,40.638606,-73.9482662,BROOKLYN,1.0,0.0,0,0,0,0,1,0,3369347,2016-01-10 22:00:00,2016-01-10T22:00,2016,1,5.1,0.0,Clear
09/20/2016,14:00,40.696228,-73.93393,BROOKLYN,1.0,0.0,0,0,0,0,1,0,3523844,2016-09-20 14:00:00,2016-09-20T14:00,2016,9,26.3,0.0,Cloudy
07/27/2016,1:00,40.612343,-73.97898,BROOKLYN,0.0,0.0,0,0,0,0,0,0,3490130,2016-07-27 01:00:00,2016-07-27T01:00,2016,7,24.4,0.0,Cloudy
01/14/2016,20:00,40.6465718,-73.8961633,BROOKLYN,0.0,0.0,0,0,0,0,0,0,3370728,2016-01-14 20:00:00,2016-01-14T20:00,2016,1,-0.8,0.0,Cloudy
09/17/2016,0:00,40.669518,-73.89424,BROOKLYN,1.0,0.0,0,0,0,0,1,0,3524155,2016-09-17 00:00:00,2016-09-17T00:00,2016,9,15.4,0.0,Cloudy
05/04/2016,0:00,40.687637,-73.95476,BROOKLYN,5.0,0.0,0,0,0,0,5,0,3435092,2016-05-04 00:00:00,2016-05-04T00:00,2016,5,9.8,0.0,Cloudy
08/18/2016,5:00,40.65207,-74.00676,BROOKLYN,1.0,0.0,0,0,0,0,1,0,3502451,2016-08-18 05:00:00,2016-08-18T05:00,2016,8,23.5,0.0,Cloudy
03/09/2016,21:00,40.7311422,-73.959477,BROOKLYN,0.0,0.0,0,0,0,0,0,0,3403115,2016-03-09 21:00:00,2016-03-09T21:00,2016,3,15.0,0.0,Cloudy
01/08/2016,16:00,40.7484375,-73.9845604,MANHATTAN,0.0,0.0,0,0,0,0,0,0,3367458,2016-01-08 16:00:00,2016-01-08T16:00,2016,1,5.3,0.0,Cloudy
10/13/2016,0:00,40.73047,-74.00205,MANHATTAN,0.0,0.0,0,0,0,0,0,0,3541552,2016-10-13 00:00:00,2016-10-13T00:00,2016,10,12.9,0.0,Clear
09/10/2016,15:00,40.72106,-73.99821,MANHATTAN,0.0,0.0,0,0,0,0,0,0,3517194,2016-09-10 15:00:00,2016-09-10T15:00,2016,9,30.0,1.8,Light Rain
10/28/2016,13:00,40.712944,-73.99531,MANHATTAN,1.0,0.0,1,0,0,0,0,0,3550542,2016-10-28 13:00:00,2016-10-28T13:00,2016,10,9.5,0.0,Cloudy
06/18/2016,6:00,40.797306,-73.93446,MANHATTAN,3.0,0.0,0,0,0,0,3,0,3464076,2016-06-18 06:00:00,2016-06-18T06:00,2016,6,15.7,0.0,Clear
11/13/2016,14:00,40.742252,-74.00071,MANHATTAN,2.0,0.0,0,0,0,0,2,0,3561553,2016-11-13 14:00:00,2016-11-13T14:00,2016,11,15.2,0.0,Clear
04/19/2016,20:00,40.82873,-73.94877,MANHATTAN,0.0,0.0,0,0,0,0,0,0,3410278,2016-04-19 20:00:00,2016-04-19T20:00,2016,4,12.6,0.0,Cloudy
10/07/2016,16:00,40.710888,-74.00907,MANHATTAN,1.0,0.0,1,0,0,0,0,0,3541149,2016-10-07 16:00:00,2016-10-07T16:00,2016,10,20.3,0.0,Cloudy
08/03/2016,9:00,40.85245,-73.931694,MANHATTAN,1.0,0.0,1,0,0,0,0,0,3493962,2016-08-03 09:00:00,2016-08-03T09:00,2016,8,22.3,0.0,Clear
08/26/2016,0:00,40.743813,-73.9833,MANHATTAN,1.0,0.0,0,0,1,0,0,0,3508256,2016-08-26 00:00:00,2016-08-26T00:00,2016,8,23.5,0.0,Cloudy
04/03/2016,23:00,40.752876,-73.99512,MANHATTAN,2.0,0.0,0,0,1,0,1,0,3407332,2016-04-03 23:00:00,2016-04-03T23:00,2016,4,0.4,0.0,Cloudy
05/31/2016,14:00,40.718666,-73.985306,MANHATTAN,1.0,0.0,0,0,0,0,1,0,3454902,2016-05-31 14:00:00,2016-05-31T14:00,2016,5,26.9,0.2,Drizzle
09/24/2016,14:00,40.79166,-73.96469,MANHATTAN,1.0,0.0,1,0,0,0,0,0,3527397,2016-09-24 14:00:00,2016-09-24T14:00,2016,9,20.4,0.0,Clear
06/18/2016,16:00,40.817924,-73.95401,MANHATTAN,1.0,0.0,0,0,0,0,1,0,3464094,2016-06-18 16:00:00,2016-06-18T16:00,2016,6,27.6,0.0,Cloudy
05/21/2016,2:00,40.790234,-73.95199,MANHATTAN,1.0,0.0,0,0,0,0,1,0,3445856,2016-05-21 02:00:00,2016-05-21T02:00,2016,5,12.8,0.0,Cloudy
07/14/2016,13:00,40.752995,-73.99541,MANHATTAN,1.0,0.0,1,0,0,0,0,0,3481247,2016-07-14 13:00:00,2016-07-14T13:00,2016,7,29.8,0.0,Clear
07/12/2016,18:00,40.791145,-73.951324,MANHATTAN,0.0,0.0,0,0,0,0,0,0,3480214,2016-07-12 18:00:00,2016-07-12T18:00,2016,7,24.0,0.0,Cloudy
07/06/2016,23:00,40.72919,-73.98724,MANHATTAN,0.0,0.0,0,0,0,0,0,0,3478146,2016-07-06 23:00:00,2016-07-06T23:00,2016,7,25.6,0.0,Clear
02/07/2016,1:00,40.7750017,-73.9630861,MANHATTAN,1.0,0.0,1,0,0,0,0,0,3384988,2016-02-07 01:00:00,2016-02-07T01:00,2016,2,-5.1,0.0,Clear
11/01/2016,18:00,40.767838,-73.98137,MANHATTAN,1.0,0.0,0,0,1,0,0,0,3560165,2016-11-01 18:00:00,2016-11-01T18:00,2016,11,11.4,0.0,Cloudy
09/06/2016,15:00,40.718113,-73.98689,MANHATTAN,0.0,0.0,0,0,0,0,0,0,3515128,2016-09-06 15:00:00,2016-09-06T15:00,2016,9,25.0,0.2,Drizzle
05/05/2016,18:00,40.726933,-73.99992,MANHATTAN,1.0,0.0,0,0,1,0,0,0,3436990,2016-05-05 18:00:00,2016-05-05T18:00,2016,5,11.8,0.0,Cloudy
10/10/2016,21:00,40.702663,-74.012886,MANHATTAN,1.0,0.0,1,0,0,0,0,0,3539374,2016-10-10 21:00:00,2016-10-10T21:00,2016,10,10.0,0.0,Clear
04/17/2016,23:00,40.7136,-74.0091,MANHATTAN,2.0,0.0,0,0,0,0,2,0,3410446,2016-04-17 23:00:00,2016-04-17T23:00,2016,4,8.5,0.0,Clear
03/06/2016,14:00,40.7428118,-73.9965789,MANHATTAN,0.0,0.0,0,0,0,0,0,0,3400372,2016-03-06 14:00:00,2016-03-06T14:00,2016,3,5.4,0.0,Cloudy
07/09/2016,16:00,40.71745,-74.00354,MANHATTAN,1.0,0.0,0,0,1,0,0,0,3477246,2016-07-09 16:00:00,2016-07-09T16:00,2016,7,21.8,2.0,Light Rain
03/06/2016,22:00,40.7339213,-73.9927942,MANHATTAN,1.0,0.0,0,0,1,0,0,0,3400887,2016-03-06 22:00:00,2016-03-06T22:00,2016,3,-0.2,0.0,Clear
07/04/2016,22:00,40.708492,-74.00294,MANHATTAN,1.0,0.0,0,0,0,0,1,0,3474713,2016-07-04 22:00:00,2016-07-04T22:00,2016,7,21.2,1.5,Light Rain
08/31/2016,17:00,40.83468,-73.944435,MANHATTAN,0.0,0.0,0,0,0,0,0,0,3515915,2016-08-31 17:00:00,2016-08-31T17:00,2016,8,28.1,0.0,Cloudy
04/22/2016,8:00,40.81427,-73.93722,MANHATTAN,0.0,0.0,0,0,0,0,0,0,3410460,2016-04-22 08:00:00,2016-04-22T08:00,2016,4,17.7,0.0,Cloudy
02/07/2016,15:00,40.7808583,-73.9609091,MANHATTAN,1.0,0.0,1,0,0,0,0,0,3384992,2016-02-07 15:00:00,2016-02-07T15:00,2016,2,3.6,0.0,Cloudy
12/07/2016,18:00,40.731827,-73.988266,MANHATTAN,1.0,0.0,0,0,1,0,0,0,3575907,2016-12-07 18:00:00,2016-12-07T18:00,2016,12,6.1,0.0,Cloudy
03/02/2016,9:00,40.7335259,-73.989868,MANHATTAN,0.0,0.0,0,0,0,0,0,0,3397857,2016-03-02 09:00:00,2016-03-02T09:00,2016,3,4.1,0.0,Cloudy
09/13/2016,1:00,40.785866,-73.950935,MANHATTAN,1.0,0.0,1,0,0,0,0,0,3520028,2016-09-13 01:00:00,2016-09-13T01:00,2016,9,16.3,0.0,Clear
10/08/2016,1:00,0.0,0.0,MANHATTAN,1.0,0.0,0,0,0,0,1,0,3535575,2016-10-08 01:00:00,2016-10-08T01:00,2016,10,25.0,0.0,Cloudy
07/11/2016,6:00,40.83468,-73.944435,MANHATTAN,0.0,0.0,0,0,0,0,0,0,3478974,2016-07-11 06:00:00,2016-07-11T06:00,2016,7,18.5,0.0,Cloudy
01/18/2016,19:00,40.7501572,-73.9769843,MANHATTAN,3.0,0.0,0,0,0,0,3,0,3373143,2016-01-18 19:00:00,2016-01-18T19:00,2016,1,-6.2,0.0,Clear
06/28/2016,0:00,40.74889,-74.00703,MANHATTAN,1.0,0.0,0,0,0,0,1,0,3471125,2016-06-28 00:00:00,2016-06-28T00:00,2016,6,20.9,2.3,Light Rain
01/28/2016,16:00,40.7963012,-73.9382838,MANHATTAN,1.0,0.0,0,0,0,0,1,0,3378869,2016-01-28 16:00:00,2016-01-28T16:00,2016,1,0.8,0.0,Cloudy
06/04/2016,0:00,40.757233,-73.9898,MANHATTAN,0.0,0.0,0,0,0,0,0,0,3455673,2016-06-04 00:00:00,2016-06-04T00:00,2016,6,17.9,0.0,Cloudy
06/23/2016,22:00,40.71523,-74.01334,MANHATTAN,1.0,0.0,1,0,0,0,0,0,3469450,2016-06-23 22:00:00,2016-06-23T22:00,2016,6,21.8,0.0,Clear
06/08/2016,9:00,40.801655,-73.95093,MANHATTAN,1.0,0.0,0,0,0,0,1,0,3486611,2016-06-08 09:00:00,2016-06-08T09:00,2016,6,19.0,0.0,Cloudy
02/03/2016,13:00,40.7113923,-74.0085993,MANHATTAN,1.0,0.0,0,0,0,0,1,0,3382608,2016-02-03 13:00:00,2016-02-03T13:00,2016,2,11.0,1.3,Light Rain
05/06/2016,8:00,40.754677,-73.975815,MANHATTAN,1.0,0.0,0,0,0,0,1,0,3437377,2016-05-06 08:00:00,2016-05-06T08:00,2016,5,8.3,1.4,Light Rain
04/11/2016,1:00,40.737194,-73.98328,MANHATTAN,0.0,0.0,0,0,0,0,0,0,3407014,2016-04-11 01:00:00,2016-04-11T01:00,2016,4,4.3,0.0,Cloudy
11/03/2016,23:00,40.748272,-73.988884,MANHATTAN,1.0,0.0,0,0,0,0,1,0,3554884,2016-11-03 23:00:00,2016-11-03T23:00,2016,11,11.7,0.0,Cloudy
05/20/2016,10:00,40.755302,-73.97536,MANHATTAN,1.0,0.0,0,0,0,0,1,0,3448211,2016-05-20 10:00:00,2016-05-20T10:00,2016,5,19.8,0.0,Clear
02/27/2016,20:00,40.7799246,-73.9806751,MANHATTAN,1.0,0.0,0,0,1,0,0,0,3395891,2016-02-27 20:00:00,2016-02-27T20:00,2016,2,0.6,0.0,Cloudy
09/12/2016,8:00,40.7505,-73.990974,MANHATTAN,0.0,0.0,0,0,0,0,0,0,3526802,2016-09-12 08:00:00,2016-09-12T08:00,2016,9,18.8,0.0,Clear
01/27/2016,16:00,40.7576386,-73.9634098,MANHATTAN,0.0,0.0,0,0,0,0,0,0,3378101,2016-01-27 16:00:00,2016-01-27T16:00,2016,1,2.5,0.0,Clear
11/17/2016,17:00,40.760254,-73.967545,MANHATTAN,0.0,0.0,0,0,0,0,0,0,3563018,2016-11-17 17:00:00,2016-11-17T17:00,2016,11,11.9,0.0,Clear
07/01/2016,18:00,40.80307,-73.93838,MANHATTAN,1.0,0.0,1,0,0,0,0,0,3474786,2016-07-01 18:00:00,2016-07-01T18:00,2016,7,24.1,0.2,Drizzle
01/13/2016,10:00,40.7389026,-73.9873015,MANHATTAN,1.0,0.0,0,0,1,0,0,0,3372731,2016-01-13 10:00:00,2016-01-13T10:00,2016,1,-3.6,0.0,Cloudy
07/13/2016,19:00,40.77741,-73.978806,MANHATTAN,0.0,0.0,0,0,0,0,0,0,3479646,2016-07-13 19:00:00,2016-07-13T19:00,2016,7,23.9,0.0,Cloudy
05/23/2016,10:00,40.706657,-74.015915,MANHATTAN,0.0,0.0,0,0,0,0,0,0,3447486,2016-05-23 10:00:00,2016-05-23T10:00,2016,5,20.7,0.0,Clear
06/08/2016,12:00,40.75469,-73.99536,MANHATTAN,0.0,0.0,0,0,0,0,0,0,4022839,2016-06-08 12:00:00,2016-06-08T12:00,2016,6,17.1,2.7,Heavy Rain
11/26/2016,10:00,40.76023,-73.961525,MANHATTAN,0.0,0.0,0,0,0,0,0,0,3568656,2016-11-26 10:00:00,2016-11-26T10:00,2016,11,7.4,0.0,Clear
05/20/2016,16:00,40.728447,-73.9818,MANHATTAN,1.0,0.0,1,0,0,0,0,0,3447713,2016-05-20 16:00:00,2016-05-20T16:00,2016,5,22.3,0.0,Cloudy
07/18/2016,8:00,40.713615,-74.00676,MANHATTAN,0.0,0.0,0,0,0,0,0,0,3485162,2016-07-18 08:00:00,2016-07-18T08:00,2016,7,27.3,0.0,Clear
08/14/2016,1:00,40.761173,-73.95789,MANHATTAN,0.0,0.0,0,0,0,0,0,0,3499927,2016-08-14 01:00:00,2016-08-14T01:00,2016,8,26.6,0.0,Cloudy
06/20/2016,10:00,40.762287,-73.972374,MANHATTAN,0.0,0.0,0,0,0,0,0,0,3465604,2016-06-20 10:00:00,2016-06-20T10:00,2016,6,26.7,0.0,Clear
09/09/2016,10:00,40.760536,-73.95836,MANHATTAN,2.0,0.0,0,0,0,0,2,0,3531927,2016-09-09 10:00:00,2016-09-09T10:00,2016,9,28.2,0.0,Clear
02/01/2016,6:00,40.8077723,-73.9454833,MANHATTAN,1.0,0.0,1,0,0,0,0,0,3381239,2016-02-01 06:00:00,2016-02-01T06:00,2016,2,2.2,0.0,Cloudy
08/06/2016,17:00,40.809155,-73.940895,MANHATTAN,2.0,0.0,0,0,0,0,2,0,3495455,2016-08-06 17:00:00,2016-08-06T17:00,2016,8,28.2,0.3,Drizzle
01/26/2016,6:00,40.7160144,-74.0088235,MANHATTAN,1.0,0.0,0,0,0,0,1,0,3377217,2016-01-26 06:00:00,2016-01-26T06:00,2016,1,-4.8,0.0,Cloudy
05/22/2016,22:00,40.789474,-73.9574,MANHATTAN,1.0,0.0,0,0,1,0,0,0,4022431,2016-05-22 22:00:00,2016-05-22T22:00,2016,5,12.7,0.0,Clear
10/05/2016,10:00,40.71787,-73.997116,MANHATTAN,1.0,0.0,0,0,0,0,1,0,3534835,2016-10-05 10:00:00,2016-10-05T10:00,2016,10,15.9,0.0,Clear
10/14/2016,0:00,40.821445,-73.950386,MANHATTAN,0.0,0.0,0,0,0,0,0,0,3544384,2016-10-14 00:00:00,2016-10-14T00:00,2016,10,10.9,0.0,Clear
01/11/2016,6:00,40.7738755,-73.9822257,MANHATTAN,1.0,0.0,1,0,0,0,0,0,3374599,2016-01-11 06:00:00,2016-01-11T06:00,2016,1,-0.7,0.0,Clear
11/07/2016,11:00,40.757107,-73.997314,MANHATTAN,0.0,0.0,0,0,0,0,0,0,3556436,2016-11-07 11:00:00,2016-11-07T11:00,2016,11,8.7,0.0,Clear
02/06/2016,15:00,40.7117796,-73.9997006,MANHATTAN,1.0,0.0,1,0,0,0,0,0,3384424,2016-02-06 15:00:00,2016-02-06T15:00,2016,2,2.7,0.0,Cloudy
05/06/2016,21:00,40.829155,-73.93728,MANHATTAN,1.0,0.0,1,0,0,0,0,0,3437621,2016-05-06 21:00:00,2016-05-06T21:00,2016,5,9.6,0.0,Cloudy
11/15/2016,14:00,0.0,0.0,MANHATTAN,0.0,0.0,0,0,0,0,0,0,3561047,2016-11-15 14:00:00,2016-11-15T14:00,2016,11,26.5,0.1,Drizzle
07/06/2016,18:00,40.83016,-73.94167,MANHATTAN,1.0,0.0,1,0,0,0,0,0,3476137,2016-07-06 18:00:00,2016-07-06T18:00,2016,7,29.6,0.0,Clear
07/02/2016,18:00,40.729084,-73.98133,MANHATTAN,1.0,0.0,1,0,0,0,0,0,3472942,2016-07-02 18:00:00,2016-07-02T18:00,2016,7,24.6,0.0,Clear
09/07/2016,18:00,40.81316,-73.950356,MANHATTAN,1.0,0.0,1,0,0,0,0,0,3515904,2016-09-07 18:00:00,2016-09-07T18:00,2016,9,26.2,0.0,Clear
03/06/2016,5:00,40.7647362,-73.988033,MANHATTAN,1.0,0.0,1,0,0,0,0,0,3400400,2016-03-06 05:00:00,2016-03-06T05:00,2016,3,-3.5,0.0,Clear
04/25/2016,23:00,40.727196,-73.997215,MANHATTAN,1.0,0.0,0,0,1,0,0,0,3406082,2016-04-25 23:00:00,2016-04-25T23:00,2016,4,11.6,0.0,Clear
12/18/2016,19:00,40.74769,-74.00417,MANHATTAN,0.0,0.0,0,0,0,0,0,0,3584203,2016-12-18 19:00:00,2016-12-18T19:00,2016,12,1.4,0.0,Cloudy
08/16/2016,16:00,40.784122,-73.97261,MANHATTAN,0.0,0.0,0,0,0,0,0,0,3501526,2016-08-16 16:00:00,2016-08-16T16:00,2016,8,28.8,0.0,Cloudy
03/09/2016,19:00,40.79745,-73.9467017,MANHATTAN,1.0,0.0,0,0,0,0,1,0,3402201,2016-03-09 19:00:00,2016-03-09T19:00,2016,3,15.4,0.0,Clear
09/22/2016,20:00,40.818394,-73.95089,MANHATTAN,1.0,0.0,0,0,0,0,1,0,3525884,2016-09-22 20:00:00,2016-09-22T20:00,2016,9,19.5,0.0,Clear
01/21/2016,7:00,40.7928151,-73.9377345,MANHATTAN,1.0,0.0,1,0,0,0,0,0,3374607,2016-01-21 07:00:00,2016-01-21T07:00,2016,1,-3.9,0.0,Clear
05/10/2016,10:00,40.752377,-73.97035,MANHATTAN,1.0,0.0,0,0,0,0,1,0,3448006,2016-05-10 10:00:00,2016-05-10T10:00,2016,5,14.0,0.0,Cloudy
03/01/2016,14:00,40.7109836,-74.0005086,MANHATTAN,0.0,0.0,0,0,0,0,0,0,3397039,2016-03-01 14:00:00,2016-03-01T14:00,2016,3,8.9,0.0,Clear
06/27/2016,0:00,40.72797,-73.98065,MANHATTAN,0.0,0.0,0,0,0,0,0,0,3469493,2016-06-27 00:00:00,2016-06-27T00:00,2016,6,20.0,0.0,Cloudy
05/18/2016,18:00,40.7429,-73.99281,MANHATTAN,1.0,0.0,0,0,1,0,0,0,3447887,2016-05-18 18:00:00,2016-05-18T18:00,2016,5,15.1,0.0,Cloudy
07/13/2016,0:00,40.76392,-73.97837,MANHATTAN,0.0,0.0,0,0,0,0,0,0,3485177,2016-07-13 00:00:00,2016-07-13T00:00,2016,7,20.5,0.0,Clear
05/30/2016,16:00,40.864048,-73.92746,MANHATTAN,0.0,0.0,0,0,0,0,0,0,3453086,2016-05-30 16:00:00,2016-05-30T16:00,2016,5,25.8,0.0,Cloudy
03/23/2016,23:00,40.719055,-73.97604,MANHATTAN,0.0,0.0,0,0,0,0,0,0,3406314,2016-03-23 23:00:00,2016-03-23T23:00,2016,3,8.6,0.0,Clear
01/04/2016,20:00,40.7490533,-73.9957485,MANHATTAN,1.0,0.0,1,0,0,0,0,0,3365096,2016-01-04 20:00:00,2016-01-04T20:00,2016,1,-6.7,0.0,Clear
04/24/2016,0:00,40.741802,-73.98902,MANHATTAN,0.0,0.0,0,0,0,0,0,0,3407121,2016-04-24 00:00:00,2016-04-24T00:00,2016,4,10.4,0.0,Clear
02/27/2016,22:00,40.7717376,-73.961243,MANHATTAN,1.0,0.0,0,0,1,0,0,0,3396444,2016-02-27 22:00:00,2016-02-27T22:00,2016,2,0.3,0.0,Cloudy
09/16/2016,8:00,40.760822,-73.99832,MANHATTAN,1.0,0.0,1,0,0,0,0,0,3523055,2016-09-16 08:00:00,2016-09-16T08:00,2016,9,18.7,0.0,Cloudy
04/04/2016,12:00,40.82322,-73.9388,MANHATTAN,0.0,0.0,0,0,0,0,0,0,3410377,2016-04-04 12:00:00,2016-04-04T12:00,2016,4,10.8,0.8,Drizzle
11/30/2016,18:00,40.784943,-73.946594,MANHATTAN,1.0,0.0,1,0,0,0,0,0,3570975,2016-11-30 18:00:00,2016-11-30T18:00,2016,11,10.7,0.6,Drizzle
06/21/2016,23:00,40.720707,-73.981316,MANHATTAN,2.0,0.0,0,0,0,0,2,0,3470259,2016-06-21 23:00:00,2016-06-21T23:00,2016,6,21.3,0.0,Clear
10/25/2016,14:00,40.848682,-73.939224,MANHATTAN,1.0,0.0,1,0,0,0,0,0,3548972,2016-10-25 14:00:00,2016-10-25T14:00,2016,10,10.7,0.0,Cloudy
07/15/2016,20:00,40.719467,-73.98638,MANHATTAN,1.0,0.0,0,0,1,0,0,0,3480848,2016-07-15 20:00:00,2016-07-15T20:00,2016,7,27.4,0.0,Clear
04/30/2016,22:00,40.756664,-73.990204,MANHATTAN,0.0,0.0,0,0,0,0,0,0,3431260,2016-04-30 22:00:00,2016-04-30T22:00,2016,4,8.3,0.0,Cloudy
10/28/2016,7:00,40.757385,-73.98226,MANHATTAN,1.0,0.0,0,0,1,0,0,0,3549111,2016-10-28 07:00:00,2016-10-28T07:00,2016,10,5.9,0.0,Clear
02/20/2016,15:00,40.7158555,-73.9949534,MANHATTAN,1.0,0.0,1,0,0,0,0,0,3392122,2016-02-20 15:00:00,2016-02-20T15:00,2016,2,14.9,0.0,Clear
04/02/2016,17:00,40.742275,-73.989235,MANHATTAN,1.0,0.0,1,0,0,0,0,0,3406954,2016-04-02 17:00:00,2016-04-02T17:00,2016,4,12.2,0.0,Clear
12/28/2016,1:00,40.75484,-73.98412,MANHATTAN,1.0,0.0,0,0,0,0,1,0,3588158,2016-12-28 01:00:00,2016-12-28T01:00,2016,12,-0.3,0.0,Clear
01/18/2016,9:00,40.843502,-73.9379834,MANHATTAN,0.0,0.0,0,0,0,0,0,0,3372796,2016-01-18 09:00:00,2016-01-18T09:00,2016,1,-5.2,0.0,Clear
03/12/2016,20:00,40.7156332,-73.9984921,MANHATTAN,0.0,0.0,0,0,0,0,0,0,3404539,2016-03-12 20:00:00,2016-03-12T20:00,2016,3,10.7,0.0,Cloudy
07/29/2016,17:00,40.76236,-73.9646,MANHATTAN,0.0,0.0,0,0,0,0,0,0,3491538,2016-07-29 17:00:00,2016-07-29T17:00,2016,7,29.0,0.0,Clear
04/21/2016,17:00,40.847504,-73.933235,MANHATTAN,0.0,0.0,0,0,0,0,0,0,3410871,2016-04-21 17:00:00,2016-04-21T17:00,2016,4,19.8,0.0,Cloudy
08/06/2016,10:00,40.718624,-73.9884,MANHATTAN,1.0,0.0,0,0,0,0,1,0,3495297,2016-08-06 10:00:00,2016-08-06T10:00,2016,8,26.5,0.0,Cloudy
11/16/2016,21:00,40.766712,-73.98289,MANHATTAN,1.0,0.0,1,0,0,0,0,0,3562188,2016-11-16 21:00:00,2016-11-16T21:00,2016,11,8.9,0.0,Clear
11/30/2016,14:00,40.84552,-73.93469,MANHATTAN,0.0,0.0,0,0,0,0,0,0,3571484,2016-11-30 14:00:00,2016-11-30T14:00,2016,11,10.3,2.7,Heavy Rain
12/01/2016,6:00,40.801155,-73.959656,MANHATTAN,1.0,0.0,1,0,0,0,0,0,3574391,2016-12-01 06:00:00,2016-12-01T06:00,2016,12,11.1,0.0,Cloudy
03/31/2016,20:00,40.746483,-73.991554,MANHATTAN,0.0,0.0,0,0,0,0,0,0,3406940,2016-03-31 20:00:00,2016-03-31T20:00,2016,3,15.0,0.0,Cloudy
07/28/2016,13:00,40.720554,-74.00352,MANHATTAN,0.0,0.0,0,0,0,0,0,0,3620671,2016-07-28 13:00:00,2016-07-28T13:00,2016,7,31.6,0.0,Clear
12/04/2016,23:00,40.7384,-73.97813,MANHATTAN,0.0,0.0,0,0,0,0,0,0,3572967,2016-12-04 23:00:00,2016-12-04T23:00,2016,12,3.0,0.0,Cloudy
07/05/2016,2:00,40.76359,-73.98144,MANHATTAN,0.0,0.0,0,0,0,0,0,0,3476073,2016-07-05 02:00:00,2016-07-05T02:00,2016,7,20.1,1.0,Drizzle
08/16/2016,14:00,40.758427,-73.99264,MANHATTAN,1.0,0.0,1,0,0,0,0,0,3501470,2016-08-16 14:00:00,2016-08-16T14:00,2016,8,28.0,0.1,Drizzle
03/13/2016,6:00,40.765957,-73.957344,MANHATTAN,0.0,0.0,0,0,0,0,0,0,3408452,2016-03-13 06:00:00,2016-03-13T06:00,2016,3,6.2,0.0,Cloudy
07/06/2016,9:00,40.74668,-73.9745,MANHATTAN,0.0,0.0,0,0,0,0,0,0,3475428,2016-07-06 09:00:00,2016-07-06T09:00,2016,7,29.5,0.0,Clear
10/19/2016,8:00,40.752617,-73.99451,MANHATTAN,1.0,0.0,1,0,0,0,0,0,3543602,2016-10-19 08:00:00,2016-10-19T08:00,2016,10,21.0,0.0,Clear
07/22/2016,14:00,40.793377,-73.97086,MANHATTAN,1.0,0.0,1,0,0,0,0,0,3488099,2016-07-22 14:00:00,2016-07-22T14:00,2016,7,34.3,0.0,Clear
12/27/2016,13:00,40.7379,-73.99012,MANHATTAN,0.0,0.0,0,0,0,0,0,0,3588267,2016-12-27 13:00:00,2016-12-27T13:00,2016,12,14.3,0.0,Clear
02/02/2016,15:00,40.7625822,-74.0003863,MANHATTAN,1.0,0.0,0,0,0,0,1,0,3382629,2016-02-02 15:00:00,2016-02-02T15:00,2016,2,8.8,0.0,Clear
03/18/2016,10:00,40.740654,-73.99148,MANHATTAN,1.0,0.0,1,0,0,0,0,0,3406848,2016-03-18 10:00:00,2016-03-18T10:00,2016,3,10.5,0.0,Clear
04/22/2016,23:00,40.861565,-73.92792,MANHATTAN,1.0,0.0,1,0,0,0,0,0,3431565,2016-04-22 23:00:00,2016-04-22T23:00,2016,4,15.9,0.0,Cloudy
10/14/2016,13:00,40.81728,-73.938545,MANHATTAN,2.0,0.0,1,0,0,0,1,0,3541593,2016-10-14 13:00:00,2016-10-14T13:00,2016,10,15.7,0.0,Clear
01/28/2016,15:00,40.7684859,-73.9636168,MANHATTAN,0.0,0.0,0,0,0,0,0,0,3379464,2016-01-28 15:00:00,2016-01-28T15:00,2016,1,1.9,0.0,Cloudy
01/31/2016,8:00,40.7457967,-73.9822801,MANHATTAN,1.0,0.0,0,0,0,0,1,0,3380592,2016-01-31 08:00:00,2016-01-31T08:00,2016,1,-2.7,0.0,Cloudy
07/24/2016,5:00,40.792873,-73.94373,MANHATTAN,1.0,0.0,0,0,0,0,1,0,3486578,2016-07-24 05:00:00,2016-07-24T05:00,2016,7,20.5,0.0,Clear
11/19/2016,3:00,40.86446,-73.91895,MANHATTAN,1.0,0.0,0,0,0,0,1,0,4023805,2016-11-19 03:00:00,2016-11-19T03:00,2016,11,6.7,0.0,Clear
06/14/2016,9:00,40.787693,-73.98115,MANHATTAN,1.0,0.0,0,0,1,0,0,0,4023021,2016-06-14 09:00:00,2016-06-14T09:00,2016,6,19.2,0.0,Clear
04/02/2016,21:00,40.815742,-73.940704,MANHATTAN,2.0,0.0,1,0,0,0,1,0,3410372,2016-04-02 21:00:00,2016-04-02T21:00,2016,4,8.5,0.0,Cloudy
08/15/2016,2:00,40.742256,-73.97768,MANHATTAN,0.0,0.0,0,0,0,0,0,0,3505092,2016-08-15 02:00:00,2016-08-15T02:00,2016,8,25.7,0.0,Cloudy
08/19/2016,10:00,40.767677,-73.961685,MANHATTAN,0.0,0.0,0,0,0,0,0,0,3505115,2016-08-19 10:00:00,2016-08-19T10:00,2016,8,27.2,0.0,Clear
12/07/2016,20:00,40.750786,-74.00564,MANHATTAN,1.0,0.0,0,0,1,0,0,0,3575714,2016-12-07 20:00:00,2016-12-07T20:00,2016,12,4.7,0.0,Cloudy
06/09/2016,0:00,40.743206,-73.979965,MANHATTAN,1.0,0.0,0,0,0,0,0,0,3461077,2016-06-09 00:00:00,2016-06-09T00:00,2016,6,14.2,0.0,Clear
11/03/2016,12:00,40.815666,-73.93657,MANHATTAN,2.0,0.0,2,0,0,0,0,0,3555610,2016-11-03 12:00:00,2016-11-03T12:00,2016,11,19.6,0.0,Cloudy
04/27/2016,17:00,40.727425,-73.976425,MANHATTAN,0.0,0.0,0,0,0,0,0,0,3431145,2016-04-27 17:00:00,2016-04-27T17:00,2016,4,14.3,0.0,Cloudy
11/30/2016,12:00,40.746403,-73.97973,MANHATTAN,1.0,0.0,1,0,0,0,0,0,3570608,2016-11-30 12:00:00,2016-11-30T12:00,2016,11,10.7,1.3,Light Rain
01/09/2016,10:00,40.7207095,-73.9813092,MANHATTAN,0.0,0.0,0,0,0,0,0,0,3367439,2016-01-09 10:00:00,2016-01-09T10:00,2016,1,6.3,0.0,Cloudy
07/04/2016,22:00,40.799984,-73.94275,MANHATTAN,2.0,0.0,1,0,0,0,1,0,3474793,2016-07-04 22:00:00,2016-07-04T22:00,2016,7,21.2,1.5,Light Rain
12/09/2016,13:00,40.707977,-74.00801,MANHATTAN,1.0,0.0,1,0,0,0,0,0,3585854,2016-12-09 13:00:00,2016-12-09T13:00,2016,12,3.2,0.0,Cloudy
07/22/2016,0:00,40.77696,-73.959564,MANHATTAN,1.0,0.0,0,0,0,0,1,0,3486525,2016-07-22 00:00:00,2016-07-22T00:00,2016,7,23.4,0.0,Cloudy
08/21/2016,21:00,40.76394,-73.97325,MANHATTAN,1.0,0.0,1,0,0,0,0,0,3504274,2016-08-21 21:00:00,2016-08-21T21:00,2016,8,23.6,1.0,Drizzle
05/17/2016,14:00,40.747627,-73.976746,MANHATTAN,0.0,0.0,0,0,0,0,0,0,3448025,2016-05-17 14:00:00,2016-05-17T14:00,2016,5,16.0,0.1,Drizzle
03/22/2016,13:00,40.749428,-73.98414,MANHATTAN,0.0,0.0,0,0,0,0,0,0,4022135,2016-03-22 13:00:00,2016-03-22T13:00,2016,3,10.3,0.0,Clear
10/26/2016,9:00,40.754677,-73.975815,MANHATTAN,1.0,0.0,0,0,0,0,1,0,3548416,2016-10-26 09:00:00,2016-10-26T09:00,2016,10,5.7,0.0,Clear
07/01/2016,7:00,40.762234,-73.98987,MANHATTAN,0.0,0.0,0,0,0,0,0,0,3473425,2016-07-01 07:00:00,2016-07-01T07:00,2016,7,22.9,0.0,Cloudy
10/01/2016,18:00,40.747345,-73.98118,MANHATTAN,0.0,0.0,0,0,0,0,0,0,3530907,2016-10-01 18:00:00,2016-10-01T18:00,2016,10,15.6,0.0,Cloudy
05/15/2016,14:00,40.848118,-73.93089,MANHATTAN,2.0,0.0,0,0,0,0,2,0,3448772,2016-05-15 14:00:00,2016-05-15T14:00,2016,5,13.1,0.0,Clear
01/22/2016,22:00,40.797836,-73.96946,MANHATTAN,2.0,0.0,0,0,0,0,2,0,3545891,2016-01-22 22:00:00,2016-01-22T22:00,2016,1,-2.5,0.2,Light Snow
07/28/2016,19:00,40.727875,-74.00543,MANHATTAN,1.0,0.0,0,0,1,0,0,0,3489876,2016-07-28 19:00:00,2016-07-28T19:00,2016,7,27.6,0.0,Cloudy
05/16/2016,20:00,40.757828,-73.99308,MANHATTAN,0.0,0.0,0,0,0,0,0,0,3447766,2016-05-16 20:00:00,2016-05-16T20:00,2016,5,13.1,0.0,Clear
07/19/2016,14:00,40.818535,-73.94736,MANHATTAN,1.0,0.0,0,0,0,0,1,0,3483656,2016-07-19 14:00:00,2016-07-19T14:00,2016,7,28.0,0.0,Clear
11/16/2016,16:00,40.765987,-73.98713,MANHATTAN,0.0,0.0,0,0,0,0,0,0,3576537,2016-11-16 16:00:00,2016-11-16T16:00,2016,11,14.2,0.0,Cloudy
11/29/2016,10:00,40.848522,-73.931816,MANHATTAN,3.0,0.0,0,0,0,0,3,0,3570281,2016-11-29 10:00:00,2016-11-29T10:00,2016,11,12.2,0.9,Drizzle
04/29/2016,15:00,40.724377,-73.98767,MANHATTAN,0.0,0.0,0,0,0,0,0,0,3431152,2016-04-29 15:00:00,2016-04-29T15:00,2016,4,11.5,0.0,Cloudy
11/17/2016,23:00,40.819397,-73.94443,MANHATTAN,1.0,0.0,0,0,0,0,1,0,3567209,2016-11-17 23:00:00,2016-11-17T23:00,2016,11,5.9,0.0,Clear
12/09/2016,1:00,40.869217,-73.91304,MANHATTAN,0.0,0.0,0,0,0,0,0,0,3576475,2016-12-09 01:00:00,2016-12-09T01:00,2016,12,0.2,0.0,Clear
10/16/2016,8:00,40.769608,-73.98569,MANHATTAN,0.0,0.0,0,0,0,0,0,0,3540715,2016-10-16 08:00:00,2016-10-16T08:00,2016,10,12.4,0.0,Clear
03/10/2016,17:00,40.812739,-73.9376183,MANHATTAN,0.0,0.0,0,0,0,0,0,0,3402849,2016-03-10 17:00:00,2016-03-10T17:00,2016,3,21.4,0.0,Cloudy
02/24/2016,4:00,40.7155203,-74.0092383,MANHATTAN,1.0,0.0,0,0,0,0,1,0,3393902,2016-02-24 04:00:00,2016-02-24T04:00,2016,2,3.3,0.0,Cloudy
02/12/2016,13:00,40.7383125,-73.9877418,MANHATTAN,1.0,0.0,0,0,1,0,0,0,3387736,2016-02-12 13:00:00,2016-02-12T13:00,2016,2,-4.2,0.0,Cloudy
05/08/2016,20:00,40.73243,-73.98924,MANHATTAN,0.0,0.0,0,0,0,0,0,0,3437044,2016-05-08 20:00:00,2016-05-08T20:00,2016,5,11.7,0.0,Clear
04/30/2016,0:00,40.86479,-73.92401,MANHATTAN,1.0,0.0,1,0,0,0,0,0,3431577,2016-04-30 00:00:00,2016-04-30T00:00,2016,4,7.2,0.0,Cloudy
12/06/2016,13:00,40.730076,-73.99285,MANHATTAN,1.0,0.0,0,0,0,0,1,0,3577583,2016-12-06 13:00:00,2016-12-06T13:00,2016,12,6.8,0.0,Cloudy
05/27/2016,17:00,40.759953,-73.98638,MANHATTAN,1.0,0.0,1,0,0,0,0,0,3446700,2016-05-27 17:00:00,2016-05-27T17:00,2016,5,25.6,0.2,Drizzle
08/22/2016,17:00,40.73782,-73.99792,MANHATTAN,1.0,0.0,0,0,0,0,1,0,3505082,2016-08-22 17:00:00,2016-08-22T17:00,2016,8,24.4,0.0,Clear
03/19/2016,4:00,40.73169,-73.98248,MANHATTAN,1.0,0.0,0,0,1,0,0,0,3406852,2016-03-19 04:00:00,2016-03-19T04:00,2016,3,1.7,0.0,Clear
03/07/2016,18:00,40.735313,-73.9941184,MANHATTAN,0.0,0.0,0,0,0,0,0,0,3400891,2016-03-07 18:00:00,2016-03-07T18:00,2016,3,10.8,0.0,Clear
03/02/2016,17:00,40.7694395,-73.9518578,MANHATTAN,1.0,0.0,1,0,0,0,0,0,3398561,2016-03-02 17:00:00,2016-03-02T17:00,2016,3,2.8,0.0,Clear
11/16/2016,18:00,40.738503,-73.991806,MANHATTAN,1.0,0.0,1,0,0,0,0,0,3562997,2016-11-16 18:00:00,2016-11-16T18:00,2016,11,11.6,0.0,Clear
12/07/2016,5:00,40.72716,-73.99154,MANHATTAN,0.0,0.0,0,0,0,0,0,0,3577668,2016-12-07 05:00:00,2016-12-07T05:00,2016,12,4.7,0.3,Drizzle
04/08/2016,9:00,40.707108,-74.00885,MANHATTAN,0.0,0.0,0,0,0,0,0,0,3405450,2016-04-08 09:00:00,2016-04-08T09:00,2016,4,5.9,0.0,Cloudy
08/22/2016,5:00,40.744644,-74.00639,MANHATTAN,0.0,0.0,0,0,0,0,0,0,3505829,2016-08-22 05:00:00,2016-08-22T05:00,2016,8,20.1,0.0,Clear
12/20/2016,14:00,40.761395,-73.96819,MANHATTAN,1.0,0.0,0,0,0,0,1,0,3584469,2016-12-20 14:00:00,2016-12-20T14:00,2016,12,-0.3,0.0,Clear
11/30/2016,18:00,40.7441,-73.99565,MANHATTAN,1.0,0.0,0,0,1,0,0,0,3572952,2016-11-30 18:00:00,2016-11-30T18:00,2016,11,10.9,0.6,Drizzle
06/27/2016,22:00,40.759624,-73.99548,MANHATTAN,2.0,0.0,0,0,0,0,2,0,3469510,2016-06-27 22:00:00,2016-06-27T22:00,2016,6,21.3,1.6,Light Rain
10/17/2016,8:00,40.835308,-73.94398,MANHATTAN,0.0,0.0,0,0,0,0,0,0,3542973,2016-10-17 08:00:00,2016-10-17T08:00,2016,10,16.7,0.0,Clear
03/06/2016,15:00,40.7972603,-73.9405186,MANHATTAN,0.0,0.0,0,0,0,0,0,0,3400442,2016-03-06 15:00:00,2016-03-06T15:00,2016,3,5.7,0.0,Cloudy
08/01/2016,21:00,40.792187,-73.9382,MANHATTAN,0.0,0.0,0,0,0,0,0,0,3532821,2016-08-01 21:00:00,2016-08-01T21:00,2016,8,22.2,0.0,Cloudy
11/06/2016,14:00,40.758633,-73.96579,MANHATTAN,1.0,0.0,0,0,1,0,0,0,3554737,2016-11-06 14:00:00,2016-11-06T14:00,2016,11,12.9,0.0,Clear
09/22/2016,21:00,40.725582,-73.988,MANHATTAN,1.0,0.0,0,0,1,0,0,0,3526455,2016-09-22 21:00:00,2016-09-22T21:00,2016,9,18.4,0.0,Clear
01/21/2016,9:00,40.8272062,-73.9424538,MANHATTAN,0.0,0.0,0,0,0,0,0,0,3374629,2016-01-21 09:00:00,2016-01-21T09:00,2016,1,-2.5,0.0,Clear
11/03/2016,18:00,40.76871,-73.969986,MANHATTAN,0.0,0.0,0,0,0,0,0,0,3553402,2016-11-03 18:00:00,2016-11-03T18:00,2016,11,16.1,0.0,Clear
02/20/2016,17:00,40.7603532,-73.991232,MANHATTAN,0.0,0.0,0,0,0,0,0,0,3392169,2016-02-20 17:00:00,2016-02-20T17:00,2016,2,12.8,0.0,Clear
05/10/2016,17:00,40.74756,-74.00786,MANHATTAN,0.0,0.0,0,0,0,0,0,0,3447748,2016-05-10 17:00:00,2016-05-10T17:00,2016,5,14.6,0.0,Cloudy
07/12/2016,8:00,40.763023,-73.97815,MANHATTAN,1.0,0.0,0,0,0,0,1,0,3481290,2016-07-12 08:00:00,2016-07-12T08:00,2016,7,22.0,0.0,Cloudy
09/28/2016,19:00,40.738503,-73.991806,MANHATTAN,0.0,0.0,0,0,0,0,0,0,3534116,2016-09-28 19:00:00,2016-09-28T19:00,2016,9,16.1,0.0,Cloudy
10/07/2016,20:00,40.725082,-73.99534,MANHATTAN,0.0,0.0,0,0,0,0,0,0,3536458,2016-10-07 20:00:00,2016-10-07T20:00,2016,10,14.8,0.0,Cloudy
06/26/2016,20:00,40.75831,-73.96294,MANHATTAN,0.0,0.0,0,0,0,0,0,0,3468567,2016-06-26 20:00:00,2016-06-26T20:00,2016,6,22.4,0.0,Cloudy
05/21/2016,0:00,40.73603,-73.99781,MANHATTAN,1.0,0.0,0,0,1,0,0,0,3447640,2016-05-21 00:00:00,2016-05-21T00:00,2016,5,13.2,0.0,Cloudy
03/15/2016,21:00,40.7244,-73.9818,MANHATTAN,1.0,0.0,1,0,0,0,0,0,3409112,2016-03-15 21:00:00,2016-03-15T21:00,2016,3,7.5,0.0,Clear
10/05/2016,18:00,40.806915,-73.93557,MANHATTAN,1.0,0.0,0,0,0,0,1,0,3534735,2016-10-05 18:00:00,2016-10-05T18:00,2016,10,16.3,0.0,Clear
05/15/2016,16:00,40.798866,-73.95988,MANHATTAN,1.0,0.0,1,0,0,0,0,0,4022400,2016-05-15 16:00:00,2016-05-15T16:00,2016,5,12.9,0.0,Clear
06/20/2016,13:00,40.719067,-73.99336,MANHATTAN,2.0,0.0,0,0,0,0,2,0,3466427,2016-06-20 13:00:00,2016-06-20T13:00,2016,6,29.1,0.0,Cloudy
05/14/2016,14:00,40.773098,-73.96448,MANHATTAN,1.0,0.0,1,0,0,0,0,0,3442053,2016-05-14 14:00:00,2016-05-14T14:00,2016,5,20.4,0.1,Drizzle
07/07/2016,15:00,40.747204,-73.99711,MANHATTAN,1.0,0.0,0,0,0,0,1,0,3477273,2016-07-07 15:00:00,2016-07-07T15:00,2016,7,30.2,0.9,Drizzle
08/25/2016,17:00,40.748055,-73.98571,MANHATTAN,1.0,0.0,0,0,1,0,0,0,3508728,2016-08-25 17:00:00,2016-08-25T17:00,2016,8,27.3,0.0,Cloudy
03/16/2016,16:00,40.864273,-73.920845,MANHATTAN,0.0,0.0,0,0,0,0,0,0,3410693,2016-03-16 16:00:00,2016-03-16T16:00,2016,3,15.2,0.0,Cloudy
04/08/2016,17:00,40.75446,-73.98809,MANHATTAN,1.0,0.0,1,0,0,0,0,0,3407377,2016-04-08 17:00:00,2016-04-08T17:00,2016,4,8.3,0.0,Cloudy
12/27/2016,23:00,40.75812,-73.98791,MANHATTAN,0.0,0.0,0,0,0,0,0,0,3589249,2016-12-27 23:00:00,2016-12-27T23:00,2016,12,1.2,0.0,Clear
12/15/2016,7:00,40.723022,-73.99882,MANHATTAN,0.0,0.0,0,0,0,0,0,0,3580825,2016-12-15 07:00:00,2016-12-15T07:00,2016,12,-3.6,0.0,Clear
05/14/2016,22:00,40.730133,-73.98949,MANHATTAN,0.0,0.0,0,0,0,0,0,0,3441953,2016-05-14 22:00:00,2016-05-14T22:00,2016,5,13.8,0.0,Cloudy
06/28/2016,23:00,40.745934,-73.97797,MANHATTAN,0.0,0.0,0,0,0,0,0,0,3471186,2016-06-28 23:00:00,2016-06-28T23:00,2016,6,21.3,0.2,Drizzle
11/12/2016,14:00,40.826424,-73.95254,MANHATTAN,1.0,0.0,0,0,1,0,0,0,3560668,2016-11-12 14:00:00,2016-11-12T14:00,2016,11,9.4,0.0,Clear
10/22/2016,15:00,40.75738,-73.966705,MANHATTAN,1.0,0.0,0,0,1,0,0,0,3544926,2016-10-22 15:00:00,2016-10-22T15:00,2016,10,8.6,0.8,Drizzle
10/05/2016,18:00,40.773655,-73.97783,MANHATTAN,1.0,0.0,1,0,0,0,0,0,3535279,2016-10-05 18:00:00,2016-10-05T18:00,2016,10,16.0,0.0,Clear
01/28/2016,22:00,40.7476845,-73.9787861,MANHATTAN,0.0,0.0,0,0,0,0,0,0,3379443,2016-01-28 22:00:00,2016-01-28T22:00,2016,1,-3.3,0.0,Cloudy
05/27/2016,10:00,40.724335,-73.94909,MANHATTAN,0.0,0.0,0,0,0,0,0,0,3451176,2016-05-27 10:00:00,2016-05-27T10:00,2016,5,26.9,0.0,Cloudy
08/11/2016,0:00,40.811142,-73.94364,MANHATTAN,0.0,0.0,0,0,0,0,0,0,3500006,2016-08-11 00:00:00,2016-08-11T00:00,2016,8,24.6,0.0,Cloudy
01/07/2016,17:00,40.7223244,-74.0117465,MANHATTAN,0.0,0.0,0,0,0,0,0,0,3366393,2016-01-07 17:00:00,2016-01-07T17:00,2016,1,4.1,0.0,Cloudy
02/07/2016,1:00,40.834114,-73.941118,MANHATTAN,0.0,0.0,0,0,0,0,0,0,3385019,2016-02-07 01:00:00,2016-02-07T01:00,2016,2,-5.3,0.0,Clear
12/10/2016,14:00,40.867992,-73.91967,MANHATTAN,1.0,0.0,1,0,0,0,0,0,3578820,2016-12-10 14:00:00,2016-12-10T14:00,2016,12,1.2,0.0,Cloudy
11/01/2016,17:00,40.733944,-73.996735,MANHATTAN,0.0,0.0,0,0,0,0,0,0,3552327,2016-11-01 17:00:00,2016-11-01T17:00,2016,11,12.5,0.0,Cloudy
04/22/2016,12:00,40.718834,-73.99852,MANHATTAN,1.0,0.0,1,0,0,0,0,0,3405884,2016-04-22 12:00:00,2016-04-22T12:00,2016,4,23.9,0.0,Cloudy
10/12/2016,11:00,40.758377,-73.994385,MANHATTAN,1.0,0.0,1,0,0,0,0,0,3539226,2016-10-12 11:00:00,2016-10-12T11:00,2016,10,16.8,0.0,Cloudy
12/16/2016,16:00,40.758327,-73.96894,MANHATTAN,0.0,0.0,0,0,0,0,0,0,3581227,2016-12-16 16:00:00,2016-12-16T16:00,2016,12,-3.3,0.0,Cloudy
01/24/2016,14:00,40.7681193,-73.9588624,MANHATTAN,0.0,0.0,0,0,0,0,0,0,3376113,2016-01-24 14:00:00,2016-01-24T14:00,2016,1,-2.6,0.0,Clear
07/09/2016,17:00,40.71725,-73.99748,MANHATTAN,0.0,0.0,0,0,0,0,0,0,3477258,2016-07-09 17:00:00,2016-07-09T17:00,2016,7,21.7,1.0,Drizzle
10/10/2016,19:00,40.771137,-73.9908,MANHATTAN,0.0,0.0,0,0,0,0,0,0,3579529,2016-10-10 19:00:00,2016-10-10T19:00,2016,10,12.1,0.0,Clear
12/26/2016,14:00,40.832863,-73.94204,MANHATTAN,0.0,0.0,0,0,0,0,0,0,3588215,2016-12-26 14:00:00,2016-12-26T14:00,2016,12,4.6,0.0,Cloudy
02/16/2016,17:00,40.7496708,-73.9952973,MANHATTAN,0.0,0.0,0,0,0,0,0,0,3389325,2016-02-16 17:00:00,2016-02-16T17:00,2016,2,8.9,0.0,Cloudy
05/02/2016,17:00,40.7591,-73.99215,MANHATTAN,1.0,0.0,0,0,1,0,0,0,3440402,2016-05-02 17:00:00,2016-05-02T17:00,2016,5,14.5,0.0,Cloudy
03/05/2016,20:00,40.7641704,-73.9847336,MANHATTAN,1.0,0.0,1,0,0,0,0,0,3400390,2016-03-05 20:00:00,2016-03-05T20:00,2016,3,-0.1,0.0,Clear
12/08/2016,18:00,40.7606,-73.96434,MANHATTAN,1.0,0.0,1,0,0,0,0,0,3588068,2016-12-08 18:00:00,2016-12-08T18:00,2016,12,3.2,0.0,Clear
07/24/2016,0:00,40.797916,-73.96385,MANHATTAN,0.0,0.0,0,0,0,0,0,0,3488111,2016-07-24 00:00:00,2016-07-24T00:00,2016,7,23.3,0.0,Clear
12/04/2016,12:00,40.74865,-73.9851,MANHATTAN,0.0,0.0,0,0,0,0,0,0,3572486,2016-12-04 12:00:00,2016-12-04T12:00,2016,12,5.4,0.0,Clear
11/16/2016,4:00,40.783245,-73.94473,MANHATTAN,1.0,0.0,0,0,0,0,1,0,3561392,2016-11-16 04:00:00,2016-11-16T04:00,2016,11,7.4,0.0,Cloudy
04/16/2016,22:00,40.793205,-73.946495,MANHATTAN,0.0,0.0,0,0,0,0,0,0,3409516,2016-04-16 22:00:00,2016-04-16T22:00,2016,4,6.1,0.0,Cloudy
05/12/2016,15:00,40.77936,-73.97737,MANHATTAN,1.0,0.0,0,0,1,0,0,0,4022397,2016-05-12 15:00:00,2016-05-12T15:00,2016,5,23.2,0.0,Cloudy
05/15/2016,11:00,40.74047,-73.99829,MANHATTAN,1.0,0.0,0,0,0,0,1,0,3442988,2016-05-15 11:00:00,2016-05-15T11:00,2016,5,13.1,0.0,Cloudy
09/13/2016,10:00,40.707912,-74.00014,MANHATTAN,1.0,0.0,0,0,0,0,1,0,3521421,2016-09-13 10:00:00,2016-09-13T10:00,2016,9,24.0,0.0,Clear
03/14/2016,7:00,40.734703,-73.986145,MANHATTAN,1.0,0.0,1,0,0,0,0,0,3406822,2016-03-14 07:00:00,2016-03-14T07:00,2016,3,6.6,0.7,Drizzle
07/29/2016,9:00,40.74456,-73.983185,MANHATTAN,1.0,0.0,0,0,0,0,1,0,3491016,2016-07-29 09:00:00,2016-07-29T09:00,2016,7,22.5,0.4,Drizzle
10/19/2016,13:00,40.755333,-73.98531,MANHATTAN,1.0,0.0,1,0,0,0,0,0,3543906,2016-10-19 13:00:00,2016-10-19T13:00,2016,10,26.8,0.0,Clear
04/15/2016,13:00,40.717796,-73.99126,MANHATTAN,1.0,0.0,0,0,0,0,1,0,3405814,2016-04-15 13:00:00,2016-04-15T13:00,2016,4,13.4,0.0,Clear
09/25/2016,19:00,40.85253,-73.9314,MANHATTAN,1.0,0.0,0,0,0,0,1,0,3527974,2016-09-25 19:00:00,2016-09-25T19:00,2016,9,15.9,0.0,Clear
03/05/2016,14:00,40.7239136,-73.9879718,MANHATTAN,0.0,0.0,0,0,0,0,0,0,3399744,2016-03-05 14:00:00,2016-03-05T14:00,2016,3,3.2,0.0,Cloudy
12/01/2016,15:00,40.750843,-73.978615,MANHATTAN,3.0,0.0,0,0,0,0,3,0,3571894,2016-12-01 15:00:00,2016-12-01T15:00,2016,12,9.5,0.0,Cloudy
08/25/2016,11:00,40.741238,-73.98888,MANHATTAN,1.0,0.0,0,0,0,0,1,0,3507278,2016-08-25 11:00:00,2016-08-25T11:00,2016,8,27.8,0.0,Cloudy
10/06/2016,21:00,40.72919,-73.98724,MANHATTAN,1.0,0.0,1,0,0,0,0,0,3535784,2016-10-06 21:00:00,2016-10-06T21:00,2016,10,13.9,0.0,Clear
04/14/2016,11:00,40.830154,-73.93964,MANHATTAN,3.0,0.0,0,0,0,0,3,0,3410641,2016-04-14 11:00:00,2016-04-14T11:00,2016,4,11.0,0.0,Clear
04/14/2016,16:00,40.745506,-73.99311,MANHATTAN,1.0,0.0,0,0,1,0,0,0,3407053,2016-04-14 16:00:00,2016-04-14T16:00,2016,4,13.5,0.0,Clear
08/30/2016,0:00,40.82289,-73.94208,MANHATTAN,0.0,0.0,0,0,0,0,0,0,3513257,2016-08-30 00:00:00,2016-08-30T00:00,2016,8,21.9,0.0,Clear
09/19/2016,20:00,40.796795,-73.94718,MANHATTAN,0.0,0.0,0,0,0,0,0,0,3523660,2016-09-19 20:00:00,2016-09-19T20:00,2016,9,21.0,0.0,Cloudy
10/18/2016,2:00,40.72628,-73.98938,MANHATTAN,1.0,0.0,1,0,0,0,0,0,3542214,2016-10-18 02:00:00,2016-10-18T02:00,2016,10,17.0,0.0,Clear
01/29/2016,7:00,40.7503074,-74.0083661,MANHATTAN,0.0,0.0,0,0,0,0,0,0,3379919,2016-01-29 07:00:00,2016-01-29T07:00,2016,1,-3.0,0.0,Clear
03/01/2016,12:00,40.8265303,-73.9466603,MANHATTAN,0.0,0.0,0,0,0,0,0,0,3397173,2016-03-01 12:00:00,2016-03-01T12:00,2016,3,6.3,0.0,Clear
01/12/2016,10:00,40.7551165,-74.0024725,MANHATTAN,1.0,0.0,1,0,0,0,0,0,3369087,2016-01-12 10:00:00,2016-01-12T10:00,2016,1,0.9,0.0,Cloudy
09/20/2016,14:00,40.753925,-73.98979,MANHATTAN,1.0,0.0,1,0,0,0,0,0,3525240,2016-09-20 14:00:00,2016-09-20T14:00,2016,9,26.5,0.0,Cloudy
01/31/2016,13:00,40.8154026,-73.9399099,MANHATTAN,0.0,0.0,0,0,0,0,0,0,3381245,2016-01-31 13:00:00,2016-01-31T13:00,2016,1,5.1,0.0,Cloudy
06/30/2016,0:00,40.75791,-73.97766,MANHATTAN,0.0,0.0,0,0,0,0,0,0,3473417,2016-06-30 00:00:00,2016-06-30T00:00,2016,6,19.9,0.0,Clear
02/22/2016,11:00,40.744099,-73.9956441,MANHATTAN,1.0,0.0,1,0,0,0,0,0,3393230,2016-02-22 11:00:00,2016-02-22T11:00,2016,2,5.9,0.0,Clear
06/21/2016,17:00,40.713924,-73.999565,MANHATTAN,1.0,0.0,1,0,0,0,0,0,3466429,2016-06-21 17:00:00,2016-06-21T17:00,2016,6,28.6,0.0,Cloudy
09/13/2016,0:00,40.86769,-73.92122,MANHATTAN,2.0,0.0,0,0,0,0,2,0,3518412,2016-09-13 00:00:00,2016-09-13T00:00,2016,9,17.3,0.0,Clear
09/29/2016,7:00,40.755222,-73.98098,MANHATTAN,0.0,0.0,0,0,0,0,0,0,3530901,2016-09-29 07:00:00,2016-09-29T07:00,2016,9,15.3,0.0,Cloudy
08/04/2016,10:00,40.713997,-74.00869,MANHATTAN,0.0,0.0,0,0,0,0,0,0,3493843,2016-08-04 10:00:00,2016-08-04T10:00,2016,8,23.9,0.0,Clear
01/26/2016,7:00,40.7564889,-73.9977585,MANHATTAN,0.0,0.0,0,0,0,0,0,0,3378070,2016-01-26 07:00:00,2016-01-26T07:00,2016,1,-5.1,0.0,Cloudy
01/29/2016,17:00,40.7736551,-73.9778247,MANHATTAN,0.0,0.0,0,0,0,0,0,0,3379475,2016-01-29 17:00:00,2016-01-29T17:00,2016,1,1.6,0.0,Cloudy
11/02/2016,16:00,40.71654,-73.996994,MANHATTAN,1.0,0.0,0,0,1,0,0,0,3553683,2016-11-02 16:00:00,2016-11-02T16:00,2016,11,19.8,0.0,Cloudy
05/17/2016,18:00,40.715233,-74.005424,MANHATTAN,1.0,0.0,0,0,0,0,1,0,3447445,2016-05-17 18:00:00,2016-05-17T18:00,2016,5,12.8,0.0,Cloudy
01/30/2016,17:00,40.72084,-74.0006602,MANHATTAN,1.0,0.0,0,0,0,0,1,0,3379887,2016-01-30 17:00:00,2016-01-30T17:00,2016,1,0.1,0.0,Clear
05/07/2016,3:00,40.73736,-73.99685,MANHATTAN,1.0,0.0,1,0,0,0,0,0,3436044,2016-05-07 03:00:00,2016-05-07T03:00,2016,5,9.3,0.0,Cloudy
12/27/2016,13:00,40.731564,-73.985535,MANHATTAN,0.0,0.0,0,0,0,0,0,0,3588883,2016-12-27 13:00:00,2016-12-27T13:00,2016,12,14.4,0.0,Clear
01/20/2016,16:00,40.7472771,-73.9896169,MANHATTAN,0.0,0.0,0,0,0,0,0,0,3374548,2016-01-20 16:00:00,2016-01-20T16:00,2016,1,2.0,0.0,Cloudy
04/25/2016,19:00,40.757515,-73.976746,MANHATTAN,0.0,0.0,0,0,0,0,0,0,3657720,2016-04-25 19:00:00,2016-04-25T19:00,2016,4,13.6,0.0,Cloudy
04/21/2016,16:00,40.741558,-73.98536,MANHATTAN,1.0,0.0,0,0,1,0,0,0,3407099,2016-04-21 16:00:00,2016-04-21T16:00,2016,4,20.7,0.0,Cloudy
03/28/2016,9:00,40.754032,-73.99385,MANHATTAN,1.0,0.0,0,0,1,0,0,0,3407270,2016-03-28 09:00:00,2016-03-28T09:00,2016,3,7.8,0.4,Drizzle
03/09/2016,16:00,40.8373693,-73.9469841,MANHATTAN,1.0,0.0,1,0,0,0,0,0,3402233,2016-03-09 16:00:00,2016-03-09T16:00,2016,3,20.9,0.0,Cloudy
08/19/2016,0:00,40.83876,-73.93967,MANHATTAN,0.0,0.0,0,0,0,0,0,0,3504396,2016-08-19 00:00:00,2016-08-19T00:00,2016,8,23.4,0.0,Cloudy
10/24/2016,18:00,40.768803,-73.95837,MANHATTAN,2.0,0.0,0,0,0,0,2,0,3546717,2016-10-24 18:00:00,2016-10-24T18:00,2016,10,11.8,0.0,Clear
08/13/2016,15:00,40.794468,-73.93964,MANHATTAN,0.0,0.0,0,0,0,0,0,0,3501534,2016-08-13 15:00:00,2016-08-13T15:00,2016,8,31.9,1.2,Drizzle
11/10/2016,19:00,40.72175,-74.00573,MANHATTAN,0.0,0.0,0,0,0,0,0,0,3557539,2016-11-10 19:00:00,2016-11-10T19:00,2016,11,9.9,0.0,Cloudy
10/16/2016,0:00,40.750294,-73.99485,MANHATTAN,1.0,0.0,0,0,1,0,0,0,3543504,2016-10-16 00:00:00,2016-10-16T00:00,2016,10,9.4,0.0,Clear
09/23/2016,21:00,40.727627,-73.98169,MANHATTAN,1.0,0.0,0,0,1,0,0,0,3526467,2016-09-23 21:00:00,2016-09-23T21:00,2016,9,22.3,0.0,Clear
03/05/2016,18:00,40.759308,-73.9652931,MANHATTAN,0.0,0.0,0,0,0,0,0,0,3400385,2016-03-05 18:00:00,2016-03-05T18:00,2016,3,2.2,0.0,Clear
09/14/2016,18:00,40.7923,-73.95046,MANHATTAN,1.0,0.0,1,0,0,0,0,0,3520867,2016-09-14 18:00:00,2016-09-14T18:00,2016,9,27.8,0.0,Cloudy
06/07/2016,1:00,40.729652,-74.00221,MANHATTAN,2.0,0.0,0,0,0,0,2,0,3456712,2016-06-07 01:00:00,2016-06-07T01:00,2016,6,20.1,0.0,Cloudy
06/17/2016,12:00,40.751522,-73.99396,MANHATTAN,1.0,0.0,0,0,0,0,1,0,3463964,2016-06-17 12:00:00,2016-06-17T12:00,2016,6,24.5,1.0,Drizzle
06/26/2016,5:00,40.75332,-73.972595,MANHATTAN,1.0,0.0,0,0,0,0,1,0,3468076,2016-06-26 05:00:00,2016-06-26T05:00,2016,6,17.0,0.0,Cloudy
11/12/2016,14:00,40.815186,-73.94009,MANHATTAN,1.0,0.0,0,0,0,0,1,0,3559716,2016-11-12 14:00:00,2016-11-12T14:00,2016,11,9.3,0.0,Clear
08/23/2016,13:00,40.790363,-73.965645,MANHATTAN,1.0,0.0,0,0,0,0,1,0,3505880,2016-08-23 13:00:00,2016-08-23T13:00,2016,8,25.8,0.0,Clear
04/21/2016,16:00,40.73264,-73.99005,MANHATTAN,1.0,0.0,0,0,0,0,1,0,3406419,2016-04-21 16:00:00,2016-04-21T16:00,2016,4,20.9,0.0,Cloudy
04/10/2016,14:00,40.724365,-73.99325,MANHATTAN,0.0,0.0,0,0,0,0,0,0,3406391,2016-04-10 14:00:00,2016-04-10T14:00,2016,4,8.5,0.0,Clear
03/31/2016,16:00,40.752197,-73.981834,MANHATTAN,2.0,0.0,0,0,0,0,2,0,3407301,2016-03-31 16:00:00,2016-03-31T16:00,2016,3,19.3,0.0,Cloudy
12/14/2016,6:00,40.764362,-73.96162,MANHATTAN,0.0,0.0,0,0,0,0,0,0,3579488,2016-12-14 06:00:00,2016-12-14T06:00,2016,12,-1.4,0.0,Clear
06/04/2016,5:00,40.733166,-74.01014,MANHATTAN,0.0,0.0,0,0,0,0,0,0,3455250,2016-06-04 05:00:00,2016-06-04T05:00,2016,6,18.6,0.0,Cloudy
05/16/2016,10:00,40.755405,-73.97949,MANHATTAN,1.0,0.0,1,0,0,0,0,0,3447929,2016-05-16 10:00:00,2016-05-16T10:00,2016,5,10.0,0.0,Cloudy
04/22/2016,14:00,40.741955,-73.98273,MANHATTAN,1.0,0.0,1,0,0,0,0,0,3407109,2016-04-22 14:00:00,2016-04-22T14:00,2016,4,24.9,0.0,Cloudy
08/13/2016,23:00,40.74433,-73.980736,MANHATTAN,0.0,0.0,0,0,0,0,0,0,3508756,2016-08-13 23:00:00,2016-08-13T23:00,2016,8,27.3,0.0,Cloudy
07/13/2016,16:00,40.75513,-73.96525,MANHATTAN,1.0,0.0,1,0,0,0,0,0,3486433,2016-07-13 16:00:00,2016-07-13T16:00,2016,7,26.2,0.0,Cloudy
06/01/2016,11:00,40.716812,-73.99777,MANHATTAN,1.0,0.0,0,0,0,0,1,0,3454300,2016-06-01 11:00:00,2016-06-01T11:00,2016,6,26.3,0.0,Cloudy
06/23/2016,1:00,40.75791,-73.97766,MANHATTAN,0.0,0.0,0,0,0,0,0,0,3467154,2016-06-23 01:00:00,2016-06-23T01:00,2016,6,17.8,0.0,Cloudy
05/14/2016,12:00,40.759575,-73.96803,MANHATTAN,1.0,0.0,1,0,0,0,0,0,4022396,2016-05-14 12:00:00,2016-05-14T12:00,2016,5,21.0,0.0,Cloudy
12/16/2016,16:00,40.70817,-74.00647,MANHATTAN,2.0,0.0,0,0,0,0,2,0,3581961,2016-12-16 16:00:00,2016-12-16T16:00,2016,12,-3.6,0.0,Cloudy
10/12/2016,21:00,40.753113,-73.98787,MANHATTAN,1.0,0.0,0,0,0,0,1,0,3539140,2016-10-12 21:00:00,2016-10-12T21:00,2016,10,13.2,0.0,Clear
01/13/2016,17:00,40.7883815,-73.9470014,MANHATTAN,0.0,0.0,0,0,0,0,0,0,3369902,2016-01-13 17:00:00,2016-01-13T17:00,2016,1,-2.9,0.0,Clear
12/24/2016,16:00,40.749825,-73.972206,MANHATTAN,0.0,0.0,0,0,0,0,0,0,3590172,2016-12-24 16:00:00,2016-12-24T16:00,2016,12,5.9,0.0,Cloudy
10/14/2016,6:00,40.72141,-74.004745,MANHATTAN,1.0,0.0,0,0,0,0,1,0,3540903,2016-10-14 06:00:00,2016-10-14T06:00,2016,10,8.5,0.0,Clear
03/01/2016,7:00,40.8670274,-73.9170421,MANHATTAN,1.0,0.0,0,0,0,0,1,0,3397198,2016-03-01 07:00:00,2016-03-01T07:00,2016,3,1.3,0.0,Clear
11/09/2016,9:00,40.79931,-73.943245,MANHATTAN,1.0,0.0,0,0,0,0,1,0,3558814,2016-11-09 09:00:00,2016-11-09T09:00,2016,11,12.5,0.0,Cloudy
11/30/2016,17:00,40.765545,-73.95471,MANHATTAN,0.0,0.0,0,0,0,0,0,0,3575820,2016-11-30 17:00:00,2016-11-30T17:00,2016,11,10.4,1.2,Drizzle
04/26/2016,11:00,40.744183,-73.99381,MANHATTAN,2.0,0.0,0,0,0,0,2,0,3407129,2016-04-26 11:00:00,2016-04-26T11:00,2016,4,19.1,0.0,Cloudy
06/02/2016,16:00,40.717007,-73.99836,MANHATTAN,0.0,0.0,0,0,0,0,0,0,3454306,2016-06-02 16:00:00,2016-06-02T16:00,2016,6,21.4,0.0,Cloudy
08/16/2016,18:00,40.80159,-73.948685,MANHATTAN,1.0,0.0,1,0,0,0,0,0,3504366,2016-08-16 18:00:00,2016-08-16T18:00,2016,8,28.4,0.0,Cloudy
06/12/2016,0:00,40.80777,-73.94549,MANHATTAN,1.0,0.0,1,0,0,0,0,0,3479672,2016-06-12 00:00:00,2016-06-12T00:00,2016,6,22.7,0.0,Clear
06/28/2016,22:00,40.717186,-74.0129,MANHATTAN,1.0,0.0,0,0,1,0,0,0,3470241,2016-06-28 22:00:00,2016-06-28T22:00,2016,6,21.4,0.3,Drizzle
10/21/2016,10:00,40.772526,-73.993935,MANHATTAN,1.0,0.0,0,0,0,0,1,0,3546106,2016-10-21 10:00:00,2016-10-21T10:00,2016,10,19.8,0.9,Drizzle
03/29/2016,13:00,40.73773,-73.99659,MANHATTAN,0.0,0.0,0,0,0,0,0,0,3406916,2016-03-29 13:00:00,2016-03-29T13:00,2016,3,10.8,0.0,Clear
06/28/2016,22:00,40.770424,-73.96222,MANHATTAN,0.0,0.0,0,0,0,0,0,0,3470361,2016-06-28 22:00:00,2016-06-28T22:00,2016,6,20.9,0.3,Drizzle
07/12/2016,10:00,40.717186,-74.0129,MANHATTAN,0.0,0.0,0,0,0,0,0,0,3478131,2016-07-12 10:00:00,2016-07-12T10:00,2016,7,25.4,0.0,Cloudy
12/29/2016,18:00,40.802788,-73.95264,MANHATTAN,1.0,0.0,1,0,0,0,0,0,3589226,2016-12-29 18:00:00,2016-12-29T18:00,2016,12,2.2,0.0,Cloudy
12/08/2016,9:00,40.770313,-73.99141,MANHATTAN,0.0,0.0,0,0,0,0,0,0,3576425,2016-12-08 09:00:00,2016-12-08T09:00,2016,12,2.6,0.0,Cloudy
04/01/2016,2:00,40.724575,-73.990616,MANHATTAN,1.0,0.0,0,0,0,0,1,0,3406349,2016-04-01 02:00:00,2016-04-01T02:00,2016,4,15.8,0.0,Cloudy
10/29/2016,3:00,40.74527,-73.97845,MANHATTAN,1.0,0.0,1,0,0,0,0,0,3550926,2016-10-29 03:00:00,2016-10-29T03:00,2016,10,3.3,0.0,Cloudy
12/14/2016,0:00,40.767,-73.9876,MANHATTAN,1.0,0.0,0,0,1,0,0,0,3580214,2016-12-14 00:00:00,2016-12-14T00:00,2016,12,0.9,0.0,Cloudy
12/27/2016,15:00,40.701782,-74.01117,MANHATTAN,0.0,0.0,0,0,0,0,0,0,3593247,2016-12-27 15:00:00,2016-12-27T15:00,2016,12,13.7,0.0,Clear
04/22/2016,12:00,40.733967,-73.98378,MANHATTAN,1.0,0.0,0,0,0,0,1,0,3407050,2016-04-22 12:00:00,2016-04-22T12:00,2016,4,24.0,0.0,Cloudy
02/25/2016,22:00,40.7546776,-73.9758061,MANHATTAN,0.0,0.0,0,0,0,0,0,0,3395230,2016-02-25 22:00:00,2016-02-25T22:00,2016,2,2.9,0.0,Cloudy
08/13/2016,12:00,40.795326,-73.971306,MANHATTAN,0.0,0.0,0,0,0,0,0,0,3501551,2016-08-13 12:00:00,2016-08-13T12:00,2016,8,32.7,0.0,Cloudy
12/20/2016,8:00,40.710007,-74.004456,MANHATTAN,1.0,0.0,1,0,0,0,0,0,3583446,2016-12-20 08:00:00,2016-12-20T08:00,2016,12,-6.8,0.0,Clear
08/02/2016,0:00,40.77369,-73.961945,MANHATTAN,0.0,0.0,0,0,0,0,0,0,3532961,2016-08-02 00:00:00,2016-08-02T00:00,2016,8,21.3,0.0,Cloudy
04/07/2016,22:00,40.866333,-73.92789,MANHATTAN,0.0,0.0,0,0,0,0,0,0,3433572,2016-04-07 22:00:00,2016-04-07T22:00,2016,4,8.3,0.0,Cloudy
08/09/2016,9:00,40.739407,-73.97671,MANHATTAN,1.0,0.0,1,0,0,0,0,0,3533214,2016-08-09 09:00:00,2016-08-09T09:00,2016,8,27.0,0.0,Clear
03/13/2016,14:00,40.7999787,-73.9427338,MANHATTAN,1.0,0.0,1,0,0,0,0,0,3404617,2016-03-13 14:00:00,2016-03-13T14:00,2016,3,15.0,0.0,Cloudy
11/30/2016,20:00,40.73167,-73.99029,MANHATTAN,1.0,0.0,1,0,0,0,0,0,3572551,2016-11-30 20:00:00,2016-11-30T20:00,2016,11,10.7,1.1,Drizzle
04/30/2016,22:00,40.81252,-73.94945,MANHATTAN,1.0,0.0,0,0,0,0,1,0,3431535,2016-04-30 22:00:00,2016-04-30T22:00,2016,4,8.1,0.0,Cloudy
07/24/2016,1:00,40.735535,-74.0017,MANHATTAN,0.0,0.0,0,0,0,0,0,0,3487994,2016-07-24 01:00:00,2016-07-24T01:00,2016,7,24.3,0.0,Clear
09/23/2016,8:00,40.75565,-73.76716,QUEENS,1.0,0.0,1,0,0,0,0,0,3525690,2016-09-23 08:00:00,2016-09-23T08:00,2016,9,18.9,0.0,Cloudy
08/25/2016,11:00,40.755398,-73.93182,QUEENS,0.0,0.0,0,0,0,0,0,0,3507197,2016-08-25 11:00:00,2016-08-25T11:00,2016,8,27.6,0.0,Cloudy
12/23/2016,13:00,40.77004,-73.90951,QUEENS,1.0,0.0,0,0,0,0,1,0,3585527,2016-12-23 13:00:00,2016-12-23T13:00,2016,12,6.1,0.0,Cloudy
02/12/2016,9:00,40.7446598,-73.9068045,QUEENS,1.0,0.0,1,0,0,0,0,0,3388589,2016-02-12 09:00:00,2016-02-12T09:00,2016,2,-10.6,0.0,Clear
06/06/2016,13:00,40.680115,-73.75324,QUEENS,1.0,0.0,1,0,0,0,0,0,3457378,2016-06-06 13:00:00,2016-06-06T13:00,2016,6,27.2,0.0,Cloudy
04/20/2016,18:00,40.76006,-73.834885,QUEENS,1.0,0.0,1,0,0,0,0,0,3426701,2016-04-20 18:00:00,2016-04-20T18:00,2016,4,13.9,0.0,Clear
06/21/2016,17:00,40.723824,-73.797615,QUEENS,2.0,0.0,0,0,0,0,2,0,3484943,2016-06-21 17:00:00,2016-06-21T17:00,2016,6,28.1,0.0,Cloudy
05/08/2016,16:00,40.68299,-73.83444,QUEENS,1.0,0.0,1,0,0,0,0,0,3439040,2016-05-08 16:00:00,2016-05-08T16:00,2016,5,16.8,0.0,Clear
07/16/2016,15:00,40.695156,-73.845406,QUEENS,1.0,0.0,1,0,0,0,0,0,3482505,2016-07-16 15:00:00,2016-07-16T15:00,2016,7,29.6,0.0,Cloudy
02/29/2016,6:00,40.6909168,-73.7281786,QUEENS,0.0,0.0,0,0,0,0,0,0,3396798,2016-02-29 06:00:00,2016-02-29T06:00,2016,2,7.3,0.0,Cloudy
01/02/2016,22:00,40.6603474,-73.7679652,QUEENS,1.0,0.0,1,0,0,0,0,0,3364295,2016-01-02 22:00:00,2016-01-02T22:00,2016,1,1.2,0.0,Clear
06/04/2016,18:00,40.704617,-73.7718,QUEENS,3.0,0.0,0,0,0,0,3,0,3456470,2016-06-04 18:00:00,2016-06-04T18:00,2016,6,22.0,0.0,Cloudy
05/24/2016,12:00,40.75739,-73.72776,QUEENS,1.0,0.0,0,0,0,0,1,0,3452137,2016-05-24 12:00:00,2016-05-24T12:00,2016,5,17.1,0.1,Drizzle
02/01/2016,22:00,40.6647218,-73.7443005,QUEENS,0.0,0.0,0,0,0,0,0,0,3382393,2016-02-01 22:00:00,2016-02-01T22:00,2016,2,4.6,0.0,Cloudy
09/15/2016,17:00,40.759724,-73.85847,QUEENS,1.0,0.0,0,0,0,0,1,0,3521350,2016-09-15 17:00:00,2016-09-15T17:00,2016,9,22.0,0.0,Clear
12/21/2016,7:00,40.76616,-73.82091,QUEENS,2.0,0.0,2,0,0,0,0,0,3584121,2016-12-21 07:00:00,2016-12-21T07:00,2016,12,-2.9,0.0,Clear
07/06/2016,18:00,40.7383,-73.88547,QUEENS,1.0,0.0,0,0,0,0,1,0,3475907,2016-07-06 18:00:00,2016-07-06T18:00,2016,7,29.6,0.0,Clear
01/27/2016,15:00,40.6978751,-73.802369,QUEENS,0.0,0.0,0,0,0,0,0,0,3378538,2016-01-27 15:00:00,2016-01-27T15:00,2016,1,3.5,0.0,Clear
02/24/2016,22:00,40.6667387,-73.8210649,QUEENS,0.0,0.0,0,0,0,0,0,0,3395005,2016-02-24 22:00:00,2016-02-24T22:00,2016,2,13.7,3.5,Heavy Rain
01/06/2016,15:00,40.7520753,-73.7210967,QUEENS,1.0,0.0,0,0,0,0,1,0,3366817,2016-01-06 15:00:00,2016-01-06T15:00,2016,1,2.8,0.0,Clear
03/03/2016,15:00,40.704485,-73.814183,QUEENS,1.0,0.0,0,0,0,0,1,0,3399022,2016-03-03 15:00:00,2016-03-03T15:00,2016,3,1.9,0.0,Cloudy
10/28/2016,21:00,40.697243,-73.813324,QUEENS,1.0,0.0,0,0,0,0,1,0,3557455,2016-10-28 21:00:00,2016-10-28T21:00,2016,10,6.3,0.0,Clear
01/16/2016,17:00,40.7025952,-73.8552926,QUEENS,1.0,0.0,0,0,0,0,1,0,3372476,2016-01-16 17:00:00,2016-01-16T17:00,2016,1,7.4,0.0,Cloudy
06/25/2016,13:00,40.749504,-73.704926,QUEENS,1.0,0.0,0,0,0,0,0,0,3469981,2016-06-25 13:00:00,2016-06-25T13:00,2016,6,26.0,0.0,Cloudy
10/21/2016,10:00,40.717667,-73.74351,QUEENS,0.0,0.0,0,0,0,0,0,0,3544650,2016-10-21 10:00:00,2016-10-21T10:00,2016,10,19.7,0.8,Drizzle
04/02/2016,17:00,40.677174,-73.814705,QUEENS,0.0,0.0,0,0,0,0,0,0,3424608,2016-04-02 17:00:00,2016-04-02T17:00,2016,4,11.4,0.0,Clear
12/08/2016,0:00,40.697403,-73.83641,QUEENS,1.0,0.0,1,0,0,0,0,0,3576145,2016-12-08 00:00:00,2016-12-08T00:00,2016,12,3.9,0.0,Cloudy
08/06/2016,7:00,40.611145,-73.7485,QUEENS,0.0,0.0,0,0,0,0,0,0,3495140,2016-08-06 07:00:00,2016-08-06T07:00,2016,8,23.5,0.0,Cloudy
10/31/2016,15:00,40.68106,-73.82637,QUEENS,3.0,0.0,0,0,0,0,3,0,3551107,2016-10-31 15:00:00,2016-10-31T15:00,2016,10,11.9,0.0,Clear
05/03/2016,6:00,40.685356,-73.866394,QUEENS,0.0,0.0,0,0,0,0,0,0,3435243,2016-05-03 06:00:00,2016-05-03T06:00,2016,5,10.9,4.2,Heavy Rain
05/30/2016,17:00,40.69615,-73.89979,QUEENS,1.0,0.0,0,0,0,0,1,0,3453757,2016-05-30 17:00:00,2016-05-30T17:00,2016,5,23.9,0.0,Cloudy
05/14/2016,10:00,40.66759,-73.85261,QUEENS,1.0,0.0,1,0,0,0,0,0,3441752,2016-05-14 10:00:00,2016-05-14T10:00,2016,5,19.5,0.0,Cloudy
01/29/2016,10:00,40.6754483,-73.7595091,QUEENS,2.0,0.0,0,0,0,0,2,0,3379826,2016-01-29 10:00:00,2016-01-29T10:00,2016,1,-1.7,0.0,Cloudy
01/16/2016,14:00,40.7769796,-73.7515817,QUEENS,0.0,0.0,0,0,0,0,0,0,3372576,2016-01-16 14:00:00,2016-01-16T14:00,2016,1,9.6,0.0,Cloudy
08/31/2016,11:00,40.73725,-73.91799,QUEENS,1.0,0.0,1,0,0,0,0,0,3510920,2016-08-31 11:00:00,2016-08-31T11:00,2016,8,28.5,0.0,Cloudy
03/18/2016,22:00,40.7244,-73.9818,QUEENS,1.0,0.0,0,0,0,0,1,0,3426087,2016-03-18 22:00:00,2016-03-18T22:00,2016,3,5.8,0.0,Clear
09/15/2016,12:00,40.700123,-73.90622,QUEENS,1.0,0.0,0,0,1,0,0,0,3526928,2016-09-15 12:00:00,2016-09-15T12:00,2016,9,22.0,0.0,Clear
09/29/2016,8:00,40.763424,-73.83016,QUEENS,2.0,0.0,0,0,0,0,2,0,3530714,2016-09-29 08:00:00,2016-09-29T08:00,2016,9,16.3,0.0,Cloudy
10/09/2016,12:00,40.77812,-73.80917,QUEENS,1.0,0.0,1,0,0,0,0,0,3536463,2016-10-09 12:00:00,2016-10-09T12:00,2016,10,12.1,0.7,Drizzle
04/21/2016,12:00,40.73935,-73.890945,QUEENS,1.0,0.0,0,0,0,0,1,0,3425959,2016-04-21 12:00:00,2016-04-21T12:00,2016,4,19.1,0.0,Cloudy
06/21/2016,17:00,40.745728,-73.823105,QUEENS,1.0,0.0,0,0,0,0,1,0,3466234,2016-06-21 17:00:00,2016-06-21T17:00,2016,6,28.1,0.0,Cloudy
07/28/2016,15:00,40.712257,-73.741165,QUEENS,2.0,0.0,0,0,0,0,2,0,3490376,2016-07-28 15:00:00,2016-07-28T15:00,2016,7,30.3,0.0,Cloudy
11/06/2016,21:00,40.682484,-73.86371,QUEENS,2.0,0.0,0,0,0,0,2,0,3555199,2016-11-06 21:00:00,2016-11-06T21:00,2016,11,6.6,0.0,Clear
02/22/2016,20:00,40.7246918,-73.7540928,QUEENS,1.0,0.0,0,0,0,0,1,0,3393713,2016-02-22 20:00:00,2016-02-22T20:00,2016,2,3.5,0.0,Clear
01/30/2016,2:00,40.7399663,-73.8942315,QUEENS,0.0,0.0,0,0,0,0,0,0,3380402,2016-01-30 02:00:00,2016-01-30T02:00,2016,1,-5.3,0.0,Clear
08/25/2016,17:00,40.70696,-73.8345,QUEENS,1.0,0.0,0,0,0,0,1,0,3507725,2016-08-25 17:00:00,2016-08-25T17:00,2016,8,26.8,0.0,Cloudy
07/28/2016,10:00,40.7182,-73.80137,QUEENS,2.0,0.0,0,0,0,0,2,0,3490738,2016-07-28 10:00:00,2016-07-28T10:00,2016,7,30.0,0.0,Cloudy
01/07/2016,17:00,40.7535224,-73.9344686,QUEENS,1.0,0.0,1,0,0,0,0,0,3368405,2016-01-07 17:00:00,2016-01-07T17:00,2016,1,3.8,0.0,Cloudy
01/27/2016,9:00,40.7302722,-73.7227647,QUEENS,0.0,0.0,0,0,0,0,0,0,3378569,2016-01-27 09:00:00,2016-01-27T09:00,2016,1,1.7,0.0,Cloudy
11/19/2016,22:00,40.753338,-73.88876,QUEENS,1.0,0.0,1,0,0,0,0,0,3564592,2016-11-19 22:00:00,2016-11-19T22:00,2016,11,10.5,0.8,Drizzle
07/03/2016,19:00,40.748318,-73.87734,QUEENS,1.0,0.0,1,0,0,0,0,0,3474067,2016-07-03 19:00:00,2016-07-03T19:00,2016,7,23.6,0.0,Cloudy
04/15/2016,16:00,40.699173,-73.82675,QUEENS,0.0,0.0,0,0,0,0,0,0,3422492,2016-04-15 16:00:00,2016-04-15T16:00,2016,4,14.2,0.0,Clear
04/15/2016,7:00,40.721333,-73.85593,QUEENS,0.0,0.0,0,0,0,0,0,0,3428070,2016-04-15 07:00:00,2016-04-15T07:00,2016,4,5.5,0.0,Clear
08/04/2016,17:00,40.744488,-73.75044,QUEENS,2.0,0.0,0,0,0,0,2,0,3532584,2016-08-04 17:00:00,2016-08-04T17:00,2016,8,24.2,0.0,Clear
02/09/2016,14:00,40.7604552,-73.8430563,QUEENS,0.0,0.0,0,0,0,0,0,0,3387030,2016-02-09 14:00:00,2016-02-09T14:00,2016,2,0.5,0.0,Cloudy
12/30/2016,11:00,40.758514,-73.91939,QUEENS,0.0,0.0,0,0,0,0,0,0,3589360,2016-12-30 11:00:00,2016-12-30T11:00,2016,12,3.3,0.0,Clear
05/05/2016,13:00,40.6818,-73.86137,QUEENS,0.0,0.0,0,0,0,0,0,0,3435872,2016-05-05 13:00:00,2016-05-05T13:00,2016,5,11.2,0.0,Cloudy
12/11/2016,19:00,40.68406,-73.72873,QUEENS,0.0,0.0,0,0,0,0,0,0,3578047,2016-12-11 19:00:00,2016-12-11T19:00,2016,12,0.4,0.2,Light Snow
04/15/2016,15:00,40.7575,-73.90896,QUEENS,1.0,0.0,1,0,0,0,0,0,3429070,2016-04-15 15:00:00,2016-04-15T15:00,2016,4,15.1,0.0,Clear
04/13/2016,8:00,40.592724,-73.798386,QUEENS,0.0,0.0,0,0,0,0,0,0,3421992,2016-04-13 08:00:00,2016-04-13T08:00,2016,4,5.7,0.0,Clear
04/22/2016,10:00,40.74031,-73.94365,QUEENS,1.0,0.0,0,0,0,0,1,0,3425969,2016-04-22 10:00:00,2016-04-22T10:00,2016,4,21.9,0.0,Cloudy
09/01/2016,12:00,40.66035,-73.74127,QUEENS,0.0,0.0,0,0,0,0,0,0,3511514,2016-09-01 12:00:00,2016-09-01T12:00,2016,9,24.6,0.2,Drizzle
03/09/2016,9:00,40.6661438,-73.8232509,QUEENS,0.0,0.0,0,0,0,0,0,0,3402586,2016-03-09 09:00:00,2016-03-09T09:00,2016,3,11.9,0.0,Cloudy
08/18/2016,14:00,40.689865,-73.84281,QUEENS,2.0,0.0,0,0,0,0,2,0,3504806,2016-08-18 14:00:00,2016-08-18T14:00,2016,8,27.2,0.0,Cloudy
01/14/2016,12:00,40.6951166,-73.9032171,QUEENS,1.0,0.0,1,0,0,0,0,0,3370842,2016-01-14 12:00:00,2016-01-14T12:00,2016,1,1.1,0.0,Clear
06/03/2016,12:00,40.609535,-73.75372,QUEENS,1.0,0.0,1,0,0,0,0,0,3455073,2016-06-03 12:00:00,2016-06-03T12:00,2016,6,19.0,0.9,Drizzle
11/03/2016,18:00,40.713303,-73.73586,QUEENS,1.0,0.0,0,0,0,0,0,0,3554253,2016-11-03 18:00:00,2016-11-03T18:00,2016,11,16.7,0.0,Clear
11/02/2016,15:00,40.70084,-73.79437,QUEENS,1.0,0.0,0,0,0,0,1,0,3552773,2016-11-02 15:00:00,2016-11-02T15:00,2016,11,19.8,0.0,Clear
05/13/2016,11:00,40.5815,-73.844154,QUEENS,1.0,0.0,0,0,0,0,1,0,3451192,2016-05-13 11:00:00,2016-05-13T11:00,2016,5,17.5,0.3,Drizzle
03/08/2016,10:00,40.7108183,-73.7706571,QUEENS,1.0,0.0,0,0,0,0,1,0,3401922,2016-03-08 10:00:00,2016-03-08T10:00,2016,3,11.5,0.0,Clear
12/08/2016,15:00,40.711823,-73.83612,QUEENS,1.0,0.0,0,0,0,0,1,0,3576138,2016-12-08 15:00:00,2016-12-08T15:00,2016,12,6.1,0.0,Cloudy
03/06/2016,17:00,40.7085962,-73.7796821,QUEENS,0.0,0.0,0,0,0,0,0,0,3400690,2016-03-06 17:00:00,2016-03-06T17:00,2016,3,5.3,0.0,Cloudy
09/30/2016,19:00,40.7079,-73.851105,QUEENS,0.0,0.0,0,0,0,0,0,0,3530405,2016-09-30 19:00:00,2016-09-30T19:00,2016,9,15.0,0.0,Cloudy
06/09/2016,17:00,40.781715,-73.823845,QUEENS,1.0,0.0,0,0,0,0,1,0,3459566,2016-06-09 17:00:00,2016-06-09T17:00,2016,6,20.9,0.0,Clear
02/04/2016,18:00,40.7019316,-73.9062079,QUEENS,1.0,0.0,0,0,1,0,0,0,3384250,2016-02-04 18:00:00,2016-02-04T18:00,2016,2,8.5,0.0,Cloudy
09/19/2016,0:00,40.69501,-73.80823,QUEENS,0.0,0.0,0,0,0,0,0,0,3524511,2016-09-19 00:00:00,2016-09-19T00:00,2016,9,22.6,0.0,Cloudy
03/10/2016,15:00,40.7562991,-73.8989268,QUEENS,1.0,0.0,0,0,1,0,0,0,3403860,2016-03-10 15:00:00,2016-03-10T15:00,2016,3,23.1,0.0,Cloudy
09/06/2016,13:00,40.65616,-73.76736,QUEENS,0.0,0.0,0,0,0,0,0,0,3515630,2016-09-06 13:00:00,2016-09-06T13:00,2016,9,26.2,0.0,Cloudy
03/07/2016,8:00,40.7115706,-73.7850288,QUEENS,1.0,0.0,0,0,0,0,1,0,3401189,2016-03-07 08:00:00,2016-03-07T08:00,2016,3,2.4,0.0,Clear
03/22/2016,13:00,40.740284,-73.9335,QUEENS,0.0,0.0,0,0,0,0,0,0,3425513,2016-03-22 13:00:00,2016-03-22T13:00,2016,3,10.2,0.0,Clear
04/09/2016,13:00,40.709824,-73.728294,QUEENS,1.0,0.0,0,0,0,0,1,0,3424054,2016-04-09 13:00:00,2016-04-09T13:00,2016,4,4.9,0.5,Drizzle
07/10/2016,10:00,40.674862,-73.85744,QUEENS,0.0,0.0,0,0,0,0,0,0,3477979,2016-07-10 10:00:00,2016-07-10T10:00,2016,7,24.2,0.2,Drizzle
04/10/2016,9:00,40.712914,-73.917496,QUEENS,2.0,0.0,0,0,0,0,2,0,3423401,2016-04-10 09:00:00,2016-04-10T09:00,2016,4,3.0,0.0,Clear
11/18/2016,13:00,40.712505,-73.78818,QUEENS,1.0,0.0,1,0,0,0,0,0,3563491,2016-11-18 13:00:00,2016-11-18T13:00,2016,11,14.9,0.0,Clear
01/08/2016,7:00,40.723485,-73.8684516,QUEENS,0.0,0.0,0,0,0,0,0,0,3367358,2016-01-08 07:00:00,2016-01-08T07:00,2016,1,-0.9,0.0,Clear
07/20/2016,7:00,40.711452,-73.91987,QUEENS,1.0,0.0,0,0,1,0,0,0,3484877,2016-07-20 07:00:00,2016-07-20T07:00,2016,7,21.8,0.0,Cloudy
02/10/2016,2:00,40.6906979,-73.8282846,QUEENS,1.0,0.0,1,0,0,0,0,0,3386938,2016-02-10 02:00:00,2016-02-10T02:00,2016,2,-1.2,0.0,Cloudy
01/28/2016,14:00,40.7433116,-73.8745041,QUEENS,1.0,0.0,1,0,0,0,0,0,3379790,2016-01-28 14:00:00,2016-01-28T14:00,2016,1,1.7,0.0,Cloudy
09/11/2016,1:00,40.69614,-73.790955,QUEENS,2.0,0.0,0,0,0,0,2,0,3519322,2016-09-11 01:00:00,2016-09-11T01:00,2016,9,24.5,0.0,Clear
06/11/2016,8:00,40.597282,-73.7914,QUEENS,0.0,0.0,0,0,0,0,0,0,3463808,2016-06-11 08:00:00,2016-06-11T08:00,2016,6,20.3,0.0,Cloudy
05/08/2016,20:00,40.711884,-73.781204,QUEENS,1.0,0.0,0,0,0,0,1,0,3438932,2016-05-08 20:00:00,2016-05-08T20:00,2016,5,12.1,0.0,Clear
09/06/2016,0:00,40.711823,-73.78786,QUEENS,3.0,0.0,0,0,0,0,3,0,3514923,2016-09-06 00:00:00,2016-09-06T00:00,2016,9,21.8,0.0,Clear
11/17/2016,16:00,40.715023,-73.80765,QUEENS,0.0,0.0,0,0,0,0,0,0,3562503,2016-11-17 16:00:00,2016-11-17T16:00,2016,11,13.8,0.0,Clear
01/20/2016,8:00,40.6949823,-73.7900876,QUEENS,1.0,0.0,0,0,0,0,1,0,3374283,2016-01-20 08:00:00,2016-01-20T08:00,2016,1,-3.2,0.0,Clear
07/02/2016,17:00,40.7632,-73.92109,QUEENS,1.0,0.0,0,0,0,0,1,0,3474100,2016-07-02 17:00:00,2016-07-02T17:00,2016,7,24.6,0.0,Cloudy
12/07/2016,14:00,40.704647,-73.768745,QUEENS,3.0,0.0,0,0,0,0,3,0,3575839,2016-12-07 14:00:00,2016-12-07T14:00,2016,12,6.6,0.0,Cloudy
12/30/2016,15:00,40.712196,-73.83258,QUEENS,1.0,0.0,1,0,0,0,0,0,3590813,2016-12-30 15:00:00,2016-12-30T15:00,2016,12,4.3,0.0,Clear
06/24/2016,21:00,40.68326,-73.84152,QUEENS,2.0,0.0,0,0,0,0,2,0,3467842,2016-06-24 21:00:00,2016-06-24T21:00,2016,6,19.6,0.0,Clear
07/16/2016,17:00,40.7086,-73.8596,QUEENS,1.0,0.0,1,0,0,0,0,0,3482678,2016-07-16 17:00:00,2016-07-16T17:00,2016,7,26.8,0.0,Cloudy
12/23/2016,11:00,40.777252,-73.89799,QUEENS,1.0,0.0,0,0,0,0,1,0,3586607,2016-12-23 11:00:00,2016-12-23T11:00,2016,12,4.8,0.0,Cloudy
04/07/2016,20:00,40.68749,-73.8334,QUEENS,0.0,0.0,0,0,0,0,0,0,3433992,2016-04-07 20:00:00,2016-04-07T20:00,2016,4,9.9,0.0,Cloudy
08/29/2016,2:00,40.76813,-73.87625,QUEENS,1.0,0.0,0,0,0,0,1,0,3510223,2016-08-29 02:00:00,2016-08-29T02:00,2016,8,22.0,0.0,Cloudy
02/16/2016,22:00,40.7145996,-73.7757159,QUEENS,0.0,0.0,0,0,0,0,0,0,3390365,2016-02-16 22:00:00,2016-02-16T22:00,2016,2,1.8,0.0,Clear
01/06/2016,14:00,40.7738078,-73.8928888,QUEENS,1.0,0.0,0,0,0,0,1,0,3366347,2016-01-06 14:00:00,2016-01-06T14:00,2016,1,3.4,0.0,Clear
09/08/2016,23:00,40.760464,-73.826546,QUEENS,1.0,0.0,0,0,1,0,0,0,3516372,2016-09-08 23:00:00,2016-09-08T23:00,2016,9,25.4,0.0,Cloudy
11/09/2016,16:00,40.576748,-73.84142,QUEENS,1.0,0.0,0,0,0,0,1,0,3557390,2016-11-09 16:00:00,2016-11-09T16:00,2016,11,12.5,0.1,Drizzle
07/18/2016,8:00,40.712727,-73.87935,QUEENS,1.0,0.0,0,0,1,0,0,0,3483998,2016-07-18 08:00:00,2016-07-18T08:00,2016,7,27.4,0.0,Clear
08/29/2016,10:00,40.726463,-73.85943,QUEENS,0.0,0.0,0,0,0,0,0,0,3509604,2016-08-29 10:00:00,2016-08-29T10:00,2016,8,29.3,0.0,Clear
01/04/2016,10:00,40.7386227,-73.8507903,QUEENS,0.0,0.0,0,0,0,0,0,0,3365654,2016-01-04 10:00:00,2016-01-04T10:00,2016,1,-0.4,0.0,Cloudy
10/16/2016,16:00,40.782444,-73.776535,QUEENS,1.0,0.0,0,0,0,0,1,0,3541164,2016-10-16 16:00:00,2016-10-16T16:00,2016,10,20.6,0.0,Clear
11/13/2016,13:00,40.690918,-73.7623,QUEENS,0.0,0.0,0,0,0,0,0,0,3560853,2016-11-13 13:00:00,2016-11-13T13:00,2016,11,13.4,0.0,Clear
02/08/2016,9:00,40.6735712,-73.7335235,QUEENS,0.0,0.0,0,0,0,0,0,0,3385856,2016-02-08 09:00:00,2016-02-08T09:00,2016,2,0.1,0.2,Light Snow
10/06/2016,8:00,40.764233,-73.81683,QUEENS,1.0,0.0,1,0,0,0,0,0,3534589,2016-10-06 08:00:00,2016-10-06T08:00,2016,10,13.2,0.0,Cloudy
02/12/2016,13:00,40.6581687,-73.7449563,QUEENS,0.0,0.0,0,0,0,0,0,0,3388113,2016-02-12 13:00:00,2016-02-12T13:00,2016,2,-4.6,0.0,Cloudy
12/05/2016,8:00,40.714622,-73.90117,QUEENS,1.0,0.0,1,0,0,0,0,0,3573785,2016-12-05 08:00:00,2016-12-05T08:00,2016,12,4.2,0.3,Drizzle
10/27/2016,16:00,40.702442,-73.81687,QUEENS,0.0,0.0,0,0,0,0,0,0,3548729,2016-10-27 16:00:00,2016-10-27T16:00,2016,10,11.0,0.7,Drizzle
01/28/2016,21:00,40.6804618,-73.8430751,QUEENS,0.0,0.0,0,0,0,0,0,0,3379724,2016-01-28 21:00:00,2016-01-28T21:00,2016,1,-2.5,0.0,Cloudy
06/27/2016,21:00,40.709896,-73.87033,QUEENS,0.0,0.0,0,0,0,0,0,0,3469970,2016-06-27 21:00:00,2016-06-27T21:00,2016,6,21.8,0.6,Drizzle
06/05/2016,4:00,40.72542,-73.78718,QUEENS,3.0,0.0,0,0,0,0,3,0,3455531,2016-06-05 04:00:00,2016-06-05T04:00,2016,6,17.9,0.0,Cloudy
01/05/2016,15:00,40.7667156,-73.9285568,QUEENS,1.0,0.0,0,0,0,0,1,0,3366334,2016-01-05 15:00:00,2016-01-05T15:00,2016,1,-1.4,0.0,Clear
12/29/2016,22:00,40.69595,-73.86237,QUEENS,0.0,0.0,0,0,0,0,0,0,3589186,2016-12-29 22:00:00,2016-12-29T22:00,2016,12,0.2,0.0,Clear
11/06/2016,19:00,40.66645,-73.75764,QUEENS,0.0,0.0,0,0,0,0,0,0,3556035,2016-11-06 19:00:00,2016-11-06T19:00,2016,11,7.9,0.0,Clear
07/27/2016,10:00,40.723904,-73.820656,QUEENS,1.0,0.0,0,0,0,0,1,0,3489006,2016-07-27 10:00:00,2016-07-27T10:00,2016,7,28.8,0.0,Clear
04/18/2016,21:00,40.691643,-73.82005,QUEENS,0.0,0.0,0,0,0,0,0,0,3422523,2016-04-18 21:00:00,2016-04-18T21:00,2016,4,12.3,0.0,Cloudy
09/02/2016,7:00,40.601955,-73.745415,QUEENS,4.0,0.0,0,0,0,0,4,0,3513626,2016-09-02 07:00:00,2016-09-02T07:00,2016,9,19.6,0.0,Cloudy
10/22/2016,18:00,40.74026,-73.888275,QUEENS,0.0,0.0,0,0,0,0,0,0,3545535,2016-10-22 18:00:00,2016-10-22T18:00,2016,10,8.7,0.3,Drizzle
09/19/2016,16:00,40.74356,-73.70768,QUEENS,1.0,0.0,0,0,0,0,1,0,3524658,2016-09-19 16:00:00,2016-09-19T16:00,2016,9,21.9,1.8,Light Rain
02/16/2016,19:00,40.7448698,-73.8762803,QUEENS,0.0,0.0,0,0,0,0,0,0,3390417,2016-02-16 19:00:00,2016-02-16T19:00,2016,2,5.8,0.0,Clear
06/22/2016,15:00,40.724964,-73.779076,QUEENS,1.0,0.0,0,0,0,0,1,0,3466978,2016-06-22 15:00:00,2016-06-22T15:00,2016,6,28.6,0.0,Clear
12/20/2016,10:00,40.690884,-73.72801,QUEENS,1.0,0.0,1,0,0,0,0,0,3583787,2016-12-20 10:00:00,2016-12-20T10:00,2016,12,-2.7,0.0,Clear
06/24/2016,23:00,40.769543,-73.7924,QUEENS,1.0,0.0,0,0,0,0,1,0,3469219,2016-06-24 23:00:00,2016-06-24T23:00,2016,6,18.8,0.0,Clear
05/28/2016,20:00,40.742294,-73.81014,QUEENS,1.0,0.0,0,0,0,0,1,0,3452008,2016-05-28 20:00:00,2016-05-28T20:00,2016,5,23.7,0.0,Cloudy
05/28/2016,17:00,40.738426,-73.865555,QUEENS,2.0,0.0,0,0,0,0,2,0,3454051,2016-05-28 17:00:00,2016-05-28T17:00,2016,5,28.2,0.0,Cloudy
01/28/2016,15:00,40.7720903,-73.9096436,QUEENS,1.0,0.0,0,0,0,0,1,0,3380460,2016-01-28 15:00:00,2016-01-28T15:00,2016,1,1.1,0.0,Cloudy
10/25/2016,17:00,40.73397,-73.885056,QUEENS,0.0,0.0,0,0,0,0,0,0,3547341,2016-10-25 17:00:00,2016-10-25T17:00,2016,10,9.5,0.0,Clear
09/16/2016,8:00,40.73578,-73.746544,QUEENS,1.0,0.0,1,0,0,0,0,0,3520829,2016-09-16 08:00:00,2016-09-16T08:00,2016,9,18.5,0.0,Cloudy
08/08/2016,8:00,40.74713,-73.88869,QUEENS,1.0,0.0,1,0,0,0,0,0,3497722,2016-08-08 08:00:00,2016-08-08T08:00,2016,8,24.8,0.0,Clear
06/19/2016,11:00,40.69447,-73.78147,QUEENS,1.0,0.0,0,0,0,0,1,0,3464819,2016-06-19 11:00:00,2016-06-19T11:00,2016,6,28.0,0.0,Clear
11/21/2016,0:00,40.70024,-73.83263,QUEENS,1.0,0.0,1,0,0,0,0,0,3565045,2016-11-21 00:00:00,2016-11-21T00:00,2016,11,2.1,0.0,Cloudy
06/04/2016,17:00,40.70382,-73.72995,QUEENS,1.0,0.0,0,0,1,0,0,0,3455514,2016-06-04 17:00:00,2016-06-04T17:00,2016,6,21.8,0.0,Cloudy
02/16/2016,10:00,40.7323251,-73.8107713,QUEENS,1.0,0.0,1,0,0,0,0,0,3389738,2016-02-16 10:00:00,2016-02-16T10:00,2016,2,11.3,0.4,Drizzle
11/01/2016,0:00,40.72844,-73.87116,QUEENS,0.0,0.0,0,0,0,0,0,0,3552162,2016-11-01 00:00:00,2016-11-01T00:00,2016,11,5.2,0.0,Clear
10/21/2016,22:00,40.671566,-73.79031,QUEENS,0.0,0.0,0,0,0,0,0,0,3551867,2016-10-21 22:00:00,2016-10-21T22:00,2016,10,18.5,0.1,Drizzle
01/08/2016,10:00,40.7405978,-73.9305948,QUEENS,1.0,0.0,0,0,0,0,1,0,3367818,2016-01-08 10:00:00,2016-01-08T10:00,2016,1,2.4,0.0,Cloudy
07/18/2016,5:00,40.70969,-73.74823,QUEENS,3.0,0.0,0,0,0,0,3,0,3482563,2016-07-18 05:00:00,2016-07-18T05:00,2016,7,24.2,0.0,Cloudy
12/18/2016,5:00,40.67013,-73.80938,QUEENS,3.0,0.0,0,0,0,0,3,0,3581700,2016-12-18 05:00:00,2016-12-18T05:00,2016,12,9.4,0.7,Drizzle
03/09/2016,2:00,40.7010548,-73.9047268,QUEENS,1.0,0.0,0,0,0,0,1,0,3402558,2016-03-09 02:00:00,2016-03-09T02:00,2016,3,5.2,0.0,Clear
05/26/2016,15:00,40.695984,-73.894196,QUEENS,0.0,0.0,0,0,0,0,0,0,3446442,2016-05-26 15:00:00,2016-05-26T15:00,2016,5,29.4,0.0,Clear
12/21/2016,17:00,40.741726,-73.89521,QUEENS,1.0,0.0,0,0,0,0,1,0,3584480,2016-12-21 17:00:00,2016-12-21T17:00,2016,12,2.2,0.0,Cloudy
10/18/2016,14:00,40.707943,-73.78375,QUEENS,1.0,0.0,0,0,0,0,1,0,3542723,2016-10-18 14:00:00,2016-10-18T14:00,2016,10,25.7,0.0,Clear
08/09/2016,7:00,40.700397,-73.82353,QUEENS,0.0,0.0,0,0,0,0,0,0,3496678,2016-08-09 07:00:00,2016-08-09T07:00,2016,8,23.3,0.0,Clear
06/10/2016,10:00,40.76754,-73.91204,QUEENS,1.0,0.0,0,0,0,0,1,0,3460949,2016-06-10 10:00:00,2016-06-10T10:00,2016,6,19.0,0.0,Clear
06/05/2016,13:00,40.711838,-73.917496,QUEENS,1.0,0.0,0,0,0,0,1,0,3456486,2016-06-05 13:00:00,2016-06-05T13:00,2016,6,20.0,0.2,Drizzle
04/14/2016,8:00,40.71015,-73.798386,QUEENS,0.0,0.0,0,0,0,0,0,0,3425273,2016-04-14 08:00:00,2016-04-14T08:00,2016,4,6.6,0.0,Clear
05/29/2016,0:00,40.765728,-73.80704,QUEENS,0.0,0.0,0,0,0,0,0,0,3452012,2016-05-29 00:00:00,2016-05-29T00:00,2016,5,21.7,0.0,Clear
09/29/2016,16:00,40.690685,-73.78161,QUEENS,2.0,0.0,0,0,0,0,2,0,3530592,2016-09-29 16:00:00,2016-09-29T16:00,2016,9,17.0,0.2,Drizzle
07/19/2016,13:00,40.747982,-73.86872,QUEENS,1.0,0.0,0,0,1,0,0,0,3484113,2016-07-19 13:00:00,2016-07-19T13:00,2016,7,28.8,0.0,Clear
03/06/2016,19:00,40.6886755,-73.8012712,QUEENS,0.0,0.0,0,0,0,0,0,0,3401184,2016-03-06 19:00:00,2016-03-06T19:00,2016,3,2.8,0.0,Clear
03/08/2016,13:00,40.7329423,-73.8496051,QUEENS,0.0,0.0,0,0,0,0,0,0,3402045,2016-03-08 13:00:00,2016-03-08T13:00,2016,3,13.3,0.0,Clear
12/02/2016,8:00,40.681522,-73.82473,QUEENS,0.0,0.0,0,0,0,0,0,0,3571372,2016-12-02 08:00:00,2016-12-02T08:00,2016,12,3.8,0.0,Clear
12/17/2016,1:00,40.711197,-73.8719,QUEENS,1.0,0.0,0,0,0,0,1,0,3581659,2016-12-17 01:00:00,2016-12-17T01:00,2016,12,-3.5,0.1,Light Snow
11/07/2016,17:00,40.66561,-73.73568,QUEENS,3.0,0.0,0,0,0,0,3,0,3556077,2016-11-07 17:00:00,2016-11-07T17:00,2016,11,10.0,0.0,Clear
01/02/2016,15:00,40.6819877,-73.8369746,QUEENS,0.0,0.0,0,0,0,0,0,0,3364322,2016-01-02 15:00:00,2016-01-02T15:00,2016,1,4.2,0.0,Clear
03/04/2016,14:00,40.7634451,-73.8830107,QUEENS,1.0,0.0,0,0,0,0,1,0,3399680,2016-03-04 14:00:00,2016-03-04T14:00,2016,3,1.9,0.0,Cloudy
08/21/2016,15:00,40.670937,-73.73544,QUEENS,0.0,0.0,0,0,0,0,0,0,3504875,2016-08-21 15:00:00,2016-08-21T15:00,2016,8,27.7,0.0,Cloudy
09/01/2016,19:00,40.660347,-73.767975,QUEENS,1.0,0.0,1,0,0,0,0,0,3512231,2016-09-01 19:00:00,2016-09-01T19:00,2016,9,23.9,0.0,Cloudy
10/12/2016,13:00,40.75213,-73.83237,QUEENS,3.0,0.0,0,0,0,0,3,0,3538881,2016-10-12 13:00:00,2016-10-12T13:00,2016,10,17.1,0.0,Cloudy
10/01/2016,9:00,40.6767,-73.795,QUEENS,3.0,0.0,0,0,0,0,3,0,3530756,2016-10-01 09:00:00,2016-10-01T09:00,2016,10,16.0,0.0,Cloudy
01/06/2016,11:00,40.7491627,-73.889904,QUEENS,1.0,0.0,1,0,0,0,0,0,3366351,2016-01-06 11:00:00,2016-01-06T11:00,2016,1,0.2,0.0,Clear
06/03/2016,9:00,40.732838,-73.783936,QUEENS,1.0,0.0,0,0,1,0,0,0,3454751,2016-06-03 09:00:00,2016-06-03T09:00,2016,6,17.1,0.7,Drizzle
11/01/2016,17:00,40.761166,-73.82938,QUEENS,0.0,0.0,0,0,0,0,0,0,3552020,2016-11-01 17:00:00,2016-11-01T17:00,2016,11,12.0,0.0,Cloudy
12/19/2016,9:00,40.70764,-73.817566,QUEENS,0.0,0.0,0,0,0,0,0,0,3582696,2016-12-19 09:00:00,2016-12-19T09:00,2016,12,-4.7,0.0,Cloudy
10/23/2016,4:00,40.745323,-73.871605,QUEENS,0.0,0.0,0,0,0,0,0,0,3545538,2016-10-23 04:00:00,2016-10-23T04:00,2016,10,7.6,0.0,Clear
11/15/2016,0:00,40.712128,-73.736404,QUEENS,2.0,0.0,0,0,0,0,2,0,3560986,2016-11-15 00:00:00,2016-11-15T00:00,2016,11,10.1,0.0,Cloudy
12/24/2016,12:00,40.68787,-73.79747,QUEENS,0.0,0.0,0,0,0,0,0,0,3585916,2016-12-24 12:00:00,2016-12-24T12:00,2016,12,6.3,2.3,Light Rain
03/05/2016,11:00,40.7633458,-73.8773073,QUEENS,1.0,0.0,0,0,1,0,0,0,3400260,2016-03-05 11:00:00,2016-03-05T11:00,2016,3,2.3,0.0,Cloudy
04/10/2016,14:00,40.710255,-73.72985,QUEENS,1.0,0.0,0,0,0,0,1,0,3424071,2016-04-10 14:00:00,2016-04-10T14:00,2016,4,7.7,0.0,Clear
07/08/2016,12:00,40.842564,-73.83842,QUEENS,2.0,0.0,0,0,0,0,2,0,3478379,2016-07-08 12:00:00,2016-07-08T12:00,2016,7,28.3,0.7,Drizzle
08/20/2016,17:00,40.742065,-73.909256,QUEENS,1.0,0.0,0,0,0,0,1,0,3504072,2016-08-20 17:00:00,2016-08-20T17:00,2016,8,26.3,0.3,Drizzle
05/29/2016,12:00,40.759182,-73.86883,QUEENS,1.0,0.0,1,0,0,0,0,0,3452517,2016-05-29 12:00:00,2016-05-29T12:00,2016,5,29.8,0.0,Cloudy
11/01/2016,10:00,40.67685,-73.74819,QUEENS,0.0,0.0,0,0,0,0,0,0,3552619,2016-11-01 10:00:00,2016-11-01T10:00,2016,11,12.5,0.0,Cloudy
01/03/2016,16:00,40.7257899,-73.791744,QUEENS,1.0,0.0,1,0,0,0,0,0,3364965,2016-01-03 16:00:00,2016-01-03T16:00,2016,1,5.8,0.0,Clear
07/02/2016,11:00,40.721375,-73.7903,QUEENS,1.0,0.0,0,0,0,0,1,0,3473203,2016-07-02 11:00:00,2016-07-02T11:00,2016,7,23.7,0.0,Cloudy
09/25/2016,12:00,40.66016,-73.75579,QUEENS,1.0,0.0,0,0,0,0,1,0,3526547,2016-09-25 12:00:00,2016-09-25T12:00,2016,9,18.7,0.0,Clear
01/16/2016,7:00,40.67725,-73.8255757,QUEENS,0.0,0.0,0,0,0,0,0,0,3372090,2016-01-16 07:00:00,2016-01-16T07:00,2016,1,4.1,0.7,Drizzle
05/12/2016,2:00,40.67676,-73.81349,QUEENS,0.0,0.0,0,0,0,0,0,0,3440975,2016-05-12 02:00:00,2016-05-12T02:00,2016,5,12.8,0.0,Clear
10/13/2016,7:00,40.735626,-73.92307,QUEENS,0.0,0.0,0,0,0,0,0,0,3539326,2016-10-13 07:00:00,2016-10-13T07:00,2016,10,11.6,0.0,Cloudy
09/20/2016,14:00,40.705425,-73.78228,QUEENS,0.0,0.0,0,0,0,0,0,0,3523847,2016-09-20 14:00:00,2016-09-20T14:00,2016,9,26.2,0.0,Cloudy
02/23/2016,15:00,40.7750605,-73.9138567,QUEENS,1.0,0.0,1,0,0,0,0,0,3403280,2016-02-23 15:00:00,2016-02-23T15:00,2016,2,2.0,1.0,Light Snow
10/31/2016,15:00,40.728065,-73.86107,QUEENS,0.0,0.0,0,0,0,0,0,0,3551110,2016-10-31 15:00:00,2016-10-31T15:00,2016,10,11.9,0.0,Clear
04/08/2016,8:00,40.759644,-73.929474,QUEENS,1.0,0.0,1,0,0,0,0,0,3428980,2016-04-08 08:00:00,2016-04-08T08:00,2016,4,6.2,0.0,Clear
05/21/2016,0:00,40.769352,-73.83258,QUEENS,0.0,0.0,0,0,0,0,0,0,3451929,2016-05-21 00:00:00,2016-05-21T00:00,2016,5,13.4,0.0,Cloudy
06/13/2016,19:00,40.740437,-73.92304,QUEENS,1.0,0.0,0,0,1,0,0,0,3461617,2016-06-13 19:00:00,2016-06-13T19:00,2016,6,20.0,0.0,Cloudy
09/07/2016,16:00,40.700607,-73.90994,QUEENS,1.0,0.0,1,0,0,0,0,0,3515624,2016-09-07 16:00:00,2016-09-07T16:00,2016,9,27.4,0.0,Clear
10/20/2016,18:00,40.685837,-73.82686,QUEENS,1.0,0.0,0,0,1,0,0,0,3544098,2016-10-20 18:00:00,2016-10-20T18:00,2016,10,19.0,0.0,Cloudy
09/12/2016,15:00,40.69484,-73.86433,QUEENS,0.0,0.0,0,0,0,0,0,0,3518750,2016-09-12 15:00:00,2016-09-12T15:00,2016,9,23.8,0.0,Clear
08/25/2016,0:00,40.657875,-73.77051,QUEENS,2.0,0.0,0,0,0,0,2,0,3507769,2016-08-25 00:00:00,2016-08-25T00:00,2016,8,22.3,0.0,Cloudy
11/25/2016,12:00,40.78043,-73.91897,QUEENS,0.0,0.0,0,0,0,0,0,0,3570332,2016-11-25 12:00:00,2016-11-25T12:00,2016,11,10.7,0.0,Cloudy
04/28/2016,14:00,40.735844,-73.90619,QUEENS,0.0,0.0,0,0,0,0,0,0,3432976,2016-04-28 14:00:00,2016-04-28T14:00,2016,4,12.0,0.0,Cloudy
08/03/2016,21:00,40.760994,-73.82443,QUEENS,0.0,0.0,0,0,0,0,0,0,3494368,2016-08-03 21:00:00,2016-08-03T21:00,2016,8,20.6,0.0,Clear
11/13/2016,14:00,0.0,0.0,QUEENS,1.0,0.0,0,0,0,0,1,0,3559287,2016-11-13 14:00:00,2016-11-13T14:00,2016,11,26.3,0.0,Clear
01/26/2016,18:00,40.7367523,-73.8776702,QUEENS,0.0,0.0,0,0,0,0,0,0,3382501,2016-01-26 18:00:00,2016-01-26T18:00,2016,1,3.9,0.0,Cloudy
12/27/2016,15:00,40.709988,-73.90475,QUEENS,0.0,0.0,0,0,0,0,0,0,3587984,2016-12-27 15:00:00,2016-12-27T15:00,2016,12,13.7,0.0,Clear
06/20/2016,18:00,40.657185,-73.76597,QUEENS,2.0,0.0,0,0,0,0,2,0,3465282,2016-06-20 18:00:00,2016-06-20T18:00,2016,6,23.9,0.0,Cloudy
11/02/2016,19:00,40.736637,-73.7116,QUEENS,5.0,0.0,0,0,0,0,5,0,3552806,2016-11-02 19:00:00,2016-11-02T19:00,2016,11,16.1,0.0,Cloudy
12/03/2016,19:00,40.75482,-73.84499,QUEENS,1.0,0.0,0,0,1,0,0,0,3572974,2016-12-03 19:00:00,2016-12-03T19:00,2016,12,4.7,0.0,Clear
07/27/2016,23:00,40.667522,-73.78063,QUEENS,1.0,0.0,0,0,0,0,1,0,3489807,2016-07-27 23:00:00,2016-07-27T23:00,2016,7,24.5,0.0,Clear
10/27/2016,7:00,40.75781,-73.94003,QUEENS,1.0,0.0,1,0,0,0,0,0,3548258,2016-10-27 07:00:00,2016-10-27T07:00,2016,10,5.8,0.5,Drizzle
02/01/2016,13:00,40.6596509,-73.7738282,QUEENS,1.0,0.0,0,0,0,0,1,0,3381759,2016-02-01 13:00:00,2016-02-01T13:00,2016,2,9.6,0.0,Cloudy
05/29/2016,0:00,40.758705,-73.93793,QUEENS,4.0,0.0,0,0,0,0,4,0,3452453,2016-05-29 00:00:00,2016-05-29T00:00,2016,5,22.1,0.0,Clear
10/21/2016,5:00,40.754234,-73.89809,QUEENS,0.0,0.0,0,0,0,0,0,0,3544442,2016-10-21 05:00:00,2016-10-21T05:00,2016,10,18.8,0.0,Cloudy
12/29/2016,18:00,40.708527,-73.87172,QUEENS,0.0,0.0,0,0,0,0,0,0,3590396,2016-12-29 18:00:00,2016-12-29T18:00,2016,12,2.6,0.0,Cloudy
09/02/2016,17:00,40.76184,-73.869316,QUEENS,0.0,0.0,0,0,0,0,0,0,3513006,2016-09-02 17:00:00,2016-09-02T17:00,2016,9,25.0,0.0,Cloudy
05/22/2016,5:00,40.75352,-73.93448,QUEENS,1.0,0.0,0,0,0,0,1,0,3452386,2016-05-22 05:00:00,2016-05-22T05:00,2016,5,11.2,0.2,Drizzle
06/01/2016,13:00,40.72028,-73.86548,QUEENS,1.0,0.0,0,0,0,0,1,0,3453877,2016-06-01 13:00:00,2016-06-01T13:00,2016,6,25.2,0.0,Cloudy
07/09/2016,11:00,40.765965,-73.76814,QUEENS,1.0,0.0,0,0,0,0,1,0,3476816,2016-07-09 11:00:00,2016-07-09T11:00,2016,7,21.7,0.0,Cloudy
05/28/2016,16:00,40.69251,-73.78008,QUEENS,3.0,0.0,0,0,0,0,3,0,3447145,2016-05-28 16:00:00,2016-05-28T16:00,2016,5,28.2,0.0,Clear
08/29/2016,13:00,40.762856,-73.888596,QUEENS,0.0,0.0,0,0,0,0,0,0,3510227,2016-08-29 13:00:00,2016-08-29T13:00,2016,8,32.1,0.0,Clear
05/13/2016,17:00,40.657875,-73.77051,QUEENS,0.0,0.0,0,0,0,0,0,0,3441287,2016-05-13 17:00:00,2016-05-13T17:00,2016,5,16.4,1.5,Light Rain
01/03/2016,17:00,40.7060836,-73.8688105,QUEENS,0.0,0.0,0,0,0,0,0,0,3364925,2016-01-03 17:00:00,2016-01-03T17:00,2016,1,4.4,0.0,Clear
07/21/2016,8:00,40.705284,-73.90636,QUEENS,0.0,0.0,0,0,0,0,0,0,3485763,2016-07-21 08:00:00,2016-07-21T08:00,2016,7,24.7,0.0,Clear
07/02/2016,15:00,40.719643,-73.83507,QUEENS,2.0,0.0,0,0,0,0,2,0,3473238,2016-07-02 15:00:00,2016-07-02T15:00,2016,7,25.2,0.0,Cloudy
01/08/2016,14:00,40.766359,-73.8875543,QUEENS,1.0,0.0,0,0,0,0,1,0,3367379,2016-01-08 14:00:00,2016-01-08T14:00,2016,1,5.9,0.0,Cloudy
11/29/2016,21:00,40.75425,-73.827835,QUEENS,0.0,0.0,0,0,0,0,0,0,3570086,2016-11-29 21:00:00,2016-11-29T21:00,2016,11,13.7,0.0,Cloudy
08/15/2016,18:00,40.75363,-73.88597,QUEENS,1.0,0.0,0,0,0,0,1,0,3502108,2016-08-15 18:00:00,2016-08-15T18:00,2016,8,30.1,0.2,Drizzle
10/30/2016,9:00,40.668434,-73.80062,QUEENS,1.0,0.0,0,0,0,0,1,0,3549846,2016-10-30 09:00:00,2016-10-30T09:00,2016,10,17.9,0.0,Clear
03/20/2016,12:00,40.66484,-73.734955,QUEENS,1.0,0.0,0,0,0,0,1,0,3423698,2016-03-20 12:00:00,2016-03-20T12:00,2016,3,3.8,0.0,Cloudy
05/30/2016,17:00,40.726757,-73.71409,QUEENS,1.0,0.0,0,0,0,0,1,0,3447367,2016-05-30 17:00:00,2016-05-30T17:00,2016,5,22.0,0.0,Cloudy
09/15/2016,16:00,40.68804,-73.83275,QUEENS,1.0,0.0,0,0,0,0,1,0,3520767,2016-09-15 16:00:00,2016-09-15T16:00,2016,9,22.3,0.0,Clear
11/04/2016,18:00,40.674458,-73.7795,QUEENS,0.0,0.0,0,0,0,0,0,0,3554096,2016-11-04 18:00:00,2016-11-04T18:00,2016,11,11.3,0.0,Clear
08/20/2016,0:00,40.745632,-73.906425,QUEENS,1.0,0.0,0,0,0,0,1,0,3503699,2016-08-20 00:00:00,2016-08-20T00:00,2016,8,25.0,0.0,Clear
11/29/2016,19:00,40.75207,-73.926476,QUEENS,0.0,0.0,0,0,0,0,0,0,3570371,2016-11-29 19:00:00,2016-11-29T19:00,2016,11,13.8,0.0,Cloudy
04/16/2016,14:00,40.744957,-73.86979,QUEENS,0.0,0.0,0,0,0,0,0,0,3427167,2016-04-16 14:00:00,2016-04-16T14:00,2016,4,16.0,0.0,Cloudy
12/10/2016,18:00,40.73251,-73.86827,QUEENS,0.0,0.0,0,0,0,0,0,0,3576678,2016-12-10 18:00:00,2016-12-10T18:00,2016,12,-0.8,0.0,Clear
04/06/2016,14:00,40.71155,-73.79072,QUEENS,0.0,0.0,0,0,0,0,0,0,3425161,2016-04-06 14:00:00,2016-04-06T14:00,2016,4,7.1,0.0,Clear
06/29/2016,10:00,40.77674,-73.79996,QUEENS,1.0,0.0,1,0,0,0,0,0,3470976,2016-06-29 10:00:00,2016-06-29T10:00,2016,6,24.5,0.0,Clear
09/10/2016,11:00,40.68049,-73.774704,QUEENS,1.0,0.0,0,0,1,0,0,0,3517121,2016-09-10 11:00:00,2016-09-10T11:00,2016,9,28.9,0.0,Cloudy
05/24/2016,16:00,40.704388,-73.796844,QUEENS,1.0,0.0,0,0,0,0,1,0,3445724,2016-05-24 16:00:00,2016-05-24T16:00,2016,5,20.0,0.3,Drizzle
08/03/2016,22:00,40.74729,-73.912125,QUEENS,1.0,0.0,0,0,1,0,0,0,3532509,2016-08-03 22:00:00,2016-08-03T22:00,2016,8,19.2,0.0,Clear
07/03/2016,1:00,40.686302,-73.793915,QUEENS,6.0,0.0,0,0,0,0,6,0,3473251,2016-07-03 01:00:00,2016-07-03T01:00,2016,7,18.7,0.0,Cloudy
04/16/2016,18:00,40.690113,-73.86115,QUEENS,1.0,0.0,1,0,0,0,0,0,3422509,2016-04-16 18:00:00,2016-04-16T18:00,2016,4,13.6,0.0,Cloudy
12/19/2016,10:00,40.745117,-73.904495,QUEENS,1.0,0.0,0,0,1,0,0,0,3585534,2016-12-19 10:00:00,2016-12-19T10:00,2016,12,-4.0,0.0,Clear
12/25/2016,12:00,40.66798,-73.77432,QUEENS,0.0,0.0,0,0,0,0,0,0,3586559,2016-12-25 12:00:00,2016-12-25T12:00,2016,12,6.5,0.0,Clear
10/11/2016,19:00,40.68025,-73.82223,QUEENS,1.0,0.0,0,0,1,0,0,0,3538329,2016-10-11 19:00:00,2016-10-11T19:00,2016,10,12.9,0.0,Cloudy
09/22/2016,7:00,40.70297,-73.86825,QUEENS,2.0,0.0,0,0,0,0,2,0,3524810,2016-09-22 07:00:00,2016-09-22T07:00,2016,9,18.0,0.0,Clear
07/02/2016,22:00,40.740273,-73.89586,QUEENS,1.0,0.0,0,0,0,0,1,0,3473213,2016-07-02 22:00:00,2016-07-02T22:00,2016,7,20.0,0.0,Cloudy
07/29/2016,20:00,40.7666,-73.89117,QUEENS,3.0,0.0,0,0,0,0,3,0,3491344,2016-07-29 20:00:00,2016-07-29T20:00,2016,7,25.4,0.0,Clear
06/28/2016,8:00,40.670227,-73.84549,QUEENS,0.0,0.0,0,0,0,0,0,0,3470023,2016-06-28 08:00:00,2016-06-28T08:00,2016,6,21.7,0.0,Cloudy
09/23/2016,20:00,40.678276,-73.762344,QUEENS,2.0,0.0,0,0,0,0,2,0,3526064,2016-09-23 20:00:00,2016-09-23T20:00,2016,9,22.3,0.0,Clear
05/15/2016,10:00,40.756985,-73.90737,QUEENS,1.0,0.0,0,0,0,0,1,0,3442866,2016-05-15 10:00:00,2016-05-15T10:00,2016,5,12.9,0.0,Cloudy
01/08/2016,17:00,40.6662863,-73.7635324,QUEENS,1.0,0.0,0,0,0,0,1,0,3367791,2016-01-08 17:00:00,2016-01-08T17:00,2016,1,5.5,0.0,Cloudy
01/09/2016,15:00,40.7783403,-73.7711322,QUEENS,0.0,0.0,0,0,0,0,0,0,3367874,2016-01-09 15:00:00,2016-01-09T15:00,2016,1,8.0,0.0,Cloudy
05/22/2016,13:00,40.691948,-73.730675,QUEENS,1.0,0.0,0,0,0,0,1,0,3451552,2016-05-22 13:00:00,2016-05-22T13:00,2016,5,18.8,0.0,Cloudy
08/15/2016,11:00,40.69447,-73.78147,QUEENS,2.0,0.0,0,0,2,0,0,0,3501359,2016-08-15 11:00:00,2016-08-15T11:00,2016,8,30.1,0.0,Clear
04/16/2016,0:00,40.670216,-73.803566,QUEENS,0.0,0.0,0,0,0,0,0,0,3434048,2016-04-16 00:00:00,2016-04-16T00:00,2016,4,5.2,0.0,Clear
07/24/2016,13:00,40.60238,-73.76772,QUEENS,0.0,0.0,0,0,0,0,0,0,3489675,2016-07-24 13:00:00,2016-07-24T13:00,2016,7,33.0,0.0,Cloudy
07/21/2016,16:00,40.745594,-73.9034,QUEENS,1.0,0.0,1,0,0,0,0,0,3490412,2016-07-21 16:00:00,2016-07-21T16:00,2016,7,29.8,0.0,Cloudy
03/17/2016,22:00,40.7728532,-73.9060611,QUEENS,1.0,0.0,1,0,0,0,0,0,3428709,2016-03-17 22:00:00,2016-03-17T22:00,2016,3,8.5,0.0,Clear
07/01/2016,6:00,40.756004,-73.8634,QUEENS,1.0,0.0,1,0,0,0,0,0,3472588,2016-07-01 06:00:00,2016-07-01T06:00,2016,7,21.1,0.0,Cloudy
10/13/2016,10:00,40.75776,-73.7834,QUEENS,1.0,0.0,1,0,0,0,0,0,3539404,2016-10-13 10:00:00,2016-10-13T10:00,2016,10,16.8,0.0,Cloudy
12/28/2016,21:00,40.719276,-73.81569,QUEENS,1.0,0.0,1,0,0,0,0,0,3588441,2016-12-28 21:00:00,2016-12-28T21:00,2016,12,-1.0,0.0,Clear
10/08/2016,21:00,40.670555,-73.85634,QUEENS,1.0,0.0,0,0,0,0,1,0,3537498,2016-10-08 21:00:00,2016-10-08T21:00,2016,10,17.6,0.4,Drizzle
10/09/2016,1:00,40.689865,-73.84281,QUEENS,1.0,0.0,0,0,0,0,1,0,3536908,2016-10-09 01:00:00,2016-10-09T01:00,2016,10,17.1,0.8,Drizzle
03/16/2016,19:00,40.752262,-73.83446,QUEENS,0.0,0.0,0,0,0,0,0,0,3426069,2016-03-16 19:00:00,2016-03-16T19:00,2016,3,9.1,0.6,Drizzle
06/11/2016,15:00,40.746635,-73.95529,QUEENS,0.0,0.0,0,0,0,0,0,0,4022649,2016-06-11 15:00:00,2016-06-11T15:00,2016,6,29.5,0.0,Cloudy
05/06/2016,14:00,40.700512,-73.796776,QUEENS,1.0,0.0,0,0,0,0,1,0,3436361,2016-05-06 14:00:00,2016-05-06T14:00,2016,5,11.3,0.1,Drizzle
03/15/2016,13:00,40.674,-73.8721,QUEENS,0.0,0.0,0,0,0,0,0,0,3427269,2016-03-15 13:00:00,2016-03-15T13:00,2016,3,10.7,0.0,Cloudy
11/21/2016,7:00,40.709476,-73.76393,QUEENS,2.0,0.0,0,0,0,0,2,0,3565066,2016-11-21 07:00:00,2016-11-21T07:00,2016,11,1.6,0.0,Cloudy
09/08/2016,9:00,40.672146,-73.84318,QUEENS,2.0,0.0,0,0,0,0,2,0,3515663,2016-09-08 09:00:00,2016-09-08T09:00,2016,9,24.2,0.0,Cloudy
07/06/2016,9:00,40.70731,-73.804245,QUEENS,0.0,0.0,0,0,0,0,0,0,3476466,2016-07-06 09:00:00,2016-07-06T09:00,2016,7,29.2,0.0,Clear
09/12/2016,7:00,40.66549,-73.75236,QUEENS,2.0,0.0,0,0,0,0,2,0,3518054,2016-09-12 07:00:00,2016-09-12T07:00,2016,9,17.5,0.0,Clear
04/20/2016,16:00,40.761257,-73.92488,QUEENS,0.0,0.0,0,0,0,0,0,0,3429139,2016-04-20 16:00:00,2016-04-20T16:00,2016,4,17.3,0.0,Clear
08/12/2016,8:00,40.666405,-73.74661,QUEENS,1.0,0.0,0,0,0,0,1,0,3498884,2016-08-12 08:00:00,2016-08-12T08:00,2016,8,27.3,0.0,Cloudy
11/30/2016,4:00,40.696625,-73.7849,QUEENS,1.0,0.0,0,0,0,0,1,0,3570398,2016-11-30 04:00:00,2016-11-30T04:00,2016,11,11.1,0.0,Cloudy
06/19/2016,17:00,40.729225,-73.796936,QUEENS,0.0,0.0,0,0,0,0,0,0,3484940,2016-06-19 17:00:00,2016-06-19T17:00,2016,6,22.8,0.0,Clear
11/12/2016,16:00,40.674557,-73.859604,QUEENS,0.0,0.0,0,0,0,0,0,0,4023789,2016-11-12 16:00:00,2016-11-12T16:00,2016,11,9.2,0.0,Clear
05/05/2016,18:00,40.756866,-73.88563,QUEENS,0.0,0.0,0,0,0,0,0,0,3436928,2016-05-05 18:00:00,2016-05-05T18:00,2016,5,11.7,0.0,Cloudy
09/25/2016,9:00,40.689274,-73.73004,QUEENS,0.0,0.0,0,0,0,0,0,0,3526422,2016-09-25 09:00:00,2016-09-25T09:00,2016,9,15.6,0.0,Clear
09/08/2016,10:00,40.70844,-73.87621,QUEENS,1.0,0.0,0,0,1,0,0,0,3516270,2016-09-08 10:00:00,2016-09-08T10:00,2016,9,25.8,0.0,Cloudy
11/17/2016,19:00,40.746037,-73.705635,QUEENS,1.0,0.0,0,0,0,0,1,0,3562405,2016-11-17 19:00:00,2016-11-17T19:00,2016,11,10.2,0.0,Clear
06/18/2016,23:00,40.687603,-73.820625,QUEENS,0.0,0.0,0,0,0,0,0,0,3463839,2016-06-18 23:00:00,2016-06-18T23:00,2016,6,19.7,0.0,Cloudy
02/25/2016,21:00,40.7387326,-73.7572959,QUEENS,1.0,0.0,1,0,0,0,0,0,3395718,2016-02-25 21:00:00,2016-02-25T21:00,2016,2,3.6,0.0,Cloudy
03/24/2016,17:00,40.655254,-73.76568,QUEENS,0.0,0.0,0,0,0,0,0,0,3423765,2016-03-24 17:00:00,2016-03-24T17:00,2016,3,9.2,0.0,Cloudy
06/08/2016,15:00,40.66454,-73.82276,QUEENS,1.0,0.0,1,0,0,0,0,0,3458778,2016-06-08 15:00:00,2016-06-08T15:00,2016,6,13.3,0.9,Drizzle
02/27/2016,17:00,40.7025952,-73.8552926,QUEENS,1.0,0.0,0,0,0,0,1,0,3396233,2016-02-27 17:00:00,2016-02-27T17:00,2016,2,3.7,0.0,Clear
12/13/2016,16:00,40.750843,-73.72681,QUEENS,1.0,0.0,0,0,0,0,1,0,3579073,2016-12-13 16:00:00,2016-12-13T16:00,2016,12,3.8,0.0,Cloudy
04/05/2016,8:00,40.75048,-73.758804,QUEENS,0.0,0.0,0,0,0,0,0,0,3427487,2016-04-05 08:00:00,2016-04-05T08:00,2016,4,-2.0,0.0,Clear
04/04/2016,15:00,40.722675,-73.921425,QUEENS,1.0,0.0,0,0,0,0,1,0,3425707,2016-04-04 15:00:00,2016-04-04T15:00,2016,4,8.2,1.6,Light Rain
03/27/2016,15:00,40.7339,-73.9542,QUEENS,2.0,0.0,0,0,0,0,2,0,3422739,2016-03-27 15:00:00,2016-03-27T15:00,2016,3,9.3,0.0,Cloudy
07/31/2016,23:00,40.689976,-73.79955,QUEENS,1.0,0.0,0,0,0,0,1,0,3495973,2016-07-31 23:00:00,2016-07-31T23:00,2016,7,22.7,0.0,Cloudy
09/30/2016,12:00,40.75204,-73.92875,QUEENS,1.0,0.0,0,0,0,0,1,0,3530296,2016-09-30 12:00:00,2016-09-30T12:00,2016,9,14.8,0.0,Cloudy
05/23/2016,16:00,40.76166,-73.84384,QUEENS,1.0,0.0,0,0,0,0,1,0,3445771,2016-05-23 16:00:00,2016-05-23T16:00,2016,5,21.2,0.2,Drizzle
12/03/2016,19:00,40.723427,-73.744026,QUEENS,2.0,0.0,0,0,0,0,2,0,3572587,2016-12-03 19:00:00,2016-12-03T19:00,2016,12,5.1,0.0,Clear
06/20/2016,20:00,40.725636,-73.82884,QUEENS,1.0,0.0,0,0,1,0,0,0,3484942,2016-06-20 20:00:00,2016-06-20T20:00,2016,6,22.7,0.0,Cloudy
08/13/2016,23:00,40.749424,-73.87952,QUEENS,0.0,0.0,0,0,0,0,0,0,3500684,2016-08-13 23:00:00,2016-08-13T23:00,2016,8,27.4,0.0,Cloudy
02/18/2016,19:00,40.7530285,-73.9216199,QUEENS,1.0,0.0,1,0,0,0,0,0,3391571,2016-02-18 19:00:00,2016-02-18T19:00,2016,2,-2.4,0.0,Clear
06/26/2016,23:00,40.758404,-73.844795,QUEENS,1.0,0.0,0,0,0,0,1,0,3469284,2016-06-26 23:00:00,2016-06-26T23:00,2016,6,20.4,0.0,Clear
11/30/2016,17:00,40.69297,-73.78024,QUEENS,1.0,0.0,0,0,0,0,1,0,3570637,2016-11-30 17:00:00,2016-11-30T17:00,2016,11,11.4,1.3,Light Rain
07/24/2016,20:00,40.677353,-73.78096,QUEENS,0.0,0.0,0,0,0,0,0,0,3487813,2016-07-24 20:00:00,2016-07-24T20:00,2016,7,26.3,0.0,Cloudy
05/25/2016,22:00,40.748924,-73.937386,QUEENS,0.0,0.0,0,0,0,0,0,0,3457280,2016-05-25 22:00:00,2016-05-25T22:00,2016,5,19.8,0.0,Clear
09/17/2016,5:00,40.707714,-73.802795,QUEENS,1.0,0.0,0,0,0,0,1,0,3521589,2016-09-17 05:00:00,2016-09-17T05:00,2016,9,17.3,0.0,Cloudy
07/05/2016,20:00,40.688408,-73.7305,QUEENS,1.0,0.0,0,0,0,0,1,0,3475196,2016-07-05 20:00:00,2016-07-05T20:00,2016,7,26.4,0.0,Clear
10/12/2016,15:00,40.75563,-73.73907,QUEENS,0.0,0.0,0,0,0,0,0,0,3542596,2016-10-12 15:00:00,2016-10-12T15:00,2016,10,17.3,0.0,Cloudy
08/07/2016,15:00,40.751392,-73.83561,QUEENS,0.0,0.0,0,0,0,0,0,0,3496071,2016-08-07 15:00:00,2016-08-07T15:00,2016,8,30.0,0.0,Clear
05/20/2016,22:00,40.744358,-73.865036,QUEENS,0.0,0.0,0,0,0,0,0,0,3445492,2016-05-20 22:00:00,2016-05-20T22:00,2016,5,14.2,0.0,Cloudy
07/09/2016,22:00,40.68309,-73.789246,QUEENS,1.0,0.0,0,0,0,0,1,0,3478061,2016-07-09 22:00:00,2016-07-09T22:00,2016,7,20.8,0.5,Drizzle
10/30/2016,0:00,40.747124,-73.94239,QUEENS,0.0,0.0,0,0,0,0,0,0,3550778,2016-10-30 00:00:00,2016-10-30T00:00,2016,10,15.3,0.0,Cloudy
07/17/2016,4:00,40.76577,-73.919,QUEENS,3.0,0.0,0,0,0,0,3,0,3481696,2016-07-17 04:00:00,2016-07-17T04:00,2016,7,22.6,0.0,Cloudy
10/20/2016,19:00,40.749714,-73.93617,QUEENS,0.0,0.0,0,0,0,0,0,0,3544206,2016-10-20 19:00:00,2016-10-20T19:00,2016,10,18.9,0.0,Cloudy
04/07/2016,17:00,40.778214,-73.896835,QUEENS,0.0,0.0,0,0,0,0,0,0,3428976,2016-04-07 17:00:00,2016-04-07T17:00,2016,4,12.8,0.0,Cloudy
06/11/2016,11:00,40.681347,-73.82534,QUEENS,0.0,0.0,0,0,0,0,0,0,3459893,2016-06-11 11:00:00,2016-06-11T11:00,2016,6,25.0,0.0,Cloudy
08/01/2016,18:00,40.688217,-73.83083,QUEENS,0.0,0.0,0,0,0,0,0,0,3493012,2016-08-01 18:00:00,2016-08-01T18:00,2016,8,23.3,0.0,Cloudy
04/01/2016,11:00,40.676548,-73.76838,QUEENS,1.0,0.0,0,0,0,0,1,0,3428366,2016-04-01 11:00:00,2016-04-01T11:00,2016,4,17.2,0.0,Cloudy
08/12/2016,18:00,40.715973,-73.76228,QUEENS,0.0,0.0,0,0,0,0,0,0,3499261,2016-08-12 18:00:00,2016-08-12T18:00,2016,8,29.8,0.0,Cloudy
12/23/2016,21:00,40.707794,-73.89443,QUEENS,1.0,0.0,1,0,0,0,0,0,3591195,2016-12-23 21:00:00,2016-12-23T21:00,2016,12,1.9,0.0,Cloudy
11/14/2016,16:00,40.655598,-73.72644,QUEENS,1.0,0.0,0,0,0,0,1,0,3563468,2016-11-14 16:00:00,2016-11-14T16:00,2016,11,14.2,0.0,Cloudy
08/16/2016,19:00,40.697346,-73.89081,QUEENS,1.0,0.0,0,0,0,0,1,0,3502593,2016-08-16 19:00:00,2016-08-16T19:00,2016,8,27.8,0.0,Cloudy
11/01/2016,12:00,40.7231,-73.87768,QUEENS,1.0,0.0,0,0,1,0,0,0,3552164,2016-11-01 12:00:00,2016-11-01T12:00,2016,11,13.6,0.0,Cloudy
07/11/2016,10:00,40.72294,-73.8002,QUEENS,1.0,0.0,1,0,0,0,0,0,3479365,2016-07-11 10:00:00,2016-07-11T10:00,2016,7,22.9,0.0,Cloudy
03/17/2016,18:00,40.660538,-73.84989,QUEENS,0.0,0.0,0,0,0,0,0,0,3424376,2016-03-17 18:00:00,2016-03-17T18:00,2016,3,12.6,0.0,Cloudy
05/24/2016,10:00,40.74545,-73.70838,QUEENS,1.0,0.0,0,0,0,0,1,0,3451568,2016-05-24 10:00:00,2016-05-24T10:00,2016,5,16.3,0.4,Drizzle
05/27/2016,15:00,40.7201,-73.79038,QUEENS,2.0,0.0,0,0,0,0,2,0,3451809,2016-05-27 15:00:00,2016-05-27T15:00,2016,5,25.3,0.0,Cloudy
06/01/2016,21:00,40.666702,-73.76731,QUEENS,1.0,0.0,0,0,0,0,1,0,3453930,2016-06-01 21:00:00,2016-06-01T21:00,2016,6,17.3,0.0,Clear
06/24/2016,17:00,40.695858,-73.828896,QUEENS,2.0,0.0,0,0,0,0,2,0,3467801,2016-06-24 17:00:00,2016-06-24T17:00,2016,6,23.5,0.0,Cloudy
12/02/2016,15:00,40.76449,-73.930374,QUEENS,1.0,0.0,0,0,0,0,1,0,3572216,2016-12-02 15:00:00,2016-12-02T15:00,2016,12,9.4,0.0,Cloudy
05/10/2016,18:00,40.756405,-73.89792,QUEENS,0.0,0.0,0,0,0,0,0,0,3440314,2016-05-10 18:00:00,2016-05-10T18:00,2016,5,14.1,0.0,Clear
10/26/2016,13:00,40.71948,-73.820206,QUEENS,1.0,0.0,0,0,0,0,1,0,3547509,2016-10-26 13:00:00,2016-10-26T13:00,2016,10,10.1,0.0,Cloudy
10/08/2016,17:00,40.719753,-73.733,QUEENS,1.0,0.0,0,0,0,0,1,0,3536218,2016-10-08 17:00:00,2016-10-08T17:00,2016,10,19.0,0.3,Drizzle
02/22/2016,8:00,40.7840499,-73.7947323,QUEENS,1.0,0.0,1,0,0,0,0,0,3393089,2016-02-22 08:00:00,2016-02-22T08:00,2016,2,0.6,0.0,Clear
02/11/2016,8:00,40.6859884,-73.7287324,QUEENS,1.0,0.0,0,0,0,0,1,0,3387533,2016-02-11 08:00:00,2016-02-11T08:00,2016,2,-5.0,0.0,Clear
12/04/2016,11:00,40.66343,-73.74079,QUEENS,1.0,0.0,0,0,0,0,1,0,3572677,2016-12-04 11:00:00,2016-12-04T11:00,2016,12,4.6,0.0,Clear
12/06/2016,11:00,40.598934,-73.76368,QUEENS,0.0,0.0,0,0,0,0,0,0,3574719,2016-12-06 11:00:00,2016-12-06T11:00,2016,12,5.9,0.0,Cloudy
02/03/2016,11:00,40.7477341,-73.8829986,QUEENS,1.0,0.0,0,0,0,0,1,0,3383207,2016-02-03 11:00:00,2016-02-03T11:00,2016,2,10.1,0.3,Drizzle
06/06/2016,14:00,40.752934,-73.819786,QUEENS,1.0,0.0,1,0,0,0,0,0,3457315,2016-06-06 14:00:00,2016-06-06T14:00,2016,6,27.5,0.0,Cloudy
08/23/2016,11:00,40.746334,-73.89633,QUEENS,1.0,0.0,1,0,0,0,0,0,3505634,2016-08-23 11:00:00,2016-08-23T11:00,2016,8,24.3,0.0,Clear
03/03/2016,12:00,40.7386307,-73.9083249,QUEENS,0.0,0.0,0,0,0,0,0,0,3402004,2016-03-03 12:00:00,2016-03-03T12:00,2016,3,0.8,0.0,Cloudy
10/29/2016,3:00,40.7056,-73.85822,QUEENS,1.0,0.0,0,0,0,0,1,0,3550876,2016-10-29 03:00:00,2016-10-29T03:00,2016,10,3.6,0.0,Cloudy
01/28/2016,14:00,40.7502443,-73.920129,QUEENS,1.0,0.0,0,0,0,0,1,0,3380457,2016-01-28 14:00:00,2016-01-28T14:00,2016,1,2.0,0.0,Cloudy
05/20/2016,16:00,40.69595,-73.86237,QUEENS,1.0,0.0,0,0,0,0,1,0,3451276,2016-05-20 16:00:00,2016-05-20T16:00,2016,5,21.3,0.0,Cloudy
03/25/2016,20:00,40.7339,-73.9542,QUEENS,2.0,0.0,0,0,0,0,2,0,3422736,2016-03-25 20:00:00,2016-03-25T20:00,2016,3,14.1,0.0,Cloudy
05/07/2016,23:00,40.74806,-73.891685,QUEENS,0.0,0.0,0,0,0,0,0,0,3439489,2016-05-07 23:00:00,2016-05-07T23:00,2016,5,9.5,0.0,Clear
06/14/2016,13:00,40.70636,-73.792534,QUEENS,1.0,0.0,0,0,1,0,0,0,3471649,2016-06-14 13:00:00,2016-06-14T13:00,2016,6,24.8,0.0,Clear
07/15/2016,19:00,40.711468,-73.7315,QUEENS,1.0,0.0,0,0,0,0,1,0,3481582,2016-07-15 19:00:00,2016-07-15T19:00,2016,7,29.1,0.0,Clear
10/21/2016,17:00,40.636112,-73.7403,QUEENS,1.0,0.0,1,0,0,0,0,0,3544638,2016-10-21 17:00:00,2016-10-21T17:00,2016,10,20.4,0.0,Cloudy
01/27/2016,15:00,40.7092505,-73.8269131,QUEENS,2.0,0.0,2,0,0,0,0,0,3379197,2016-01-27 15:00:00,2016-01-27T15:00,2016,1,3.3,0.0,Clear
08/28/2016,0:00,40.715816,-73.82147,QUEENS,0.0,0.0,0,0,0,0,0,0,3508559,2016-08-28 00:00:00,2016-08-28T00:00,2016,8,22.7,0.0,Cloudy
11/15/2016,6:00,40.740913,-73.95226,QUEENS,1.0,0.0,0,0,0,0,1,0,3560958,2016-11-15 06:00:00,2016-11-15T06:00,2016,11,8.6,1.4,Light Rain
12/24/2016,23:00,40.732613,-73.80219,QUEENS,1.0,0.0,0,0,0,0,1,0,3589571,2016-12-24 23:00:00,2016-12-24T23:00,2016,12,1.8,0.0,Clear
06/16/2016,14:00,40.714622,-73.90117,QUEENS,1.0,0.0,0,0,0,0,1,0,3462326,2016-06-16 14:00:00,2016-06-16T14:00,2016,6,23.6,0.0,Clear
07/13/2016,8:00,40.707203,-73.79488,QUEENS,1.0,0.0,0,0,1,0,0,0,3479303,2016-07-13 08:00:00,2016-07-13T08:00,2016,7,24.4,0.0,Clear
04/08/2016,14:00,40.677654,-73.82866,QUEENS,1.0,0.0,1,0,0,0,0,0,3424676,2016-04-08 14:00:00,2016-04-08T14:00,2016,4,9.1,0.0,Cloudy
05/06/2016,21:00,40.726864,-73.85344,QUEENS,1.0,0.0,0,0,0,0,1,0,3436481,2016-05-06 21:00:00,2016-05-06T21:00,2016,5,9.6,0.0,Cloudy
09/15/2016,16:00,40.729004,-73.90404,QUEENS,0.0,0.0,0,0,0,0,0,0,3520769,2016-09-15 16:00:00,2016-09-15T16:00,2016,9,22.6,0.0,Clear
04/21/2016,12:00,40.7086,-73.8596,QUEENS,0.0,0.0,0,0,0,0,0,0,3428127,2016-04-21 12:00:00,2016-04-21T12:00,2016,4,19.1,0.0,Cloudy
05/13/2016,23:00,40.713394,-73.85956,QUEENS,3.0,0.0,0,0,0,0,3,0,3442653,2016-05-13 23:00:00,2016-05-13T23:00,2016,5,14.8,0.0,Cloudy
11/17/2016,14:00,40.6711,-73.9364,QUEENS,0.0,0.0,0,0,0,0,0,0,3564912,2016-11-17 14:00:00,2016-11-17T14:00,2016,11,15.3,0.0,Clear
04/19/2016,14:00,40.68354,-73.81065,QUEENS,0.0,0.0,0,0,0,0,0,0,3451734,2016-04-19 14:00:00,2016-04-19T14:00,2016,4,19.4,0.0,Cloudy
06/22/2016,9:00,40.6981,-73.76203,QUEENS,3.0,0.0,0,0,0,0,3,0,3466298,2016-06-22 09:00:00,2016-06-22T09:00,2016,6,24.4,0.0,Clear
12/25/2016,19:00,40.755524,-73.833405,QUEENS,1.0,0.0,1,0,0,0,0,0,3586764,2016-12-25 19:00:00,2016-12-25T19:00,2016,12,3.1,0.0,Clear
10/13/2016,12:00,40.767174,-73.93765,QUEENS,0.0,0.0,0,0,0,0,0,0,3539366,2016-10-13 12:00:00,2016-10-13T12:00,2016,10,19.6,0.0,Cloudy
10/12/2016,9:00,40.746967,-73.75714,QUEENS,0.0,0.0,0,0,0,0,0,0,3542486,2016-10-12 09:00:00,2016-10-12T09:00,2016,10,15.7,0.0,Cloudy
01/28/2016,8:00,40.7329792,-73.8443478,QUEENS,3.0,0.0,0,0,0,0,3,0,3379340,2016-01-28 08:00:00,2016-01-28T08:00,2016,1,-6.6,0.0,Clear
07/24/2016,21:00,40.665245,-73.73709,QUEENS,1.0,0.0,0,0,1,0,0,0,3487594,2016-07-24 21:00:00,2016-07-24T21:00,2016,7,25.5,0.0,Cloudy
07/27/2016,13:00,40.764008,-73.8278,QUEENS,0.0,0.0,0,0,0,0,0,0,3489753,2016-07-27 13:00:00,2016-07-27T13:00,2016,7,31.9,0.0,Cloudy
03/21/2016,22:00,40.580395,-73.828064,QUEENS,0.0,0.0,0,0,0,0,0,0,3421956,2016-03-21 22:00:00,2016-03-21T22:00,2016,3,2.8,0.0,Clear
07/08/2016,0:00,40.69407,-73.82802,QUEENS,2.0,0.0,0,0,0,0,2,0,3477134,2016-07-08 00:00:00,2016-07-08T00:00,2016,7,24.9,0.0,Clear
03/08/2016,10:00,40.7018598,-73.8819106,QUEENS,0.0,0.0,0,0,0,0,0,0,3401929,2016-03-08 10:00:00,2016-03-08T10:00,2016,3,11.8,0.0,Clear
09/30/2016,0:00,40.763515,-73.9142,QUEENS,1.0,0.0,0,0,1,0,0,0,3530386,2016-09-30 00:00:00,2016-09-30T00:00,2016,9,14.7,0.6,Drizzle
07/21/2016,23:00,40.66615,-73.80575,QUEENS,1.0,0.0,0,0,0,0,1,0,3485814,2016-07-21 23:00:00,2016-07-21T23:00,2016,7,24.3,0.0,Cloudy
11/14/2016,0:00,40.761623,-73.82208,QUEENS,1.0,0.0,1,0,0,0,0,0,3560017,2016-11-14 00:00:00,2016-11-14T00:00,2016,11,5.8,0.0,Clear
11/26/2016,21:00,40.754807,-73.84499,QUEENS,1.0,0.0,0,0,0,0,1,0,3568310,2016-11-26 21:00:00,2016-11-26T21:00,2016,11,4.4,0.0,Clear
10/16/2016,19:00,40.680115,-73.75324,QUEENS,1.0,0.0,1,0,0,0,0,0,3548235,2016-10-16 19:00:00,2016-10-16T19:00,2016,10,17.5,0.0,Cloudy
07/14/2016,17:00,40.739674,-73.934586,QUEENS,0.0,0.0,0,0,0,0,0,0,3480667,2016-07-14 17:00:00,2016-07-14T17:00,2016,7,28.0,0.9,Drizzle
04/30/2016,19:00,40.774197,-73.837875,QUEENS,0.0,0.0,0,0,0,0,0,0,3433041,2016-04-30 19:00:00,2016-04-30T19:00,2016,4,10.5,0.0,Clear
11/09/2016,14:00,40.702312,-73.78478,QUEENS,1.0,0.0,1,0,0,0,0,0,3556838,2016-11-09 14:00:00,2016-11-09T14:00,2016,11,12.6,0.3,Drizzle
08/03/2016,12:00,40.73061,-73.89147,QUEENS,0.0,0.0,0,0,0,0,0,0,3494309,2016-08-03 12:00:00,2016-08-03T12:00,2016,8,24.3,0.0,Clear
01/27/2016,21:00,40.7208226,-73.892256,QUEENS,1.0,0.0,0,0,0,0,1,0,3379224,2016-01-27 21:00:00,2016-01-27T21:00,2016,1,-4.2,0.0,Clear
12/20/2016,17:00,40.70253,-73.8143,QUEENS,1.0,0.0,0,0,0,0,1,0,3584375,2016-12-20 17:00:00,2016-12-20T17:00,2016,12,-1.5,0.0,Clear
02/04/2016,12:00,40.7653588,-73.7442823,QUEENS,1.0,0.0,0,0,0,0,1,0,3383793,2016-02-04 12:00:00,2016-02-04T12:00,2016,2,10.6,0.0,Cloudy
01/06/2016,15:00,40.6653874,-73.7449215,QUEENS,1.0,0.0,1,0,0,0,0,0,3367310,2016-01-06 15:00:00,2016-01-06T15:00,2016,1,3.3,0.0,Clear
11/20/2016,20:00,40.749393,-73.7199,QUEENS,2.0,0.0,2,0,0,0,0,0,3564251,2016-11-20 20:00:00,2016-11-20T20:00,2016,11,3.2,0.0,Cloudy
03/30/2016,19:00,40.720276,-73.80797,QUEENS,0.0,0.0,0,0,0,0,0,0,3425061,2016-03-30 19:00:00,2016-03-30T19:00,2016,3,6.4,0.0,Cloudy
07/29/2016,15:00,40.69115,-73.83202,QUEENS,0.0,0.0,0,0,0,0,0,0,3492338,2016-07-29 15:00:00,2016-07-29T15:00,2016,7,27.9,0.0,Clear
12/24/2016,17:00,40.68574,-73.82774,QUEENS,1.0,0.0,1,0,0,0,0,0,3586073,2016-12-24 17:00:00,2016-12-24T17:00,2016,12,5.1,0.0,Clear
02/22/2016,8:00,40.7824378,-73.7765382,QUEENS,1.0,0.0,0,0,0,0,1,0,3393091,2016-02-22 08:00:00,2016-02-22T08:00,2016,2,0.7,0.0,Clear
03/01/2016,17:00,40.6668627,-73.8044903,QUEENS,0.0,0.0,0,0,0,0,0,0,3397624,2016-03-01 17:00:00,2016-03-01T17:00,2016,3,5.9,0.0,Cloudy
09/15/2016,8:00,40.69125,-73.85087,QUEENS,1.0,0.0,0,0,0,0,1,0,3520056,2016-09-15 08:00:00,2016-09-15T08:00,2016,9,17.8,0.0,Clear
08/26/2016,11:00,40.66675,-73.779945,QUEENS,1.0,0.0,0,0,0,0,1,0,3508071,2016-08-26 11:00:00,2016-08-26T11:00,2016,8,30.0,0.1,Drizzle
12/27/2016,17:00,40.66685,-73.73672,QUEENS,0.0,0.0,0,0,0,0,0,0,3587805,2016-12-27 17:00:00,2016-12-27T17:00,2016,12,10.6,0.0,Clear
04/23/2016,16:00,40.57587,-73.96865,QUEENS,1.0,0.0,1,0,0,0,0,0,3425383,2016-04-23 16:00:00,2016-04-23T16:00,2016,4,19.6,0.0,Cloudy
09/16/2016,9:00,40.67927,-73.745605,QUEENS,2.0,0.0,0,0,0,0,2,0,3521325,2016-09-16 09:00:00,2016-09-16T09:00,2016,9,19.7,0.0,Cloudy
08/05/2016,19:00,40.750916,-73.87317,QUEENS,1.0,0.0,1,0,0,0,0,0,3496932,2016-08-05 19:00:00,2016-08-05T19:00,2016,8,24.1,0.0,Cloudy
12/14/2016,0:00,40.749714,-73.93617,QUEENS,1.0,0.0,0,0,0,0,1,0,3580213,2016-12-14 00:00:00,2016-12-14T00:00,2016,12,1.4,0.0,Cloudy
03/19/2016,16:00,40.75361,-73.78901,QUEENS,4.0,0.0,0,0,0,0,4,0,3427306,2016-03-19 16:00:00,2016-03-19T16:00,2016,3,7.3,0.0,Cloudy
06/13/2016,7:00,40.68866,-73.829185,QUEENS,3.0,0.0,0,0,0,0,3,0,3460788,2016-06-13 07:00:00,2016-06-13T07:00,2016,6,15.5,0.0,Clear
06/02/2016,10:00,40.763695,-73.81911,QUEENS,1.0,0.0,1,0,0,0,0,0,3454044,2016-06-02 10:00:00,2016-06-02T10:00,2016,6,21.4,0.0,Cloudy
06/22/2016,0:00,40.725616,-73.851036,QUEENS,1.0,0.0,0,0,0,0,1,0,3467036,2016-06-22 00:00:00,2016-06-22T00:00,2016,6,20.5,0.0,Clear
06/02/2016,22:00,40.741383,-73.708855,QUEENS,0.0,0.0,0,0,0,0,0,0,3454700,2016-06-02 22:00:00,2016-06-02T22:00,2016,6,17.1,0.0,Cloudy
04/23/2016,5:00,40.69814,-73.85274,QUEENS,1.0,0.0,0,0,0,0,1,0,3422571,2016-04-23 05:00:00,2016-04-23T05:00,2016,4,14.5,0.2,Drizzle
04/08/2016,15:00,40.71071,-73.793045,QUEENS,0.0,0.0,0,0,0,0,0,0,3425193,2016-04-08 15:00:00,2016-04-08T15:00,2016,4,9.2,0.0,Cloudy
12/19/2016,10:00,40.683777,-73.76975,QUEENS,1.0,0.0,1,0,0,0,0,0,3585483,2016-12-19 10:00:00,2016-12-19T10:00,2016,12,-3.8,0.0,Clear
09/19/2016,0:00,40.71437,-73.7302,QUEENS,0.0,0.0,0,0,0,0,0,0,3523231,2016-09-19 00:00:00,2016-09-19T00:00,2016,9,22.5,0.0,Cloudy
10/31/2016,15:00,40.746334,-73.89633,QUEENS,1.0,0.0,0,0,1,0,0,0,3553012,2016-10-31 15:00:00,2016-10-31T15:00,2016,10,11.9,0.0,Clear
08/27/2016,17:00,40.75361,-73.829544,QUEENS,1.0,0.0,0,0,0,0,1,0,3620730,2016-08-27 17:00:00,2016-08-27T17:00,2016,8,27.8,0.0,Cloudy
04/20/2016,13:00,40.71949,-73.8506,QUEENS,2.0,0.0,0,0,0,0,2,0,3428118,2016-04-20 13:00:00,2016-04-20T13:00,2016,4,15.8,0.0,Clear
04/15/2016,23:00,40.7681,-73.90512,QUEENS,1.0,0.0,0,0,0,0,1,0,3429079,2016-04-15 23:00:00,2016-04-15T23:00,2016,4,7.3,0.0,Clear
02/12/2016,23:00,40.7473426,-73.8867166,QUEENS,1.0,0.0,1,0,0,0,0,0,3388674,2016-02-12 23:00:00,2016-02-12T23:00,2016,2,-8.0,0.0,Cloudy
02/27/2016,14:00,40.7582757,-73.9333522,QUEENS,2.0,0.0,0,0,0,0,2,0,3396348,2016-02-27 14:00:00,2016-02-27T14:00,2016,2,3.9,0.0,Clear
04/18/2016,21:00,40.72221,-73.90216,QUEENS,0.0,0.0,0,0,0,0,0,0,3423509,2016-04-18 21:00:00,2016-04-18T21:00,2016,4,12.6,0.0,Cloudy
10/11/2016,11:00,40.761116,-73.88734,QUEENS,1.0,0.0,0,0,0,0,1,0,3538765,2016-10-11 11:00:00,2016-10-11T11:00,2016,10,14.5,0.0,Clear
04/24/2016,16:00,40.57869,-73.83762,QUEENS,0.0,0.0,0,0,0,0,0,0,3422017,2016-04-24 16:00:00,2016-04-24T16:00,2016,4,17.5,0.0,Clear
08/27/2016,19:00,40.69843,-73.83893,QUEENS,1.0,0.0,0,0,0,0,1,0,3508515,2016-08-27 19:00:00,2016-08-27T19:00,2016,8,25.4,0.0,Cloudy
05/29/2016,16:00,40.767326,-73.92986,QUEENS,1.0,0.0,0,0,1,0,0,0,3452451,2016-05-29 16:00:00,2016-05-29T16:00,2016,5,26.3,0.0,Cloudy
05/10/2016,10:00,40.66484,-73.734955,QUEENS,0.0,0.0,0,0,0,0,0,0,3439017,2016-05-10 10:00:00,2016-05-10T10:00,2016,5,13.4,0.0,Cloudy
03/29/2016,15:00,40.57896,-73.84566,QUEENS,0.0,0.0,0,0,0,0,0,0,3421970,2016-03-29 15:00:00,2016-03-29T15:00,2016,3,11.1,0.0,Clear
12/19/2016,20:00,40.740784,-73.89893,QUEENS,1.0,0.0,0,0,0,0,1,0,3583211,2016-12-19 20:00:00,2016-12-19T20:00,2016,12,-3.6,0.0,Cloudy
12/13/2016,20:00,40.721066,-73.861916,QUEENS,2.0,0.0,0,0,0,0,2,0,3579103,2016-12-13 20:00:00,2016-12-13T20:00,2016,12,2.8,0.0,Cloudy
06/30/2016,16:00,40.77227,-73.89576,QUEENS,1.0,0.0,1,0,0,0,0,0,3474088,2016-06-30 16:00:00,2016-06-30T16:00,2016,6,28.2,0.0,Clear
10/05/2016,20:00,40.754276,-73.90902,QUEENS,2.0,0.0,0,0,0,0,2,0,3534464,2016-10-05 20:00:00,2016-10-05T20:00,2016,10,14.6,0.0,Clear
03/26/2016,14:00,40.67209,-73.73524,QUEENS,2.0,0.0,0,0,0,0,2,0,3423806,2016-03-26 14:00:00,2016-03-26T14:00,2016,3,9.7,0.0,Cloudy
04/01/2016,9:00,40.73602,-73.9116,QUEENS,2.0,0.0,0,0,0,0,2,0,3428904,2016-04-01 09:00:00,2016-04-01T09:00,2016,4,15.8,0.0,Cloudy
09/22/2016,16:00,40.708,-73.907166,QUEENS,0.0,0.0,0,0,0,0,0,0,3526917,2016-09-22 16:00:00,2016-09-22T16:00,2016,9,25.9,0.0,Clear
07/28/2016,10:00,40.76289,-73.805534,QUEENS,1.0,0.0,0,0,0,0,1,0,3489770,2016-07-28 10:00:00,2016-07-28T10:00,2016,7,30.7,0.0,Cloudy
01/24/2016,14:00,40.7118379,-73.9174877,QUEENS,0.0,0.0,0,0,0,0,0,0,3376948,2016-01-24 14:00:00,2016-01-24T14:00,2016,1,-3.9,0.0,Clear
11/14/2016,17:00,40.700047,-73.75457,QUEENS,1.0,0.0,0,0,0,0,1,0,3560862,2016-11-14 17:00:00,2016-11-14T17:00,2016,11,13.0,0.0,Cloudy
07/11/2016,8:00,40.739094,-73.91762,QUEENS,1.0,0.0,0,0,0,0,1,0,3484055,2016-07-11 08:00:00,2016-07-11T08:00,2016,7,20.9,0.0,Cloudy
06/22/2016,19:00,40.66561,-73.73568,QUEENS,4.0,0.0,0,0,0,0,4,0,3466940,2016-06-22 19:00:00,2016-06-22T19:00,2016,6,26.3,0.0,Clear
09/27/2016,15:00,40.758595,-73.87452,QUEENS,1.0,0.0,0,0,0,0,1,0,3528442,2016-09-27 15:00:00,2016-09-27T15:00,2016,9,22.7,0.0,Cloudy
11/08/2016,16:00,40.704853,-73.791664,QUEENS,0.0,0.0,0,0,0,0,0,0,3556609,2016-11-08 16:00:00,2016-11-08T16:00,2016,11,16.5,0.0,Clear
03/26/2016,21:00,40.693592,-73.82971,QUEENS,1.0,0.0,0,0,0,0,1,0,3422275,2016-03-26 21:00:00,2016-03-26T21:00,2016,3,5.2,0.0,Cloudy
11/30/2016,21:00,40.751637,-73.90985,QUEENS,1.0,0.0,0,0,0,0,1,0,3570631,2016-11-30 21:00:00,2016-11-30T21:00,2016,11,10.5,1.4,Light Rain
09/22/2016,23:00,40.713436,-73.73627,QUEENS,0.0,0.0,0,0,0,0,0,0,3525324,2016-09-22 23:00:00,2016-09-22T23:00,2016,9,19.0,0.0,Clear
06/24/2016,10:00,40.693768,-73.80052,QUEENS,3.0,0.0,0,0,0,0,3,0,3467450,2016-06-24 10:00:00,2016-06-24T10:00,2016,6,25.0,0.0,Clear
11/20/2016,9:00,40.682087,-73.85367,QUEENS,1.0,0.0,1,0,0,0,0,0,3564826,2016-11-20 09:00:00,2016-11-20T09:00,2016,11,3.7,0.0,Clear
12/01/2016,19:00,40.763687,-73.81444,QUEENS,1.0,0.0,1,0,0,0,0,0,3571178,2016-12-01 19:00:00,2016-12-01T19:00,2016,12,7.2,0.0,Cloudy
05/24/2016,9:00,40.69044,-73.77636,QUEENS,1.0,0.0,0,0,0,0,1,0,3452302,2016-05-24 09:00:00,2016-05-24T09:00,2016,5,16.2,0.8,Drizzle
04/25/2016,19:00,40.675014,-73.7528,QUEENS,1.0,0.0,0,0,0,0,1,0,3424346,2016-04-25 19:00:00,2016-04-25T19:00,2016,4,12.8,0.0,Cloudy
06/17/2016,19:00,40.607292,-73.75141,QUEENS,3.0,0.0,0,0,0,0,3,0,3465239,2016-06-17 19:00:00,2016-06-17T19:00,2016,6,19.6,0.0,Clear
05/24/2016,0:00,40.762703,-73.80179,QUEENS,0.0,0.0,0,0,0,0,0,0,3451952,2016-05-24 00:00:00,2016-05-24T00:00,2016,5,14.0,0.2,Drizzle
01/07/2016,15:00,40.6911355,-73.8218324,QUEENS,0.0,0.0,0,0,0,0,0,0,3366786,2016-01-07 15:00:00,2016-01-07T15:00,2016,1,5.1,0.0,Cloudy
12/02/2016,17:00,40.666855,-73.80425,QUEENS,0.0,0.0,0,0,0,0,0,0,3571964,2016-12-02 17:00:00,2016-12-02T17:00,2016,12,7.7,0.0,Cloudy
01/28/2016,12:00,40.7403404,-73.9363437,QUEENS,1.0,0.0,0,0,0,0,1,0,3379740,2016-01-28 12:00:00,2016-01-28T12:00,2016,1,-1.0,0.0,Clear
05/29/2016,19:00,40.719933,-73.7807,QUEENS,1.0,0.0,0,0,0,0,1,0,3447378,2016-05-29 19:00:00,2016-05-29T19:00,2016,5,20.2,0.0,Cloudy
09/18/2016,15:00,40.741135,-73.93524,QUEENS,1.0,0.0,0,0,0,0,1,0,3522526,2016-09-18 15:00:00,2016-09-18T15:00,2016,9,28.5,0.0,Cloudy
03/01/2016,14:00,40.7857658,-73.8523674,QUEENS,1.0,0.0,1,0,0,0,0,0,3398382,2016-03-01 14:00:00,2016-03-01T14:00,2016,3,8.7,0.0,Clear
08/15/2016,20:00,40.712166,-73.74211,QUEENS,1.0,0.0,0,0,0,0,1,0,3501255,2016-08-15 20:00:00,2016-08-15T20:00,2016,8,27.1,0.0,Clear
03/03/2016,13:00,40.7423432,-73.8539324,QUEENS,0.0,0.0,0,0,0,0,0,0,3399643,2016-03-03 13:00:00,2016-03-03T13:00,2016,3,1.8,0.0,Cloudy
08/02/2016,12:00,40.595562,-73.74711,QUEENS,1.0,0.0,0,0,0,0,1,0,3493634,2016-08-02 12:00:00,2016-08-02T12:00,2016,8,23.9,0.0,Cloudy
06/10/2016,8:00,40.677902,-73.829956,QUEENS,1.0,0.0,0,0,0,0,1,0,3459537,2016-06-10 08:00:00,2016-06-10T08:00,2016,6,16.3,0.0,Clear
08/22/2016,14:00,40.746902,-73.834694,QUEENS,1.0,0.0,0,0,0,0,1,0,3506435,2016-08-22 14:00:00,2016-08-22T14:00,2016,8,25.9,0.0,Clear
12/29/2016,22:00,40.775604,-73.91136,QUEENS,0.0,0.0,0,0,0,0,0,0,3589296,2016-12-29 22:00:00,2016-12-29T22:00,2016,12,0.1,0.0,Clear
07/01/2016,22:00,40.687904,-73.84971,QUEENS,0.0,0.0,0,0,0,0,0,0,3473171,2016-07-01 22:00:00,2016-07-01T22:00,2016,7,22.6,0.0,Clear
03/09/2016,8:00,40.7396685,-73.8988257,QUEENS,1.0,0.0,0,0,0,0,1,0,3402619,2016-03-09 08:00:00,2016-03-09T08:00,2016,3,8.3,0.0,Clear
01/23/2016,2:00,40.7570971,-73.9150061,QUEENS,0.0,0.0,0,0,0,0,0,0,3377131,2016-01-23 02:00:00,2016-01-23T02:00,2016,1,-3.2,0.8,Heavy Snow
08/30/2016,14:00,40.71388,-73.75404,QUEENS,1.0,0.0,0,0,0,0,1,0,3511462,2016-08-30 14:00:00,2016-08-30T14:00,2016,8,27.7,0.0,Cloudy
09/14/2016,22:00,40.76141,-73.884544,QUEENS,4.0,0.0,0,0,0,0,4,0,3521340,2016-09-14 22:00:00,2016-09-14T22:00,2016,9,22.8,0.0,Clear
09/20/2016,11:00,40.744453,-73.92983,QUEENS,1.0,0.0,0,0,0,0,1,0,3524923,2016-09-20 11:00:00,2016-09-20T11:00,2016,9,24.6,0.0,Cloudy
10/28/2016,7:00,40.73428,-73.779526,QUEENS,1.0,0.0,0,0,0,0,1,0,3549345,2016-10-28 07:00:00,2016-10-28T07:00,2016,10,6.7,0.0,Clear
02/29/2016,9:00,40.6656299,-73.7392073,QUEENS,2.0,0.0,0,0,0,0,2,0,3396807,2016-02-29 09:00:00,2016-02-29T09:00,2016,2,10.1,0.0,Clear
04/04/2016,15:00,40.762665,-73.73364,QUEENS,1.0,0.0,0,0,0,0,1,0,3427728,2016-04-04 15:00:00,2016-04-04T15:00,2016,4,6.7,1.7,Light Rain
03/14/2016,20:00,40.7476924,-73.8937969,QUEENS,1.0,0.0,1,0,0,0,0,0,3429275,2016-03-14 20:00:00,2016-03-14T20:00,2016,3,6.1,0.0,Cloudy
10/29/2016,22:00,40.613476,-74.09793,STATEN ISLAND,1.0,0.0,0,0,0,0,1,0,3551320,2016-10-29 22:00:00,2016-10-29T22:00,2016,10,14.8,0.0,Cloudy
12/11/2016,15:00,40.57241,-74.09564,STATEN ISLAND,1.0,0.0,0,0,0,0,1,0,3577970,2016-12-11 15:00:00,2016-12-11T15:00,2016,12,0.9,0.0,Cloudy
02/07/2016,17:00,40.5593847,-74.1539234,STATEN ISLAND,1.0,0.0,0,0,0,0,1,0,3385439,2016-02-07 17:00:00,2016-02-07T17:00,2016,2,3.1,0.0,Cloudy
09/26/2016,8:00,40.587067,-74.09162,STATEN ISLAND,6.0,0.0,0,0,0,0,6,0,3528378,2016-09-26 08:00:00,2016-09-26T08:00,2016,9,17.0,0.0,Clear
02/15/2016,13:00,40.6306952,-74.1046983,STATEN ISLAND,1.0,0.0,0,0,0,0,1,0,3389846,2016-02-15 13:00:00,2016-02-15T13:00,2016,2,0.4,0.1,Light Snow
12/29/2016,4:00,40.6453,-74.10441,STATEN ISLAND,0.0,0.0,0,0,0,0,0,0,3589133,2016-12-29 04:00:00,2016-12-29T04:00,2016,12,-1.6,0.0,Cloudy
09/13/2016,10:00,40.60645,-74.06669,STATEN ISLAND,2.0,0.0,0,0,0,0,2,0,3519391,2016-09-13 10:00:00,2016-09-13T10:00,2016,9,23.9,0.0,Clear
08/14/2016,22:00,40.613075,-74.12257,STATEN ISLAND,0.0,0.0,0,0,0,0,0,0,3502126,2016-08-14 22:00:00,2016-08-14T22:00,2016,8,27.6,0.0,Cloudy
07/14/2016,13:00,40.614258,-74.12258,STATEN ISLAND,0.0,0.0,0,0,0,0,0,0,3480776,2016-07-14 13:00:00,2016-07-14T13:00,2016,7,30.4,0.0,Clear
12/10/2016,13:00,40.60514,-74.10183,STATEN ISLAND,0.0,0.0,0,0,0,0,0,0,3577670,2016-12-10 13:00:00,2016-12-10T13:00,2016,12,1.1,0.0,Cloudy
09/23/2016,20:00,40.605473,-74.064644,STATEN ISLAND,1.0,0.0,0,0,0,0,1,0,3552098,2016-09-23 20:00:00,2016-09-23T20:00,2016,9,23.3,0.0,Clear
10/31/2016,17:00,40.5575,-74.127075,STATEN ISLAND,1.0,0.0,0,0,1,0,0,0,3551291,2016-10-31 17:00:00,2016-10-31T17:00,2016,10,11.1,0.0,Cloudy
02/20/2016,11:00,40.5217311,-74.2350426,STATEN ISLAND,2.0,0.0,0,0,0,0,2,0,3392605,2016-02-20 11:00:00,2016-02-20T11:00,2016,2,11.9,0.0,Cloudy
06/15/2016,10:00,40.62782,-74.12126,STATEN ISLAND,0.0,0.0,0,0,0,0,0,0,3462496,2016-06-15 10:00:00,2016-06-15T10:00,2016,6,25.9,0.0,Clear
09/27/2016,0:00,40.571987,-74.10823,STATEN ISLAND,1.0,0.0,0,0,0,0,1,0,3528381,2016-09-27 00:00:00,2016-09-27T00:00,2016,9,19.2,0.0,Cloudy
01/10/2016,18:00,40.640569,-74.1179917,STATEN ISLAND,1.0,0.0,0,0,0,0,1,0,3369754,2016-01-10 18:00:00,2016-01-10T18:00,2016,1,10.3,0.0,Clear
02/11/2016,22:00,40.5637738,-74.1558518,STATEN ISLAND,2.0,0.0,0,0,0,0,2,0,3388204,2016-02-11 22:00:00,2016-02-11T22:00,2016,2,-6.5,0.0,Clear
04/07/2016,8:00,40.55901,-74.16565,STATEN ISLAND,1.0,0.0,0,0,0,0,1,0,3430616,2016-04-07 08:00:00,2016-04-07T08:00,2016,4,12.8,0.1,Drizzle
03/03/2016,8:00,40.6440727,-74.0777656,STATEN ISLAND,1.0,0.0,1,0,0,0,0,0,3399133,2016-03-03 08:00:00,2016-03-03T08:00,2016,3,-2.0,0.0,Clear
06/27/2016,9:00,40.607895,-74.10154,STATEN ISLAND,2.0,0.0,0,0,0,0,2,0,3471066,2016-06-27 09:00:00,2016-06-27T09:00,2016,6,23.3,0.0,Cloudy
11/08/2016,11:00,40.59791,-74.08361,STATEN ISLAND,1.0,0.0,0,0,0,0,1,0,3557165,2016-11-08 11:00:00,2016-11-08T11:00,2016,11,14.8,0.0,Clear
01/05/2016,8:00,40.5077536,-74.2300632,STATEN ISLAND,0.0,0.0,0,0,0,0,0,0,3365763,2016-01-05 08:00:00,2016-01-05T08:00,2016,1,-9.5,0.0,Clear
01/11/2016,7:00,40.5502524,-74.2213144,STATEN ISLAND,1.0,0.0,0,0,0,0,1,0,3369042,2016-01-11 07:00:00,2016-01-11T07:00,2016,1,-1.1,0.0,Clear
12/23/2016,10:00,40.61423,-74.116905,STATEN ISLAND,1.0,0.0,0,0,0,0,1,0,3587264,2016-12-23 10:00:00,2016-12-23T10:00,2016,12,3.4,0.0,Cloudy
04/30/2016,15:00,40.57286,-74.094124,STATEN ISLAND,1.0,0.0,0,0,1,0,0,0,4022402,2016-04-30 15:00:00,2016-04-30T15:00,2016,4,15.4,0.0,Cloudy
05/05/2016,8:00,40.627056,-74.11749,STATEN ISLAND,0.0,0.0,0,0,0,0,0,0,3435995,2016-05-05 08:00:00,2016-05-05T08:00,2016,5,8.2,0.0,Cloudy
06/22/2016,6:00,40.512672,-74.24378,STATEN ISLAND,0.0,0.0,0,0,0,0,0,0,3466400,2016-06-22 06:00:00,2016-06-22T06:00,2016,6,19.8,0.0,Clear
05/20/2016,0:00,40.633858,-74.12596,STATEN ISLAND,1.0,0.0,0,0,0,0,1,0,3452562,2016-05-20 00:00:00,2016-05-20T00:00,2016,5,12.7,0.0,Clear
12/12/2016,7:00,40.634567,-74.1172,STATEN ISLAND,1.0,0.0,1,0,0,0,0,0,3578564,2016-12-12 07:00:00,2016-12-12T07:00,2016,12,5.2,1.8,Light Rain
12/24/2016,13:00,40.624603,-74.129654,STATEN ISLAND,0.0,0.0,0,0,0,0,0,0,3587741,2016-12-24 13:00:00,2016-12-24T13:00,2016,12,6.6,0.2,Drizzle
06/05/2016,12:00,40.534325,-74.193016,STATEN ISLAND,1.0,0.0,0,0,0,0,1,0,3456667,2016-06-05 12:00:00,2016-06-05T12:00,2016,6,20.8,0.4,Drizzle
10/21/2016,19:00,40.643524,-74.07615,STATEN ISLAND,1.0,0.0,0,0,0,0,1,0,3547176,2016-10-21 19:00:00,2016-10-21T19:00,2016,10,19.2,0.0,Cloudy
07/25/2016,15:00,40.571987,-74.10823,STATEN ISLAND,2.0,0.0,2,0,0,0,0,0,3488652,2016-07-25 15:00:00,2016-07-25T15:00,2016,7,34.2,0.0,Cloudy
11/04/2016,9:00,40.638092,-74.0779,STATEN ISLAND,1.0,0.0,1,0,0,0,0,0,3556716,2016-11-04 09:00:00,2016-11-04T09:00,2016,11,11.9,0.0,Clear
11/13/2016,20:00,40.62494,-74.078545,STATEN ISLAND,1.0,0.0,1,0,0,0,0,0,3560486,2016-11-13 20:00:00,2016-11-13T20:00,2016,11,8.4,0.0,Clear
09/19/2016,7:00,40.595364,-74.09723,STATEN ISLAND,1.0,0.0,0,0,0,0,1,0,3523333,2016-09-19 07:00:00,2016-09-19T07:00,2016,9,21.1,0.8,Drizzle
10/18/2016,8:00,40.54055,-74.19321,STATEN ISLAND,1.0,0.0,1,0,0,0,0,0,3542705,2016-10-18 08:00:00,2016-10-18T08:00,2016,10,18.8,0.0,Clear
08/24/2016,19:00,40.618282,-74.105194,STATEN ISLAND,0.0,0.0,0,0,0,0,0,0,3507879,2016-08-24 19:00:00,2016-08-24T19:00,2016,8,25.4,0.0,Clear
06/08/2016,13:00,40.54396,-74.19184,STATEN ISLAND,0.0,0.0,0,0,0,0,0,0,3459670,2016-06-08 13:00:00,2016-06-08T13:00,2016,6,13.9,4.3,Heavy Rain
04/11/2016,16:00,40.628555,-74.107155,STATEN ISLAND,0.0,0.0,0,0,0,0,0,0,3429785,2016-04-11 16:00:00,2016-04-11T16:00,2016,4,16.3,0.0,Cloudy
11/01/2016,9:00,40.633953,-74.085754,STATEN ISLAND,1.0,0.0,0,0,0,0,1,0,3553554,2016-11-01 09:00:00,2016-11-01T09:00,2016,11,10.4,0.0,Clear
09/17/2016,10:00,40.535923,-74.16612,STATEN ISLAND,2.0,0.0,0,0,0,0,2,0,3521970,2016-09-17 10:00:00,2016-09-17T10:00,2016,9,22.3,0.0,Cloudy
05/26/2016,13:00,40.57477,-74.097626,STATEN ISLAND,1.0,0.0,0,0,0,0,1,0,3452726,2016-05-26 13:00:00,2016-05-26T13:00,2016,5,30.8,0.0,Cloudy
06/18/2016,0:00,40.580315,-74.11368,STATEN ISLAND,3.0,0.0,0,0,0,0,3,0,3465470,2016-06-18 00:00:00,2016-06-18T00:00,2016,6,14.9,0.0,Clear
11/01/2016,22:00,40.57383,-74.121704,STATEN ISLAND,2.0,0.0,0,0,0,0,2,0,3552585,2016-11-01 22:00:00,2016-11-01T22:00,2016,11,10.3,0.0,Cloudy
10/09/2016,6:00,40.647312,-74.08069,STATEN ISLAND,1.0,0.0,0,0,0,0,1,0,3536786,2016-10-09 06:00:00,2016-10-09T06:00,2016,10,13.8,1.5,Light Rain
09/12/2016,14:00,40.646023,-74.081436,STATEN ISLAND,0.0,0.0,0,0,0,0,0,0,3519383,2016-09-12 14:00:00,2016-09-12T14:00,2016,9,24.0,0.0,Clear
08/30/2016,13:00,40.511734,-74.21044,STATEN ISLAND,1.0,0.0,0,0,0,0,1,0,3511056,2016-08-30 13:00:00,2016-08-30T13:00,2016,8,28.7,0.0,Cloudy
12/05/2016,15:00,40.577946,-74.102325,STATEN ISLAND,1.0,0.0,0,0,0,0,1,0,3573761,2016-12-05 15:00:00,2016-12-05T15:00,2016,12,8.6,0.0,Clear
04/02/2016,2:00,40.645367,-74.08075,STATEN ISLAND,0.0,0.0,0,0,0,0,0,0,3410368,2016-04-02 02:00:00,2016-04-02T02:00,2016,4,13.4,0.1,Drizzle
04/25/2016,13:00,40.62046,-74.07641,STATEN ISLAND,0.0,0.0,0,0,0,0,0,0,3429890,2016-04-25 13:00:00,2016-04-25T13:00,2016,4,20.0,0.0,Cloudy
08/14/2016,15:00,40.546093,-74.21274,STATEN ISLAND,1.0,0.0,0,0,0,0,1,0,3501418,2016-08-14 15:00:00,2016-08-14T15:00,2016,8,33.4,0.0,Cloudy
03/18/2016,5:00,40.586433,-74.09865,STATEN ISLAND,1.0,0.0,0,0,0,0,1,0,3430404,2016-03-18 05:00:00,2016-03-18T05:00,2016,3,7.5,0.0,Clear
06/19/2016,16:00,40.56464,-74.11563,STATEN ISLAND,0.0,0.0,0,0,0,0,0,0,3465467,2016-06-19 16:00:00,2016-06-19T16:00,2016,6,25.4,0.0,Clear
05/12/2016,16:00,40.61683,-74.08239,STATEN ISLAND,0.0,0.0,0,0,0,0,0,0,3441092,2016-05-12 16:00:00,2016-05-12T16:00,2016,5,21.9,0.0,Clear
08/21/2016,1:00,40.634,-74.097275,STATEN ISLAND,1.0,0.0,0,0,0,0,1,0,3506556,2016-08-21 01:00:00,2016-08-21T01:00,2016,8,23.0,0.0,Clear
07/16/2016,18:00,40.62731,-74.08307,STATEN ISLAND,1.0,0.0,0,0,1,0,0,0,3482727,2016-07-16 18:00:00,2016-07-16T18:00,2016,7,26.7,0.0,Cloudy
02/08/2016,20:00,40.5865308,-74.0959235,STATEN ISLAND,0.0,0.0,0,0,0,0,0,0,3386532,2016-02-08 20:00:00,2016-02-08T20:00,2016,2,-1.4,0.2,Light Snow
08/12/2016,17:00,40.587074,-74.10393,STATEN ISLAND,0.0,0.0,0,0,0,0,0,0,3499376,2016-08-12 17:00:00,2016-08-12T17:00,2016,8,29.9,0.1,Drizzle
05/24/2016,3:00,40.529453,-74.211006,STATEN ISLAND,1.0,0.0,0,0,0,0,1,0,3452778,2016-05-24 03:00:00,2016-05-24T03:00,2016,5,14.2,0.6,Drizzle
02/22/2016,20:00,40.6198067,-74.0845598,STATEN ISLAND,3.0,0.0,0,0,0,0,3,0,3393868,2016-02-22 20:00:00,2016-02-22T20:00,2016,2,4.0,0.0,Cloudy
06/10/2016,18:00,40.54396,-74.19184,STATEN ISLAND,2.0,0.0,0,0,0,0,2,0,3460057,2016-06-10 18:00:00,2016-06-10T18:00,2016,6,22.8,0.0,Cloudy
10/24/2016,2:00,40.553246,-74.21778,STATEN ISLAND,0.0,0.0,0,0,0,0,0,0,3546171,2016-10-24 02:00:00,2016-10-24T02:00,2016,10,11.3,0.2,Drizzle
08/31/2016,13:00,40.59791,-74.08361,STATEN ISLAND,0.0,0.0,0,0,0,0,0,0,3514426,2016-08-31 13:00:00,2016-08-31T13:00,2016,8,30.0,0.0,Cloudy
05/24/2016,11:00,40.574276,-74.10592,STATEN ISLAND,2.0,0.0,0,0,0,0,2,0,3446335,2016-05-24 11:00:00,2016-05-24T11:00,2016,5,19.2,0.1,Drizzle
09/08/2016,21:00,40.63163,-74.0828,STATEN ISLAND,0.0,0.0,0,0,0,0,0,0,3518244,2016-09-08 21:00:00,2016-09-08T21:00,2016,9,26.7,0.0,Cloudy
08/11/2016,18:00,40.62185,-74.11186,STATEN ISLAND,6.0,0.0,0,0,0,0,6,0,3500718,2016-08-11 18:00:00,2016-08-11T18:00,2016,8,28.0,0.5,Drizzle
11/27/2016,6:00,40.561512,-74.171844,STATEN ISLAND,1.0,0.0,0,0,0,0,1,0,3569120,2016-11-27 06:00:00,2016-11-27T06:00,2016,11,3.3,0.0,Clear
09/06/2016,15:00,40.61346,-74.100555,STATEN ISLAND,1.0,0.0,0,0,0,0,1,0,3516469,2016-09-06 15:00:00,2016-09-06T15:00,2016,9,25.1,0.0,Cloudy
02/07/2016,12:00,40.5890362,-74.0898783,STATEN ISLAND,0.0,0.0,0,0,0,0,0,0,3385438,2016-02-07 12:00:00,2016-02-07T12:00,2016,2,6.0,0.0,Cloudy
06/25/2016,0:00,40.542423,-74.14592,STATEN ISLAND,1.0,0.0,0,0,0,0,1,0,3470214,2016-06-25 00:00:00,2016-06-25T00:00,2016,6,18.9,0.0,Clear
08/05/2016,19:00,40.611507,-74.08318,STATEN ISLAND,1.0,0.0,1,0,0,0,0,0,3496939,2016-08-05 19:00:00,2016-08-05T19:00,2016,8,25.1,0.0,Clear
09/23/2016,7:00,40.613163,-74.121414,STATEN ISLAND,1.0,0.0,0,0,0,0,1,0,3528559,2016-09-23 07:00:00,2016-09-23T07:00,2016,9,16.3,0.0,Cloudy
03/08/2016,15:00,40.6263283,-74.1313101,STATEN ISLAND,1.0,0.0,1,0,0,0,0,0,3402716,2016-03-08 15:00:00,2016-03-08T15:00,2016,3,16.1,0.0,Cloudy
01/24/2016,13:00,40.5554755,-74.180746,STATEN ISLAND,1.0,0.0,1,0,0,0,0,0,3377204,2016-01-24 13:00:00,2016-01-24T13:00,2016,1,-3.0,0.0,Clear
06/05/2016,22:00,40.6228,-74.08526,STATEN ISLAND,1.0,0.0,0,0,0,0,1,0,3457436,2016-06-05 22:00:00,2016-06-05T22:00,2016,6,21.1,0.0,Cloudy
08/23/2016,19:00,40.580162,-74.07681,STATEN ISLAND,0.0,0.0,0,0,0,0,0,0,3507901,2016-08-23 19:00:00,2016-08-23T19:00,2016,8,24.3,0.0,Clear
12/16/2016,21:00,40.579735,-74.114235,STATEN ISLAND,0.0,0.0,0,0,0,0,0,0,3581346,2016-12-16 21:00:00,2016-12-16T21:00,2016,12,-4.4,0.0,Cloudy
