CRASH DATE,CRASH TIME,LATITUDE,LONGITUDE,BOROUGH,NUMBER OF PERSONS INJURED,NUMBER OF PERSONS KILLED,NUMBER OF PEDESTRIANS INJURED,NUMBER OF PEDESTRIANS KILLED,NUMBER OF CYCLIST INJURED,NUMBER OF CYCLIST KILLED,NUMBER OF MOTORIST INJURED,NUMBER OF MOTORIST KILLED,COLLISION_ID,datetime,iso_datetime,year,month,temperature,precipitation,weather_condition
11/09/2020,19:00,40.846657,-73.89619,BRONX,1.0,0.0,1,0,0,0,0,0,4366427,2020-11-09 19:00:00,2020-11-09T19:00,2020,11,12.9,0.0,Clear
07/19/2020,6:00,40.822105,-73.90062,BRONX,2.0,0.0,0,0,0,0,2,0,4329662,2020-07-19 06:00:00,2020-07-19T06:00,2020,7,24.1,0.0,Clear
10/05/2020,13:00,40.857758,-73.90095,BRONX,1.0,0.0,0,0,0,0,1,0,4355130,2020-10-05 13:00:00,2020-10-05T13:00,2020,10,19.3,0.0,Cloudy
05/26/2020,10:00,40.88919,-73.83131,BRONX,1.0,0.0,0,0,0,0,1,0,4317303,2020-05-26 10:00:00,2020-05-26T10:00,2020,5,20.2,0.0,Cloudy
02/09/2020,5:00,40.847027,-73.89807,BRONX,1.0,0.0,0,0,0,0,1,0,4287317,2020-02-09 05:00:00,2020-02-09T05:00,2020,2,-1.3,0.0,Cloudy
02/10/2020,15:00,40.87234,-73.9033,BRONX,1.0,0.0,1,0,0,0,0,0,4288429,2020-02-10 15:00:00,2020-02-10T15:00,2020,2,7.1,1.3,Light Rain
04/22/2020,17:00,40.81103,-73.92149,BRONX,2.0,0.0,0,0,0,0,2,0,4309963,2020-04-22 17:00:00,2020-04-22T17:00,2020,4,9.3,0.0,Clear
03/21/2020,15:00,40.843765,-73.88546,BRONX,2.0,0.0,0,0,0,0,2,0,4302947,2020-03-21 15:00:00,2020-03-21T15:00,2020,3,9.9,0.0,Clear
01/21/2020,12:00,40.875492,-73.86052,BRONX,1.0,0.0,0,0,0,0,1,0,4276857,2020-01-21 12:00:00,2020-01-21T12:00,2020,1,-0.5,0.0,Clear
07/08/2020,13:00,40.877033,-73.846375,BRONX,2.0,0.0,0,0,0,0,2,0,4326975,2020-07-08 13:00:00,2020-07-08T13:00,2020,7,27.7,0.2,Drizzle
03/17/2020,16:00,40.87074,-73.887794,BRONX,1.0,0.0,0,0,0,0,1,0,4301698,2020-03-17 16:00:00,2020-03-17T16:00,2020,3,11.3,0.0,Cloudy
07/19/2020,0:00,40.84106,-73.81858,BRONX,1.0,0.0,0,0,0,0,1,0,4330421,2020-07-19 00:00:00,2020-07-19T00:00,2020,7,23.7,0.0,Cloudy
11/10/2020,20:00,40.84596,-73.862595,BRONX,1.0,0.0,1,0,0,0,0,0,4366474,2020-11-10 20:00:00,2020-11-10T20:00,2020,11,16.5,0.0,Clear
09/28/2020,21:00,40.842937,-73.895386,BRONX,1.0,0.0,0,0,1,0,0,0,4352780,2020-09-28 21:00:00,2020-09-28T21:00,2020,9,20.1,0.0,Clear
09/10/2020,14:00,40.8077,-73.92955,BRONX,0.0,0.0,0,0,0,0,0,0,4346698,2020-09-10 14:00:00,2020-09-10T14:00,2020,9,26.8,0.2,Drizzle
12/18/2020,10:00,40.840446,-73.86692,BRONX,3.0,0.0,0,0,0,0,3,0,4380427,2020-12-18 10:00:00,2020-12-18T10:00,2020,12,-4.2,0.0,Cloudy
11/14/2020,11:00,40.875965,-73.83581,BRONX,2.0,0.0,0,0,0,0,2,0,4367685,2020-11-14 11:00:00,2020-11-14T11:00,2020,11,9.5,0.0,Clear
03/15/2020,18:00,40.884647,-73.82662,BRONX,0.0,0.0,0,0,0,0,0,0,4301045,2020-03-15 18:00:00,2020-03-15T18:00,2020,3,6.3,0.0,Clear
02/15/2020,20:00,40.869694,-73.86723,BRONX,1.0,0.0,1,0,0,0,0,0,4289076,2020-02-15 20:00:00,2020-02-15T20:00,2020,2,-2.8,0.0,Cloudy
10/18/2020,0:00,40.81768,-73.921074,BRONX,1.0,0.0,1,0,0,0,0,0,4362026,2020-10-18 00:00:00,2020-10-18T00:00,2020,10,10.2,0.0,Clear
09/17/2020,15:00,40.80719,-73.92431,BRONX,1.0,0.0,0,0,0,0,1,0,4352888,2020-09-17 15:00:00,2020-09-17T15:00,2020,9,22.6,0.0,Cloudy
05/29/2020,21:00,40.87627,-73.88808,BRONX,1.0,0.0,1,0,0,0,0,0,4316628,2020-05-29 21:00:00,2020-05-29T21:00,2020,5,18.7,0.1,Drizzle
06/14/2020,23:00,40.832493,-73.88955,BRONX,0.0,0.0,0,0,0,0,0,0,4320453,2020-06-14 23:00:00,2020-06-14T23:00,2020,6,15.1,0.0,Clear
10/30/2020,23:00,40.847332,-73.831375,BRONX,1.0,0.0,0,0,0,0,1,0,4362733,2020-10-30 23:00:00,2020-10-30T23:00,2020,10,2.8,0.0,Clear
08/13/2020,5:00,40.869694,-73.86723,BRONX,0.0,0.0,0,0,0,0,0,0,4337853,2020-08-13 05:00:00,2020-08-13T05:00,2020,8,22.7,0.0,Cloudy
10/02/2020,13:00,40.806866,-73.9208,BRONX,0.0,0.0,0,0,0,0,0,0,4354633,2020-10-02 13:00:00,2020-10-02T13:00,2020,10,16.2,0.0,Clear
03/05/2020,17:00,40.82615,-73.87766,BRONX,1.0,0.0,0,0,0,0,1,0,4298155,2020-03-05 17:00:00,2020-03-05T17:00,2020,3,6.9,0.0,Cloudy
07/05/2020,15:00,40.829556,-73.86873,BRONX,1.0,0.0,0,0,0,0,1,0,4326358,2020-07-05 15:00:00,2020-07-05T15:00,2020,7,33.0,0.0,Clear
10/04/2020,13:00,40.83241,-73.90406,BRONX,0.0,0.0,0,0,0,0,0,0,4354706,2020-10-04 13:00:00,2020-10-04T13:00,2020,10,18.4,0.0,Cloudy
02/04/2020,17:00,40.87802,-73.90241,BRONX,1.0,0.0,0,0,0,0,1,0,4285354,2020-02-04 17:00:00,2020-02-04T17:00,2020,2,11.8,0.0,Cloudy
07/18/2020,20:00,40.882168,-73.863594,BRONX,1.0,0.0,0,0,1,0,0,0,4330084,2020-07-18 20:00:00,2020-07-18T20:00,2020,7,25.8,0.0,Cloudy
02/23/2020,16:00,40.829136,-73.9114,BRONX,1.0,0.0,0,0,0,0,1,0,4292434,2020-02-23 16:00:00,2020-02-23T16:00,2020,2,10.7,0.0,Cloudy
02/05/2020,8:00,40.81463,-73.886536,BRONX,1.0,0.0,1,0,0,0,0,0,4285272,2020-02-05 08:00:00,2020-02-05T08:00,2020,2,4.0,0.0,Cloudy
08/26/2020,17:00,40.81872,-73.9035,BRONX,2.0,0.0,0,0,2,0,0,0,4343146,2020-08-26 17:00:00,2020-08-26T17:00,2020,8,25.7,0.0,Cloudy
11/28/2020,0:00,40.885616,-73.879074,BRONX,1.0,0.0,0,0,0,0,1,0,4371854,2020-11-28 00:00:00,2020-11-28T00:00,2020,11,7.2,0.0,Clear
03/10/2020,8:00,40.89999,-73.85301,BRONX,1.0,0.0,0,0,0,0,1,0,4298802,2020-03-10 08:00:00,2020-03-10T08:00,2020,3,10.4,0.0,Cloudy
09/08/2020,19:00,40.87757,-73.86613,BRONX,1.0,0.0,1,0,0,0,0,0,4346599,2020-09-08 19:00:00,2020-09-08T19:00,2020,9,21.1,0.0,Clear
06/17/2020,0:00,40.90355,-73.854836,BRONX,2.0,0.0,0,0,0,0,2,0,4321132,2020-06-17 00:00:00,2020-06-17T00:00,2020,6,14.3,0.0,Clear
09/22/2020,17:00,40.81566,-73.85679,BRONX,2.0,0.0,0,0,0,0,2,0,4351264,2020-09-22 17:00:00,2020-09-22T17:00,2020,9,20.6,0.0,Clear
05/14/2020,12:00,40.838963,-73.90484,BRONX,0.0,0.0,0,0,0,0,0,0,4314362,2020-05-14 12:00:00,2020-05-14T12:00,2020,5,16.2,0.0,Clear
08/26/2020,0:00,40.80321,-73.91892,BRONX,1.0,0.0,0,0,0,0,1,0,4341826,2020-08-26 00:00:00,2020-08-26T00:00,2020,8,22.2,0.0,Clear
05/12/2020,14:00,40.806965,-73.911674,BRONX,2.0,0.0,0,0,0,0,2,0,4313211,2020-05-12 14:00:00,2020-05-12T14:00,2020,5,14.2,0.0,Cloudy
06/10/2020,21:00,40.905254,-73.85347,BRONX,0.0,0.0,0,0,0,0,0,0,4319379,2020-06-10 21:00:00,2020-06-10T21:00,2020,6,21.3,0.0,Clear
06/13/2020,0:00,40.823895,-73.88766,BRONX,1.0,0.0,0,0,0,0,1,0,4320051,2020-06-13 00:00:00,2020-06-13T00:00,2020,6,19.1,0.0,Clear
05/28/2020,19:00,40.892128,-73.84719,BRONX,4.0,0.0,0,0,0,0,4,0,4316549,2020-05-28 19:00:00,2020-05-28T19:00,2020,5,18.6,0.0,Cloudy
11/03/2020,9:00,40.824387,-73.901184,BRONX,0.0,0.0,0,0,0,0,0,0,4364052,2020-11-03 09:00:00,2020-11-03T09:00,2020,11,8.6,0.0,Cloudy
07/27/2020,0:00,40.846485,-73.89434,BRONX,1.0,0.0,1,0,0,0,0,0,4333268,2020-07-27 00:00:00,2020-07-27T00:00,2020,7,23.1,0.0,Cloudy
10/04/2020,0:00,40.838116,-73.85002,BRONX,1.0,0.0,0,0,1,0,0,0,4355198,2020-10-04 00:00:00,2020-10-04T00:00,2020,10,12.0,0.0,Clear
10/23/2020,16:00,40.86339,-73.9018,BRONX,1.0,0.0,1,0,0,0,0,0,4360473,2020-10-23 16:00:00,2020-10-23T16:00,2020,10,19.2,0.0,Cloudy
07/12/2020,9:00,40.803593,-73.919785,BRONX,1.0,0.0,0,0,0,0,1,0,4327855,2020-07-12 09:00:00,2020-07-12T09:00,2020,7,26.3,0.0,Clear
11/30/2020,18:00,40.836697,-73.907104,BRONX,1.0,0.0,1,0,0,0,0,0,4372177,2020-11-30 18:00:00,2020-11-30T18:00,2020,11,16.1,2.9,Heavy Rain
11/29/2020,0:00,40.813217,-73.9256,BRONX,0.0,0.0,0,0,0,0,0,0,4391946,2020-11-29 00:00:00,2020-11-29T00:00,2020,11,3.6,0.0,Clear
11/06/2020,11:00,40.826153,-73.920265,BRONX,1.0,0.0,1,0,0,0,0,0,4365841,2020-11-06 11:00:00,2020-11-06T11:00,2020,11,17.4,0.0,Clear
07/10/2020,0:00,40.839268,-73.903824,BRONX,1.0,0.0,0,0,0,0,1,0,4327478,2020-07-10 00:00:00,2020-07-10T00:00,2020,7,22.6,0.0,Cloudy
03/22/2020,16:00,40.88437,-73.90105,BRONX,0.0,0.0,0,0,0,0,0,0,4303047,2020-03-22 16:00:00,2020-03-22T16:00,2020,3,5.8,0.0,Cloudy
09/30/2020,16:00,40.822456,-73.86721,BRONX,0.0,0.0,0,0,0,0,0,0,4356099,2020-09-30 16:00:00,2020-09-30T16:00,2020,9,20.6,0.0,Clear
05/20/2020,21:00,40.869778,-73.89142,BRONX,0.0,0.0,0,0,0,0,0,0,4314802,2020-05-20 21:00:00,2020-05-20T21:00,2020,5,8.7,0.0,Clear
10/03/2020,15:00,40.89471,-73.84915,BRONX,1.0,0.0,1,0,0,0,0,0,4359228,2020-10-03 15:00:00,2020-10-03T15:00,2020,10,18.2,0.0,Clear
09/23/2020,10:00,40.85106,-73.88233,BRONX,1.0,0.0,0,0,0,0,1,0,4350939,2020-09-23 10:00:00,2020-09-23T10:00,2020,9,21.6,0.0,Clear
07/22/2020,0:00,40.90348,-73.85035,BRONX,1.0,0.0,0,0,1,0,0,0,4332622,2020-07-22 00:00:00,2020-07-22T00:00,2020,7,24.3,0.0,Cloudy
12/14/2020,11:00,40.896687,-73.84511,BRONX,1.0,0.0,0,0,0,0,1,0,4376316,2020-12-14 11:00:00,2020-12-14T11:00,2020,12,2.9,0.6,Drizzle
06/20/2020,3:00,40.816044,-73.91195,BRONX,0.0,0.0,0,0,0,0,0,0,4323851,2020-06-20 03:00:00,2020-06-20T03:00,2020,6,19.2,0.0,Cloudy
05/04/2020,0:00,40.885345,-73.89433,BRONX,1.0,0.0,0,0,0,0,1,0,4312238,2020-05-04 00:00:00,2020-05-04T00:00,2020,5,16.4,0.2,Drizzle
03/10/2020,16:00,40.877476,-73.83661,BRONX,0.0,0.0,0,0,0,0,0,0,4307206,2020-03-10 16:00:00,2020-03-10T16:00,2020,3,15.1,0.0,Cloudy
11/20/2020,0:00,40.837063,-73.886826,BRONX,0.0,0.0,0,0,0,0,0,0,4369575,2020-11-20 00:00:00,2020-11-20T00:00,2020,11,5.8,0.0,Cloudy
01/16/2020,17:00,40.8305,-73.861626,BRONX,1.0,0.0,1,0,0,0,0,0,4282564,2020-01-16 17:00:00,2020-01-16T17:00,2020,1,3.9,0.0,Clear
03/10/2020,0:00,40.90348,-73.85035,BRONX,1.0,0.0,0,0,0,0,1,0,4302081,2020-03-10 00:00:00,2020-03-10T00:00,2020,3,9.4,0.0,Cloudy
05/16/2020,17:00,40.844368,-73.88902,BRONX,1.0,0.0,0,0,1,0,0,0,4314101,2020-05-16 17:00:00,2020-05-16T17:00,2020,5,21.3,0.0,Clear
08/27/2020,8:00,40.895847,-73.85604,BRONX,0.0,0.0,0,0,0,0,0,0,4342292,2020-08-27 08:00:00,2020-08-27T08:00,2020,8,21.2,0.0,Cloudy
04/27/2020,14:00,40.84693,-73.8951,BRONX,0.0,0.0,0,0,0,0,0,0,4311652,2020-04-27 14:00:00,2020-04-27T14:00,2020,4,7.8,0.0,Cloudy
08/15/2020,23:00,40.836243,-73.861,BRONX,3.0,0.0,0,0,0,0,3,0,4338998,2020-08-15 23:00:00,2020-08-15T23:00,2020,8,21.7,0.0,Cloudy
01/09/2020,10:00,40.816532,-73.92822,BRONX,1.0,0.0,0,0,0,0,1,0,4271013,2020-01-09 10:00:00,2020-01-09T10:00,2020,1,-2.8,0.0,Clear
07/18/2020,18:00,40.839985,-73.877426,BRONX,0.0,0.0,0,0,0,0,0,0,4329700,2020-07-18 18:00:00,2020-07-18T18:00,2020,7,29.1,0.0,Cloudy
07/22/2020,20:00,40.828407,-73.84392,BRONX,1.0,0.0,0,0,0,0,1,0,4331006,2020-07-22 20:00:00,2020-07-22T20:00,2020,7,25.5,2.6,Heavy Rain
04/21/2020,21:00,40.818535,-73.90783,BRONX,1.0,0.0,0,0,0,0,1,0,4309844,2020-04-21 21:00:00,2020-04-21T21:00,2020,4,6.0,0.0,Clear
01/17/2020,8:00,40.85227,-73.82854,BRONX,1.0,0.0,1,0,0,0,0,0,4275988,2020-01-17 08:00:00,2020-01-17T08:00,2020,1,-5.6,0.0,Clear
07/29/2020,0:00,40.83752,-73.854805,BRONX,0.0,0.0,0,0,0,0,0,0,4334299,2020-07-29 00:00:00,2020-07-29T00:00,2020,7,25.9,0.0,Cloudy
10/15/2020,16:00,40.8844,-73.797325,BRONX,1.0,0.0,0,0,1,0,0,0,4358687,2020-10-15 16:00:00,2020-10-15T16:00,2020,10,18.8,0.0,Cloudy
02/26/2020,17:00,40.82311,-73.88076,BRONX,3.0,0.0,0,0,0,0,3,0,4294640,2020-02-26 17:00:00,2020-02-26T17:00,2020,2,8.9,0.0,Cloudy
01/03/2020,12:00,40.84343,-73.88254,BRONX,0.0,0.0,0,0,0,0,0,0,4268865,2020-01-03 12:00:00,2020-01-03T12:00,2020,1,7.9,0.0,Cloudy
12/21/2020,9:00,40.86066,-73.88945,BRONX,2.0,0.0,0,0,0,0,2,0,4378020,2020-12-21 09:00:00,2020-12-21T09:00,2020,12,0.5,0.0,Cloudy
02/27/2020,15:00,40.841938,-73.85793,BRONX,1.0,0.0,0,0,0,0,1,0,4294669,2020-02-27 15:00:00,2020-02-27T15:00,2020,2,5.3,0.0,Clear
05/27/2020,22:00,40.83142,-73.92644,BRONX,1.0,0.0,0,0,1,0,0,0,4316247,2020-05-27 22:00:00,2020-05-27T22:00,2020,5,16.0,0.0,Cloudy
10/28/2020,1:00,40.846657,-73.89619,BRONX,1.0,0.0,0,0,1,0,0,0,4361930,2020-10-28 01:00:00,2020-10-28T01:00,2020,10,11.5,0.0,Cloudy
12/07/2020,0:00,40.8617,-73.89139,BRONX,0.0,0.0,0,0,0,0,0,0,4374160,2020-12-07 00:00:00,2020-12-07T00:00,2020,12,-0.2,0.0,Clear
09/28/2020,15:00,0.0,0.0,BRONX,0.0,0.0,0,0,0,0,0,0,4352906,2020-09-28 15:00:00,2020-09-28T15:00,2020,9,24.3,0.0,Cloudy
05/31/2020,18:00,40.87738,-73.905876,BRONX,1.0,0.0,0,0,0,0,1,0,4316864,2020-05-31 18:00:00,2020-05-31T18:00,2020,5,16.7,0.0,Clear
10/06/2020,11:00,40.832752,-73.844925,BRONX,0.0,0.0,0,0,0,0,0,0,4355524,2020-10-06 11:00:00,2020-10-06T11:00,2020,10,18.9,0.0,Clear
10/08/2020,0:00,40.838875,-73.90266,BRONX,1.0,0.0,0,0,1,0,0,0,4356798,2020-10-08 00:00:00,2020-10-08T00:00,2020,10,14.9,0.0,Clear
03/09/2020,14:00,40.8297,-73.91932,BRONX,0.0,0.0,0,0,0,0,0,0,4306659,2020-03-09 14:00:00,2020-03-09T14:00,2020,3,19.2,0.0,Clear
07/24/2020,13:00,40.825455,-73.84954,BRONX,1.0,0.0,0,0,0,0,1,0,4331422,2020-07-24 13:00:00,2020-07-24T13:00,2020,7,23.6,1.1,Drizzle
11/21/2020,0:00,40.83475,-73.88409,BRONX,0.0,0.0,0,0,0,0,0,0,4369602,2020-11-21 00:00:00,2020-11-21T00:00,2020,11,9.3,0.0,Clear
03/14/2020,15:00,40.822697,-73.87001,BRONX,1.0,0.0,0,0,0,0,1,0,4300832,2020-03-14 15:00:00,2020-03-14T15:00,2020,3,12.3,0.0,Cloudy
01/14/2020,13:00,40.85365,-73.882744,BRONX,1.0,0.0,1,0,0,0,0,0,4273982,2020-01-14 13:00:00,2020-01-14T13:00,2020,1,6.9,0.0,Cloudy
08/28/2020,22:00,40.824707,-73.91552,BRONX,0.0,0.0,0,0,0,0,0,0,4343220,2020-08-28 22:00:00,2020-08-28T22:00,2020,8,23.0,0.0,Cloudy
02/27/2020,10:00,40.840702,-73.78407,BRONX,0.0,0.0,0,0,0,0,0,0,4295822,2020-02-27 10:00:00,2020-02-27T10:00,2020,2,5.3,0.0,Cloudy
03/03/2020,15:00,40.874928,-73.86498,BRONX,1.0,0.0,1,0,0,0,0,0,4297730,2020-03-03 15:00:00,2020-03-03T15:00,2020,3,10.2,0.4,Drizzle
09/14/2020,0:00,40.89339,-73.857376,BRONX,0.0,0.0,0,0,0,0,0,0,4348185,2020-09-14 00:00:00,2020-09-14T00:00,2020,9,19.5,0.0,Cloudy
12/10/2020,20:00,40.878475,-73.851395,BRONX,1.0,0.0,1,0,0,0,0,0,4375533,2020-12-10 20:00:00,2020-12-10T20:00,2020,12,1.0,0.0,Clear
02/12/2020,14:00,40.878742,-73.87255,BRONX,2.0,0.0,0,0,0,0,2,0,4287667,2020-02-12 14:00:00,2020-02-12T14:00,2020,2,6.8,0.0,Cloudy
02/20/2020,9:00,40.811108,-73.88228,BRONX,1.0,0.0,0,0,0,0,1,0,4291135,2020-02-20 09:00:00,2020-02-20T09:00,2020,2,-0.4,0.0,Cloudy
07/04/2020,8:00,40.804905,-73.91883,BRONX,3.0,0.0,0,0,0,0,3,0,4325774,2020-07-04 08:00:00,2020-07-04T08:00,2020,7,21.9,0.0,Cloudy
11/13/2020,8:00,40.804314,-73.90695,BRONX,0.0,0.0,0,0,0,0,0,0,4372083,2020-11-13 08:00:00,2020-11-13T08:00,2020,11,9.2,0.2,Drizzle
03/15/2020,13:00,40.824455,-73.91474,BRONX,0.0,0.0,0,0,0,0,0,0,4300792,2020-03-15 13:00:00,2020-03-15T13:00,2020,3,10.3,0.0,Clear
01/13/2020,22:00,40.84869,-73.90329,BRONX,1.0,0.0,1,0,0,0,0,0,4272966,2020-01-13 22:00:00,2020-01-13T22:00,2020,1,4.0,0.0,Cloudy
10/16/2020,0:00,40.835716,-73.8775,BRONX,0.0,0.0,0,0,0,0,0,0,4358220,2020-10-16 00:00:00,2020-10-16T00:00,2020,10,16.9,0.0,Cloudy
10/13/2020,15:00,40.84944,-73.906006,BRONX,1.0,0.0,0,0,0,0,1,0,4358173,2020-10-13 15:00:00,2020-10-13T15:00,2020,10,13.6,0.1,Drizzle
11/20/2020,10:00,40.85578,-73.88433,BRONX,0.0,0.0,0,0,0,0,0,0,4369893,2020-11-20 10:00:00,2020-11-20T10:00,2020,11,9.6,0.0,Clear
11/10/2020,17:00,40.835094,-73.88697,BRONX,0.0,0.0,0,0,0,0,0,0,4366778,2020-11-10 17:00:00,2020-11-10T17:00,2020,11,16.0,0.0,Clear
08/03/2020,0:00,40.827656,-73.8861,BRONX,0.0,0.0,0,0,0,0,0,0,4335996,2020-08-03 00:00:00,2020-08-03T00:00,2020,8,27.3,0.0,Clear
12/24/2020,19:00,40.812386,-73.92469,BRONX,1.0,0.0,1,0,0,0,0,0,4378872,2020-12-24 19:00:00,2020-12-24T19:00,2020,12,14.1,0.1,Drizzle
02/18/2020,22:00,40.861862,-73.91282,BRONX,1.0,0.0,0,0,0,0,1,0,4290506,2020-02-18 22:00:00,2020-02-18T22:00,2020,2,4.7,0.1,Drizzle
05/30/2020,10:00,40.90782,-73.896576,BRONX,1.0,0.0,0,0,0,0,1,0,4316738,2020-05-30 10:00:00,2020-05-30T10:00,2020,5,22.6,0.0,Cloudy
08/28/2020,16:00,40.825176,-73.83526,BRONX,1.0,0.0,0,0,0,0,1,0,4343165,2020-08-28 16:00:00,2020-08-28T16:00,2020,8,29.8,0.0,Cloudy
06/29/2020,6:00,40.845142,-73.91106,BRONX,1.0,0.0,0,0,1,0,0,0,4324042,2020-06-29 06:00:00,2020-06-29T06:00,2020,6,21.0,0.0,Clear
05/06/2020,10:00,40.858685,-73.86758,BRONX,0.0,0.0,0,0,0,0,0,0,4313915,2020-05-06 10:00:00,2020-05-06T10:00,2020,5,10.3,0.0,Cloudy
05/15/2020,15:00,40.82914,-73.90811,BRONX,0.0,0.0,0,0,0,0,0,0,4313888,2020-05-15 15:00:00,2020-05-15T15:00,2020,5,27.5,0.0,Clear
08/23/2020,20:00,40.86886,-73.85569,BRONX,0.0,0.0,0,0,0,0,0,0,4341856,2020-08-23 20:00:00,2020-08-23T20:00,2020,8,23.9,0.0,Cloudy
06/12/2020,19:00,40.84764,-73.901,BRONX,1.0,0.0,0,0,1,0,0,0,4319754,2020-06-12 19:00:00,2020-06-12T19:00,2020,6,25.2,0.0,Clear
12/18/2020,14:00,40.833893,-73.89901,BRONX,0.0,0.0,0,0,0,0,0,0,4377702,2020-12-18 14:00:00,2020-12-18T14:00,2020,12,-1.9,0.0,Clear
03/15/2020,14:00,40.85912,-73.90606,BRONX,0.0,0.0,0,0,0,0,0,0,4300700,2020-03-15 14:00:00,2020-03-15T14:00,2020,3,10.5,0.0,Clear
02/17/2020,21:00,40.822315,-73.81918,BRONX,1.0,0.0,1,0,0,0,0,0,4291381,2020-02-17 21:00:00,2020-02-17T21:00,2020,2,2.1,0.0,Clear
07/24/2020,18:00,40.873783,-73.848076,BRONX,0.0,0.0,0,0,0,0,0,0,4331964,2020-07-24 18:00:00,2020-07-24T18:00,2020,7,25.4,0.0,Cloudy
08/02/2020,21:00,40.832706,-73.90506,BRONX,1.0,0.0,0,0,1,0,0,0,4334311,2020-08-02 21:00:00,2020-08-02T21:00,2020,8,28.1,0.0,Cloudy
10/04/2020,23:00,40.882496,-73.86989,BRONX,3.0,0.0,0,0,0,0,3,0,4356439,2020-10-04 23:00:00,2020-10-04T23:00,2020,10,13.0,0.0,Clear
10/23/2020,14:00,40.881187,-73.82623,BRONX,0.0,0.0,0,0,0,0,0,0,4363553,2020-10-23 14:00:00,2020-10-23T14:00,2020,10,21.0,0.1,Drizzle
12/27/2020,0:00,40.88499,-73.8654,BRONX,0.0,0.0,0,0,0,0,0,0,4379253,2020-12-27 00:00:00,2020-12-27T00:00,2020,12,-4.4,0.0,Clear
12/22/2020,15:00,40.813072,-73.88996,BRONX,0.0,0.0,0,0,0,0,0,0,4378377,2020-12-22 15:00:00,2020-12-22T15:00,2020,12,5.0,0.0,Clear
04/18/2020,1:00,40.81881,-73.92828,BRONX,1.0,0.0,1,0,0,0,0,0,4309521,2020-04-18 01:00:00,2020-04-18T01:00,2020,4,5.6,0.5,Drizzle
03/13/2020,10:00,40.88269,-73.89504,BRONX,0.0,0.0,0,0,0,0,0,0,4301388,2020-03-13 10:00:00,2020-03-13T10:00,2020,3,12.0,0.6,Drizzle
03/12/2020,10:00,40.846798,-73.910164,BRONX,0.0,0.0,0,0,0,0,0,0,4299463,2020-03-12 10:00:00,2020-03-12T10:00,2020,3,7.9,0.0,Cloudy
08/16/2020,16:00,40.815735,-73.91829,BRONX,1.0,0.0,0,0,1,0,0,0,4343140,2020-08-16 16:00:00,2020-08-16T16:00,2020,8,21.1,0.2,Drizzle
07/09/2020,12:00,40.832005,-73.862305,BRONX,1.0,0.0,0,0,0,0,1,0,4327254,2020-07-09 12:00:00,2020-07-09T12:00,2020,7,30.8,0.0,Clear
10/30/2020,19:00,40.823772,-73.891846,BRONX,0.0,0.0,0,0,0,0,0,0,4363328,2020-10-30 19:00:00,2020-10-30T19:00,2020,10,5.0,0.0,Clear
09/11/2020,9:00,40.84412,-73.900375,BRONX,0.0,0.0,0,0,0,0,0,0,4346813,2020-09-11 09:00:00,2020-09-11T09:00,2020,9,21.7,0.0,Clear
06/24/2020,22:00,40.840107,-73.90519,BRONX,1.0,0.0,1,0,0,0,0,0,4322940,2020-06-24 22:00:00,2020-06-24T22:00,2020,6,22.5,0.0,Clear
01/06/2020,19:00,40.847816,-73.88285,BRONX,0.0,0.0,0,0,0,0,0,0,4270647,2020-01-06 19:00:00,2020-01-06T19:00,2020,1,1.6,0.0,Clear
06/03/2020,7:00,40.818,-73.9132,BRONX,2.0,0.0,0,0,0,0,2,0,4317422,2020-06-03 07:00:00,2020-06-03T07:00,2020,6,18.7,0.0,Clear
03/05/2020,21:00,40.892708,-73.84455,BRONX,1.0,0.0,0,0,0,0,1,0,4298436,2020-03-05 21:00:00,2020-03-05T21:00,2020,3,3.4,0.0,Cloudy
04/06/2020,10:00,40.84104,-73.92195,BRONX,1.0,0.0,0,0,0,0,1,0,4307832,2020-04-06 10:00:00,2020-04-06T10:00,2020,4,13.1,0.0,Clear
05/30/2020,2:00,40.860023,-73.9029,BRONX,1.0,0.0,0,0,1,0,0,0,4317052,2020-05-30 02:00:00,2020-05-30T02:00,2020,5,20.1,0.0,Cloudy
03/24/2020,21:00,40.870792,-73.90046,BRONX,0.0,0.0,0,0,0,0,0,0,4303736,2020-03-24 21:00:00,2020-03-24T21:00,2020,3,4.6,0.0,Cloudy
08/30/2020,1:00,40.805557,-73.91047,BRONX,1.0,0.0,0,0,0,0,1,0,4343131,2020-08-30 01:00:00,2020-08-30T01:00,2020,8,20.4,0.0,Clear
11/11/2020,0:00,40.8283,-73.88296,BRONX,1.0,0.0,0,0,0,0,1,0,4368927,2020-11-11 00:00:00,2020-11-11T00:00,2020,11,15.5,0.0,Clear
07/19/2020,8:00,40.81843,-73.887535,BRONX,0.0,0.0,0,0,0,0,0,0,4329996,2020-07-19 08:00:00,2020-07-19T08:00,2020,7,28.5,0.0,Clear
08/05/2020,19:00,40.89845,-73.85431,BRONX,1.0,0.0,0,0,1,0,0,0,4336519,2020-08-05 19:00:00,2020-08-05T19:00,2020,8,25.3,0.0,Clear
11/06/2020,0:00,40.854973,-73.90396,BRONX,1.0,0.0,1,0,0,0,0,0,4365001,2020-11-06 00:00:00,2020-11-06T00:00,2020,11,10.6,0.0,Cloudy
06/27/2020,12:00,40.867012,-73.86833,BRONX,0.0,0.0,0,0,0,0,0,0,4324257,2020-06-27 12:00:00,2020-06-27T12:00,2020,6,26.1,0.3,Drizzle
06/15/2020,22:00,40.853962,-73.881516,BRONX,1.0,0.0,0,0,1,0,0,0,4320496,2020-06-15 22:00:00,2020-06-15T22:00,2020,6,15.0,0.0,Cloudy
10/15/2020,0:00,40.822533,-73.88509,BRONX,4.0,0.0,0,0,0,0,4,0,4358442,2020-10-15 00:00:00,2020-10-15T00:00,2020,10,10.7,0.0,Cloudy
10/23/2020,14:00,40.83228,-73.90963,BRONX,1.0,0.0,1,0,0,0,0,0,4360744,2020-10-23 14:00:00,2020-10-23T14:00,2020,10,20.7,0.0,Cloudy
09/01/2020,0:00,40.855614,-73.90352,BRONX,0.0,0.0,0,0,0,0,0,0,4344077,2020-09-01 00:00:00,2020-09-01T00:00,2020,9,19.5,0.0,Clear
03/23/2020,12:00,40.843597,-73.90587,BRONX,2.0,0.0,0,0,0,0,2,0,4303341,2020-03-23 12:00:00,2020-03-23T12:00,2020,3,2.0,1.9,Heavy Snow
01/19/2020,0:00,40.84137,-73.83515,BRONX,0.0,0.0,0,0,0,0,0,0,4287893,2020-01-19 00:00:00,2020-01-19T00:00,2020,1,2.2,0.0,Cloudy
10/29/2020,6:00,40.832645,-73.85122,BRONX,1.0,0.0,1,0,0,0,0,0,4362425,2020-10-29 06:00:00,2020-10-29T06:00,2020,10,11.5,0.0,Cloudy
02/24/2020,0:00,40.880478,-73.88594,BRONX,1.0,0.0,0,0,1,0,0,0,4293078,2020-02-24 00:00:00,2020-02-24T00:00,2020,2,1.4,0.0,Cloudy
04/11/2020,14:00,40.8614,-73.90322,BRONX,1.0,0.0,0,0,0,0,1,0,4308412,2020-04-11 14:00:00,2020-04-11T14:00,2020,4,11.5,0.0,Cloudy
01/18/2020,14:00,40.852337,-73.86393,BRONX,0.0,0.0,0,0,0,0,0,0,4277142,2020-01-18 14:00:00,2020-01-18T14:00,2020,1,-2.6,1.0,Heavy Snow
07/14/2020,14:00,40.835716,-73.8775,BRONX,3.0,0.0,0,0,0,0,3,0,4328658,2020-07-14 14:00:00,2020-07-14T14:00,2020,7,28.5,0.0,Cloudy
08/19/2020,13:00,40.845985,-73.884476,BRONX,1.0,0.0,0,0,0,0,1,0,4340411,2020-08-19 13:00:00,2020-08-19T13:00,2020,8,22.5,0.0,Clear
10/04/2020,18:00,40.83885,-73.86372,BRONX,1.0,0.0,0,0,0,0,1,0,4354761,2020-10-04 18:00:00,2020-10-04T18:00,2020,10,13.2,0.0,Clear
01/24/2020,16:00,40.861107,-73.89028,BRONX,1.0,0.0,0,0,0,0,1,0,4278914,2020-01-24 16:00:00,2020-01-24T16:00,2020,1,6.8,0.0,Cloudy
01/01/2020,14:00,40.814934,-73.89765,BRONX,0.0,0.0,0,0,0,0,0,0,4268084,2020-01-01 14:00:00,2020-01-01T14:00,2020,1,4.6,0.0,Cloudy
06/11/2020,0:00,40.859875,-73.89323,BRONX,4.0,0.0,0,0,0,0,4,0,4319752,2020-06-11 00:00:00,2020-06-11T00:00,2020,6,20.9,0.0,Cloudy
04/07/2020,12:00,40.835724,-73.92129,BRONX,1.0,0.0,1,0,0,0,0,0,4308222,2020-04-07 12:00:00,2020-04-07T12:00,2020,4,16.6,0.0,Cloudy
10/05/2020,23:00,40.804256,-73.9193,BRONX,0.0,0.0,0,0,0,0,0,0,4354921,2020-10-05 23:00:00,2020-10-05T23:00,2020,10,13.5,0.0,Clear
05/20/2020,16:00,40.8439,-73.91171,BRONX,1.0,0.0,0,0,1,0,0,0,4314763,2020-05-20 16:00:00,2020-05-20T16:00,2020,5,16.7,0.0,Cloudy
01/17/2020,12:00,40.816864,-73.882744,BRONX,0.0,0.0,0,0,0,0,0,0,4275177,2020-01-17 12:00:00,2020-01-17T12:00,2020,1,-2.9,0.0,Clear
02/05/2020,0:00,40.884777,-73.85877,BRONX,1.0,0.0,0,0,0,0,1,0,4286164,2020-02-05 00:00:00,2020-02-05T00:00,2020,2,7.4,0.1,Drizzle
04/15/2020,17:00,40.84632,-73.823074,BRONX,1.0,0.0,0,0,0,0,1,0,4309036,2020-04-15 17:00:00,2020-04-15T17:00,2020,4,9.7,0.0,Cloudy
01/26/2020,13:00,40.89487,-73.85657,BRONX,0.0,0.0,0,0,0,0,0,0,4281492,2020-01-26 13:00:00,2020-01-26T13:00,2020,1,7.3,0.0,Cloudy
01/03/2020,2:00,40.84478,-73.91132,BRONX,0.0,0.0,0,0,0,0,0,0,4283939,2020-01-03 02:00:00,2020-01-03T02:00,2020,1,4.4,0.0,Cloudy
01/09/2020,13:00,40.81908,-73.863716,BRONX,1.0,0.0,1,0,0,0,0,0,4274084,2020-01-09 13:00:00,2020-01-09T13:00,2020,1,0.2,0.0,Clear
01/01/2020,13:00,40.804344,-73.92158,BRONX,1.0,0.0,0,0,0,0,1,0,4267730,2020-01-01 13:00:00,2020-01-01T13:00,2020,1,4.2,0.0,Cloudy
01/30/2020,14:00,40.81792,-73.90532,BRONX,1.0,0.0,0,0,0,0,1,0,4281207,2020-01-30 14:00:00,2020-01-30T14:00,2020,1,1.5,0.0,Cloudy
01/09/2020,8:00,40.812817,-73.89198,BRONX,0.0,0.0,0,0,0,0,0,0,4271650,2020-01-09 08:00:00,2020-01-09T08:00,2020,1,-4.8,0.0,Clear
11/29/2020,1:00,40.818634,-73.92154,BRONX,0.0,0.0,0,0,0,0,0,0,4371937,2020-11-29 01:00:00,2020-11-29T01:00,2020,11,3.3,0.0,Clear
11/06/2020,18:00,40.82698,-73.871475,BRONX,1.0,0.0,0,0,0,0,1,0,4365469,2020-11-06 18:00:00,2020-11-06T18:00,2020,11,14.5,0.0,Clear
03/09/2020,20:00,40.870544,-73.84327,BRONX,0.0,0.0,0,0,0,0,0,0,4306796,2020-03-09 20:00:00,2020-03-09T20:00,2020,3,12.7,0.0,Cloudy
10/02/2020,20:00,40.81972,-73.918144,BRONX,1.0,0.0,1,0,0,0,0,0,4354629,2020-10-02 20:00:00,2020-10-02T20:00,2020,10,14.4,0.0,Clear
08/24/2020,21:00,40.82802,-73.852455,BRONX,0.0,0.0,0,0,0,0,0,0,4341712,2020-08-24 21:00:00,2020-08-24T21:00,2020,8,25.3,0.0,Clear
12/07/2020,10:00,40.82098,-73.89388,BRONX,0.0,0.0,0,0,0,0,0,0,4374095,2020-12-07 10:00:00,2020-12-07T10:00,2020,12,1.7,0.0,Cloudy
08/24/2020,12:00,40.832233,-73.881,BRONX,1.0,0.0,0,0,1,0,0,0,4341707,2020-08-24 12:00:00,2020-08-24T12:00,2020,8,29.6,0.1,Drizzle
01/30/2020,22:00,40.82278,-73.905975,BRONX,0.0,0.0,0,0,0,0,0,0,4388240,2020-01-30 22:00:00,2020-01-30T22:00,2020,1,-0.3,0.0,Cloudy
07/22/2020,19:00,40.870605,-73.8465,BRONX,1.0,0.0,0,0,0,0,1,0,4336062,2020-07-22 19:00:00,2020-07-22T19:00,2020,7,25.6,0.1,Drizzle
01/09/2020,0:00,40.888687,-73.84018,BRONX,3.0,0.0,0,0,0,0,3,0,4272550,2020-01-09 00:00:00,2020-01-09T00:00,2020,1,-2.7,0.0,Cloudy
03/06/2020,0:00,40.831055,-73.905846,BRONX,0.0,0.0,0,0,0,0,0,0,4298626,2020-03-06 00:00:00,2020-03-06T00:00,2020,3,2.8,0.0,Cloudy
08/24/2020,19:00,40.819138,-73.912544,BRONX,1.0,0.0,0,0,1,0,0,0,4341373,2020-08-24 19:00:00,2020-08-24T19:00,2020,8,25.9,0.0,Clear
06/04/2020,18:00,40.835773,-73.86229,BRONX,1.0,0.0,1,0,0,0,0,0,4317874,2020-06-04 18:00:00,2020-06-04T18:00,2020,6,23.2,0.0,Cloudy
06/11/2020,19:00,40.87384,-73.86286,BRONX,1.0,0.0,0,0,0,0,1,0,4319485,2020-06-11 19:00:00,2020-06-11T19:00,2020,6,23.6,0.0,Cloudy
12/29/2020,14:00,40.910023,-73.90262,BRONX,1.0,0.0,1,0,0,0,0,0,4380122,2020-12-29 14:00:00,2020-12-29T14:00,2020,12,2.7,0.0,Cloudy
11/21/2020,19:00,40.821815,-73.82673,BRONX,2.0,0.0,0,0,0,0,2,0,4369423,2020-11-21 19:00:00,2020-11-21T19:00,2020,11,11.4,0.0,Cloudy
05/18/2020,9:00,40.867424,-73.89182,BRONX,0.0,0.0,0,0,0,0,0,0,4314403,2020-05-18 09:00:00,2020-05-18T09:00,2020,5,14.6,0.0,Cloudy
06/02/2020,16:00,40.81505,-73.92427,BRONX,0.0,0.0,0,0,0,0,0,0,4317420,2020-06-02 16:00:00,2020-06-02T16:00,2020,6,21.7,0.0,Cloudy
02/28/2020,15:00,40.89141,-73.89742,BRONX,1.0,0.0,0,0,0,0,1,0,4294865,2020-02-28 15:00:00,2020-02-28T15:00,2020,2,4.7,0.0,Cloudy
05/27/2020,11:00,40.87645,-73.848175,BRONX,1.0,0.0,0,0,0,0,1,0,4316790,2020-05-27 11:00:00,2020-05-27T11:00,2020,5,21.4,0.0,Cloudy
11/16/2020,19:00,40.82463,-73.85566,BRONX,1.0,0.0,0,0,0,0,1,0,4368970,2020-11-16 19:00:00,2020-11-16T19:00,2020,11,5.9,0.0,Clear
08/07/2020,0:00,40.81073,-73.92777,BRONX,0.0,0.0,0,0,0,0,0,0,4336161,2020-08-07 00:00:00,2020-08-07T00:00,2020,8,22.9,0.0,Cloudy
11/15/2020,21:00,40.816532,-73.92822,BRONX,0.0,0.0,0,0,0,0,0,0,4367900,2020-11-15 21:00:00,2020-11-15T21:00,2020,11,16.6,0.9,Drizzle
09/17/2020,9:00,40.84469,-73.90667,BRONX,0.0,0.0,0,0,0,0,0,0,4349064,2020-09-17 09:00:00,2020-09-17T09:00,2020,9,20.1,0.0,Cloudy
05/21/2020,9:00,40.88125,-73.86071,BRONX,1.0,0.0,0,0,0,0,1,0,4314862,2020-05-21 09:00:00,2020-05-21T09:00,2020,5,13.7,0.0,Clear
09/06/2020,8:00,40.85407,-73.89932,BRONX,1.0,0.0,0,0,0,0,1,0,4345474,2020-09-06 08:00:00,2020-09-06T08:00,2020,9,20.4,0.0,Clear
06/03/2020,16:00,40.857086,-73.89045,BRONX,0.0,0.0,0,0,0,0,0,0,4319000,2020-06-03 16:00:00,2020-06-03T16:00,2020,6,25.4,0.0,Clear
04/21/2020,21:00,40.812386,-73.92469,BRONX,0.0,0.0,0,0,0,0,0,0,4310556,2020-04-21 21:00:00,2020-04-21T21:00,2020,4,6.1,0.0,Clear
05/28/2020,13:00,40.851894,-73.857086,BRONX,1.0,0.0,0,0,0,0,1,0,4316556,2020-05-28 13:00:00,2020-05-28T13:00,2020,5,23.8,0.0,Cloudy
07/23/2020,17:00,40.876503,-73.904564,BRONX,1.0,0.0,1,0,0,0,0,0,4331286,2020-07-23 17:00:00,2020-07-23T17:00,2020,7,27.2,1.3,Light Rain
07/13/2020,17:00,40.834423,-73.879265,BRONX,1.0,0.0,0,0,0,0,1,0,4328282,2020-07-13 17:00:00,2020-07-13T17:00,2020,7,30.3,0.0,Clear
10/22/2020,17:00,40.813995,-73.91552,BRONX,1.0,0.0,0,0,0,0,1,0,4360308,2020-10-22 17:00:00,2020-10-22T17:00,2020,10,19.6,0.0,Cloudy
08/17/2020,21:00,40.84921,-73.90011,BRONX,1.0,0.0,1,0,0,0,0,0,4339414,2020-08-17 21:00:00,2020-08-17T21:00,2020,8,21.2,0.5,Drizzle
05/04/2020,10:00,40.87467,-73.83358,BRONX,1.0,0.0,0,0,0,0,1,0,4311888,2020-05-04 10:00:00,2020-05-04T10:00,2020,5,19.7,0.0,Clear
08/17/2020,10:00,40.87617,-73.84904,BRONX,1.0,0.0,0,0,0,0,1,0,4339406,2020-08-17 10:00:00,2020-08-17T10:00,2020,8,23.2,0.0,Clear
05/03/2020,19:00,40.855873,-73.79149,BRONX,1.0,0.0,1,0,0,0,0,0,4311951,2020-05-03 19:00:00,2020-05-03T19:00,2020,5,19.6,0.0,Clear
11/23/2020,23:00,40.83413,-73.87475,BRONX,1.0,0.0,0,0,1,0,0,0,4371414,2020-11-23 23:00:00,2020-11-23T23:00,2020,11,4.6,0.0,Clear
07/10/2020,15:00,40.823936,-73.89488,BRONX,2.0,0.0,0,0,0,0,2,0,4327658,2020-07-10 15:00:00,2020-07-10T15:00,2020,7,23.6,4.9,Heavy Rain
09/29/2020,18:00,40.85819,-73.88435,BRONX,1.0,0.0,0,0,0,0,1,0,4354021,2020-09-29 18:00:00,2020-09-29T18:00,2020,9,20.8,1.1,Drizzle
09/01/2020,13:00,40.879948,-73.82339,BRONX,0.0,0.0,0,0,0,0,0,0,4343960,2020-09-01 13:00:00,2020-09-01T13:00,2020,9,24.9,0.0,Cloudy
01/31/2020,15:00,40.886295,-73.847916,BRONX,1.0,0.0,1,0,0,0,0,0,4281782,2020-01-31 15:00:00,2020-01-31T15:00,2020,1,5.6,0.0,Cloudy
09/10/2020,7:00,40.861862,-73.91282,BRONX,1.0,0.0,0,0,0,0,1,0,4347055,2020-09-10 07:00:00,2020-09-10T07:00,2020,9,22.7,4.5,Heavy Rain
11/08/2020,21:00,40.817894,-73.930565,BRONX,0.0,0.0,0,0,0,0,0,0,4366380,2020-11-08 21:00:00,2020-11-08T21:00,2020,11,13.3,0.0,Clear
12/05/2020,11:00,40.80853,-73.90497,BRONX,1.0,0.0,0,0,0,0,1,0,4373571,2020-12-05 11:00:00,2020-12-05T11:00,2020,12,4.5,1.2,Drizzle
12/11/2020,13:00,40.85609,-73.88612,BRONX,1.0,0.0,1,0,0,0,0,0,4375467,2020-12-11 13:00:00,2020-12-11T13:00,2020,12,10.2,0.0,Cloudy
11/19/2020,10:00,40.876884,-73.867096,BRONX,1.0,0.0,0,0,0,0,1,0,4370303,2020-11-19 10:00:00,2020-11-19T10:00,2020,11,2.6,0.0,Cloudy
03/16/2020,13:00,40.859547,-73.80091,BRONX,1.0,0.0,0,0,0,0,1,0,4301399,2020-03-16 13:00:00,2020-03-16T13:00,2020,3,6.1,0.0,Cloudy
03/05/2020,11:00,40.848537,-73.90678,BRONX,1.0,0.0,1,0,0,0,0,0,4306016,2020-03-05 11:00:00,2020-03-05T11:00,2020,3,7.7,0.0,Clear
01/10/2020,18:00,40.87642,-73.86706,BRONX,1.0,0.0,1,0,0,0,0,0,4273676,2020-01-10 18:00:00,2020-01-10T18:00,2020,1,10.6,0.0,Clear
07/18/2020,22:00,40.843124,-73.89796,BRONX,0.0,0.0,0,0,0,0,0,0,4329658,2020-07-18 22:00:00,2020-07-18T22:00,2020,7,25.0,0.0,Cloudy
06/06/2020,18:00,40.831852,-73.86221,BRONX,0.0,0.0,0,0,0,0,0,0,4318512,2020-06-06 18:00:00,2020-06-06T18:00,2020,6,26.3,0.0,Clear
07/09/2020,23:00,40.882217,-73.88046,BRONX,1.0,0.0,1,0,0,0,0,0,4327124,2020-07-09 23:00:00,2020-07-09T23:00,2020,7,22.6,0.0,Cloudy
11/17/2020,19:00,40.882446,-73.856674,BRONX,1.0,0.0,0,0,0,0,1,0,4369631,2020-11-17 19:00:00,2020-11-17T19:00,2020,11,4.3,0.0,Clear
03/15/2020,16:00,40.838333,-73.91692,BRONX,0.0,0.0,0,0,0,0,0,0,4301332,2020-03-15 16:00:00,2020-03-15T16:00,2020,3,10.5,0.0,Clear
08/27/2020,14:00,40.821007,-73.89666,BRONX,0.0,0.0,0,0,0,0,0,0,4343016,2020-08-27 14:00:00,2020-08-27T14:00,2020,8,33.8,0.0,Clear
11/08/2020,0:00,40.812855,-73.90725,BRONX,1.0,0.0,0,0,1,0,0,0,4367891,2020-11-08 00:00:00,2020-11-08T00:00,2020,11,10.5,0.0,Cloudy
10/28/2020,0:00,40.87111,-73.83741,BRONX,0.0,0.0,0,0,0,0,0,0,4362869,2020-10-28 00:00:00,2020-10-28T00:00,2020,10,11.6,0.0,Cloudy
07/21/2020,22:00,40.836456,-73.8872,BRONX,0.0,0.0,0,0,0,0,0,0,4330777,2020-07-21 22:00:00,2020-07-21T22:00,2020,7,25.4,0.0,Cloudy
04/24/2020,17:00,40.842506,-73.85307,BRONX,1.0,0.0,1,0,0,0,0,0,4313813,2020-04-24 17:00:00,2020-04-24T17:00,2020,4,8.8,0.0,Cloudy
02/02/2020,2:00,40.836624,-73.92612,BRONX,1.0,0.0,0,0,1,0,0,0,4285008,2020-02-02 02:00:00,2020-02-02T02:00,2020,2,1.9,0.1,Drizzle
04/06/2020,17:00,40.865208,-73.84336,BRONX,1.0,0.0,0,0,0,0,1,0,4308115,2020-04-06 17:00:00,2020-04-06T17:00,2020,4,15.7,0.0,Clear
04/14/2020,19:00,40.820305,-73.89083,BRONX,0.0,0.0,0,0,0,0,0,0,4308880,2020-04-14 19:00:00,2020-04-14T19:00,2020,4,9.3,0.0,Cloudy
06/22/2020,10:00,40.877113,-73.87423,BRONX,0.0,0.0,0,0,0,0,0,0,4322525,2020-06-22 10:00:00,2020-06-22T10:00,2020,6,29.4,0.0,Clear
02/27/2020,13:00,40.81102,-73.88557,BRONX,0.0,0.0,0,0,0,0,0,0,4294379,2020-02-27 13:00:00,2020-02-27T13:00,2020,2,5.9,0.0,Cloudy
07/27/2020,19:00,40.813488,-73.89935,BRONX,1.0,0.0,0,0,1,0,0,0,4332947,2020-07-27 19:00:00,2020-07-27T19:00,2020,7,30.6,0.0,Clear
10/15/2020,10:00,40.820984,-73.891624,BRONX,1.0,0.0,0,0,0,0,1,0,4359098,2020-10-15 10:00:00,2020-10-15T10:00,2020,10,19.0,0.0,Clear
12/20/2020,0:00,40.828125,-73.84105,BRONX,1.0,0.0,0,0,0,0,1,0,4377979,2020-12-20 00:00:00,2020-12-20T00:00,2020,12,-4.7,0.0,Cloudy
04/17/2020,3:00,40.87892,-73.90479,BRONX,1.0,0.0,1,0,0,0,0,0,4309188,2020-04-17 03:00:00,2020-04-17T03:00,2020,4,0.6,0.0,Clear
11/27/2020,20:00,40.881264,-73.83875,BRONX,0.0,0.0,0,0,0,0,0,0,4371487,2020-11-27 20:00:00,2020-11-27T20:00,2020,11,9.9,0.0,Clear
01/24/2020,11:00,40.806606,-73.91994,BRONX,1.0,0.0,0,0,0,0,1,0,4278402,2020-01-24 11:00:00,2020-01-24T11:00,2020,1,7.2,0.0,Clear
11/11/2020,19:00,40.843204,-73.91196,BRONX,1.0,0.0,1,0,0,0,0,0,4366836,2020-11-11 19:00:00,2020-11-11T19:00,2020,11,17.5,2.1,Light Rain
04/06/2020,17:00,40.813255,-73.93028,BRONX,1.0,0.0,0,0,0,0,1,0,4307886,2020-04-06 17:00:00,2020-04-06T17:00,2020,4,16.6,0.0,Clear
01/16/2020,9:00,40.846066,-73.881516,BRONX,1.0,0.0,1,0,0,0,0,0,4275460,2020-01-16 09:00:00,2020-01-16T09:00,2020,1,8.2,0.0,Clear
07/25/2020,0:00,40.861744,-73.911804,BRONX,1.0,0.0,0,0,0,0,1,0,4331535,2020-07-25 00:00:00,2020-07-25T00:00,2020,7,21.8,0.0,Cloudy
09/30/2020,18:00,40.86227,-73.83102,BRONX,0.0,0.0,0,0,0,0,0,0,4353601,2020-09-30 18:00:00,2020-09-30T18:00,2020,9,17.3,0.0,Clear
03/26/2020,16:00,40.895374,-73.86356,BRONX,0.0,0.0,0,0,0,0,0,0,4304042,2020-03-26 16:00:00,2020-03-26T16:00,2020,3,10.7,0.0,Clear
12/31/2020,21:00,40.815243,-73.92109,BRONX,0.0,0.0,0,0,0,0,0,0,4380883,2020-12-31 21:00:00,2020-12-31T21:00,2020,12,3.0,0.0,Clear
11/06/2020,12:00,40.88919,-73.83131,BRONX,3.0,0.0,0,0,0,0,3,0,4365711,2020-11-06 12:00:00,2020-11-06T12:00,2020,11,18.8,0.0,Clear
03/02/2020,11:00,40.846485,-73.89434,BRONX,0.0,0.0,0,0,0,0,0,0,4306382,2020-03-02 11:00:00,2020-03-02T11:00,2020,3,9.1,0.0,Clear
02/21/2020,16:00,40.83511,-73.91945,BRONX,1.0,0.0,0,0,0,0,1,0,4294297,2020-02-21 16:00:00,2020-02-21T16:00,2020,2,1.5,0.0,Clear
07/18/2020,22:00,40.88189,-73.862755,BRONX,0.0,0.0,0,0,0,0,0,0,4330095,2020-07-18 22:00:00,2020-07-18T22:00,2020,7,24.6,0.0,Cloudy
02/10/2020,15:00,40.851967,-73.897095,BRONX,1.0,0.0,0,0,0,0,1,0,4286889,2020-02-10 15:00:00,2020-02-10T15:00,2020,2,7.2,1.3,Light Rain
02/29/2020,10:00,40.809227,-73.856125,BRONX,0.0,0.0,0,0,0,0,0,0,4295971,2020-02-29 10:00:00,2020-02-29T10:00,2020,2,0.8,0.0,Cloudy
12/12/2020,0:00,40.809776,-73.92241,BRONX,1.0,0.0,0,0,1,0,0,0,4375871,2020-12-12 00:00:00,2020-12-12T00:00,2020,12,3.2,0.0,Clear
09/11/2020,10:00,40.840427,-73.886734,BRONX,0.0,0.0,0,0,0,0,0,0,4347028,2020-09-11 10:00:00,2020-09-11T10:00,2020,9,22.8,0.0,Clear
01/03/2020,13:00,40.831055,-73.905846,BRONX,1.0,0.0,0,0,1,0,0,0,4268760,2020-01-03 13:00:00,2020-01-03T13:00,2020,1,8.4,0.0,Cloudy
10/08/2020,14:00,40.856106,-73.90646,BRONX,1.0,0.0,0,0,0,0,1,0,4355986,2020-10-08 14:00:00,2020-10-08T14:00,2020,10,17.2,0.0,Clear
10/15/2020,12:00,40.840458,-73.89115,BRONX,0.0,0.0,0,0,0,0,0,0,4358408,2020-10-15 12:00:00,2020-10-15T12:00,2020,10,21.0,0.0,Cloudy
12/19/2020,15:00,40.854465,-73.84359,BRONX,0.0,0.0,0,0,0,0,0,0,4379937,2020-12-19 15:00:00,2020-12-19T15:00,2020,12,-2.6,0.0,Cloudy
06/25/2020,15:00,40.68484,-73.9795,BROOKLYN,1.0,0.0,1,0,0,0,0,0,4323106,2020-06-25 15:00:00,2020-06-25T15:00,2020,6,26.7,0.0,Cloudy
04/04/2020,23:00,40.70476,-73.91996,BROOKLYN,0.0,0.0,0,0,0,0,0,0,4307705,2020-04-04 23:00:00,2020-04-04T23:00,2020,4,7.7,0.0,Cloudy
10/28/2020,12:00,40.652752,-73.88629,BROOKLYN,1.0,0.0,1,0,0,0,0,0,4362308,2020-10-28 12:00:00,2020-10-28T12:00,2020,10,14.1,0.0,Cloudy
02/10/2020,22:00,40.695354,-73.93637,BROOKLYN,1.0,0.0,0,0,0,0,1,0,4287967,2020-02-10 22:00:00,2020-02-10T22:00,2020,2,5.6,0.8,Drizzle
03/26/2020,20:00,40.576347,-73.967545,BROOKLYN,1.0,0.0,1,0,0,0,0,0,4304123,2020-03-26 20:00:00,2020-03-26T20:00,2020,3,7.9,0.0,Cloudy
11/18/2020,0:00,40.67003,-73.97233,BROOKLYN,1.0,0.0,0,0,1,0,0,0,4368883,2020-11-18 00:00:00,2020-11-18T00:00,2020,11,1.3,0.0,Clear
12/31/2020,15:00,40.680946,-73.90703,BROOKLYN,1.0,0.0,0,0,0,0,1,0,4390327,2020-12-31 15:00:00,2020-12-31T15:00,2020,12,6.3,0.0,Cloudy
08/03/2020,15:00,40.68061,-73.86944,BROOKLYN,0.0,0.0,0,0,0,0,0,0,4335407,2020-08-03 15:00:00,2020-08-03T15:00,2020,8,28.5,0.0,Clear
02/13/2020,21:00,40.642796,-73.97945,BROOKLYN,0.0,0.0,0,0,0,0,0,0,4290166,2020-02-13 21:00:00,2020-02-13T21:00,2020,2,4.2,0.0,Cloudy
02/16/2020,19:00,40.616314,-74.00083,BROOKLYN,1.0,0.0,0,0,1,0,0,0,4289348,2020-02-16 19:00:00,2020-02-16T19:00,2020,2,1.9,0.0,Cloudy
11/02/2020,19:00,40.666187,-73.916664,BROOKLYN,1.0,0.0,1,0,0,0,0,0,4364079,2020-11-02 19:00:00,2020-11-02T19:00,2020,11,5.3,0.0,Clear
01/01/2020,8:00,40.582935,-73.95921,BROOKLYN,0.0,0.0,0,0,0,0,0,0,4267756,2020-01-01 08:00:00,2020-01-01T08:00,2020,1,2.4,0.0,Cloudy
01/29/2020,21:00,40.649643,-73.95289,BROOKLYN,1.0,0.0,1,0,0,0,0,0,4282317,2020-01-29 21:00:00,2020-01-29T21:00,2020,1,-1.4,0.0,Clear
12/04/2020,16:00,40.61739,-74.02463,BROOKLYN,2.0,0.0,0,0,0,0,2,0,4377143,2020-12-04 16:00:00,2020-12-04T16:00,2020,12,8.0,0.3,Drizzle
03/10/2020,8:00,40.675827,-73.938805,BROOKLYN,0.0,0.0,0,0,0,0,0,0,4299429,2020-03-10 08:00:00,2020-03-10T08:00,2020,3,11.2,0.0,Cloudy
01/28/2020,21:00,40.654163,-73.91163,BROOKLYN,2.0,0.0,0,0,0,0,2,0,4280625,2020-01-28 21:00:00,2020-01-28T21:00,2020,1,2.9,0.0,Cloudy
03/03/2020,14:00,40.65011,-73.930214,BROOKLYN,0.0,0.0,0,0,0,0,0,0,4298229,2020-03-03 14:00:00,2020-03-03T14:00,2020,3,9.7,0.7,Drizzle
07/21/2020,0:00,40.67452,-73.878044,BROOKLYN,1.0,0.0,0,0,1,0,0,0,4331120,2020-07-21 00:00:00,2020-07-21T00:00,2020,7,24.6,0.0,Clear
11/08/2020,2:00,40.643356,-74.00139,BROOKLYN,0.0,0.0,0,0,0,0,0,0,4365665,2020-11-08 02:00:00,2020-11-08T02:00,2020,11,10.2,0.0,Clear
07/11/2020,18:00,40.578846,-73.958496,BROOKLYN,1.0,0.0,0,0,0,0,1,0,4327815,2020-07-11 18:00:00,2020-07-11T18:00,2020,7,26.3,0.0,Clear
05/22/2020,21:00,40.673935,-73.8997,BROOKLYN,1.0,0.0,1,0,0,0,0,0,4315695,2020-05-22 21:00:00,2020-05-22T21:00,2020,5,14.9,0.1,Drizzle
11/12/2020,3:00,40.64495,-73.95186,BROOKLYN,2.0,0.0,0,0,0,0,2,0,4366870,2020-11-12 03:00:00,2020-11-12T03:00,2020,11,18.0,1.1,Drizzle
12/01/2020,12:00,40.61859,-73.94242,BROOKLYN,1.0,0.0,0,0,0,0,1,0,4373075,2020-12-01 12:00:00,2020-12-01T12:00,2020,12,9.2,0.2,Drizzle
08/09/2020,8:00,40.672516,-73.93356,BROOKLYN,1.0,0.0,0,0,0,0,1,0,4345569,2020-08-09 08:00:00,2020-08-09T08:00,2020,8,24.2,0.0,Cloudy
05/07/2020,3:00,40.628777,-73.94143,BROOKLYN,1.0,0.0,1,0,0,0,0,0,4312802,2020-05-07 03:00:00,2020-05-07T03:00,2020,5,7.2,0.0,Clear
05/02/2020,19:00,40.63934,-73.89585,BROOKLYN,1.0,0.0,0,0,0,0,1,0,4311675,2020-05-02 19:00:00,2020-05-02T19:00,2020,5,16.7,0.0,Clear
05/22/2020,23:00,40.69257,-73.93994,BROOKLYN,1.0,0.0,1,0,0,0,0,0,4321698,2020-05-22 23:00:00,2020-05-22T23:00,2020,5,14.2,0.0,Cloudy
02/16/2020,15:00,40.69644,-73.92228,BROOKLYN,0.0,0.0,0,0,0,0,0,0,4289604,2020-02-16 15:00:00,2020-02-16T15:00,2020,2,6.8,0.0,Clear
03/18/2020,6:00,40.690926,-73.92066,BROOKLYN,1.0,0.0,0,0,0,0,1,0,4301790,2020-03-18 06:00:00,2020-03-18T06:00,2020,3,1.0,0.0,Cloudy
10/26/2020,0:00,40.69999,-73.95475,BROOKLYN,0.0,0.0,0,0,0,0,0,0,4361491,2020-10-26 00:00:00,2020-10-26T00:00,2020,10,12.0,0.1,Drizzle
12/12/2020,16:00,40.68315,-73.92006,BROOKLYN,1.0,0.0,1,0,0,0,0,0,4376299,2020-12-12 16:00:00,2020-12-12T16:00,2020,12,12.2,0.0,Clear
01/12/2020,0:00,40.685913,-73.9206,BROOKLYN,1.0,0.0,1,0,0,0,0,0,4277479,2020-01-12 00:00:00,2020-01-12T00:00,2020,1,14.9,0.0,Cloudy
01/03/2020,20:00,40.65114,-73.89,BROOKLYN,1.0,0.0,0,0,0,0,1,0,4268888,2020-01-03 20:00:00,2020-01-03T20:00,2020,1,7.3,0.3,Drizzle
09/11/2020,14:00,40.61913,-73.98855,BROOKLYN,0.0,0.0,0,0,0,0,0,0,4348998,2020-09-11 14:00:00,2020-09-11T14:00,2020,9,24.9,0.0,Cloudy
02/22/2020,0:00,40.67425,-73.88885,BROOKLYN,1.0,0.0,0,0,0,0,1,0,4292882,2020-02-22 00:00:00,2020-02-22T00:00,2020,2,-2.4,0.0,Clear
07/22/2020,23:00,40.625175,-73.9614,BROOKLYN,1.0,0.0,1,0,0,0,0,0,4331686,2020-07-22 23:00:00,2020-07-22T23:00,2020,7,24.7,0.0,Cloudy
03/25/2020,18:00,40.658913,-73.90119,BROOKLYN,0.0,0.0,0,0,0,0,0,0,4303921,2020-03-25 18:00:00,2020-03-25T18:00,2020,3,5.3,0.0,Cloudy
05/31/2020,12:00,40.616177,-73.94683,BROOKLYN,0.0,0.0,0,0,0,0,0,0,4316789,2020-05-31 12:00:00,2020-05-31T12:00,2020,5,19.2,0.0,Clear
08/19/2020,11:00,40.671608,-73.91695,BROOKLYN,2.0,0.0,0,0,0,0,2,0,4339947,2020-08-19 11:00:00,2020-08-19T11:00,2020,8,20.3,1.5,Light Rain
09/14/2020,8:00,40.601852,-73.913734,BROOKLYN,1.0,0.0,0,0,0,0,1,0,4348582,2020-09-14 08:00:00,2020-09-14T08:00,2020,9,21.6,0.0,Cloudy
05/12/2020,12:00,40.692024,-73.9818,BROOKLYN,0.0,0.0,0,0,0,0,0,0,4314287,2020-05-12 12:00:00,2020-05-12T12:00,2020,5,12.6,0.0,Clear
03/03/2020,17:00,40.62362,-74.0351,BROOKLYN,0.0,0.0,0,0,0,0,0,0,4296938,2020-03-03 17:00:00,2020-03-03T17:00,2020,3,7.7,0.1,Drizzle
02/24/2020,9:00,40.679543,-73.87105,BROOKLYN,2.0,0.0,0,0,0,0,2,0,4294222,2020-02-24 09:00:00,2020-02-24T09:00,2020,2,6.1,0.0,Clear
01/03/2020,11:00,40.665474,-73.9,BROOKLYN,1.0,0.0,0,0,0,0,1,0,4268524,2020-01-03 11:00:00,2020-01-03T11:00,2020,1,7.3,0.1,Drizzle
08/18/2020,14:00,40.715733,-73.96448,BROOKLYN,0.0,0.0,0,0,0,0,0,0,4344561,2020-08-18 14:00:00,2020-08-18T14:00,2020,8,28.4,0.0,Clear
06/23/2020,14:00,40.575127,-73.98111,BROOKLYN,0.0,0.0,0,0,0,0,0,0,4322654,2020-06-23 14:00:00,2020-06-23T14:00,2020,6,24.4,0.0,Clear
05/08/2020,0:00,40.653805,-73.93061,BROOKLYN,0.0,0.0,0,0,0,0,0,0,4312458,2020-05-08 00:00:00,2020-05-08T00:00,2020,5,10.0,0.5,Drizzle
09/05/2020,18:00,40.658268,-73.91693,BROOKLYN,0.0,0.0,0,0,0,0,0,0,4345892,2020-09-05 18:00:00,2020-09-05T18:00,2020,9,21.7,0.0,Clear
11/27/2020,15:00,40.672462,-73.896034,BROOKLYN,2.0,0.0,0,0,0,0,2,0,4371801,2020-11-27 15:00:00,2020-11-27T15:00,2020,11,14.9,0.0,Clear
08/23/2020,22:00,40.643715,-73.909836,BROOKLYN,0.0,0.0,0,0,0,0,0,0,4341680,2020-08-23 22:00:00,2020-08-23T22:00,2020,8,23.9,0.0,Cloudy
11/12/2020,18:00,40.626556,-73.99018,BROOKLYN,1.0,0.0,1,0,0,0,0,0,4367581,2020-11-12 18:00:00,2020-11-12T18:00,2020,11,10.5,0.0,Cloudy
12/16/2020,20:00,40.63406,-74.00411,BROOKLYN,0.0,0.0,0,0,0,0,0,0,4376936,2020-12-16 20:00:00,2020-12-16T20:00,2020,12,-3.9,2.5,Heavy Snow
05/06/2020,15:00,40.69398,-73.961266,BROOKLYN,1.0,0.0,0,0,1,0,0,0,4312488,2020-05-06 15:00:00,2020-05-06T15:00,2020,5,9.2,0.7,Drizzle
12/09/2020,2:00,40.66077,-73.91975,BROOKLYN,1.0,0.0,0,0,0,0,1,0,4374769,2020-12-09 02:00:00,2020-12-09T02:00,2020,12,-1.3,0.0,Cloudy
03/29/2020,0:00,40.676197,-73.93731,BROOKLYN,0.0,0.0,0,0,0,0,0,0,4304555,2020-03-29 00:00:00,2020-03-29T00:00,2020,3,8.6,0.0,Cloudy
09/20/2020,17:00,40.661037,-73.99744,BROOKLYN,1.0,0.0,0,0,1,0,0,0,4350422,2020-09-20 17:00:00,2020-09-20T17:00,2020,9,16.6,0.0,Clear
04/14/2020,6:00,40.694576,-73.95615,BROOKLYN,1.0,0.0,0,0,1,0,0,0,4309608,2020-04-14 06:00:00,2020-04-14T06:00,2020,4,6.5,0.0,Clear
08/17/2020,13:00,40.674664,-73.97025,BROOKLYN,2.0,0.0,0,0,0,0,2,0,4339748,2020-08-17 13:00:00,2020-08-17T13:00,2020,8,24.3,0.0,Clear
01/08/2020,10:00,40.623714,-73.99314,BROOKLYN,0.0,0.0,0,0,0,0,0,0,4270432,2020-01-08 10:00:00,2020-01-08T10:00,2020,1,2.7,0.0,Clear
06/22/2020,11:00,40.672844,-73.88943,BROOKLYN,6.0,0.0,0,0,0,0,6,0,4322442,2020-06-22 11:00:00,2020-06-22T11:00,2020,6,29.6,0.0,Clear
03/02/2020,18:00,40.674145,-74.00601,BROOKLYN,1.0,0.0,0,0,1,0,0,0,4296464,2020-03-02 18:00:00,2020-03-02T18:00,2020,3,10.0,0.0,Cloudy
08/06/2020,23:00,40.645767,-73.98529,BROOKLYN,1.0,0.0,0,0,1,0,0,0,4336662,2020-08-06 23:00:00,2020-08-06T23:00,2020,8,22.1,0.0,Cloudy
10/25/2020,14:00,40.68268,-73.922676,BROOKLYN,1.0,0.0,0,0,1,0,0,0,4360972,2020-10-25 14:00:00,2020-10-25T14:00,2020,10,11.1,0.0,Cloudy
07/18/2020,17:00,40.67116,-73.917,BROOKLYN,1.0,0.0,0,0,0,0,1,0,4329513,2020-07-18 17:00:00,2020-07-18T17:00,2020,7,28.6,0.0,Cloudy
07/09/2020,0:00,40.66549,-73.92137,BROOKLYN,0.0,0.0,0,0,0,0,0,0,4327949,2020-07-09 00:00:00,2020-07-09T00:00,2020,7,23.6,0.0,Clear
03/16/2020,10:00,40.67101,-73.92239,BROOKLYN,2.0,0.0,0,0,0,0,2,0,4301738,2020-03-16 10:00:00,2020-03-16T10:00,2020,3,3.8,0.0,Cloudy
01/22/2020,19:00,40.681213,-73.953476,BROOKLYN,1.0,0.0,0,0,1,0,0,0,4279417,2020-01-22 19:00:00,2020-01-22T19:00,2020,1,-0.2,0.0,Clear
03/30/2020,19:00,40.68821,-73.96583,BROOKLYN,3.0,0.0,0,0,0,0,3,0,4304917,2020-03-30 19:00:00,2020-03-30T19:00,2020,3,6.0,0.0,Clear
08/15/2020,14:00,40.615826,-73.9577,BROOKLYN,1.0,0.0,0,0,0,0,1,0,4338583,2020-08-15 14:00:00,2020-08-15T14:00,2020,8,25.2,0.0,Cloudy
02/27/2020,19:00,40.63862,-73.89105,BROOKLYN,0.0,0.0,0,0,0,0,0,0,4295546,2020-02-27 19:00:00,2020-02-27T19:00,2020,2,0.6,0.0,Clear
06/02/2020,11:00,40.660755,-73.87611,BROOKLYN,0.0,0.0,0,0,0,0,0,0,4317469,2020-06-02 11:00:00,2020-06-02T11:00,2020,6,22.2,0.0,Cloudy
11/29/2020,15:00,40.641182,-73.944664,BROOKLYN,1.0,0.0,1,0,0,0,0,0,4371554,2020-11-29 15:00:00,2020-11-29T15:00,2020,11,10.7,0.0,Clear
08/02/2020,18:00,40.669785,-73.9858,BROOKLYN,1.0,0.0,0,0,0,0,1,0,4334259,2020-08-02 18:00:00,2020-08-02T18:00,2020,8,27.3,0.0,Cloudy
08/13/2020,18:00,40.63347,-74.02102,BROOKLYN,1.0,0.0,1,0,0,0,0,0,4338063,2020-08-13 18:00:00,2020-08-13T18:00,2020,8,24.7,0.2,Drizzle
09/06/2020,13:00,40.65391,-73.97305,BROOKLYN,1.0,0.0,0,0,1,0,0,0,4345514,2020-09-06 13:00:00,2020-09-06T13:00,2020,9,26.1,0.0,Clear
10/22/2020,10:00,40.68255,-73.977684,BROOKLYN,1.0,0.0,0,0,0,0,1,0,4360335,2020-10-22 10:00:00,2020-10-22T10:00,2020,10,20.1,0.0,Cloudy
10/07/2020,0:00,40.657135,-73.90365,BROOKLYN,0.0,0.0,0,0,0,0,0,0,4355650,2020-10-07 00:00:00,2020-10-07T00:00,2020,10,15.2,0.0,Cloudy
09/12/2020,8:00,40.674465,-73.97547,BROOKLYN,1.0,0.0,0,0,0,0,1,0,4347239,2020-09-12 08:00:00,2020-09-12T08:00,2020,9,18.3,0.0,Clear
05/21/2020,0:00,40.68937,-73.949356,BROOKLYN,1.0,0.0,0,0,1,0,0,0,4315090,2020-05-21 00:00:00,2020-05-21T00:00,2020,5,7.3,0.0,Clear
02/07/2020,12:00,40.714893,-73.959045,BROOKLYN,0.0,0.0,0,0,0,0,0,0,4286676,2020-02-07 12:00:00,2020-02-07T12:00,2020,2,13.8,0.6,Drizzle
09/24/2020,15:00,40.684387,-73.98657,BROOKLYN,1.0,0.0,0,0,0,0,1,0,4351386,2020-09-24 15:00:00,2020-09-24T15:00,2020,9,23.2,0.0,Cloudy
11/24/2020,21:00,40.667168,-73.88087,BROOKLYN,1.0,0.0,0,0,1,0,0,0,4370613,2020-11-24 21:00:00,2020-11-24T21:00,2020,11,2.8,0.0,Cloudy
01/09/2020,0:00,40.622265,-73.95576,BROOKLYN,1.0,0.0,0,0,0,0,1,0,4270856,2020-01-09 00:00:00,2020-01-09T00:00,2020,1,-2.2,0.0,Clear
11/13/2020,22:00,40.678867,-73.90823,BROOKLYN,0.0,1.0,0,0,0,1,0,0,4367428,2020-11-13 22:00:00,2020-11-13T22:00,2020,11,7.3,0.0,Clear
02/21/2020,23:00,40.674404,-73.86976,BROOKLYN,2.0,0.0,0,0,0,0,2,0,4292911,2020-02-21 23:00:00,2020-02-21T23:00,2020,2,-1.6,0.0,Clear
06/18/2020,20:00,40.692226,-73.930916,BROOKLYN,2.0,0.0,0,0,0,0,2,0,4323783,2020-06-18 20:00:00,2020-06-18T20:00,2020,6,19.3,0.0,Cloudy
06/08/2020,0:00,40.656685,-73.9299,BROOKLYN,1.0,0.0,0,0,1,0,0,0,4318592,2020-06-08 00:00:00,2020-06-08T00:00,2020,6,16.1,0.0,Cloudy
08/23/2020,15:00,40.59978,-73.95273,BROOKLYN,1.0,0.0,0,0,1,0,0,0,4340922,2020-08-23 15:00:00,2020-08-23T15:00,2020,8,25.9,0.0,Clear
01/23/2020,17:00,40.67835,-73.912285,BROOKLYN,0.0,0.0,0,0,0,0,0,0,4282244,2020-01-23 17:00:00,2020-01-23T17:00,2020,1,2.0,0.0,Cloudy
12/22/2020,18:00,40.677353,-74.00446,BROOKLYN,0.0,0.0,0,0,0,0,0,0,4378325,2020-12-22 18:00:00,2020-12-22T18:00,2020,12,3.5,0.0,Clear
08/08/2020,23:00,40.695705,-73.94637,BROOKLYN,1.0,0.0,0,0,1,0,0,0,4337473,2020-08-08 23:00:00,2020-08-08T23:00,2020,8,22.2,0.0,Clear
10/12/2020,8:00,40.624653,-73.99933,BROOKLYN,2.0,0.0,0,0,0,0,2,0,4356922,2020-10-12 08:00:00,2020-10-12T08:00,2020,10,11.2,2.9,Heavy Rain
09/07/2020,21:00,40.70522,-73.95279,BROOKLYN,1.0,0.0,0,0,0,0,1,0,4345622,2020-09-07 21:00:00,2020-09-07T21:00,2020,9,20.7,0.0,Clear
05/29/2020,11:00,40.660927,-73.98669,BROOKLYN,1.0,0.0,0,0,1,0,0,0,4316627,2020-05-29 11:00:00,2020-05-29T11:00,2020,5,22.4,0.1,Drizzle
06/16/2020,20:00,40.62075,-74.00698,BROOKLYN,1.0,0.0,0,0,0,0,1,0,4320882,2020-06-16 20:00:00,2020-06-16T20:00,2020,6,17.0,0.0,Clear
03/02/2020,17:00,40.605217,-74.00838,BROOKLYN,1.0,0.0,0,0,0,0,1,0,4296371,2020-03-02 17:00:00,2020-03-02T17:00,2020,3,9.7,0.0,Cloudy
10/14/2020,14:00,40.695385,-73.98324,BROOKLYN,0.0,0.0,0,0,0,0,0,0,4357739,2020-10-14 14:00:00,2020-10-14T14:00,2020,10,20.2,0.0,Clear
03/08/2020,7:00,40.642254,-73.96967,BROOKLYN,0.0,0.0,0,0,0,0,0,0,4306002,2020-03-08 07:00:00,2020-03-08T07:00,2020,3,0.6,0.0,Clear
03/14/2020,4:00,40.65157,-73.95195,BROOKLYN,0.0,0.0,0,0,0,0,0,0,4300615,2020-03-14 04:00:00,2020-03-14T04:00,2020,3,4.9,0.0,Clear
11/06/2020,16:00,40.67598,-74.01181,BROOKLYN,0.0,0.0,0,0,0,0,0,0,4365361,2020-11-06 16:00:00,2020-11-06T16:00,2020,11,18.0,0.0,Clear
01/14/2020,18:00,40.592438,-73.97268,BROOKLYN,1.0,0.0,1,0,0,0,0,0,4273312,2020-01-14 18:00:00,2020-01-14T18:00,2020,1,7.0,0.2,Drizzle
06/24/2020,10:00,40.677296,-73.87682,BROOKLYN,1.0,0.0,0,0,1,0,0,0,4323120,2020-06-24 10:00:00,2020-06-24T10:00,2020,6,28.0,0.0,Cloudy
09/17/2020,17:00,40.660397,-73.98038,BROOKLYN,0.0,0.0,0,0,0,0,0,0,4351084,2020-09-17 17:00:00,2020-09-17T17:00,2020,9,21.1,0.0,Cloudy
05/20/2020,15:00,40.674397,-73.896515,BROOKLYN,0.0,0.0,0,0,0,0,0,0,4314728,2020-05-20 15:00:00,2020-05-20T15:00,2020,5,14.8,0.0,Cloudy
11/06/2020,20:00,40.700726,-73.94194,BROOKLYN,1.0,0.0,1,0,0,0,0,0,4365523,2020-11-06 20:00:00,2020-11-06T20:00,2020,11,14.2,0.0,Clear
12/03/2020,9:00,40.655067,-73.93497,BROOKLYN,1.0,0.0,0,0,0,0,1,0,4372936,2020-12-03 09:00:00,2020-12-03T09:00,2020,12,2.9,0.0,Clear
10/03/2020,10:00,40.631115,-73.90797,BROOKLYN,0.0,0.0,0,0,0,0,0,0,4354188,2020-10-03 10:00:00,2020-10-03T10:00,2020,10,16.1,0.0,Clear
07/11/2020,0:00,40.59328,-73.94538,BROOKLYN,2.0,0.0,0,0,0,0,2,0,4327542,2020-07-11 00:00:00,2020-07-11T00:00,2020,7,23.7,0.1,Drizzle
04/09/2020,0:00,40.666134,-73.88492,BROOKLYN,1.0,0.0,0,0,0,0,1,0,4308481,2020-04-09 00:00:00,2020-04-09T00:00,2020,4,8.1,0.0,Clear
01/21/2020,21:00,40.679516,-73.956825,BROOKLYN,3.0,0.0,0,0,0,0,3,0,4277978,2020-01-21 21:00:00,2020-01-21T21:00,2020,1,-3.0,0.0,Cloudy
06/06/2020,13:00,40.698036,-73.962845,BROOKLYN,2.0,0.0,0,0,1,0,1,0,4318257,2020-06-06 13:00:00,2020-06-06T13:00,2020,6,29.5,0.0,Cloudy
04/14/2020,14:00,40.659477,-73.908134,BROOKLYN,1.0,0.0,1,0,0,0,0,0,4308953,2020-04-14 14:00:00,2020-04-14T14:00,2020,4,13.2,0.0,Cloudy
12/03/2020,10:00,40.67641,-74.00104,BROOKLYN,1.0,0.0,0,0,0,0,1,0,4372987,2020-12-03 10:00:00,2020-12-03T10:00,2020,12,4.4,0.0,Clear
03/02/2020,13:00,40.61617,-73.9546,BROOKLYN,0.0,0.0,0,0,0,0,0,0,4296364,2020-03-02 13:00:00,2020-03-02T13:00,2020,3,10.8,0.0,Clear
05/15/2020,17:00,40.68418,-73.983955,BROOKLYN,0.0,0.0,0,0,0,0,0,0,4313746,2020-05-15 17:00:00,2020-05-15T17:00,2020,5,24.5,0.0,Clear
03/11/2020,11:00,40.6761,-73.959625,BROOKLYN,0.0,0.0,0,0,0,0,0,0,4303328,2020-03-11 11:00:00,2020-03-11T11:00,2020,3,10.1,0.0,Cloudy
02/09/2020,19:00,40.652214,-73.92828,BROOKLYN,1.0,0.0,0,0,1,0,0,0,4285798,2020-02-09 19:00:00,2020-02-09T19:00,2020,2,4.3,0.0,Cloudy
01/30/2020,8:00,40.66626,-73.95957,BROOKLYN,1.0,0.0,1,0,0,0,0,0,4287241,2020-01-30 08:00:00,2020-01-30T08:00,2020,1,-4.8,0.0,Clear
03/06/2020,9:00,40.609554,-73.96631,BROOKLYN,1.0,0.0,0,0,0,0,1,0,4298310,2020-03-06 09:00:00,2020-03-06T09:00,2020,3,6.4,0.0,Cloudy
06/11/2020,11:00,40.657173,-73.921074,BROOKLYN,2.0,0.0,0,0,0,0,2,0,4320115,2020-06-11 11:00:00,2020-06-11T11:00,2020,6,26.3,0.2,Drizzle
08/07/2020,16:00,40.696205,-73.91782,BROOKLYN,1.0,0.0,0,0,1,0,0,0,4336890,2020-08-07 16:00:00,2020-08-07T16:00,2020,8,25.7,0.0,Cloudy
12/09/2020,14:00,40.66294,-73.87558,BROOKLYN,1.0,0.0,0,0,1,0,0,0,4375084,2020-12-09 14:00:00,2020-12-09T14:00,2020,12,3.1,0.2,Light Snow
03/07/2020,14:00,40.62657,-74.01167,BROOKLYN,0.0,0.0,0,0,0,0,0,0,4305941,2020-03-07 14:00:00,2020-03-07T14:00,2020,3,7.7,0.0,Clear
08/19/2020,23:00,40.665627,-73.92045,BROOKLYN,1.0,0.0,0,0,0,0,1,0,4344247,2020-08-19 23:00:00,2020-08-19T23:00,2020,8,20.1,0.4,Drizzle
09/08/2020,17:00,40.642014,-73.9313,BROOKLYN,2.0,0.0,0,0,0,0,2,0,4346625,2020-09-08 17:00:00,2020-09-08T17:00,2020,9,23.7,0.0,Clear
11/22/2020,0:00,40.670532,-73.92989,BROOKLYN,1.0,0.0,1,0,0,0,0,0,4371528,2020-11-22 00:00:00,2020-11-22T00:00,2020,11,6.4,0.0,Clear
06/29/2020,0:00,40.611256,-73.974525,BROOKLYN,1.0,0.0,1,0,0,0,0,0,4324130,2020-06-29 00:00:00,2020-06-29T00:00,2020,6,22.4,0.0,Clear
09/23/2020,23:00,40.66255,-73.90893,BROOKLYN,1.0,0.0,0,0,1,0,0,0,4351855,2020-09-23 23:00:00,2020-09-23T23:00,2020,9,17.4,0.0,Clear
02/27/2020,4:00,40.60657,-73.8981,BROOKLYN,2.0,0.0,0,0,0,0,2,0,4294681,2020-02-27 04:00:00,2020-02-27T04:00,2020,2,9.3,0.9,Drizzle
06/28/2020,20:00,40.60635,-73.97552,BROOKLYN,1.0,0.0,0,0,1,0,0,0,4323789,2020-06-28 20:00:00,2020-06-28T20:00,2020,6,22.7,0.0,Clear
01/28/2020,16:00,40.622047,-74.03165,BROOKLYN,1.0,0.0,1,0,0,0,0,0,4280171,2020-01-28 16:00:00,2020-01-28T16:00,2020,1,4.6,0.0,Cloudy
08/08/2020,18:00,40.61372,-73.952126,BROOKLYN,0.0,0.0,0,0,0,0,0,0,4336370,2020-08-08 18:00:00,2020-08-08T18:00,2020,8,23.0,0.0,Clear
04/24/2020,16:00,40.67684,-74.00527,BROOKLYN,0.0,0.0,0,0,0,0,0,0,4310543,2020-04-24 16:00:00,2020-04-24T16:00,2020,4,9.0,0.1,Drizzle
01/18/2020,20:00,40.628643,-74.005936,BROOKLYN,1.0,0.0,1,0,0,0,0,0,4275217,2020-01-18 20:00:00,2020-01-18T20:00,2020,1,1.7,1.2,Heavy Snow
04/01/2020,18:00,40.65505,-73.95631,BROOKLYN,1.0,0.0,1,0,0,0,0,0,4305075,2020-04-01 18:00:00,2020-04-01T18:00,2020,4,9.9,0.0,Clear
12/02/2020,14:00,40.636463,-73.9118,BROOKLYN,1.0,0.0,1,0,0,0,0,0,4372664,2020-12-02 14:00:00,2020-12-02T14:00,2020,12,5.9,0.0,Cloudy
06/20/2020,23:00,40.639645,-74.008835,BROOKLYN,0.0,0.0,0,0,0,0,0,0,4321587,2020-06-20 23:00:00,2020-06-20T23:00,2020,6,21.3,0.0,Cloudy
03/12/2020,8:00,40.7065,-73.91701,BROOKLYN,0.0,0.0,0,0,0,0,0,0,4300187,2020-03-12 08:00:00,2020-03-12T08:00,2020,3,5.3,0.0,Cloudy
10/16/2020,9:00,40.692356,-73.911064,BROOKLYN,1.0,0.0,0,0,1,0,0,0,4359002,2020-10-16 09:00:00,2020-10-16T09:00,2020,10,14.2,0.7,Drizzle
07/10/2020,14:00,40.574333,-73.99733,BROOKLYN,1.0,0.0,0,0,0,0,1,0,4327808,2020-07-10 14:00:00,2020-07-10T14:00,2020,7,23.7,8.2,Heavy Rain
05/22/2020,12:00,40.688553,-73.962845,BROOKLYN,1.0,0.0,0,0,1,0,0,0,4320372,2020-05-22 12:00:00,2020-05-22T12:00,2020,5,20.3,0.0,Cloudy
06/21/2020,3:00,40.632015,-73.941765,BROOKLYN,1.0,0.0,0,0,1,0,0,0,4323307,2020-06-21 03:00:00,2020-06-21T03:00,2020,6,19.1,0.0,Cloudy
05/07/2020,8:00,40.612293,-74.00184,BROOKLYN,1.0,0.0,0,0,0,0,1,0,4312290,2020-05-07 08:00:00,2020-05-07T08:00,2020,5,10.8,0.0,Clear
04/16/2020,10:00,40.727604,-73.93662,BROOKLYN,1.0,0.0,0,0,0,0,1,0,4310132,2020-04-16 10:00:00,2020-04-16T10:00,2020,4,7.1,0.0,Clear
08/15/2020,5:00,40.63178,-73.945625,BROOKLYN,1.0,0.0,0,0,1,0,0,0,4338930,2020-08-15 05:00:00,2020-08-15T05:00,2020,8,21.6,0.0,Cloudy
08/21/2020,18:00,40.66331,-73.92106,BROOKLYN,1.0,0.0,1,0,0,0,0,0,4340783,2020-08-21 18:00:00,2020-08-21T18:00,2020,8,25.2,0.0,Cloudy
05/16/2020,18:00,40.68733,-73.87169,BROOKLYN,1.0,0.0,0,0,0,0,1,0,4314005,2020-05-16 18:00:00,2020-05-16T18:00,2020,5,17.7,0.0,Cloudy
12/31/2020,17:00,40.697323,-73.95181,BROOKLYN,1.0,0.0,0,0,0,0,1,0,4381225,2020-12-31 17:00:00,2020-12-31T17:00,2020,12,5.0,0.0,Cloudy
10/01/2020,18:00,40.60312,-73.960556,BROOKLYN,0.0,0.0,0,0,0,0,0,0,4353691,2020-10-01 18:00:00,2020-10-01T18:00,2020,10,18.4,0.0,Clear
11/08/2020,1:00,40.68416,-73.94252,BROOKLYN,1.0,0.0,0,0,1,0,0,0,4365514,2020-11-08 01:00:00,2020-11-08T01:00,2020,11,11.2,0.0,Clear
09/17/2020,19:00,40.63018,-74.015076,BROOKLYN,1.0,0.0,1,0,0,0,0,0,4350601,2020-09-17 19:00:00,2020-09-17T19:00,2020,9,21.1,0.0,Cloudy
09/04/2020,0:00,40.668373,-73.92264,BROOKLYN,1.0,0.0,0,0,0,0,1,0,4344792,2020-09-04 00:00:00,2020-09-04T00:00,2020,9,23.3,0.0,Cloudy
04/13/2020,0:00,40.608078,-73.979706,BROOKLYN,1.0,0.0,0,0,0,0,1,0,4308782,2020-04-13 00:00:00,2020-04-13T00:00,2020,4,13.4,0.0,Cloudy
06/26/2020,20:00,40.710785,-73.95995,BROOKLYN,1.0,0.0,0,0,1,0,0,0,4324218,2020-06-26 20:00:00,2020-06-26T20:00,2020,6,26.4,0.0,Clear
11/14/2020,0:00,40.61196,-73.96816,BROOKLYN,1.0,0.0,1,0,0,0,0,0,4367911,2020-11-14 00:00:00,2020-11-14T00:00,2020,11,7.9,0.0,Clear
08/20/2020,10:00,40.712784,-73.937256,BROOKLYN,1.0,0.0,0,0,1,0,0,0,4340268,2020-08-20 10:00:00,2020-08-20T10:00,2020,8,22.7,0.0,Clear
06/16/2020,19:00,40.652477,-73.86798,BROOKLYN,0.0,0.0,0,0,0,0,0,0,4321109,2020-06-16 19:00:00,2020-06-16T19:00,2020,6,18.3,0.0,Cloudy
10/01/2020,1:00,40.670624,-73.90452,BROOKLYN,1.0,0.0,0,0,0,0,1,0,4353437,2020-10-01 01:00:00,2020-10-01T01:00,2020,10,16.2,0.0,Clear
12/10/2020,0:00,40.683464,-73.97569,BROOKLYN,2.0,0.0,0,0,0,0,2,0,4374946,2020-12-10 00:00:00,2020-12-10T00:00,2020,12,1.8,0.0,Clear
09/01/2020,17:00,40.691593,-73.92996,BROOKLYN,0.0,0.0,0,0,0,0,0,0,4347902,2020-09-01 17:00:00,2020-09-01T17:00,2020,9,23.4,0.0,Clear
01/16/2020,15:00,40.611145,-73.937874,BROOKLYN,0.0,0.0,0,0,0,0,0,0,4274626,2020-01-16 15:00:00,2020-01-16T15:00,2020,1,6.3,0.0,Cloudy
08/15/2020,21:00,40.687855,-73.98148,BROOKLYN,1.0,0.0,0,0,1,0,0,0,4338480,2020-08-15 21:00:00,2020-08-15T21:00,2020,8,22.3,0.0,Cloudy
05/01/2020,20:00,40.573326,-74.002556,BROOKLYN,1.0,0.0,1,0,0,0,0,0,4311602,2020-05-01 20:00:00,2020-05-01T20:00,2020,5,14.1,0.0,Clear
07/04/2020,17:00,40.70743,-73.95505,BROOKLYN,1.0,0.0,0,0,1,0,0,0,4327353,2020-07-04 17:00:00,2020-07-04T17:00,2020,7,25.4,0.0,Clear
05/07/2020,11:00,40.650517,-73.92359,BROOKLYN,2.0,0.0,0,0,0,0,2,0,4312464,2020-05-07 11:00:00,2020-05-07T11:00,2020,5,15.5,0.0,Cloudy
06/17/2020,19:00,40.610954,-74.00877,BROOKLYN,1.0,0.0,1,0,0,0,0,0,4320965,2020-06-17 19:00:00,2020-06-17T19:00,2020,6,17.9,0.0,Cloudy
05/05/2020,10:00,40.70029,-73.92904,BROOKLYN,0.0,0.0,0,0,0,0,0,0,4312169,2020-05-05 10:00:00,2020-05-05T10:00,2020,5,11.4,0.0,Clear
02/28/2020,19:00,40.6216,-73.92327,BROOKLYN,1.0,0.0,0,0,0,0,1,0,4295071,2020-02-28 19:00:00,2020-02-28T19:00,2020,2,3.0,0.0,Clear
05/24/2020,17:00,40.659275,-73.889,BROOKLYN,1.0,0.0,0,0,0,0,1,0,4315684,2020-05-24 17:00:00,2020-05-24T17:00,2020,5,16.0,0.0,Cloudy
12/18/2020,12:00,40.62788,-73.93251,BROOKLYN,0.0,0.0,0,0,0,0,0,0,4377936,2020-12-18 12:00:00,2020-12-18T12:00,2020,12,-2.6,0.0,Clear
11/12/2020,11:00,40.608536,-73.93884,BROOKLYN,0.0,0.0,0,0,0,0,0,0,4373974,2020-11-12 11:00:00,2020-11-12T11:00,2020,11,12.1,0.4,Drizzle
05/18/2020,22:00,40.575413,-73.98347,BROOKLYN,2.0,0.0,0,0,0,0,2,0,4314382,2020-05-18 22:00:00,2020-05-18T22:00,2020,5,13.6,0.0,Cloudy
01/27/2020,12:00,40.651695,-73.94968,BROOKLYN,0.0,0.0,0,0,0,0,0,0,4279788,2020-01-27 12:00:00,2020-01-27T12:00,2020,1,6.6,0.0,Cloudy
04/15/2020,21:00,40.632435,-73.88818,BROOKLYN,4.0,0.0,0,0,0,0,4,0,4309056,2020-04-15 21:00:00,2020-04-15T21:00,2020,4,7.4,0.0,Clear
09/29/2020,14:00,40.686172,-73.970474,BROOKLYN,1.0,0.0,1,0,0,0,0,0,4353947,2020-09-29 14:00:00,2020-09-29T14:00,2020,9,22.5,0.5,Drizzle
07/15/2020,15:00,40.632225,-73.91076,BROOKLYN,0.0,0.0,0,0,0,0,0,0,4328990,2020-07-15 15:00:00,2020-07-15T15:00,2020,7,24.2,0.0,Clear
10/01/2020,21:00,40.62685,-73.97643,BROOKLYN,0.0,0.0,0,0,0,0,0,0,4354660,2020-10-01 21:00:00,2020-10-01T21:00,2020,10,18.2,0.0,Cloudy
05/18/2020,11:00,40.60667,-73.972595,BROOKLYN,2.0,0.0,0,0,0,0,2,0,4314327,2020-05-18 11:00:00,2020-05-18T11:00,2020,5,16.0,0.0,Cloudy
02/23/2020,0:00,40.663124,-73.96244,BROOKLYN,0.0,0.0,0,0,0,0,0,0,4292444,2020-02-23 00:00:00,2020-02-23T00:00,2020,2,0.6,0.0,Clear
11/12/2020,0:00,40.690823,-73.936615,BROOKLYN,1.0,0.0,1,0,0,0,0,0,4369614,2020-11-12 00:00:00,2020-11-12T00:00,2020,11,18.8,0.8,Drizzle
03/13/2020,15:00,40.61747,-73.999626,BROOKLYN,1.0,0.0,0,0,0,0,1,0,4299956,2020-03-13 15:00:00,2020-03-13T15:00,2020,3,19.0,0.0,Clear
07/12/2020,1:00,40.650295,-73.966156,BROOKLYN,0.0,0.0,0,0,0,0,0,0,4327926,2020-07-12 01:00:00,2020-07-12T01:00,2020,7,23.2,0.0,Clear
06/24/2020,0:00,40.647297,-73.9803,BROOKLYN,3.0,0.0,0,0,0,0,3,0,4322676,2020-06-24 00:00:00,2020-06-24T00:00,2020,6,23.1,0.0,Cloudy
10/21/2020,7:00,40.66447,-73.89593,BROOKLYN,1.0,0.0,0,0,1,0,0,0,4359840,2020-10-21 07:00:00,2020-10-21T07:00,2020,10,16.0,0.0,Cloudy
09/30/2020,23:00,40.659817,-73.98785,BROOKLYN,2.0,0.0,0,0,0,0,2,0,4353355,2020-09-30 23:00:00,2020-09-30T23:00,2020,9,16.6,0.0,Clear
07/02/2020,8:00,40.630028,-73.93581,BROOKLYN,1.0,0.0,0,0,0,0,1,0,4326392,2020-07-02 08:00:00,2020-07-02T08:00,2020,7,23.4,0.0,Clear
12/29/2020,14:00,40.695015,-73.98876,BROOKLYN,1.0,0.0,0,0,0,0,1,0,4380205,2020-12-29 14:00:00,2020-12-29T14:00,2020,12,3.2,0.0,Cloudy
09/26/2020,0:00,40.656315,-73.93961,BROOKLYN,3.0,0.0,0,0,0,0,3,0,4351844,2020-09-26 00:00:00,2020-09-26T00:00,2020,9,16.7,0.0,Clear
10/29/2020,1:00,40.676468,-73.91301,BROOKLYN,1.0,0.0,0,0,0,0,1,0,4362215,2020-10-29 01:00:00,2020-10-29T01:00,2020,10,12.9,0.0,Cloudy
05/29/2020,16:00,40.590305,-73.95265,BROOKLYN,0.0,0.0,0,0,0,0,0,0,4316952,2020-05-29 16:00:00,2020-05-29T16:00,2020,5,21.5,0.0,Cloudy
11/17/2020,9:00,40.707012,-73.93871,BROOKLYN,0.0,0.0,0,0,0,0,0,0,4369461,2020-11-17 09:00:00,2020-11-17T09:00,2020,11,6.6,0.0,Cloudy
07/16/2020,14:00,40.655247,-73.981804,BROOKLYN,1.0,0.0,1,0,0,0,0,0,4329413,2020-07-16 14:00:00,2020-07-16T14:00,2020,7,23.6,0.0,Clear
07/29/2020,0:00,40.63021,-73.93294,BROOKLYN,2.0,0.0,0,0,0,0,2,0,4333287,2020-07-29 00:00:00,2020-07-29T00:00,2020,7,26.1,0.0,Cloudy
03/24/2020,10:00,40.67221,-73.92802,BROOKLYN,1.0,0.0,0,0,0,0,1,0,4304051,2020-03-24 10:00:00,2020-03-24T10:00,2020,3,7.8,0.0,Clear
03/27/2020,16:00,40.67997,-73.94168,BROOKLYN,1.0,0.0,0,0,1,0,0,0,4304520,2020-03-27 16:00:00,2020-03-27T16:00,2020,3,17.8,0.0,Clear
05/11/2020,15:00,40.700485,-73.93637,BROOKLYN,1.0,0.0,0,0,0,0,1,0,4313055,2020-05-11 15:00:00,2020-05-11T15:00,2020,5,13.1,0.5,Drizzle
06/02/2020,19:00,40.63461,-74.01576,BROOKLYN,1.0,0.0,0,0,0,0,1,0,4318034,2020-06-02 19:00:00,2020-06-02T19:00,2020,6,18.3,0.0,Cloudy
04/28/2020,10:00,40.634747,-73.9189,BROOKLYN,1.0,0.0,1,0,0,0,0,0,4311168,2020-04-28 10:00:00,2020-04-28T10:00,2020,4,11.4,0.0,Clear
03/05/2020,20:00,40.606422,-74.0147,BROOKLYN,2.0,0.0,0,0,0,0,2,0,4298009,2020-03-05 20:00:00,2020-03-05T20:00,2020,3,5.1,0.0,Cloudy
03/26/2020,17:00,40.69285,-73.90355,BROOKLYN,1.0,0.0,0,0,0,0,1,0,4304074,2020-03-26 17:00:00,2020-03-26T17:00,2020,3,7.4,0.0,Clear
10/12/2020,10:00,40.610523,-74.00806,BROOKLYN,1.0,0.0,1,0,0,0,0,0,4357026,2020-10-12 10:00:00,2020-10-12T10:00,2020,10,11.9,2.1,Light Rain
04/16/2020,17:00,40.652752,-73.88629,BROOKLYN,0.0,0.0,0,0,0,0,0,0,4309422,2020-04-16 17:00:00,2020-04-16T17:00,2020,4,8.5,0.0,Cloudy
12/09/2020,16:00,40.69602,-73.99548,BROOKLYN,0.0,0.0,0,0,0,0,0,0,4374642,2020-12-09 16:00:00,2020-12-09T16:00,2020,12,2.7,0.0,Clear
10/03/2020,21:00,40.69624,-73.99004,BROOKLYN,1.0,0.0,0,0,1,0,0,0,4354432,2020-10-03 21:00:00,2020-10-03T21:00,2020,10,11.2,0.0,Clear
08/23/2020,14:00,40.65136,-73.86971,BROOKLYN,0.0,0.0,0,0,0,0,0,0,4342271,2020-08-23 14:00:00,2020-08-23T14:00,2020,8,26.6,0.0,Clear
12/12/2020,13:00,40.6687,-73.9965,BROOKLYN,1.0,0.0,0,0,0,0,1,0,4375313,2020-12-12 13:00:00,2020-12-12T13:00,2020,12,12.3,0.3,Drizzle
10/08/2020,13:00,40.58972,-73.964645,BROOKLYN,1.0,0.0,0,0,0,0,1,0,4355872,2020-10-08 13:00:00,2020-10-08T13:00,2020,10,18.3,0.0,Clear
10/11/2020,17:00,40.651234,-73.86991,BROOKLYN,1.0,0.0,1,0,0,0,0,0,4356631,2020-10-11 17:00:00,2020-10-11T17:00,2020,10,17.8,0.0,Cloudy
05/27/2020,0:00,40.64902,-74.00625,BROOKLYN,0.0,0.0,0,0,0,0,0,0,4316523,2020-05-27 00:00:00,2020-05-27T00:00,2020,5,15.2,0.0,Cloudy
01/03/2020,8:00,40.61872,-74.027306,BROOKLYN,1.0,0.0,0,0,0,0,1,0,4268642,2020-01-03 08:00:00,2020-01-03T08:00,2020,1,5.8,0.9,Drizzle
04/14/2020,17:00,40.6913,-73.9455,BROOKLYN,1.0,0.0,0,0,1,0,0,0,4309062,2020-04-14 17:00:00,2020-04-14T17:00,2020,4,11.8,0.0,Cloudy
10/09/2020,10:00,40.655827,-73.91034,BROOKLYN,0.0,0.0,0,0,0,0,0,0,4356280,2020-10-09 10:00:00,2020-10-09T10:00,2020,10,15.7,0.0,Clear
09/22/2020,18:00,40.6993,-73.91361,BROOKLYN,1.0,0.0,1,0,0,0,0,0,4353548,2020-09-22 18:00:00,2020-09-22T18:00,2020,9,19.0,0.0,Clear
03/07/2020,6:00,40.59417,-73.979034,BROOKLYN,0.0,0.0,0,0,0,0,0,0,4305712,2020-03-07 06:00:00,2020-03-07T06:00,2020,3,1.5,0.0,Cloudy
06/18/2020,23:00,40.691822,-73.92223,BROOKLYN,2.0,0.0,0,0,0,0,2,0,4321288,2020-06-18 23:00:00,2020-06-18T23:00,2020,6,18.5,0.0,Cloudy
06/09/2020,20:00,40.641674,-74.00313,BROOKLYN,1.0,0.0,0,0,1,0,0,0,4319451,2020-06-09 20:00:00,2020-06-09T20:00,2020,6,25.0,0.0,Clear
05/06/2020,15:00,40.7114,-73.942184,BROOKLYN,2.0,0.0,0,0,0,0,2,0,4312360,2020-05-06 15:00:00,2020-05-06T15:00,2020,5,9.4,0.7,Drizzle
07/24/2020,17:00,40.6337,-73.96719,BROOKLYN,1.0,0.0,0,0,1,0,0,0,4331693,2020-07-24 17:00:00,2020-07-24T17:00,2020,7,25.8,0.0,Cloudy
12/14/2020,12:00,40.714066,-73.95163,BROOKLYN,0.0,0.0,0,0,0,0,0,0,4376134,2020-12-14 12:00:00,2020-12-14T12:00,2020,12,3.0,0.8,Drizzle
02/29/2020,0:00,40.686726,-73.939735,BROOKLYN,0.0,0.0,0,0,0,0,0,0,4297094,2020-02-29 00:00:00,2020-02-29T00:00,2020,2,-0.8,0.0,Clear
12/23/2020,20:00,40.676144,-73.893074,BROOKLYN,1.0,0.0,1,0,0,0,0,0,4379630,2020-12-23 20:00:00,2020-12-23T20:00,2020,12,4.0,0.0,Cloudy
06/05/2020,14:00,40.657642,-73.8749,BROOKLYN,1.0,0.0,1,0,0,0,0,0,4318541,2020-06-05 14:00:00,2020-06-05T14:00,2020,6,24.5,0.4,Drizzle
05/28/2020,23:00,40.660713,-73.9411,BROOKLYN,0.0,0.0,0,0,0,0,0,0,4316475,2020-05-28 23:00:00,2020-05-28T23:00,2020,5,17.0,0.0,Cloudy
02/03/2020,18:00,40.652237,-73.949745,BROOKLYN,1.0,0.0,1,0,0,0,0,0,4283575,2020-02-03 18:00:00,2020-02-03T18:00,2020,2,7.6,0.0,Clear
04/04/2020,14:00,40.649086,-74.007835,BROOKLYN,0.0,0.0,0,0,0,0,0,0,4307530,2020-04-04 14:00:00,2020-04-04T14:00,2020,4,12.6,0.0,Cloudy
01/12/2020,12:00,40.635475,-73.97013,BROOKLYN,0.0,0.0,0,0,0,0,0,0,4273089,2020-01-12 12:00:00,2020-01-12T12:00,2020,1,18.5,0.0,Cloudy
06/07/2020,19:00,40.696033,-73.98453,BROOKLYN,3.0,0.0,0,0,0,0,3,0,4319095,2020-06-07 19:00:00,2020-06-07T19:00,2020,6,20.9,0.0,Clear
08/19/2020,8:00,40.613174,-73.997284,BROOKLYN,1.0,0.0,0,0,0,0,1,0,4339877,2020-08-19 08:00:00,2020-08-19T08:00,2020,8,22.2,0.0,Cloudy
11/11/2020,19:00,40.652477,-73.86798,BROOKLYN,1.0,0.0,0,0,0,0,1,0,4366907,2020-11-11 19:00:00,2020-11-11T19:00,2020,11,17.3,1.5,Light Rain
07/05/2020,17:00,40.66636,-73.97872,BROOKLYN,1.0,0.0,0,0,0,0,1,0,4325764,2020-07-05 17:00:00,2020-07-05T17:00,2020,7,28.3,0.0,Cloudy
10/29/2020,20:00,40.66551,-73.992775,BROOKLYN,1.0,0.0,1,0,0,0,0,0,4362721,2020-10-29 20:00:00,2020-10-29T20:00,2020,10,8.9,0.0,Cloudy
03/18/2020,9:00,40.631428,-73.931145,BROOKLYN,1.0,0.0,0,0,0,0,1,0,4302585,2020-03-18 09:00:00,2020-03-18T09:00,2020,3,7.8,0.0,Clear
03/14/2020,5:00,40.63403,-73.9665,BROOKLYN,1.0,0.0,0,0,0,0,1,0,4300317,2020-03-14 05:00:00,2020-03-14T05:00,2020,3,4.6,0.0,Cloudy
03/14/2020,16:00,40.718338,-73.960045,BROOKLYN,0.0,0.0,0,0,0,0,0,0,4300866,2020-03-14 16:00:00,2020-03-14T16:00,2020,3,12.0,0.0,Cloudy
08/07/2020,6:00,40.68244,-73.96198,BROOKLYN,1.0,0.0,1,0,0,0,0,0,4336131,2020-08-07 06:00:00,2020-08-07T06:00,2020,8,22.1,0.0,Cloudy
05/01/2020,21:00,40.638405,-73.882614,BROOKLYN,1.0,0.0,0,0,0,0,1,0,4311671,2020-05-01 21:00:00,2020-05-01T21:00,2020,5,13.6,0.0,Clear
04/24/2020,10:00,40.67655,-73.914505,BROOKLYN,0.0,0.0,0,0,0,0,0,0,4310212,2020-04-24 10:00:00,2020-04-24T10:00,2020,4,7.4,1.1,Drizzle
01/27/2020,18:00,40.66895,-73.9339,BROOKLYN,2.0,0.0,0,0,0,0,2,0,4285133,2020-01-27 18:00:00,2020-01-27T18:00,2020,1,4.7,0.0,Cloudy
01/20/2020,0:00,40.661713,-73.903824,BROOKLYN,2.0,0.0,0,0,0,0,2,0,4277510,2020-01-20 00:00:00,2020-01-20T00:00,2020,1,-2.7,0.0,Cloudy
07/16/2020,20:00,40.653038,-73.91523,BROOKLYN,0.0,0.0,0,0,0,0,0,0,4329868,2020-07-16 20:00:00,2020-07-16T20:00,2020,7,21.3,0.0,Cloudy
01/27/2020,22:00,40.623592,-73.97581,BROOKLYN,0.0,0.0,0,0,0,0,0,0,4280492,2020-01-27 22:00:00,2020-01-27T22:00,2020,1,3.9,0.0,Cloudy
05/05/2020,10:00,40.668427,-73.97777,BROOKLYN,0.0,0.0,0,0,0,0,0,0,4311893,2020-05-05 10:00:00,2020-05-05T10:00,2020,5,11.3,0.0,Clear
04/23/2020,18:00,40.651367,-73.95592,BROOKLYN,1.0,0.0,0,0,1,0,0,0,4310413,2020-04-23 18:00:00,2020-04-23T18:00,2020,4,7.4,0.0,Cloudy
01/29/2020,14:00,40.636005,-73.99827,BROOKLYN,1.0,0.0,0,0,0,0,1,0,4281023,2020-01-29 14:00:00,2020-01-29T14:00,2020,1,3.6,0.0,Clear
01/21/2020,16:00,40.67308,-73.91124,BROOKLYN,3.0,0.0,0,0,0,0,3,0,4277486,2020-01-21 16:00:00,2020-01-21T16:00,2020,1,0.5,0.0,Clear
10/05/2020,12:00,40.71407,-73.954346,BROOKLYN,1.0,0.0,0,0,0,0,1,0,4355002,2020-10-05 12:00:00,2020-10-05T12:00,2020,10,19.4,0.0,Clear
01/25/2020,11:00,40.687183,-73.92253,BROOKLYN,0.0,0.0,0,0,0,0,0,0,4279072,2020-01-25 11:00:00,2020-01-25T11:00,2020,1,6.8,2.3,Light Rain
03/29/2020,12:00,0.0,0.0,BROOKLYN,0.0,0.0,0,0,0,0,0,0,4304414,2020-03-29 12:00:00,2020-03-29T12:00,2020,3,29.0,0.0,Clear
12/17/2020,12:00,40.673485,-73.99524,BROOKLYN,1.0,0.0,1,0,0,0,0,0,4376962,2020-12-17 12:00:00,2020-12-17T12:00,2020,12,-2.9,0.0,Cloudy
06/22/2020,20:00,40.655754,-73.92403,BROOKLYN,1.0,0.0,0,0,0,0,1,0,4323282,2020-06-22 20:00:00,2020-06-22T20:00,2020,6,24.7,0.0,Clear
04/02/2020,15:00,40.71819,-73.95829,BROOKLYN,1.0,0.0,0,0,0,0,1,0,4307436,2020-04-02 15:00:00,2020-04-02T15:00,2020,4,13.5,0.0,Cloudy
05/24/2020,20:00,40.671665,-73.917885,BROOKLYN,1.0,0.0,1,0,0,0,0,0,4315528,2020-05-24 20:00:00,2020-05-24T20:00,2020,5,13.1,0.0,Cloudy
12/07/2020,23:00,40.644634,-73.943115,BROOKLYN,0.0,0.0,0,0,0,0,0,0,4375609,2020-12-07 23:00:00,2020-12-07T23:00,2020,12,-0.2,0.0,Cloudy
07/04/2020,18:00,40.573524,-73.98959,BROOKLYN,0.0,0.0,0,0,0,0,0,0,4326235,2020-07-04 18:00:00,2020-07-04T18:00,2020,7,23.0,0.0,Clear
12/15/2020,19:00,40.609463,-73.97419,BROOKLYN,1.0,0.0,1,0,0,0,0,0,4376364,2020-12-15 19:00:00,2020-12-15T19:00,2020,12,0.7,0.0,Cloudy
02/29/2020,10:00,40.6525,-73.924644,BROOKLYN,0.0,0.0,0,0,0,0,0,0,4295597,2020-02-29 10:00:00,2020-02-29T10:00,2020,2,0.8,0.0,Clear
10/07/2020,23:00,40.634815,-73.98876,BROOKLYN,0.0,0.0,0,0,0,0,0,0,4355617,2020-10-07 23:00:00,2020-10-07T23:00,2020,10,16.2,0.0,Clear
10/07/2020,19:00,40.70281,-73.9254,BROOKLYN,1.0,0.0,0,0,1,0,0,0,4363606,2020-10-07 19:00:00,2020-10-07T19:00,2020,10,18.8,0.0,Clear
02/10/2020,18:00,40.65318,-74.00561,BROOKLYN,1.0,0.0,0,0,0,0,1,0,4286515,2020-02-10 18:00:00,2020-02-10T18:00,2020,2,6.4,0.2,Drizzle
07/25/2020,1:00,40.67118,-73.89181,BROOKLYN,1.0,0.0,0,0,1,0,0,0,4332322,2020-07-25 01:00:00,2020-07-25T01:00,2020,7,22.6,0.1,Drizzle
03/07/2020,6:00,40.661083,-73.908035,BROOKLYN,0.0,0.0,0,0,0,0,0,0,4305939,2020-03-07 06:00:00,2020-03-07T06:00,2020,3,1.0,0.0,Cloudy
12/23/2020,15:00,40.620323,-74.02723,BROOKLYN,1.0,0.0,1,0,0,0,0,0,4380310,2020-12-23 15:00:00,2020-12-23T15:00,2020,12,4.0,0.0,Cloudy
04/29/2020,13:00,40.718082,-73.95229,BROOKLYN,2.0,0.0,0,0,0,0,2,0,4310937,2020-04-29 13:00:00,2020-04-29T13:00,2020,4,13.8,0.0,Cloudy
05/19/2020,9:00,40.679825,-73.99515,BROOKLYN,0.0,0.0,0,0,0,0,0,0,4314620,2020-05-19 09:00:00,2020-05-19T09:00,2020,5,15.7,0.0,Cloudy
06/17/2020,7:00,40.64297,-73.97903,BROOKLYN,1.0,0.0,1,0,0,0,0,0,4321068,2020-06-17 07:00:00,2020-06-17T07:00,2020,6,17.8,0.0,Cloudy
11/22/2020,18:00,40.65642,-73.933815,BROOKLYN,1.0,0.0,1,0,0,0,0,0,4369828,2020-11-22 18:00:00,2020-11-22T18:00,2020,11,13.0,0.0,Cloudy
01/01/2020,12:00,40.67619,-73.9081,BROOKLYN,0.0,0.0,0,0,0,0,0,0,4271400,2020-01-01 12:00:00,2020-01-01T12:00,2020,1,4.4,0.0,Cloudy
07/10/2020,19:00,40.633636,-73.951065,BROOKLYN,1.0,0.0,0,0,0,0,1,0,4327901,2020-07-10 19:00:00,2020-07-10T19:00,2020,7,23.5,0.9,Drizzle
06/24/2020,18:00,40.68309,-73.910774,BROOKLYN,1.0,0.0,0,0,1,0,0,0,4322915,2020-06-24 18:00:00,2020-06-24T18:00,2020,6,28.2,0.0,Clear
07/19/2020,0:00,40.63529,-74.02502,BROOKLYN,1.0,0.0,0,0,1,0,0,0,4329900,2020-07-19 00:00:00,2020-07-19T00:00,2020,7,23.5,0.0,Cloudy
06/04/2020,11:00,40.67922,-73.90405,BROOKLYN,2.0,0.0,0,0,0,0,2,0,4318116,2020-06-04 11:00:00,2020-06-04T11:00,2020,6,27.5,0.0,Cloudy
12/16/2020,11:00,40.607265,-73.92219,BROOKLYN,1.0,0.0,0,0,0,0,1,0,4377925,2020-12-16 11:00:00,2020-12-16T11:00,2020,12,-0.2,0.0,Cloudy
08/30/2020,18:00,40.62591,-73.92083,BROOKLYN,1.0,0.0,0,0,1,0,0,0,4343246,2020-08-30 18:00:00,2020-08-30T18:00,2020,8,23.9,0.0,Clear
05/21/2020,12:00,40.666885,-73.98159,BROOKLYN,1.0,0.0,0,0,1,0,0,0,4315033,2020-05-21 12:00:00,2020-05-21T12:00,2020,5,14.6,0.0,Clear
12/18/2020,13:00,40.654003,-73.979935,BROOKLYN,1.0,0.0,0,0,0,0,1,0,4377250,2020-12-18 13:00:00,2020-12-18T13:00,2020,12,-2.3,0.0,Clear
11/18/2020,12:00,40.652855,-73.945915,BROOKLYN,1.0,0.0,0,0,0,0,1,0,4368802,2020-11-18 12:00:00,2020-11-18T12:00,2020,11,1.8,0.0,Clear
04/01/2020,12:00,40.68556,-73.90719,BROOKLYN,1.0,0.0,0,0,0,0,1,0,4305127,2020-04-01 12:00:00,2020-04-01T12:00,2020,4,9.7,0.0,Cloudy
06/12/2020,13:00,40.600258,-73.95378,BROOKLYN,1.0,0.0,0,0,0,0,1,0,4319551,2020-06-12 13:00:00,2020-06-12T13:00,2020,6,27.4,0.0,Clear
10/17/2020,14:00,40.646637,-74.01589,BROOKLYN,1.0,0.0,0,0,0,0,1,0,4358475,2020-10-17 14:00:00,2020-10-17T14:00,2020,10,15.5,0.0,Clear
08/13/2020,15:00,40.684246,-73.92869,BROOKLYN,1.0,0.0,0,0,0,0,1,0,4338659,2020-08-13 15:00:00,2020-08-13T15:00,2020,8,25.5,0.2,Drizzle
05/15/2020,13:00,40.67038,-73.88974,BROOKLYN,1.0,0.0,0,0,0,0,1,0,4313734,2020-05-15 13:00:00,2020-05-15T13:00,2020,5,26.1,0.0,Cloudy
06/26/2020,19:00,40.60969,-73.96497,BROOKLYN,1.0,0.0,0,0,0,0,1,0,4323522,2020-06-26 19:00:00,2020-06-26T19:00,2020,6,27.6,0.0,Clear
11/26/2020,0:00,40.661396,-73.92182,BROOKLYN,0.0,0.0,0,0,0,0,0,0,4371444,2020-11-26 00:00:00,2020-11-26T00:00,2020,11,10.9,0.5,Drizzle
07/23/2020,21:00,40.6283,-73.98438,BROOKLYN,0.0,0.0,0,0,0,0,0,0,4332018,2020-07-23 21:00:00,2020-07-23T21:00,2020,7,26.5,0.0,Cloudy
04/24/2020,21:00,40.70914,-73.950836,BROOKLYN,1.0,0.0,1,0,0,0,0,0,4310522,2020-04-24 21:00:00,2020-04-24T21:00,2020,4,6.2,0.0,Clear
02/09/2020,7:00,40.65662,-73.889175,BROOKLYN,1.0,0.0,0,0,0,0,1,0,4285578,2020-02-09 07:00:00,2020-02-09T07:00,2020,2,-1.8,0.0,Clear
07/29/2020,19:00,40.704716,-73.92875,BROOKLYN,1.0,0.0,1,0,0,0,0,0,4333152,2020-07-29 19:00:00,2020-07-29T19:00,2020,7,27.5,0.0,Clear
01/23/2020,16:00,40.766193,-73.96205,MANHATTAN,1.0,0.0,1,0,0,0,0,0,4278102,2020-01-23 16:00:00,2020-01-23T16:00,2020,1,4.5,0.0,Cloudy
02/15/2020,10:00,40.753185,-73.98721,MANHATTAN,0.0,0.0,0,0,0,0,0,0,4289334,2020-02-15 10:00:00,2020-02-15T10:00,2020,2,-6.7,0.0,Clear
11/12/2020,0:00,40.701782,-74.01117,MANHATTAN,1.0,0.0,0,0,0,0,1,0,4367528,2020-11-12 00:00:00,2020-11-12T00:00,2020,11,18.7,0.6,Drizzle
02/13/2020,20:00,40.74831,-73.97455,MANHATTAN,1.0,0.0,0,0,1,0,0,0,4288133,2020-02-13 20:00:00,2020-02-13T20:00,2020,2,4.6,0.0,Cloudy
06/03/2020,18:00,40.791283,-73.97241,MANHATTAN,1.0,0.0,0,0,1,0,0,0,4318514,2020-06-03 18:00:00,2020-06-03T18:00,2020,6,25.4,0.0,Cloudy
01/29/2020,15:00,40.716976,-73.98229,MANHATTAN,0.0,0.0,0,0,0,0,0,0,4280629,2020-01-29 15:00:00,2020-01-29T15:00,2020,1,4.4,0.0,Clear
09/27/2020,17:00,40.810276,-73.94738,MANHATTAN,1.0,0.0,0,0,0,0,1,0,4352159,2020-09-27 17:00:00,2020-09-27T17:00,2020,9,23.1,0.0,Cloudy
12/19/2020,18:00,40.81151,-73.94649,MANHATTAN,1.0,0.0,0,0,0,0,1,0,4377799,2020-12-19 18:00:00,2020-12-19T18:00,2020,12,-5.4,0.0,Cloudy
06/29/2020,0:00,40.76275,-73.99692,MANHATTAN,1.0,0.0,0,0,0,0,1,0,4323951,2020-06-29 00:00:00,2020-06-29T00:00,2020,6,22.5,0.0,Clear
05/02/2020,20:00,40.814774,-73.94038,MANHATTAN,2.0,0.0,1,0,1,0,0,0,4311882,2020-05-02 20:00:00,2020-05-02T20:00,2020,5,16.2,0.0,Clear
01/01/2020,4:00,40.83718,-73.942604,MANHATTAN,1.0,0.0,1,0,0,0,0,0,4268311,2020-01-01 04:00:00,2020-01-01T04:00,2020,1,0.4,0.0,Cloudy
09/14/2020,15:00,40.719048,-73.99648,MANHATTAN,2.0,0.0,0,0,0,0,2,0,4350737,2020-09-14 15:00:00,2020-09-14T15:00,2020,9,24.9,0.0,Clear
03/02/2020,9:00,40.848682,-73.939224,MANHATTAN,0.0,0.0,0,0,0,0,0,0,4297198,2020-03-02 09:00:00,2020-03-02T09:00,2020,3,5.0,0.0,Clear
07/25/2020,22:00,40.71299,-74.00418,MANHATTAN,1.0,0.0,0,0,1,0,0,0,4332841,2020-07-25 22:00:00,2020-07-25T22:00,2020,7,25.9,0.0,Clear
03/07/2020,17:00,40.77656,-73.95271,MANHATTAN,0.0,0.0,0,0,0,0,0,0,4305735,2020-03-07 17:00:00,2020-03-07T17:00,2020,3,6.4,0.0,Clear
02/15/2020,23:00,40.74456,-73.983185,MANHATTAN,1.0,0.0,0,0,0,0,1,0,4289343,2020-02-15 23:00:00,2020-02-15T23:00,2020,2,-3.2,0.0,Cloudy
06/27/2020,15:00,40.82982,-73.940575,MANHATTAN,1.0,0.0,0,0,0,0,1,0,4327890,2020-06-27 15:00:00,2020-06-27T15:00,2020,6,24.9,3.5,Heavy Rain
05/31/2020,6:00,40.72179,-73.99986,MANHATTAN,1.0,0.0,1,0,0,0,0,0,4316770,2020-05-31 06:00:00,2020-05-31T06:00,2020,5,13.1,0.0,Clear
01/09/2020,14:00,40.7606,-73.96434,MANHATTAN,0.0,0.0,0,0,0,0,0,0,4270831,2020-01-09 14:00:00,2020-01-09T14:00,2020,1,0.2,0.0,Cloudy
06/14/2020,5:00,40.82653,-73.94667,MANHATTAN,1.0,0.0,0,0,0,0,1,0,4320054,2020-06-14 05:00:00,2020-06-14T05:00,2020,6,11.7,0.0,Clear
11/03/2020,0:00,40.827194,-73.944374,MANHATTAN,1.0,0.0,1,0,0,0,0,0,4366717,2020-11-03 00:00:00,2020-11-03T00:00,2020,11,4.1,0.0,Clear
03/02/2020,10:00,40.8037,-73.93582,MANHATTAN,1.0,0.0,0,0,0,0,1,0,4296826,2020-03-02 10:00:00,2020-03-02T10:00,2020,3,7.8,0.0,Clear
02/26/2020,6:00,40.784237,-73.947075,MANHATTAN,1.0,0.0,0,0,1,0,0,0,4293864,2020-02-26 06:00:00,2020-02-26T06:00,2020,2,5.9,0.0,Cloudy
08/07/2020,17:00,40.73609,-73.98429,MANHATTAN,0.0,0.0,0,0,0,0,0,0,4336453,2020-08-07 17:00:00,2020-08-07T17:00,2020,8,25.5,0.0,Cloudy
08/05/2020,15:00,40.80641,-73.94227,MANHATTAN,1.0,0.0,0,0,0,0,1,0,4335416,2020-08-05 15:00:00,2020-08-05T15:00,2020,8,30.8,0.0,Clear
05/02/2020,16:00,40.798626,-73.93953,MANHATTAN,1.0,0.0,1,0,0,0,0,0,4312781,2020-05-02 16:00:00,2020-05-02T16:00,2020,5,21.3,0.0,Clear
06/30/2020,18:00,40.762287,-73.972374,MANHATTAN,1.0,0.0,0,0,1,0,0,0,4330067,2020-06-30 18:00:00,2020-06-30T18:00,2020,6,21.9,1.4,Light Rain
03/08/2020,22:00,40.75185,-73.9937,MANHATTAN,1.0,0.0,0,0,0,0,1,0,4306279,2020-03-08 22:00:00,2020-03-08T22:00,2020,3,7.0,0.0,Clear
06/12/2020,20:00,40.74148,-73.99891,MANHATTAN,0.0,0.0,0,0,0,0,0,0,4320873,2020-06-12 20:00:00,2020-06-12T20:00,2020,6,23.4,0.0,Clear
07/05/2020,9:00,40.778805,-73.947975,MANHATTAN,1.0,0.0,1,0,0,0,0,0,4325729,2020-07-05 09:00:00,2020-07-05T09:00,2020,7,26.5,0.0,Clear
01/20/2020,8:00,40.717926,-73.98568,MANHATTAN,0.0,0.0,0,0,0,0,0,0,4277062,2020-01-20 08:00:00,2020-01-20T08:00,2020,1,-6.2,0.0,Clear
02/21/2020,8:00,40.70495,-74.01156,MANHATTAN,1.0,0.0,1,0,0,0,0,0,4294250,2020-02-21 08:00:00,2020-02-21T08:00,2020,2,-5.7,0.0,Clear
12/31/2020,21:00,40.811665,-73.93509,MANHATTAN,0.0,0.0,0,0,0,0,0,0,4381434,2020-12-31 21:00:00,2020-12-31T21:00,2020,12,3.0,0.0,Clear
01/24/2020,9:00,40.739613,-73.99629,MANHATTAN,1.0,0.0,1,0,0,0,0,0,4278284,2020-01-24 09:00:00,2020-01-24T09:00,2020,1,1.6,0.0,Clear
03/25/2020,12:00,40.76031,-73.9717,MANHATTAN,1.0,0.0,0,0,0,0,1,0,4303807,2020-03-25 12:00:00,2020-03-25T12:00,2020,3,7.3,0.0,Cloudy
04/15/2020,22:00,40.74777,-74.000404,MANHATTAN,1.0,0.0,0,0,0,0,1,0,4309333,2020-04-15 22:00:00,2020-04-15T22:00,2020,4,5.7,0.0,Clear
10/23/2020,19:00,40.762672,-73.97327,MANHATTAN,1.0,0.0,0,0,1,0,0,0,4360547,2020-10-23 19:00:00,2020-10-23T19:00,2020,10,16.0,0.0,Cloudy
04/16/2020,0:00,40.763733,-73.962074,MANHATTAN,1.0,0.0,0,0,0,0,1,0,4309577,2020-04-16 00:00:00,2020-04-16T00:00,2020,4,4.9,0.0,Cloudy
08/16/2020,17:00,40.843567,-73.93422,MANHATTAN,1.0,0.0,1,0,0,0,0,0,4338793,2020-08-16 17:00:00,2020-08-16T17:00,2020,8,20.9,0.1,Drizzle
02/19/2020,10:00,40.725773,-74.00091,MANHATTAN,1.0,0.0,1,0,0,0,0,0,4290994,2020-02-19 10:00:00,2020-02-19T10:00,2020,2,6.3,0.0,Clear
08/27/2020,10:00,40.743893,-73.9717,MANHATTAN,1.0,0.0,0,0,0,0,1,0,4342313,2020-08-27 10:00:00,2020-08-27T10:00,2020,8,26.4,0.0,Clear
12/02/2020,23:00,40.80333,-73.94873,MANHATTAN,2.0,0.0,0,0,0,0,2,0,4374164,2020-12-02 23:00:00,2020-12-02T23:00,2020,12,2.6,0.0,Clear
02/21/2020,16:00,40.753754,-73.98863,MANHATTAN,0.0,0.0,0,0,0,0,0,0,4296387,2020-02-21 16:00:00,2020-02-21T16:00,2020,2,1.5,0.0,Clear
12/10/2020,13:00,40.715996,-74.0071,MANHATTAN,1.0,0.0,1,0,0,0,0,0,4374976,2020-12-10 13:00:00,2020-12-10T13:00,2020,12,9.1,0.0,Clear
11/18/2020,11:00,40.736706,-73.97822,MANHATTAN,1.0,0.0,1,0,0,0,0,0,4369547,2020-11-18 11:00:00,2020-11-18T11:00,2020,11,1.4,0.0,Clear
03/05/2020,22:00,40.753994,-73.9742,MANHATTAN,1.0,0.0,0,0,0,0,1,0,4298156,2020-03-05 22:00:00,2020-03-05T22:00,2020,3,3.2,0.0,Cloudy
11/03/2020,18:00,40.719517,-73.994385,MANHATTAN,1.0,0.0,0,0,0,0,1,0,4366932,2020-11-03 18:00:00,2020-11-03T18:00,2020,11,8.1,0.0,Clear
05/21/2020,15:00,40.791084,-73.953445,MANHATTAN,0.0,0.0,0,0,0,0,0,0,4315636,2020-05-21 15:00:00,2020-05-21T15:00,2020,5,16.5,0.0,Clear
10/01/2020,13:00,40.802696,-73.949196,MANHATTAN,0.0,0.0,0,0,0,0,0,0,4353726,2020-10-01 13:00:00,2020-10-01T13:00,2020,10,22.1,0.0,Cloudy
02/10/2020,0:00,40.77303,-73.97829,MANHATTAN,1.0,0.0,1,0,0,0,0,0,4391423,2020-02-10 00:00:00,2020-02-10T00:00,2020,2,3.5,0.1,Drizzle
08/27/2020,8:00,40.74954,-73.97744,MANHATTAN,0.0,0.0,0,0,0,0,0,0,4342314,2020-08-27 08:00:00,2020-08-27T08:00,2020,8,21.8,0.5,Drizzle
03/07/2020,17:00,40.75524,-73.97328,MANHATTAN,1.0,0.0,0,0,0,0,1,0,4301955,2020-03-07 17:00:00,2020-03-07T17:00,2020,3,6.3,0.0,Clear
06/23/2020,10:00,40.722584,-74.00636,MANHATTAN,1.0,0.0,0,0,0,0,1,0,4322449,2020-06-23 10:00:00,2020-06-23T10:00,2020,6,27.4,0.0,Cloudy
10/23/2020,17:00,40.81386,-73.95669,MANHATTAN,1.0,0.0,0,0,0,0,1,0,4363019,2020-10-23 17:00:00,2020-10-23T17:00,2020,10,17.1,0.0,Clear
10/21/2020,19:00,40.748302,-73.97835,MANHATTAN,1.0,0.0,0,0,0,0,1,0,4360287,2020-10-21 19:00:00,2020-10-21T19:00,2020,10,17.2,0.0,Clear
10/10/2020,20:00,40.726974,-73.98751,MANHATTAN,1.0,0.0,0,0,1,0,0,0,4356540,2020-10-10 20:00:00,2020-10-10T20:00,2020,10,19.5,0.0,Cloudy
05/18/2020,19:00,40.76229,-73.986115,MANHATTAN,0.0,0.0,0,0,0,0,0,0,4314400,2020-05-18 19:00:00,2020-05-18T19:00,2020,5,15.6,0.0,Cloudy
08/01/2020,8:00,40.767185,-73.98997,MANHATTAN,0.0,0.0,0,0,0,0,0,0,4334406,2020-08-01 08:00:00,2020-08-01T08:00,2020,8,25.7,0.0,Clear
09/14/2020,0:00,40.784534,-73.9736,MANHATTAN,1.0,0.0,0,0,0,0,1,0,4348381,2020-09-14 00:00:00,2020-09-14T00:00,2020,9,19.9,0.0,Cloudy
02/10/2020,21:00,40.841076,-73.93977,MANHATTAN,1.0,0.0,0,0,0,0,1,0,4286823,2020-02-10 21:00:00,2020-02-10T21:00,2020,2,5.5,0.4,Drizzle
11/06/2020,12:00,40.74649,-74.001335,MANHATTAN,1.0,0.0,0,0,0,0,1,0,4364964,2020-11-06 12:00:00,2020-11-06T12:00,2020,11,19.0,0.0,Clear
02/25/2020,15:00,40.858273,-73.93182,MANHATTAN,1.0,0.0,0,0,1,0,0,0,4293743,2020-02-25 15:00:00,2020-02-25T15:00,2020,2,9.5,0.1,Drizzle
08/14/2020,14:00,40.76025,-73.969635,MANHATTAN,0.0,0.0,0,0,0,0,0,0,4338402,2020-08-14 14:00:00,2020-08-14T14:00,2020,8,29.6,0.0,Cloudy
11/01/2020,12:00,40.761402,-73.97623,MANHATTAN,1.0,0.0,1,0,0,0,0,0,4371142,2020-11-01 12:00:00,2020-11-01T12:00,2020,11,13.7,0.5,Drizzle
10/11/2020,23:00,40.841713,-73.93558,MANHATTAN,1.0,0.0,0,0,1,0,0,0,4356687,2020-10-11 23:00:00,2020-10-11T23:00,2020,10,14.3,0.3,Drizzle
05/16/2020,15:00,40.803696,-73.93792,MANHATTAN,1.0,0.0,0,0,0,0,1,0,4314318,2020-05-16 15:00:00,2020-05-16T15:00,2020,5,23.0,0.0,Cloudy
12/21/2020,10:00,40.797363,-73.93751,MANHATTAN,1.0,0.0,0,0,0,0,1,0,4378126,2020-12-21 10:00:00,2020-12-21T10:00,2020,12,1.2,0.0,Clear
10/22/2020,0:00,40.718384,-73.99285,MANHATTAN,1.0,0.0,0,0,0,0,1,0,4382147,2020-10-22 00:00:00,2020-10-22T00:00,2020,10,17.0,0.0,Cloudy
08/10/2020,21:00,40.742023,-73.98292,MANHATTAN,1.0,0.0,0,0,1,0,0,0,4338263,2020-08-10 21:00:00,2020-08-10T21:00,2020,8,27.0,0.0,Clear
01/31/2020,17:00,40.762913,-73.96981,MANHATTAN,1.0,0.0,0,0,1,0,0,0,4282586,2020-01-31 17:00:00,2020-01-31T17:00,2020,1,4.5,0.0,Cloudy
02/10/2020,19:00,40.711777,-73.99219,MANHATTAN,1.0,0.0,1,0,0,0,0,0,4286527,2020-02-10 19:00:00,2020-02-10T19:00,2020,2,5.2,0.3,Drizzle
10/06/2020,9:00,40.80425,-73.9371,MANHATTAN,1.0,0.0,1,0,0,0,0,0,4355234,2020-10-06 09:00:00,2020-10-06T09:00,2020,10,16.8,0.0,Clear
02/16/2020,0:00,40.76742,-73.99442,MANHATTAN,0.0,0.0,0,0,0,0,0,0,4289193,2020-02-16 00:00:00,2020-02-16T00:00,2020,2,-2.8,0.0,Cloudy
01/17/2020,17:00,40.75927,-73.980896,MANHATTAN,1.0,0.0,0,0,0,0,1,0,4277743,2020-01-17 17:00:00,2020-01-17T17:00,2020,1,-3.3,0.0,Clear
03/08/2020,0:00,40.758682,-73.961716,MANHATTAN,0.0,0.0,0,0,0,0,0,0,4306124,2020-03-08 00:00:00,2020-03-08T00:00,2020,3,-0.7,0.0,Clear
07/16/2020,8:00,40.718143,-73.993835,MANHATTAN,1.0,0.0,0,0,1,0,0,0,4329219,2020-07-16 08:00:00,2020-07-16T08:00,2020,7,22.4,0.0,Cloudy
03/07/2020,9:00,40.71449,-74.01147,MANHATTAN,0.0,0.0,0,0,0,0,0,0,4306515,2020-03-07 09:00:00,2020-03-07T09:00,2020,3,3.3,0.0,Clear
06/05/2020,17:00,40.817257,-73.95713,MANHATTAN,0.0,0.0,0,0,0,0,0,0,4332161,2020-06-05 17:00:00,2020-06-05T17:00,2020,6,21.6,3.8,Heavy Rain
09/28/2020,12:00,40.719498,-73.986465,MANHATTAN,2.0,0.0,0,0,0,0,2,0,4352763,2020-09-28 12:00:00,2020-09-28T12:00,2020,9,23.5,0.1,Drizzle
02/14/2020,11:00,40.790997,-73.94931,MANHATTAN,0.0,0.0,0,0,0,0,0,0,4290249,2020-02-14 11:00:00,2020-02-14T11:00,2020,2,-0.9,0.0,Clear
05/03/2020,16:00,40.795055,-73.93317,MANHATTAN,0.0,0.0,0,0,0,0,0,0,4312785,2020-05-03 16:00:00,2020-05-03T16:00,2020,5,24.2,0.0,Clear
05/31/2020,2:00,40.81401,-73.94466,MANHATTAN,1.0,0.0,0,0,1,0,0,0,4317065,2020-05-31 02:00:00,2020-05-31T02:00,2020,5,15.2,0.0,Clear
06/24/2020,15:00,40.784515,-73.94983,MANHATTAN,1.0,0.0,1,0,0,0,0,0,4324818,2020-06-24 15:00:00,2020-06-24T15:00,2020,6,31.0,0.0,Clear
02/14/2020,0:00,40.753895,-73.97425,MANHATTAN,0.0,0.0,0,0,0,0,0,0,4288421,2020-02-14 00:00:00,2020-02-14T00:00,2020,2,2.0,0.0,Cloudy
04/17/2020,13:00,40.771496,-73.988235,MANHATTAN,0.0,0.0,0,0,0,0,0,0,4310036,2020-04-17 13:00:00,2020-04-17T13:00,2020,4,10.1,0.0,Cloudy
03/12/2020,19:00,40.75834,-73.996414,MANHATTAN,0.0,0.0,0,0,0,0,0,0,4299475,2020-03-12 19:00:00,2020-03-12T19:00,2020,3,7.2,0.0,Cloudy
05/04/2020,20:00,40.799984,-73.94275,MANHATTAN,1.0,0.0,0,0,0,0,1,0,4312782,2020-05-04 20:00:00,2020-05-04T20:00,2020,5,11.3,0.0,Clear
10/26/2020,16:00,40.759575,-73.96803,MANHATTAN,1.0,0.0,0,0,0,0,1,0,4363119,2020-10-26 16:00:00,2020-10-26T16:00,2020,10,16.5,0.0,Cloudy
11/14/2020,13:00,40.747684,-73.97879,MANHATTAN,1.0,0.0,0,0,1,0,0,0,4367442,2020-11-14 13:00:00,2020-11-14T13:00,2020,11,11.0,0.0,Clear
02/20/2020,8:00,40.8463,-73.9327,MANHATTAN,1.0,0.0,0,0,0,0,1,0,4291558,2020-02-20 08:00:00,2020-02-20T08:00,2020,2,-1.8,0.0,Cloudy
01/05/2020,15:00,40.75731,-73.98791,MANHATTAN,1.0,0.0,0,0,1,0,0,0,4269740,2020-01-05 15:00:00,2020-01-05T15:00,2020,1,4.6,0.0,Clear
06/08/2020,7:00,40.7879,-73.94398,MANHATTAN,0.0,0.0,0,0,0,0,0,0,4321712,2020-06-08 07:00:00,2020-06-08T07:00,2020,6,17.3,0.0,Clear
06/23/2020,14:00,40.79939,-73.94739,MANHATTAN,1.0,0.0,1,0,0,0,0,0,4324045,2020-06-23 14:00:00,2020-06-23T14:00,2020,6,28.2,0.0,Clear
09/20/2020,18:00,40.741714,-73.99369,MANHATTAN,1.0,0.0,1,0,0,0,0,0,4349791,2020-09-20 18:00:00,2020-09-20T18:00,2020,9,14.9,0.0,Clear
11/30/2020,9:00,40.774704,-73.988205,MANHATTAN,1.0,0.0,1,0,0,0,0,0,4371976,2020-11-30 09:00:00,2020-11-30T09:00,2020,11,12.7,1.1,Drizzle
09/01/2020,14:00,40.7606,-73.96434,MANHATTAN,1.0,0.0,0,0,1,0,0,0,4344288,2020-09-01 14:00:00,2020-09-01T14:00,2020,9,24.5,0.0,Clear
12/11/2020,16:00,40.748863,-73.97584,MANHATTAN,7.0,0.0,7,0,0,0,0,0,4376901,2020-12-11 16:00:00,2020-12-11T16:00,2020,12,9.0,0.0,Cloudy
04/16/2020,19:00,40.806915,-73.93557,MANHATTAN,1.0,0.0,0,0,0,0,1,0,4309240,2020-04-16 19:00:00,2020-04-16T19:00,2020,4,6.3,0.0,Clear
06/10/2020,12:00,40.836555,-73.94306,MANHATTAN,1.0,0.0,0,0,0,0,1,0,4319088,2020-06-10 12:00:00,2020-06-10T12:00,2020,6,28.3,0.0,Cloudy
04/29/2020,13:00,40.717464,-73.97824,MANHATTAN,0.0,0.0,0,0,0,0,0,0,4310927,2020-04-29 13:00:00,2020-04-29T13:00,2020,4,13.7,0.0,Cloudy
05/15/2020,0:00,40.800087,-73.9511,MANHATTAN,4.0,0.0,0,0,0,0,4,0,4314704,2020-05-15 00:00:00,2020-05-15T00:00,2020,5,12.4,0.0,Cloudy
01/04/2020,1:00,40.748516,-73.99066,MANHATTAN,1.0,0.0,0,0,0,0,1,0,4268963,2020-01-04 01:00:00,2020-01-04T01:00,2020,1,6.4,0.3,Drizzle
01/05/2020,13:00,40.761173,-73.95789,MANHATTAN,2.0,0.0,0,0,0,0,2,0,4269295,2020-01-05 13:00:00,2020-01-05T13:00,2020,1,5.0,0.0,Cloudy
11/19/2020,11:00,40.823257,-73.94293,MANHATTAN,1.0,0.0,1,0,0,0,0,0,4371133,2020-11-19 11:00:00,2020-11-19T11:00,2020,11,4.1,0.0,Cloudy
06/20/2020,11:00,40.76625,-73.99438,MANHATTAN,1.0,0.0,0,0,1,0,0,0,4322166,2020-06-20 11:00:00,2020-06-20T11:00,2020,6,27.2,0.0,Cloudy
08/03/2020,21:00,40.726986,-73.985756,MANHATTAN,1.0,0.0,0,0,1,0,0,0,4335357,2020-08-03 21:00:00,2020-08-03T21:00,2020,8,24.5,0.7,Drizzle
08/21/2020,16:00,40.721935,-73.987404,MANHATTAN,0.0,0.0,0,0,0,0,0,0,4340540,2020-08-21 16:00:00,2020-08-21T16:00,2020,8,28.4,0.0,Cloudy
12/26/2020,7:00,40.74796,-73.99128,MANHATTAN,0.0,0.0,0,0,0,0,0,0,4379018,2020-12-26 07:00:00,2020-12-26T07:00,2020,12,-4.7,0.0,Clear
02/20/2020,10:00,40.723175,-73.9894,MANHATTAN,1.0,0.0,0,0,0,0,1,0,4291276,2020-02-20 10:00:00,2020-02-20T10:00,2020,2,0.3,0.0,Cloudy
09/29/2020,0:00,40.71802,-74.003914,MANHATTAN,0.0,0.0,0,0,0,0,0,0,4353142,2020-09-29 00:00:00,2020-09-29T00:00,2020,9,19.2,0.0,Clear
02/11/2020,17:00,40.813385,-73.94511,MANHATTAN,1.0,0.0,0,0,1,0,0,0,4287198,2020-02-11 17:00:00,2020-02-11T17:00,2020,2,7.2,0.0,Cloudy
12/08/2020,12:00,40.719593,-73.986755,MANHATTAN,1.0,0.0,1,0,0,0,0,0,4374760,2020-12-08 12:00:00,2020-12-08T12:00,2020,12,2.6,0.0,Cloudy
09/30/2020,13:00,40.70909,-74.005516,MANHATTAN,1.0,0.0,0,0,1,0,0,0,4353234,2020-09-30 13:00:00,2020-09-30T13:00,2020,9,20.6,0.0,Clear
11/17/2020,19:00,40.779495,-73.95559,MANHATTAN,1.0,0.0,0,0,1,0,0,0,4368668,2020-11-17 19:00:00,2020-11-17T19:00,2020,11,4.5,0.0,Clear
02/04/2020,18:00,40.758816,-73.979805,MANHATTAN,1.0,0.0,1,0,0,0,0,0,4283626,2020-02-04 18:00:00,2020-02-04T18:00,2020,2,10.5,0.0,Cloudy
09/10/2020,17:00,40.725403,-73.980965,MANHATTAN,1.0,0.0,0,0,1,0,0,0,4354457,2020-09-10 17:00:00,2020-09-10T17:00,2020,9,26.4,0.0,Cloudy
04/18/2020,8:00,40.813385,-73.94511,MANHATTAN,0.0,0.0,0,0,0,0,0,0,4309294,2020-04-18 08:00:00,2020-04-18T08:00,2020,4,7.6,0.3,Drizzle
06/13/2020,14:00,40.79417,-73.93984,MANHATTAN,0.0,0.0,0,0,0,0,0,0,4320802,2020-06-13 14:00:00,2020-06-13T14:00,2020,6,22.7,0.0,Clear
01/17/2020,1:00,40.744423,-73.991714,MANHATTAN,1.0,0.0,0,0,1,0,0,0,4274549,2020-01-17 01:00:00,2020-01-17T01:00,2020,1,-1.1,0.0,Cloudy
01/19/2020,18:00,40.84691,-73.93824,MANHATTAN,1.0,0.0,1,0,0,0,0,0,4275750,2020-01-19 18:00:00,2020-01-19T18:00,2020,1,0.1,0.0,Cloudy
06/17/2020,2:00,40.757668,-73.99483,MANHATTAN,0.0,0.0,0,0,0,0,0,0,4321322,2020-06-17 02:00:00,2020-06-17T02:00,2020,6,14.8,0.0,Clear
08/07/2020,19:00,40.854916,-73.93604,MANHATTAN,1.0,0.0,0,0,1,0,0,0,4336912,2020-08-07 19:00:00,2020-08-07T19:00,2020,8,23.3,0.0,Cloudy
04/17/2020,0:00,40.756557,-73.97444,MANHATTAN,1.0,0.0,1,0,0,0,0,0,4309205,2020-04-17 00:00:00,2020-04-17T00:00,2020,4,1.4,0.0,Clear
06/28/2020,3:00,40.798126,-73.94832,MANHATTAN,1.0,0.0,0,0,1,0,0,0,4326783,2020-06-28 03:00:00,2020-06-28T03:00,2020,6,20.2,0.0,Clear
01/23/2020,11:00,40.76702,-73.98359,MANHATTAN,0.0,0.0,0,0,0,0,0,0,4278134,2020-01-23 11:00:00,2020-01-23T11:00,2020,1,3.1,0.0,Cloudy
07/06/2020,18:00,40.731064,-74.00142,MANHATTAN,1.0,0.0,0,0,0,0,1,0,4326206,2020-07-06 18:00:00,2020-07-06T18:00,2020,7,26.8,0.3,Drizzle
11/08/2020,4:00,40.75603,-73.979034,MANHATTAN,1.0,0.0,0,0,1,0,0,0,4365340,2020-11-08 04:00:00,2020-11-08T04:00,2020,11,8.2,0.0,Clear
02/15/2020,11:00,40.735134,-73.9829,MANHATTAN,1.0,0.0,0,0,1,0,0,0,4288722,2020-02-15 11:00:00,2020-02-15T11:00,2020,2,-4.7,0.0,Clear
12/06/2020,10:00,40.761242,-73.96683,MANHATTAN,0.0,0.0,0,0,0,0,0,0,4377288,2020-12-06 10:00:00,2020-12-06T10:00,2020,12,2.5,0.0,Clear
01/25/2020,17:00,40.76211,-73.96016,MANHATTAN,0.0,0.0,0,0,0,0,0,0,4279312,2020-01-25 17:00:00,2020-01-25T17:00,2020,1,9.2,0.4,Drizzle
03/12/2020,17:00,40.70966,-74.00484,MANHATTAN,0.0,0.0,0,0,0,0,0,0,4300022,2020-03-12 17:00:00,2020-03-12T17:00,2020,3,8.0,0.0,Cloudy
01/17/2020,15:00,40.75825,-73.98907,MANHATTAN,0.0,0.0,0,0,0,0,0,0,4275571,2020-01-17 15:00:00,2020-01-17T15:00,2020,1,-1.4,0.0,Clear
02/14/2020,0:00,40.720573,-73.98716,MANHATTAN,1.0,0.0,0,0,1,0,0,0,4291956,2020-02-14 00:00:00,2020-02-14T00:00,2020,2,2.5,0.0,Cloudy
11/25/2020,16:00,40.721252,-74.00146,MANHATTAN,0.0,0.0,0,0,0,0,0,0,4371061,2020-11-25 16:00:00,2020-11-25T16:00,2020,11,10.3,0.0,Clear
08/19/2020,19:00,40.818516,-73.93765,MANHATTAN,1.0,0.0,0,0,1,0,0,0,4344148,2020-08-19 19:00:00,2020-08-19T19:00,2020,8,21.5,0.0,Clear
06/10/2020,16:00,40.723022,-73.99882,MANHATTAN,1.0,0.0,1,0,0,0,0,0,4319147,2020-06-10 16:00:00,2020-06-10T16:00,2020,6,24.7,0.0,Cloudy
08/26/2020,19:00,40.728065,-73.99896,MANHATTAN,1.0,0.0,0,0,1,0,0,0,4342238,2020-08-26 19:00:00,2020-08-26T19:00,2020,8,22.6,0.0,Clear
06/18/2020,0:00,40.72495,-73.99492,MANHATTAN,1.0,0.0,0,0,1,0,0,0,4321236,2020-06-18 00:00:00,2020-06-18T00:00,2020,6,17.8,0.0,Cloudy
10/14/2020,9:00,40.77334,-73.94902,MANHATTAN,0.0,0.0,0,0,0,0,0,0,4357936,2020-10-14 09:00:00,2020-10-14T09:00,2020,10,14.5,0.0,Clear
03/12/2020,11:00,40.72455,-74.00194,MANHATTAN,1.0,0.0,1,0,0,0,0,0,4299333,2020-03-12 11:00:00,2020-03-12T11:00,2020,3,9.0,0.0,Cloudy
10/16/2020,11:00,40.769115,-73.98856,MANHATTAN,0.0,0.0,0,0,0,0,0,0,4358235,2020-10-16 11:00:00,2020-10-16T11:00,2020,10,12.4,4.7,Heavy Rain
08/27/2020,14:00,40.805782,-73.95066,MANHATTAN,1.0,0.0,0,0,1,0,0,0,4342568,2020-08-27 14:00:00,2020-08-27T14:00,2020,8,33.8,0.0,Clear
04/28/2020,11:00,40.82982,-73.9368,MANHATTAN,1.0,0.0,1,0,0,0,0,0,4310853,2020-04-28 11:00:00,2020-04-28T11:00,2020,4,12.9,0.0,Clear
07/15/2020,18:00,40.861256,-73.925674,MANHATTAN,2.0,0.0,0,0,0,0,2,0,4329944,2020-07-15 18:00:00,2020-07-15T18:00,2020,7,23.8,0.0,Cloudy
06/22/2020,11:00,40.762333,-73.99349,MANHATTAN,1.0,0.0,0,0,0,0,1,0,4332860,2020-06-22 11:00:00,2020-06-22T11:00,2020,6,30.0,0.0,Clear
01/11/2020,0:00,40.830513,-73.94051,MANHATTAN,1.0,0.0,1,0,0,0,0,0,4271956,2020-01-11 00:00:00,2020-01-11T00:00,2020,1,7.8,0.0,Cloudy
09/16/2020,18:00,40.711304,-73.989044,MANHATTAN,1.0,0.0,0,0,1,0,0,0,4348774,2020-09-16 18:00:00,2020-09-16T18:00,2020,9,19.9,0.0,Clear
09/12/2020,13:00,40.811096,-73.95235,MANHATTAN,5.0,0.0,0,0,0,0,5,0,4347444,2020-09-12 13:00:00,2020-09-12T13:00,2020,9,21.4,0.0,Cloudy
02/07/2020,15:00,40.77783,-73.953735,MANHATTAN,1.0,0.0,1,0,0,0,0,0,4289577,2020-02-07 15:00:00,2020-02-07T15:00,2020,2,4.4,0.0,Cloudy
10/15/2020,19:00,40.740185,-73.986374,MANHATTAN,1.0,0.0,0,0,1,0,0,0,4358167,2020-10-15 19:00:00,2020-10-15T19:00,2020,10,17.2,0.0,Cloudy
06/11/2020,20:00,40.848118,-73.93089,MANHATTAN,1.0,0.0,0,0,0,0,1,0,4319424,2020-06-11 20:00:00,2020-06-11T20:00,2020,6,22.5,0.0,Cloudy
07/01/2020,17:00,40.72543,-73.99678,MANHATTAN,1.0,0.0,1,0,0,0,0,0,4325906,2020-07-01 17:00:00,2020-07-01T17:00,2020,7,23.9,2.3,Light Rain
03/02/2020,11:00,40.802902,-73.94965,MANHATTAN,0.0,0.0,0,0,0,0,0,0,4296806,2020-03-02 11:00:00,2020-03-02T11:00,2020,3,9.4,0.0,Clear
06/09/2020,8:00,40.763645,-73.97769,MANHATTAN,1.0,0.0,0,0,0,0,1,0,4318787,2020-06-09 08:00:00,2020-06-09T08:00,2020,6,21.9,0.0,Clear
03/21/2020,14:00,40.845585,-73.93903,MANHATTAN,0.0,0.0,0,0,0,0,0,0,4303120,2020-03-21 14:00:00,2020-03-21T14:00,2020,3,9.6,0.0,Clear
05/07/2020,13:00,40.722717,-74.004456,MANHATTAN,1.0,0.0,0,0,1,0,0,0,4312242,2020-05-07 13:00:00,2020-05-07T13:00,2020,5,16.3,0.0,Cloudy
06/26/2020,12:00,40.77656,-73.95271,MANHATTAN,1.0,0.0,0,0,0,0,1,0,4323869,2020-06-26 12:00:00,2020-06-26T12:00,2020,6,28.4,0.0,Clear
06/19/2020,13:00,40.72267,-73.98297,MANHATTAN,1.0,0.0,1,0,0,0,0,0,4322259,2020-06-19 13:00:00,2020-06-19T13:00,2020,6,24.7,0.2,Drizzle
09/01/2020,20:00,40.866024,-73.92588,MANHATTAN,1.0,0.0,1,0,0,0,0,0,4345821,2020-09-01 20:00:00,2020-09-01T20:00,2020,9,21.1,0.0,Cloudy
08/07/2020,0:00,40.729553,-74.000885,MANHATTAN,0.0,0.0,0,0,0,0,0,0,4336406,2020-08-07 00:00:00,2020-08-07T00:00,2020,8,23.3,0.0,Cloudy
08/24/2020,15:00,40.81304,-73.949066,MANHATTAN,0.0,0.0,0,0,0,0,0,0,4341671,2020-08-24 15:00:00,2020-08-24T15:00,2020,8,31.0,0.0,Cloudy
08/17/2020,0:00,40.770573,-73.982155,MANHATTAN,1.0,0.0,1,0,0,0,0,0,4339727,2020-08-17 00:00:00,2020-08-17T00:00,2020,8,18.1,0.0,Clear
08/04/2020,13:00,40.783245,-73.94473,MANHATTAN,3.0,0.0,0,0,0,0,3,0,4336696,2020-08-04 13:00:00,2020-08-04T13:00,2020,8,24.6,4.1,Heavy Rain
06/04/2020,15:00,40.76229,-73.986115,MANHATTAN,1.0,0.0,0,0,1,0,0,0,4317814,2020-06-04 15:00:00,2020-06-04T15:00,2020,6,25.9,0.0,Cloudy
08/20/2020,17:00,40.771023,-73.95365,MANHATTAN,1.0,0.0,1,0,0,0,0,0,4340225,2020-08-20 17:00:00,2020-08-20T17:00,2020,8,24.9,0.0,Cloudy
01/23/2020,23:00,40.76457,-73.97364,MANHATTAN,2.0,0.0,0,0,0,0,2,0,4278461,2020-01-23 23:00:00,2020-01-23T23:00,2020,1,0.7,0.0,Cloudy
08/25/2020,9:00,40.757122,-73.97192,MANHATTAN,1.0,0.0,1,0,0,0,0,0,4341705,2020-08-25 09:00:00,2020-08-25T09:00,2020,8,27.6,0.0,Cloudy
09/16/2020,11:00,40.795055,-73.93317,MANHATTAN,1.0,0.0,0,0,0,0,1,0,4348679,2020-09-16 11:00:00,2020-09-16T11:00,2020,9,20.5,0.0,Clear
03/12/2020,23:00,40.723026,-73.97962,MANHATTAN,1.0,0.0,0,0,1,0,0,0,4299962,2020-03-12 23:00:00,2020-03-12T23:00,2020,3,7.1,0.5,Drizzle
06/07/2020,10:00,40.827057,-73.95202,MANHATTAN,0.0,0.0,0,0,0,0,0,0,4318394,2020-06-07 10:00:00,2020-06-07T10:00,2020,6,21.6,0.0,Clear
06/14/2020,0:00,40.796738,-73.96098,MANHATTAN,2.0,0.0,0,0,0,0,2,0,4319876,2020-06-14 00:00:00,2020-06-14T00:00,2020,6,13.9,0.0,Clear
02/21/2020,10:00,40.74577,-73.97043,MANHATTAN,0.0,0.0,0,0,0,0,0,0,4291424,2020-02-21 10:00:00,2020-02-21T10:00,2020,2,-3.2,0.0,Clear
07/27/2020,6:00,40.750645,-73.99186,MANHATTAN,0.0,0.0,0,0,0,0,0,0,4335771,2020-07-27 06:00:00,2020-07-27T06:00,2020,7,22.5,0.0,Cloudy
02/06/2020,19:00,40.741302,-74.00207,MANHATTAN,1.0,0.0,0,0,0,0,1,0,4286334,2020-02-06 19:00:00,2020-02-06T19:00,2020,2,3.1,1.2,Drizzle
11/25/2020,13:00,40.727314,-73.98862,MANHATTAN,0.0,0.0,0,0,0,0,0,0,4372564,2020-11-25 13:00:00,2020-11-25T13:00,2020,11,11.8,0.0,Cloudy
12/02/2020,17:00,40.814384,-73.96161,MANHATTAN,0.0,0.0,0,0,0,0,0,0,4372927,2020-12-02 17:00:00,2020-12-02T17:00,2020,12,5.3,0.0,Clear
05/29/2020,19:00,40.748436,-73.984566,MANHATTAN,0.0,0.0,0,0,0,0,0,0,4317510,2020-05-29 19:00:00,2020-05-29T19:00,2020,5,23.1,0.0,Cloudy
12/30/2020,13:00,40.737957,-73.998245,MANHATTAN,1.0,0.0,1,0,0,0,0,0,4380232,2020-12-30 13:00:00,2020-12-30T13:00,2020,12,3.6,0.0,Cloudy
02/22/2020,7:00,40.751633,-74.00186,MANHATTAN,0.0,0.0,0,0,0,0,0,0,4293887,2020-02-22 07:00:00,2020-02-22T07:00,2020,2,-2.3,0.0,Clear
01/05/2020,23:00,40.713135,-74.00407,MANHATTAN,1.0,0.0,0,0,0,0,1,0,4270260,2020-01-05 23:00:00,2020-01-05T23:00,2020,1,0.3,0.0,Cloudy
01/16/2020,18:00,40.74954,-73.97744,MANHATTAN,1.0,0.0,0,0,1,0,0,0,4274922,2020-01-16 18:00:00,2020-01-16T18:00,2020,1,2.6,0.0,Clear
05/13/2020,0:00,40.824554,-73.94196,MANHATTAN,1.0,0.0,0,0,1,0,0,0,4313454,2020-05-13 00:00:00,2020-05-13T00:00,2020,5,6.1,0.0,Clear
11/24/2020,9:00,40.76428,-73.97302,MANHATTAN,0.0,0.0,0,0,0,0,0,0,4370473,2020-11-24 09:00:00,2020-11-24T09:00,2020,11,6.4,0.0,Clear
03/08/2020,20:00,40.788994,-73.94656,MANHATTAN,0.0,0.0,0,0,0,0,0,0,4306239,2020-03-08 20:00:00,2020-03-08T20:00,2020,3,8.3,0.0,Clear
12/19/2020,21:00,40.75484,-73.98412,MANHATTAN,1.0,0.0,0,0,1,0,0,0,4381842,2020-12-19 21:00:00,2020-12-19T21:00,2020,12,-5.4,0.0,Cloudy
11/09/2020,16:00,40.76729,-73.96661,MANHATTAN,1.0,0.0,0,0,1,0,0,0,4366039,2020-11-09 16:00:00,2020-11-09T16:00,2020,11,17.8,0.0,Clear
05/26/2020,8:00,40.850693,-73.92748,MANHATTAN,0.0,0.0,0,0,0,0,0,0,4315946,2020-05-26 08:00:00,2020-05-26T08:00,2020,5,17.0,0.1,Drizzle
03/26/2020,14:00,40.718555,-73.988205,MANHATTAN,1.0,0.0,1,0,0,0,0,0,4304395,2020-03-26 14:00:00,2020-03-26T14:00,2020,3,13.9,0.0,Clear
02/22/2020,9:00,40.777092,-73.98211,MANHATTAN,1.0,0.0,1,0,0,0,0,0,4292231,2020-02-22 09:00:00,2020-02-22T09:00,2020,2,1.1,0.0,Clear
03/07/2020,12:00,40.76161,-73.99032,MANHATTAN,1.0,0.0,1,0,0,0,0,0,4306588,2020-03-07 12:00:00,2020-03-07T12:00,2020,3,6.5,0.0,Clear
12/10/2020,18:00,40.783245,-73.94473,MANHATTAN,0.0,0.0,0,0,0,0,0,0,4375099,2020-12-10 18:00:00,2020-12-10T18:00,2020,12,3.9,0.0,Clear
02/19/2020,20:00,40.75348,-73.980896,MANHATTAN,0.0,0.0,0,0,0,0,0,0,4291452,2020-02-19 20:00:00,2020-02-19T20:00,2020,2,0.5,0.0,Clear
05/05/2020,15:00,40.82465,-73.94623,MANHATTAN,1.0,0.0,0,0,0,0,1,0,4312149,2020-05-05 15:00:00,2020-05-05T15:00,2020,5,14.5,0.0,Cloudy
05/11/2020,13:00,40.760403,-73.98748,MANHATTAN,1.0,0.0,1,0,0,0,0,0,4313054,2020-05-11 13:00:00,2020-05-11T13:00,2020,5,14.0,0.2,Drizzle
07/16/2020,13:00,40.83593,-73.94352,MANHATTAN,1.0,0.0,0,0,1,0,0,0,4329189,2020-07-16 13:00:00,2020-07-16T13:00,2020,7,24.5,0.0,Clear
10/19/2020,13:00,40.812187,-73.94995,MANHATTAN,1.0,0.0,0,0,1,0,0,0,4360515,2020-10-19 13:00:00,2020-10-19T13:00,2020,10,17.8,0.0,Cloudy
11/26/2020,20:00,40.818565,-73.96092,MANHATTAN,2.0,0.0,0,0,0,0,2,0,4371518,2020-11-26 20:00:00,2020-11-26T20:00,2020,11,11.9,0.0,Clear
11/23/2020,13:00,40.790253,-73.94564,MANHATTAN,0.0,0.0,0,0,0,0,0,0,4371760,2020-11-23 13:00:00,2020-11-23T13:00,2020,11,9.9,0.0,Clear
11/29/2020,3:00,40.72902,-73.99029,MANHATTAN,1.0,0.0,1,0,0,0,0,0,4372758,2020-11-29 03:00:00,2020-11-29T03:00,2020,11,2.3,0.0,Clear
10/26/2020,0:00,40.82077,-73.95459,MANHATTAN,0.0,0.0,0,0,0,0,0,0,4361823,2020-10-26 00:00:00,2020-10-26T00:00,2020,10,10.9,0.1,Drizzle
05/20/2020,16:00,40.841713,-73.93558,MANHATTAN,4.0,0.0,0,0,0,0,4,0,4314845,2020-05-20 16:00:00,2020-05-20T16:00,2020,5,16.7,0.0,Cloudy
04/06/2020,17:00,40.758327,-73.96894,MANHATTAN,1.0,0.0,0,0,1,0,0,0,4308432,2020-04-06 17:00:00,2020-04-06T17:00,2020,4,16.6,0.0,Clear
09/25/2020,22:00,40.83406,-73.944885,MANHATTAN,1.0,0.0,1,0,0,0,0,0,4353124,2020-09-25 22:00:00,2020-09-25T22:00,2020,9,18.1,0.0,Cloudy
08/04/2020,11:00,40.72582,-74.0029,MANHATTAN,0.0,0.0,0,0,0,0,0,0,4335347,2020-08-04 11:00:00,2020-08-04T11:00,2020,8,24.2,3.7,Heavy Rain
06/13/2020,20:00,40.79507,-73.93919,MANHATTAN,1.0,0.0,0,0,1,0,0,0,4326344,2020-06-13 20:00:00,2020-06-13T20:00,2020,6,18.6,0.0,Clear
12/01/2020,5:00,40.798344,-73.95243,MANHATTAN,1.0,0.0,0,0,0,0,1,0,4373128,2020-12-01 05:00:00,2020-12-01T05:00,2020,12,11.5,0.0,Cloudy
06/13/2020,7:00,40.79634,-73.934135,MANHATTAN,1.0,0.0,1,0,0,0,0,0,4320389,2020-06-13 07:00:00,2020-06-13T07:00,2020,6,16.8,0.0,Clear
01/20/2020,13:00,40.785294,-73.969345,MANHATTAN,1.0,0.0,1,0,0,0,0,0,4276638,2020-01-20 13:00:00,2020-01-20T13:00,2020,1,-1.7,0.0,Clear
08/01/2020,10:00,40.720707,-73.981316,MANHATTAN,1.0,0.0,0,0,1,0,0,0,4334113,2020-08-01 10:00:00,2020-08-01T10:00,2020,8,28.7,0.0,Cloudy
02/08/2020,4:00,40.71654,-73.996994,MANHATTAN,1.0,0.0,1,0,0,0,0,0,4288631,2020-02-08 04:00:00,2020-02-08T04:00,2020,2,-1.9,0.0,Clear
08/21/2020,20:00,40.71766,-74.007545,MANHATTAN,2.0,0.0,0,0,0,0,2,0,4345429,2020-08-21 20:00:00,2020-08-21T20:00,2020,8,24.7,0.0,Cloudy
01/31/2020,22:00,40.75044,-73.98935,MANHATTAN,1.0,0.0,1,0,0,0,0,0,4283868,2020-01-31 22:00:00,2020-01-31T22:00,2020,1,2.5,0.5,Drizzle
02/24/2020,17:00,40.744762,-73.99517,MANHATTAN,1.0,0.0,0,0,1,0,0,0,4292971,2020-02-24 17:00:00,2020-02-24T17:00,2020,2,8.2,0.0,Cloudy
03/08/2020,3:00,40.718792,-73.98902,MANHATTAN,1.0,0.0,1,0,0,0,0,0,4329086,2020-03-08 03:00:00,2020-03-08T03:00,2020,3,-1.9,0.0,Clear
02/03/2020,9:00,40.826794,-73.93568,MANHATTAN,1.0,0.0,0,0,0,0,1,0,4287195,2020-02-03 09:00:00,2020-02-03T09:00,2020,2,6.0,0.0,Clear
12/13/2020,20:00,40.836716,-73.94539,MANHATTAN,0.0,0.0,0,0,0,0,0,0,4375746,2020-12-13 20:00:00,2020-12-13T20:00,2020,12,7.0,0.0,Cloudy
09/09/2020,7:00,40.87229,-73.91269,MANHATTAN,1.0,0.0,0,0,1,0,0,0,4347421,2020-09-09 07:00:00,2020-09-09T07:00,2020,9,20.7,0.0,Cloudy
08/05/2020,10:00,40.748985,-73.979965,MANHATTAN,1.0,0.0,0,0,0,0,1,0,4335323,2020-08-05 10:00:00,2020-08-05T10:00,2020,8,27.5,0.0,Clear
04/30/2020,22:00,40.753242,-73.96662,MANHATTAN,1.0,0.0,0,0,0,0,1,0,4311959,2020-04-30 22:00:00,2020-04-30T22:00,2020,4,12.8,4.7,Heavy Rain
10/23/2020,13:00,40.74633,-73.98609,MANHATTAN,1.0,0.0,0,0,0,0,1,0,4366718,2020-10-23 13:00:00,2020-10-23T13:00,2020,10,20.0,0.0,Cloudy
01/21/2020,9:00,40.716454,-73.98058,MANHATTAN,0.0,0.0,0,0,0,0,0,0,4277636,2020-01-21 09:00:00,2020-01-21T09:00,2020,1,-4.4,0.0,Clear
03/10/2020,22:00,40.750893,-73.99629,MANHATTAN,1.0,0.0,0,0,0,0,1,0,4298651,2020-03-10 22:00:00,2020-03-10T22:00,2020,3,13.6,0.0,Cloudy
02/07/2020,11:00,40.774323,-73.96149,MANHATTAN,1.0,0.0,1,0,0,0,0,0,4284834,2020-02-07 11:00:00,2020-02-07T11:00,2020,2,13.3,0.3,Drizzle
09/10/2020,10:00,40.711994,-74.00811,MANHATTAN,0.0,0.0,0,0,0,0,0,0,4347791,2020-09-10 10:00:00,2020-09-10T10:00,2020,9,24.5,0.2,Drizzle
09/19/2020,10:00,40.805637,-73.9344,MANHATTAN,1.0,0.0,0,0,1,0,0,0,4350156,2020-09-19 10:00:00,2020-09-19T10:00,2020,9,14.6,0.0,Clear
06/23/2020,19:00,40.737732,-73.98817,MANHATTAN,1.0,0.0,0,0,0,0,1,0,4322679,2020-06-23 19:00:00,2020-06-23T19:00,2020,6,23.3,0.0,Cloudy
01/02/2020,13:00,40.75355,-73.98505,MANHATTAN,1.0,0.0,1,0,0,0,0,0,4268974,2020-01-02 13:00:00,2020-01-02T13:00,2020,1,7.9,0.0,Cloudy
01/23/2020,8:00,40.86446,-73.91895,MANHATTAN,1.0,0.0,1,0,0,0,0,0,4280577,2020-01-23 08:00:00,2020-01-23T08:00,2020,1,-2.8,0.0,Cloudy
11/27/2020,0:00,40.79292,-73.94579,MANHATTAN,0.0,0.0,0,0,0,0,0,0,4372578,2020-11-27 00:00:00,2020-11-27T00:00,2020,11,7.9,0.0,Clear
10/24/2020,13:00,40.72293,-73.98865,MANHATTAN,1.0,0.0,0,0,1,0,0,0,4364226,2020-10-24 13:00:00,2020-10-24T13:00,2020,10,20.0,0.0,Cloudy
07/26/2020,8:00,40.674347,-73.82071,QUEENS,0.0,0.0,0,0,0,0,0,0,4332132,2020-07-26 08:00:00,2020-07-26T08:00,2020,7,27.4,0.0,Cloudy
02/28/2020,19:00,40.723885,-73.84915,QUEENS,1.0,0.0,0,0,0,0,1,0,4305768,2020-02-28 19:00:00,2020-02-28T19:00,2020,2,0.0,0.0,Clear
12/24/2020,11:00,40.737892,-73.7251,QUEENS,3.0,0.0,0,0,0,0,3,0,4378769,2020-12-24 11:00:00,2020-12-24T11:00,2020,12,14.0,0.0,Cloudy
03/09/2020,16:00,40.611176,-73.74547,QUEENS,0.0,0.0,0,0,0,0,0,0,4300936,2020-03-09 16:00:00,2020-03-09T16:00,2020,3,9.2,0.0,Clear
07/07/2020,9:00,40.78933,-73.849754,QUEENS,0.0,0.0,0,0,0,0,0,0,4326513,2020-07-07 09:00:00,2020-07-07T09:00,2020,7,25.0,0.1,Drizzle
02/20/2020,0:00,40.73105,-73.86061,QUEENS,1.0,0.0,0,0,0,0,1,0,4291538,2020-02-20 00:00:00,2020-02-20T00:00,2020,2,-1.5,0.0,Cloudy
07/11/2020,3:00,40.654156,-73.838646,QUEENS,1.0,0.0,0,0,0,0,1,0,4327846,2020-07-11 03:00:00,2020-07-11T03:00,2020,7,23.6,0.0,Cloudy
07/04/2020,15:00,40.71245,-73.91853,QUEENS,1.0,0.0,0,0,1,0,0,0,4326602,2020-07-04 15:00:00,2020-07-04T15:00,2020,7,27.5,0.2,Drizzle
01/07/2020,7:00,40.667114,-73.834656,QUEENS,4.0,0.0,0,0,0,0,4,0,4270195,2020-01-07 07:00:00,2020-01-07T07:00,2020,1,1.2,0.0,Cloudy
02/27/2020,17:00,40.73088,-73.871635,QUEENS,2.0,0.0,0,0,0,0,2,0,4294420,2020-02-27 17:00:00,2020-02-27T17:00,2020,2,2.7,0.0,Clear
07/26/2020,15:00,40.76232,-73.871216,QUEENS,1.0,0.0,0,0,1,0,0,0,4332907,2020-07-26 15:00:00,2020-07-26T15:00,2020,7,34.9,0.0,Cloudy
12/30/2020,22:00,40.750717,-73.85877,QUEENS,1.0,0.0,0,0,1,0,0,0,4380931,2020-12-30 22:00:00,2020-12-30T22:00,2020,12,3.9,0.0,Cloudy
06/25/2020,0:00,40.72308,-73.82674,QUEENS,1.0,0.0,0,0,0,0,1,0,4323149,2020-06-25 00:00:00,2020-06-25T00:00,2020,6,21.1,0.0,Clear
04/18/2020,22:00,40.749214,-73.936676,QUEENS,1.0,0.0,0,0,0,0,1,0,4309530,2020-04-18 22:00:00,2020-04-18T22:00,2020,4,3.7,0.0,Clear
03/12/2020,13:00,40.700306,-73.76599,QUEENS,1.0,0.0,0,0,0,0,1,0,4300956,2020-03-12 13:00:00,2020-03-12T13:00,2020,3,8.4,0.0,Cloudy
10/06/2020,0:00,40.758606,-73.892075,QUEENS,0.0,0.0,0,0,0,0,0,0,4358467,2020-10-06 00:00:00,2020-10-06T00:00,2020,10,14.6,0.1,Drizzle
12/05/2020,17:00,40.66612,-73.82225,QUEENS,1.0,0.0,0,0,0,0,1,0,4373426,2020-12-05 17:00:00,2020-12-05T17:00,2020,12,6.0,0.0,Clear
02/11/2020,14:00,40.65616,-73.76736,QUEENS,0.0,0.0,0,0,0,0,0,0,4286910,2020-02-11 14:00:00,2020-02-11T14:00,2020,2,7.4,0.4,Drizzle
01/18/2020,15:00,40.750515,-73.85158,QUEENS,1.0,0.0,0,0,0,0,1,0,4275607,2020-01-18 15:00:00,2020-01-18T15:00,2020,1,-2.1,0.3,Heavy Snow
09/01/2020,0:00,40.756523,-73.85868,QUEENS,2.0,0.0,0,0,0,0,2,0,4348539,2020-09-01 00:00:00,2020-09-01T00:00,2020,9,20.2,0.0,Cloudy
03/06/2020,16:00,40.72452,-73.90626,QUEENS,1.0,0.0,0,0,0,0,1,0,4302158,2020-03-06 16:00:00,2020-03-06T16:00,2020,3,5.0,0.4,Drizzle
08/17/2020,8:00,40.728424,-73.79285,QUEENS,3.0,0.0,0,0,0,0,3,0,4339106,2020-08-17 08:00:00,2020-08-17T08:00,2020,8,21.0,0.0,Clear
01/18/2020,14:00,40.69722,-73.77991,QUEENS,1.0,0.0,0,0,0,0,1,0,4275572,2020-01-18 14:00:00,2020-01-18T14:00,2020,1,-1.5,1.0,Heavy Snow
01/05/2020,15:00,40.728935,-73.89918,QUEENS,0.0,0.0,0,0,0,0,0,0,4269393,2020-01-05 15:00:00,2020-01-05T15:00,2020,1,4.5,0.0,Clear
08/29/2020,0:00,40.76002,-73.85927,QUEENS,1.0,0.0,0,0,1,0,0,0,4343688,2020-08-29 00:00:00,2020-08-29T00:00,2020,8,23.1,0.0,Cloudy
01/05/2020,11:00,40.658203,-73.75397,QUEENS,2.0,0.0,0,0,0,0,2,0,4268919,2020-01-05 11:00:00,2020-01-05T11:00,2020,1,4.3,0.0,Clear
09/22/2020,14:00,40.69167,-73.80177,QUEENS,2.0,0.0,0,0,0,0,2,0,4350529,2020-09-22 14:00:00,2020-09-22T14:00,2020,9,21.7,0.0,Clear
10/04/2020,18:00,40.765224,-73.9317,QUEENS,1.0,0.0,0,0,0,0,1,0,4354602,2020-10-04 18:00:00,2020-10-04T18:00,2020,10,14.3,0.0,Clear
11/05/2020,8:00,40.74646,-73.91709,QUEENS,1.0,0.0,0,0,1,0,0,0,4364879,2020-11-05 08:00:00,2020-11-05T08:00,2020,11,10.5,0.0,Cloudy
05/27/2020,18:00,40.766895,-73.921394,QUEENS,1.0,0.0,0,0,0,0,1,0,4316318,2020-05-27 18:00:00,2020-05-27T18:00,2020,5,17.7,0.0,Cloudy
02/09/2020,0:00,40.74573,-73.90212,QUEENS,1.0,0.0,1,0,0,0,0,0,4289755,2020-02-09 00:00:00,2020-02-09T00:00,2020,2,-1.6,0.0,Clear
03/11/2020,14:00,40.73091,-73.774925,QUEENS,1.0,0.0,0,0,0,0,1,0,4299308,2020-03-11 14:00:00,2020-03-11T14:00,2020,3,12.2,0.0,Cloudy
01/01/2020,19:00,40.725353,-73.82108,QUEENS,0.0,0.0,0,0,0,0,0,0,4268937,2020-01-01 19:00:00,2020-01-01T19:00,2020,1,1.1,0.0,Clear
09/20/2020,21:00,40.73725,-73.91799,QUEENS,0.0,0.0,0,0,0,0,0,0,4351595,2020-09-20 21:00:00,2020-09-20T21:00,2020,9,11.7,0.0,Clear
05/26/2020,20:00,40.75496,-73.870964,QUEENS,0.0,0.0,0,0,0,0,0,0,4317492,2020-05-26 20:00:00,2020-05-26T20:00,2020,5,15.1,0.0,Cloudy
04/07/2020,0:00,40.757847,-73.89922,QUEENS,0.0,0.0,0,0,0,0,0,0,4308097,2020-04-07 00:00:00,2020-04-07T00:00,2020,4,8.5,0.0,Cloudy
01/02/2020,10:00,40.714954,-73.76464,QUEENS,0.0,0.0,0,0,0,0,0,0,4267999,2020-01-02 10:00:00,2020-01-02T10:00,2020,1,3.7,0.0,Clear
02/22/2020,5:00,40.734253,-73.86875,QUEENS,2.0,0.0,0,0,0,0,2,0,4294156,2020-02-22 05:00:00,2020-02-22T05:00,2020,2,-3.5,0.0,Clear
09/05/2020,12:00,40.684746,-73.83112,QUEENS,1.0,0.0,1,0,0,0,0,0,4345028,2020-09-05 12:00:00,2020-09-05T12:00,2020,9,24.2,0.0,Cloudy
08/07/2020,19:00,40.658943,-73.73997,QUEENS,1.0,0.0,1,0,0,0,0,0,4336185,2020-08-07 19:00:00,2020-08-07T19:00,2020,8,23.4,0.0,Cloudy
11/13/2020,15:00,40.747566,-73.88462,QUEENS,1.0,0.0,1,0,0,0,0,0,4367460,2020-11-13 15:00:00,2020-11-13T15:00,2020,11,10.4,0.0,Cloudy
06/07/2020,16:00,40.75412,-73.881325,QUEENS,3.0,0.0,0,0,0,0,3,0,4320625,2020-06-07 16:00:00,2020-06-07T16:00,2020,6,23.5,0.0,Clear
05/03/2020,19:00,40.695114,-73.74574,QUEENS,1.0,0.0,0,0,0,0,1,0,4311696,2020-05-03 19:00:00,2020-05-03T19:00,2020,5,19.5,0.0,Clear
03/17/2020,10:00,40.696167,-73.8045,QUEENS,1.0,0.0,0,0,0,0,1,0,4301856,2020-03-17 10:00:00,2020-03-17T10:00,2020,3,7.0,0.5,Drizzle
08/23/2020,16:00,40.59405,-73.77295,QUEENS,1.0,0.0,0,0,0,0,1,0,4340968,2020-08-23 16:00:00,2020-08-23T16:00,2020,8,25.7,0.0,Cloudy
04/11/2020,0:00,40.74675,-73.89233,QUEENS,1.0,0.0,1,0,0,0,0,0,4308803,2020-04-11 00:00:00,2020-04-11T00:00,2020,4,4.3,0.0,Clear
04/18/2020,22:00,40.722313,-73.74285,QUEENS,2.0,0.0,0,0,0,0,2,0,4309341,2020-04-18 22:00:00,2020-04-18T22:00,2020,4,3.6,0.0,Clear
12/31/2020,15:00,40.734375,-73.87342,QUEENS,1.0,0.0,1,0,0,0,0,0,4380614,2020-12-31 15:00:00,2020-12-31T15:00,2020,12,6.3,0.0,Cloudy
02/11/2020,10:00,40.790802,-73.84459,QUEENS,2.0,0.0,0,0,0,0,2,0,4287082,2020-02-11 10:00:00,2020-02-11T10:00,2020,2,6.1,0.2,Drizzle
02/22/2020,19:00,40.74251,-73.90734,QUEENS,0.0,0.0,0,0,0,0,0,0,4292925,2020-02-22 19:00:00,2020-02-22T19:00,2020,2,3.0,0.0,Clear
06/15/2020,23:00,40.667114,-73.834656,QUEENS,1.0,0.0,0,0,0,0,1,0,4320464,2020-06-15 23:00:00,2020-06-15T23:00,2020,6,14.4,0.0,Cloudy
04/10/2020,14:00,40.666172,-73.76265,QUEENS,1.0,0.0,0,0,0,0,1,0,4308390,2020-04-10 14:00:00,2020-04-10T14:00,2020,4,9.2,0.1,Drizzle
12/25/2020,12:00,40.69432,-73.77785,QUEENS,1.0,0.0,0,0,0,0,1,0,4378998,2020-12-25 12:00:00,2020-12-25T12:00,2020,12,11.6,1.2,Drizzle
04/11/2020,0:00,40.71512,-73.77358,QUEENS,2.0,0.0,0,0,0,0,2,0,4308473,2020-04-11 00:00:00,2020-04-11T00:00,2020,4,4.5,0.0,Clear
12/21/2020,9:00,40.751602,-73.93384,QUEENS,1.0,0.0,0,0,1,0,0,0,4378720,2020-12-21 09:00:00,2020-12-21T09:00,2020,12,0.2,0.0,Cloudy
08/31/2020,0:00,40.74743,-73.925476,QUEENS,2.0,0.0,0,0,2,0,0,0,4343675,2020-08-31 00:00:00,2020-08-31T00:00,2020,8,17.4,0.0,Cloudy
06/20/2020,3:00,40.755028,-73.872696,QUEENS,0.0,0.0,0,0,0,0,0,0,4322314,2020-06-20 03:00:00,2020-06-20T03:00,2020,6,19.3,0.0,Cloudy
01/04/2020,16:00,40.7428,-73.71709,QUEENS,0.0,0.0,0,0,0,0,0,0,4268652,2020-01-04 16:00:00,2020-01-04T16:00,2020,1,9.8,0.0,Cloudy
01/27/2020,13:00,40.711636,-73.8585,QUEENS,0.0,0.0,0,0,0,0,0,0,4279780,2020-01-27 13:00:00,2020-01-27T13:00,2020,1,6.6,0.0,Cloudy
02/15/2020,4:00,40.75203,-73.92915,QUEENS,1.0,0.0,0,0,0,0,1,0,4288930,2020-02-15 04:00:00,2020-02-15T04:00,2020,2,-9.0,0.0,Clear
03/02/2020,17:00,40.732857,-73.79857,QUEENS,1.0,0.0,0,0,0,0,1,0,4296377,2020-03-02 17:00:00,2020-03-02T17:00,2020,3,8.8,0.0,Cloudy
09/15/2020,16:00,40.73011,-73.86509,QUEENS,0.0,0.0,0,0,0,0,0,0,4348313,2020-09-15 16:00:00,2020-09-15T16:00,2020,9,18.2,0.0,Clear
03/01/2020,0:00,40.71302,-73.79141,QUEENS,1.0,0.0,0,0,0,0,1,0,4295704,2020-03-01 00:00:00,2020-03-01T00:00,2020,3,-4.8,0.0,Clear
02/23/2020,13:00,40.689075,-73.80401,QUEENS,3.0,0.0,0,0,0,0,3,0,4292844,2020-02-23 13:00:00,2020-02-23T13:00,2020,2,9.6,0.0,Clear
08/04/2020,13:00,40.672405,-73.730515,QUEENS,1.0,0.0,0,0,0,0,1,0,4334927,2020-08-04 13:00:00,2020-08-04T13:00,2020,8,25.2,2.0,Light Rain
11/21/2020,18:00,40.70219,-73.880165,QUEENS,1.0,0.0,1,0,0,0,0,0,4377550,2020-11-21 18:00:00,2020-11-21T18:00,2020,11,11.5,0.0,Cloudy
06/22/2020,15:00,40.744007,-73.858505,QUEENS,1.0,0.0,0,0,0,0,1,0,4322647,2020-06-22 15:00:00,2020-06-22T15:00,2020,6,29.1,0.0,Clear
02/06/2020,8:00,40.7285,-73.91798,QUEENS,0.0,0.0,0,0,0,0,0,0,4284476,2020-02-06 08:00:00,2020-02-06T08:00,2020,2,4.0,0.0,Cloudy
12/05/2020,13:00,40.691895,-73.77822,QUEENS,3.0,0.0,0,0,0,0,3,0,4373451,2020-12-05 13:00:00,2020-12-05T13:00,2020,12,5.6,0.2,Drizzle
01/06/2020,9:00,40.767952,-73.77834,QUEENS,1.0,0.0,0,0,0,0,1,0,4269448,2020-01-06 09:00:00,2020-01-06T09:00,2020,1,1.5,0.0,Cloudy
03/07/2020,9:00,40.770134,-73.82657,QUEENS,1.0,0.0,1,0,0,0,0,0,4305540,2020-03-07 09:00:00,2020-03-07T09:00,2020,3,3.1,0.0,Cloudy
09/11/2020,15:00,40.71606,-73.761185,QUEENS,2.0,0.0,0,0,0,0,2,0,4347883,2020-09-11 15:00:00,2020-09-11T15:00,2020,9,24.7,0.0,Clear
08/16/2020,2:00,40.740364,-73.85646,QUEENS,1.0,0.0,0,0,0,0,1,0,4339433,2020-08-16 02:00:00,2020-08-16T02:00,2020,8,20.8,0.2,Drizzle
03/13/2020,14:00,40.702473,-73.79993,QUEENS,0.0,0.0,0,0,0,0,0,0,4300464,2020-03-13 14:00:00,2020-03-13T14:00,2020,3,19.4,0.0,Cloudy
10/31/2020,17:00,40.68867,-73.73138,QUEENS,2.0,0.0,0,0,0,0,2,0,4362829,2020-10-31 17:00:00,2020-10-31T17:00,2020,10,6.0,0.0,Cloudy
07/27/2020,14:00,40.669712,-73.816284,QUEENS,0.0,0.0,0,0,0,0,0,0,4332288,2020-07-27 14:00:00,2020-07-27T14:00,2020,7,32.2,0.0,Cloudy
03/13/2020,1:00,40.69158,-73.79319,QUEENS,0.0,0.0,0,0,0,0,0,0,4299630,2020-03-13 01:00:00,2020-03-13T01:00,2020,3,7.9,0.4,Drizzle
04/09/2020,9:00,40.685097,-73.760735,QUEENS,1.0,0.0,0,0,0,0,1,0,4308251,2020-04-09 09:00:00,2020-04-09T09:00,2020,4,10.1,1.4,Light Rain
03/29/2020,16:00,40.750492,-73.70702,QUEENS,1.0,0.0,0,0,0,0,1,0,4304447,2020-03-29 16:00:00,2020-03-29T16:00,2020,3,12.7,0.0,Cloudy
07/03/2020,16:00,40.663223,-73.73351,QUEENS,1.0,0.0,0,0,0,0,1,0,4325323,2020-07-03 16:00:00,2020-07-03T16:00,2020,7,28.0,0.0,Cloudy
08/08/2020,4:00,40.752964,-73.93049,QUEENS,1.0,0.0,0,0,0,0,1,0,4336629,2020-08-08 04:00:00,2020-08-08T04:00,2020,8,21.0,3.1,Heavy Rain
08/19/2020,9:00,40.740875,-73.89962,QUEENS,1.0,0.0,1,0,0,0,0,0,4342584,2020-08-19 09:00:00,2020-08-19T09:00,2020,8,21.9,0.7,Drizzle
09/16/2020,13:00,40.743973,-73.8851,QUEENS,1.0,0.0,1,0,0,0,0,0,4348761,2020-09-16 13:00:00,2020-09-16T13:00,2020,9,21.7,0.0,Cloudy
06/22/2020,17:00,40.71307,-73.75362,QUEENS,1.0,0.0,0,0,0,0,1,0,4322802,2020-06-22 17:00:00,2020-06-22T17:00,2020,6,25.3,0.0,Clear
06/12/2020,12:00,40.678364,-73.77949,QUEENS,1.0,0.0,0,0,0,0,1,0,4319583,2020-06-12 12:00:00,2020-06-12T12:00,2020,6,27.1,0.0,Clear
10/08/2020,9:00,40.66549,-73.819534,QUEENS,0.0,0.0,0,0,0,0,0,0,4355954,2020-10-08 09:00:00,2020-10-08T09:00,2020,10,15.0,0.0,Clear
10/07/2020,15:00,40.732037,-73.814926,QUEENS,1.0,0.0,1,0,0,0,0,0,4357272,2020-10-07 15:00:00,2020-10-07T15:00,2020,10,24.6,0.0,Cloudy
03/02/2020,10:00,40.712887,-73.877716,QUEENS,0.0,0.0,0,0,0,0,0,0,4296242,2020-03-02 10:00:00,2020-03-02T10:00,2020,3,7.5,0.0,Clear
01/16/2020,1:00,40.742306,-73.91889,QUEENS,2.0,0.0,0,0,0,0,2,0,4273944,2020-01-16 01:00:00,2020-01-16T01:00,2020,1,6.1,0.0,Cloudy
06/24/2020,17:00,40.76347,-73.89154,QUEENS,1.0,0.0,0,0,0,0,1,0,4323022,2020-06-24 17:00:00,2020-06-24T17:00,2020,6,30.7,0.0,Clear
10/25/2020,11:00,40.711887,-73.78745,QUEENS,2.0,0.0,0,0,0,0,2,0,4360847,2020-10-25 11:00:00,2020-10-25T11:00,2020,10,9.9,0.0,Cloudy
07/13/2020,16:00,40.740707,-73.89841,QUEENS,1.0,0.0,0,0,0,0,1,0,4328523,2020-07-13 16:00:00,2020-07-13T16:00,2020,7,30.7,0.0,Cloudy
05/07/2020,13:00,40.668724,-73.82145,QUEENS,1.0,0.0,0,0,0,0,1,0,4312327,2020-05-07 13:00:00,2020-05-07T13:00,2020,5,16.2,0.0,Cloudy
03/21/2020,9:00,40.774445,-73.910736,QUEENS,1.0,0.0,1,0,0,0,0,0,4302901,2020-03-21 09:00:00,2020-03-21T09:00,2020,3,6.8,0.0,Cloudy
02/13/2020,15:00,40.68123,-73.736404,QUEENS,0.0,0.0,0,0,0,0,0,0,4287993,2020-02-13 15:00:00,2020-02-13T15:00,2020,2,6.2,1.3,Light Rain
07/06/2020,18:00,40.723663,-73.86864,QUEENS,0.0,0.0,0,0,0,0,0,0,4326551,2020-07-06 18:00:00,2020-07-06T18:00,2020,7,26.8,0.0,Clear
02/18/2020,18:00,40.745476,-73.90446,QUEENS,1.0,0.0,0,0,0,0,1,0,4290388,2020-02-18 18:00:00,2020-02-18T18:00,2020,2,7.6,0.0,Cloudy
01/06/2020,8:00,40.778603,-73.846115,QUEENS,1.0,0.0,1,0,0,0,0,0,4269514,2020-01-06 08:00:00,2020-01-06T08:00,2020,1,0.8,0.0,Cloudy
03/22/2020,14:00,40.754494,-73.779625,QUEENS,0.0,0.0,0,0,0,0,0,0,4302994,2020-03-22 14:00:00,2020-03-22T14:00,2020,3,5.8,0.0,Clear
05/09/2020,11:00,40.764652,-73.92213,QUEENS,1.0,0.0,1,0,0,0,0,0,4312599,2020-05-09 11:00:00,2020-05-09T11:00,2020,5,7.7,0.0,Clear
08/06/2020,10:00,40.73625,-73.81055,QUEENS,0.0,0.0,0,0,0,0,0,0,4335684,2020-08-06 10:00:00,2020-08-06T10:00,2020,8,23.5,0.8,Drizzle
03/06/2020,14:00,40.66705,-73.77411,QUEENS,1.0,0.0,0,0,0,0,1,0,4298538,2020-03-06 14:00:00,2020-03-06T14:00,2020,3,6.7,0.4,Drizzle
09/29/2020,12:00,40.757683,-73.88576,QUEENS,1.0,0.0,0,0,0,0,1,0,4354712,2020-09-29 12:00:00,2020-09-29T12:00,2020,9,22.2,1.1,Drizzle
05/26/2020,19:00,40.692726,-73.85558,QUEENS,1.0,0.0,0,0,1,0,0,0,4320168,2020-05-26 19:00:00,2020-05-26T19:00,2020,5,14.3,0.0,Cloudy
01/12/2020,14:00,40.731777,-73.817535,QUEENS,1.0,0.0,0,0,0,0,1,0,4272095,2020-01-12 14:00:00,2020-01-12T14:00,2020,1,16.8,0.0,Clear
02/05/2020,17:00,40.72848,-73.80523,QUEENS,1.0,0.0,0,0,0,0,1,0,4285695,2020-02-05 17:00:00,2020-02-05T17:00,2020,2,3.9,0.0,Cloudy
08/14/2020,18:00,40.707085,-73.7981,QUEENS,1.0,0.0,0,0,0,0,1,0,4344495,2020-08-14 18:00:00,2020-08-14T18:00,2020,8,26.2,0.0,Clear
11/21/2020,0:00,40.700104,-73.884926,QUEENS,2.0,0.0,0,0,2,0,0,0,4370482,2020-11-21 00:00:00,2020-11-21T00:00,2020,11,9.3,0.0,Clear
11/01/2020,13:00,40.757286,-73.904465,QUEENS,1.0,0.0,1,0,0,0,0,0,4363834,2020-11-01 13:00:00,2020-11-01T13:00,2020,11,13.1,0.8,Drizzle
11/29/2020,20:00,40.72428,-73.898445,QUEENS,3.0,0.0,0,0,0,0,3,0,4371635,2020-11-29 20:00:00,2020-11-29T20:00,2020,11,7.4,0.0,Cloudy
01/09/2020,0:00,40.72861,-73.88721,QUEENS,1.0,0.0,1,0,0,0,0,0,4275351,2020-01-09 00:00:00,2020-01-09T00:00,2020,1,-2.9,0.0,Cloudy
09/09/2020,22:00,40.745827,-73.90111,QUEENS,0.0,0.0,0,0,0,0,0,0,4346581,2020-09-09 22:00:00,2020-09-09T22:00,2020,9,22.7,0.3,Drizzle
02/13/2020,16:00,40.756287,-73.860725,QUEENS,1.0,0.0,1,0,0,0,0,0,4288159,2020-02-13 16:00:00,2020-02-13T16:00,2020,2,6.4,0.6,Drizzle
02/10/2020,17:00,40.66252,-73.84071,QUEENS,0.0,0.0,0,0,0,0,0,0,4286749,2020-02-10 17:00:00,2020-02-10T17:00,2020,2,6.9,0.5,Drizzle
03/11/2020,19:00,40.7448,-73.953415,QUEENS,0.0,0.0,0,0,0,0,0,0,4300545,2020-03-11 19:00:00,2020-03-11T19:00,2020,3,8.4,0.0,Cloudy
03/15/2020,20:00,40.68787,-73.79747,QUEENS,0.0,0.0,0,0,0,0,0,0,4305041,2020-03-15 20:00:00,2020-03-15T20:00,2020,3,6.0,0.0,Clear
01/06/2020,8:00,40.74485,-73.88448,QUEENS,0.0,0.0,0,0,0,0,0,0,4270812,2020-01-06 08:00:00,2020-01-06T08:00,2020,1,0.8,0.0,Cloudy
05/18/2020,15:00,40.67469,-73.79804,QUEENS,0.0,0.0,0,0,0,0,0,0,4314404,2020-05-18 15:00:00,2020-05-18T15:00,2020,5,17.6,0.0,Cloudy
11/06/2020,0:00,40.70288,-73.85796,QUEENS,1.0,0.0,0,0,0,0,1,0,4365564,2020-11-06 00:00:00,2020-11-06T00:00,2020,11,12.2,0.0,Cloudy
12/02/2020,17:00,40.7613,-73.80952,QUEENS,0.0,0.0,0,0,0,0,0,0,4372715,2020-12-02 17:00:00,2020-12-02T17:00,2020,12,5.2,0.0,Cloudy
05/21/2020,16:00,40.63588,-73.740204,QUEENS,1.0,0.0,0,0,0,0,1,0,4314978,2020-05-21 16:00:00,2020-05-21T16:00,2020,5,13.1,0.0,Clear
01/27/2020,0:00,40.7553,-73.87009,QUEENS,1.0,0.0,1,0,0,0,0,0,4280467,2020-01-27 00:00:00,2020-01-27T00:00,2020,1,1.0,0.0,Clear
05/24/2020,11:00,40.700726,-73.89552,QUEENS,1.0,0.0,0,0,1,0,0,0,4315938,2020-05-24 11:00:00,2020-05-24T11:00,2020,5,16.4,0.0,Cloudy
10/16/2020,13:00,40.67481,-73.79511,QUEENS,0.0,0.0,0,0,0,0,0,0,4358295,2020-10-16 13:00:00,2020-10-16T13:00,2020,10,12.7,2.0,Light Rain
06/22/2020,16:00,40.713333,-73.76387,QUEENS,1.0,0.0,0,0,0,0,1,0,4322472,2020-06-22 16:00:00,2020-06-22T16:00,2020,6,26.9,0.0,Clear
02/25/2020,18:00,40.72103,-73.904106,QUEENS,1.0,0.0,0,0,0,0,1,0,4293516,2020-02-25 18:00:00,2020-02-25T18:00,2020,2,7.9,0.1,Drizzle
09/19/2020,13:00,40.676727,-73.85984,QUEENS,3.0,0.0,0,0,0,0,3,0,4349518,2020-09-19 13:00:00,2020-09-19T13:00,2020,9,17.0,0.0,Clear
01/01/2020,20:00,40.6977,-73.9078,QUEENS,0.0,0.0,0,0,0,0,0,0,4269536,2020-01-01 20:00:00,2020-01-01T20:00,2020,1,0.9,0.0,Clear
12/03/2020,22:00,40.746334,-73.89633,QUEENS,1.0,0.0,0,0,1,0,0,0,4373181,2020-12-03 22:00:00,2020-12-03T22:00,2020,12,6.6,0.0,Cloudy
09/11/2020,6:00,40.75523,-73.87964,QUEENS,0.0,0.0,0,0,0,0,0,0,4350162,2020-09-11 06:00:00,2020-09-11T06:00,2020,9,20.7,0.0,Clear
03/13/2020,11:00,40.768913,-73.88873,QUEENS,4.0,0.0,0,0,0,0,4,0,4299754,2020-03-13 11:00:00,2020-03-13T11:00,2020,3,15.6,0.0,Cloudy
06/02/2020,15:00,40.751625,-73.70876,QUEENS,1.0,0.0,1,0,0,0,0,0,4317357,2020-06-02 15:00:00,2020-06-02T15:00,2020,6,21.0,0.0,Cloudy
03/28/2020,17:00,40.67626,-73.81525,QUEENS,0.0,0.0,0,0,0,0,0,0,4304298,2020-03-28 17:00:00,2020-03-28T17:00,2020,3,9.4,0.5,Drizzle
12/20/2020,6:00,40.69242,-73.85151,QUEENS,2.0,0.0,0,0,0,0,2,0,4377790,2020-12-20 06:00:00,2020-12-20T06:00,2020,12,-3.9,0.0,Cloudy
01/07/2020,11:00,40.761623,-73.82208,QUEENS,1.0,0.0,0,0,0,0,1,0,4270134,2020-01-07 11:00:00,2020-01-07T11:00,2020,1,5.4,0.0,Cloudy
02/03/2020,13:00,40.674946,-73.79808,QUEENS,1.0,0.0,0,0,1,0,0,0,4304223,2020-02-03 13:00:00,2020-02-03T13:00,2020,2,10.7,0.0,Clear
09/04/2020,18:00,40.724308,-73.72474,QUEENS,1.0,0.0,0,0,0,0,1,0,4344793,2020-09-04 18:00:00,2020-09-04T18:00,2020,9,23.7,0.0,Clear
10/23/2020,14:00,40.74255,-73.952644,QUEENS,1.0,0.0,0,0,1,0,0,0,4362176,2020-10-23 14:00:00,2020-10-23T14:00,2020,10,20.1,0.0,Cloudy
04/04/2020,0:00,40.72613,-73.75658,QUEENS,1.0,0.0,0,0,0,0,1,0,4307570,2020-04-04 00:00:00,2020-04-04T00:00,2020,4,8.4,0.0,Cloudy
09/22/2020,12:00,40.678944,-73.83447,QUEENS,1.0,0.0,0,0,0,0,1,0,4350680,2020-09-22 12:00:00,2020-09-22T12:00,2020,9,20.0,0.0,Clear
12/18/2020,0:00,40.69774,-73.89289,QUEENS,1.0,0.0,0,0,0,0,1,0,4378252,2020-12-18 00:00:00,2020-12-18T00:00,2020,12,-4.8,0.0,Cloudy
05/31/2020,0:00,40.7581,-73.762,QUEENS,0.0,0.0,0,0,0,0,0,0,4322243,2020-05-31 00:00:00,2020-05-31T00:00,2020,5,18.3,0.0,Clear
08/02/2020,5:00,40.756947,-73.872086,QUEENS,1.0,0.0,0,0,0,0,1,0,4336876,2020-08-02 05:00:00,2020-08-02T05:00,2020,8,24.3,0.0,Cloudy
06/07/2020,22:00,40.75014,-73.722725,QUEENS,0.0,0.0,0,0,0,0,0,0,4318391,2020-06-07 22:00:00,2020-06-07T22:00,2020,6,16.2,0.0,Cloudy
01/23/2020,19:00,40.77326,-73.80129,QUEENS,1.0,0.0,0,0,0,0,1,0,4278113,2020-01-23 19:00:00,2020-01-23T19:00,2020,1,0.7,0.0,Cloudy
09/25/2020,20:00,40.736385,-73.85905,QUEENS,0.0,0.0,0,0,0,0,0,0,4352147,2020-09-25 20:00:00,2020-09-25T20:00,2020,9,19.2,0.0,Cloudy
04/27/2020,7:00,40.681046,-73.77599,QUEENS,0.0,0.0,0,0,0,0,0,0,4310531,2020-04-27 07:00:00,2020-04-27T07:00,2020,4,5.5,0.0,Cloudy
06/12/2020,7:00,40.59329,-73.77972,QUEENS,1.0,0.0,0,0,0,0,1,0,4320055,2020-06-12 07:00:00,2020-06-12T07:00,2020,6,22.2,0.0,Clear
12/07/2020,17:00,40.693115,-73.81977,QUEENS,0.0,0.0,0,0,0,0,0,0,4374266,2020-12-07 17:00:00,2020-12-07T17:00,2020,12,1.3,0.0,Clear
02/09/2020,14:00,40.674133,-73.85826,QUEENS,1.0,0.0,0,0,0,0,1,0,4286186,2020-02-09 14:00:00,2020-02-09T14:00,2020,2,6.6,0.1,Drizzle
01/15/2020,21:00,40.65736,-73.84046,QUEENS,1.0,0.0,0,0,1,0,0,0,4273915,2020-01-15 21:00:00,2020-01-15T21:00,2020,1,4.3,0.0,Clear
01/06/2020,11:00,40.66546,-73.747284,QUEENS,2.0,0.0,0,0,0,0,2,0,4269704,2020-01-06 11:00:00,2020-01-06T11:00,2020,1,5.0,0.0,Clear
03/06/2020,16:00,40.756702,-73.91532,QUEENS,0.0,0.0,0,0,0,0,0,0,4306548,2020-03-06 16:00:00,2020-03-06T16:00,2020,3,5.0,0.4,Drizzle
11/20/2020,14:00,40.659348,-73.75983,QUEENS,0.0,0.0,0,0,0,0,0,0,4369400,2020-11-20 14:00:00,2020-11-20T14:00,2020,11,14.5,0.0,Clear
10/28/2020,14:00,40.70806,-73.8073,QUEENS,3.0,0.0,0,0,0,0,3,0,4362067,2020-10-28 14:00:00,2020-10-28T14:00,2020,10,15.1,0.1,Drizzle
06/26/2020,20:00,40.7081,-73.7823,QUEENS,0.0,0.0,0,0,0,0,0,0,4323441,2020-06-26 20:00:00,2020-06-26T20:00,2020,6,24.5,0.0,Clear
05/30/2020,16:00,40.744026,-73.92616,QUEENS,1.0,0.0,0,0,0,0,1,0,4319025,2020-05-30 16:00:00,2020-05-30T16:00,2020,5,26.6,0.0,Clear
06/01/2020,2:00,40.739895,-73.85246,QUEENS,0.0,0.0,0,0,0,0,0,0,4317162,2020-06-01 02:00:00,2020-06-01T02:00,2020,6,10.3,0.0,Clear
03/15/2020,1:00,40.685963,-73.85654,QUEENS,0.0,0.0,0,0,0,0,0,0,4300673,2020-03-15 01:00:00,2020-03-15T01:00,2020,3,6.2,0.1,Drizzle
08/26/2020,18:00,40.72546,-73.87734,QUEENS,1.0,0.0,0,0,0,0,1,0,4342890,2020-08-26 18:00:00,2020-08-26T18:00,2020,8,25.2,0.0,Cloudy
04/11/2020,19:00,40.748997,-73.89151,QUEENS,1.0,0.0,0,0,0,0,1,0,4308715,2020-04-11 19:00:00,2020-04-11T19:00,2020,4,7.9,0.0,Clear
11/10/2020,8:00,40.783222,-73.83772,QUEENS,0.0,0.0,0,0,0,0,0,0,4366351,2020-11-10 08:00:00,2020-11-10T08:00,2020,11,13.5,0.0,Clear
12/11/2020,19:00,40.72028,-73.86548,QUEENS,1.0,0.0,0,0,0,0,1,0,4375563,2020-12-11 19:00:00,2020-12-11T19:00,2020,12,6.4,0.0,Clear
03/26/2020,17:00,40.680115,-73.75324,QUEENS,0.0,0.0,0,0,0,0,0,0,4304048,2020-03-26 17:00:00,2020-03-26T17:00,2020,3,7.6,0.0,Clear
03/12/2020,8:00,40.767376,-73.76758,QUEENS,0.0,0.0,0,0,0,0,0,0,4299182,2020-03-12 08:00:00,2020-03-12T08:00,2020,3,5.6,0.0,Cloudy
02/29/2020,19:00,40.784103,-73.84854,QUEENS,0.0,0.0,0,0,0,0,0,0,4295344,2020-02-29 19:00:00,2020-02-29T19:00,2020,2,-2.4,0.0,Clear
11/03/2020,18:00,40.712696,-73.900604,QUEENS,1.0,0.0,0,0,0,0,1,0,4363947,2020-11-03 18:00:00,2020-11-03T18:00,2020,11,7.9,0.0,Clear
07/08/2020,17:00,40.656963,-73.84322,QUEENS,2.0,0.0,0,0,2,0,0,0,4326798,2020-07-08 17:00:00,2020-07-08T17:00,2020,7,25.6,0.0,Cloudy
05/22/2020,13:00,40.700123,-73.90622,QUEENS,1.0,0.0,0,0,0,0,1,0,4316299,2020-05-22 13:00:00,2020-05-22T13:00,2020,5,20.7,0.0,Clear
03/22/2020,16:00,40.682095,-73.78174,QUEENS,0.0,0.0,0,0,0,0,0,0,4303339,2020-03-22 16:00:00,2020-03-22T16:00,2020,3,4.0,0.0,Cloudy
08/07/2020,0:00,40.752308,-73.86808,QUEENS,1.0,0.0,0,0,1,0,0,0,4336844,2020-08-07 00:00:00,2020-08-07T00:00,2020,8,22.9,0.0,Cloudy
11/09/2020,9:00,40.74203,-73.91892,QUEENS,0.0,0.0,0,0,0,0,0,0,4365828,2020-11-09 09:00:00,2020-11-09T09:00,2020,11,13.2,0.0,Clear
08/21/2020,17:00,40.701885,-73.73824,QUEENS,3.0,0.0,0,0,0,0,3,0,4340491,2020-08-21 17:00:00,2020-08-21T17:00,2020,8,24.0,0.0,Cloudy
01/10/2020,12:00,40.709866,-73.81642,QUEENS,1.0,0.0,1,0,0,0,0,0,4271616,2020-01-10 12:00:00,2020-01-10T12:00,2020,1,8.3,0.0,Cloudy
10/27/2020,19:00,40.78058,-73.81431,QUEENS,1.0,0.0,0,0,0,0,1,0,4361802,2020-10-27 19:00:00,2020-10-27T19:00,2020,10,12.5,0.0,Cloudy
06/30/2020,2:00,40.710754,-73.9051,QUEENS,2.0,0.0,0,0,0,0,2,0,4324412,2020-06-30 02:00:00,2020-06-30T02:00,2020,6,20.1,0.0,Clear
10/28/2020,12:00,40.76508,-73.91955,QUEENS,0.0,0.0,0,0,0,0,0,0,4363831,2020-10-28 12:00:00,2020-10-28T12:00,2020,10,13.6,0.0,Cloudy
10/19/2020,18:00,40.726646,-73.71497,QUEENS,0.0,0.0,0,0,0,0,0,0,4359620,2020-10-19 18:00:00,2020-10-19T18:00,2020,10,14.7,0.0,Cloudy
11/23/2020,20:00,40.668163,-73.84577,QUEENS,0.0,0.0,0,0,0,0,0,0,4370318,2020-11-23 20:00:00,2020-11-23T20:00,2020,11,6.0,0.0,Clear
03/12/2020,18:00,40.704334,-73.82452,QUEENS,0.0,0.0,0,0,0,0,0,0,4299710,2020-03-12 18:00:00,2020-03-12T18:00,2020,3,7.3,0.0,Cloudy
12/11/2020,17:00,40.703293,-73.7961,QUEENS,1.0,0.0,0,0,0,0,1,0,4375217,2020-12-11 17:00:00,2020-12-11T17:00,2020,12,6.6,0.0,Clear
02/27/2020,19:00,40.689644,-73.81907,QUEENS,1.0,0.0,0,0,0,0,1,0,4296859,2020-02-27 19:00:00,2020-02-27T19:00,2020,2,0.7,0.0,Clear
08/20/2020,18:00,40.744587,-73.81966,QUEENS,1.0,0.0,0,0,1,0,0,0,4340170,2020-08-20 18:00:00,2020-08-20T18:00,2020,8,22.4,0.0,Cloudy
03/21/2020,19:00,40.74885,-73.94711,QUEENS,0.0,0.0,0,0,0,0,0,0,4303074,2020-03-21 19:00:00,2020-03-21T19:00,2020,3,6.1,0.0,Clear
07/27/2020,6:00,40.670555,-73.85634,QUEENS,1.0,0.0,0,0,0,0,1,0,4332144,2020-07-27 06:00:00,2020-07-27T06:00,2020,7,23.4,0.0,Cloudy
03/11/2020,9:00,40.66549,-73.819534,QUEENS,1.0,0.0,0,0,0,0,1,0,4298751,2020-03-11 09:00:00,2020-03-11T09:00,2020,3,8.4,0.0,Cloudy
05/24/2020,15:00,40.676968,-73.83527,QUEENS,0.0,0.0,0,0,0,0,0,0,4315553,2020-05-24 15:00:00,2020-05-24T15:00,2020,5,16.3,0.0,Cloudy
07/24/2020,22:00,40.690914,-73.72819,QUEENS,2.0,0.0,0,0,0,0,2,0,4333404,2020-07-24 22:00:00,2020-07-24T22:00,2020,7,22.7,0.0,Cloudy
04/18/2020,15:00,40.701458,-73.812515,QUEENS,1.0,0.0,0,0,0,0,1,0,4309765,2020-04-18 15:00:00,2020-04-18T15:00,2020,4,7.8,0.0,Cloudy
09/20/2020,22:00,40.74861,-73.89984,QUEENS,0.0,0.0,0,0,0,0,0,0,4350284,2020-09-20 22:00:00,2020-09-20T22:00,2020,9,11.2,0.0,Clear
11/03/2020,16:00,40.65942,-73.761116,QUEENS,0.0,0.0,0,0,0,0,0,0,4364021,2020-11-03 16:00:00,2020-11-03T16:00,2020,11,10.6,0.0,Cloudy
01/06/2020,17:00,40.72257,-73.75729,QUEENS,1.0,0.0,1,0,0,0,0,0,4270849,2020-01-06 17:00:00,2020-01-06T17:00,2020,1,4.0,0.0,Clear
08/25/2020,9:00,40.666332,-73.81056,QUEENS,1.0,0.0,0,0,0,0,1,0,4341551,2020-08-25 09:00:00,2020-08-25T09:00,2020,8,27.7,0.0,Cloudy
04/20/2020,13:00,40.753826,-73.88412,QUEENS,1.0,0.0,0,0,1,0,0,0,4310196,2020-04-20 13:00:00,2020-04-20T13:00,2020,4,11.0,0.0,Cloudy
06/18/2020,17:00,40.740772,-73.89867,QUEENS,1.0,0.0,0,0,1,0,0,0,4321196,2020-06-18 17:00:00,2020-06-18T17:00,2020,6,22.5,0.0,Cloudy
06/08/2020,8:00,40.724915,-73.72793,QUEENS,0.0,0.0,0,0,0,0,0,0,4318841,2020-06-08 08:00:00,2020-06-08T08:00,2020,6,19.2,0.0,Clear
01/28/2020,11:00,40.75332,-73.72683,QUEENS,0.0,0.0,0,0,0,0,0,0,4280142,2020-01-28 11:00:00,2020-01-28T11:00,2020,1,5.4,0.0,Cloudy
08/22/2020,19:00,40.725006,-73.8792,QUEENS,1.0,0.0,0,0,0,0,1,0,4340693,2020-08-22 19:00:00,2020-08-22T19:00,2020,8,26.1,0.0,Cloudy
08/06/2020,0:00,40.706364,-73.81673,QUEENS,1.0,0.0,0,0,0,0,1,0,4335554,2020-08-06 00:00:00,2020-08-06T00:00,2020,8,21.0,0.0,Cloudy
05/11/2020,0:00,40.74312,-73.86118,QUEENS,0.0,0.0,0,0,0,0,0,0,4313050,2020-05-11 00:00:00,2020-05-11T00:00,2020,5,8.9,0.0,Clear
07/03/2020,23:00,40.707226,-73.804504,QUEENS,0.0,0.0,0,0,0,0,0,0,4351275,2020-07-03 23:00:00,2020-07-03T23:00,2020,7,21.6,3.6,Heavy Rain
01/07/2020,18:00,40.7516,-73.7058,QUEENS,1.0,0.0,0,0,0,0,1,0,4270091,2020-01-07 18:00:00,2020-01-07T18:00,2020,1,2.9,0.0,Cloudy
06/16/2020,18:00,40.714443,-73.75999,QUEENS,1.0,0.0,0,0,0,0,1,0,4320893,2020-06-16 18:00:00,2020-06-16T18:00,2020,6,19.0,0.0,Cloudy
01/30/2020,16:00,40.713715,-73.80309,QUEENS,2.0,0.0,0,0,0,0,2,0,4281438,2020-01-30 16:00:00,2020-01-30T16:00,2020,1,1.1,0.0,Cloudy
11/02/2020,18:00,40.706665,-73.739296,QUEENS,5.0,0.0,0,0,0,0,5,0,4363674,2020-11-02 18:00:00,2020-11-02T18:00,2020,11,4.2,0.0,Clear
04/25/2020,22:00,40.71616,-73.744774,QUEENS,0.0,0.0,0,0,0,0,0,0,4310388,2020-04-25 22:00:00,2020-04-25T22:00,2020,4,8.4,0.0,Cloudy
09/29/2020,17:00,40.671074,-73.754776,QUEENS,1.0,0.0,0,0,0,0,1,0,4352994,2020-09-29 17:00:00,2020-09-29T17:00,2020,9,21.2,1.3,Light Rain
01/02/2020,14:00,40.75432,-73.89725,QUEENS,0.0,0.0,0,0,0,0,0,0,4270294,2020-01-02 14:00:00,2020-01-02T14:00,2020,1,8.8,0.0,Cloudy
08/21/2020,16:00,40.697525,-73.746826,QUEENS,2.0,0.0,0,0,0,0,2,0,4341401,2020-08-21 16:00:00,2020-08-21T16:00,2020,8,25.1,0.0,Cloudy
06/15/2020,17:00,40.70212,-73.90959,QUEENS,1.0,0.0,0,0,0,0,1,0,4320823,2020-06-15 17:00:00,2020-06-15T17:00,2020,6,19.0,0.0,Cloudy
05/31/2020,16:00,40.715244,-73.88021,QUEENS,2.0,0.0,2,0,0,0,0,0,4317645,2020-05-31 16:00:00,2020-05-31T16:00,2020,5,18.8,0.0,Clear
08/09/2020,18:00,40.7375,-73.85276,QUEENS,2.0,0.0,0,0,0,0,2,0,4337192,2020-08-09 18:00:00,2020-08-09T18:00,2020,8,26.0,0.0,Clear
07/09/2020,2:00,40.70622,-73.7851,QUEENS,1.0,0.0,1,0,0,0,0,0,4327026,2020-07-09 02:00:00,2020-07-09T02:00,2020,7,22.6,0.0,Clear
04/03/2020,0:00,40.744846,-73.835686,QUEENS,1.0,0.0,0,0,0,0,1,0,4307444,2020-04-03 00:00:00,2020-04-03T00:00,2020,4,7.8,0.1,Drizzle
07/04/2020,18:00,40.6912,-73.88979,QUEENS,7.0,0.0,0,0,0,0,7,0,4325513,2020-07-04 18:00:00,2020-07-04T18:00,2020,7,23.0,0.0,Clear
01/21/2020,19:00,40.788525,-73.81117,QUEENS,1.0,0.0,1,0,0,0,0,0,4277090,2020-01-21 19:00:00,2020-01-21T19:00,2020,1,-3.5,0.0,Clear
06/05/2020,17:00,40.675682,-73.816,QUEENS,0.0,0.0,0,0,0,0,0,0,4318036,2020-06-05 17:00:00,2020-06-05T17:00,2020,6,19.6,3.7,Heavy Rain
03/04/2020,16:00,40.66537,-73.73254,QUEENS,0.0,0.0,0,0,0,0,0,0,4297749,2020-03-04 16:00:00,2020-03-04T16:00,2020,3,12.7,0.0,Clear
04/22/2020,12:00,40.751297,-73.73986,QUEENS,0.0,0.0,0,0,0,0,0,0,4311847,2020-04-22 12:00:00,2020-04-22T12:00,2020,4,7.5,0.0,Cloudy
10/23/2020,16:00,40.7316,-73.87885,QUEENS,0.0,0.0,0,0,0,0,0,0,4363103,2020-10-23 16:00:00,2020-10-23T16:00,2020,10,18.5,0.0,Cloudy
03/16/2020,20:00,40.674908,-73.800674,QUEENS,0.0,0.0,0,0,0,0,0,0,4301598,2020-03-16 20:00:00,2020-03-16T20:00,2020,3,4.2,0.0,Cloudy
10/10/2020,0:00,40.672382,-73.78574,QUEENS,2.0,0.0,0,0,0,0,2,0,4356190,2020-10-10 00:00:00,2020-10-10T00:00,2020,10,15.4,0.0,Clear
02/19/2020,9:00,40.692413,-73.82703,QUEENS,0.0,0.0,0,0,0,0,0,0,4290686,2020-02-19 09:00:00,2020-02-19T09:00,2020,2,5.9,0.0,Clear
10/24/2020,18:00,40.757607,-73.78094,QUEENS,0.0,0.0,0,0,0,0,0,0,4360639,2020-10-24 18:00:00,2020-10-24T18:00,2020,10,15.2,0.0,Clear
06/22/2020,11:00,40.71841,-73.74167,QUEENS,1.0,0.0,0,0,0,0,1,0,4322212,2020-06-22 11:00:00,2020-06-22T11:00,2020,6,30.4,0.0,Clear
06/21/2020,16:00,40.74462,-73.94859,QUEENS,1.0,0.0,0,0,0,0,1,0,4321850,2020-06-21 16:00:00,2020-06-21T16:00,2020,6,26.6,0.0,Cloudy
09/03/2020,21:00,40.756546,-73.8064,QUEENS,1.0,0.0,0,0,0,0,1,0,4344576,2020-09-03 21:00:00,2020-09-03T21:00,2020,9,23.2,2.3,Light Rain
10/24/2020,19:00,40.708096,-73.87268,QUEENS,1.0,0.0,0,0,1,0,0,0,4360943,2020-10-24 19:00:00,2020-10-24T19:00,2020,10,14.0,0.0,Cloudy
01/07/2020,9:00,40.7749,-73.803894,QUEENS,2.0,0.0,0,0,0,0,2,0,4270579,2020-01-07 09:00:00,2020-01-07T09:00,2020,1,2.1,0.0,Cloudy
11/11/2020,0:00,40.6682,-73.83929,QUEENS,1.0,0.0,0,0,0,0,1,0,4366580,2020-11-11 00:00:00,2020-11-11T00:00,2020,11,16.0,0.0,Clear
06/23/2020,16:00,40.72002,-73.81834,QUEENS,1.0,0.0,0,0,1,0,0,0,4322510,2020-06-23 16:00:00,2020-06-23T16:00,2020,6,25.2,0.0,Clear
09/17/2020,0:00,40.75373,-73.88505,QUEENS,0.0,0.0,0,0,0,0,0,0,4350335,2020-09-17 00:00:00,2020-09-17T00:00,2020,9,17.6,0.0,Cloudy
07/03/2020,18:00,40.7056,-73.85822,QUEENS,1.0,0.0,0,0,0,0,1,0,4325509,2020-07-03 18:00:00,2020-07-03T18:00,2020,7,27.4,0.0,Clear
11/06/2020,15:00,40.73772,-73.93352,QUEENS,0.0,0.0,0,0,0,0,0,0,4365045,2020-11-06 15:00:00,2020-11-06T15:00,2020,11,19.8,0.0,Clear
03/24/2020,14:00,40.692066,-73.7654,QUEENS,1.0,0.0,0,0,0,0,1,0,4304648,2020-03-24 14:00:00,2020-03-24T14:00,2020,3,12.5,0.0,Cloudy
04/29/2020,20:00,40.667114,-73.834656,QUEENS,2.0,0.0,0,0,0,0,2,0,4311000,2020-04-29 20:00:00,2020-04-29T20:00,2020,4,8.9,0.1,Drizzle
02/07/2020,12:00,40.657864,-73.766075,QUEENS,0.0,0.0,0,0,0,0,0,0,4284940,2020-02-07 12:00:00,2020-02-07T12:00,2020,2,14.3,0.4,Drizzle
12/02/2020,15:00,40.69795,-73.73666,QUEENS,0.0,0.0,0,0,0,0,0,0,4372687,2020-12-02 15:00:00,2020-12-02T15:00,2020,12,5.7,0.0,Cloudy
09/29/2020,4:00,0.0,0.0,QUEENS,1.0,0.0,1,0,0,0,0,0,4355088,2020-09-29 04:00:00,2020-09-29T04:00,2020,9,24.4,0.0,Cloudy
02/11/2020,0:00,40.756287,-73.860725,QUEENS,1.0,0.0,0,0,0,0,1,0,4287775,2020-02-11 00:00:00,2020-02-11T00:00,2020,2,5.4,0.2,Drizzle
10/17/2020,9:00,40.768806,-73.900345,QUEENS,3.0,0.0,0,0,0,0,3,0,4358730,2020-10-17 09:00:00,2020-10-17T09:00,2020,10,10.4,0.0,Clear
12/10/2020,9:00,40.74734,-73.88673,QUEENS,1.0,0.0,1,0,0,0,0,0,4374996,2020-12-10 09:00:00,2020-12-10T09:00,2020,12,6.0,0.0,Clear
01/27/2020,19:00,40.679024,-73.73673,QUEENS,2.0,0.0,0,0,0,0,2,0,4279839,2020-01-27 19:00:00,2020-01-27T19:00,2020,1,5.1,0.0,Cloudy
02/25/2020,19:00,40.67581,-73.739555,QUEENS,1.0,0.0,1,0,0,0,0,0,4293381,2020-02-25 19:00:00,2020-02-25T19:00,2020,2,6.9,0.1,Drizzle
03/15/2020,15:00,40.742683,-73.89566,QUEENS,1.0,0.0,1,0,0,0,0,0,4301436,2020-03-15 15:00:00,2020-03-15T15:00,2020,3,10.9,0.0,Clear
12/26/2020,17:00,40.678062,-73.85921,QUEENS,0.0,0.0,0,0,0,0,0,0,4379112,2020-12-26 17:00:00,2020-12-26T17:00,2020,12,-1.3,0.0,Clear
07/21/2020,0:00,40.740875,-73.89962,QUEENS,0.0,0.0,0,0,0,0,0,0,4331320,2020-07-21 00:00:00,2020-07-21T00:00,2020,7,25.4,0.0,Clear
11/24/2020,17:00,40.76423,-73.87554,QUEENS,1.0,0.0,1,0,0,0,0,0,4370880,2020-11-24 17:00:00,2020-11-24T17:00,2020,11,5.9,0.0,Clear
05/24/2020,16:00,40.58239,-73.82824,QUEENS,2.0,0.0,1,0,1,0,0,0,4315452,2020-05-24 16:00:00,2020-05-24T16:00,2020,5,14.6,0.0,Cloudy
06/09/2020,21:00,40.68163,-73.76557,QUEENS,1.0,0.0,0,0,0,0,1,0,4318880,2020-06-09 21:00:00,2020-06-09T21:00,2020,6,21.5,0.0,Clear
08/23/2020,4:00,40.679855,-73.79554,QUEENS,2.0,0.0,0,0,0,0,2,0,4341402,2020-08-23 04:00:00,2020-08-23T04:00,2020,8,21.4,0.0,Cloudy
01/04/2020,2:00,40.763798,-73.808235,QUEENS,1.0,0.0,0,0,0,0,1,0,4268596,2020-01-04 02:00:00,2020-01-04T02:00,2020,1,6.7,0.5,Drizzle
03/23/2020,5:00,40.724308,-73.842575,QUEENS,1.0,0.0,0,0,0,0,1,0,4303379,2020-03-23 05:00:00,2020-03-23T05:00,2020,3,2.3,0.3,Light Snow
11/21/2020,19:00,40.711784,-73.79,QUEENS,1.0,0.0,1,0,0,0,0,0,4370794,2020-11-21 19:00:00,2020-11-21T19:00,2020,11,11.3,0.0,Cloudy
12/25/2020,6:00,40.749363,-73.86291,QUEENS,1.0,0.0,1,0,0,0,0,0,4379526,2020-12-25 06:00:00,2020-12-25T06:00,2020,12,14.5,4.2,Heavy Rain
03/20/2020,12:00,40.73421,-73.824905,QUEENS,0.0,0.0,0,0,0,0,0,0,4302619,2020-03-20 12:00:00,2020-03-20T12:00,2020,3,18.7,0.9,Drizzle
12/20/2020,15:00,40.756332,-73.8734,QUEENS,1.0,0.0,1,0,0,0,0,0,4381702,2020-12-20 15:00:00,2020-12-20T15:00,2020,12,1.3,0.0,Cloudy
08/31/2020,15:00,40.78416,-73.83639,QUEENS,0.0,0.0,0,0,0,0,0,0,4343499,2020-08-31 15:00:00,2020-08-31T15:00,2020,8,23.7,0.0,Cloudy
09/05/2020,21:00,40.698986,-73.804886,QUEENS,1.0,0.0,0,0,1,0,0,0,4345830,2020-09-05 21:00:00,2020-09-05T21:00,2020,9,21.2,0.0,Clear
07/14/2020,14:00,40.74539,-73.90559,QUEENS,1.0,0.0,0,0,1,0,0,0,4328522,2020-07-14 14:00:00,2020-07-14T14:00,2020,7,28.8,0.0,Cloudy
05/28/2020,11:00,40.749485,-73.883316,QUEENS,0.0,0.0,0,0,0,0,0,0,4329595,2020-05-28 11:00:00,2020-05-28T11:00,2020,5,22.0,0.0,Cloudy
06/18/2020,15:00,40.68106,-73.82637,QUEENS,1.0,0.0,0,0,0,0,1,0,4321268,2020-06-18 15:00:00,2020-06-18T15:00,2020,6,22.1,0.0,Cloudy
03/24/2020,2:00,40.69058,-73.74989,QUEENS,2.0,0.0,0,0,0,0,2,0,4303535,2020-03-24 02:00:00,2020-03-24T02:00,2020,3,2.5,0.0,Clear
08/23/2020,0:00,40.6722,-73.734604,QUEENS,1.0,0.0,0,0,0,0,1,0,4340813,2020-08-23 00:00:00,2020-08-23T00:00,2020,8,23.0,0.0,Cloudy
08/01/2020,12:00,40.657436,-73.746185,QUEENS,1.0,0.0,0,0,0,0,1,0,4333921,2020-08-01 12:00:00,2020-08-01T12:00,2020,8,28.5,0.0,Cloudy
10/15/2020,11:00,40.70985,-73.917145,QUEENS,1.0,0.0,0,0,1,0,0,0,4360949,2020-10-15 11:00:00,2020-10-15T11:00,2020,10,20.2,0.0,Cloudy
02/15/2020,8:00,40.759518,-73.87758,QUEENS,0.0,0.0,0,0,0,0,0,0,4289029,2020-02-15 08:00:00,2020-02-15T08:00,2020,2,-8.7,0.0,Clear
10/15/2020,21:00,40.73664,-73.86584,QUEENS,2.0,0.0,0,0,0,0,2,0,4358238,2020-10-15 21:00:00,2020-10-15T21:00,2020,10,17.8,0.0,Cloudy
10/27/2020,13:00,40.699764,-73.788185,QUEENS,0.0,0.0,0,0,0,0,0,0,4361742,2020-10-27 13:00:00,2020-10-27T13:00,2020,10,15.2,0.0,Cloudy
01/16/2020,10:00,40.747692,-73.89381,QUEENS,1.0,0.0,1,0,0,0,0,0,4274326,2020-01-16 10:00:00,2020-01-16T10:00,2020,1,8.3,0.0,Clear
11/10/2020,9:00,40.743263,-73.91964,QUEENS,0.0,0.0,0,0,0,0,0,0,4366867,2020-11-10 09:00:00,2020-11-10T09:00,2020,11,14.9,0.0,Clear
07/29/2020,18:00,40.73025,-73.887314,QUEENS,1.0,0.0,1,0,0,0,0,0,4334098,2020-07-29 18:00:00,2020-07-29T18:00,2020,7,28.6,0.0,Clear
02/21/2020,19:00,40.748547,-73.89584,QUEENS,1.0,0.0,0,0,0,0,1,0,4291631,2020-02-21 19:00:00,2020-02-21T19:00,2020,2,-1.4,0.0,Clear
02/14/2020,10:00,40.77686,-73.82168,QUEENS,0.0,0.0,0,0,0,0,0,0,4289031,2020-02-14 10:00:00,2020-02-14T10:00,2020,2,-1.4,0.0,Clear
05/22/2020,7:00,40.748543,-73.86705,QUEENS,1.0,0.0,0,0,1,0,0,0,4315757,2020-05-22 07:00:00,2020-05-22T07:00,2020,5,15.3,0.0,Clear
07/17/2020,22:00,40.60076,-73.75405,QUEENS,1.0,0.0,1,0,0,0,0,0,4330115,2020-07-17 22:00:00,2020-07-17T22:00,2020,7,24.1,0.0,Clear
11/28/2020,21:00,40.699837,-73.782616,QUEENS,1.0,0.0,0,0,0,0,1,0,4371982,2020-11-28 21:00:00,2020-11-28T21:00,2020,11,6.0,0.0,Clear
07/25/2020,1:00,40.674133,-73.85826,QUEENS,3.0,0.0,0,0,0,0,3,0,4332136,2020-07-25 01:00:00,2020-07-25T01:00,2020,7,22.5,0.0,Clear
10/26/2020,18:00,40.712494,-73.78447,QUEENS,1.0,0.0,0,0,0,0,1,0,4361735,2020-10-26 18:00:00,2020-10-26T18:00,2020,10,16.2,0.0,Cloudy
12/04/2020,15:00,40.715,-73.89986,QUEENS,0.0,0.0,0,0,0,0,0,0,4375561,2020-12-04 15:00:00,2020-12-04T15:00,2020,12,8.3,0.1,Drizzle
04/04/2020,5:00,40.733128,-73.783035,QUEENS,1.0,0.0,0,0,0,0,1,0,4307480,2020-04-04 05:00:00,2020-04-04T05:00,2020,4,6.9,0.1,Drizzle
05/02/2020,12:00,40.777462,-73.9031,QUEENS,1.0,0.0,0,0,0,0,1,0,4311953,2020-05-02 12:00:00,2020-05-02T12:00,2020,5,19.9,0.0,Cloudy
05/13/2020,13:00,40.69612,-73.74619,QUEENS,2.0,0.0,2,0,0,0,0,0,4313317,2020-05-13 13:00:00,2020-05-13T13:00,2020,5,13.9,0.0,Cloudy
06/16/2020,21:00,40.742683,-73.89566,QUEENS,1.0,0.0,1,0,0,0,0,0,4320837,2020-06-16 21:00:00,2020-06-16T21:00,2020,6,17.8,0.0,Clear
07/12/2020,2:00,40.691135,-73.82184,QUEENS,1.0,0.0,0,0,0,0,1,0,4328160,2020-07-12 02:00:00,2020-07-12T02:00,2020,7,22.8,0.0,Clear
07/04/2020,22:00,40.687447,-73.748856,QUEENS,5.0,0.0,0,0,0,0,5,0,4326476,2020-07-04 22:00:00,2020-07-04T22:00,2020,7,21.9,0.0,Clear
03/18/2020,11:00,40.702473,-73.79993,QUEENS,2.0,0.0,0,0,0,0,2,0,4301858,2020-03-18 11:00:00,2020-03-18T11:00,2020,3,9.1,0.0,Clear
05/25/2020,14:00,40.733097,-73.80788,QUEENS,0.0,0.0,0,0,0,0,0,0,4315777,2020-05-25 14:00:00,2020-05-25T14:00,2020,5,19.6,0.0,Cloudy
06/20/2020,20:00,40.740448,-73.84967,QUEENS,0.0,0.0,0,0,0,0,0,0,4321936,2020-06-20 20:00:00,2020-06-20T20:00,2020,6,21.1,0.0,Cloudy
02/23/2020,12:00,40.749462,-73.901665,QUEENS,1.0,0.0,0,0,0,0,1,0,4292260,2020-02-23 12:00:00,2020-02-23T12:00,2020,2,9.5,0.0,Clear
08/17/2020,16:00,40.665558,-73.72985,QUEENS,2.0,0.0,0,0,0,0,2,0,4339628,2020-08-17 16:00:00,2020-08-17T16:00,2020,8,22.8,0.0,Clear
09/29/2020,11:00,40.72741,-73.731476,QUEENS,3.0,0.0,0,0,0,0,3,0,4352996,2020-09-29 11:00:00,2020-09-29T11:00,2020,9,21.2,1.3,Light Rain
10/05/2020,19:00,40.651405,-73.758896,QUEENS,1.0,0.0,0,0,0,0,1,0,4355021,2020-10-05 19:00:00,2020-10-05T19:00,2020,10,15.8,0.0,Clear
01/11/2020,0:00,40.665245,-73.73709,QUEENS,1.0,0.0,0,0,0,0,1,0,4271576,2020-01-11 00:00:00,2020-01-11T00:00,2020,1,9.4,0.0,Cloudy
03/02/2020,19:00,40.676617,-73.8579,QUEENS,1.0,0.0,0,0,1,0,0,0,4296720,2020-03-02 19:00:00,2020-03-02T19:00,2020,3,10.3,0.0,Cloudy
12/14/2020,4:00,40.7558,-73.86535,QUEENS,0.0,0.0,0,0,0,0,0,0,4377608,2020-12-14 04:00:00,2020-12-14T04:00,2020,12,3.2,0.0,Cloudy
12/18/2020,11:00,40.72965,-73.90023,QUEENS,1.0,0.0,0,0,0,0,1,0,4377575,2020-12-18 11:00:00,2020-12-18T11:00,2020,12,-3.6,0.0,Clear
12/31/2020,17:00,40.700306,-73.76599,QUEENS,1.0,0.0,0,0,0,0,1,0,4380667,2020-12-31 17:00:00,2020-12-31T17:00,2020,12,5.0,0.0,Cloudy
10/09/2020,0:00,40.745007,-73.91928,QUEENS,1.0,0.0,1,0,0,0,0,0,4356133,2020-10-09 00:00:00,2020-10-09T00:00,2020,10,10.7,0.0,Clear
06/24/2020,12:00,40.677837,-73.82103,QUEENS,2.0,0.0,0,0,0,0,2,0,4322747,2020-06-24 12:00:00,2020-06-24T12:00,2020,6,28.9,0.0,Cloudy
01/28/2020,10:00,40.76315,-73.81261,QUEENS,0.0,0.0,0,0,0,0,0,0,4280323,2020-01-28 10:00:00,2020-01-28T10:00,2020,1,4.4,0.0,Clear
02/26/2020,11:00,40.7452,-73.8249,QUEENS,0.0,0.0,0,0,0,0,0,0,4294046,2020-02-26 11:00:00,2020-02-26T11:00,2020,2,9.3,0.0,Cloudy
06/20/2020,5:00,40.75571,-73.866104,QUEENS,0.0,0.0,0,0,0,0,0,0,4322307,2020-06-20 05:00:00,2020-06-20T05:00,2020,6,19.7,0.0,Cloudy
05/16/2020,21:00,40.712494,-73.78447,QUEENS,1.0,0.0,0,0,1,0,0,0,4314352,2020-05-16 21:00:00,2020-05-16T21:00,2020,5,14.6,0.0,Cloudy
05/24/2020,15:00,40.66352,-73.73135,QUEENS,2.0,0.0,0,0,0,0,2,0,4315400,2020-05-24 15:00:00,2020-05-24T15:00,2020,5,16.2,0.0,Cloudy
02/10/2020,21:00,40.664745,-73.74003,QUEENS,1.0,0.0,0,0,0,0,1,0,4286587,2020-02-10 21:00:00,2020-02-10T21:00,2020,2,6.3,0.5,Drizzle
04/04/2020,18:00,40.788914,-73.800415,QUEENS,0.0,0.0,0,0,0,0,0,0,4307564,2020-04-04 18:00:00,2020-04-04T18:00,2020,4,11.2,0.0,Cloudy
01/09/2020,18:00,40.709805,-73.76882,QUEENS,2.0,0.0,2,0,0,0,0,0,4276438,2020-01-09 18:00:00,2020-01-09T18:00,2020,1,-1.1,0.0,Cloudy
03/10/2020,19:00,40.767357,-73.820045,QUEENS,0.0,0.0,0,0,0,0,0,0,4307113,2020-03-10 19:00:00,2020-03-10T19:00,2020,3,15.1,1.7,Light Rain
06/16/2020,8:00,0.0,0.0,QUEENS,1.0,0.0,0,0,0,0,1,0,4320773,2020-06-16 08:00:00,2020-06-16T08:00,2020,6,23.9,0.0,Clear
04/10/2020,9:00,40.72229,-73.86732,QUEENS,1.0,0.0,1,0,0,0,0,0,4308355,2020-04-10 09:00:00,2020-04-10T09:00,2020,4,6.9,0.0,Cloudy
05/04/2020,18:00,40.697605,-73.8232,QUEENS,0.0,0.0,0,0,0,0,0,0,4311807,2020-05-04 18:00:00,2020-05-04T18:00,2020,5,13.2,0.0,Clear
09/08/2020,18:00,40.70509,-73.7907,QUEENS,1.0,0.0,0,0,0,0,1,0,4345939,2020-09-08 18:00:00,2020-09-08T18:00,2020,9,22.1,0.0,Clear
06/07/2020,8:00,40.588078,-73.80635,QUEENS,2.0,0.0,0,0,0,0,2,0,4318646,2020-06-07 08:00:00,2020-06-07T08:00,2020,6,19.3,0.0,Clear
02/07/2020,12:00,40.65855,-73.76616,QUEENS,0.0,0.0,0,0,0,0,0,0,4284998,2020-02-07 12:00:00,2020-02-07T12:00,2020,2,14.3,0.4,Drizzle
11/08/2020,15:00,40.70156,-73.9078,QUEENS,0.0,0.0,0,0,0,0,0,0,4365924,2020-11-08 15:00:00,2020-11-08T15:00,2020,11,21.1,0.0,Clear
08/11/2020,7:00,40.768234,-73.90709,QUEENS,2.0,0.0,0,0,0,0,2,0,4337858,2020-08-11 07:00:00,2020-08-11T07:00,2020,8,26.1,0.0,Clear
09/17/2020,18:00,40.7131,-73.83318,QUEENS,1.0,0.0,0,0,0,0,1,0,4349039,2020-09-17 18:00:00,2020-09-17T18:00,2020,9,20.3,0.0,Cloudy
03/16/2020,13:00,40.684258,-73.84604,QUEENS,1.0,0.0,1,0,0,0,0,0,4301026,2020-03-16 13:00:00,2020-03-16T13:00,2020,3,5.8,0.0,Cloudy
01/29/2020,18:00,40.736576,-73.85406,QUEENS,1.0,0.0,0,0,0,0,1,0,4280720,2020-01-29 18:00:00,2020-01-29T18:00,2020,1,0.2,0.0,Clear
07/11/2020,23:00,40.701588,-73.7544,QUEENS,0.0,0.0,0,0,0,0,0,0,4327564,2020-07-11 23:00:00,2020-07-11T23:00,2020,7,24.5,0.0,Clear
08/14/2020,12:00,40.66067,-73.768036,QUEENS,0.0,0.0,0,0,0,0,0,0,4342205,2020-08-14 12:00:00,2020-08-14T12:00,2020,8,29.0,0.0,Cloudy
02/04/2020,0:00,40.687527,-73.802795,QUEENS,0.0,0.0,0,0,0,0,0,0,4283634,2020-02-04 00:00:00,2020-02-04T00:00,2020,2,6.0,0.0,Cloudy
06/30/2020,15:00,40.74298,-73.934875,QUEENS,1.0,0.0,0,0,0,0,1,0,4324724,2020-06-30 15:00:00,2020-06-30T15:00,2020,6,25.1,0.0,Cloudy
05/13/2020,12:00,40.74726,-73.86248,QUEENS,1.0,0.0,0,0,0,0,1,0,4313547,2020-05-13 12:00:00,2020-05-13T12:00,2020,5,13.3,0.0,Clear
01/09/2020,17:00,40.711433,-73.78768,QUEENS,1.0,0.0,0,0,0,0,1,0,4271259,2020-01-09 17:00:00,2020-01-09T17:00,2020,1,-2.4,0.0,Cloudy
07/02/2020,16:00,40.666332,-73.81056,QUEENS,1.0,0.0,0,0,0,0,1,0,4325107,2020-07-02 16:00:00,2020-07-02T16:00,2020,7,27.3,0.0,Clear
12/23/2020,20:00,40.671825,-73.774506,QUEENS,1.0,0.0,0,0,0,0,1,0,4378639,2020-12-23 20:00:00,2020-12-23T20:00,2020,12,4.5,0.0,Cloudy
07/19/2020,22:00,40.64912,-73.83737,QUEENS,0.0,0.0,0,0,0,0,0,0,4330111,2020-07-19 22:00:00,2020-07-19T22:00,2020,7,25.4,0.0,Cloudy
06/22/2020,20:00,40.738335,-73.84991,QUEENS,1.0,0.0,0,0,0,0,1,0,4322622,2020-06-22 20:00:00,2020-06-22T20:00,2020,6,23.4,0.0,Clear
09/26/2020,16:00,40.696583,-73.7667,QUEENS,0.0,0.0,0,0,0,0,0,0,4351807,2020-09-26 16:00:00,2020-09-26T16:00,2020,9,21.8,0.0,Clear
11/04/2020,10:00,40.778614,-73.84069,QUEENS,0.0,0.0,0,0,0,0,0,0,4364320,2020-11-04 10:00:00,2020-11-04T10:00,2020,11,12.1,0.0,Clear
04/11/2020,20:00,40.727398,-73.895485,QUEENS,1.0,0.0,0,0,1,0,0,0,4308499,2020-04-11 20:00:00,2020-04-11T20:00,2020,4,7.2,0.0,Clear
10/03/2020,12:00,40.74869,-73.85772,QUEENS,1.0,0.0,0,0,1,0,0,0,4354483,2020-10-03 12:00:00,2020-10-03T12:00,2020,10,17.7,0.0,Clear
03/27/2020,5:00,40.683735,-73.85932,QUEENS,0.0,0.0,0,0,0,0,0,0,4304088,2020-03-27 05:00:00,2020-03-27T05:00,2020,3,7.8,0.0,Cloudy
11/07/2020,11:00,40.66561,-73.73568,QUEENS,2.0,0.0,0,0,0,0,2,0,4365062,2020-11-07 11:00:00,2020-11-07T11:00,2020,11,18.2,0.0,Cloudy
06/09/2020,19:00,40.69377,-73.82756,QUEENS,1.0,0.0,0,0,1,0,0,0,4326835,2020-06-09 19:00:00,2020-06-09T19:00,2020,6,22.5,0.0,Clear
05/31/2020,0:00,40.578053,-74.11717,STATEN ISLAND,1.0,0.0,0,0,0,0,1,0,4317207,2020-05-31 00:00:00,2020-05-31T00:00,2020,5,18.2,0.0,Clear
06/25/2020,14:00,40.61658,-74.08275,STATEN ISLAND,1.0,0.0,0,0,0,0,1,0,4323267,2020-06-25 14:00:00,2020-06-25T14:00,2020,6,26.2,0.0,Cloudy
10/21/2020,0:00,40.609528,-74.07019,STATEN ISLAND,0.0,0.0,0,0,0,0,0,0,4360384,2020-10-21 00:00:00,2020-10-21T00:00,2020,10,14.6,0.0,Cloudy
01/23/2020,11:00,40.610107,-74.10081,STATEN ISLAND,1.0,0.0,0,0,0,0,1,0,4278138,2020-01-23 11:00:00,2020-01-23T11:00,2020,1,2.8,0.0,Cloudy
12/03/2020,16:00,40.640766,-74.09476,STATEN ISLAND,0.0,0.0,0,0,0,0,0,0,4373283,2020-12-03 16:00:00,2020-12-03T16:00,2020,12,7.7,0.0,Cloudy
03/14/2020,16:00,40.57761,-74.11189,STATEN ISLAND,1.0,0.0,0,0,0,0,1,0,4300449,2020-03-14 16:00:00,2020-03-14T16:00,2020,3,12.3,0.0,Cloudy
10/19/2020,18:00,40.55172,-74.151566,STATEN ISLAND,0.0,0.0,0,0,0,0,0,0,4359308,2020-10-19 18:00:00,2020-10-19T18:00,2020,10,15.2,0.0,Cloudy
09/24/2020,20:00,40.626663,-74.07565,STATEN ISLAND,0.0,0.0,0,0,0,0,0,0,4354797,2020-09-24 20:00:00,2020-09-24T20:00,2020,9,18.8,0.0,Cloudy
01/26/2020,15:00,40.56272,-74.13976,STATEN ISLAND,0.0,0.0,0,0,0,0,0,0,4279183,2020-01-26 15:00:00,2020-01-26T15:00,2020,1,7.0,0.0,Cloudy
08/25/2020,19:00,40.550133,-74.14213,STATEN ISLAND,1.0,0.0,0,0,0,0,1,0,4342289,2020-08-25 19:00:00,2020-08-25T19:00,2020,8,27.6,0.2,Drizzle
02/08/2020,14:00,40.543766,-74.16345,STATEN ISLAND,1.0,0.0,0,0,0,0,1,0,4285380,2020-02-08 14:00:00,2020-02-08T14:00,2020,2,5.1,0.0,Cloudy
01/31/2020,8:00,40.52472,-74.21029,STATEN ISLAND,1.0,0.0,0,0,0,0,1,0,4283387,2020-01-31 08:00:00,2020-01-31T08:00,2020,1,0.6,0.0,Cloudy
02/07/2020,8:00,40.560223,-74.133865,STATEN ISLAND,1.0,0.0,0,0,0,0,1,0,4284827,2020-02-07 08:00:00,2020-02-07T08:00,2020,2,5.4,1.1,Drizzle
07/14/2020,20:00,40.59415,-74.086586,STATEN ISLAND,1.0,0.0,1,0,0,0,0,0,4329026,2020-07-14 20:00:00,2020-07-14T20:00,2020,7,25.5,0.0,Cloudy
11/05/2020,10:00,40.59183,-74.10098,STATEN ISLAND,0.0,0.0,0,0,0,0,0,0,4364504,2020-11-05 10:00:00,2020-11-05T10:00,2020,11,13.9,0.0,Cloudy
01/11/2020,17:00,40.63727,-74.08841,STATEN ISLAND,0.0,0.0,0,0,0,0,0,0,4273137,2020-01-11 17:00:00,2020-01-11T17:00,2020,1,16.5,0.0,Cloudy
01/10/2020,8:00,40.629833,-74.116356,STATEN ISLAND,1.0,0.0,0,0,0,0,1,0,4272363,2020-01-10 08:00:00,2020-01-10T08:00,2020,1,2.7,0.0,Cloudy
01/16/2020,8:00,40.643723,-74.0834,STATEN ISLAND,0.0,0.0,0,0,0,0,0,0,4274473,2020-01-16 08:00:00,2020-01-16T08:00,2020,1,7.6,0.0,Clear
06/27/2020,17:00,40.637154,-74.086555,STATEN ISLAND,1.0,0.0,0,0,0,0,1,0,4324289,2020-06-27 17:00:00,2020-06-27T17:00,2020,6,25.9,0.0,Cloudy
11/27/2020,14:00,40.56781,-74.112434,STATEN ISLAND,0.0,0.0,0,0,0,0,0,0,4371837,2020-11-27 14:00:00,2020-11-27T14:00,2020,11,15.3,0.0,Cloudy
08/28/2020,9:00,40.59924,-74.09179,STATEN ISLAND,0.0,0.0,0,0,0,0,0,0,4342700,2020-08-28 09:00:00,2020-08-28T09:00,2020,8,25.0,0.0,Cloudy
12/21/2020,10:00,40.594616,-74.12555,STATEN ISLAND,0.0,0.0,0,0,0,0,0,0,4377842,2020-12-21 10:00:00,2020-12-21T10:00,2020,12,1.8,0.0,Cloudy
11/17/2020,13:00,40.5956,-74.063126,STATEN ISLAND,1.0,0.0,0,0,0,0,1,0,4368641,2020-11-17 13:00:00,2020-11-17T13:00,2020,11,9.1,0.0,Cloudy
11/10/2020,17:00,40.619698,-74.10771,STATEN ISLAND,1.0,0.0,0,0,1,0,0,0,4367993,2020-11-10 17:00:00,2020-11-10T17:00,2020,11,18.3,0.0,Clear
06/30/2020,8:00,40.542423,-74.14592,STATEN ISLAND,0.0,0.0,0,0,0,0,0,0,4324337,2020-06-30 08:00:00,2020-06-30T08:00,2020,6,23.4,0.0,Clear
06/07/2020,21:00,40.586956,-74.11046,STATEN ISLAND,0.0,0.0,0,0,0,0,0,0,4318501,2020-06-07 21:00:00,2020-06-07T21:00,2020,6,19.2,0.0,Clear
01/22/2020,14:00,40.63198,-74.10066,STATEN ISLAND,3.0,0.0,0,0,0,0,3,0,4277751,2020-01-22 14:00:00,2020-01-22T14:00,2020,1,2.2,0.0,Clear
05/31/2020,21:00,40.60918,-74.09397,STATEN ISLAND,1.0,0.0,0,0,0,0,1,0,4317388,2020-05-31 21:00:00,2020-05-31T21:00,2020,5,14.8,0.0,Clear
07/10/2020,22:00,40.59942,-74.064095,STATEN ISLAND,1.0,0.0,0,0,0,0,1,0,4327451,2020-07-10 22:00:00,2020-07-10T22:00,2020,7,23.8,0.1,Drizzle
08/09/2020,11:00,40.61978,-74.10793,STATEN ISLAND,1.0,0.0,1,0,0,0,0,0,4337642,2020-08-09 11:00:00,2020-08-09T11:00,2020,8,27.4,0.1,Drizzle
06/13/2020,18:00,40.627167,-74.07595,STATEN ISLAND,0.0,0.0,0,0,0,0,0,0,4321301,2020-06-13 18:00:00,2020-06-13T18:00,2020,6,21.9,0.0,Clear
09/09/2020,15:00,40.61238,-74.07117,STATEN ISLAND,0.0,0.0,0,0,0,0,0,0,4347841,2020-09-09 15:00:00,2020-09-09T15:00,2020,9,23.6,0.0,Cloudy
05/13/2020,20:00,40.563663,-74.132515,STATEN ISLAND,2.0,0.0,0,0,0,0,2,0,4313460,2020-05-13 20:00:00,2020-05-13T20:00,2020,5,10.0,0.0,Clear
07/23/2020,21:00,40.63786,-74.11763,STATEN ISLAND,1.0,0.0,0,0,0,0,1,0,4354775,2020-07-23 21:00:00,2020-07-23T21:00,2020,7,26.2,0.0,Cloudy
04/20/2020,16:00,40.566013,-74.10079,STATEN ISLAND,0.0,0.0,0,0,0,0,0,0,4309630,2020-04-20 16:00:00,2020-04-20T16:00,2020,4,11.9,0.0,Cloudy
06/29/2020,10:00,40.55759,-74.13818,STATEN ISLAND,1.0,0.0,1,0,0,0,0,0,4324973,2020-06-29 10:00:00,2020-06-29T10:00,2020,6,27.2,0.0,Clear
11/09/2020,12:00,40.537106,-74.145485,STATEN ISLAND,0.0,0.0,0,0,0,0,0,0,4366107,2020-11-09 12:00:00,2020-11-09T12:00,2020,11,21.0,0.0,Clear
11/14/2020,10:00,40.610172,-74.12146,STATEN ISLAND,1.0,0.0,0,0,1,0,0,0,4368041,2020-11-14 10:00:00,2020-11-14T10:00,2020,11,9.2,0.0,Clear
07/06/2020,17:00,40.504482,-74.24727,STATEN ISLAND,1.0,0.0,1,0,0,0,0,0,4326628,2020-07-06 17:00:00,2020-07-06T17:00,2020,7,30.6,0.1,Drizzle
05/24/2020,21:00,40.537117,-74.166985,STATEN ISLAND,0.0,0.0,0,0,0,0,0,0,4315664,2020-05-24 21:00:00,2020-05-24T21:00,2020,5,13.1,0.0,Cloudy
07/26/2020,12:00,40.594296,-74.06716,STATEN ISLAND,1.0,0.0,1,0,0,0,0,0,4337070,2020-07-26 12:00:00,2020-07-26T12:00,2020,7,32.2,0.0,Clear
10/09/2020,18:00,40.546894,-74.19585,STATEN ISLAND,1.0,0.0,1,0,0,0,0,0,4358248,2020-10-09 18:00:00,2020-10-09T18:00,2020,10,16.9,0.0,Clear
09/22/2020,0:00,40.611553,-74.08775,STATEN ISLAND,1.0,0.0,1,0,0,0,0,0,4351174,2020-09-22 00:00:00,2020-09-22T00:00,2020,9,11.9,0.0,Clear
12/28/2020,17:00,40.53301,-74.203354,STATEN ISLAND,1.0,0.0,0,0,0,0,1,0,4380519,2020-12-28 17:00:00,2020-12-28T17:00,2020,12,5.7,0.0,Clear
09/21/2020,14:00,40.54387,-74.14445,STATEN ISLAND,0.0,0.0,0,0,0,0,0,0,4350176,2020-09-21 14:00:00,2020-09-21T14:00,2020,9,18.1,0.0,Clear
04/27/2020,13:00,40.510517,-74.24828,STATEN ISLAND,0.0,0.0,0,0,0,0,0,0,4311101,2020-04-27 13:00:00,2020-04-27T13:00,2020,4,8.1,0.1,Drizzle
09/27/2020,18:00,40.646664,-74.088936,STATEN ISLAND,1.0,0.0,1,0,0,0,0,0,4353150,2020-09-27 18:00:00,2020-09-27T18:00,2020,9,21.4,0.0,Clear
04/22/2020,12:00,40.625587,-74.07896,STATEN ISLAND,1.0,0.0,0,0,1,0,0,0,4310069,2020-04-22 12:00:00,2020-04-22T12:00,2020,4,7.7,0.0,Cloudy
10/07/2020,20:00,40.55057,-74.16758,STATEN ISLAND,1.0,0.0,0,0,0,0,1,0,4355609,2020-10-07 20:00:00,2020-10-07T20:00,2020,10,17.9,0.0,Clear
01/08/2020,18:00,40.53343,-74.19537,STATEN ISLAND,0.0,0.0,0,0,0,0,0,0,4271202,2020-01-08 18:00:00,2020-01-08T18:00,2020,1,1.1,0.0,Clear
12/31/2020,7:00,40.623585,-74.08278,STATEN ISLAND,1.0,0.0,1,0,0,0,0,0,4380657,2020-12-31 07:00:00,2020-12-31T07:00,2020,12,7.0,0.9,Drizzle
02/10/2020,8:00,40.534267,-74.15398,STATEN ISLAND,1.0,0.0,0,0,0,0,1,0,4286399,2020-02-10 08:00:00,2020-02-10T08:00,2020,2,5.3,0.7,Drizzle
07/07/2020,19:00,40.530106,-74.190475,STATEN ISLAND,2.0,0.0,0,0,0,0,2,0,4326681,2020-07-07 19:00:00,2020-07-07T19:00,2020,7,24.1,0.4,Drizzle
06/16/2020,16:00,40.635193,-74.07548,STATEN ISLAND,1.0,0.0,1,0,0,0,0,0,4321302,2020-06-16 16:00:00,2020-06-16T16:00,2020,6,20.8,0.0,Cloudy
12/13/2020,19:00,40.637653,-74.07992,STATEN ISLAND,1.0,0.0,0,0,1,0,0,0,4378095,2020-12-13 19:00:00,2020-12-13T19:00,2020,12,7.2,0.0,Cloudy
07/06/2020,19:00,40.57323,-74.14702,STATEN ISLAND,0.0,0.0,0,0,0,0,0,0,4326141,2020-07-06 19:00:00,2020-07-06T19:00,2020,7,24.1,0.0,Clear
11/28/2020,22:00,40.54783,-74.13952,STATEN ISLAND,2.0,0.0,0,0,0,0,2,0,4372521,2020-11-28 22:00:00,2020-11-28T22:00,2020,11,5.1,0.0,Clear
09/17/2020,8:00,40.63934,-74.0936,STATEN ISLAND,0.0,0.0,0,0,0,0,0,0,4351169,2020-09-17 08:00:00,2020-09-17T08:00,2020,9,18.7,0.0,Cloudy
