CRASH DATE,CRASH TIME,LATITUDE,LONGITUDE,BOROUGH,NUMBER OF PERSONS INJURED,NUMBER OF PERSONS KILLED,NUMBER OF PEDESTRIANS INJURED,NUMBER OF PEDESTRIANS KILLED,NUMBER OF CYCLIST INJURED,NUMBER OF CYCLIST KILLED,NUMBER OF MOTORIST INJURED,NUMBER OF MOTORIST KILLED,COLLISION_ID,datetime,iso_datetime,year,month,temperature,precipitation,weather_condition
10/30/2018,21:00,40.87395,-73.85278,BRONX,0.0,0.0,0,0,0,0,0,0,4011164,2018-10-30 21:00:00,2018-10-30T21:00,2018,10,5.0,0.0,Clear
09/21/2018,4:00,40.888744,-73.85563,BRONX,0.0,0.0,0,0,0,0,0,0,3986446,2018-09-21 04:00:00,2018-09-21T04:00,2018,9,18.7,0.0,Cloudy
09/18/2018,0:00,40.838306,-73.82893,BRONX,1.0,0.0,1,0,0,0,0,0,3985115,2018-09-18 00:00:00,2018-09-18T00:00,2018,9,23.0,0.0,Cloudy
02/15/2018,12:00,40.87927,-73.85446,BRONX,1.0,0.0,0,0,0,0,1,0,3847651,2018-02-15 12:00:00,2018-02-15T12:00,2018,2,11.4,0.0,Cloudy
03/18/2018,15:00,40.81888,-73.916504,BRONX,1.0,0.0,0,0,0,0,1,0,3866212,2018-03-18 15:00:00,2018-03-18T15:00,2018,3,5.2,0.0,Clear
12/16/2018,16:00,40.874878,-73.85302,BRONX,2.0,0.0,0,0,0,0,2,0,4047027,2018-12-16 16:00:00,2018-12-16T16:00,2018,12,4.3,0.2,Drizzle
07/30/2018,2:00,40.85612,-73.89331,BRONX,0.0,0.0,0,0,0,0,0,0,3952132,2018-07-30 02:00:00,2018-07-30T02:00,2018,7,20.3,0.0,Clear
09/03/2018,12:00,40.887234,-73.84828,BRONX,0.0,0.0,0,0,0,0,0,0,3973410,2018-09-03 12:00:00,2018-09-03T12:00,2018,9,30.6,0.0,Clear
08/16/2018,14:00,40.80495,-73.883995,BRONX,1.0,0.0,0,0,0,0,1,0,3962951,2018-08-16 14:00:00,2018-08-16T14:00,2018,8,31.8,0.0,Clear
04/18/2018,14:00,40.73858,-73.9846,BRONX,0.0,1.0,0,0,0,0,0,0,4025853,2018-04-18 14:00:00,2018-04-18T14:00,2018,4,11.3,0.0,Cloudy
10/04/2018,14:00,40.862747,-73.90494,BRONX,1.0,0.0,1,0,0,0,0,0,3994423,2018-10-04 14:00:00,2018-10-04T14:00,2018,10,23.5,0.0,Cloudy
06/17/2018,21:00,40.853985,-73.882576,BRONX,4.0,0.0,0,0,0,0,4,0,3923049,2018-06-17 21:00:00,2018-06-17T21:00,2018,6,21.5,0.0,Cloudy
11/20/2018,19:00,40.819096,-73.914566,BRONX,0.0,0.0,0,0,0,0,0,0,4029899,2018-11-20 19:00:00,2018-11-20T19:00,2018,11,4.2,0.0,Clear
11/13/2018,13:00,40.857605,-73.89124,BRONX,0.0,0.0,0,0,0,0,0,0,4020024,2018-11-13 13:00:00,2018-11-13T13:00,2018,11,7.9,0.0,Cloudy
06/14/2018,0:00,40.87911,-73.84325,BRONX,1.0,0.0,0,0,0,0,1,0,3923153,2018-06-14 00:00:00,2018-06-14T00:00,2018,6,21.8,0.0,Cloudy
02/22/2018,21:00,40.87746,-73.853745,BRONX,1.0,0.0,1,0,0,0,0,0,3852347,2018-02-22 21:00:00,2018-02-22T21:00,2018,2,2.5,0.0,Cloudy
08/04/2018,0:00,40.843857,-73.83044,BRONX,1.0,0.0,0,0,0,0,1,0,3955818,2018-08-04 00:00:00,2018-08-04T00:00,2018,8,22.5,0.0,Cloudy
12/23/2018,0:00,40.8262,-73.821686,BRONX,1.0,0.0,0,0,0,0,1,0,4050695,2018-12-23 00:00:00,2018-12-23T00:00,2018,12,3.6,0.0,Cloudy
08/07/2018,1:00,40.85592,-73.9172,BRONX,0.0,0.0,0,0,0,0,0,0,3957109,2018-08-07 01:00:00,2018-08-07T01:00,2018,8,25.3,0.0,Clear
10/18/2018,8:00,40.8281,-73.92021,BRONX,1.0,0.0,1,0,0,0,0,0,4003287,2018-10-18 08:00:00,2018-10-18T08:00,2018,10,6.1,0.0,Clear
01/20/2018,10:00,40.83121,-73.850876,BRONX,1.0,0.0,1,0,0,0,0,0,3832503,2018-01-20 10:00:00,2018-01-20T10:00,2018,1,6.0,0.0,Clear
02/26/2018,17:00,40.840057,-73.870964,BRONX,1.0,0.0,0,0,0,0,1,0,3853029,2018-02-26 17:00:00,2018-02-26T17:00,2018,2,9.8,0.0,Cloudy
02/16/2018,0:00,40.83648,-73.897736,BRONX,1.0,0.0,0,0,0,0,1,0,3848155,2018-02-16 00:00:00,2018-02-16T00:00,2018,2,11.3,1.7,Light Rain
05/13/2018,20:00,40.840225,-73.91769,BRONX,1.0,0.0,1,0,0,0,0,0,3900859,2018-05-13 20:00:00,2018-05-13T20:00,2018,5,11.5,0.0,Cloudy
02/24/2018,15:00,40.834415,-73.92854,BRONX,1.0,0.0,0,0,0,0,1,0,3852028,2018-02-24 15:00:00,2018-02-24T15:00,2018,2,10.7,0.6,Drizzle
04/04/2018,22:00,40.834232,-73.874,BRONX,0.0,0.0,0,0,0,0,0,0,3877017,2018-04-04 22:00:00,2018-04-04T22:00,2018,4,4.9,0.0,Clear
11/19/2018,0:00,40.815525,-73.85779,BRONX,1.0,0.0,0,0,0,0,1,0,4028849,2018-11-19 00:00:00,2018-11-19T00:00,2018,11,3.9,0.0,Cloudy
08/28/2018,14:00,40.85554,-73.91413,BRONX,1.0,0.0,0,0,0,0,1,0,3969524,2018-08-28 14:00:00,2018-08-28T14:00,2018,8,33.3,0.0,Clear
09/04/2018,15:00,40.815903,-73.92848,BRONX,0.0,0.0,0,0,0,0,0,0,3974063,2018-09-04 15:00:00,2018-09-04T15:00,2018,9,31.6,0.0,Cloudy
01/12/2018,0:00,40.884033,-73.89797,BRONX,1.0,0.0,1,0,0,0,0,0,3828709,2018-01-12 00:00:00,2018-01-12T00:00,2018,1,7.6,0.0,Cloudy
02/13/2018,8:00,40.876907,-73.9057,BRONX,1.0,0.0,0,0,0,0,1,0,3845532,2018-02-13 08:00:00,2018-02-13T08:00,2018,2,-3.5,0.0,Clear
09/19/2018,22:00,40.827087,-73.9309,BRONX,0.0,0.0,0,0,0,0,0,0,3985513,2018-09-19 22:00:00,2018-09-19T22:00,2018,9,20.3,0.3,Drizzle
10/12/2018,20:00,40.86795,-73.8705,BRONX,1.0,0.0,0,0,1,0,0,0,3999313,2018-10-12 20:00:00,2018-10-12T20:00,2018,10,11.5,0.0,Clear
01/22/2018,5:00,40.808163,-73.92653,BRONX,1.0,0.0,1,0,0,0,0,0,3837142,2018-01-22 05:00:00,2018-01-22T05:00,2018,1,5.4,0.0,Cloudy
04/05/2018,17:00,40.806164,-73.909134,BRONX,0.0,0.0,0,0,0,0,0,0,3875839,2018-04-05 17:00:00,2018-04-05T17:00,2018,4,5.7,0.0,Cloudy
11/07/2018,8:00,40.830536,-73.91948,BRONX,1.0,0.0,1,0,0,0,0,0,4020550,2018-11-07 08:00:00,2018-11-07T08:00,2018,11,10.4,0.0,Clear
10/14/2018,18:00,40.881298,-73.8991,BRONX,1.0,0.0,1,0,0,0,0,0,3999686,2018-10-14 18:00:00,2018-10-14T18:00,2018,10,12.2,0.0,Clear
03/02/2018,22:00,40.818012,-73.92519,BRONX,1.0,0.0,1,0,0,0,0,0,3857358,2018-03-02 22:00:00,2018-03-02T22:00,2018,3,3.3,0.0,Cloudy
07/09/2018,9:00,40.847855,-73.895584,BRONX,0.0,0.0,0,0,0,0,0,0,3939039,2018-07-09 09:00:00,2018-07-09T09:00,2018,7,25.0,0.0,Clear
05/10/2018,23:00,40.83394,-73.9087,BRONX,1.0,0.0,0,0,0,0,1,0,3902766,2018-05-10 23:00:00,2018-05-10T23:00,2018,5,14.7,0.0,Clear
07/24/2018,14:00,40.826424,-73.85868,BRONX,1.0,0.0,0,0,0,0,1,0,3948153,2018-07-24 14:00:00,2018-07-24T14:00,2018,7,27.5,0.1,Drizzle
10/06/2018,9:00,40.85819,-73.88435,BRONX,1.0,0.0,1,0,0,0,0,0,3995970,2018-10-06 09:00:00,2018-10-06T09:00,2018,10,17.6,0.0,Cloudy
08/29/2018,8:00,40.900288,-73.89704,BRONX,1.0,0.0,0,0,0,0,1,0,3971420,2018-08-29 08:00:00,2018-08-29T08:00,2018,8,27.9,0.0,Clear
12/17/2018,0:00,40.845493,-73.883484,BRONX,1.0,0.0,1,0,0,0,0,0,4048903,2018-12-17 00:00:00,2018-12-17T00:00,2018,12,1.8,0.4,Drizzle
03/22/2018,0:00,40.834354,-73.850174,BRONX,1.0,0.0,0,0,0,0,1,0,3868065,2018-03-22 00:00:00,2018-03-22T00:00,2018,3,-0.1,0.9,Heavy Snow
02/19/2018,5:00,40.82756,-73.90316,BRONX,0.0,0.0,0,0,0,0,0,0,3849384,2018-02-19 05:00:00,2018-02-19T05:00,2018,2,-0.5,0.0,Cloudy
09/18/2018,13:00,40.884155,-73.900375,BRONX,0.0,0.0,0,0,0,0,0,0,3983531,2018-09-18 13:00:00,2018-09-18T13:00,2018,9,23.8,4.3,Heavy Rain
03/11/2018,17:00,40.867035,-73.896324,BRONX,0.0,0.0,0,0,0,0,0,0,3860674,2018-03-11 17:00:00,2018-03-11T17:00,2018,3,5.3,0.0,Clear
01/22/2018,18:00,40.904243,-73.852165,BRONX,2.0,0.0,0,0,0,0,2,0,3833698,2018-01-22 18:00:00,2018-01-22T18:00,2018,1,5.1,0.0,Cloudy
06/20/2018,19:00,40.887966,-73.8235,BRONX,0.0,0.0,0,0,0,0,0,0,3926121,2018-06-20 19:00:00,2018-06-20T19:00,2018,6,22.4,0.0,Cloudy
09/30/2018,11:00,40.861744,-73.911804,BRONX,1.0,0.0,0,0,0,0,1,0,3992080,2018-09-30 11:00:00,2018-09-30T11:00,2018,9,18.9,0.0,Clear
01/23/2018,22:00,40.883133,-73.882095,BRONX,2.0,0.0,2,0,0,0,0,0,3834796,2018-01-23 22:00:00,2018-01-23T22:00,2018,1,5.2,0.0,Clear
12/06/2018,21:00,40.84518,-73.91417,BRONX,1.0,0.0,0,0,0,0,1,0,4039984,2018-12-06 21:00:00,2018-12-06T21:00,2018,12,2.1,0.0,Cloudy
10/05/2018,5:00,40.89466,-73.86137,BRONX,0.0,0.0,0,0,0,0,0,0,3994246,2018-10-05 05:00:00,2018-10-05T05:00,2018,10,14.1,0.0,Clear
03/04/2018,18:00,40.830723,-73.82322,BRONX,2.0,0.0,0,0,0,0,2,0,3856728,2018-03-04 18:00:00,2018-03-04T18:00,2018,3,3.7,0.0,Cloudy
03/08/2018,8:00,40.815155,-73.86056,BRONX,4.0,0.0,0,0,0,0,4,0,3859219,2018-03-08 08:00:00,2018-03-08T08:00,2018,3,0.3,0.0,Cloudy
12/21/2018,17:00,40.84455,-73.91751,BRONX,0.0,0.0,0,0,0,0,0,0,4050491,2018-12-21 17:00:00,2018-12-21T17:00,2018,12,11.0,0.0,Clear
09/28/2018,13:00,40.88144,-73.848755,BRONX,1.0,0.0,0,0,0,0,1,0,4000057,2018-09-28 13:00:00,2018-09-28T13:00,2018,9,17.0,0.0,Cloudy
04/12/2018,16:00,40.88532,-73.91403,BRONX,1.0,0.0,1,0,0,0,0,0,3882844,2018-04-12 16:00:00,2018-04-12T16:00,2018,4,13.0,0.1,Drizzle
06/29/2018,15:00,40.803905,-73.91844,BRONX,2.0,0.0,0,0,0,0,2,0,3932344,2018-06-29 15:00:00,2018-06-29T15:00,2018,6,31.7,0.0,Clear
11/15/2018,15:00,40.880657,-73.877625,BRONX,1.0,0.0,0,0,0,0,1,0,4026725,2018-11-15 15:00:00,2018-11-15T15:00,2018,11,1.8,1.2,Heavy Snow
11/29/2018,12:00,40.88886,-73.82857,BRONX,1.0,0.0,0,0,0,0,1,0,4034938,2018-11-29 12:00:00,2018-11-29T12:00,2018,11,6.5,0.0,Cloudy
04/02/2018,10:00,40.817574,-73.90359,BRONX,2.0,0.0,0,0,0,0,2,0,3874389,2018-04-02 10:00:00,2018-04-02T10:00,2018,4,0.6,0.4,Heavy Snow
11/28/2018,0:00,40.85378,-73.88808,BRONX,1.0,0.0,1,0,0,0,0,0,4035462,2018-11-28 00:00:00,2018-11-28T00:00,2018,11,3.0,0.0,Cloudy
02/12/2018,6:00,40.868237,-73.855705,BRONX,0.0,0.0,0,0,0,0,0,0,3845604,2018-02-12 06:00:00,2018-02-12T06:00,2018,2,4.6,0.0,Cloudy
07/05/2018,1:00,40.807507,-73.92701,BRONX,5.0,0.0,0,0,0,0,5,0,3934749,2018-07-05 01:00:00,2018-07-05T01:00,2018,7,23.7,0.0,Clear
02/26/2018,8:00,40.875763,-73.90968,BRONX,0.0,0.0,0,0,0,0,0,0,3854950,2018-02-26 08:00:00,2018-02-26T08:00,2018,2,6.3,0.0,Cloudy
05/15/2018,13:00,40.84518,-73.91417,BRONX,1.0,0.0,0,0,0,0,1,0,3919789,2018-05-15 13:00:00,2018-05-15T13:00,2018,5,29.0,0.0,Cloudy
02/02/2018,19:00,40.83438,-73.85388,BRONX,1.0,0.0,1,0,0,0,0,0,3840396,2018-02-02 19:00:00,2018-02-02T19:00,2018,2,-6.9,0.0,Clear
08/10/2018,14:00,40.840004,-73.87081,BRONX,0.0,0.0,0,0,0,0,0,0,3959174,2018-08-10 14:00:00,2018-08-10T14:00,2018,8,30.1,0.0,Cloudy
09/16/2018,13:00,40.825573,-73.918465,BRONX,2.0,0.0,0,0,0,0,2,0,3982080,2018-09-16 13:00:00,2018-09-16T13:00,2018,9,27.7,0.0,Clear
12/15/2018,3:00,40.877476,-73.83661,BRONX,1.0,0.0,0,0,0,0,1,0,4049437,2018-12-15 03:00:00,2018-12-15T03:00,2018,12,6.6,0.7,Drizzle
07/24/2018,14:00,40.87902,-73.82658,BRONX,0.0,0.0,0,0,0,0,0,0,3949013,2018-07-24 14:00:00,2018-07-24T14:00,2018,7,27.6,0.1,Drizzle
12/19/2018,19:00,40.866573,-73.83876,BRONX,0.0,0.0,0,0,0,0,0,0,4048404,2018-12-19 19:00:00,2018-12-19T19:00,2018,12,0.7,0.0,Clear
05/27/2018,0:00,40.85914,-73.81824,BRONX,3.0,0.0,0,0,0,0,3,0,3909356,2018-05-27 00:00:00,2018-05-27T00:00,2018,5,19.4,0.0,Cloudy
02/10/2018,19:00,40.88427,-73.89347,BRONX,2.0,0.0,0,0,0,0,2,0,3844448,2018-02-10 19:00:00,2018-02-10T19:00,2018,2,5.3,0.3,Drizzle
10/05/2018,16:00,40.881264,-73.83875,BRONX,1.0,0.0,0,0,1,0,0,0,4000213,2018-10-05 16:00:00,2018-10-05T16:00,2018,10,18.9,0.0,Clear
08/28/2018,8:00,40.879684,-73.87796,BRONX,0.0,0.0,0,0,0,0,0,0,3970261,2018-08-28 08:00:00,2018-08-28T08:00,2018,8,27.3,0.0,Clear
02/21/2018,16:00,40.853344,-73.881676,BRONX,1.0,0.0,0,0,0,0,1,0,3850736,2018-02-21 16:00:00,2018-02-21T16:00,2018,2,22.7,0.0,Clear
06/27/2018,21:00,40.89596,-73.857376,BRONX,1.0,0.0,0,0,0,0,1,0,3931460,2018-06-27 21:00:00,2018-06-27T21:00,2018,6,19.5,1.2,Drizzle
03/05/2018,8:00,40.811604,-73.92283,BRONX,0.0,0.0,0,0,0,0,0,0,3858570,2018-03-05 08:00:00,2018-03-05T08:00,2018,3,1.4,0.0,Clear
10/20/2018,5:00,40.852703,-73.921844,BRONX,1.0,0.0,0,0,0,0,1,0,4003642,2018-10-20 05:00:00,2018-10-20T05:00,2018,10,11.7,0.2,Drizzle
09/17/2018,7:00,40.834522,-73.87183,BRONX,0.0,0.0,0,0,0,0,0,0,3988795,2018-09-17 07:00:00,2018-09-17T07:00,2018,9,20.3,0.0,Cloudy
06/02/2018,16:00,40.890648,-73.84875,BRONX,1.0,0.0,0,0,1,0,0,0,3913670,2018-06-02 16:00:00,2018-06-02T16:00,2018,6,25.7,0.0,Cloudy
06/28/2018,0:00,40.82406,-73.8998,BRONX,1.0,0.0,1,0,0,0,0,0,3930709,2018-06-28 00:00:00,2018-06-28T00:00,2018,6,20.4,1.1,Drizzle
01/08/2018,17:00,40.82193,-73.88844,BRONX,1.0,0.0,0,0,0,0,1,0,3825288,2018-01-08 17:00:00,2018-01-08T17:00,2018,1,-2.1,0.4,Heavy Snow
08/30/2018,13:00,40.81608,-73.917694,BRONX,1.0,0.0,0,0,0,0,1,0,3970945,2018-08-30 13:00:00,2018-08-30T13:00,2018,8,30.4,0.1,Drizzle
03/28/2018,19:00,40.87864,-73.83729,BRONX,1.0,0.0,1,0,0,0,0,0,3873025,2018-03-28 19:00:00,2018-03-28T19:00,2018,3,7.6,0.0,Cloudy
10/30/2018,15:00,40.84473,-73.82758,BRONX,1.0,0.0,1,0,0,0,0,0,4011582,2018-10-30 15:00:00,2018-10-30T15:00,2018,10,12.2,0.0,Clear
01/06/2018,4:00,40.81632,-73.903015,BRONX,1.0,0.0,1,0,0,0,0,0,3824354,2018-01-06 04:00:00,2018-01-06T04:00,2018,1,-15.9,0.0,Clear
09/04/2018,21:00,40.878643,-73.871605,BRONX,0.0,0.0,0,0,0,0,0,0,3980457,2018-09-04 21:00:00,2018-09-04T21:00,2018,9,27.3,0.0,Clear
04/09/2018,0:00,40.848927,-73.88816,BRONX,1.0,0.0,0,0,0,0,1,0,3878714,2018-04-09 00:00:00,2018-04-09T00:00,2018,4,-0.8,0.0,Clear
08/03/2018,20:00,40.846237,-73.91818,BRONX,0.0,0.0,0,0,0,0,0,0,3954656,2018-08-03 20:00:00,2018-08-03T20:00,2018,8,23.8,0.0,Cloudy
10/05/2018,8:00,40.905468,-73.90073,BRONX,1.0,0.0,0,0,1,0,0,0,3997924,2018-10-05 08:00:00,2018-10-05T08:00,2018,10,14.3,0.0,Cloudy
05/16/2018,16:00,40.86661,-73.90121,BRONX,1.0,0.0,1,0,0,0,0,0,3918403,2018-05-16 16:00:00,2018-05-16T16:00,2018,5,14.6,0.6,Drizzle
09/26/2018,16:00,40.84543,-73.91399,BRONX,1.0,0.0,0,0,0,0,1,0,3988629,2018-09-26 16:00:00,2018-09-26T16:00,2018,9,24.4,0.0,Cloudy
09/13/2018,17:00,40.895794,-73.85945,BRONX,1.0,0.0,1,0,0,0,0,0,3991292,2018-09-13 17:00:00,2018-09-13T17:00,2018,9,22.4,0.0,Cloudy
11/14/2018,17:00,40.87314,-73.90572,BRONX,1.0,0.0,1,0,0,0,0,0,4020977,2018-11-14 17:00:00,2018-11-14T17:00,2018,11,1.3,0.0,Cloudy
02/26/2018,18:00,40.880547,-73.86111,BRONX,1.0,0.0,1,0,0,0,0,0,3863898,2018-02-26 18:00:00,2018-02-26T18:00,2018,2,6.6,0.0,Clear
09/01/2018,0:00,40.86832,-73.83317,BRONX,1.0,0.0,0,0,0,0,1,0,3972307,2018-09-01 00:00:00,2018-09-01T00:00,2018,9,19.7,0.0,Clear
04/14/2018,19:00,40.87229,-73.90096,BRONX,1.0,0.0,0,0,1,0,0,0,3881622,2018-04-14 19:00:00,2018-04-14T19:00,2018,4,8.3,0.0,Cloudy
09/30/2018,20:00,40.850456,-73.899315,BRONX,1.0,0.0,0,0,0,0,1,0,3990915,2018-09-30 20:00:00,2018-09-30T20:00,2018,9,16.9,0.0,Cloudy
05/12/2018,15:00,40.826424,-73.85868,BRONX,1.0,0.0,0,0,0,0,1,0,3904405,2018-05-12 15:00:00,2018-05-12T15:00,2018,5,15.7,0.0,Cloudy
04/25/2018,19:00,40.836346,-73.90926,BRONX,2.0,0.0,0,0,0,0,2,0,3893477,2018-04-25 19:00:00,2018-04-25T19:00,2018,4,12.4,0.0,Cloudy
09/29/2018,17:00,40.820305,-73.89083,BRONX,2.0,0.0,0,0,0,0,2,0,3990123,2018-09-29 17:00:00,2018-09-29T17:00,2018,9,20.7,0.0,Clear
12/09/2018,20:00,40.86539,-73.86913,BRONX,1.0,0.0,1,0,0,0,0,0,4042286,2018-12-09 20:00:00,2018-12-09T20:00,2018,12,-1.1,0.0,Cloudy
11/22/2018,7:00,40.806164,-73.909134,BRONX,0.0,0.0,0,0,0,0,0,0,4030877,2018-11-22 07:00:00,2018-11-22T07:00,2018,11,-6.5,0.0,Clear
07/04/2018,5:00,40.859875,-73.89323,BRONX,0.0,0.0,0,0,0,0,0,0,3935592,2018-07-04 05:00:00,2018-07-04T05:00,2018,7,23.5,1.4,Light Rain
10/24/2018,15:00,40.891136,-73.85527,BRONX,1.0,0.0,1,0,0,0,0,0,4009718,2018-10-24 15:00:00,2018-10-24T15:00,2018,10,12.0,0.0,Cloudy
12/28/2018,12:00,40.810192,-73.88632,BRONX,3.0,0.0,0,0,0,0,3,0,4054994,2018-12-28 12:00:00,2018-12-28T12:00,2018,12,11.5,2.8,Heavy Rain
03/25/2018,17:00,40.875298,-73.86706,BRONX,1.0,0.0,0,0,0,0,1,0,3870279,2018-03-25 17:00:00,2018-03-25T17:00,2018,3,4.5,0.0,Clear
02/25/2018,22:00,40.884014,-73.8791,BRONX,1.0,0.0,1,0,0,0,0,0,3854080,2018-02-25 22:00:00,2018-02-25T22:00,2018,2,4.9,0.0,Cloudy
08/18/2018,16:00,40.813232,-73.90908,BRONX,1.0,0.0,1,0,0,0,0,0,3963800,2018-08-18 16:00:00,2018-08-18T16:00,2018,8,27.9,0.2,Drizzle
10/29/2018,19:00,40.87028,-73.878395,BRONX,1.0,0.0,0,0,0,0,1,0,4010882,2018-10-29 19:00:00,2018-10-29T19:00,2018,10,9.0,0.0,Clear
05/23/2018,10:00,40.803715,-73.91588,BRONX,2.0,0.0,0,0,0,0,2,0,3906327,2018-05-23 10:00:00,2018-05-23T10:00,2018,5,21.8,0.6,Drizzle
10/01/2018,14:00,40.86531,-73.90333,BRONX,1.0,0.0,0,0,0,0,1,0,3992112,2018-10-01 14:00:00,2018-10-01T14:00,2018,10,23.8,0.0,Cloudy
02/05/2018,16:00,40.840164,-73.84262,BRONX,0.0,0.0,0,0,0,0,0,0,3841679,2018-02-05 16:00:00,2018-02-05T16:00,2018,2,-1.5,0.0,Clear
06/28/2018,16:00,40.80944,-73.92937,BRONX,0.0,0.0,0,0,0,0,0,0,3931357,2018-06-28 16:00:00,2018-06-28T16:00,2018,6,24.8,0.1,Drizzle
07/09/2018,14:00,40.90799,-73.90381,BRONX,0.0,0.0,0,0,0,0,0,0,3937887,2018-07-09 14:00:00,2018-07-09T14:00,2018,7,29.3,0.0,Clear
03/28/2018,11:00,40.810192,-73.88632,BRONX,1.0,0.0,0,0,0,0,1,0,3871580,2018-03-28 11:00:00,2018-03-28T11:00,2018,3,6.2,0.0,Cloudy
05/02/2018,14:00,40.838127,-73.91931,BRONX,1.0,0.0,1,0,0,0,0,0,3893627,2018-05-02 14:00:00,2018-05-02T14:00,2018,5,28.5,0.0,Cloudy
08/09/2018,13:00,40.813187,-73.92079,BRONX,1.0,0.0,1,0,0,0,0,0,3958306,2018-08-09 13:00:00,2018-08-09T13:00,2018,8,29.3,0.1,Drizzle
05/23/2018,11:00,40.852287,-73.890495,BRONX,1.0,0.0,0,0,0,0,1,0,3906707,2018-05-23 11:00:00,2018-05-23T11:00,2018,5,21.5,0.0,Clear
04/13/2018,15:00,40.878372,-73.86813,BRONX,1.0,0.0,0,0,0,0,1,0,3883891,2018-04-13 15:00:00,2018-04-13T15:00,2018,4,24.2,0.0,Clear
07/18/2018,17:00,40.80853,-73.90497,BRONX,2.0,0.0,0,0,0,0,2,0,3943894,2018-07-18 17:00:00,2018-07-18T17:00,2018,7,28.7,0.0,Clear
05/22/2018,1:00,40.818222,-73.91494,BRONX,0.0,0.0,0,0,0,0,0,0,3905467,2018-05-22 01:00:00,2018-05-22T01:00,2018,5,13.4,0.0,Cloudy
07/24/2018,17:00,40.87831,-73.870155,BRONX,0.0,0.0,0,0,0,0,0,0,3949170,2018-07-24 17:00:00,2018-07-24T17:00,2018,7,26.0,0.0,Clear
03/02/2018,8:00,40.823082,-73.86722,BRONX,1.0,0.0,0,0,0,0,1,0,3855079,2018-03-02 08:00:00,2018-03-02T08:00,2018,3,2.0,2.8,Heavy Snow
03/22/2018,18:00,40.878178,-73.83702,BRONX,1.0,0.0,0,0,0,0,1,0,3868131,2018-03-22 18:00:00,2018-03-22T18:00,2018,3,4.6,0.0,Cloudy
08/08/2018,7:00,40.843212,-73.83894,BRONX,1.0,0.0,0,0,0,0,1,0,3957215,2018-08-08 07:00:00,2018-08-08T07:00,2018,8,25.2,0.0,Cloudy
07/04/2018,20:00,40.82453,-73.8996,BRONX,1.0,0.0,0,0,0,0,1,0,3936107,2018-07-04 20:00:00,2018-07-04T20:00,2018,7,25.0,0.0,Cloudy
08/02/2018,12:00,40.82233,-73.91249,BRONX,1.0,0.0,1,0,0,0,0,0,4026207,2018-08-02 12:00:00,2018-08-02T12:00,2018,8,28.3,0.3,Drizzle
09/02/2018,18:00,40.85651,-73.897316,BRONX,0.0,0.0,0,0,0,0,0,0,3972775,2018-09-02 18:00:00,2018-09-02T18:00,2018,9,23.5,0.0,Clear
09/07/2018,7:00,40.829685,-73.8253,BRONX,1.0,0.0,0,0,0,0,1,0,3978097,2018-09-07 07:00:00,2018-09-07T07:00,2018,9,23.5,0.0,Cloudy
05/31/2018,21:00,40.86826,-73.833374,BRONX,4.0,0.0,0,0,0,0,4,0,3913586,2018-05-31 21:00:00,2018-05-31T21:00,2018,5,18.5,0.0,Cloudy
11/13/2018,13:00,40.87349,-73.83664,BRONX,0.0,0.0,0,0,0,0,0,0,4030924,2018-11-13 13:00:00,2018-11-13T13:00,2018,11,7.9,0.0,Cloudy
05/09/2018,10:00,40.90389,-73.85139,BRONX,1.0,0.0,0,0,1,0,0,0,3901130,2018-05-09 10:00:00,2018-05-09T10:00,2018,5,20.1,0.0,Clear
12/19/2018,9:00,40.84197,-73.86744,BRONX,0.0,0.0,0,0,0,0,0,0,4048783,2018-12-19 09:00:00,2018-12-19T09:00,2018,12,-1.9,0.0,Clear
09/27/2018,0:00,40.85219,-73.88201,BRONX,2.0,0.0,0,0,0,0,2,0,3989335,2018-09-27 00:00:00,2018-09-27T00:00,2018,9,19.6,0.0,Cloudy
06/09/2018,11:00,40.849003,-73.855896,BRONX,0.0,0.0,0,0,0,0,0,0,3920116,2018-06-09 11:00:00,2018-06-09T11:00,2018,6,24.5,0.0,Cloudy
02/17/2018,3:00,40.855362,-73.89878,BRONX,0.0,0.0,0,0,0,0,0,0,3847783,2018-02-17 03:00:00,2018-02-17T03:00,2018,2,-2.4,0.0,Clear
12/31/2018,23:00,40.84497,-73.90247,BRONX,1.0,0.0,0,0,0,0,1,0,4060480,2018-12-31 23:00:00,2018-12-31T23:00,2018,12,7.9,4.1,Heavy Rain
02/16/2018,19:00,40.896687,-73.84511,BRONX,7.0,0.0,0,0,0,0,7,0,3851958,2018-02-16 19:00:00,2018-02-16T19:00,2018,2,5.2,0.0,Clear
05/10/2018,8:00,40.849308,-73.88481,BRONX,0.0,0.0,0,0,0,0,0,0,3901664,2018-05-10 08:00:00,2018-05-10T08:00,2018,5,13.1,0.0,Cloudy
11/17/2018,15:00,40.81186,-73.8883,BRONX,1.0,0.0,0,0,0,0,1,0,4027998,2018-11-17 15:00:00,2018-11-17T15:00,2018,11,8.6,0.0,Cloudy
05/24/2018,0:00,40.895596,-73.85617,BRONX,0.0,0.0,0,0,0,0,0,0,3908911,2018-05-24 00:00:00,2018-05-24T00:00,2018,5,17.1,0.0,Clear
06/26/2018,0:00,40.844788,-73.89168,BRONX,1.0,0.0,0,0,1,0,0,0,3930216,2018-06-26 00:00:00,2018-06-26T00:00,2018,6,15.5,0.0,Clear
02/20/2018,0:00,40.838837,-73.84424,BRONX,0.0,0.0,0,0,0,0,0,0,3850774,2018-02-20 00:00:00,2018-02-20T00:00,2018,2,8.8,0.0,Cloudy
01/19/2018,10:00,40.862083,-73.90162,BRONX,1.0,0.0,0,0,0,0,1,0,3832122,2018-01-19 10:00:00,2018-01-19T10:00,2018,1,-0.5,0.0,Cloudy
03/27/2018,9:00,40.88441,-73.89226,BRONX,0.0,0.0,0,0,0,0,0,0,3880135,2018-03-27 09:00:00,2018-03-27T09:00,2018,3,3.0,0.0,Cloudy
06/13/2018,20:00,40.85226,-73.852905,BRONX,1.0,0.0,0,0,0,0,1,0,3920807,2018-06-13 20:00:00,2018-06-13T20:00,2018,6,22.5,0.0,Cloudy
09/04/2018,17:00,40.854477,-73.90125,BRONX,1.0,0.0,1,0,0,0,0,0,3974483,2018-09-04 17:00:00,2018-09-04T17:00,2018,9,30.1,0.0,Cloudy
11/30/2018,8:00,40.862614,-73.890114,BRONX,4.0,0.0,0,0,0,0,4,0,4037923,2018-11-30 08:00:00,2018-11-30T08:00,2018,11,2.3,0.0,Cloudy
02/24/2018,21:00,40.87123,-73.85604,BRONX,1.0,0.0,0,0,0,0,1,0,3852420,2018-02-24 21:00:00,2018-02-24T21:00,2018,2,6.8,0.1,Drizzle
01/15/2018,0:00,40.86226,-73.89589,BRONX,2.0,0.0,0,0,0,0,2,0,3829999,2018-01-15 00:00:00,2018-01-15T00:00,2018,1,-9.0,0.0,Cloudy
04/30/2018,22:00,40.895374,-73.86356,BRONX,1.0,0.0,0,0,0,0,1,0,3895111,2018-04-30 22:00:00,2018-04-30T22:00,2018,4,7.3,0.0,Clear
09/30/2018,5:00,40.861862,-73.91282,BRONX,1.0,0.0,0,0,0,0,1,0,3993918,2018-09-30 05:00:00,2018-09-30T05:00,2018,9,12.2,0.0,Clear
07/02/2018,16:00,40.817875,-73.89333,BRONX,2.0,0.0,0,0,0,0,2,0,3934301,2018-07-02 16:00:00,2018-07-02T16:00,2018,7,30.5,0.0,Clear
05/03/2018,19:00,40.875328,-73.869225,BRONX,1.0,0.0,0,0,1,0,0,0,3895103,2018-05-03 19:00:00,2018-05-03T19:00,2018,5,22.6,0.0,Cloudy
01/17/2018,19:00,40.84921,-73.83056,BRONX,0.0,0.0,0,0,0,0,0,0,3831223,2018-01-17 19:00:00,2018-01-17T19:00,2018,1,-3.2,0.0,Cloudy
02/09/2018,7:00,40.855244,-73.89314,BRONX,0.0,0.0,0,0,0,0,0,0,3843385,2018-02-09 07:00:00,2018-02-09T07:00,2018,2,-6.3,0.0,Clear
10/16/2018,11:00,40.841496,-73.92486,BRONX,0.0,0.0,0,0,0,0,0,0,4004349,2018-10-16 11:00:00,2018-10-16T11:00,2018,10,11.3,0.0,Cloudy
02/08/2018,13:00,40.869385,-73.85762,BRONX,0.0,0.0,0,0,0,0,0,0,3843871,2018-02-08 13:00:00,2018-02-08T13:00,2018,2,0.0,0.0,Clear
04/16/2018,9:00,40.851852,-73.83376,BRONX,1.0,0.0,1,0,0,0,0,0,3882286,2018-04-16 09:00:00,2018-04-16T09:00,2018,4,6.2,7.4,Heavy Rain
08/10/2018,0:00,40.87367,-73.879234,BRONX,1.0,0.0,1,0,0,0,0,0,3959076,2018-08-10 00:00:00,2018-08-10T00:00,2018,8,21.7,0.0,Clear
05/21/2018,18:00,40.835438,-73.86412,BRONX,1.0,0.0,1,0,0,0,0,0,3906041,2018-05-21 18:00:00,2018-05-21T18:00,2018,5,19.1,0.0,Cloudy
07/04/2018,17:00,40.890163,-73.83214,BRONX,0.0,0.0,0,0,0,0,0,0,3937531,2018-07-04 17:00:00,2018-07-04T17:00,2018,7,27.0,0.0,Cloudy
06/11/2018,0:00,40.829754,-73.87374,BRONX,0.0,0.0,0,0,0,0,0,0,3919854,2018-06-11 00:00:00,2018-06-11T00:00,2018,6,15.3,0.3,Drizzle
01/19/2018,0:00,40.82858,-73.87918,BRONX,1.0,0.0,0,0,0,0,1,0,3831433,2018-01-19 00:00:00,2018-01-19T00:00,2018,1,-5.4,0.0,Clear
01/09/2018,18:00,40.880623,-73.84047,BRONX,1.0,0.0,1,0,0,0,0,0,3825948,2018-01-09 18:00:00,2018-01-09T18:00,2018,1,0.2,0.0,Clear
01/18/2018,9:00,40.851665,-73.89175,BRONX,1.0,0.0,0,0,0,0,1,0,3831165,2018-01-18 09:00:00,2018-01-18T09:00,2018,1,-5.5,0.0,Clear
03/07/2018,0:00,40.857166,-73.90978,BRONX,3.0,0.0,0,0,0,0,3,0,4025660,2018-03-07 00:00:00,2018-03-07T00:00,2018,3,1.8,0.4,Light Snow
08/26/2018,1:00,40.859303,-73.89884,BRONX,1.0,0.0,1,0,0,0,0,0,3967708,2018-08-26 01:00:00,2018-08-26T01:00,2018,8,18.1,0.0,Clear
06/01/2018,20:00,40.86391,-73.833885,BRONX,1.0,0.0,0,0,0,0,1,0,3913508,2018-06-01 20:00:00,2018-06-01T20:00,2018,6,21.0,0.1,Drizzle
11/09/2018,15:00,40.86052,-73.89257,BRONX,2.0,0.0,0,0,0,0,2,0,4019266,2018-11-09 15:00:00,2018-11-09T15:00,2018,11,9.8,0.1,Drizzle
05/16/2018,0:00,40.86661,-73.90121,BRONX,1.0,0.0,1,0,0,0,0,0,4025993,2018-05-16 00:00:00,2018-05-16T00:00,2018,5,15.4,0.0,Cloudy
02/06/2018,14:00,40.834908,-73.90814,BRONX,4.0,0.0,0,0,0,0,4,0,3841283,2018-02-06 14:00:00,2018-02-06T14:00,2018,2,1.9,0.0,Cloudy
12/02/2018,18:00,40.820305,-73.89083,BRONX,1.0,0.0,0,0,0,0,1,0,4036827,2018-12-02 18:00:00,2018-12-02T18:00,2018,12,13.7,0.2,Drizzle
01/09/2018,9:00,40.833057,-73.84815,BRONX,1.0,0.0,0,0,0,0,1,0,3825878,2018-01-09 09:00:00,2018-01-09T09:00,2018,1,-0.3,0.0,Clear
01/23/2018,18:00,40.88845,-73.841965,BRONX,1.0,0.0,1,0,0,0,0,0,3834827,2018-01-23 18:00:00,2018-01-23T18:00,2018,1,9.4,0.0,Cloudy
08/13/2018,11:00,40.833473,-73.84509,BRONX,0.0,0.0,0,0,0,0,0,0,3960716,2018-08-13 11:00:00,2018-08-13T11:00,2018,8,22.2,3.7,Heavy Rain
08/11/2018,15:00,40.87862,-73.857414,BRONX,0.0,0.0,0,0,0,0,0,0,3960134,2018-08-11 15:00:00,2018-08-11T15:00,2018,8,24.1,0.8,Drizzle
02/07/2018,14:00,40.858433,-73.885124,BRONX,1.0,0.0,1,0,0,0,0,0,3845735,2018-02-07 14:00:00,2018-02-07T14:00,2018,2,2.6,1.9,Light Rain
12/17/2018,8:00,40.866203,-73.86632,BRONX,0.0,0.0,0,0,0,0,0,0,4047214,2018-12-17 08:00:00,2018-12-17T08:00,2018,12,1.8,0.0,Cloudy
10/04/2018,15:00,40.81601,-73.89652,BRONX,0.0,0.0,0,0,0,0,0,0,3994603,2018-10-04 15:00:00,2018-10-04T15:00,2018,10,22.8,0.0,Cloudy
06/07/2018,0:00,40.830368,-73.89718,BRONX,1.0,0.0,0,0,0,0,1,0,3917130,2018-06-07 00:00:00,2018-06-07T00:00,2018,6,14.4,0.0,Cloudy
06/07/2018,9:00,40.848,-73.89243,BRONX,1.0,0.0,1,0,0,0,0,0,3919104,2018-06-07 09:00:00,2018-06-07T09:00,2018,6,17.7,0.0,Cloudy
03/07/2018,0:00,40.851498,-73.88383,BRONX,1.0,0.0,0,0,1,0,0,0,3858881,2018-03-07 00:00:00,2018-03-07T00:00,2018,3,2.0,0.4,Light Snow
08/02/2018,14:00,40.835716,-73.8775,BRONX,1.0,0.0,0,0,1,0,0,0,3954007,2018-08-02 14:00:00,2018-08-02T14:00,2018,8,27.4,0.3,Drizzle
05/28/2018,7:00,40.878643,-73.871605,BRONX,1.0,0.0,0,0,0,0,1,0,3912667,2018-05-28 07:00:00,2018-05-28T07:00,2018,5,13.6,0.0,Cloudy
05/15/2018,17:00,40.816746,-73.92904,BRONX,0.0,0.0,0,0,0,0,0,0,3901559,2018-05-15 17:00:00,2018-05-15T17:00,2018,5,27.4,0.0,Cloudy
03/29/2018,12:00,40.848404,-73.86079,BRONX,0.0,0.0,0,0,0,0,0,0,3871867,2018-03-29 12:00:00,2018-03-29T12:00,2018,3,11.1,0.0,Cloudy
07/25/2018,12:00,40.839962,-73.84629,BRONX,1.0,0.0,1,0,0,0,0,0,3949122,2018-07-25 12:00:00,2018-07-25T12:00,2018,7,24.6,0.2,Drizzle
09/20/2018,15:00,40.85586,-73.86476,BRONX,0.0,0.0,0,0,0,0,0,0,3985003,2018-09-20 15:00:00,2018-09-20T15:00,2018,9,21.0,0.0,Cloudy
08/31/2018,21:00,40.895718,-73.849525,BRONX,1.0,0.0,0,0,0,0,1,0,3972312,2018-08-31 21:00:00,2018-08-31T21:00,2018,8,20.3,0.0,Cloudy
08/30/2018,21:00,40.849106,-73.89495,BRONX,1.0,0.0,0,0,0,0,1,0,3971240,2018-08-30 21:00:00,2018-08-30T21:00,2018,8,24.9,0.0,Cloudy
06/24/2018,19:00,40.84065,-73.888245,BRONX,1.0,0.0,0,0,1,0,0,0,3930227,2018-06-24 19:00:00,2018-06-24T19:00,2018,6,24.6,1.5,Light Rain
03/20/2018,1:00,40.812664,-73.906334,BRONX,0.0,0.0,0,0,0,0,0,0,3867612,2018-03-20 01:00:00,2018-03-20T01:00,2018,3,-3.9,0.0,Cloudy
01/16/2018,9:00,40.830914,-73.92047,BRONX,1.0,0.0,1,0,0,0,0,0,3829699,2018-01-16 09:00:00,2018-01-16T09:00,2018,1,-2.3,0.0,Cloudy
03/06/2018,17:00,40.839268,-73.903824,BRONX,4.0,0.0,0,0,0,0,4,0,3857742,2018-03-06 17:00:00,2018-03-06T17:00,2018,3,4.4,0.0,Cloudy
08/09/2018,22:00,40.804256,-73.9193,BRONX,0.0,0.0,0,0,0,0,0,0,3960459,2018-08-09 22:00:00,2018-08-09T22:00,2018,8,23.2,0.0,Clear
08/26/2018,1:00,40.87004,-73.89264,BRONX,2.0,0.0,0,0,0,0,2,0,3969476,2018-08-26 01:00:00,2018-08-26T01:00,2018,8,18.0,0.0,Clear
08/23/2018,12:00,40.8666,-73.895454,BRONX,1.0,0.0,0,0,1,0,0,0,3967187,2018-08-23 12:00:00,2018-08-23T12:00,2018,8,23.4,0.0,Clear
07/17/2018,0:00,40.852516,-73.90001,BRONX,2.0,0.0,0,0,0,0,2,0,3943527,2018-07-17 00:00:00,2018-07-17T00:00,2018,7,24.5,0.0,Clear
02/08/2018,12:00,40.84073,-73.84332,BRONX,1.0,0.0,0,0,0,0,1,0,3844544,2018-02-08 12:00:00,2018-02-08T12:00,2018,2,-0.1,0.0,Cloudy
09/03/2018,10:00,40.858368,-73.903915,BRONX,0.0,0.0,0,0,0,0,0,0,3980868,2018-09-03 10:00:00,2018-09-03T10:00,2018,9,28.3,0.0,Cloudy
06/16/2018,17:00,40.8869,-73.83336,BRONX,0.0,0.0,0,0,0,0,0,0,3923283,2018-06-16 17:00:00,2018-06-16T17:00,2018,6,26.5,0.0,Cloudy
04/14/2018,7:00,40.82211,-73.908104,BRONX,0.0,0.0,0,0,0,0,0,0,3880810,2018-04-14 07:00:00,2018-04-14T07:00,2018,4,16.2,0.0,Cloudy
06/22/2018,11:00,40.804935,-73.88413,BRONX,0.0,0.0,0,0,0,0,0,0,3926888,2018-06-22 11:00:00,2018-06-22T11:00,2018,6,24.0,0.0,Cloudy
05/21/2018,18:00,40.88467,-73.83163,BRONX,1.0,0.0,0,0,0,0,1,0,3905633,2018-05-21 18:00:00,2018-05-21T18:00,2018,5,19.6,0.0,Cloudy
02/23/2018,13:00,40.832752,-73.844925,BRONX,2.0,0.0,0,0,0,0,2,0,3852515,2018-02-23 13:00:00,2018-02-23T13:00,2018,2,3.6,0.1,Drizzle
01/06/2018,13:00,40.86759,-73.85095,BRONX,1.0,0.0,0,0,0,0,1,0,3823478,2018-01-06 13:00:00,2018-01-06T13:00,2018,1,-12.9,0.0,Clear
10/13/2018,15:00,40.80944,-73.92937,BRONX,3.0,0.0,0,0,0,0,3,0,4000030,2018-10-13 15:00:00,2018-10-13T15:00,2018,10,13.4,0.0,Cloudy
07/21/2018,4:00,40.842247,-73.91403,BRONX,0.0,0.0,0,0,0,0,0,0,3954061,2018-07-21 04:00:00,2018-07-21T04:00,2018,7,17.7,0.0,Clear
02/17/2018,18:00,40.86542,-73.854774,BRONX,0.0,0.0,0,0,0,0,0,0,3848162,2018-02-17 18:00:00,2018-02-17T18:00,2018,2,2.2,0.4,Heavy Snow
03/07/2018,16:00,40.848537,-73.90678,BRONX,1.0,0.0,1,0,0,0,0,0,3858415,2018-03-07 16:00:00,2018-03-07T16:00,2018,3,1.3,3.1,Heavy Snow
03/08/2018,13:00,40.852837,-73.88419,BRONX,1.0,0.0,0,0,0,0,1,0,3859384,2018-03-08 13:00:00,2018-03-08T13:00,2018,3,4.2,0.0,Cloudy
12/08/2018,19:00,40.84441,-73.8689,BRONX,1.0,0.0,0,0,0,0,1,0,4042284,2018-12-08 19:00:00,2018-12-08T19:00,2018,12,-0.3,0.0,Cloudy
03/08/2018,12:00,40.87979,-73.835434,BRONX,0.0,0.0,0,0,0,0,0,0,3859570,2018-03-08 12:00:00,2018-03-08T12:00,2018,3,4.4,0.0,Cloudy
05/21/2018,2:00,40.825573,-73.918465,BRONX,1.0,0.0,0,0,1,0,0,0,3905836,2018-05-21 02:00:00,2018-05-21T02:00,2018,5,14.0,0.0,Cloudy
12/30/2018,18:00,40.83367,-73.85675,BRONX,1.0,0.0,0,0,0,0,1,0,4054888,2018-12-30 18:00:00,2018-12-30T18:00,2018,12,2.2,0.0,Cloudy
05/09/2018,0:00,40.82825,-73.8887,BRONX,0.0,0.0,0,0,0,0,0,0,3897102,2018-05-09 00:00:00,2018-05-09T00:00,2018,5,11.2,0.0,Clear
08/30/2018,17:00,40.87664,-73.90139,BRONX,2.0,0.0,2,0,0,0,0,0,3971425,2018-08-30 17:00:00,2018-08-30T17:00,2018,8,29.0,0.0,Cloudy
02/08/2018,13:00,40.880936,-73.8623,BRONX,2.0,0.0,0,0,0,0,2,0,3843635,2018-02-08 13:00:00,2018-02-08T13:00,2018,2,0.0,0.0,Clear
01/05/2018,11:00,40.813652,-73.906975,BRONX,1.0,0.0,0,0,0,0,1,0,3822857,2018-01-05 11:00:00,2018-01-05T11:00,2018,1,-12.9,0.0,Clear
05/02/2018,15:00,40.812126,-73.90419,BRONX,1.0,0.0,0,0,0,0,1,0,3893216,2018-05-02 15:00:00,2018-05-02T15:00,2018,5,28.4,0.0,Cloudy
04/03/2018,15:00,40.834644,-73.854836,BRONX,1.0,0.0,0,0,0,0,1,0,3877013,2018-04-03 15:00:00,2018-04-03T15:00,2018,4,5.1,0.9,Drizzle
04/21/2018,15:00,40.82615,-73.87766,BRONX,0.0,0.0,0,0,0,0,0,0,3885218,2018-04-21 15:00:00,2018-04-21T15:00,2018,4,15.0,0.0,Clear
01/04/2018,0:00,40.86544,-73.86702,BRONX,1.0,0.0,0,0,0,0,1,0,3822738,2018-01-04 00:00:00,2018-01-04T00:00,2018,1,-4.4,0.0,Cloudy
11/02/2018,8:00,40.82845,-73.827805,BRONX,1.0,0.0,0,0,0,0,1,0,4013135,2018-11-02 08:00:00,2018-11-02T08:00,2018,11,19.3,0.4,Drizzle
06/22/2018,6:00,40.822456,-73.92692,BRONX,0.0,0.0,0,0,0,0,0,0,3931328,2018-06-22 06:00:00,2018-06-22T06:00,2018,6,18.9,0.0,Cloudy
12/04/2018,15:00,40.814655,-73.86426,BRONX,2.0,0.0,0,0,0,0,2,0,4038139,2018-12-04 15:00:00,2018-12-04T15:00,2018,12,3.3,0.0,Clear
06/09/2018,12:00,40.825455,-73.91317,BRONX,3.0,0.0,0,0,0,0,3,0,3917764,2018-06-09 12:00:00,2018-06-09T12:00,2018,6,25.4,0.0,Cloudy
01/08/2018,22:00,40.814655,-73.86426,BRONX,1.0,0.0,1,0,0,0,0,0,3825177,2018-01-08 22:00:00,2018-01-08T22:00,2018,1,-2.0,0.0,Cloudy
07/06/2018,16:00,40.880833,-73.83232,BRONX,2.0,0.0,0,0,0,0,2,0,3937142,2018-07-06 16:00:00,2018-07-06T16:00,2018,7,26.0,0.0,Cloudy
07/29/2018,13:00,40.875492,-73.86052,BRONX,2.0,0.0,0,0,0,0,2,0,3950286,2018-07-29 13:00:00,2018-07-29T13:00,2018,7,27.2,0.0,Cloudy
08/07/2018,13:00,40.88845,-73.841965,BRONX,1.0,0.0,0,0,0,0,1,0,3957204,2018-08-07 13:00:00,2018-08-07T13:00,2018,8,29.5,0.3,Drizzle
02/22/2018,15:00,40.845413,-73.865204,BRONX,1.0,0.0,0,0,0,0,1,0,3851472,2018-02-22 15:00:00,2018-02-22T15:00,2018,2,4.7,0.8,Drizzle
01/29/2018,7:00,40.862812,-73.907555,BRONX,0.0,0.0,0,0,0,0,0,0,3837162,2018-01-29 07:00:00,2018-01-29T07:00,2018,1,2.3,0.0,Cloudy
06/18/2018,0:00,40.815464,-73.86348,BRONX,1.0,0.0,0,0,1,0,0,0,3924640,2018-06-18 00:00:00,2018-06-18T00:00,2018,6,21.1,0.0,Cloudy
06/25/2018,11:00,40.85592,-73.9172,BRONX,0.0,0.0,0,0,0,0,0,0,3929690,2018-06-25 11:00:00,2018-06-25T11:00,2018,6,24.4,0.0,Clear
03/06/2018,16:00,40.824734,-73.90515,BRONX,0.0,0.0,0,0,0,0,0,0,3857745,2018-03-06 16:00:00,2018-03-06T16:00,2018,3,5.5,0.0,Cloudy
05/09/2018,18:00,40.82674,-73.8879,BRONX,1.0,0.0,0,0,1,0,0,0,3897252,2018-05-09 18:00:00,2018-05-09T18:00,2018,5,16.6,0.0,Cloudy
12/08/2018,20:00,40.83366,-73.856705,BRONX,1.0,0.0,0,0,0,0,1,0,4040935,2018-12-08 20:00:00,2018-12-08T20:00,2018,12,-0.0,0.0,Cloudy
04/18/2018,18:00,40.878742,-73.87255,BRONX,1.0,0.0,0,0,0,0,1,0,3883854,2018-04-18 18:00:00,2018-04-18T18:00,2018,4,10.1,0.0,Clear
08/16/2018,18:00,40.8352,-73.86599,BRONX,0.0,0.0,0,0,0,0,0,0,3962480,2018-08-16 18:00:00,2018-08-16T18:00,2018,8,28.8,0.0,Clear
06/12/2018,20:00,40.83142,-73.91831,BRONX,1.0,0.0,1,0,0,0,0,0,3921246,2018-06-12 20:00:00,2018-06-12T20:00,2018,6,16.1,0.0,Cloudy
02/03/2018,17:00,40.838383,-73.91902,BRONX,3.0,0.0,0,0,0,0,3,0,3840392,2018-02-03 17:00:00,2018-02-03T17:00,2018,2,-1.6,0.0,Clear
04/29/2018,15:00,40.867584,-73.83117,BRONX,0.0,0.0,0,0,0,0,0,0,3890598,2018-04-29 15:00:00,2018-04-29T15:00,2018,4,13.3,0.0,Cloudy
11/06/2018,21:00,40.83442,-73.86297,BRONX,1.0,0.0,1,0,0,0,0,0,4017307,2018-11-06 21:00:00,2018-11-06T21:00,2018,11,13.2,0.0,Clear
02/08/2018,4:00,40.88757,-73.90627,BRONX,0.0,0.0,0,0,0,0,0,0,3843437,2018-02-08 04:00:00,2018-02-08T04:00,2018,2,-4.2,0.0,Cloudy
10/29/2018,13:00,40.850304,-73.85137,BRONX,2.0,0.0,0,0,0,0,2,0,4010790,2018-10-29 13:00:00,2018-10-29T13:00,2018,10,13.5,0.0,Cloudy
07/07/2018,4:00,40.809574,-73.91806,BRONX,0.0,0.0,0,0,0,0,0,0,3936953,2018-07-07 04:00:00,2018-07-07T04:00,2018,7,16.9,0.0,Clear
10/24/2018,10:00,40.803593,-73.919785,BRONX,0.0,0.0,0,0,0,0,0,0,4006781,2018-10-24 10:00:00,2018-10-24T10:00,2018,10,11.1,0.0,Clear
09/14/2018,12:00,40.828854,-73.89932,BRONX,1.0,0.0,1,0,0,0,0,0,3980834,2018-09-14 12:00:00,2018-09-14T12:00,2018,9,23.6,0.0,Cloudy
11/19/2018,0:00,40.831013,-73.86186,BRONX,2.0,0.0,0,0,0,0,2,0,4029103,2018-11-19 00:00:00,2018-11-19T00:00,2018,11,3.9,0.0,Cloudy
08/26/2018,23:00,40.85477,-73.90299,BRONX,1.0,0.0,0,0,0,0,1,0,3968637,2018-08-26 23:00:00,2018-08-26T23:00,2018,8,22.6,0.0,Clear
12/23/2018,0:00,40.85429,-73.90027,BRONX,1.0,0.0,1,0,0,0,0,0,4051403,2018-12-23 00:00:00,2018-12-23T00:00,2018,12,3.3,0.0,Cloudy
02/16/2018,18:00,40.868176,-73.90058,BRONX,1.0,0.0,0,0,0,0,1,0,3848500,2018-02-16 18:00:00,2018-02-16T18:00,2018,2,5.2,0.0,Cloudy
06/26/2018,23:00,40.850338,-73.8931,BRONX,0.0,0.0,0,0,0,0,0,0,3930229,2018-06-26 23:00:00,2018-06-26T23:00,2018,6,18.5,0.0,Cloudy
01/16/2018,8:00,40.842175,-73.83004,BRONX,0.0,0.0,0,0,0,0,0,0,3829844,2018-01-16 08:00:00,2018-01-16T08:00,2018,1,-2.9,0.0,Cloudy
07/08/2018,20:00,40.831722,-73.915016,BRONX,1.0,0.0,1,0,0,0,0,0,3936657,2018-07-08 20:00:00,2018-07-08T20:00,2018,7,21.0,0.0,Clear
02/20/2018,7:00,40.839996,-73.86832,BRONX,1.0,0.0,1,0,0,0,0,0,3850622,2018-02-20 07:00:00,2018-02-20T07:00,2018,2,8.9,0.0,Cloudy
06/03/2018,16:00,40.85226,-73.852905,BRONX,1.0,0.0,1,0,0,0,0,0,3913497,2018-06-03 16:00:00,2018-06-03T16:00,2018,6,17.5,0.0,Cloudy
10/25/2018,9:00,40.821415,-73.88933,BRONX,0.0,0.0,0,0,0,0,0,0,4008388,2018-10-25 09:00:00,2018-10-25T09:00,2018,10,7.3,0.0,Clear
03/31/2018,11:00,40.88263,-73.839516,BRONX,1.0,0.0,0,0,0,0,1,0,3872882,2018-03-31 11:00:00,2018-03-31T11:00,2018,3,9.9,0.0,Clear
02/03/2018,14:00,40.820877,-73.8667,BRONX,0.0,0.0,0,0,0,0,0,0,3840439,2018-02-03 14:00:00,2018-02-03T14:00,2018,2,-0.5,0.0,Clear
04/02/2018,0:00,40.883286,-73.883194,BRONX,2.0,0.0,0,0,0,0,2,0,3876452,2018-04-02 00:00:00,2018-04-02T00:00,2018,4,2.3,0.0,Cloudy
04/20/2018,16:00,40.809048,-73.8939,BRONX,0.0,0.0,0,0,0,0,0,0,3885391,2018-04-20 16:00:00,2018-04-20T16:00,2018,4,10.1,0.0,Cloudy
03/31/2018,20:00,40.834793,-73.868996,BRONX,0.0,0.0,0,0,0,0,0,0,3876792,2018-03-31 20:00:00,2018-03-31T20:00,2018,3,6.5,0.0,Clear
09/13/2018,17:00,40.87467,-73.90623,BRONX,0.0,0.0,0,0,0,0,0,0,3980495,2018-09-13 17:00:00,2018-09-13T17:00,2018,9,22.5,0.0,Cloudy
04/25/2018,12:00,40.8617,-73.89139,BRONX,1.0,0.0,1,0,0,0,0,0,3888599,2018-04-25 12:00:00,2018-04-25T12:00,2018,4,13.8,1.1,Drizzle
01/31/2018,0:00,40.83499,-73.89174,BRONX,0.0,0.0,0,0,0,0,0,0,3838047,2018-01-31 00:00:00,2018-01-31T00:00,2018,1,-5.5,0.0,Clear
08/18/2018,0:00,40.843067,-73.88637,BRONX,2.0,0.0,0,0,0,0,2,0,3964524,2018-08-18 00:00:00,2018-08-18T00:00,2018,8,23.1,2.4,Light Rain
06/24/2018,0:00,40.84126,-73.92805,BRONX,2.0,0.0,0,0,0,0,2,0,3930417,2018-06-24 00:00:00,2018-06-24T00:00,2018,6,16.6,0.0,Clear
11/24/2018,21:00,40.82609,-73.92307,BRONX,1.0,0.0,1,0,0,0,0,0,4033149,2018-11-24 21:00:00,2018-11-24T21:00,2018,11,7.6,2.1,Light Rain
09/26/2018,15:00,40.828125,-73.84105,BRONX,2.0,0.0,0,0,0,0,2,0,3989801,2018-09-26 15:00:00,2018-09-26T15:00,2018,9,25.0,0.0,Cloudy
11/09/2018,9:00,40.846893,-73.92055,BRONX,1.0,0.0,0,0,0,0,1,0,4018351,2018-11-09 09:00:00,2018-11-09T09:00,2018,11,7.6,0.0,Cloudy
11/15/2018,16:00,40.868694,-73.90237,BRONX,0.0,0.0,0,0,0,0,0,0,4026829,2018-11-15 16:00:00,2018-11-15T16:00,2018,11,1.9,2.3,Heavy Snow
09/10/2018,12:00,40.813652,-73.906975,BRONX,1.0,0.0,0,0,0,0,1,0,3978001,2018-09-10 12:00:00,2018-09-10T12:00,2018,9,17.2,2.5,Heavy Rain
09/14/2018,20:00,40.841724,-73.84358,BRONX,0.0,0.0,0,0,0,0,0,0,3981525,2018-09-14 20:00:00,2018-09-14T20:00,2018,9,21.2,0.0,Cloudy
09/19/2018,0:00,40.86906,-73.88914,BRONX,1.0,0.0,0,0,0,0,1,0,3984646,2018-09-19 00:00:00,2018-09-19T00:00,2018,9,19.7,0.0,Clear
04/09/2018,6:00,40.881695,-73.86214,BRONX,0.0,0.0,0,0,0,0,0,0,3878640,2018-04-09 06:00:00,2018-04-09T06:00,2018,4,-2.5,0.0,Cloudy
04/25/2018,20:00,40.89371,-73.84398,BRONX,1.0,0.0,0,0,0,0,1,0,3888762,2018-04-25 20:00:00,2018-04-25T20:00,2018,4,12.4,0.0,Cloudy
11/04/2018,15:00,40.861416,-73.83898,BRONX,1.0,0.0,0,0,0,0,1,0,4014563,2018-11-04 15:00:00,2018-11-04T15:00,2018,11,12.0,0.0,Clear
02/02/2018,16:00,40.8891,-73.8422,BRONX,0.0,0.0,0,0,0,0,0,0,3840188,2018-02-02 16:00:00,2018-02-02T16:00,2018,2,-4.1,0.0,Clear
07/15/2018,13:00,40.825573,-73.918465,BRONX,1.0,0.0,1,0,0,0,0,0,4171423,2018-07-15 13:00:00,2018-07-15T13:00,2018,7,26.4,0.0,Cloudy
02/17/2018,14:00,40.815636,-73.84934,BRONX,1.0,0.0,1,0,0,0,0,0,3848197,2018-02-17 14:00:00,2018-02-17T14:00,2018,2,3.2,0.0,Cloudy
10/21/2018,15:00,40.808163,-73.92653,BRONX,0.0,0.0,0,0,0,0,0,0,4005567,2018-10-21 15:00:00,2018-10-21T15:00,2018,10,7.7,0.0,Clear
07/16/2018,7:00,40.853592,-73.89372,BRONX,0.0,0.0,0,0,0,0,0,0,3942753,2018-07-16 07:00:00,2018-07-16T07:00,2018,7,25.3,0.0,Clear
01/05/2018,0:00,40.861862,-73.91282,BRONX,1.0,0.0,0,0,0,0,1,0,3824124,2018-01-05 00:00:00,2018-01-05T00:00,2018,1,-8.5,0.0,Clear
08/01/2018,16:00,40.835426,-73.89515,BRONX,1.0,0.0,0,0,0,0,1,0,3952876,2018-08-01 16:00:00,2018-08-01T16:00,2018,8,28.6,0.1,Drizzle
07/22/2018,5:00,40.88414,-73.86465,BRONX,0.0,0.0,0,0,0,0,0,0,3946161,2018-07-22 05:00:00,2018-07-22T05:00,2018,7,23.0,0.1,Drizzle
09/30/2018,0:00,40.88368,-73.893135,BRONX,1.0,0.0,0,0,1,0,0,0,3991435,2018-09-30 00:00:00,2018-09-30T00:00,2018,9,13.2,0.0,Clear
07/16/2018,17:00,40.86569,-73.80516,BRONX,0.0,0.0,0,0,0,0,0,0,3942117,2018-07-16 17:00:00,2018-07-16T17:00,2018,7,28.8,0.0,Clear
01/22/2018,14:00,40.826424,-73.85868,BRONX,0.0,0.0,0,0,0,0,0,0,3833704,2018-01-22 14:00:00,2018-01-22T14:00,2018,1,8.2,0.0,Cloudy
04/28/2018,16:00,40.81608,-73.917694,BRONX,1.0,0.0,0,0,0,0,1,0,3890828,2018-04-28 16:00:00,2018-04-28T16:00,2018,4,13.6,0.0,Clear
04/21/2018,0:00,40.80988,-73.90308,BRONX,1.0,0.0,0,0,0,0,1,0,3885400,2018-04-21 00:00:00,2018-04-21T00:00,2018,4,1.9,0.0,Clear
12/22/2018,0:00,40.874214,-73.85652,BRONX,0.0,0.0,0,0,0,0,0,0,4050365,2018-12-22 00:00:00,2018-12-22T00:00,2018,12,10.0,0.0,Cloudy
07/31/2018,11:00,40.872158,-73.90336,BRONX,1.0,0.0,1,0,0,0,0,0,3952650,2018-07-31 11:00:00,2018-07-31T11:00,2018,7,26.5,0.1,Drizzle
03/31/2018,15:00,40.833363,-73.88769,BRONX,1.0,0.0,1,0,0,0,0,0,3873256,2018-03-31 15:00:00,2018-03-31T15:00,2018,3,10.6,0.0,Clear
05/01/2018,9:00,40.827656,-73.8861,BRONX,1.0,0.0,0,0,1,0,0,0,3892031,2018-05-01 09:00:00,2018-05-01T09:00,2018,5,15.4,0.0,Clear
03/02/2018,16:00,40.808964,-73.88326,BRONX,1.0,0.0,0,0,0,0,1,0,3857443,2018-03-02 16:00:00,2018-03-02T16:00,2018,3,2.8,1.3,Heavy Snow
10/04/2018,11:00,40.820377,-73.89203,BRONX,1.0,0.0,0,0,1,0,0,0,3997729,2018-10-04 11:00:00,2018-10-04T11:00,2018,10,23.5,0.0,Cloudy
08/27/2018,9:00,40.8283,-73.88296,BRONX,0.0,0.0,0,0,0,0,0,0,3972952,2018-08-27 09:00:00,2018-08-27T09:00,2018,8,26.3,0.0,Cloudy
07/01/2018,18:00,40.85914,-73.81824,BRONX,7.0,0.0,0,0,0,0,7,0,3933262,2018-07-01 18:00:00,2018-07-01T18:00,2018,7,29.9,0.0,Clear
09/04/2018,21:00,40.807556,-73.919235,BRONX,1.0,0.0,1,0,0,0,0,0,3974073,2018-09-04 21:00:00,2018-09-04T21:00,2018,9,28.0,0.0,Clear
02/08/2018,8:00,40.61847,-74.021225,BROOKLYN,4.0,0.0,0,0,0,0,4,0,3843911,2018-02-08 08:00:00,2018-02-08T08:00,2018,2,-3.1,0.0,Clear
04/07/2018,12:00,40.651024,-73.932274,BROOKLYN,0.0,0.0,0,0,0,0,0,0,3877511,2018-04-07 12:00:00,2018-04-07T12:00,2018,4,6.4,0.0,Cloudy
03/16/2018,0:00,40.695717,-73.9396,BROOKLYN,1.0,0.0,0,0,0,0,1,0,3864853,2018-03-16 00:00:00,2018-03-16T00:00,2018,3,0.3,0.0,Clear
09/20/2018,20:00,40.662846,-73.94284,BROOKLYN,3.0,0.0,0,0,0,0,3,0,3986996,2018-09-20 20:00:00,2018-09-20T20:00,2018,9,19.5,0.0,Cloudy
03/05/2018,18:00,40.678684,-73.98219,BROOKLYN,1.0,0.0,0,0,0,0,1,0,3857176,2018-03-05 18:00:00,2018-03-05T18:00,2018,3,4.1,0.0,Cloudy
12/29/2018,21:00,40.6103,-73.959526,BROOKLYN,1.0,0.0,1,0,0,0,0,0,4055049,2018-12-29 21:00:00,2018-12-29T21:00,2018,12,4.0,0.0,Cloudy
02/10/2018,15:00,40.697716,-73.967735,BROOKLYN,1.0,0.0,0,0,1,0,0,0,3843680,2018-02-10 15:00:00,2018-02-10T15:00,2018,2,8.4,0.8,Drizzle
01/11/2018,19:00,40.644512,-73.963135,BROOKLYN,1.0,0.0,1,0,0,0,0,0,3827245,2018-01-11 19:00:00,2018-01-11T19:00,2018,1,6.1,0.0,Cloudy
02/16/2018,15:00,40.642548,-74.016655,BROOKLYN,1.0,0.0,1,0,0,0,0,0,3847284,2018-02-16 15:00:00,2018-02-16T15:00,2018,2,10.7,0.6,Drizzle
03/06/2018,13:00,40.72628,-73.95224,BROOKLYN,1.0,0.0,0,0,0,0,1,0,3857888,2018-03-06 13:00:00,2018-03-06T13:00,2018,3,6.2,0.0,Cloudy
06/12/2018,11:00,40.712524,-73.962555,BROOKLYN,1.0,0.0,0,0,1,0,0,0,3924510,2018-06-12 11:00:00,2018-06-12T11:00,2018,6,20.8,0.0,Cloudy
10/26/2018,13:00,40.62964,-73.91835,BROOKLYN,1.0,0.0,0,0,0,0,1,0,4009641,2018-10-26 13:00:00,2018-10-26T13:00,2018,10,9.7,0.0,Cloudy
02/22/2018,19:00,40.61334,-74.01109,BROOKLYN,1.0,0.0,1,0,0,0,0,0,3850522,2018-02-22 19:00:00,2018-02-22T19:00,2018,2,2.7,0.4,Drizzle
07/07/2018,21:00,40.64995,-74.01231,BROOKLYN,0.0,0.0,0,0,0,0,0,0,3937019,2018-07-07 21:00:00,2018-07-07T21:00,2018,7,17.9,0.0,Clear
09/10/2018,10:00,40.629932,-74.031364,BROOKLYN,1.0,0.0,0,0,1,0,0,0,3978515,2018-09-10 10:00:00,2018-09-10T10:00,2018,9,17.9,1.6,Light Rain
06/26/2018,0:00,40.606007,-73.95583,BROOKLYN,1.0,0.0,0,0,0,0,1,0,3929796,2018-06-26 00:00:00,2018-06-26T00:00,2018,6,18.5,0.0,Clear
11/12/2018,8:00,40.59392,-73.93965,BROOKLYN,1.0,0.0,1,0,0,0,0,0,4019711,2018-11-12 08:00:00,2018-11-12T08:00,2018,11,5.0,0.0,Clear
08/23/2018,10:00,40.654137,-73.91234,BROOKLYN,0.0,0.0,0,0,0,0,0,0,3966586,2018-08-23 10:00:00,2018-08-23T10:00,2018,8,21.7,0.0,Clear
03/10/2018,17:00,40.603348,-73.97236,BROOKLYN,0.0,0.0,0,0,0,0,0,0,3860092,2018-03-10 17:00:00,2018-03-10T17:00,2018,3,4.3,0.0,Cloudy
03/13/2018,12:00,40.607723,-73.97766,BROOKLYN,0.0,0.0,0,0,0,0,0,0,3862286,2018-03-13 12:00:00,2018-03-13T12:00,2018,3,2.5,0.2,Light Snow
01/08/2018,17:00,40.634087,-73.9895,BROOKLYN,1.0,0.0,0,0,1,0,0,0,4063968,2018-01-08 17:00:00,2018-01-08T17:00,2018,1,-1.6,0.3,Heavy Snow
08/29/2018,14:00,40.652794,-73.946884,BROOKLYN,1.0,0.0,0,0,0,0,1,0,3972434,2018-08-29 14:00:00,2018-08-29T14:00,2018,8,33.4,0.0,Clear
10/02/2018,14:00,40.622894,-73.96002,BROOKLYN,0.0,0.0,0,0,0,0,0,0,3992200,2018-10-02 14:00:00,2018-10-02T14:00,2018,10,23.4,0.0,Cloudy
01/09/2018,16:00,40.646523,-73.9733,BROOKLYN,0.0,0.0,0,0,0,0,0,0,3826826,2018-01-09 16:00:00,2018-01-09T16:00,2018,1,1.9,0.0,Clear
04/20/2018,21:00,40.60164,-73.95184,BROOKLYN,1.0,0.0,1,0,0,0,0,0,3885937,2018-04-20 21:00:00,2018-04-20T21:00,2018,4,4.9,0.0,Clear
04/05/2018,2:00,40.652435,-73.91183,BROOKLYN,0.0,0.0,0,0,0,0,0,0,3877368,2018-04-05 02:00:00,2018-04-05T02:00,2018,4,1.7,0.0,Clear
04/17/2018,15:00,40.57813,-73.95964,BROOKLYN,1.0,0.0,1,0,0,0,0,0,3882661,2018-04-17 15:00:00,2018-04-17T15:00,2018,4,7.7,0.0,Cloudy
09/05/2018,7:00,40.608204,-73.920715,BROOKLYN,0.0,0.0,0,0,0,0,0,0,3974248,2018-09-05 07:00:00,2018-09-05T07:00,2018,9,25.5,0.0,Clear
09/01/2018,18:00,40.664707,-73.92824,BROOKLYN,0.0,0.0,0,0,0,0,0,0,3975303,2018-09-01 18:00:00,2018-09-01T18:00,2018,9,21.9,0.0,Cloudy
01/03/2018,12:00,40.63874,-73.8952,BROOKLYN,1.0,0.0,0,0,0,0,1,0,3821844,2018-01-03 12:00:00,2018-01-03T12:00,2018,1,-4.2,0.0,Cloudy
07/05/2018,16:00,40.690212,-73.93548,BROOKLYN,2.0,0.0,0,0,0,0,2,0,3937176,2018-07-05 16:00:00,2018-07-05T16:00,2018,7,27.3,0.1,Drizzle
01/18/2018,8:00,40.617443,-74.028404,BROOKLYN,0.0,0.0,0,0,0,0,0,0,3831232,2018-01-18 08:00:00,2018-01-18T08:00,2018,1,-6.6,0.0,Clear
02/28/2018,17:00,40.68545,-73.994415,BROOKLYN,1.0,0.0,1,0,0,0,0,0,3854061,2018-02-28 17:00:00,2018-02-28T17:00,2018,2,11.7,0.0,Clear
08/28/2018,10:00,40.67843,-73.91357,BROOKLYN,1.0,0.0,0,0,0,0,1,0,3970060,2018-08-28 10:00:00,2018-08-28T10:00,2018,8,30.4,0.0,Clear
01/29/2018,16:00,40.642174,-74.02064,BROOKLYN,1.0,0.0,0,0,0,0,1,0,3836883,2018-01-29 16:00:00,2018-01-29T16:00,2018,1,5.2,0.0,Cloudy
12/12/2018,17:00,40.61753,-73.979805,BROOKLYN,1.0,0.0,0,0,0,0,1,0,4043581,2018-12-12 17:00:00,2018-12-12T17:00,2018,12,1.8,0.0,Cloudy
10/22/2018,14:00,40.723347,-73.93426,BROOKLYN,0.0,0.0,0,0,0,0,0,0,4005646,2018-10-22 14:00:00,2018-10-22T14:00,2018,10,10.1,0.0,Cloudy
01/03/2018,13:00,40.69045,-73.959435,BROOKLYN,0.0,0.0,0,0,0,0,0,0,3822798,2018-01-03 13:00:00,2018-01-03T13:00,2018,1,-3.3,0.0,Cloudy
08/30/2018,21:00,40.633682,-73.89868,BROOKLYN,1.0,0.0,0,0,0,0,1,0,3975089,2018-08-30 21:00:00,2018-08-30T21:00,2018,8,25.9,0.0,Cloudy
07/10/2018,18:00,40.618652,-73.9317,BROOKLYN,2.0,0.0,0,0,0,0,2,0,3939027,2018-07-10 18:00:00,2018-07-10T18:00,2018,7,26.0,0.0,Clear
03/31/2018,17:00,40.728424,-73.95343,BROOKLYN,1.0,0.0,0,0,1,0,0,0,3873622,2018-03-31 17:00:00,2018-03-31T17:00,2018,3,7.2,0.0,Clear
07/04/2018,12:00,40.701256,-73.94278,BROOKLYN,0.0,0.0,0,0,0,0,0,0,3934639,2018-07-04 12:00:00,2018-07-04T12:00,2018,7,28.1,0.0,Cloudy
03/25/2018,18:00,40.724262,-73.93766,BROOKLYN,1.0,0.0,0,0,0,0,1,0,3869431,2018-03-25 18:00:00,2018-03-25T18:00,2018,3,4.2,0.0,Cloudy
01/12/2018,11:00,40.696198,-73.98869,BROOKLYN,0.0,0.0,0,0,0,0,0,0,3827350,2018-01-12 11:00:00,2018-01-12T11:00,2018,1,12.9,1.0,Drizzle
09/30/2018,4:00,40.692623,-73.93398,BROOKLYN,1.0,0.0,0,0,1,0,0,0,3991871,2018-09-30 04:00:00,2018-09-30T04:00,2018,9,13.2,0.0,Clear
04/30/2018,15:00,40.647034,-73.94529,BROOKLYN,0.0,0.0,0,0,0,0,0,0,3891173,2018-04-30 15:00:00,2018-04-30T15:00,2018,4,9.0,0.3,Drizzle
01/08/2018,12:00,40.5789,-74.00362,BROOKLYN,0.0,0.0,0,0,0,0,0,0,3825849,2018-01-08 12:00:00,2018-01-08T12:00,2018,1,-3.1,0.0,Cloudy
04/05/2018,4:00,40.64986,-74.01972,BROOKLYN,1.0,0.0,0,0,0,0,1,0,3875467,2018-04-05 04:00:00,2018-04-05T04:00,2018,4,0.6,0.0,Clear
05/31/2018,17:00,40.71814,-73.95525,BROOKLYN,1.0,0.0,0,0,0,0,1,0,3911856,2018-05-31 17:00:00,2018-05-31T17:00,2018,5,19.0,0.0,Cloudy
10/03/2018,13:00,40.698067,-73.95873,BROOKLYN,1.0,0.0,0,0,0,0,1,0,3993350,2018-10-03 13:00:00,2018-10-03T13:00,2018,10,24.1,0.0,Clear
11/20/2018,14:00,40.673397,-73.98279,BROOKLYN,1.0,0.0,0,0,0,0,1,0,4029715,2018-11-20 14:00:00,2018-11-20T14:00,2018,11,8.4,0.0,Clear
07/10/2018,0:00,40.71148,-73.9456,BROOKLYN,1.0,0.0,1,0,0,0,0,0,3938506,2018-07-10 00:00:00,2018-07-10T00:00,2018,7,21.3,0.0,Clear
01/12/2018,13:00,40.706913,-73.94766,BROOKLYN,1.0,0.0,1,0,0,0,0,0,3828873,2018-01-12 13:00:00,2018-01-12T13:00,2018,1,13.6,1.2,Drizzle
02/16/2018,19:00,40.608807,-73.9532,BROOKLYN,1.0,0.0,0,0,0,0,1,0,3848459,2018-02-16 19:00:00,2018-02-16T19:00,2018,2,5.8,0.0,Cloudy
07/05/2018,20:00,40.68175,-73.96748,BROOKLYN,0.0,0.0,0,0,0,0,0,0,3936509,2018-07-05 20:00:00,2018-07-05T20:00,2018,7,25.4,0.0,Cloudy
04/12/2018,21:00,40.660656,-73.885796,BROOKLYN,0.0,0.0,0,0,0,0,0,0,3880128,2018-04-12 21:00:00,2018-04-12T21:00,2018,4,12.3,0.0,Cloudy
01/18/2018,12:00,40.65245,-74.013435,BROOKLYN,0.0,0.0,0,0,0,0,0,0,3831180,2018-01-18 12:00:00,2018-01-18T12:00,2018,1,-1.1,0.0,Clear
05/04/2018,17:00,40.639984,-73.94842,BROOKLYN,1.0,0.0,0,0,0,0,1,0,3899742,2018-05-04 17:00:00,2018-05-04T17:00,2018,5,21.9,0.0,Cloudy
04/20/2018,23:00,40.664192,-73.87759,BROOKLYN,1.0,0.0,0,0,0,0,1,0,3885275,2018-04-20 23:00:00,2018-04-20T23:00,2018,4,3.2,0.0,Clear
07/24/2018,17:00,40.648983,-73.94841,BROOKLYN,1.0,0.0,0,0,1,0,0,0,3948483,2018-07-24 17:00:00,2018-07-24T17:00,2018,7,25.4,0.0,Clear
11/21/2018,20:00,40.67816,-73.897484,BROOKLYN,1.0,0.0,0,0,0,0,1,0,4030731,2018-11-21 20:00:00,2018-11-21T20:00,2018,11,3.1,0.0,Cloudy
09/20/2018,16:00,40.587303,-73.96036,BROOKLYN,1.0,0.0,0,0,0,0,1,0,3984851,2018-09-20 16:00:00,2018-09-20T16:00,2018,9,20.5,0.0,Cloudy
11/25/2018,18:00,40.62418,-73.97048,BROOKLYN,1.0,0.0,0,0,0,0,1,0,4034547,2018-11-25 18:00:00,2018-11-25T18:00,2018,11,9.8,0.0,Cloudy
05/24/2018,16:00,40.7014,-73.98366,BROOKLYN,1.0,0.0,0,0,0,0,1,0,3910917,2018-05-24 16:00:00,2018-05-24T16:00,2018,5,23.6,0.0,Clear
04/13/2018,18:00,40.701977,-73.92272,BROOKLYN,0.0,0.0,0,0,0,0,0,0,3880813,2018-04-13 18:00:00,2018-04-13T18:00,2018,4,17.5,0.0,Cloudy
05/24/2018,8:00,40.580006,-74.00675,BROOKLYN,1.0,0.0,0,0,0,0,1,0,3907482,2018-05-24 08:00:00,2018-05-24T08:00,2018,5,20.3,0.0,Clear
04/29/2018,1:00,40.63063,-73.89906,BROOKLYN,0.0,0.0,0,0,0,0,0,0,3889950,2018-04-29 01:00:00,2018-04-29T01:00,2018,4,10.4,0.1,Drizzle
12/12/2018,9:00,40.623962,-73.97245,BROOKLYN,1.0,0.0,0,0,0,0,1,0,4043482,2018-12-12 09:00:00,2018-12-12T09:00,2018,12,1.7,0.0,Cloudy
05/25/2018,13:00,40.706512,-73.9309,BROOKLYN,1.0,0.0,0,0,0,0,1,0,3908258,2018-05-25 13:00:00,2018-05-25T13:00,2018,5,28.1,0.0,Cloudy
08/11/2018,20:00,40.65138,-73.93778,BROOKLYN,1.0,0.0,1,0,0,0,0,0,3961508,2018-08-11 20:00:00,2018-08-11T20:00,2018,8,23.3,0.1,Drizzle
06/10/2018,13:00,40.64609,-73.89691,BROOKLYN,2.0,0.0,0,0,0,0,2,0,3917955,2018-06-10 13:00:00,2018-06-10T13:00,2018,6,16.9,0.5,Drizzle
04/29/2018,9:00,40.61276,-73.96093,BROOKLYN,5.0,0.0,0,0,0,0,5,0,3890850,2018-04-29 09:00:00,2018-04-29T09:00,2018,4,10.0,0.1,Drizzle
07/28/2018,18:00,40.644985,-74.01769,BROOKLYN,0.0,0.0,0,0,0,0,0,0,3950939,2018-07-28 18:00:00,2018-07-28T18:00,2018,7,25.0,0.0,Cloudy
03/30/2018,12:00,40.64927,-74.009674,BROOKLYN,1.0,0.0,1,0,0,0,0,0,3872448,2018-03-30 12:00:00,2018-03-30T12:00,2018,3,11.4,0.0,Cloudy
06/01/2018,19:00,40.67489,-73.884544,BROOKLYN,1.0,0.0,0,0,0,0,1,0,3912588,2018-06-01 19:00:00,2018-06-01T19:00,2018,6,19.4,0.0,Cloudy
09/04/2018,14:00,40.730934,-73.94444,BROOKLYN,1.0,0.0,1,0,0,0,0,0,3974342,2018-09-04 14:00:00,2018-09-04T14:00,2018,9,32.1,0.0,Cloudy
12/01/2018,11:00,40.60949,-73.95334,BROOKLYN,1.0,0.0,0,0,0,0,1,0,4036096,2018-12-01 11:00:00,2018-12-01T11:00,2018,12,5.6,0.0,Clear
03/27/2018,8:00,40.700626,-73.960304,BROOKLYN,1.0,0.0,0,0,0,0,1,0,3870722,2018-03-27 08:00:00,2018-03-27T08:00,2018,3,1.8,0.0,Cloudy
11/15/2018,18:00,40.640167,-73.95713,BROOKLYN,0.0,0.0,0,0,0,0,0,0,4026938,2018-11-15 18:00:00,2018-11-15T18:00,2018,11,1.0,3.2,Heavy Snow
01/22/2018,13:00,40.677605,-74.0063,BROOKLYN,1.0,0.0,0,0,0,0,1,0,3833451,2018-01-22 13:00:00,2018-01-22T13:00,2018,1,9.1,0.0,Cloudy
06/16/2018,19:00,40.670887,-73.93649,BROOKLYN,2.0,0.0,0,0,0,0,2,0,3926728,2018-06-16 19:00:00,2018-06-16T19:00,2018,6,22.2,0.0,Cloudy
05/29/2018,13:00,40.608807,-73.924126,BROOKLYN,0.0,0.0,0,0,0,0,0,0,3910337,2018-05-29 13:00:00,2018-05-29T13:00,2018,5,25.2,0.0,Cloudy
02/17/2018,1:00,40.696945,-73.913574,BROOKLYN,0.0,0.0,0,0,0,0,0,0,3848621,2018-02-17 01:00:00,2018-02-17T01:00,2018,2,-0.5,0.0,Cloudy
04/03/2018,13:00,40.681503,-73.974236,BROOKLYN,1.0,0.0,1,0,0,0,0,0,3876237,2018-04-03 13:00:00,2018-04-03T13:00,2018,4,5.0,1.4,Light Rain
11/02/2018,13:00,40.67239,-73.87463,BROOKLYN,3.0,0.0,0,0,0,0,3,0,4013737,2018-11-02 13:00:00,2018-11-02T13:00,2018,11,20.1,0.6,Drizzle
01/09/2018,10:00,40.662014,-73.86838,BROOKLYN,1.0,0.0,0,0,0,0,1,0,3825311,2018-01-09 10:00:00,2018-01-09T10:00,2018,1,1.2,0.0,Clear
03/11/2018,17:00,40.593002,-73.98874,BROOKLYN,1.0,0.0,0,0,0,0,1,0,3861408,2018-03-11 17:00:00,2018-03-11T17:00,2018,3,5.5,0.0,Clear
06/23/2018,13:00,40.646515,-73.958115,BROOKLYN,1.0,0.0,1,0,0,0,0,0,3927988,2018-06-23 13:00:00,2018-06-23T13:00,2018,6,20.9,0.4,Drizzle
10/16/2018,8:00,40.678623,-73.9173,BROOKLYN,1.0,0.0,1,0,0,0,0,0,4001122,2018-10-16 08:00:00,2018-10-16T08:00,2018,10,8.7,0.0,Cloudy
01/03/2018,20:00,40.73046,-73.9515,BROOKLYN,3.0,0.0,0,0,0,0,3,0,3821902,2018-01-03 20:00:00,2018-01-03T20:00,2018,1,-4.9,0.0,Cloudy
04/24/2018,12:00,40.625156,-73.95631,BROOKLYN,1.0,0.0,0,0,0,0,1,0,3888809,2018-04-24 12:00:00,2018-04-24T12:00,2018,4,12.2,0.0,Cloudy
04/27/2018,20:00,40.680187,-73.880875,BROOKLYN,1.0,0.0,0,0,0,0,1,0,3890461,2018-04-27 20:00:00,2018-04-27T20:00,2018,4,11.0,0.0,Cloudy
02/14/2018,16:00,40.594215,-73.96231,BROOKLYN,1.0,0.0,0,0,0,0,1,0,3846243,2018-02-14 16:00:00,2018-02-14T16:00,2018,2,9.2,0.0,Clear
05/23/2018,17:00,40.632156,-73.98435,BROOKLYN,1.0,0.0,1,0,0,0,0,0,3906269,2018-05-23 17:00:00,2018-05-23T17:00,2018,5,24.7,0.0,Clear
02/15/2018,11:00,40.7145,-73.957565,BROOKLYN,1.0,0.0,0,0,1,0,0,0,3846921,2018-02-15 11:00:00,2018-02-15T11:00,2018,2,10.3,0.0,Cloudy
05/14/2018,14:00,40.648533,-73.95826,BROOKLYN,2.0,0.0,0,0,0,0,2,0,3901167,2018-05-14 14:00:00,2018-05-14T14:00,2018,5,17.0,0.0,Cloudy
01/28/2018,14:00,40.691643,-73.96754,BROOKLYN,0.0,0.0,0,0,0,0,0,0,3836695,2018-01-28 14:00:00,2018-01-28T14:00,2018,1,9.1,0.2,Drizzle
04/22/2018,15:00,40.693684,-73.963646,BROOKLYN,2.0,0.0,0,0,0,0,2,0,3887889,2018-04-22 15:00:00,2018-04-22T15:00,2018,4,13.7,0.0,Clear
02/21/2018,13:00,40.691456,-73.98735,BROOKLYN,2.0,0.0,2,0,0,0,0,0,3850916,2018-02-21 13:00:00,2018-02-21T13:00,2018,2,21.3,0.0,Clear
02/05/2018,10:00,40.686028,-73.87294,BROOKLYN,1.0,0.0,1,0,0,0,0,0,3841449,2018-02-05 10:00:00,2018-02-05T10:00,2018,2,-0.4,0.0,Clear
09/09/2018,19:00,40.615776,-74.00305,BROOKLYN,0.0,0.0,0,0,0,0,0,0,3976981,2018-09-09 19:00:00,2018-09-09T19:00,2018,9,15.5,2.0,Light Rain
11/12/2018,14:00,40.734688,-73.95247,BROOKLYN,0.0,0.0,0,0,0,0,0,0,4019587,2018-11-12 14:00:00,2018-11-12T14:00,2018,11,8.3,0.0,Cloudy
11/26/2018,17:00,40.677483,-73.93033,BROOKLYN,1.0,0.0,1,0,0,0,0,0,4034131,2018-11-26 17:00:00,2018-11-26T17:00,2018,11,9.5,4.9,Heavy Rain
01/22/2018,12:00,40.636242,-74.01237,BROOKLYN,1.0,0.0,0,0,1,0,0,0,3833331,2018-01-22 12:00:00,2018-01-22T12:00,2018,1,8.1,0.0,Cloudy
07/22/2018,11:00,40.66077,-73.91975,BROOKLYN,2.0,0.0,0,0,0,0,2,0,3946500,2018-07-22 11:00:00,2018-07-22T11:00,2018,7,25.5,0.0,Cloudy
06/21/2018,23:00,40.70005,-73.9544,BROOKLYN,0.0,0.0,0,0,0,0,0,0,3926050,2018-06-21 23:00:00,2018-06-21T23:00,2018,6,20.3,0.0,Cloudy
09/27/2018,14:00,40.67752,-73.972725,BROOKLYN,1.0,0.0,0,0,0,0,1,0,3989274,2018-09-27 14:00:00,2018-09-27T14:00,2018,9,21.2,0.0,Cloudy
06/14/2018,20:00,40.677998,-74.00415,BROOKLYN,2.0,0.0,0,0,0,0,2,0,3921155,2018-06-14 20:00:00,2018-06-14T20:00,2018,6,21.2,0.0,Clear
04/02/2018,15:00,40.6791,-73.9874,BROOKLYN,0.0,0.0,0,0,0,0,0,0,3874126,2018-04-02 15:00:00,2018-04-02T15:00,2018,4,2.4,0.0,Clear
06/14/2018,0:00,40.62689,-73.945885,BROOKLYN,0.0,0.0,0,0,0,0,0,0,3926691,2018-06-14 00:00:00,2018-06-14T00:00,2018,6,22.0,0.0,Cloudy
04/16/2018,16:00,40.638523,-74.01,BROOKLYN,0.0,0.0,0,0,0,0,0,0,3881876,2018-04-16 16:00:00,2018-04-16T16:00,2018,4,16.9,0.0,Cloudy
09/02/2018,15:00,40.665627,-73.909706,BROOKLYN,1.0,0.0,0,0,0,0,1,0,3974106,2018-09-02 15:00:00,2018-09-02T15:00,2018,9,24.7,0.0,Cloudy
04/26/2018,13:00,40.601322,-73.99282,BROOKLYN,0.0,0.0,0,0,0,0,0,0,3889300,2018-04-26 13:00:00,2018-04-26T13:00,2018,4,17.7,0.0,Cloudy
05/29/2018,0:00,40.5963,-73.959785,BROOKLYN,1.0,0.0,0,0,1,0,0,0,3910326,2018-05-29 00:00:00,2018-05-29T00:00,2018,5,16.9,0.0,Cloudy
08/12/2018,6:00,40.707523,-73.96115,BROOKLYN,1.0,0.0,0,0,0,0,1,0,3960136,2018-08-12 06:00:00,2018-08-12T06:00,2018,8,22.1,0.0,Clear
09/20/2018,11:00,40.66592,-73.984825,BROOKLYN,0.0,0.0,0,0,0,0,0,0,3984966,2018-09-20 11:00:00,2018-09-20T11:00,2018,9,20.3,0.1,Drizzle
03/28/2018,11:00,40.678192,-73.96386,BROOKLYN,1.0,0.0,0,0,0,0,1,0,3871170,2018-03-28 11:00:00,2018-03-28T11:00,2018,3,6.3,0.0,Cloudy
03/17/2018,7:00,40.7011,-73.91181,BROOKLYN,0.0,0.0,0,0,0,0,0,0,3865357,2018-03-17 07:00:00,2018-03-17T07:00,2018,3,-2.4,0.0,Clear
05/26/2018,14:00,40.625977,-73.91793,BROOKLYN,0.0,0.0,0,0,0,0,0,0,3910538,2018-05-26 14:00:00,2018-05-26T14:00,2018,5,25.3,1.0,Drizzle
07/31/2018,8:00,40.709053,-73.96711,BROOKLYN,1.0,0.0,0,0,1,0,0,0,3951981,2018-07-31 08:00:00,2018-07-31T08:00,2018,7,23.7,0.0,Cloudy
11/30/2018,0:00,40.673943,-73.86393,BROOKLYN,1.0,0.0,1,0,0,0,0,0,4035761,2018-11-30 00:00:00,2018-11-30T00:00,2018,11,1.6,0.0,Clear
10/12/2018,11:00,40.663605,-73.934395,BROOKLYN,1.0,0.0,0,0,0,0,1,0,3998814,2018-10-12 11:00:00,2018-10-12T11:00,2018,10,15.8,0.0,Clear
12/27/2018,23:00,40.638367,-73.95584,BROOKLYN,0.0,0.0,0,0,0,0,0,0,4060508,2018-12-27 23:00:00,2018-12-27T23:00,2018,12,5.6,0.0,Cloudy
07/13/2018,13:00,40.692623,-73.923676,BROOKLYN,2.0,0.0,0,0,0,0,2,0,3941675,2018-07-13 13:00:00,2018-07-13T13:00,2018,7,25.5,0.0,Cloudy
04/16/2018,14:00,40.585407,-73.96645,BROOKLYN,1.0,0.0,1,0,0,0,0,0,3882468,2018-04-16 14:00:00,2018-04-16T14:00,2018,4,12.9,0.0,Clear
02/16/2018,18:00,40.707813,-73.93986,BROOKLYN,1.0,0.0,0,0,0,0,1,0,3848554,2018-02-16 18:00:00,2018-02-16T18:00,2018,2,5.3,0.0,Cloudy
04/14/2018,16:00,40.64043,-73.95624,BROOKLYN,2.0,0.0,0,0,0,0,2,0,3882206,2018-04-14 16:00:00,2018-04-14T16:00,2018,4,15.3,0.0,Clear
11/14/2018,18:00,40.623962,-73.97245,BROOKLYN,0.0,0.0,0,0,0,0,0,0,4021384,2018-11-14 18:00:00,2018-11-14T18:00,2018,11,1.9,0.0,Cloudy
09/29/2018,19:00,40.650715,-73.951385,BROOKLYN,0.0,0.0,0,0,0,0,0,0,3990695,2018-09-29 19:00:00,2018-09-29T19:00,2018,9,18.6,0.0,Clear
12/24/2018,0:00,40.655495,-73.88833,BROOKLYN,1.0,0.0,0,0,0,0,1,0,4051261,2018-12-24 00:00:00,2018-12-24T00:00,2018,12,1.8,0.2,Light Snow
12/12/2018,0:00,40.635933,-73.96249,BROOKLYN,1.0,0.0,1,0,0,0,0,0,4043547,2018-12-12 00:00:00,2018-12-12T00:00,2018,12,-0.8,0.0,Clear
06/28/2018,19:00,40.603264,-73.98076,BROOKLYN,0.0,0.0,0,0,0,0,0,0,3931276,2018-06-28 19:00:00,2018-06-28T19:00,2018,6,23.3,0.0,Clear
04/24/2018,15:00,40.655495,-73.88833,BROOKLYN,1.0,0.0,0,0,0,0,1,0,3887399,2018-04-24 15:00:00,2018-04-24T15:00,2018,4,13.9,0.0,Cloudy
08/01/2018,0:00,40.680016,-73.87743,BROOKLYN,1.0,0.0,0,0,0,0,1,0,3952541,2018-08-01 00:00:00,2018-08-01T00:00,2018,8,23.1,0.0,Cloudy
08/17/2018,19:00,40.675632,-73.89878,BROOKLYN,1.0,0.0,0,0,0,0,1,0,3964319,2018-08-17 19:00:00,2018-08-17T19:00,2018,8,26.9,0.0,Cloudy
09/09/2018,7:00,40.65415,-73.949936,BROOKLYN,1.0,0.0,0,0,0,0,1,0,3977034,2018-09-09 07:00:00,2018-09-09T07:00,2018,9,14.4,0.8,Drizzle
07/29/2018,23:00,40.67189,-73.895874,BROOKLYN,1.0,0.0,0,0,1,0,0,0,3950717,2018-07-29 23:00:00,2018-07-29T23:00,2018,7,24.6,0.0,Clear
02/04/2018,16:00,40.64122,-73.9833,BROOKLYN,2.0,0.0,0,0,0,0,2,0,3840135,2018-02-04 16:00:00,2018-02-04T16:00,2018,2,4.9,0.6,Drizzle
12/01/2018,0:00,40.71086,-73.95801,BROOKLYN,1.0,0.0,0,0,1,0,0,0,4036322,2018-12-01 00:00:00,2018-12-01T00:00,2018,12,2.0,0.0,Clear
02/16/2018,23:00,40.62685,-73.97643,BROOKLYN,1.0,0.0,0,0,0,0,1,0,3849420,2018-02-16 23:00:00,2018-02-16T23:00,2018,2,2.1,0.0,Clear
11/28/2018,0:00,40.600838,-73.98125,BROOKLYN,1.0,0.0,0,0,0,0,1,0,4034455,2018-11-28 00:00:00,2018-11-28T00:00,2018,11,2.3,0.0,Cloudy
03/06/2018,16:00,40.57836,-73.97633,BROOKLYN,0.0,0.0,0,0,0,0,0,0,3857524,2018-03-06 16:00:00,2018-03-06T16:00,2018,3,4.5,0.0,Clear
01/01/2018,16:00,40.57688,-73.95288,BROOKLYN,1.0,0.0,0,0,0,0,1,0,3821189,2018-01-01 16:00:00,2018-01-01T16:00,2018,1,-6.6,0.0,Clear
04/11/2018,15:00,40.643356,-74.00139,BROOKLYN,1.0,0.0,1,0,0,0,0,0,3879072,2018-04-11 15:00:00,2018-04-11T15:00,2018,4,7.0,0.0,Cloudy
08/15/2018,2:00,40.62788,-73.92201,BROOKLYN,0.0,0.0,0,0,0,0,0,0,3961304,2018-08-15 02:00:00,2018-08-15T02:00,2018,8,21.7,0.0,Cloudy
08/11/2018,13:00,40.713123,-73.95351,BROOKLYN,0.0,0.0,0,0,0,0,0,0,3960822,2018-08-11 13:00:00,2018-08-11T13:00,2018,8,25.1,0.3,Drizzle
01/06/2018,15:00,40.65227,-73.8683,BROOKLYN,2.0,0.0,0,0,0,0,2,0,3823874,2018-01-06 15:00:00,2018-01-06T15:00,2018,1,-12.8,0.0,Clear
05/16/2018,15:00,40.65626,-73.89109,BROOKLYN,1.0,0.0,0,0,0,0,1,0,3904829,2018-05-16 15:00:00,2018-05-16T15:00,2018,5,15.1,0.5,Drizzle
11/22/2018,17:00,40.67385,-73.90024,BROOKLYN,1.0,0.0,0,0,0,0,1,0,4032138,2018-11-22 17:00:00,2018-11-22T17:00,2018,11,-4.8,0.0,Clear
11/24/2018,0:00,40.68419,-73.8703,BROOKLYN,0.0,0.0,0,0,0,0,0,0,4031886,2018-11-24 00:00:00,2018-11-24T00:00,2018,11,-0.5,0.0,Cloudy
01/23/2018,16:00,40.603218,-73.94244,BROOKLYN,3.0,0.0,0,0,0,0,3,0,3834045,2018-01-23 16:00:00,2018-01-23T16:00,2018,1,12.1,0.0,Cloudy
02/04/2018,15:00,40.60648,-73.96462,BROOKLYN,1.0,0.0,1,0,0,0,0,0,3840038,2018-02-04 15:00:00,2018-02-04T15:00,2018,2,4.7,0.5,Drizzle
05/20/2018,22:00,40.668957,-73.98585,BROOKLYN,1.0,0.0,0,0,0,0,1,0,3904259,2018-05-20 22:00:00,2018-05-20T22:00,2018,5,18.0,0.0,Cloudy
08/09/2018,9:00,40.61669,-73.949814,BROOKLYN,1.0,0.0,0,0,1,0,0,0,3957880,2018-08-09 09:00:00,2018-08-09T09:00,2018,8,26.2,0.1,Drizzle
02/21/2018,13:00,40.696033,-73.98453,BROOKLYN,1.0,0.0,0,0,0,0,1,0,3850339,2018-02-21 13:00:00,2018-02-21T13:00,2018,2,21.4,0.0,Clear
02/19/2018,19:00,40.638554,-73.88851,BROOKLYN,0.0,0.0,0,0,0,0,0,0,3849952,2018-02-19 19:00:00,2018-02-19T19:00,2018,2,6.5,0.0,Cloudy
09/21/2018,22:00,40.573498,-73.98745,BROOKLYN,0.0,0.0,0,0,0,0,0,0,3986467,2018-09-21 22:00:00,2018-09-21T22:00,2018,9,21.6,0.0,Cloudy
11/06/2018,8:00,40.598553,-73.997345,BROOKLYN,0.0,0.0,0,0,0,0,0,0,4015464,2018-11-06 08:00:00,2018-11-06T08:00,2018,11,11.4,0.0,Cloudy
03/09/2018,9:00,40.67453,-73.86884,BROOKLYN,1.0,0.0,1,0,0,0,0,0,3859581,2018-03-09 09:00:00,2018-03-09T09:00,2018,3,1.2,0.1,Light Snow
06/01/2018,16:00,40.59692,-73.95412,BROOKLYN,1.0,0.0,0,0,1,0,0,0,3913425,2018-06-01 16:00:00,2018-06-01T16:00,2018,6,21.3,0.0,Cloudy
12/31/2018,22:00,40.64891,-73.89256,BROOKLYN,2.0,0.0,2,0,0,0,0,0,4055631,2018-12-31 22:00:00,2018-12-31T22:00,2018,12,7.7,3.8,Heavy Rain
03/20/2018,9:00,40.621433,-73.987854,BROOKLYN,1.0,0.0,0,0,0,0,1,0,3866427,2018-03-20 09:00:00,2018-03-20T09:00,2018,3,0.9,0.0,Cloudy
01/07/2018,1:00,40.693867,-73.99921,BROOKLYN,1.0,0.0,0,0,0,0,1,0,3823416,2018-01-07 01:00:00,2018-01-07T01:00,2018,1,-16.2,0.0,Clear
11/20/2018,22:00,40.68993,-73.98148,BROOKLYN,1.0,0.0,0,0,0,0,1,0,4030008,2018-11-20 22:00:00,2018-11-20T22:00,2018,11,3.9,0.0,Clear
09/23/2018,13:00,40.70196,-73.96015,BROOKLYN,1.0,0.0,1,0,0,0,0,0,3986265,2018-09-23 13:00:00,2018-09-23T13:00,2018,9,18.5,0.2,Drizzle
01/09/2018,15:00,40.59076,-73.96063,BROOKLYN,0.0,0.0,0,0,0,0,0,0,3825539,2018-01-09 15:00:00,2018-01-09T15:00,2018,1,3.5,0.0,Clear
09/06/2018,20:00,40.610714,-73.95575,BROOKLYN,2.0,0.0,0,0,0,0,2,0,3976330,2018-09-06 20:00:00,2018-09-06T20:00,2018,9,25.6,0.0,Clear
11/15/2018,15:00,40.6363,-74.025375,BROOKLYN,1.0,0.0,0,0,0,0,1,0,4021609,2018-11-15 15:00:00,2018-11-15T15:00,2018,11,1.2,2.3,Heavy Snow
05/26/2018,16:00,40.6619,-73.9175,BROOKLYN,1.0,0.0,1,0,0,0,0,0,3911764,2018-05-26 16:00:00,2018-05-26T16:00,2018,5,26.4,0.1,Drizzle
06/10/2018,7:00,40.646927,-74.00126,BROOKLYN,1.0,0.0,0,0,0,0,1,0,3918888,2018-06-10 07:00:00,2018-06-10T07:00,2018,6,17.8,0.1,Drizzle
08/27/2018,18:00,40.62853,-74.02305,BROOKLYN,1.0,0.0,0,0,0,0,1,0,3969132,2018-08-27 18:00:00,2018-08-27T18:00,2018,8,25.0,0.0,Cloudy
05/23/2018,15:00,40.65612,-73.9386,BROOKLYN,1.0,0.0,1,0,0,0,0,0,3906286,2018-05-23 15:00:00,2018-05-23T15:00,2018,5,25.5,0.0,Clear
10/14/2018,18:00,40.60242,-73.99459,BROOKLYN,2.0,0.0,0,0,0,0,2,0,4000647,2018-10-14 18:00:00,2018-10-14T18:00,2018,10,13.1,0.0,Clear
01/09/2018,15:00,40.588886,-73.965645,BROOKLYN,1.0,0.0,0,0,0,0,1,0,3825872,2018-01-09 15:00:00,2018-01-09T15:00,2018,1,3.5,0.0,Clear
06/18/2018,0:00,40.64063,-74.025734,BROOKLYN,2.0,0.0,0,0,0,0,2,0,3924155,2018-06-18 00:00:00,2018-06-18T00:00,2018,6,20.9,0.0,Cloudy
05/31/2018,8:00,40.65271,-73.959946,BROOKLYN,0.0,0.0,0,0,0,0,0,0,3911426,2018-05-31 08:00:00,2018-05-31T08:00,2018,5,17.9,0.0,Cloudy
11/15/2018,16:00,40.673836,-74.0023,BROOKLYN,1.0,0.0,0,0,0,0,1,0,4027120,2018-11-15 16:00:00,2018-11-15T16:00,2018,11,1.3,3.0,Heavy Snow
08/21/2018,12:00,40.71914,-73.96298,BROOKLYN,0.0,0.0,0,0,0,0,0,0,3966433,2018-08-21 12:00:00,2018-08-21T12:00,2018,8,23.5,0.0,Cloudy
12/06/2018,20:00,40.648106,-73.91852,BROOKLYN,2.0,0.0,0,0,0,0,2,0,4039694,2018-12-06 20:00:00,2018-12-06T20:00,2018,12,2.5,0.0,Cloudy
02/22/2018,6:00,40.646572,-73.89617,BROOKLYN,2.0,0.0,0,0,0,0,2,0,3850498,2018-02-22 06:00:00,2018-02-22T06:00,2018,2,6.9,0.1,Drizzle
08/07/2018,13:00,40.607338,-73.96189,BROOKLYN,1.0,0.0,1,0,0,0,0,0,3956406,2018-08-07 13:00:00,2018-08-07T13:00,2018,8,27.9,0.0,Clear
10/22/2018,16:00,40.613335,-73.99277,BROOKLYN,0.0,0.0,0,0,0,0,0,0,4005536,2018-10-22 16:00:00,2018-10-22T16:00,2018,10,10.2,0.0,Clear
07/02/2018,11:00,40.62237,-73.96473,BROOKLYN,0.0,0.0,0,0,0,0,0,0,3933634,2018-07-02 11:00:00,2018-07-02T11:00,2018,7,29.4,0.0,Clear
06/26/2018,20:00,40.631924,-73.96668,BROOKLYN,1.0,0.0,0,0,1,0,0,0,3931048,2018-06-26 20:00:00,2018-06-26T20:00,2018,6,20.2,0.0,Cloudy
09/04/2018,23:00,40.59592,-73.941025,BROOKLYN,1.0,0.0,0,0,0,0,1,0,3974184,2018-09-04 23:00:00,2018-09-04T23:00,2018,9,24.9,0.0,Cloudy
10/08/2018,22:00,40.69746,-73.99303,BROOKLYN,0.0,0.0,0,0,0,0,0,0,3998716,2018-10-08 22:00:00,2018-10-08T22:00,2018,10,19.5,0.0,Cloudy
05/09/2018,16:00,40.67757,-73.88604,BROOKLYN,1.0,0.0,0,0,0,0,1,0,3897109,2018-05-09 16:00:00,2018-05-09T16:00,2018,5,16.2,0.0,Cloudy
11/13/2018,7:00,40.670277,-73.92542,BROOKLYN,1.0,0.0,1,0,0,0,0,0,4020129,2018-11-13 07:00:00,2018-11-13T07:00,2018,11,10.6,2.5,Heavy Rain
03/04/2018,19:00,40.69365,-73.98333,BROOKLYN,0.0,0.0,0,0,0,0,0,0,3858095,2018-03-04 19:00:00,2018-03-04T19:00,2018,3,3.0,0.0,Clear
04/14/2018,18:00,40.71786,-73.96223,BROOKLYN,0.0,0.0,0,0,0,0,0,0,3881352,2018-04-14 18:00:00,2018-04-14T18:00,2018,4,14.6,0.0,Cloudy
11/06/2018,21:00,40.616043,-73.94484,BROOKLYN,1.0,0.0,1,0,0,0,0,0,4019524,2018-11-06 21:00:00,2018-11-06T21:00,2018,11,14.3,0.0,Clear
02/15/2018,19:00,40.663834,-73.99452,BROOKLYN,0.0,0.0,0,0,0,0,0,0,3846670,2018-02-15 19:00:00,2018-02-15T19:00,2018,2,11.5,0.0,Cloudy
08/07/2018,12:00,40.684544,-73.96509,BROOKLYN,1.0,0.0,0,0,1,0,0,0,3956884,2018-08-07 12:00:00,2018-08-07T12:00,2018,8,28.8,0.1,Drizzle
02/09/2018,13:00,40.71119,-73.948555,BROOKLYN,0.0,0.0,0,0,0,0,0,0,3844428,2018-02-09 13:00:00,2018-02-09T13:00,2018,2,1.2,0.0,Cloudy
01/07/2018,4:00,40.68837,-73.944916,BROOKLYN,1.0,0.0,0,0,0,0,1,0,3823691,2018-01-07 04:00:00,2018-01-07T04:00,2018,1,-17.2,0.0,Clear
10/26/2018,10:00,40.680016,-73.87743,BROOKLYN,1.0,0.0,0,0,0,0,1,0,4009876,2018-10-26 10:00:00,2018-10-26T10:00,2018,10,7.4,0.0,Cloudy
07/06/2018,12:00,40.64575,-74.01332,BROOKLYN,0.0,0.0,0,0,0,0,0,0,3938828,2018-07-06 12:00:00,2018-07-06T12:00,2018,7,25.1,0.1,Drizzle
01/07/2018,13:00,40.707783,-73.932076,BROOKLYN,1.0,0.0,0,0,0,0,1,0,3824909,2018-01-07 13:00:00,2018-01-07T13:00,2018,1,-13.7,0.0,Clear
04/15/2018,21:00,40.62709,-73.94403,BROOKLYN,0.0,0.0,0,0,0,0,0,0,3881938,2018-04-15 21:00:00,2018-04-15T21:00,2018,4,3.4,1.6,Light Rain
08/26/2018,21:00,40.610077,-74.00732,BROOKLYN,0.0,0.0,0,0,0,0,0,0,3968586,2018-08-26 21:00:00,2018-08-26T21:00,2018,8,24.5,0.0,Clear
06/08/2018,18:00,40.629936,-73.957214,BROOKLYN,1.0,0.0,0,0,1,0,0,0,3916921,2018-06-08 18:00:00,2018-06-08T18:00,2018,6,21.6,0.0,Cloudy
06/01/2018,0:00,40.68251,-73.976326,BROOKLYN,0.0,0.0,0,0,0,0,0,0,3913403,2018-06-01 00:00:00,2018-06-01T00:00,2018,6,17.1,0.0,Cloudy
10/07/2018,14:00,40.607635,-73.92159,BROOKLYN,0.0,0.0,0,0,0,0,0,0,3995949,2018-10-07 14:00:00,2018-10-07T14:00,2018,10,25.6,0.0,Cloudy
03/01/2018,12:00,40.68902,-73.98617,BROOKLYN,1.0,0.0,1,0,0,0,0,0,3854656,2018-03-01 12:00:00,2018-03-01T12:00,2018,3,14.7,0.0,Cloudy
07/01/2018,15:00,40.67229,-73.913124,BROOKLYN,1.0,0.0,0,0,0,0,1,0,3933748,2018-07-01 15:00:00,2018-07-01T15:00,2018,7,30.9,0.0,Cloudy
09/22/2018,6:00,40.644337,-74.00754,BROOKLYN,1.0,0.0,1,0,0,0,0,0,3987076,2018-09-22 06:00:00,2018-09-22T06:00,2018,9,21.3,0.0,Cloudy
08/14/2018,23:00,40.62132,-73.969925,BROOKLYN,4.0,0.0,0,0,0,0,4,0,3962731,2018-08-14 23:00:00,2018-08-14T23:00,2018,8,22.1,0.0,Cloudy
04/29/2018,15:00,40.6545,-73.88222,BROOKLYN,4.0,0.0,0,0,0,0,4,0,3890495,2018-04-29 15:00:00,2018-04-29T15:00,2018,4,14.2,0.0,Cloudy
01/11/2018,17:00,40.639847,-73.91055,BROOKLYN,1.0,0.0,1,0,0,0,0,0,3828829,2018-01-11 17:00:00,2018-01-11T17:00,2018,1,7.7,0.0,Cloudy
03/09/2018,10:00,40.674652,-73.87712,BROOKLYN,1.0,0.0,1,0,0,0,0,0,3861569,2018-03-09 10:00:00,2018-03-09T10:00,2018,3,2.4,0.1,Light Snow
08/29/2018,16:00,40.63931,-73.98565,BROOKLYN,1.0,0.0,0,0,0,0,1,0,3970909,2018-08-29 16:00:00,2018-08-29T16:00,2018,8,32.8,0.0,Clear
10/27/2018,8:00,40.706512,-73.9309,BROOKLYN,1.0,0.0,0,0,1,0,0,0,4009551,2018-10-27 08:00:00,2018-10-27T08:00,2018,10,8.4,6.0,Heavy Rain
10/05/2018,23:00,40.64409,-73.95657,BROOKLYN,2.0,0.0,0,0,0,0,2,0,3994873,2018-10-05 23:00:00,2018-10-05T23:00,2018,10,17.9,0.0,Cloudy
10/09/2018,8:00,40.669003,-73.91839,BROOKLYN,0.0,0.0,0,0,0,0,0,0,4000347,2018-10-09 08:00:00,2018-10-09T08:00,2018,10,21.7,0.1,Drizzle
08/30/2018,18:00,40.62875,-73.95111,BROOKLYN,0.0,0.0,0,0,0,0,0,0,3971346,2018-08-30 18:00:00,2018-08-30T18:00,2018,8,29.1,0.0,Cloudy
07/11/2018,0:00,40.65136,-73.86971,BROOKLYN,1.0,0.0,0,0,0,0,1,0,3939926,2018-07-11 00:00:00,2018-07-11T00:00,2018,7,23.0,1.0,Drizzle
06/09/2018,15:00,40.639446,-74.02696,BROOKLYN,0.0,0.0,0,0,0,0,0,0,3919986,2018-06-09 15:00:00,2018-06-09T15:00,2018,6,26.3,0.0,Cloudy
07/09/2018,0:00,40.683037,-73.96478,BROOKLYN,1.0,0.0,1,0,0,0,0,0,3937782,2018-07-09 00:00:00,2018-07-09T00:00,2018,7,19.1,0.0,Clear
12/20/2018,19:00,40.6599,-73.916046,BROOKLYN,1.0,0.0,0,0,0,0,1,0,4050055,2018-12-20 19:00:00,2018-12-20T19:00,2018,12,7.1,1.1,Drizzle
06/28/2018,20:00,40.683464,-73.97569,BROOKLYN,1.0,0.0,0,0,1,0,0,0,3930752,2018-06-28 20:00:00,2018-06-28T20:00,2018,6,23.1,0.1,Drizzle
04/11/2018,13:00,40.629986,-73.97157,BROOKLYN,1.0,0.0,0,0,0,0,1,0,3879425,2018-04-11 13:00:00,2018-04-11T13:00,2018,4,7.6,0.0,Cloudy
04/14/2018,19:00,40.62748,-73.939156,BROOKLYN,1.0,0.0,0,0,0,0,1,0,3881941,2018-04-14 19:00:00,2018-04-14T19:00,2018,4,9.4,0.0,Cloudy
06/11/2018,18:00,40.64291,-74.01426,BROOKLYN,0.0,0.0,0,0,0,0,0,0,3918702,2018-06-11 18:00:00,2018-06-11T18:00,2018,6,17.0,0.0,Clear
01/21/2018,15:00,40.635395,-73.90904,BROOKLYN,0.0,0.0,0,0,0,0,0,0,3832783,2018-01-21 15:00:00,2018-01-21T15:00,2018,1,9.8,0.0,Cloudy
11/21/2018,18:00,40.68389,-73.93823,BROOKLYN,2.0,0.0,0,0,0,0,2,0,4030685,2018-11-21 18:00:00,2018-11-21T18:00,2018,11,5.0,0.0,Cloudy
02/22/2018,12:00,40.709946,-73.955505,BROOKLYN,2.0,0.0,0,0,0,0,2,0,3853075,2018-02-22 12:00:00,2018-02-22T12:00,2018,2,6.7,0.0,Cloudy
12/21/2018,8:00,40.67165,-73.906364,BROOKLYN,1.0,0.0,1,0,0,0,0,0,4049686,2018-12-21 08:00:00,2018-12-21T08:00,2018,12,14.1,1.2,Drizzle
12/10/2018,12:00,40.685818,-73.97533,BROOKLYN,0.0,0.0,0,0,0,0,0,0,4041904,2018-12-10 12:00:00,2018-12-10T12:00,2018,12,2.6,0.0,Clear
02/12/2018,9:00,40.69925,-73.973206,BROOKLYN,1.0,0.0,0,0,1,0,0,0,3845367,2018-02-12 09:00:00,2018-02-12T09:00,2018,2,5.0,0.0,Cloudy
06/15/2018,20:00,40.638603,-73.94827,BROOKLYN,1.0,0.0,0,0,1,0,0,0,3924889,2018-06-15 20:00:00,2018-06-15T20:00,2018,6,17.4,0.0,Clear
06/29/2018,20:00,40.685184,-73.920456,BROOKLYN,3.0,0.0,0,0,0,0,3,0,3934513,2018-06-29 20:00:00,2018-06-29T20:00,2018,6,25.3,0.0,Cloudy
01/22/2018,0:00,40.647728,-73.97634,BROOKLYN,1.0,0.0,0,0,0,0,1,0,3833917,2018-01-22 00:00:00,2018-01-22T00:00,2018,1,6.2,0.0,Cloudy
03/17/2018,7:00,40.66255,-73.90893,BROOKLYN,1.0,0.0,0,0,0,0,1,0,3864558,2018-03-17 07:00:00,2018-03-17T07:00,2018,3,-2.3,0.0,Clear
12/06/2018,17:00,40.579185,-73.96401,BROOKLYN,1.0,0.0,1,0,0,0,0,0,4040057,2018-12-06 17:00:00,2018-12-06T17:00,2018,12,3.2,0.0,Cloudy
01/18/2018,16:00,40.662075,-73.92652,BROOKLYN,1.0,0.0,0,0,0,0,1,0,3832866,2018-01-18 16:00:00,2018-01-18T16:00,2018,1,-0.2,0.0,Clear
02/02/2018,0:00,40.663353,-73.87464,BROOKLYN,3.0,0.0,0,0,0,0,3,0,3841420,2018-02-02 00:00:00,2018-02-02T00:00,2018,2,2.7,1.1,Drizzle
12/19/2018,20:00,40.656033,-73.96088,BROOKLYN,0.0,0.0,0,0,0,0,0,0,4052126,2018-12-19 20:00:00,2018-12-19T20:00,2018,12,1.9,0.0,Clear
12/11/2018,19:00,40.632248,-73.951775,BROOKLYN,1.0,0.0,0,0,1,0,0,0,4044035,2018-12-11 19:00:00,2018-12-11T19:00,2018,12,2.1,0.0,Clear
02/10/2018,23:00,40.63143,-73.95548,BROOKLYN,1.0,0.0,0,0,0,0,1,0,3843821,2018-02-10 23:00:00,2018-02-10T23:00,2018,2,9.4,0.7,Drizzle
07/29/2018,15:00,40.62884,-73.943474,BROOKLYN,0.0,0.0,0,0,0,0,0,0,3950222,2018-07-29 15:00:00,2018-07-29T15:00,2018,7,26.1,0.0,Cloudy
04/13/2018,7:00,40.61232,-73.93172,BROOKLYN,0.0,0.0,0,0,0,0,0,0,3886910,2018-04-13 07:00:00,2018-04-13T07:00,2018,4,13.8,0.3,Drizzle
05/19/2018,22:00,40.714397,-73.965515,BROOKLYN,0.0,0.0,0,0,0,0,0,0,3904434,2018-05-19 22:00:00,2018-05-19T22:00,2018,5,14.5,0.3,Drizzle
10/05/2018,8:00,40.631706,-73.94649,BROOKLYN,1.0,0.0,1,0,0,0,0,0,3994442,2018-10-05 08:00:00,2018-10-05T08:00,2018,10,15.9,0.0,Cloudy
07/07/2018,14:00,40.651936,-73.9294,BROOKLYN,0.0,0.0,0,0,0,0,0,0,3937509,2018-07-07 14:00:00,2018-07-07T14:00,2018,7,23.4,0.0,Clear
03/23/2018,0:00,40.659416,-73.88264,BROOKLYN,0.0,0.0,0,0,0,0,0,0,3870310,2018-03-23 00:00:00,2018-03-23T00:00,2018,3,0.1,0.0,Cloudy
12/14/2018,18:00,40.672855,-73.87131,BROOKLYN,1.0,0.0,1,0,0,0,0,0,4044887,2018-12-14 18:00:00,2018-12-14T18:00,2018,12,8.2,0.1,Drizzle
07/26/2018,18:00,40.671032,-73.93927,BROOKLYN,1.0,0.0,0,0,0,0,1,0,3949132,2018-07-26 18:00:00,2018-07-26T18:00,2018,7,25.6,0.0,Clear
10/04/2018,10:00,40.71407,-73.954346,BROOKLYN,1.0,0.0,0,0,0,0,1,0,4010408,2018-10-04 10:00:00,2018-10-04T10:00,2018,10,22.0,0.0,Cloudy
02/26/2018,11:00,40.585632,-73.93328,BROOKLYN,0.0,0.0,0,0,0,0,0,0,3852858,2018-02-26 11:00:00,2018-02-26T11:00,2018,2,7.8,0.0,Cloudy
08/02/2018,19:00,40.67046,-73.88788,BROOKLYN,3.0,0.0,0,0,0,0,3,0,3954210,2018-08-02 19:00:00,2018-08-02T19:00,2018,8,25.8,0.1,Drizzle
12/18/2018,15:00,40.62427,-73.99255,BROOKLYN,1.0,0.0,0,0,0,0,1,0,4047703,2018-12-18 15:00:00,2018-12-18T15:00,2018,12,1.7,0.0,Clear
05/05/2018,13:00,40.698124,-73.9623,BROOKLYN,0.0,0.0,0,0,0,0,0,0,3894425,2018-05-05 13:00:00,2018-05-05T13:00,2018,5,20.9,0.0,Cloudy
07/14/2018,12:00,40.68405,-73.97746,BROOKLYN,0.0,0.0,0,0,0,0,0,0,3941243,2018-07-14 12:00:00,2018-07-14T12:00,2018,7,29.2,0.0,Clear
05/23/2018,8:00,40.68175,-73.96748,BROOKLYN,1.0,0.0,0,0,0,0,1,0,3906683,2018-05-23 08:00:00,2018-05-23T08:00,2018,5,18.9,0.0,Cloudy
02/19/2018,21:00,40.643456,-73.972725,BROOKLYN,0.0,0.0,0,0,0,0,0,0,3849944,2018-02-19 21:00:00,2018-02-19T21:00,2018,2,8.3,0.2,Drizzle
10/01/2018,19:00,40.718372,-73.96463,BROOKLYN,0.0,0.0,0,0,0,0,0,0,3991789,2018-10-01 19:00:00,2018-10-01T19:00,2018,10,20.1,0.0,Clear
10/25/2018,13:00,40.67619,-73.9081,BROOKLYN,0.0,0.0,0,0,0,0,0,0,4010133,2018-10-25 13:00:00,2018-10-25T13:00,2018,10,10.7,0.0,Clear
02/12/2018,0:00,40.573708,-73.99072,BROOKLYN,0.0,0.0,0,0,0,0,0,0,3847012,2018-02-12 00:00:00,2018-02-12T00:00,2018,2,15.3,0.2,Drizzle
04/28/2018,18:00,40.627728,-74.01358,BROOKLYN,4.0,0.0,0,0,0,0,4,0,3890311,2018-04-28 18:00:00,2018-04-28T18:00,2018,4,8.9,0.0,Cloudy
08/03/2018,15:00,40.61137,-73.94979,BROOKLYN,1.0,0.0,0,0,0,0,1,0,3955194,2018-08-03 15:00:00,2018-08-03T15:00,2018,8,27.7,0.1,Drizzle
03/06/2018,7:00,40.636433,-73.9515,BROOKLYN,1.0,0.0,0,0,0,0,1,0,3857941,2018-03-06 07:00:00,2018-03-06T07:00,2018,3,-0.6,0.0,Clear
05/30/2018,15:00,40.688904,-73.980934,BROOKLYN,1.0,0.0,0,0,0,0,1,0,3911079,2018-05-30 15:00:00,2018-05-30T15:00,2018,5,19.2,0.0,Cloudy
07/11/2018,15:00,40.636593,-73.89418,BROOKLYN,1.0,0.0,0,0,0,0,1,0,3940592,2018-07-11 15:00:00,2018-07-11T15:00,2018,7,27.7,0.7,Drizzle
09/17/2018,8:00,40.610405,-73.94574,BROOKLYN,2.0,0.0,0,0,0,0,2,0,3982467,2018-09-17 08:00:00,2018-09-17T08:00,2018,9,22.3,0.1,Drizzle
01/05/2018,18:00,40.657932,-73.93104,BROOKLYN,2.0,0.0,0,0,0,0,2,0,3823086,2018-01-05 18:00:00,2018-01-05T18:00,2018,1,-11.5,0.0,Clear
10/30/2018,16:00,40.61628,-73.95356,BROOKLYN,1.0,0.0,1,0,0,0,0,0,4017912,2018-10-30 16:00:00,2018-10-30T16:00,2018,10,12.1,0.0,Clear
11/15/2018,18:00,40.693226,-73.96785,BROOKLYN,1.0,0.0,1,0,0,0,0,0,4021604,2018-11-15 18:00:00,2018-11-15T18:00,2018,11,1.0,3.2,Heavy Snow
01/30/2018,17:00,40.66895,-73.9339,BROOKLYN,1.0,0.0,0,0,0,0,1,0,3837893,2018-01-30 17:00:00,2018-01-30T17:00,2018,1,0.3,0.0,Cloudy
09/07/2018,8:00,40.609333,-73.948425,BROOKLYN,1.0,0.0,1,0,0,0,0,0,3975839,2018-09-07 08:00:00,2018-09-07T08:00,2018,9,24.6,0.2,Drizzle
11/01/2018,13:00,40.727516,-73.94439,BROOKLYN,0.0,0.0,0,0,0,0,0,0,4012622,2018-11-01 13:00:00,2018-11-01T13:00,2018,11,18.3,0.0,Cloudy
10/20/2018,8:00,40.68438,-73.94702,BROOKLYN,1.0,0.0,0,0,0,0,1,0,4005054,2018-10-20 08:00:00,2018-10-20T08:00,2018,10,12.9,0.1,Drizzle
08/13/2018,16:00,40.682957,-73.99788,BROOKLYN,0.0,0.0,0,0,0,0,0,0,3961988,2018-08-13 16:00:00,2018-08-13T16:00,2018,8,24.8,1.0,Drizzle
12/26/2018,14:00,40.58655,-73.96617,BROOKLYN,1.0,0.0,0,0,0,0,1,0,4053478,2018-12-26 14:00:00,2018-12-26T14:00,2018,12,5.8,0.0,Cloudy
12/29/2018,19:00,40.634083,-73.915474,BROOKLYN,0.0,0.0,0,0,0,0,0,0,4056048,2018-12-29 19:00:00,2018-12-29T19:00,2018,12,4.9,0.0,Clear
09/09/2018,20:00,40.621216,-73.93539,BROOKLYN,2.0,0.0,0,0,0,0,2,0,3977818,2018-09-09 20:00:00,2018-09-09T20:00,2018,9,15.0,0.9,Drizzle
05/11/2018,9:00,40.70191,-73.93699,BROOKLYN,0.0,0.0,0,0,0,0,0,0,3898616,2018-05-11 09:00:00,2018-05-11T09:00,2018,5,18.3,0.0,Clear
03/20/2018,4:00,40.658577,-73.89063,BROOKLYN,3.0,0.0,0,0,0,0,3,0,3866369,2018-03-20 04:00:00,2018-03-20T04:00,2018,3,-3.0,0.0,Cloudy
01/11/2018,21:00,40.615795,-73.93937,BROOKLYN,4.0,0.0,0,0,0,0,4,0,3833387,2018-01-11 21:00:00,2018-01-11T21:00,2018,1,7.7,0.0,Cloudy
11/10/2018,18:00,40.71022,-73.951004,BROOKLYN,1.0,0.0,0,0,1,0,0,0,4018678,2018-11-10 18:00:00,2018-11-10T18:00,2018,11,3.3,0.0,Clear
04/28/2018,19:00,40.71148,-73.9456,BROOKLYN,2.0,0.0,0,0,0,0,2,0,3889761,2018-04-28 19:00:00,2018-04-28T19:00,2018,4,9.9,0.0,Cloudy
06/19/2018,13:00,40.708836,-73.92252,BROOKLYN,1.0,0.0,0,0,0,0,1,0,3924484,2018-06-19 13:00:00,2018-06-19T13:00,2018,6,30.4,0.0,Cloudy
10/21/2018,16:00,40.714,-73.9256,BROOKLYN,0.0,0.0,0,0,0,0,0,0,4007147,2018-10-21 16:00:00,2018-10-21T16:00,2018,10,7.1,0.0,Clear
02/15/2018,23:00,40.635258,-73.92745,BROOKLYN,1.0,0.0,0,0,0,0,1,0,3859269,2018-02-15 23:00:00,2018-02-15T23:00,2018,2,11.6,2.5,Heavy Rain
12/17/2018,21:00,40.66931,-73.97957,BROOKLYN,1.0,0.0,1,0,0,0,0,0,4046969,2018-12-17 21:00:00,2018-12-17T21:00,2018,12,4.3,0.0,Clear
04/15/2018,5:00,40.674603,-73.891754,BROOKLYN,0.0,0.0,0,0,0,0,0,0,3894594,2018-04-15 05:00:00,2018-04-15T05:00,2018,4,5.5,0.0,Cloudy
07/04/2018,16:00,40.66739,-73.872345,BROOKLYN,1.0,0.0,0,0,0,0,1,0,3935257,2018-07-04 16:00:00,2018-07-04T16:00,2018,7,25.8,0.0,Cloudy
03/22/2018,8:00,40.714092,-73.94899,BROOKLYN,1.0,0.0,1,0,0,0,0,0,3867561,2018-03-22 08:00:00,2018-03-22T08:00,2018,3,1.4,0.0,Cloudy
08/20/2018,9:00,40.623714,-73.99314,BROOKLYN,7.0,0.0,1,0,0,0,6,0,3965083,2018-08-20 09:00:00,2018-08-20T09:00,2018,8,21.2,0.2,Drizzle
04/22/2018,5:00,40.642735,-73.89966,BROOKLYN,1.0,0.0,0,0,0,0,1,0,3885627,2018-04-22 05:00:00,2018-04-22T05:00,2018,4,2.4,0.0,Clear
07/14/2018,13:00,40.68459,-73.92557,BROOKLYN,0.0,0.0,0,0,0,0,0,0,3940699,2018-07-14 13:00:00,2018-07-14T13:00,2018,7,28.1,0.0,Cloudy
10/16/2018,8:00,40.678192,-73.890526,BROOKLYN,1.0,0.0,1,0,0,0,0,0,4020741,2018-10-16 08:00:00,2018-10-16T08:00,2018,10,8.8,0.0,Cloudy
07/10/2018,0:00,40.729256,-73.94605,BROOKLYN,0.0,0.0,0,0,0,0,0,0,3938235,2018-07-10 00:00:00,2018-07-10T00:00,2018,7,21.4,0.0,Clear
05/15/2018,8:00,40.6446,-74.02161,BROOKLYN,0.0,0.0,0,0,0,0,0,0,3902057,2018-05-15 08:00:00,2018-05-15T08:00,2018,5,18.8,0.1,Drizzle
01/04/2018,14:00,40.62751,-73.99635,BROOKLYN,1.0,0.0,0,0,0,0,1,0,3822546,2018-01-04 14:00:00,2018-01-04T14:00,2018,1,-3.9,1.4,Heavy Snow
05/20/2018,5:00,40.65301,-73.92858,BROOKLYN,0.0,0.0,0,0,0,0,0,0,3904015,2018-05-20 05:00:00,2018-05-20T05:00,2018,5,19.4,0.1,Drizzle
09/06/2018,21:00,40.654358,-73.91916,BROOKLYN,1.0,0.0,0,0,0,0,1,0,3978633,2018-09-06 21:00:00,2018-09-06T21:00,2018,9,24.7,0.0,Clear
08/01/2018,16:00,40.60933,-73.98614,BROOKLYN,0.0,0.0,0,0,0,0,0,0,3954104,2018-08-01 16:00:00,2018-08-01T16:00,2018,8,27.6,0.1,Drizzle
03/27/2018,17:00,40.678978,-73.98501,BROOKLYN,2.0,0.0,0,0,0,0,2,0,3872582,2018-03-27 17:00:00,2018-03-27T17:00,2018,3,3.3,0.0,Cloudy
06/16/2018,22:00,40.648922,-73.94938,BROOKLYN,1.0,0.0,0,0,1,0,0,0,3922490,2018-06-16 22:00:00,2018-06-16T22:00,2018,6,19.4,0.0,Cloudy
05/27/2018,15:00,40.672825,-73.93908,BROOKLYN,1.0,0.0,0,0,0,0,1,0,3910703,2018-05-27 15:00:00,2018-05-27T15:00,2018,5,14.8,0.0,Cloudy
06/30/2018,16:00,40.61806,-74.03147,BROOKLYN,1.0,0.0,1,0,0,0,0,0,3932966,2018-06-30 16:00:00,2018-06-30T16:00,2018,6,28.3,0.0,Clear
07/27/2018,22:00,40.717785,-73.94321,BROOKLYN,1.0,0.0,1,0,0,0,0,0,3949992,2018-07-27 22:00:00,2018-07-27T22:00,2018,7,23.6,0.7,Drizzle
06/16/2018,17:00,40.65417,-73.89595,BROOKLYN,1.0,0.0,0,0,0,0,1,0,3923459,2018-06-16 17:00:00,2018-06-16T17:00,2018,6,23.2,0.0,Cloudy
06/15/2018,13:00,40.651733,-73.93039,BROOKLYN,1.0,0.0,1,0,0,0,0,0,3922504,2018-06-15 13:00:00,2018-06-15T13:00,2018,6,23.1,0.0,Cloudy
05/15/2018,1:00,40.69001,-73.9832,BROOKLYN,0.0,0.0,0,0,0,0,0,0,3901210,2018-05-15 01:00:00,2018-05-15T01:00,2018,5,16.2,0.0,Cloudy
02/17/2018,10:00,40.69343,-73.96591,BROOKLYN,0.0,0.0,0,0,0,0,0,0,3847966,2018-02-17 10:00:00,2018-02-17T10:00,2018,2,1.4,0.0,Cloudy
04/05/2018,17:00,40.68238,-73.90565,BROOKLYN,0.0,0.0,0,0,0,0,0,0,3877191,2018-04-05 17:00:00,2018-04-05T17:00,2018,4,5.9,0.0,Cloudy
09/07/2018,9:00,40.642372,-73.957466,BROOKLYN,1.0,0.0,1,0,0,0,0,0,3976277,2018-09-07 09:00:00,2018-09-07T09:00,2018,9,24.7,0.1,Drizzle
07/01/2018,23:00,40.578312,-73.96808,BROOKLYN,0.0,0.0,0,0,0,0,0,0,3932432,2018-07-01 23:00:00,2018-07-01T23:00,2018,7,25.5,0.0,Clear
02/13/2018,7:00,40.65249,-73.95267,BROOKLYN,0.0,0.0,0,0,0,0,0,0,3847117,2018-02-13 07:00:00,2018-02-13T07:00,2018,2,-4.3,0.0,Clear
06/15/2018,8:00,40.64891,-73.89256,BROOKLYN,2.0,0.0,0,0,0,0,2,0,3922565,2018-06-15 08:00:00,2018-06-15T08:00,2018,6,19.2,0.0,Clear
02/03/2018,18:00,40.658985,-73.93961,BROOKLYN,1.0,0.0,0,0,0,0,1,0,3840932,2018-02-03 18:00:00,2018-02-03T18:00,2018,2,-1.7,0.0,Clear
06/29/2018,16:00,40.60424,-73.95033,BROOKLYN,1.0,0.0,0,0,1,0,0,0,3932103,2018-06-29 16:00:00,2018-06-29T16:00,2018,6,28.6,0.0,Clear
11/27/2018,9:00,40.60358,-73.95636,BROOKLYN,1.0,0.0,0,0,0,0,1,0,4033630,2018-11-27 09:00:00,2018-11-27T09:00,2018,11,5.4,0.0,Cloudy
07/19/2018,0:00,40.701412,-73.91132,BROOKLYN,1.0,0.0,1,0,0,0,0,0,3944211,2018-07-19 00:00:00,2018-07-19T00:00,2018,7,20.4,0.0,Clear
06/21/2018,11:00,40.642864,-74.01266,BROOKLYN,1.0,0.0,0,0,0,0,1,0,3926427,2018-06-21 11:00:00,2018-06-21T11:00,2018,6,23.1,0.0,Clear
09/26/2018,9:00,40.66994,-73.96184,BROOKLYN,0.0,0.0,0,0,0,0,0,0,3988236,2018-09-26 09:00:00,2018-09-26T09:00,2018,9,23.8,0.0,Cloudy
08/04/2018,20:00,40.65259,-73.950836,BROOKLYN,1.0,0.0,0,0,1,0,0,0,3955734,2018-08-04 20:00:00,2018-08-04T20:00,2018,8,26.0,0.0,Clear
05/12/2018,18:00,40.65121,-73.95893,BROOKLYN,0.0,0.0,0,0,0,0,0,0,3899437,2018-05-12 18:00:00,2018-05-12T18:00,2018,5,12.8,3.2,Heavy Rain
06/24/2018,13:00,40.616047,-73.93464,BROOKLYN,1.0,0.0,0,0,0,0,1,0,3928863,2018-06-24 13:00:00,2018-06-24T13:00,2018,6,22.9,0.0,Clear
02/13/2018,8:00,40.649895,-73.90762,BROOKLYN,1.0,0.0,0,0,0,0,1,0,3845622,2018-02-13 08:00:00,2018-02-13T08:00,2018,2,-3.2,0.0,Clear
04/30/2018,18:00,40.64275,-73.90378,BROOKLYN,4.0,0.0,0,0,0,0,4,0,3891297,2018-04-30 18:00:00,2018-04-30T18:00,2018,4,9.7,0.0,Cloudy
02/25/2018,14:00,40.65792,-73.90189,BROOKLYN,1.0,0.0,0,0,0,0,1,0,3852307,2018-02-25 14:00:00,2018-02-25T14:00,2018,2,7.4,0.1,Drizzle
02/25/2018,12:00,40.696957,-73.91707,BROOKLYN,0.0,0.0,0,0,0,0,0,0,3861870,2018-02-25 12:00:00,2018-02-25T12:00,2018,2,6.9,1.6,Light Rain
05/08/2018,0:00,40.683132,-73.88259,BROOKLYN,1.0,0.0,0,0,0,0,1,0,3895642,2018-05-08 00:00:00,2018-05-08T00:00,2018,5,10.5,0.0,Clear
06/27/2018,11:00,40.695232,-73.98326,BROOKLYN,0.0,0.0,0,0,0,0,0,0,3930077,2018-06-27 11:00:00,2018-06-27T11:00,2018,6,22.1,0.0,Cloudy
11/19/2018,15:00,40.588173,-73.95246,BROOKLYN,0.0,0.0,0,0,0,0,0,0,4030133,2018-11-19 15:00:00,2018-11-19T15:00,2018,11,10.3,0.0,Cloudy
04/21/2018,18:00,40.720318,-73.96173,BROOKLYN,1.0,0.0,1,0,0,0,0,0,3885722,2018-04-21 18:00:00,2018-04-21T18:00,2018,4,12.8,0.0,Cloudy
08/10/2018,23:00,40.689144,-73.99071,BROOKLYN,1.0,0.0,0,0,0,0,1,0,3958478,2018-08-10 23:00:00,2018-08-10T23:00,2018,8,23.7,2.1,Light Rain
04/19/2018,17:00,40.59168,-73.992584,BROOKLYN,1.0,0.0,0,0,0,0,1,0,3883972,2018-04-19 17:00:00,2018-04-19T17:00,2018,4,6.8,0.0,Cloudy
03/21/2018,18:00,40.68871,-73.95499,BROOKLYN,0.0,0.0,0,0,0,0,0,0,3867891,2018-03-21 18:00:00,2018-03-21T18:00,2018,3,0.8,2.1,Heavy Snow
09/18/2018,18:00,40.689674,-73.96614,BROOKLYN,1.0,0.0,0,0,1,0,0,0,3985231,2018-09-18 18:00:00,2018-09-18T18:00,2018,9,22.0,0.0,Cloudy
11/05/2018,19:00,40.63406,-73.946815,BROOKLYN,1.0,0.0,0,0,0,0,1,0,4014959,2018-11-05 19:00:00,2018-11-05T19:00,2018,11,10.4,0.5,Drizzle
05/06/2018,13:00,40.680473,-73.867134,BROOKLYN,0.0,0.0,0,0,0,0,0,0,3900031,2018-05-06 13:00:00,2018-05-06T13:00,2018,5,17.4,0.0,Cloudy
03/08/2018,18:00,40.615383,-74.01613,BROOKLYN,0.0,0.0,0,0,0,0,0,0,3859403,2018-03-08 18:00:00,2018-03-08T18:00,2018,3,2.6,0.0,Cloudy
08/25/2018,19:00,40.63739,-73.91038,BROOKLYN,4.0,0.0,0,0,0,0,4,0,3967689,2018-08-25 19:00:00,2018-08-25T19:00,2018,8,21.3,0.0,Cloudy
08/29/2018,14:00,40.693142,-73.9185,BROOKLYN,0.0,0.0,0,0,0,0,0,0,3970618,2018-08-29 14:00:00,2018-08-29T14:00,2018,8,33.5,0.0,Clear
05/18/2018,6:00,40.611855,-73.99346,BROOKLYN,0.0,0.0,0,0,0,0,0,0,3903451,2018-05-18 06:00:00,2018-05-18T06:00,2018,5,16.1,0.0,Cloudy
02/16/2018,12:00,40.639076,-73.90337,BROOKLYN,0.0,0.0,0,0,0,0,0,0,3848770,2018-02-16 12:00:00,2018-02-16T12:00,2018,2,13.6,0.0,Cloudy
02/07/2018,20:00,40.64531,-73.94608,BROOKLYN,1.0,0.0,1,0,0,0,0,0,3843433,2018-02-07 20:00:00,2018-02-07T20:00,2018,2,4.5,1.2,Drizzle
08/13/2018,16:00,40.70955,-73.95887,BROOKLYN,1.0,0.0,0,0,0,0,1,0,3960821,2018-08-13 16:00:00,2018-08-13T16:00,2018,8,24.9,0.6,Drizzle
01/29/2018,13:00,40.64423,-74.014915,BROOKLYN,0.0,0.0,0,0,0,0,0,0,3837310,2018-01-29 13:00:00,2018-01-29T13:00,2018,1,6.7,0.0,Cloudy
12/03/2018,16:00,40.693783,-73.987206,BROOKLYN,0.0,0.0,0,0,0,0,0,0,4037481,2018-12-03 16:00:00,2018-12-03T16:00,2018,12,9.5,0.0,Cloudy
07/21/2018,20:00,40.653976,-73.952835,BROOKLYN,0.0,0.0,0,0,0,0,0,0,3946403,2018-07-21 20:00:00,2018-07-21T20:00,2018,7,18.9,2.5,Heavy Rain
02/22/2018,13:00,40.676147,-73.98391,BROOKLYN,0.0,0.0,0,0,0,0,0,0,3850595,2018-02-22 13:00:00,2018-02-22T13:00,2018,2,6.3,0.2,Drizzle
07/05/2018,13:00,40.655132,-73.916336,BROOKLYN,0.0,0.0,0,0,0,0,0,0,3937455,2018-07-05 13:00:00,2018-07-05T13:00,2018,7,27.9,0.0,Clear
07/21/2018,22:00,40.687885,-73.96221,BROOKLYN,1.0,0.0,0,0,1,0,0,0,3945666,2018-07-21 22:00:00,2018-07-21T22:00,2018,7,20.8,2.1,Light Rain
11/09/2018,7:00,40.6743,-73.91114,BROOKLYN,0.0,0.0,0,0,0,0,0,0,4026535,2018-11-09 07:00:00,2018-11-09T07:00,2018,11,4.7,0.0,Clear
06/26/2018,11:00,40.696033,-73.98453,BROOKLYN,1.0,0.0,0,0,0,0,1,0,3929590,2018-06-26 11:00:00,2018-06-26T11:00,2018,6,21.8,0.0,Clear
03/09/2018,15:00,40.588223,-73.97168,BROOKLYN,0.0,0.0,0,0,0,0,0,0,3859653,2018-03-09 15:00:00,2018-03-09T15:00,2018,3,4.9,0.0,Cloudy
02/18/2018,3:00,40.69101,-73.95462,BROOKLYN,0.0,0.0,0,0,0,0,0,0,3850911,2018-02-18 03:00:00,2018-02-18T03:00,2018,2,0.6,0.0,Cloudy
10/07/2018,20:00,40.609776,-73.9643,BROOKLYN,1.0,0.0,0,0,1,0,0,0,3995499,2018-10-07 20:00:00,2018-10-07T20:00,2018,10,21.9,0.0,Clear
10/27/2018,0:00,40.692818,-73.915924,BROOKLYN,1.0,0.0,0,0,0,0,1,0,4009460,2018-10-27 00:00:00,2018-10-27T00:00,2018,10,7.3,1.1,Drizzle
04/23/2018,6:00,40.66919,-73.99682,BROOKLYN,1.0,0.0,0,0,0,0,1,0,3886815,2018-04-23 06:00:00,2018-04-23T06:00,2018,4,4.9,0.0,Clear
05/13/2018,21:00,40.644245,-73.89103,BROOKLYN,2.0,0.0,0,0,0,0,2,0,3899781,2018-05-13 21:00:00,2018-05-13T21:00,2018,5,11.1,1.9,Light Rain
11/14/2018,15:00,40.696686,-73.9378,BROOKLYN,1.0,0.0,1,0,0,0,0,0,4021034,2018-11-14 15:00:00,2018-11-14T15:00,2018,11,3.5,0.0,Cloudy
08/30/2018,13:00,40.644985,-74.01769,BROOKLYN,3.0,0.0,0,0,0,0,3,0,3970986,2018-08-30 13:00:00,2018-08-30T13:00,2018,8,31.1,0.1,Drizzle
08/08/2018,15:00,40.668377,-73.92012,BROOKLYN,1.0,0.0,1,0,0,0,0,0,3957574,2018-08-08 15:00:00,2018-08-08T15:00,2018,8,27.9,0.0,Cloudy
10/06/2018,7:00,40.695393,-73.93586,BROOKLYN,0.0,0.0,0,0,0,0,0,0,3994926,2018-10-06 07:00:00,2018-10-06T07:00,2018,10,17.9,0.0,Cloudy
05/10/2018,19:00,40.65422,-73.92386,BROOKLYN,1.0,0.0,0,0,0,0,1,0,3899737,2018-05-10 19:00:00,2018-05-10T19:00,2018,5,14.7,0.0,Cloudy
04/12/2018,23:00,40.66845,-73.99354,BROOKLYN,1.0,0.0,0,0,0,0,1,0,3879614,2018-04-12 23:00:00,2018-04-12T23:00,2018,4,14.2,0.0,Clear
02/03/2018,20:00,40.682415,-73.97065,BROOKLYN,1.0,0.0,1,0,0,0,0,0,3842692,2018-02-03 20:00:00,2018-02-03T20:00,2018,2,-2.6,0.0,Cloudy
06/21/2018,0:00,40.66899,-73.99641,BROOKLYN,0.0,0.0,0,0,0,0,0,0,3926430,2018-06-21 00:00:00,2018-06-21T00:00,2018,6,20.9,4.6,Heavy Rain
05/08/2018,8:00,40.72521,-73.936844,BROOKLYN,0.0,0.0,0,0,0,0,0,0,3896640,2018-05-08 08:00:00,2018-05-08T08:00,2018,5,15.5,0.0,Clear
06/21/2018,17:00,40.650146,-73.97682,BROOKLYN,0.0,0.0,0,0,0,0,0,0,3926429,2018-06-21 17:00:00,2018-06-21T17:00,2018,6,24.7,0.0,Cloudy
04/02/2018,0:00,40.650654,-73.95296,BROOKLYN,0.0,0.0,0,0,0,0,0,0,3874420,2018-04-02 00:00:00,2018-04-02T00:00,2018,4,3.1,0.0,Cloudy
05/04/2018,21:00,40.62657,-74.01167,BROOKLYN,0.0,0.0,0,0,0,0,0,0,3894447,2018-05-04 21:00:00,2018-05-04T21:00,2018,5,23.5,0.0,Cloudy
12/19/2018,8:00,40.68992,-73.87261,BROOKLYN,1.0,0.0,0,0,0,0,1,0,4047910,2018-12-19 08:00:00,2018-12-19T08:00,2018,12,-3.2,0.0,Clear
03/31/2018,0:00,40.65362,-73.933525,BROOKLYN,1.0,0.0,1,0,0,0,0,0,3876123,2018-03-31 00:00:00,2018-03-31T00:00,2018,3,4.5,0.0,Clear
05/20/2018,19:00,40.644615,-73.962166,BROOKLYN,1.0,0.0,0,0,1,0,0,0,3905377,2018-05-20 19:00:00,2018-05-20T19:00,2018,5,21.2,0.0,Cloudy
04/26/2018,14:00,40.662914,-73.871086,BROOKLYN,1.0,0.0,1,0,0,0,0,0,3894613,2018-04-26 14:00:00,2018-04-26T14:00,2018,4,18.9,0.0,Clear
02/10/2018,0:00,40.604935,-73.96822,BROOKLYN,1.0,0.0,1,0,0,0,0,0,3844388,2018-02-10 00:00:00,2018-02-10T00:00,2018,2,3.9,0.0,Cloudy
09/27/2018,18:00,40.65731,-73.91194,BROOKLYN,1.0,0.0,0,0,1,0,0,0,3989107,2018-09-27 18:00:00,2018-09-27T18:00,2018,9,19.5,0.0,Cloudy
08/18/2018,14:00,40.69805,-73.94541,BROOKLYN,0.0,0.0,0,0,0,0,0,0,3965328,2018-08-18 14:00:00,2018-08-18T14:00,2018,8,28.0,0.2,Drizzle
06/04/2018,16:00,40.66931,-73.97957,BROOKLYN,1.0,0.0,0,0,0,0,1,0,3915247,2018-06-04 16:00:00,2018-06-04T16:00,2018,6,20.0,0.0,Cloudy
06/29/2018,13:00,40.8651,-73.92189,MANHATTAN,1.0,0.0,0,0,0,0,1,0,3932376,2018-06-29 13:00:00,2018-06-29T13:00,2018,6,30.6,0.0,Clear
05/03/2018,11:00,40.756714,-73.988556,MANHATTAN,1.0,0.0,0,0,0,0,1,0,3894655,2018-05-03 11:00:00,2018-05-03T11:00,2018,5,28.0,0.0,Cloudy
10/04/2018,9:00,40.757732,-73.99686,MANHATTAN,0.0,0.0,0,0,0,0,0,0,3997003,2018-10-04 09:00:00,2018-10-04T09:00,2018,10,20.5,0.0,Cloudy
03/28/2018,12:00,40.738487,-73.98996,MANHATTAN,0.0,0.0,0,0,0,0,0,0,3871840,2018-03-28 12:00:00,2018-03-28T12:00,2018,3,6.5,0.0,Cloudy
09/09/2018,8:00,40.823547,-73.95539,MANHATTAN,0.0,0.0,0,0,0,0,0,0,3976738,2018-09-09 08:00:00,2018-09-09T08:00,2018,9,14.3,0.6,Drizzle
11/27/2018,22:00,40.76986,-73.99243,MANHATTAN,0.0,0.0,0,0,0,0,0,0,4033952,2018-11-27 22:00:00,2018-11-27T22:00,2018,11,2.9,0.0,Cloudy
07/17/2018,7:00,40.791634,-73.96257,MANHATTAN,1.0,0.0,0,0,1,0,0,0,3944591,2018-07-17 07:00:00,2018-07-17T07:00,2018,7,25.9,0.0,Cloudy
09/08/2018,14:00,40.792362,-73.96418,MANHATTAN,0.0,0.0,0,0,0,0,0,0,3977455,2018-09-08 14:00:00,2018-09-08T14:00,2018,9,20.6,0.0,Cloudy
07/30/2018,14:00,40.7429,-73.99281,MANHATTAN,0.0,0.0,0,0,0,0,0,0,3952049,2018-07-30 14:00:00,2018-07-30T14:00,2018,7,25.3,0.0,Cloudy
02/02/2018,10:00,40.744442,-73.979065,MANHATTAN,0.0,0.0,0,0,0,0,0,0,3839779,2018-02-02 10:00:00,2018-02-02T10:00,2018,2,-2.7,0.0,Clear
11/30/2018,14:00,40.761814,-73.9939,MANHATTAN,1.0,0.0,0,0,1,0,0,0,4035658,2018-11-30 14:00:00,2018-11-30T14:00,2018,11,4.7,1.1,Heavy Snow
10/11/2018,16:00,40.831463,-73.935585,MANHATTAN,0.0,0.0,0,0,0,0,0,0,3998427,2018-10-11 16:00:00,2018-10-11T16:00,2018,10,24.1,0.4,Drizzle
05/29/2018,9:00,40.831566,-73.942986,MANHATTAN,1.0,0.0,0,0,1,0,0,0,3912361,2018-05-29 09:00:00,2018-05-29T09:00,2018,5,23.6,0.0,Cloudy
08/18/2018,12:00,40.74892,-73.9779,MANHATTAN,3.0,0.0,0,0,0,0,3,0,3966523,2018-08-18 12:00:00,2018-08-18T12:00,2018,8,28.7,0.0,Cloudy
01/26/2018,14:00,40.73988,-73.99872,MANHATTAN,0.0,0.0,0,0,0,0,0,0,3836490,2018-01-26 14:00:00,2018-01-26T14:00,2018,1,1.6,0.0,Clear
08/04/2018,14:00,40.764896,-73.97256,MANHATTAN,0.0,0.0,0,0,0,0,0,0,3956379,2018-08-04 14:00:00,2018-08-04T14:00,2018,8,28.7,0.0,Clear
02/19/2018,14:00,40.793377,-73.97086,MANHATTAN,1.0,0.0,1,0,0,0,0,0,3852601,2018-02-19 14:00:00,2018-02-19T14:00,2018,2,7.2,0.0,Cloudy
02/20/2018,14:00,40.747772,-73.985054,MANHATTAN,1.0,0.0,0,0,0,0,1,0,3850154,2018-02-20 14:00:00,2018-02-20T14:00,2018,2,17.3,0.0,Clear
04/26/2018,12:00,40.856503,-73.93277,MANHATTAN,1.0,0.0,0,0,0,0,1,0,3889086,2018-04-26 12:00:00,2018-04-26T12:00,2018,4,17.2,0.0,Clear
11/25/2018,0:00,40.81275,-73.94558,MANHATTAN,1.0,0.0,1,0,0,0,0,0,4032690,2018-11-25 00:00:00,2018-11-25T00:00,2018,11,8.1,6.5,Heavy Rain
01/25/2018,21:00,40.76479,-73.98429,MANHATTAN,1.0,0.0,0,0,1,0,0,0,3837140,2018-01-25 21:00:00,2018-01-25T21:00,2018,1,-4.4,0.0,Cloudy
02/08/2018,11:00,40.82451,-73.95186,MANHATTAN,1.0,0.0,1,0,0,0,0,0,3843126,2018-02-08 11:00:00,2018-02-08T11:00,2018,2,-0.9,0.0,Clear
01/16/2018,17:00,40.74197,-73.980865,MANHATTAN,0.0,0.0,0,0,0,0,0,0,3830424,2018-01-16 17:00:00,2018-01-16T17:00,2018,1,1.5,0.0,Cloudy
12/13/2018,14:00,40.741028,-73.99417,MANHATTAN,1.0,0.0,0,0,0,0,1,0,4043999,2018-12-13 14:00:00,2018-12-13T14:00,2018,12,4.5,0.0,Cloudy
05/10/2018,22:00,40.80988,-73.936745,MANHATTAN,1.0,0.0,1,0,0,0,0,0,3898823,2018-05-10 22:00:00,2018-05-10T22:00,2018,5,14.4,0.1,Drizzle
07/08/2018,16:00,40.719482,-73.991295,MANHATTAN,0.0,0.0,0,0,0,0,0,0,3938014,2018-07-08 16:00:00,2018-07-08T16:00,2018,7,25.0,0.0,Clear
12/14/2018,8:00,40.747627,-73.976746,MANHATTAN,1.0,0.0,0,0,0,0,1,0,4044510,2018-12-14 08:00:00,2018-12-14T08:00,2018,12,3.9,0.0,Cloudy
12/16/2018,16:00,40.804886,-73.96248,MANHATTAN,2.0,0.0,0,0,0,0,2,0,4046010,2018-12-16 16:00:00,2018-12-16T16:00,2018,12,4.0,0.2,Drizzle
08/28/2018,22:00,40.821106,-73.93575,MANHATTAN,3.0,0.0,0,0,0,0,3,0,3970472,2018-08-28 22:00:00,2018-08-28T22:00,2018,8,27.2,0.0,Clear
06/26/2018,18:00,40.717922,-73.9931,MANHATTAN,2.0,0.0,1,0,1,0,0,0,3930045,2018-06-26 18:00:00,2018-06-26T18:00,2018,6,21.2,0.0,Cloudy
03/13/2018,14:00,40.74044,-74.00203,MANHATTAN,1.0,0.0,1,0,0,0,0,0,3863474,2018-03-13 14:00:00,2018-03-13T14:00,2018,3,5.4,0.0,Cloudy
02/17/2018,20:00,40.762127,-73.99739,MANHATTAN,1.0,0.0,1,0,0,0,0,0,3848730,2018-02-17 20:00:00,2018-02-17T20:00,2018,2,0.8,2.4,Heavy Snow
09/12/2018,8:00,40.79157,-73.94469,MANHATTAN,0.0,0.0,0,0,0,0,0,0,3979194,2018-09-12 08:00:00,2018-09-12T08:00,2018,9,22.6,0.2,Drizzle
10/30/2018,21:00,40.72163,-73.99353,MANHATTAN,1.0,0.0,0,0,1,0,0,0,4011601,2018-10-30 21:00:00,2018-10-30T21:00,2018,10,6.1,0.0,Clear
10/27/2018,0:00,40.733265,-73.99981,MANHATTAN,1.0,0.0,0,0,0,0,1,0,4008672,2018-10-27 00:00:00,2018-10-27T00:00,2018,10,6.3,1.0,Drizzle
01/08/2018,15:00,40.85306,-73.931,MANHATTAN,0.0,0.0,0,0,0,0,0,0,3826831,2018-01-08 15:00:00,2018-01-08T15:00,2018,1,-2.2,0.0,Cloudy
11/01/2018,15:00,40.724136,-73.992615,MANHATTAN,1.0,0.0,0,0,0,0,1,0,4015226,2018-11-01 15:00:00,2018-11-01T15:00,2018,11,20.2,0.0,Cloudy
02/04/2018,2:00,40.780125,-73.95304,MANHATTAN,1.0,0.0,0,0,0,0,1,0,3840714,2018-02-04 02:00:00,2018-02-04T02:00,2018,2,-2.2,0.0,Cloudy
05/03/2018,15:00,40.783245,-73.94473,MANHATTAN,0.0,0.0,0,0,0,0,0,0,3893000,2018-05-03 15:00:00,2018-05-03T15:00,2018,5,30.1,0.0,Cloudy
01/07/2018,18:00,40.73447,-73.989944,MANHATTAN,0.0,0.0,0,0,0,0,0,0,3823638,2018-01-07 18:00:00,2018-01-07T18:00,2018,1,-11.5,0.0,Cloudy
02/06/2018,9:00,40.826263,-73.95213,MANHATTAN,0.0,0.0,0,0,0,0,0,0,3841620,2018-02-06 09:00:00,2018-02-06T09:00,2018,2,-2.5,0.1,Light Snow
07/03/2018,0:00,40.802395,-73.936775,MANHATTAN,1.0,0.0,1,0,0,0,0,0,3933161,2018-07-03 00:00:00,2018-07-03T00:00,2018,7,22.9,0.0,Clear
05/25/2018,17:00,40.74564,-73.993385,MANHATTAN,0.0,0.0,0,0,0,0,0,0,3908988,2018-05-25 17:00:00,2018-05-25T17:00,2018,5,28.1,0.0,Clear
09/29/2018,12:00,40.784473,-73.967224,MANHATTAN,1.0,0.0,1,0,0,0,0,0,3990170,2018-09-29 12:00:00,2018-09-29T12:00,2018,9,21.4,0.0,Clear
08/13/2018,12:00,40.714222,-73.994865,MANHATTAN,0.0,0.0,0,0,0,0,0,0,3961836,2018-08-13 12:00:00,2018-08-13T12:00,2018,8,22.3,1.6,Light Rain
11/02/2018,11:00,40.73883,-73.983154,MANHATTAN,1.0,0.0,1,0,0,0,0,0,4012758,2018-11-02 11:00:00,2018-11-02T11:00,2018,11,20.8,0.1,Drizzle
09/18/2018,14:00,40.80098,-73.93178,MANHATTAN,0.0,0.0,0,0,0,0,0,0,3984954,2018-09-18 14:00:00,2018-09-18T14:00,2018,9,22.3,2.4,Light Rain
12/28/2018,7:00,40.80897,-73.94833,MANHATTAN,1.0,0.0,1,0,0,0,0,0,4053476,2018-12-28 07:00:00,2018-12-28T07:00,2018,12,8.0,1.7,Light Rain
02/27/2018,19:00,40.75979,-73.98793,MANHATTAN,0.0,0.0,0,0,0,0,0,0,3853694,2018-02-27 19:00:00,2018-02-27T19:00,2018,2,5.5,0.0,Clear
08/24/2018,9:00,40.791084,-73.953445,MANHATTAN,1.0,0.0,0,0,0,0,1,0,3967799,2018-08-24 09:00:00,2018-08-24T09:00,2018,8,22.8,0.0,Clear
08/03/2018,13:00,40.755867,-73.998215,MANHATTAN,0.0,0.0,0,0,0,0,0,0,3956320,2018-08-03 13:00:00,2018-08-03T13:00,2018,8,26.4,0.4,Drizzle
07/09/2018,16:00,40.810173,-73.95117,MANHATTAN,1.0,0.0,0,0,1,0,0,0,3938627,2018-07-09 16:00:00,2018-07-09T16:00,2018,7,27.5,0.0,Clear
05/09/2018,19:00,40.86177,-73.91848,MANHATTAN,2.0,0.0,0,0,0,0,2,0,3898011,2018-05-09 19:00:00,2018-05-09T19:00,2018,5,15.5,0.0,Cloudy
11/04/2018,16:00,40.782627,-73.97499,MANHATTAN,1.0,0.0,1,0,0,0,0,0,4019020,2018-11-04 16:00:00,2018-11-04T16:00,2018,11,11.0,0.0,Cloudy
12/27/2018,11:00,40.759514,-73.99926,MANHATTAN,0.0,0.0,0,0,0,0,0,0,4053547,2018-12-27 11:00:00,2018-12-27T11:00,2018,12,3.6,0.0,Clear
01/03/2018,15:00,40.794735,-73.96988,MANHATTAN,2.0,0.0,0,0,0,0,2,0,3822269,2018-01-03 15:00:00,2018-01-03T15:00,2018,1,-2.6,0.0,Clear
06/30/2018,0:00,40.728195,-73.984886,MANHATTAN,0.0,0.0,0,0,0,0,0,0,3932821,2018-06-30 00:00:00,2018-06-30T00:00,2018,6,21.1,0.0,Clear
10/05/2018,13:00,40.737732,-73.98817,MANHATTAN,1.0,0.0,0,0,0,0,1,0,3994608,2018-10-05 13:00:00,2018-10-05T13:00,2018,10,19.4,0.0,Clear
03/27/2018,16:00,40.80685,-73.939835,MANHATTAN,0.0,0.0,0,0,0,0,0,0,3870514,2018-03-27 16:00:00,2018-03-27T16:00,2018,3,4.3,0.0,Cloudy
04/20/2018,16:00,40.74635,-73.99129,MANHATTAN,1.0,0.0,0,0,1,0,0,0,3889261,2018-04-20 16:00:00,2018-04-20T16:00,2018,4,9.9,0.0,Cloudy
08/14/2018,9:00,40.738316,-73.989525,MANHATTAN,1.0,0.0,0,0,1,0,0,0,3960854,2018-08-14 09:00:00,2018-08-14T09:00,2018,8,23.9,0.3,Drizzle
05/24/2018,7:00,40.86446,-73.91895,MANHATTAN,1.0,0.0,1,0,0,0,0,0,3908024,2018-05-24 07:00:00,2018-05-24T07:00,2018,5,18.7,0.0,Clear
10/30/2018,18:00,40.765865,-73.95742,MANHATTAN,1.0,0.0,0,0,0,0,1,0,4013875,2018-10-30 18:00:00,2018-10-30T18:00,2018,10,7.5,0.0,Clear
08/19/2018,18:00,40.74763,-73.98937,MANHATTAN,0.0,0.0,0,0,0,0,0,0,3964189,2018-08-19 18:00:00,2018-08-19T18:00,2018,8,21.0,0.1,Drizzle
04/24/2018,10:00,40.787773,-73.97525,MANHATTAN,1.0,0.0,1,0,0,0,0,0,3887738,2018-04-24 10:00:00,2018-04-24T10:00,2018,4,14.6,0.0,Cloudy
03/09/2018,20:00,40.72218,-74.00066,MANHATTAN,0.0,0.0,0,0,0,0,0,0,3860123,2018-03-09 20:00:00,2018-03-09T20:00,2018,3,1.5,0.0,Clear
04/20/2018,9:00,40.762527,-73.990585,MANHATTAN,1.0,0.0,0,0,0,0,1,0,3886434,2018-04-20 09:00:00,2018-04-20T09:00,2018,4,5.6,0.0,Clear
03/09/2018,18:00,40.717186,-74.0129,MANHATTAN,0.0,0.0,0,0,0,0,0,0,3859832,2018-03-09 18:00:00,2018-03-09T18:00,2018,3,3.6,0.0,Clear
06/04/2018,0:00,40.725082,-73.99534,MANHATTAN,0.0,0.0,0,0,0,0,0,0,3916340,2018-06-04 00:00:00,2018-06-04T00:00,2018,6,11.6,0.3,Drizzle
09/21/2018,17:00,40.72175,-73.97511,MANHATTAN,1.0,0.0,0,0,1,0,0,0,3986552,2018-09-21 17:00:00,2018-09-21T17:00,2018,9,22.0,0.0,Clear
11/01/2018,17:00,40.728367,-74.00537,MANHATTAN,0.0,0.0,0,0,0,0,0,0,4016433,2018-11-01 17:00:00,2018-11-01T17:00,2018,11,16.6,0.0,Cloudy
03/06/2018,13:00,40.80307,-73.93838,MANHATTAN,1.0,0.0,0,0,1,0,0,0,3858200,2018-03-06 13:00:00,2018-03-06T13:00,2018,3,6.6,0.0,Cloudy
01/18/2018,11:00,40.733612,-73.999565,MANHATTAN,1.0,0.0,1,0,0,0,0,0,3831749,2018-01-18 11:00:00,2018-01-18T11:00,2018,1,-2.1,0.0,Clear
02/06/2018,11:00,40.8017,-73.93904,MANHATTAN,0.0,0.0,0,0,0,0,0,0,3841831,2018-02-06 11:00:00,2018-02-06T11:00,2018,2,-0.1,0.0,Cloudy
08/17/2018,10:00,40.742184,-74.00614,MANHATTAN,1.0,0.0,0,0,1,0,0,0,3963643,2018-08-17 10:00:00,2018-08-17T10:00,2018,8,27.7,0.6,Drizzle
03/16/2018,17:00,40.766716,-73.96914,MANHATTAN,1.0,0.0,0,0,0,0,1,0,3881902,2018-03-16 17:00:00,2018-03-16T17:00,2018,3,0.5,0.0,Cloudy
08/25/2018,17:00,40.760822,-73.99832,MANHATTAN,1.0,0.0,0,0,0,0,1,0,3970133,2018-08-25 17:00:00,2018-08-25T17:00,2018,8,23.2,0.0,Clear
09/17/2018,4:00,40.73222,-74.00356,MANHATTAN,0.0,0.0,0,0,0,0,0,0,3994924,2018-09-17 04:00:00,2018-09-17T04:00,2018,9,20.2,0.0,Cloudy
08/07/2018,16:00,40.73856,-73.9846,MANHATTAN,0.0,0.0,0,0,0,0,0,0,3956538,2018-08-07 16:00:00,2018-08-07T16:00,2018,8,28.4,0.0,Cloudy
07/31/2018,0:00,40.732212,-73.99862,MANHATTAN,1.0,0.0,0,0,1,0,0,0,3953642,2018-07-31 00:00:00,2018-07-31T00:00,2018,7,19.9,0.0,Clear
12/09/2018,1:00,40.728596,-73.98768,MANHATTAN,0.0,0.0,0,0,0,0,0,0,4041063,2018-12-09 01:00:00,2018-12-09T01:00,2018,12,-3.1,0.0,Cloudy
06/21/2018,20:00,40.72706,-73.995415,MANHATTAN,1.0,0.0,1,0,0,0,0,0,3927005,2018-06-21 20:00:00,2018-06-21T20:00,2018,6,22.8,0.0,Cloudy
09/11/2018,0:00,40.818516,-73.93765,MANHATTAN,1.0,0.0,1,0,0,0,0,0,3979581,2018-09-11 00:00:00,2018-09-11T00:00,2018,9,18.9,0.2,Drizzle
01/11/2018,14:00,40.75582,-73.970764,MANHATTAN,1.0,0.0,1,0,0,0,0,0,3826393,2018-01-11 14:00:00,2018-01-11T14:00,2018,1,6.1,0.0,Cloudy
02/05/2018,18:00,40.748505,-73.99443,MANHATTAN,1.0,0.0,0,0,1,0,0,0,3840702,2018-02-05 18:00:00,2018-02-05T18:00,2018,2,-4.5,0.0,Clear
05/31/2018,1:00,40.747803,-73.99855,MANHATTAN,0.0,0.0,0,0,0,0,0,0,3913876,2018-05-31 01:00:00,2018-05-31T01:00,2018,5,16.7,0.0,Cloudy
09/17/2018,14:00,40.74285,-73.97721,MANHATTAN,1.0,0.0,0,0,1,0,0,0,3982632,2018-09-17 14:00:00,2018-09-17T14:00,2018,9,24.1,0.0,Cloudy
03/15/2018,22:00,40.867435,-73.92633,MANHATTAN,1.0,0.0,0,0,0,0,1,0,3864967,2018-03-15 22:00:00,2018-03-15T22:00,2018,3,0.6,0.0,Clear
10/28/2018,19:00,40.747894,-73.989174,MANHATTAN,1.0,0.0,0,0,0,0,1,0,4009763,2018-10-28 19:00:00,2018-10-28T19:00,2018,10,10.2,0.0,Cloudy
04/26/2018,14:00,40.70153,-74.012344,MANHATTAN,1.0,0.0,1,0,0,0,0,0,3893522,2018-04-26 14:00:00,2018-04-26T14:00,2018,4,19.4,0.0,Clear
11/15/2018,16:00,40.872112,-73.91628,MANHATTAN,0.0,0.0,0,0,0,0,0,0,4028927,2018-11-15 16:00:00,2018-11-15T16:00,2018,11,2.2,2.3,Heavy Snow
09/29/2018,14:00,40.726986,-73.985756,MANHATTAN,1.0,0.0,0,0,1,0,0,0,4026409,2018-09-29 14:00:00,2018-09-29T14:00,2018,9,22.3,0.0,Cloudy
01/23/2018,8:00,40.788948,-73.94057,MANHATTAN,1.0,0.0,0,0,0,0,1,0,3833720,2018-01-23 08:00:00,2018-01-23T08:00,2018,1,10.5,1.5,Light Rain
10/15/2018,11:00,40.745686,-73.97213,MANHATTAN,1.0,0.0,1,0,0,0,0,0,4000567,2018-10-15 11:00:00,2018-10-15T11:00,2018,10,16.8,0.3,Drizzle
12/12/2018,12:00,40.738235,-73.98781,MANHATTAN,1.0,0.0,0,0,1,0,0,0,4043289,2018-12-12 12:00:00,2018-12-12T12:00,2018,12,4.7,0.0,Cloudy
10/31/2018,12:00,40.765614,-73.9607,MANHATTAN,1.0,0.0,1,0,0,0,0,0,4011484,2018-10-31 12:00:00,2018-10-31T12:00,2018,10,16.1,0.0,Clear
03/30/2018,18:00,40.72235,-73.99327,MANHATTAN,1.0,0.0,0,0,0,0,1,0,3873320,2018-03-30 18:00:00,2018-03-30T18:00,2018,3,8.5,0.1,Drizzle
10/14/2018,0:00,40.754444,-73.98716,MANHATTAN,0.0,0.0,0,0,0,0,0,0,3999579,2018-10-14 00:00:00,2018-10-14T00:00,2018,10,7.5,0.0,Clear
03/02/2018,11:00,40.751884,-73.96759,MANHATTAN,1.0,0.0,0,0,0,0,1,0,3855236,2018-03-02 11:00:00,2018-03-02T11:00,2018,3,2.1,3.8,Heavy Snow
06/07/2018,18:00,40.760178,-73.964676,MANHATTAN,1.0,0.0,0,0,1,0,0,0,3916638,2018-06-07 18:00:00,2018-06-07T18:00,2018,6,16.5,0.0,Clear
05/19/2018,23:00,40.755505,-73.96807,MANHATTAN,0.0,0.0,0,0,0,0,0,0,3903646,2018-05-19 23:00:00,2018-05-19T23:00,2018,5,15.4,0.1,Drizzle
02/12/2018,17:00,40.729942,-73.99737,MANHATTAN,1.0,0.0,0,0,1,0,0,0,3849647,2018-02-12 17:00:00,2018-02-12T17:00,2018,2,4.8,0.0,Clear
04/21/2018,23:00,40.77622,-73.97596,MANHATTAN,0.0,0.0,0,0,0,0,0,0,3886880,2018-04-21 23:00:00,2018-04-21T23:00,2018,4,7.2,0.0,Cloudy
06/15/2018,16:00,40.72388,-73.98209,MANHATTAN,1.0,0.0,0,0,0,0,1,0,3921905,2018-06-15 16:00:00,2018-06-15T16:00,2018,6,23.7,0.0,Cloudy
04/28/2018,13:00,40.817635,-73.95686,MANHATTAN,2.0,0.0,0,0,0,0,2,0,3895734,2018-04-28 13:00:00,2018-04-28T13:00,2018,4,16.6,0.0,Clear
02/17/2018,17:00,40.72636,-73.97873,MANHATTAN,0.0,0.0,0,0,0,0,0,0,3848566,2018-02-17 17:00:00,2018-02-17T17:00,2018,2,3.1,0.1,Drizzle
06/06/2018,8:00,40.786438,-73.942406,MANHATTAN,0.0,0.0,0,0,0,0,0,0,3915887,2018-06-06 08:00:00,2018-06-06T08:00,2018,6,16.8,0.0,Cloudy
04/30/2018,16:00,40.761173,-73.95789,MANHATTAN,0.0,0.0,0,0,0,0,0,0,3891523,2018-04-30 16:00:00,2018-04-30T16:00,2018,4,9.9,0.0,Cloudy
08/09/2018,11:00,40.775604,-73.94428,MANHATTAN,0.0,0.0,0,0,0,0,0,0,3958905,2018-08-09 11:00:00,2018-08-09T11:00,2018,8,28.5,0.0,Clear
02/28/2018,8:00,40.777676,-73.963234,MANHATTAN,0.0,0.0,0,0,0,0,0,0,3856861,2018-02-28 08:00:00,2018-02-28T08:00,2018,2,4.2,0.0,Cloudy
02/10/2018,20:00,40.72422,-74.00865,MANHATTAN,0.0,0.0,0,0,0,0,0,0,3844394,2018-02-10 20:00:00,2018-02-10T20:00,2018,2,7.1,3.3,Heavy Rain
06/15/2018,8:00,40.76975,-73.96061,MANHATTAN,1.0,0.0,0,0,1,0,0,0,3921585,2018-06-15 08:00:00,2018-06-15T08:00,2018,6,19.2,0.0,Cloudy
10/06/2018,14:00,40.753242,-73.96662,MANHATTAN,0.0,0.0,0,0,0,0,0,0,3994635,2018-10-06 14:00:00,2018-10-06T14:00,2018,10,19.5,0.0,Cloudy
12/17/2018,16:00,40.772243,-73.954605,MANHATTAN,0.0,0.0,0,0,0,0,0,0,4048234,2018-12-17 16:00:00,2018-12-17T16:00,2018,12,5.3,0.0,Cloudy
12/13/2018,15:00,40.752052,-74.000984,MANHATTAN,0.0,0.0,0,0,0,0,0,0,4050822,2018-12-13 15:00:00,2018-12-13T15:00,2018,12,5.0,0.0,Clear
02/21/2018,1:00,40.732822,-73.98752,MANHATTAN,1.0,0.0,0,0,0,0,1,0,3849833,2018-02-21 01:00:00,2018-02-21T01:00,2018,2,13.1,0.0,Cloudy
09/20/2018,23:00,40.713615,-74.00676,MANHATTAN,1.0,0.0,0,0,0,0,1,0,3984825,2018-09-20 23:00:00,2018-09-20T23:00,2018,9,19.5,0.0,Cloudy
09/12/2018,18:00,40.76134,-73.98773,MANHATTAN,0.0,0.0,0,0,0,0,0,0,3979734,2018-09-12 18:00:00,2018-09-12T18:00,2018,9,23.8,0.1,Drizzle
05/02/2018,0:00,40.740948,-73.99219,MANHATTAN,1.0,0.0,0,0,1,0,0,0,3896111,2018-05-02 00:00:00,2018-05-02T00:00,2018,5,15.2,0.0,Cloudy
04/12/2018,16:00,40.756336,-73.87794,MANHATTAN,0.0,0.0,0,0,0,0,0,0,4025822,2018-04-12 16:00:00,2018-04-12T16:00,2018,4,12.8,0.0,Cloudy
09/25/2018,19:00,40.752724,-73.996796,MANHATTAN,1.0,0.0,1,0,0,0,0,0,3988179,2018-09-25 19:00:00,2018-09-25T19:00,2018,9,21.2,1.3,Light Rain
03/14/2018,12:00,40.84019,-73.94307,MANHATTAN,1.0,0.0,1,0,0,0,0,0,3863538,2018-03-14 12:00:00,2018-03-14T12:00,2018,3,3.8,0.0,Cloudy
07/27/2018,15:00,40.838425,-73.941696,MANHATTAN,1.0,0.0,0,0,0,0,1,0,3950416,2018-07-27 15:00:00,2018-07-27T15:00,2018,7,27.4,0.0,Cloudy
02/27/2018,13:00,40.732277,-73.99132,MANHATTAN,1.0,0.0,1,0,0,0,0,0,3854556,2018-02-27 13:00:00,2018-02-27T13:00,2018,2,12.0,0.0,Clear
05/03/2018,16:00,40.78065,-73.97643,MANHATTAN,1.0,0.0,0,0,0,0,1,0,3894259,2018-05-03 16:00:00,2018-05-03T16:00,2018,5,29.3,0.0,Cloudy
08/27/2018,19:00,40.80016,-73.93538,MANHATTAN,1.0,0.0,0,0,1,0,0,0,3969375,2018-08-27 19:00:00,2018-08-27T19:00,2018,8,25.5,0.0,Cloudy
12/01/2018,16:00,40.808224,-73.93673,MANHATTAN,1.0,0.0,0,0,0,0,1,0,4036281,2018-12-01 16:00:00,2018-12-01T16:00,2018,12,5.7,0.0,Cloudy
11/12/2018,6:00,40.72293,-73.98865,MANHATTAN,1.0,0.0,1,0,0,0,0,0,4020534,2018-11-12 06:00:00,2018-11-12T06:00,2018,11,0.2,0.0,Clear
09/25/2018,11:00,40.79166,-73.96469,MANHATTAN,1.0,0.0,0,0,1,0,0,0,3991176,2018-09-25 11:00:00,2018-09-25T11:00,2018,9,20.5,2.1,Light Rain
09/28/2018,17:00,40.752117,-73.977684,MANHATTAN,1.0,0.0,1,0,0,0,0,0,3990622,2018-09-28 17:00:00,2018-09-28T17:00,2018,9,18.7,0.0,Cloudy
02/18/2018,9:00,40.741547,-73.98958,MANHATTAN,1.0,0.0,0,0,0,0,1,0,3848704,2018-02-18 09:00:00,2018-02-18T09:00,2018,2,1.5,0.0,Clear
04/10/2018,13:00,40.799072,-73.97043,MANHATTAN,1.0,0.0,0,0,0,0,1,0,3879570,2018-04-10 13:00:00,2018-04-10T13:00,2018,4,8.1,0.0,Cloudy
11/13/2018,13:00,40.731705,-74.00096,MANHATTAN,0.0,0.0,0,0,0,0,0,0,4020815,2018-11-13 13:00:00,2018-11-13T13:00,2018,11,9.4,0.0,Cloudy
09/05/2018,16:00,40.819096,-73.94093,MANHATTAN,1.0,0.0,0,0,0,0,1,0,3974760,2018-09-05 16:00:00,2018-09-05T16:00,2018,9,27.8,0.0,Clear
12/17/2018,15:00,40.76685,-73.95376,MANHATTAN,0.0,0.0,0,0,0,0,0,0,4046771,2018-12-17 15:00:00,2018-12-17T15:00,2018,12,5.6,0.0,Cloudy
03/17/2018,17:00,40.71449,-74.01147,MANHATTAN,0.0,0.0,0,0,0,0,0,0,3864489,2018-03-17 17:00:00,2018-03-17T17:00,2018,3,8.4,0.0,Cloudy
07/24/2018,9:00,40.72593,-73.99466,MANHATTAN,1.0,0.0,0,0,0,0,1,0,3947873,2018-07-24 09:00:00,2018-07-24T09:00,2018,7,24.4,0.1,Drizzle
08/11/2018,12:00,40.775642,-73.960526,MANHATTAN,1.0,0.0,0,0,0,0,1,0,3959949,2018-08-11 12:00:00,2018-08-11T12:00,2018,8,24.3,0.3,Drizzle
12/29/2018,20:00,40.73603,-73.99781,MANHATTAN,1.0,0.0,0,0,1,0,0,0,4055836,2018-12-29 20:00:00,2018-12-29T20:00,2018,12,3.8,0.0,Clear
12/07/2018,14:00,40.751793,-73.97688,MANHATTAN,0.0,0.0,0,0,0,0,0,0,4040618,2018-12-07 14:00:00,2018-12-07T14:00,2018,12,2.2,0.0,Clear
05/05/2018,12:00,40.75537,-73.98746,MANHATTAN,1.0,0.0,1,0,0,0,0,0,3895090,2018-05-05 12:00:00,2018-05-05T12:00,2018,5,20.2,0.0,Cloudy
11/14/2018,14:00,40.758377,-73.994385,MANHATTAN,2.0,0.0,2,0,0,0,0,0,4026603,2018-11-14 14:00:00,2018-11-14T14:00,2018,11,4.0,0.0,Cloudy
08/25/2018,11:00,40.730057,-73.999374,MANHATTAN,1.0,0.0,1,0,0,0,0,0,3969675,2018-08-25 11:00:00,2018-08-25T11:00,2018,8,24.9,0.0,Cloudy
03/13/2018,14:00,40.706013,-74.00882,MANHATTAN,1.0,0.0,1,0,0,0,0,0,3862735,2018-03-13 14:00:00,2018-03-13T14:00,2018,3,4.8,0.0,Cloudy
01/07/2018,7:00,40.71581,-73.99904,MANHATTAN,1.0,0.0,0,0,0,0,1,0,3824817,2018-01-07 07:00:00,2018-01-07T07:00,2018,1,-19.2,0.0,Clear
12/05/2018,9:00,40.739494,-73.97663,MANHATTAN,1.0,0.0,0,0,0,0,1,0,4043126,2018-12-05 09:00:00,2018-12-05T09:00,2018,12,-1.5,0.0,Clear
07/17/2018,20:00,40.779476,-73.97358,MANHATTAN,1.0,0.0,1,0,0,0,0,0,3943744,2018-07-17 20:00:00,2018-07-17T20:00,2018,7,22.9,0.1,Drizzle
04/20/2018,18:00,40.7615,-73.997826,MANHATTAN,0.0,0.0,0,0,0,0,0,0,3887285,2018-04-20 18:00:00,2018-04-20T18:00,2018,4,7.7,0.0,Clear
12/18/2018,22:00,40.74314,-73.981705,MANHATTAN,1.0,0.0,0,0,0,0,1,0,4047788,2018-12-18 22:00:00,2018-12-18T22:00,2018,12,-2.8,0.0,Clear
04/01/2018,18:00,40.746616,-73.99382,MANHATTAN,0.0,0.0,0,0,0,0,0,0,3874963,2018-04-01 18:00:00,2018-04-01T18:00,2018,4,8.5,0.0,Clear
02/27/2018,8:00,40.815826,-73.947044,MANHATTAN,1.0,0.0,0,0,0,0,1,0,3858013,2018-02-27 08:00:00,2018-02-27T08:00,2018,2,3.0,0.0,Clear
01/12/2018,11:00,40.748436,-73.984566,MANHATTAN,0.0,0.0,0,0,0,0,0,0,3827977,2018-01-12 11:00:00,2018-01-12T11:00,2018,1,13.4,0.5,Drizzle
01/26/2018,13:00,40.790516,-73.95178,MANHATTAN,1.0,0.0,1,0,0,0,0,0,3835725,2018-01-26 13:00:00,2018-01-26T13:00,2018,1,1.3,0.0,Clear
03/17/2018,13:00,40.77753,-73.975006,MANHATTAN,0.0,0.0,0,0,0,0,0,0,3864191,2018-03-17 13:00:00,2018-03-17T13:00,2018,3,7.9,0.0,Cloudy
06/19/2018,10:00,40.75974,-73.97423,MANHATTAN,0.0,0.0,0,0,0,0,0,0,3925075,2018-06-19 10:00:00,2018-06-19T10:00,2018,6,26.1,0.1,Drizzle
01/27/2018,20:00,40.759163,-73.97675,MANHATTAN,1.0,0.0,0,0,0,0,1,0,3836505,2018-01-27 20:00:00,2018-01-27T20:00,2018,1,9.0,0.0,Cloudy
07/10/2018,0:00,40.745686,-73.97213,MANHATTAN,1.0,0.0,0,0,1,0,0,0,3938385,2018-07-10 00:00:00,2018-07-10T00:00,2018,7,21.4,0.0,Clear
05/07/2018,11:00,40.78201,-73.981674,MANHATTAN,0.0,0.0,0,0,0,0,0,0,3897457,2018-05-07 11:00:00,2018-05-07T11:00,2018,5,20.2,0.0,Cloudy
05/25/2018,3:00,40.746616,-73.99382,MANHATTAN,2.0,0.0,0,0,0,0,2,0,3909129,2018-05-25 03:00:00,2018-05-25T03:00,2018,5,16.7,0.0,Clear
12/02/2018,4:00,40.71975,-73.992165,MANHATTAN,2.0,0.0,0,0,0,0,2,0,4036507,2018-12-02 04:00:00,2018-12-02T04:00,2018,12,8.6,0.7,Drizzle
04/19/2018,13:00,40.793377,-73.97086,MANHATTAN,1.0,0.0,1,0,0,0,0,0,3884733,2018-04-19 13:00:00,2018-04-19T13:00,2018,4,7.0,0.6,Drizzle
06/19/2018,15:00,40.795586,-73.950165,MANHATTAN,1.0,0.0,0,0,0,0,1,0,3927121,2018-06-19 15:00:00,2018-06-19T15:00,2018,6,30.6,0.0,Clear
01/19/2018,15:00,40.709805,-74.009995,MANHATTAN,1.0,0.0,0,0,1,0,0,0,3832833,2018-01-19 15:00:00,2018-01-19T15:00,2018,1,3.8,0.0,Cloudy
05/19/2018,18:00,40.77161,-73.99046,MANHATTAN,1.0,0.0,0,0,1,0,0,0,3905181,2018-05-19 18:00:00,2018-05-19T18:00,2018,5,14.8,0.5,Drizzle
06/22/2018,5:00,40.754745,-73.9879,MANHATTAN,0.0,0.0,0,0,0,0,0,0,3932041,2018-06-22 05:00:00,2018-06-22T05:00,2018,6,18.3,0.0,Cloudy
11/26/2018,10:00,40.71523,-74.01334,MANHATTAN,1.0,0.0,0,0,0,0,1,0,4043223,2018-11-26 10:00:00,2018-11-26T10:00,2018,11,10.8,0.2,Drizzle
07/26/2018,12:00,40.802868,-73.93987,MANHATTAN,0.0,0.0,0,0,0,0,0,0,3949001,2018-07-26 12:00:00,2018-07-26T12:00,2018,7,25.6,0.0,Cloudy
04/12/2018,13:00,40.74608,-73.974945,MANHATTAN,2.0,0.0,2,0,0,0,0,0,3880388,2018-04-12 13:00:00,2018-04-12T13:00,2018,4,13.4,0.0,Cloudy
02/21/2018,22:00,40.751484,-73.98204,MANHATTAN,0.0,0.0,0,0,0,0,0,0,3850015,2018-02-21 22:00:00,2018-02-21T22:00,2018,2,12.4,2.9,Heavy Rain
07/06/2018,17:00,40.72267,-73.98297,MANHATTAN,1.0,0.0,0,0,1,0,0,0,3936482,2018-07-06 17:00:00,2018-07-06T17:00,2018,7,26.0,0.0,Cloudy
05/27/2018,15:00,40.815933,-73.93722,MANHATTAN,0.0,0.0,0,0,0,0,0,0,3909615,2018-05-27 15:00:00,2018-05-27T15:00,2018,5,14.5,0.0,Cloudy
03/19/2018,1:00,40.744442,-73.979065,MANHATTAN,2.0,0.0,2,0,0,0,0,0,3865102,2018-03-19 01:00:00,2018-03-19T01:00,2018,3,-1.5,0.0,Clear
01/23/2018,20:00,40.8076,-73.93719,MANHATTAN,0.0,0.0,0,0,0,0,0,0,3833503,2018-01-23 20:00:00,2018-01-23T20:00,2018,1,7.6,0.0,Clear
05/14/2018,17:00,40.80066,-73.9544,MANHATTAN,1.0,0.0,0,0,0,0,1,0,3903242,2018-05-14 17:00:00,2018-05-14T17:00,2018,5,17.4,0.0,Cloudy
11/19/2018,9:00,40.710533,-74.00936,MANHATTAN,1.0,0.0,1,0,0,0,0,0,4028832,2018-11-19 09:00:00,2018-11-19T09:00,2018,11,5.8,0.0,Cloudy
06/06/2018,8:00,40.767117,-73.956505,MANHATTAN,1.0,0.0,0,0,0,0,1,0,3915747,2018-06-06 08:00:00,2018-06-06T08:00,2018,6,16.6,0.0,Cloudy
07/29/2018,17:00,40.822834,-73.941925,MANHATTAN,2.0,0.0,0,0,0,0,2,0,3950308,2018-07-29 17:00:00,2018-07-29T17:00,2018,7,27.1,0.0,Cloudy
05/29/2018,0:00,40.748825,-73.98553,MANHATTAN,1.0,0.0,0,0,0,0,1,0,3910878,2018-05-29 00:00:00,2018-05-29T00:00,2018,5,16.9,0.0,Cloudy
01/16/2018,10:00,40.720837,-73.997665,MANHATTAN,1.0,0.0,0,0,0,0,1,0,3829773,2018-01-16 10:00:00,2018-01-16T10:00,2018,1,-1.1,0.0,Cloudy
11/07/2018,9:00,40.77719,-73.95225,MANHATTAN,1.0,0.0,0,0,1,0,0,0,4028791,2018-11-07 09:00:00,2018-11-07T09:00,2018,11,11.8,0.0,Clear
11/17/2018,21:00,40.74773,-73.986885,MANHATTAN,1.0,0.0,1,0,0,0,0,0,4029024,2018-11-17 21:00:00,2018-11-17T21:00,2018,11,3.9,0.0,Clear
01/19/2018,8:00,40.759617,-73.961975,MANHATTAN,1.0,0.0,0,0,1,0,0,0,3831553,2018-01-19 08:00:00,2018-01-19T08:00,2018,1,-3.8,0.0,Cloudy
03/01/2018,14:00,40.750942,-74.00598,MANHATTAN,0.0,0.0,0,0,0,0,0,0,3857319,2018-03-01 14:00:00,2018-03-01T14:00,2018,3,15.5,0.0,Cloudy
05/31/2018,10:00,40.74589,-73.99207,MANHATTAN,0.0,0.0,0,0,0,0,0,0,3913110,2018-05-31 10:00:00,2018-05-31T10:00,2018,5,19.2,0.9,Drizzle
08/06/2018,13:00,40.763966,-73.993965,MANHATTAN,0.0,0.0,0,0,0,0,0,0,3957184,2018-08-06 13:00:00,2018-08-06T13:00,2018,8,32.5,0.0,Clear
01/02/2018,15:00,40.764736,-73.98804,MANHATTAN,1.0,0.0,0,0,0,0,1,0,3822206,2018-01-02 15:00:00,2018-01-02T15:00,2018,1,-3.0,0.0,Clear
03/16/2018,10:00,40.76657,-73.95312,MANHATTAN,0.0,0.0,0,0,0,0,0,0,3864951,2018-03-16 10:00:00,2018-03-16T10:00,2018,3,2.5,0.0,Clear
02/19/2018,20:00,40.73696,-73.98451,MANHATTAN,1.0,0.0,0,0,0,0,1,0,3850947,2018-02-19 20:00:00,2018-02-19T20:00,2018,2,6.9,1.2,Drizzle
01/17/2018,12:00,40.724236,-73.997795,MANHATTAN,1.0,0.0,0,0,1,0,0,0,3830168,2018-01-17 12:00:00,2018-01-17T12:00,2018,1,1.3,0.4,Heavy Snow
05/29/2018,17:00,40.742832,-74.00771,MANHATTAN,0.0,0.0,0,0,0,0,0,0,4144446,2018-05-29 17:00:00,2018-05-29T17:00,2018,5,25.8,0.0,Clear
09/25/2018,7:00,40.763622,-73.979546,MANHATTAN,1.0,0.0,0,0,0,0,1,0,3987205,2018-09-25 07:00:00,2018-09-25T07:00,2018,9,16.0,3.7,Heavy Rain
03/22/2018,18:00,40.76234,-73.98236,MANHATTAN,1.0,0.0,0,0,1,0,0,0,3870603,2018-03-22 18:00:00,2018-03-22T18:00,2018,3,3.4,0.0,Cloudy
02/07/2018,4:00,40.826427,-73.950455,MANHATTAN,1.0,0.0,0,0,1,0,0,0,3843133,2018-02-07 04:00:00,2018-02-07T04:00,2018,2,-3.4,0.0,Cloudy
09/24/2018,17:00,40.795975,-73.97497,MANHATTAN,1.0,0.0,1,0,0,0,0,0,3987194,2018-09-24 17:00:00,2018-09-24T17:00,2018,9,17.5,0.0,Cloudy
01/27/2018,17:00,40.71996,-73.99705,MANHATTAN,0.0,0.0,0,0,0,0,0,0,3836828,2018-01-27 17:00:00,2018-01-27T17:00,2018,1,9.5,0.0,Cloudy
02/13/2018,13:00,40.77941,-73.979485,MANHATTAN,1.0,0.0,1,0,0,0,0,0,3845575,2018-02-13 13:00:00,2018-02-13T13:00,2018,2,1.7,0.0,Cloudy
02/05/2018,17:00,40.84215,-73.94228,MANHATTAN,1.0,0.0,0,0,1,0,0,0,4025526,2018-02-05 17:00:00,2018-02-05T17:00,2018,2,-3.0,0.0,Clear
06/17/2018,3:00,40.721447,-73.997406,MANHATTAN,0.0,0.0,0,0,0,0,0,0,3923626,2018-06-17 03:00:00,2018-06-17T03:00,2018,6,17.0,0.0,Clear
02/16/2018,17:00,40.71863,-73.988495,MANHATTAN,0.0,0.0,0,0,0,0,0,0,3849780,2018-02-16 17:00:00,2018-02-16T17:00,2018,2,7.8,0.1,Drizzle
10/15/2018,0:00,40.846104,-73.93609,MANHATTAN,1.0,0.0,0,0,1,0,0,0,4001583,2018-10-15 00:00:00,2018-10-15T00:00,2018,10,8.9,0.0,Clear
03/28/2018,19:00,40.73656,-74.0011,MANHATTAN,1.0,0.0,1,0,0,0,0,0,3873328,2018-03-28 19:00:00,2018-03-28T19:00,2018,3,7.4,0.0,Cloudy
06/30/2018,13:00,40.73952,-73.986855,MANHATTAN,0.0,0.0,0,0,0,0,0,0,3932373,2018-06-30 13:00:00,2018-06-30T13:00,2018,6,30.8,0.0,Clear
11/26/2018,14:00,40.824627,-73.938255,MANHATTAN,0.0,0.0,0,0,0,0,0,0,4037755,2018-11-26 14:00:00,2018-11-26T14:00,2018,11,10.3,0.2,Drizzle
04/18/2018,23:00,40.864807,-73.91937,MANHATTAN,2.0,0.0,0,0,0,0,2,0,3883823,2018-04-18 23:00:00,2018-04-18T23:00,2018,4,5.8,0.0,Cloudy
09/11/2018,10:00,40.71523,-74.01334,MANHATTAN,0.0,0.0,0,0,0,0,0,0,3978892,2018-09-11 10:00:00,2018-09-11T10:00,2018,9,21.9,0.5,Drizzle
01/11/2018,13:00,40.87229,-73.91269,MANHATTAN,0.0,0.0,0,0,0,0,0,0,3826879,2018-01-11 13:00:00,2018-01-11T13:00,2018,1,5.9,0.0,Cloudy
03/30/2018,13:00,40.748646,-73.98505,MANHATTAN,1.0,0.0,0,0,0,0,1,0,3872957,2018-03-30 13:00:00,2018-03-30T13:00,2018,3,11.2,0.0,Cloudy
08/08/2018,21:00,40.76023,-73.961525,MANHATTAN,0.0,0.0,0,0,0,0,0,0,3958918,2018-08-08 21:00:00,2018-08-08T21:00,2018,8,25.9,0.0,Cloudy
08/30/2018,18:00,40.810856,-73.939026,MANHATTAN,1.0,0.0,0,0,0,0,1,0,3971298,2018-08-30 18:00:00,2018-08-30T18:00,2018,8,27.9,0.0,Cloudy
04/20/2018,16:00,40.72543,-73.99678,MANHATTAN,1.0,0.0,0,0,0,0,1,0,3886868,2018-04-20 16:00:00,2018-04-20T16:00,2018,4,9.9,0.0,Cloudy
03/02/2018,0:00,40.85045,-73.93667,MANHATTAN,1.0,0.0,1,0,0,0,0,0,3855310,2018-03-02 00:00:00,2018-03-02T00:00,2018,3,5.4,1.7,Light Rain
07/11/2018,20:00,40.75594,-73.98333,MANHATTAN,1.0,0.0,0,0,1,0,0,0,3940221,2018-07-11 20:00:00,2018-07-11T20:00,2018,7,21.4,0.6,Drizzle
04/23/2018,11:00,40.762966,-73.973976,MANHATTAN,0.0,0.0,0,0,0,0,0,0,3886437,2018-04-23 11:00:00,2018-04-23T11:00,2018,4,14.6,0.0,Clear
12/04/2018,10:00,40.724804,-73.9933,MANHATTAN,0.0,0.0,0,0,0,0,0,0,4045213,2018-12-04 10:00:00,2018-12-04T10:00,2018,12,3.9,0.0,Cloudy
10/14/2018,7:00,40.75034,-73.983185,MANHATTAN,1.0,0.0,0,0,0,0,1,0,4001849,2018-10-14 07:00:00,2018-10-14T07:00,2018,10,9.0,0.0,Cloudy
01/15/2018,19:00,40.72293,-73.98865,MANHATTAN,1.0,0.0,1,0,0,0,0,0,3829534,2018-01-15 19:00:00,2018-01-15T19:00,2018,1,-3.8,0.0,Cloudy
11/02/2018,18:00,40.70981,-73.99178,MANHATTAN,1.0,0.0,0,0,0,0,1,0,4014060,2018-11-02 18:00:00,2018-11-02T18:00,2018,11,18.7,0.8,Drizzle
05/30/2018,17:00,40.753994,-73.9742,MANHATTAN,1.0,0.0,0,0,1,0,0,0,3912019,2018-05-30 17:00:00,2018-05-30T17:00,2018,5,18.4,0.0,Clear
08/01/2018,21:00,40.7682,-73.98553,MANHATTAN,0.0,0.0,0,0,0,0,0,0,3953037,2018-08-01 21:00:00,2018-08-01T21:00,2018,8,25.9,0.0,Cloudy
02/23/2018,22:00,40.743427,-73.99613,MANHATTAN,1.0,0.0,1,0,0,0,0,0,3851577,2018-02-23 22:00:00,2018-02-23T22:00,2018,2,4.5,0.0,Cloudy
07/16/2018,19:00,40.73893,-73.99572,MANHATTAN,1.0,0.0,0,0,1,0,0,0,3943843,2018-07-16 19:00:00,2018-07-16T19:00,2018,7,27.3,0.0,Clear
05/11/2018,12:00,40.72915,-73.999084,MANHATTAN,0.0,0.0,0,0,0,0,0,0,3898384,2018-05-11 12:00:00,2018-05-11T12:00,2018,5,20.0,0.0,Cloudy
11/24/2018,18:00,40.720936,-73.993805,MANHATTAN,0.0,0.0,0,0,0,0,0,0,4032136,2018-11-24 18:00:00,2018-11-24T18:00,2018,11,6.9,0.3,Drizzle
05/19/2018,21:00,40.72163,-73.99353,MANHATTAN,1.0,0.0,0,0,0,0,1,0,3904473,2018-05-19 21:00:00,2018-05-19T21:00,2018,5,13.7,0.3,Drizzle
06/16/2018,22:00,40.72368,-74.00365,MANHATTAN,0.0,0.0,0,0,0,0,0,0,3922305,2018-06-16 22:00:00,2018-06-16T22:00,2018,6,19.3,0.0,Cloudy
06/10/2018,18:00,40.748478,-73.97302,MANHATTAN,1.0,0.0,1,0,0,0,0,0,4026102,2018-06-10 18:00:00,2018-06-10T18:00,2018,6,16.6,0.1,Drizzle
10/02/2018,19:00,40.760777,-73.96672,MANHATTAN,0.0,0.0,0,0,0,0,0,0,3998965,2018-10-02 19:00:00,2018-10-02T19:00,2018,10,20.8,1.4,Light Rain
09/25/2018,11:00,40.765987,-73.98713,MANHATTAN,0.0,0.0,0,0,0,0,0,0,3987397,2018-09-25 11:00:00,2018-09-25T11:00,2018,9,20.7,1.8,Light Rain
08/10/2018,22:00,40.755295,-73.979256,MANHATTAN,1.0,0.0,0,0,0,0,1,0,3959390,2018-08-10 22:00:00,2018-08-10T22:00,2018,8,24.4,0.1,Drizzle
08/08/2018,12:00,40.77929,-73.98114,MANHATTAN,1.0,0.0,1,0,0,0,0,0,3957999,2018-08-08 12:00:00,2018-08-08T12:00,2018,8,30.2,0.0,Clear
05/26/2018,18:00,40.76338,-73.97498,MANHATTAN,0.0,0.0,0,0,0,0,0,0,3908769,2018-05-26 18:00:00,2018-05-26T18:00,2018,5,24.6,0.0,Cloudy
01/11/2018,8:00,40.837193,-73.9367,MANHATTAN,1.0,0.0,0,0,0,0,1,0,3826979,2018-01-11 08:00:00,2018-01-11T08:00,2018,1,1.7,0.0,Cloudy
09/23/2018,13:00,40.785294,-73.969345,MANHATTAN,0.0,0.0,0,0,0,0,0,0,3988174,2018-09-23 13:00:00,2018-09-23T13:00,2018,9,18.3,0.0,Cloudy
09/17/2018,13:00,40.802753,-73.93358,MANHATTAN,1.0,0.0,1,0,0,0,0,0,3984057,2018-09-17 13:00:00,2018-09-17T13:00,2018,9,24.7,0.4,Drizzle
08/24/2018,18:00,40.723625,-74.00479,MANHATTAN,0.0,0.0,0,0,0,0,0,0,3968036,2018-08-24 18:00:00,2018-08-24T18:00,2018,8,23.2,0.0,Clear
02/01/2018,11:00,40.852703,-73.93013,MANHATTAN,3.0,0.0,0,0,0,0,3,0,3839185,2018-02-01 11:00:00,2018-02-01T11:00,2018,2,4.0,0.0,Cloudy
03/26/2018,22:00,40.801872,-73.94137,MANHATTAN,1.0,0.0,0,0,1,0,0,0,3871375,2018-03-26 22:00:00,2018-03-26T22:00,2018,3,-0.3,0.0,Clear
06/20/2018,16:00,40.75991,-73.95882,MANHATTAN,0.0,0.0,0,0,0,0,0,0,3929764,2018-06-20 16:00:00,2018-06-20T16:00,2018,6,25.7,0.0,Cloudy
12/16/2018,17:00,40.738552,-73.99969,MANHATTAN,0.0,0.0,0,0,0,0,0,0,4046031,2018-12-16 17:00:00,2018-12-16T17:00,2018,12,4.3,0.2,Drizzle
01/24/2018,12:00,40.71997,-73.992905,MANHATTAN,0.0,0.0,0,0,0,0,0,0,3834733,2018-01-24 12:00:00,2018-01-24T12:00,2018,1,4.6,0.0,Clear
07/07/2018,0:00,40.802395,-73.936775,MANHATTAN,1.0,0.0,0,0,0,0,1,0,3936593,2018-07-07 00:00:00,2018-07-07T00:00,2018,7,20.1,0.0,Clear
09/27/2018,17:00,40.716278,-74.00454,MANHATTAN,1.0,0.0,0,0,1,0,0,0,3996055,2018-09-27 17:00:00,2018-09-27T17:00,2018,9,19.9,0.4,Drizzle
10/03/2018,20:00,40.747204,-73.99711,MANHATTAN,1.0,0.0,1,0,0,0,0,0,3996493,2018-10-03 20:00:00,2018-10-03T20:00,2018,10,19.0,0.0,Cloudy
04/11/2018,9:00,40.73792,-73.977806,MANHATTAN,1.0,0.0,0,0,0,0,1,0,3879551,2018-04-11 09:00:00,2018-04-11T09:00,2018,4,6.2,0.0,Clear
01/20/2018,15:00,40.709503,-74.00167,MANHATTAN,0.0,0.0,0,0,0,0,0,0,3831946,2018-01-20 15:00:00,2018-01-20T15:00,2018,1,9.4,0.0,Clear
03/15/2018,9:00,40.76311,-73.962524,MANHATTAN,0.0,0.0,0,0,0,0,0,0,3867700,2018-03-15 09:00:00,2018-03-15T09:00,2018,3,2.2,0.0,Clear
06/22/2018,12:00,40.80417,-73.966705,MANHATTAN,1.0,0.0,0,0,0,0,1,0,3927964,2018-06-22 12:00:00,2018-06-22T12:00,2018,6,23.2,0.0,Cloudy
10/12/2018,17:00,40.78911,-73.95068,MANHATTAN,0.0,0.0,0,0,0,0,0,0,4001019,2018-10-12 17:00:00,2018-10-12T17:00,2018,10,13.9,0.0,Cloudy
05/22/2018,0:00,40.748825,-73.96984,MANHATTAN,0.0,0.0,0,0,0,0,0,0,3905752,2018-05-22 00:00:00,2018-05-22T00:00,2018,5,14.0,0.0,Cloudy
04/26/2018,17:00,40.8076,-73.93719,MANHATTAN,0.0,0.0,0,0,0,0,0,0,3888820,2018-04-26 17:00:00,2018-04-26T17:00,2018,4,19.1,0.0,Clear
09/02/2018,7:00,40.75332,-73.972595,MANHATTAN,0.0,0.0,0,0,0,0,0,0,3973664,2018-09-02 07:00:00,2018-09-02T07:00,2018,9,20.7,0.0,Cloudy
09/28/2018,13:00,40.749985,-73.99509,MANHATTAN,0.0,0.0,0,0,0,0,0,0,3992139,2018-09-28 13:00:00,2018-09-28T13:00,2018,9,17.2,0.0,Cloudy
08/09/2018,20:00,40.73539,-73.99828,MANHATTAN,1.0,0.0,0,0,1,0,0,0,3958777,2018-08-09 20:00:00,2018-08-09T20:00,2018,8,25.1,0.0,Clear
04/03/2018,9:00,40.75843,-73.973076,MANHATTAN,1.0,0.0,0,0,1,0,0,0,3875953,2018-04-03 09:00:00,2018-04-03T09:00,2018,4,3.9,0.0,Cloudy
09/26/2018,0:00,40.762386,-73.99721,MANHATTAN,1.0,0.0,0,0,1,0,0,0,3988605,2018-09-26 00:00:00,2018-09-26T00:00,2018,9,21.8,0.0,Cloudy
12/24/2018,12:00,40.731064,-74.00142,MANHATTAN,0.0,0.0,0,0,0,0,0,0,4051514,2018-12-24 12:00:00,2018-12-24T12:00,2018,12,6.0,0.0,Clear
08/31/2018,0:00,40.753647,-73.97141,MANHATTAN,1.0,0.0,0,0,1,0,0,0,3973650,2018-08-31 00:00:00,2018-08-31T00:00,2018,8,23.8,0.0,Cloudy
03/28/2018,13:00,40.738945,-73.992836,MANHATTAN,1.0,0.0,1,0,0,0,0,0,3872696,2018-03-28 13:00:00,2018-03-28T13:00,2018,3,7.7,0.0,Cloudy
12/13/2018,19:00,40.727875,-74.00543,MANHATTAN,0.0,0.0,0,0,0,0,0,0,4044175,2018-12-13 19:00:00,2018-12-13T19:00,2018,12,2.1,0.0,Cloudy
07/15/2018,18:00,40.761658,-73.986565,MANHATTAN,1.0,0.0,1,0,0,0,0,0,3941787,2018-07-15 18:00:00,2018-07-15T18:00,2018,7,28.1,0.0,Cloudy
09/09/2018,9:00,40.731277,-73.98853,MANHATTAN,0.0,0.0,0,0,0,0,0,0,3984226,2018-09-09 09:00:00,2018-09-09T09:00,2018,9,14.1,1.2,Drizzle
04/03/2018,20:00,40.753,-73.969894,MANHATTAN,1.0,0.0,1,0,0,0,0,0,3878664,2018-04-03 20:00:00,2018-04-03T20:00,2018,4,3.8,0.0,Cloudy
12/26/2018,17:00,40.754177,-73.984604,MANHATTAN,1.0,0.0,0,0,0,0,1,0,4056193,2018-12-26 17:00:00,2018-12-26T17:00,2018,12,2.6,0.0,Clear
02/21/2018,0:00,40.771137,-73.9908,MANHATTAN,1.0,0.0,1,0,0,0,0,0,3850207,2018-02-21 00:00:00,2018-02-21T00:00,2018,2,13.9,0.0,Cloudy
02/04/2018,23:00,40.76552,-73.97211,MANHATTAN,1.0,0.0,1,0,0,0,0,0,3844303,2018-02-04 23:00:00,2018-02-04T23:00,2018,2,4.8,1.7,Light Rain
12/05/2018,8:00,40.806717,-73.93704,MANHATTAN,0.0,0.0,0,0,0,0,0,0,4038477,2018-12-05 08:00:00,2018-12-05T08:00,2018,12,-2.7,0.0,Clear
01/09/2018,13:00,40.836555,-73.94306,MANHATTAN,1.0,0.0,1,0,0,0,0,0,3827225,2018-01-09 13:00:00,2018-01-09T13:00,2018,1,3.6,0.0,Clear
06/08/2018,20:00,40.761665,-73.97492,MANHATTAN,0.0,0.0,0,0,0,0,0,0,3917570,2018-06-08 20:00:00,2018-06-08T20:00,2018,6,21.1,0.0,Clear
04/10/2018,23:00,40.761093,-73.98327,MANHATTAN,1.0,0.0,0,0,0,0,1,0,3878337,2018-04-10 23:00:00,2018-04-10T23:00,2018,4,1.7,0.0,Clear
07/07/2018,22:00,40.753674,-73.98074,MANHATTAN,0.0,0.0,0,0,0,0,0,0,3936798,2018-07-07 22:00:00,2018-07-07T22:00,2018,7,17.1,0.0,Clear
03/28/2018,17:00,40.706394,-74.01283,MANHATTAN,1.0,0.0,1,0,0,0,0,0,3871801,2018-03-28 17:00:00,2018-03-28T17:00,2018,3,8.4,0.0,Cloudy
01/19/2018,19:00,40.73136,-73.98257,MANHATTAN,0.0,0.0,0,0,0,0,0,0,3832743,2018-01-19 19:00:00,2018-01-19T19:00,2018,1,-0.3,0.0,Cloudy
09/05/2018,17:00,40.812813,-73.94181,MANHATTAN,1.0,0.0,0,0,0,0,1,0,3978552,2018-09-05 17:00:00,2018-09-05T17:00,2018,9,26.9,0.0,Clear
01/24/2018,16:00,40.72593,-73.99466,MANHATTAN,1.0,0.0,1,0,0,0,0,0,3841270,2018-01-24 16:00:00,2018-01-24T16:00,2018,1,2.5,0.0,Clear
02/17/2018,21:00,40.74104,-74.005615,MANHATTAN,1.0,0.0,0,0,0,0,1,0,3848339,2018-02-17 21:00:00,2018-02-17T21:00,2018,2,0.5,3.2,Heavy Snow
05/25/2018,9:00,40.747627,-73.976746,MANHATTAN,0.0,0.0,0,0,0,0,0,0,3908049,2018-05-25 09:00:00,2018-05-25T09:00,2018,5,23.3,0.0,Clear
06/16/2018,14:00,40.746002,-73.99427,MANHATTAN,1.0,0.0,0,0,0,0,1,0,3923397,2018-06-16 14:00:00,2018-06-16T14:00,2018,6,27.5,0.0,Cloudy
12/31/2018,20:00,40.716454,-74.01306,MANHATTAN,0.0,0.0,0,0,0,0,0,0,4055535,2018-12-31 20:00:00,2018-12-31T20:00,2018,12,6.3,2.6,Heavy Rain
11/10/2018,17:00,40.75736,-73.98798,MANHATTAN,0.0,0.0,0,0,0,0,0,0,4019783,2018-11-10 17:00:00,2018-11-10T17:00,2018,11,3.9,0.0,Clear
01/11/2018,13:00,40.721046,-73.977974,MANHATTAN,1.0,0.0,0,0,1,0,0,0,3827095,2018-01-11 13:00:00,2018-01-11T13:00,2018,1,5.5,0.0,Cloudy
07/30/2018,17:00,40.76009,-73.96765,MANHATTAN,0.0,0.0,0,0,0,0,0,0,3951289,2018-07-30 17:00:00,2018-07-30T17:00,2018,7,23.4,0.4,Drizzle
01/16/2018,13:00,40.757072,-73.96986,MANHATTAN,1.0,0.0,1,0,0,0,0,0,3829781,2018-01-16 13:00:00,2018-01-16T13:00,2018,1,3.4,0.0,Cloudy
05/14/2018,5:00,40.72089,-73.99576,MANHATTAN,3.0,0.0,0,0,0,0,3,0,3900997,2018-05-14 05:00:00,2018-05-14T05:00,2018,5,11.9,0.1,Drizzle
06/22/2018,19:00,40.720074,-73.988365,MANHATTAN,0.0,0.0,0,0,0,0,0,0,3927087,2018-06-22 19:00:00,2018-06-22T19:00,2018,6,19.1,0.0,Cloudy
06/25/2018,19:00,40.74581,-74.00554,MANHATTAN,1.0,0.0,1,0,0,0,0,0,3931365,2018-06-25 19:00:00,2018-06-25T19:00,2018,6,22.4,0.0,Clear
01/14/2018,15:00,40.72032,-73.99404,MANHATTAN,1.0,0.0,0,0,1,0,0,0,3828172,2018-01-14 15:00:00,2018-01-14T15:00,2018,1,-3.5,0.0,Clear
03/14/2018,19:00,0.0,0.0,MANHATTAN,1.0,0.0,0,0,1,0,0,0,3862506,2018-03-14 19:00:00,2018-03-14T19:00,2018,3,27.9,0.1,Drizzle
07/12/2018,15:00,40.757336,-73.98973,MANHATTAN,0.0,0.0,0,0,0,0,0,0,3941576,2018-07-12 15:00:00,2018-07-12T15:00,2018,7,26.5,0.0,Clear
02/10/2018,16:00,40.805508,-73.96201,MANHATTAN,1.0,0.0,0,0,0,0,1,0,3844861,2018-02-10 16:00:00,2018-02-10T16:00,2018,2,6.8,1.0,Drizzle
05/13/2018,13:00,40.713455,-73.98178,MANHATTAN,0.0,0.0,0,0,0,0,0,0,3900581,2018-05-13 13:00:00,2018-05-13T13:00,2018,5,12.3,0.6,Drizzle
06/19/2018,13:00,40.732254,-73.99636,MANHATTAN,1.0,0.0,0,0,1,0,0,0,3925539,2018-06-19 13:00:00,2018-06-19T13:00,2018,6,30.1,0.0,Cloudy
05/02/2018,0:00,40.870388,-73.91216,MANHATTAN,1.0,0.0,0,0,0,0,0,0,4025930,2018-05-02 00:00:00,2018-05-02T00:00,2018,5,14.7,0.0,Cloudy
04/03/2018,18:00,40.716812,-73.99777,MANHATTAN,0.0,0.0,0,0,0,0,0,0,3874948,2018-04-03 18:00:00,2018-04-03T18:00,2018,4,5.7,0.1,Drizzle
07/06/2018,0:00,40.749672,-73.97187,MANHATTAN,0.0,0.0,0,0,0,0,0,0,3935733,2018-07-06 00:00:00,2018-07-06T00:00,2018,7,24.7,0.0,Cloudy
06/03/2018,21:00,40.76416,-73.968895,MANHATTAN,1.0,0.0,0,0,0,0,1,0,3921183,2018-06-03 21:00:00,2018-06-03T21:00,2018,6,12.5,0.1,Drizzle
01/23/2018,23:00,40.75458,-73.99915,MANHATTAN,0.0,0.0,0,0,0,0,0,0,3834270,2018-01-23 23:00:00,2018-01-23T23:00,2018,1,4.8,0.0,Clear
07/31/2018,9:00,40.757698,-73.9694,MANHATTAN,0.0,0.0,0,0,0,0,0,0,3951917,2018-07-31 09:00:00,2018-07-31T09:00,2018,7,24.2,0.0,Cloudy
11/26/2018,19:00,40.75954,-73.97225,MANHATTAN,0.0,0.0,0,0,0,0,0,0,4033247,2018-11-26 19:00:00,2018-11-26T19:00,2018,11,8.0,4.2,Heavy Rain
12/31/2018,12:00,40.729046,-74.01073,MANHATTAN,1.0,0.0,1,0,0,0,0,0,4055271,2018-12-31 12:00:00,2018-12-31T12:00,2018,12,7.2,0.0,Cloudy
09/08/2018,15:00,40.856712,-73.93264,MANHATTAN,1.0,0.0,0,0,1,0,0,0,3976977,2018-09-08 15:00:00,2018-09-08T15:00,2018,9,18.6,0.6,Drizzle
04/08/2018,17:00,40.747612,-73.98852,MANHATTAN,0.0,0.0,0,0,0,0,0,0,3877409,2018-04-08 17:00:00,2018-04-08T17:00,2018,4,5.6,0.0,Cloudy
07/25/2018,20:00,40.70991,-74.006096,MANHATTAN,1.0,0.0,1,0,0,0,0,0,3950520,2018-07-25 20:00:00,2018-07-25T20:00,2018,7,22.2,1.3,Light Rain
12/21/2018,12:00,40.86369,-73.91707,MANHATTAN,1.0,0.0,0,0,0,0,1,0,4049684,2018-12-21 12:00:00,2018-12-21T12:00,2018,12,13.8,3.1,Heavy Rain
06/15/2018,10:00,40.740738,-73.97884,MANHATTAN,1.0,0.0,0,0,0,0,1,0,3921668,2018-06-15 10:00:00,2018-06-15T10:00,2018,6,20.9,0.0,Cloudy
10/14/2018,19:00,40.727642,-73.999306,MANHATTAN,0.0,0.0,0,0,0,0,0,0,4001714,2018-10-14 19:00:00,2018-10-14T19:00,2018,10,11.6,0.0,Clear
03/09/2018,10:00,40.802868,-73.93987,MANHATTAN,0.0,0.0,0,0,0,0,0,0,3859695,2018-03-09 10:00:00,2018-03-09T10:00,2018,3,2.2,0.0,Cloudy
07/30/2018,16:00,40.733963,-73.988785,MANHATTAN,1.0,0.0,0,0,1,0,0,0,3952383,2018-07-30 16:00:00,2018-07-30T16:00,2018,7,23.9,0.2,Drizzle
06/19/2018,13:00,40.79398,-73.97229,MANHATTAN,1.0,0.0,1,0,0,0,0,0,3925447,2018-06-19 13:00:00,2018-06-19T13:00,2018,6,29.8,0.0,Cloudy
05/15/2018,12:00,40.716938,-73.99811,MANHATTAN,1.0,0.0,0,0,0,0,1,0,3901576,2018-05-15 12:00:00,2018-05-15T12:00,2018,5,28.6,0.0,Clear
04/01/2018,0:00,40.754707,-73.99164,MANHATTAN,1.0,0.0,1,0,0,0,0,0,3872843,2018-04-01 00:00:00,2018-04-01T00:00,2018,4,4.8,0.0,Cloudy
03/25/2018,18:00,40.86155,-73.92472,MANHATTAN,1.0,0.0,0,0,0,0,1,0,3869236,2018-03-25 18:00:00,2018-03-25T18:00,2018,3,3.6,0.0,Clear
12/07/2018,14:00,40.714584,-74.00723,MANHATTAN,0.0,0.0,0,0,0,0,0,0,4040139,2018-12-07 14:00:00,2018-12-07T14:00,2018,12,2.6,0.0,Clear
11/12/2018,0:00,40.82725,-73.9387,MANHATTAN,1.0,0.0,0,0,0,0,1,0,4019655,2018-11-12 00:00:00,2018-11-12T00:00,2018,11,2.4,0.0,Clear
08/07/2018,14:00,40.71975,-73.992165,MANHATTAN,1.0,0.0,0,0,0,0,1,0,3957213,2018-08-07 14:00:00,2018-08-07T14:00,2018,8,29.5,0.3,Drizzle
03/29/2018,17:00,40.715862,-73.98961,MANHATTAN,0.0,0.0,0,0,0,0,0,0,3873011,2018-03-29 17:00:00,2018-03-29T17:00,2018,3,10.7,0.0,Cloudy
01/12/2018,14:00,40.751335,-73.967896,MANHATTAN,1.0,0.0,1,0,0,0,0,0,3827413,2018-01-12 14:00:00,2018-01-12T14:00,2018,1,13.8,3.1,Heavy Rain
02/09/2018,12:00,40.76889,-73.9821,MANHATTAN,1.0,0.0,0,0,0,0,1,0,3843073,2018-02-09 12:00:00,2018-02-09T12:00,2018,2,0.7,0.0,Cloudy
05/17/2018,18:00,40.716022,-73.99132,MANHATTAN,0.0,0.0,0,0,0,0,0,0,3903653,2018-05-17 18:00:00,2018-05-17T18:00,2018,5,20.2,0.0,Cloudy
07/15/2018,12:00,40.73301,-73.986534,MANHATTAN,0.0,0.0,0,0,0,0,0,0,3943153,2018-07-15 12:00:00,2018-07-15T12:00,2018,7,24.1,0.1,Drizzle
05/14/2018,0:00,40.74769,-74.00417,MANHATTAN,0.0,0.0,0,0,0,0,0,0,3902586,2018-05-14 00:00:00,2018-05-14T00:00,2018,5,11.1,0.0,Cloudy
08/08/2018,15:00,40.760822,-73.99832,MANHATTAN,0.0,0.0,0,0,0,0,0,0,3959979,2018-08-08 15:00:00,2018-08-08T15:00,2018,8,28.6,0.1,Drizzle
10/25/2018,20:00,40.72308,-74.00806,MANHATTAN,1.0,0.0,0,0,0,0,1,0,4008442,2018-10-25 20:00:00,2018-10-25T20:00,2018,10,4.6,0.0,Cloudy
12/10/2018,10:00,40.718018,-73.99996,MANHATTAN,0.0,0.0,0,0,0,0,0,0,4042178,2018-12-10 10:00:00,2018-12-10T10:00,2018,12,1.2,0.0,Clear
09/12/2018,8:00,40.806408,-73.94016,MANHATTAN,0.0,0.0,0,0,0,0,0,0,3979285,2018-09-12 08:00:00,2018-09-12T08:00,2018,9,22.5,0.2,Drizzle
12/08/2018,15:00,40.774933,-73.94477,MANHATTAN,0.0,0.0,0,0,0,0,0,0,4041527,2018-12-08 15:00:00,2018-12-08T15:00,2018,12,1.6,0.0,Cloudy
02/24/2018,10:00,40.760677,-73.9873,MANHATTAN,1.0,0.0,1,0,0,0,0,0,3851567,2018-02-24 10:00:00,2018-02-24T10:00,2018,2,10.8,0.0,Cloudy
01/22/2018,9:00,40.7602,-73.971466,MANHATTAN,1.0,0.0,0,0,1,0,0,0,3833312,2018-01-22 09:00:00,2018-01-22T09:00,2018,1,5.3,0.0,Cloudy
12/24/2018,10:00,40.784943,-73.946594,MANHATTAN,1.0,0.0,0,0,1,0,0,0,4051445,2018-12-24 10:00:00,2018-12-24T10:00,2018,12,3.1,0.1,Drizzle
09/26/2018,20:00,40.77592,-73.95317,MANHATTAN,0.0,0.0,0,0,0,0,0,0,3988679,2018-09-26 20:00:00,2018-09-26T20:00,2018,9,22.8,3.4,Heavy Rain
01/22/2018,23:00,40.69336,-73.75207,QUEENS,1.0,0.0,0,0,0,0,1,0,3832958,2018-01-22 23:00:00,2018-01-22T23:00,2018,1,5.1,0.0,Cloudy
07/12/2018,14:00,40.67502,-73.86133,QUEENS,0.0,0.0,0,0,0,0,0,0,3939896,2018-07-12 14:00:00,2018-07-12T14:00,2018,7,25.2,0.0,Clear
09/21/2018,18:00,40.71884,-73.86413,QUEENS,0.0,0.0,0,0,0,0,0,0,3985365,2018-09-21 18:00:00,2018-09-21T18:00,2018,9,21.1,0.0,Clear
02/26/2018,14:00,40.722466,-73.8675,QUEENS,0.0,0.0,0,0,0,0,0,0,3852689,2018-02-26 14:00:00,2018-02-26T14:00,2018,2,10.7,0.0,Cloudy
06/30/2018,18:00,40.674133,-73.85826,QUEENS,2.0,0.0,0,0,0,0,2,0,3932974,2018-06-30 18:00:00,2018-06-30T18:00,2018,6,25.6,0.0,Clear
02/17/2018,19:00,40.678852,-73.834114,QUEENS,1.0,0.0,1,0,0,0,0,0,3848967,2018-02-17 19:00:00,2018-02-17T19:00,2018,2,1.5,0.7,Light Snow
10/15/2018,21:00,40.75771,-73.93216,QUEENS,1.0,0.0,0,0,1,0,0,0,4000854,2018-10-15 21:00:00,2018-10-15T21:00,2018,10,19.5,0.1,Drizzle
11/23/2018,0:00,40.65792,-73.72883,QUEENS,0.0,0.0,0,0,0,0,0,0,4031178,2018-11-23 00:00:00,2018-11-23T00:00,2018,11,-7.6,0.0,Clear
10/18/2018,12:00,40.748924,-73.937386,QUEENS,1.0,0.0,0,0,0,0,1,0,4002750,2018-10-18 12:00:00,2018-10-18T12:00,2018,10,8.6,0.0,Clear
07/22/2018,10:00,40.68815,-73.72963,QUEENS,3.0,0.0,0,0,0,0,3,0,3947943,2018-07-22 10:00:00,2018-07-22T10:00,2018,7,24.5,0.0,Cloudy
11/06/2018,13:00,40.70191,-73.892845,QUEENS,0.0,0.0,0,0,0,0,0,0,4016972,2018-11-06 13:00:00,2018-11-06T13:00,2018,11,17.1,1.8,Light Rain
09/03/2018,20:00,40.693295,-73.80802,QUEENS,1.0,0.0,0,0,0,0,1,0,3973113,2018-09-03 20:00:00,2018-09-03T20:00,2018,9,25.4,0.0,Cloudy
08/04/2018,11:00,40.720043,-73.76184,QUEENS,2.0,0.0,0,0,0,0,2,0,3955324,2018-08-04 11:00:00,2018-08-04T11:00,2018,8,23.7,1.3,Light Rain
01/24/2018,16:00,40.739067,-73.89588,QUEENS,1.0,0.0,1,0,0,0,0,0,3834340,2018-01-24 16:00:00,2018-01-24T16:00,2018,1,2.5,0.0,Clear
02/09/2018,8:00,40.751575,-73.85584,QUEENS,1.0,0.0,1,0,0,0,0,0,3843544,2018-02-09 08:00:00,2018-02-09T08:00,2018,2,-4.2,0.0,Clear
04/01/2018,15:00,40.770435,-73.83421,QUEENS,1.0,0.0,0,0,0,0,1,0,3873250,2018-04-01 15:00:00,2018-04-01T15:00,2018,4,11.3,0.0,Cloudy
05/27/2018,14:00,40.765873,-73.8089,QUEENS,2.0,0.0,0,0,0,0,2,0,3908732,2018-05-27 14:00:00,2018-05-27T14:00,2018,5,14.4,0.0,Cloudy
12/01/2018,4:00,40.689373,-73.7937,QUEENS,2.0,0.0,0,0,0,0,2,0,4041577,2018-12-01 04:00:00,2018-12-01T04:00,2018,12,0.6,0.0,Clear
02/24/2018,13:00,40.6854,-73.82947,QUEENS,1.0,0.0,1,0,0,0,0,0,3851578,2018-02-24 13:00:00,2018-02-24T13:00,2018,2,12.2,0.0,Cloudy
07/12/2018,10:00,40.677563,-73.85286,QUEENS,1.0,0.0,0,0,0,0,1,0,3940022,2018-07-12 10:00:00,2018-07-12T10:00,2018,7,24.8,0.0,Clear
06/08/2018,21:00,40.785835,-73.850426,QUEENS,1.0,0.0,0,0,0,0,1,0,3917272,2018-06-08 21:00:00,2018-06-08T21:00,2018,6,21.5,0.0,Clear
07/27/2018,9:00,40.72106,-73.75945,QUEENS,0.0,0.0,0,0,0,0,0,0,3949522,2018-07-27 09:00:00,2018-07-27T09:00,2018,7,27.4,0.0,Clear
01/03/2018,16:00,40.706303,-73.79893,QUEENS,1.0,0.0,0,0,0,0,1,0,3821527,2018-01-03 16:00:00,2018-01-03T16:00,2018,1,-3.0,0.0,Clear
07/28/2018,19:00,40.700367,-73.906624,QUEENS,1.0,0.0,0,0,0,0,1,0,3950605,2018-07-28 19:00:00,2018-07-28T19:00,2018,7,23.8,0.0,Cloudy
11/15/2018,17:00,40.68818,-73.78869,QUEENS,0.0,0.0,0,0,0,0,0,0,4026780,2018-11-15 17:00:00,2018-11-15T17:00,2018,11,1.5,3.6,Heavy Snow
10/21/2018,3:00,40.76132,-73.9171,QUEENS,3.0,0.0,0,0,0,0,3,0,4004021,2018-10-21 03:00:00,2018-10-21T03:00,2018,10,8.1,0.0,Cloudy
03/16/2018,21:00,40.76961,-73.831505,QUEENS,1.0,0.0,1,0,0,0,0,0,3864360,2018-03-16 21:00:00,2018-03-16T21:00,2018,3,-0.9,0.0,Clear
03/30/2018,23:00,40.740875,-73.89962,QUEENS,1.0,0.0,0,0,0,0,1,0,3872565,2018-03-30 23:00:00,2018-03-30T23:00,2018,3,5.0,0.0,Clear
01/26/2018,20:00,40.765823,-73.87795,QUEENS,1.0,0.0,0,0,0,0,1,0,3839704,2018-01-26 20:00:00,2018-01-26T20:00,2018,1,-0.3,0.0,Clear
07/19/2018,18:00,40.67759,-73.74479,QUEENS,0.0,0.0,0,0,0,0,0,0,3957212,2018-07-19 18:00:00,2018-07-19T18:00,2018,7,23.1,0.0,Clear
07/14/2018,0:00,40.682144,-73.74631,QUEENS,1.0,0.0,0,0,0,0,1,0,3941456,2018-07-14 00:00:00,2018-07-14T00:00,2018,7,20.9,0.0,Clear
11/21/2018,11:00,40.784466,-73.79995,QUEENS,1.0,0.0,0,0,0,0,1,0,4030404,2018-11-21 11:00:00,2018-11-21T11:00,2018,11,4.7,0.0,Clear
02/19/2018,9:00,40.602192,-73.75523,QUEENS,1.0,0.0,1,0,0,0,0,0,3849380,2018-02-19 09:00:00,2018-02-19T09:00,2018,2,4.8,0.0,Clear
01/08/2018,8:00,40.710144,-73.73752,QUEENS,1.0,0.0,0,0,0,0,1,0,3824322,2018-01-08 08:00:00,2018-01-08T08:00,2018,1,-7.9,0.0,Cloudy
04/17/2018,21:00,40.72527,-73.816154,QUEENS,4.0,0.0,0,0,0,0,4,0,3883493,2018-04-17 21:00:00,2018-04-17T21:00,2018,4,3.7,0.0,Clear
07/02/2018,11:00,40.790203,-73.79654,QUEENS,0.0,0.0,0,0,0,0,0,0,3933198,2018-07-02 11:00:00,2018-07-02T11:00,2018,7,33.1,0.0,Clear
10/13/2018,19:00,40.741936,-73.95381,QUEENS,0.0,0.0,0,0,0,0,0,0,3999098,2018-10-13 19:00:00,2018-10-13T19:00,2018,10,11.3,0.0,Clear
11/27/2018,19:00,40.67252,-73.8106,QUEENS,0.0,0.0,0,0,0,0,0,0,4033869,2018-11-27 19:00:00,2018-11-27T19:00,2018,11,3.6,0.0,Clear
09/26/2018,18:00,40.665245,-73.80204,QUEENS,2.0,0.0,0,0,0,0,2,0,3987883,2018-09-26 18:00:00,2018-09-26T18:00,2018,9,23.4,0.0,Cloudy
05/13/2018,17:00,40.70089,-73.89336,QUEENS,0.0,0.0,0,0,0,0,0,0,3900087,2018-05-13 17:00:00,2018-05-13T17:00,2018,5,11.7,0.1,Drizzle
02/03/2018,17:00,40.71467,-73.74259,QUEENS,2.0,0.0,0,0,0,0,2,0,3839694,2018-02-03 17:00:00,2018-02-03T17:00,2018,2,-1.8,0.0,Clear
06/27/2018,18:00,40.78015,-73.84511,QUEENS,1.0,0.0,0,0,0,0,1,0,3929958,2018-06-27 18:00:00,2018-06-27T18:00,2018,6,21.0,0.3,Drizzle
01/27/2018,18:00,40.75583,-73.78734,QUEENS,1.0,0.0,0,0,0,0,1,0,3835820,2018-01-27 18:00:00,2018-01-27T18:00,2018,1,9.5,0.0,Cloudy
02/17/2018,20:00,40.72298,-73.73127,QUEENS,0.0,0.0,0,0,0,0,0,0,3848013,2018-02-17 20:00:00,2018-02-17T20:00,2018,2,0.8,2.3,Heavy Snow
09/23/2018,1:00,40.73191,-73.87124,QUEENS,1.0,0.0,0,0,0,0,1,0,3985794,2018-09-23 01:00:00,2018-09-23T01:00,2018,9,15.7,0.0,Cloudy
09/28/2018,9:00,40.732536,-73.765564,QUEENS,1.0,0.0,0,0,0,0,1,0,3989590,2018-09-28 09:00:00,2018-09-28T09:00,2018,9,15.1,0.1,Drizzle
05/30/2018,20:00,40.691395,-73.83741,QUEENS,0.0,0.0,0,0,0,0,0,0,3911337,2018-05-30 20:00:00,2018-05-30T20:00,2018,5,14.1,0.0,Clear
01/06/2018,10:00,40.691307,-73.75791,QUEENS,0.0,0.0,0,0,0,0,0,0,3823258,2018-01-06 10:00:00,2018-01-06T10:00,2018,1,-13.7,0.0,Clear
02/05/2018,23:00,40.757324,-73.834,QUEENS,1.0,0.0,0,0,0,0,1,0,3841126,2018-02-05 23:00:00,2018-02-05T23:00,2018,2,-5.6,0.0,Clear
11/19/2018,12:00,40.712772,-73.77201,QUEENS,2.0,0.0,0,0,0,0,2,0,4029239,2018-11-19 12:00:00,2018-11-19T12:00,2018,11,10.3,0.0,Cloudy
06/21/2018,18:00,40.691883,-73.76412,QUEENS,0.0,0.0,0,0,0,0,0,0,3926931,2018-06-21 18:00:00,2018-06-21T18:00,2018,6,22.7,0.0,Cloudy
06/14/2018,21:00,40.667847,-73.77612,QUEENS,1.0,0.0,0,0,0,0,1,0,3921660,2018-06-14 21:00:00,2018-06-14T21:00,2018,6,21.2,0.0,Clear
05/22/2018,0:00,40.65616,-73.76736,QUEENS,0.0,0.0,0,0,0,0,0,0,3905089,2018-05-22 00:00:00,2018-05-22T00:00,2018,5,13.1,0.0,Cloudy
03/20/2018,15:00,40.734947,-73.78518,QUEENS,0.0,0.0,0,0,0,0,0,0,3866456,2018-03-20 15:00:00,2018-03-20T15:00,2018,3,2.4,0.1,Light Snow
05/07/2018,15:00,40.72501,-73.72205,QUEENS,0.0,0.0,0,0,0,0,0,0,3895800,2018-05-07 15:00:00,2018-05-07T15:00,2018,5,19.4,0.0,Cloudy
01/10/2018,20:00,40.73633,-73.88386,QUEENS,1.0,0.0,0,0,0,0,1,0,3830116,2018-01-10 20:00:00,2018-01-10T20:00,2018,1,2.2,0.0,Cloudy
04/08/2018,17:00,40.658154,-73.73815,QUEENS,2.0,0.0,0,0,0,0,2,0,3876760,2018-04-08 17:00:00,2018-04-08T17:00,2018,4,5.2,0.0,Clear
06/23/2018,13:00,40.733536,-73.87035,QUEENS,0.0,0.0,0,0,0,0,0,0,3928677,2018-06-23 13:00:00,2018-06-23T13:00,2018,6,20.9,0.4,Drizzle
07/02/2018,19:00,40.663944,-73.84105,QUEENS,0.0,0.0,0,0,0,0,0,0,3933878,2018-07-02 19:00:00,2018-07-02T19:00,2018,7,24.2,0.0,Clear
08/03/2018,12:00,40.75482,-73.84499,QUEENS,1.0,0.0,0,0,0,0,1,0,3954359,2018-08-03 12:00:00,2018-08-03T12:00,2018,8,27.3,1.9,Light Rain
08/26/2018,12:00,40.688953,-73.75985,QUEENS,1.0,0.0,0,0,0,0,1,0,3968923,2018-08-26 12:00:00,2018-08-26T12:00,2018,8,24.6,0.0,Clear
02/27/2018,18:00,40.731247,-73.782135,QUEENS,3.0,0.0,0,0,0,0,3,0,3853588,2018-02-27 18:00:00,2018-02-27T18:00,2018,2,4.9,0.0,Clear
08/26/2018,16:00,40.6873,-73.7331,QUEENS,2.0,0.0,0,0,0,0,2,0,3968131,2018-08-26 16:00:00,2018-08-26T16:00,2018,8,24.5,0.0,Clear
01/08/2018,9:00,40.720276,-73.80797,QUEENS,0.0,0.0,0,0,0,0,0,0,3825246,2018-01-08 09:00:00,2018-01-08T09:00,2018,1,-6.7,0.0,Cloudy
02/14/2018,0:00,40.708447,-73.800224,QUEENS,2.0,0.0,0,0,0,0,2,0,3846133,2018-02-14 00:00:00,2018-02-14T00:00,2018,2,1.5,0.0,Cloudy
08/11/2018,14:00,40.75322,-73.85967,QUEENS,2.0,0.0,0,0,0,0,2,0,3959243,2018-08-11 14:00:00,2018-08-11T14:00,2018,8,24.2,1.3,Light Rain
07/21/2018,22:00,40.59994,-73.74101,QUEENS,1.0,0.0,1,0,0,0,0,0,3948667,2018-07-21 22:00:00,2018-07-21T22:00,2018,7,22.0,1.9,Light Rain
05/13/2018,21:00,40.66454,-73.82276,QUEENS,1.0,0.0,0,0,0,0,1,0,3900393,2018-05-13 21:00:00,2018-05-13T21:00,2018,5,11.0,1.3,Light Rain
09/12/2018,12:00,40.713985,-73.73812,QUEENS,1.0,0.0,0,0,0,0,1,0,3979513,2018-09-12 12:00:00,2018-09-12T12:00,2018,9,25.6,0.0,Cloudy
03/24/2018,10:00,40.742096,-73.86748,QUEENS,1.0,0.0,1,0,0,0,0,0,3871563,2018-03-24 10:00:00,2018-03-24T10:00,2018,3,5.7,0.0,Clear
01/05/2018,14:00,40.761623,-73.82208,QUEENS,1.0,0.0,0,0,0,0,1,0,3823221,2018-01-05 14:00:00,2018-01-05T14:00,2018,1,-11.8,0.0,Clear
02/09/2018,0:00,40.678364,-73.77949,QUEENS,0.0,0.0,0,0,0,0,0,0,3844938,2018-02-09 00:00:00,2018-02-09T00:00,2018,2,-4.3,0.0,Clear
05/17/2018,7:00,40.753727,-73.873436,QUEENS,1.0,0.0,1,0,0,0,0,0,3905454,2018-05-17 07:00:00,2018-05-17T07:00,2018,5,13.5,1.6,Light Rain
12/17/2018,21:00,40.725006,-73.8792,QUEENS,2.0,0.0,0,0,0,0,2,0,4050024,2018-12-17 21:00:00,2018-12-17T21:00,2018,12,3.7,0.0,Clear
10/11/2018,20:00,40.68081,-73.84521,QUEENS,1.0,0.0,1,0,0,0,0,0,3998275,2018-10-11 20:00:00,2018-10-11T20:00,2018,10,21.7,1.3,Light Rain
08/14/2018,18:00,40.706413,-73.79238,QUEENS,1.0,0.0,0,0,0,0,1,0,3963127,2018-08-14 18:00:00,2018-08-14T18:00,2018,8,23.3,0.0,Cloudy
12/20/2018,19:00,40.704536,-73.802284,QUEENS,1.0,0.0,1,0,0,0,0,0,4055809,2018-12-20 19:00:00,2018-12-20T19:00,2018,12,7.3,0.9,Drizzle
07/19/2018,14:00,40.678295,-73.808075,QUEENS,1.0,0.0,0,0,0,0,1,0,3947810,2018-07-19 14:00:00,2018-07-19T14:00,2018,7,25.3,0.0,Clear
08/10/2018,0:00,40.68231,-73.84495,QUEENS,2.0,0.0,0,0,0,0,2,0,3958613,2018-08-10 00:00:00,2018-08-10T00:00,2018,8,22.3,0.0,Clear
03/30/2018,16:00,40.701267,-73.78816,QUEENS,1.0,0.0,0,0,0,0,1,0,3873754,2018-03-30 16:00:00,2018-03-30T16:00,2018,3,12.4,0.3,Drizzle
12/16/2018,0:00,40.733776,-73.86632,QUEENS,1.0,0.0,0,0,0,0,1,0,4046049,2018-12-16 00:00:00,2018-12-16T00:00,2018,12,6.7,0.0,Cloudy
06/24/2018,20:00,40.728024,-73.74764,QUEENS,1.0,0.0,0,0,0,0,1,0,3928586,2018-06-24 20:00:00,2018-06-24T20:00,2018,6,23.5,0.2,Drizzle
10/18/2018,20:00,40.74575,-73.71438,QUEENS,1.0,0.0,1,0,0,0,0,0,4003447,2018-10-18 20:00:00,2018-10-18T20:00,2018,10,5.7,0.0,Clear
05/16/2018,14:00,40.72755,-73.80027,QUEENS,0.0,0.0,0,0,0,0,0,0,3901998,2018-05-16 14:00:00,2018-05-16T14:00,2018,5,14.9,1.0,Drizzle
03/09/2018,19:00,40.765743,-73.89239,QUEENS,0.0,0.0,0,0,0,0,0,0,3859844,2018-03-09 19:00:00,2018-03-09T19:00,2018,3,2.1,0.0,Clear
01/03/2018,11:00,40.784916,-73.84213,QUEENS,1.0,0.0,0,0,0,0,1,0,3821567,2018-01-03 11:00:00,2018-01-03T11:00,2018,1,-5.5,0.0,Cloudy
01/26/2018,18:00,40.70967,-73.77404,QUEENS,2.0,0.0,0,0,0,0,2,0,3836215,2018-01-26 18:00:00,2018-01-26T18:00,2018,1,-1.7,0.0,Clear
03/05/2018,16:00,40.705746,-73.8097,QUEENS,1.0,0.0,1,0,0,0,0,0,3856984,2018-03-05 16:00:00,2018-03-05T16:00,2018,3,4.7,0.0,Cloudy
09/04/2018,16:00,40.750183,-73.86799,QUEENS,1.0,0.0,0,0,0,0,1,0,3976987,2018-09-04 16:00:00,2018-09-04T16:00,2018,9,32.0,0.0,Cloudy
11/20/2018,8:00,40.710747,-73.75066,QUEENS,0.0,0.0,0,0,0,0,0,0,4034062,2018-11-20 08:00:00,2018-11-20T08:00,2018,11,5.8,0.2,Drizzle
07/23/2018,18:00,40.60428,-73.755806,QUEENS,1.0,0.0,0,0,0,0,1,0,3948374,2018-07-23 18:00:00,2018-07-23T18:00,2018,7,24.1,0.0,Clear
03/02/2018,15:00,40.784492,-73.77998,QUEENS,0.0,0.0,0,0,0,0,0,0,3856347,2018-03-02 15:00:00,2018-03-02T15:00,2018,3,2.8,1.5,Light Snow
02/16/2018,14:00,40.65965,-73.773834,QUEENS,1.0,0.0,0,0,0,0,1,0,3847269,2018-02-16 14:00:00,2018-02-16T14:00,2018,2,12.5,0.1,Drizzle
04/02/2018,20:00,40.74662,-73.89359,QUEENS,1.0,0.0,1,0,0,0,0,0,3874315,2018-04-02 20:00:00,2018-04-02T20:00,2018,4,0.5,0.0,Cloudy
02/16/2018,0:00,40.78168,-73.82102,QUEENS,1.0,0.0,1,0,0,0,0,0,3848168,2018-02-16 00:00:00,2018-02-16T00:00,2018,2,11.6,2.2,Light Rain
05/20/2018,8:00,40.741135,-73.93524,QUEENS,0.0,0.0,0,0,0,0,0,0,3904711,2018-05-20 08:00:00,2018-05-20T08:00,2018,5,20.8,0.1,Drizzle
02/07/2018,17:00,40.768795,-73.73708,QUEENS,0.0,0.0,0,0,0,0,0,0,3842232,2018-02-07 17:00:00,2018-02-07T17:00,2018,2,10.4,1.9,Light Rain
12/06/2018,7:00,40.724792,-73.722916,QUEENS,0.0,0.0,0,0,0,0,0,0,4040782,2018-12-06 07:00:00,2018-12-06T07:00,2018,12,-3.5,0.0,Cloudy
06/14/2018,22:00,40.691795,-73.84376,QUEENS,1.0,0.0,0,0,0,0,1,0,3921582,2018-06-14 22:00:00,2018-06-14T22:00,2018,6,19.1,0.0,Clear
03/23/2018,14:00,40.716793,-73.92155,QUEENS,0.0,0.0,0,0,0,0,0,0,3872816,2018-03-23 14:00:00,2018-03-23T14:00,2018,3,6.7,0.0,Cloudy
06/23/2018,8:00,40.691433,-73.89063,QUEENS,1.0,0.0,0,0,0,0,1,0,3927363,2018-06-23 08:00:00,2018-06-23T08:00,2018,6,17.2,0.3,Drizzle
04/27/2018,13:00,40.761967,-73.89695,QUEENS,1.0,0.0,0,0,0,0,1,0,3890368,2018-04-27 13:00:00,2018-04-27T13:00,2018,4,13.2,0.1,Drizzle
12/31/2018,21:00,40.6838,-73.72786,QUEENS,3.0,0.0,0,0,0,0,3,0,4055548,2018-12-31 21:00:00,2018-12-31T21:00,2018,12,7.2,3.6,Heavy Rain
04/25/2018,14:00,40.747963,-73.8809,QUEENS,1.0,0.0,0,0,1,0,0,0,3888513,2018-04-25 14:00:00,2018-04-25T14:00,2018,4,14.7,0.0,Cloudy
02/28/2018,19:00,40.75932,-73.86218,QUEENS,0.0,0.0,0,0,0,0,0,0,3855131,2018-02-28 19:00:00,2018-02-28T19:00,2018,2,8.8,0.0,Clear
07/14/2018,17:00,40.712204,-73.88665,QUEENS,1.0,0.0,0,0,0,0,1,0,3944681,2018-07-14 17:00:00,2018-07-14T17:00,2018,7,29.3,0.0,Clear
10/12/2018,12:00,40.71614,-73.83357,QUEENS,2.0,0.0,0,0,0,0,2,0,3998903,2018-10-12 12:00:00,2018-10-12T12:00,2018,10,16.1,0.0,Clear
04/02/2018,22:00,40.731785,-73.81082,QUEENS,2.0,0.0,0,0,0,0,2,0,3874035,2018-04-02 22:00:00,2018-04-02T22:00,2018,4,-0.8,0.0,Clear
06/22/2018,10:00,40.769558,-73.906075,QUEENS,0.0,0.0,0,0,0,0,0,0,3928286,2018-06-22 10:00:00,2018-06-22T10:00,2018,6,22.7,0.0,Cloudy
05/01/2018,14:00,40.765358,-73.80237,QUEENS,1.0,0.0,0,0,0,0,1,0,3891641,2018-05-01 14:00:00,2018-05-01T14:00,2018,5,23.4,0.0,Clear
09/02/2018,13:00,40.743374,-73.92056,QUEENS,0.0,0.0,0,0,0,0,0,0,3973546,2018-09-02 13:00:00,2018-09-02T13:00,2018,9,25.5,0.0,Clear
10/05/2018,20:00,40.695858,-73.81891,QUEENS,1.0,0.0,0,0,0,0,1,0,3996259,2018-10-05 20:00:00,2018-10-05T20:00,2018,10,17.1,0.0,Cloudy
01/03/2018,15:00,40.708138,-73.80303,QUEENS,0.0,0.0,0,0,0,0,0,0,3822286,2018-01-03 15:00:00,2018-01-03T15:00,2018,1,-2.2,0.0,Clear
12/03/2018,8:00,40.71815,-73.77505,QUEENS,1.0,0.0,0,0,0,0,1,0,4037806,2018-12-03 08:00:00,2018-12-03T08:00,2018,12,10.3,0.0,Cloudy
03/08/2018,14:00,40.69485,-73.822624,QUEENS,0.0,0.0,0,0,0,0,0,0,3858967,2018-03-08 14:00:00,2018-03-08T14:00,2018,3,6.0,0.0,Cloudy
05/26/2018,15:00,40.73434,-73.81478,QUEENS,0.0,0.0,0,0,0,0,0,0,3910121,2018-05-26 15:00:00,2018-05-26T15:00,2018,5,27.0,0.4,Drizzle
08/15/2018,23:00,40.752487,-73.8269,QUEENS,0.0,0.0,0,0,0,0,0,0,3961751,2018-08-15 23:00:00,2018-08-15T23:00,2018,8,24.6,0.0,Cloudy
06/10/2018,23:00,40.756344,-73.91342,QUEENS,1.0,0.0,0,0,0,0,1,0,3918264,2018-06-10 23:00:00,2018-06-10T23:00,2018,6,15.3,0.4,Drizzle
02/15/2018,20:00,40.750717,-73.894905,QUEENS,2.0,0.0,0,0,0,0,2,0,3847404,2018-02-15 20:00:00,2018-02-15T20:00,2018,2,11.5,0.1,Drizzle
01/27/2018,15:00,40.664356,-73.734535,QUEENS,0.0,0.0,0,0,0,0,0,0,3837667,2018-01-27 15:00:00,2018-01-27T15:00,2018,1,9.2,0.0,Cloudy
10/16/2018,8:00,40.680832,-73.732925,QUEENS,1.0,0.0,0,0,0,0,1,0,4002479,2018-10-16 08:00:00,2018-10-16T08:00,2018,10,8.9,0.0,Cloudy
11/18/2018,23:00,40.750717,-73.87217,QUEENS,0.0,0.0,0,0,0,0,0,0,4029203,2018-11-18 23:00:00,2018-11-18T23:00,2018,11,4.6,0.0,Cloudy
09/29/2018,0:00,40.74128,-73.90257,QUEENS,1.0,0.0,0,0,0,0,1,0,3990418,2018-09-29 00:00:00,2018-09-29T00:00,2018,9,15.1,0.0,Clear
07/24/2018,15:00,40.695496,-73.8035,QUEENS,1.0,0.0,0,0,1,0,0,0,3955180,2018-07-24 15:00:00,2018-07-24T15:00,2018,7,26.2,0.0,Clear
06/07/2018,10:00,40.656414,-73.76464,QUEENS,0.0,0.0,0,0,0,0,0,0,3916377,2018-06-07 10:00:00,2018-06-07T10:00,2018,6,17.0,0.0,Cloudy
01/02/2018,13:00,40.605286,-73.75185,QUEENS,1.0,0.0,0,0,0,0,1,0,3820991,2018-01-02 13:00:00,2018-01-02T13:00,2018,1,-4.0,0.0,Clear
05/25/2018,20:00,40.599243,-73.752495,QUEENS,2.0,0.0,0,0,0,0,2,0,3909885,2018-05-25 20:00:00,2018-05-25T20:00,2018,5,18.3,0.0,Clear
04/20/2018,0:00,40.690872,-73.806435,QUEENS,1.0,0.0,0,0,0,0,1,0,3885718,2018-04-20 00:00:00,2018-04-20T00:00,2018,4,2.4,0.0,Clear
07/03/2018,9:00,40.73312,-73.71856,QUEENS,1.0,0.0,0,0,0,0,1,0,3935699,2018-07-03 09:00:00,2018-07-03T09:00,2018,7,29.3,0.3,Drizzle
12/27/2018,4:00,40.754,-73.93632,QUEENS,0.0,0.0,0,0,0,0,0,0,4053118,2018-12-27 04:00:00,2018-12-27T04:00,2018,12,0.5,0.0,Clear
04/08/2018,11:00,40.759914,-73.77092,QUEENS,1.0,0.0,0,0,0,0,1,0,3877156,2018-04-08 11:00:00,2018-04-08T11:00,2018,4,5.4,0.0,Clear
11/03/2018,22:00,40.728966,-73.89559,QUEENS,5.0,0.0,0,0,0,0,5,0,4014162,2018-11-03 22:00:00,2018-11-03T22:00,2018,11,8.0,0.0,Clear
02/17/2018,11:00,40.75895,-73.76862,QUEENS,0.0,0.0,0,0,0,0,0,0,3847810,2018-02-17 11:00:00,2018-02-17T11:00,2018,2,2.9,0.0,Cloudy
10/03/2018,18:00,40.7318,-73.71709,QUEENS,0.0,0.0,0,0,0,0,0,0,3992997,2018-10-03 18:00:00,2018-10-03T18:00,2018,10,19.9,0.0,Clear
09/03/2018,12:00,40.73533,-73.86111,QUEENS,0.0,0.0,0,0,0,0,0,0,3973436,2018-09-03 12:00:00,2018-09-03T12:00,2018,9,30.2,0.0,Clear
03/29/2018,16:00,40.684746,-73.83112,QUEENS,1.0,0.0,1,0,0,0,0,0,3872653,2018-03-29 16:00:00,2018-03-29T16:00,2018,3,10.6,0.0,Cloudy
01/06/2018,15:00,40.788944,-73.838196,QUEENS,0.0,0.0,0,0,0,0,0,0,3824196,2018-01-06 15:00:00,2018-01-06T15:00,2018,1,-12.9,0.0,Clear
01/03/2018,14:00,40.758793,-73.87256,QUEENS,1.0,0.0,0,0,0,0,1,0,3821540,2018-01-03 14:00:00,2018-01-03T14:00,2018,1,-2.8,0.0,Cloudy
04/20/2018,21:00,40.7639,-73.875496,QUEENS,1.0,0.0,0,0,0,0,1,0,3886319,2018-04-20 21:00:00,2018-04-20T21:00,2018,4,4.0,0.0,Clear
04/29/2018,1:00,40.768513,-73.908875,QUEENS,0.0,0.0,0,0,0,0,0,0,3890788,2018-04-29 01:00:00,2018-04-29T01:00,2018,4,10.6,0.2,Drizzle
08/10/2018,13:00,40.673214,-73.733795,QUEENS,2.0,0.0,0,0,0,0,2,0,3958859,2018-08-10 13:00:00,2018-08-10T13:00,2018,8,28.7,0.0,Cloudy
03/25/2018,20:00,40.68677,-73.829185,QUEENS,1.0,0.0,1,0,0,0,0,0,3869394,2018-03-25 20:00:00,2018-03-25T20:00,2018,3,1.8,0.0,Clear
12/23/2018,12:00,40.74885,-73.94711,QUEENS,1.0,0.0,0,0,0,0,1,0,4050922,2018-12-23 12:00:00,2018-12-23T12:00,2018,12,4.7,0.0,Clear
11/09/2018,11:00,40.605114,-73.81973,QUEENS,1.0,0.0,0,0,0,0,1,0,4017543,2018-11-09 11:00:00,2018-11-09T11:00,2018,11,10.2,0.0,Cloudy
10/16/2018,16:00,40.76315,-73.88581,QUEENS,0.0,0.0,0,0,0,0,0,0,4002569,2018-10-16 16:00:00,2018-10-16T16:00,2018,10,13.1,0.0,Cloudy
06/26/2018,9:00,40.702156,-73.83879,QUEENS,1.0,0.0,0,0,0,0,1,0,3930980,2018-06-26 09:00:00,2018-06-26T09:00,2018,6,20.8,0.0,Clear
05/21/2018,19:00,40.665257,-73.735344,QUEENS,1.0,0.0,0,0,0,0,1,0,3904955,2018-05-21 19:00:00,2018-05-21T19:00,2018,5,14.3,0.0,Cloudy
01/11/2018,18:00,40.747944,-73.8809,QUEENS,1.0,0.0,0,0,1,0,0,0,3826340,2018-01-11 18:00:00,2018-01-11T18:00,2018,1,5.6,0.0,Cloudy
11/04/2018,20:00,40.684746,-73.83112,QUEENS,0.0,0.0,0,0,0,0,0,0,4014054,2018-11-04 20:00:00,2018-11-04T20:00,2018,11,6.0,0.0,Cloudy
11/30/2018,9:00,40.717285,-73.792274,QUEENS,1.0,0.0,0,0,0,0,1,0,4035574,2018-11-30 09:00:00,2018-11-30T09:00,2018,11,2.9,0.0,Cloudy
11/15/2018,15:00,40.69616,-73.78661,QUEENS,0.0,0.0,0,0,0,0,0,0,4021913,2018-11-15 15:00:00,2018-11-15T15:00,2018,11,1.9,2.2,Heavy Snow
11/10/2018,14:00,40.756947,-73.84405,QUEENS,3.0,0.0,0,0,0,0,3,0,4019067,2018-11-10 14:00:00,2018-11-10T14:00,2018,11,6.2,0.0,Cloudy
01/28/2018,23:00,40.664745,-73.74003,QUEENS,1.0,0.0,1,0,0,0,0,0,3838907,2018-01-28 23:00:00,2018-01-28T23:00,2018,1,6.7,0.0,Cloudy
04/15/2018,12:00,40.716156,-73.82094,QUEENS,0.0,0.0,0,0,0,0,0,0,3881447,2018-04-15 12:00:00,2018-04-15T12:00,2018,4,6.1,0.0,Cloudy
11/21/2018,16:00,40.700512,-73.796776,QUEENS,1.0,0.0,1,0,0,0,0,0,4030860,2018-11-21 16:00:00,2018-11-21T16:00,2018,11,6.2,0.0,Cloudy
04/23/2018,23:00,40.720158,-73.79877,QUEENS,1.0,0.0,0,0,0,0,1,0,3886493,2018-04-23 23:00:00,2018-04-23T23:00,2018,4,6.4,0.0,Cloudy
03/22/2018,8:00,40.718727,-73.841255,QUEENS,0.0,0.0,0,0,0,0,0,0,3867448,2018-03-22 08:00:00,2018-03-22T08:00,2018,3,1.3,0.0,Cloudy
11/14/2018,22:00,40.714584,-73.84831,QUEENS,3.0,0.0,0,0,0,0,3,0,4020960,2018-11-14 22:00:00,2018-11-14T22:00,2018,11,0.0,0.0,Cloudy
04/27/2018,18:00,40.7568,-73.873665,QUEENS,0.0,0.0,0,0,0,0,0,0,3890304,2018-04-27 18:00:00,2018-04-27T18:00,2018,4,12.1,0.0,Cloudy
05/22/2018,18:00,40.71061,-73.796036,QUEENS,0.0,0.0,0,0,0,0,0,0,3905728,2018-05-22 18:00:00,2018-05-22T18:00,2018,5,14.1,0.1,Drizzle
09/10/2018,22:00,40.70616,-73.768196,QUEENS,2.0,0.0,0,0,0,0,2,0,3978246,2018-09-10 22:00:00,2018-09-10T22:00,2018,9,18.4,0.7,Drizzle
01/31/2018,21:00,40.76796,-73.802956,QUEENS,1.0,0.0,0,0,0,0,1,0,3838069,2018-01-31 21:00:00,2018-01-31T21:00,2018,1,-1.5,0.0,Cloudy
06/21/2018,13:00,40.739956,-73.89421,QUEENS,1.0,0.0,0,0,0,0,1,0,3926484,2018-06-21 13:00:00,2018-06-21T13:00,2018,6,26.2,0.0,Cloudy
02/08/2018,17:00,40.701054,-73.90473,QUEENS,1.0,0.0,1,0,0,0,0,0,3842706,2018-02-08 17:00:00,2018-02-08T17:00,2018,2,-0.5,0.0,Clear
10/25/2018,5:00,40.68594,-73.84686,QUEENS,0.0,0.0,0,0,0,0,0,0,4006964,2018-10-25 05:00:00,2018-10-25T05:00,2018,10,4.3,0.0,Clear
07/10/2018,8:00,40.735123,-73.87524,QUEENS,1.0,0.0,0,0,0,0,1,0,3938749,2018-07-10 08:00:00,2018-07-10T08:00,2018,7,26.4,0.0,Clear
08/07/2018,18:00,40.711365,-73.78765,QUEENS,1.0,0.0,0,0,0,0,1,0,3959925,2018-08-07 18:00:00,2018-08-07T18:00,2018,8,27.2,0.1,Drizzle
05/30/2018,19:00,40.749325,-73.88518,QUEENS,0.0,0.0,0,0,0,0,0,0,3912124,2018-05-30 19:00:00,2018-05-30T19:00,2018,5,15.2,0.0,Clear
09/25/2018,15:00,40.70793,-73.78383,QUEENS,1.0,0.0,0,0,0,0,1,0,3988382,2018-09-25 15:00:00,2018-09-25T15:00,2018,9,22.0,1.4,Light Rain
06/22/2018,0:00,40.695465,-73.734886,QUEENS,2.0,0.0,0,0,0,0,2,0,3926351,2018-06-22 00:00:00,2018-06-22T00:00,2018,6,18.5,0.0,Cloudy
09/07/2018,18:00,40.689915,-73.7779,QUEENS,1.0,0.0,0,0,0,0,1,0,3976823,2018-09-07 18:00:00,2018-09-07T18:00,2018,9,22.4,0.1,Drizzle
01/05/2018,12:00,40.57582,-73.84288,QUEENS,0.0,0.0,0,0,0,0,0,0,3823464,2018-01-05 12:00:00,2018-01-05T12:00,2018,1,-11.0,0.0,Clear
04/03/2018,18:00,40.755592,-73.815605,QUEENS,1.0,0.0,0,0,0,0,1,0,3875331,2018-04-03 18:00:00,2018-04-03T18:00,2018,4,6.0,0.1,Drizzle
03/11/2018,12:00,40.713295,-73.916245,QUEENS,2.0,0.0,0,0,0,0,2,0,3860887,2018-03-11 12:00:00,2018-03-11T12:00,2018,3,5.3,0.0,Clear
06/15/2018,14:00,40.681263,-73.83954,QUEENS,0.0,0.0,0,0,0,0,0,0,3921727,2018-06-15 14:00:00,2018-06-15T14:00,2018,6,23.4,0.0,Clear
01/05/2018,12:00,40.767784,-73.87418,QUEENS,0.0,0.0,0,0,0,0,0,0,3824242,2018-01-05 12:00:00,2018-01-05T12:00,2018,1,-12.3,0.0,Clear
10/26/2018,11:00,40.755848,-73.93464,QUEENS,0.0,0.0,0,0,0,0,0,0,4012574,2018-10-26 11:00:00,2018-10-26T11:00,2018,10,8.2,0.0,Cloudy
12/20/2018,20:00,40.60992,-73.745,QUEENS,3.0,0.0,0,0,0,0,3,0,4049242,2018-12-20 20:00:00,2018-12-20T20:00,2018,12,9.0,1.7,Light Rain
05/02/2018,17:00,40.72556,-73.87965,QUEENS,1.0,0.0,0,0,0,0,1,0,3897641,2018-05-02 17:00:00,2018-05-02T17:00,2018,5,26.5,0.0,Cloudy
08/28/2018,17:00,40.73261,-73.8686,QUEENS,0.0,0.0,0,0,0,0,0,0,3970850,2018-08-28 17:00:00,2018-08-28T17:00,2018,8,32.6,0.0,Clear
09/23/2018,17:00,40.749294,-73.75579,QUEENS,1.0,0.0,0,0,0,0,1,0,3986040,2018-09-23 17:00:00,2018-09-23T17:00,2018,9,17.8,0.1,Drizzle
03/25/2018,12:00,40.70177,-73.9007,QUEENS,1.0,0.0,1,0,0,0,0,0,3882596,2018-03-25 12:00:00,2018-03-25T12:00,2018,3,6.6,0.1,Drizzle
03/13/2018,8:00,40.71928,-73.76362,QUEENS,1.0,0.0,0,0,0,0,1,0,3863515,2018-03-13 08:00:00,2018-03-13T08:00,2018,3,0.6,1.1,Heavy Snow
02/19/2018,15:00,40.733604,-73.84995,QUEENS,1.0,0.0,0,0,0,0,1,0,3849130,2018-02-19 15:00:00,2018-02-19T15:00,2018,2,7.6,0.0,Cloudy
07/27/2018,11:00,40.74975,-73.863976,QUEENS,0.0,0.0,0,0,0,0,0,0,3949405,2018-07-27 11:00:00,2018-07-27T11:00,2018,7,29.1,0.0,Cloudy
12/01/2018,3:00,40.602894,-73.75723,QUEENS,0.0,0.0,0,0,0,0,0,0,4037054,2018-12-01 03:00:00,2018-12-01T03:00,2018,12,3.1,0.0,Clear
07/18/2018,7:00,40.664192,-73.841125,QUEENS,0.0,0.0,0,0,0,0,0,0,3943659,2018-07-18 07:00:00,2018-07-18T07:00,2018,7,21.6,0.0,Clear
11/06/2018,14:00,40.70297,-73.86825,QUEENS,1.0,0.0,1,0,0,0,0,0,4016985,2018-11-06 14:00:00,2018-11-06T14:00,2018,11,18.3,2.3,Light Rain
08/10/2018,18:00,40.680275,-73.8417,QUEENS,0.0,0.0,0,0,0,0,0,0,3959011,2018-08-10 18:00:00,2018-08-10T18:00,2018,8,26.3,0.0,Cloudy
08/21/2018,0:00,40.67903,-73.77843,QUEENS,1.0,0.0,0,0,0,0,1,0,3966330,2018-08-21 00:00:00,2018-08-21T00:00,2018,8,20.3,0.0,Cloudy
03/07/2018,13:00,40.74128,-73.90257,QUEENS,1.0,0.0,0,0,0,0,1,0,3858307,2018-03-07 13:00:00,2018-03-07T13:00,2018,3,1.3,2.6,Heavy Snow
04/12/2018,14:00,40.746998,-73.92173,QUEENS,1.0,0.0,0,0,0,0,1,0,3879970,2018-04-12 14:00:00,2018-04-12T14:00,2018,4,10.5,0.0,Cloudy
12/20/2018,21:00,40.736362,-73.71284,QUEENS,3.0,0.0,0,0,0,0,3,0,4049326,2018-12-20 21:00:00,2018-12-20T21:00,2018,12,9.6,0.5,Drizzle
10/16/2018,16:00,40.76518,-73.88807,QUEENS,1.0,0.0,1,0,0,0,0,0,4004465,2018-10-16 16:00:00,2018-10-16T16:00,2018,10,13.1,0.0,Cloudy
11/12/2018,16:00,40.741104,-73.85382,QUEENS,1.0,0.0,1,0,0,0,0,0,4019688,2018-11-12 16:00:00,2018-11-12T16:00,2018,11,7.7,0.0,Cloudy
10/18/2018,0:00,40.761894,-73.8124,QUEENS,1.0,0.0,0,0,0,0,1,0,4002977,2018-10-18 00:00:00,2018-10-18T00:00,2018,10,7.5,0.0,Clear
10/30/2018,7:00,40.748676,-73.89455,QUEENS,0.0,0.0,0,0,0,0,0,0,4012587,2018-10-30 07:00:00,2018-10-30T07:00,2018,10,5.2,0.0,Clear
10/18/2018,21:00,40.70969,-73.921585,QUEENS,1.0,0.0,0,0,0,0,1,0,4005048,2018-10-18 21:00:00,2018-10-18T21:00,2018,10,5.5,0.0,Clear
11/26/2018,16:00,40.69803,-73.80203,QUEENS,1.0,0.0,1,0,0,0,0,0,4035607,2018-11-26 16:00:00,2018-11-26T16:00,2018,11,9.9,2.1,Light Rain
10/27/2018,17:00,40.736965,-73.897766,QUEENS,0.0,0.0,0,0,0,0,0,0,4008621,2018-10-27 17:00:00,2018-10-27T17:00,2018,10,11.7,1.3,Light Rain
01/11/2018,14:00,40.666393,-73.75177,QUEENS,1.0,0.0,0,0,0,0,1,0,3826567,2018-01-11 14:00:00,2018-01-11T14:00,2018,1,6.1,0.0,Cloudy
07/23/2018,9:00,40.746296,-73.93041,QUEENS,0.0,0.0,0,0,0,0,0,0,3947631,2018-07-23 09:00:00,2018-07-23T09:00,2018,7,23.6,2.7,Heavy Rain
07/30/2018,6:00,40.72365,-73.75158,QUEENS,1.0,0.0,0,0,0,0,1,0,3951706,2018-07-30 06:00:00,2018-07-30T06:00,2018,7,20.3,0.0,Cloudy
10/20/2018,13:00,40.745148,-73.95331,QUEENS,1.0,0.0,0,0,0,0,1,0,4003768,2018-10-20 13:00:00,2018-10-20T13:00,2018,10,16.4,0.0,Clear
10/27/2018,11:00,40.765114,-73.93148,QUEENS,0.0,0.0,0,0,0,0,0,0,4008760,2018-10-27 11:00:00,2018-10-27T11:00,2018,10,11.1,2.6,Heavy Rain
02/27/2018,19:00,40.734135,-73.86918,QUEENS,1.0,0.0,0,0,0,0,1,0,3854636,2018-02-27 19:00:00,2018-02-27T19:00,2018,2,4.8,0.0,Clear
09/18/2018,11:00,40.719757,-73.809685,QUEENS,1.0,0.0,0,0,0,0,1,0,3983248,2018-09-18 11:00:00,2018-09-18T11:00,2018,9,23.0,2.0,Light Rain
10/20/2018,8:00,40.71329,-73.72968,QUEENS,1.0,0.0,0,0,0,0,1,0,4003659,2018-10-20 08:00:00,2018-10-20T08:00,2018,10,12.7,0.2,Drizzle
05/08/2018,4:00,40.66386,-73.82297,QUEENS,1.0,0.0,0,0,0,0,1,0,3896322,2018-05-08 04:00:00,2018-05-08T04:00,2018,5,8.4,0.0,Cloudy
12/01/2018,4:00,40.662273,-73.85428,QUEENS,0.0,0.0,0,0,0,0,0,0,4036084,2018-12-01 04:00:00,2018-12-01T04:00,2018,12,0.6,0.0,Clear
02/28/2018,19:00,40.745632,-73.82931,QUEENS,0.0,0.0,0,0,0,0,0,0,3854178,2018-02-28 19:00:00,2018-02-28T19:00,2018,2,7.8,0.0,Clear
12/13/2018,13:00,40.66612,-73.82225,QUEENS,1.0,0.0,1,0,0,0,0,0,4043935,2018-12-13 13:00:00,2018-12-13T13:00,2018,12,6.0,0.2,Drizzle
02/16/2018,21:00,40.66232,-73.75743,QUEENS,0.0,0.0,0,0,0,0,0,0,3847479,2018-02-16 21:00:00,2018-02-16T21:00,2018,2,4.2,0.0,Clear
10/02/2018,10:00,40.699013,-73.79573,QUEENS,0.0,0.0,0,0,0,0,0,0,3992244,2018-10-02 10:00:00,2018-10-02T10:00,2018,10,22.1,0.0,Cloudy
07/17/2018,8:00,40.72802,-73.83022,QUEENS,2.0,0.0,0,0,0,0,2,0,3942972,2018-07-17 08:00:00,2018-07-17T08:00,2018,7,27.5,0.0,Cloudy
02/14/2018,22:00,40.756687,-73.94455,QUEENS,0.0,0.0,0,0,0,0,0,0,3846722,2018-02-14 22:00:00,2018-02-14T22:00,2018,2,5.9,0.0,Cloudy
03/08/2018,15:00,40.65925,-73.73475,QUEENS,1.0,0.0,1,0,0,0,0,0,3859304,2018-03-08 15:00:00,2018-03-08T15:00,2018,3,5.7,0.0,Cloudy
11/14/2018,0:00,40.667038,-73.757324,QUEENS,0.0,0.0,0,0,0,0,0,0,4029659,2018-11-14 00:00:00,2018-11-14T00:00,2018,11,5.6,0.0,Cloudy
06/16/2018,22:00,40.75726,-73.88188,QUEENS,2.0,0.0,0,0,0,0,2,0,3923018,2018-06-16 22:00:00,2018-06-16T22:00,2018,6,19.8,0.0,Cloudy
11/21/2018,19:00,40.677116,-73.729744,QUEENS,0.0,0.0,0,0,0,0,0,0,4030663,2018-11-21 19:00:00,2018-11-21T19:00,2018,11,4.4,0.0,Cloudy
08/30/2018,17:00,40.751637,-73.90985,QUEENS,1.0,0.0,1,0,0,0,0,0,3971003,2018-08-30 17:00:00,2018-08-30T17:00,2018,8,30.2,0.0,Cloudy
05/31/2018,17:00,40.746838,-73.710884,QUEENS,2.0,0.0,0,0,0,0,2,0,3911708,2018-05-31 17:00:00,2018-05-31T17:00,2018,5,18.6,0.0,Cloudy
04/09/2018,9:00,40.658657,-73.771996,QUEENS,0.0,0.0,0,0,0,0,0,0,3879163,2018-04-09 09:00:00,2018-04-09T09:00,2018,4,2.4,0.0,Cloudy
03/05/2018,15:00,40.757072,-73.85602,QUEENS,0.0,0.0,0,0,0,0,0,0,3858081,2018-03-05 15:00:00,2018-03-05T15:00,2018,3,4.9,0.0,Cloudy
11/15/2018,18:00,40.686695,-73.81498,QUEENS,2.0,0.0,0,0,0,0,2,0,4021523,2018-11-15 18:00:00,2018-11-15T18:00,2018,11,1.1,3.3,Heavy Snow
04/17/2018,17:00,40.73791,-73.77444,QUEENS,1.0,0.0,0,0,0,0,1,0,3882762,2018-04-17 17:00:00,2018-04-17T17:00,2018,4,6.6,0.0,Cloudy
04/25/2018,18:00,40.71388,-73.75404,QUEENS,1.0,0.0,0,0,0,0,1,0,3888139,2018-04-25 18:00:00,2018-04-25T18:00,2018,4,12.3,0.0,Cloudy
05/06/2018,0:00,40.717102,-73.75873,QUEENS,1.0,0.0,0,0,0,0,1,0,3894928,2018-05-06 00:00:00,2018-05-06T00:00,2018,5,14.6,0.0,Cloudy
06/13/2018,18:00,40.745495,-73.86293,QUEENS,0.0,0.0,0,0,0,0,0,0,3921231,2018-06-13 18:00:00,2018-06-13T18:00,2018,6,23.3,0.0,Cloudy
11/06/2018,15:00,40.75477,-73.82997,QUEENS,1.0,0.0,0,0,1,0,0,0,4017026,2018-11-06 15:00:00,2018-11-06T15:00,2018,11,15.8,1.2,Drizzle
10/01/2018,15:00,40.72214,-73.902275,QUEENS,0.0,0.0,0,0,0,0,0,0,3992807,2018-10-01 15:00:00,2018-10-01T15:00,2018,10,24.3,0.0,Cloudy
09/18/2018,9:00,40.723072,-73.90937,QUEENS,0.0,0.0,0,0,0,0,0,0,3984009,2018-09-18 09:00:00,2018-09-18T09:00,2018,9,23.6,5.2,Heavy Rain
11/24/2018,22:00,40.75899,-73.83454,QUEENS,0.0,0.0,0,0,0,0,0,0,4039544,2018-11-24 22:00:00,2018-11-24T22:00,2018,11,8.7,3.7,Heavy Rain
11/05/2018,17:00,40.752655,-73.89526,QUEENS,0.0,0.0,0,0,0,0,0,0,4016726,2018-11-05 17:00:00,2018-11-05T17:00,2018,11,11.3,0.1,Drizzle
03/31/2018,12:00,40.763462,-73.87804,QUEENS,1.0,0.0,0,0,0,0,1,0,3872916,2018-03-31 12:00:00,2018-03-31T12:00,2018,3,10.6,0.0,Clear
11/30/2018,23:00,40.70564,-73.75048,QUEENS,1.0,0.0,0,0,0,0,1,0,4036853,2018-11-30 23:00:00,2018-11-30T23:00,2018,11,3.1,0.0,Cloudy
03/28/2018,14:00,40.769886,-73.92781,QUEENS,1.0,0.0,0,0,1,0,0,0,3871717,2018-03-28 14:00:00,2018-03-28T14:00,2018,3,8.4,0.0,Cloudy
09/21/2018,15:00,40.72932,-73.8591,QUEENS,3.0,0.0,0,0,0,0,3,0,3987075,2018-09-21 15:00:00,2018-09-21T15:00,2018,9,23.1,0.0,Cloudy
07/13/2018,9:00,40.60426,-73.75286,QUEENS,1.0,0.0,1,0,0,0,0,0,3941590,2018-07-13 09:00:00,2018-07-13T09:00,2018,7,22.0,0.0,Cloudy
05/20/2018,0:00,40.780952,-73.819084,QUEENS,3.0,0.0,0,0,0,0,3,0,3903936,2018-05-20 00:00:00,2018-05-20T00:00,2018,5,16.4,0.0,Cloudy
06/02/2018,6:00,40.78167,-73.829216,QUEENS,1.0,0.0,0,0,0,0,1,0,3912847,2018-06-02 06:00:00,2018-06-02T06:00,2018,6,20.9,0.0,Cloudy
02/17/2018,19:00,40.686234,-73.82418,QUEENS,1.0,0.0,1,0,0,0,0,0,3849157,2018-02-17 19:00:00,2018-02-17T19:00,2018,2,1.5,0.7,Light Snow
02/23/2018,8:00,40.690357,-73.84109,QUEENS,0.0,0.0,0,0,0,0,0,0,3851969,2018-02-23 08:00:00,2018-02-23T08:00,2018,2,2.4,0.0,Cloudy
04/23/2018,19:00,40.680294,-73.76282,QUEENS,1.0,0.0,0,0,0,0,1,0,3887859,2018-04-23 19:00:00,2018-04-23T19:00,2018,4,7.1,0.0,Clear
03/08/2018,19:00,40.753468,-73.91355,QUEENS,1.0,0.0,1,0,0,0,0,0,3859895,2018-03-08 19:00:00,2018-03-08T19:00,2018,3,1.6,0.0,Cloudy
03/02/2018,19:00,40.735176,-73.881874,QUEENS,1.0,0.0,1,0,0,0,0,0,3856438,2018-03-02 19:00:00,2018-03-02T19:00,2018,3,2.3,0.7,Heavy Snow
11/01/2018,0:00,40.700806,-73.80677,QUEENS,0.0,0.0,0,0,0,0,0,0,4013810,2018-11-01 00:00:00,2018-11-01T00:00,2018,11,13.4,0.0,Cloudy
09/28/2018,0:00,40.770824,-73.77419,QUEENS,1.0,0.0,1,0,0,0,0,0,3989380,2018-09-28 00:00:00,2018-09-28T00:00,2018,9,17.0,1.6,Light Rain
06/26/2018,9:00,40.697533,-73.80906,QUEENS,0.0,0.0,0,0,0,0,0,0,3931029,2018-06-26 09:00:00,2018-06-26T09:00,2018,6,20.9,0.0,Clear
04/18/2018,9:00,40.67002,-73.78312,QUEENS,1.0,0.0,0,0,0,0,1,0,4116875,2018-04-18 09:00:00,2018-04-18T09:00,2018,4,6.4,0.0,Cloudy
09/14/2018,19:00,40.725075,-73.72799,QUEENS,0.0,0.0,0,0,0,0,0,0,3980919,2018-09-14 19:00:00,2018-09-14T19:00,2018,9,21.1,0.0,Clear
12/22/2018,15:00,40.66725,-73.73141,QUEENS,2.0,0.0,0,0,0,0,2,0,4050793,2018-12-22 15:00:00,2018-12-22T15:00,2018,12,6.0,0.0,Clear
07/01/2018,22:00,40.666893,-73.80546,QUEENS,0.0,0.0,0,0,0,0,0,0,3932360,2018-07-01 22:00:00,2018-07-01T22:00,2018,7,24.6,0.0,Clear
06/26/2018,17:00,40.74052,-73.70259,QUEENS,2.0,0.0,2,0,0,0,0,0,3929505,2018-06-26 17:00:00,2018-06-26T17:00,2018,6,21.6,0.0,Cloudy
11/14/2018,15:00,40.72717,-73.8109,QUEENS,4.0,0.0,0,0,0,0,4,0,4020838,2018-11-14 15:00:00,2018-11-14T15:00,2018,11,2.9,0.0,Cloudy
07/29/2018,15:00,40.74925,-73.858025,QUEENS,1.0,0.0,1,0,0,0,0,0,3950377,2018-07-29 15:00:00,2018-07-29T15:00,2018,7,27.8,0.0,Cloudy
10/25/2018,20:00,40.76229,-73.75711,QUEENS,1.0,0.0,1,0,0,0,0,0,4007878,2018-10-25 20:00:00,2018-10-25T20:00,2018,10,5.5,0.0,Cloudy
09/19/2018,11:00,40.692123,-73.75541,QUEENS,0.0,0.0,0,0,0,0,0,0,3984034,2018-09-19 11:00:00,2018-09-19T11:00,2018,9,25.8,0.0,Cloudy
12/05/2018,19:00,40.677654,-73.82866,QUEENS,1.0,0.0,1,0,0,0,0,0,4038984,2018-12-05 19:00:00,2018-12-05T19:00,2018,12,0.6,0.0,Cloudy
06/02/2018,20:00,40.76654,-73.8712,QUEENS,1.0,0.0,0,0,0,0,1,0,3912936,2018-06-02 20:00:00,2018-06-02T20:00,2018,6,22.6,0.4,Drizzle
09/08/2018,15:00,40.69297,-73.78024,QUEENS,1.0,0.0,0,0,0,0,1,0,3976828,2018-09-08 15:00:00,2018-09-08T15:00,2018,9,20.8,0.3,Drizzle
12/23/2018,17:00,40.6679,-73.84204,QUEENS,1.0,0.0,0,0,0,0,1,0,4051064,2018-12-23 17:00:00,2018-12-23T17:00,2018,12,3.1,0.0,Clear
07/08/2018,0:00,40.60957,-73.81905,QUEENS,1.0,0.0,0,0,0,0,1,0,3942543,2018-07-08 00:00:00,2018-07-08T00:00,2018,7,21.1,0.0,Clear
09/30/2018,16:00,40.713924,-73.80212,QUEENS,1.0,0.0,0,0,1,0,0,0,3992693,2018-09-30 16:00:00,2018-09-30T16:00,2018,9,18.7,0.0,Cloudy
07/03/2018,8:00,40.73155,-73.77132,QUEENS,0.0,0.0,0,0,0,0,0,0,3934267,2018-07-03 08:00:00,2018-07-03T08:00,2018,7,27.8,0.0,Clear
02/12/2018,14:00,40.706627,-73.815956,QUEENS,1.0,0.0,0,0,1,0,0,0,3845132,2018-02-12 14:00:00,2018-02-12T14:00,2018,2,4.4,0.0,Cloudy
12/26/2018,18:00,40.740784,-73.89893,QUEENS,2.0,0.0,0,0,0,0,2,0,4052643,2018-12-26 18:00:00,2018-12-26T18:00,2018,12,1.5,0.0,Clear
06/11/2018,9:00,40.70798,-73.801865,QUEENS,0.0,0.0,0,0,0,0,0,0,3919056,2018-06-11 09:00:00,2018-06-11T09:00,2018,6,17.0,0.0,Cloudy
09/27/2018,14:00,40.696663,-73.81207,QUEENS,0.0,0.0,0,0,0,0,0,0,3991384,2018-09-27 14:00:00,2018-09-27T14:00,2018,9,21.4,0.0,Cloudy
03/25/2018,15:00,40.750717,-73.85877,QUEENS,1.0,0.0,1,0,0,0,0,0,3869269,2018-03-25 15:00:00,2018-03-25T15:00,2018,3,7.4,0.0,Clear
09/02/2018,12:00,40.75842,-73.82939,QUEENS,0.0,0.0,0,0,0,0,0,0,3972749,2018-09-02 12:00:00,2018-09-02T12:00,2018,9,25.9,0.0,Clear
11/07/2018,17:00,40.744453,-73.92983,QUEENS,0.0,0.0,0,0,0,0,0,0,4017712,2018-11-07 17:00:00,2018-11-07T17:00,2018,11,14.3,0.0,Cloudy
11/02/2018,7:00,40.734188,-73.874,QUEENS,1.0,0.0,1,0,0,0,0,0,4014200,2018-11-02 07:00:00,2018-11-02T07:00,2018,11,18.7,0.1,Drizzle
04/06/2018,8:00,40.774426,-73.898796,QUEENS,0.0,0.0,0,0,0,0,0,0,3879430,2018-04-06 08:00:00,2018-04-06T08:00,2018,4,2.7,0.4,Heavy Snow
12/12/2018,7:00,40.744026,-73.92616,QUEENS,0.0,0.0,0,0,0,0,0,0,4043036,2018-12-12 07:00:00,2018-12-12T07:00,2018,12,-2.3,0.0,Clear
06/05/2018,17:00,40.711845,-73.859764,QUEENS,0.0,0.0,0,0,0,0,0,0,3915835,2018-06-05 17:00:00,2018-06-05T17:00,2018,6,21.1,0.0,Cloudy
08/03/2018,22:00,40.71388,-73.75404,QUEENS,0.0,0.0,0,0,0,0,0,0,3953288,2018-08-03 22:00:00,2018-08-03T22:00,2018,8,23.2,0.3,Drizzle
02/17/2018,19:00,40.710796,-73.78267,QUEENS,1.0,0.0,1,0,0,0,0,0,3852604,2018-02-17 19:00:00,2018-02-17T19:00,2018,2,1.3,0.8,Heavy Snow
05/31/2018,8:00,40.718987,-73.75139,QUEENS,1.0,0.0,0,0,0,0,1,0,3911780,2018-05-31 08:00:00,2018-05-31T08:00,2018,5,19.1,0.0,Cloudy
06/16/2018,23:00,40.77215,-73.929,QUEENS,1.0,0.0,0,0,1,0,0,0,3922854,2018-06-16 23:00:00,2018-06-16T23:00,2018,6,18.9,0.0,Clear
04/25/2018,15:00,40.69521,-73.81718,QUEENS,1.0,0.0,0,0,0,0,1,0,3888148,2018-04-25 15:00:00,2018-04-25T15:00,2018,4,13.5,0.0,Cloudy
03/16/2018,13:00,40.588215,-73.80515,QUEENS,0.0,0.0,0,0,0,0,0,0,3864260,2018-03-16 13:00:00,2018-03-16T13:00,2018,3,3.4,0.0,Cloudy
05/30/2018,18:00,40.706497,-73.89695,QUEENS,0.0,0.0,0,0,0,0,0,0,3911475,2018-05-30 18:00:00,2018-05-30T18:00,2018,5,17.0,0.0,Clear
01/23/2018,13:00,40.750877,-73.87146,QUEENS,0.0,0.0,0,0,0,0,0,0,3834126,2018-01-23 13:00:00,2018-01-23T13:00,2018,1,12.7,0.1,Drizzle
02/26/2018,18:00,40.735897,-73.825165,QUEENS,0.0,0.0,0,0,0,0,0,0,3856001,2018-02-26 18:00:00,2018-02-26T18:00,2018,2,7.4,0.0,Clear
02/10/2018,19:00,40.734398,-73.81478,QUEENS,1.0,0.0,0,0,0,0,1,0,3843941,2018-02-10 19:00:00,2018-02-10T19:00,2018,2,6.3,1.2,Drizzle
10/02/2018,18:00,40.750423,-73.78517,QUEENS,1.0,0.0,0,0,0,0,1,0,3992243,2018-10-02 18:00:00,2018-10-02T18:00,2018,10,21.5,0.3,Drizzle
09/02/2018,11:00,40.71323,-73.78145,QUEENS,0.0,0.0,0,0,0,0,0,0,3972119,2018-09-02 11:00:00,2018-09-02T11:00,2018,9,26.1,0.0,Clear
02/02/2018,17:00,40.71149,-73.76538,QUEENS,1.0,0.0,1,0,0,0,0,0,3839043,2018-02-02 17:00:00,2018-02-02T17:00,2018,2,-5.1,0.0,Clear
05/22/2018,4:00,40.663033,-73.77668,QUEENS,1.0,0.0,0,0,0,0,1,0,3905084,2018-05-22 04:00:00,2018-05-22T04:00,2018,5,12.5,0.0,Cloudy
12/14/2018,18:00,40.75563,-73.73907,QUEENS,1.0,0.0,0,0,0,0,1,0,4044852,2018-12-14 18:00:00,2018-12-14T18:00,2018,12,7.8,0.2,Drizzle
09/11/2018,13:00,40.689472,-73.8442,QUEENS,1.0,0.0,0,0,0,0,1,0,3978871,2018-09-11 13:00:00,2018-09-11T13:00,2018,9,24.7,0.0,Cloudy
04/17/2018,14:00,40.665222,-73.84465,QUEENS,0.0,0.0,0,0,0,0,0,0,3882537,2018-04-17 14:00:00,2018-04-17T14:00,2018,4,8.2,0.0,Cloudy
08/07/2018,22:00,40.716114,-73.8119,QUEENS,1.0,0.0,0,0,0,0,1,0,3957057,2018-08-07 22:00:00,2018-08-07T22:00,2018,8,23.4,0.0,Cloudy
10/25/2018,19:00,40.71772,-73.737915,QUEENS,1.0,0.0,0,0,0,0,1,0,4007702,2018-10-25 19:00:00,2018-10-25T19:00,2018,10,5.8,0.0,Cloudy
11/14/2018,11:00,40.77067,-73.7355,QUEENS,1.0,0.0,0,0,0,0,1,0,4020699,2018-11-14 11:00:00,2018-11-14T11:00,2018,11,3.6,0.0,Cloudy
01/09/2018,18:00,40.760254,-73.76935,QUEENS,0.0,0.0,0,0,0,0,0,0,3825385,2018-01-09 18:00:00,2018-01-09T18:00,2018,1,0.5,0.0,Clear
02/25/2018,13:00,40.743263,-73.91964,QUEENS,1.0,0.0,0,0,0,0,1,0,3853903,2018-02-25 13:00:00,2018-02-25T13:00,2018,2,6.6,0.8,Drizzle
12/05/2018,20:00,40.681488,-73.74568,QUEENS,1.0,0.0,0,0,0,0,1,0,4039002,2018-12-05 20:00:00,2018-12-05T20:00,2018,12,0.0,0.0,Cloudy
07/20/2018,21:00,40.751545,-73.87085,QUEENS,0.0,0.0,0,0,0,0,0,0,3945396,2018-07-20 21:00:00,2018-07-20T21:00,2018,7,20.6,0.0,Cloudy
10/29/2018,17:00,40.72202,-73.81936,QUEENS,1.0,0.0,0,0,0,0,1,0,4010301,2018-10-29 17:00:00,2018-10-29T17:00,2018,10,11.9,0.0,Clear
12/08/2018,19:00,40.6887,-73.73942,QUEENS,0.0,0.0,0,0,0,0,0,0,4040936,2018-12-08 19:00:00,2018-12-08T19:00,2018,12,-1.8,0.0,Cloudy
10/03/2018,12:00,40.76301,-73.7942,QUEENS,1.0,0.0,0,0,0,0,1,0,3992680,2018-10-03 12:00:00,2018-10-03T12:00,2018,10,23.7,0.0,Clear
09/28/2018,11:00,40.713055,-73.80897,QUEENS,1.0,0.0,0,0,0,0,1,0,3991544,2018-09-28 11:00:00,2018-09-28T11:00,2018,9,16.1,0.0,Cloudy
08/27/2018,19:00,40.654453,-73.73678,QUEENS,0.0,0.0,0,0,0,0,0,0,3969385,2018-08-27 19:00:00,2018-08-27T19:00,2018,8,24.2,0.0,Cloudy
01/09/2018,20:00,40.68476,-73.78742,QUEENS,0.0,0.0,0,0,0,0,0,0,3826151,2018-01-09 20:00:00,2018-01-09T20:00,2018,1,-1.1,0.0,Clear
07/02/2018,15:00,40.72667,-73.71484,QUEENS,1.0,0.0,0,0,0,0,1,0,3936266,2018-07-02 15:00:00,2018-07-02T15:00,2018,7,30.5,0.0,Clear
04/30/2018,9:00,40.77153,-73.78824,QUEENS,2.0,0.0,0,0,0,0,2,0,3891218,2018-04-30 09:00:00,2018-04-30T09:00,2018,4,9.5,0.0,Cloudy
05/27/2018,17:00,40.79346,-73.84167,QUEENS,0.0,0.0,0,0,0,0,0,0,3908718,2018-05-27 17:00:00,2018-05-27T17:00,2018,5,14.4,0.1,Drizzle
11/08/2018,15:00,40.784786,-73.84859,QUEENS,0.0,0.0,0,0,0,0,0,0,4016994,2018-11-08 15:00:00,2018-11-08T15:00,2018,11,12.2,0.0,Clear
01/07/2018,12:00,40.69975,-73.788185,QUEENS,0.0,0.0,0,0,0,0,0,0,3823763,2018-01-07 12:00:00,2018-01-07T12:00,2018,1,-14.1,0.0,Clear
09/22/2018,11:00,40.725918,-73.89535,QUEENS,0.0,0.0,0,0,0,0,0,0,3985884,2018-09-22 11:00:00,2018-09-22T11:00,2018,9,20.4,0.0,Cloudy
05/25/2018,21:00,40.711437,-73.74779,QUEENS,0.0,0.0,0,0,0,0,0,0,3907795,2018-05-25 21:00:00,2018-05-25T21:00,2018,5,22.5,0.0,Clear
07/06/2018,19:00,40.76229,-73.75711,QUEENS,0.0,0.0,0,0,0,0,0,0,3940657,2018-07-06 19:00:00,2018-07-06T19:00,2018,7,24.9,0.0,Cloudy
10/17/2018,14:00,40.729607,-73.82489,QUEENS,0.0,0.0,0,0,0,0,0,0,4004140,2018-10-17 14:00:00,2018-10-17T14:00,2018,10,16.2,0.0,Cloudy
05/30/2018,11:00,40.69317,-73.74483,QUEENS,1.0,0.0,0,0,0,0,1,0,3911837,2018-05-30 11:00:00,2018-05-30T11:00,2018,5,20.2,0.0,Cloudy
10/30/2018,9:00,40.7145,-73.77114,QUEENS,2.0,0.0,0,0,0,0,2,0,4014474,2018-10-30 09:00:00,2018-10-30T09:00,2018,10,7.7,0.0,Clear
03/10/2018,8:00,40.69595,-73.86237,QUEENS,1.0,0.0,1,0,0,0,0,0,3861098,2018-03-10 08:00:00,2018-03-10T08:00,2018,3,0.3,0.0,Clear
11/13/2018,13:00,40.766716,-73.928566,QUEENS,0.0,0.0,0,0,0,0,0,0,4021233,2018-11-13 13:00:00,2018-11-13T13:00,2018,11,9.1,0.0,Cloudy
02/03/2018,15:00,40.74802,-73.705376,QUEENS,3.0,0.0,0,0,0,0,3,0,3840514,2018-02-03 15:00:00,2018-02-03T15:00,2018,2,-0.9,0.0,Clear
03/23/2018,8:00,40.70887,-73.81871,QUEENS,2.0,0.0,0,0,0,0,2,0,3868212,2018-03-23 08:00:00,2018-03-23T08:00,2018,3,0.4,0.0,Cloudy
08/24/2018,0:00,40.79083,-73.845505,QUEENS,1.0,0.0,0,0,0,0,1,0,3967027,2018-08-24 00:00:00,2018-08-24T00:00,2018,8,17.5,0.0,Clear
07/22/2018,9:00,40.779224,-73.81898,QUEENS,0.0,0.0,0,0,0,0,0,0,3946574,2018-07-22 09:00:00,2018-07-22T09:00,2018,7,23.5,0.1,Drizzle
12/20/2018,8:00,40.656918,-73.74637,QUEENS,1.0,0.0,0,0,0,0,1,0,4048670,2018-12-20 08:00:00,2018-12-20T08:00,2018,12,0.9,0.0,Cloudy
07/31/2018,14:00,40.713448,-73.80183,QUEENS,2.0,0.0,0,0,0,0,2,0,3952665,2018-07-31 14:00:00,2018-07-31T14:00,2018,7,25.5,0.0,Cloudy
07/16/2018,22:00,40.690914,-73.72819,QUEENS,1.0,0.0,0,0,0,0,1,0,3943351,2018-07-16 22:00:00,2018-07-16T22:00,2018,7,23.8,0.6,Drizzle
08/30/2018,18:00,40.68046,-73.84309,QUEENS,1.0,0.0,1,0,0,0,0,0,3971106,2018-08-30 18:00:00,2018-08-30T18:00,2018,8,28.6,0.0,Cloudy
04/11/2018,13:00,40.704025,-73.89547,QUEENS,0.0,0.0,0,0,0,0,0,0,3878901,2018-04-11 13:00:00,2018-04-11T13:00,2018,4,8.5,0.1,Drizzle
01/17/2018,17:00,40.66537,-73.73254,QUEENS,1.0,0.0,0,0,0,0,1,0,3830357,2018-01-17 17:00:00,2018-01-17T17:00,2018,1,-0.6,0.0,Cloudy
02/21/2018,11:00,40.737507,-73.87726,QUEENS,0.0,0.0,0,0,0,0,0,0,3850310,2018-02-21 11:00:00,2018-02-21T11:00,2018,2,18.2,0.0,Cloudy
07/28/2018,19:00,40.68272,-73.82912,QUEENS,3.0,0.0,0,0,0,0,3,0,3949890,2018-07-28 19:00:00,2018-07-28T19:00,2018,7,23.9,0.0,Cloudy
06/27/2018,18:00,40.70241,-73.79253,QUEENS,2.0,0.0,0,0,0,0,2,0,3930846,2018-06-27 18:00:00,2018-06-27T18:00,2018,6,21.0,0.2,Drizzle
12/31/2018,21:00,40.743675,-73.88711,QUEENS,2.0,0.0,2,0,0,0,0,0,4055590,2018-12-31 21:00:00,2018-12-31T21:00,2018,12,6.8,3.2,Heavy Rain
07/19/2018,15:00,40.735947,-73.872185,QUEENS,1.0,0.0,0,0,0,0,1,0,3945123,2018-07-19 15:00:00,2018-07-19T15:00,2018,7,26.2,0.0,Clear
03/25/2018,21:00,40.66209,-73.73249,QUEENS,1.0,0.0,0,0,0,0,1,0,3870854,2018-03-25 21:00:00,2018-03-25T21:00,2018,3,1.6,0.0,Cloudy
07/03/2018,11:00,40.68167,-73.83781,QUEENS,1.0,0.0,0,0,0,0,1,0,3934072,2018-07-03 11:00:00,2018-07-03T11:00,2018,7,27.6,0.1,Drizzle
01/08/2018,16:00,40.69297,-73.78024,QUEENS,2.0,0.0,0,0,0,0,2,0,3824469,2018-01-08 16:00:00,2018-01-08T16:00,2018,1,-0.4,0.0,Cloudy
03/30/2018,12:00,40.69248,-73.8594,QUEENS,0.0,0.0,0,0,0,0,0,0,3873077,2018-03-30 12:00:00,2018-03-30T12:00,2018,3,13.1,0.6,Drizzle
09/04/2018,9:00,40.697872,-73.802376,QUEENS,0.0,0.0,0,0,0,0,0,0,3974773,2018-09-04 09:00:00,2018-09-04T09:00,2018,9,28.6,0.0,Cloudy
10/28/2018,4:00,40.74202,-73.92656,QUEENS,1.0,0.0,1,0,0,0,0,0,4010129,2018-10-28 04:00:00,2018-10-28T04:00,2018,10,7.5,0.0,Clear
01/27/2018,13:00,40.694675,-73.73228,QUEENS,2.0,0.0,0,0,0,0,2,0,3835771,2018-01-27 13:00:00,2018-01-27T13:00,2018,1,9.8,0.0,Cloudy
09/08/2018,3:00,40.7482,-73.9418,QUEENS,0.0,0.0,0,0,0,0,0,0,3987265,2018-09-08 03:00:00,2018-09-08T03:00,2018,9,20.5,0.0,Cloudy
07/12/2018,13:00,40.735527,-73.93698,QUEENS,0.0,0.0,0,0,0,0,0,0,3943992,2018-07-12 13:00:00,2018-07-12T13:00,2018,7,28.7,0.0,Clear
02/02/2018,0:00,40.730247,-73.8126,QUEENS,1.0,0.0,0,0,0,0,1,0,3839023,2018-02-02 00:00:00,2018-02-02T00:00,2018,2,2.0,1.0,Drizzle
02/22/2018,18:00,40.733604,-73.84995,QUEENS,1.0,0.0,1,0,0,0,0,0,3850541,2018-02-22 18:00:00,2018-02-22T18:00,2018,2,3.2,0.8,Drizzle
08/28/2018,16:00,40.68795,-73.82502,QUEENS,1.0,0.0,0,0,0,0,1,0,3978890,2018-08-28 16:00:00,2018-08-28T16:00,2018,8,29.4,0.0,Clear
02/11/2018,22:00,40.737465,-73.919846,QUEENS,1.0,0.0,1,0,0,0,0,0,3844018,2018-02-11 22:00:00,2018-02-11T22:00,2018,2,15.8,0.8,Drizzle
06/26/2018,14:00,40.764713,-73.823044,QUEENS,1.0,0.0,0,0,1,0,0,0,3929419,2018-06-26 14:00:00,2018-06-26T14:00,2018,6,22.4,0.0,Cloudy
02/03/2018,12:00,40.692455,-73.76814,QUEENS,1.0,0.0,0,0,0,0,1,0,3840935,2018-02-03 12:00:00,2018-02-03T12:00,2018,2,-2.7,0.0,Clear
04/12/2018,9:00,40.73029,-73.81606,QUEENS,1.0,0.0,0,0,0,0,1,0,3879682,2018-04-12 09:00:00,2018-04-12T09:00,2018,4,11.1,0.0,Cloudy
11/15/2018,11:00,40.69733,-73.76202,QUEENS,1.0,0.0,1,0,0,0,0,0,4030168,2018-11-15 11:00:00,2018-11-15T11:00,2018,11,0.7,0.0,Cloudy
05/01/2018,12:00,40.73659,-73.71181,QUEENS,0.0,0.0,0,0,0,0,0,0,3892043,2018-05-01 12:00:00,2018-05-01T12:00,2018,5,21.1,0.0,Clear
11/21/2018,12:00,40.70186,-73.88192,QUEENS,1.0,0.0,0,0,0,0,1,0,4030350,2018-11-21 12:00:00,2018-11-21T12:00,2018,11,6.6,0.0,Clear
08/30/2018,7:00,40.7411,-73.88569,QUEENS,1.0,0.0,1,0,0,0,0,0,3970646,2018-08-30 07:00:00,2018-08-30T07:00,2018,8,26.6,0.0,Cloudy
10/16/2018,14:00,40.755337,-73.843254,QUEENS,0.0,0.0,0,0,0,0,0,0,4001903,2018-10-16 14:00:00,2018-10-16T14:00,2018,10,13.2,0.0,Cloudy
07/01/2018,19:00,40.717113,-73.802086,QUEENS,0.0,0.0,0,0,0,0,0,0,3932302,2018-07-01 19:00:00,2018-07-01T19:00,2018,7,27.1,0.0,Clear
09/05/2018,13:00,40.768974,-73.773766,QUEENS,1.0,0.0,1,0,0,0,0,0,3976044,2018-09-05 13:00:00,2018-09-05T13:00,2018,9,29.0,0.0,Clear
05/26/2018,17:00,40.717827,-73.8724,QUEENS,1.0,0.0,0,0,0,0,1,0,3908850,2018-05-26 17:00:00,2018-05-26T17:00,2018,5,25.9,0.0,Cloudy
06/24/2018,17:00,40.75554,-73.81499,QUEENS,1.0,0.0,0,0,0,0,1,0,3927770,2018-06-24 17:00:00,2018-06-24T17:00,2018,6,25.1,0.6,Drizzle
10/05/2018,21:00,40.667522,-73.78063,QUEENS,1.0,0.0,0,0,0,0,1,0,3994907,2018-10-05 21:00:00,2018-10-05T21:00,2018,10,17.2,0.0,Cloudy
04/19/2018,0:00,40.58708,-73.81386,QUEENS,1.0,0.0,0,0,0,0,1,0,3884083,2018-04-19 00:00:00,2018-04-19T00:00,2018,4,7.6,0.1,Drizzle
12/14/2018,21:00,40.739025,-73.89408,QUEENS,0.0,0.0,0,0,0,0,0,0,4045159,2018-12-14 21:00:00,2018-12-14T21:00,2018,12,8.0,0.4,Drizzle
11/21/2018,21:00,40.697746,-73.75468,QUEENS,2.0,0.0,0,0,0,0,2,0,4031026,2018-11-21 21:00:00,2018-11-21T21:00,2018,11,1.2,0.0,Clear
07/13/2018,9:00,40.693283,-73.84107,QUEENS,1.0,0.0,0,0,0,0,1,0,3943069,2018-07-13 09:00:00,2018-07-13T09:00,2018,7,24.6,0.0,Cloudy
04/16/2018,11:00,40.760475,-73.9222,QUEENS,1.0,0.0,1,0,0,0,0,0,3882982,2018-04-16 11:00:00,2018-04-16T11:00,2018,4,14.9,2.9,Heavy Rain
02/10/2018,14:00,40.752007,-73.809845,QUEENS,2.0,0.0,0,0,0,0,2,0,3843770,2018-02-10 14:00:00,2018-02-10T14:00,2018,2,9.0,0.1,Drizzle
09/29/2018,15:00,40.686028,-73.82506,QUEENS,0.0,0.0,0,0,0,0,0,0,3990351,2018-09-29 15:00:00,2018-09-29T15:00,2018,9,22.3,0.0,Cloudy
03/23/2018,7:00,40.75048,-73.94051,QUEENS,0.0,0.0,0,0,0,0,0,0,3867883,2018-03-23 07:00:00,2018-03-23T07:00,2018,3,-1.1,0.0,Cloudy
05/22/2018,14:00,40.691456,-73.85012,QUEENS,0.0,0.0,0,0,0,0,0,0,3905951,2018-05-22 14:00:00,2018-05-22T14:00,2018,5,15.2,0.0,Cloudy
12/10/2018,7:00,40.704845,-73.80928,QUEENS,1.0,0.0,1,0,0,0,0,0,4041703,2018-12-10 07:00:00,2018-12-10T07:00,2018,12,-2.6,0.0,Clear
03/26/2018,8:00,40.66609,-73.82809,QUEENS,0.0,0.0,0,0,0,0,0,0,3870332,2018-03-26 08:00:00,2018-03-26T08:00,2018,3,2.8,0.0,Clear
12/01/2018,20:00,40.68343,-73.82661,QUEENS,0.0,0.0,0,0,0,0,0,0,4039346,2018-12-01 20:00:00,2018-12-01T20:00,2018,12,5.3,0.7,Drizzle
11/27/2018,17:00,40.72621,-73.920525,QUEENS,1.0,0.0,0,0,1,0,0,0,4033790,2018-11-27 17:00:00,2018-11-27T17:00,2018,11,4.0,0.0,Cloudy
03/08/2018,8:00,40.650265,-73.73739,QUEENS,1.0,0.0,0,0,0,0,1,0,3858897,2018-03-08 08:00:00,2018-03-08T08:00,2018,3,1.2,0.0,Clear
04/21/2018,16:00,40.77081,-73.890045,QUEENS,0.0,0.0,0,0,0,0,0,0,3885791,2018-04-21 16:00:00,2018-04-21T16:00,2018,4,15.6,0.0,Cloudy
07/27/2018,12:00,40.71135,-73.76077,QUEENS,1.0,0.0,0,0,0,0,1,0,3950265,2018-07-27 12:00:00,2018-07-27T12:00,2018,7,29.1,0.0,Cloudy
12/02/2018,6:00,40.70571,-73.90594,QUEENS,1.0,0.0,0,0,0,0,1,0,4036536,2018-12-02 06:00:00,2018-12-02T06:00,2018,12,10.5,0.7,Drizzle
03/29/2018,17:00,40.70775,-73.756325,QUEENS,1.0,0.0,0,0,0,0,1,0,3873477,2018-03-29 17:00:00,2018-03-29T17:00,2018,3,11.2,0.0,Clear
07/08/2018,12:00,40.680183,-73.8459,QUEENS,2.0,0.0,0,0,0,0,2,0,3937184,2018-07-08 12:00:00,2018-07-08T12:00,2018,7,24.2,0.0,Clear
05/28/2018,0:00,40.65965,-73.773834,QUEENS,1.0,0.0,0,0,0,0,1,0,3909515,2018-05-28 00:00:00,2018-05-28T00:00,2018,5,13.1,0.0,Cloudy
12/19/2018,8:00,40.695835,-73.72965,QUEENS,2.0,0.0,0,0,0,0,2,0,4052285,2018-12-19 08:00:00,2018-12-19T08:00,2018,12,-3.5,0.0,Clear
09/26/2018,23:00,40.761127,-73.93559,QUEENS,0.0,0.0,0,0,0,0,0,0,3990252,2018-09-26 23:00:00,2018-09-26T23:00,2018,9,21.8,0.1,Drizzle
10/12/2018,17:00,40.748962,-73.891754,QUEENS,0.0,0.0,0,0,0,0,0,0,3999073,2018-10-12 17:00:00,2018-10-12T17:00,2018,10,13.8,0.0,Cloudy
01/08/2018,11:00,40.660347,-73.767975,QUEENS,1.0,0.0,0,0,0,0,1,0,3824325,2018-01-08 11:00:00,2018-01-08T11:00,2018,1,-4.4,0.0,Cloudy
01/09/2018,11:00,40.7038,-73.82345,QUEENS,0.0,0.0,0,0,0,0,0,0,3825114,2018-01-09 11:00:00,2018-01-09T11:00,2018,1,2.3,0.0,Clear
02/09/2018,17:00,40.666695,-73.767136,QUEENS,1.0,0.0,0,0,0,0,1,0,3843924,2018-02-09 17:00:00,2018-02-09T17:00,2018,2,1.5,0.0,Cloudy
07/01/2018,0:00,40.66696,-73.77078,QUEENS,1.0,0.0,0,0,0,0,1,0,3933663,2018-07-01 00:00:00,2018-07-01T00:00,2018,7,23.2,0.0,Clear
11/06/2018,9:00,40.76027,-73.83049,QUEENS,0.0,0.0,0,0,0,0,0,0,4015414,2018-11-06 09:00:00,2018-11-06T09:00,2018,11,11.6,0.0,Cloudy
09/04/2018,18:00,40.74662,-73.89359,QUEENS,1.0,0.0,1,0,0,0,0,0,3975988,2018-09-04 18:00:00,2018-09-04T18:00,2018,9,29.9,0.0,Cloudy
07/08/2018,19:00,40.730957,-73.85626,QUEENS,2.0,0.0,0,0,0,0,2,0,3937308,2018-07-08 19:00:00,2018-07-08T19:00,2018,7,22.7,0.0,Clear
05/14/2018,11:00,40.713913,-73.83009,QUEENS,1.0,0.0,0,0,0,0,1,0,3900681,2018-05-14 11:00:00,2018-05-14T11:00,2018,5,16.1,0.0,Cloudy
02/20/2018,16:00,40.724308,-73.72474,QUEENS,2.0,0.0,0,0,0,0,2,0,3849893,2018-02-20 16:00:00,2018-02-20T16:00,2018,2,17.6,0.0,Cloudy
01/14/2018,8:00,40.743195,-73.93673,QUEENS,0.0,0.0,0,0,0,0,0,0,3828554,2018-01-14 08:00:00,2018-01-14T08:00,2018,1,-9.2,0.0,Clear
02/28/2018,10:00,40.705944,-73.81202,QUEENS,0.0,0.0,0,0,0,0,0,0,3853861,2018-02-28 10:00:00,2018-02-28T10:00,2018,2,8.1,0.0,Cloudy
07/23/2018,18:00,40.67172,-73.850975,QUEENS,1.0,0.0,0,0,0,0,1,0,3947134,2018-07-23 18:00:00,2018-07-23T18:00,2018,7,24.8,0.0,Clear
04/01/2018,13:00,40.707714,-73.802795,QUEENS,1.0,0.0,1,0,0,0,0,0,3873649,2018-04-01 13:00:00,2018-04-01T13:00,2018,4,11.0,0.0,Cloudy
12/04/2018,16:00,40.6679,-73.84204,QUEENS,1.0,0.0,0,0,0,0,1,0,4038197,2018-12-04 16:00:00,2018-12-04T16:00,2018,12,2.5,0.0,Clear
04/09/2018,11:00,40.66355,-73.84097,QUEENS,0.0,0.0,0,0,0,0,0,0,3877947,2018-04-09 11:00:00,2018-04-09T11:00,2018,4,4.1,0.0,Cloudy
06/19/2018,23:00,40.734203,-73.82488,QUEENS,0.0,0.0,0,0,0,0,0,0,3939723,2018-06-19 23:00:00,2018-06-19T23:00,2018,6,20.5,0.0,Cloudy
06/26/2018,14:00,40.735657,-73.85996,QUEENS,2.0,0.0,0,0,0,0,2,0,3929806,2018-06-26 14:00:00,2018-06-26T14:00,2018,6,22.5,0.0,Cloudy
03/09/2018,18:00,40.69968,-73.79864,QUEENS,0.0,0.0,0,0,0,0,0,0,3860541,2018-03-09 18:00:00,2018-03-09T18:00,2018,3,3.7,0.0,Clear
01/18/2018,13:00,40.680687,-73.84459,QUEENS,0.0,0.0,0,0,0,0,0,0,3831225,2018-01-18 13:00:00,2018-01-18T13:00,2018,1,-0.4,0.0,Clear
11/24/2018,16:00,40.713287,-73.87163,QUEENS,0.0,0.0,0,0,0,0,0,0,4031899,2018-11-24 16:00:00,2018-11-24T16:00,2018,11,7.2,0.0,Cloudy
11/16/2018,19:00,40.669872,-73.74005,QUEENS,1.0,0.0,0,0,0,0,1,0,4027604,2018-11-16 19:00:00,2018-11-16T19:00,2018,11,4.4,0.0,Clear
05/28/2018,23:00,40.76824,-73.87519,QUEENS,1.0,0.0,1,0,0,0,0,0,3912058,2018-05-28 23:00:00,2018-05-28T23:00,2018,5,16.3,0.0,Cloudy
11/16/2018,18:00,40.703224,-73.82055,QUEENS,0.0,0.0,0,0,0,0,0,0,4027527,2018-11-16 18:00:00,2018-11-16T18:00,2018,11,4.0,0.0,Clear
03/16/2018,11:00,40.75732,-73.834015,QUEENS,1.0,0.0,0,0,0,0,1,0,3864392,2018-03-16 11:00:00,2018-03-16T11:00,2018,3,3.7,0.0,Cloudy
05/26/2018,3:00,40.74614,-73.81417,QUEENS,1.0,0.0,0,0,0,0,1,0,3908954,2018-05-26 03:00:00,2018-05-26T03:00,2018,5,20.8,0.0,Clear
10/18/2018,18:00,40.76229,-73.75711,QUEENS,1.0,0.0,0,0,0,0,1,0,4002716,2018-10-18 18:00:00,2018-10-18T18:00,2018,10,7.6,0.0,Clear
03/02/2018,21:00,40.72939,-73.745415,QUEENS,0.0,0.0,0,0,0,0,0,0,3855564,2018-03-02 21:00:00,2018-03-02T21:00,2018,3,3.1,0.0,Cloudy
08/10/2018,10:00,40.753674,-73.9299,QUEENS,1.0,0.0,0,0,0,0,1,0,3959456,2018-08-10 10:00:00,2018-08-10T10:00,2018,8,28.3,0.0,Cloudy
09/10/2018,3:00,40.71189,-73.78743,QUEENS,1.0,0.0,1,0,0,0,0,0,3977330,2018-09-10 03:00:00,2018-09-10T03:00,2018,9,14.3,1.2,Drizzle
12/06/2018,14:00,40.690514,-73.728386,QUEENS,2.0,0.0,0,0,0,0,2,0,4043040,2018-12-06 14:00:00,2018-12-06T14:00,2018,12,4.0,0.0,Cloudy
03/18/2018,21:00,40.70663,-73.806595,QUEENS,2.0,0.0,0,0,0,0,2,0,3865014,2018-03-18 21:00:00,2018-03-18T21:00,2018,3,2.1,0.0,Clear
02/05/2018,11:00,40.76548,-73.913704,QUEENS,1.0,0.0,1,0,0,0,0,0,3840825,2018-02-05 11:00:00,2018-02-05T11:00,2018,2,-1.1,0.0,Clear
06/13/2018,10:00,40.711834,-73.90799,QUEENS,0.0,0.0,0,0,0,0,0,0,3920755,2018-06-13 10:00:00,2018-06-13T10:00,2018,6,19.8,0.0,Cloudy
11/20/2018,9:00,40.67396,-73.778824,QUEENS,3.0,0.0,0,0,0,0,3,0,4029666,2018-11-20 09:00:00,2018-11-20T09:00,2018,11,6.0,0.1,Drizzle
06/18/2018,23:00,40.754623,-73.823006,QUEENS,0.0,0.0,0,0,0,0,0,0,3923572,2018-06-18 23:00:00,2018-06-18T23:00,2018,6,25.4,0.0,Cloudy
10/25/2018,21:00,40.756992,-73.86178,QUEENS,0.0,0.0,0,0,0,0,0,0,4008578,2018-10-25 21:00:00,2018-10-25T21:00,2018,10,4.7,0.0,Cloudy
10/09/2018,0:00,40.6078,-73.81932,QUEENS,1.0,0.0,0,0,0,0,1,0,3996707,2018-10-09 00:00:00,2018-10-09T00:00,2018,10,20.7,0.0,Cloudy
07/12/2018,17:00,40.713985,-73.73812,QUEENS,1.0,0.0,1,0,0,0,0,0,3939694,2018-07-12 17:00:00,2018-07-12T17:00,2018,7,24.9,0.0,Clear
03/08/2018,15:00,40.764828,-73.86985,QUEENS,1.0,0.0,0,0,0,0,1,0,3859916,2018-03-08 15:00:00,2018-03-08T15:00,2018,3,6.0,0.0,Cloudy
12/08/2018,19:00,40.76027,-73.80401,QUEENS,2.0,0.0,0,0,0,0,2,0,4040937,2018-12-08 19:00:00,2018-12-08T19:00,2018,12,-2.9,0.0,Cloudy
01/18/2018,21:00,40.678574,-73.828125,QUEENS,1.0,0.0,0,0,0,0,1,0,3830748,2018-01-18 21:00:00,2018-01-18T21:00,2018,1,-3.3,0.0,Clear
02/01/2018,12:00,40.58545,-73.82466,QUEENS,2.0,0.0,0,0,0,0,2,0,3839676,2018-02-01 12:00:00,2018-02-01T12:00,2018,2,5.9,0.0,Cloudy
03/26/2018,17:00,40.76494,-73.87761,QUEENS,1.0,0.0,0,0,0,0,1,0,3872202,2018-03-26 17:00:00,2018-03-26T17:00,2018,3,4.1,0.0,Clear
12/12/2018,1:00,40.620686,-74.11002,STATEN ISLAND,1.0,0.0,0,0,0,0,1,0,4047050,2018-12-12 01:00:00,2018-12-12T01:00,2018,12,-1.0,0.0,Cloudy
12/18/2018,15:00,40.60453,-74.12079,STATEN ISLAND,1.0,0.0,1,0,0,0,0,0,4047576,2018-12-18 15:00:00,2018-12-18T15:00,2018,12,1.4,0.0,Clear
02/08/2018,8:00,40.613308,-74.08722,STATEN ISLAND,1.0,0.0,0,0,0,0,1,0,3842563,2018-02-08 08:00:00,2018-02-08T08:00,2018,2,-3.6,0.0,Clear
03/12/2018,9:00,40.61293,-74.087494,STATEN ISLAND,1.0,0.0,1,0,0,0,0,0,3862348,2018-03-12 09:00:00,2018-03-12T09:00,2018,3,2.6,0.0,Cloudy
03/15/2018,0:00,40.616413,-74.103516,STATEN ISLAND,4.0,0.0,0,0,0,0,4,0,3863700,2018-03-15 00:00:00,2018-03-15T00:00,2018,3,-0.1,0.0,Cloudy
03/19/2018,12:00,40.57811,-74.10215,STATEN ISLAND,0.0,0.0,0,0,0,0,0,0,3866055,2018-03-19 12:00:00,2018-03-19T12:00,2018,3,5.7,0.0,Clear
12/28/2018,15:00,40.59761,-74.084496,STATEN ISLAND,1.0,0.0,1,0,0,0,0,0,4054271,2018-12-28 15:00:00,2018-12-28T15:00,2018,12,13.6,2.7,Heavy Rain
10/07/2018,22:00,40.50429,-74.24434,STATEN ISLAND,3.0,0.0,0,0,0,0,3,0,3995915,2018-10-07 22:00:00,2018-10-07T22:00,2018,10,20.5,0.0,Clear
03/31/2018,22:00,40.579174,-74.11483,STATEN ISLAND,2.0,0.0,0,0,0,0,2,0,3873941,2018-03-31 22:00:00,2018-03-31T22:00,2018,3,5.8,0.0,Cloudy
07/13/2018,16:00,40.643154,-74.09958,STATEN ISLAND,1.0,0.0,0,0,0,0,1,0,3943643,2018-07-13 16:00:00,2018-07-13T16:00,2018,7,26.8,0.0,Clear
06/05/2018,8:00,40.597622,-74.123695,STATEN ISLAND,2.0,0.0,0,0,0,0,2,0,3914707,2018-06-05 08:00:00,2018-06-05T08:00,2018,6,17.7,0.0,Clear
03/20/2018,12:00,40.644756,-74.099724,STATEN ISLAND,1.0,0.0,0,0,0,0,1,0,3866653,2018-03-20 12:00:00,2018-03-20T12:00,2018,3,2.6,0.0,Cloudy
11/15/2018,21:00,40.620834,-74.07127,STATEN ISLAND,1.0,0.0,0,0,0,0,1,0,4027318,2018-11-15 21:00:00,2018-11-15T21:00,2018,11,3.1,2.0,Light Rain
11/13/2018,17:00,40.63165,-74.08762,STATEN ISLAND,1.0,0.0,0,0,0,0,1,0,4020570,2018-11-13 17:00:00,2018-11-13T17:00,2018,11,7.5,0.0,Cloudy
07/10/2018,22:00,40.614204,-74.101585,STATEN ISLAND,0.0,0.0,0,0,0,0,0,0,3939114,2018-07-10 22:00:00,2018-07-10T22:00,2018,7,24.6,0.0,Cloudy
01/23/2018,18:00,40.63657,-74.12064,STATEN ISLAND,1.0,0.0,0,0,0,0,1,0,3834618,2018-01-23 18:00:00,2018-01-23T18:00,2018,1,9.9,0.0,Clear
09/25/2018,15:00,40.545353,-74.1781,STATEN ISLAND,0.0,0.0,0,0,0,0,0,0,3988932,2018-09-25 15:00:00,2018-09-25T15:00,2018,9,21.7,1.3,Light Rain
03/12/2018,8:00,40.615158,-74.11436,STATEN ISLAND,0.0,0.0,0,0,0,0,0,0,3861440,2018-03-12 08:00:00,2018-03-12T08:00,2018,3,0.4,0.0,Cloudy
11/26/2018,0:00,40.55485,-74.16853,STATEN ISLAND,2.0,0.0,0,0,0,0,2,0,4032668,2018-11-26 00:00:00,2018-11-26T00:00,2018,11,4.3,0.0,Cloudy
09/25/2018,15:00,40.613525,-74.11685,STATEN ISLAND,1.0,0.0,0,0,0,0,1,0,3988415,2018-09-25 15:00:00,2018-09-25T15:00,2018,9,21.4,1.1,Drizzle
07/20/2018,18:00,40.6101,-74.11668,STATEN ISLAND,0.0,0.0,0,0,0,0,0,0,3945275,2018-07-20 18:00:00,2018-07-20T18:00,2018,7,22.5,0.0,Cloudy
11/19/2018,14:00,40.573784,-74.10643,STATEN ISLAND,0.0,0.0,0,0,0,0,0,0,4029010,2018-11-19 14:00:00,2018-11-19T14:00,2018,11,11.1,0.0,Cloudy
03/15/2018,20:00,40.563446,-74.169754,STATEN ISLAND,1.0,0.0,0,0,0,0,1,0,3864417,2018-03-15 20:00:00,2018-03-15T20:00,2018,3,2.6,0.0,Clear
03/22/2018,9:00,40.64063,-74.09563,STATEN ISLAND,0.0,0.0,0,0,0,0,0,0,3871075,2018-03-22 09:00:00,2018-03-22T09:00,2018,3,2.1,0.0,Cloudy
09/04/2018,18:00,40.560375,-74.166435,STATEN ISLAND,0.0,0.0,0,0,0,0,0,0,3974091,2018-09-04 18:00:00,2018-09-04T18:00,2018,9,26.9,0.0,Clear
11/06/2018,20:00,40.538654,-74.16336,STATEN ISLAND,0.0,0.0,0,0,0,0,0,0,4015588,2018-11-06 20:00:00,2018-11-06T20:00,2018,11,14.2,0.0,Clear
04/12/2018,12:00,40.615925,-74.078766,STATEN ISLAND,2.0,0.0,0,0,0,0,2,0,3880090,2018-04-12 12:00:00,2018-04-12T12:00,2018,4,11.3,0.0,Cloudy
01/09/2018,21:00,40.570465,-74.10977,STATEN ISLAND,1.0,0.0,0,0,0,0,1,0,3825780,2018-01-09 21:00:00,2018-01-09T21:00,2018,1,-0.2,0.0,Clear
09/26/2018,18:00,40.573704,-74.10652,STATEN ISLAND,0.0,0.0,0,0,0,0,0,0,3988580,2018-09-26 18:00:00,2018-09-26T18:00,2018,9,24.5,0.0,Cloudy
01/24/2018,15:00,40.555832,-74.13106,STATEN ISLAND,0.0,0.0,0,0,0,0,0,0,3834431,2018-01-24 15:00:00,2018-01-24T15:00,2018,1,4.4,0.0,Clear
10/30/2018,8:00,40.59589,-74.085884,STATEN ISLAND,1.0,0.0,0,0,0,0,1,0,4010631,2018-10-30 08:00:00,2018-10-30T08:00,2018,10,6.6,0.0,Clear
02/18/2018,16:00,40.52358,-74.187225,STATEN ISLAND,1.0,0.0,0,0,0,0,1,0,3848525,2018-02-18 16:00:00,2018-02-18T16:00,2018,2,7.7,0.0,Clear
12/13/2018,10:00,40.556137,-74.158615,STATEN ISLAND,2.0,0.0,0,0,0,0,2,0,4043842,2018-12-13 10:00:00,2018-12-13T10:00,2018,12,4.4,0.1,Drizzle
04/05/2018,23:00,40.610172,-74.12146,STATEN ISLAND,1.0,0.0,1,0,0,0,0,0,3875860,2018-04-05 23:00:00,2018-04-05T23:00,2018,4,0.7,0.0,Cloudy
04/19/2018,15:00,40.598484,-74.06513,STATEN ISLAND,1.0,0.0,0,0,0,0,1,0,3883995,2018-04-19 15:00:00,2018-04-19T15:00,2018,4,7.2,0.4,Drizzle
05/17/2018,16:00,40.64553,-74.07766,STATEN ISLAND,0.0,0.0,0,0,0,0,0,0,3908438,2018-05-17 16:00:00,2018-05-17T16:00,2018,5,19.8,0.0,Cloudy
11/07/2018,15:00,40.64481,-74.09598,STATEN ISLAND,1.0,0.0,0,0,0,0,1,0,4016498,2018-11-07 15:00:00,2018-11-07T15:00,2018,11,16.6,0.0,Clear
08/18/2018,11:00,40.620674,-74.07742,STATEN ISLAND,1.0,0.0,0,0,0,0,1,0,3968738,2018-08-18 11:00:00,2018-08-18T11:00,2018,8,27.6,0.0,Cloudy
12/30/2018,0:00,40.643326,-74.10635,STATEN ISLAND,0.0,0.0,0,0,0,0,0,0,4055225,2018-12-30 00:00:00,2018-12-30T00:00,2018,12,1.8,0.0,Cloudy
11/03/2018,0:00,40.557926,-74.16175,STATEN ISLAND,1.0,0.0,0,0,0,0,1,0,4013208,2018-11-03 00:00:00,2018-11-03T00:00,2018,11,18.7,1.1,Drizzle
07/21/2018,11:00,40.580315,-74.11368,STATEN ISLAND,1.0,0.0,0,0,0,0,1,0,3945555,2018-07-21 11:00:00,2018-07-21T11:00,2018,7,22.7,0.0,Cloudy
05/16/2018,13:00,40.595364,-74.09723,STATEN ISLAND,1.0,0.0,0,0,0,0,1,0,3902213,2018-05-16 13:00:00,2018-05-16T13:00,2018,5,15.1,0.9,Drizzle
10/04/2018,19:00,40.58524,-74.093414,STATEN ISLAND,0.0,0.0,0,0,0,0,0,0,3994032,2018-10-04 19:00:00,2018-10-04T19:00,2018,10,22.8,0.9,Drizzle
11/22/2018,16:00,40.570465,-74.10977,STATEN ISLAND,0.0,0.0,0,0,0,0,0,0,4031071,2018-11-22 16:00:00,2018-11-22T16:00,2018,11,-3.4,0.0,Clear
08/30/2018,12:00,40.542366,-74.16514,STATEN ISLAND,1.0,0.0,0,0,0,0,1,0,3971263,2018-08-30 12:00:00,2018-08-30T12:00,2018,8,30.6,0.0,Cloudy
11/13/2018,13:00,40.617165,-74.06688,STATEN ISLAND,1.0,0.0,0,0,0,0,1,0,4029453,2018-11-13 13:00:00,2018-11-13T13:00,2018,11,9.7,0.0,Cloudy
08/06/2018,3:00,40.631947,-74.11169,STATEN ISLAND,0.0,0.0,0,0,0,0,0,0,3956965,2018-08-06 03:00:00,2018-08-06T03:00,2018,8,24.0,0.0,Clear
03/26/2018,16:00,40.5842,-74.09472,STATEN ISLAND,0.0,0.0,0,0,0,0,0,0,3870700,2018-03-26 16:00:00,2018-03-26T16:00,2018,3,5.0,0.0,Clear
05/02/2018,21:00,40.6228,-74.08526,STATEN ISLAND,1.0,0.0,0,0,0,0,1,0,3892314,2018-05-02 21:00:00,2018-05-02T21:00,2018,5,21.5,0.0,Cloudy
05/22/2018,12:00,40.542603,-74.20835,STATEN ISLAND,0.0,0.0,0,0,0,0,0,0,3906121,2018-05-22 12:00:00,2018-05-22T12:00,2018,5,18.9,0.0,Cloudy
06/16/2018,18:00,40.606884,-74.0781,STATEN ISLAND,1.0,0.0,0,0,0,0,1,0,3923788,2018-06-16 18:00:00,2018-06-16T18:00,2018,6,23.7,0.0,Cloudy
10/28/2018,15:00,40.638092,-74.0779,STATEN ISLAND,0.0,0.0,0,0,0,0,0,0,4010534,2018-10-28 15:00:00,2018-10-28T15:00,2018,10,11.9,0.0,Cloudy
07/09/2018,16:00,40.598934,-74.06377,STATEN ISLAND,3.0,0.0,0,0,0,0,3,0,3939671,2018-07-09 16:00:00,2018-07-09T16:00,2018,7,24.5,0.0,Clear
11/24/2018,12:00,40.612,-74.0683,STATEN ISLAND,1.0,0.0,0,0,0,0,1,0,4032905,2018-11-24 12:00:00,2018-11-24T12:00,2018,11,8.3,0.0,Cloudy
09/24/2018,8:00,40.618996,-74.07593,STATEN ISLAND,1.0,0.0,0,0,0,0,1,0,3987191,2018-09-24 08:00:00,2018-09-24T08:00,2018,9,16.2,0.0,Cloudy
06/16/2018,15:00,40.54354,-74.16449,STATEN ISLAND,0.0,0.0,0,0,0,0,0,0,3922319,2018-06-16 15:00:00,2018-06-16T15:00,2018,6,27.1,0.0,Cloudy
12/14/2018,15:00,40.57322,-74.106995,STATEN ISLAND,0.0,0.0,0,0,0,0,0,0,4044878,2018-12-14 15:00:00,2018-12-14T15:00,2018,12,9.3,0.0,Cloudy
09/29/2018,4:00,40.57253,-74.14024,STATEN ISLAND,1.0,0.0,0,0,0,0,1,0,3990182,2018-09-29 04:00:00,2018-09-29T04:00,2018,9,14.9,0.0,Clear
04/25/2018,20:00,40.59102,-74.100914,STATEN ISLAND,1.0,0.0,0,0,0,0,1,0,3888617,2018-04-25 20:00:00,2018-04-25T20:00,2018,4,10.7,0.9,Drizzle
02/25/2018,7:00,40.550102,-74.171295,STATEN ISLAND,0.0,0.0,0,0,0,0,0,0,3852748,2018-02-25 07:00:00,2018-02-25T07:00,2018,2,5.5,2.6,Heavy Rain
04/10/2018,15:00,40.618526,-74.11819,STATEN ISLAND,0.0,0.0,0,0,0,0,0,0,3879055,2018-04-10 15:00:00,2018-04-10T15:00,2018,4,8.6,0.0,Cloudy
02/26/2018,16:00,40.578197,-74.11703,STATEN ISLAND,0.0,0.0,0,0,0,0,0,0,4087285,2018-02-26 16:00:00,2018-02-26T16:00,2018,2,10.1,0.0,Cloudy
10/05/2018,17:00,40.6271,-74.12514,STATEN ISLAND,1.0,0.0,0,0,1,0,0,0,3996464,2018-10-05 17:00:00,2018-10-05T17:00,2018,10,19.1,0.0,Clear
06/30/2018,13:00,40.55968,-74.1066,STATEN ISLAND,1.0,0.0,0,0,0,0,1,0,3932567,2018-06-30 13:00:00,2018-06-30T13:00,2018,6,31.5,0.0,Clear
11/06/2018,21:00,40.56878,-74.10661,STATEN ISLAND,2.0,0.0,0,0,0,0,2,0,4015658,2018-11-06 21:00:00,2018-11-06T21:00,2018,11,14.0,0.0,Clear
08/27/2018,22:00,40.534645,-74.15464,STATEN ISLAND,3.0,0.0,0,0,0,0,3,0,3969542,2018-08-27 22:00:00,2018-08-27T22:00,2018,8,26.3,0.0,Cloudy
01/03/2018,14:00,40.576904,-74.09848,STATEN ISLAND,0.0,0.0,0,0,0,0,0,0,3821748,2018-01-03 14:00:00,2018-01-03T14:00,2018,1,-1.7,0.0,Cloudy
04/28/2018,0:00,40.610172,-74.12146,STATEN ISLAND,1.0,0.0,0,0,0,0,1,0,3889602,2018-04-28 00:00:00,2018-04-28T00:00,2018,4,9.8,0.0,Clear
10/16/2018,14:00,40.561707,-74.172264,STATEN ISLAND,0.0,0.0,0,0,0,0,0,0,4001552,2018-10-16 14:00:00,2018-10-16T14:00,2018,10,13.5,0.0,Cloudy
03/24/2018,12:00,40.614,-74.08734,STATEN ISLAND,2.0,0.0,0,0,0,0,2,0,3869222,2018-03-24 12:00:00,2018-03-24T12:00,2018,3,7.6,0.0,Clear
03/19/2018,10:00,40.61289,-74.082985,STATEN ISLAND,1.0,0.0,1,0,0,0,0,0,3866246,2018-03-19 10:00:00,2018-03-19T10:00,2018,3,3.0,0.0,Clear
11/13/2018,6:00,40.588165,-74.08821,STATEN ISLAND,0.0,0.0,0,0,0,0,0,0,4020243,2018-11-13 06:00:00,2018-11-13T06:00,2018,11,8.6,1.8,Light Rain
10/22/2018,14:00,40.640335,-74.077614,STATEN ISLAND,0.0,0.0,0,0,0,0,0,0,4005952,2018-10-22 14:00:00,2018-10-22T14:00,2018,10,10.2,0.0,Clear
07/07/2018,17:00,40.609055,-74.08923,STATEN ISLAND,0.0,0.0,0,0,0,0,0,0,3939062,2018-07-07 17:00:00,2018-07-07T17:00,2018,7,21.8,0.0,Clear
02/08/2018,14:00,40.62282,-74.08391,STATEN ISLAND,0.0,0.0,0,0,0,0,0,0,3842538,2018-02-08 14:00:00,2018-02-08T14:00,2018,2,0.7,0.0,Clear
08/08/2018,18:00,40.62199,-74.07826,STATEN ISLAND,0.0,0.0,0,0,0,0,0,0,3958762,2018-08-08 18:00:00,2018-08-08T18:00,2018,8,27.1,0.0,Cloudy
03/04/2018,14:00,40.64649,-74.08654,STATEN ISLAND,0.0,0.0,0,0,0,0,0,0,3857155,2018-03-04 14:00:00,2018-03-04T14:00,2018,3,6.5,0.0,Cloudy
07/12/2018,18:00,40.60186,-74.11778,STATEN ISLAND,4.0,0.0,0,0,0,0,4,0,3939670,2018-07-12 18:00:00,2018-07-12T18:00,2018,7,24.7,0.0,Clear
04/14/2018,19:00,40.58004,-74.11396,STATEN ISLAND,1.0,0.0,0,0,0,0,1,0,3881370,2018-04-14 19:00:00,2018-04-14T19:00,2018,4,9.6,0.0,Cloudy
