CRASH DATE,CRASH TIME,LATITUDE,LONGITUDE,BOROUGH,NUMBER OF PERSONS INJURED,NUMBER OF PERSONS KILLED,NUMBER OF PEDESTRIANS INJURED,NUMBER OF PEDESTRIANS KILLED,NUMBER OF CYCLIST INJURED,NUMBER OF CYCLIST KILLED,NUMBER OF MOTORIST INJURED,NUMBER OF MOTORIST KILLED,COLLISION_ID,datetime,iso_datetime,year,month,temperature,precipitation,weather_condition
03/03/2022,8:00,40.875042,-73.91228,BRONX,1.0,0.0,1,0,0,0,0,0,4507110,2022-03-03 08:00:00,2022-03-03T08:00,2022,3,3.4,0.0,Clear
05/16/2022,22:00,40.88437,-73.86914,BRONX,1.0,0.0,0,0,0,0,1,0,4528676,2022-05-16 22:00:00,2022-05-16T22:00,2022,5,16.4,0.0,Clear
09/21/2022,12:00,40.88129,-73.90943,BRONX,1.0,0.0,1,0,0,0,0,0,4566121,2022-09-21 12:00:00,2022-09-21T12:00,2022,9,24.5,0.0,Clear
07/15/2022,19:00,40.88569,-73.831245,BRONX,0.0,0.0,0,0,0,0,0,0,4548864,2022-07-15 19:00:00,2022-07-15T19:00,2022,7,25.6,0.0,Clear
08/12/2022,7:00,40.83664,-73.83382,BRONX,2.0,0.0,0,0,0,0,2,0,4555121,2022-08-12 07:00:00,2022-08-12T07:00,2022,8,22.2,0.0,Clear
10/12/2022,10:00,40.897564,-73.84109,BRONX,1.0,0.0,1,0,0,0,0,0,4573316,2022-10-12 10:00:00,2022-10-12T10:00,2022,10,17.2,0.0,Cloudy
01/17/2022,2:00,40.854218,-73.89004,BRONX,1.0,0.0,0,0,0,0,0,0,4500715,2022-01-17 02:00:00,2022-01-17T02:00,2022,1,4.9,4.1,Heavy Rain
10/15/2022,11:00,40.84664,-73.90469,BRONX,2.0,0.0,1,0,0,0,1,0,4573562,2022-10-15 11:00:00,2022-10-15T11:00,2022,10,18.6,0.0,Clear
05/03/2022,18:00,40.84441,-73.8689,BRONX,1.0,0.0,0,0,0,0,1,0,4524577,2022-05-03 18:00:00,2022-05-03T18:00,2022,5,13.4,0.0,Cloudy
06/06/2022,15:00,40.87892,-73.90479,BRONX,0.0,0.0,0,0,0,0,0,0,4535646,2022-06-06 15:00:00,2022-06-06T15:00,2022,6,26.0,0.0,Cloudy
05/17/2022,17:00,40.887043,-73.84029,BRONX,1.0,0.0,1,0,0,0,0,0,4529227,2022-05-17 17:00:00,2022-05-17T17:00,2022,5,21.6,0.0,Clear
01/26/2022,16:00,40.87645,-73.848175,BRONX,3.0,0.0,0,0,0,0,3,0,4497893,2022-01-26 16:00:00,2022-01-26T16:00,2022,1,-3.9,0.0,Clear
06/03/2022,8:00,40.89016,-73.84261,BRONX,1.0,0.0,0,0,0,0,1,0,4534255,2022-06-03 08:00:00,2022-06-03T08:00,2022,6,18.2,0.0,Cloudy
07/28/2022,22:00,40.875328,-73.869225,BRONX,3.0,0.0,0,0,0,0,3,0,4552039,2022-07-28 22:00:00,2022-07-28T22:00,2022,7,26.2,0.0,Clear
01/22/2022,12:00,40.884235,-73.901146,BRONX,1.0,0.0,1,0,0,0,0,0,4499146,2022-01-22 12:00:00,2022-01-22T12:00,2022,1,-2.6,0.0,Clear
12/17/2022,13:00,40.81702,-73.90507,BRONX,1.0,0.0,1,0,0,0,0,0,4599787,2022-12-17 13:00:00,2022-12-17T13:00,2022,12,6.9,0.0,Clear
08/30/2022,15:00,40.854588,-73.90187,BRONX,1.0,0.0,0,0,0,0,1,0,4559769,2022-08-30 15:00:00,2022-08-30T15:00,2022,8,28.9,0.0,Cloudy
09/25/2022,12:00,40.832737,-73.90504,BRONX,3.0,0.0,0,0,0,0,3,0,4567855,2022-09-25 12:00:00,2022-09-25T12:00,2022,9,20.4,0.0,Cloudy
07/16/2022,17:00,40.86231,-73.909874,BRONX,0.0,0.0,0,0,0,0,0,0,4546769,2022-07-16 17:00:00,2022-07-16T17:00,2022,7,25.9,0.1,Drizzle
08/16/2022,0:00,40.820187,-73.890686,BRONX,1.0,0.0,0,0,0,0,0,0,4555853,2022-08-16 00:00:00,2022-08-16T00:00,2022,8,19.4,0.0,Clear
03/24/2022,23:00,40.829777,-73.85055,BRONX,1.0,0.0,1,0,0,0,0,0,4514182,2022-03-24 23:00:00,2022-03-24T23:00,2022,3,6.5,2.6,Heavy Rain
01/22/2022,0:00,40.828587,-73.85026,BRONX,1.0,0.0,0,0,0,0,1,0,4496960,2022-01-22 00:00:00,2022-01-22T00:00,2022,1,-8.7,0.0,Cloudy
03/30/2022,15:00,40.801,-73.91371,BRONX,0.0,0.0,0,0,0,0,0,0,4514913,2022-03-30 15:00:00,2022-03-30T15:00,2022,3,5.6,0.0,Cloudy
04/02/2022,13:00,40.825848,-73.90993,BRONX,1.0,0.0,0,0,0,0,1,0,4515661,2022-04-02 13:00:00,2022-04-02T13:00,2022,4,9.8,0.0,Clear
09/02/2022,17:00,40.843464,-73.83683,BRONX,1.0,0.0,0,0,0,0,1,0,4560452,2022-09-02 17:00:00,2022-09-02T17:00,2022,9,24.5,0.0,Cloudy
02/27/2022,21:00,40.825577,-73.918465,BRONX,0.0,0.0,0,0,0,0,0,0,4506981,2022-02-27 21:00:00,2022-02-27T21:00,2022,2,3.9,0.0,Clear
03/27/2022,14:00,40.837673,-73.91922,BRONX,1.0,0.0,0,0,0,0,1,0,4516702,2022-03-27 14:00:00,2022-03-27T14:00,2022,3,6.3,0.0,Cloudy
03/10/2022,13:00,40.899185,-73.8562,BRONX,0.0,0.0,0,0,0,0,0,0,4510043,2022-03-10 13:00:00,2022-03-10T13:00,2022,3,8.6,0.0,Cloudy
08/16/2022,22:00,40.823658,-73.836426,BRONX,2.0,0.0,0,0,0,0,2,0,4556513,2022-08-16 22:00:00,2022-08-16T22:00,2022,8,21.4,0.0,Cloudy
12/31/2022,16:00,40.87892,-73.90479,BRONX,1.0,0.0,1,0,0,0,0,0,4595064,2022-12-31 16:00:00,2022-12-31T16:00,2022,12,10.5,0.3,Drizzle
12/24/2022,17:00,40.868458,-73.82051,BRONX,2.0,0.0,0,0,0,0,2,0,4592939,2022-12-24 17:00:00,2022-12-24T17:00,2022,12,-7.7,0.0,Clear
04/18/2022,13:00,40.820744,-73.82374,BRONX,0.0,0.0,0,0,0,0,0,0,4520074,2022-04-18 13:00:00,2022-04-18T13:00,2022,4,9.6,0.0,Cloudy
03/09/2022,10:00,40.839615,-73.8619,BRONX,1.0,0.0,1,0,0,0,0,0,4509950,2022-03-09 10:00:00,2022-03-09T10:00,2022,3,2.2,1.1,Light Snow
08/09/2022,13:00,40.869194,-73.88039,BRONX,1.0,0.0,0,0,0,0,0,0,4553970,2022-08-09 13:00:00,2022-08-09T13:00,2022,8,35.7,0.0,Cloudy
11/23/2022,9:00,40.815304,-73.8567,BRONX,1.0,0.0,0,0,0,0,1,0,4585339,2022-11-23 09:00:00,2022-11-23T09:00,2022,11,6.5,0.0,Clear
08/31/2022,18:00,40.819786,-73.91216,BRONX,1.0,0.0,0,0,0,0,1,0,4560023,2022-08-31 18:00:00,2022-08-31T18:00,2022,8,25.9,0.0,Clear
02/13/2022,2:00,40.857525,-73.8818,BRONX,1.0,0.0,0,0,0,0,1,0,4502832,2022-02-13 02:00:00,2022-02-13T02:00,2022,2,2.4,0.1,Drizzle
10/14/2022,0:00,40.891445,-73.897415,BRONX,1.0,0.0,0,0,0,0,1,0,4579825,2022-10-14 00:00:00,2022-10-14T00:00,2022,10,12.7,1.2,Drizzle
03/03/2022,15:00,40.86877,-73.83174,BRONX,0.0,0.0,0,0,0,0,0,0,4507111,2022-03-03 15:00:00,2022-03-03T15:00,2022,3,4.6,0.0,Cloudy
10/21/2022,10:00,40.871822,-73.88813,BRONX,1.0,0.0,0,0,0,0,1,0,4575642,2022-10-21 10:00:00,2022-10-21T10:00,2022,10,13.2,0.0,Clear
01/05/2022,15:00,40.825577,-73.918465,BRONX,1.0,0.0,1,0,0,0,0,0,4493038,2022-01-05 15:00:00,2022-01-05T15:00,2022,1,6.9,0.0,Cloudy
10/01/2022,5:00,40.866726,-73.86077,BRONX,1.0,0.0,0,0,0,0,1,0,4568951,2022-10-01 05:00:00,2022-10-01T05:00,2022,10,12.6,0.7,Drizzle
06/12/2022,10:00,40.856403,-73.89213,BRONX,0.0,0.0,0,0,0,0,0,0,4538985,2022-06-12 10:00:00,2022-06-12T10:00,2022,6,19.1,0.4,Drizzle
03/03/2022,10:00,40.883152,-73.856285,BRONX,1.0,0.0,0,0,1,0,0,0,4507049,2022-03-03 10:00:00,2022-03-03T10:00,2022,3,3.9,0.0,Clear
05/30/2022,9:00,40.85681,-73.86013,BRONX,0.0,0.0,0,0,0,0,0,0,4532646,2022-05-30 09:00:00,2022-05-30T09:00,2022,5,24.3,0.0,Cloudy
09/12/2022,0:00,40.821358,-73.889114,BRONX,2.0,0.0,0,0,0,0,2,0,4563526,2022-09-12 00:00:00,2022-09-12T00:00,2022,9,21.4,2.0,Light Rain
08/28/2022,2:00,40.90184,-73.85702,BRONX,1.0,0.0,1,0,0,0,0,0,4560547,2022-08-28 02:00:00,2022-08-28T02:00,2022,8,22.0,0.0,Clear
01/28/2022,9:00,40.877476,-73.83661,BRONX,1.0,0.0,0,0,0,0,1,0,4499220,2022-01-28 09:00:00,2022-01-28T09:00,2022,1,-1.2,0.2,Light Snow
05/08/2022,0:00,40.87307,-73.84424,BRONX,2.0,0.0,0,0,0,0,2,0,4526931,2022-05-08 00:00:00,2022-05-08T00:00,2022,5,7.1,0.1,Drizzle
02/11/2022,0:00,40.829502,-73.87462,BRONX,1.0,0.0,1,0,0,0,0,0,4502672,2022-02-11 00:00:00,2022-02-11T00:00,2022,2,0.6,0.0,Clear
06/05/2022,7:00,40.87874,-73.89799,BRONX,1.0,0.0,0,0,0,0,1,0,4535638,2022-06-05 07:00:00,2022-06-05T07:00,2022,6,16.9,0.0,Clear
04/09/2022,14:00,40.882965,-73.82563,BRONX,0.0,0.0,0,0,0,0,0,0,4518274,2022-04-09 14:00:00,2022-04-09T14:00,2022,4,13.6,0.0,Cloudy
06/03/2022,3:00,40.838978,-73.86375,BRONX,1.0,0.0,0,0,0,0,1,0,4533842,2022-06-03 03:00:00,2022-06-03T03:00,2022,6,17.9,0.0,Cloudy
01/18/2022,16:00,40.863552,-73.90443,BRONX,1.0,0.0,0,0,0,0,0,0,4598759,2022-01-18 16:00:00,2022-01-18T16:00,2022,1,0.3,0.0,Clear
07/15/2022,0:00,40.836124,-73.88987,BRONX,1.0,0.0,0,0,0,0,1,0,4547033,2022-07-15 00:00:00,2022-07-15T00:00,2022,7,23.0,0.0,Clear
09/02/2022,0:00,40.8477,-73.90097,BRONX,1.0,0.0,1,0,0,0,0,0,4561613,2022-09-02 00:00:00,2022-09-02T00:00,2022,9,18.1,0.0,Clear
05/21/2022,14:00,40.869118,-73.83048,BRONX,1.0,0.0,0,0,0,0,1,0,4529975,2022-05-21 14:00:00,2022-05-21T14:00,2022,5,31.6,0.0,Clear
11/12/2022,20:00,40.814777,-73.903595,BRONX,1.0,0.0,1,0,0,0,0,0,4584969,2022-11-12 20:00:00,2022-11-12T20:00,2022,11,14.6,0.0,Cloudy
08/31/2022,16:00,40.8518,-73.909225,BRONX,1.0,0.0,0,0,1,0,0,0,4560610,2022-08-31 16:00:00,2022-08-31T16:00,2022,8,28.1,0.0,Clear
07/17/2022,17:00,40.88081,-73.839935,BRONX,1.0,0.0,1,0,0,0,0,0,4547881,2022-07-17 17:00:00,2022-07-17T17:00,2022,7,26.6,0.0,Cloudy
08/24/2022,11:00,40.89213,-73.85341,BRONX,1.0,0.0,0,0,0,0,1,0,4560566,2022-08-24 11:00:00,2022-08-24T11:00,2022,8,28.4,0.0,Clear
08/10/2022,17:00,40.83971,-73.87212,BRONX,2.0,0.0,0,0,0,0,0,0,4554848,2022-08-10 17:00:00,2022-08-10T17:00,2022,8,28.5,0.0,Clear
01/30/2022,0:00,40.85135,-73.7886,BRONX,2.0,0.0,0,0,0,0,2,0,4498649,2022-01-30 00:00:00,2022-01-30T00:00,2022,1,-13.6,0.0,Clear
06/23/2022,9:00,40.83996,-73.870705,BRONX,1.0,0.0,0,0,1,0,0,0,4540055,2022-06-23 09:00:00,2022-06-23T09:00,2022,6,21.3,0.1,Drizzle
10/06/2022,22:00,40.833836,-73.91586,BRONX,1.0,0.0,1,0,0,0,0,0,4571761,2022-10-06 22:00:00,2022-10-06T22:00,2022,10,13.2,0.0,Cloudy
06/06/2022,14:00,40.882645,-73.86332,BRONX,0.0,0.0,0,0,0,0,0,0,4535716,2022-06-06 14:00:00,2022-06-06T14:00,2022,6,26.4,0.0,Clear
12/19/2022,9:00,40.81813,-73.89101,BRONX,0.0,0.0,0,0,0,0,0,0,4595827,2022-12-19 09:00:00,2022-12-19T09:00,2022,12,0.4,0.0,Clear
04/08/2022,17:00,40.82817,-73.86265,BRONX,1.0,0.0,0,0,1,0,0,0,4519964,2022-04-08 17:00:00,2022-04-08T17:00,2022,4,15.8,0.0,Clear
09/22/2022,20:00,40.89466,-73.86137,BRONX,1.0,0.0,0,0,0,0,1,0,4567150,2022-09-22 20:00:00,2022-09-22T20:00,2022,9,16.0,0.0,Clear
02/19/2022,15:00,40.8883,-73.85682,BRONX,1.0,0.0,0,0,0,0,1,0,4505502,2022-02-19 15:00:00,2022-02-19T15:00,2022,2,3.6,0.1,Drizzle
03/06/2022,20:00,40.81427,-73.91535,BRONX,1.0,0.0,1,0,0,0,0,0,4508012,2022-03-06 20:00:00,2022-03-06T20:00,2022,3,17.7,0.0,Cloudy
11/05/2022,14:00,40.813663,-73.931244,BRONX,2.0,0.0,0,0,0,0,2,0,4582080,2022-11-05 14:00:00,2022-11-05T14:00,2022,11,21.7,0.0,Clear
03/21/2022,22:00,40.843765,-73.88546,BRONX,0.0,0.0,0,0,0,0,0,0,4512791,2022-03-21 22:00:00,2022-03-21T22:00,2022,3,5.9,0.0,Cloudy
12/11/2022,17:00,40.848454,-73.85548,BRONX,1.0,0.0,0,0,0,0,1,0,4588944,2022-12-11 17:00:00,2022-12-11T17:00,2022,12,3.5,0.8,Drizzle
05/31/2022,11:00,40.854458,-73.86576,BRONX,1.0,0.0,1,0,0,0,0,0,4533088,2022-05-31 11:00:00,2022-05-31T11:00,2022,5,31.7,0.0,Cloudy
02/01/2022,15:00,40.821003,-73.89787,BRONX,1.0,0.0,0,0,0,0,1,0,4499279,2022-02-01 15:00:00,2022-02-01T15:00,2022,2,-1.0,0.0,Cloudy
10/06/2022,18:00,40.817387,-73.92277,BRONX,1.0,0.0,1,0,0,0,0,0,4572778,2022-10-06 18:00:00,2022-10-06T18:00,2022,10,16.6,0.0,Clear
10/01/2022,6:00,40.81231,-73.91648,BRONX,1.0,0.0,0,0,1,0,0,0,4575479,2022-10-01 06:00:00,2022-10-01T06:00,2022,10,12.1,3.4,Heavy Rain
06/11/2022,9:00,40.846657,-73.89619,BRONX,0.0,0.0,0,0,0,0,0,0,4536861,2022-06-11 09:00:00,2022-06-11T09:00,2022,6,23.3,0.0,Cloudy
07/13/2022,10:00,40.85713,-73.8808,BRONX,1.0,0.0,0,0,1,0,0,0,4547069,2022-07-13 10:00:00,2022-07-13T10:00,2022,7,29.8,0.0,Clear
09/20/2022,7:00,40.877686,-73.86756,BRONX,1.0,0.0,0,0,0,0,1,0,4567123,2022-09-20 07:00:00,2022-09-20T07:00,2022,9,19.3,0.0,Clear
09/29/2022,8:00,40.855812,-73.890785,BRONX,1.0,0.0,1,0,0,0,0,0,4568463,2022-09-29 08:00:00,2022-09-29T08:00,2022,9,14.3,0.0,Clear
06/09/2022,17:00,40.80422,-73.91135,BRONX,1.0,0.0,0,0,0,0,1,0,4537042,2022-06-09 17:00:00,2022-06-09T17:00,2022,6,25.5,0.0,Clear
01/29/2022,5:00,40.859306,-73.89885,BRONX,1.0,0.0,0,0,0,0,1,0,4498617,2022-01-29 05:00:00,2022-01-29T05:00,2022,1,-10.2,1.6,Heavy Snow
05/18/2022,17:00,40.82382,-73.8523,BRONX,1.0,0.0,0,0,0,0,1,0,4535579,2022-05-18 17:00:00,2022-05-18T17:00,2022,5,19.8,0.0,Cloudy
07/14/2022,11:00,40.893623,-73.85525,BRONX,1.0,0.0,0,0,0,0,1,0,4547185,2022-07-14 11:00:00,2022-07-14T11:00,2022,7,29.0,0.0,Clear
08/11/2022,11:00,40.84148,-73.88853,BRONX,1.0,0.0,0,0,0,0,1,0,4555325,2022-08-11 11:00:00,2022-08-11T11:00,2022,8,28.4,0.0,Cloudy
10/22/2022,13:00,40.870323,-73.89961,BRONX,1.0,0.0,0,0,1,0,0,0,4576018,2022-10-22 13:00:00,2022-10-22T13:00,2022,10,17.8,0.0,Clear
09/28/2022,9:00,40.83547,-73.88676,BRONX,0.0,0.0,0,0,0,0,0,0,4568442,2022-09-28 09:00:00,2022-09-28T09:00,2022,9,15.7,0.0,Clear
01/26/2022,10:00,40.878807,-73.86388,BRONX,0.0,0.0,0,0,0,0,0,0,4497595,2022-01-26 10:00:00,2022-01-26T10:00,2022,1,-4.5,0.0,Clear
06/12/2022,6:00,40.818558,-73.92732,BRONX,2.0,0.0,0,0,0,0,2,0,4543889,2022-06-12 06:00:00,2022-06-12T06:00,2022,6,18.4,0.0,Cloudy
04/15/2022,14:00,40.832233,-73.85427,BRONX,1.0,0.0,1,0,0,0,0,0,4519932,2022-04-15 14:00:00,2022-04-15T14:00,2022,4,19.3,0.0,Clear
07/05/2022,23:00,40.90487,-73.84603,BRONX,3.0,0.0,0,0,0,0,3,0,4544012,2022-07-05 23:00:00,2022-07-05T23:00,2022,7,21.8,0.0,Cloudy
12/16/2022,6:00,40.86661,-73.890366,BRONX,1.0,0.0,0,0,1,0,0,0,4590982,2022-12-16 06:00:00,2022-12-16T06:00,2022,12,6.4,0.8,Drizzle
10/03/2022,0:00,40.87023,-73.90061,BRONX,0.0,0.0,0,0,0,0,0,0,4569979,2022-10-03 00:00:00,2022-10-03T00:00,2022,10,10.6,0.4,Drizzle
05/09/2022,18:00,40.845177,-73.91417,BRONX,1.0,0.0,0,0,0,0,1,0,4526384,2022-05-09 18:00:00,2022-05-09T18:00,2022,5,15.2,0.0,Clear
03/16/2022,17:00,40.81062,-73.92472,BRONX,1.0,0.0,0,0,0,0,0,0,4521028,2022-03-16 17:00:00,2022-03-16T17:00,2022,3,12.1,0.0,Clear
01/20/2022,20:00,40.842236,-73.87175,BRONX,1.0,0.0,0,0,0,0,1,0,4496136,2022-01-20 20:00:00,2022-01-20T20:00,2022,1,-3.6,0.0,Cloudy
01/29/2022,18:00,40.81612,-73.926636,BRONX,1.0,0.0,1,0,0,0,0,0,4498627,2022-01-29 18:00:00,2022-01-29T18:00,2022,1,-8.7,0.1,Light Snow
07/26/2022,13:00,40.875484,-73.8507,BRONX,1.0,0.0,1,0,0,0,0,0,4551720,2022-07-26 13:00:00,2022-07-26T13:00,2022,7,28.9,0.0,Cloudy
12/01/2022,22:00,40.84275,-73.924774,BRONX,1.0,0.0,1,0,0,0,0,0,4586660,2022-12-01 22:00:00,2022-12-01T22:00,2022,12,0.0,0.0,Cloudy
12/05/2022,0:00,40.80655,-73.88632,BRONX,1.0,0.0,0,0,0,0,1,0,4590042,2022-12-05 00:00:00,2022-12-05T00:00,2022,12,-1.4,0.0,Clear
02/18/2022,19:00,40.844177,-73.90292,BRONX,1.0,0.0,0,0,0,0,1,0,4507605,2022-02-18 19:00:00,2022-02-18T19:00,2022,2,-0.7,0.0,Clear
05/16/2022,16:00,40.81655,-73.91955,BRONX,1.0,0.0,0,0,0,0,1,0,4528761,2022-05-16 16:00:00,2022-05-16T16:00,2022,5,21.0,0.0,Cloudy
08/29/2022,19:00,40.871876,-73.84163,BRONX,2.0,0.0,0,0,0,0,2,0,4560540,2022-08-29 19:00:00,2022-08-29T19:00,2022,8,24.2,0.0,Clear
02/14/2022,14:00,40.871284,-73.8585,BRONX,1.0,0.0,0,0,0,0,1,0,4502985,2022-02-14 14:00:00,2022-02-14T14:00,2022,2,-4.9,0.0,Cloudy
05/31/2022,8:00,40.839146,-73.88625,BRONX,0.0,0.0,0,0,0,0,0,0,4533236,2022-05-31 08:00:00,2022-05-31T08:00,2022,5,27.7,0.0,Clear
11/19/2022,11:00,40.82796,-73.82367,BRONX,1.0,0.0,1,0,0,0,0,0,4583490,2022-11-19 11:00:00,2022-11-19T11:00,2022,11,2.4,0.0,Clear
06/28/2022,3:00,40.826256,-73.90166,BRONX,1.0,0.0,0,0,0,0,1,0,4541825,2022-06-28 03:00:00,2022-06-28T03:00,2022,6,18.8,0.0,Cloudy
10/28/2022,14:00,40.886665,-73.862144,BRONX,0.0,0.0,0,0,0,0,0,0,4578725,2022-10-28 14:00:00,2022-10-28T14:00,2022,10,13.0,0.0,Cloudy
02/26/2022,23:00,40.826397,-73.92116,BRONX,0.0,0.0,0,0,0,0,0,0,4505871,2022-02-26 23:00:00,2022-02-26T23:00,2022,2,-2.4,0.0,Clear
09/21/2022,10:00,40.888035,-73.83131,BRONX,1.0,0.0,1,0,0,0,0,0,4567401,2022-09-21 10:00:00,2022-09-21T10:00,2022,9,22.1,0.0,Cloudy
06/20/2022,17:00,40.835705,-73.888756,BRONX,1.0,0.0,0,0,0,0,1,0,4539501,2022-06-20 17:00:00,2022-06-20T17:00,2022,6,26.7,0.0,Cloudy
02/02/2022,17:00,40.82731,-73.857834,BRONX,1.0,0.0,0,0,0,0,1,0,4500004,2022-02-02 17:00:00,2022-02-02T17:00,2022,2,2.9,0.0,Cloudy
01/26/2022,10:00,40.843174,-73.91196,BRONX,3.0,0.0,0,0,0,0,3,0,4497559,2022-01-26 10:00:00,2022-01-26T10:00,2022,1,-4.3,0.0,Clear
06/13/2022,12:00,40.84678,-73.8838,BRONX,1.0,0.0,1,0,0,0,0,0,4539696,2022-06-13 12:00:00,2022-06-13T12:00,2022,6,28.2,0.1,Drizzle
02/08/2022,5:00,40.844887,-73.82616,BRONX,0.0,0.0,0,0,0,0,0,0,4501700,2022-02-08 05:00:00,2022-02-08T05:00,2022,2,1.3,0.0,Cloudy
04/22/2022,12:00,0.0,0.0,BRONX,0.0,0.0,0,0,0,0,0,0,4521190,2022-04-22 12:00:00,2022-04-22T12:00,2022,4,27.8,0.0,Cloudy
06/04/2022,17:00,40.805866,-73.915276,BRONX,2.0,0.0,0,0,0,0,2,0,4534569,2022-06-04 17:00:00,2022-06-04T17:00,2022,6,21.5,0.0,Clear
07/23/2022,11:00,40.86778,-73.8615,BRONX,1.0,0.0,0,0,1,0,0,0,4550064,2022-07-23 11:00:00,2022-07-23T11:00,2022,7,32.5,0.0,Clear
07/04/2022,17:00,40.88011,-73.89939,BRONX,1.0,0.0,1,0,0,0,0,0,4544439,2022-07-04 17:00:00,2022-07-04T17:00,2022,7,29.4,0.0,Cloudy
04/12/2022,10:00,40.889458,-73.89828,BRONX,1.0,0.0,0,0,0,0,1,0,4522429,2022-04-12 10:00:00,2022-04-12T10:00,2022,4,11.0,0.4,Drizzle
02/19/2022,5:00,40.8283,-73.88296,BRONX,1.0,0.0,0,0,1,0,0,0,4504436,2022-02-19 05:00:00,2022-02-19T05:00,2022,2,-5.2,0.0,Clear
04/15/2022,21:00,40.839268,-73.903824,BRONX,0.0,0.0,0,0,0,0,0,0,4519789,2022-04-15 21:00:00,2022-04-15T21:00,2022,4,13.4,0.0,Clear
08/28/2022,15:00,40.87295,-73.8383,BRONX,1.0,0.0,0,0,0,0,1,0,4560969,2022-08-28 15:00:00,2022-08-28T15:00,2022,8,27.6,0.1,Drizzle
02/12/2022,18:00,40.822105,-73.90062,BRONX,1.0,0.0,1,0,0,0,0,0,4508526,2022-02-12 18:00:00,2022-02-12T18:00,2022,2,8.3,0.0,Cloudy
12/07/2022,9:00,40.880474,-73.91054,BRONX,1.0,0.0,0,0,0,0,1,0,4588069,2022-12-07 09:00:00,2022-12-07T09:00,2022,12,12.9,0.1,Drizzle
01/22/2022,13:00,40.837673,-73.91922,BRONX,2.0,0.0,0,0,0,0,2,0,4498226,2022-01-22 13:00:00,2022-01-22T13:00,2022,1,-1.7,0.0,Clear
02/19/2022,4:00,40.81488,-73.92886,BRONX,0.0,0.0,0,0,0,0,0,0,4505657,2022-02-19 04:00:00,2022-02-19T04:00,2022,2,-5.4,0.0,Clear
03/30/2022,19:00,40.83078,-73.82631,BRONX,1.0,0.0,0,0,1,0,0,0,4515110,2022-03-30 19:00:00,2022-03-30T19:00,2022,3,3.2,0.0,Clear
12/21/2022,3:00,40.819878,-73.85777,BRONX,1.0,0.0,0,0,0,0,1,0,4592302,2022-12-21 03:00:00,2022-12-21T03:00,2022,12,-3.4,0.0,Clear
02/06/2022,2:00,40.85586,-73.89462,BRONX,1.0,0.0,0,0,0,0,1,0,4500175,2022-02-06 02:00:00,2022-02-06T02:00,2022,2,-7.9,0.0,Clear
09/05/2022,3:00,40.869247,-73.829895,BRONX,0.0,0.0,0,0,0,0,0,0,4568498,2022-09-05 03:00:00,2022-09-05T03:00,2022,9,22.0,0.0,Cloudy
01/06/2022,23:00,40.87413,-73.83796,BRONX,1.0,0.0,0,0,0,0,1,0,4493209,2022-01-06 23:00:00,2022-01-06T23:00,2022,1,-0.0,0.0,Cloudy
03/31/2022,5:00,40.831055,-73.905846,BRONX,1.0,0.0,1,0,0,0,0,0,4715923,2022-03-31 05:00:00,2022-03-31T05:00,2022,3,9.6,0.0,Cloudy
09/08/2022,20:00,40.875458,-73.85485,BRONX,3.0,0.0,0,0,0,0,3,0,4563000,2022-09-08 20:00:00,2022-09-08T20:00,2022,9,19.8,0.0,Clear
04/25/2022,22:00,40.839565,-73.90475,BRONX,0.0,0.0,0,0,0,0,0,0,4522408,2022-04-25 22:00:00,2022-04-25T22:00,2022,4,10.3,0.0,Cloudy
01/17/2022,19:00,40.89521,-73.860245,BRONX,1.0,0.0,0,0,0,0,1,0,4495579,2022-01-17 19:00:00,2022-01-17T19:00,2022,1,1.7,0.2,Light Snow
08/14/2022,12:00,40.81793,-73.9053,BRONX,2.0,0.0,0,0,0,0,2,0,4555370,2022-08-14 12:00:00,2022-08-14T12:00,2022,8,27.5,0.0,Cloudy
05/07/2022,8:00,0.0,0.0,BRONX,0.0,0.0,0,0,0,0,0,0,4525527,2022-05-07 08:00:00,2022-05-07T08:00,2022,5,27.4,0.0,Cloudy
03/05/2022,5:00,40.845886,-73.915085,BRONX,1.0,0.0,1,0,0,0,0,0,4508092,2022-03-05 05:00:00,2022-03-05T05:00,2022,3,-2.8,0.0,Cloudy
12/14/2022,19:00,40.812035,-73.92855,BRONX,4.0,0.0,0,0,0,0,4,0,4592230,2022-12-14 19:00:00,2022-12-14T19:00,2022,12,0.5,0.0,Clear
08/19/2022,12:00,40.803185,-73.918655,BRONX,1.0,0.0,0,0,0,0,1,0,4560037,2022-08-19 12:00:00,2022-08-19T12:00,2022,8,31.3,0.0,Clear
05/18/2022,18:00,40.90799,-73.90381,BRONX,1.0,0.0,1,0,0,0,0,0,4529648,2022-05-18 18:00:00,2022-05-18T18:00,2022,5,18.2,0.0,Cloudy
01/07/2022,6:00,40.816868,-73.91639,BRONX,1.0,0.0,0,0,0,0,1,0,4493312,2022-01-07 06:00:00,2022-01-07T06:00,2022,1,-2.0,1.8,Heavy Snow
01/15/2022,18:00,40.87448,-73.83393,BRONX,1.0,0.0,1,0,0,0,0,0,4496443,2022-01-15 18:00:00,2022-01-15T18:00,2022,1,-7.8,0.0,Cloudy
05/08/2022,18:00,40.87856,-73.865776,BRONX,1.0,0.0,1,0,0,0,0,0,4525869,2022-05-08 18:00:00,2022-05-08T18:00,2022,5,11.5,0.0,Cloudy
01/29/2022,19:00,40.81959,-73.89283,BRONX,0.0,0.0,0,0,0,0,0,0,4499953,2022-01-29 19:00:00,2022-01-29T19:00,2022,1,-8.2,0.0,Cloudy
01/30/2022,20:00,40.886333,-73.847885,BRONX,1.0,0.0,1,0,0,0,0,0,4501645,2022-01-30 20:00:00,2022-01-30T20:00,2022,1,-9.7,0.0,Cloudy
05/23/2022,11:00,40.83924,-73.86668,BRONX,1.0,0.0,0,0,1,0,0,0,4530407,2022-05-23 11:00:00,2022-05-23T11:00,2022,5,20.5,0.0,Cloudy
01/05/2022,0:00,40.804905,-73.91883,BRONX,3.0,0.0,0,0,0,0,3,0,4492669,2022-01-05 00:00:00,2022-01-05T00:00,2022,1,-1.8,0.0,Clear
06/05/2022,0:00,40.83641,-73.86618,BRONX,1.0,0.0,0,0,0,0,1,0,4534561,2022-06-05 00:00:00,2022-06-05T00:00,2022,6,16.7,0.0,Clear
01/15/2022,2:00,40.83278,-73.85992,BRONX,1.0,0.0,0,0,0,0,1,0,4495289,2022-01-15 02:00:00,2022-01-15T02:00,2022,1,-8.4,0.0,Clear
07/16/2022,0:00,40.884735,-73.84045,BRONX,1.0,0.0,0,0,0,0,1,0,4547236,2022-07-16 00:00:00,2022-07-16T00:00,2022,7,21.4,0.0,Clear
01/15/2022,18:00,40.847378,-73.86827,BRONX,0.0,0.0,0,0,0,0,0,0,4494997,2022-01-15 18:00:00,2022-01-15T18:00,2022,1,-7.8,0.0,Cloudy
08/07/2022,20:00,40.839542,-73.8521,BRONX,1.0,0.0,1,0,0,0,0,0,4553702,2022-08-07 20:00:00,2022-08-07T20:00,2022,8,27.4,0.1,Drizzle
11/14/2022,14:00,40.86514,-73.801544,BRONX,2.0,0.0,0,0,0,0,2,0,4582477,2022-11-14 14:00:00,2022-11-14T14:00,2022,11,7.5,0.0,Clear
08/26/2022,15:00,40.85038,-73.90699,BRONX,1.0,0.0,0,0,0,0,1,0,4558636,2022-08-26 15:00:00,2022-08-26T15:00,2022,8,28.5,0.0,Clear
01/26/2022,10:00,40.827908,-73.88309,BRONX,1.0,0.0,0,0,0,0,1,0,4497789,2022-01-26 10:00:00,2022-01-26T10:00,2022,1,-4.2,0.0,Clear
08/31/2022,20:00,40.881508,-73.85111,BRONX,2.0,0.0,0,0,0,0,2,0,4559982,2022-08-31 20:00:00,2022-08-31T20:00,2022,8,21.1,0.0,Clear
09/12/2022,0:00,40.862747,-73.90494,BRONX,1.0,0.0,1,0,0,0,0,0,4563490,2022-09-12 00:00:00,2022-09-12T00:00,2022,9,20.8,2.0,Light Rain
11/20/2022,19:00,40.876583,-73.90266,BRONX,1.0,0.0,0,0,1,0,0,0,4585832,2022-11-20 19:00:00,2022-11-20T19:00,2022,11,-0.9,0.0,Clear
08/08/2022,18:00,40.89237,-73.897865,BRONX,1.0,0.0,0,0,0,0,1,0,4554351,2022-08-08 18:00:00,2022-08-08T18:00,2022,8,29.2,0.0,Clear
07/21/2022,20:00,40.847485,-73.82728,BRONX,0.0,0.0,0,0,0,0,0,0,4549308,2022-07-21 20:00:00,2022-07-21T20:00,2022,7,28.2,0.0,Clear
05/05/2022,9:00,40.830837,-73.9166,BRONX,1.0,0.0,0,0,0,0,1,0,4526374,2022-05-05 09:00:00,2022-05-05T09:00,2022,5,17.2,0.0,Cloudy
10/12/2022,8:00,40.818012,-73.92519,BRONX,1.0,0.0,0,0,1,0,0,0,4572556,2022-10-12 08:00:00,2022-10-12T08:00,2022,10,13.4,0.0,Cloudy
09/15/2022,9:00,40.838238,-73.876686,BRONX,2.0,0.0,0,0,0,0,2,0,4567852,2022-09-15 09:00:00,2022-09-15T09:00,2022,9,18.6,0.0,Clear
08/09/2022,18:00,40.892128,-73.84719,BRONX,1.0,0.0,0,0,0,0,1,0,4554005,2022-08-09 18:00:00,2022-08-09T18:00,2022,8,31.3,0.0,Cloudy
05/29/2022,20:00,40.86938,-73.825455,BRONX,1.0,0.0,0,0,0,0,0,0,4535455,2022-05-29 20:00:00,2022-05-29T20:00,2022,5,18.0,0.0,Clear
04/29/2022,0:00,40.839638,-73.88181,BRONX,1.0,0.0,0,0,0,0,0,0,4524073,2022-04-29 00:00:00,2022-04-29T00:00,2022,4,5.1,0.0,Clear
10/04/2022,14:00,0.0,0.0,BRONX,1.0,0.0,1,0,0,0,0,0,4571360,2022-10-04 14:00:00,2022-10-04T14:00,2022,10,25.2,0.0,Cloudy
01/14/2022,18:00,40.87182,-73.861374,BRONX,1.0,0.0,0,0,0,0,0,0,4494952,2022-01-14 18:00:00,2022-01-14T18:00,2022,1,-1.7,0.0,Clear
02/19/2022,4:00,40.842007,-73.85755,BRONX,1.0,0.0,0,0,0,0,1,0,4503914,2022-02-19 04:00:00,2022-02-19T04:00,2022,2,-5.4,0.0,Clear
08/15/2022,9:00,40.844795,-73.88482,BRONX,0.0,0.0,0,0,0,0,0,0,4556085,2022-08-15 09:00:00,2022-08-15T09:00,2022,8,25.2,0.0,Cloudy
08/14/2022,17:00,40.8965,-73.87248,BRONX,1.0,0.0,1,0,0,0,0,0,4555535,2022-08-14 17:00:00,2022-08-14T17:00,2022,8,24.7,0.0,Clear
09/18/2022,12:00,40.83351,-73.85809,BRONX,1.0,0.0,0,0,1,0,0,0,4564997,2022-09-18 12:00:00,2022-09-18T12:00,2022,9,27.2,0.0,Cloudy
09/03/2022,0:00,40.834354,-73.82623,BRONX,1.0,0.0,0,0,1,0,0,0,4562223,2022-09-03 00:00:00,2022-09-03T00:00,2022,9,18.1,0.0,Clear
07/10/2022,13:00,40.846497,-73.894196,BRONX,1.0,0.0,0,0,0,0,1,0,4545519,2022-07-10 13:00:00,2022-07-10T13:00,2022,7,27.9,0.0,Clear
03/02/2022,16:00,40.87911,-73.84325,BRONX,6.0,0.0,0,0,0,0,6,0,4507052,2022-03-02 16:00:00,2022-03-02T16:00,2022,3,10.0,0.0,Clear
04/10/2022,8:00,40.816845,-73.89941,BRONX,0.0,0.0,0,0,0,0,0,0,4520685,2022-04-10 08:00:00,2022-04-10T08:00,2022,4,7.1,0.0,Clear
11/18/2022,22:00,40.818798,-73.89213,BRONX,4.0,0.0,0,0,0,0,4,0,4586038,2022-11-18 22:00:00,2022-11-18T22:00,2022,11,2.7,0.0,Clear
01/29/2022,14:00,40.831985,-73.908676,BRONX,0.0,0.0,0,0,0,0,0,0,4498602,2022-01-29 14:00:00,2022-01-29T14:00,2022,1,-8.4,0.7,Heavy Snow
11/09/2022,18:00,40.81343,-73.91003,BRONX,0.0,0.0,0,0,0,0,0,0,4580767,2022-11-09 18:00:00,2022-11-09T18:00,2022,11,6.3,0.0,Clear
12/25/2022,15:00,40.854244,-73.91557,BRONX,2.0,0.0,0,0,0,0,2,0,4593188,2022-12-25 15:00:00,2022-12-25T15:00,2022,12,-2.1,0.0,Clear
03/21/2022,0:00,40.823845,-73.896866,BRONX,1.0,0.0,1,0,0,0,0,0,4516543,2022-03-21 00:00:00,2022-03-21T00:00,2022,3,7.4,0.0,Cloudy
08/16/2022,17:00,40.86778,-73.83482,BRONX,1.0,0.0,1,0,0,0,0,0,4556164,2022-08-16 17:00:00,2022-08-16T17:00,2022,8,27.1,0.0,Cloudy
01/18/2022,20:00,40.820023,-73.92663,BRONX,1.0,0.0,0,0,0,0,0,0,4495653,2022-01-18 20:00:00,2022-01-18T20:00,2022,1,-3.7,0.0,Clear
04/22/2022,14:00,0.0,0.0,BRONX,2.0,0.0,0,0,0,0,2,0,4521165,2022-04-22 14:00:00,2022-04-22T14:00,2022,4,28.0,0.0,Cloudy
05/22/2022,1:00,40.86876,-73.864365,BRONX,0.0,0.0,0,0,0,0,0,0,4530907,2022-05-22 01:00:00,2022-05-22T01:00,2022,5,21.2,0.0,Clear
02/18/2022,15:00,40.848362,-73.86252,BRONX,1.0,0.0,1,0,0,0,0,0,4505259,2022-02-18 15:00:00,2022-02-18T15:00,2022,2,3.8,0.0,Clear
03/24/2022,17:00,40.827656,-73.8861,BRONX,1.0,0.0,0,0,0,0,1,0,4513342,2022-03-24 17:00:00,2022-03-24T17:00,2022,3,9.5,0.0,Cloudy
08/19/2022,2:00,40.837784,-73.852486,BRONX,1.0,0.0,0,0,0,0,1,0,4556578,2022-08-19 02:00:00,2022-08-19T02:00,2022,8,19.6,0.0,Clear
08/25/2022,17:00,40.887714,-73.90697,BRONX,0.0,0.0,0,0,0,0,0,0,4561482,2022-08-25 17:00:00,2022-08-25T17:00,2022,8,28.5,0.0,Clear
03/07/2022,18:00,40.80549,-73.91031,BRONX,1.0,0.0,0,0,0,0,1,0,4508286,2022-03-07 18:00:00,2022-03-07T18:00,2022,3,19.6,0.4,Drizzle
04/16/2022,14:00,40.87142,-73.90654,BRONX,5.0,0.0,0,0,0,0,5,0,4519980,2022-04-16 14:00:00,2022-04-16T14:00,2022,4,17.4,0.0,Cloudy
12/02/2022,0:00,40.80549,-73.91031,BRONX,1.0,0.0,0,0,0,0,1,0,4587015,2022-12-02 00:00:00,2022-12-02T00:00,2022,12,-0.2,0.0,Clear
01/30/2022,4:00,40.835876,-73.918846,BRONX,1.0,0.0,1,0,0,0,0,0,4498603,2022-01-30 04:00:00,2022-01-30T04:00,2022,1,-13.3,0.0,Clear
02/17/2022,21:00,40.820187,-73.890686,BRONX,1.0,0.0,0,0,0,0,1,0,4504303,2022-02-17 21:00:00,2022-02-17T21:00,2022,2,12.3,0.0,Cloudy
10/04/2022,12:00,40.867878,-73.89944,BRONX,1.0,0.0,0,0,1,0,0,0,4571686,2022-10-04 12:00:00,2022-10-04T12:00,2022,10,11.7,0.8,Drizzle
03/29/2022,15:00,40.845913,-73.84783,BRONX,1.0,0.0,0,0,0,0,1,0,4514940,2022-03-29 15:00:00,2022-03-29T15:00,2022,3,3.0,0.0,Cloudy
02/19/2022,13:00,40.844982,-73.88244,BRONX,2.0,0.0,0,0,0,0,2,0,4504742,2022-02-19 13:00:00,2022-02-19T13:00,2022,2,2.6,0.1,Light Snow
11/09/2022,13:00,40.844177,-73.90292,BRONX,2.0,0.0,0,0,0,0,2,0,4580768,2022-11-09 13:00:00,2022-11-09T13:00,2022,11,10.3,0.0,Clear
03/18/2022,17:00,40.840042,-73.863945,BRONX,1.0,0.0,1,0,0,0,0,0,4513118,2022-03-18 17:00:00,2022-03-18T17:00,2022,3,13.0,0.0,Cloudy
01/07/2022,17:00,40.847546,-73.86724,BRONX,1.0,0.0,1,0,0,0,0,0,4493622,2022-01-07 17:00:00,2022-01-07T17:00,2022,1,-2.1,0.0,Clear
10/27/2022,11:00,40.85713,-73.8808,BRONX,1.0,0.0,0,0,0,0,1,0,4577648,2022-10-27 11:00:00,2022-10-27T11:00,2022,10,16.4,0.0,Clear
05/26/2022,14:00,40.827423,-73.86823,BRONX,1.0,0.0,0,0,0,0,1,0,4531424,2022-05-26 14:00:00,2022-05-26T14:00,2022,5,20.0,0.0,Clear
04/19/2022,18:00,40.83417,-73.852036,BRONX,0.0,0.0,0,0,0,0,0,0,4521883,2022-04-19 18:00:00,2022-04-19T18:00,2022,4,9.1,0.0,Clear
01/31/2022,0:00,40.841087,-73.86449,BRONX,1.0,0.0,1,0,0,0,0,0,4498808,2022-01-31 00:00:00,2022-01-31T00:00,2022,1,-14.4,0.0,Clear
11/20/2022,15:00,40.86553,-73.88703,BRONX,0.0,0.0,0,0,0,0,0,0,4583360,2022-11-20 15:00:00,2022-11-20T15:00,2022,11,1.4,0.0,Clear
02/15/2022,16:00,40.87829,-73.84602,BRONX,0.0,0.0,0,0,0,0,0,0,4509119,2022-02-15 16:00:00,2022-02-15T16:00,2022,2,-0.8,0.0,Clear
03/30/2022,0:00,40.854767,-73.83128,BRONX,1.0,0.0,0,0,0,0,1,0,4515062,2022-03-30 00:00:00,2022-03-30T00:00,2022,3,-1.9,0.0,Clear
03/20/2022,8:00,40.87695,-73.86461,BRONX,1.0,0.0,0,0,0,0,1,0,4512446,2022-03-20 08:00:00,2022-03-20T08:00,2022,3,11.3,0.0,Clear
01/28/2022,18:00,40.83741,-73.847595,BRONX,2.0,0.0,0,0,0,0,2,0,4498643,2022-01-28 18:00:00,2022-01-28T18:00,2022,1,-0.5,0.0,Cloudy
06/09/2022,19:00,40.843647,-73.88754,BRONX,1.0,0.0,0,0,0,0,1,0,4547040,2022-06-09 19:00:00,2022-06-09T19:00,2022,6,21.9,0.0,Clear
02/10/2022,17:00,40.843765,-73.8656,BRONX,1.0,0.0,0,0,1,0,0,0,4501971,2022-02-10 17:00:00,2022-02-10T17:00,2022,2,7.7,0.0,Clear
05/11/2022,7:00,40.838844,-73.87817,BRONX,0.0,0.0,0,0,0,0,0,0,4527024,2022-05-11 07:00:00,2022-05-11T07:00,2022,5,13.5,0.0,Clear
12/16/2022,6:00,40.825333,-73.84485,BRONX,1.0,0.0,1,0,0,0,0,0,4591682,2022-12-16 06:00:00,2022-12-16T06:00,2022,12,6.7,0.8,Drizzle
12/08/2022,22:00,40.86617,-73.822975,BRONX,1.0,0.0,0,0,0,0,0,0,4588377,2022-12-08 22:00:00,2022-12-08T22:00,2022,12,5.6,0.0,Cloudy
06/05/2022,15:00,40.818558,-73.92732,BRONX,1.0,0.0,0,0,0,0,1,0,4538255,2022-06-05 15:00:00,2022-06-05T15:00,2022,6,24.5,0.0,Cloudy
02/16/2022,14:00,40.81881,-73.92828,BRONX,1.0,0.0,0,0,0,0,0,0,4508933,2022-02-16 14:00:00,2022-02-16T14:00,2022,2,6.3,0.0,Cloudy
10/06/2022,16:00,40.8981,-73.86886,BRONX,0.0,0.0,0,0,0,0,0,0,4571771,2022-10-06 16:00:00,2022-10-06T16:00,2022,10,21.7,0.0,Clear
05/12/2022,12:00,40.819477,-73.92689,BRONX,0.0,0.0,0,0,0,0,0,0,4530310,2022-05-12 12:00:00,2022-05-12T12:00,2022,5,19.6,0.0,Cloudy
02/07/2022,15:00,40.835926,-73.90291,BRONX,2.0,0.0,2,0,0,0,0,0,4502455,2022-02-07 15:00:00,2022-02-07T15:00,2022,2,2.4,0.7,Drizzle
12/24/2022,13:00,40.88661,-73.86451,BRONX,1.0,0.0,1,0,0,0,0,0,4596748,2022-12-24 13:00:00,2022-12-24T13:00,2022,12,-9.0,0.0,Cloudy
04/25/2022,13:00,0.0,0.0,BRONX,1.0,0.0,0,0,0,0,1,0,4522267,2022-04-25 13:00:00,2022-04-25T13:00,2022,4,27.2,0.1,Drizzle
05/06/2022,20:00,40.901775,-73.84708,BRONX,1.0,0.0,0,0,0,0,1,0,4527973,2022-05-06 20:00:00,2022-05-06T20:00,2022,5,10.3,2.0,Light Rain
09/12/2022,8:00,40.824894,-73.82426,BRONX,3.0,0.0,0,0,0,0,3,0,4563273,2022-09-12 08:00:00,2022-09-12T08:00,2022,9,21.5,0.0,Cloudy
07/04/2022,17:00,40.813297,-73.85822,BRONX,1.0,0.0,0,0,1,0,0,0,4543953,2022-07-04 17:00:00,2022-07-04T17:00,2022,7,28.2,0.0,Cloudy
03/25/2022,0:00,40.85713,-73.8808,BRONX,0.0,0.0,0,0,0,0,0,0,4514180,2022-03-25 00:00:00,2022-03-25T00:00,2022,3,6.5,0.5,Drizzle
10/12/2022,18:00,40.887737,-73.86755,BRONX,4.0,0.0,0,0,0,0,4,0,4574267,2022-10-12 18:00:00,2022-10-12T18:00,2022,10,15.6,0.0,Cloudy
09/21/2022,15:00,40.838966,-73.88229,BRONX,2.0,0.0,1,0,0,0,1,0,4567856,2022-09-21 15:00:00,2022-09-21T15:00,2022,9,25.9,0.0,Clear
04/06/2022,10:00,40.89213,-73.85341,BRONX,1.0,0.0,0,0,0,0,1,0,4516734,2022-04-06 10:00:00,2022-04-06T10:00,2022,4,9.1,1.1,Drizzle
12/24/2022,14:00,40.804344,-73.92158,BRONX,1.0,0.0,0,0,0,0,1,0,4592708,2022-12-24 14:00:00,2022-12-24T14:00,2022,12,-7.7,0.0,Cloudy
10/18/2022,18:00,40.803593,-73.919785,BRONX,1.0,0.0,0,0,0,0,1,0,4574026,2022-10-18 18:00:00,2022-10-18T18:00,2022,10,10.4,0.0,Clear
08/01/2022,6:00,40.853333,-73.91961,BRONX,0.0,0.0,0,0,0,0,0,0,4551660,2022-08-01 06:00:00,2022-08-01T06:00,2022,8,21.0,1.2,Drizzle
09/24/2022,3:00,40.84516,-73.88376,BRONX,0.0,0.0,0,0,0,0,0,0,4568767,2022-09-24 03:00:00,2022-09-24T03:00,2022,9,10.0,0.0,Cloudy
04/10/2022,15:00,40.856987,-73.90897,BRONX,1.0,0.0,0,0,0,0,1,0,4517888,2022-04-10 15:00:00,2022-04-10T15:00,2022,4,9.7,0.1,Drizzle
08/02/2022,7:00,40.852596,-73.86778,BRONX,0.0,0.0,0,0,0,0,0,0,4551586,2022-08-02 07:00:00,2022-08-02T07:00,2022,8,23.1,0.0,Clear
08/21/2022,1:00,40.85071,-73.89408,BRONX,0.0,0.0,0,0,0,0,0,0,4558455,2022-08-21 01:00:00,2022-08-21T01:00,2022,8,21.4,0.0,Clear
12/19/2022,21:00,40.814693,-73.85122,BRONX,0.0,0.0,0,0,0,0,0,0,4592303,2022-12-19 21:00:00,2022-12-19T21:00,2022,12,-0.2,0.0,Cloudy
10/02/2022,21:00,40.878777,-73.85294,BRONX,4.0,0.0,0,0,0,0,4,0,4571423,2022-10-02 21:00:00,2022-10-02T21:00,2022,10,11.1,0.0,Cloudy
05/08/2022,0:00,40.846497,-73.894196,BRONX,2.0,0.0,0,0,0,0,2,0,4526046,2022-05-08 00:00:00,2022-05-08T00:00,2022,5,7.2,0.1,Drizzle
04/23/2022,14:00,40.821808,-73.91322,BRONX,1.0,0.0,0,0,1,0,0,0,4521577,2022-04-23 14:00:00,2022-04-23T14:00,2022,4,14.8,0.0,Cloudy
11/15/2022,3:00,40.86351,-73.833115,BRONX,1.0,0.0,0,0,0,0,1,0,4584954,2022-11-15 03:00:00,2022-11-15T03:00,2022,11,2.0,0.0,Cloudy
12/04/2022,3:00,40.86877,-73.83174,BRONX,1.0,0.0,0,0,0,0,1,0,4591476,2022-12-04 03:00:00,2022-12-04T03:00,2022,12,3.1,0.0,Clear
05/09/2022,3:00,40.840225,-73.91769,BRONX,1.0,0.0,0,0,0,0,1,0,4525993,2022-05-09 03:00:00,2022-05-09T03:00,2022,5,6.0,0.0,Clear
12/04/2022,16:00,40.832928,-73.88928,BRONX,0.0,0.0,0,0,0,0,0,0,4587255,2022-12-04 16:00:00,2022-12-04T16:00,2022,12,4.9,0.0,Cloudy
06/21/2022,0:00,40.858418,-73.88514,BRONX,0.0,0.0,0,0,0,0,0,0,4539697,2022-06-21 00:00:00,2022-06-21T00:00,2022,6,16.4,0.0,Cloudy
04/24/2022,2:00,40.67007,-73.89927,BROOKLYN,1.0,0.0,0,0,0,0,1,0,4521529,2022-04-24 02:00:00,2022-04-24T02:00,2022,4,9.2,0.0,Clear
01/17/2022,8:00,40.653683,-73.93255,BROOKLYN,0.0,0.0,0,0,0,0,0,0,4495201,2022-01-17 08:00:00,2022-01-17T08:00,2022,1,4.7,0.1,Drizzle
03/01/2022,16:00,40.60059,-73.96137,BROOKLYN,1.0,0.0,0,0,0,0,1,0,4506667,2022-03-01 16:00:00,2022-03-01T16:00,2022,3,6.0,0.0,Cloudy
08/14/2022,0:00,40.61172,-73.92316,BROOKLYN,1.0,0.0,0,0,0,0,1,0,4555230,2022-08-14 00:00:00,2022-08-14T00:00,2022,8,20.4,0.0,Clear
06/11/2022,22:00,40.69599,-73.98322,BROOKLYN,0.0,0.0,0,0,0,0,0,0,4537971,2022-06-11 22:00:00,2022-06-11T22:00,2022,6,18.6,0.0,Clear
02/21/2022,12:00,40.681076,-73.88111,BROOKLYN,1.0,0.0,1,0,0,0,0,0,4511139,2022-02-21 12:00:00,2022-02-21T12:00,2022,2,6.8,0.0,Cloudy
01/25/2022,9:00,40.62704,-73.96663,BROOKLYN,1.0,0.0,1,0,0,0,0,0,4497205,2022-01-25 09:00:00,2022-01-25T09:00,2022,1,3.0,0.0,Cloudy
03/13/2022,21:00,40.694088,-73.93427,BROOKLYN,1.0,0.0,0,0,0,0,1,0,4510496,2022-03-13 21:00:00,2022-03-13T21:00,2022,3,-1.7,0.0,Clear
02/01/2022,9:00,40.5906,-73.94679,BROOKLYN,0.0,0.0,0,0,0,0,0,0,4499642,2022-02-01 09:00:00,2022-02-01T09:00,2022,2,-5.7,0.0,Clear
06/17/2022,16:00,40.647243,-73.96048,BROOKLYN,0.0,0.0,0,0,0,0,0,0,4538666,2022-06-17 16:00:00,2022-06-17T16:00,2022,6,30.2,0.0,Clear
01/01/2022,19:00,40.639984,-73.94842,BROOKLYN,1.0,0.0,0,0,0,0,1,0,4492117,2022-01-01 19:00:00,2022-01-01T19:00,2022,1,10.3,1.2,Drizzle
05/12/2022,18:00,40.58605,-73.95076,BROOKLYN,0.0,0.0,0,0,0,0,0,0,4527343,2022-05-12 18:00:00,2022-05-12T18:00,2022,5,13.1,0.0,Cloudy
11/16/2022,13:00,40.6572,-74.004684,BROOKLYN,1.0,0.0,1,0,0,0,0,0,4582225,2022-11-16 13:00:00,2022-11-16T13:00,2022,11,11.2,0.0,Cloudy
11/07/2022,3:00,40.608,-74.001724,BROOKLYN,1.0,0.0,1,0,0,0,0,0,4582868,2022-11-07 03:00:00,2022-11-07T03:00,2022,11,18.8,0.0,Clear
10/01/2022,21:00,40.601,-73.936745,BROOKLYN,1.0,0.0,0,0,0,0,1,0,4569432,2022-10-01 21:00:00,2022-10-01T21:00,2022,10,15.1,0.1,Drizzle
10/06/2022,14:00,40.601322,-73.96616,BROOKLYN,1.0,0.0,1,0,0,0,0,0,4570686,2022-10-06 14:00:00,2022-10-06T14:00,2022,10,21.0,0.0,Clear
02/11/2022,15:00,0.0,0.0,BROOKLYN,1.0,0.0,0,0,0,0,1,0,4502368,2022-02-11 15:00:00,2022-02-11T15:00,2022,2,27.4,0.0,Cloudy
10/26/2022,4:00,40.624893,-74.015045,BROOKLYN,0.0,0.0,0,0,0,0,0,0,4576208,2022-10-26 04:00:00,2022-10-26T04:00,2022,10,17.3,0.0,Cloudy
07/14/2022,18:00,40.658516,-74.003334,BROOKLYN,0.0,0.0,0,0,0,0,0,0,4547397,2022-07-14 18:00:00,2022-07-14T18:00,2022,7,26.2,0.0,Clear
10/27/2022,16:00,40.70153,-73.92314,BROOKLYN,1.0,0.0,0,0,0,0,0,0,4577246,2022-10-27 16:00:00,2022-10-27T16:00,2022,10,16.4,0.0,Clear
03/21/2022,14:00,40.63676,-73.94019,BROOKLYN,3.0,0.0,0,0,0,0,3,0,4512475,2022-03-21 14:00:00,2022-03-21T14:00,2022,3,15.7,0.0,Clear
09/18/2022,21:00,40.73207,-73.94462,BROOKLYN,1.0,0.0,0,0,1,0,0,0,4567325,2022-09-18 21:00:00,2022-09-18T21:00,2022,9,22.6,0.0,Cloudy
12/16/2022,19:00,40.618134,-73.95884,BROOKLYN,3.0,0.0,0,0,0,0,3,0,4590678,2022-12-16 19:00:00,2022-12-16T19:00,2022,12,3.9,0.1,Drizzle
09/08/2022,14:00,40.69821,-73.92406,BROOKLYN,1.0,0.0,0,0,0,0,1,0,4562169,2022-09-08 14:00:00,2022-09-08T14:00,2022,9,23.7,0.0,Cloudy
09/24/2022,0:00,40.677998,-74.01216,BROOKLYN,1.0,0.0,0,0,1,0,0,0,4567418,2022-09-24 00:00:00,2022-09-24T00:00,2022,9,9.8,0.0,Clear
02/03/2022,22:00,40.61642,-73.97445,BROOKLYN,1.0,0.0,0,0,0,0,1,0,4500192,2022-02-03 22:00:00,2022-02-03T22:00,2022,2,10.1,0.6,Drizzle
06/15/2022,15:00,40.6891,-73.936264,BROOKLYN,1.0,0.0,0,0,0,0,1,0,4538785,2022-06-15 15:00:00,2022-06-15T15:00,2022,6,23.3,0.0,Cloudy
01/08/2022,21:00,40.607235,-73.99194,BROOKLYN,1.0,0.0,0,0,1,0,0,0,4493030,2022-01-08 21:00:00,2022-01-08T21:00,2022,1,-2.3,0.0,Clear
06/04/2022,14:00,40.606754,-73.92066,BROOKLYN,1.0,0.0,0,0,1,0,0,0,4535463,2022-06-04 14:00:00,2022-06-04T14:00,2022,6,20.3,0.0,Clear
04/27/2022,14:00,40.716778,-73.93635,BROOKLYN,0.0,0.0,0,0,0,0,0,0,4522751,2022-04-27 14:00:00,2022-04-27T14:00,2022,4,12.7,0.0,Cloudy
01/11/2022,15:00,40.59085,-73.94779,BROOKLYN,4.0,0.0,0,0,0,0,4,0,4493800,2022-01-11 15:00:00,2022-01-11T15:00,2022,1,-5.7,0.0,Clear
01/29/2022,14:00,40.62537,-74.039116,BROOKLYN,1.0,0.0,0,0,0,0,1,0,4498154,2022-01-29 14:00:00,2022-01-29T14:00,2022,1,-7.6,0.6,Heavy Snow
01/21/2022,19:00,40.71526,-73.96318,BROOKLYN,1.0,0.0,0,0,1,0,0,0,4496750,2022-01-21 19:00:00,2022-01-21T19:00,2022,1,-7.0,0.0,Cloudy
04/04/2022,0:00,40.661125,-73.9507,BROOKLYN,1.0,0.0,0,0,1,0,0,0,4516340,2022-04-04 00:00:00,2022-04-04T00:00,2022,4,4.0,0.0,Cloudy
07/16/2022,0:00,40.609776,-73.9643,BROOKLYN,1.0,0.0,0,0,0,0,1,0,4546546,2022-07-16 00:00:00,2022-07-16T00:00,2022,7,21.9,0.0,Clear
02/07/2022,16:00,40.654488,-73.89521,BROOKLYN,1.0,0.0,1,0,0,0,0,0,4500937,2022-02-07 16:00:00,2022-02-07T16:00,2022,2,2.4,0.2,Drizzle
02/23/2022,17:00,40.736916,-73.95265,BROOKLYN,0.0,0.0,0,0,0,0,0,0,4505169,2022-02-23 17:00:00,2022-02-23T17:00,2022,2,14.0,0.0,Clear
01/17/2022,12:00,40.618137,-74.03414,BROOKLYN,0.0,0.0,0,0,0,0,0,0,4495344,2022-01-17 12:00:00,2022-01-17T12:00,2022,1,2.9,0.0,Cloudy
07/24/2022,15:00,40.657307,-73.93098,BROOKLYN,0.0,0.0,0,0,0,0,0,0,4549624,2022-07-24 15:00:00,2022-07-24T15:00,2022,7,33.3,0.0,Clear
05/10/2022,10:00,40.689297,-73.87406,BROOKLYN,1.0,0.0,1,0,0,0,0,0,4526685,2022-05-10 10:00:00,2022-05-10T10:00,2022,5,16.0,0.0,Clear
05/08/2022,17:00,0.0,0.0,BROOKLYN,4.0,0.0,0,0,0,0,4,0,4527239,2022-05-08 17:00:00,2022-05-08T17:00,2022,5,28.9,0.0,Cloudy
08/31/2022,14:00,40.60886,-74.00066,BROOKLYN,1.0,0.0,0,0,0,0,0,0,4559998,2022-08-31 14:00:00,2022-08-31T14:00,2022,8,29.4,0.0,Clear
12/02/2022,0:00,40.70547,-73.95024,BROOKLYN,1.0,0.0,0,0,0,0,0,0,4586631,2022-12-02 00:00:00,2022-12-02T00:00,2022,12,-0.2,0.0,Clear
03/17/2022,0:00,40.665627,-73.909706,BROOKLYN,1.0,0.0,0,0,0,0,1,0,4511230,2022-03-17 00:00:00,2022-03-17T00:00,2022,3,5.6,0.0,Cloudy
12/17/2022,12:00,40.62051,-73.99248,BROOKLYN,1.0,0.0,1,0,0,0,0,0,4592194,2022-12-17 12:00:00,2022-12-17T12:00,2022,12,6.5,0.0,Clear
08/02/2022,0:00,40.72757,-73.94388,BROOKLYN,1.0,0.0,0,0,0,0,0,0,4552479,2022-08-02 00:00:00,2022-08-02T00:00,2022,8,22.4,0.0,Clear
11/07/2022,9:00,40.646015,-74.00579,BROOKLYN,1.0,0.0,0,0,1,0,0,0,4580148,2022-11-07 09:00:00,2022-11-07T09:00,2022,11,21.1,0.0,Clear
08/12/2022,0:00,40.58371,-73.94739,BROOKLYN,1.0,0.0,0,0,1,0,0,0,4554501,2022-08-12 00:00:00,2022-08-12T00:00,2022,8,25.3,0.0,Cloudy
05/03/2022,5:00,40.660736,-73.910385,BROOKLYN,0.0,0.0,0,0,0,0,0,0,4524830,2022-05-03 05:00:00,2022-05-03T05:00,2022,5,7.8,0.0,Clear
10/13/2022,19:00,40.680733,-73.97451,BROOKLYN,1.0,0.0,0,0,0,0,0,0,4573096,2022-10-13 19:00:00,2022-10-13T19:00,2022,10,18.2,0.9,Drizzle
01/06/2022,7:00,40.673782,-73.87405,BROOKLYN,1.0,0.0,0,0,0,0,1,0,4492450,2022-01-06 07:00:00,2022-01-06T07:00,2022,1,2.3,0.0,Cloudy
04/30/2022,0:00,40.62868,-74.012146,BROOKLYN,2.0,0.0,0,0,0,0,2,0,4523335,2022-04-30 00:00:00,2022-04-30T00:00,2022,4,7.5,0.0,Clear
04/04/2022,8:00,40.665348,-73.922325,BROOKLYN,1.0,0.0,0,0,0,0,1,0,4516974,2022-04-04 08:00:00,2022-04-04T08:00,2022,4,6.5,0.0,Clear
03/13/2022,9:00,40.703285,-73.950645,BROOKLYN,3.0,0.0,0,0,0,0,3,0,4509852,2022-03-13 09:00:00,2022-03-13T09:00,2022,3,-2.5,0.0,Clear
01/29/2022,9:00,40.69821,-73.92406,BROOKLYN,1.0,0.0,0,0,0,0,1,0,4498708,2022-01-29 09:00:00,2022-01-29T09:00,2022,1,-10.3,1.4,Heavy Snow
10/18/2022,16:00,40.671864,-73.87834,BROOKLYN,4.0,0.0,0,0,0,0,4,0,4574117,2022-10-18 16:00:00,2022-10-18T16:00,2022,10,13.1,0.0,Clear
04/10/2022,10:00,40.612556,-74.0361,BROOKLYN,1.0,0.0,0,0,1,0,0,0,4517785,2022-04-10 10:00:00,2022-04-10T10:00,2022,4,8.2,0.0,Cloudy
05/31/2022,15:00,40.73398,-73.95995,BROOKLYN,1.0,0.0,0,0,1,0,0,0,4533039,2022-05-31 15:00:00,2022-05-31T15:00,2022,5,35.0,0.0,Clear
12/13/2022,13:00,40.683895,-73.88181,BROOKLYN,0.0,0.0,0,0,0,0,0,0,4591786,2022-12-13 13:00:00,2022-12-13T13:00,2022,12,3.6,0.0,Clear
08/22/2022,14:00,40.595394,-73.945786,BROOKLYN,1.0,0.0,0,0,0,0,0,0,4558785,2022-08-22 14:00:00,2022-08-22T14:00,2022,8,23.2,0.1,Drizzle
09/29/2022,15:00,40.67417,-73.95671,BROOKLYN,1.0,0.0,0,0,1,0,0,0,4570413,2022-09-29 15:00:00,2022-09-29T15:00,2022,9,19.3,0.0,Cloudy
03/12/2022,22:00,40.665245,-73.87513,BROOKLYN,1.0,0.0,0,0,1,0,0,0,4509709,2022-03-12 22:00:00,2022-03-12T22:00,2022,3,-4.0,0.0,Clear
09/19/2022,0:00,40.67619,-73.9081,BROOKLYN,1.0,0.0,0,0,0,0,1,0,4565634,2022-09-19 00:00:00,2022-09-19T00:00,2022,9,21.5,0.0,Clear
07/19/2022,13:00,40.69629,-73.934715,BROOKLYN,1.0,0.0,0,0,1,0,0,0,4548633,2022-07-19 13:00:00,2022-07-19T13:00,2022,7,32.3,0.0,Clear
03/04/2022,10:00,40.676506,-73.90807,BROOKLYN,2.0,0.0,0,0,0,0,2,0,4522511,2022-03-04 10:00:00,2022-03-04T10:00,2022,3,-2.9,0.0,Cloudy
01/19/2022,19:00,40.58331,-73.95202,BROOKLYN,1.0,0.0,0,0,0,0,1,0,4495842,2022-01-19 19:00:00,2022-01-19T19:00,2022,1,6.2,0.0,Cloudy
07/13/2022,7:00,40.62194,-73.91753,BROOKLYN,1.0,0.0,0,0,0,0,1,0,4546165,2022-07-13 07:00:00,2022-07-13T07:00,2022,7,25.9,0.0,Clear
05/18/2022,8:00,40.654003,-73.952255,BROOKLYN,0.0,0.0,0,0,0,0,0,0,4529326,2022-05-18 08:00:00,2022-05-18T08:00,2022,5,15.6,0.0,Cloudy
10/24/2022,12:00,40.72642,-73.95471,BROOKLYN,0.0,0.0,0,0,0,0,0,0,4575707,2022-10-24 12:00:00,2022-10-24T12:00,2022,10,16.2,0.2,Drizzle
07/25/2022,0:00,40.627144,-74.00032,BROOKLYN,1.0,0.0,0,0,0,0,0,0,4549702,2022-07-25 00:00:00,2022-07-25T00:00,2022,7,27.9,0.0,Clear
06/24/2022,16:00,40.643635,-73.97746,BROOKLYN,1.0,0.0,0,0,1,0,0,0,4540643,2022-06-24 16:00:00,2022-06-24T16:00,2022,6,23.5,0.0,Clear
02/10/2022,7:00,40.625893,-73.92661,BROOKLYN,0.0,0.0,0,0,0,0,0,0,4501670,2022-02-10 07:00:00,2022-02-10T07:00,2022,2,2.1,0.0,Clear
12/15/2022,20:00,40.64195,-73.932274,BROOKLYN,1.0,0.0,1,0,0,0,0,0,4591152,2022-12-15 20:00:00,2022-12-15T20:00,2022,12,5.6,1.9,Light Rain
08/29/2022,18:00,40.713955,-73.95794,BROOKLYN,1.0,0.0,0,0,1,0,0,0,4562340,2022-08-29 18:00:00,2022-08-29T18:00,2022,8,25.5,0.0,Clear
05/14/2022,23:00,40.704605,-73.966095,BROOKLYN,0.0,0.0,0,0,0,0,0,0,4527672,2022-05-14 23:00:00,2022-05-14T23:00,2022,5,14.5,0.3,Drizzle
08/01/2022,19:00,40.66871,-73.91731,BROOKLYN,1.0,0.0,1,0,0,0,0,0,4553300,2022-08-01 19:00:00,2022-08-01T19:00,2022,8,23.8,0.0,Clear
09/30/2022,0:00,40.660122,-73.91705,BROOKLYN,1.0,0.0,0,0,1,0,0,0,4570629,2022-09-30 00:00:00,2022-09-30T00:00,2022,9,12.9,0.0,Cloudy
07/16/2022,8:00,40.727547,-73.94421,BROOKLYN,1.0,0.0,0,0,0,0,1,0,4546995,2022-07-16 08:00:00,2022-07-16T08:00,2022,7,24.0,0.0,Cloudy
11/09/2022,13:00,0.0,0.0,BROOKLYN,1.0,0.0,0,0,0,0,0,0,4580534,2022-11-09 13:00:00,2022-11-09T13:00,2022,11,24.5,1.0,Drizzle
02/15/2022,8:00,0.0,0.0,BROOKLYN,0.0,0.0,0,0,0,0,0,0,4503119,2022-02-15 08:00:00,2022-02-15T08:00,2022,2,27.7,0.0,Cloudy
02/16/2022,19:00,40.66425,-73.922104,BROOKLYN,1.0,0.0,0,0,1,0,0,0,4505839,2022-02-16 19:00:00,2022-02-16T19:00,2022,2,3.8,0.0,Cloudy
07/05/2022,5:00,40.691494,-73.93077,BROOKLYN,1.0,0.0,0,0,1,0,0,0,4546688,2022-07-05 05:00:00,2022-07-05T05:00,2022,7,20.7,0.0,Cloudy
05/19/2022,11:00,40.68457,-73.925735,BROOKLYN,0.0,0.0,0,0,0,0,0,0,4534241,2022-05-19 11:00:00,2022-05-19T11:00,2022,5,15.7,0.0,Cloudy
05/27/2022,21:00,40.654976,-73.936554,BROOKLYN,0.0,0.0,0,0,0,0,0,0,4532430,2022-05-27 21:00:00,2022-05-27T21:00,2022,5,16.9,8.5,Heavy Rain
04/16/2022,16:00,40.713264,-73.94218,BROOKLYN,0.0,0.0,0,0,0,0,0,0,4519986,2022-04-16 16:00:00,2022-04-16T16:00,2022,4,15.4,0.3,Drizzle
07/13/2022,1:00,40.666706,-73.871826,BROOKLYN,3.0,0.0,0,0,0,0,3,0,4548043,2022-07-13 01:00:00,2022-07-13T01:00,2022,7,25.4,0.0,Cloudy
11/04/2022,14:00,40.72218,-73.949875,BROOKLYN,1.0,0.0,0,0,1,0,0,0,4580751,2022-11-04 14:00:00,2022-11-04T14:00,2022,11,19.9,0.0,Clear
03/04/2022,2:00,40.676495,-73.913704,BROOKLYN,1.0,0.0,0,0,0,0,1,0,4508021,2022-03-04 02:00:00,2022-03-04T02:00,2022,3,-6.1,0.0,Clear
08/27/2022,17:00,40.662743,-73.921936,BROOKLYN,1.0,0.0,1,0,0,0,0,0,4559919,2022-08-27 17:00:00,2022-08-27T17:00,2022,8,27.1,0.0,Clear
11/19/2022,16:00,40.617218,-74.01599,BROOKLYN,1.0,0.0,0,0,0,0,1,0,4583177,2022-11-19 16:00:00,2022-11-19T16:00,2022,11,4.1,0.0,Clear
10/21/2022,17:00,40.585556,-73.94881,BROOKLYN,1.0,0.0,1,0,0,0,0,0,4574908,2022-10-21 17:00:00,2022-10-21T17:00,2022,10,13.4,0.0,Clear
10/24/2022,12:00,40.630592,-73.97551,BROOKLYN,1.0,0.0,1,0,0,0,0,0,4576407,2022-10-24 12:00:00,2022-10-24T12:00,2022,10,16.3,0.2,Drizzle
02/08/2022,12:00,40.59783,-73.96549,BROOKLYN,0.0,0.0,0,0,0,0,0,0,4501181,2022-02-08 12:00:00,2022-02-08T12:00,2022,2,6.9,0.0,Clear
12/28/2022,10:00,40.681637,-73.99392,BROOKLYN,0.0,0.0,0,0,0,0,0,0,4594330,2022-12-28 10:00:00,2022-12-28T10:00,2022,12,2.3,0.0,Cloudy
02/13/2022,8:00,40.680016,-73.87743,BROOKLYN,0.0,0.0,0,0,0,0,0,0,4502383,2022-02-13 08:00:00,2022-02-13T08:00,2022,2,-0.2,0.6,Heavy Snow
06/09/2022,0:00,40.691307,-73.91326,BROOKLYN,1.0,0.0,0,0,0,0,1,0,4535867,2022-06-09 00:00:00,2022-06-09T00:00,2022,6,19.4,0.1,Drizzle
08/27/2022,13:00,40.57741,-73.96237,BROOKLYN,1.0,0.0,1,0,0,0,0,0,4558851,2022-08-27 13:00:00,2022-08-27T13:00,2022,8,28.9,0.0,Clear
07/19/2022,0:00,40.67873,-73.932976,BROOKLYN,1.0,0.0,0,0,0,0,1,0,4550980,2022-07-19 00:00:00,2022-07-19T00:00,2022,7,24.1,0.0,Clear
12/14/2022,12:00,40.7183,-73.95007,BROOKLYN,1.0,0.0,0,0,0,0,1,0,4589939,2022-12-14 12:00:00,2022-12-14T12:00,2022,12,2.3,0.0,Cloudy
05/18/2022,4:00,40.642467,-73.916954,BROOKLYN,1.0,0.0,1,0,0,0,0,0,4528748,2022-05-18 04:00:00,2022-05-18T04:00,2022,5,11.7,0.0,Clear
01/25/2022,16:00,40.63396,-74.01476,BROOKLYN,0.0,0.0,0,0,0,0,0,0,4497327,2022-01-25 16:00:00,2022-01-25T16:00,2022,1,4.8,0.0,Clear
01/21/2022,0:00,40.672405,-73.871185,BROOKLYN,1.0,0.0,1,0,0,0,0,0,4497427,2022-01-21 00:00:00,2022-01-21T00:00,2022,1,-6.9,0.0,Cloudy
11/03/2022,0:00,40.644615,-73.992905,BROOKLYN,1.0,0.0,1,0,0,0,0,0,4578588,2022-11-03 00:00:00,2022-11-03T00:00,2022,11,10.0,0.0,Clear
06/20/2022,0:00,40.623524,-74.014854,BROOKLYN,1.0,0.0,0,0,0,0,1,0,4539434,2022-06-20 00:00:00,2022-06-20T00:00,2022,6,16.1,0.0,Clear
07/13/2022,0:00,40.64802,-73.979546,BROOKLYN,1.0,0.0,0,0,1,0,0,0,4546368,2022-07-13 00:00:00,2022-07-13T00:00,2022,7,26.1,0.0,Cloudy
12/10/2022,9:00,40.588135,-73.95246,BROOKLYN,0.0,0.0,0,0,0,0,0,0,4592465,2022-12-10 09:00:00,2022-12-10T09:00,2022,12,1.1,0.0,Clear
12/02/2022,19:00,40.637108,-73.89338,BROOKLYN,1.0,0.0,1,0,0,0,0,0,4586595,2022-12-02 19:00:00,2022-12-02T19:00,2022,12,4.6,0.0,Cloudy
03/14/2022,15:00,40.661015,-73.90853,BROOKLYN,0.0,0.0,0,0,0,0,0,0,4510994,2022-03-14 15:00:00,2022-03-14T15:00,2022,3,10.1,0.0,Cloudy
02/08/2022,3:00,40.680504,-73.8829,BROOKLYN,2.0,0.0,0,0,0,0,2,0,4501330,2022-02-08 03:00:00,2022-02-08T03:00,2022,2,1.6,0.5,Drizzle
01/02/2022,21:00,40.665474,-73.9,BROOKLYN,0.0,0.0,0,0,0,0,0,0,4492457,2022-01-02 21:00:00,2022-01-02T21:00,2022,1,4.3,0.0,Cloudy
04/21/2022,16:00,40.657204,-73.90352,BROOKLYN,1.0,0.0,0,0,0,0,1,0,4521378,2022-04-21 16:00:00,2022-04-21T16:00,2022,4,10.5,0.0,Cloudy
05/13/2022,23:00,40.684666,-73.96404,BROOKLYN,0.0,0.0,0,0,0,0,0,0,4527508,2022-05-13 23:00:00,2022-05-13T23:00,2022,5,14.1,0.0,Cloudy
10/19/2022,12:00,40.65415,-73.93935,BROOKLYN,0.0,0.0,0,0,0,0,0,0,4579963,2022-10-19 12:00:00,2022-10-19T12:00,2022,10,11.6,0.0,Cloudy
07/28/2022,18:00,40.57997,-73.97466,BROOKLYN,1.0,0.0,0,0,0,0,1,0,4556430,2022-07-28 18:00:00,2022-07-28T18:00,2022,7,31.0,0.0,Clear
03/31/2022,7:00,40.641533,-74.01045,BROOKLYN,1.0,0.0,0,0,1,0,0,0,4515470,2022-03-31 07:00:00,2022-03-31T07:00,2022,3,12.5,0.0,Cloudy
02/23/2022,12:00,40.66551,-73.992775,BROOKLYN,1.0,0.0,0,0,0,0,1,0,4505010,2022-02-23 12:00:00,2022-02-23T12:00,2022,2,17.7,0.0,Cloudy
06/06/2022,0:00,40.684937,-73.91014,BROOKLYN,1.0,0.0,0,0,0,0,1,0,4534871,2022-06-06 00:00:00,2022-06-06T00:00,2022,6,15.6,0.0,Clear
11/20/2022,10:00,40.59755,-73.930405,BROOKLYN,0.0,0.0,0,0,0,0,0,0,4583264,2022-11-20 10:00:00,2022-11-20T10:00,2022,11,1.7,0.0,Clear
06/15/2022,6:00,40.651173,-73.889946,BROOKLYN,2.0,0.0,0,0,0,0,2,0,4537631,2022-06-15 06:00:00,2022-06-15T06:00,2022,6,20.2,0.0,Cloudy
04/05/2022,14:00,40.711834,-73.949814,BROOKLYN,1.0,0.0,0,0,1,0,0,0,4516650,2022-04-05 14:00:00,2022-04-05T14:00,2022,4,10.5,0.0,Cloudy
01/01/2022,2:00,40.719215,-73.94365,BROOKLYN,0.0,0.0,0,0,0,0,0,0,4491383,2022-01-01 02:00:00,2022-01-01T02:00,2022,1,7.8,0.0,Cloudy
02/05/2022,19:00,40.68342,-73.97545,BROOKLYN,1.0,0.0,0,0,0,0,1,0,4500479,2022-02-05 19:00:00,2022-02-05T19:00,2022,2,-5.4,0.0,Clear
09/19/2022,15:00,40.64986,-73.96194,BROOKLYN,1.0,0.0,0,0,1,0,0,0,4567815,2022-09-19 15:00:00,2022-09-19T15:00,2022,9,28.9,0.0,Cloudy
09/12/2022,13:00,40.665203,-73.90184,BROOKLYN,1.0,0.0,0,0,0,0,1,0,4564956,2022-09-12 13:00:00,2022-09-12T13:00,2022,9,26.4,0.0,Cloudy
12/30/2022,0:00,40.65249,-73.92179,BROOKLYN,1.0,0.0,0,0,0,0,1,0,4594615,2022-12-30 00:00:00,2022-12-30T00:00,2022,12,2.7,0.0,Clear
11/20/2022,17:00,40.699482,-73.96104,BROOKLYN,1.0,0.0,0,0,0,0,1,0,4584574,2022-11-20 17:00:00,2022-11-20T17:00,2022,11,0.7,0.0,Clear
02/15/2022,19:00,40.59683,-73.999115,BROOKLYN,1.0,0.0,0,0,0,0,1,0,4503140,2022-02-15 19:00:00,2022-02-15T19:00,2022,2,-3.4,0.0,Clear
05/19/2022,14:00,40.676094,-73.94992,BROOKLYN,1.0,0.0,0,0,0,0,1,0,4532191,2022-05-19 14:00:00,2022-05-19T14:00,2022,5,17.2,0.0,Cloudy
06/06/2022,18:00,40.66468,-73.95101,BROOKLYN,1.0,0.0,0,0,0,0,0,0,4534818,2022-06-06 18:00:00,2022-06-06T18:00,2022,6,21.3,0.0,Cloudy
10/15/2022,23:00,40.644672,-73.92573,BROOKLYN,1.0,0.0,0,0,1,0,0,0,4574983,2022-10-15 23:00:00,2022-10-15T23:00,2022,10,13.3,0.0,Clear
09/12/2022,11:00,40.662014,-73.886826,BROOKLYN,1.0,0.0,1,0,0,0,0,0,4563362,2022-09-12 11:00:00,2022-09-12T11:00,2022,9,24.6,0.0,Cloudy
12/15/2022,21:00,40.682114,-73.95367,BROOKLYN,1.0,0.0,1,0,0,0,0,0,4591403,2022-12-15 21:00:00,2022-12-15T21:00,2022,12,5.6,2.7,Heavy Rain
12/21/2022,18:00,40.595985,-73.96264,BROOKLYN,1.0,0.0,1,0,0,0,0,0,4591920,2022-12-21 18:00:00,2022-12-21T18:00,2022,12,2.7,0.0,Cloudy
11/21/2022,6:00,40.714382,-73.93345,BROOKLYN,1.0,0.0,0,0,0,0,1,0,4583716,2022-11-21 06:00:00,2022-11-21T06:00,2022,11,-3.2,0.0,Clear
07/02/2022,17:00,40.675575,-73.94998,BROOKLYN,1.0,0.0,0,0,1,0,0,0,4546734,2022-07-02 17:00:00,2022-07-02T17:00,2022,7,23.9,0.2,Drizzle
10/14/2022,20:00,40.67816,-73.897484,BROOKLYN,1.0,0.0,0,0,0,0,1,0,4573350,2022-10-14 20:00:00,2022-10-14T20:00,2022,10,13.2,0.0,Clear
11/19/2022,19:00,40.67989,-73.94034,BROOKLYN,1.0,0.0,0,0,0,0,1,0,4583160,2022-11-19 19:00:00,2022-11-19T19:00,2022,11,2.8,0.0,Clear
03/13/2022,0:00,40.644913,-73.97443,BROOKLYN,2.0,0.0,0,0,0,0,2,0,4510244,2022-03-13 00:00:00,2022-03-13T00:00,2022,3,-4.6,0.0,Clear
05/26/2022,14:00,40.705227,-73.949844,BROOKLYN,1.0,0.0,0,0,0,0,1,0,4533035,2022-05-26 14:00:00,2022-05-26T14:00,2022,5,19.9,0.0,Clear
11/24/2022,23:00,40.68839,-73.97844,BROOKLYN,0.0,0.0,0,0,0,0,0,0,4584727,2022-11-24 23:00:00,2022-11-24T23:00,2022,11,6.4,0.0,Cloudy
08/14/2022,7:00,40.60059,-73.96137,BROOKLYN,1.0,0.0,0,0,0,0,1,0,4555297,2022-08-14 07:00:00,2022-08-14T07:00,2022,8,21.3,0.0,Cloudy
12/09/2022,0:00,40.67365,-73.87496,BROOKLYN,1.0,0.0,1,0,0,0,0,0,4588922,2022-12-09 00:00:00,2022-12-09T00:00,2022,12,4.8,0.0,Clear
06/19/2022,14:00,40.68775,-74.001396,BROOKLYN,1.0,0.0,0,0,0,0,1,0,4538849,2022-06-19 14:00:00,2022-06-19T14:00,2022,6,22.4,0.0,Cloudy
06/12/2022,12:00,40.669724,-73.86097,BROOKLYN,1.0,0.0,0,0,0,0,0,0,4536473,2022-06-12 12:00:00,2022-06-12T12:00,2022,6,20.0,0.7,Drizzle
08/26/2022,6:00,40.67954,-73.89959,BROOKLYN,1.0,0.0,0,0,0,0,1,0,4558566,2022-08-26 06:00:00,2022-08-26T06:00,2022,8,22.6,0.0,Clear
03/09/2022,14:00,40.60389,-73.95349,BROOKLYN,3.0,0.0,0,0,0,0,3,0,4509001,2022-03-09 14:00:00,2022-03-09T14:00,2022,3,1.9,1.6,Heavy Snow
02/14/2022,10:00,40.601562,-73.94312,BROOKLYN,0.0,0.0,0,0,0,0,0,0,4502794,2022-02-14 10:00:00,2022-02-14T10:00,2022,2,-7.4,0.0,Clear
05/08/2022,0:00,40.66475,-73.89405,BROOKLYN,1.0,0.0,1,0,0,0,0,0,4526014,2022-05-08 00:00:00,2022-05-08T00:00,2022,5,7.0,0.2,Drizzle
11/17/2022,18:00,40.658577,-73.89063,BROOKLYN,1.0,0.0,0,0,0,0,1,0,4583398,2022-11-17 18:00:00,2022-11-17T18:00,2022,11,5.0,0.0,Clear
04/23/2022,23:00,0.0,0.0,BROOKLYN,1.0,0.0,0,0,1,0,0,0,4530765,2022-04-23 23:00:00,2022-04-23T23:00,2022,4,28.5,0.0,Cloudy
01/23/2022,5:00,40.67264,-73.907646,BROOKLYN,0.0,0.0,0,0,0,0,0,0,4496634,2022-01-23 05:00:00,2022-01-23T05:00,2022,1,-5.0,0.0,Clear
10/21/2022,10:00,40.6532,-74.005585,BROOKLYN,1.0,0.0,0,0,0,0,1,0,4575172,2022-10-21 10:00:00,2022-10-21T10:00,2022,10,12.9,0.0,Clear
01/06/2022,17:00,40.665703,-73.94256,BROOKLYN,1.0,0.0,1,0,0,0,0,0,4492578,2022-01-06 17:00:00,2022-01-06T17:00,2022,1,1.7,0.0,Cloudy
06/08/2022,15:00,40.647526,-73.978195,BROOKLYN,1.0,0.0,0,0,0,0,1,0,4537745,2022-06-08 15:00:00,2022-06-08T15:00,2022,6,26.2,0.0,Cloudy
08/10/2022,15:00,40.69816,-73.92528,BROOKLYN,0.0,0.0,0,0,0,0,0,0,4554869,2022-08-10 15:00:00,2022-08-10T15:00,2022,8,31.5,0.0,Clear
01/27/2022,14:00,40.67053,-73.90511,BROOKLYN,2.0,0.0,0,0,0,0,2,0,4499443,2022-01-27 14:00:00,2022-01-27T14:00,2022,1,-0.6,0.0,Cloudy
11/06/2022,16:00,40.665348,-73.91157,BROOKLYN,0.0,0.0,0,0,0,0,0,0,4597009,2022-11-06 16:00:00,2022-11-06T16:00,2022,11,20.1,0.0,Cloudy
03/02/2022,14:00,40.700726,-73.94194,BROOKLYN,1.0,0.0,0,0,0,0,1,0,4506899,2022-03-02 14:00:00,2022-03-02T14:00,2022,3,10.2,0.0,Clear
01/12/2022,12:00,40.647213,-73.98099,BROOKLYN,0.0,0.0,0,0,0,0,0,0,4494176,2022-01-12 12:00:00,2022-01-12T12:00,2022,1,2.6,0.0,Cloudy
02/24/2022,19:00,40.70525,-73.96662,BROOKLYN,1.0,0.0,0,0,0,0,1,0,4505410,2022-02-24 19:00:00,2022-02-24T19:00,2022,2,0.2,0.0,Cloudy
10/31/2022,17:00,40.581944,-73.95892,BROOKLYN,1.0,0.0,1,0,0,0,0,0,4577835,2022-10-31 17:00:00,2022-10-31T17:00,2022,10,15.0,0.3,Drizzle
06/02/2022,16:00,40.62633,-73.973045,BROOKLYN,1.0,0.0,0,0,0,0,1,0,4533675,2022-06-02 16:00:00,2022-06-02T16:00,2022,6,19.9,1.2,Drizzle
05/10/2022,8:00,40.618595,-73.99847,BROOKLYN,2.0,0.0,2,0,0,0,0,0,4527283,2022-05-10 08:00:00,2022-05-10T08:00,2022,5,13.0,0.0,Clear
11/15/2022,15:00,40.683266,-73.96587,BROOKLYN,1.0,0.0,0,0,0,0,0,0,4582487,2022-11-15 15:00:00,2022-11-15T15:00,2022,11,7.9,0.0,Cloudy
06/30/2022,15:00,40.676376,-73.92622,BROOKLYN,0.0,0.0,0,0,0,0,0,0,4542956,2022-06-30 15:00:00,2022-06-30T15:00,2022,6,30.0,0.0,Clear
05/25/2022,15:00,40.689137,-73.990715,BROOKLYN,1.0,0.0,0,0,0,0,1,0,4531125,2022-05-25 15:00:00,2022-05-25T15:00,2022,5,16.8,0.0,Clear
02/09/2022,10:00,40.65591,-73.89191,BROOKLYN,1.0,0.0,0,0,0,0,1,0,4501333,2022-02-09 10:00:00,2022-02-09T10:00,2022,2,1.3,0.0,Clear
09/15/2022,7:00,40.60673,-73.99603,BROOKLYN,1.0,0.0,0,0,0,0,1,0,4564700,2022-09-15 07:00:00,2022-09-15T07:00,2022,9,18.2,0.0,Clear
08/10/2022,0:00,40.60337,-73.95822,BROOKLYN,2.0,0.0,0,0,0,0,2,0,4554125,2022-08-10 00:00:00,2022-08-10T00:00,2022,8,27.2,0.0,Clear
01/08/2022,19:00,40.668694,-73.90856,BROOKLYN,0.0,0.0,0,0,0,0,0,0,4493076,2022-01-08 19:00:00,2022-01-08T19:00,2022,1,-6.7,0.0,Clear
04/03/2022,18:00,40.670727,-73.88609,BROOKLYN,2.0,0.0,0,0,0,0,2,0,4516093,2022-04-03 18:00:00,2022-04-03T18:00,2022,4,8.0,0.1,Drizzle
11/02/2022,9:00,40.66702,-73.87521,BROOKLYN,2.0,0.0,0,0,0,0,2,0,4578754,2022-11-02 09:00:00,2022-11-02T09:00,2022,11,15.0,0.0,Clear
12/02/2022,17:00,40.649277,-73.94361,BROOKLYN,1.0,0.0,1,0,0,0,0,0,4586578,2022-12-02 17:00:00,2022-12-02T17:00,2022,12,3.4,0.0,Clear
10/25/2022,23:00,40.64122,-73.9833,BROOKLYN,1.0,0.0,0,0,0,0,1,0,4576563,2022-10-25 23:00:00,2022-10-25T23:00,2022,10,17.3,0.0,Cloudy
01/20/2022,0:00,40.609417,-73.9677,BROOKLYN,2.0,0.0,0,0,0,0,2,0,4496141,2022-01-20 00:00:00,2022-01-20T00:00,2022,1,5.9,0.0,Cloudy
12/08/2022,16:00,40.66168,-73.94907,BROOKLYN,0.0,0.0,0,0,0,0,0,0,4588656,2022-12-08 16:00:00,2022-12-08T16:00,2022,12,9.6,0.0,Cloudy
08/08/2022,15:00,40.665066,-73.898,BROOKLYN,1.0,0.0,1,0,0,0,0,0,4554630,2022-08-08 15:00:00,2022-08-08T15:00,2022,8,31.6,0.0,Cloudy
05/25/2022,13:00,40.648182,-73.93001,BROOKLYN,1.0,0.0,0,0,1,0,0,0,4533576,2022-05-25 13:00:00,2022-05-25T13:00,2022,5,18.0,0.0,Cloudy
08/08/2022,11:00,40.650032,-74.0079,BROOKLYN,0.0,0.0,0,0,0,0,0,0,4555237,2022-08-08 11:00:00,2022-08-08T11:00,2022,8,30.3,0.9,Drizzle
10/25/2022,12:00,40.69554,-73.91261,BROOKLYN,1.0,0.0,0,0,0,0,1,0,4576066,2022-10-25 12:00:00,2022-10-25T12:00,2022,10,19.9,0.2,Drizzle
10/08/2022,12:00,40.675053,-73.947235,BROOKLYN,1.0,0.0,0,0,1,0,0,0,4574288,2022-10-08 12:00:00,2022-10-08T12:00,2022,10,13.1,0.0,Cloudy
10/15/2022,15:00,40.675735,-73.89686,BROOKLYN,1.0,0.0,0,0,0,0,1,0,4573355,2022-10-15 15:00:00,2022-10-15T15:00,2022,10,17.7,0.0,Clear
12/06/2022,18:00,40.701397,-73.95808,BROOKLYN,1.0,0.0,1,0,0,0,0,0,4589898,2022-12-06 18:00:00,2022-12-06T18:00,2022,12,12.1,1.1,Drizzle
05/28/2022,21:00,40.681828,-73.87858,BROOKLYN,1.0,0.0,0,0,0,0,1,0,4539178,2022-05-28 21:00:00,2022-05-28T21:00,2022,5,19.3,0.0,Clear
07/13/2022,19:00,40.700356,-73.912575,BROOKLYN,1.0,0.0,0,0,1,0,0,0,4546558,2022-07-13 19:00:00,2022-07-13T19:00,2022,7,26.2,0.0,Clear
07/05/2022,5:00,40.70143,-73.98442,BROOKLYN,1.0,0.0,1,0,0,0,0,0,4544814,2022-07-05 05:00:00,2022-07-05T05:00,2022,7,20.7,0.0,Cloudy
12/18/2022,0:00,40.598835,-73.95641,BROOKLYN,1.0,0.0,0,0,0,0,1,0,4590974,2022-12-18 00:00:00,2022-12-18T00:00,2022,12,2.3,0.0,Clear
12/19/2022,23:00,40.631207,-73.911545,BROOKLYN,4.0,0.0,0,0,0,0,4,0,4591587,2022-12-19 23:00:00,2022-12-19T23:00,2022,12,-0.2,0.0,Clear
10/24/2022,22:00,40.697853,-73.93325,BROOKLYN,1.0,0.0,0,0,0,0,0,0,4576087,2022-10-24 22:00:00,2022-10-24T22:00,2022,10,15.3,0.7,Drizzle
01/11/2022,0:00,40.64962,-73.874306,BROOKLYN,1.0,0.0,1,0,0,0,0,0,4493878,2022-01-11 00:00:00,2022-01-11T00:00,2022,1,-4.1,0.0,Clear
04/04/2022,8:00,40.625034,-74.0061,BROOKLYN,1.0,0.0,1,0,0,0,0,0,4516221,2022-04-04 08:00:00,2022-04-04T08:00,2022,4,6.2,0.0,Clear
11/15/2022,14:00,40.716805,-73.94306,BROOKLYN,1.0,0.0,0,0,0,0,1,0,4582109,2022-11-15 14:00:00,2022-11-15T14:00,2022,11,8.1,0.0,Cloudy
06/03/2022,14:00,40.602108,-73.96629,BROOKLYN,2.0,0.0,0,0,0,0,2,0,4542739,2022-06-03 14:00:00,2022-06-03T14:00,2022,6,21.1,0.0,Cloudy
05/27/2022,17:00,40.666122,-73.93139,BROOKLYN,1.0,0.0,1,0,0,0,0,0,4531740,2022-05-27 17:00:00,2022-05-27T17:00,2022,5,18.5,0.2,Drizzle
08/09/2022,23:00,40.659595,-73.88326,BROOKLYN,1.0,0.0,1,0,0,0,0,0,4554182,2022-08-09 23:00:00,2022-08-09T23:00,2022,8,28.1,0.0,Clear
11/04/2022,10:00,40.632584,-74.00631,BROOKLYN,1.0,0.0,0,0,0,0,0,0,4584886,2022-11-04 10:00:00,2022-11-04T10:00,2022,11,14.4,0.0,Cloudy
01/13/2022,0:00,40.577003,-74.00217,BROOKLYN,2.0,0.0,2,0,0,0,0,0,4496535,2022-01-13 00:00:00,2022-01-13T00:00,2022,1,-1.8,0.0,Cloudy
06/26/2022,7:00,40.667835,-73.89484,BROOKLYN,1.0,0.0,0,0,1,0,0,0,4541064,2022-06-26 07:00:00,2022-06-26T07:00,2022,6,23.9,0.0,Clear
10/23/2022,12:00,40.71807,-73.96414,BROOKLYN,1.0,0.0,0,0,0,0,1,0,4576271,2022-10-23 12:00:00,2022-10-23T12:00,2022,10,14.7,1.1,Drizzle
12/22/2022,20:00,40.657642,-73.8749,BROOKLYN,1.0,0.0,1,0,0,0,0,0,4593532,2022-12-22 20:00:00,2022-12-22T20:00,2022,12,6.4,0.6,Drizzle
06/13/2022,7:00,40.61146,-73.92437,BROOKLYN,1.0,0.0,0,0,1,0,0,0,4539721,2022-06-13 07:00:00,2022-06-13T07:00,2022,6,22.1,0.0,Clear
05/18/2022,18:00,40.660225,-73.99459,BROOKLYN,0.0,0.0,0,0,0,0,0,0,4529493,2022-05-18 18:00:00,2022-05-18T18:00,2022,5,16.3,0.0,Cloudy
12/17/2022,0:00,40.63463,-73.91229,BROOKLYN,1.0,0.0,0,0,0,0,1,0,4590650,2022-12-17 00:00:00,2022-12-17T00:00,2022,12,4.3,0.1,Drizzle
08/26/2022,15:00,40.626823,-73.996796,BROOKLYN,4.0,0.0,0,0,0,0,4,0,4559684,2022-08-26 15:00:00,2022-08-26T15:00,2022,8,25.2,0.2,Drizzle
02/25/2022,20:00,40.64939,-74.00083,BROOKLYN,1.0,0.0,0,0,0,0,1,0,4506793,2022-02-25 20:00:00,2022-02-25T20:00,2022,2,1.2,0.0,Cloudy
06/10/2022,20:00,40.701942,-73.961754,BROOKLYN,0.0,0.0,0,0,0,0,0,0,4537086,2022-06-10 20:00:00,2022-06-10T20:00,2022,6,19.4,0.0,Cloudy
10/18/2022,14:00,40.682285,-73.9982,BROOKLYN,2.0,0.0,0,0,1,0,1,0,4574030,2022-10-18 14:00:00,2022-10-18T14:00,2022,10,13.4,0.0,Clear
08/22/2022,13:00,40.672447,-73.892136,BROOKLYN,1.0,0.0,0,0,0,0,0,0,4558070,2022-08-22 13:00:00,2022-08-22T13:00,2022,8,23.0,0.1,Drizzle
09/09/2022,16:00,40.648705,-74.01177,BROOKLYN,0.0,0.0,0,0,0,0,0,0,4562631,2022-09-09 16:00:00,2022-09-09T16:00,2022,9,26.0,0.0,Clear
02/11/2022,20:00,40.67396,-73.86373,BROOKLYN,0.0,0.0,0,0,0,0,0,0,4502358,2022-02-11 20:00:00,2022-02-11T20:00,2022,2,8.1,0.0,Cloudy
11/11/2022,0:00,40.631805,-73.988304,BROOKLYN,1.0,0.0,0,0,1,0,0,0,4583316,2022-11-11 00:00:00,2022-11-11T00:00,2022,11,12.9,0.0,Cloudy
01/13/2022,14:00,40.64994,-74.00172,BROOKLYN,2.0,0.0,0,0,0,0,2,0,4494332,2022-01-13 14:00:00,2022-01-13T14:00,2022,1,6.3,0.0,Cloudy
07/29/2022,21:00,40.64272,-73.95703,BROOKLYN,3.0,0.0,0,0,0,0,3,0,4551096,2022-07-29 21:00:00,2022-07-29T21:00,2022,7,24.6,0.1,Drizzle
04/18/2022,19:00,40.65249,-73.92179,BROOKLYN,1.0,0.0,0,0,1,0,0,0,4520441,2022-04-18 19:00:00,2022-04-18T19:00,2022,4,7.0,0.4,Drizzle
12/16/2022,12:00,40.679638,-73.91655,BROOKLYN,1.0,0.0,0,0,1,0,0,0,4592894,2022-12-16 12:00:00,2022-12-16T12:00,2022,12,6.7,0.2,Drizzle
04/28/2022,10:00,40.67598,-73.99955,BROOKLYN,0.0,0.0,0,0,0,0,0,0,4522871,2022-04-28 10:00:00,2022-04-28T10:00,2022,4,9.4,0.0,Clear
06/18/2022,14:00,40.686428,-73.935745,BROOKLYN,1.0,0.0,0,0,0,0,1,0,4538748,2022-06-18 14:00:00,2022-06-18T14:00,2022,6,21.6,0.0,Cloudy
03/29/2022,6:00,40.612946,-73.943756,BROOKLYN,1.0,0.0,1,0,0,0,0,0,4514870,2022-03-29 06:00:00,2022-03-29T06:00,2022,3,-3.6,0.0,Clear
10/09/2022,1:00,40.66242,-73.919624,BROOKLYN,0.0,0.0,0,0,0,0,0,0,4571922,2022-10-09 01:00:00,2022-10-09T01:00,2022,10,7.8,0.0,Clear
06/06/2022,9:00,40.62751,-73.99635,BROOKLYN,1.0,0.0,0,0,0,0,1,0,4535002,2022-06-06 09:00:00,2022-06-06T09:00,2022,6,21.2,0.0,Clear
01/07/2022,9:00,40.657,-73.91403,BROOKLYN,1.0,0.0,1,0,0,0,0,0,4493913,2022-01-07 09:00:00,2022-01-07T09:00,2022,1,-2.0,0.3,Heavy Snow
12/17/2022,19:00,40.617287,-73.97786,BROOKLYN,0.0,0.0,0,0,0,0,0,0,4596375,2022-12-17 19:00:00,2022-12-17T19:00,2022,12,4.1,0.0,Clear
03/11/2022,8:00,40.637505,-73.914185,BROOKLYN,1.0,0.0,1,0,0,0,0,0,4509261,2022-03-11 08:00:00,2022-03-11T08:00,2022,3,4.4,0.0,Clear
03/03/2022,22:00,40.644672,-73.92573,BROOKLYN,2.0,0.0,0,0,0,0,2,0,4507747,2022-03-03 22:00:00,2022-03-03T22:00,2022,3,-2.4,0.0,Clear
03/25/2022,21:00,40.678463,-73.9217,BROOKLYN,0.0,0.0,0,0,0,0,0,0,4513614,2022-03-25 21:00:00,2022-03-25T21:00,2022,3,9.7,0.0,Cloudy
08/14/2022,14:00,40.6489,-73.96968,BROOKLYN,1.0,0.0,0,0,1,0,0,0,4556427,2022-08-14 14:00:00,2022-08-14T14:00,2022,8,26.4,0.0,Clear
06/09/2022,4:00,40.645733,-74.020424,BROOKLYN,1.0,0.0,1,0,0,0,0,0,4535727,2022-06-09 04:00:00,2022-06-09T04:00,2022,6,19.8,4.3,Heavy Rain
03/19/2022,12:00,40.61354,-73.98898,BROOKLYN,0.0,0.0,0,0,0,0,0,0,4512611,2022-03-19 12:00:00,2022-03-19T12:00,2022,3,13.2,0.0,Cloudy
02/19/2022,12:00,40.67398,-73.911156,BROOKLYN,3.0,0.0,0,0,0,0,3,0,4504442,2022-02-19 12:00:00,2022-02-19T12:00,2022,2,3.5,0.0,Cloudy
03/30/2022,18:00,40.702255,-73.92008,BROOKLYN,1.0,0.0,0,0,0,0,0,0,4514984,2022-03-30 18:00:00,2022-03-30T18:00,2022,3,4.4,0.0,Clear
09/01/2022,13:00,40.669712,-73.94774,BROOKLYN,1.0,0.0,0,0,0,0,1,0,4560317,2022-09-01 13:00:00,2022-09-01T13:00,2022,9,29.8,0.0,Clear
03/15/2022,16:00,40.67577,-73.98421,BROOKLYN,1.0,0.0,0,0,0,0,1,0,4512092,2022-03-15 16:00:00,2022-03-15T16:00,2022,3,11.1,0.0,Cloudy
12/16/2022,15:00,40.713646,-73.96314,BROOKLYN,0.0,0.0,0,0,0,0,0,0,4590807,2022-12-16 15:00:00,2022-12-16T15:00,2022,12,4.6,0.6,Drizzle
06/01/2022,13:00,40.619984,-73.96427,BROOKLYN,1.0,0.0,0,0,1,0,0,0,4533521,2022-06-01 13:00:00,2022-06-01T13:00,2022,6,18.6,0.0,Cloudy
03/10/2022,11:00,40.58008,-73.95981,BROOKLYN,1.0,0.0,0,0,0,0,1,0,4510155,2022-03-10 11:00:00,2022-03-10T11:00,2022,3,5.6,0.0,Cloudy
11/04/2022,14:00,40.657936,-73.92067,BROOKLYN,1.0,0.0,1,0,0,0,0,0,4579221,2022-11-04 14:00:00,2022-11-04T14:00,2022,11,19.0,0.0,Clear
01/31/2022,16:00,40.641953,-73.9885,BROOKLYN,1.0,0.0,1,0,0,0,0,0,4498971,2022-01-31 16:00:00,2022-01-31T16:00,2022,1,-5.7,0.0,Cloudy
09/10/2022,0:00,40.73115,-73.95179,BROOKLYN,1.0,0.0,0,0,0,0,0,0,4563257,2022-09-10 00:00:00,2022-09-10T00:00,2022,9,18.2,0.0,Clear
02/05/2022,17:00,40.708378,-73.94759,BROOKLYN,0.0,0.0,0,0,0,0,0,0,4500492,2022-02-05 17:00:00,2022-02-05T17:00,2022,2,-4.1,0.0,Clear
11/15/2022,10:00,40.670887,-73.93649,BROOKLYN,1.0,0.0,0,0,0,0,1,0,4583078,2022-11-15 10:00:00,2022-11-15T10:00,2022,11,5.5,0.0,Cloudy
02/10/2022,10:00,40.62734,-73.94126,BROOKLYN,0.0,0.0,0,0,0,0,0,0,4534649,2022-02-10 10:00:00,2022-02-10T10:00,2022,2,5.5,0.0,Clear
02/22/2022,0:00,40.697716,-73.967735,BROOKLYN,1.0,0.0,0,0,1,0,0,0,4504885,2022-02-22 00:00:00,2022-02-22T00:00,2022,2,2.0,0.0,Cloudy
02/09/2022,11:00,40.67448,-73.87996,BROOKLYN,0.0,0.0,0,0,0,0,0,0,4501744,2022-02-09 11:00:00,2022-02-09T11:00,2022,2,2.9,0.0,Clear
05/06/2022,17:00,40.70778,-73.93854,BROOKLYN,0.0,0.0,0,0,0,0,0,0,4526286,2022-05-06 17:00:00,2022-05-06T17:00,2022,5,12.4,1.8,Light Rain
01/22/2022,16:00,40.65289,-73.866745,BROOKLYN,3.0,0.0,0,0,0,0,3,0,4497486,2022-01-22 16:00:00,2022-01-22T16:00,2022,1,-1.5,0.0,Clear
06/16/2022,11:00,40.67898,-73.88107,BROOKLYN,2.0,0.0,0,0,0,0,2,0,4539160,2022-06-16 11:00:00,2022-06-16T11:00,2022,6,20.9,0.0,Cloudy
04/16/2022,22:00,40.805096,-73.95488,MANHATTAN,2.0,0.0,0,0,0,0,2,0,4520235,2022-04-16 22:00:00,2022-04-16T22:00,2022,4,7.7,1.6,Light Rain
05/15/2022,4:00,40.741272,-73.97535,MANHATTAN,4.0,0.0,0,0,0,0,4,0,4531070,2022-05-15 04:00:00,2022-05-15T04:00,2022,5,15.1,0.0,Cloudy
01/23/2022,5:00,40.722534,-73.99922,MANHATTAN,0.0,0.0,0,0,0,0,0,0,4496835,2022-01-23 05:00:00,2022-01-23T05:00,2022,1,-5.6,0.0,Clear
08/06/2022,23:00,40.720936,-73.993805,MANHATTAN,1.0,0.0,1,0,0,0,0,0,4554255,2022-08-06 23:00:00,2022-08-06T23:00,2022,8,24.5,3.2,Heavy Rain
07/15/2022,20:00,40.797447,-73.94671,MANHATTAN,1.0,0.0,0,0,0,0,1,0,4546644,2022-07-15 20:00:00,2022-07-15T20:00,2022,7,23.5,0.0,Clear
04/14/2022,5:00,40.718456,-73.99482,MANHATTAN,2.0,0.0,0,0,0,0,2,0,4518832,2022-04-14 05:00:00,2022-04-14T05:00,2022,4,17.3,0.0,Cloudy
03/04/2022,7:00,40.85558,-73.93428,MANHATTAN,0.0,0.0,0,0,0,0,0,0,4509029,2022-03-04 07:00:00,2022-03-04T07:00,2022,3,-6.1,0.0,Clear
04/08/2022,23:00,40.81339,-73.95627,MANHATTAN,1.0,0.0,0,0,0,0,0,0,4517792,2022-04-08 23:00:00,2022-04-08T23:00,2022,4,8.1,0.0,Cloudy
12/10/2022,6:00,40.720318,-74.01218,MANHATTAN,3.0,0.0,0,0,0,0,3,0,4589013,2022-12-10 06:00:00,2022-12-10T06:00,2022,12,-1.2,0.0,Clear
04/29/2022,19:00,40.704674,-74.00813,MANHATTAN,1.0,0.0,0,0,1,0,0,0,4523472,2022-04-29 19:00:00,2022-04-29T19:00,2022,4,10.5,0.0,Clear
03/22/2022,16:00,40.803387,-73.93604,MANHATTAN,0.0,0.0,0,0,0,0,0,0,4514452,2022-03-22 16:00:00,2022-03-22T16:00,2022,3,12.4,0.0,Cloudy
05/02/2022,13:00,40.853836,-73.934975,MANHATTAN,0.0,0.0,0,0,0,0,0,0,4524384,2022-05-02 13:00:00,2022-05-02T13:00,2022,5,13.2,0.2,Drizzle
05/13/2022,19:00,40.727104,-74.00491,MANHATTAN,1.0,0.0,0,0,1,0,0,0,4528170,2022-05-13 19:00:00,2022-05-13T19:00,2022,5,16.1,0.0,Cloudy
02/16/2022,16:00,40.814297,-73.95308,MANHATTAN,0.0,0.0,0,0,0,0,0,0,4506063,2022-02-16 16:00:00,2022-02-16T16:00,2022,2,5.2,0.0,Cloudy
07/03/2022,19:00,40.75843,-73.973076,MANHATTAN,2.0,0.0,0,0,0,0,2,0,4543751,2022-07-03 19:00:00,2022-07-03T19:00,2022,7,25.9,0.0,Clear
09/25/2022,0:00,40.761234,-73.96389,MANHATTAN,1.0,0.0,0,0,0,0,1,0,4567252,2022-09-25 00:00:00,2022-09-25T00:00,2022,9,12.6,0.0,Clear
09/04/2022,20:00,40.806377,-73.95766,MANHATTAN,1.0,0.0,1,0,0,0,0,0,4564512,2022-09-04 20:00:00,2022-09-04T20:00,2022,9,24.0,0.3,Drizzle
02/27/2022,5:00,40.720673,-73.97824,MANHATTAN,1.0,0.0,1,0,0,0,0,0,4506444,2022-02-27 05:00:00,2022-02-27T05:00,2022,2,-3.5,0.0,Clear
10/11/2022,15:00,40.77039,-73.954124,MANHATTAN,1.0,0.0,0,0,0,0,1,0,4572119,2022-10-11 15:00:00,2022-10-11T15:00,2022,10,19.5,0.0,Clear
09/06/2022,0:00,40.71164,-73.97982,MANHATTAN,1.0,0.0,0,0,0,0,1,0,4562392,2022-09-06 00:00:00,2022-09-06T00:00,2022,9,21.1,2.7,Heavy Rain
11/17/2022,8:00,40.759617,-73.961975,MANHATTAN,1.0,0.0,1,0,0,0,0,0,4582443,2022-11-17 08:00:00,2022-11-17T08:00,2022,11,3.1,0.0,Cloudy
04/12/2022,8:00,40.806915,-73.93557,MANHATTAN,2.0,0.0,0,0,0,0,2,0,4518365,2022-04-12 08:00:00,2022-04-12T08:00,2022,4,10.2,0.2,Drizzle
06/07/2022,14:00,40.82,-73.95887,MANHATTAN,0.0,0.0,0,0,0,0,0,0,4535708,2022-06-07 14:00:00,2022-06-07T14:00,2022,6,23.1,0.0,Cloudy
02/22/2022,6:00,40.758976,-73.99394,MANHATTAN,1.0,0.0,0,0,0,0,1,0,4505921,2022-02-22 06:00:00,2022-02-22T06:00,2022,2,1.8,0.0,Cloudy
11/12/2022,17:00,40.790253,-73.94564,MANHATTAN,1.0,0.0,1,0,0,0,0,0,4581581,2022-11-12 17:00:00,2022-11-12T17:00,2022,11,17.5,0.0,Clear
12/15/2022,23:00,40.80897,-73.94833,MANHATTAN,2.0,0.0,2,0,0,0,0,0,4590360,2022-12-15 23:00:00,2022-12-15T23:00,2022,12,4.7,3.1,Heavy Rain
06/14/2022,19:00,40.870846,-73.91459,MANHATTAN,1.0,0.0,1,0,0,0,0,0,4539952,2022-06-14 19:00:00,2022-06-14T19:00,2022,6,23.6,0.0,Clear
02/23/2022,13:00,40.82653,-73.94667,MANHATTAN,1.0,0.0,0,0,0,0,0,0,4505483,2022-02-23 13:00:00,2022-02-23T13:00,2022,2,18.9,0.0,Cloudy
07/17/2022,0:00,40.760857,-73.961075,MANHATTAN,1.0,0.0,0,0,0,0,0,0,4546865,2022-07-17 00:00:00,2022-07-17T00:00,2022,7,21.3,1.9,Light Rain
03/19/2022,23:00,40.760822,-73.99832,MANHATTAN,1.0,0.0,1,0,0,0,0,0,4515679,2022-03-19 23:00:00,2022-03-19T23:00,2022,3,12.8,0.0,Clear
08/16/2022,21:00,40.752686,-74.000534,MANHATTAN,1.0,0.0,0,0,0,0,1,0,4556169,2022-08-16 21:00:00,2022-08-16T21:00,2022,8,21.4,0.0,Cloudy
10/24/2022,17:00,40.752895,-73.98925,MANHATTAN,1.0,0.0,1,0,0,0,0,0,4579892,2022-10-24 17:00:00,2022-10-24T17:00,2022,10,15.6,0.1,Drizzle
09/25/2022,23:00,40.81666,-73.938995,MANHATTAN,0.0,0.0,0,0,0,0,0,0,4567304,2022-09-25 23:00:00,2022-09-25T23:00,2022,9,16.1,0.0,Clear
01/06/2022,13:00,40.738228,-73.98782,MANHATTAN,0.0,0.0,0,0,0,0,0,0,4492953,2022-01-06 13:00:00,2022-01-06T13:00,2022,1,4.1,0.0,Clear
04/24/2022,2:00,40.725735,-73.996506,MANHATTAN,0.0,0.0,0,0,0,0,0,0,4521928,2022-04-24 02:00:00,2022-04-24T02:00,2022,4,9.5,0.0,Clear
11/30/2022,22:00,40.740643,-73.97581,MANHATTAN,1.0,0.0,0,0,1,0,0,0,4589146,2022-11-30 22:00:00,2022-11-30T22:00,2022,11,6.4,0.0,Clear
08/20/2022,14:00,40.767174,-73.988014,MANHATTAN,0.0,0.0,0,0,0,0,0,0,4559483,2022-08-20 14:00:00,2022-08-20T14:00,2022,8,29.8,0.0,Clear
07/31/2022,1:00,40.81403,-73.94835,MANHATTAN,1.0,0.0,0,0,0,0,1,0,4552017,2022-07-31 01:00:00,2022-07-31T01:00,2022,7,21.3,0.0,Clear
07/01/2022,5:00,40.799953,-73.95274,MANHATTAN,0.0,0.0,0,0,0,0,0,0,4545596,2022-07-01 05:00:00,2022-07-01T05:00,2022,7,20.4,0.0,Clear
02/27/2022,16:00,40.738735,-74.00961,MANHATTAN,1.0,0.0,1,0,0,0,0,0,4506307,2022-02-27 16:00:00,2022-02-27T16:00,2022,2,8.4,0.0,Clear
09/21/2022,0:00,40.844677,-73.93886,MANHATTAN,1.0,0.0,0,0,0,0,0,0,4573812,2022-09-21 00:00:00,2022-09-21T00:00,2022,9,17.3,0.0,Cloudy
07/05/2022,10:00,40.807095,-73.945984,MANHATTAN,1.0,0.0,1,0,0,0,0,0,4547409,2022-07-05 10:00:00,2022-07-05T10:00,2022,7,29.8,0.0,Cloudy
05/21/2022,16:00,40.86249,-73.92226,MANHATTAN,1.0,0.0,0,0,1,0,0,0,4530807,2022-05-21 16:00:00,2022-05-21T16:00,2022,5,27.6,0.0,Clear
10/19/2022,9:00,40.815502,-73.93562,MANHATTAN,1.0,0.0,0,0,0,0,1,0,4574697,2022-10-19 09:00:00,2022-10-19T09:00,2022,10,8.6,0.0,Clear
03/10/2022,15:00,40.822834,-73.941925,MANHATTAN,1.0,0.0,0,0,1,0,0,0,4514087,2022-03-10 15:00:00,2022-03-10T15:00,2022,3,9.3,0.0,Cloudy
04/23/2022,0:00,40.76177,-73.979065,MANHATTAN,1.0,0.0,0,0,1,0,0,0,4521360,2022-04-23 00:00:00,2022-04-23T00:00,2022,4,7.1,0.0,Cloudy
08/19/2022,7:00,40.724136,-73.992615,MANHATTAN,1.0,0.0,0,0,1,0,0,0,4557388,2022-08-19 07:00:00,2022-08-19T07:00,2022,8,21.6,0.0,Clear
04/14/2022,13:00,40.731544,-73.9992,MANHATTAN,1.0,0.0,1,0,0,0,0,0,4522187,2022-04-14 13:00:00,2022-04-14T13:00,2022,4,28.8,0.0,Cloudy
06/21/2022,14:00,40.720535,-74.007744,MANHATTAN,0.0,0.0,0,0,0,0,0,0,4539505,2022-06-21 14:00:00,2022-06-21T14:00,2022,6,26.6,0.0,Cloudy
03/15/2022,20:00,40.752815,-73.98138,MANHATTAN,0.0,0.0,0,0,0,0,0,0,4510909,2022-03-15 20:00:00,2022-03-15T20:00,2022,3,12.3,0.0,Cloudy
03/10/2022,16:00,40.716404,-73.989334,MANHATTAN,1.0,0.0,0,0,0,0,1,0,4509161,2022-03-10 16:00:00,2022-03-10T16:00,2022,3,7.9,0.0,Cloudy
08/02/2022,17:00,40.789684,-73.94815,MANHATTAN,0.0,0.0,0,0,0,0,0,0,4555995,2022-08-02 17:00:00,2022-08-02T17:00,2022,8,32.9,0.0,Clear
04/25/2022,15:00,40.728462,-73.97568,MANHATTAN,1.0,0.0,0,0,0,0,1,0,4522879,2022-04-25 15:00:00,2022-04-25T15:00,2022,4,13.2,0.0,Cloudy
04/16/2022,0:00,40.826164,-73.93577,MANHATTAN,1.0,0.0,0,0,0,0,1,0,4523158,2022-04-16 00:00:00,2022-04-16T00:00,2022,4,12.5,0.0,Cloudy
04/21/2022,0:00,40.75425,-73.96899,MANHATTAN,1.0,0.0,0,0,1,0,0,0,4521002,2022-04-21 00:00:00,2022-04-21T00:00,2022,4,5.4,0.0,Clear
12/20/2022,19:00,40.74406,-74.00682,MANHATTAN,0.0,0.0,0,0,0,0,0,0,4592024,2022-12-20 19:00:00,2022-12-20T19:00,2022,12,-0.0,0.0,Clear
10/28/2022,7:00,40.75591,-73.99448,MANHATTAN,1.0,0.0,1,0,0,0,0,0,4578389,2022-10-28 07:00:00,2022-10-28T07:00,2022,10,7.0,0.0,Cloudy
02/08/2022,14:00,40.78263,-73.9512,MANHATTAN,1.0,0.0,0,0,1,0,0,0,4502438,2022-02-08 14:00:00,2022-02-08T14:00,2022,2,8.0,0.0,Clear
09/23/2022,14:00,40.75595,-73.99074,MANHATTAN,1.0,0.0,0,0,0,0,0,0,4567062,2022-09-23 14:00:00,2022-09-23T14:00,2022,9,16.6,0.0,Clear
11/02/2022,22:00,40.76244,-73.96867,MANHATTAN,1.0,0.0,0,0,1,0,0,0,4578462,2022-11-02 22:00:00,2022-11-02T22:00,2022,11,12.0,0.0,Clear
09/22/2022,12:00,40.77656,-73.95271,MANHATTAN,1.0,0.0,1,0,0,0,0,0,4566458,2022-09-22 12:00:00,2022-09-22T12:00,2022,9,20.8,0.2,Drizzle
09/06/2022,1:00,40.83468,-73.944435,MANHATTAN,1.0,0.0,1,0,0,0,0,0,4562047,2022-09-06 01:00:00,2022-09-06T01:00,2022,9,20.8,2.7,Heavy Rain
06/30/2022,13:00,40.72493,-73.99035,MANHATTAN,1.0,0.0,0,0,0,0,1,0,4542774,2022-06-30 13:00:00,2022-06-30T13:00,2022,6,31.2,0.0,Clear
04/11/2022,22:00,40.808903,-73.93835,MANHATTAN,4.0,0.0,0,0,0,0,4,0,4518364,2022-04-11 22:00:00,2022-04-11T22:00,2022,4,8.8,0.0,Cloudy
12/04/2022,20:00,40.74905,-73.99382,MANHATTAN,1.0,0.0,1,0,0,0,0,0,4587161,2022-12-04 20:00:00,2022-12-04T20:00,2022,12,0.7,0.0,Clear
05/04/2022,20:00,40.744064,-73.987755,MANHATTAN,1.0,0.0,1,0,0,0,0,0,4525116,2022-05-04 20:00:00,2022-05-04T20:00,2022,5,14.3,0.0,Clear
07/08/2022,14:00,40.742233,-73.9933,MANHATTAN,0.0,0.0,0,0,0,0,0,0,4545250,2022-07-08 14:00:00,2022-07-08T14:00,2022,7,27.0,0.3,Drizzle
11/05/2022,19:00,40.750786,-74.00564,MANHATTAN,1.0,0.0,1,0,0,0,0,0,4579590,2022-11-05 19:00:00,2022-11-05T19:00,2022,11,17.7,0.0,Cloudy
06/08/2022,10:00,40.756138,-73.98318,MANHATTAN,1.0,0.0,1,0,0,0,0,0,4536564,2022-06-08 10:00:00,2022-06-08T10:00,2022,6,24.6,0.0,Cloudy
05/07/2022,20:00,40.768684,-73.99161,MANHATTAN,1.0,0.0,1,0,0,0,0,0,4526326,2022-05-07 20:00:00,2022-05-07T20:00,2022,5,7.4,1.2,Drizzle
10/24/2022,15:00,40.754314,-73.98687,MANHATTAN,0.0,0.0,0,0,0,0,0,0,4580348,2022-10-24 15:00:00,2022-10-24T15:00,2022,10,15.9,0.0,Cloudy
08/01/2022,9:00,40.78148,-73.95625,MANHATTAN,1.0,0.0,0,0,0,0,0,0,4551636,2022-08-01 09:00:00,2022-08-01T09:00,2022,8,23.1,0.0,Cloudy
01/14/2022,20:00,40.83723,-73.93884,MANHATTAN,1.0,0.0,1,0,0,0,0,0,4495496,2022-01-14 20:00:00,2022-01-14T20:00,2022,1,-2.0,0.0,Clear
10/10/2022,12:00,40.739403,-73.99215,MANHATTAN,1.0,0.0,0,0,0,0,1,0,4572576,2022-10-10 12:00:00,2022-10-10T12:00,2022,10,18.7,0.0,Clear
05/14/2022,20:00,40.76135,-73.98196,MANHATTAN,1.0,0.0,0,0,1,0,0,0,4528185,2022-05-14 20:00:00,2022-05-14T20:00,2022,5,14.9,1.2,Drizzle
05/12/2022,21:00,40.795525,-73.97594,MANHATTAN,1.0,0.0,0,0,0,0,1,0,4527438,2022-05-12 21:00:00,2022-05-12T21:00,2022,5,13.7,0.0,Cloudy
12/15/2022,9:00,40.720833,-73.997665,MANHATTAN,1.0,0.0,1,0,0,0,0,0,4592231,2022-12-15 09:00:00,2022-12-15T09:00,2022,12,2.0,0.0,Cloudy
09/08/2022,13:00,40.714146,-73.98914,MANHATTAN,1.0,0.0,0,0,0,0,1,0,4562894,2022-09-08 13:00:00,2022-09-08T13:00,2022,9,23.0,0.0,Cloudy
03/07/2022,3:00,0.0,0.0,MANHATTAN,0.0,0.0,0,0,0,0,0,0,4508726,2022-03-07 03:00:00,2022-03-07T03:00,2022,3,27.5,0.0,Cloudy
08/06/2022,4:00,40.7591,-73.99214,MANHATTAN,0.0,0.0,0,0,0,0,0,0,4552887,2022-08-06 04:00:00,2022-08-06T04:00,2022,8,23.8,0.0,Clear
05/04/2022,8:00,40.790417,-73.95184,MANHATTAN,1.0,0.0,1,0,0,0,0,0,4524946,2022-05-04 08:00:00,2022-05-04T08:00,2022,5,11.2,0.2,Drizzle
01/22/2022,22:00,40.72931,-73.997894,MANHATTAN,1.0,0.0,0,0,0,0,1,0,4496632,2022-01-22 22:00:00,2022-01-22T22:00,2022,1,-4.7,0.0,Cloudy
03/27/2022,0:00,40.746403,-73.97973,MANHATTAN,1.0,0.0,0,0,0,0,1,0,4513631,2022-03-27 00:00:00,2022-03-27T00:00,2022,3,4.3,0.1,Drizzle
03/18/2022,14:00,40.796005,-73.93542,MANHATTAN,1.0,0.0,0,0,1,0,0,0,4511883,2022-03-18 14:00:00,2022-03-18T14:00,2022,3,20.9,0.0,Clear
04/24/2022,3:00,40.722435,-73.99742,MANHATTAN,1.0,0.0,1,0,0,0,0,0,4522769,2022-04-24 03:00:00,2022-04-24T03:00,2022,4,7.9,0.0,Clear
03/30/2022,23:00,40.8285,-73.93779,MANHATTAN,1.0,0.0,0,0,0,0,1,0,4516489,2022-03-30 23:00:00,2022-03-30T23:00,2022,3,4.1,0.0,Clear
04/14/2022,21:00,40.712463,-73.99241,MANHATTAN,1.0,0.0,0,0,1,0,0,0,4519257,2022-04-14 21:00:00,2022-04-14T21:00,2022,4,14.8,0.0,Cloudy
04/23/2022,1:00,40.820965,-73.939575,MANHATTAN,1.0,0.0,0,0,0,0,1,0,4524066,2022-04-23 01:00:00,2022-04-23T01:00,2022,4,7.3,0.0,Cloudy
06/10/2022,22:00,40.794132,-73.94282,MANHATTAN,0.0,0.0,0,0,0,0,0,0,4539036,2022-06-10 22:00:00,2022-06-10T22:00,2022,6,18.9,0.0,Cloudy
02/17/2022,14:00,40.86676,-73.920616,MANHATTAN,1.0,0.0,0,0,0,0,0,0,4504424,2022-02-17 14:00:00,2022-02-17T14:00,2022,2,13.1,0.0,Cloudy
05/10/2022,7:00,0.0,0.0,MANHATTAN,0.0,0.0,0,0,0,0,0,0,4527086,2022-05-10 07:00:00,2022-05-10T07:00,2022,5,27.3,0.0,Cloudy
05/23/2022,8:00,40.7591,-73.99214,MANHATTAN,1.0,0.0,1,0,0,0,0,0,4530336,2022-05-23 08:00:00,2022-05-23T08:00,2022,5,17.6,0.0,Cloudy
05/30/2022,14:00,40.772343,-73.95269,MANHATTAN,0.0,0.0,0,0,0,0,0,0,4532633,2022-05-30 14:00:00,2022-05-30T14:00,2022,5,27.1,0.0,Cloudy
12/21/2022,19:00,40.736977,-74.00963,MANHATTAN,0.0,0.0,0,0,0,0,0,0,4592975,2022-12-21 19:00:00,2022-12-21T19:00,2022,12,0.7,0.0,Cloudy
05/11/2022,14:00,40.733433,-73.9955,MANHATTAN,1.0,0.0,0,0,1,0,0,0,4528791,2022-05-11 14:00:00,2022-05-11T14:00,2022,5,20.2,0.0,Cloudy
11/12/2022,4:00,40.75326,-74.00383,MANHATTAN,1.0,0.0,0,0,0,0,1,0,4582142,2022-11-12 04:00:00,2022-11-12T04:00,2022,11,19.3,0.7,Drizzle
10/19/2022,18:00,40.789707,-73.97581,MANHATTAN,0.0,0.0,0,0,0,0,0,0,4619306,2022-10-19 18:00:00,2022-10-19T18:00,2022,10,9.5,0.0,Clear
12/17/2022,0:00,40.79465,-73.97179,MANHATTAN,1.0,0.0,1,0,0,0,0,0,4590598,2022-12-17 00:00:00,2022-12-17T00:00,2022,12,3.7,0.1,Drizzle
01/28/2022,18:00,40.79435,-73.94473,MANHATTAN,1.0,0.0,1,0,0,0,0,0,4498110,2022-01-28 18:00:00,2022-01-28T18:00,2022,1,-0.5,0.0,Cloudy
03/03/2022,15:00,40.715828,-74.00355,MANHATTAN,1.0,0.0,0,0,1,0,0,0,4507414,2022-03-03 15:00:00,2022-03-03T15:00,2022,3,4.9,0.0,Cloudy
11/21/2022,16:00,40.779217,-73.9549,MANHATTAN,1.0,0.0,1,0,0,0,0,0,4583625,2022-11-21 16:00:00,2022-11-21T16:00,2022,11,3.4,0.0,Clear
01/28/2022,21:00,40.826237,-73.935715,MANHATTAN,0.0,0.0,0,0,0,0,0,0,4498758,2022-01-28 21:00:00,2022-01-28T21:00,2022,1,-1.2,0.4,Heavy Snow
09/20/2022,9:00,0.0,0.0,MANHATTAN,0.0,0.0,0,0,0,0,0,0,4567115,2022-09-20 09:00:00,2022-09-20T09:00,2022,9,24.7,0.1,Drizzle
10/24/2022,22:00,40.72032,-73.99405,MANHATTAN,1.0,0.0,1,0,0,0,0,0,4576307,2022-10-24 22:00:00,2022-10-24T22:00,2022,10,15.2,0.1,Drizzle
08/09/2022,14:00,40.713688,-73.99459,MANHATTAN,1.0,0.0,1,0,0,0,0,0,4554254,2022-08-09 14:00:00,2022-08-09T14:00,2022,8,37.5,0.0,Cloudy
12/16/2022,10:00,40.705544,-74.00796,MANHATTAN,1.0,0.0,1,0,0,0,0,0,4590696,2022-12-16 10:00:00,2022-12-16T10:00,2022,12,5.5,0.1,Drizzle
08/12/2022,16:00,40.872314,-73.91274,MANHATTAN,1.0,0.0,0,0,0,0,0,0,4557084,2022-08-12 16:00:00,2022-08-12T16:00,2022,8,28.5,0.0,Clear
07/27/2022,0:00,40.747765,-73.98296,MANHATTAN,1.0,0.0,1,0,0,0,0,0,4549899,2022-07-27 00:00:00,2022-07-27T00:00,2022,7,20.4,0.0,Clear
12/26/2022,20:00,40.809338,-73.95922,MANHATTAN,0.0,0.0,0,0,0,0,0,0,4593027,2022-12-26 20:00:00,2022-12-26T20:00,2022,12,-3.3,0.0,Cloudy
04/23/2022,0:00,40.71787,-73.98858,MANHATTAN,1.0,0.0,0,0,1,0,0,0,4521339,2022-04-23 00:00:00,2022-04-23T00:00,2022,4,7.9,0.0,Cloudy
01/26/2022,8:00,40.81751,-73.96069,MANHATTAN,1.0,0.0,1,0,0,0,0,0,4497576,2022-01-26 08:00:00,2022-01-26T08:00,2022,1,-6.3,0.0,Clear
04/06/2022,0:00,40.742363,-73.98268,MANHATTAN,1.0,0.0,0,0,0,0,1,0,4516757,2022-04-06 00:00:00,2022-04-06T00:00,2022,4,6.6,1.0,Drizzle
04/29/2022,16:00,0.0,0.0,MANHATTAN,1.0,0.0,0,0,0,0,1,0,4526192,2022-04-29 16:00:00,2022-04-29T16:00,2022,4,28.5,0.0,Cloudy
02/07/2022,15:00,40.781315,-73.94614,MANHATTAN,1.0,0.0,0,0,1,0,0,0,4501191,2022-02-07 15:00:00,2022-02-07T15:00,2022,2,2.5,0.7,Drizzle
12/06/2022,17:00,40.759624,-73.970085,MANHATTAN,1.0,0.0,1,0,0,0,0,0,4637068,2022-12-06 17:00:00,2022-12-06T17:00,2022,12,12.0,1.4,Light Rain
06/05/2022,10:00,40.720707,-73.981316,MANHATTAN,1.0,0.0,0,0,0,0,0,0,4534399,2022-06-05 10:00:00,2022-06-05T10:00,2022,6,20.3,0.0,Cloudy
12/31/2022,20:00,40.799984,-73.944855,MANHATTAN,1.0,0.0,1,0,0,0,0,0,4596372,2022-12-31 20:00:00,2022-12-31T20:00,2022,12,10.9,1.2,Drizzle
06/25/2022,3:00,40.723274,-73.99122,MANHATTAN,1.0,0.0,0,0,1,0,0,0,4543220,2022-06-25 03:00:00,2022-06-25T03:00,2022,6,18.8,0.0,Clear
09/16/2022,22:00,40.757385,-73.98226,MANHATTAN,1.0,0.0,1,0,0,0,0,0,4565563,2022-09-16 22:00:00,2022-09-16T22:00,2022,9,17.1,0.0,Cloudy
11/15/2022,20:00,40.76948,-73.95787,MANHATTAN,1.0,0.0,1,0,0,0,0,0,4585197,2022-11-15 20:00:00,2022-11-15T20:00,2022,11,5.7,1.9,Light Rain
11/22/2022,7:00,40.863422,-73.93003,MANHATTAN,1.0,0.0,0,0,0,0,1,0,4584151,2022-11-22 07:00:00,2022-11-22T07:00,2022,11,0.6,0.0,Clear
04/15/2022,15:00,40.872314,-73.91274,MANHATTAN,1.0,0.0,0,0,1,0,0,0,4519717,2022-04-15 15:00:00,2022-04-15T15:00,2022,4,17.8,0.0,Clear
07/21/2022,14:00,40.848473,-73.93255,MANHATTAN,1.0,0.0,1,0,0,0,0,0,4550918,2022-07-21 14:00:00,2022-07-21T14:00,2022,7,28.6,0.1,Drizzle
11/09/2022,23:00,40.86446,-73.91895,MANHATTAN,1.0,0.0,0,0,0,0,1,0,4601269,2022-11-09 23:00:00,2022-11-09T23:00,2022,11,6.7,0.0,Clear
07/17/2022,1:00,40.734837,-73.99076,MANHATTAN,1.0,0.0,0,0,1,0,0,0,4547395,2022-07-17 01:00:00,2022-07-17T01:00,2022,7,21.5,0.5,Drizzle
09/13/2022,10:00,40.752934,-73.9855,MANHATTAN,1.0,0.0,0,0,0,0,1,0,4563921,2022-09-13 10:00:00,2022-09-13T10:00,2022,9,24.5,0.0,Cloudy
04/08/2022,18:00,40.83112,-73.94786,MANHATTAN,0.0,0.0,0,0,0,0,0,0,4517336,2022-04-08 18:00:00,2022-04-08T18:00,2022,4,12.4,0.0,Clear
05/30/2022,19:00,40.723503,-73.97929,MANHATTAN,1.0,0.0,0,0,1,0,0,0,4534076,2022-05-30 19:00:00,2022-05-30T19:00,2022,5,24.3,0.0,Cloudy
07/06/2022,15:00,40.75018,-74.00608,MANHATTAN,2.0,0.0,0,0,0,0,2,0,4545538,2022-07-06 15:00:00,2022-07-06T15:00,2022,7,31.5,0.0,Cloudy
01/21/2022,21:00,40.735294,-73.98282,MANHATTAN,1.0,0.0,0,0,1,0,0,0,4496542,2022-01-21 21:00:00,2022-01-21T21:00,2022,1,-7.6,0.0,Cloudy
10/06/2022,5:00,40.734123,-73.99498,MANHATTAN,0.0,0.0,0,0,0,0,0,0,4571213,2022-10-06 05:00:00,2022-10-06T05:00,2022,10,11.3,0.0,Clear
10/01/2022,11:00,40.770542,-73.99198,MANHATTAN,1.0,0.0,0,0,0,0,1,0,4569860,2022-10-01 11:00:00,2022-10-01T11:00,2022,10,14.2,1.7,Light Rain
01/27/2022,21:00,40.736336,-73.98301,MANHATTAN,1.0,0.0,1,0,0,0,0,0,4501587,2022-01-27 21:00:00,2022-01-27T21:00,2022,1,-4.1,0.0,Cloudy
01/08/2022,14:00,40.749367,-73.984695,MANHATTAN,3.0,0.0,0,0,0,0,3,0,4493108,2022-01-08 14:00:00,2022-01-08T14:00,2022,1,-4.1,0.0,Clear
10/27/2022,8:00,40.730442,-73.98035,MANHATTAN,1.0,0.0,0,0,0,0,1,0,4576646,2022-10-27 08:00:00,2022-10-27T08:00,2022,10,14.3,0.0,Clear
03/11/2022,23:00,40.761425,-73.99419,MANHATTAN,1.0,0.0,0,0,0,0,1,0,4509356,2022-03-11 23:00:00,2022-03-11T23:00,2022,3,3.0,0.0,Cloudy
12/15/2022,8:00,40.763733,-73.962074,MANHATTAN,0.0,0.0,0,0,0,0,0,0,4589984,2022-12-15 08:00:00,2022-12-15T08:00,2022,12,1.2,0.0,Cloudy
01/08/2022,14:00,40.73978,-73.97951,MANHATTAN,1.0,0.0,1,0,0,0,0,0,4492964,2022-01-08 14:00:00,2022-01-08T14:00,2022,1,-3.9,0.0,Clear
10/07/2022,15:00,40.747295,-73.97405,MANHATTAN,1.0,0.0,0,0,1,0,0,0,4581007,2022-10-07 15:00:00,2022-10-07T15:00,2022,10,23.7,0.0,Clear
08/20/2022,6:00,40.762966,-73.9819,MANHATTAN,0.0,0.0,0,0,0,0,0,0,4557865,2022-08-20 06:00:00,2022-08-20T06:00,2022,8,21.6,0.0,Clear
12/07/2022,9:00,40.753925,-73.99761,MANHATTAN,1.0,0.0,1,0,0,0,0,0,4591377,2022-12-07 09:00:00,2022-12-07T09:00,2022,12,12.7,0.2,Drizzle
04/18/2022,12:00,40.708473,-74.004875,MANHATTAN,0.0,0.0,0,0,0,0,0,0,4520201,2022-04-18 12:00:00,2022-04-18T12:00,2022,4,9.6,0.0,Cloudy
12/08/2022,14:00,40.749832,-73.98196,MANHATTAN,0.0,0.0,0,0,0,0,0,0,4588645,2022-12-08 14:00:00,2022-12-08T14:00,2022,12,11.3,0.0,Cloudy
11/17/2022,12:00,40.80573,-73.93855,MANHATTAN,1.0,0.0,0,0,0,0,0,0,4582721,2022-11-17 12:00:00,2022-11-17T12:00,2022,11,7.6,0.0,Clear
09/17/2022,11:00,40.76821,-73.95484,MANHATTAN,0.0,0.0,0,0,0,0,0,0,4565362,2022-09-17 11:00:00,2022-09-17T11:00,2022,9,21.7,0.0,Cloudy
08/05/2022,0:00,40.78363,-73.94353,MANHATTAN,1.0,0.0,0,0,0,0,1,0,4552393,2022-08-05 00:00:00,2022-08-05T00:00,2022,8,25.7,0.0,Cloudy
06/01/2022,19:00,40.78065,-73.976425,MANHATTAN,1.0,0.0,0,0,0,0,1,0,4535092,2022-06-01 19:00:00,2022-06-01T19:00,2022,6,17.2,0.0,Cloudy
05/22/2022,15:00,40.75772,-73.98695,MANHATTAN,0.0,0.0,0,0,0,0,0,0,4531937,2022-05-22 15:00:00,2022-05-22T15:00,2022,5,30.2,0.0,Cloudy
09/30/2022,7:00,40.79824,-73.95247,MANHATTAN,1.0,0.0,0,0,1,0,0,0,4569508,2022-09-30 07:00:00,2022-09-30T07:00,2022,9,10.9,0.0,Cloudy
09/04/2022,0:00,40.749825,-73.972206,MANHATTAN,1.0,0.0,0,0,0,0,1,0,4560754,2022-09-04 00:00:00,2022-09-04T00:00,2022,9,22.0,0.0,Cloudy
10/18/2022,11:00,40.750828,-73.99027,MANHATTAN,1.0,0.0,1,0,0,0,0,0,4576247,2022-10-18 11:00:00,2022-10-18T11:00,2022,10,11.4,0.0,Clear
11/16/2022,10:00,40.802925,-73.96758,MANHATTAN,0.0,0.0,0,0,0,0,0,0,4583251,2022-11-16 10:00:00,2022-11-16T10:00,2022,11,5.4,0.0,Cloudy
04/06/2022,18:00,40.755737,-73.97836,MANHATTAN,1.0,0.0,0,0,0,0,1,0,4516898,2022-04-06 18:00:00,2022-04-06T18:00,2022,4,10.8,0.0,Cloudy
12/15/2022,11:00,40.74808,-73.98959,MANHATTAN,1.0,0.0,0,0,1,0,0,0,4590816,2022-12-15 11:00:00,2022-12-15T11:00,2022,12,3.5,0.0,Cloudy
06/08/2022,11:00,40.76399,-73.958786,MANHATTAN,0.0,0.0,0,0,0,0,0,0,4536987,2022-06-08 11:00:00,2022-06-08T11:00,2022,6,26.2,0.0,Cloudy
12/12/2022,9:00,40.82326,-73.95277,MANHATTAN,0.0,0.0,0,0,0,0,0,0,4593983,2022-12-12 09:00:00,2022-12-12T09:00,2022,12,0.3,0.0,Clear
09/26/2022,16:00,40.762127,-73.99739,MANHATTAN,1.0,0.0,0,0,1,0,0,0,4572508,2022-09-26 16:00:00,2022-09-26T16:00,2022,9,22.8,0.0,Clear
08/29/2022,10:00,40.810406,-73.95171,MANHATTAN,1.0,0.0,0,0,1,0,0,0,4560534,2022-08-29 10:00:00,2022-08-29T10:00,2022,8,27.0,0.1,Drizzle
06/11/2022,0:00,40.718273,-74.00533,MANHATTAN,3.0,0.0,0,0,0,0,3,0,4537713,2022-06-11 00:00:00,2022-06-11T00:00,2022,6,18.4,0.0,Cloudy
10/08/2022,11:00,40.72455,-74.00194,MANHATTAN,1.0,0.0,0,0,0,0,1,0,4572236,2022-10-08 11:00:00,2022-10-08T11:00,2022,10,12.6,0.0,Cloudy
09/12/2022,21:00,40.717762,-73.9838,MANHATTAN,0.0,0.0,0,0,0,0,0,0,4563606,2022-09-12 21:00:00,2022-09-12T21:00,2022,9,22.7,0.5,Drizzle
09/03/2022,18:00,40.776875,-73.94938,MANHATTAN,2.0,0.0,0,0,2,0,0,0,4561018,2022-09-03 18:00:00,2022-09-03T18:00,2022,9,23.0,0.0,Cloudy
08/28/2022,22:00,40.835308,-73.94398,MANHATTAN,3.0,0.0,0,0,0,0,3,0,4559282,2022-08-28 22:00:00,2022-08-28T22:00,2022,8,22.1,0.0,Cloudy
09/13/2022,14:00,40.719624,-74.00864,MANHATTAN,1.0,0.0,1,0,0,0,0,0,4564457,2022-09-13 14:00:00,2022-09-13T14:00,2022,9,23.5,0.8,Drizzle
01/11/2022,13:00,40.785866,-73.950935,MANHATTAN,1.0,0.0,1,0,0,0,0,0,4493955,2022-01-11 13:00:00,2022-01-11T13:00,2022,1,-6.7,0.0,Clear
04/21/2022,9:00,40.820827,-73.950836,MANHATTAN,1.0,0.0,0,0,0,0,0,0,4531038,2022-04-21 09:00:00,2022-04-21T09:00,2022,4,11.8,0.0,Cloudy
01/29/2022,18:00,40.77981,-73.95035,MANHATTAN,0.0,0.0,0,0,0,0,0,0,4498591,2022-01-29 18:00:00,2022-01-29T18:00,2022,1,-8.8,0.1,Light Snow
08/16/2022,8:00,40.707317,-74.00428,MANHATTAN,1.0,0.0,0,0,1,0,0,0,4556100,2022-08-16 08:00:00,2022-08-16T08:00,2022,8,21.6,0.0,Cloudy
02/04/2022,22:00,40.730007,-73.987366,MANHATTAN,1.0,0.0,1,0,0,0,0,0,4500151,2022-02-04 22:00:00,2022-02-04T22:00,2022,2,-1.9,0.1,Light Snow
03/27/2022,15:00,40.754093,-73.99209,MANHATTAN,1.0,0.0,1,0,0,0,0,0,4514268,2022-03-27 15:00:00,2022-03-27T15:00,2022,3,5.1,0.1,Drizzle
01/18/2022,0:00,40.748985,-73.979965,MANHATTAN,1.0,0.0,0,0,0,0,1,0,4495520,2022-01-18 00:00:00,2022-01-18T00:00,2022,1,-0.2,0.0,Cloudy
05/25/2022,23:00,40.72388,-73.996956,MANHATTAN,1.0,0.0,0,0,1,0,0,0,4531789,2022-05-25 23:00:00,2022-05-25T23:00,2022,5,11.6,0.0,Cloudy
04/07/2022,13:00,40.71709,-73.98804,MANHATTAN,1.0,0.0,1,0,0,0,0,0,4517073,2022-04-07 13:00:00,2022-04-07T13:00,2022,4,9.3,1.6,Light Rain
05/29/2022,16:00,40.75736,-73.98577,MANHATTAN,1.0,0.0,0,0,1,0,0,0,4532473,2022-05-29 16:00:00,2022-05-29T16:00,2022,5,24.1,0.0,Cloudy
09/02/2022,17:00,40.81218,-73.955246,MANHATTAN,1.0,0.0,0,0,1,0,0,0,4561562,2022-09-02 17:00:00,2022-09-02T17:00,2022,9,24.5,0.0,Cloudy
05/25/2022,0:00,40.799458,-73.95154,MANHATTAN,1.0,0.0,0,0,1,0,0,0,4531532,2022-05-25 00:00:00,2022-05-25T00:00,2022,5,11.7,0.0,Cloudy
05/06/2022,8:00,40.709976,-74.004486,MANHATTAN,1.0,0.0,0,0,0,0,1,0,4525138,2022-05-06 08:00:00,2022-05-06T08:00,2022,5,13.3,1.2,Drizzle
07/28/2022,11:00,40.803967,-73.952194,MANHATTAN,1.0,0.0,0,0,0,0,1,0,4552154,2022-07-28 11:00:00,2022-07-28T11:00,2022,7,29.6,0.0,Cloudy
04/06/2022,10:00,40.744366,-73.974884,MANHATTAN,1.0,0.0,1,0,0,0,0,0,4517098,2022-04-06 10:00:00,2022-04-06T10:00,2022,4,8.9,1.1,Drizzle
07/15/2022,16:00,40.78654,-73.95044,MANHATTAN,1.0,0.0,1,0,0,0,0,0,4547655,2022-07-15 16:00:00,2022-07-15T16:00,2022,7,28.2,0.0,Clear
04/10/2022,0:00,40.820625,-73.95842,MANHATTAN,2.0,0.0,0,0,0,0,2,0,4518575,2022-04-10 00:00:00,2022-04-10T00:00,2022,4,7.1,0.0,Cloudy
06/28/2022,21:00,40.749825,-73.972206,MANHATTAN,2.0,0.0,0,0,0,0,2,0,4541647,2022-06-28 21:00:00,2022-06-28T21:00,2022,6,21.0,0.0,Cloudy
11/01/2022,13:00,40.783897,-73.97407,MANHATTAN,1.0,0.0,0,0,1,0,0,0,4579816,2022-11-01 13:00:00,2022-11-01T13:00,2022,11,18.9,0.1,Drizzle
03/04/2022,8:00,40.720074,-73.988365,MANHATTAN,1.0,0.0,1,0,0,0,0,0,4507236,2022-03-04 08:00:00,2022-03-04T08:00,2022,3,-4.9,0.0,Clear
06/07/2022,0:00,40.721024,-74.00526,MANHATTAN,0.0,0.0,0,0,0,0,0,0,4535217,2022-06-07 00:00:00,2022-06-07T00:00,2022,6,17.7,0.0,Cloudy
07/27/2022,0:00,40.763363,-73.98283,MANHATTAN,1.0,0.0,0,0,0,0,1,0,4549731,2022-07-27 00:00:00,2022-07-27T00:00,2022,7,20.4,0.0,Clear
01/24/2022,15:00,40.794132,-73.94282,MANHATTAN,1.0,0.0,0,0,0,0,0,0,4497500,2022-01-24 15:00:00,2022-01-24T15:00,2022,1,0.2,0.0,Cloudy
06/26/2022,11:00,40.848118,-73.93089,MANHATTAN,1.0,0.0,0,0,0,0,1,0,4541504,2022-06-26 11:00:00,2022-06-26T11:00,2022,6,30.2,0.0,Clear
04/09/2022,20:00,40.751404,-74.00518,MANHATTAN,1.0,0.0,1,0,0,0,0,0,4517647,2022-04-09 20:00:00,2022-04-09T20:00,2022,4,7.4,0.0,Cloudy
01/08/2022,0:00,40.719025,-73.98978,MANHATTAN,0.0,0.0,0,0,0,0,0,0,4492899,2022-01-08 00:00:00,2022-01-08T00:00,2022,1,-5.5,0.0,Clear
06/11/2022,14:00,40.793186,-73.94057,MANHATTAN,1.0,0.0,0,0,1,0,0,0,4536801,2022-06-11 14:00:00,2022-06-11T14:00,2022,6,24.0,0.0,Cloudy
01/07/2022,0:00,40.713135,-74.00407,MANHATTAN,2.0,0.0,0,0,0,0,2,0,4494764,2022-01-07 00:00:00,2022-01-07T00:00,2022,1,-0.6,0.1,Light Snow
08/09/2022,19:00,40.750763,-73.97445,MANHATTAN,1.0,0.0,1,0,0,0,0,0,4554806,2022-08-09 19:00:00,2022-08-09T19:00,2022,8,27.3,0.4,Drizzle
01/16/2022,22:00,40.82465,-73.94623,MANHATTAN,0.0,0.0,0,0,0,0,0,0,4500065,2022-01-16 22:00:00,2022-01-16T22:00,2022,1,1.7,1.5,Heavy Snow
11/09/2022,11:00,40.793804,-73.94404,MANHATTAN,0.0,0.0,0,0,0,0,0,0,4580479,2022-11-09 11:00:00,2022-11-09T11:00,2022,11,8.8,0.0,Clear
04/29/2022,18:00,40.75045,-73.9873,MANHATTAN,1.0,0.0,1,0,0,0,0,0,4523505,2022-04-29 18:00:00,2022-04-29T18:00,2022,4,13.2,0.0,Clear
10/09/2022,18:00,40.723648,-73.99103,MANHATTAN,1.0,0.0,0,0,0,0,1,0,4571711,2022-10-09 18:00:00,2022-10-09T18:00,2022,10,13.2,0.0,Clear
11/05/2022,19:00,40.753994,-73.98846,MANHATTAN,1.0,0.0,0,0,1,0,0,0,4581125,2022-11-05 19:00:00,2022-11-05T19:00,2022,11,17.3,0.0,Cloudy
01/15/2022,11:00,40.71481,-74.01616,MANHATTAN,0.0,0.0,0,0,0,0,0,0,4494704,2022-01-15 11:00:00,2022-01-15T11:00,2022,1,-8.0,0.0,Cloudy
12/12/2022,8:00,40.75564,-73.99189,MANHATTAN,1.0,0.0,1,0,0,0,0,0,4589219,2022-12-12 08:00:00,2022-12-12T08:00,2022,12,0.5,0.0,Cloudy
06/07/2022,12:00,40.759167,-73.97092,MANHATTAN,1.0,0.0,0,0,1,0,0,0,4535866,2022-06-07 12:00:00,2022-06-07T12:00,2022,6,23.9,0.0,Cloudy
03/24/2022,5:00,40.73555,-73.979355,MANHATTAN,1.0,0.0,1,0,0,0,0,0,4513001,2022-03-24 05:00:00,2022-03-24T05:00,2022,3,8.8,2.3,Light Rain
09/18/2022,1:00,40.806213,-73.94182,MANHATTAN,2.0,0.0,0,0,0,0,2,0,4565260,2022-09-18 01:00:00,2022-09-18T01:00,2022,9,18.7,0.0,Clear
11/04/2022,17:00,40.714066,-73.98999,MANHATTAN,1.0,0.0,0,0,0,0,0,0,4582003,2022-11-04 17:00:00,2022-11-04T17:00,2022,11,15.9,0.0,Cloudy
11/15/2022,19:00,40.71746,-74.00191,MANHATTAN,0.0,0.0,0,0,0,0,0,0,4582659,2022-11-15 19:00:00,2022-11-15T19:00,2022,11,5.9,0.3,Drizzle
02/28/2022,10:00,40.79726,-73.94053,MANHATTAN,0.0,0.0,0,0,0,0,0,0,4508166,2022-02-28 10:00:00,2022-02-28T10:00,2022,2,-1.5,0.0,Clear
10/28/2022,8:00,40.806755,-73.952995,MANHATTAN,0.0,0.0,0,0,0,0,0,0,4576881,2022-10-28 08:00:00,2022-10-28T08:00,2022,10,7.7,0.0,Cloudy
10/21/2022,15:00,40.746616,-73.99382,MANHATTAN,1.0,0.0,1,0,0,0,0,0,4585923,2022-10-21 15:00:00,2022-10-21T15:00,2022,10,15.8,0.0,Clear
08/18/2022,0:00,40.76234,-73.98236,MANHATTAN,1.0,0.0,0,0,0,0,0,0,4556622,2022-08-18 00:00:00,2022-08-18T00:00,2022,8,18.5,0.0,Clear
12/10/2022,21:00,40.78143,-73.960175,MANHATTAN,1.0,0.0,1,0,0,0,0,0,4589023,2022-12-10 21:00:00,2022-12-10T21:00,2022,12,2.9,0.0,Cloudy
09/02/2022,19:00,40.76121,-73.98691,MANHATTAN,1.0,0.0,1,0,0,0,0,0,4561797,2022-09-02 19:00:00,2022-09-02T19:00,2022,9,21.4,0.0,Cloudy
12/18/2022,19:00,40.80351,-73.9532,MANHATTAN,1.0,0.0,0,0,0,0,1,0,4591447,2022-12-18 19:00:00,2022-12-18T19:00,2022,12,-0.1,0.0,Clear
07/30/2022,0:00,40.7227,-73.98599,MANHATTAN,1.0,0.0,1,0,0,0,0,0,4550812,2022-07-30 00:00:00,2022-07-30T00:00,2022,7,23.3,0.7,Drizzle
08/15/2022,14:00,40.790752,-73.94678,MANHATTAN,1.0,0.0,0,0,1,0,0,0,4555582,2022-08-15 14:00:00,2022-08-15T14:00,2022,8,27.3,0.0,Clear
12/21/2022,2:00,0.0,0.0,MANHATTAN,1.0,0.0,1,0,0,0,0,0,4592065,2022-12-21 02:00:00,2022-12-21T02:00,2022,12,25.5,0.0,Cloudy
11/21/2022,7:00,40.7463,-73.971664,MANHATTAN,0.0,0.0,0,0,0,0,0,0,4585737,2022-11-21 07:00:00,2022-11-21T07:00,2022,11,-2.8,0.0,Clear
07/11/2022,0:00,40.838497,-73.939835,MANHATTAN,1.0,0.0,0,0,1,0,0,0,4545332,2022-07-11 00:00:00,2022-07-11T00:00,2022,7,19.3,0.0,Clear
12/10/2022,13:00,40.831566,-73.942986,MANHATTAN,1.0,0.0,0,0,0,0,1,0,4588769,2022-12-10 13:00:00,2022-12-10T13:00,2022,12,4.3,0.0,Clear
05/03/2022,8:00,40.734875,-73.99443,MANHATTAN,0.0,0.0,0,0,0,0,0,0,4525739,2022-05-03 08:00:00,2022-05-03T08:00,2022,5,12.8,0.0,Clear
07/13/2022,12:00,40.839767,-73.94073,MANHATTAN,1.0,0.0,1,0,0,0,0,0,4550052,2022-07-13 12:00:00,2022-07-13T12:00,2022,7,32.1,0.0,Cloudy
03/24/2022,10:00,40.793816,-73.94012,MANHATTAN,1.0,0.0,0,0,0,0,1,0,4513258,2022-03-24 10:00:00,2022-03-24T10:00,2022,3,6.7,0.2,Drizzle
11/22/2022,14:00,40.744316,-73.974815,MANHATTAN,1.0,0.0,0,0,0,0,1,0,4588635,2022-11-22 14:00:00,2022-11-22T14:00,2022,11,8.7,0.0,Clear
03/10/2022,16:00,40.76118,-73.95791,MANHATTAN,1.0,0.0,0,0,0,0,1,0,4509101,2022-03-10 16:00:00,2022-03-10T16:00,2022,3,7.9,0.0,Cloudy
09/11/2022,22:00,40.751575,-73.982285,MANHATTAN,1.0,0.0,0,0,0,0,1,0,4563197,2022-09-11 22:00:00,2022-09-11T22:00,2022,9,20.4,0.8,Drizzle
09/03/2022,12:00,40.86688,-73.92347,MANHATTAN,1.0,0.0,0,0,0,0,0,0,4564025,2022-09-03 12:00:00,2022-09-03T12:00,2022,9,26.9,0.0,Clear
02/24/2022,15:00,40.709805,-73.99191,MANHATTAN,2.0,0.0,0,0,0,0,2,0,4505340,2022-02-24 15:00:00,2022-02-24T15:00,2022,2,0.5,0.0,Cloudy
04/21/2022,17:00,40.8183,-73.95273,MANHATTAN,2.0,0.0,0,0,0,0,2,0,4575786,2022-04-21 17:00:00,2022-04-21T17:00,2022,4,10.5,0.0,Cloudy
09/12/2022,7:00,40.740185,-73.986374,MANHATTAN,1.0,0.0,0,0,0,0,1,0,4563224,2022-09-12 07:00:00,2022-09-12T07:00,2022,9,20.5,0.0,Cloudy
10/15/2022,8:00,40.756252,-73.99144,MANHATTAN,2.0,0.0,0,0,0,0,2,0,4573150,2022-10-15 08:00:00,2022-10-15T08:00,2022,10,12.1,0.0,Clear
11/08/2022,23:00,40.733715,-73.98822,MANHATTAN,1.0,0.0,0,0,1,0,0,0,4580520,2022-11-08 23:00:00,2022-11-08T23:00,2022,11,7.9,0.0,Clear
06/26/2022,20:00,40.73831,-73.98775,MANHATTAN,0.0,0.0,0,0,0,0,0,0,4541031,2022-06-26 20:00:00,2022-06-26T20:00,2022,6,24.9,0.0,Cloudy
07/11/2022,19:00,40.717175,-74.01288,MANHATTAN,1.0,0.0,0,0,0,0,1,0,4545638,2022-07-11 19:00:00,2022-07-11T19:00,2022,7,22.4,0.0,Clear
03/06/2022,14:00,40.80222,-73.93398,MANHATTAN,1.0,0.0,0,0,0,0,1,0,4508119,2022-03-06 14:00:00,2022-03-06T14:00,2022,3,18.4,0.5,Drizzle
09/12/2022,0:00,40.713196,-73.98389,MANHATTAN,1.0,0.0,1,0,0,0,0,0,4564153,2022-09-12 00:00:00,2022-09-12T00:00,2022,9,21.3,2.6,Heavy Rain
01/30/2022,15:00,40.738323,-73.8856,QUEENS,1.0,0.0,1,0,0,0,0,0,4498439,2022-01-30 15:00:00,2022-01-30T15:00,2022,1,-7.3,0.0,Clear
12/30/2022,6:00,40.755165,-73.8891,QUEENS,1.0,0.0,0,0,0,0,1,0,4594397,2022-12-30 06:00:00,2022-12-30T06:00,2022,12,1.2,0.0,Cloudy
09/02/2022,11:00,40.70253,-73.813896,QUEENS,1.0,0.0,0,0,0,0,1,0,4568287,2022-09-02 11:00:00,2022-09-02T11:00,2022,9,23.7,0.0,Clear
11/10/2022,18:00,40.73856,-73.85524,QUEENS,1.0,0.0,1,0,0,0,0,0,4580736,2022-11-10 18:00:00,2022-11-10T18:00,2022,11,13.2,0.0,Cloudy
10/03/2022,8:00,40.684746,-73.83112,QUEENS,1.0,0.0,1,0,0,0,0,0,4570189,2022-10-03 08:00:00,2022-10-03T08:00,2022,10,10.4,0.5,Drizzle
12/23/2022,9:00,40.74733,-73.88185,QUEENS,0.0,0.0,0,0,0,0,0,0,4593389,2022-12-23 09:00:00,2022-12-23T09:00,2022,12,8.6,1.2,Drizzle
09/11/2022,12:00,40.771015,-73.9136,QUEENS,0.0,0.0,0,0,0,0,0,0,4563068,2022-09-11 12:00:00,2022-09-11T12:00,2022,9,24.0,0.3,Drizzle
09/25/2022,17:00,40.746635,-73.95529,QUEENS,1.0,0.0,1,0,0,0,0,0,4567706,2022-09-25 17:00:00,2022-09-25T17:00,2022,9,22.8,0.0,Cloudy
07/07/2022,20:00,40.713924,-73.80212,QUEENS,1.0,0.0,1,0,0,0,0,0,4544548,2022-07-07 20:00:00,2022-07-07T20:00,2022,7,22.0,0.0,Cloudy
01/22/2022,23:00,40.697666,-73.792046,QUEENS,0.0,0.0,0,0,0,0,0,0,4496700,2022-01-22 23:00:00,2022-01-22T23:00,2022,1,-3.1,0.0,Clear
04/11/2022,21:00,40.749966,-73.861755,QUEENS,1.0,0.0,0,0,1,0,0,0,4520118,2022-04-11 21:00:00,2022-04-11T21:00,2022,4,9.0,0.0,Cloudy
08/07/2022,0:00,40.703712,-73.90677,QUEENS,0.0,0.0,0,0,0,0,0,0,4553010,2022-08-07 00:00:00,2022-08-07T00:00,2022,8,25.0,0.4,Drizzle
01/15/2022,0:00,40.702335,-73.89073,QUEENS,2.0,0.0,0,0,0,0,2,0,4494907,2022-01-15 00:00:00,2022-01-15T00:00,2022,1,-6.3,0.0,Clear
02/11/2022,0:00,40.70877,-73.78606,QUEENS,1.0,0.0,0,0,0,0,1,0,4503375,2022-02-11 00:00:00,2022-02-11T00:00,2022,2,2.0,0.0,Clear
10/28/2022,9:00,40.712353,-73.91696,QUEENS,0.0,0.0,0,0,0,0,0,0,4577316,2022-10-28 09:00:00,2022-10-28T09:00,2022,10,9.0,0.0,Cloudy
03/02/2022,16:00,40.757824,-73.79032,QUEENS,1.0,0.0,0,0,0,0,1,0,4506818,2022-03-02 16:00:00,2022-03-02T16:00,2022,3,10.1,0.0,Clear
04/09/2022,11:00,40.724888,-73.89899,QUEENS,1.0,0.0,0,0,0,0,1,0,4518374,2022-04-09 11:00:00,2022-04-09T11:00,2022,4,10.6,0.2,Drizzle
02/18/2022,16:00,40.72898,-73.882385,QUEENS,1.0,0.0,1,0,0,0,0,0,4504170,2022-02-18 16:00:00,2022-02-18T16:00,2022,2,3.1,0.0,Clear
07/27/2022,13:00,40.73764,-73.93502,QUEENS,1.0,0.0,0,0,0,0,1,0,4550022,2022-07-27 13:00:00,2022-07-27T13:00,2022,7,29.0,0.0,Clear
10/31/2022,20:00,40.74994,-73.882454,QUEENS,1.0,0.0,1,0,0,0,0,0,4577735,2022-10-31 20:00:00,2022-10-31T20:00,2022,10,14.4,2.8,Heavy Rain
12/06/2022,20:00,40.667862,-73.85073,QUEENS,1.0,0.0,1,0,0,0,0,0,4587705,2022-12-06 20:00:00,2022-12-06T20:00,2022,12,12.6,0.5,Drizzle
08/04/2022,8:00,40.67472,-73.85839,QUEENS,1.0,0.0,0,0,0,0,1,0,4552191,2022-08-04 08:00:00,2022-08-04T08:00,2022,8,27.7,0.0,Clear
07/17/2022,14:00,40.7497,-73.902565,QUEENS,1.0,0.0,0,0,0,0,1,0,4547543,2022-07-17 14:00:00,2022-07-17T14:00,2022,7,27.7,0.0,Cloudy
01/27/2022,20:00,40.71362,-73.83038,QUEENS,1.0,0.0,1,0,0,0,0,0,4499418,2022-01-27 20:00:00,2022-01-27T20:00,2022,1,-3.3,0.0,Cloudy
09/01/2022,2:00,40.67815,-73.83109,QUEENS,1.0,0.0,0,0,0,0,1,0,4559993,2022-09-01 02:00:00,2022-09-01T02:00,2022,9,21.0,0.0,Clear
03/22/2022,8:00,40.58301,-73.82607,QUEENS,3.0,0.0,0,0,0,0,3,0,4512480,2022-03-22 08:00:00,2022-03-22T08:00,2022,3,7.6,0.0,Cloudy
01/27/2022,14:00,40.73155,-73.8939,QUEENS,0.0,0.0,0,0,0,0,0,0,4499144,2022-01-27 14:00:00,2022-01-27T14:00,2022,1,-0.8,0.0,Cloudy
08/25/2022,0:00,40.703514,-73.8099,QUEENS,1.0,0.0,0,0,0,0,1,0,4565399,2022-08-25 00:00:00,2022-08-25T00:00,2022,8,22.2,0.0,Clear
11/27/2022,14:00,40.718616,-73.902626,QUEENS,0.0,0.0,0,0,0,0,0,0,4585116,2022-11-27 14:00:00,2022-11-27T14:00,2022,11,10.5,1.7,Light Rain
09/28/2022,19:00,40.701645,-73.91168,QUEENS,0.0,0.0,0,0,0,0,0,0,4570658,2022-09-28 19:00:00,2022-09-28T19:00,2022,9,16.8,0.0,Cloudy
03/07/2022,22:00,40.72261,-73.81479,QUEENS,1.0,0.0,0,0,1,0,0,0,4510090,2022-03-07 22:00:00,2022-03-07T22:00,2022,3,16.5,1.9,Light Rain
02/09/2022,0:00,40.75116,-73.862366,QUEENS,1.0,0.0,1,0,0,0,0,0,4505386,2022-02-09 00:00:00,2022-02-09T00:00,2022,2,-2.6,0.0,Clear
06/21/2022,16:00,40.734768,-73.87459,QUEENS,1.0,0.0,0,0,0,0,1,0,4540376,2022-06-21 16:00:00,2022-06-21T16:00,2022,6,24.2,0.0,Cloudy
01/31/2022,15:00,40.658733,-73.727745,QUEENS,1.0,0.0,0,0,0,0,1,0,4498879,2022-01-31 15:00:00,2022-01-31T15:00,2022,1,-2.5,0.0,Cloudy
07/15/2022,15:00,40.75303,-73.92163,QUEENS,1.0,0.0,0,0,1,0,0,0,4546597,2022-07-15 15:00:00,2022-07-15T15:00,2022,7,28.6,0.0,Cloudy
07/04/2022,12:00,40.76151,-73.88361,QUEENS,1.0,0.0,1,0,0,0,0,0,4543546,2022-07-04 12:00:00,2022-07-04T12:00,2022,7,29.6,0.0,Clear
01/16/2022,11:00,40.72298,-73.74476,QUEENS,1.0,0.0,0,0,0,0,1,0,4495255,2022-01-16 11:00:00,2022-01-16T11:00,2022,1,-4.8,0.0,Cloudy
01/03/2022,13:00,40.746685,-73.856316,QUEENS,0.0,0.0,0,0,0,0,0,0,4491844,2022-01-03 13:00:00,2022-01-03T13:00,2022,1,-2.6,0.7,Heavy Snow
09/27/2022,16:00,40.765057,-73.81293,QUEENS,0.0,0.0,0,0,0,0,0,0,4568275,2022-09-27 16:00:00,2022-09-27T16:00,2022,9,21.0,0.0,Clear
03/29/2022,23:00,40.694275,-73.901855,QUEENS,1.0,0.0,1,0,0,0,0,0,4514855,2022-03-29 23:00:00,2022-03-29T23:00,2022,3,-1.3,0.0,Clear
08/16/2022,14:00,0.0,0.0,QUEENS,1.0,0.0,0,0,0,0,1,0,4556307,2022-08-16 14:00:00,2022-08-16T14:00,2022,8,23.0,0.0,Cloudy
08/19/2022,10:00,40.712055,-73.75319,QUEENS,1.0,0.0,0,0,0,0,1,0,4556575,2022-08-19 10:00:00,2022-08-19T10:00,2022,8,29.3,0.0,Clear
02/11/2022,17:00,40.74089,-73.89581,QUEENS,1.0,0.0,0,0,0,0,1,0,4501963,2022-02-11 17:00:00,2022-02-11T17:00,2022,2,7.6,0.0,Clear
03/11/2022,8:00,40.67071,-73.82183,QUEENS,1.0,0.0,0,0,0,0,1,0,4509353,2022-03-11 08:00:00,2022-03-11T08:00,2022,3,4.2,0.0,Clear
11/22/2022,17:00,40.75531,-73.73821,QUEENS,1.0,0.0,1,0,0,0,0,0,4583946,2022-11-22 17:00:00,2022-11-22T17:00,2022,11,5.8,0.0,Clear
08/22/2022,4:00,40.697872,-73.802376,QUEENS,1.0,0.0,1,0,0,0,0,0,4558034,2022-08-22 04:00:00,2022-08-22T04:00,2022,8,22.3,1.2,Drizzle
01/08/2022,20:00,40.74664,-73.891396,QUEENS,1.0,0.0,0,0,0,0,1,0,4493149,2022-01-08 20:00:00,2022-01-08T20:00,2022,1,-8.0,0.0,Clear
04/20/2022,11:00,40.708862,-73.778,QUEENS,1.0,0.0,0,0,0,0,1,0,4520673,2022-04-20 11:00:00,2022-04-20T11:00,2022,4,11.4,0.0,Clear
03/10/2022,15:00,40.76285,-73.798935,QUEENS,0.0,0.0,0,0,0,0,0,0,4509115,2022-03-10 15:00:00,2022-03-10T15:00,2022,3,9.1,0.0,Cloudy
02/05/2022,14:00,40.760284,-73.769356,QUEENS,1.0,0.0,0,0,0,0,1,0,4500291,2022-02-05 14:00:00,2022-02-05T14:00,2022,2,-1.7,0.0,Clear
10/29/2022,23:00,40.745365,-73.88834,QUEENS,0.0,0.0,0,0,0,0,0,0,4577194,2022-10-29 23:00:00,2022-10-29T23:00,2022,10,6.0,0.0,Clear
08/18/2022,9:00,40.715805,-73.887924,QUEENS,1.0,0.0,1,0,0,0,0,0,4556364,2022-08-18 09:00:00,2022-08-18T09:00,2022,8,25.6,0.0,Clear
09/26/2022,11:00,0.0,0.0,QUEENS,1.0,0.0,0,0,0,0,1,0,4567566,2022-09-26 11:00:00,2022-09-26T11:00,2022,9,25.1,0.0,Clear
08/30/2022,17:00,40.739964,-73.89424,QUEENS,1.0,0.0,0,0,0,0,1,0,4559686,2022-08-30 17:00:00,2022-08-30T17:00,2022,8,26.7,0.0,Clear
06/27/2022,8:00,40.666084,-73.82809,QUEENS,1.0,0.0,0,0,0,0,1,0,4541854,2022-06-27 08:00:00,2022-06-27T08:00,2022,6,24.9,0.0,Cloudy
06/27/2022,15:00,40.693817,-73.80296,QUEENS,1.0,0.0,0,0,0,0,1,0,4551657,2022-06-27 15:00:00,2022-06-27T15:00,2022,6,24.2,0.2,Drizzle
10/03/2022,23:00,40.743416,-73.95387,QUEENS,0.0,0.0,0,0,0,0,0,0,4570391,2022-10-03 23:00:00,2022-10-03T23:00,2022,10,9.3,6.1,Heavy Rain
10/29/2022,0:00,40.708424,-73.76036,QUEENS,2.0,0.0,0,0,0,0,2,0,4580160,2022-10-29 00:00:00,2022-10-29T00:00,2022,10,6.5,0.0,Clear
05/25/2022,0:00,40.590736,-73.79595,QUEENS,1.0,0.0,1,0,0,0,0,0,4531583,2022-05-25 00:00:00,2022-05-25T00:00,2022,5,12.5,0.0,Cloudy
03/28/2022,17:00,40.662724,-73.766594,QUEENS,0.0,0.0,0,0,0,0,0,0,4514296,2022-03-28 17:00:00,2022-03-28T17:00,2022,3,-0.3,0.0,Clear
02/06/2022,13:00,40.750538,-73.893005,QUEENS,0.0,0.0,0,0,0,0,0,0,4505072,2022-02-06 13:00:00,2022-02-06T13:00,2022,2,-2.4,0.0,Cloudy
02/07/2022,19:00,40.708168,-73.91056,QUEENS,1.0,0.0,0,0,0,0,1,0,4505150,2022-02-07 19:00:00,2022-02-07T19:00,2022,2,1.5,0.1,Drizzle
01/09/2022,23:00,40.66612,-73.82225,QUEENS,1.0,0.0,1,0,0,0,0,0,4493277,2022-01-09 23:00:00,2022-01-09T23:00,2022,1,4.4,0.0,Cloudy
07/06/2022,19:00,40.670494,-73.78359,QUEENS,1.0,0.0,0,0,0,0,1,0,4544059,2022-07-06 19:00:00,2022-07-06T19:00,2022,7,27.3,0.0,Clear
06/01/2022,7:00,40.725445,-73.90972,QUEENS,1.0,0.0,0,0,0,0,1,0,4533231,2022-06-01 07:00:00,2022-06-01T07:00,2022,6,16.8,0.0,Cloudy
01/23/2022,0:00,40.666695,-73.767136,QUEENS,2.0,0.0,0,0,0,0,2,0,4498926,2022-01-23 00:00:00,2022-01-23T00:00,2022,1,-3.9,0.0,Clear
11/19/2022,4:00,40.770916,-73.889046,QUEENS,0.0,0.0,0,0,0,0,0,0,4583724,2022-11-19 04:00:00,2022-11-19T04:00,2022,11,-0.8,0.0,Cloudy
07/17/2022,19:00,40.685936,-73.82594,QUEENS,1.0,0.0,0,0,0,0,1,0,4546825,2022-07-17 19:00:00,2022-07-17T19:00,2022,7,24.7,0.0,Cloudy
08/03/2022,22:00,40.759148,-73.79323,QUEENS,0.0,0.0,0,0,0,0,0,0,4552284,2022-08-03 22:00:00,2022-08-03T22:00,2022,8,23.8,0.0,Clear
07/11/2022,0:00,40.699684,-73.832146,QUEENS,1.0,0.0,1,0,0,0,0,0,4545750,2022-07-11 00:00:00,2022-07-11T00:00,2022,7,19.9,0.0,Clear
07/18/2022,9:00,40.728645,-73.8039,QUEENS,0.0,0.0,0,0,0,0,0,0,4547380,2022-07-18 09:00:00,2022-07-18T09:00,2022,7,25.5,0.3,Drizzle
02/17/2022,13:00,40.703403,-73.75322,QUEENS,1.0,0.0,0,0,0,0,1,0,4503749,2022-02-17 13:00:00,2022-02-17T13:00,2022,2,12.5,0.0,Cloudy
01/07/2022,20:00,40.766342,-73.819466,QUEENS,0.0,0.0,0,0,0,0,0,0,4493249,2022-01-07 20:00:00,2022-01-07T20:00,2022,1,-3.8,0.0,Clear
08/08/2022,8:00,40.601078,-73.756165,QUEENS,0.0,0.0,0,0,0,0,0,0,4553555,2022-08-08 08:00:00,2022-08-08T08:00,2022,8,25.4,0.0,Clear
04/16/2022,4:00,40.703022,-73.83768,QUEENS,1.0,0.0,0,0,0,0,1,0,4519452,2022-04-16 04:00:00,2022-04-16T04:00,2022,4,12.4,0.0,Cloudy
04/27/2022,12:00,40.699936,-73.90286,QUEENS,0.0,0.0,0,0,0,0,0,0,4523296,2022-04-27 12:00:00,2022-04-27T12:00,2022,4,11.8,0.0,Cloudy
04/20/2022,20:00,40.70953,-73.7964,QUEENS,1.0,0.0,1,0,0,0,0,0,4520692,2022-04-20 20:00:00,2022-04-20T20:00,2022,4,6.0,0.0,Clear
04/19/2022,18:00,40.703854,-73.900024,QUEENS,0.0,0.0,0,0,0,0,0,0,4520798,2022-04-19 18:00:00,2022-04-19T18:00,2022,4,8.9,0.0,Clear
11/20/2022,0:00,40.710545,-73.76412,QUEENS,1.0,0.0,0,0,0,0,1,0,4583598,2022-11-20 00:00:00,2022-11-20T00:00,2022,11,2.3,0.0,Clear
06/05/2022,19:00,40.70958,-73.79626,QUEENS,1.0,0.0,0,0,0,0,1,0,4534912,2022-06-05 19:00:00,2022-06-05T19:00,2022,6,18.2,0.0,Cloudy
05/28/2022,14:00,40.68704,-73.780525,QUEENS,0.0,0.0,0,0,0,0,0,0,4532713,2022-05-28 14:00:00,2022-05-28T14:00,2022,5,21.3,1.2,Drizzle
08/30/2022,17:00,40.72229,-73.86732,QUEENS,1.0,0.0,0,0,0,0,1,0,4559969,2022-08-30 17:00:00,2022-08-30T17:00,2022,8,26.6,0.0,Clear
01/22/2022,0:00,40.658913,-73.75661,QUEENS,1.0,0.0,1,0,0,0,0,0,4496386,2022-01-22 00:00:00,2022-01-22T00:00,2022,1,-7.4,0.0,Cloudy
12/01/2022,0:00,40.707493,-73.796974,QUEENS,1.0,0.0,1,0,0,0,0,0,4590372,2022-12-01 00:00:00,2022-12-01T00:00,2022,12,4.7,0.0,Cloudy
06/21/2022,17:00,40.76774,-73.87999,QUEENS,1.0,0.0,0,0,1,0,0,0,4541573,2022-06-21 17:00:00,2022-06-21T17:00,2022,6,22.3,0.0,Cloudy
05/19/2022,17:00,40.74274,-73.89283,QUEENS,1.0,0.0,0,0,1,0,0,0,4529300,2022-05-19 17:00:00,2022-05-19T17:00,2022,5,21.1,0.0,Clear
11/14/2022,15:00,40.736362,-73.71284,QUEENS,1.0,0.0,0,0,0,0,1,0,4581914,2022-11-14 15:00:00,2022-11-14T15:00,2022,11,7.1,0.0,Clear
05/04/2022,7:00,40.71164,-73.83591,QUEENS,1.0,0.0,0,0,0,0,1,0,4526379,2022-05-04 07:00:00,2022-05-04T07:00,2022,5,10.6,0.2,Drizzle
12/27/2022,6:00,40.700737,-73.9042,QUEENS,1.0,0.0,0,0,0,0,0,0,4594736,2022-12-27 06:00:00,2022-12-27T06:00,2022,12,-4.6,0.0,Clear
04/11/2022,15:00,40.680164,-73.84095,QUEENS,1.0,0.0,1,0,0,0,0,0,4518194,2022-04-11 15:00:00,2022-04-11T15:00,2022,4,9.8,0.0,Cloudy
02/19/2022,8:00,40.71282,-73.90378,QUEENS,1.0,0.0,0,0,0,0,1,0,4504161,2022-02-19 08:00:00,2022-02-19T08:00,2022,2,-1.5,0.0,Clear
12/16/2022,16:00,40.68484,-73.83596,QUEENS,1.0,0.0,0,0,0,0,1,0,4591061,2022-12-16 16:00:00,2022-12-16T16:00,2022,12,4.7,0.7,Drizzle
07/02/2022,21:00,40.704155,-73.90752,QUEENS,2.0,0.0,0,0,0,0,2,0,4542993,2022-07-02 21:00:00,2022-07-02T21:00,2022,7,26.2,0.0,Cloudy
08/13/2022,19:00,40.687004,-73.82836,QUEENS,1.0,0.0,0,0,0,0,1,0,4555291,2022-08-13 19:00:00,2022-08-13T19:00,2022,8,22.4,0.0,Clear
01/19/2022,18:00,40.751526,-73.859184,QUEENS,1.0,0.0,0,0,1,0,0,0,4496041,2022-01-19 18:00:00,2022-01-19T18:00,2022,1,5.2,0.0,Cloudy
02/28/2022,16:00,40.779564,-73.90607,QUEENS,0.0,0.0,0,0,0,0,0,0,4506922,2022-02-28 16:00:00,2022-02-28T16:00,2022,2,1.6,0.0,Cloudy
09/17/2022,16:00,40.744026,-73.92616,QUEENS,1.0,0.0,0,0,0,0,1,0,4565193,2022-09-17 16:00:00,2022-09-17T16:00,2022,9,21.4,0.0,Clear
11/29/2022,16:00,40.675213,-73.7378,QUEENS,1.0,0.0,1,0,0,0,0,0,4586334,2022-11-29 16:00:00,2022-11-29T16:00,2022,11,4.8,0.0,Cloudy
04/27/2022,14:00,40.665245,-73.73709,QUEENS,1.0,0.0,0,0,0,0,1,0,4522631,2022-04-27 14:00:00,2022-04-27T14:00,2022,4,12.8,0.0,Cloudy
03/22/2022,10:00,40.714787,-73.74164,QUEENS,1.0,0.0,0,0,0,0,1,0,4512524,2022-03-22 10:00:00,2022-03-22T10:00,2022,3,9.0,0.0,Cloudy
07/18/2022,16:00,40.773373,-73.752205,QUEENS,0.0,0.0,0,0,0,0,0,0,4547228,2022-07-18 16:00:00,2022-07-18T16:00,2022,7,28.1,0.0,Cloudy
02/04/2022,17:00,40.75693,-73.77902,QUEENS,2.0,0.0,0,0,0,0,2,0,4499919,2022-02-04 17:00:00,2022-02-04T17:00,2022,2,-0.9,0.4,Drizzle
09/28/2022,8:00,40.750248,-73.75428,QUEENS,1.0,0.0,0,0,0,0,1,0,4574223,2022-09-28 08:00:00,2022-09-28T08:00,2022,9,14.0,0.0,Clear
10/28/2022,8:00,40.756176,-73.80173,QUEENS,2.0,0.0,2,0,0,0,0,0,4577083,2022-10-28 08:00:00,2022-10-28T08:00,2022,10,8.1,0.0,Cloudy
02/28/2022,9:00,40.752754,-73.89434,QUEENS,1.0,0.0,1,0,0,0,0,0,4506559,2022-02-28 09:00:00,2022-02-28T09:00,2022,2,-2.1,0.0,Clear
02/25/2022,12:00,40.74938,-73.88426,QUEENS,1.0,0.0,0,0,1,0,0,0,4505689,2022-02-25 12:00:00,2022-02-25T12:00,2022,2,2.7,0.0,Cloudy
01/06/2022,22:00,40.676113,-73.84883,QUEENS,4.0,0.0,0,0,0,0,4,0,4492594,2022-01-06 22:00:00,2022-01-06T22:00,2022,1,0.1,0.0,Cloudy
07/09/2022,3:00,40.74467,-73.8951,QUEENS,2.0,0.0,0,0,0,0,2,0,4545140,2022-07-09 03:00:00,2022-07-09T03:00,2022,7,21.8,0.0,Cloudy
02/01/2022,23:00,40.68083,-73.81034,QUEENS,0.0,0.0,0,0,0,0,0,0,4499503,2022-02-01 23:00:00,2022-02-01T23:00,2022,2,-1.1,0.0,Cloudy
10/06/2022,16:00,40.75529,-73.90847,QUEENS,2.0,0.0,2,0,0,0,0,0,4571016,2022-10-06 16:00:00,2022-10-06T16:00,2022,10,22.2,0.0,Clear
10/04/2022,18:00,40.741673,-73.895744,QUEENS,1.0,0.0,0,0,1,0,0,0,4570389,2022-10-04 18:00:00,2022-10-04T18:00,2022,10,13.3,4.4,Heavy Rain
10/24/2022,17:00,40.751743,-73.87333,QUEENS,0.0,0.0,0,0,0,0,0,0,4576668,2022-10-24 17:00:00,2022-10-24T17:00,2022,10,16.1,0.1,Drizzle
10/13/2022,12:00,40.72621,-73.920525,QUEENS,1.0,0.0,0,0,0,0,1,0,4574823,2022-10-13 12:00:00,2022-10-13T12:00,2022,10,20.4,0.0,Cloudy
03/02/2022,11:00,40.700462,-73.83593,QUEENS,0.0,0.0,0,0,0,0,0,0,4506934,2022-03-02 11:00:00,2022-03-02T11:00,2022,3,7.9,0.0,Clear
02/02/2022,16:00,40.705666,-73.818474,QUEENS,0.0,0.0,0,0,0,0,0,0,4499958,2022-02-02 16:00:00,2022-02-02T16:00,2022,2,4.3,0.0,Cloudy
05/06/2022,9:00,40.748913,-73.9374,QUEENS,2.0,0.0,0,0,0,0,2,0,4525506,2022-05-06 09:00:00,2022-05-06T09:00,2022,5,14.2,0.8,Drizzle
10/05/2022,0:00,40.74126,-73.92004,QUEENS,1.0,0.0,1,0,0,0,0,0,4570404,2022-10-05 00:00:00,2022-10-05T00:00,2022,10,13.0,6.3,Heavy Rain
03/19/2022,3:00,40.754776,-73.892815,QUEENS,1.0,0.0,0,0,0,0,1,0,4511548,2022-03-19 03:00:00,2022-03-19T03:00,2022,3,7.9,0.0,Cloudy
02/09/2022,22:00,40.709694,-73.79352,QUEENS,1.0,0.0,0,0,0,0,1,0,4501615,2022-02-09 22:00:00,2022-02-09T22:00,2022,2,2.3,0.0,Clear
12/28/2022,21:00,40.75868,-73.87552,QUEENS,1.0,0.0,0,0,0,0,1,0,4594410,2022-12-28 21:00:00,2022-12-28T21:00,2022,12,1.3,0.0,Cloudy
04/17/2022,14:00,40.763733,-73.9414,QUEENS,1.0,0.0,0,0,0,0,1,0,4519768,2022-04-17 14:00:00,2022-04-17T14:00,2022,4,10.0,0.0,Clear
05/11/2022,7:00,40.72469,-73.7541,QUEENS,1.0,0.0,1,0,0,0,0,0,4527862,2022-05-11 07:00:00,2022-05-11T07:00,2022,5,13.4,0.0,Cloudy
11/26/2022,18:00,40.748154,-73.87223,QUEENS,1.0,0.0,0,0,0,0,1,0,4585300,2022-11-26 18:00:00,2022-11-26T18:00,2022,11,7.9,0.0,Clear
01/13/2022,15:00,40.76485,-73.73543,QUEENS,2.0,0.0,0,0,0,0,2,0,4497410,2022-01-13 15:00:00,2022-01-13T15:00,2022,1,6.6,0.0,Cloudy
12/02/2022,23:00,40.744976,-73.748634,QUEENS,1.0,0.0,0,0,1,0,0,0,4586646,2022-12-02 23:00:00,2022-12-02T23:00,2022,12,5.5,0.0,Cloudy
03/11/2022,21:00,40.57741,-73.83713,QUEENS,1.0,0.0,1,0,0,0,0,0,4511356,2022-03-11 21:00:00,2022-03-11T21:00,2022,3,5.3,0.0,Clear
10/26/2022,14:00,40.6601,-73.73312,QUEENS,1.0,0.0,0,0,0,0,1,0,4576429,2022-10-26 14:00:00,2022-10-26T14:00,2022,10,20.4,0.0,Clear
10/17/2022,19:00,40.716354,-73.78419,QUEENS,0.0,0.0,0,0,0,0,0,0,4575308,2022-10-17 19:00:00,2022-10-17T19:00,2022,10,14.3,0.1,Drizzle
04/17/2022,20:00,40.767963,-73.91169,QUEENS,0.0,0.0,0,0,0,0,0,0,4521685,2022-04-17 20:00:00,2022-04-17T20:00,2022,4,5.4,0.0,Clear
07/04/2022,16:00,40.73093,-73.864586,QUEENS,1.0,0.0,0,0,0,0,1,0,4545411,2022-07-04 16:00:00,2022-07-04T16:00,2022,7,29.4,0.0,Clear
05/27/2022,0:00,40.68574,-73.82774,QUEENS,1.0,0.0,0,0,0,0,1,0,4532344,2022-05-27 00:00:00,2022-05-27T00:00,2022,5,15.8,0.0,Cloudy
02/15/2022,0:00,40.57799,-73.8354,QUEENS,1.0,0.0,0,0,0,0,1,0,4504982,2022-02-15 00:00:00,2022-02-15T00:00,2022,2,-9.7,0.0,Clear
01/16/2022,3:00,0.0,0.0,QUEENS,1.0,0.0,0,0,0,0,1,0,4495176,2022-01-16 03:00:00,2022-01-16T03:00,2022,1,26.2,0.0,Clear
01/04/2022,10:00,40.74163,-73.880714,QUEENS,0.0,0.0,0,0,0,0,0,0,4492015,2022-01-04 10:00:00,2022-01-04T10:00,2022,1,-3.9,0.0,Clear
11/07/2022,0:00,40.66504,-73.76218,QUEENS,0.0,0.0,0,0,0,0,0,0,4580686,2022-11-07 00:00:00,2022-11-07T00:00,2022,11,19.2,0.2,Drizzle
05/22/2022,23:00,40.746788,-73.827156,QUEENS,0.0,0.0,0,0,0,0,0,0,4530921,2022-05-22 23:00:00,2022-05-22T23:00,2022,5,21.3,0.0,Cloudy
11/14/2022,9:00,40.73563,-73.90096,QUEENS,1.0,0.0,0,0,1,0,0,0,4583170,2022-11-14 09:00:00,2022-11-14T09:00,2022,11,4.5,0.0,Clear
05/11/2022,9:00,40.66696,-73.77078,QUEENS,1.0,0.0,0,0,0,0,1,0,4526851,2022-05-11 09:00:00,2022-05-11T09:00,2022,5,15.7,0.0,Cloudy
09/23/2022,22:00,40.695255,-73.75554,QUEENS,1.0,0.0,0,0,0,0,1,0,4566990,2022-09-23 22:00:00,2022-09-23T22:00,2022,9,10.5,0.0,Clear
10/15/2022,6:00,40.77645,-73.90167,QUEENS,1.0,0.0,0,0,0,0,1,0,4574211,2022-10-15 06:00:00,2022-10-15T06:00,2022,10,10.2,0.0,Clear
08/28/2022,12:00,40.76437,-73.74749,QUEENS,1.0,0.0,0,0,1,0,0,0,4558982,2022-08-28 12:00:00,2022-08-28T12:00,2022,8,27.2,0.0,Cloudy
12/16/2022,9:00,40.719353,-73.815475,QUEENS,0.0,0.0,0,0,0,0,0,0,4599934,2022-12-16 09:00:00,2022-12-16T09:00,2022,12,6.1,0.3,Drizzle
11/13/2022,12:00,40.66537,-73.73254,QUEENS,2.0,0.0,0,0,0,0,2,0,4581192,2022-11-13 12:00:00,2022-11-13T12:00,2022,11,9.7,0.0,Cloudy
02/14/2022,22:00,40.67646,-73.80752,QUEENS,1.0,0.0,1,0,0,0,0,0,4502777,2022-02-14 22:00:00,2022-02-14T22:00,2022,2,-12.7,0.0,Clear
10/21/2022,0:00,40.702133,-73.78001,QUEENS,0.0,0.0,0,0,0,0,0,0,4575682,2022-10-21 00:00:00,2022-10-21T00:00,2022,10,10.7,0.0,Clear
06/06/2022,15:00,40.75793,-73.858376,QUEENS,0.0,0.0,0,0,0,0,0,0,4535876,2022-06-06 15:00:00,2022-06-06T15:00,2022,6,25.4,0.0,Cloudy
06/07/2022,19:00,40.740894,-73.70084,QUEENS,0.0,0.0,0,0,0,0,0,0,4535137,2022-06-07 19:00:00,2022-06-07T19:00,2022,6,19.2,0.0,Cloudy
03/26/2022,10:00,40.75868,-73.87552,QUEENS,0.0,0.0,0,0,0,0,0,0,4513519,2022-03-26 10:00:00,2022-03-26T10:00,2022,3,10.7,0.0,Cloudy
06/21/2022,20:00,40.601734,-73.74902,QUEENS,1.0,0.0,0,0,0,0,1,0,4539688,2022-06-21 20:00:00,2022-06-21T20:00,2022,6,18.9,0.0,Cloudy
09/09/2022,7:00,40.597103,-73.76994,QUEENS,1.0,0.0,1,0,0,0,0,0,4567941,2022-09-09 07:00:00,2022-09-09T07:00,2022,9,17.9,0.0,Clear
01/01/2022,8:00,40.75081,-73.89398,QUEENS,1.0,0.0,0,0,0,0,1,0,4491163,2022-01-01 08:00:00,2022-01-01T08:00,2022,1,9.8,0.6,Drizzle
07/27/2022,20:00,40.764053,-73.74443,QUEENS,1.0,0.0,0,0,0,0,1,0,4549911,2022-07-27 20:00:00,2022-07-27T20:00,2022,7,24.6,0.0,Cloudy
03/21/2022,19:00,40.695637,-73.80372,QUEENS,1.0,0.0,1,0,0,0,0,0,4515138,2022-03-21 19:00:00,2022-03-21T19:00,2022,3,11.4,0.0,Clear
11/01/2022,22:00,40.691433,-73.89063,QUEENS,3.0,0.0,0,0,0,0,3,0,4578114,2022-11-01 22:00:00,2022-11-01T22:00,2022,11,14.4,0.0,Clear
10/05/2022,14:00,40.660965,-73.7408,QUEENS,2.0,0.0,0,0,0,0,2,0,4570444,2022-10-05 14:00:00,2022-10-05T14:00,2022,10,17.0,0.0,Cloudy
09/25/2022,11:00,40.605152,-73.76374,QUEENS,0.0,0.0,0,0,0,0,0,0,4568589,2022-09-25 11:00:00,2022-09-25T11:00,2022,9,20.1,0.0,Cloudy
08/07/2022,18:00,40.737167,-73.740166,QUEENS,1.0,0.0,0,0,0,0,1,0,4554854,2022-08-07 18:00:00,2022-08-07T18:00,2022,8,28.3,0.0,Cloudy
09/02/2022,11:00,40.732002,-73.824524,QUEENS,0.0,0.0,0,0,0,0,0,0,4560376,2022-09-02 11:00:00,2022-09-02T11:00,2022,9,23.7,0.0,Clear
01/08/2022,15:00,40.72394,-73.77845,QUEENS,1.0,0.0,1,0,0,0,0,0,4492996,2022-01-08 15:00:00,2022-01-08T15:00,2022,1,-4.5,0.0,Clear
05/08/2022,12:00,40.713497,-73.758255,QUEENS,1.0,0.0,0,0,0,0,1,0,4525932,2022-05-08 12:00:00,2022-05-08T12:00,2022,5,11.1,0.0,Cloudy
07/04/2022,15:00,40.69168,-73.75127,QUEENS,1.0,0.0,0,0,0,0,1,0,4544073,2022-07-04 15:00:00,2022-07-04T15:00,2022,7,27.0,0.0,Clear
05/22/2022,20:00,40.746098,-73.866425,QUEENS,0.0,0.0,0,0,0,0,0,0,4531141,2022-05-22 20:00:00,2022-05-22T20:00,2022,5,24.3,0.0,Cloudy
02/07/2022,19:00,40.743103,-73.86751,QUEENS,1.0,0.0,0,0,1,0,0,0,4502793,2022-02-07 19:00:00,2022-02-07T19:00,2022,2,1.7,0.1,Drizzle
03/02/2022,0:00,40.72773,-73.90674,QUEENS,4.0,0.0,0,0,0,0,4,0,4507119,2022-03-02 00:00:00,2022-03-02T00:00,2022,3,5.6,0.0,Clear
05/13/2022,17:00,40.659843,-73.83521,QUEENS,1.0,0.0,0,0,1,0,0,0,4528098,2022-05-13 17:00:00,2022-05-13T17:00,2022,5,15.2,0.1,Drizzle
08/22/2022,0:00,40.76502,-73.829605,QUEENS,1.0,0.0,1,0,0,0,0,0,4557757,2022-08-22 00:00:00,2022-08-22T00:00,2022,8,22.9,0.0,Cloudy
04/29/2022,18:00,40.718277,-73.86358,QUEENS,1.0,0.0,0,0,0,0,1,0,4524806,2022-04-29 18:00:00,2022-04-29T18:00,2022,4,13.4,0.0,Clear
04/27/2022,17:00,40.663788,-73.734024,QUEENS,1.0,0.0,0,0,0,0,1,0,4522897,2022-04-27 17:00:00,2022-04-27T17:00,2022,4,10.9,0.0,Clear
11/29/2022,9:00,40.75518,-73.88889,QUEENS,0.0,0.0,0,0,0,0,0,0,4587325,2022-11-29 09:00:00,2022-11-29T09:00,2022,11,3.2,0.0,Cloudy
11/06/2022,5:00,40.761265,-73.9094,QUEENS,1.0,0.0,0,0,1,0,0,0,4580127,2022-11-06 05:00:00,2022-11-06T05:00,2022,11,17.9,0.0,Clear
11/07/2022,8:00,40.702873,-73.817055,QUEENS,1.0,0.0,1,0,0,0,0,0,4579721,2022-11-07 08:00:00,2022-11-07T08:00,2022,11,19.7,0.0,Clear
03/21/2022,20:00,40.75624,-73.87887,QUEENS,1.0,0.0,0,0,0,0,1,0,4513244,2022-03-21 20:00:00,2022-03-21T20:00,2022,3,8.9,0.0,Cloudy
11/20/2022,9:00,40.72706,-73.870636,QUEENS,0.0,0.0,0,0,0,0,0,0,4583968,2022-11-20 09:00:00,2022-11-20T09:00,2022,11,1.1,0.0,Clear
09/26/2022,16:00,40.75818,-73.933174,QUEENS,1.0,0.0,1,0,0,0,0,0,4568908,2022-09-26 16:00:00,2022-09-26T16:00,2022,9,23.0,0.0,Clear
05/16/2022,6:00,40.734863,-73.90662,QUEENS,0.0,0.0,0,0,0,0,0,0,4529298,2022-05-16 06:00:00,2022-05-16T06:00,2022,5,17.2,0.0,Clear
03/01/2022,0:00,40.73444,-73.72179,QUEENS,2.0,0.0,0,0,0,0,2,0,4506611,2022-03-01 00:00:00,2022-03-01T00:00,2022,3,-4.1,0.0,Cloudy
04/02/2022,2:00,40.75198,-73.882835,QUEENS,2.0,0.0,0,0,0,0,2,0,4515481,2022-04-02 02:00:00,2022-04-02T02:00,2022,4,2.4,0.0,Clear
06/24/2022,19:00,40.72145,-73.851944,QUEENS,1.0,0.0,0,0,0,0,1,0,4543833,2022-06-24 19:00:00,2022-06-24T19:00,2022,6,22.9,0.0,Clear
11/23/2022,19:00,40.740364,-73.85646,QUEENS,1.0,0.0,1,0,0,0,0,0,4586154,2022-11-23 19:00:00,2022-11-23T19:00,2022,11,5.5,0.0,Clear
03/07/2022,4:00,40.70476,-73.784424,QUEENS,1.0,0.0,0,0,0,0,1,0,4507982,2022-03-07 04:00:00,2022-03-07T04:00,2022,3,13.0,0.0,Cloudy
03/08/2022,7:00,40.66612,-73.82225,QUEENS,0.0,0.0,0,0,0,0,0,0,4508556,2022-03-08 07:00:00,2022-03-08T07:00,2022,3,3.6,0.0,Clear
11/25/2022,22:00,40.702286,-73.74592,QUEENS,1.0,0.0,0,0,0,0,1,0,4584586,2022-11-25 22:00:00,2022-11-25T22:00,2022,11,7.1,0.0,Clear
05/06/2022,17:00,40.66856,-73.75672,QUEENS,4.0,0.0,0,0,0,0,4,0,4525334,2022-05-06 17:00:00,2022-05-06T17:00,2022,5,11.6,1.9,Light Rain
03/14/2022,18:00,40.76514,-73.813675,QUEENS,1.0,0.0,1,0,0,0,0,0,4510212,2022-03-14 18:00:00,2022-03-14T18:00,2022,3,6.4,0.0,Cloudy
12/18/2022,7:00,40.72162,-73.77672,QUEENS,0.0,0.0,0,0,0,0,0,0,4591141,2022-12-18 07:00:00,2022-12-18T07:00,2022,12,-2.0,0.0,Clear
05/23/2022,23:00,40.756535,-73.876076,QUEENS,1.0,0.0,0,0,1,0,0,0,4530665,2022-05-23 23:00:00,2022-05-23T23:00,2022,5,16.3,0.0,Cloudy
11/12/2022,14:00,40.75811,-73.940865,QUEENS,0.0,0.0,0,0,0,0,0,0,4583243,2022-11-12 14:00:00,2022-11-12T14:00,2022,11,20.4,0.0,Clear
10/14/2022,12:00,40.680435,-73.731186,QUEENS,2.0,0.0,0,0,0,0,2,0,4572820,2022-10-14 12:00:00,2022-10-14T12:00,2022,10,16.5,0.0,Clear
06/23/2022,10:00,40.746887,-73.8347,QUEENS,1.0,0.0,0,0,0,0,1,0,4540129,2022-06-23 10:00:00,2022-06-23T10:00,2022,6,22.4,0.0,Cloudy
01/28/2022,12:00,40.767193,-73.93759,QUEENS,1.0,0.0,0,0,0,0,1,0,4499159,2022-01-28 12:00:00,2022-01-28T12:00,2022,1,-0.4,0.1,Light Snow
09/24/2022,6:00,40.704468,-73.814186,QUEENS,0.0,0.0,0,0,0,0,0,0,4568258,2022-09-24 06:00:00,2022-09-24T06:00,2022,9,9.4,0.0,Clear
10/18/2022,22:00,40.746048,-73.89903,QUEENS,1.0,0.0,0,0,0,0,0,0,4574039,2022-10-18 22:00:00,2022-10-18T22:00,2022,10,7.4,0.0,Clear
02/19/2022,8:00,40.69414,-73.902115,QUEENS,0.0,0.0,0,0,0,0,0,0,4505294,2022-02-19 08:00:00,2022-02-19T08:00,2022,2,-1.1,0.0,Clear
02/09/2022,0:00,40.697205,-73.81334,QUEENS,1.0,0.0,0,0,0,0,1,0,4501618,2022-02-09 00:00:00,2022-02-09T00:00,2022,2,-2.2,0.0,Clear
07/27/2022,14:00,40.7546,-73.93357,QUEENS,1.0,0.0,0,0,0,0,1,0,4550858,2022-07-27 14:00:00,2022-07-27T14:00,2022,7,29.4,0.0,Cloudy
08/25/2022,14:00,40.737137,-73.70923,QUEENS,1.0,0.0,0,0,0,0,1,0,4559278,2022-08-25 14:00:00,2022-08-25T14:00,2022,8,31.1,0.0,Cloudy
11/09/2022,18:00,40.768917,-73.888756,QUEENS,1.0,0.0,1,0,0,0,0,0,4581439,2022-11-09 18:00:00,2022-11-09T18:00,2022,11,7.5,0.0,Clear
09/23/2022,17:00,40.725475,-73.76559,QUEENS,2.0,0.0,0,0,0,0,2,0,4568641,2022-09-23 17:00:00,2022-09-23T17:00,2022,9,13.8,0.0,Clear
04/24/2022,13:00,40.76217,-73.87041,QUEENS,1.0,0.0,0,0,0,0,1,0,4529676,2022-04-24 13:00:00,2022-04-24T13:00,2022,4,14.3,0.0,Clear
09/11/2022,14:00,40.67472,-73.85839,QUEENS,1.0,0.0,0,0,0,0,1,0,4563037,2022-09-11 14:00:00,2022-09-11T14:00,2022,9,22.3,0.8,Drizzle
05/19/2022,15:00,40.760735,-73.842155,QUEENS,0.0,0.0,0,0,0,0,0,0,4531135,2022-05-19 15:00:00,2022-05-19T15:00,2022,5,18.5,0.0,Cloudy
06/02/2022,15:00,40.67279,-73.85692,QUEENS,1.0,0.0,1,0,0,0,0,0,4533648,2022-06-02 15:00:00,2022-06-02T15:00,2022,6,22.4,2.1,Light Rain
12/17/2022,3:00,40.74744,-73.885796,QUEENS,1.0,0.0,0,0,0,0,1,0,4590614,2022-12-17 03:00:00,2022-12-17T03:00,2022,12,3.0,0.0,Clear
05/15/2022,20:00,40.663574,-73.764694,QUEENS,3.0,0.0,0,0,0,0,3,0,4528918,2022-05-15 20:00:00,2022-05-15T20:00,2022,5,13.4,0.0,Cloudy
05/21/2022,12:00,40.749107,-73.878525,QUEENS,1.0,0.0,0,0,0,0,1,0,4532795,2022-05-21 12:00:00,2022-05-21T12:00,2022,5,31.0,0.0,Clear
04/06/2022,10:00,40.71135,-73.754875,QUEENS,1.0,0.0,0,0,0,0,1,0,4516775,2022-04-06 10:00:00,2022-04-06T10:00,2022,4,8.4,1.2,Drizzle
02/11/2022,18:00,40.75703,-73.938126,QUEENS,1.0,0.0,0,0,0,0,0,0,4502091,2022-02-11 18:00:00,2022-02-11T18:00,2022,2,6.8,0.0,Cloudy
05/27/2022,17:00,40.733498,-73.87038,QUEENS,1.0,0.0,0,0,1,0,0,0,4532122,2022-05-27 17:00:00,2022-05-27T17:00,2022,5,18.9,0.2,Drizzle
07/08/2022,15:00,40.748756,-73.7087,QUEENS,0.0,0.0,0,0,0,0,0,0,4544681,2022-07-08 15:00:00,2022-07-08T15:00,2022,7,26.2,0.0,Cloudy
08/12/2022,0:00,40.75705,-73.83395,QUEENS,0.0,0.0,0,0,0,0,0,0,4554903,2022-08-12 00:00:00,2022-08-12T00:00,2022,8,24.5,0.0,Cloudy
01/27/2022,10:00,40.721363,-73.84808,QUEENS,0.0,0.0,0,0,0,0,0,0,4497856,2022-01-27 10:00:00,2022-01-27T10:00,2022,1,-3.8,0.0,Clear
10/19/2022,16:00,40.747498,-73.853615,QUEENS,1.0,0.0,1,0,0,0,0,0,4575243,2022-10-19 16:00:00,2022-10-19T16:00,2022,10,11.7,0.0,Cloudy
12/01/2022,17:00,40.71033,-73.77073,QUEENS,1.0,0.0,0,0,1,0,0,0,4586535,2022-12-01 17:00:00,2022-12-01T17:00,2022,12,3.9,0.0,Clear
01/31/2022,8:00,40.65694,-73.76878,QUEENS,1.0,0.0,0,0,0,0,1,0,4498831,2022-01-31 08:00:00,2022-01-31T08:00,2022,1,-13.1,0.0,Cloudy
05/02/2022,9:00,40.67544,-73.78086,QUEENS,1.0,0.0,0,0,0,0,1,0,4524349,2022-05-02 09:00:00,2022-05-02T09:00,2022,5,11.9,0.1,Drizzle
09/15/2022,13:00,40.681313,-73.74373,QUEENS,1.0,0.0,0,0,0,0,1,0,4564340,2022-09-15 13:00:00,2022-09-15T13:00,2022,9,21.4,0.0,Clear
07/10/2022,1:00,40.599503,-73.754074,QUEENS,1.0,0.0,1,0,0,0,0,0,4545722,2022-07-10 01:00:00,2022-07-10T01:00,2022,7,20.4,0.0,Cloudy
11/09/2022,16:00,40.763878,-73.72672,QUEENS,2.0,0.0,2,0,0,0,0,0,4580393,2022-11-09 16:00:00,2022-11-09T16:00,2022,11,9.1,0.0,Clear
07/20/2022,13:00,40.68402,-73.82308,QUEENS,1.0,0.0,0,0,0,0,1,0,4547967,2022-07-20 13:00:00,2022-07-20T13:00,2022,7,31.5,0.0,Clear
04/30/2022,14:00,40.687332,-73.77967,QUEENS,0.0,0.0,0,0,0,0,0,0,4524350,2022-04-30 14:00:00,2022-04-30T14:00,2022,4,17.4,0.0,Clear
09/02/2022,15:00,40.71319,-73.91078,QUEENS,1.0,0.0,0,0,0,0,1,0,4561114,2022-09-02 15:00:00,2022-09-02T15:00,2022,9,25.3,0.0,Cloudy
02/24/2022,0:00,40.679787,-73.85256,QUEENS,1.0,0.0,0,0,0,0,1,0,4505403,2022-02-24 00:00:00,2022-02-24T00:00,2022,2,1.4,0.0,Cloudy
04/28/2022,17:00,40.702133,-73.80445,QUEENS,1.0,0.0,1,0,0,0,0,0,4522956,2022-04-28 17:00:00,2022-04-28T17:00,2022,4,11.4,0.0,Clear
08/04/2022,2:00,40.7608,-73.93915,QUEENS,1.0,0.0,0,0,1,0,0,0,4554709,2022-08-04 02:00:00,2022-08-04T02:00,2022,8,23.6,0.0,Clear
08/20/2022,7:00,40.75317,-73.82193,QUEENS,0.0,0.0,0,0,0,0,0,0,4556886,2022-08-20 07:00:00,2022-08-20T07:00,2022,8,25.0,0.0,Clear
08/03/2022,20:00,40.737526,-73.87725,QUEENS,1.0,0.0,1,0,0,0,0,0,4554576,2022-08-03 20:00:00,2022-08-03T20:00,2022,8,25.1,0.0,Clear
08/22/2022,14:00,40.66008,-73.774155,QUEENS,1.0,0.0,1,0,0,0,0,0,4557686,2022-08-22 14:00:00,2022-08-22T14:00,2022,8,24.1,0.1,Drizzle
01/14/2022,7:00,40.66985,-73.80064,QUEENS,0.0,0.0,0,0,0,0,0,0,4494557,2022-01-14 07:00:00,2022-01-14T07:00,2022,1,2.1,0.0,Cloudy
10/19/2022,15:00,40.755962,-73.7706,QUEENS,0.0,0.0,0,0,0,0,0,0,4574305,2022-10-19 15:00:00,2022-10-19T15:00,2022,10,12.0,0.0,Cloudy
12/31/2022,1:00,40.710117,-73.7705,QUEENS,2.0,0.0,0,0,0,0,2,0,4594531,2022-12-31 01:00:00,2022-12-31T01:00,2022,12,7.3,0.0,Cloudy
08/09/2022,23:00,40.75982,-73.88046,QUEENS,1.0,0.0,0,0,0,0,1,0,4554759,2022-08-09 23:00:00,2022-08-09T23:00,2022,8,28.0,0.0,Clear
01/08/2022,21:00,40.71025,-73.799866,QUEENS,2.0,0.0,0,0,0,0,2,0,4492960,2022-01-08 21:00:00,2022-01-08T21:00,2022,1,-5.0,0.0,Clear
09/13/2022,18:00,40.737335,-73.870415,QUEENS,1.0,0.0,1,0,0,0,0,0,4563880,2022-09-13 18:00:00,2022-09-13T18:00,2022,9,23.4,0.0,Clear
03/22/2022,8:00,40.66773,-73.81594,QUEENS,2.0,0.0,0,0,0,0,2,0,4512729,2022-03-22 08:00:00,2022-03-22T08:00,2022,3,7.5,0.0,Clear
08/11/2022,13:00,40.700657,-73.757965,QUEENS,1.0,0.0,0,0,0,0,1,0,4554749,2022-08-11 13:00:00,2022-08-11T13:00,2022,8,29.3,0.0,Cloudy
02/22/2022,13:00,40.76752,-73.92276,QUEENS,1.0,0.0,0,0,0,0,0,0,4505407,2022-02-22 13:00:00,2022-02-22T13:00,2022,2,13.5,0.0,Cloudy
08/06/2022,0:00,40.746296,-73.93041,QUEENS,1.0,0.0,0,0,0,0,1,0,4553648,2022-08-06 00:00:00,2022-08-06T00:00,2022,8,26.1,0.0,Cloudy
10/05/2022,16:00,40.60957,-73.81905,QUEENS,1.0,0.0,0,0,0,0,1,0,4570711,2022-10-05 16:00:00,2022-10-05T16:00,2022,10,15.8,0.0,Cloudy
06/14/2022,22:00,40.74831,-73.70954,QUEENS,1.0,0.0,0,0,0,0,1,0,4537334,2022-06-14 22:00:00,2022-06-14T22:00,2022,6,18.6,0.0,Clear
06/20/2022,19:00,40.76311,-73.86388,QUEENS,0.0,0.0,0,0,0,0,0,0,4539410,2022-06-20 19:00:00,2022-06-20T19:00,2022,6,24.7,0.0,Cloudy
11/17/2022,13:00,40.715973,-73.77111,QUEENS,2.0,0.0,0,0,0,0,2,0,4584510,2022-11-17 13:00:00,2022-11-17T13:00,2022,11,7.6,0.0,Clear
04/29/2022,15:00,40.702934,-73.75501,QUEENS,7.0,0.0,0,0,0,0,7,0,4523342,2022-04-29 15:00:00,2022-04-29T15:00,2022,4,15.3,0.0,Clear
03/07/2022,0:00,40.756493,-73.85881,QUEENS,1.0,0.0,0,0,0,0,1,0,4510070,2022-03-07 00:00:00,2022-03-07T00:00,2022,3,16.9,0.0,Cloudy
04/24/2022,5:00,40.743954,-73.87423,QUEENS,2.0,0.0,0,0,0,0,2,0,4521457,2022-04-24 05:00:00,2022-04-24T05:00,2022,4,7.2,0.0,Clear
08/27/2022,12:00,40.763126,-73.93972,QUEENS,3.0,0.0,0,0,0,0,3,0,4558783,2022-08-27 12:00:00,2022-08-27T12:00,2022,8,29.7,0.0,Clear
09/10/2022,15:00,40.764885,-73.8656,QUEENS,2.0,0.0,0,0,0,0,2,0,4564072,2022-09-10 15:00:00,2022-09-10T15:00,2022,9,26.7,0.0,Cloudy
11/02/2022,17:00,40.73675,-73.92821,QUEENS,1.0,0.0,0,0,0,0,1,0,4578378,2022-11-02 17:00:00,2022-11-02T17:00,2022,11,17.0,0.0,Clear
04/15/2022,22:00,40.692352,-73.762436,QUEENS,2.0,0.0,0,0,0,0,2,0,4520483,2022-04-15 22:00:00,2022-04-15T22:00,2022,4,12.3,0.0,Cloudy
07/31/2022,14:00,40.69278,-73.73833,QUEENS,0.0,0.0,0,0,0,0,0,0,4551023,2022-07-31 14:00:00,2022-07-31T14:00,2022,7,27.4,0.0,Cloudy
08/31/2022,23:00,40.66563,-73.73921,QUEENS,1.0,0.0,0,0,0,0,1,0,4560329,2022-08-31 23:00:00,2022-08-31T23:00,2022,8,22.5,0.0,Clear
11/16/2022,14:00,40.68958,-73.73594,QUEENS,1.0,0.0,0,0,0,0,1,0,4582481,2022-11-16 14:00:00,2022-11-16T14:00,2022,11,11.0,0.0,Cloudy
11/03/2022,23:00,40.678616,-73.78424,QUEENS,0.0,0.0,0,0,0,0,0,0,4580616,2022-11-03 23:00:00,2022-11-03T23:00,2022,11,11.2,0.0,Clear
02/06/2022,0:00,40.679005,-73.81259,QUEENS,1.0,0.0,0,0,0,0,1,0,4500496,2022-02-06 00:00:00,2022-02-06T00:00,2022,2,-7.3,0.0,Clear
07/18/2022,11:00,40.741863,-73.90751,QUEENS,3.0,0.0,0,0,0,0,3,0,4548345,2022-07-18 11:00:00,2022-07-18T11:00,2022,7,26.7,0.0,Cloudy
11/17/2022,10:00,40.68621,-73.816666,QUEENS,1.0,0.0,1,0,0,0,0,0,4582622,2022-11-17 10:00:00,2022-11-17T10:00,2022,11,5.2,0.0,Cloudy
10/24/2022,19:00,40.756485,-73.94005,QUEENS,1.0,0.0,0,0,0,0,1,0,4580163,2022-10-24 19:00:00,2022-10-24T19:00,2022,10,15.3,0.0,Cloudy
02/10/2022,13:00,40.73664,-73.86584,QUEENS,1.0,0.0,1,0,0,0,0,0,4501828,2022-02-10 13:00:00,2022-02-10T13:00,2022,2,11.2,0.0,Clear
09/20/2022,12:00,40.764347,-73.92347,QUEENS,0.0,0.0,0,0,0,0,0,0,4565722,2022-09-20 12:00:00,2022-09-20T12:00,2022,9,24.8,0.0,Clear
08/19/2022,10:00,40.746033,-73.93441,QUEENS,1.0,0.0,0,0,0,0,1,0,4556724,2022-08-19 10:00:00,2022-08-19T10:00,2022,8,29.1,0.0,Clear
12/18/2022,16:00,40.730255,-73.81192,QUEENS,0.0,0.0,0,0,0,0,0,0,4591143,2022-12-18 16:00:00,2022-12-18T16:00,2022,12,2.8,0.0,Clear
02/14/2022,0:00,40.73572,-73.93677,QUEENS,0.0,0.0,0,0,0,0,0,0,4504675,2022-02-14 00:00:00,2022-02-14T00:00,2022,2,-4.5,0.0,Cloudy
02/12/2022,21:00,40.706738,-73.80625,QUEENS,1.0,0.0,1,0,0,0,0,0,4505154,2022-02-12 21:00:00,2022-02-12T21:00,2022,2,7.3,0.0,Cloudy
04/21/2022,19:00,40.735897,-73.89781,QUEENS,2.0,0.0,0,0,0,0,2,0,4521218,2022-04-21 19:00:00,2022-04-21T19:00,2022,4,10.8,0.0,Cloudy
08/18/2022,18:00,40.708927,-73.77733,QUEENS,0.0,0.0,0,0,0,0,0,0,4556649,2022-08-18 18:00:00,2022-08-18T18:00,2022,8,25.6,0.0,Clear
03/21/2022,16:00,40.748062,-73.87976,QUEENS,1.0,0.0,1,0,0,0,0,0,4512387,2022-03-21 16:00:00,2022-03-21T16:00,2022,3,15.3,0.0,Clear
06/11/2022,20:00,40.744938,-73.90959,QUEENS,1.0,0.0,0,0,0,0,0,0,4536895,2022-06-11 20:00:00,2022-06-11T20:00,2022,6,20.1,0.0,Cloudy
07/04/2022,5:00,40.685017,-73.84336,QUEENS,0.0,0.0,0,0,0,0,0,0,4543501,2022-07-04 05:00:00,2022-07-04T05:00,2022,7,17.4,0.0,Clear
10/08/2022,14:00,40.728184,-73.86631,QUEENS,1.0,0.0,1,0,0,0,0,0,4571175,2022-10-08 14:00:00,2022-10-08T14:00,2022,10,14.4,0.0,Clear
11/12/2022,12:00,40.69598,-73.77793,QUEENS,1.0,0.0,0,0,0,0,1,0,4581020,2022-11-12 12:00:00,2022-11-12T12:00,2022,11,20.3,0.0,Clear
08/30/2022,16:00,40.748863,-73.892715,QUEENS,1.0,0.0,0,0,0,0,0,0,4560580,2022-08-30 16:00:00,2022-08-30T16:00,2022,8,27.7,0.0,Cloudy
07/24/2022,8:00,40.753284,-73.92049,QUEENS,1.0,0.0,0,0,0,0,1,0,4551619,2022-07-24 08:00:00,2022-07-24T08:00,2022,7,29.4,0.0,Cloudy
06/09/2022,13:00,40.717648,-73.76665,QUEENS,2.0,0.0,0,0,0,0,2,0,4535783,2022-06-09 13:00:00,2022-06-09T13:00,2022,6,28.6,0.0,Clear
06/20/2022,13:00,40.738,-73.883865,QUEENS,1.0,0.0,0,0,0,0,1,0,4539334,2022-06-20 13:00:00,2022-06-20T13:00,2022,6,26.5,0.0,Clear
05/13/2022,15:00,40.688656,-73.760704,QUEENS,1.0,0.0,1,0,0,0,0,0,4527558,2022-05-13 15:00:00,2022-05-13T15:00,2022,5,17.3,0.4,Drizzle
03/11/2022,0:00,40.75462,-73.82167,QUEENS,0.0,0.0,0,0,0,0,0,0,4509538,2022-03-11 00:00:00,2022-03-11T00:00,2022,3,0.4,0.0,Clear
11/21/2022,0:00,40.670776,-73.84788,QUEENS,0.0,0.0,0,0,0,0,0,0,4583248,2022-11-21 00:00:00,2022-11-21T00:00,2022,11,-2.0,0.0,Clear
02/17/2022,11:00,40.75036,-73.878586,QUEENS,1.0,0.0,0,0,0,0,0,0,4503572,2022-02-17 11:00:00,2022-02-17T11:00,2022,2,15.4,0.0,Cloudy
12/03/2022,10:00,40.75077,-73.85544,QUEENS,0.0,0.0,0,0,0,0,0,0,4586833,2022-12-03 10:00:00,2022-12-03T10:00,2022,12,12.1,0.9,Drizzle
02/03/2022,21:00,40.706684,-73.79915,QUEENS,1.0,0.0,1,0,0,0,0,0,4499763,2022-02-03 21:00:00,2022-02-03T21:00,2022,2,9.1,1.1,Drizzle
08/28/2022,18:00,40.762745,-73.83329,QUEENS,1.0,0.0,0,0,0,0,1,0,4559099,2022-08-28 18:00:00,2022-08-28T18:00,2022,8,24.0,0.0,Cloudy
12/15/2022,10:00,40.74961,-73.95106,QUEENS,1.0,0.0,0,0,0,0,1,0,4590430,2022-12-15 10:00:00,2022-12-15T10:00,2022,12,3.4,0.0,Cloudy
05/18/2022,18:00,40.756046,-73.81307,QUEENS,1.0,0.0,0,0,1,0,0,0,4529006,2022-05-18 18:00:00,2022-05-18T18:00,2022,5,15.8,0.0,Cloudy
03/05/2022,7:00,40.67751,-73.81085,QUEENS,0.0,0.0,0,0,0,0,0,0,4507926,2022-03-05 07:00:00,2022-03-05T07:00,2022,3,-1.9,0.0,Cloudy
10/29/2022,14:00,40.675144,-73.73757,QUEENS,1.0,0.0,0,0,0,0,1,0,4577061,2022-10-29 14:00:00,2022-10-29T14:00,2022,10,14.0,0.0,Clear
05/05/2022,16:00,40.686512,-73.730484,QUEENS,3.0,0.0,0,0,0,0,3,0,4525048,2022-05-05 16:00:00,2022-05-05T16:00,2022,5,17.3,0.0,Cloudy
05/03/2022,18:00,0.0,0.0,QUEENS,1.0,0.0,0,0,0,0,1,0,4524468,2022-05-03 18:00:00,2022-05-03T18:00,2022,5,27.5,0.0,Cloudy
11/24/2022,19:00,40.76041,-73.87485,QUEENS,1.0,0.0,0,0,0,0,1,0,4585356,2022-11-24 19:00:00,2022-11-24T19:00,2022,11,7.3,0.0,Cloudy
11/22/2022,0:00,40.742973,-73.814316,QUEENS,1.0,0.0,0,0,1,0,0,0,4583988,2022-11-22 00:00:00,2022-11-22T00:00,2022,11,3.4,0.0,Clear
11/27/2022,14:00,40.758057,-73.800545,QUEENS,1.0,0.0,0,0,0,0,1,0,4585082,2022-11-27 14:00:00,2022-11-27T14:00,2022,11,10.7,1.0,Drizzle
11/05/2022,18:00,40.78566,-73.855095,QUEENS,0.0,0.0,0,0,0,0,0,0,4579481,2022-11-05 18:00:00,2022-11-05T18:00,2022,11,18.0,0.0,Clear
02/12/2022,18:00,0.0,0.0,QUEENS,1.0,0.0,0,0,0,0,1,0,4502435,2022-02-12 18:00:00,2022-02-12T18:00,2022,2,27.0,0.0,Clear
06/17/2022,12:00,40.69096,-73.7898,QUEENS,1.0,0.0,1,0,0,0,0,0,4538288,2022-06-17 12:00:00,2022-06-17T12:00,2022,6,31.9,0.0,Clear
09/09/2022,12:00,40.706017,-73.89896,QUEENS,1.0,0.0,0,0,1,0,0,0,4562552,2022-09-09 12:00:00,2022-09-09T12:00,2022,9,24.9,0.0,Clear
11/28/2022,15:00,40.68636,-73.810036,QUEENS,3.0,0.0,0,0,0,0,3,0,4585548,2022-11-28 15:00:00,2022-11-28T15:00,2022,11,10.4,0.0,Cloudy
05/21/2022,17:00,40.5893,-73.810936,QUEENS,3.0,0.0,0,0,0,0,3,0,4531420,2022-05-21 17:00:00,2022-05-21T17:00,2022,5,24.5,0.0,Clear
02/25/2022,2:00,40.60298,-73.766556,QUEENS,0.0,0.0,0,0,0,0,0,0,4506167,2022-02-25 02:00:00,2022-02-25T02:00,2022,2,0.8,1.3,Light Rain
09/28/2022,12:00,40.749096,-73.863,QUEENS,1.0,0.0,1,0,0,0,0,0,4568428,2022-09-28 12:00:00,2022-09-28T12:00,2022,9,20.7,0.0,Cloudy
09/03/2022,10:00,40.74762,-73.94099,QUEENS,1.0,0.0,0,0,1,0,0,0,4560679,2022-09-03 10:00:00,2022-09-03T10:00,2022,9,24.8,0.0,Clear
10/10/2022,20:00,40.710182,-73.908485,QUEENS,1.0,0.0,1,0,0,0,0,0,4572072,2022-10-10 20:00:00,2022-10-10T20:00,2022,10,13.8,0.0,Clear
10/31/2022,4:00,40.693497,-73.73491,QUEENS,1.0,0.0,0,0,0,0,1,0,4577482,2022-10-31 04:00:00,2022-10-31T04:00,2022,10,12.7,0.0,Cloudy
10/03/2022,6:00,40.679005,-73.819595,QUEENS,0.0,0.0,0,0,0,0,0,0,4569815,2022-10-03 06:00:00,2022-10-03T06:00,2022,10,10.5,0.0,Cloudy
11/22/2022,14:00,40.72641,-73.90604,QUEENS,4.0,0.0,0,0,0,0,4,0,4585044,2022-11-22 14:00:00,2022-11-22T14:00,2022,11,8.8,0.0,Clear
06/12/2022,1:00,40.679638,-73.8373,QUEENS,0.0,0.0,0,0,0,0,0,0,4537552,2022-06-12 01:00:00,2022-06-12T01:00,2022,6,17.5,0.0,Cloudy
12/31/2022,4:00,40.71886,-73.78935,QUEENS,1.0,0.0,0,0,0,0,1,0,4594177,2022-12-31 04:00:00,2022-12-31T04:00,2022,12,7.0,0.1,Drizzle
11/20/2022,20:00,40.692314,-73.88268,QUEENS,0.0,0.0,0,0,0,0,0,0,4585043,2022-11-20 20:00:00,2022-11-20T20:00,2022,11,-1.1,0.0,Clear
10/21/2022,0:00,40.70127,-73.79001,QUEENS,2.0,0.0,0,0,0,0,2,0,4575718,2022-10-21 00:00:00,2022-10-21T00:00,2022,10,10.7,0.0,Clear
06/02/2022,14:00,40.76477,-73.7949,QUEENS,1.0,0.0,0,0,0,0,1,0,4533749,2022-06-02 14:00:00,2022-06-02T14:00,2022,6,25.8,0.1,Drizzle
11/24/2022,0:00,40.70942,-73.7749,QUEENS,1.0,0.0,0,0,0,0,1,0,4584516,2022-11-24 00:00:00,2022-11-24T00:00,2022,11,2.7,0.0,Clear
07/19/2022,13:00,40.740402,-73.88213,QUEENS,1.0,0.0,0,0,1,0,0,0,4547906,2022-07-19 13:00:00,2022-07-19T13:00,2022,7,32.3,0.0,Clear
09/25/2022,13:00,40.752235,-73.86293,QUEENS,1.0,0.0,0,0,0,0,1,0,4568901,2022-09-25 13:00:00,2022-09-25T13:00,2022,9,21.3,0.0,Cloudy
07/23/2022,9:00,40.749825,-73.818275,QUEENS,0.0,0.0,0,0,0,0,0,0,4549539,2022-07-23 09:00:00,2022-07-23T09:00,2022,7,31.1,0.0,Clear
06/25/2022,22:00,40.7366,-73.856674,QUEENS,1.0,0.0,0,0,0,0,1,0,4540853,2022-06-25 22:00:00,2022-06-25T22:00,2022,6,22.8,0.0,Clear
01/07/2022,7:00,40.70967,-73.77404,QUEENS,0.0,0.0,0,0,0,0,0,0,4492731,2022-01-07 07:00:00,2022-01-07T07:00,2022,1,-1.6,1.5,Heavy Snow
09/11/2022,16:00,40.558655,-74.11478,STATEN ISLAND,1.0,0.0,0,0,1,0,0,0,4566637,2022-09-11 16:00:00,2022-09-11T16:00,2022,9,20.9,2.9,Heavy Rain
12/06/2022,17:00,40.638145,-74.07986,STATEN ISLAND,1.0,0.0,1,0,0,0,0,0,4588636,2022-12-06 17:00:00,2022-12-06T17:00,2022,12,11.3,1.7,Light Rain
12/16/2022,15:00,40.628544,-74.07648,STATEN ISLAND,1.0,0.0,1,0,0,0,0,0,4591865,2022-12-16 15:00:00,2022-12-16T15:00,2022,12,4.9,1.4,Light Rain
08/17/2022,10:00,40.56296,-74.17541,STATEN ISLAND,1.0,0.0,0,0,0,0,1,0,4556489,2022-08-17 10:00:00,2022-08-17T10:00,2022,8,24.1,0.0,Cloudy
04/13/2022,18:00,40.545395,-74.16575,STATEN ISLAND,1.0,0.0,1,0,0,0,0,0,4518779,2022-04-13 18:00:00,2022-04-13T18:00,2022,4,19.5,0.0,Cloudy
09/23/2022,21:00,40.61789,-74.084045,STATEN ISLAND,0.0,0.0,0,0,0,0,0,0,4567392,2022-09-23 21:00:00,2022-09-23T21:00,2022,9,11.5,0.0,Clear
07/31/2022,13:00,40.61106,-74.086006,STATEN ISLAND,1.0,0.0,0,0,0,0,1,0,4551601,2022-07-31 13:00:00,2022-07-31T13:00,2022,7,26.6,0.0,Cloudy
11/24/2022,10:00,40.618237,-74.10517,STATEN ISLAND,0.0,0.0,0,0,0,0,0,0,4585094,2022-11-24 10:00:00,2022-11-24T10:00,2022,11,6.6,0.0,Clear
12/28/2022,22:00,40.561584,-74.13397,STATEN ISLAND,1.0,0.0,0,0,0,0,1,0,4595139,2022-12-28 22:00:00,2022-12-28T22:00,2022,12,1.8,0.0,Cloudy
11/19/2022,6:00,40.634197,-74.099884,STATEN ISLAND,1.0,0.0,0,0,0,0,1,0,4583440,2022-11-19 06:00:00,2022-11-19T06:00,2022,11,-2.7,0.0,Clear
09/03/2022,17:00,40.57925,-74.07781,STATEN ISLAND,0.0,0.0,0,0,0,0,0,0,4561069,2022-09-03 17:00:00,2022-09-03T17:00,2022,9,23.2,0.0,Cloudy
03/10/2022,16:00,40.58653,-74.09593,STATEN ISLAND,0.0,0.0,0,0,0,0,0,0,4510481,2022-03-10 16:00:00,2022-03-10T16:00,2022,3,6.9,0.0,Cloudy
04/18/2022,16:00,40.60415,-74.091156,STATEN ISLAND,1.0,0.0,0,0,0,0,1,0,4520160,2022-04-18 16:00:00,2022-04-18T16:00,2022,4,7.6,0.0,Cloudy
01/20/2022,23:00,40.626816,-74.074135,STATEN ISLAND,0.0,0.0,0,0,0,0,0,0,4496878,2022-01-20 23:00:00,2022-01-20T23:00,2022,1,-5.4,0.0,Cloudy
05/17/2022,18:00,40.634277,-74.0863,STATEN ISLAND,1.0,0.0,0,0,0,0,1,0,4529885,2022-05-17 18:00:00,2022-05-17T18:00,2022,5,20.5,0.0,Clear
10/14/2022,6:00,40.618294,-74.13136,STATEN ISLAND,0.0,1.0,0,1,0,0,0,0,4574548,2022-10-14 06:00:00,2022-10-14T06:00,2022,10,12.1,0.0,Clear
11/15/2022,9:00,40.610424,-74.130035,STATEN ISLAND,1.0,0.0,0,0,0,0,1,0,4582162,2022-11-15 09:00:00,2022-11-15T09:00,2022,11,4.2,0.0,Cloudy
01/05/2022,11:00,40.636692,-74.085884,STATEN ISLAND,4.0,0.0,0,0,0,0,4,0,4493565,2022-01-05 11:00:00,2022-01-05T11:00,2022,1,3.3,0.1,Drizzle
01/07/2022,11:00,40.555454,-74.16389,STATEN ISLAND,1.0,0.0,0,0,0,0,1,0,4492724,2022-01-07 11:00:00,2022-01-07T11:00,2022,1,-0.3,0.0,Clear
12/15/2022,18:00,40.56527,-74.134605,STATEN ISLAND,1.0,0.0,1,0,0,0,0,0,4590484,2022-12-15 18:00:00,2022-12-15T18:00,2022,12,6.0,1.7,Light Rain
03/15/2022,1:00,40.634075,-74.12308,STATEN ISLAND,4.0,0.0,0,0,0,0,4,0,4515800,2022-03-15 01:00:00,2022-03-15T01:00,2022,3,5.8,0.0,Cloudy
09/09/2022,7:00,40.55198,-74.15673,STATEN ISLAND,1.0,0.0,1,0,0,0,0,0,4563574,2022-09-09 07:00:00,2022-09-09T07:00,2022,9,18.3,0.0,Clear
07/25/2022,10:00,40.630978,-74.07786,STATEN ISLAND,1.0,0.0,0,0,0,0,1,0,4549916,2022-07-25 10:00:00,2022-07-25T10:00,2022,7,31.6,0.0,Cloudy
10/08/2022,4:00,40.539837,-74.19577,STATEN ISLAND,0.0,0.0,0,0,0,0,0,0,4574568,2022-10-08 04:00:00,2022-10-08T04:00,2022,10,11.3,0.0,Cloudy
09/30/2022,15:00,40.57961,-74.09883,STATEN ISLAND,1.0,0.0,0,0,1,0,0,0,4568927,2022-09-30 15:00:00,2022-09-30T15:00,2022,9,17.2,0.0,Cloudy
09/23/2022,15:00,40.625523,-74.09229,STATEN ISLAND,1.0,0.0,0,0,0,0,1,0,4567393,2022-09-23 15:00:00,2022-09-23T15:00,2022,9,15.7,0.0,Clear
08/08/2022,23:00,40.58524,-74.093414,STATEN ISLAND,2.0,0.0,0,0,0,0,2,0,4553937,2022-08-08 23:00:00,2022-08-08T23:00,2022,8,28.9,0.0,Clear
11/08/2022,15:00,40.602135,-74.114876,STATEN ISLAND,1.0,0.0,0,0,0,0,1,0,4581976,2022-11-08 15:00:00,2022-11-08T15:00,2022,11,13.2,0.0,Clear
01/14/2022,12:00,40.59183,-74.10098,STATEN ISLAND,1.0,0.0,0,0,0,0,1,0,4494660,2022-01-14 12:00:00,2022-01-14T12:00,2022,1,5.3,0.0,Cloudy
03/24/2022,10:00,40.641994,-74.07886,STATEN ISLAND,0.0,0.0,0,0,0,0,0,0,4515163,2022-03-24 10:00:00,2022-03-24T10:00,2022,3,6.9,0.9,Drizzle
08/13/2022,16:00,40.636623,-74.08179,STATEN ISLAND,1.0,0.0,0,0,0,0,1,0,4557317,2022-08-13 16:00:00,2022-08-13T16:00,2022,8,27.8,0.0,Clear
05/03/2022,8:00,40.635204,-74.08931,STATEN ISLAND,0.0,0.0,0,0,0,0,0,0,4525207,2022-05-03 08:00:00,2022-05-03T08:00,2022,5,13.0,0.0,Clear
06/06/2022,12:00,40.536915,-74.22502,STATEN ISLAND,2.0,0.0,0,0,0,0,2,0,4535615,2022-06-06 12:00:00,2022-06-06T12:00,2022,6,25.6,0.0,Clear
11/13/2022,16:00,40.606865,-74.08805,STATEN ISLAND,2.0,0.0,0,0,0,0,2,0,4582508,2022-11-13 16:00:00,2022-11-13T16:00,2022,11,10.7,0.0,Cloudy
09/03/2022,16:00,40.57322,-74.106995,STATEN ISLAND,2.0,0.0,0,0,0,0,2,0,4561460,2022-09-03 16:00:00,2022-09-03T16:00,2022,9,23.8,0.0,Cloudy
02/18/2022,11:00,40.628048,-74.12692,STATEN ISLAND,2.0,0.0,0,0,0,0,2,0,4503793,2022-02-18 11:00:00,2022-02-18T11:00,2022,2,4.6,0.0,Clear
03/07/2022,10:00,40.646442,-74.07884,STATEN ISLAND,13.0,0.0,0,0,0,0,13,0,4508149,2022-03-07 10:00:00,2022-03-07T10:00,2022,3,19.3,0.0,Cloudy
06/21/2022,17:00,40.541744,-74.207,STATEN ISLAND,1.0,0.0,0,0,0,0,1,0,4541933,2022-06-21 17:00:00,2022-06-21T17:00,2022,6,20.3,0.1,Drizzle
06/02/2022,14:00,40.58479,-74.0885,STATEN ISLAND,1.0,0.0,0,0,0,0,1,0,4534140,2022-06-02 14:00:00,2022-06-02T14:00,2022,6,22.9,0.0,Cloudy
07/28/2022,15:00,40.62016,-74.076965,STATEN ISLAND,1.0,0.0,0,0,0,0,1,0,4555768,2022-07-28 15:00:00,2022-07-28T15:00,2022,7,27.9,0.0,Cloudy
07/26/2022,13:00,40.61701,-74.0718,STATEN ISLAND,0.0,0.0,0,0,0,0,0,0,4549923,2022-07-26 13:00:00,2022-07-26T13:00,2022,7,27.0,0.0,Cloudy
08/04/2022,17:00,40.617397,-74.08487,STATEN ISLAND,0.0,0.0,0,0,0,0,0,0,4557312,2022-08-04 17:00:00,2022-08-04T17:00,2022,8,29.7,0.0,Clear
12/31/2022,22:00,40.615112,-74.08185,STATEN ISLAND,0.0,0.0,0,0,0,0,0,0,4594324,2022-12-31 22:00:00,2022-12-31T22:00,2022,12,11.2,2.0,Light Rain
08/22/2022,21:00,40.57761,-74.11188,STATEN ISLAND,1.0,0.0,0,0,0,0,1,0,4557679,2022-08-22 21:00:00,2022-08-22T21:00,2022,8,21.9,0.2,Drizzle
