CRASH DATE,CRASH TIME,LATITUDE,LONGITUDE,BOROUGH,NUMBER OF PERSONS INJURED,NUMBER OF PERSONS KILLED,NUMBER OF PEDESTRIANS INJURED,NUMBER OF PEDESTRIANS KILLED,NUMBER OF CYCLIST INJURED,NUMBER OF CYCLIST KILLED,NUMBER OF MOTORIST INJURED,NUMBER OF MOTORIST KILLED,COLLISION_ID,datetime,iso_datetime,year,month,temperature,precipitation,weather_condition
10/08/2025,8:00,40.844193,-73.82978,BRONX,1.0,0.0,0,0,0,0,1,0,4849394,2025-10-08 08:00:00,2025-10-08T08:00,2025,10,19.0,1.1,Drizzle
06/28/2025,15:00,40.82842,-73.86067,BRONX,1.0,0.0,0,0,1,0,0,0,4824123,2025-06-28 15:00:00,2025-06-28T15:00,2025,6,29.6,0.0,Cloudy
01/28/2025,8:00,40.82851,-73.88011,BRONX,1.0,0.0,1,0,0,0,0,0,4789239,2025-01-28 08:00:00,2025-01-28T08:00,2025,1,2.2,0.0,Clear
06/30/2025,18:00,40.80968,-73.90306,BRONX,1.0,0.0,0,0,0,0,1,0,4826394,2025-06-30 18:00:00,2025-06-30T18:00,2025,6,29.9,0.0,Cloudy
10/16/2025,17:00,40.82969,-73.825294,BRONX,1.0,0.0,0,0,0,0,1,0,4852765,2025-10-16 17:00:00,2025-10-16T17:00,2025,10,12.6,0.0,Clear
07/01/2025,5:00,40.807705,-73.92954,BRONX,1.0,0.0,0,0,0,0,1,0,4824979,2025-07-01 05:00:00,2025-07-01T05:00,2025,7,24.9,0.0,Cloudy
03/05/2025,15:00,40.83472,-73.9112,BRONX,1.0,0.0,0,0,0,0,1,0,4796585,2025-03-05 15:00:00,2025-03-05T15:00,2025,3,11.7,0.0,Cloudy
01/29/2025,5:00,40.865128,-73.83887,BRONX,0.0,0.0,0,0,0,0,0,0,4790939,2025-01-29 05:00:00,2025-01-29T05:00,2025,1,2.6,0.0,Clear
08/25/2025,0:00,40.895752,-73.864914,BRONX,1.0,0.0,0,0,0,0,1,0,4837481,2025-08-25 00:00:00,2025-08-25T00:00,2025,8,21.5,0.0,Cloudy
01/28/2025,12:00,40.819748,-73.891594,BRONX,0.0,0.0,0,0,0,0,0,0,4788917,2025-01-28 12:00:00,2025-01-28T12:00,2025,1,3.5,0.0,Cloudy
06/02/2025,0:00,40.855995,-73.844215,BRONX,1.0,0.0,0,0,0,0,1,0,4817589,2025-06-02 00:00:00,2025-06-02T00:00,2025,6,12.1,0.0,Clear
10/02/2025,12:00,40.882633,-73.83951,BRONX,2.0,0.0,0,0,0,0,2,0,4851443,2025-10-02 12:00:00,2025-10-02T12:00,2025,10,17.7,0.0,Cloudy
02/15/2025,19:00,40.819057,-73.92922,BRONX,1.0,0.0,0,0,0,0,1,0,4793486,2025-02-15 19:00:00,2025-02-15T19:00,2025,2,0.8,0.6,Heavy Snow
03/09/2025,17:00,40.822716,-73.90314,BRONX,1.0,0.0,1,0,0,0,0,0,4797419,2025-03-09 17:00:00,2025-03-09T17:00,2025,3,9.7,0.0,Clear
01/29/2025,8:00,40.825554,-73.84325,BRONX,1.0,0.0,0,0,0,0,0,0,4790314,2025-01-29 08:00:00,2025-01-29T08:00,2025,1,2.9,0.0,Cloudy
03/30/2025,8:00,40.85934,-73.83103,BRONX,0.0,0.0,0,0,0,0,0,0,4802164,2025-03-30 08:00:00,2025-03-30T08:00,2025,3,6.0,0.0,Cloudy
04/03/2025,7:00,40.867805,-73.8625,BRONX,1.0,0.0,1,0,0,0,0,0,4804430,2025-04-03 07:00:00,2025-04-03T07:00,2025,4,12.1,0.0,Cloudy
05/10/2025,0:00,40.849236,-73.862785,BRONX,1.0,0.0,0,0,0,0,0,0,4811904,2025-05-10 00:00:00,2025-05-10T00:00,2025,5,11.6,0.0,Cloudy
08/11/2025,5:00,0.0,0.0,BRONX,0.0,0.0,0,0,0,0,0,0,4835137,2025-08-11 05:00:00,2025-08-11T05:00,2025,8,22.5,0.0,Clear
01/29/2025,13:00,40.846973,-73.900085,BRONX,0.0,0.0,0,0,0,0,0,0,4789220,2025-01-29 13:00:00,2025-01-29T13:00,2025,1,8.6,0.0,Cloudy
05/29/2025,18:00,40.868282,-73.90107,BRONX,1.0,0.0,0,0,0,0,1,0,4816870,2025-05-29 18:00:00,2025-05-29T18:00,2025,5,20.2,0.0,Cloudy
04/26/2025,0:00,40.807705,-73.92954,BRONX,2.0,0.0,0,0,0,0,2,0,4808671,2025-04-26 00:00:00,2025-04-26T00:00,2025,4,15.8,0.0,Cloudy
04/10/2025,14:00,40.845596,-73.86433,BRONX,3.0,0.0,0,0,0,0,3,0,4806040,2025-04-10 14:00:00,2025-04-10T14:00,2025,4,7.6,0.0,Cloudy
04/10/2025,14:00,0.0,0.0,BRONX,1.0,0.0,1,0,0,0,0,0,4806127,2025-04-10 14:00:00,2025-04-10T14:00,2025,4,28.2,0.0,Cloudy
09/30/2025,0:00,40.86275,-73.90493,BRONX,2.0,0.0,0,0,0,0,2,0,4846710,2025-09-30 00:00:00,2025-09-30T00:00,2025,9,18.1,0.0,Cloudy
06/06/2025,3:00,40.846313,-73.84798,BRONX,0.0,0.0,0,0,0,0,0,0,4818285,2025-06-06 03:00:00,2025-06-06T03:00,2025,6,22.7,0.0,Cloudy
02/11/2025,15:00,40.825848,-73.90992,BRONX,1.0,0.0,1,0,0,0,0,0,4792458,2025-02-11 15:00:00,2025-02-11T15:00,2025,2,-0.2,0.0,Cloudy
03/31/2025,18:00,40.823936,-73.91724,BRONX,0.0,0.0,0,0,0,0,0,0,4803997,2025-03-31 18:00:00,2025-03-31T18:00,2025,3,16.5,3.4,Heavy Rain
09/11/2025,7:00,40.87911,-73.84325,BRONX,0.0,0.0,0,0,0,0,0,0,4842007,2025-09-11 07:00:00,2025-09-11T07:00,2025,9,16.8,0.0,Clear
01/22/2025,9:00,40.833546,-73.8963,BRONX,1.0,0.0,0,0,0,0,1,0,4787980,2025-01-22 09:00:00,2025-01-22T09:00,2025,1,-12.8,0.0,Clear
02/09/2025,10:00,40.824207,-73.85879,BRONX,0.0,0.0,0,0,0,0,0,0,4791361,2025-02-09 10:00:00,2025-02-09T10:00,2025,2,0.5,0.0,Clear
07/26/2025,0:00,40.82151,-73.86203,BRONX,1.0,0.0,0,0,0,0,1,0,4830523,2025-07-26 00:00:00,2025-07-26T00:00,2025,7,27.0,0.0,Cloudy
07/28/2025,0:00,40.830296,-73.85065,BRONX,3.0,0.0,0,0,0,0,3,0,4830929,2025-07-28 00:00:00,2025-07-28T00:00,2025,7,26.1,0.0,Clear
10/24/2025,11:00,40.85661,-73.88685,BRONX,0.0,0.0,0,0,0,0,0,0,4852794,2025-10-24 11:00:00,2025-10-24T11:00,2025,10,12.8,0.0,Clear
06/22/2025,20:00,40.81614,-73.89487,BRONX,1.0,0.0,0,0,0,0,1,0,4822487,2025-06-22 20:00:00,2025-06-22T20:00,2025,6,30.4,0.0,Cloudy
04/25/2025,7:00,40.850006,-73.84543,BRONX,1.0,0.0,1,0,0,0,0,0,4808165,2025-04-25 07:00:00,2025-04-25T07:00,2025,4,16.0,0.0,Cloudy
04/09/2025,12:00,40.865364,-73.87042,BRONX,1.0,0.0,0,0,0,0,1,0,4804576,2025-04-09 12:00:00,2025-04-09T12:00,2025,4,5.4,0.0,Clear
06/15/2025,15:00,40.85586,-73.894615,BRONX,1.0,0.0,1,0,0,0,0,0,4820577,2025-06-15 15:00:00,2025-06-15T15:00,2025,6,18.9,0.0,Cloudy
06/10/2025,0:00,40.818993,-73.886696,BRONX,1.0,0.0,1,0,0,0,0,0,4819602,2025-06-10 00:00:00,2025-06-10T00:00,2025,6,17.1,0.0,Cloudy
08/10/2025,9:00,40.846546,-73.885605,BRONX,1.0,0.0,0,0,1,0,0,0,4834231,2025-08-10 09:00:00,2025-08-10T09:00,2025,8,26.7,0.0,Clear
09/16/2025,10:00,40.826786,-73.89091,BRONX,1.0,0.0,0,0,0,0,0,0,4843003,2025-09-16 10:00:00,2025-09-16T10:00,2025,9,22.4,0.0,Cloudy
08/26/2025,0:00,40.869404,-73.861046,BRONX,1.0,0.0,1,0,0,0,0,0,4839225,2025-08-26 00:00:00,2025-08-26T00:00,2025,8,21.8,0.0,Clear
03/14/2025,14:00,40.822544,-73.885025,BRONX,3.0,0.0,0,0,0,0,3,0,4799632,2025-03-14 14:00:00,2025-03-14T14:00,2025,3,13.0,0.0,Clear
03/05/2025,9:00,40.830006,-73.91811,BRONX,2.0,0.0,0,0,0,0,2,0,4796566,2025-03-05 09:00:00,2025-03-05T09:00,2025,3,11.0,0.0,Cloudy
04/10/2025,16:00,40.83413,-73.87474,BRONX,4.0,0.0,0,0,0,0,4,0,4805011,2025-04-10 16:00:00,2025-04-10T16:00,2025,4,6.5,0.1,Drizzle
07/11/2025,0:00,40.828304,-73.88295,BRONX,0.0,0.0,0,0,0,0,0,0,4827441,2025-07-11 00:00:00,2025-07-11T00:00,2025,7,22.7,0.0,Clear
02/26/2025,7:00,40.855633,-73.86465,BRONX,0.0,0.0,0,0,0,0,0,0,4795005,2025-02-26 07:00:00,2025-02-26T07:00,2025,2,2.0,0.0,Clear
09/28/2025,10:00,40.835968,-73.869995,BRONX,1.0,0.0,0,0,0,0,1,0,4845658,2025-09-28 10:00:00,2025-09-28T10:00,2025,9,23.1,0.0,Clear
10/22/2025,20:00,40.895905,-73.9008,BRONX,1.0,0.0,0,0,0,0,1,0,4851888,2025-10-22 20:00:00,2025-10-22T20:00,2025,10,12.2,0.0,Clear
10/21/2025,0:00,40.872494,-73.88146,BRONX,1.0,0.0,0,0,0,0,1,0,4852058,2025-10-21 00:00:00,2025-10-21T00:00,2025,10,11.5,0.0,Clear
08/28/2025,13:00,40.884094,-73.89835,BRONX,1.0,0.0,0,0,0,0,1,0,4840152,2025-08-28 13:00:00,2025-08-28T13:00,2025,8,27.1,0.0,Cloudy
02/19/2025,16:00,40.853516,-73.88366,BRONX,0.0,0.0,0,0,0,0,0,0,4793913,2025-02-19 16:00:00,2025-02-19T16:00,2025,2,-2.1,0.0,Cloudy
06/19/2025,17:00,40.834827,-73.85213,BRONX,1.0,0.0,0,0,0,0,1,0,4821785,2025-06-19 17:00:00,2025-06-19T17:00,2025,6,27.3,1.9,Light Rain
06/09/2025,0:00,40.84582,-73.831276,BRONX,1.0,0.0,0,0,0,0,0,0,4821131,2025-06-09 00:00:00,2025-06-09T00:00,2025,6,16.2,0.1,Drizzle
02/20/2025,10:00,40.8738,-73.835815,BRONX,2.0,0.0,0,0,0,0,2,0,4793975,2025-02-20 10:00:00,2025-02-20T10:00,2025,2,-4.6,0.0,Cloudy
01/07/2025,16:00,40.856026,-73.88845,BRONX,2.0,0.0,0,0,0,0,2,0,4784381,2025-01-07 16:00:00,2025-01-07T16:00,2025,1,-3.1,0.0,Cloudy
07/15/2025,20:00,40.82019,-73.89068,BRONX,1.0,0.0,0,0,0,0,1,0,4828110,2025-07-15 20:00:00,2025-07-15T20:00,2025,7,25.9,0.0,Clear
03/30/2025,1:00,40.88698,-73.84744,BRONX,1.0,0.0,0,0,0,0,1,0,4802268,2025-03-30 01:00:00,2025-03-30T01:00,2025,3,5.0,0.0,Cloudy
06/22/2025,8:00,40.82284,-73.92876,BRONX,3.0,0.0,0,0,0,0,3,0,4822144,2025-06-22 08:00:00,2025-06-22T08:00,2025,6,25.6,0.0,Cloudy
07/02/2025,13:00,40.87998,-73.83488,BRONX,1.0,0.0,0,0,0,0,1,0,4825796,2025-07-02 13:00:00,2025-07-02T13:00,2025,7,27.8,0.1,Drizzle
03/24/2025,6:00,40.812283,-73.904465,BRONX,1.0,0.0,0,0,0,0,0,0,4802024,2025-03-24 06:00:00,2025-03-24T06:00,2025,3,4.3,0.4,Drizzle
04/22/2025,8:00,40.87466,-73.91109,BRONX,1.0,0.0,1,0,0,0,0,0,4809928,2025-04-22 08:00:00,2025-04-22T08:00,2025,4,14.3,0.0,Cloudy
09/24/2025,10:00,40.86366,-73.89349,BRONX,1.0,0.0,0,0,0,0,1,0,4844888,2025-09-24 10:00:00,2025-09-24T10:00,2025,9,23.7,0.0,Cloudy
04/03/2025,6:00,40.824085,-73.842896,BRONX,0.0,0.0,0,0,0,0,0,0,4803556,2025-04-03 06:00:00,2025-04-03T06:00,2025,4,10.5,0.0,Cloudy
08/30/2025,15:00,40.847145,-73.85445,BRONX,1.0,0.0,0,0,0,0,0,0,4838578,2025-08-30 15:00:00,2025-08-30T15:00,2025,8,25.7,0.0,Cloudy
06/08/2025,20:00,40.823467,-73.92446,BRONX,0.0,0.0,0,0,0,0,0,0,4820507,2025-06-08 20:00:00,2025-06-08T20:00,2025,6,17.1,0.3,Drizzle
01/02/2025,15:00,40.823936,-73.89165,BRONX,1.0,0.0,0,0,0,0,1,0,4783813,2025-01-02 15:00:00,2025-01-02T15:00,2025,1,4.7,0.0,Cloudy
07/16/2025,14:00,40.866974,-73.83732,BRONX,1.0,0.0,1,0,0,0,0,0,4830195,2025-07-16 14:00:00,2025-07-16T14:00,2025,7,31.2,0.1,Drizzle
07/28/2025,10:00,40.86482,-73.89044,BRONX,0.0,0.0,0,0,0,0,0,0,4833424,2025-07-28 10:00:00,2025-07-28T10:00,2025,7,31.2,0.0,Clear
02/26/2025,18:00,40.838722,-73.91377,BRONX,3.0,0.0,1,0,0,0,2,0,4795388,2025-02-26 18:00:00,2025-02-26T18:00,2025,2,8.5,0.0,Clear
10/07/2025,18:00,40.822777,-73.858444,BRONX,0.0,0.0,0,0,0,0,0,0,4848617,2025-10-07 18:00:00,2025-10-07T18:00,2025,10,22.3,0.0,Cloudy
06/06/2025,17:00,40.85349,-73.88402,BRONX,1.0,0.0,1,0,0,0,0,0,4819810,2025-06-06 17:00:00,2025-06-06T17:00,2025,6,27.3,0.2,Drizzle
08/01/2025,6:00,40.868122,-73.89449,BRONX,0.0,0.0,0,0,0,0,0,0,4833671,2025-08-01 06:00:00,2025-08-01T06:00,2025,8,17.6,0.0,Cloudy
10/17/2025,9:00,40.885017,-73.89207,BRONX,0.0,0.0,0,0,0,0,0,0,4851567,2025-10-17 09:00:00,2025-10-17T09:00,2025,10,10.2,0.0,Clear
08/07/2025,0:00,40.842472,-73.85334,BRONX,2.0,0.0,0,0,0,0,2,0,4833803,2025-08-07 00:00:00,2025-08-07T00:00,2025,8,20.4,0.1,Drizzle
06/09/2025,21:00,40.88753,-73.89922,BRONX,3.0,0.0,0,0,0,0,3,0,4819357,2025-06-09 21:00:00,2025-06-09T21:00,2025,6,16.7,0.0,Cloudy
04/17/2025,15:00,40.822826,-73.83416,BRONX,1.0,0.0,0,0,0,0,1,0,4807128,2025-04-17 15:00:00,2025-04-17T15:00,2025,4,15.0,0.0,Clear
10/09/2025,8:00,40.845066,-73.866875,BRONX,1.0,0.0,1,0,0,0,0,0,4849429,2025-10-09 08:00:00,2025-10-09T08:00,2025,10,11.1,0.0,Clear
02/25/2025,7:00,40.84843,-73.91298,BRONX,1.0,0.0,1,0,0,0,0,0,4795945,2025-02-25 07:00:00,2025-02-25T07:00,2025,2,3.3,0.0,Cloudy
03/09/2025,4:00,40.832737,-73.90503,BRONX,0.0,0.0,0,0,0,0,0,0,4797265,2025-03-09 04:00:00,2025-03-09T04:00,2025,3,-1.5,0.0,Clear
02/08/2025,0:00,40.88874,-73.83732,BRONX,2.0,0.0,0,0,0,0,2,0,4791391,2025-02-08 00:00:00,2025-02-08T00:00,2025,2,-3.1,0.0,Cloudy
05/20/2025,9:00,40.81165,-73.921036,BRONX,1.0,0.0,0,0,0,0,1,0,4816456,2025-05-20 09:00:00,2025-05-20T09:00,2025,5,13.5,0.0,Clear
02/17/2025,15:00,40.84914,-73.86157,BRONX,0.0,0.0,0,0,0,0,0,0,4794236,2025-02-17 15:00:00,2025-02-17T15:00,2025,2,-0.9,0.0,Clear
04/14/2025,8:00,40.901726,-73.90603,BRONX,0.0,0.0,0,0,0,0,0,0,4806166,2025-04-14 08:00:00,2025-04-14T08:00,2025,4,9.7,0.0,Cloudy
09/08/2025,6:00,40.893276,-73.85483,BRONX,0.0,0.0,0,0,0,0,0,0,4841361,2025-09-08 06:00:00,2025-09-08T06:00,2025,9,12.9,0.0,Clear
02/14/2025,17:00,0.0,0.0,BRONX,0.0,0.0,0,0,0,0,0,0,4792875,2025-02-14 17:00:00,2025-02-14T17:00,2025,2,28.0,0.0,Cloudy
06/20/2025,8:00,40.844845,-73.84624,BRONX,1.0,0.0,0,0,0,0,1,0,4821825,2025-06-20 08:00:00,2025-06-20T08:00,2025,6,22.5,0.0,Clear
02/19/2025,0:00,40.87739,-73.86649,BRONX,2.0,0.0,2,0,0,0,0,0,4793535,2025-02-19 00:00:00,2025-02-19T00:00,2025,2,-7.3,0.0,Clear
01/08/2025,20:00,40.84861,-73.91397,BRONX,1.0,0.0,1,0,0,0,0,0,4787736,2025-01-08 20:00:00,2025-01-08T20:00,2025,1,-5.5,0.0,Clear
01/13/2025,12:00,40.842922,-73.90956,BRONX,0.0,0.0,0,0,0,0,0,0,4786105,2025-01-13 12:00:00,2025-01-13T12:00,2025,1,3.5,0.0,Clear
10/16/2025,14:00,40.81049,-73.90507,BRONX,1.0,0.0,0,0,0,0,1,0,4850268,2025-10-16 14:00:00,2025-10-16T14:00,2025,10,15.1,0.0,Clear
06/27/2025,15:00,40.830936,-73.9124,BRONX,2.0,0.0,1,0,0,0,1,0,4828036,2025-06-27 15:00:00,2025-06-27T15:00,2025,6,21.6,0.0,Cloudy
04/19/2025,22:00,40.85048,-73.91543,BRONX,1.0,0.0,1,0,0,0,0,0,4826380,2025-04-19 22:00:00,2025-04-19T22:00,2025,4,21.7,0.0,Cloudy
07/08/2025,15:00,40.885098,-73.90065,BRONX,1.0,0.0,1,0,0,0,0,0,4826240,2025-07-08 15:00:00,2025-07-08T15:00,2025,7,30.4,6.7,Heavy Rain
06/23/2025,13:00,40.851902,-73.91644,BRONX,1.0,0.0,0,0,1,0,0,0,4824482,2025-06-23 13:00:00,2025-06-23T13:00,2025,6,38.0,0.0,Cloudy
04/15/2025,0:00,40.862343,-73.834076,BRONX,1.0,0.0,0,0,0,0,1,0,4806865,2025-04-15 00:00:00,2025-04-15T00:00,2025,4,10.4,4.3,Heavy Rain
02/14/2025,15:00,40.811596,-73.88305,BRONX,1.0,0.0,0,0,0,0,1,0,4792690,2025-02-14 15:00:00,2025-02-14T15:00,2025,2,0.3,0.0,Clear
06/20/2025,0:00,40.88963,-73.91147,BRONX,1.0,0.0,0,0,0,0,1,0,4822392,2025-06-20 00:00:00,2025-06-20T00:00,2025,6,21.9,0.0,Clear
04/18/2025,0:00,40.847366,-73.8995,BRONX,1.0,0.0,0,0,1,0,0,0,4807125,2025-04-18 00:00:00,2025-04-18T00:00,2025,4,7.3,0.0,Clear
08/24/2025,16:00,40.845417,-73.8652,BRONX,1.0,0.0,0,0,1,0,0,0,4837603,2025-08-24 16:00:00,2025-08-24T16:00,2025,8,25.7,0.0,Cloudy
09/01/2025,18:00,40.834415,-73.928535,BRONX,1.0,0.0,1,0,0,0,0,0,4839089,2025-09-01 18:00:00,2025-09-01T18:00,2025,9,23.1,0.0,Clear
06/20/2025,16:00,40.8247,-73.931114,BRONX,1.0,0.0,0,0,0,0,1,0,4824439,2025-06-20 16:00:00,2025-06-20T16:00,2025,6,28.2,0.0,Cloudy
09/22/2025,15:00,40.8305,-73.86162,BRONX,1.0,0.0,0,0,1,0,0,0,4844447,2025-09-22 15:00:00,2025-09-22T15:00,2025,9,23.0,0.0,Cloudy
01/30/2025,17:00,40.860268,-73.901634,BRONX,1.0,0.0,0,0,1,0,0,0,4790213,2025-01-30 17:00:00,2025-01-30T17:00,2025,1,-0.6,0.0,Cloudy
02/18/2025,16:00,40.861866,-73.91274,BRONX,1.0,0.0,0,0,0,0,1,0,4794501,2025-02-18 16:00:00,2025-02-18T16:00,2025,2,-3.8,0.0,Cloudy
05/04/2025,0:00,40.85713,-73.88079,BRONX,6.0,0.0,0,0,0,0,6,0,4810372,2025-05-04 00:00:00,2025-05-04T00:00,2025,5,18.6,0.5,Drizzle
06/06/2025,16:00,40.82223,-73.89368,BRONX,1.0,0.0,0,0,0,0,1,0,4819099,2025-06-06 16:00:00,2025-06-06T16:00,2025,6,28.4,0.0,Cloudy
10/02/2025,7:00,40.807808,-73.923836,BRONX,1.0,0.0,0,0,0,0,1,0,4846877,2025-10-02 07:00:00,2025-10-02T07:00,2025,10,11.6,0.0,Clear
02/21/2025,12:00,40.888325,-73.822075,BRONX,1.0,0.0,0,0,0,0,1,0,4794336,2025-02-21 12:00:00,2025-02-21T12:00,2025,2,-1.0,0.0,Clear
05/02/2025,0:00,40.84272,-73.88594,BRONX,2.0,0.0,1,0,0,0,1,0,4812039,2025-05-02 00:00:00,2025-05-02T00:00,2025,5,15.1,0.0,Cloudy
05/30/2025,0:00,40.862736,-73.90332,BRONX,1.0,0.0,1,0,0,0,0,0,4817247,2025-05-30 00:00:00,2025-05-30T00:00,2025,5,16.7,0.0,Cloudy
02/07/2025,15:00,40.809555,-73.92352,BRONX,1.0,0.0,0,0,0,0,1,0,4791660,2025-02-07 15:00:00,2025-02-07T15:00,2025,2,0.7,0.0,Clear
10/10/2025,0:00,40.85713,-73.88079,BRONX,1.0,0.0,0,0,0,0,1,0,4848753,2025-10-10 00:00:00,2025-10-10T00:00,2025,10,8.1,0.0,Clear
01/04/2025,0:00,40.849323,-73.85028,BRONX,1.0,0.0,0,0,0,0,1,0,4783605,2025-01-04 00:00:00,2025-01-04T00:00,2025,1,-1.7,0.0,Clear
03/01/2025,22:00,40.892254,-73.861626,BRONX,0.0,0.0,0,0,0,0,0,0,4795741,2025-03-01 22:00:00,2025-03-01T22:00,2025,3,-2.3,0.0,Clear
09/21/2025,0:00,40.828304,-73.88295,BRONX,1.0,0.0,1,0,0,0,0,0,4845272,2025-09-21 00:00:00,2025-09-21T00:00,2025,9,16.2,0.0,Clear
02/14/2025,0:00,40.83989,-73.88847,BRONX,1.0,0.0,0,0,0,0,1,0,4792532,2025-02-14 00:00:00,2025-02-14T00:00,2025,2,-0.7,0.0,Clear
02/24/2025,9:00,40.883183,-73.856,BRONX,1.0,0.0,1,0,0,0,0,0,4794914,2025-02-24 09:00:00,2025-02-24T09:00,2025,2,2.5,0.0,Clear
09/26/2025,9:00,40.82734,-73.89385,BRONX,1.0,0.0,0,0,0,0,1,0,4846897,2025-09-26 09:00:00,2025-09-26T09:00,2025,9,22.7,0.0,Cloudy
01/19/2025,2:00,40.845177,-73.91416,BRONX,2.0,0.0,0,0,0,0,2,0,4786860,2025-01-19 02:00:00,2025-01-19T02:00,2025,1,0.9,0.0,Clear
07/25/2025,17:00,40.834187,-73.90958,BRONX,0.0,0.0,0,0,0,0,0,0,4831289,2025-07-25 17:00:00,2025-07-25T17:00,2025,7,32.1,0.0,Cloudy
01/09/2025,13:00,40.857525,-73.88179,BRONX,1.0,0.0,0,0,0,0,1,0,4785051,2025-01-09 13:00:00,2025-01-09T13:00,2025,1,-2.0,0.0,Cloudy
01/30/2025,13:00,40.82143,-73.8794,BRONX,1.0,0.0,0,0,0,0,1,0,4790378,2025-01-30 13:00:00,2025-01-30T13:00,2025,1,0.2,0.0,Clear
05/16/2025,23:00,40.828598,-73.92172,BRONX,1.0,0.0,0,0,0,0,1,0,4813778,2025-05-16 23:00:00,2025-05-16T23:00,2025,5,16.8,0.0,Cloudy
07/12/2025,18:00,40.87036,-73.843445,BRONX,1.0,0.0,0,0,0,0,1,0,4827249,2025-07-12 18:00:00,2025-07-12T18:00,2025,7,25.8,0.0,Cloudy
05/24/2025,17:00,40.855995,-73.844215,BRONX,1.0,0.0,0,0,0,0,1,0,4815458,2025-05-24 17:00:00,2025-05-24T17:00,2025,5,15.2,0.0,Cloudy
05/30/2025,21:00,40.858707,-73.903694,BRONX,1.0,0.0,1,0,0,0,0,0,4816919,2025-05-30 21:00:00,2025-05-30T21:00,2025,5,16.3,0.0,Cloudy
07/11/2025,12:00,40.821804,-73.87663,BRONX,1.0,0.0,1,0,0,0,0,0,4827445,2025-07-11 12:00:00,2025-07-11T12:00,2025,7,28.9,0.0,Cloudy
02/13/2025,12:00,40.85776,-73.90094,BRONX,1.0,0.0,1,0,0,0,0,0,4793296,2025-02-13 12:00:00,2025-02-13T12:00,2025,2,3.1,0.0,Cloudy
06/05/2025,16:00,40.857807,-73.84005,BRONX,1.0,0.0,0,0,1,0,0,0,4818283,2025-06-05 16:00:00,2025-06-05T16:00,2025,6,30.6,0.3,Drizzle
08/17/2025,13:00,40.86175,-73.893394,BRONX,1.0,0.0,1,0,0,0,0,0,4839235,2025-08-17 13:00:00,2025-08-17T13:00,2025,8,33.5,0.0,Cloudy
08/13/2025,18:00,40.882874,-73.90223,BRONX,1.0,0.0,0,0,1,0,0,0,4836177,2025-08-13 18:00:00,2025-08-13T18:00,2025,8,27.9,0.0,Cloudy
07/23/2025,15:00,40.90348,-73.85034,BRONX,1.0,0.0,0,0,1,0,0,0,4830212,2025-07-23 15:00:00,2025-07-23T15:00,2025,7,27.2,0.0,Cloudy
05/31/2025,23:00,40.848682,-73.88378,BRONX,1.0,0.0,0,0,0,0,1,0,4818666,2025-05-31 23:00:00,2025-05-31T23:00,2025,5,11.3,0.0,Cloudy
04/21/2025,17:00,40.874233,-73.90823,BRONX,3.0,0.0,0,0,0,0,3,0,4807510,2025-04-21 17:00:00,2025-04-21T17:00,2025,4,11.7,0.0,Cloudy
03/15/2025,18:00,40.834297,-73.82058,BRONX,0.0,0.0,0,0,0,0,0,0,4800537,2025-03-15 18:00:00,2025-03-15T18:00,2025,3,7.9,0.0,Cloudy
09/06/2025,0:00,40.862064,-73.89483,BRONX,1.0,0.0,1,0,0,0,0,0,4841525,2025-09-06 00:00:00,2025-09-06T00:00,2025,9,23.4,0.0,Clear
09/14/2025,9:00,40.87975,-73.88466,BRONX,1.0,0.0,1,0,0,0,0,0,4842467,2025-09-14 09:00:00,2025-09-14T09:00,2025,9,22.8,0.0,Clear
03/13/2025,10:00,40.804905,-73.91882,BRONX,4.0,0.0,0,0,0,0,4,0,4799220,2025-03-13 10:00:00,2025-03-13T10:00,2025,3,7.2,0.0,Cloudy
06/03/2025,18:00,40.854588,-73.90186,BRONX,2.0,0.0,0,0,0,0,2,0,4817856,2025-06-03 18:00:00,2025-06-03T18:00,2025,6,21.7,0.0,Clear
07/25/2025,19:00,40.84606,-73.91043,BRONX,0.0,0.0,0,0,0,0,0,0,4830857,2025-07-25 19:00:00,2025-07-25T19:00,2025,7,28.8,1.0,Drizzle
01/06/2025,0:00,40.826916,-73.87203,BRONX,1.0,0.0,0,0,0,0,1,0,4784063,2025-01-06 00:00:00,2025-01-06T00:00,2025,1,-2.3,0.0,Cloudy
01/06/2025,8:00,40.8188,-73.88715,BRONX,2.0,0.0,2,0,0,0,0,0,4784023,2025-01-06 08:00:00,2025-01-06T08:00,2025,1,-1.9,0.0,Cloudy
02/02/2025,15:00,40.89466,-73.86136,BRONX,0.0,0.0,0,0,0,0,0,0,4790159,2025-02-02 15:00:00,2025-02-02T15:00,2025,2,-2.4,0.0,Cloudy
10/22/2025,5:00,40.827152,-73.839325,BRONX,10.0,0.0,0,0,0,0,10,0,4852052,2025-10-22 05:00:00,2025-10-22T05:00,2025,10,12.7,0.0,Cloudy
03/08/2025,16:00,40.85713,-73.88079,BRONX,0.0,0.0,0,0,0,0,0,0,4797532,2025-03-08 16:00:00,2025-03-08T16:00,2025,3,4.5,0.0,Clear
04/12/2025,9:00,40.818504,-73.823425,BRONX,1.0,0.0,0,0,0,0,1,0,4805715,2025-04-12 09:00:00,2025-04-12T09:00,2025,4,3.6,0.1,Drizzle
08/12/2025,16:00,40.855995,-73.844215,BRONX,1.0,0.0,0,0,0,0,1,0,4834543,2025-08-12 16:00:00,2025-08-12T16:00,2025,8,31.1,0.0,Clear
04/25/2025,12:00,40.84541,-73.89113,BRONX,1.0,0.0,1,0,0,0,0,0,4810337,2025-04-25 12:00:00,2025-04-25T12:00,2025,4,23.7,0.0,Cloudy
01/18/2025,3:00,40.81942,-73.88391,BRONX,1.0,0.0,0,0,0,0,1,0,4786528,2025-01-18 03:00:00,2025-01-18T03:00,2025,1,-0.3,0.0,Clear
04/08/2025,13:00,40.847282,-73.87071,BRONX,2.0,0.0,0,0,0,0,2,0,4804431,2025-04-08 13:00:00,2025-04-08T13:00,2025,4,5.9,0.0,Cloudy
06/16/2025,0:00,40.81942,-73.92714,BRONX,1.0,0.0,1,0,0,0,0,0,4832354,2025-06-16 00:00:00,2025-06-16T00:00,2025,6,16.5,0.0,Cloudy
06/24/2025,0:00,40.845966,-73.892235,BRONX,1.0,0.0,1,0,0,0,0,0,4823363,2025-06-24 00:00:00,2025-06-24T00:00,2025,6,30.1,0.0,Clear
09/07/2025,1:00,40.810406,-73.92195,BRONX,1.0,0.0,1,0,0,0,0,0,4840882,2025-09-07 01:00:00,2025-09-07T01:00,2025,9,18.0,1.8,Light Rain
03/29/2025,0:00,40.83333,-73.86876,BRONX,0.0,0.0,0,0,0,0,0,0,4802032,2025-03-29 00:00:00,2025-03-29T00:00,2025,3,10.2,0.0,Cloudy
05/14/2025,9:00,40.872005,-73.88913,BRONX,0.0,0.0,0,0,0,0,0,0,4812885,2025-05-14 09:00:00,2025-05-14T09:00,2025,5,15.2,0.7,Drizzle
07/20/2025,19:00,40.881607,-73.83783,BRONX,1.0,0.0,0,0,0,0,1,0,4833950,2025-07-20 19:00:00,2025-07-20T19:00,2025,7,27.3,0.0,Cloudy
05/20/2025,0:00,40.85713,-73.88079,BRONX,2.0,0.0,0,0,0,0,2,0,4815614,2025-05-20 00:00:00,2025-05-20T00:00,2025,5,10.3,0.0,Clear
05/17/2025,13:00,40.874123,-73.8752,BRONX,0.0,0.0,0,0,0,0,0,0,4813908,2025-05-17 13:00:00,2025-05-17T13:00,2025,5,23.5,0.0,Clear
06/24/2025,0:00,40.80801,-73.8896,BRONX,0.0,0.0,0,0,0,0,0,0,4823556,2025-06-24 00:00:00,2025-06-24T00:00,2025,6,30.3,0.0,Cloudy
09/14/2025,5:00,40.87805,-73.89865,BRONX,1.0,0.0,0,0,0,0,1,0,4842366,2025-09-14 05:00:00,2025-09-14T05:00,2025,9,17.6,0.0,Clear
03/04/2025,9:00,40.88435,-73.887054,BRONX,1.0,0.0,0,0,0,0,1,0,4804087,2025-03-04 09:00:00,2025-03-04T09:00,2025,3,2.4,0.0,Cloudy
10/03/2025,10:00,40.868534,-73.82573,BRONX,4.0,0.0,0,0,0,0,4,0,4848497,2025-10-03 10:00:00,2025-10-03T10:00,2025,10,17.9,0.0,Clear
05/24/2025,2:00,40.885242,-73.90472,BRONX,0.0,0.0,0,0,0,0,0,0,4815953,2025-05-24 02:00:00,2025-05-24T02:00,2025,5,9.6,0.0,Clear
07/18/2025,18:00,40.84698,-73.910645,BRONX,2.0,0.0,0,0,1,0,1,0,4830401,2025-07-18 18:00:00,2025-07-18T18:00,2025,7,28.0,0.0,Clear
01/23/2025,16:00,40.871605,-73.84245,BRONX,1.0,0.0,0,0,0,0,1,0,4787859,2025-01-23 16:00:00,2025-01-23T16:00,2025,1,-4.4,0.0,Clear
08/02/2025,20:00,40.843174,-73.91195,BRONX,1.0,0.0,1,0,0,0,0,0,4832362,2025-08-02 20:00:00,2025-08-02T20:00,2025,8,20.8,0.0,Clear
06/24/2025,10:00,40.841255,-73.90939,BRONX,1.0,0.0,0,0,0,0,1,0,4823124,2025-06-24 10:00:00,2025-06-24T10:00,2025,6,36.4,0.0,Clear
05/02/2025,13:00,40.827656,-73.88609,BRONX,2.0,0.0,0,0,0,0,2,0,4811169,2025-05-02 13:00:00,2025-05-02T13:00,2025,5,29.2,0.0,Clear
04/27/2025,7:00,40.886,-73.913445,BRONX,1.0,0.0,0,0,0,0,1,0,4808772,2025-04-27 07:00:00,2025-04-27T07:00,2025,4,9.2,0.0,Clear
07/10/2025,22:00,40.875496,-73.86051,BRONX,2.0,0.0,0,0,0,0,2,0,4828268,2025-07-10 22:00:00,2025-07-10T22:00,2025,7,23.0,0.0,Cloudy
05/13/2025,12:00,40.820988,-73.89162,BRONX,1.0,0.0,1,0,0,0,0,0,4813016,2025-05-13 12:00:00,2025-05-13T12:00,2025,5,19.2,0.2,Drizzle
10/17/2025,0:00,40.86929,-73.88355,BRONX,2.0,0.0,2,0,0,0,0,0,4850898,2025-10-17 00:00:00,2025-10-17T00:00,2025,10,8.3,0.0,Clear
01/23/2025,16:00,40.816803,-73.89704,BRONX,1.0,0.0,1,0,0,0,0,0,4787867,2025-01-23 16:00:00,2025-01-23T16:00,2025,1,-4.3,0.0,Clear
09/20/2025,18:00,40.856956,-73.88162,BRONX,1.0,0.0,0,0,0,0,1,0,4846000,2025-09-20 18:00:00,2025-09-20T18:00,2025,9,20.5,0.0,Clear
09/09/2025,10:00,40.83747,-73.852646,BRONX,0.0,0.0,0,0,0,0,0,0,4844217,2025-09-09 10:00:00,2025-09-09T10:00,2025,9,19.9,0.0,Clear
01/28/2025,16:00,40.816536,-73.928215,BRONX,1.0,0.0,0,0,1,0,0,0,4789590,2025-01-28 16:00:00,2025-01-28T16:00,2025,1,-0.2,0.0,Cloudy
08/15/2025,0:00,40.85868,-73.899216,BRONX,1.0,0.0,0,0,0,0,1,0,4844749,2025-08-15 00:00:00,2025-08-15T00:00,2025,8,24.4,0.0,Clear
06/24/2025,0:00,40.86519,-73.89282,BRONX,0.0,0.0,0,0,0,0,0,0,4822787,2025-06-24 00:00:00,2025-06-24T00:00,2025,6,30.0,0.0,Clear
09/29/2025,0:00,40.862545,-73.890526,BRONX,1.0,0.0,0,0,0,0,0,0,4846726,2025-09-29 00:00:00,2025-09-29T00:00,2025,9,20.7,0.0,Clear
02/07/2025,17:00,40.826687,-73.85772,BRONX,1.0,0.0,0,0,0,0,1,0,4791359,2025-02-07 17:00:00,2025-02-07T17:00,2025,2,-0.8,0.0,Clear
04/16/2025,11:00,40.8252,-73.91475,BRONX,1.0,0.0,1,0,0,0,0,0,4806363,2025-04-16 11:00:00,2025-04-16T11:00,2025,4,8.5,0.0,Cloudy
08/12/2025,17:00,40.819683,-73.8096,BRONX,0.0,0.0,0,0,0,0,0,0,4835565,2025-08-12 17:00:00,2025-08-12T17:00,2025,8,27.7,0.0,Clear
04/24/2025,10:00,40.8893,-73.82187,BRONX,1.0,0.0,0,0,0,0,1,0,4807988,2025-04-24 10:00:00,2025-04-24T10:00,2025,4,19.8,0.0,Clear
03/27/2025,18:00,40.87874,-73.87564,BRONX,1.0,0.0,0,0,0,0,1,0,4802324,2025-03-27 18:00:00,2025-03-27T18:00,2025,3,7.4,0.0,Clear
08/20/2025,13:00,40.837425,-73.920364,BRONX,1.0,0.0,0,0,0,0,1,0,4836466,2025-08-20 13:00:00,2025-08-20T13:00,2025,8,22.2,0.1,Drizzle
07/16/2025,20:00,40.87765,-73.889084,BRONX,0.0,0.0,0,0,0,0,0,0,4829025,2025-07-16 20:00:00,2025-07-16T20:00,2025,7,26.6,0.0,Cloudy
05/05/2025,16:00,40.850636,-73.86025,BRONX,0.0,0.0,0,0,0,0,0,0,4811552,2025-05-05 16:00:00,2025-05-05T16:00,2025,5,14.9,1.4,Light Rain
03/25/2025,17:00,40.8528,-73.9115,BRONX,1.0,0.0,0,0,0,0,1,0,4801842,2025-03-25 17:00:00,2025-03-25T17:00,2025,3,12.8,0.0,Clear
06/08/2025,13:00,40.88537,-73.854836,BRONX,1.0,0.0,1,0,0,0,0,0,4819633,2025-06-08 13:00:00,2025-06-08T13:00,2025,6,22.9,0.0,Cloudy
02/07/2025,17:00,40.86873,-73.901985,BRONX,1.0,0.0,0,0,1,0,0,0,4791344,2025-02-07 17:00:00,2025-02-07T17:00,2025,2,-1.2,0.0,Clear
05/26/2025,18:00,40.878853,-73.85572,BRONX,2.0,0.0,0,0,0,0,2,0,4817028,2025-05-26 18:00:00,2025-05-26T18:00,2025,5,19.3,0.0,Clear
06/13/2025,10:00,40.817795,-73.89318,BRONX,0.0,0.0,0,0,0,0,0,0,4822672,2025-06-13 10:00:00,2025-06-13T10:00,2025,6,25.5,0.0,Cloudy
06/20/2025,23:00,40.837673,-73.91921,BRONX,0.0,0.0,0,0,0,0,0,0,4824753,2025-06-20 23:00:00,2025-06-20T23:00,2025,6,22.8,0.0,Clear
10/22/2025,10:00,40.851505,-73.90213,BRONX,1.0,0.0,0,0,0,0,1,0,4852706,2025-10-22 10:00:00,2025-10-22T10:00,2025,10,15.5,0.1,Drizzle
03/03/2025,17:00,40.86964,-73.86339,BRONX,3.0,0.0,0,0,0,0,3,0,4797406,2025-03-03 17:00:00,2025-03-03T17:00,2025,3,3.0,0.0,Clear
03/30/2025,9:00,40.838444,-73.83701,BRONX,0.0,0.0,0,0,0,0,0,0,4802425,2025-03-30 09:00:00,2025-03-30T09:00,2025,3,7.2,0.0,Cloudy
05/06/2025,20:00,40.85885,-73.88595,BRONX,1.0,0.0,0,0,0,0,1,0,4811729,2025-05-06 20:00:00,2025-05-06T20:00,2025,5,15.1,0.0,Cloudy
09/10/2025,0:00,40.843685,-73.89482,BRONX,1.0,0.0,0,0,0,0,1,0,4841359,2025-09-10 00:00:00,2025-09-10T00:00,2025,9,16.9,0.0,Cloudy
01/28/2025,15:00,40.840313,-73.92507,BRONX,0.0,0.0,0,0,0,0,0,0,4790279,2025-01-28 15:00:00,2025-01-28T15:00,2025,1,0.2,0.0,Clear
08/14/2025,8:00,40.813587,-73.931046,BRONX,1.0,0.0,0,0,0,0,1,0,4836550,2025-08-14 08:00:00,2025-08-14T08:00,2025,8,23.4,0.9,Drizzle
08/14/2025,7:00,40.833965,-73.86289,BRONX,0.0,0.0,0,0,0,0,0,0,4835979,2025-08-14 07:00:00,2025-08-14T07:00,2025,8,24.2,0.0,Cloudy
07/13/2025,14:00,40.717407,-73.9562,BROOKLYN,0.0,0.0,0,0,0,0,0,0,4828234,2025-07-13 14:00:00,2025-07-13T14:00,2025,7,29.2,0.0,Clear
04/07/2025,13:00,40.6848,-73.97979,BROOKLYN,1.0,0.0,0,0,0,0,1,0,4804544,2025-04-07 13:00:00,2025-04-07T13:00,2025,4,6.5,1.2,Drizzle
01/31/2025,12:00,40.626713,-73.97659,BROOKLYN,1.0,0.0,1,0,0,0,0,0,4789700,2025-01-31 12:00:00,2025-01-31T12:00,2025,1,6.5,0.0,Cloudy
01/23/2025,15:00,40.666443,-73.89345,BROOKLYN,1.0,0.0,0,0,0,0,1,0,4788338,2025-01-23 15:00:00,2025-01-23T15:00,2025,1,-3.2,0.0,Clear
04/02/2025,16:00,40.63065,-73.9289,BROOKLYN,0.0,0.0,0,0,0,0,0,0,4803014,2025-04-02 16:00:00,2025-04-02T16:00,2025,4,5.5,0.0,Cloudy
03/23/2025,19:00,40.579967,-73.97658,BROOKLYN,3.0,0.0,0,0,0,0,3,0,4801453,2025-03-23 19:00:00,2025-03-23T19:00,2025,3,4.2,0.0,Cloudy
08/17/2025,15:00,40.702576,-73.93481,BROOKLYN,1.0,0.0,0,0,1,0,0,0,4836301,2025-08-17 15:00:00,2025-08-17T15:00,2025,8,30.9,1.0,Drizzle
09/02/2025,19:00,40.696354,-73.940704,BROOKLYN,1.0,0.0,0,0,1,0,0,0,4839898,2025-09-02 19:00:00,2025-09-02T19:00,2025,9,20.5,0.0,Clear
01/08/2025,0:00,40.643074,-73.98733,BROOKLYN,1.0,0.0,0,0,1,0,0,0,4784582,2025-01-08 00:00:00,2025-01-08T00:00,2025,1,-3.7,0.0,Cloudy
01/11/2025,9:00,40.60562,-74.01315,BROOKLYN,2.0,0.0,0,0,0,0,2,0,4785397,2025-01-11 09:00:00,2025-01-11T09:00,2025,1,-2.0,0.0,Cloudy
07/20/2025,22:00,40.68413,-73.87013,BROOKLYN,1.0,0.0,1,0,0,0,0,0,4829162,2025-07-20 22:00:00,2025-07-20T22:00,2025,7,27.5,0.0,Cloudy
08/26/2025,0:00,40.67509,-73.89186,BROOKLYN,1.0,0.0,1,0,0,0,0,0,4838186,2025-08-26 00:00:00,2025-08-26T00:00,2025,8,22.7,0.0,Clear
10/17/2025,19:00,40.65807,-74.00762,BROOKLYN,0.0,0.0,0,0,0,0,0,0,4850772,2025-10-17 19:00:00,2025-10-17T19:00,2025,10,12.9,0.0,Clear
08/28/2025,13:00,40.670124,-73.95527,BROOKLYN,1.0,0.0,1,0,0,0,0,0,4838359,2025-08-28 13:00:00,2025-08-28T13:00,2025,8,25.4,0.0,Cloudy
08/16/2025,17:00,40.716496,-73.95186,BROOKLYN,1.0,0.0,0,0,1,0,0,0,4836969,2025-08-16 17:00:00,2025-08-16T17:00,2025,8,26.6,1.3,Light Rain
01/21/2025,16:00,40.646626,-74.02058,BROOKLYN,0.0,0.0,0,0,0,0,0,0,4788797,2025-01-21 16:00:00,2025-01-21T16:00,2025,1,-8.8,0.0,Cloudy
02/11/2025,16:00,40.698048,-73.975784,BROOKLYN,2.0,0.0,0,0,0,0,2,0,4796866,2025-02-11 16:00:00,2025-02-11T16:00,2025,2,0.6,0.0,Cloudy
10/19/2025,20:00,40.614178,-73.92913,BROOKLYN,1.0,0.0,1,0,0,0,0,0,4851000,2025-10-19 20:00:00,2025-10-19T20:00,2025,10,18.7,0.0,Cloudy
01/23/2025,12:00,40.656487,-73.960075,BROOKLYN,1.0,0.0,1,0,0,0,0,0,4787925,2025-01-23 12:00:00,2025-01-23T12:00,2025,1,-5.1,0.0,Cloudy
06/16/2025,10:00,40.686905,-73.944626,BROOKLYN,1.0,0.0,0,0,0,0,1,0,4823222,2025-06-16 10:00:00,2025-06-16T10:00,2025,6,18.1,0.0,Cloudy
01/28/2025,18:00,40.64193,-73.958405,BROOKLYN,1.0,0.0,1,0,0,0,0,0,4788977,2025-01-28 18:00:00,2025-01-28T18:00,2025,1,-1.2,0.0,Cloudy
08/17/2025,0:00,40.70219,-73.92834,BROOKLYN,1.0,0.0,0,0,0,0,1,0,4835755,2025-08-17 00:00:00,2025-08-17T00:00,2025,8,23.6,0.0,Clear
09/04/2025,14:00,40.648403,-73.9763,BROOKLYN,0.0,0.0,0,0,0,0,0,0,4840793,2025-09-04 14:00:00,2025-09-04T14:00,2025,9,23.3,0.1,Drizzle
02/06/2025,12:00,40.642006,-73.89883,BROOKLYN,0.0,0.0,0,0,0,0,0,0,4790912,2025-02-06 12:00:00,2025-02-06T12:00,2025,2,3.2,0.4,Drizzle
02/23/2025,15:00,40.679146,-73.92656,BROOKLYN,2.0,0.0,0,0,0,0,2,0,4795536,2025-02-23 15:00:00,2025-02-23T15:00,2025,2,7.4,0.0,Cloudy
04/24/2025,15:00,0.0,0.0,BROOKLYN,1.0,0.0,0,0,0,0,1,0,4807913,2025-04-24 15:00:00,2025-04-24T15:00,2025,4,28.9,0.0,Clear
02/18/2025,9:00,40.69579,-73.93312,BROOKLYN,1.0,0.0,0,0,1,0,0,0,4793743,2025-02-18 09:00:00,2025-02-18T09:00,2025,2,-6.2,0.0,Clear
08/31/2025,23:00,40.589043,-73.94457,BROOKLYN,1.0,0.0,0,0,0,0,1,0,4839399,2025-08-31 23:00:00,2025-08-31T23:00,2025,8,19.2,0.0,Cloudy
06/14/2025,0:00,40.682007,-73.92334,BROOKLYN,1.0,0.0,0,0,0,0,1,0,4820201,2025-06-14 00:00:00,2025-06-14T00:00,2025,6,19.7,0.0,Cloudy
02/25/2025,16:00,40.68442,-73.978386,BROOKLYN,0.0,0.0,0,0,0,0,0,0,4795681,2025-02-25 16:00:00,2025-02-25T16:00,2025,2,8.5,0.0,Cloudy
01/06/2025,13:00,40.630634,-74.009224,BROOKLYN,1.0,0.0,0,0,1,0,0,0,4784093,2025-01-06 13:00:00,2025-01-06T13:00,2025,1,-1.9,0.2,Light Snow
04/06/2025,0:00,40.671448,-73.984604,BROOKLYN,1.0,0.0,0,0,1,0,0,0,4803843,2025-04-06 00:00:00,2025-04-06T00:00,2025,4,6.5,2.6,Heavy Rain
01/21/2025,0:00,40.665348,-73.922325,BROOKLYN,1.0,0.0,1,0,0,0,0,0,4787621,2025-01-21 00:00:00,2025-01-21T00:00,2025,1,-11.0,0.0,Clear
07/04/2025,10:00,40.625645,-74.03311,BROOKLYN,1.0,0.0,1,0,0,0,0,0,4825173,2025-07-04 10:00:00,2025-07-04T10:00,2025,7,25.1,0.0,Clear
08/04/2025,15:00,40.664227,-73.945465,BROOKLYN,1.0,0.0,0,0,0,0,1,0,4833200,2025-08-04 15:00:00,2025-08-04T15:00,2025,8,30.2,0.0,Cloudy
07/05/2025,1:00,40.692993,-73.955826,BROOKLYN,1.0,0.0,0,0,1,0,0,0,4825269,2025-07-05 01:00:00,2025-07-05T01:00,2025,7,22.3,0.0,Clear
06/28/2025,0:00,40.686825,-73.938805,BROOKLYN,1.0,0.0,0,0,1,0,0,0,4824794,2025-06-28 00:00:00,2025-06-28T00:00,2025,6,19.3,0.0,Cloudy
03/18/2025,15:00,40.662132,-73.91173,BROOKLYN,1.0,0.0,1,0,0,0,0,0,4800078,2025-03-18 15:00:00,2025-03-18T15:00,2025,3,13.4,0.0,Clear
05/04/2025,14:00,40.608204,-73.92071,BROOKLYN,1.0,0.0,0,0,0,0,1,0,4810491,2025-05-04 14:00:00,2025-05-04T14:00,2025,5,15.5,0.9,Drizzle
06/28/2025,14:00,40.67398,-73.91115,BROOKLYN,1.0,0.0,0,0,0,0,1,0,4824349,2025-06-28 14:00:00,2025-06-28T14:00,2025,6,27.6,0.0,Cloudy
06/29/2025,13:00,40.59592,-73.94102,BROOKLYN,1.0,0.0,0,0,0,0,1,0,4826739,2025-06-29 13:00:00,2025-06-29T13:00,2025,6,32.2,0.0,Cloudy
04/25/2025,12:00,40.687126,-73.99687,BROOKLYN,1.0,0.0,0,0,0,0,1,0,4808034,2025-04-25 12:00:00,2025-04-25T12:00,2025,4,21.2,0.0,Cloudy
07/07/2025,15:00,40.689785,-73.96519,BROOKLYN,1.0,0.0,0,0,1,0,0,0,4826280,2025-07-07 15:00:00,2025-07-07T15:00,2025,7,28.4,0.0,Cloudy
01/30/2025,0:00,40.674072,-73.86299,BROOKLYN,1.0,0.0,1,0,0,0,0,0,4789488,2025-01-30 00:00:00,2025-01-30T00:00,2025,1,-1.1,0.0,Clear
08/13/2025,15:00,40.68933,-73.922585,BROOKLYN,2.0,0.0,0,0,0,0,2,0,4834979,2025-08-13 15:00:00,2025-08-13T15:00,2025,8,27.9,0.0,Cloudy
03/07/2025,0:00,40.680244,-73.8766,BROOKLYN,2.0,0.0,0,0,0,0,2,0,4797450,2025-03-07 00:00:00,2025-03-07T00:00,2025,3,0.8,0.0,Clear
05/12/2025,17:00,40.638264,-74.02109,BROOKLYN,1.0,0.0,0,0,0,0,1,0,4812321,2025-05-12 17:00:00,2025-05-12T17:00,2025,5,19.6,0.0,Cloudy
10/14/2025,15:00,40.65266,-73.86971,BROOKLYN,1.0,0.0,1,0,0,0,0,0,4850907,2025-10-14 15:00:00,2025-10-14T15:00,2025,10,16.9,0.0,Cloudy
10/09/2025,21:00,40.61606,-74.02575,BROOKLYN,0.0,0.0,0,0,0,0,0,0,4849357,2025-10-09 21:00:00,2025-10-09T21:00,2025,10,10.1,0.0,Clear
07/22/2025,16:00,40.634804,-74.00106,BROOKLYN,1.0,0.0,0,0,1,0,0,0,4829521,2025-07-22 16:00:00,2025-07-22T16:00,2025,7,25.1,0.0,Clear
02/15/2025,20:00,40.62951,-73.94415,BROOKLYN,1.0,0.0,1,0,0,0,0,0,4792815,2025-02-15 20:00:00,2025-02-15T20:00,2025,2,2.0,1.1,Drizzle
03/20/2025,18:00,40.63627,-73.94801,BROOKLYN,1.0,0.0,0,0,0,0,1,0,4800531,2025-03-20 18:00:00,2025-03-20T18:00,2025,3,7.6,0.0,Cloudy
02/28/2025,7:00,40.6256,-74.03607,BROOKLYN,1.0,0.0,1,0,0,0,0,0,4798049,2025-02-28 07:00:00,2025-02-28T07:00,2025,2,2.2,0.0,Clear
01/24/2025,0:00,40.661728,-73.868164,BROOKLYN,2.0,0.0,0,0,0,0,2,0,4788347,2025-01-24 00:00:00,2025-01-24T00:00,2025,1,-6.6,0.0,Clear
05/08/2025,18:00,0.0,0.0,BROOKLYN,1.0,0.0,0,0,1,0,0,0,4812071,2025-05-08 18:00:00,2025-05-08T18:00,2025,5,26.0,2.3,Light Rain
05/10/2025,20:00,40.648643,-73.955765,BROOKLYN,1.0,0.0,1,0,0,0,0,0,4813608,2025-05-10 20:00:00,2025-05-10T20:00,2025,5,18.0,0.0,Cloudy
09/21/2025,0:00,40.73256,-73.95971,BROOKLYN,1.0,0.0,0,0,1,0,0,0,4845546,2025-09-21 00:00:00,2025-09-21T00:00,2025,9,15.9,0.0,Clear
08/12/2025,0:00,40.668503,-73.9179,BROOKLYN,1.0,0.0,1,0,0,0,0,0,4836804,2025-08-12 00:00:00,2025-08-12T00:00,2025,8,22.9,0.0,Clear
01/09/2025,14:00,40.688618,-73.98917,BROOKLYN,1.0,0.0,1,0,0,0,0,0,4785267,2025-01-09 14:00:00,2025-01-09T14:00,2025,1,-1.6,0.0,Clear
01/19/2025,4:00,40.688255,-73.97929,BROOKLYN,1.0,0.0,0,0,0,0,1,0,4787175,2025-01-19 04:00:00,2025-01-19T04:00,2025,1,0.8,0.0,Clear
07/13/2025,17:00,40.586754,-73.95805,BROOKLYN,1.0,0.0,1,0,0,0,0,0,4827381,2025-07-13 17:00:00,2025-07-13T17:00,2025,7,25.7,0.0,Cloudy
05/07/2025,11:00,40.640514,-74.00048,BROOKLYN,1.0,0.0,0,0,0,0,1,0,4811119,2025-05-07 11:00:00,2025-05-07T11:00,2025,5,19.8,0.0,Clear
04/27/2025,1:00,40.708546,-73.92286,BROOKLYN,0.0,0.0,0,0,0,0,0,0,4808600,2025-04-27 01:00:00,2025-04-27T01:00,2025,4,10.1,0.0,Clear
08/04/2025,19:00,40.609417,-73.96769,BROOKLYN,1.0,0.0,1,0,0,0,0,0,4832800,2025-08-04 19:00:00,2025-08-04T19:00,2025,8,25.3,0.0,Clear
04/27/2025,9:00,40.67347,-73.99839,BROOKLYN,1.0,0.0,0,0,0,0,1,0,4808402,2025-04-27 09:00:00,2025-04-27T09:00,2025,4,11.9,0.0,Cloudy
01/05/2025,12:00,40.664097,-73.90931,BROOKLYN,1.0,0.0,0,0,0,0,1,0,4784233,2025-01-05 12:00:00,2025-01-05T12:00,2025,1,-0.5,0.0,Cloudy
09/03/2025,0:00,40.671066,-73.90143,BROOKLYN,2.0,0.0,0,0,0,0,2,0,4839425,2025-09-03 00:00:00,2025-09-03T00:00,2025,9,18.5,0.0,Clear
10/22/2025,21:00,40.650707,-73.92058,BROOKLYN,1.0,0.0,0,0,0,0,1,0,4851879,2025-10-22 21:00:00,2025-10-22T21:00,2025,10,12.5,0.0,Cloudy
07/25/2025,16:00,40.65636,-73.934784,BROOKLYN,1.0,0.0,0,0,1,0,0,0,4831472,2025-07-25 16:00:00,2025-07-25T16:00,2025,7,32.6,0.0,Cloudy
07/04/2025,12:00,40.59938,-73.9514,BROOKLYN,2.0,0.0,0,0,0,0,2,0,4825703,2025-07-04 12:00:00,2025-07-04T12:00,2025,7,26.5,0.0,Clear
08/07/2025,10:00,40.69133,-73.95176,BROOKLYN,1.0,0.0,0,0,0,0,1,0,4833604,2025-08-07 10:00:00,2025-08-07T10:00,2025,8,25.1,0.0,Clear
09/06/2025,20:00,40.607677,-74.00171,BROOKLYN,1.0,0.0,1,0,0,0,0,0,4840123,2025-09-06 20:00:00,2025-09-06T20:00,2025,9,22.1,2.8,Heavy Rain
01/29/2025,0:00,40.63948,-74.01617,BROOKLYN,1.0,0.0,0,0,0,0,1,0,4789075,2025-01-29 00:00:00,2025-01-29T00:00,2025,1,0.4,0.0,Clear
01/01/2025,0:00,40.66326,-73.99511,BROOKLYN,1.0,0.0,0,0,0,0,0,0,4783162,2025-01-01 00:00:00,2025-01-01T00:00,2025,1,9.7,1.1,Drizzle
09/04/2025,0:00,40.636784,-73.97234,BROOKLYN,1.0,0.0,0,0,0,0,1,0,4839753,2025-09-04 00:00:00,2025-09-04T00:00,2025,9,18.9,0.0,Clear
06/12/2025,0:00,40.674072,-73.86299,BROOKLYN,1.0,0.0,0,0,0,0,1,0,4819969,2025-06-12 00:00:00,2025-06-12T00:00,2025,6,22.5,0.0,Clear
07/18/2025,0:00,40.652767,-73.88629,BROOKLYN,1.0,0.0,0,0,0,0,1,0,4828803,2025-07-18 00:00:00,2025-07-18T00:00,2025,7,27.5,0.0,Clear
07/29/2025,22:00,40.6752,-73.96088,BROOKLYN,1.0,0.0,0,0,1,0,0,0,4832257,2025-07-29 22:00:00,2025-07-29T22:00,2025,7,29.8,0.0,Clear
07/29/2025,21:00,40.667015,-73.93129,BROOKLYN,1.0,0.0,0,0,0,0,1,0,4831628,2025-07-29 21:00:00,2025-07-29T21:00,2025,7,29.9,0.0,Clear
02/28/2025,0:00,40.637775,-73.99539,BROOKLYN,1.0,0.0,0,0,0,0,0,0,4795491,2025-02-28 00:00:00,2025-02-28T00:00,2025,2,6.6,0.0,Cloudy
10/18/2025,0:00,40.72912,-73.953926,BROOKLYN,1.0,0.0,0,0,0,0,1,0,4851956,2025-10-18 00:00:00,2025-10-18T00:00,2025,10,8.2,0.0,Clear
02/08/2025,22:00,40.6802,-73.953285,BROOKLYN,1.0,0.0,1,0,0,0,0,0,4792660,2025-02-08 22:00:00,2025-02-08T22:00,2025,2,-0.2,3.4,Heavy Snow
06/12/2025,19:00,40.6789,-73.88052,BROOKLYN,1.0,0.0,0,0,0,0,1,0,4819970,2025-06-12 19:00:00,2025-06-12T19:00,2025,6,30.2,0.0,Cloudy
04/07/2025,14:00,40.697803,-73.96973,BROOKLYN,1.0,0.0,0,0,1,0,0,0,4804371,2025-04-07 14:00:00,2025-04-07T14:00,2025,4,7.1,0.3,Drizzle
10/03/2025,12:00,40.666126,-73.99529,BROOKLYN,1.0,0.0,0,0,0,0,1,0,4847949,2025-10-03 12:00:00,2025-10-03T12:00,2025,10,19.3,0.0,Clear
08/26/2025,20:00,40.602795,-73.941315,BROOKLYN,1.0,0.0,0,0,0,0,1,0,4837844,2025-08-26 20:00:00,2025-08-26T20:00,2025,8,22.9,0.0,Clear
09/09/2025,10:00,40.68493,-73.98011,BROOKLYN,1.0,0.0,0,0,0,0,1,0,4841629,2025-09-09 10:00:00,2025-09-09T10:00,2025,9,19.8,0.0,Clear
10/05/2025,17:00,40.686092,-73.93866,BROOKLYN,1.0,0.0,0,0,1,0,0,0,4847827,2025-10-05 17:00:00,2025-10-05T17:00,2025,10,23.0,0.0,Clear
03/15/2025,0:00,40.63823,-73.89599,BROOKLYN,2.0,0.0,0,0,0,0,2,0,4798767,2025-03-15 00:00:00,2025-03-15T00:00,2025,3,4.8,0.0,Cloudy
07/28/2025,15:00,40.68107,-73.8808,BROOKLYN,0.0,0.0,0,0,0,0,0,0,4831247,2025-07-28 15:00:00,2025-07-28T15:00,2025,7,35.2,0.0,Clear
05/28/2025,22:00,40.68063,-73.96804,BROOKLYN,1.0,0.0,1,0,0,0,0,0,4816382,2025-05-28 22:00:00,2025-05-28T22:00,2025,5,12.5,0.1,Drizzle
02/04/2025,0:00,40.627872,-73.9848,BROOKLYN,2.0,0.0,2,0,0,0,0,0,4792125,2025-02-04 00:00:00,2025-02-04T00:00,2025,2,5.7,0.0,Cloudy
02/05/2025,20:00,40.682392,-73.87662,BROOKLYN,1.0,0.0,0,0,0,0,0,0,4790719,2025-02-05 20:00:00,2025-02-05T20:00,2025,2,-0.5,0.0,Cloudy
08/19/2025,0:00,40.655422,-73.950066,BROOKLYN,1.0,0.0,0,0,0,0,1,0,4841148,2025-08-19 00:00:00,2025-08-19T00:00,2025,8,20.2,0.0,Clear
06/14/2025,8:00,40.66519,-73.869385,BROOKLYN,2.0,0.0,0,0,0,0,2,0,4820490,2025-06-14 08:00:00,2025-06-14T08:00,2025,6,16.5,0.1,Drizzle
08/12/2025,0:00,40.681232,-73.881424,BROOKLYN,1.0,0.0,0,0,0,0,1,0,4834508,2025-08-12 00:00:00,2025-08-12T00:00,2025,8,22.9,0.0,Clear
07/01/2025,15:00,40.70497,-73.9332,BROOKLYN,0.0,0.0,0,0,0,0,0,0,4824588,2025-07-01 15:00:00,2025-07-01T15:00,2025,7,30.8,0.0,Cloudy
02/04/2025,17:00,40.696987,-73.93523,BROOKLYN,1.0,0.0,1,0,0,0,0,0,4790766,2025-02-04 17:00:00,2025-02-04T17:00,2025,2,2.3,0.0,Clear
07/04/2025,0:00,40.578438,-73.96804,BROOKLYN,1.0,0.0,0,0,0,0,1,0,4827723,2025-07-04 00:00:00,2025-07-04T00:00,2025,7,21.1,0.0,Clear
10/19/2025,5:00,40.650146,-74.00507,BROOKLYN,2.0,0.0,0,0,0,0,2,0,4850775,2025-10-19 05:00:00,2025-10-19T05:00,2025,10,11.1,0.0,Clear
06/20/2025,0:00,40.62984,-73.96322,BROOKLYN,1.0,0.0,1,0,0,0,0,0,4822018,2025-06-20 00:00:00,2025-06-20T00:00,2025,6,21.8,0.0,Clear
03/28/2025,21:00,40.61873,-73.94026,BROOKLYN,0.0,0.0,0,0,0,0,0,0,4801951,2025-03-28 21:00:00,2025-03-28T21:00,2025,3,11.1,0.0,Clear
03/05/2025,19:00,40.683727,-73.967964,BROOKLYN,1.0,0.0,1,0,0,0,0,0,4797043,2025-03-05 19:00:00,2025-03-05T19:00,2025,3,9.7,6.8,Heavy Rain
07/12/2025,0:00,40.670033,-73.90933,BROOKLYN,1.0,0.0,1,0,0,0,0,0,4828961,2025-07-12 00:00:00,2025-07-12T00:00,2025,7,22.8,0.0,Cloudy
08/07/2025,16:00,40.696133,-73.98711,BROOKLYN,1.0,0.0,0,0,0,0,1,0,4835112,2025-08-07 16:00:00,2025-08-07T16:00,2025,8,24.5,0.0,Clear
03/22/2025,12:00,40.636894,-73.95172,BROOKLYN,1.0,0.0,0,0,0,0,1,0,4801165,2025-03-22 12:00:00,2025-03-22T12:00,2025,3,12.8,0.0,Cloudy
09/22/2025,21:00,40.64544,-74.01334,BROOKLYN,1.0,0.0,1,0,0,0,0,0,4844391,2025-09-22 21:00:00,2025-09-22T21:00,2025,9,19.1,0.0,Clear
10/17/2025,0:00,40.692627,-73.95899,BROOKLYN,1.0,0.0,0,0,1,0,0,0,4851434,2025-10-17 00:00:00,2025-10-17T00:00,2025,10,8.6,0.0,Clear
09/29/2025,0:00,40.654045,-73.92672,BROOKLYN,1.0,0.0,0,0,1,0,0,0,4847980,2025-09-29 00:00:00,2025-09-29T00:00,2025,9,20.8,0.0,Cloudy
05/27/2025,1:00,40.59266,-73.98056,BROOKLYN,0.0,0.0,0,0,0,0,0,0,4816994,2025-05-27 01:00:00,2025-05-27T01:00,2025,5,15.1,0.0,Cloudy
03/11/2025,16:00,40.662556,-73.90892,BROOKLYN,1.0,0.0,0,0,0,0,1,0,4797989,2025-03-11 16:00:00,2025-03-11T16:00,2025,3,11.2,0.0,Clear
03/09/2025,0:00,40.642574,-73.89795,BROOKLYN,1.0,0.0,0,0,0,0,1,0,4799499,2025-03-09 00:00:00,2025-03-09T00:00,2025,3,0.9,0.0,Clear
05/07/2025,0:00,40.670124,-73.95527,BROOKLYN,1.0,0.0,0,0,1,0,0,0,4811949,2025-05-07 00:00:00,2025-05-07T00:00,2025,5,14.7,0.0,Cloudy
01/04/2025,16:00,40.626713,-73.97659,BROOKLYN,0.0,0.0,0,0,0,0,0,0,4783819,2025-01-04 16:00:00,2025-01-04T16:00,2025,1,-0.7,0.0,Cloudy
07/13/2025,0:00,40.635258,-73.927444,BROOKLYN,0.0,0.0,0,0,0,0,0,0,4827531,2025-07-13 00:00:00,2025-07-13T00:00,2025,7,22.7,0.0,Cloudy
02/11/2025,14:00,40.687122,-73.99814,BROOKLYN,0.0,0.0,0,0,0,0,0,0,4792272,2025-02-11 14:00:00,2025-02-11T14:00,2025,2,-0.3,0.0,Cloudy
08/18/2025,0:00,40.703938,-73.93479,BROOKLYN,1.0,0.0,1,0,0,0,0,0,4835886,2025-08-18 00:00:00,2025-08-18T00:00,2025,8,21.9,0.0,Clear
02/11/2025,23:00,40.66335,-73.93012,BROOKLYN,2.0,0.0,0,0,0,0,2,0,4792318,2025-02-11 23:00:00,2025-02-11T23:00,2025,2,-1.4,0.8,Heavy Snow
09/28/2025,17:00,40.68506,-73.971825,BROOKLYN,1.0,0.0,0,0,1,0,0,0,4846032,2025-09-28 17:00:00,2025-09-28T17:00,2025,9,25.3,0.0,Clear
01/28/2025,11:00,40.65753,-73.897964,BROOKLYN,1.0,0.0,0,0,0,0,1,0,4788867,2025-01-28 11:00:00,2025-01-28T11:00,2025,1,4.5,0.0,Clear
01/20/2025,18:00,40.63633,-73.947044,BROOKLYN,1.0,0.0,0,0,0,0,0,0,4787386,2025-01-20 18:00:00,2025-01-20T18:00,2025,1,-7.6,0.0,Cloudy
10/19/2025,2:00,40.67059,-73.87611,BROOKLYN,1.0,0.0,0,0,0,0,1,0,4850938,2025-10-19 02:00:00,2025-10-19T02:00,2025,10,11.8,0.0,Clear
01/14/2025,9:00,40.66464,-73.9889,BROOKLYN,1.0,0.0,1,0,0,0,0,0,4786151,2025-01-14 09:00:00,2025-01-14T09:00,2025,1,-2.3,0.0,Clear
01/19/2025,20:00,40.636692,-74.00267,BROOKLYN,1.0,0.0,1,0,0,0,0,0,4787003,2025-01-19 20:00:00,2025-01-19T20:00,2025,1,-1.1,1.7,Heavy Snow
09/19/2025,21:00,40.6827,-73.92901,BROOKLYN,1.0,0.0,0,0,1,0,0,0,4843761,2025-09-19 21:00:00,2025-09-19T21:00,2025,9,23.7,0.0,Clear
10/02/2025,0:00,40.61895,-73.92688,BROOKLYN,2.0,0.0,0,0,0,0,2,0,4846851,2025-10-02 00:00:00,2025-10-02T00:00,2025,10,13.7,0.0,Clear
05/10/2025,12:00,40.690765,-73.98334,BROOKLYN,1.0,0.0,1,0,0,0,0,0,4811788,2025-05-10 12:00:00,2025-05-10T12:00,2025,5,18.3,0.0,Clear
09/05/2025,13:00,40.609707,-73.9712,BROOKLYN,3.0,0.0,0,0,0,0,3,0,4839873,2025-09-05 13:00:00,2025-09-05T13:00,2025,9,24.3,0.2,Drizzle
05/13/2025,21:00,40.67216,-73.98721,BROOKLYN,2.0,0.0,0,0,0,0,2,0,4814163,2025-05-13 21:00:00,2025-05-13T21:00,2025,5,15.6,0.3,Drizzle
03/16/2025,23:00,40.632057,-73.9433,BROOKLYN,1.0,0.0,0,0,0,0,1,0,4801898,2025-03-16 23:00:00,2025-03-16T23:00,2025,3,12.5,1.5,Light Rain
08/17/2025,11:00,40.67261,-73.89991,BROOKLYN,1.0,0.0,0,0,1,0,0,0,4835653,2025-08-17 11:00:00,2025-08-17T11:00,2025,8,30.7,0.0,Cloudy
01/02/2025,9:00,40.61255,-73.96286,BROOKLYN,1.0,0.0,0,0,1,0,0,0,4783820,2025-01-02 09:00:00,2025-01-02T09:00,2025,1,3.2,0.0,Clear
01/19/2025,0:00,40.654133,-73.91233,BROOKLYN,0.0,0.0,0,0,0,0,0,0,4786720,2025-01-19 00:00:00,2025-01-19T00:00,2025,1,2.8,0.0,Clear
02/14/2025,0:00,40.71051,-73.95655,BROOKLYN,1.0,0.0,0,0,0,0,1,0,4792988,2025-02-14 00:00:00,2025-02-14T00:00,2025,2,-0.2,0.0,Clear
08/06/2025,5:00,40.655632,-73.95986,BROOKLYN,1.0,0.0,1,0,0,0,0,0,4833816,2025-08-06 05:00:00,2025-08-06T05:00,2025,8,21.4,0.0,Cloudy
06/21/2025,16:00,40.588524,-73.951355,BROOKLYN,0.0,0.0,0,0,0,0,0,0,4822354,2025-06-21 16:00:00,2025-06-21T16:00,2025,6,26.5,0.1,Drizzle
04/06/2025,2:00,40.643066,-73.94931,BROOKLYN,1.0,0.0,1,0,0,0,0,0,4805308,2025-04-06 02:00:00,2025-04-06T02:00,2025,4,6.7,0.2,Drizzle
08/25/2025,12:00,40.67138,-73.89203,BROOKLYN,1.0,0.0,0,0,0,0,1,0,4838672,2025-08-25 12:00:00,2025-08-25T12:00,2025,8,29.5,0.0,Clear
10/10/2025,0:00,40.69192,-73.97895,BROOKLYN,1.0,0.0,0,0,1,0,0,0,4848810,2025-10-10 00:00:00,2025-10-10T00:00,2025,10,8.6,0.0,Clear
03/30/2025,0:00,40.58481,-73.983,BROOKLYN,2.0,0.0,0,0,0,0,2,0,4802442,2025-03-30 00:00:00,2025-03-30T00:00,2025,3,5.6,0.0,Cloudy
07/29/2025,0:00,40.683655,-74.00582,BROOKLYN,1.0,0.0,0,0,0,0,1,0,4831423,2025-07-29 00:00:00,2025-07-29T00:00,2025,7,26.5,0.0,Cloudy
05/14/2025,9:00,40.609787,-73.95862,BROOKLYN,1.0,0.0,1,0,0,0,0,0,4813302,2025-05-14 09:00:00,2025-05-14T09:00,2025,5,15.2,1.6,Light Rain
03/13/2025,12:00,40.701103,-73.922386,BROOKLYN,1.0,0.0,1,0,0,0,0,0,4798444,2025-03-13 12:00:00,2025-03-13T12:00,2025,3,8.7,0.0,Cloudy
10/05/2025,3:00,40.64147,-73.95937,BROOKLYN,1.0,0.0,1,0,0,0,0,0,4849569,2025-10-05 03:00:00,2025-10-05T03:00,2025,10,16.7,0.0,Clear
03/27/2025,13:00,40.62657,-73.970924,BROOKLYN,1.0,0.0,0,0,0,0,1,0,4801851,2025-03-27 13:00:00,2025-03-27T13:00,2025,3,8.2,0.0,Clear
08/30/2025,0:00,40.667095,-73.92275,BROOKLYN,1.0,0.0,0,0,0,0,1,0,4838551,2025-08-30 00:00:00,2025-08-30T00:00,2025,8,18.2,0.0,Clear
06/02/2025,8:00,40.651325,-73.93905,BROOKLYN,0.0,0.0,0,0,0,0,0,0,4819308,2025-06-02 08:00:00,2025-06-02T08:00,2025,6,16.4,0.0,Clear
06/07/2025,1:00,40.62315,-74.02897,BROOKLYN,0.0,0.0,0,0,0,0,0,0,4818456,2025-06-07 01:00:00,2025-06-07T01:00,2025,6,21.1,0.0,Cloudy
03/19/2025,18:00,40.689217,-73.91765,BROOKLYN,1.0,0.0,0,0,0,0,1,0,4800008,2025-03-19 18:00:00,2025-03-19T18:00,2025,3,7.6,0.0,Cloudy
05/25/2025,20:00,40.67416,-73.94731,BROOKLYN,1.0,0.0,0,0,0,0,1,0,4817864,2025-05-25 20:00:00,2025-05-25T20:00,2025,5,16.2,0.0,Clear
05/13/2025,0:00,40.693375,-73.942856,BROOKLYN,1.0,0.0,0,0,1,0,0,0,4812780,2025-05-13 00:00:00,2025-05-13T00:00,2025,5,16.9,0.0,Cloudy
08/20/2025,9:00,40.697716,-73.96773,BROOKLYN,1.0,0.0,0,0,1,0,0,0,4836314,2025-08-20 09:00:00,2025-08-20T09:00,2025,8,21.4,0.2,Drizzle
08/15/2025,21:00,40.65159,-73.93892,BROOKLYN,1.0,0.0,1,0,0,0,0,0,4837211,2025-08-15 21:00:00,2025-08-15T21:00,2025,8,23.9,0.0,Clear
08/10/2025,16:00,40.65408,-73.89161,BROOKLYN,1.0,0.0,0,0,0,0,1,0,4834454,2025-08-10 16:00:00,2025-08-10T16:00,2025,8,29.3,0.0,Cloudy
04/14/2025,2:00,40.63526,-73.91458,BROOKLYN,2.0,0.0,0,0,0,0,2,0,4807122,2025-04-14 02:00:00,2025-04-14T02:00,2025,4,7.5,0.0,Clear
04/29/2025,17:00,40.641083,-73.96558,BROOKLYN,1.0,0.0,0,0,0,0,0,0,4809938,2025-04-29 17:00:00,2025-04-29T17:00,2025,4,21.8,0.0,Cloudy
05/12/2025,16:00,40.66993,-73.88069,BROOKLYN,1.0,0.0,1,0,0,0,0,0,4813059,2025-05-12 16:00:00,2025-05-12T16:00,2025,5,17.6,0.0,Cloudy
05/02/2025,7:00,40.642376,-73.99523,BROOKLYN,1.0,0.0,1,0,0,0,0,0,4809878,2025-05-02 07:00:00,2025-05-02T07:00,2025,5,18.7,0.0,Cloudy
10/06/2025,20:00,40.595776,-73.98822,BROOKLYN,1.0,0.0,0,0,0,0,0,0,4848016,2025-10-06 20:00:00,2025-10-06T20:00,2025,10,20.0,0.0,Cloudy
07/06/2025,9:00,40.652145,-73.95915,BROOKLYN,0.0,0.0,0,0,0,0,0,0,4826069,2025-07-06 09:00:00,2025-07-06T09:00,2025,7,27.7,0.0,Clear
02/26/2025,0:00,40.644684,-73.96368,BROOKLYN,0.0,0.0,0,0,0,0,0,0,4796051,2025-02-26 00:00:00,2025-02-26T00:00,2025,2,4.9,0.0,Clear
05/28/2025,0:00,40.68608,-73.990906,BROOKLYN,1.0,0.0,0,0,1,0,0,0,4817130,2025-05-28 00:00:00,2025-05-28T00:00,2025,5,17.7,0.0,Cloudy
10/02/2025,0:00,40.639736,-73.930115,BROOKLYN,1.0,0.0,1,0,0,0,0,0,4848597,2025-10-02 00:00:00,2025-10-02T00:00,2025,10,13.3,0.0,Clear
02/11/2025,16:00,40.607456,-73.98533,BROOKLYN,1.0,0.0,1,0,0,0,0,0,4792015,2025-02-11 16:00:00,2025-02-11T16:00,2025,2,1.3,0.0,Cloudy
08/02/2025,19:00,40.67482,-73.89367,BROOKLYN,3.0,0.0,0,0,0,0,3,0,4832277,2025-08-02 19:00:00,2025-08-02T19:00,2025,8,22.3,0.0,Cloudy
10/13/2025,23:00,40.68029,-73.94773,BROOKLYN,1.0,0.0,0,0,0,0,1,0,4851416,2025-10-13 23:00:00,2025-10-13T23:00,2025,10,13.7,0.0,Cloudy
07/19/2025,0:00,40.650826,-73.975494,BROOKLYN,1.0,0.0,0,0,0,0,1,0,4829876,2025-07-19 00:00:00,2025-07-19T00:00,2025,7,24.9,0.0,Clear
04/13/2025,12:00,40.656143,-73.977295,BROOKLYN,1.0,0.0,0,0,1,0,0,0,4806377,2025-04-13 12:00:00,2025-04-13T12:00,2025,4,11.6,0.0,Cloudy
10/02/2025,17:00,40.63488,-73.98405,BROOKLYN,1.0,0.0,1,0,0,0,0,0,4846915,2025-10-02 17:00:00,2025-10-02T17:00,2025,10,17.3,0.0,Cloudy
03/22/2025,14:00,40.696198,-73.98876,BROOKLYN,0.0,0.0,0,0,0,0,0,0,4801613,2025-03-22 14:00:00,2025-03-22T14:00,2025,3,14.9,0.0,Cloudy
06/08/2025,14:00,40.666496,-73.9312,BROOKLYN,1.0,0.0,1,0,0,0,0,0,4819133,2025-06-08 14:00:00,2025-06-08T14:00,2025,6,21.4,0.0,Cloudy
09/18/2025,0:00,40.70604,-73.941284,BROOKLYN,1.0,0.0,0,0,1,0,0,0,4843752,2025-09-18 00:00:00,2025-09-18T00:00,2025,9,19.3,0.0,Cloudy
07/18/2025,11:00,40.66326,-73.99511,BROOKLYN,0.0,0.0,0,0,0,0,0,0,4830112,2025-07-18 11:00:00,2025-07-18T11:00,2025,7,27.7,0.0,Cloudy
06/16/2025,21:00,40.620483,-74.00007,BROOKLYN,1.0,0.0,1,0,0,0,0,0,4820593,2025-06-16 21:00:00,2025-06-16T21:00,2025,6,17.0,0.5,Drizzle
01/06/2025,21:00,40.70161,-73.92056,BROOKLYN,1.0,0.0,1,0,0,0,0,0,4798423,2025-01-06 21:00:00,2025-01-06T21:00,2025,1,-3.7,0.0,Cloudy
08/01/2025,21:00,40.689754,-73.93939,BROOKLYN,1.0,0.0,0,0,0,0,1,0,4832425,2025-08-01 21:00:00,2025-08-01T21:00,2025,8,20.6,0.0,Cloudy
09/04/2025,13:00,40.61059,-73.95537,BROOKLYN,0.0,0.0,0,0,0,0,0,0,4842672,2025-09-04 13:00:00,2025-09-04T13:00,2025,9,22.9,0.0,Clear
04/21/2025,15:00,40.63686,-73.938484,BROOKLYN,0.0,0.0,0,0,0,0,0,0,4807323,2025-04-21 15:00:00,2025-04-21T15:00,2025,4,11.8,0.0,Cloudy
02/04/2025,12:00,40.71924,-73.956436,BROOKLYN,0.0,0.0,0,0,0,0,0,0,4793561,2025-02-04 12:00:00,2025-02-04T12:00,2025,2,6.4,0.0,Clear
10/12/2025,23:00,40.695953,-73.98239,BROOKLYN,1.0,0.0,0,0,0,0,1,0,4849475,2025-10-12 23:00:00,2025-10-12T23:00,2025,10,14.0,1.4,Light Rain
03/07/2025,8:00,40.708427,-73.9579,BROOKLYN,1.0,0.0,0,0,0,0,1,0,4797800,2025-03-07 08:00:00,2025-03-07T08:00,2025,3,1.9,0.0,Clear
07/19/2025,13:00,40.698246,-73.980545,BROOKLYN,1.0,0.0,0,0,1,0,0,0,4830050,2025-07-19 13:00:00,2025-07-19T13:00,2025,7,27.1,0.0,Cloudy
08/04/2025,17:00,40.659256,-73.97801,BROOKLYN,1.0,0.0,0,0,0,0,1,0,4832955,2025-08-04 17:00:00,2025-08-04T17:00,2025,8,27.8,0.0,Cloudy
04/20/2025,12:00,40.68397,-73.94404,BROOKLYN,2.0,0.0,0,0,0,0,2,0,4808170,2025-04-20 12:00:00,2025-04-20T12:00,2025,4,17.4,0.0,Cloudy
09/02/2025,17:00,40.606445,-74.00588,BROOKLYN,2.0,0.0,0,0,0,0,2,0,4839241,2025-09-02 17:00:00,2025-09-02T17:00,2025,9,21.3,0.0,Clear
01/05/2025,9:00,40.70307,-73.956985,BROOKLYN,1.0,0.0,0,0,1,0,0,0,4783772,2025-01-05 09:00:00,2025-01-05T09:00,2025,1,-2.4,0.0,Clear
09/03/2025,13:00,40.675816,-73.89583,BROOKLYN,1.0,0.0,0,0,0,0,1,0,4839422,2025-09-03 13:00:00,2025-09-03T13:00,2025,9,24.0,0.0,Clear
08/30/2025,10:00,40.69612,-73.90501,BROOKLYN,1.0,0.0,1,0,0,0,0,0,4839364,2025-08-30 10:00:00,2025-08-30T10:00,2025,8,20.7,0.0,Clear
01/16/2025,9:00,40.69279,-73.95205,BROOKLYN,2.0,0.0,0,0,0,0,2,0,4786417,2025-01-16 09:00:00,2025-01-16T09:00,2025,1,-4.9,0.0,Cloudy
01/04/2025,2:00,40.63948,-74.01617,BROOKLYN,1.0,0.0,0,0,1,0,0,0,4783586,2025-01-04 02:00:00,2025-01-04T02:00,2025,1,-2.0,0.0,Cloudy
06/02/2025,0:00,40.677147,-73.88362,BROOKLYN,1.0,0.0,0,0,0,0,1,0,4817659,2025-06-02 00:00:00,2025-06-02T00:00,2025,6,12.9,0.0,Clear
05/30/2025,14:00,40.655304,-73.87176,BROOKLYN,0.0,0.0,0,0,0,0,0,0,4817655,2025-05-30 14:00:00,2025-05-30T14:00,2025,5,18.5,0.0,Cloudy
10/06/2025,18:00,40.58478,-73.96255,BROOKLYN,1.0,0.0,1,0,0,0,0,0,4849078,2025-10-06 18:00:00,2025-10-06T18:00,2025,10,20.2,0.0,Clear
05/13/2025,16:00,40.64557,-73.90298,BROOKLYN,1.0,0.0,1,0,0,0,0,0,4812714,2025-05-13 16:00:00,2025-05-13T16:00,2025,5,17.2,0.3,Drizzle
01/10/2025,9:00,40.579826,-73.97621,BROOKLYN,1.0,0.0,1,0,0,0,0,0,4785164,2025-01-10 09:00:00,2025-01-10T09:00,2025,1,-1.2,0.0,Cloudy
05/15/2025,9:00,40.6147,-74.00011,BROOKLYN,1.0,0.0,0,0,0,0,1,0,4812970,2025-05-15 09:00:00,2025-05-15T09:00,2025,5,18.0,0.2,Drizzle
02/05/2025,16:00,40.690033,-73.96037,BROOKLYN,0.0,0.0,0,0,0,0,0,0,4790664,2025-02-05 16:00:00,2025-02-05T16:00,2025,2,1.4,0.0,Cloudy
01/28/2025,20:00,40.71845,-73.96357,BROOKLYN,1.0,0.0,0,0,0,0,1,0,4790274,2025-01-28 20:00:00,2025-01-28T20:00,2025,1,-1.9,0.0,Cloudy
06/11/2025,17:00,40.632294,-73.966774,BROOKLYN,1.0,0.0,0,0,0,0,1,0,4819734,2025-06-11 17:00:00,2025-06-11T17:00,2025,6,25.0,0.0,Cloudy
01/02/2025,4:00,40.64713,-73.919685,BROOKLYN,2.0,0.0,0,0,0,0,2,0,4783317,2025-01-02 04:00:00,2025-01-02T04:00,2025,1,1.8,0.0,Clear
10/04/2025,20:00,40.68867,-73.914474,BROOKLYN,1.0,0.0,0,0,0,0,1,0,4847299,2025-10-04 20:00:00,2025-10-04T20:00,2025,10,20.7,0.0,Cloudy
02/19/2025,9:00,40.678253,-73.99091,BROOKLYN,0.0,0.0,0,0,0,0,0,0,4793966,2025-02-19 09:00:00,2025-02-19T09:00,2025,2,-6.0,0.0,Cloudy
03/25/2025,8:00,40.596615,-73.999344,BROOKLYN,1.0,0.0,0,0,0,0,0,0,4801099,2025-03-25 08:00:00,2025-03-25T08:00,2025,3,8.3,0.0,Cloudy
06/15/2025,4:00,40.675755,-73.97142,BROOKLYN,1.0,0.0,0,0,0,0,1,0,4820486,2025-06-15 04:00:00,2025-06-15T04:00,2025,6,15.2,0.0,Cloudy
08/23/2025,19:00,40.653725,-73.88578,BROOKLYN,0.0,0.0,0,0,0,0,0,0,4837490,2025-08-23 19:00:00,2025-08-23T19:00,2025,8,22.1,0.0,Clear
01/10/2025,18:00,40.632206,-73.9096,BROOKLYN,1.0,0.0,1,0,0,0,0,0,4785915,2025-01-10 18:00:00,2025-01-10T18:00,2025,1,0.8,0.0,Cloudy
07/09/2025,8:00,40.65905,-73.87591,BROOKLYN,1.0,0.0,0,0,0,0,0,0,4826329,2025-07-09 08:00:00,2025-07-09T08:00,2025,7,26.6,0.0,Clear
04/08/2025,0:00,40.57848,-73.989456,BROOKLYN,1.0,0.0,1,0,0,0,0,0,4804816,2025-04-08 00:00:00,2025-04-08T00:00,2025,4,5.2,0.0,Cloudy
04/03/2025,14:00,40.687775,-73.987,BROOKLYN,2.0,0.0,0,0,1,0,1,0,4805568,2025-04-03 14:00:00,2025-04-03T14:00,2025,4,21.7,0.1,Drizzle
09/19/2025,8:00,40.68405,-73.98156,BROOKLYN,1.0,0.0,1,0,0,0,0,0,4843869,2025-09-19 08:00:00,2025-09-19T08:00,2025,9,22.0,0.0,Clear
07/21/2025,23:00,40.607876,-73.92553,BROOKLYN,1.0,0.0,1,0,0,0,0,0,4829519,2025-07-21 23:00:00,2025-07-21T23:00,2025,7,25.2,0.0,Clear
10/01/2025,19:00,40.7128,-73.96493,BROOKLYN,0.0,0.0,0,0,0,0,0,0,4847339,2025-10-01 19:00:00,2025-10-01T19:00,2025,10,16.8,0.0,Clear
02/23/2025,15:00,40.627464,-73.89955,BROOKLYN,2.0,0.0,0,0,0,0,2,0,4794772,2025-02-23 15:00:00,2025-02-23T15:00,2025,2,6.9,0.0,Cloudy
06/24/2025,19:00,40.663483,-73.90931,BROOKLYN,1.0,0.0,0,0,0,0,1,0,4822990,2025-06-24 19:00:00,2025-06-24T19:00,2025,6,36.2,0.0,Clear
01/16/2025,16:00,40.656727,-73.905045,BROOKLYN,1.0,0.0,0,0,1,0,0,0,4786308,2025-01-16 16:00:00,2025-01-16T16:00,2025,1,-1.6,0.1,Light Snow
08/09/2025,11:00,40.685844,-73.94731,BROOKLYN,1.0,0.0,1,0,0,0,0,0,4833912,2025-08-09 11:00:00,2025-08-09T11:00,2025,8,26.8,0.0,Clear
04/29/2025,11:00,40.678158,-73.94415,BROOKLYN,0.0,0.0,0,0,0,0,0,0,4810777,2025-04-29 11:00:00,2025-04-29T11:00,2025,4,22.7,0.0,Clear
10/03/2025,10:00,40.696354,-73.940704,BROOKLYN,1.0,0.0,0,0,0,0,1,0,4847044,2025-10-03 10:00:00,2025-10-03T10:00,2025,10,17.0,0.0,Clear
05/18/2025,14:00,40.676693,-73.996826,BROOKLYN,2.0,0.0,0,0,2,0,0,0,4814727,2025-05-18 14:00:00,2025-05-18T14:00,2025,5,23.2,0.1,Drizzle
02/23/2025,0:00,40.634003,-73.967575,BROOKLYN,3.0,0.0,3,0,0,0,0,0,4794620,2025-02-23 00:00:00,2025-02-23T00:00,2025,2,-0.5,0.0,Cloudy
08/16/2025,12:00,40.677864,-73.93862,BROOKLYN,1.0,0.0,0,0,0,0,0,0,4836064,2025-08-16 12:00:00,2025-08-16T12:00,2025,8,27.9,0.1,Drizzle
05/09/2025,0:00,40.64883,-73.97789,BROOKLYN,1.0,0.0,0,0,0,0,1,0,4811507,2025-05-09 00:00:00,2025-05-09T00:00,2025,5,15.0,0.0,Cloudy
04/19/2025,1:00,40.619892,-74.023125,BROOKLYN,4.0,0.0,0,0,0,0,4,0,4806652,2025-04-19 01:00:00,2025-04-19T01:00,2025,4,16.0,0.0,Cloudy
01/14/2025,16:00,40.68854,-73.923836,BROOKLYN,1.0,0.0,1,0,0,0,0,0,4785897,2025-01-14 16:00:00,2025-01-14T16:00,2025,1,-0.2,0.0,Clear
10/10/2025,20:00,40.675537,-73.870995,BROOKLYN,1.0,0.0,0,0,0,0,1,0,4849257,2025-10-10 20:00:00,2025-10-10T20:00,2025,10,14.6,0.0,Clear
07/07/2025,13:00,40.60981,-73.9225,BROOKLYN,1.0,0.0,1,0,0,0,0,0,4826458,2025-07-07 13:00:00,2025-07-07T13:00,2025,7,27.6,0.0,Clear
09/10/2025,10:00,40.712704,-73.952324,BROOKLYN,1.0,0.0,1,0,0,0,0,0,4841188,2025-09-10 10:00:00,2025-09-10T10:00,2025,9,16.7,1.0,Drizzle
03/21/2025,12:00,40.650772,-74.01518,BROOKLYN,1.0,0.0,0,0,0,0,1,0,4800285,2025-03-21 12:00:00,2025-03-21T12:00,2025,3,7.0,0.0,Clear
05/16/2025,9:00,40.60469,-73.97885,BROOKLYN,1.0,0.0,1,0,0,0,0,0,4814140,2025-05-16 09:00:00,2025-05-16T09:00,2025,5,17.0,0.0,Cloudy
07/20/2025,13:00,0.0,0.0,BROOKLYN,1.0,0.0,0,0,1,0,0,0,4829058,2025-07-20 13:00:00,2025-07-20T13:00,2025,7,24.4,0.0,Clear
01/06/2025,11:00,40.663643,-73.87394,BROOKLYN,1.0,0.0,0,0,0,0,1,0,4784206,2025-01-06 11:00:00,2025-01-06T11:00,2025,1,-1.7,0.4,Heavy Snow
01/04/2025,9:00,40.693497,-73.94593,BROOKLYN,1.0,0.0,0,0,1,0,0,0,4784332,2025-01-04 09:00:00,2025-01-04T09:00,2025,1,-0.6,0.0,Cloudy
04/19/2025,15:00,40.760822,-73.998314,MANHATTAN,1.0,0.0,1,0,0,0,0,0,4807357,2025-04-19 15:00:00,2025-04-19T15:00,2025,4,26.9,0.0,Cloudy
05/09/2025,0:00,40.752895,-73.98924,MANHATTAN,1.0,0.0,1,0,0,0,0,0,4811750,2025-05-09 00:00:00,2025-05-09T00:00,2025,5,13.9,0.0,Clear
03/20/2025,18:00,40.78051,-73.944244,MANHATTAN,1.0,0.0,0,0,0,0,1,0,4801282,2025-03-20 18:00:00,2025-03-20T18:00,2025,3,8.2,0.0,Cloudy
06/09/2025,7:00,40.810066,-73.95497,MANHATTAN,1.0,0.0,0,0,1,0,0,0,4819255,2025-06-09 07:00:00,2025-06-09T07:00,2025,6,15.4,0.1,Drizzle
10/05/2025,17:00,40.71062,-74.0002,MANHATTAN,1.0,0.0,1,0,0,0,0,0,4848229,2025-10-05 17:00:00,2025-10-05T17:00,2025,10,24.7,0.0,Clear
05/27/2025,18:00,40.76025,-73.96752,MANHATTAN,1.0,0.0,1,0,0,0,0,0,4815984,2025-05-27 18:00:00,2025-05-27T18:00,2025,5,19.1,0.0,Cloudy
03/05/2025,10:00,40.79032,-73.9521,MANHATTAN,1.0,0.0,0,0,1,0,0,0,4796873,2025-03-05 10:00:00,2025-03-05T10:00,2025,3,10.7,0.0,Cloudy
03/30/2025,16:00,0.0,0.0,MANHATTAN,1.0,0.0,0,0,1,0,0,0,4802622,2025-03-30 16:00:00,2025-03-30T16:00,2025,3,29.0,0.0,Cloudy
09/28/2025,3:00,40.723625,-74.00479,MANHATTAN,1.0,0.0,0,0,0,0,1,0,4845579,2025-09-28 03:00:00,2025-09-28T03:00,2025,9,19.1,0.0,Cloudy
02/08/2025,8:00,40.749104,-73.992004,MANHATTAN,1.0,0.0,1,0,0,0,0,0,4792870,2025-02-08 08:00:00,2025-02-08T08:00,2025,2,-4.0,0.0,Cloudy
09/04/2025,9:00,40.812202,-73.94225,MANHATTAN,1.0,0.0,1,0,0,0,0,0,4839689,2025-09-04 09:00:00,2025-09-04T09:00,2025,9,22.8,0.0,Clear
10/02/2025,16:00,40.75959,-73.96805,MANHATTAN,1.0,0.0,1,0,0,0,0,0,4846944,2025-10-02 16:00:00,2025-10-02T16:00,2025,10,18.1,0.0,Cloudy
04/22/2025,10:00,40.725025,-74.0059,MANHATTAN,1.0,0.0,0,0,0,0,1,0,4807925,2025-04-22 10:00:00,2025-04-22T10:00,2025,4,21.9,0.0,Clear
05/07/2025,13:00,40.777412,-73.9788,MANHATTAN,3.0,0.0,0,0,0,0,3,0,4811180,2025-05-07 13:00:00,2025-05-07T13:00,2025,5,21.1,0.0,Cloudy
03/31/2025,0:00,40.76614,-73.97165,MANHATTAN,1.0,0.0,0,0,0,0,1,0,4802848,2025-03-31 00:00:00,2025-03-31T00:00,2025,3,8.8,0.0,Cloudy
04/07/2025,21:00,40.71891,-73.99942,MANHATTAN,1.0,0.0,0,0,1,0,0,0,4815334,2025-04-07 21:00:00,2025-04-07T21:00,2025,4,5.1,0.0,Cloudy
01/27/2025,8:00,40.759167,-73.976746,MANHATTAN,1.0,0.0,1,0,0,0,0,0,4788903,2025-01-27 08:00:00,2025-01-27T08:00,2025,1,-4.3,0.0,Clear
04/02/2025,18:00,40.75595,-73.99073,MANHATTAN,1.0,0.0,1,0,0,0,0,0,4803685,2025-04-02 18:00:00,2025-04-02T18:00,2025,4,5.6,0.0,Cloudy
09/06/2025,15:00,40.757065,-74.00105,MANHATTAN,2.0,0.0,2,0,0,0,0,0,4840334,2025-09-06 15:00:00,2025-09-06T15:00,2025,9,26.8,0.1,Drizzle
05/03/2025,22:00,40.811478,-73.95528,MANHATTAN,1.0,0.0,0,0,1,0,0,0,4810112,2025-05-03 22:00:00,2025-05-03T22:00,2025,5,18.3,0.8,Drizzle
10/09/2025,11:00,40.750843,-73.97861,MANHATTAN,1.0,0.0,0,0,0,0,1,0,4848580,2025-10-09 11:00:00,2025-10-09T11:00,2025,10,12.7,0.0,Clear
06/25/2025,20:00,40.760822,-73.998314,MANHATTAN,0.0,0.0,0,0,0,0,0,0,4824643,2025-06-25 20:00:00,2025-06-25T20:00,2025,6,31.8,0.0,Cloudy
06/26/2025,13:00,40.849842,-73.93497,MANHATTAN,1.0,0.0,1,0,0,0,0,0,4823408,2025-06-26 13:00:00,2025-06-26T13:00,2025,6,24.1,0.0,Cloudy
09/03/2025,0:00,40.71514,-73.99733,MANHATTAN,1.0,0.0,0,0,0,0,1,0,4839495,2025-09-03 00:00:00,2025-09-03T00:00,2025,9,17.8,0.0,Clear
08/14/2025,19:00,40.72365,-73.99102,MANHATTAN,1.0,0.0,0,0,0,0,1,0,4835848,2025-08-14 19:00:00,2025-08-14T19:00,2025,8,28.4,0.0,Clear
04/09/2025,0:00,40.783222,-73.947624,MANHATTAN,1.0,0.0,0,0,1,0,0,0,4804738,2025-04-09 00:00:00,2025-04-09T00:00,2025,4,0.6,0.0,Clear
05/06/2025,21:00,40.81785,-73.94184,MANHATTAN,0.0,0.0,0,0,0,0,0,0,4810984,2025-05-06 21:00:00,2025-05-06T21:00,2025,5,15.9,0.0,Clear
09/24/2025,0:00,40.7851,-73.976906,MANHATTAN,1.0,0.0,0,0,0,0,1,0,4845089,2025-09-24 00:00:00,2025-09-24T00:00,2025,9,20.3,0.0,Cloudy
01/17/2025,10:00,40.79915,-73.97253,MANHATTAN,1.0,0.0,0,0,0,0,0,0,4790785,2025-01-17 10:00:00,2025-01-17T10:00,2025,1,-0.2,0.0,Clear
02/05/2025,16:00,0.0,0.0,MANHATTAN,1.0,0.0,1,0,0,0,0,0,4792299,2025-02-05 16:00:00,2025-02-05T16:00,2025,2,27.5,0.0,Cloudy
10/01/2025,9:00,40.732754,-73.990036,MANHATTAN,1.0,0.0,1,0,0,0,0,0,4848070,2025-10-01 09:00:00,2025-10-01T09:00,2025,10,15.2,0.0,Clear
06/03/2025,15:00,40.823135,-73.945015,MANHATTAN,1.0,0.0,0,0,1,0,0,0,4817898,2025-06-03 15:00:00,2025-06-03T15:00,2025,6,26.2,0.0,Clear
04/15/2025,12:00,40.745384,-73.99471,MANHATTAN,1.0,0.0,0,0,1,0,0,0,4807189,2025-04-15 12:00:00,2025-04-15T12:00,2025,4,16.5,0.0,Cloudy
04/01/2025,22:00,40.786915,-73.98123,MANHATTAN,1.0,0.0,0,0,0,0,1,0,4804217,2025-04-01 22:00:00,2025-04-01T22:00,2025,4,5.4,0.0,Clear
03/15/2025,22:00,40.768383,-73.992805,MANHATTAN,0.0,0.0,0,0,0,0,0,0,4799568,2025-03-15 22:00:00,2025-03-15T22:00,2025,3,7.4,0.0,Cloudy
06/14/2025,0:00,40.72709,-73.97664,MANHATTAN,1.0,0.0,0,0,1,0,0,0,4822913,2025-06-14 00:00:00,2025-06-14T00:00,2025,6,20.2,0.0,Cloudy
07/07/2025,17:00,40.721622,-74.002205,MANHATTAN,0.0,0.0,0,0,0,0,0,0,4826132,2025-07-07 17:00:00,2025-07-07T17:00,2025,7,29.7,0.0,Cloudy
07/14/2025,0:00,40.72132,-74.00835,MANHATTAN,2.0,0.0,0,0,0,0,2,0,4829199,2025-07-14 00:00:00,2025-07-14T00:00,2025,7,23.8,0.1,Drizzle
02/05/2025,15:00,40.763546,-73.98519,MANHATTAN,1.0,0.0,1,0,0,0,0,0,4790949,2025-02-05 15:00:00,2025-02-05T15:00,2025,2,1.7,0.0,Cloudy
02/15/2025,19:00,40.754875,-73.96852,MANHATTAN,1.0,0.0,0,0,1,0,0,0,4794104,2025-02-15 19:00:00,2025-02-15T19:00,2025,2,0.6,0.7,Heavy Snow
02/24/2025,0:00,40.827778,-73.94575,MANHATTAN,1.0,0.0,0,0,1,0,0,0,4794981,2025-02-24 00:00:00,2025-02-24T00:00,2025,2,0.2,0.0,Cloudy
05/11/2025,16:00,40.825233,-73.9476,MANHATTAN,1.0,0.0,0,0,1,0,0,0,4812182,2025-05-11 16:00:00,2025-05-11T16:00,2025,5,21.9,0.0,Cloudy
03/15/2025,7:00,40.743244,-73.98741,MANHATTAN,1.0,0.0,0,0,0,0,1,0,4799316,2025-03-15 07:00:00,2025-03-15T07:00,2025,3,5.2,0.0,Cloudy
10/13/2025,16:00,40.78363,-73.94352,MANHATTAN,0.0,0.0,0,0,0,0,0,0,4849946,2025-10-13 16:00:00,2025-10-13T16:00,2025,10,14.9,0.0,Cloudy
05/10/2025,0:00,40.758644,-73.98935,MANHATTAN,1.0,0.0,0,0,1,0,0,0,4811744,2025-05-10 00:00:00,2025-05-10T00:00,2025,5,11.1,0.0,Cloudy
08/13/2025,13:00,0.0,0.0,MANHATTAN,1.0,0.0,0,0,1,0,0,0,4836689,2025-08-13 13:00:00,2025-08-13T13:00,2025,8,22.8,0.0,Cloudy
05/01/2025,0:00,40.749905,-73.98843,MANHATTAN,3.0,0.0,0,0,0,0,3,0,4810047,2025-05-01 00:00:00,2025-05-01T00:00,2025,5,13.8,0.0,Cloudy
04/16/2025,9:00,40.75096,-73.98272,MANHATTAN,0.0,0.0,0,0,0,0,0,0,4806175,2025-04-16 09:00:00,2025-04-16T09:00,2025,4,7.5,0.0,Cloudy
08/21/2025,0:00,40.846153,-73.93233,MANHATTAN,0.0,0.0,0,0,0,0,0,0,4836767,2025-08-21 00:00:00,2025-08-21T00:00,2025,8,15.5,0.1,Drizzle
06/08/2025,18:00,40.731323,-73.98861,MANHATTAN,1.0,0.0,1,0,0,0,0,0,4819147,2025-06-08 18:00:00,2025-06-08T18:00,2025,6,18.6,0.2,Drizzle
03/29/2025,6:00,40.744007,-73.985695,MANHATTAN,1.0,0.0,0,0,0,0,1,0,4802399,2025-03-29 06:00:00,2025-03-29T06:00,2025,3,12.6,0.0,Clear
02/01/2025,15:00,40.763485,-73.988945,MANHATTAN,1.0,0.0,0,0,1,0,0,0,4790123,2025-02-01 15:00:00,2025-02-01T15:00,2025,2,-0.4,0.0,Clear
06/30/2025,0:00,40.805744,-73.94276,MANHATTAN,0.0,0.0,0,0,0,0,0,0,4826700,2025-06-30 00:00:00,2025-06-30T00:00,2025,6,25.8,0.0,Clear
10/06/2025,0:00,40.84845,-73.93855,MANHATTAN,1.0,0.0,0,0,0,0,1,0,4848051,2025-10-06 00:00:00,2025-10-06T00:00,2025,10,20.0,0.0,Clear
10/20/2025,17:00,40.736465,-73.98696,MANHATTAN,1.0,0.0,1,0,0,0,0,0,4852183,2025-10-20 17:00:00,2025-10-20T17:00,2025,10,14.4,0.0,Clear
07/29/2025,10:00,40.754974,-73.98864,MANHATTAN,1.0,0.0,0,0,1,0,0,0,4831841,2025-07-29 10:00:00,2025-07-29T10:00,2025,7,35.6,0.0,Clear
06/29/2025,2:00,40.82138,-73.95413,MANHATTAN,0.0,0.0,0,0,0,0,0,0,4827906,2025-06-29 02:00:00,2025-06-29T02:00,2025,6,24.1,0.0,Cloudy
03/12/2025,15:00,40.731167,-73.99192,MANHATTAN,1.0,0.0,1,0,0,0,0,0,4803620,2025-03-12 15:00:00,2025-03-12T15:00,2025,3,11.3,0.0,Cloudy
05/07/2025,12:00,40.709602,-74.00628,MANHATTAN,0.0,0.0,0,0,0,0,0,0,4811385,2025-05-07 12:00:00,2025-05-07T12:00,2025,5,21.2,0.0,Cloudy
02/17/2025,13:00,40.76356,-73.97284,MANHATTAN,1.0,0.0,1,0,0,0,0,0,4793692,2025-02-17 13:00:00,2025-02-17T13:00,2025,2,-0.3,0.0,Cloudy
10/10/2025,17:00,40.75067,-73.97379,MANHATTAN,1.0,0.0,0,0,1,0,0,0,4851927,2025-10-10 17:00:00,2025-10-10T17:00,2025,10,13.4,0.0,Clear
09/13/2025,15:00,40.740574,-74.00405,MANHATTAN,0.0,0.0,0,0,0,0,0,0,4842444,2025-09-13 15:00:00,2025-09-13T15:00,2025,9,24.3,0.5,Drizzle
06/23/2025,0:00,40.716534,-74.006676,MANHATTAN,1.0,0.0,0,0,1,0,0,0,4824091,2025-06-23 00:00:00,2025-06-23T00:00,2025,6,28.7,0.0,Clear
09/24/2025,0:00,40.751812,-73.98498,MANHATTAN,0.0,0.0,0,0,0,0,0,0,4846646,2025-09-24 00:00:00,2025-09-24T00:00,2025,9,20.3,0.0,Cloudy
08/09/2025,2:00,40.719204,-73.990364,MANHATTAN,0.0,0.0,0,0,0,0,0,0,4834159,2025-08-09 02:00:00,2025-08-09T02:00,2025,8,18.2,0.0,Clear
09/15/2025,0:00,40.722324,-74.01175,MANHATTAN,1.0,0.0,0,0,0,0,0,0,4843235,2025-09-15 00:00:00,2025-09-15T00:00,2025,9,19.8,0.0,Cloudy
06/11/2025,0:00,40.740185,-73.98637,MANHATTAN,1.0,0.0,0,0,0,0,1,0,4820250,2025-06-11 00:00:00,2025-06-11T00:00,2025,6,19.3,0.0,Clear
10/04/2025,12:00,40.73398,-73.990944,MANHATTAN,1.0,0.0,0,0,1,0,0,0,4847367,2025-10-04 12:00:00,2025-10-04T12:00,2025,10,25.7,0.0,Clear
05/09/2025,21:00,40.86064,-73.93077,MANHATTAN,1.0,0.0,0,0,0,0,1,0,4813437,2025-05-09 21:00:00,2025-05-09T21:00,2025,5,12.1,0.0,Cloudy
02/13/2025,10:00,40.759167,-73.976746,MANHATTAN,1.0,0.0,1,0,0,0,0,0,4792623,2025-02-13 10:00:00,2025-02-13T10:00,2025,2,2.6,0.1,Drizzle
05/08/2025,19:00,40.81023,-73.947754,MANHATTAN,1.0,0.0,1,0,0,0,0,0,4813504,2025-05-08 19:00:00,2025-05-08T19:00,2025,5,17.8,0.0,Clear
10/15/2025,9:00,40.72168,-73.980606,MANHATTAN,1.0,0.0,0,0,1,0,0,0,4850227,2025-10-15 09:00:00,2025-10-15T09:00,2025,10,15.9,0.0,Cloudy
06/03/2025,5:00,40.736603,-73.98184,MANHATTAN,1.0,0.0,1,0,0,0,0,0,4817799,2025-06-03 05:00:00,2025-06-03T05:00,2025,6,11.3,0.0,Clear
08/05/2025,9:00,40.715538,-73.99939,MANHATTAN,0.0,0.0,0,0,0,0,0,0,4833324,2025-08-05 09:00:00,2025-08-05T09:00,2025,8,25.9,0.0,Cloudy
02/13/2025,21:00,40.870415,-73.915146,MANHATTAN,1.0,0.0,0,0,0,0,1,0,4792502,2025-02-13 21:00:00,2025-02-13T21:00,2025,2,3.0,0.0,Clear
03/28/2025,8:00,40.773033,-73.9822,MANHATTAN,1.0,0.0,0,0,0,0,1,0,4803638,2025-03-28 08:00:00,2025-03-28T08:00,2025,3,8.4,0.0,Cloudy
02/27/2025,0:00,40.748142,-73.973145,MANHATTAN,1.0,0.0,0,0,1,0,0,0,4795327,2025-02-27 00:00:00,2025-02-27T00:00,2025,2,5.4,0.0,Cloudy
10/09/2025,0:00,40.72369,-73.99807,MANHATTAN,1.0,0.0,0,0,1,0,0,0,4848879,2025-10-09 00:00:00,2025-10-09T00:00,2025,10,12.6,0.0,Clear
06/13/2025,18:00,40.7313,-74.01046,MANHATTAN,1.0,0.0,0,0,1,0,0,0,4820316,2025-06-13 18:00:00,2025-06-13T18:00,2025,6,24.7,0.0,Cloudy
05/05/2025,18:00,40.73324,-73.995415,MANHATTAN,1.0,0.0,0,0,0,0,1,0,4810971,2025-05-05 18:00:00,2025-05-05T18:00,2025,5,15.2,1.3,Light Rain
06/17/2025,17:00,40.75925,-73.99272,MANHATTAN,1.0,0.0,1,0,0,0,0,0,4821595,2025-06-17 17:00:00,2025-06-17T17:00,2025,6,20.9,0.0,Cloudy
09/16/2025,0:00,40.751522,-73.980225,MANHATTAN,1.0,0.0,0,0,0,0,1,0,4842934,2025-09-16 00:00:00,2025-09-16T00:00,2025,9,19.4,0.0,Cloudy
04/02/2025,23:00,40.720436,-74.0067,MANHATTAN,1.0,0.0,1,0,0,0,0,0,4803697,2025-04-02 23:00:00,2025-04-02T23:00,2025,4,6.7,0.0,Cloudy
07/10/2025,0:00,40.73059,-73.99241,MANHATTAN,1.0,0.0,0,0,1,0,0,0,4827716,2025-07-10 00:00:00,2025-07-10T00:00,2025,7,23.4,1.2,Drizzle
09/08/2025,0:00,0.0,0.0,MANHATTAN,1.0,0.0,0,0,1,0,0,0,4840933,2025-09-08 00:00:00,2025-09-08T00:00,2025,9,24.2,0.0,Cloudy
04/10/2025,17:00,40.86302,-73.91756,MANHATTAN,2.0,0.0,0,0,0,0,2,0,4805560,2025-04-10 17:00:00,2025-04-10T17:00,2025,4,5.9,0.1,Drizzle
10/10/2025,16:00,40.801888,-73.93691,MANHATTAN,1.0,0.0,1,0,0,0,0,0,4848929,2025-10-10 16:00:00,2025-10-10T16:00,2025,10,15.6,0.0,Clear
02/11/2025,0:00,0.0,0.0,MANHATTAN,1.0,0.0,0,0,1,0,0,0,4792089,2025-02-11 00:00:00,2025-02-11T00:00,2025,2,28.1,0.0,Cloudy
03/05/2025,22:00,40.716434,-73.98158,MANHATTAN,1.0,0.0,1,0,0,0,0,0,4797094,2025-03-05 22:00:00,2025-03-05T22:00,2025,3,9.3,7.3,Heavy Rain
07/30/2025,16:00,40.765366,-73.98758,MANHATTAN,1.0,0.0,1,0,0,0,0,0,4832908,2025-07-30 16:00:00,2025-07-30T16:00,2025,7,34.4,0.0,Cloudy
08/21/2025,17:00,40.809498,-73.93581,MANHATTAN,1.0,0.0,0,0,0,0,1,0,4836723,2025-08-21 17:00:00,2025-08-21T17:00,2025,8,21.3,0.0,Cloudy
03/17/2025,6:00,40.848667,-73.93918,MANHATTAN,1.0,0.0,1,0,0,0,0,0,4801167,2025-03-17 06:00:00,2025-03-17T06:00,2025,3,12.6,0.8,Drizzle
02/10/2025,12:00,40.76112,-73.97888,MANHATTAN,1.0,0.0,0,0,1,0,0,0,4792619,2025-02-10 12:00:00,2025-02-10T12:00,2025,2,-0.3,0.0,Cloudy
05/19/2025,15:00,40.7599,-73.98042,MANHATTAN,1.0,0.0,0,0,0,0,1,0,4814267,2025-05-19 15:00:00,2025-05-19T15:00,2025,5,19.6,0.0,Clear
02/26/2025,10:00,40.84552,-73.934685,MANHATTAN,1.0,0.0,0,0,1,0,0,0,4800099,2025-02-26 10:00:00,2025-02-26T10:00,2025,2,8.0,0.0,Clear
09/12/2025,18:00,40.75005,-73.98362,MANHATTAN,1.0,0.0,1,0,0,0,0,0,4842702,2025-09-12 18:00:00,2025-09-12T18:00,2025,9,22.4,0.0,Cloudy
10/18/2025,22:00,40.769905,-73.98056,MANHATTAN,1.0,0.0,0,0,1,0,0,0,4850617,2025-10-18 22:00:00,2025-10-18T22:00,2025,10,12.9,0.0,Clear
02/13/2025,0:00,40.797184,-73.93857,MANHATTAN,1.0,0.0,0,0,0,0,1,0,4792528,2025-02-13 00:00:00,2025-02-13T00:00,2025,2,1.1,0.4,Drizzle
04/24/2025,15:00,40.755806,-73.986404,MANHATTAN,1.0,0.0,0,0,1,0,0,0,4810019,2025-04-24 15:00:00,2025-04-24T15:00,2025,4,23.5,0.0,Clear
10/11/2025,9:00,40.764057,-73.96476,MANHATTAN,1.0,0.0,0,0,1,0,0,0,4850146,2025-10-11 09:00:00,2025-10-11T09:00,2025,10,13.8,0.7,Drizzle
07/03/2025,19:00,40.714752,-73.99382,MANHATTAN,1.0,0.0,0,0,1,0,0,0,4829660,2025-07-03 19:00:00,2025-07-03T19:00,2025,7,25.0,0.0,Clear
06/05/2025,2:00,40.812958,-73.93857,MANHATTAN,1.0,0.0,0,0,0,0,0,0,4819259,2025-06-05 02:00:00,2025-06-05T02:00,2025,6,21.8,0.0,Clear
02/03/2025,18:00,40.8076,-73.93718,MANHATTAN,1.0,0.0,0,0,0,0,1,0,4790640,2025-02-03 18:00:00,2025-02-03T18:00,2025,2,2.4,0.0,Cloudy
08/02/2025,20:00,40.812202,-73.94225,MANHATTAN,1.0,0.0,0,0,1,0,0,0,4833044,2025-08-02 20:00:00,2025-08-02T20:00,2025,8,20.9,0.0,Clear
08/24/2025,19:00,40.75083,-73.997765,MANHATTAN,1.0,0.0,1,0,0,0,0,0,4837438,2025-08-24 19:00:00,2025-08-24T19:00,2025,8,22.4,0.0,Clear
07/28/2025,15:00,40.84954,-73.9364,MANHATTAN,1.0,0.0,0,0,1,0,0,0,4831945,2025-07-28 15:00:00,2025-07-28T15:00,2025,7,33.6,0.0,Clear
03/04/2025,21:00,40.743683,-73.9878,MANHATTAN,1.0,0.0,1,0,0,0,0,0,4796430,2025-03-04 21:00:00,2025-03-04T21:00,2025,3,7.7,0.0,Clear
02/08/2025,11:00,40.848392,-73.93767,MANHATTAN,1.0,0.0,1,0,0,0,0,0,4791174,2025-02-08 11:00:00,2025-02-08T11:00,2025,2,-0.6,0.0,Cloudy
07/19/2025,19:00,40.757797,-73.98877,MANHATTAN,2.0,0.0,0,0,0,0,2,0,4829243,2025-07-19 19:00:00,2025-07-19T19:00,2025,7,24.3,0.0,Cloudy
01/30/2025,11:00,40.762287,-73.97026,MANHATTAN,1.0,0.0,0,0,1,0,0,0,4789445,2025-01-30 11:00:00,2025-01-30T11:00,2025,1,-1.4,0.0,Clear
05/20/2025,11:00,40.809692,-73.944084,MANHATTAN,1.0,0.0,0,0,0,0,1,0,4814520,2025-05-20 11:00:00,2025-05-20T11:00,2025,5,17.3,0.0,Cloudy
05/15/2025,21:00,40.732605,-73.98768,MANHATTAN,1.0,0.0,1,0,0,0,0,0,4814094,2025-05-15 21:00:00,2025-05-15T21:00,2025,5,16.3,0.0,Cloudy
10/19/2025,19:00,40.81032,-73.936844,MANHATTAN,1.0,0.0,1,0,0,0,0,0,4851486,2025-10-19 19:00:00,2025-10-19T19:00,2025,10,18.2,0.0,Clear
05/16/2025,23:00,0.0,0.0,MANHATTAN,1.0,0.0,0,0,1,0,0,0,4815093,2025-05-16 23:00:00,2025-05-16T23:00,2025,5,27.1,0.1,Drizzle
08/26/2025,0:00,40.825233,-73.9476,MANHATTAN,1.0,0.0,0,0,1,0,0,0,4842431,2025-08-26 00:00:00,2025-08-26T00:00,2025,8,22.0,0.0,Clear
04/07/2025,4:00,40.863163,-73.919876,MANHATTAN,2.0,0.0,2,0,0,0,0,0,4804807,2025-04-07 04:00:00,2025-04-07T04:00,2025,4,5.6,0.5,Drizzle
09/07/2025,0:00,40.818535,-73.94735,MANHATTAN,1.0,0.0,1,0,0,0,0,0,4841075,2025-09-07 00:00:00,2025-09-07T00:00,2025,9,18.2,0.3,Drizzle
07/31/2025,22:00,40.75591,-73.99447,MANHATTAN,2.0,0.0,2,0,0,0,0,0,4833251,2025-07-31 22:00:00,2025-07-31T22:00,2025,7,19.9,0.3,Drizzle
03/26/2025,0:00,40.805058,-73.93903,MANHATTAN,1.0,0.0,0,0,0,0,1,0,4802475,2025-03-26 00:00:00,2025-03-26T00:00,2025,3,6.7,0.0,Cloudy
02/04/2025,10:00,40.79157,-73.94468,MANHATTAN,1.0,0.0,1,0,0,0,0,0,4790579,2025-02-04 10:00:00,2025-02-04T10:00,2025,2,5.8,0.0,Cloudy
01/31/2025,17:00,0.0,0.0,MANHATTAN,1.0,0.0,1,0,0,0,0,0,4789765,2025-01-31 17:00:00,2025-01-31T17:00,2025,1,27.8,0.0,Cloudy
06/17/2025,0:00,40.791355,-73.94848,MANHATTAN,0.0,0.0,0,0,0,0,0,0,4821014,2025-06-17 00:00:00,2025-06-17T00:00,2025,6,17.3,2.7,Heavy Rain
04/29/2025,8:00,40.740833,-74.00466,MANHATTAN,1.0,0.0,1,0,0,0,0,0,4809469,2025-04-29 08:00:00,2025-04-29T08:00,2025,4,16.5,0.0,Clear
03/13/2025,8:00,40.75484,-73.984116,MANHATTAN,1.0,0.0,1,0,0,0,0,0,4798994,2025-03-13 08:00:00,2025-03-13T08:00,2025,3,3.5,0.0,Cloudy
08/24/2025,0:00,40.732605,-73.98768,MANHATTAN,1.0,0.0,0,0,0,0,1,0,4843932,2025-08-24 00:00:00,2025-08-24T00:00,2025,8,19.7,0.0,Clear
06/03/2025,15:00,40.766716,-73.96913,MANHATTAN,1.0,0.0,0,0,1,0,0,0,4820722,2025-06-03 15:00:00,2025-06-03T15:00,2025,6,25.8,0.0,Clear
06/04/2025,17:00,40.706234,-74.00316,MANHATTAN,1.0,0.0,0,0,1,0,0,0,4818735,2025-06-04 17:00:00,2025-06-04T17:00,2025,6,26.0,0.0,Clear
07/14/2025,12:00,40.732246,-73.99479,MANHATTAN,1.0,0.0,0,0,0,0,1,0,4827684,2025-07-14 12:00:00,2025-07-14T12:00,2025,7,31.4,0.0,Cloudy
01/24/2025,12:00,40.763435,-73.97172,MANHATTAN,1.0,0.0,0,0,1,0,0,0,4788291,2025-01-24 12:00:00,2025-01-24T12:00,2025,1,-2.2,0.0,Clear
09/16/2025,19:00,40.762024,-74.00115,MANHATTAN,1.0,0.0,0,0,1,0,0,0,4843711,2025-09-16 19:00:00,2025-09-16T19:00,2025,9,20.0,0.0,Cloudy
06/04/2025,22:00,40.730724,-73.98905,MANHATTAN,1.0,0.0,1,0,0,0,0,0,4818384,2025-06-04 22:00:00,2025-06-04T22:00,2025,6,24.7,0.0,Clear
01/22/2025,0:00,40.827282,-73.953606,MANHATTAN,1.0,0.0,0,0,0,0,1,0,4787602,2025-01-22 00:00:00,2025-01-22T00:00,2025,1,-10.6,0.0,Cloudy
03/13/2025,13:00,40.794132,-73.94281,MANHATTAN,1.0,0.0,1,0,0,0,0,0,4798579,2025-03-13 13:00:00,2025-03-13T13:00,2025,3,10.3,0.0,Cloudy
01/25/2025,0:00,40.813656,-73.96128,MANHATTAN,0.0,0.0,0,0,0,0,0,0,4788679,2025-01-25 00:00:00,2025-01-25T00:00,2025,1,-9.4,0.0,Clear
05/18/2025,1:00,40.729813,-74.000534,MANHATTAN,1.0,0.0,1,0,0,0,0,0,4813429,2025-05-18 01:00:00,2025-05-18T01:00,2025,5,17.0,0.0,Clear
05/01/2025,9:00,40.744064,-73.98775,MANHATTAN,1.0,0.0,1,0,0,0,0,0,4810513,2025-05-01 09:00:00,2025-05-01T09:00,2025,5,17.6,0.0,Cloudy
04/10/2025,9:00,40.738052,-74.00085,MANHATTAN,0.0,0.0,0,0,0,0,0,0,4806463,2025-04-10 09:00:00,2025-04-10T09:00,2025,4,7.6,0.0,Clear
07/12/2025,15:00,40.760418,-73.97583,MANHATTAN,1.0,0.0,0,0,1,0,0,0,4827784,2025-07-12 15:00:00,2025-07-12T15:00,2025,7,27.7,0.0,Cloudy
04/19/2025,3:00,40.774967,-73.956795,MANHATTAN,1.0,0.0,0,0,0,0,1,0,4806654,2025-04-19 03:00:00,2025-04-19T03:00,2025,4,16.0,0.0,Cloudy
08/23/2025,5:00,40.736885,-73.97854,MANHATTAN,2.0,0.0,0,0,0,0,2,0,4837428,2025-08-23 05:00:00,2025-08-23T05:00,2025,8,17.3,0.0,Cloudy
05/12/2025,10:00,40.814186,-73.95086,MANHATTAN,0.0,0.0,0,0,0,0,0,0,4812526,2025-05-12 10:00:00,2025-05-12T10:00,2025,5,18.1,0.0,Cloudy
01/27/2025,0:00,40.744194,-73.99952,MANHATTAN,1.0,0.0,1,0,0,0,0,0,4788584,2025-01-27 00:00:00,2025-01-27T00:00,2025,1,-4.6,0.0,Cloudy
01/22/2025,23:00,40.851616,-73.93367,MANHATTAN,1.0,0.0,0,0,0,0,1,0,4789136,2025-01-22 23:00:00,2025-01-22T23:00,2025,1,-11.6,0.0,Clear
01/15/2025,11:00,40.760777,-74.00218,MANHATTAN,1.0,0.0,0,0,0,0,1,0,4786405,2025-01-15 11:00:00,2025-01-15T11:00,2025,1,-1.6,0.0,Cloudy
07/14/2025,17:00,40.810116,-73.94674,MANHATTAN,0.0,0.0,0,0,0,0,0,0,4827698,2025-07-14 17:00:00,2025-07-14T17:00,2025,7,27.3,3.1,Heavy Rain
09/23/2025,14:00,40.74979,-73.98777,MANHATTAN,1.0,0.0,0,0,0,0,0,0,4844725,2025-09-23 14:00:00,2025-09-23T14:00,2025,9,29.2,0.0,Clear
05/14/2025,20:00,40.772373,-73.960785,MANHATTAN,1.0,0.0,1,0,0,0,0,0,4815136,2025-05-14 20:00:00,2025-05-14T20:00,2025,5,16.1,1.4,Light Rain
02/01/2025,8:00,40.774654,-73.954094,MANHATTAN,1.0,0.0,0,0,0,0,1,0,4790074,2025-02-01 08:00:00,2025-02-01T08:00,2025,2,1.3,0.0,Cloudy
05/05/2025,0:00,40.8201,-73.95508,MANHATTAN,1.0,0.0,0,0,0,0,1,0,4811265,2025-05-05 00:00:00,2025-05-05T00:00,2025,5,15.1,0.0,Cloudy
05/29/2025,14:00,40.849308,-73.931915,MANHATTAN,0.0,0.0,0,0,0,0,0,0,4816889,2025-05-29 14:00:00,2025-05-29T14:00,2025,5,18.4,0.0,Cloudy
04/10/2025,0:00,40.798317,-73.972244,MANHATTAN,1.0,0.0,1,0,0,0,0,0,4805553,2025-04-10 00:00:00,2025-04-10T00:00,2025,4,2.9,0.0,Clear
10/07/2025,19:00,40.806435,-73.940506,MANHATTAN,1.0,0.0,0,0,0,0,0,0,4848356,2025-10-07 19:00:00,2025-10-07T19:00,2025,10,22.3,0.0,Cloudy
05/23/2025,8:00,40.80114,-73.93769,MANHATTAN,1.0,0.0,1,0,0,0,0,0,4815850,2025-05-23 08:00:00,2025-05-23T08:00,2025,5,9.9,0.0,Cloudy
04/05/2025,0:00,40.715633,-73.99849,MANHATTAN,1.0,0.0,0,0,1,0,0,0,4803672,2025-04-05 00:00:00,2025-04-05T00:00,2025,4,12.1,0.0,Cloudy
07/14/2025,15:00,40.7883,-73.947296,MANHATTAN,0.0,0.0,0,0,0,0,0,0,4831207,2025-07-14 15:00:00,2025-07-14T15:00,2025,7,28.5,0.6,Drizzle
03/14/2025,13:00,40.744186,-73.99187,MANHATTAN,1.0,0.0,0,0,1,0,0,0,4799151,2025-03-14 13:00:00,2025-03-14T13:00,2025,3,12.5,0.0,Cloudy
07/16/2025,17:00,40.802517,-73.942375,MANHATTAN,1.0,0.0,0,0,1,0,0,0,4828299,2025-07-16 17:00:00,2025-07-16T17:00,2025,7,29.3,0.0,Cloudy
07/01/2025,15:00,40.761234,-73.96388,MANHATTAN,1.0,0.0,0,0,1,0,0,0,4825174,2025-07-01 15:00:00,2025-07-01T15:00,2025,7,30.6,0.0,Cloudy
06/16/2025,14:00,40.71637,-74.01252,MANHATTAN,1.0,0.0,0,0,1,0,0,0,4821739,2025-06-16 14:00:00,2025-06-16T14:00,2025,6,20.0,0.2,Drizzle
07/03/2025,0:00,40.784245,-73.94709,MANHATTAN,1.0,0.0,0,0,1,0,0,0,4827023,2025-07-03 00:00:00,2025-07-03T00:00,2025,7,23.6,0.0,Clear
07/15/2025,0:00,40.732307,-74.009926,MANHATTAN,1.0,0.0,0,0,0,0,0,0,4828060,2025-07-15 00:00:00,2025-07-15T00:00,2025,7,23.4,0.5,Drizzle
05/27/2025,9:00,40.786808,-73.94523,MANHATTAN,1.0,0.0,0,0,1,0,0,0,4816240,2025-05-27 09:00:00,2025-05-27T09:00,2025,5,20.2,0.0,Cloudy
03/05/2025,17:00,40.757694,-73.989685,MANHATTAN,1.0,0.0,0,0,0,0,1,0,4797184,2025-03-05 17:00:00,2025-03-05T17:00,2025,3,10.0,2.3,Light Rain
09/03/2025,18:00,40.791416,-73.94155,MANHATTAN,1.0,0.0,1,0,0,0,0,0,4840747,2025-09-03 18:00:00,2025-09-03T18:00,2025,9,21.6,0.0,Clear
04/10/2025,10:00,40.750904,-73.99812,MANHATTAN,1.0,0.0,0,0,1,0,0,0,4805342,2025-04-10 10:00:00,2025-04-10T10:00,2025,4,9.3,0.0,Cloudy
02/28/2025,16:00,40.744686,-73.98373,MANHATTAN,1.0,0.0,0,0,1,0,0,0,4796466,2025-02-28 16:00:00,2025-02-28T16:00,2025,2,9.3,0.0,Cloudy
03/04/2025,18:00,40.74627,-73.99646,MANHATTAN,1.0,0.0,0,0,1,0,0,0,4797618,2025-03-04 18:00:00,2025-03-04T18:00,2025,3,9.4,0.0,Clear
07/14/2025,20:00,40.754585,-73.999146,MANHATTAN,1.0,0.0,1,0,0,0,0,0,4829113,2025-07-14 20:00:00,2025-07-14T20:00,2025,7,24.2,0.9,Drizzle
09/12/2025,14:00,40.76025,-73.96752,MANHATTAN,0.0,0.0,0,0,0,0,0,0,4842921,2025-09-12 14:00:00,2025-09-12T14:00,2025,9,27.0,0.0,Cloudy
08/11/2025,11:00,40.714897,-74.006096,MANHATTAN,0.0,0.0,0,0,0,0,0,0,4834873,2025-08-11 11:00:00,2025-08-11T11:00,2025,8,30.5,0.0,Clear
04/08/2025,7:00,40.839565,-73.93988,MANHATTAN,1.0,0.0,0,0,1,0,0,0,4804399,2025-04-08 07:00:00,2025-04-08T07:00,2025,4,2.4,0.0,Clear
03/06/2025,10:00,40.81535,-73.95775,MANHATTAN,1.0,0.0,1,0,0,0,0,0,4797325,2025-03-06 10:00:00,2025-03-06T10:00,2025,3,11.6,0.0,Cloudy
10/17/2025,13:00,40.727867,-73.99314,MANHATTAN,1.0,0.0,0,0,1,0,0,0,4850721,2025-10-17 13:00:00,2025-10-17T13:00,2025,10,16.0,0.0,Cloudy
06/12/2025,21:00,40.734028,-73.98933,MANHATTAN,1.0,0.0,1,0,0,0,0,0,4820149,2025-06-12 21:00:00,2025-06-12T21:00,2025,6,27.7,0.0,Cloudy
02/12/2025,9:00,40.746494,-74.00133,MANHATTAN,1.0,0.0,0,0,1,0,0,0,4793429,2025-02-12 09:00:00,2025-02-12T09:00,2025,2,-0.3,0.0,Cloudy
02/04/2025,11:00,40.74122,-73.9788,MANHATTAN,0.0,0.0,0,0,0,0,0,0,4791704,2025-02-04 11:00:00,2025-02-04T11:00,2025,2,6.1,0.0,Cloudy
02/16/2025,17:00,40.750843,-73.97861,MANHATTAN,1.0,0.0,1,0,0,0,0,0,4792977,2025-02-16 17:00:00,2025-02-16T17:00,2025,2,5.5,2.5,Heavy Rain
01/10/2025,14:00,40.759136,-73.99191,MANHATTAN,1.0,0.0,0,0,1,0,0,0,4785101,2025-01-10 14:00:00,2025-01-10T14:00,2025,1,3.3,0.0,Cloudy
05/27/2025,20:00,40.825233,-73.9476,MANHATTAN,1.0,0.0,0,0,1,0,0,0,4816128,2025-05-27 20:00:00,2025-05-27T20:00,2025,5,18.6,0.0,Cloudy
03/21/2025,10:00,40.72579,-73.99495,MANHATTAN,1.0,0.0,1,0,0,0,0,0,4803617,2025-03-21 10:00:00,2025-03-21T10:00,2025,3,4.6,0.0,Clear
04/25/2025,20:00,40.76156,-73.983154,MANHATTAN,0.0,0.0,0,0,0,0,0,0,4810575,2025-04-25 20:00:00,2025-04-25T20:00,2025,4,18.7,0.0,Cloudy
04/05/2025,21:00,40.746124,-73.992874,MANHATTAN,1.0,0.0,0,0,1,0,0,0,4803535,2025-04-05 21:00:00,2025-04-05T21:00,2025,4,6.4,0.0,Cloudy
06/27/2025,21:00,40.822357,-73.949486,MANHATTAN,1.0,0.0,0,0,0,0,1,0,4823730,2025-06-27 21:00:00,2025-06-27T21:00,2025,6,17.9,0.1,Drizzle
08/09/2025,5:00,40.802025,-73.949684,MANHATTAN,1.0,0.0,0,0,0,0,1,0,4833829,2025-08-09 05:00:00,2025-08-09T05:00,2025,8,17.7,0.0,Clear
04/04/2025,15:00,40.777412,-73.9788,MANHATTAN,1.0,0.0,0,0,1,0,0,0,4803641,2025-04-04 15:00:00,2025-04-04T15:00,2025,4,19.1,0.0,Cloudy
10/06/2025,21:00,40.803196,-73.942566,MANHATTAN,1.0,0.0,0,0,0,0,1,0,4848020,2025-10-06 21:00:00,2025-10-06T21:00,2025,10,20.1,0.0,Clear
02/02/2025,23:00,40.84954,-73.9364,MANHATTAN,0.0,0.0,0,0,0,0,0,0,4790769,2025-02-02 23:00:00,2025-02-02T23:00,2025,2,-1.1,1.0,Heavy Snow
01/31/2025,22:00,40.714165,-74.00631,MANHATTAN,1.0,0.0,0,0,1,0,0,0,4790862,2025-01-31 22:00:00,2025-01-31T22:00,2025,1,6.0,1.2,Drizzle
09/28/2025,4:00,40.741623,-73.99374,MANHATTAN,1.0,0.0,1,0,0,0,0,0,4845506,2025-09-28 04:00:00,2025-09-28T04:00,2025,9,18.4,0.0,Cloudy
03/25/2025,11:00,40.76889,-73.98209,MANHATTAN,2.0,0.0,0,0,0,0,2,0,4801266,2025-03-25 11:00:00,2025-03-25T11:00,2025,3,11.9,0.0,Cloudy
10/06/2025,14:00,40.71652,-74.0033,MANHATTAN,0.0,0.0,0,0,0,0,0,0,4848041,2025-10-06 14:00:00,2025-10-06T14:00,2025,10,26.6,0.0,Clear
02/24/2025,18:00,40.7919,-73.93799,MANHATTAN,0.0,0.0,0,0,0,0,0,0,4795054,2025-02-24 18:00:00,2025-02-24T18:00,2025,2,5.1,0.0,Cloudy
02/06/2025,0:00,40.75677,-73.98271,MANHATTAN,1.0,0.0,0,0,0,0,0,0,4790950,2025-02-06 00:00:00,2025-02-06T00:00,2025,2,-2.0,0.1,Light Snow
10/16/2025,19:00,40.845543,-73.93277,MANHATTAN,1.0,0.0,0,0,0,0,1,0,4850639,2025-10-16 19:00:00,2025-10-16T19:00,2025,10,10.8,0.0,Clear
04/22/2025,20:00,40.7615,-73.99782,MANHATTAN,0.0,0.0,0,0,0,0,0,0,4811039,2025-04-22 20:00:00,2025-04-22T20:00,2025,4,20.6,0.0,Cloudy
09/04/2025,0:00,40.718143,-73.99383,MANHATTAN,1.0,0.0,1,0,0,0,0,0,4840025,2025-09-04 00:00:00,2025-09-04T00:00,2025,9,18.1,0.0,Clear
09/29/2025,7:00,40.793186,-73.94056,MANHATTAN,3.0,0.0,0,0,0,0,3,0,4846270,2025-09-29 07:00:00,2025-09-29T07:00,2025,9,17.8,0.0,Cloudy
09/15/2025,11:00,40.755253,-73.99866,MANHATTAN,0.0,0.0,0,0,0,0,0,0,4843214,2025-09-15 11:00:00,2025-09-15T11:00,2025,9,26.5,0.0,Clear
09/19/2025,18:00,40.821186,-73.93759,MANHATTAN,1.0,0.0,0,0,1,0,0,0,4844111,2025-09-19 18:00:00,2025-09-19T18:00,2025,9,24.3,0.0,Clear
08/21/2025,8:00,40.80313,-73.94077,MANHATTAN,1.0,0.0,1,0,0,0,0,0,4836626,2025-08-21 08:00:00,2025-08-21T08:00,2025,8,15.9,0.0,Cloudy
08/30/2025,0:00,40.74307,-73.986565,MANHATTAN,1.0,0.0,0,0,0,0,1,0,4838933,2025-08-30 00:00:00,2025-08-30T00:00,2025,8,17.5,0.0,Clear
06/11/2025,8:00,40.72135,-74.00464,MANHATTAN,1.0,0.0,0,0,0,0,1,0,4820385,2025-06-11 08:00:00,2025-06-11T08:00,2025,6,23.2,0.0,Clear
04/11/2025,17:00,40.75142,-73.98765,MANHATTAN,0.0,0.0,0,0,0,0,0,0,4806170,2025-04-11 17:00:00,2025-04-11T17:00,2025,4,6.8,0.2,Drizzle
10/21/2025,14:00,40.783844,-73.97999,MANHATTAN,4.0,0.0,0,0,0,0,4,0,4851753,2025-10-21 14:00:00,2025-10-21T14:00,2025,10,18.9,0.0,Clear
07/23/2025,22:00,40.792126,-73.94558,MANHATTAN,1.0,0.0,0,0,0,0,0,0,4830796,2025-07-23 22:00:00,2025-07-23T22:00,2025,7,23.3,0.0,Cloudy
09/29/2025,20:00,0.0,0.0,MANHATTAN,1.0,0.0,0,0,0,0,1,0,4846300,2025-09-29 20:00:00,2025-09-29T20:00,2025,9,24.9,0.0,Cloudy
02/21/2025,14:00,40.7445,-73.98111,MANHATTAN,1.0,0.0,1,0,0,0,0,0,4794220,2025-02-21 14:00:00,2025-02-21T14:00,2025,2,-0.3,0.0,Clear
04/14/2025,15:00,40.794052,-73.97037,MANHATTAN,0.0,0.0,0,0,0,0,0,0,4805896,2025-04-14 15:00:00,2025-04-14T15:00,2025,4,15.9,0.0,Cloudy
04/14/2025,0:00,40.761738,-73.98063,MANHATTAN,1.0,0.0,0,0,0,0,1,0,4805925,2025-04-14 00:00:00,2025-04-14T00:00,2025,4,7.6,0.0,Clear
05/18/2025,15:00,40.760937,-73.971245,MANHATTAN,1.0,0.0,0,0,1,0,0,0,4814564,2025-05-18 15:00:00,2025-05-18T15:00,2025,5,22.4,0.1,Drizzle
01/17/2025,19:00,40.739407,-74.00645,MANHATTAN,1.0,0.0,1,0,0,0,0,0,4786676,2025-01-17 19:00:00,2025-01-17T19:00,2025,1,0.8,0.0,Clear
03/02/2025,11:00,40.834682,-73.94443,MANHATTAN,1.0,0.0,1,0,0,0,0,0,4796360,2025-03-02 11:00:00,2025-03-02T11:00,2025,3,-2.4,0.0,Clear
05/25/2025,0:00,40.848736,-73.932335,MANHATTAN,2.0,0.0,0,0,2,0,0,0,4819082,2025-05-25 00:00:00,2025-05-25T00:00,2025,5,11.5,0.0,Cloudy
06/27/2025,11:00,40.72272,-73.99415,MANHATTAN,1.0,0.0,0,0,1,0,0,0,4823679,2025-06-27 11:00:00,2025-06-27T11:00,2025,6,21.7,0.0,Cloudy
03/05/2025,18:00,40.742912,-73.992805,MANHATTAN,1.0,0.0,1,0,0,0,0,0,4796621,2025-03-05 18:00:00,2025-03-05T18:00,2025,3,10.0,7.0,Heavy Rain
05/27/2025,0:00,40.76839,-73.98168,MANHATTAN,1.0,0.0,0,0,1,0,0,0,4816172,2025-05-27 00:00:00,2025-05-27T00:00,2025,5,13.9,0.0,Cloudy
02/14/2025,15:00,40.734814,-74.00844,MANHATTAN,1.0,0.0,0,0,1,0,0,0,4793611,2025-02-14 15:00:00,2025-02-14T15:00,2025,2,0.4,0.0,Clear
01/03/2025,13:00,40.746998,-73.974045,MANHATTAN,1.0,0.0,1,0,0,0,0,0,4784359,2025-01-03 13:00:00,2025-01-03T13:00,2025,1,2.9,0.0,Cloudy
02/26/2025,17:00,40.798622,-73.94162,MANHATTAN,1.0,0.0,1,0,0,0,0,0,4795408,2025-02-26 17:00:00,2025-02-26T17:00,2025,2,10.9,0.0,Cloudy
04/29/2025,23:00,40.735554,-73.97935,MANHATTAN,1.0,0.0,1,0,0,0,0,0,4810909,2025-04-29 23:00:00,2025-04-29T23:00,2025,4,21.7,0.0,Cloudy
10/04/2025,0:00,40.738506,-73.9918,MANHATTAN,1.0,0.0,0,0,0,0,1,0,4847581,2025-10-04 00:00:00,2025-10-04T00:00,2025,10,14.8,0.0,Clear
07/27/2025,15:00,0.0,0.0,MANHATTAN,1.0,0.0,0,0,1,0,0,0,4833260,2025-07-27 15:00:00,2025-07-27T15:00,2025,7,22.4,0.0,Clear
07/30/2025,15:00,40.760822,-73.998314,MANHATTAN,1.0,0.0,0,0,1,0,0,0,4832306,2025-07-30 15:00:00,2025-07-30T15:00,2025,7,34.9,0.0,Clear
03/20/2025,18:00,40.848938,-73.93707,MANHATTAN,1.0,0.0,1,0,0,0,0,0,4801402,2025-03-20 18:00:00,2025-03-20T18:00,2025,3,8.1,0.0,Cloudy
06/23/2025,18:00,40.75248,-73.912544,QUEENS,1.0,0.0,1,0,0,0,0,0,4822984,2025-06-23 18:00:00,2025-06-23T18:00,2025,6,32.5,0.0,Cloudy
02/05/2025,10:00,40.704403,-73.81444,QUEENS,1.0,0.0,0,0,0,0,1,0,4790645,2025-02-05 10:00:00,2025-02-05T10:00,2025,2,-1.3,0.0,Cloudy
01/09/2025,17:00,40.716686,-73.74489,QUEENS,1.0,0.0,0,0,0,0,1,0,4784849,2025-01-09 17:00:00,2025-01-09T17:00,2025,1,-3.4,0.0,Clear
01/09/2025,11:00,40.66863,-73.781685,QUEENS,1.0,0.0,0,0,1,0,0,0,4786083,2025-01-09 11:00:00,2025-01-09T11:00,2025,1,-3.1,0.0,Cloudy
02/25/2025,12:00,40.72621,-73.726395,QUEENS,0.0,0.0,0,0,0,0,0,0,4795224,2025-02-25 12:00:00,2025-02-25T12:00,2025,2,11.2,0.0,Cloudy
01/10/2025,22:00,40.748768,-73.87827,QUEENS,1.0,0.0,0,0,0,0,1,0,4785244,2025-01-10 22:00:00,2025-01-10T22:00,2025,1,-0.5,0.0,Cloudy
07/02/2025,8:00,40.713867,-73.78015,QUEENS,2.0,0.0,0,0,0,0,2,0,4824681,2025-07-02 08:00:00,2025-07-02T08:00,2025,7,23.4,0.8,Drizzle
10/01/2025,8:00,40.74987,-73.862724,QUEENS,2.0,0.0,1,0,0,0,1,0,4846714,2025-10-01 08:00:00,2025-10-01T08:00,2025,10,14.1,0.0,Clear
02/27/2025,5:00,40.706127,-73.88366,QUEENS,0.0,0.0,0,0,0,0,0,0,4795870,2025-02-27 05:00:00,2025-02-27T05:00,2025,2,5.5,0.0,Cloudy
06/14/2025,0:00,40.76278,-73.861984,QUEENS,1.0,0.0,0,0,0,0,1,0,4821459,2025-06-14 00:00:00,2025-06-14T00:00,2025,6,20.1,0.0,Cloudy
06/05/2025,23:00,40.74704,-73.88957,QUEENS,1.0,0.0,0,0,0,0,1,0,4819216,2025-06-05 23:00:00,2025-06-05T23:00,2025,6,26.7,0.0,Clear
07/09/2025,17:00,40.579514,-73.838104,QUEENS,1.0,0.0,1,0,0,0,0,0,4826523,2025-07-09 17:00:00,2025-07-09T17:00,2025,7,26.6,0.0,Clear
06/12/2025,12:00,40.70375,-73.79915,QUEENS,1.0,0.0,0,0,1,0,0,0,4820581,2025-06-12 12:00:00,2025-06-12T12:00,2025,6,33.2,0.0,Clear
06/19/2025,8:00,40.761906,-73.87989,QUEENS,1.0,0.0,0,0,0,0,1,0,4821610,2025-06-19 08:00:00,2025-06-19T08:00,2025,6,26.5,0.0,Clear
09/05/2025,15:00,40.686913,-73.79437,QUEENS,1.0,0.0,0,0,0,0,1,0,4840384,2025-09-05 15:00:00,2025-09-05T15:00,2025,9,23.7,0.0,Clear
06/04/2025,12:00,40.682053,-73.76502,QUEENS,0.0,0.0,0,0,0,0,0,0,4818318,2025-06-04 12:00:00,2025-06-04T12:00,2025,6,23.1,0.0,Clear
02/10/2025,16:00,40.718502,-73.73526,QUEENS,1.0,0.0,1,0,0,0,0,0,4791971,2025-02-10 16:00:00,2025-02-10T16:00,2025,2,-0.5,0.0,Clear
08/25/2025,20:00,40.757343,-73.867065,QUEENS,1.0,0.0,0,0,1,0,0,0,4837715,2025-08-25 20:00:00,2025-08-25T20:00,2025,8,26.3,0.0,Clear
05/16/2025,8:00,40.68213,-73.86499,QUEENS,3.0,0.0,0,0,0,0,3,0,4813159,2025-05-16 08:00:00,2025-05-16T08:00,2025,5,16.5,0.0,Cloudy
06/16/2025,17:00,40.75658,-73.92975,QUEENS,1.0,0.0,0,0,0,0,0,0,4821516,2025-06-16 17:00:00,2025-06-16T17:00,2025,6,19.5,0.0,Cloudy
07/01/2025,21:00,40.73675,-73.87767,QUEENS,1.0,0.0,1,0,0,0,0,0,4824931,2025-07-01 21:00:00,2025-07-01T21:00,2025,7,24.8,0.5,Drizzle
09/02/2025,12:00,40.701767,-73.73434,QUEENS,1.0,0.0,1,0,0,0,0,0,4839145,2025-09-02 12:00:00,2025-09-02T12:00,2025,9,24.4,0.0,Clear
08/12/2025,17:00,40.596024,-73.74302,QUEENS,0.0,0.0,0,0,0,0,0,0,4835194,2025-08-12 17:00:00,2025-08-12T17:00,2025,8,23.8,0.0,Clear
04/25/2025,11:00,40.752876,-73.91469,QUEENS,1.0,0.0,0,0,0,0,1,0,4807991,2025-04-25 11:00:00,2025-04-25T11:00,2025,4,22.8,0.0,Cloudy
07/05/2025,17:00,40.713284,-73.76605,QUEENS,1.0,0.0,1,0,0,0,0,0,4825340,2025-07-05 17:00:00,2025-07-05T17:00,2025,7,27.9,0.0,Clear
10/12/2025,10:00,40.68658,-73.804565,QUEENS,0.0,0.0,0,0,0,0,0,0,4849309,2025-10-12 10:00:00,2025-10-12T10:00,2025,10,15.4,0.0,Cloudy
03/03/2025,11:00,40.765827,-73.82792,QUEENS,1.0,0.0,0,0,0,0,1,0,4796121,2025-03-03 11:00:00,2025-03-03T11:00,2025,3,-0.2,0.0,Clear
01/24/2025,6:00,40.70281,-73.743866,QUEENS,1.0,0.0,0,0,0,0,1,0,4787905,2025-01-24 06:00:00,2025-01-24T06:00,2025,1,-7.8,0.0,Clear
01/30/2025,5:00,40.736233,-73.722534,QUEENS,2.0,0.0,0,0,0,0,2,0,4789140,2025-01-30 05:00:00,2025-01-30T05:00,2025,1,-5.6,0.0,Clear
06/20/2025,8:00,40.68179,-73.844475,QUEENS,1.0,0.0,0,0,1,0,0,0,4822406,2025-06-20 08:00:00,2025-06-20T08:00,2025,6,22.5,0.0,Clear
01/30/2025,16:00,40.704304,-73.80314,QUEENS,1.0,0.0,1,0,0,0,0,0,4789375,2025-01-30 16:00:00,2025-01-30T16:00,2025,1,0.6,0.0,Cloudy
05/24/2025,18:00,40.756676,-73.87737,QUEENS,1.0,0.0,0,0,0,0,0,0,4816716,2025-05-24 18:00:00,2025-05-24T18:00,2025,5,15.6,0.0,Clear
04/26/2025,0:00,40.741627,-73.87917,QUEENS,1.0,0.0,0,0,0,0,0,0,4808205,2025-04-26 00:00:00,2025-04-26T00:00,2025,4,15.4,0.0,Cloudy
06/05/2025,19:00,40.668434,-73.80061,QUEENS,1.0,0.0,0,0,0,0,1,0,4818245,2025-06-05 19:00:00,2025-06-05T19:00,2025,6,22.4,0.0,Cloudy
01/21/2025,14:00,40.759686,-73.82117,QUEENS,1.0,0.0,0,0,0,0,1,0,4788389,2025-01-21 14:00:00,2025-01-21T14:00,2025,1,-8.7,0.0,Cloudy
08/03/2025,0:00,40.68236,-73.793755,QUEENS,1.0,0.0,0,0,0,0,1,0,4832586,2025-08-03 00:00:00,2025-08-03T00:00,2025,8,19.7,0.0,Clear
01/31/2025,7:00,40.72131,-73.759926,QUEENS,1.0,0.0,1,0,0,0,0,0,4789726,2025-01-31 07:00:00,2025-01-31T07:00,2025,1,3.5,0.3,Drizzle
05/12/2025,0:00,40.701054,-73.808876,QUEENS,1.0,0.0,0,0,0,0,1,0,4812508,2025-05-12 00:00:00,2025-05-12T00:00,2025,5,15.2,0.0,Clear
01/24/2025,8:00,40.757584,-73.77937,QUEENS,1.0,0.0,1,0,0,0,0,0,4788046,2025-01-24 08:00:00,2025-01-24T08:00,2025,1,-8.8,0.0,Clear
10/16/2025,20:00,40.74543,-73.9038,QUEENS,1.0,0.0,0,0,0,0,1,0,4850309,2025-10-16 20:00:00,2025-10-16T20:00,2025,10,10.4,0.0,Clear
02/22/2025,13:00,40.760277,-73.843124,QUEENS,0.0,0.0,0,0,0,0,0,0,4794463,2025-02-22 13:00:00,2025-02-22T13:00,2025,2,2.1,0.0,Clear
03/05/2025,18:00,40.70242,-73.817444,QUEENS,1.0,0.0,0,0,0,0,1,0,4796707,2025-03-05 18:00:00,2025-03-05T18:00,2025,3,9.4,1.8,Light Rain
04/22/2025,0:00,40.74724,-73.89041,QUEENS,1.0,0.0,1,0,0,0,0,0,4807531,2025-04-22 00:00:00,2025-04-22T00:00,2025,4,11.8,0.1,Drizzle
06/28/2025,3:00,40.711845,-73.85976,QUEENS,2.0,0.0,0,0,0,0,2,0,4826340,2025-06-28 03:00:00,2025-06-28T03:00,2025,6,19.5,0.0,Cloudy
01/23/2025,0:00,40.748726,-73.79649,QUEENS,0.0,0.0,0,0,0,0,0,0,4787799,2025-01-23 00:00:00,2025-01-23T00:00,2025,1,-12.2,0.0,Cloudy
07/27/2025,2:00,40.713608,-73.91287,QUEENS,0.0,0.0,0,0,0,0,0,0,4831819,2025-07-27 02:00:00,2025-07-27T02:00,2025,7,23.0,0.0,Cloudy
10/03/2025,20:00,40.772263,-73.9259,QUEENS,1.0,0.0,1,0,0,0,0,0,4847483,2025-10-03 20:00:00,2025-10-03T20:00,2025,10,16.8,0.0,Clear
02/21/2025,23:00,40.71125,-73.777084,QUEENS,0.0,0.0,0,0,0,0,0,0,4794486,2025-02-21 23:00:00,2025-02-21T23:00,2025,2,-5.6,0.0,Clear
03/20/2025,11:00,40.60021,-73.75402,QUEENS,1.0,0.0,1,0,0,0,0,0,4800291,2025-03-20 11:00:00,2025-03-20T11:00,2025,3,6.7,0.0,Cloudy
09/10/2025,10:00,40.689735,-73.89032,QUEENS,1.0,0.0,0,0,0,0,1,0,4842277,2025-09-10 10:00:00,2025-09-10T10:00,2025,9,16.4,1.3,Light Rain
09/09/2025,8:00,40.669,-73.803566,QUEENS,1.0,0.0,0,0,0,0,1,0,4842356,2025-09-09 08:00:00,2025-09-09T08:00,2025,9,16.8,0.0,Clear
07/13/2025,2:00,40.760014,-73.87859,QUEENS,1.0,0.0,1,0,0,0,0,0,4826946,2025-07-13 02:00:00,2025-07-13T02:00,2025,7,22.6,0.0,Cloudy
07/30/2025,8:00,40.760372,-73.81509,QUEENS,1.0,0.0,0,0,1,0,0,0,4831982,2025-07-30 08:00:00,2025-07-30T08:00,2025,7,30.9,0.0,Cloudy
10/04/2025,22:00,40.68928,-73.77978,QUEENS,1.0,0.0,0,0,1,0,0,0,4847965,2025-10-04 22:00:00,2025-10-04T22:00,2025,10,20.5,0.0,Cloudy
03/02/2025,19:00,40.764706,-73.811,QUEENS,1.0,0.0,0,0,1,0,0,0,4803295,2025-03-02 19:00:00,2025-03-02T19:00,2025,3,-2.9,0.0,Clear
10/04/2025,10:00,40.681393,-73.828606,QUEENS,1.0,0.0,0,0,0,0,1,0,4847249,2025-10-04 10:00:00,2025-10-04T10:00,2025,10,20.3,0.0,Clear
02/26/2025,8:00,40.72416,-73.75497,QUEENS,1.0,0.0,1,0,0,0,0,0,4795060,2025-02-26 08:00:00,2025-02-26T08:00,2025,2,4.8,0.0,Clear
06/19/2025,13:00,40.735428,-73.70489,QUEENS,1.0,0.0,0,0,0,0,1,0,4821628,2025-06-19 13:00:00,2025-06-19T13:00,2025,6,27.1,0.0,Cloudy
02/16/2025,21:00,40.69599,-73.73664,QUEENS,3.0,0.0,0,0,0,0,3,0,4793514,2025-02-16 21:00:00,2025-02-16T21:00,2025,2,5.4,0.0,Cloudy
02/05/2025,17:00,40.765217,-73.82018,QUEENS,1.0,0.0,1,0,0,0,0,0,4790712,2025-02-05 17:00:00,2025-02-05T17:00,2025,2,0.1,0.0,Cloudy
06/18/2025,23:00,40.762825,-73.92028,QUEENS,1.0,0.0,0,0,0,0,1,0,4822372,2025-06-18 23:00:00,2025-06-18T23:00,2025,6,21.5,0.0,Clear
01/11/2025,16:00,40.699806,-73.77396,QUEENS,1.0,0.0,0,0,0,0,1,0,4785436,2025-01-11 16:00:00,2025-01-11T16:00,2025,1,0.2,0.0,Cloudy
10/21/2025,17:00,40.76301,-73.87532,QUEENS,0.0,0.0,0,0,0,0,0,0,4852269,2025-10-21 17:00:00,2025-10-21T17:00,2025,10,16.5,0.0,Cloudy
01/09/2025,0:00,40.667908,-73.79473,QUEENS,1.0,0.0,0,0,0,0,1,0,4784715,2025-01-09 00:00:00,2025-01-09T00:00,2025,1,-6.1,0.0,Cloudy
10/06/2025,9:00,40.743702,-73.92334,QUEENS,1.0,0.0,1,0,0,0,0,0,4848044,2025-10-06 09:00:00,2025-10-06T09:00,2025,10,20.2,0.0,Clear
02/26/2025,21:00,40.755516,-73.8203,QUEENS,1.0,0.0,0,0,0,0,1,0,4795743,2025-02-26 21:00:00,2025-02-26T21:00,2025,2,6.6,0.0,Cloudy
03/28/2025,23:00,40.716347,-73.73548,QUEENS,1.0,0.0,1,0,0,0,0,0,4801889,2025-03-28 23:00:00,2025-03-28T23:00,2025,3,9.1,0.0,Cloudy
07/05/2025,7:00,40.793655,-73.841644,QUEENS,1.0,0.0,0,0,0,0,1,0,4825632,2025-07-05 07:00:00,2025-07-05T07:00,2025,7,22.4,0.0,Cloudy
06/28/2025,6:00,40.703022,-73.831245,QUEENS,3.0,0.0,0,0,0,0,3,0,4824061,2025-06-28 06:00:00,2025-06-28T06:00,2025,6,20.7,0.4,Drizzle
06/26/2025,0:00,40.69539,-73.89889,QUEENS,1.0,0.0,1,0,0,0,0,0,4823543,2025-06-26 00:00:00,2025-06-26T00:00,2025,6,30.3,0.0,Cloudy
06/03/2025,0:00,40.74576,-73.925804,QUEENS,2.0,0.0,0,0,0,0,2,0,4818220,2025-06-03 00:00:00,2025-06-03T00:00,2025,6,13.7,0.0,Clear
06/19/2025,17:00,40.696247,-73.76435,QUEENS,3.0,0.0,0,0,0,0,3,0,4821735,2025-06-19 17:00:00,2025-06-19T17:00,2025,6,26.6,0.0,Clear
05/26/2025,18:00,40.756805,-73.87366,QUEENS,1.0,0.0,0,0,1,0,0,0,4816167,2025-05-26 18:00:00,2025-05-26T18:00,2025,5,20.2,0.0,Clear
02/05/2025,13:00,40.694424,-73.82748,QUEENS,1.0,0.0,0,0,0,0,1,0,4790682,2025-02-05 13:00:00,2025-02-05T13:00,2025,2,0.5,0.0,Cloudy
08/11/2025,10:00,40.745674,-73.78291,QUEENS,1.0,0.0,0,0,0,0,1,0,4834296,2025-08-11 10:00:00,2025-08-11T10:00,2025,8,29.5,0.0,Clear
07/10/2025,19:00,40.760113,-73.87767,QUEENS,1.0,0.0,0,0,1,0,0,0,4826671,2025-07-10 19:00:00,2025-07-10T19:00,2025,7,24.5,0.0,Cloudy
01/09/2025,1:00,40.749466,-73.86535,QUEENS,2.0,0.0,0,0,0,0,2,0,4784901,2025-01-09 01:00:00,2025-01-09T01:00,2025,1,-6.8,0.0,Cloudy
05/20/2025,18:00,40.75634,-73.87793,QUEENS,0.0,0.0,0,0,0,0,0,0,4814307,2025-05-20 18:00:00,2025-05-20T18:00,2025,5,16.4,0.0,Clear
06/06/2025,19:00,40.765015,-73.88709,QUEENS,2.0,0.0,0,0,0,0,2,0,4818812,2025-06-06 19:00:00,2025-06-06T19:00,2025,6,25.4,0.1,Drizzle
07/11/2025,6:00,40.746555,-73.8262,QUEENS,8.0,0.0,0,0,0,0,8,0,4827343,2025-07-11 06:00:00,2025-07-11T06:00,2025,7,22.2,0.0,Cloudy
06/20/2025,15:00,40.75458,-73.89466,QUEENS,1.0,0.0,0,0,1,0,0,0,4823158,2025-06-20 15:00:00,2025-06-20T15:00,2025,6,28.3,0.0,Clear
02/22/2025,16:00,40.666843,-73.789406,QUEENS,3.0,0.0,0,0,0,0,3,0,4795875,2025-02-22 16:00:00,2025-02-22T16:00,2025,2,2.2,0.0,Cloudy
07/17/2025,21:00,40.67256,-73.84025,QUEENS,2.0,0.0,0,0,0,0,2,0,4829161,2025-07-17 21:00:00,2025-07-17T21:00,2025,7,29.9,0.0,Clear
02/16/2025,2:00,40.748108,-73.71035,QUEENS,0.0,0.0,0,0,0,0,0,0,4793059,2025-02-16 02:00:00,2025-02-16T02:00,2025,2,2.8,0.3,Drizzle
08/02/2025,15:00,40.723923,-73.899445,QUEENS,1.0,0.0,0,0,1,0,0,0,4832180,2025-08-02 15:00:00,2025-08-02T15:00,2025,8,25.5,0.0,Cloudy
01/03/2025,0:00,40.703293,-73.79609,QUEENS,2.0,0.0,0,0,0,0,2,0,4783972,2025-01-03 00:00:00,2025-01-03T00:00,2025,1,-0.3,0.0,Clear
08/08/2025,13:00,40.66956,-73.85011,QUEENS,1.0,0.0,0,0,1,0,0,0,4833795,2025-08-08 13:00:00,2025-08-08T13:00,2025,8,25.7,0.0,Clear
05/18/2025,17:00,40.702763,-73.870735,QUEENS,1.0,0.0,1,0,0,0,0,0,4813638,2025-05-18 17:00:00,2025-05-18T17:00,2025,5,21.2,0.1,Drizzle
09/06/2025,5:00,40.707573,-73.83619,QUEENS,2.0,0.0,0,0,0,0,2,0,4840056,2025-09-06 05:00:00,2025-09-06T05:00,2025,9,21.8,0.0,Clear
04/23/2025,0:00,40.749737,-73.86521,QUEENS,1.0,0.0,1,0,0,0,0,0,4807881,2025-04-23 00:00:00,2025-04-23T00:00,2025,4,16.3,0.0,Cloudy
07/03/2025,20:00,40.753765,-73.804886,QUEENS,1.0,0.0,0,0,0,0,1,0,4825066,2025-07-03 20:00:00,2025-07-03T20:00,2025,7,22.2,0.0,Clear
02/20/2025,1:00,40.742218,-73.86974,QUEENS,1.0,0.0,0,0,1,0,0,0,4793762,2025-02-20 01:00:00,2025-02-20T01:00,2025,2,-6.0,0.0,Cloudy
05/14/2025,8:00,40.73228,-73.85182,QUEENS,1.0,0.0,1,0,0,0,0,0,4813450,2025-05-14 08:00:00,2025-05-14T08:00,2025,5,16.2,2.2,Light Rain
06/16/2025,23:00,40.75694,-73.934296,QUEENS,1.0,0.0,0,0,1,0,0,0,4828528,2025-06-16 23:00:00,2025-06-16T23:00,2025,6,17.6,4.1,Heavy Rain
09/29/2025,0:00,40.76548,-73.9137,QUEENS,1.0,0.0,0,0,0,0,1,0,4846826,2025-09-29 00:00:00,2025-09-29T00:00,2025,9,20.0,0.0,Cloudy
06/15/2025,21:00,40.70136,-73.758484,QUEENS,1.0,0.0,1,0,0,0,0,0,4823081,2025-06-15 21:00:00,2025-06-15T21:00,2025,6,16.6,0.5,Drizzle
07/08/2025,7:00,40.713875,-73.772736,QUEENS,1.0,0.0,0,0,0,0,0,0,4826792,2025-07-08 07:00:00,2025-07-08T07:00,2025,7,26.3,0.0,Clear
01/18/2025,21:00,40.720303,-73.73234,QUEENS,4.0,0.0,0,0,0,0,4,0,4786601,2025-01-18 21:00:00,2025-01-18T21:00,2025,1,5.1,0.0,Cloudy
08/02/2025,0:00,40.7065,-73.89694,QUEENS,1.0,0.0,0,0,0,0,1,0,4833179,2025-08-02 00:00:00,2025-08-02T00:00,2025,8,18.8,0.0,Clear
02/04/2025,19:00,40.75899,-73.83453,QUEENS,0.0,0.0,0,0,0,0,0,0,4791240,2025-02-04 19:00:00,2025-02-04T19:00,2025,2,-0.2,0.0,Clear
01/14/2025,11:00,40.69806,-73.80986,QUEENS,2.0,0.0,0,0,0,0,2,0,4786280,2025-01-14 11:00:00,2025-01-14T11:00,2025,1,-1.3,0.0,Clear
04/06/2025,13:00,40.674473,-73.80431,QUEENS,0.0,0.0,0,0,0,0,0,0,4803916,2025-04-06 13:00:00,2025-04-06T13:00,2025,4,12.9,0.0,Cloudy
02/17/2025,20:00,40.77889,-73.81453,QUEENS,0.0,0.0,0,0,0,0,0,0,4793753,2025-02-17 20:00:00,2025-02-17T20:00,2025,2,-1.1,0.0,Cloudy
01/21/2025,20:00,40.753647,-73.74439,QUEENS,0.0,0.0,0,0,0,0,0,0,4787452,2025-01-21 20:00:00,2025-01-21T20:00,2025,1,-9.0,0.1,Light Snow
10/05/2025,0:00,40.67667,-73.86077,QUEENS,1.0,0.0,0,0,0,0,1,0,4847767,2025-10-05 00:00:00,2025-10-05T00:00,2025,10,20.1,0.0,Clear
10/22/2025,16:00,40.73494,-73.80486,QUEENS,1.0,0.0,0,0,0,0,1,0,4851774,2025-10-22 16:00:00,2025-10-22T16:00,2025,10,15.0,0.0,Cloudy
05/20/2025,14:00,40.7353,-73.85216,QUEENS,1.0,0.0,1,0,0,0,0,0,4815307,2025-05-20 14:00:00,2025-05-20T14:00,2025,5,18.8,0.0,Cloudy
04/17/2025,18:00,40.75314,-73.81525,QUEENS,1.0,0.0,1,0,0,0,0,0,4806486,2025-04-17 18:00:00,2025-04-17T18:00,2025,4,13.5,0.0,Clear
05/27/2025,10:00,40.690598,-73.76209,QUEENS,1.0,0.0,0,0,0,0,1,0,4816636,2025-05-27 10:00:00,2025-05-27T10:00,2025,5,20.9,0.0,Cloudy
06/05/2025,8:00,40.753677,-73.91447,QUEENS,1.0,0.0,0,0,0,0,0,0,4818088,2025-06-05 08:00:00,2025-06-05T08:00,2025,6,25.5,0.0,Cloudy
03/24/2025,20:00,40.791515,-73.85154,QUEENS,2.0,0.0,0,0,0,0,2,0,4801296,2025-03-24 20:00:00,2025-03-24T20:00,2025,3,7.5,0.0,Clear
03/08/2025,5:00,40.699696,-73.74172,QUEENS,2.0,0.0,0,0,0,0,2,0,4798276,2025-03-08 05:00:00,2025-03-08T05:00,2025,3,2.4,0.0,Cloudy
09/02/2025,19:00,40.72597,-73.77556,QUEENS,2.0,0.0,0,0,2,0,0,0,4839228,2025-09-02 19:00:00,2025-09-02T19:00,2025,9,20.4,0.0,Clear
10/13/2025,0:00,40.755344,-73.90798,QUEENS,1.0,0.0,0,0,1,0,0,0,4851027,2025-10-13 00:00:00,2025-10-13T00:00,2025,10,13.7,3.2,Heavy Rain
02/01/2025,3:00,40.74169,-73.850945,QUEENS,0.0,0.0,0,0,0,0,0,0,4789529,2025-02-01 03:00:00,2025-02-01T03:00,2025,2,5.3,0.5,Drizzle
06/15/2025,23:00,40.751457,-73.832275,QUEENS,1.0,0.0,0,0,1,0,0,0,4820765,2025-06-15 23:00:00,2025-06-15T23:00,2025,6,16.4,0.0,Cloudy
07/06/2025,2:00,40.67345,-73.841606,QUEENS,0.0,0.0,0,0,0,0,0,0,4829681,2025-07-06 02:00:00,2025-07-06T02:00,2025,7,22.6,0.0,Cloudy
05/01/2025,5:00,40.686653,-73.80917,QUEENS,1.0,0.0,0,0,1,0,0,0,4809676,2025-05-01 05:00:00,2025-05-01T05:00,2025,5,10.6,0.0,Cloudy
05/13/2025,22:00,40.704453,-73.792404,QUEENS,1.0,0.0,0,0,0,0,1,0,4812608,2025-05-13 22:00:00,2025-05-13T22:00,2025,5,15.1,0.9,Drizzle
09/07/2025,17:00,40.732533,-73.76564,QUEENS,3.0,0.0,0,0,0,0,3,0,4840435,2025-09-07 17:00:00,2025-09-07T17:00,2025,9,20.0,0.0,Cloudy
10/03/2025,9:00,40.68608,-73.866196,QUEENS,1.0,0.0,0,0,0,0,1,0,4847748,2025-10-03 09:00:00,2025-10-03T09:00,2025,10,14.9,0.0,Cloudy
01/07/2025,9:00,40.713284,-73.735794,QUEENS,1.0,0.0,1,0,0,0,0,0,4784390,2025-01-07 09:00:00,2025-01-07T09:00,2025,1,-5.6,0.0,Cloudy
07/05/2025,17:00,40.727734,-73.90673,QUEENS,4.0,0.0,0,0,0,0,4,0,4827826,2025-07-05 17:00:00,2025-07-05T17:00,2025,7,29.1,0.0,Clear
03/25/2025,9:00,40.711216,-73.787735,QUEENS,0.0,0.0,0,0,0,0,0,0,4801334,2025-03-25 09:00:00,2025-03-25T09:00,2025,3,10.1,0.0,Clear
10/14/2025,6:00,40.765015,-73.88709,QUEENS,1.0,0.0,1,0,0,0,0,0,4849906,2025-10-14 06:00:00,2025-10-14T06:00,2025,10,12.4,0.0,Cloudy
08/30/2025,0:00,40.673183,-73.81424,QUEENS,1.0,0.0,0,0,0,0,1,0,4839004,2025-08-30 00:00:00,2025-08-30T00:00,2025,8,18.7,0.0,Clear
02/11/2025,21:00,40.686497,-73.83816,QUEENS,1.0,0.0,1,0,0,0,0,0,4792046,2025-02-11 21:00:00,2025-02-11T21:00,2025,2,-0.5,0.6,Heavy Snow
03/18/2025,0:00,40.714554,-73.83146,QUEENS,1.0,0.0,0,0,0,0,1,0,4799612,2025-03-18 00:00:00,2025-03-18T00:00,2025,3,2.7,0.0,Clear
02/20/2025,9:00,40.68261,-73.813484,QUEENS,0.0,0.0,0,0,0,0,0,0,4793957,2025-02-20 09:00:00,2025-02-20T09:00,2025,2,-6.0,0.0,Clear
08/13/2025,11:00,40.75749,-73.80642,QUEENS,1.0,0.0,0,0,1,0,0,0,4834860,2025-08-13 11:00:00,2025-08-13T11:00,2025,8,29.7,0.4,Drizzle
10/16/2025,16:00,40.700108,-73.832664,QUEENS,0.0,0.0,0,0,0,0,0,0,4850342,2025-10-16 16:00:00,2025-10-16T16:00,2025,10,14.2,0.0,Clear
09/05/2025,1:00,40.760983,-73.91757,QUEENS,1.0,0.0,1,0,0,0,0,0,4840307,2025-09-05 01:00:00,2025-09-05T01:00,2025,9,19.3,0.5,Drizzle
06/10/2025,18:00,40.75855,-73.829636,QUEENS,1.0,0.0,0,0,0,0,1,0,4819703,2025-06-10 18:00:00,2025-06-10T18:00,2025,6,23.2,0.0,Cloudy
06/27/2025,12:00,40.74524,-73.9377,QUEENS,2.0,0.0,0,0,0,0,2,0,4823744,2025-06-27 12:00:00,2025-06-27T12:00,2025,6,22.2,0.0,Cloudy
02/04/2025,18:00,40.709854,-73.78755,QUEENS,1.0,0.0,1,0,0,0,0,0,4792190,2025-02-04 18:00:00,2025-02-04T18:00,2025,2,0.6,0.0,Clear
06/21/2025,19:00,40.680477,-73.79209,QUEENS,1.0,0.0,0,0,0,0,1,0,4822817,2025-06-21 19:00:00,2025-06-21T19:00,2025,6,25.8,0.0,Cloudy
05/03/2025,1:00,40.749344,-73.87493,QUEENS,2.0,0.0,0,0,0,0,2,0,4809883,2025-05-03 01:00:00,2025-05-03T01:00,2025,5,21.6,0.0,Cloudy
03/28/2025,0:00,40.745728,-73.86212,QUEENS,1.0,0.0,0,0,0,0,1,0,4801745,2025-03-28 00:00:00,2025-03-28T00:00,2025,3,4.5,0.0,Cloudy
06/27/2025,16:00,40.748928,-73.91375,QUEENS,1.0,0.0,1,0,0,0,0,0,4823596,2025-06-27 16:00:00,2025-06-27T16:00,2025,6,22.1,0.0,Cloudy
09/30/2025,14:00,40.738373,-73.79427,QUEENS,1.0,0.0,0,0,0,0,1,0,4846410,2025-09-30 14:00:00,2025-09-30T14:00,2025,9,25.0,0.0,Cloudy
01/24/2025,13:00,40.68803,-73.82521,QUEENS,1.0,0.0,0,0,0,0,1,0,4788404,2025-01-24 13:00:00,2025-01-24T13:00,2025,1,-1.5,0.0,Clear
10/17/2025,12:00,40.740894,-73.899605,QUEENS,2.0,0.0,0,0,0,0,2,0,4850976,2025-10-17 12:00:00,2025-10-17T12:00,2025,10,14.2,0.0,Clear
05/28/2025,16:00,40.699566,-73.83088,QUEENS,1.0,0.0,0,0,1,0,0,0,4817214,2025-05-28 16:00:00,2025-05-28T16:00,2025,5,14.6,0.5,Drizzle
05/08/2025,11:00,40.74128,-73.902565,QUEENS,1.0,0.0,0,0,0,0,1,0,4812465,2025-05-08 11:00:00,2025-05-08T11:00,2025,5,23.5,0.0,Clear
10/17/2025,0:00,40.765053,-73.77273,QUEENS,1.0,0.0,0,0,0,0,1,0,4850433,2025-10-17 00:00:00,2025-10-17T00:00,2025,10,8.4,0.0,Clear
06/28/2025,18:00,40.685287,-73.81244,QUEENS,1.0,0.0,0,0,0,0,1,0,4825908,2025-06-28 18:00:00,2025-06-28T18:00,2025,6,24.8,0.0,Clear
10/12/2025,4:00,40.755558,-73.88537,QUEENS,1.0,0.0,1,0,0,0,0,0,4849232,2025-10-12 04:00:00,2025-10-12T04:00,2025,10,15.8,0.0,Cloudy
04/19/2025,0:00,40.69114,-73.80487,QUEENS,3.0,0.0,0,0,0,0,3,0,4807109,2025-04-19 00:00:00,2025-04-19T00:00,2025,4,13.5,0.3,Drizzle
05/15/2025,17:00,40.696365,-73.74458,QUEENS,1.0,0.0,0,0,1,0,0,0,4813197,2025-05-15 17:00:00,2025-05-15T17:00,2025,5,17.8,0.0,Cloudy
04/16/2025,17:00,40.74807,-73.849106,QUEENS,1.0,0.0,0,0,0,0,1,0,4807616,2025-04-16 17:00:00,2025-04-16T17:00,2025,4,9.5,0.0,Cloudy
06/17/2025,19:00,40.699966,-73.90673,QUEENS,1.0,0.0,0,0,0,0,0,0,4821534,2025-06-17 19:00:00,2025-06-17T19:00,2025,6,19.0,0.0,Cloudy
05/09/2025,16:00,40.69989,-73.84001,QUEENS,0.0,0.0,0,0,0,0,0,0,4811957,2025-05-09 16:00:00,2025-05-09T16:00,2025,5,17.1,0.1,Drizzle
01/27/2025,14:00,40.760727,-73.89105,QUEENS,1.0,0.0,1,0,0,0,0,0,4788923,2025-01-27 14:00:00,2025-01-27T14:00,2025,1,2.0,0.0,Clear
06/24/2025,14:00,40.684063,-73.72872,QUEENS,2.0,0.0,0,0,0,0,2,0,4822860,2025-06-24 14:00:00,2025-06-24T14:00,2025,6,35.6,0.0,Clear
10/18/2025,19:00,40.6883,-73.75963,QUEENS,0.0,0.0,0,0,0,0,0,0,4851912,2025-10-18 19:00:00,2025-10-18T19:00,2025,10,14.8,0.0,Clear
09/29/2025,10:00,40.70001,-73.83089,QUEENS,1.0,0.0,1,0,0,0,0,0,4847747,2025-09-29 10:00:00,2025-09-29T10:00,2025,9,21.4,0.0,Cloudy
04/06/2025,21:00,40.73158,-73.924835,QUEENS,1.0,0.0,0,0,0,0,1,0,4804007,2025-04-06 21:00:00,2025-04-06T21:00,2025,4,10.7,0.0,Cloudy
02/21/2025,11:00,40.743195,-73.93672,QUEENS,1.0,0.0,1,0,0,0,0,0,4794165,2025-02-21 11:00:00,2025-02-21T11:00,2025,2,-1.1,0.0,Clear
04/12/2025,18:00,40.705223,-73.87856,QUEENS,1.0,0.0,0,0,0,0,1,0,4805339,2025-04-12 18:00:00,2025-04-12T18:00,2025,4,4.7,0.1,Drizzle
02/12/2025,12:00,40.68034,-73.765045,QUEENS,0.0,0.0,0,0,0,0,0,0,4792578,2025-02-12 12:00:00,2025-02-12T12:00,2025,2,0.3,0.0,Cloudy
06/24/2025,16:00,40.754475,-73.84617,QUEENS,1.0,0.0,0,0,0,0,1,0,4823356,2025-06-24 16:00:00,2025-06-24T16:00,2025,6,40.4,0.0,Clear
09/24/2025,10:00,40.745525,-73.835434,QUEENS,1.0,0.0,0,0,0,0,1,0,4851866,2025-09-24 10:00:00,2025-09-24T10:00,2025,9,24.8,0.0,Cloudy
04/05/2025,1:00,40.71837,-73.84056,QUEENS,0.0,0.0,0,0,0,0,0,0,4804476,2025-04-05 01:00:00,2025-04-05T01:00,2025,4,11.4,0.0,Cloudy
01/09/2025,9:00,40.69841,-73.806465,QUEENS,1.0,0.0,0,0,0,0,1,0,4784767,2025-01-09 09:00:00,2025-01-09T09:00,2025,1,-4.0,0.0,Clear
09/01/2025,3:00,40.67766,-73.80313,QUEENS,4.0,0.0,0,0,0,0,4,0,4839312,2025-09-01 03:00:00,2025-09-01T03:00,2025,9,18.4,0.0,Clear
05/04/2025,8:00,40.700344,-73.842674,QUEENS,1.0,0.0,0,0,0,0,1,0,4810390,2025-05-04 08:00:00,2025-05-04T08:00,2025,5,16.2,0.0,Cloudy
06/30/2025,6:00,40.6878,-73.78948,QUEENS,0.0,0.0,0,0,0,0,0,0,4824522,2025-06-30 06:00:00,2025-06-30T06:00,2025,6,23.3,0.0,Cloudy
03/28/2025,0:00,40.78168,-73.84686,QUEENS,0.0,0.0,0,0,0,0,0,0,4802837,2025-03-28 00:00:00,2025-03-28T00:00,2025,3,4.7,0.0,Cloudy
08/06/2025,2:00,40.77452,-73.826256,QUEENS,1.0,0.0,1,0,0,0,0,0,4833373,2025-08-06 02:00:00,2025-08-06T02:00,2025,8,21.2,0.0,Cloudy
10/16/2025,17:00,40.66386,-73.82296,QUEENS,1.0,0.0,0,0,0,0,1,0,4851136,2025-10-16 17:00:00,2025-10-16T17:00,2025,10,13.2,0.0,Clear
04/17/2025,19:00,40.74689,-73.9208,QUEENS,1.0,0.0,0,0,0,0,1,0,4806838,2025-04-17 19:00:00,2025-04-17T19:00,2025,4,10.7,0.0,Clear
07/06/2025,9:00,40.696472,-73.84436,QUEENS,0.0,0.0,0,0,0,0,0,0,4825658,2025-07-06 09:00:00,2025-07-06T09:00,2025,7,26.5,0.0,Clear
07/05/2025,0:00,40.768353,-73.9248,QUEENS,1.0,0.0,0,0,1,0,0,0,4825333,2025-07-05 00:00:00,2025-07-05T00:00,2025,7,23.1,0.0,Clear
08/17/2025,21:00,40.768402,-73.73754,QUEENS,2.0,0.0,0,0,0,0,2,0,4835691,2025-08-17 21:00:00,2025-08-17T21:00,2025,8,26.5,0.0,Cloudy
08/17/2025,1:00,40.739796,-73.860275,QUEENS,1.0,0.0,0,0,0,0,1,0,4836315,2025-08-17 01:00:00,2025-08-17T01:00,2025,8,23.5,0.0,Clear
10/08/2025,0:00,40.765877,-73.9195,QUEENS,2.0,0.0,0,0,0,0,2,0,4848535,2025-10-08 00:00:00,2025-10-08T00:00,2025,10,21.4,0.0,Cloudy
05/09/2025,16:00,40.760586,-73.84591,QUEENS,4.0,0.0,0,0,0,0,4,0,4812057,2025-05-09 16:00:00,2025-05-09T16:00,2025,5,17.5,0.5,Drizzle
03/07/2025,7:00,40.60436,-73.76048,QUEENS,0.0,0.0,0,0,0,0,0,0,4799323,2025-03-07 07:00:00,2025-03-07T07:00,2025,3,0.6,0.0,Clear
03/30/2025,23:00,40.705338,-73.78845,QUEENS,1.0,0.0,1,0,0,0,0,0,4802384,2025-03-30 23:00:00,2025-03-30T23:00,2025,3,8.4,0.1,Drizzle
04/19/2025,16:00,40.78959,-73.819534,QUEENS,3.0,0.0,0,0,0,0,3,0,4808687,2025-04-19 16:00:00,2025-04-19T16:00,2025,4,27.1,0.0,Cloudy
03/22/2025,19:00,40.72453,-73.80855,QUEENS,1.0,0.0,1,0,0,0,0,0,4800430,2025-03-22 19:00:00,2025-03-22T19:00,2025,3,9.9,0.0,Clear
03/20/2025,15:00,40.75496,-73.853836,QUEENS,0.0,0.0,0,0,0,0,0,0,4800580,2025-03-20 15:00:00,2025-03-20T15:00,2025,3,9.0,0.0,Cloudy
07/14/2025,14:00,40.67183,-73.7745,QUEENS,1.0,0.0,1,0,0,0,0,0,4828505,2025-07-14 14:00:00,2025-07-14T14:00,2025,7,27.0,0.2,Drizzle
05/03/2025,13:00,40.747215,-73.889175,QUEENS,1.0,0.0,0,0,0,0,0,0,4810094,2025-05-03 13:00:00,2025-05-03T13:00,2025,5,25.7,0.0,Cloudy
10/04/2025,15:00,40.727684,-73.87143,QUEENS,1.0,0.0,0,0,1,0,0,0,4849290,2025-10-04 15:00:00,2025-10-04T15:00,2025,10,27.7,0.0,Clear
06/01/2025,3:00,40.740814,-73.898895,QUEENS,1.0,0.0,0,0,0,0,1,0,4818706,2025-06-01 03:00:00,2025-06-01T03:00,2025,6,10.0,0.0,Clear
07/21/2025,17:00,40.687065,-73.81056,QUEENS,1.0,0.0,0,0,0,0,1,0,4829502,2025-07-21 17:00:00,2025-07-21T17:00,2025,7,27.3,0.4,Drizzle
10/08/2025,15:00,40.702324,-73.89141,QUEENS,1.0,0.0,0,0,1,0,0,0,4849300,2025-10-08 15:00:00,2025-10-08T15:00,2025,10,20.5,0.0,Clear
07/26/2025,0:00,40.69926,-73.85291,QUEENS,1.0,0.0,0,0,0,0,1,0,4830987,2025-07-26 00:00:00,2025-07-26T00:00,2025,7,27.5,0.0,Cloudy
06/26/2025,0:00,40.746063,-73.890495,QUEENS,0.0,0.0,0,0,0,0,0,0,4823359,2025-06-26 00:00:00,2025-06-26T00:00,2025,6,30.7,0.0,Cloudy
04/13/2025,20:00,40.71345,-73.85171,QUEENS,2.0,0.0,0,0,0,0,2,0,4805702,2025-04-13 20:00:00,2025-04-13T20:00,2025,4,10.6,0.0,Cloudy
08/18/2025,14:00,40.766888,-73.921394,QUEENS,1.0,0.0,1,0,0,0,0,0,4836006,2025-08-18 14:00:00,2025-08-18T14:00,2025,8,23.9,0.0,Cloudy
01/18/2025,0:00,40.66386,-73.82296,QUEENS,1.0,0.0,1,0,0,0,0,0,4793632,2025-01-18 00:00:00,2025-01-18T00:00,2025,1,1.2,0.0,Cloudy
09/07/2025,19:00,40.703312,-73.77394,QUEENS,1.0,0.0,0,0,0,0,0,0,4840555,2025-09-07 19:00:00,2025-09-07T19:00,2025,9,18.1,0.0,Cloudy
09/15/2025,7:00,40.71579,-73.872246,QUEENS,0.0,0.0,0,0,0,0,0,0,4842572,2025-09-15 07:00:00,2025-09-15T07:00,2025,9,19.2,0.0,Cloudy
07/10/2025,0:00,40.765232,-73.82003,QUEENS,1.0,0.0,0,0,0,0,1,0,4827390,2025-07-10 00:00:00,2025-07-10T00:00,2025,7,23.3,1.4,Light Rain
04/15/2025,17:00,40.727898,-73.80908,QUEENS,0.0,0.0,0,0,0,0,0,0,4806184,2025-04-15 17:00:00,2025-04-15T17:00,2025,4,15.3,0.0,Clear
10/21/2025,17:00,40.751713,-73.806114,QUEENS,1.0,0.0,1,0,0,0,0,0,4851548,2025-10-21 17:00:00,2025-10-21T17:00,2025,10,16.7,0.0,Clear
10/16/2025,23:00,40.666397,-73.83488,QUEENS,1.0,0.0,1,0,0,0,0,0,4851137,2025-10-16 23:00:00,2025-10-16T23:00,2025,10,9.4,0.0,Clear
07/17/2025,0:00,40.74712,-73.94238,QUEENS,1.0,0.0,0,0,0,0,1,0,4828602,2025-07-17 00:00:00,2025-07-17T00:00,2025,7,24.7,0.0,Cloudy
04/22/2025,5:00,40.66085,-73.840294,QUEENS,0.0,0.0,0,0,0,0,0,0,4807491,2025-04-22 05:00:00,2025-04-22T05:00,2025,4,11.4,0.0,Cloudy
03/21/2025,16:00,40.748993,-73.89687,QUEENS,1.0,0.0,0,0,0,0,1,0,4800833,2025-03-21 16:00:00,2025-03-21T16:00,2025,3,9.3,0.0,Clear
09/12/2025,0:00,40.746037,-73.9344,QUEENS,1.0,0.0,0,0,0,0,1,0,4841669,2025-09-12 00:00:00,2025-09-12T00:00,2025,9,18.6,0.0,Clear
10/04/2025,9:00,40.702057,-73.7526,QUEENS,1.0,0.0,0,0,0,0,1,0,4848218,2025-10-04 09:00:00,2025-10-04T09:00,2025,10,17.7,0.0,Clear
08/23/2025,0:00,40.71264,-73.73393,QUEENS,2.0,0.0,0,0,0,0,2,0,4836903,2025-08-23 00:00:00,2025-08-23T00:00,2025,8,20.8,0.0,Clear
01/13/2025,12:00,40.715347,-73.74844,QUEENS,1.0,0.0,0,0,0,0,1,0,4785584,2025-01-13 12:00:00,2025-01-13T12:00,2025,1,3.1,0.0,Clear
08/28/2025,9:00,40.726685,-73.82182,QUEENS,0.0,0.0,0,0,0,0,0,0,4838210,2025-08-28 09:00:00,2025-08-28T09:00,2025,8,22.0,0.0,Cloudy
04/10/2025,20:00,40.711178,-73.779854,QUEENS,2.0,0.0,0,0,0,0,2,0,4805035,2025-04-10 20:00:00,2025-04-10T20:00,2025,4,5.3,0.0,Cloudy
07/04/2025,17:00,40.668552,-73.80986,QUEENS,1.0,0.0,0,0,0,0,1,0,4825917,2025-07-04 17:00:00,2025-07-04T17:00,2025,7,27.7,0.0,Clear
08/27/2025,0:00,40.69665,-73.769295,QUEENS,1.0,0.0,0,0,0,0,1,0,4839316,2025-08-27 00:00:00,2025-08-27T00:00,2025,8,20.2,0.0,Clear
02/18/2025,15:00,40.757824,-73.861,QUEENS,1.0,0.0,0,0,0,0,0,0,4793495,2025-02-18 15:00:00,2025-02-18T15:00,2025,2,-3.2,0.0,Cloudy
01/17/2025,15:00,40.71417,-73.77688,QUEENS,1.0,0.0,1,0,0,0,0,0,4791582,2025-01-17 15:00:00,2025-01-17T15:00,2025,1,4.4,0.0,Cloudy
01/15/2025,11:00,40.704372,-73.832825,QUEENS,2.0,0.0,0,0,0,0,2,0,4786048,2025-01-15 11:00:00,2025-01-15T11:00,2025,1,-1.4,0.0,Cloudy
05/07/2025,9:00,40.691437,-73.890625,QUEENS,0.0,0.0,0,0,0,0,0,0,4811126,2025-05-07 09:00:00,2025-05-07T09:00,2025,5,17.6,0.0,Clear
07/08/2025,9:00,40.712006,-73.7581,QUEENS,1.0,0.0,0,0,0,0,1,0,4826795,2025-07-08 09:00:00,2025-07-08T09:00,2025,7,32.3,0.0,Clear
06/26/2025,15:00,40.737103,-73.78117,QUEENS,1.0,0.0,1,0,0,0,0,0,4823499,2025-06-26 15:00:00,2025-06-26T15:00,2025,6,26.9,0.0,Clear
07/11/2025,8:00,40.681145,-73.78119,QUEENS,1.0,0.0,0,0,0,0,1,0,4827646,2025-07-11 08:00:00,2025-07-11T08:00,2025,7,24.5,0.0,Cloudy
05/23/2025,23:00,40.719288,-73.80397,QUEENS,0.0,0.0,0,0,0,0,0,0,4815048,2025-05-23 23:00:00,2025-05-23T23:00,2025,5,10.8,0.0,Clear
09/26/2025,16:00,40.751064,-73.87224,QUEENS,1.0,0.0,1,0,0,0,0,0,4850869,2025-09-26 16:00:00,2025-09-26T16:00,2025,9,26.0,0.0,Clear
04/26/2025,17:00,40.742435,-73.8676,QUEENS,1.0,0.0,1,0,0,0,0,0,4809358,2025-04-26 17:00:00,2025-04-26T17:00,2025,4,20.8,0.1,Drizzle
01/20/2025,12:00,40.76164,-73.910194,QUEENS,1.0,0.0,0,0,0,0,1,0,4788242,2025-01-20 12:00:00,2025-01-20T12:00,2025,1,-5.5,0.0,Cloudy
05/06/2025,6:00,40.757183,-73.833954,QUEENS,0.0,0.0,0,0,0,0,0,0,4810916,2025-05-06 06:00:00,2025-05-06T06:00,2025,5,14.4,0.0,Cloudy
06/13/2025,16:00,40.717575,-73.8744,QUEENS,1.0,0.0,0,0,1,0,0,0,4820575,2025-06-13 16:00:00,2025-06-13T16:00,2025,6,26.5,0.0,Cloudy
07/18/2025,23:00,40.76551,-73.77088,QUEENS,1.0,0.0,0,0,0,0,1,0,4832058,2025-07-18 23:00:00,2025-07-18T23:00,2025,7,25.0,0.0,Clear
08/13/2025,19:00,40.69881,-73.88874,QUEENS,1.0,0.0,0,0,0,0,1,0,4834893,2025-08-13 19:00:00,2025-08-13T19:00,2025,8,25.5,0.8,Drizzle
10/09/2025,10:00,40.73186,-73.8146,QUEENS,1.0,0.0,1,0,0,0,0,0,4848607,2025-10-09 10:00:00,2025-10-09T10:00,2025,10,12.6,0.0,Clear
10/16/2025,9:00,40.757984,-73.77827,QUEENS,1.0,0.0,0,0,0,0,1,0,4850233,2025-10-16 09:00:00,2025-10-16T09:00,2025,10,9.7,0.0,Cloudy
10/13/2025,4:00,40.704967,-73.865105,QUEENS,0.0,0.0,0,0,0,0,0,0,4851718,2025-10-13 04:00:00,2025-10-13T04:00,2025,10,12.6,10.5,Heavy Rain
07/28/2025,9:00,40.730194,-73.77757,QUEENS,0.0,0.0,0,0,0,0,0,0,4831788,2025-07-28 09:00:00,2025-07-28T09:00,2025,7,30.5,0.0,Clear
02/26/2025,0:00,40.760532,-73.845535,QUEENS,3.0,0.0,0,0,0,0,3,0,4795273,2025-02-26 00:00:00,2025-02-26T00:00,2025,2,4.6,0.0,Clear
04/20/2025,19:00,40.76226,-73.75698,QUEENS,3.0,0.0,0,0,0,0,3,0,4806848,2025-04-20 19:00:00,2025-04-20T19:00,2025,4,15.4,0.0,Cloudy
01/30/2025,0:00,40.61365,-73.82059,QUEENS,1.0,0.0,0,0,0,0,1,0,4789874,2025-01-30 00:00:00,2025-01-30T00:00,2025,1,-0.6,0.0,Clear
06/05/2025,11:00,40.728657,-73.86326,QUEENS,0.0,0.0,0,0,0,0,0,0,4818271,2025-06-05 11:00:00,2025-06-05T11:00,2025,6,32.0,0.0,Cloudy
06/26/2025,20:00,40.700615,-73.901184,QUEENS,1.0,0.0,0,0,1,0,0,0,4823531,2025-06-26 20:00:00,2025-06-26T20:00,2025,6,20.4,0.0,Cloudy
04/25/2025,4:00,40.73699,-73.810486,QUEENS,0.0,0.0,0,0,0,0,0,0,4807921,2025-04-25 04:00:00,2025-04-25T04:00,2025,4,15.4,0.0,Cloudy
03/21/2025,18:00,40.746532,-73.86253,QUEENS,1.0,0.0,1,0,0,0,0,0,4806014,2025-03-21 18:00:00,2025-03-21T18:00,2025,3,7.4,0.0,Clear
08/30/2025,7:00,40.72753,-73.81934,QUEENS,1.0,0.0,0,0,0,0,1,0,4838476,2025-08-30 07:00:00,2025-08-30T07:00,2025,8,15.5,0.0,Clear
04/21/2025,2:00,40.74101,-73.90057,QUEENS,1.0,0.0,0,0,0,0,1,0,4807242,2025-04-21 02:00:00,2025-04-21T02:00,2025,4,8.1,0.0,Cloudy
01/28/2025,10:00,40.697052,-73.75733,QUEENS,0.0,0.0,0,0,0,0,0,0,4789888,2025-01-28 10:00:00,2025-01-28T10:00,2025,1,3.7,0.0,Clear
04/29/2025,23:00,40.756123,-73.93567,QUEENS,1.0,0.0,0,0,0,0,1,0,4809483,2025-04-29 23:00:00,2025-04-29T23:00,2025,4,21.9,0.0,Cloudy
08/20/2025,10:00,40.69635,-73.79666,QUEENS,1.0,0.0,1,0,0,0,0,0,4838280,2025-08-20 10:00:00,2025-08-20T10:00,2025,8,22.2,0.0,Cloudy
05/12/2025,20:00,40.753517,-73.88203,QUEENS,0.0,0.0,0,0,0,0,0,0,4812557,2025-05-12 20:00:00,2025-05-12T20:00,2025,5,15.6,0.0,Cloudy
10/10/2025,0:00,40.7858,-73.82191,QUEENS,2.0,0.0,0,0,0,0,2,0,4849890,2025-10-10 00:00:00,2025-10-10T00:00,2025,10,8.4,0.0,Clear
06/29/2025,2:00,40.74184,-73.881004,QUEENS,1.0,0.0,0,0,1,0,0,0,4824394,2025-06-29 02:00:00,2025-06-29T02:00,2025,6,24.2,0.0,Cloudy
10/24/2025,12:00,40.681988,-73.836975,QUEENS,1.0,0.0,0,0,0,0,1,0,4852746,2025-10-24 12:00:00,2025-10-24T12:00,2025,10,13.7,0.0,Clear
05/23/2025,10:00,40.759537,-73.82268,QUEENS,1.0,0.0,1,0,0,0,0,0,4815500,2025-05-23 10:00:00,2025-05-23T10:00,2025,5,12.8,0.1,Drizzle
10/22/2025,15:00,40.72313,-73.75808,QUEENS,0.0,0.0,0,0,0,0,0,0,4851808,2025-10-22 15:00:00,2025-10-22T15:00,2025,10,15.7,0.0,Cloudy
01/03/2025,14:00,40.746708,-73.83452,QUEENS,0.0,0.0,0,0,0,0,0,0,4783629,2025-01-03 14:00:00,2025-01-03T14:00,2025,1,3.0,0.0,Clear
05/22/2025,20:00,40.699013,-73.79572,QUEENS,2.0,0.0,0,0,0,0,2,0,4815269,2025-05-22 20:00:00,2025-05-22T20:00,2025,5,9.2,1.2,Drizzle
10/11/2025,21:00,40.71388,-73.75404,QUEENS,1.0,0.0,0,0,0,0,1,0,4849169,2025-10-11 21:00:00,2025-10-11T21:00,2025,10,15.7,0.0,Cloudy
07/19/2025,12:00,40.70832,-73.87217,QUEENS,1.0,0.0,1,0,0,0,0,0,4828936,2025-07-19 12:00:00,2025-07-19T12:00,2025,7,27.3,0.0,Cloudy
04/02/2025,0:00,40.74831,-73.70953,QUEENS,1.0,0.0,0,0,0,0,1,0,4803040,2025-04-02 00:00:00,2025-04-02T00:00,2025,4,3.2,0.0,Cloudy
06/12/2025,15:00,40.700512,-73.89917,QUEENS,1.0,0.0,1,0,0,0,0,0,4820008,2025-06-12 15:00:00,2025-06-12T15:00,2025,6,33.8,0.0,Cloudy
03/22/2025,6:00,40.760532,-73.8929,QUEENS,1.0,0.0,0,0,1,0,0,0,4800388,2025-03-22 06:00:00,2025-03-22T06:00,2025,3,2.7,0.0,Cloudy
03/22/2025,10:00,40.710285,-73.77281,QUEENS,0.0,0.0,0,0,0,0,0,0,4802392,2025-03-22 10:00:00,2025-03-22T10:00,2025,3,10.3,0.0,Cloudy
03/02/2025,17:00,40.752403,-73.924416,QUEENS,1.0,0.0,0,0,1,0,0,0,4795882,2025-03-02 17:00:00,2025-03-02T17:00,2025,3,-0.9,0.0,Clear
08/10/2025,5:00,40.75312,-73.868454,QUEENS,0.0,0.0,0,0,0,0,0,0,4834084,2025-08-10 05:00:00,2025-08-10T05:00,2025,8,18.4,0.0,Clear
05/03/2025,10:00,40.67655,-73.76837,QUEENS,1.0,0.0,1,0,0,0,0,0,4810281,2025-05-03 10:00:00,2025-05-03T10:00,2025,5,20.0,0.0,Cloudy
08/21/2025,0:00,40.727753,-73.858604,QUEENS,1.0,0.0,1,0,0,0,0,0,4837615,2025-08-21 00:00:00,2025-08-21T00:00,2025,8,16.2,0.1,Drizzle
01/04/2025,18:00,40.752098,-73.74141,QUEENS,0.0,0.0,0,0,0,0,0,0,4784143,2025-01-04 18:00:00,2025-01-04T18:00,2025,1,-1.8,0.0,Clear
04/06/2025,16:00,40.781986,-73.82986,QUEENS,1.0,0.0,0,0,1,0,0,0,4804000,2025-04-06 16:00:00,2025-04-06T16:00,2025,4,13.6,0.0,Cloudy
09/13/2025,14:00,40.75982,-73.913895,QUEENS,1.0,0.0,0,0,1,0,0,0,4842100,2025-09-13 14:00:00,2025-09-13T14:00,2025,9,24.6,0.2,Drizzle
01/15/2025,14:00,40.730125,-73.81074,QUEENS,1.0,0.0,1,0,0,0,0,0,4786014,2025-01-15 14:00:00,2025-01-15T14:00,2025,1,-1.3,0.0,Clear
02/21/2025,21:00,40.757088,-73.817894,QUEENS,1.0,0.0,0,0,0,0,1,0,4794838,2025-02-21 21:00:00,2025-02-21T21:00,2025,2,-3.9,0.0,Clear
03/12/2025,8:00,40.74133,-73.827995,QUEENS,1.0,0.0,0,0,0,0,1,0,4798517,2025-03-12 08:00:00,2025-03-12T08:00,2025,3,6.0,0.0,Cloudy
08/03/2025,4:00,40.692062,-73.82348,QUEENS,0.0,0.0,0,0,0,0,0,0,4832485,2025-08-03 04:00:00,2025-08-03T04:00,2025,8,18.4,0.0,Clear
01/09/2025,13:00,40.737705,-73.8823,QUEENS,1.0,0.0,0,0,0,0,1,0,4786500,2025-01-09 13:00:00,2025-01-09T13:00,2025,1,-1.5,0.0,Cloudy
02/06/2025,14:00,40.63855,-74.09079,STATEN ISLAND,1.0,0.0,1,0,0,0,0,0,4791627,2025-02-06 14:00:00,2025-02-06T14:00,2025,2,2.8,0.1,Drizzle
06/18/2025,14:00,40.566498,-74.11376,STATEN ISLAND,2.0,0.0,2,0,0,0,0,0,4822760,2025-06-18 14:00:00,2025-06-18T14:00,2025,6,23.9,0.0,Cloudy
08/04/2025,18:00,40.52257,-74.19,STATEN ISLAND,1.0,0.0,0,0,0,0,1,0,4832875,2025-08-04 18:00:00,2025-08-04T18:00,2025,8,27.8,0.0,Clear
06/29/2025,19:00,40.55646,-74.17739,STATEN ISLAND,0.0,0.0,0,0,0,0,0,0,4830020,2025-06-29 19:00:00,2025-06-29T19:00,2025,6,29.4,0.0,Cloudy
03/24/2025,15:00,40.581264,-74.11221,STATEN ISLAND,2.0,0.0,0,0,0,0,2,0,4801078,2025-03-24 15:00:00,2025-03-24T15:00,2025,3,10.5,1.6,Light Rain
10/08/2025,18:00,40.574104,-74.13094,STATEN ISLAND,1.0,0.0,0,0,0,0,1,0,4848533,2025-10-08 18:00:00,2025-10-08T18:00,2025,10,17.7,0.0,Clear
09/01/2025,11:00,40.524597,-74.18442,STATEN ISLAND,1.0,0.0,0,0,1,0,0,0,4839338,2025-09-01 11:00:00,2025-09-01T11:00,2025,9,24.8,0.0,Clear
06/25/2025,16:00,40.57104,-74.109184,STATEN ISLAND,1.0,0.0,0,0,0,0,1,0,4823559,2025-06-25 16:00:00,2025-06-25T16:00,2025,6,38.1,0.0,Clear
03/22/2025,14:00,40.62043,-74.07095,STATEN ISLAND,3.0,0.0,0,0,0,0,3,0,4800749,2025-03-22 14:00:00,2025-03-22T14:00,2025,3,14.8,0.0,Cloudy
07/29/2025,0:00,40.640877,-74.09528,STATEN ISLAND,1.0,0.0,0,0,0,0,1,0,4831224,2025-07-29 00:00:00,2025-07-29T00:00,2025,7,27.7,0.0,Cloudy
04/20/2025,20:00,40.572502,-74.11357,STATEN ISLAND,1.0,0.0,0,0,1,0,0,0,4807215,2025-04-20 20:00:00,2025-04-20T20:00,2025,4,16.1,0.0,Cloudy
04/21/2025,0:00,40.57863,-74.115425,STATEN ISLAND,0.0,0.0,0,0,0,0,0,0,4807574,2025-04-21 00:00:00,2025-04-21T00:00,2025,4,11.7,0.0,Cloudy
01/08/2025,13:00,40.566498,-74.11376,STATEN ISLAND,1.0,0.0,0,0,0,0,1,0,4784534,2025-01-08 13:00:00,2025-01-08T13:00,2025,1,-2.3,0.0,Cloudy
08/08/2025,16:00,40.61619,-74.103676,STATEN ISLAND,0.0,0.0,0,0,0,0,0,0,4834031,2025-08-08 16:00:00,2025-08-08T16:00,2025,8,24.9,0.0,Clear
09/15/2025,14:00,40.604786,-74.084465,STATEN ISLAND,1.0,0.0,1,0,0,0,0,0,4842693,2025-09-15 14:00:00,2025-09-15T14:00,2025,9,24.9,0.3,Drizzle
09/10/2025,17:00,40.644115,-74.09577,STATEN ISLAND,1.0,0.0,0,0,0,0,1,0,4842186,2025-09-10 17:00:00,2025-09-10T17:00,2025,9,20.7,0.0,Clear
04/08/2025,19:00,40.6094,-74.11656,STATEN ISLAND,2.0,0.0,0,0,0,0,2,0,4804971,2025-04-08 19:00:00,2025-04-08T19:00,2025,4,2.6,0.0,Clear
03/21/2025,18:00,40.559715,-74.16792,STATEN ISLAND,0.0,0.0,0,0,0,0,0,0,4801075,2025-03-21 18:00:00,2025-03-21T18:00,2025,3,8.1,0.0,Clear
05/13/2025,11:00,40.58847,-74.090385,STATEN ISLAND,0.0,0.0,0,0,0,0,0,0,4812495,2025-05-13 11:00:00,2025-05-13T11:00,2025,5,19.6,0.2,Drizzle
01/03/2025,23:00,40.62069,-74.110016,STATEN ISLAND,2.0,0.0,0,0,0,0,2,0,4784963,2025-01-03 23:00:00,2025-01-03T23:00,2025,1,-1.5,0.0,Clear
05/25/2025,14:00,40.595966,-74.08715,STATEN ISLAND,0.0,0.0,0,0,0,0,0,0,4815836,2025-05-25 14:00:00,2025-05-25T14:00,2025,5,19.0,0.0,Cloudy
01/22/2025,16:00,40.554893,-74.139,STATEN ISLAND,1.0,0.0,0,0,0,0,1,0,4787803,2025-01-22 16:00:00,2025-01-22T16:00,2025,1,-8.6,0.0,Clear
04/30/2025,14:00,40.615967,-74.10456,STATEN ISLAND,1.0,0.0,1,0,0,0,0,0,4809631,2025-04-30 14:00:00,2025-04-30T14:00,2025,4,23.1,0.0,Cloudy
04/30/2025,8:00,40.576504,-74.10369,STATEN ISLAND,1.0,0.0,1,0,0,0,0,0,4809431,2025-04-30 08:00:00,2025-04-30T08:00,2025,4,22.0,0.0,Cloudy
02/07/2025,20:00,40.637413,-74.08019,STATEN ISLAND,1.0,0.0,1,0,0,0,0,0,4791628,2025-02-07 20:00:00,2025-02-07T20:00,2025,2,-1.0,0.0,Cloudy
06/16/2025,10:00,40.598934,-74.06376,STATEN ISLAND,1.0,0.0,0,0,0,0,1,0,4821122,2025-06-16 10:00:00,2025-06-16T10:00,2025,6,17.9,0.1,Drizzle
03/13/2025,13:00,40.583046,-74.09617,STATEN ISLAND,1.0,0.0,0,0,0,0,1,0,4798611,2025-03-13 13:00:00,2025-03-13T13:00,2025,3,8.3,0.0,Cloudy
06/03/2025,19:00,40.602005,-74.091225,STATEN ISLAND,1.0,0.0,1,0,0,0,0,0,4818055,2025-06-03 19:00:00,2025-06-03T19:00,2025,6,20.2,0.0,Clear
01/14/2025,7:00,40.56878,-74.106606,STATEN ISLAND,1.0,0.0,1,0,0,0,0,0,4785975,2025-01-14 07:00:00,2025-01-14T07:00,2025,1,-3.4,0.0,Clear
03/20/2025,16:00,40.58077,-74.11307,STATEN ISLAND,1.0,0.0,0,0,0,0,1,0,4800614,2025-03-20 16:00:00,2025-03-20T16:00,2025,3,8.2,0.0,Cloudy
05/12/2025,16:00,40.606133,-74.11568,STATEN ISLAND,1.0,0.0,0,0,0,0,1,0,4812430,2025-05-12 16:00:00,2025-05-12T16:00,2025,5,18.0,0.0,Cloudy
09/15/2025,0:00,40.609474,-74.086525,STATEN ISLAND,1.0,0.0,0,0,0,0,1,0,4848010,2025-09-15 00:00:00,2025-09-15T00:00,2025,9,19.2,0.0,Cloudy
10/07/2025,21:00,40.62069,-74.110016,STATEN ISLAND,1.0,0.0,1,0,0,0,0,0,4848556,2025-10-07 21:00:00,2025-10-07T21:00,2025,10,21.4,0.0,Cloudy
09/08/2025,8:00,40.630806,-74.10368,STATEN ISLAND,9.0,0.0,0,0,0,0,9,0,4841268,2025-09-08 08:00:00,2025-09-08T08:00,2025,9,15.7,0.0,Clear
02/14/2025,17:00,40.57322,-74.106995,STATEN ISLAND,1.0,0.0,1,0,0,0,0,0,4792661,2025-02-14 17:00:00,2025-02-14T17:00,2025,2,-0.6,0.0,Cloudy
02/26/2025,16:00,40.615208,-74.08465,STATEN ISLAND,0.0,0.0,0,0,0,0,0,0,4795114,2025-02-26 16:00:00,2025-02-26T16:00,2025,2,13.4,0.0,Cloudy
10/23/2025,21:00,40.589066,-74.13862,STATEN ISLAND,1.0,0.0,0,0,0,0,1,0,4852174,2025-10-23 21:00:00,2025-10-23T21:00,2025,10,11.2,0.0,Clear
08/31/2025,0:00,40.507755,-74.230064,STATEN ISLAND,1.0,0.0,0,0,0,0,0,0,4839336,2025-08-31 00:00:00,2025-08-31T00:00,2025,8,18.4,0.0,Clear
05/08/2025,18:00,40.570465,-74.109764,STATEN ISLAND,3.0,0.0,0,0,0,0,3,0,4811599,2025-05-08 18:00:00,2025-05-08T18:00,2025,5,19.4,0.1,Drizzle
01/05/2025,13:00,40.592083,-74.06795,STATEN ISLAND,1.0,0.0,1,0,0,0,0,0,4784180,2025-01-05 13:00:00,2025-01-05T13:00,2025,1,-0.0,0.0,Cloudy
10/07/2025,9:00,40.526894,-74.167274,STATEN ISLAND,1.0,0.0,1,0,0,0,0,0,4848080,2025-10-07 09:00:00,2025-10-07T09:00,2025,10,21.8,0.0,Clear
08/19/2025,16:00,40.565403,-74.1834,STATEN ISLAND,1.0,0.0,0,0,0,0,1,0,4836226,2025-08-19 16:00:00,2025-08-19T16:00,2025,8,21.9,0.0,Cloudy
10/01/2025,0:00,40.633858,-74.12595,STATEN ISLAND,0.0,0.0,0,0,0,0,0,0,4846780,2025-10-01 00:00:00,2025-10-01T00:00,2025,10,18.3,0.0,Clear
08/28/2025,11:00,40.53171,-74.20289,STATEN ISLAND,2.0,0.0,0,0,0,0,2,0,4838336,2025-08-28 11:00:00,2025-08-28T11:00,2025,8,24.9,0.0,Clear
05/11/2025,0:00,40.566776,-74.152954,STATEN ISLAND,3.0,0.0,0,0,0,0,3,0,4812413,2025-05-11 00:00:00,2025-05-11T00:00,2025,5,14.2,0.0,Clear
02/05/2025,8:00,40.57185,-74.145805,STATEN ISLAND,0.0,0.0,0,0,0,0,0,0,4790799,2025-02-05 08:00:00,2025-02-05T08:00,2025,2,-2.3,0.0,Cloudy
10/21/2025,23:00,40.57925,-74.077805,STATEN ISLAND,1.0,0.0,0,0,0,0,1,0,4851966,2025-10-21 23:00:00,2025-10-21T23:00,2025,10,15.0,1.2,Drizzle
06/09/2025,8:00,40.63691,-74.0876,STATEN ISLAND,0.0,0.0,0,0,0,0,0,0,4819131,2025-06-09 08:00:00,2025-06-09T08:00,2025,6,16.9,0.1,Drizzle
07/07/2025,20:00,40.64681,-74.08707,STATEN ISLAND,0.0,0.0,0,0,0,0,0,0,4826564,2025-07-07 20:00:00,2025-07-07T20:00,2025,7,26.1,0.4,Drizzle
04/14/2025,18:00,40.536556,-74.19462,STATEN ISLAND,1.0,0.0,0,0,0,0,1,0,4806024,2025-04-14 18:00:00,2025-04-14T18:00,2025,4,13.2,0.0,Cloudy
02/26/2025,9:00,40.55871,-74.17438,STATEN ISLAND,2.0,0.0,0,0,0,0,2,0,4795164,2025-02-26 09:00:00,2025-02-26T09:00,2025,2,6.8,0.0,Clear
