CRASH DATE,CRASH TIME,LATITUDE,LONGITUDE,BOROUGH,NUMBER OF PERSONS INJURED,NUMBER OF PERSONS KILLED,NUMBER OF PEDESTRIANS INJURED,NUMBER OF PEDESTRIANS KILLED,NUMBER OF CYCLIST INJURED,NUMBER OF CYCLIST KILLED,NUMBER OF MOTORIST INJURED,NUMBER OF MOTORIST KILLED,COLLISION_ID,datetime,iso_datetime,year,month,temperature,precipitation,weather_condition
06/06/2017,16:00,40.911095,-73.8983,BRONX,1.0,0.0,0,0,0,0,1,0,3686302,2017-06-06 16:00:00,2017-06-06T16:00,2017,6,13.4,0.0,Cloudy
05/19/2017,12:00,40.80437,-73.91326,BRONX,1.0,0.0,1,0,0,0,0,0,3675357,2017-05-19 12:00:00,2017-05-19T12:00,2017,5,29.1,0.0,Cloudy
11/07/2017,8:00,40.81218,-73.9011,BRONX,1.0,0.0,0,0,0,0,1,0,3785025,2017-11-07 08:00:00,2017-11-07T08:00,2017,11,6.8,0.0,Clear
04/13/2017,20:00,40.84518,-73.91417,BRONX,1.0,0.0,0,0,0,0,1,0,3652761,2017-04-13 20:00:00,2017-04-13T20:00,2017,4,11.7,0.0,Cloudy
08/10/2017,10:00,40.86564,-73.88323,BRONX,1.0,0.0,1,0,0,0,0,0,3731805,2017-08-10 10:00:00,2017-08-10T10:00,2017,8,26.4,0.0,Cloudy
11/07/2017,22:00,40.82577,-73.88878,BRONX,2.0,0.0,0,0,0,0,2,0,3788151,2017-11-07 22:00:00,2017-11-07T22:00,2017,11,4.6,1.9,Light Rain
08/04/2017,14:00,40.85502,-73.869644,BRONX,1.0,0.0,0,0,0,0,1,0,3724908,2017-08-04 14:00:00,2017-08-04T14:00,2017,8,26.7,0.0,Clear
03/01/2017,10:00,40.862732,-73.90333,BRONX,1.0,0.0,1,0,0,0,0,0,3623911,2017-03-01 10:00:00,2017-03-01T10:00,2017,3,13.4,0.1,Drizzle
11/15/2017,8:00,40.822815,-73.895485,BRONX,1.0,0.0,0,0,0,0,1,0,3790510,2017-11-15 08:00:00,2017-11-15T08:00,2017,11,3.2,0.0,Clear
10/18/2017,11:00,40.816418,-73.882195,BRONX,0.0,0.0,0,0,0,0,0,0,3771670,2017-10-18 11:00:00,2017-10-18T11:00,2017,10,18.0,0.0,Clear
05/28/2017,17:00,40.83329,-73.87154,BRONX,0.0,0.0,0,0,0,0,0,0,3679980,2017-05-28 17:00:00,2017-05-28T17:00,2017,5,18.0,0.0,Cloudy
11/06/2017,0:00,40.82916,-73.844086,BRONX,2.0,0.0,0,0,0,0,2,0,3785123,2017-11-06 00:00:00,2017-11-06T00:00,2017,11,15.0,0.0,Cloudy
05/20/2017,16:00,40.87449,-73.901505,BRONX,1.0,0.0,1,0,0,0,0,0,3674923,2017-05-20 16:00:00,2017-05-20T16:00,2017,5,15.4,0.0,Cloudy
02/06/2017,8:00,40.864464,-73.8245,BRONX,1.0,0.0,1,0,0,0,0,0,3615803,2017-02-06 08:00:00,2017-02-06T08:00,2017,2,1.1,0.0,Clear
04/22/2017,18:00,40.8595,-73.84301,BRONX,4.0,0.0,0,0,0,0,4,0,3655370,2017-04-22 18:00:00,2017-04-22T18:00,2017,4,11.5,0.1,Drizzle
05/26/2017,12:00,40.830345,-73.92328,BRONX,1.0,0.0,0,0,0,0,1,0,3680070,2017-05-26 12:00:00,2017-05-26T12:00,2017,5,20.8,0.1,Drizzle
08/26/2017,20:00,40.850224,-73.88257,BRONX,1.0,0.0,0,0,0,0,1,0,3737850,2017-08-26 20:00:00,2017-08-26T20:00,2017,8,18.1,0.0,Clear
11/27/2017,18:00,40.806828,-73.88448,BRONX,1.0,0.0,0,0,0,0,1,0,3798369,2017-11-27 18:00:00,2017-11-27T18:00,2017,11,4.4,0.0,Cloudy
09/27/2017,18:00,40.812454,-73.903046,BRONX,0.0,0.0,0,0,0,0,0,0,3759406,2017-09-27 18:00:00,2017-09-27T18:00,2017,9,24.3,0.0,Clear
06/23/2017,20:00,40.87314,-73.90572,BRONX,1.0,0.0,0,0,0,0,1,0,3698502,2017-06-23 20:00:00,2017-06-23T20:00,2017,6,24.7,0.9,Drizzle
07/21/2017,7:00,40.81593,-73.8917,BRONX,1.0,0.0,0,0,0,0,1,0,3716902,2017-07-21 07:00:00,2017-07-21T07:00,2017,7,26.0,0.0,Clear
09/03/2017,13:00,40.844486,-73.846245,BRONX,1.0,0.0,0,0,0,0,1,0,3744144,2017-09-03 13:00:00,2017-09-03T13:00,2017,9,16.8,0.0,Cloudy
12/15/2017,17:00,40.86536,-73.87043,BRONX,1.0,0.0,0,0,0,0,1,0,3811229,2017-12-15 17:00:00,2017-12-15T17:00,2017,12,-3.5,0.5,Heavy Snow
03/20/2017,0:00,40.825314,-73.90822,BRONX,1.0,0.0,1,0,0,0,0,0,3635991,2017-03-20 00:00:00,2017-03-20T00:00,2017,3,-2.0,0.0,Clear
08/03/2017,8:00,40.855675,-73.85549,BRONX,1.0,0.0,0,0,0,0,1,0,3723779,2017-08-03 08:00:00,2017-08-03T08:00,2017,8,22.2,0.0,Cloudy
10/09/2017,0:00,40.895374,-73.86356,BRONX,0.0,0.0,0,0,0,0,0,0,3766421,2017-10-09 00:00:00,2017-10-09T00:00,2017,10,22.4,0.7,Drizzle
04/11/2017,10:00,40.803593,-73.919785,BRONX,1.0,0.0,0,0,0,0,1,0,3649607,2017-04-11 10:00:00,2017-04-11T10:00,2017,4,20.7,0.0,Cloudy
05/25/2017,9:00,40.86006,-73.891136,BRONX,1.0,0.0,1,0,0,0,0,0,3679454,2017-05-25 09:00:00,2017-05-25T09:00,2017,5,13.1,1.4,Light Rain
01/22/2017,21:00,40.831375,-73.8999,BRONX,2.0,0.0,0,0,0,0,2,0,3602732,2017-01-22 21:00:00,2017-01-22T21:00,2017,1,7.2,0.0,Cloudy
04/26/2017,8:00,40.826694,-73.90765,BRONX,0.0,0.0,0,0,0,0,0,0,3657909,2017-04-26 08:00:00,2017-04-26T08:00,2017,4,12.5,0.7,Drizzle
09/15/2017,20:00,40.897625,-73.85625,BRONX,1.0,0.0,1,0,0,0,0,0,3753105,2017-09-15 20:00:00,2017-09-15T20:00,2017,9,21.5,0.2,Drizzle
06/08/2017,19:00,40.816532,-73.92822,BRONX,0.0,0.0,0,0,0,0,0,0,3687018,2017-06-08 19:00:00,2017-06-08T19:00,2017,6,16.3,0.0,Cloudy
08/17/2017,18:00,40.84073,-73.84052,BRONX,1.0,0.0,0,0,1,0,0,0,3736867,2017-08-17 18:00:00,2017-08-17T18:00,2017,8,23.2,0.0,Cloudy
05/18/2017,15:00,40.87942,-73.89712,BRONX,0.0,0.0,0,0,0,0,0,0,3674479,2017-05-18 15:00:00,2017-05-18T15:00,2017,5,29.8,0.4,Drizzle
12/16/2017,14:00,40.84758,-73.923195,BRONX,1.0,0.0,1,0,0,0,0,0,3811439,2017-12-16 14:00:00,2017-12-16T14:00,2017,12,4.6,0.0,Clear
10/19/2017,13:00,40.883682,-73.82965,BRONX,0.0,0.0,0,0,0,0,0,0,3773332,2017-10-19 13:00:00,2017-10-19T13:00,2017,10,20.5,0.0,Clear
03/16/2017,18:00,40.847145,-73.854454,BRONX,0.0,0.0,0,0,0,0,0,0,3633749,2017-03-16 18:00:00,2017-03-16T18:00,2017,3,-2.0,0.0,Clear
10/21/2017,17:00,40.87411,-73.85547,BRONX,0.0,0.0,0,0,0,0,0,0,3776456,2017-10-21 17:00:00,2017-10-21T17:00,2017,10,17.5,0.0,Cloudy
11/09/2017,15:00,40.813175,-73.89845,BRONX,1.0,0.0,0,0,0,0,1,0,3787481,2017-11-09 15:00:00,2017-11-09T15:00,2017,11,10.9,0.0,Cloudy
02/24/2017,23:00,40.879948,-73.874954,BRONX,1.0,0.0,0,0,0,0,1,0,3621601,2017-02-24 23:00:00,2017-02-24T23:00,2017,2,11.9,0.0,Cloudy
01/24/2017,17:00,40.84744,-73.89968,BRONX,0.0,0.0,0,0,0,0,0,0,3603939,2017-01-24 17:00:00,2017-01-24T17:00,2017,1,2.2,1.5,Light Rain
03/19/2017,4:00,40.88217,-73.898285,BRONX,0.0,0.0,0,0,0,0,0,0,3634551,2017-03-19 04:00:00,2017-03-19T04:00,2017,3,-0.4,0.0,Cloudy
08/01/2017,18:00,40.85061,-73.863045,BRONX,2.0,0.0,0,0,0,0,2,0,3723805,2017-08-01 18:00:00,2017-08-01T18:00,2017,8,27.0,0.0,Clear
07/19/2017,17:00,40.84664,-73.90469,BRONX,0.0,0.0,0,0,0,0,0,0,3714885,2017-07-19 17:00:00,2017-07-19T17:00,2017,7,29.0,0.0,Clear
06/13/2017,14:00,40.804695,-73.92239,BRONX,1.0,0.0,0,0,0,0,1,0,3691799,2017-06-13 14:00:00,2017-06-13T14:00,2017,6,33.9,0.0,Clear
10/26/2017,19:00,40.834595,-73.861015,BRONX,0.0,0.0,0,0,0,0,0,0,3777673,2017-10-26 19:00:00,2017-10-26T19:00,2017,10,11.7,0.0,Clear
11/29/2017,16:00,40.826763,-73.88842,BRONX,1.0,0.0,0,0,1,0,0,0,3803062,2017-11-29 16:00:00,2017-11-29T16:00,2017,11,11.4,0.0,Clear
06/03/2017,14:00,40.834007,-73.82692,BRONX,0.0,0.0,0,0,0,0,0,0,3684031,2017-06-03 14:00:00,2017-06-03T14:00,2017,6,20.8,0.0,Cloudy
10/27/2017,8:00,40.828125,-73.84105,BRONX,2.0,0.0,0,0,0,0,2,0,3779494,2017-10-27 08:00:00,2017-10-27T08:00,2017,10,9.7,0.0,Clear
06/19/2017,15:00,40.812477,-73.899994,BRONX,1.0,0.0,1,0,0,0,0,0,3694647,2017-06-19 15:00:00,2017-06-19T15:00,2017,6,25.2,0.0,Cloudy
11/15/2017,0:00,40.836178,-73.884254,BRONX,2.0,0.0,2,0,0,0,0,0,3808741,2017-11-15 00:00:00,2017-11-15T00:00,2017,11,2.9,0.0,Clear
01/23/2017,0:00,40.873657,-73.89838,BRONX,1.0,0.0,0,0,0,0,1,0,3603188,2017-01-23 00:00:00,2017-01-23T00:00,2017,1,5.4,0.0,Cloudy
12/07/2017,15:00,40.852955,-73.84316,BRONX,1.0,0.0,0,0,0,0,1,0,3805682,2017-12-07 15:00:00,2017-12-07T15:00,2017,12,5.7,0.0,Clear
11/28/2017,18:00,40.85461,-73.89181,BRONX,2.0,0.0,2,0,0,0,0,0,3799404,2017-11-28 18:00:00,2017-11-28T18:00,2017,11,9.3,0.0,Clear
03/09/2017,9:00,40.869694,-73.86723,BRONX,1.0,0.0,1,0,0,0,0,0,3629027,2017-03-09 09:00:00,2017-03-09T09:00,2017,3,11.7,0.0,Clear
04/10/2017,8:00,40.85059,-73.8869,BRONX,1.0,0.0,0,0,1,0,0,0,3648558,2017-04-10 08:00:00,2017-04-10T08:00,2017,4,12.2,0.0,Cloudy
05/26/2017,23:00,40.82102,-73.88725,BRONX,1.0,0.0,0,0,0,0,1,0,3679188,2017-05-26 23:00:00,2017-05-26T23:00,2017,5,15.9,0.0,Clear
04/07/2017,14:00,40.82945,-73.90446,BRONX,0.0,0.0,0,0,0,0,0,0,3647273,2017-04-07 14:00:00,2017-04-07T14:00,2017,4,9.5,0.1,Drizzle
03/19/2017,14:00,40.83256,-73.86943,BRONX,0.0,0.0,0,0,0,0,0,0,3635287,2017-03-19 14:00:00,2017-03-19T14:00,2017,3,5.6,0.0,Clear
05/08/2017,19:00,40.84177,-73.92549,BRONX,0.0,0.0,0,0,0,0,0,0,3666130,2017-05-08 19:00:00,2017-05-08T19:00,2017,5,10.3,0.0,Cloudy
02/18/2017,15:00,40.86879,-73.83168,BRONX,1.0,0.0,0,0,0,0,1,0,3618157,2017-02-18 15:00:00,2017-02-18T15:00,2017,2,14.7,0.0,Cloudy
12/31/2017,15:00,40.88302,-73.85325,BRONX,1.0,0.0,1,0,0,0,0,0,3822378,2017-12-31 15:00:00,2017-12-31T15:00,2017,12,-9.0,0.0,Cloudy
04/24/2017,13:00,40.86272,-73.89233,BRONX,0.0,0.0,0,0,0,0,0,0,3658063,2017-04-24 13:00:00,2017-04-24T13:00,2017,4,14.6,0.0,Cloudy
02/27/2017,20:00,40.88004,-73.87408,BRONX,4.0,0.0,0,0,0,0,4,0,3625356,2017-02-27 20:00:00,2017-02-27T20:00,2017,2,5.8,0.0,Clear
09/07/2017,0:00,40.864117,-73.90106,BRONX,1.0,0.0,0,0,0,0,1,0,3749150,2017-09-07 00:00:00,2017-09-07T00:00,2017,9,16.9,0.8,Drizzle
09/27/2017,13:00,40.819016,-73.84804,BRONX,0.0,0.0,0,0,0,0,0,0,3758964,2017-09-27 13:00:00,2017-09-27T13:00,2017,9,28.3,0.0,Cloudy
03/03/2017,21:00,40.896683,-73.862854,BRONX,2.0,0.0,0,0,0,0,2,0,3627747,2017-03-03 21:00:00,2017-03-03T21:00,2017,3,-3.0,0.0,Clear
04/24/2017,18:00,40.862404,-73.89799,BRONX,1.0,0.0,0,0,0,0,1,0,3656560,2017-04-24 18:00:00,2017-04-24T18:00,2017,4,11.8,0.0,Cloudy
02/25/2017,20:00,40.901836,-73.84548,BRONX,0.0,0.0,0,0,0,0,0,0,3622737,2017-02-25 20:00:00,2017-02-25T20:00,2017,2,9.2,4.2,Heavy Rain
08/04/2017,0:00,40.83677,-73.88597,BRONX,2.0,0.0,2,0,0,0,0,0,3725174,2017-08-04 00:00:00,2017-08-04T00:00,2017,8,22.1,0.0,Clear
07/13/2017,9:00,40.827656,-73.8861,BRONX,1.0,0.0,0,0,1,0,0,0,3711806,2017-07-13 09:00:00,2017-07-13T09:00,2017,7,29.6,0.0,Cloudy
04/09/2017,16:00,40.819332,-73.902275,BRONX,1.0,0.0,1,0,0,0,0,0,3648417,2017-04-09 16:00:00,2017-04-09T16:00,2017,4,13.7,0.0,Cloudy
12/21/2017,10:00,40.81616,-73.8944,BRONX,2.0,0.0,0,0,0,0,2,0,3813990,2017-12-21 10:00:00,2017-12-21T10:00,2017,12,1.7,0.0,Clear
09/13/2017,14:00,40.876617,-73.83926,BRONX,1.0,0.0,0,0,0,0,1,0,3751620,2017-09-13 14:00:00,2017-09-13T14:00,2017,9,26.1,0.0,Cloudy
06/23/2017,18:00,40.877636,-73.867424,BRONX,0.0,0.0,0,0,0,0,0,0,3698312,2017-06-23 18:00:00,2017-06-23T18:00,2017,6,27.1,0.0,Cloudy
09/06/2017,19:00,40.870224,-73.88717,BRONX,1.0,0.0,0,0,0,0,1,0,3744480,2017-09-06 19:00:00,2017-09-06T19:00,2017,9,17.2,0.3,Drizzle
12/27/2017,19:00,40.868668,-73.822495,BRONX,1.0,0.0,0,0,0,0,1,0,3818765,2017-12-27 19:00:00,2017-12-27T19:00,2017,12,-6.7,0.0,Clear
07/30/2017,19:00,40.836475,-73.88512,BRONX,1.0,0.0,1,0,0,0,0,0,3721325,2017-07-30 19:00:00,2017-07-30T19:00,2017,7,21.1,0.0,Clear
03/11/2017,23:00,40.901226,-73.89686,BRONX,0.0,0.0,0,0,0,0,0,0,3630234,2017-03-11 23:00:00,2017-03-11T23:00,2017,3,-6.2,0.0,Clear
07/12/2017,16:00,40.905735,-73.849396,BRONX,1.0,0.0,0,0,0,0,1,0,3711943,2017-07-12 16:00:00,2017-07-12T16:00,2017,7,29.3,0.0,Cloudy
05/12/2017,23:00,40.858196,-73.907906,BRONX,7.0,0.0,0,0,0,0,7,0,3669259,2017-05-12 23:00:00,2017-05-12T23:00,2017,5,9.7,0.0,Cloudy
11/23/2017,0:00,40.846546,-73.895584,BRONX,2.0,0.0,0,0,0,0,2,0,3796218,2017-11-23 00:00:00,2017-11-23T00:00,2017,11,1.2,0.0,Clear
10/30/2017,8:00,40.843765,-73.8656,BRONX,0.0,0.0,0,0,0,0,0,0,3780313,2017-10-30 08:00:00,2017-10-30T08:00,2017,10,8.8,0.7,Drizzle
04/21/2017,11:00,40.877632,-73.867386,BRONX,1.0,0.0,0,0,0,0,1,0,3655702,2017-04-21 11:00:00,2017-04-21T11:00,2017,4,10.2,0.0,Cloudy
12/10/2017,0:00,40.85935,-73.90117,BRONX,1.0,0.0,1,0,0,0,0,0,3806116,2017-12-10 00:00:00,2017-12-10T00:00,2017,12,-0.7,0.1,Light Snow
04/16/2017,16:00,40.87196,-73.836876,BRONX,1.0,0.0,1,0,0,0,0,0,3651503,2017-04-16 16:00:00,2017-04-16T16:00,2017,4,26.3,0.0,Cloudy
11/25/2017,6:00,40.877525,-73.86443,BRONX,0.0,0.0,0,0,0,0,0,0,3797232,2017-11-25 06:00:00,2017-11-25T06:00,2017,11,1.9,0.0,Clear
06/10/2017,4:00,40.847004,-73.83229,BRONX,1.0,0.0,1,0,0,0,0,0,3691437,2017-06-10 04:00:00,2017-06-10T04:00,2017,6,14.1,0.0,Cloudy
09/07/2017,16:00,40.828606,-73.89127,BRONX,1.0,0.0,1,0,0,0,0,0,3747598,2017-09-07 16:00:00,2017-09-07T16:00,2017,9,21.0,0.0,Clear
04/04/2017,10:00,40.904243,-73.852165,BRONX,1.0,0.0,0,0,0,0,1,0,3644983,2017-04-04 10:00:00,2017-04-04T10:00,2017,4,9.5,0.0,Cloudy
04/11/2017,18:00,40.8305,-73.861626,BRONX,1.0,0.0,1,0,0,0,0,0,3651878,2017-04-11 18:00:00,2017-04-11T18:00,2017,4,14.8,0.0,Cloudy
02/19/2017,11:00,40.87924,-73.846565,BRONX,1.0,0.0,1,0,0,0,0,0,3623336,2017-02-19 11:00:00,2017-02-19T11:00,2017,2,15.2,0.0,Cloudy
09/04/2017,22:00,40.85225,-73.89928,BRONX,1.0,0.0,1,0,0,0,0,0,3743596,2017-09-04 22:00:00,2017-09-04T22:00,2017,9,19.7,0.0,Clear
07/27/2017,0:00,40.88592,-73.848175,BRONX,1.0,0.0,1,0,0,0,0,0,3722102,2017-07-27 00:00:00,2017-07-27T00:00,2017,7,17.7,0.0,Cloudy
01/13/2017,15:00,40.847324,-73.85983,BRONX,1.0,0.0,1,0,0,0,0,0,3599784,2017-01-13 15:00:00,2017-01-13T15:00,2017,1,5.0,0.0,Clear
06/29/2017,19:00,40.84786,-73.86489,BRONX,1.0,0.0,0,0,0,0,1,0,3703049,2017-06-29 19:00:00,2017-06-29T19:00,2017,6,22.9,0.0,Cloudy
07/18/2017,13:00,40.884842,-73.91348,BRONX,1.0,0.0,0,0,0,0,1,0,3714968,2017-07-18 13:00:00,2017-07-18T13:00,2017,7,27.6,0.3,Drizzle
08/26/2017,11:00,40.820305,-73.89083,BRONX,0.0,0.0,0,0,0,0,0,0,3738185,2017-08-26 11:00:00,2017-08-26T11:00,2017,8,22.0,0.0,Clear
10/27/2017,23:00,40.87869,-73.898575,BRONX,1.0,0.0,1,0,0,0,0,0,3788454,2017-10-27 23:00:00,2017-10-27T23:00,2017,10,11.1,0.0,Clear
10/13/2017,17:00,40.842697,-73.82519,BRONX,1.0,0.0,0,0,0,0,1,0,3769938,2017-10-13 17:00:00,2017-10-13T17:00,2017,10,17.1,0.0,Cloudy
07/17/2017,12:00,40.812954,-73.91372,BRONX,1.0,0.0,0,0,1,0,0,0,3713388,2017-07-17 12:00:00,2017-07-17T12:00,2017,7,28.0,0.0,Cloudy
10/23/2017,0:00,40.8418,-73.85322,BRONX,1.0,0.0,0,0,0,0,1,0,3776259,2017-10-23 00:00:00,2017-10-23T00:00,2017,10,14.4,0.0,Clear
05/19/2017,23:00,40.881634,-73.854126,BRONX,2.0,0.0,0,0,0,0,2,0,3673752,2017-05-19 23:00:00,2017-05-19T23:00,2017,5,17.1,0.0,Cloudy
10/22/2017,7:00,40.8398,-73.928665,BRONX,1.0,0.0,0,0,0,0,1,0,3774333,2017-10-22 07:00:00,2017-10-22T07:00,2017,10,12.9,0.0,Cloudy
07/14/2017,11:00,40.835396,-73.92031,BRONX,1.0,0.0,0,0,0,0,1,0,3711738,2017-07-14 11:00:00,2017-07-14T11:00,2017,7,19.4,0.8,Drizzle
08/09/2017,15:00,40.80843,-73.923386,BRONX,1.0,0.0,1,0,0,0,0,0,3727968,2017-08-09 15:00:00,2017-08-09T15:00,2017,8,27.0,0.0,Clear
02/08/2017,0:00,40.820263,-73.92976,BRONX,1.0,0.0,0,0,1,0,0,0,3612163,2017-02-08 00:00:00,2017-02-08T00:00,2017,2,4.4,0.0,Cloudy
04/26/2017,11:00,40.856045,-73.90079,BRONX,1.0,0.0,0,0,0,0,1,0,3658042,2017-04-26 11:00:00,2017-04-26T11:00,2017,4,13.9,0.2,Drizzle
03/11/2017,12:00,40.87137,-73.836586,BRONX,2.0,0.0,0,0,0,0,2,0,3630677,2017-03-11 12:00:00,2017-03-11T12:00,2017,3,-3.4,0.0,Cloudy
07/26/2017,21:00,40.84269,-73.89317,BRONX,1.0,0.0,1,0,0,0,0,0,3719775,2017-07-26 21:00:00,2017-07-26T21:00,2017,7,19.3,0.0,Cloudy
02/02/2017,12:00,40.84593,-73.890686,BRONX,1.0,0.0,0,0,0,0,1,0,3608575,2017-02-02 12:00:00,2017-02-02T12:00,2017,2,5.6,0.0,Clear
09/28/2017,21:00,40.815342,-73.93067,BRONX,0.0,0.0,0,0,0,0,0,0,3759469,2017-09-28 21:00:00,2017-09-28T21:00,2017,9,17.2,0.0,Clear
07/10/2017,0:00,40.861923,-73.89357,BRONX,1.0,0.0,1,0,0,0,0,0,3711155,2017-07-10 00:00:00,2017-07-10T00:00,2017,7,17.7,0.0,Clear
07/16/2017,12:00,40.816204,-73.91423,BRONX,0.0,0.0,0,0,0,0,0,0,3712868,2017-07-16 12:00:00,2017-07-16T12:00,2017,7,27.3,0.0,Cloudy
10/30/2017,7:00,40.83163,-73.92252,BRONX,1.0,0.0,1,0,0,0,0,0,3779616,2017-10-30 07:00:00,2017-10-30T07:00,2017,10,9.1,0.8,Drizzle
08/27/2017,2:00,40.854244,-73.91557,BRONX,1.0,0.0,0,0,0,0,1,0,3739251,2017-08-27 02:00:00,2017-08-27T02:00,2017,8,15.6,0.0,Clear
04/25/2017,18:00,40.840874,-73.91979,BRONX,0.0,0.0,0,0,0,0,0,0,3657912,2017-04-25 18:00:00,2017-04-25T18:00,2017,4,10.5,0.2,Drizzle
10/02/2017,0:00,40.89702,-73.85969,BRONX,1.0,0.0,1,0,0,0,0,0,3761873,2017-10-02 00:00:00,2017-10-02T00:00,2017,10,11.2,0.0,Clear
01/21/2017,0:00,40.807556,-73.919235,BRONX,1.0,0.0,1,0,0,0,0,0,3603284,2017-01-21 00:00:00,2017-01-21T00:00,2017,1,4.6,0.0,Cloudy
04/23/2017,9:00,40.803593,-73.919785,BRONX,1.0,0.0,0,0,0,0,1,0,3655670,2017-04-23 09:00:00,2017-04-23T09:00,2017,4,11.9,0.0,Clear
10/12/2017,22:00,40.8495,-73.85522,BRONX,0.0,0.0,0,0,0,0,0,0,3772347,2017-10-12 22:00:00,2017-10-12T22:00,2017,10,14.2,0.0,Cloudy
11/02/2017,15:00,40.855316,-73.8677,BRONX,0.0,0.0,0,0,0,0,0,0,3782716,2017-11-02 15:00:00,2017-11-02T15:00,2017,11,20.0,0.0,Clear
02/27/2017,17:00,40.83738,-73.90668,BRONX,1.0,0.0,0,0,0,0,1,0,3623224,2017-02-27 17:00:00,2017-02-27T17:00,2017,2,9.2,0.0,Clear
05/24/2017,10:00,40.904087,-73.84987,BRONX,2.0,0.0,0,0,0,0,2,0,3677168,2017-05-24 10:00:00,2017-05-24T10:00,2017,5,15.7,0.0,Cloudy
06/12/2017,14:00,40.869335,-73.8255,BRONX,1.0,0.0,0,0,0,0,1,0,3692471,2017-06-12 14:00:00,2017-06-12T14:00,2017,6,33.2,0.0,Clear
02/07/2017,7:00,40.852375,-73.86582,BRONX,1.0,0.0,1,0,0,0,0,0,3611191,2017-02-07 07:00:00,2017-02-07T07:00,2017,2,1.9,0.4,Drizzle
08/24/2017,9:00,40.82751,-73.92495,BRONX,2.0,0.0,0,0,1,0,1,0,3736475,2017-08-24 09:00:00,2017-08-24T09:00,2017,8,22.5,0.0,Clear
10/31/2017,14:00,40.859375,-73.868576,BRONX,1.0,0.0,0,0,1,0,0,0,3781646,2017-10-31 14:00:00,2017-10-31T14:00,2017,10,12.6,0.0,Clear
02/26/2017,19:00,40.863945,-73.86452,BRONX,1.0,0.0,0,0,0,0,1,0,3624015,2017-02-26 19:00:00,2017-02-26T19:00,2017,2,2.4,0.0,Cloudy
04/24/2017,12:00,40.89,-73.849106,BRONX,2.0,0.0,0,0,0,0,2,0,3656881,2017-04-24 12:00:00,2017-04-24T12:00,2017,4,14.1,0.0,Cloudy
10/22/2017,4:00,40.867474,-73.89741,BRONX,3.0,0.0,0,0,0,0,3,0,3778034,2017-10-22 04:00:00,2017-10-22T04:00,2017,10,13.0,0.0,Cloudy
04/15/2017,8:00,40.888092,-73.85355,BRONX,0.0,0.0,0,0,0,0,0,0,3651508,2017-04-15 08:00:00,2017-04-15T08:00,2017,4,11.2,0.0,Clear
05/16/2017,8:00,40.844643,-73.90578,BRONX,1.0,0.0,0,0,0,0,1,0,3671426,2017-05-16 08:00:00,2017-05-16T08:00,2017,5,16.9,0.0,Clear
03/27/2017,12:00,40.83694,-73.927124,BRONX,0.0,0.0,0,0,0,0,0,0,3640841,2017-03-27 12:00:00,2017-03-27T12:00,2017,3,7.2,0.0,Cloudy
03/26/2017,17:00,40.834637,-73.89443,BRONX,1.0,0.0,1,0,0,0,0,0,3639663,2017-03-26 17:00:00,2017-03-26T17:00,2017,3,5.9,0.0,Cloudy
03/06/2017,13:00,40.85198,-73.91018,BRONX,0.0,0.0,0,0,0,0,0,0,3627191,2017-03-06 13:00:00,2017-03-06T13:00,2017,3,4.5,0.0,Clear
03/22/2017,8:00,40.83694,-73.927124,BRONX,2.0,0.0,0,0,0,0,2,0,3636876,2017-03-22 08:00:00,2017-03-22T08:00,2017,3,1.7,0.0,Clear
04/02/2017,13:00,40.850494,-73.91546,BRONX,2.0,0.0,0,0,0,0,2,0,3643774,2017-04-02 13:00:00,2017-04-02T13:00,2017,4,15.1,0.0,Cloudy
10/27/2017,18:00,40.815266,-73.859726,BRONX,0.0,0.0,0,0,0,0,0,0,3778129,2017-10-27 18:00:00,2017-10-27T18:00,2017,10,12.5,0.0,Clear
12/24/2017,16:00,40.827824,-73.91934,BRONX,0.0,0.0,0,0,0,0,0,0,3815500,2017-12-24 16:00:00,2017-12-24T16:00,2017,12,3.6,0.0,Cloudy
04/20/2017,8:00,40.865406,-73.86838,BRONX,1.0,0.0,1,0,0,0,0,0,3654335,2017-04-20 08:00:00,2017-04-20T08:00,2017,4,9.7,0.5,Drizzle
05/30/2017,22:00,40.861866,-73.850204,BRONX,0.0,0.0,0,0,0,0,0,0,3681747,2017-05-30 22:00:00,2017-05-30T22:00,2017,5,14.2,0.0,Cloudy
11/23/2017,14:00,40.834507,-73.91772,BRONX,3.0,0.0,0,0,0,0,3,0,3797070,2017-11-23 14:00:00,2017-11-23T14:00,2017,11,5.2,0.0,Clear
09/10/2017,17:00,40.845287,-73.84864,BRONX,1.0,0.0,1,0,0,0,0,0,3756749,2017-09-10 17:00:00,2017-09-10T17:00,2017,9,19.7,0.0,Clear
02/23/2017,15:00,40.83154,-73.910034,BRONX,0.0,0.0,0,0,0,0,0,0,3621759,2017-02-23 15:00:00,2017-02-23T15:00,2017,2,17.2,0.0,Clear
08/16/2017,21:00,40.91083,-73.89664,BRONX,0.0,0.0,0,0,0,0,0,0,3732267,2017-08-16 21:00:00,2017-08-16T21:00,2017,8,24.1,0.0,Clear
08/15/2017,15:00,40.898273,-73.8505,BRONX,1.0,0.0,0,0,0,0,1,0,3731393,2017-08-15 15:00:00,2017-08-15T15:00,2017,8,24.3,0.1,Drizzle
02/16/2017,21:00,40.87049,-73.89043,BRONX,1.0,0.0,1,0,0,0,0,0,3617364,2017-02-16 21:00:00,2017-02-16T21:00,2017,2,-2.7,0.0,Clear
09/02/2017,9:00,40.82143,-73.87941,BRONX,0.0,0.0,0,0,0,0,0,0,3747293,2017-09-02 09:00:00,2017-09-02T09:00,2017,9,16.4,0.0,Cloudy
09/01/2017,0:00,40.885372,-73.8244,BRONX,0.0,0.0,0,0,0,0,0,0,3741609,2017-09-01 00:00:00,2017-09-01T00:00,2017,9,16.1,0.0,Clear
04/15/2017,16:00,40.88243,-73.902306,BRONX,0.0,0.0,0,0,0,0,0,0,3651612,2017-04-15 16:00:00,2017-04-15T16:00,2017,4,13.9,0.0,Cloudy
10/14/2017,20:00,40.82892,-73.821434,BRONX,0.0,0.0,0,0,0,0,0,0,3782199,2017-10-14 20:00:00,2017-10-14T20:00,2017,10,19.4,0.0,Cloudy
01/15/2017,10:00,40.840874,-73.91979,BRONX,2.0,0.0,0,0,0,0,2,0,3598253,2017-01-15 10:00:00,2017-01-15T10:00,2017,1,0.3,0.0,Clear
09/07/2017,13:00,40.852314,-73.82843,BRONX,0.0,0.0,0,0,0,0,0,0,3745585,2017-09-07 13:00:00,2017-09-07T13:00,2017,9,22.2,0.0,Clear
08/03/2017,10:00,40.838875,-73.90266,BRONX,2.0,0.0,0,0,0,0,2,0,3725313,2017-08-03 10:00:00,2017-08-03T10:00,2017,8,25.6,0.0,Cloudy
06/24/2017,2:00,40.82303,-73.90449,BRONX,2.0,0.0,0,0,0,0,2,0,3698027,2017-06-24 02:00:00,2017-06-24T02:00,2017,6,23.4,1.2,Drizzle
02/03/2017,10:00,40.827656,-73.8861,BRONX,0.0,0.0,0,0,0,0,0,0,3610138,2017-02-03 10:00:00,2017-02-03T10:00,2017,2,-1.9,0.0,Cloudy
04/25/2017,9:00,40.825554,-73.843254,BRONX,0.0,0.0,0,0,0,0,0,0,3656897,2017-04-25 09:00:00,2017-04-25T09:00,2017,4,11.2,0.2,Drizzle
11/12/2017,7:00,40.876183,-73.854454,BRONX,2.0,0.0,0,0,0,0,2,0,3788107,2017-11-12 07:00:00,2017-11-12T07:00,2017,11,1.0,0.0,Cloudy
06/14/2017,23:00,40.81612,-73.926636,BRONX,0.0,0.0,0,0,0,0,0,0,3692038,2017-06-14 23:00:00,2017-06-14T23:00,2017,6,17.9,0.0,Clear
10/05/2017,19:00,40.81322,-73.903465,BRONX,0.0,0.0,0,0,0,0,0,0,3765067,2017-10-05 19:00:00,2017-10-05T19:00,2017,10,22.2,0.0,Cloudy
12/15/2017,23:00,40.84294,-73.83871,BRONX,1.0,0.0,0,0,0,0,1,0,3811238,2017-12-15 23:00:00,2017-12-15T23:00,2017,12,-4.8,0.0,Clear
02/04/2017,18:00,40.831123,-73.826645,BRONX,0.0,0.0,0,0,0,0,0,0,3611523,2017-02-04 18:00:00,2017-02-04T18:00,2017,2,-1.2,0.0,Cloudy
06/27/2017,9:00,40.862747,-73.90494,BRONX,0.0,0.0,0,0,0,0,0,0,3701133,2017-06-27 09:00:00,2017-06-27T09:00,2017,6,20.6,0.1,Drizzle
03/03/2017,23:00,40.88104,-73.85745,BRONX,2.0,0.0,0,0,0,0,2,0,3625991,2017-03-03 23:00:00,2017-03-03T23:00,2017,3,-4.9,0.0,Clear
10/16/2017,12:00,40.84373,-73.90858,BRONX,2.0,0.0,0,0,0,0,2,0,3772094,2017-10-16 12:00:00,2017-10-16T12:00,2017,10,14.4,0.0,Cloudy
09/29/2017,0:00,40.81846,-73.91489,BRONX,1.0,0.0,0,0,0,0,1,0,3760447,2017-09-29 00:00:00,2017-09-29T00:00,2017,9,14.9,0.0,Clear
11/03/2017,7:00,40.85592,-73.9172,BRONX,0.0,0.0,0,0,0,0,0,0,3783340,2017-11-03 07:00:00,2017-11-03T07:00,2017,11,14.8,0.0,Clear
05/11/2017,21:00,40.87754,-73.90026,BRONX,3.0,0.0,0,0,0,0,3,0,3674504,2017-05-11 21:00:00,2017-05-11T21:00,2017,5,9.3,0.0,Cloudy
06/27/2017,5:00,40.861828,-73.89286,BRONX,0.0,0.0,0,0,0,0,0,0,3699938,2017-06-27 05:00:00,2017-06-27T05:00,2017,6,17.2,0.3,Drizzle
07/30/2017,22:00,40.82601,-73.88636,BRONX,0.0,0.0,0,0,0,0,0,0,3723838,2017-07-30 22:00:00,2017-07-30T22:00,2017,7,18.7,0.0,Clear
04/05/2017,23:00,40.82035,-73.90919,BRONX,1.0,0.0,0,0,0,0,1,0,3646055,2017-04-05 23:00:00,2017-04-05T23:00,2017,4,6.5,0.0,Cloudy
12/04/2017,6:00,40.816864,-73.882744,BRONX,1.0,0.0,0,0,0,0,1,0,3802421,2017-12-04 06:00:00,2017-12-04T06:00,2017,12,1.4,0.0,Cloudy
12/29/2017,2:00,40.813625,-73.92315,BRONX,1.0,0.0,1,0,0,0,0,0,3823187,2017-12-29 02:00:00,2017-12-29T02:00,2017,12,-11.1,0.0,Cloudy
03/10/2017,0:00,40.834126,-73.916664,BRONX,1.0,0.0,1,0,0,0,0,0,3634097,2017-03-10 00:00:00,2017-03-10T00:00,2017,3,6.0,0.0,Cloudy
04/25/2017,9:00,40.89466,-73.86137,BRONX,1.0,0.0,0,0,0,0,1,0,3663844,2017-04-25 09:00:00,2017-04-25T09:00,2017,4,11.0,0.4,Drizzle
01/15/2017,12:00,40.87686,-73.85976,BRONX,5.0,0.0,0,0,0,0,5,0,3598211,2017-01-15 12:00:00,2017-01-15T12:00,2017,1,2.5,0.0,Clear
08/13/2017,13:00,40.855396,-73.856415,BRONX,0.0,0.0,0,0,0,0,0,0,3730733,2017-08-13 13:00:00,2017-08-13T13:00,2017,8,27.3,0.0,Cloudy
02/06/2017,12:00,40.855217,-73.865746,BRONX,0.0,0.0,0,0,0,0,0,0,3610544,2017-02-06 12:00:00,2017-02-06T12:00,2017,2,5.0,0.0,Clear
06/28/2017,15:00,40.830795,-73.82306,BRONX,1.0,0.0,1,0,0,0,0,0,3707158,2017-06-28 15:00:00,2017-06-28T15:00,2017,6,24.6,0.0,Clear
06/19/2017,19:00,40.895134,-73.85216,BRONX,2.0,0.0,0,0,0,0,2,0,3695268,2017-06-19 19:00:00,2017-06-19T19:00,2017,6,22.4,0.6,Drizzle
11/25/2017,9:00,40.82609,-73.92307,BRONX,1.0,0.0,0,0,0,0,1,0,3797167,2017-11-25 09:00:00,2017-11-25T09:00,2017,11,5.7,0.0,Cloudy
11/16/2017,6:00,40.820988,-73.89491,BRONX,1.0,0.0,1,0,0,0,0,0,3793006,2017-11-16 06:00:00,2017-11-16T06:00,2017,11,10.5,0.3,Drizzle
12/02/2017,1:00,40.816994,-73.82229,BRONX,2.0,0.0,0,0,0,0,2,0,3804529,2017-12-02 01:00:00,2017-12-02T01:00,2017,12,2.9,0.0,Clear
03/29/2017,16:00,40.89466,-73.86137,BRONX,0.0,0.0,0,0,0,0,0,0,3642126,2017-03-29 16:00:00,2017-03-29T16:00,2017,3,13.5,0.0,Clear
09/26/2017,0:00,40.863766,-73.82863,BRONX,0.0,0.0,0,0,0,0,0,0,3759195,2017-09-26 00:00:00,2017-09-26T00:00,2017,9,20.0,0.0,Cloudy
12/30/2017,7:00,40.89552,-73.86402,BRONX,1.0,0.0,0,0,0,0,1,0,3819964,2017-12-30 07:00:00,2017-12-30T07:00,2017,12,-8.6,0.0,Cloudy
02/08/2017,8:00,40.856987,-73.90897,BRONX,1.0,0.0,1,0,0,0,0,0,3612054,2017-02-08 08:00:00,2017-02-08T08:00,2017,2,6.7,0.0,Cloudy
07/02/2017,22:00,40.844734,-73.89935,BRONX,1.0,0.0,0,0,0,0,1,0,3707558,2017-07-02 22:00:00,2017-07-02T22:00,2017,7,22.4,0.0,Cloudy
11/27/2017,15:00,40.866577,-73.867325,BRONX,2.0,0.0,0,0,0,0,2,0,3798698,2017-11-27 15:00:00,2017-11-27T15:00,2017,11,8.5,0.0,Clear
05/21/2017,12:00,40.88271,-73.881256,BRONX,1.0,0.0,1,0,0,0,0,0,3674698,2017-05-21 12:00:00,2017-05-21T12:00,2017,5,18.5,0.0,Cloudy
09/30/2017,0:00,40.824696,-73.83919,BRONX,1.0,0.0,0,0,0,0,1,0,3761180,2017-09-30 00:00:00,2017-09-30T00:00,2017,9,16.4,0.0,Cloudy
10/27/2017,18:00,40.855896,-73.86766,BRONX,2.0,0.0,0,0,0,0,2,0,3778352,2017-10-27 18:00:00,2017-10-27T18:00,2017,10,12.0,0.0,Clear
08/31/2017,10:00,40.901497,-73.90811,BRONX,1.0,0.0,0,0,0,0,1,0,3741521,2017-08-31 10:00:00,2017-08-31T10:00,2017,8,24.4,0.0,Cloudy
07/31/2017,9:00,40.86946,-73.87987,BRONX,0.0,0.0,0,0,0,0,0,0,3729545,2017-07-31 09:00:00,2017-07-31T09:00,2017,7,24.2,0.0,Clear
03/18/2017,15:00,40.851612,-73.84404,BRONX,0.0,0.0,0,0,0,0,0,0,3635291,2017-03-18 15:00:00,2017-03-18T15:00,2017,3,2.6,0.2,Drizzle
03/09/2017,12:00,40.878284,-73.90803,BRONX,2.0,0.0,2,0,0,0,0,0,3629110,2017-03-09 12:00:00,2017-03-09T12:00,2017,3,13.3,0.0,Clear
01/22/2017,0:00,40.868282,-73.90107,BRONX,0.0,0.0,0,0,0,0,0,0,3602581,2017-01-22 00:00:00,2017-01-22T00:00,2017,1,4.9,0.0,Cloudy
02/06/2017,8:00,40.857933,-73.86389,BRONX,0.0,0.0,0,0,0,0,0,0,3610718,2017-02-06 08:00:00,2017-02-06T08:00,2017,2,0.9,0.0,Clear
01/14/2017,18:00,40.83661,-73.92234,BRONX,1.0,0.0,1,0,0,0,0,0,3598233,2017-01-14 18:00:00,2017-01-14T18:00,2017,1,-0.5,0.3,Heavy Snow
01/05/2017,3:00,40.807903,-73.92005,BRONX,0.0,0.0,0,0,0,0,0,0,3592908,2017-01-05 03:00:00,2017-01-05T03:00,2017,1,-2.5,0.0,Clear
02/02/2017,0:00,40.843822,-73.892494,BRONX,2.0,0.0,0,0,0,0,2,0,3608926,2017-02-02 00:00:00,2017-02-02T00:00,2017,2,-0.9,0.0,Clear
10/26/2017,16:00,40.817894,-73.89711,BRONX,0.0,0.0,0,0,0,0,0,0,3777355,2017-10-26 16:00:00,2017-10-26T16:00,2017,10,12.9,0.1,Drizzle
08/08/2017,18:00,40.88527,-73.85511,BRONX,1.0,0.0,1,0,0,0,0,0,3727612,2017-08-08 18:00:00,2017-08-08T18:00,2017,8,22.9,0.0,Clear
12/13/2017,20:00,40.824364,-73.9096,BRONX,0.0,0.0,0,0,0,0,0,0,3808472,2017-12-13 20:00:00,2017-12-13T20:00,2017,12,-3.3,0.0,Cloudy
06/15/2017,0:00,40.889923,-73.85931,BRONX,2.0,0.0,0,0,0,0,2,0,3691406,2017-06-15 00:00:00,2017-06-15T00:00,2017,6,16.4,0.0,Clear
08/30/2017,22:00,40.86539,-73.88684,BRONX,1.0,0.0,0,0,0,0,1,0,3743035,2017-08-30 22:00:00,2017-08-30T22:00,2017,8,19.7,0.0,Clear
08/24/2017,11:00,40.86564,-73.88323,BRONX,1.0,0.0,0,0,0,0,1,0,3736900,2017-08-24 11:00:00,2017-08-24T11:00,2017,8,23.9,0.0,Clear
01/28/2017,12:00,40.858196,-73.87099,BRONX,1.0,0.0,1,0,0,0,0,0,3609856,2017-01-28 12:00:00,2017-01-28T12:00,2017,1,3.9,0.0,Cloudy
06/11/2017,23:00,40.830376,-73.90127,BRONX,1.0,0.0,0,0,0,0,1,0,3688518,2017-06-11 23:00:00,2017-06-11T23:00,2017,6,22.9,0.0,Clear
10/20/2017,20:00,40.81612,-73.926636,BRONX,0.0,0.0,0,0,0,0,0,0,3774873,2017-10-20 20:00:00,2017-10-20T20:00,2017,10,15.2,0.0,Clear
03/23/2017,9:00,40.883575,-73.86281,BRONX,0.0,0.0,0,0,0,0,0,0,3637896,2017-03-23 09:00:00,2017-03-23T09:00,2017,3,-1.9,0.0,Clear
02/27/2017,21:00,40.87757,-73.85644,BRONX,4.0,0.0,0,0,0,0,4,0,3623341,2017-02-27 21:00:00,2017-02-27T21:00,2017,2,4.9,0.0,Clear
02/26/2017,16:00,40.85185,-73.902725,BRONX,0.0,0.0,0,0,0,0,0,0,3621999,2017-02-26 16:00:00,2017-02-26T16:00,2017,2,6.1,0.0,Clear
12/02/2017,4:00,40.838875,-73.90266,BRONX,0.0,0.0,0,0,0,0,0,0,3801473,2017-12-02 04:00:00,2017-12-02T04:00,2017,12,0.7,0.0,Cloudy
08/24/2017,15:00,40.85108,-73.8948,BRONX,0.0,0.0,0,0,0,0,0,0,3744994,2017-08-24 15:00:00,2017-08-24T15:00,2017,8,25.8,0.0,Clear
01/14/2017,22:00,40.821552,-73.90567,BRONX,2.0,0.0,0,0,0,0,2,0,3599470,2017-01-14 22:00:00,2017-01-14T22:00,2017,1,-1.1,0.1,Light Snow
08/13/2017,14:00,40.82874,-73.877304,BRONX,1.0,0.0,0,0,1,0,0,0,3730053,2017-08-13 14:00:00,2017-08-13T14:00,2017,8,27.9,0.0,Cloudy
09/20/2017,0:00,40.844643,-73.90578,BRONX,2.0,0.0,0,0,0,0,2,0,3754420,2017-09-20 00:00:00,2017-09-20T00:00,2017,9,20.5,0.0,Cloudy
05/04/2017,0:00,40.859303,-73.89884,BRONX,0.0,0.0,0,0,0,0,0,0,3663019,2017-05-04 00:00:00,2017-05-04T00:00,2017,5,8.3,0.0,Clear
11/05/2017,17:00,40.869335,-73.8255,BRONX,3.0,0.0,0,0,0,0,3,0,3784233,2017-11-05 17:00:00,2017-11-05T17:00,2017,11,15.9,0.0,Cloudy
08/27/2017,8:00,40.825077,-73.90832,BRONX,1.0,0.0,0,0,0,0,1,0,3738568,2017-08-27 08:00:00,2017-08-27T08:00,2017,8,18.7,0.0,Cloudy
05/10/2017,12:00,40.852955,-73.84316,BRONX,0.0,0.0,0,0,0,0,0,0,3667524,2017-05-10 12:00:00,2017-05-10T12:00,2017,5,15.6,0.0,Cloudy
01/29/2017,15:00,40.879097,-73.90724,BRONX,0.0,0.0,0,0,0,0,0,0,3616034,2017-01-29 15:00:00,2017-01-29T15:00,2017,1,5.6,0.0,Cloudy
08/03/2017,10:00,40.870106,-73.87872,BRONX,0.0,0.0,0,0,0,0,0,0,3724120,2017-08-03 10:00:00,2017-08-03T10:00,2017,8,25.4,0.0,Cloudy
01/21/2017,19:00,40.871117,-73.87683,BRONX,1.0,0.0,0,0,0,0,1,0,3604696,2017-01-21 19:00:00,2017-01-21T19:00,2017,1,5.6,0.0,Cloudy
05/03/2017,18:00,40.82024,-73.821144,BRONX,0.0,0.0,0,0,0,0,0,0,3666492,2017-05-03 18:00:00,2017-05-03T18:00,2017,5,14.1,0.0,Clear
06/21/2017,13:00,40.83988,-73.916794,BRONX,2.0,0.0,0,0,0,0,2,0,3695937,2017-06-21 13:00:00,2017-06-21T13:00,2017,6,26.4,0.0,Clear
11/10/2017,20:00,40.8077,-73.92955,BRONX,2.0,0.0,0,0,0,0,2,0,3788846,2017-11-10 20:00:00,2017-11-10T20:00,2017,11,-2.4,0.0,Clear
04/17/2017,15:00,40.857365,-73.84657,BRONX,1.0,0.0,0,0,0,0,1,0,3653623,2017-04-17 15:00:00,2017-04-17T15:00,2017,4,20.7,0.0,Cloudy
05/01/2017,15:00,40.815437,-73.924,BRONX,1.0,0.0,1,0,0,0,0,0,3661671,2017-05-01 15:00:00,2017-05-01T15:00,2017,5,20.7,0.0,Cloudy
11/10/2017,14:00,40.819542,-73.91353,BRONX,1.0,0.0,0,0,0,0,1,0,3788562,2017-11-10 14:00:00,2017-11-10T14:00,2017,11,1.0,0.0,Clear
10/21/2017,4:00,40.85889,-73.88707,BRONX,2.0,0.0,2,0,0,0,0,0,3776501,2017-10-21 04:00:00,2017-10-21T04:00,2017,10,10.0,0.0,Clear
07/31/2017,16:00,40.829033,-73.830536,BRONX,3.0,0.0,0,0,0,0,3,0,3723772,2017-07-31 16:00:00,2017-07-31T16:00,2017,7,29.1,0.0,Clear
10/17/2017,23:00,40.879814,-73.86149,BRONX,0.0,0.0,0,0,0,0,0,0,3779813,2017-10-17 23:00:00,2017-10-17T23:00,2017,10,9.8,0.0,Clear
12/08/2017,12:00,40.877365,-73.88533,BRONX,1.0,0.0,0,0,0,0,1,0,3805148,2017-12-08 12:00:00,2017-12-08T12:00,2017,12,2.3,0.0,Cloudy
11/09/2017,0:00,40.80719,-73.92431,BRONX,1.0,0.0,1,0,0,0,0,0,3788744,2017-11-09 00:00:00,2017-11-09T00:00,2017,11,4.3,0.0,Clear
11/13/2017,0:00,40.83887,-73.87811,BRONX,0.0,0.0,0,0,0,0,0,0,3789649,2017-11-13 00:00:00,2017-11-13T00:00,2017,11,2.4,0.0,Cloudy
03/20/2017,8:00,40.83717,-73.90197,BRONX,1.0,0.0,1,0,0,0,0,0,3635992,2017-03-20 08:00:00,2017-03-20T08:00,2017,3,0.3,0.0,Clear
04/22/2017,19:00,40.85876,-73.89736,BRONX,1.0,0.0,0,0,0,0,1,0,3656765,2017-04-22 19:00:00,2017-04-22T19:00,2017,4,10.6,0.0,Cloudy
05/22/2017,19:00,40.84633,-73.887344,BRONX,3.0,0.0,0,0,0,0,3,0,3676279,2017-05-22 19:00:00,2017-05-22T19:00,2017,5,15.2,0.0,Cloudy
08/25/2017,8:00,40.854477,-73.8667,BRONX,1.0,0.0,1,0,0,0,0,0,3737945,2017-08-25 08:00:00,2017-08-25T08:00,2017,8,20.0,0.0,Clear
08/14/2017,11:00,40.887463,-73.856766,BRONX,0.0,0.0,0,0,0,0,0,0,3730883,2017-08-14 11:00:00,2017-08-14T11:00,2017,8,25.3,0.3,Drizzle
01/01/2017,2:00,40.816532,-73.92822,BRONX,1.0,0.0,0,0,0,0,1,0,3591498,2017-01-01 02:00:00,2017-01-01T02:00,2017,1,5.4,0.1,Drizzle
11/28/2017,17:00,40.857365,-73.84657,BRONX,2.0,0.0,0,0,0,0,2,0,3799547,2017-11-28 17:00:00,2017-11-28T17:00,2017,11,9.3,0.0,Clear
07/11/2017,14:00,40.866047,-73.87207,BRONX,1.0,0.0,0,0,0,0,1,0,3709220,2017-07-11 14:00:00,2017-07-11T14:00,2017,7,27.7,0.0,Cloudy
06/30/2017,0:00,40.84486,-73.88551,BRONX,1.0,0.0,1,0,0,0,0,0,3712715,2017-06-30 00:00:00,2017-06-30T00:00,2017,6,22.5,0.0,Cloudy
02/17/2017,7:00,40.89963,-73.867584,BRONX,2.0,0.0,0,0,0,0,2,0,3617992,2017-02-17 07:00:00,2017-02-17T07:00,2017,2,-4.0,0.0,Clear
10/15/2017,0:00,40.84744,-73.89968,BRONX,1.0,0.0,0,0,0,0,1,0,3775735,2017-10-15 00:00:00,2017-10-15T00:00,2017,10,18.3,0.0,Cloudy
08/01/2017,0:00,40.830624,-73.90451,BRONX,0.0,0.0,0,0,0,0,0,0,3722764,2017-08-01 00:00:00,2017-08-01T00:00,2017,8,20.8,0.0,Clear
07/16/2017,14:00,40.872696,-73.85172,BRONX,1.0,0.0,0,0,0,0,1,0,3713415,2017-07-16 14:00:00,2017-07-16T14:00,2017,7,28.0,0.0,Cloudy
07/09/2017,0:00,40.866047,-73.87207,BRONX,0.0,0.0,0,0,0,0,0,0,3716076,2017-07-09 00:00:00,2017-07-09T00:00,2017,7,20.1,0.0,Clear
07/26/2017,8:00,40.880352,-73.88593,BRONX,1.0,0.0,0,0,1,0,0,0,3719944,2017-07-26 08:00:00,2017-07-26T08:00,2017,7,20.2,0.0,Clear
09/19/2017,8:00,40.824207,-73.87529,BRONX,1.0,0.0,0,0,0,0,1,0,3753849,2017-09-19 08:00:00,2017-09-19T08:00,2017,9,21.8,0.0,Cloudy
02/06/2017,6:00,40.878376,-73.83,BRONX,1.0,0.0,0,0,0,0,1,0,3611535,2017-02-06 06:00:00,2017-02-06T06:00,2017,2,-1.4,0.0,Clear
07/16/2017,16:00,40.85106,-73.84969,BRONX,0.0,0.0,0,0,0,0,0,0,3712015,2017-07-16 16:00:00,2017-07-16T16:00,2017,7,28.4,0.0,Cloudy
11/13/2017,0:00,40.843822,-73.916565,BRONX,1.0,0.0,1,0,0,0,0,0,3789466,2017-11-13 00:00:00,2017-11-13T00:00,2017,11,3.3,0.0,Cloudy
02/11/2017,9:00,40.858707,-73.9037,BRONX,1.0,0.0,1,0,0,0,0,0,3614681,2017-02-11 09:00:00,2017-02-11T09:00,2017,2,0.7,0.0,Cloudy
04/28/2017,13:00,40.82755,-73.91847,BRONX,0.0,0.0,0,0,0,0,0,0,3659349,2017-04-28 13:00:00,2017-04-28T13:00,2017,4,25.5,0.0,Clear
06/21/2017,7:00,40.871254,-73.84355,BRONX,1.0,0.0,1,0,0,0,0,0,3695866,2017-06-21 07:00:00,2017-06-21T07:00,2017,6,22.5,0.0,Clear
03/24/2017,7:00,40.886375,-73.82656,BRONX,1.0,0.0,0,0,0,0,1,0,3638373,2017-03-24 07:00:00,2017-03-24T07:00,2017,3,0.8,0.0,Cloudy
04/17/2017,3:00,40.809628,-73.890045,BRONX,2.0,0.0,0,0,0,0,2,0,3652812,2017-04-17 03:00:00,2017-04-17T03:00,2017,4,15.9,0.0,Cloudy
02/27/2017,8:00,40.857277,-73.888466,BRONX,3.0,0.0,3,0,0,0,0,0,3624058,2017-02-27 08:00:00,2017-02-27T08:00,2017,2,1.5,0.0,Cloudy
07/14/2017,4:00,40.8552,-73.88688,BRONX,1.0,0.0,1,0,0,0,0,0,3714433,2017-07-14 04:00:00,2017-07-14T04:00,2017,7,19.4,0.0,Cloudy
02/23/2017,18:00,40.87564,-73.829,BRONX,1.0,0.0,1,0,0,0,0,0,3621006,2017-02-23 18:00:00,2017-02-23T18:00,2017,2,11.2,0.0,Clear
07/20/2017,22:00,40.85265,-73.85203,BRONX,1.0,0.0,0,0,0,0,1,0,3716548,2017-07-20 22:00:00,2017-07-20T22:00,2017,7,25.5,0.0,Clear
05/25/2017,0:00,40.874737,-73.855255,BRONX,1.0,0.0,0,0,0,0,1,0,3679253,2017-05-25 00:00:00,2017-05-25T00:00,2017,5,13.3,0.0,Cloudy
08/30/2017,15:00,40.841087,-73.86447,BRONX,0.0,0.0,0,0,0,0,0,0,3740536,2017-08-30 15:00:00,2017-08-30T15:00,2017,8,25.1,0.0,Cloudy
12/01/2017,15:00,40.889038,-73.85909,BRONX,0.0,0.0,0,0,0,0,0,0,3806553,2017-12-01 15:00:00,2017-12-01T15:00,2017,12,9.9,0.0,Clear
03/29/2017,7:00,40.814934,-73.91496,BRONX,1.0,0.0,0,0,0,0,1,0,3641807,2017-03-29 07:00:00,2017-03-29T07:00,2017,3,5.7,0.0,Clear
11/11/2017,18:00,40.864655,-73.863556,BRONX,1.0,0.0,0,0,1,0,0,0,3787861,2017-11-11 18:00:00,2017-11-11T18:00,2017,11,0.1,0.0,Cloudy
03/19/2017,16:00,40.83121,-73.850876,BRONX,1.0,0.0,1,0,0,0,0,0,3635303,2017-03-19 16:00:00,2017-03-19T16:00,2017,3,5.1,0.0,Clear
04/02/2017,20:00,40.855633,-73.84047,BRONX,1.0,0.0,1,0,0,0,0,0,3643751,2017-04-02 20:00:00,2017-04-02T20:00,2017,4,9.1,0.0,Cloudy
07/01/2017,5:00,40.880318,-73.841286,BRONX,2.0,0.0,0,0,0,0,2,0,3704184,2017-07-01 05:00:00,2017-07-01T05:00,2017,7,22.9,0.0,Clear
05/22/2017,17:00,40.8315,-73.8891,BRONX,1.0,0.0,0,0,0,0,1,0,3675893,2017-05-22 17:00:00,2017-05-22T17:00,2017,5,15.4,0.0,Cloudy
09/29/2017,6:00,40.829308,-73.89191,BRONX,1.0,0.0,0,0,0,0,1,0,3760872,2017-09-29 06:00:00,2017-09-29T06:00,2017,9,12.4,0.0,Clear
09/07/2017,20:00,40.84022,-73.873276,BRONX,1.0,0.0,1,0,0,0,0,0,3749752,2017-09-07 20:00:00,2017-09-07T20:00,2017,9,17.8,0.0,Clear
04/02/2017,15:00,40.865833,-73.887474,BRONX,0.0,0.0,0,0,0,0,0,0,4024177,2017-04-02 15:00:00,2017-04-02T15:00,2017,4,15.3,0.0,Cloudy
05/19/2017,11:00,40.859623,-73.86313,BRONX,0.0,0.0,0,0,0,0,0,0,3673567,2017-05-19 11:00:00,2017-05-19T11:00,2017,5,28.3,0.1,Drizzle
09/18/2017,17:00,40.881264,-73.83875,BRONX,0.0,0.0,0,0,0,0,0,0,3754463,2017-09-18 17:00:00,2017-09-18T17:00,2017,9,22.6,0.0,Cloudy
06/01/2017,8:00,40.8843,-73.90332,BRONX,3.0,0.0,0,0,0,0,3,0,3683210,2017-06-01 08:00:00,2017-06-01T08:00,2017,6,18.0,0.0,Cloudy
05/12/2017,14:00,40.875114,-73.91243,BRONX,0.0,0.0,0,0,0,0,0,0,3668772,2017-05-12 14:00:00,2017-05-12T14:00,2017,5,14.5,0.0,Cloudy
07/24/2017,14:00,40.80682,-73.91749,BRONX,1.0,0.0,0,0,1,0,0,0,3717954,2017-07-24 14:00:00,2017-07-24T14:00,2017,7,21.5,0.0,Cloudy
07/01/2017,19:00,40.814312,-73.80772,BRONX,3.0,0.0,0,0,0,0,3,0,3702971,2017-07-01 19:00:00,2017-07-01T19:00,2017,7,22.7,0.2,Drizzle
10/16/2017,0:00,40.84944,-73.906006,BRONX,1.0,0.0,1,0,0,0,0,0,3771729,2017-10-16 00:00:00,2017-10-16T00:00,2017,10,20.1,0.4,Drizzle
09/16/2017,16:00,40.829685,-73.8253,BRONX,0.0,0.0,0,0,0,0,0,0,3753280,2017-09-16 16:00:00,2017-09-16T16:00,2017,9,24.0,0.0,Clear
12/06/2017,14:00,40.86463,-73.892136,BRONX,1.0,0.0,0,0,0,0,1,0,3804969,2017-12-06 14:00:00,2017-12-06T14:00,2017,12,6.0,0.0,Cloudy
03/31/2017,16:00,40.831,-73.82652,BRONX,0.0,0.0,0,0,0,0,0,0,3644484,2017-03-31 16:00:00,2017-03-31T16:00,2017,3,4.8,0.9,Drizzle
06/22/2017,15:00,40.857048,-73.90691,BRONX,0.0,0.0,0,0,0,0,0,0,3696791,2017-06-22 15:00:00,2017-06-22T15:00,2017,6,26.4,0.0,Clear
09/04/2017,15:00,40.87459,-73.86223,BRONX,1.0,0.0,0,0,0,0,1,0,3744735,2017-09-04 15:00:00,2017-09-04T15:00,2017,9,25.4,0.0,Clear
04/22/2017,22:00,40.841637,-73.89318,BRONX,4.0,0.0,0,0,0,0,4,0,3655719,2017-04-22 22:00:00,2017-04-22T22:00,2017,4,9.7,0.0,Cloudy
06/01/2017,19:00,40.817387,-73.92277,BRONX,1.0,0.0,1,0,0,0,0,0,3682439,2017-06-01 19:00:00,2017-06-01T19:00,2017,6,21.0,0.0,Clear
11/01/2017,22:00,40.83987,-73.89018,BRONX,6.0,0.0,0,0,0,0,6,0,3781933,2017-11-01 22:00:00,2017-11-01T22:00,2017,11,14.9,0.0,Cloudy
07/02/2017,8:00,40.839584,-73.87032,BRONX,1.0,0.0,1,0,0,0,0,0,3703080,2017-07-02 08:00:00,2017-07-02T08:00,2017,7,25.4,0.0,Clear
08/07/2017,0:00,40.846657,-73.89619,BRONX,4.0,0.0,0,0,0,0,4,0,3727130,2017-08-07 00:00:00,2017-08-07T00:00,2017,8,17.5,0.0,Cloudy
10/03/2017,8:00,40.866066,-73.89438,BRONX,1.0,0.0,1,0,0,0,0,0,3764512,2017-10-03 08:00:00,2017-10-03T08:00,2017,10,16.3,0.0,Clear
11/01/2017,8:00,40.816624,-73.898445,BRONX,0.0,0.0,0,0,0,0,0,0,3782139,2017-11-01 08:00:00,2017-11-01T08:00,2017,11,8.3,0.0,Cloudy
05/01/2017,19:00,40.845886,-73.915085,BRONX,0.0,0.0,0,0,0,0,0,0,3661235,2017-05-01 19:00:00,2017-05-01T19:00,2017,5,17.6,0.0,Cloudy
09/10/2017,15:00,40.819542,-73.91353,BRONX,1.0,0.0,0,0,0,0,1,0,3747047,2017-09-10 15:00:00,2017-09-10T15:00,2017,9,21.2,0.0,Cloudy
02/13/2017,14:00,40.84469,-73.90667,BRONX,1.0,0.0,1,0,0,0,0,0,3614888,2017-02-13 14:00:00,2017-02-13T14:00,2017,2,1.7,0.0,Cloudy
03/20/2017,18:00,40.808887,-73.906715,BRONX,0.0,0.0,0,0,0,0,0,0,3636216,2017-03-20 18:00:00,2017-03-20T18:00,2017,3,8.9,0.0,Clear
04/03/2017,4:00,40.869217,-73.88167,BRONX,1.0,0.0,0,0,0,0,1,0,3646687,2017-04-03 04:00:00,2017-04-03T04:00,2017,4,2.3,0.0,Cloudy
07/25/2017,21:00,40.82857,-73.84119,BRONX,0.0,0.0,0,0,0,0,0,0,3719448,2017-07-25 21:00:00,2017-07-25T21:00,2017,7,19.5,0.0,Cloudy
04/27/2017,14:00,40.855194,-73.89305,BRONX,0.0,0.0,0,0,0,0,0,0,3658370,2017-04-27 14:00:00,2017-04-27T14:00,2017,4,18.5,0.0,Cloudy
05/16/2017,9:00,40.859592,-73.86559,BRONX,1.0,0.0,0,0,0,0,1,0,3671400,2017-05-16 09:00:00,2017-05-16T09:00,2017,5,18.5,0.0,Cloudy
10/03/2017,15:00,40.85487,-73.86769,BRONX,0.0,0.0,0,0,0,0,0,0,3762994,2017-10-03 15:00:00,2017-10-03T15:00,2017,10,18.5,0.0,Cloudy
11/17/2017,16:00,40.826786,-73.890915,BRONX,1.0,0.0,1,0,0,0,0,0,4025201,2017-11-17 16:00:00,2017-11-17T16:00,2017,11,7.0,0.0,Clear
01/16/2017,18:00,40.849922,-73.905624,BRONX,1.0,0.0,1,0,0,0,0,0,3599604,2017-01-16 18:00:00,2017-01-16T18:00,2017,1,1.3,0.0,Cloudy
05/14/2017,15:00,40.85447,-73.91008,BRONX,1.0,0.0,0,0,0,0,1,0,3671410,2017-05-14 15:00:00,2017-05-14T15:00,2017,5,15.9,0.3,Drizzle
07/12/2017,22:00,40.879753,-73.84881,BRONX,0.0,0.0,0,0,0,0,0,0,3710038,2017-07-12 22:00:00,2017-07-12T22:00,2017,7,23.8,0.0,Cloudy
04/23/2017,16:00,40.81889,-73.89609,BRONX,1.0,0.0,0,0,0,0,1,0,3656592,2017-04-23 16:00:00,2017-04-23T16:00,2017,4,14.8,0.0,Cloudy
12/20/2017,16:00,40.850456,-73.899315,BRONX,1.0,0.0,0,0,0,0,1,0,3815003,2017-12-20 16:00:00,2017-12-20T16:00,2017,12,4.1,0.0,Cloudy
11/03/2017,0:00,40.819427,-73.84497,BRONX,0.0,0.0,0,0,0,0,0,0,3782572,2017-11-03 00:00:00,2017-11-03T00:00,2017,11,15.8,0.0,Cloudy
09/19/2017,20:00,40.884735,-73.84045,BRONX,1.0,0.0,0,0,0,0,1,0,3754467,2017-09-19 20:00:00,2017-09-19T20:00,2017,9,20.7,0.5,Drizzle
01/18/2017,10:00,40.895374,-73.86356,BRONX,2.0,0.0,0,0,0,0,2,0,3600687,2017-01-18 10:00:00,2017-01-18T10:00,2017,1,3.5,0.0,Cloudy
02/10/2017,19:00,40.80719,-73.92431,BRONX,2.0,0.0,0,0,0,0,2,0,3615081,2017-02-10 19:00:00,2017-02-10T19:00,2017,2,-2.9,0.0,Cloudy
12/23/2017,17:00,40.821854,-73.8487,BRONX,0.0,0.0,0,0,0,0,0,0,3814954,2017-12-23 17:00:00,2017-12-23T17:00,2017,12,13.1,0.3,Drizzle
07/30/2017,20:00,40.887802,-73.86046,BRONX,1.0,0.0,0,0,0,0,1,0,3722081,2017-07-30 20:00:00,2017-07-30T20:00,2017,7,22.1,0.0,Clear
06/18/2017,0:00,40.86247,-73.90029,BRONX,2.0,0.0,0,0,0,0,2,0,3693236,2017-06-18 00:00:00,2017-06-18T00:00,2017,6,20.2,0.7,Drizzle
06/14/2017,0:00,40.88121,-73.86315,BRONX,0.0,0.0,0,0,0,0,0,0,3690833,2017-06-14 00:00:00,2017-06-14T00:00,2017,6,22.9,0.3,Drizzle
11/05/2017,13:00,40.825726,-73.82112,BRONX,0.0,0.0,0,0,0,0,0,0,3785446,2017-11-05 13:00:00,2017-11-05T13:00,2017,11,15.8,0.0,Cloudy
10/08/2017,14:00,40.895912,-73.84863,BRONX,2.0,0.0,0,0,0,0,2,0,3765915,2017-10-08 14:00:00,2017-10-08T14:00,2017,10,24.9,0.0,Cloudy
02/07/2017,8:00,40.87573,-73.87956,BRONX,1.0,0.0,0,0,0,0,1,0,3611549,2017-02-07 08:00:00,2017-02-07T08:00,2017,2,2.4,0.2,Drizzle
04/03/2017,17:00,40.84034,-73.88186,BRONX,1.0,0.0,1,0,0,0,0,0,3645487,2017-04-03 17:00:00,2017-04-03T17:00,2017,4,10.7,0.0,Cloudy
07/20/2017,11:00,40.852642,-73.908424,BRONX,1.0,0.0,0,0,0,0,1,0,3715642,2017-07-20 11:00:00,2017-07-20T11:00,2017,7,31.1,0.0,Clear
04/06/2017,20:00,40.878376,-73.861275,BRONX,0.0,0.0,0,0,0,0,0,0,3646693,2017-04-06 20:00:00,2017-04-06T20:00,2017,4,10.9,0.0,Cloudy
05/14/2017,15:00,40.839863,-73.888145,BRONX,1.0,0.0,0,0,0,0,1,0,3669809,2017-05-14 15:00:00,2017-05-14T15:00,2017,5,16.0,0.2,Drizzle
09/13/2017,16:00,40.840664,-73.88152,BRONX,0.0,0.0,0,0,0,0,0,0,3749754,2017-09-13 16:00:00,2017-09-13T16:00,2017,9,24.4,0.0,Clear
02/04/2017,0:00,40.861862,-73.91282,BRONX,0.0,0.0,0,0,0,0,0,0,3609621,2017-02-04 00:00:00,2017-02-04T00:00,2017,2,-4.4,0.0,Clear
06/01/2017,13:00,40.871967,-73.89909,BRONX,1.0,0.0,0,0,0,0,1,0,3683187,2017-06-01 13:00:00,2017-06-01T13:00,2017,6,21.4,0.0,Cloudy
06/03/2017,14:00,40.889084,-73.82948,BRONX,2.0,0.0,0,0,0,0,2,0,3683441,2017-06-03 14:00:00,2017-06-03T14:00,2017,6,20.5,0.0,Cloudy
12/07/2017,0:00,40.821552,-73.90567,BRONX,3.0,0.0,0,0,0,0,3,0,3805547,2017-12-07 00:00:00,2017-12-07T00:00,2017,12,3.3,0.0,Cloudy
08/01/2017,9:00,40.840874,-73.91979,BRONX,0.0,0.0,0,0,0,0,0,0,3722591,2017-08-01 09:00:00,2017-08-01T09:00,2017,8,26.0,0.0,Clear
10/05/2017,11:00,40.85088,-73.851814,BRONX,0.0,0.0,0,0,0,0,0,0,3767975,2017-10-05 11:00:00,2017-10-05T11:00,2017,10,24.2,0.0,Cloudy
11/15/2017,14:00,40.8724,-73.88981,BRONX,2.0,0.0,0,0,0,0,2,0,3795525,2017-11-15 14:00:00,2017-11-15T14:00,2017,11,8.3,0.0,Cloudy
03/17/2017,14:00,40.893047,-73.85633,BRONX,0.0,0.0,0,0,0,0,0,0,3634663,2017-03-17 14:00:00,2017-03-17T14:00,2017,3,4.6,0.0,Clear
10/11/2017,13:00,40.824654,-73.89194,BRONX,0.0,0.0,0,0,0,0,0,0,3767456,2017-10-11 13:00:00,2017-10-11T13:00,2017,10,21.6,0.0,Cloudy
11/03/2017,15:00,40.860577,-73.90255,BRONX,1.0,0.0,1,0,0,0,0,0,3783050,2017-11-03 15:00:00,2017-11-03T15:00,2017,11,22.6,0.0,Cloudy
05/04/2017,15:00,40.86955,-73.85855,BRONX,1.0,0.0,0,0,0,0,1,0,3663539,2017-05-04 15:00:00,2017-05-04T15:00,2017,5,14.1,0.0,Cloudy
09/18/2017,17:00,40.866047,-73.882744,BRONX,0.0,0.0,0,0,0,0,0,0,3753581,2017-09-18 17:00:00,2017-09-18T17:00,2017,9,22.6,0.0,Cloudy
05/16/2017,15:00,40.84543,-73.91399,BRONX,0.0,0.0,0,0,0,0,0,0,3671213,2017-05-16 15:00:00,2017-05-16T15:00,2017,5,24.4,0.0,Clear
07/31/2017,13:00,40.88974,-73.84591,BRONX,0.0,0.0,0,0,0,0,0,0,3722089,2017-07-31 13:00:00,2017-07-31T13:00,2017,7,28.4,0.0,Cloudy
04/14/2017,10:00,40.820305,-73.89083,BRONX,1.0,0.0,0,0,0,0,1,0,3652816,2017-04-14 10:00:00,2017-04-14T10:00,2017,4,12.8,0.0,Clear
09/12/2017,8:00,40.861637,-73.82433,BRONX,1.0,0.0,0,0,0,0,1,0,3750339,2017-09-12 08:00:00,2017-09-12T08:00,2017,9,17.7,0.0,Cloudy
06/20/2017,18:00,40.8283,-73.88296,BRONX,2.0,0.0,2,0,0,0,0,0,3695560,2017-06-20 18:00:00,2017-06-20T18:00,2017,6,25.8,0.0,Clear
03/06/2017,12:00,40.845642,-73.90211,BRONX,0.0,0.0,0,0,0,0,0,0,3627572,2017-03-06 12:00:00,2017-03-06T12:00,2017,3,3.8,0.0,Clear
06/30/2017,11:00,40.88219,-73.85066,BRONX,1.0,0.0,1,0,0,0,0,0,3702477,2017-06-30 11:00:00,2017-06-30T11:00,2017,6,28.3,0.0,Cloudy
06/17/2017,17:00,40.869495,-73.82619,BRONX,0.0,0.0,0,0,0,0,0,0,3693817,2017-06-17 17:00:00,2017-06-17T17:00,2017,6,21.4,0.0,Cloudy
07/05/2017,13:00,40.82851,-73.88012,BRONX,0.0,0.0,0,0,0,0,0,0,3705837,2017-07-05 13:00:00,2017-07-05T13:00,2017,7,28.2,0.0,Cloudy
02/22/2017,16:00,40.855927,-73.89478,BRONX,1.0,0.0,0,0,0,0,1,0,3619989,2017-02-22 16:00:00,2017-02-22T16:00,2017,2,10.9,0.0,Cloudy
12/29/2017,16:00,40.872837,-73.852196,BRONX,1.0,0.0,0,0,0,0,1,0,3821643,2017-12-29 16:00:00,2017-12-29T16:00,2017,12,-5.3,0.0,Cloudy
10/27/2017,23:00,40.864002,-73.834045,BRONX,1.0,0.0,0,0,0,0,1,0,3778347,2017-10-27 23:00:00,2017-10-27T23:00,2017,10,11.3,0.0,Clear
03/15/2017,8:00,40.89608,-73.86692,BRONX,1.0,0.0,0,0,0,0,1,0,3632275,2017-03-15 08:00:00,2017-03-15T08:00,2017,3,-6.7,0.0,Cloudy
02/02/2017,6:00,40.81485,-73.884224,BRONX,1.0,0.0,0,0,0,0,1,0,3608698,2017-02-02 06:00:00,2017-02-02T06:00,2017,2,-1.6,0.0,Cloudy
07/21/2017,13:00,40.853104,-73.83026,BRONX,0.0,0.0,0,0,0,0,0,0,3719074,2017-07-21 13:00:00,2017-07-21T13:00,2017,7,31.7,0.0,Cloudy
05/31/2017,22:00,40.846237,-73.91818,BRONX,1.0,0.0,0,0,0,0,1,0,3681842,2017-05-31 22:00:00,2017-05-31T22:00,2017,5,15.4,0.0,Clear
10/08/2017,14:00,40.848957,-73.86024,BRONX,2.0,0.0,0,0,0,0,2,0,3766739,2017-10-08 14:00:00,2017-10-08T14:00,2017,10,25.0,0.0,Cloudy
08/11/2017,21:00,40.81832,-73.88748,BRONX,1.0,0.0,1,0,0,0,0,0,3729810,2017-08-11 21:00:00,2017-08-11T21:00,2017,8,21.2,0.5,Drizzle
07/01/2017,16:00,40.820263,-73.92976,BRONX,1.0,0.0,0,0,0,0,1,0,3704230,2017-07-01 16:00:00,2017-07-01T16:00,2017,7,25.6,0.0,Cloudy
10/02/2017,8:00,40.850803,-73.86213,BRONX,0.0,0.0,0,0,0,0,0,0,3762198,2017-10-02 08:00:00,2017-10-02T08:00,2017,10,13.7,0.0,Clear
04/13/2017,14:00,40.834255,-73.90404,BRONX,1.0,0.0,0,0,0,0,1,0,3651724,2017-04-13 14:00:00,2017-04-13T14:00,2017,4,16.5,0.0,Clear
10/21/2017,0:00,40.895466,-73.87713,BRONX,1.0,0.0,0,0,0,0,1,0,3774115,2017-10-21 00:00:00,2017-10-21T00:00,2017,10,12.6,0.0,Clear
02/07/2017,17:00,40.842854,-73.85,BRONX,2.0,0.0,2,0,0,0,0,0,3611737,2017-02-07 17:00:00,2017-02-07T17:00,2017,2,4.3,0.0,Cloudy
01/09/2017,21:00,40.882374,-73.88642,BRONX,0.0,0.0,0,0,0,0,0,0,3596000,2017-01-09 21:00:00,2017-01-09T21:00,2017,1,-9.9,0.0,Clear
10/27/2017,14:00,40.825993,-73.816734,BRONX,0.0,0.0,0,0,0,0,0,0,3779496,2017-10-27 14:00:00,2017-10-27T14:00,2017,10,15.4,0.0,Clear
08/24/2017,15:00,40.869152,-73.882385,BRONX,1.0,0.0,0,0,0,0,1,0,3736913,2017-08-24 15:00:00,2017-08-24T15:00,2017,8,25.8,0.0,Clear
05/22/2017,0:00,40.873066,-73.85844,BRONX,1.0,0.0,0,0,0,0,1,0,3676454,2017-05-22 00:00:00,2017-05-22T00:00,2017,5,13.0,0.0,Cloudy
01/07/2017,18:00,40.85093,-73.83001,BRONX,1.0,0.0,0,0,0,0,1,0,3596425,2017-01-07 18:00:00,2017-01-07T18:00,2017,1,-5.4,0.9,Heavy Snow
09/13/2017,16:00,40.82816,-73.91297,BRONX,4.0,0.0,0,0,0,0,4,0,3749164,2017-09-13 16:00:00,2017-09-13T16:00,2017,9,24.4,0.0,Clear
10/30/2017,7:00,40.89466,-73.86137,BRONX,0.0,0.0,0,0,0,0,0,0,3779523,2017-10-30 07:00:00,2017-10-30T07:00,2017,10,8.8,0.8,Drizzle
05/06/2017,13:00,40.829052,-73.85038,BRONX,1.0,0.0,1,0,0,0,0,0,3665311,2017-05-06 13:00:00,2017-05-06T13:00,2017,5,17.1,0.0,Cloudy
09/04/2017,2:00,40.821667,-73.915184,BRONX,0.0,0.0,0,0,0,0,0,0,3742158,2017-09-04 02:00:00,2017-09-04T02:00,2017,9,15.9,0.0,Clear
10/19/2017,0:00,40.83541,-73.88574,BRONX,0.0,0.0,0,0,0,0,0,0,3773945,2017-10-19 00:00:00,2017-10-19T00:00,2017,10,12.2,0.0,Clear
03/13/2017,10:00,40.82187,-73.903496,BRONX,1.0,0.0,0,0,1,0,0,0,3631875,2017-03-13 10:00:00,2017-03-13T10:00,2017,3,-2.8,0.0,Cloudy
04/01/2017,0:00,40.8617,-73.89139,BRONX,0.0,0.0,0,0,0,0,0,0,3643179,2017-04-01 00:00:00,2017-04-01T00:00,2017,4,2.8,0.6,Drizzle
02/16/2017,13:00,40.707813,-73.96602,BROOKLYN,0.0,0.0,0,0,0,0,0,0,3617001,2017-02-16 13:00:00,2017-02-16T13:00,2017,2,1.9,0.0,Cloudy
09/23/2017,23:00,40.598553,-73.997345,BROOKLYN,1.0,0.0,0,0,0,0,1,0,3755660,2017-09-23 23:00:00,2017-09-23T23:00,2017,9,21.1,0.0,Clear
01/04/2017,6:00,40.62558,-74.00085,BROOKLYN,0.0,0.0,0,0,0,0,0,0,3592029,2017-01-04 06:00:00,2017-01-04T06:00,2017,1,5.7,0.0,Cloudy
10/12/2017,17:00,40.6686,-73.91813,BROOKLYN,0.0,0.0,0,0,0,0,0,0,3768366,2017-10-12 17:00:00,2017-10-12T17:00,2017,10,16.1,0.0,Cloudy
01/08/2017,1:00,40.678894,-73.90347,BROOKLYN,1.0,0.0,1,0,0,0,0,0,3597297,2017-01-08 01:00:00,2017-01-08T01:00,2017,1,-8.5,0.0,Clear
10/21/2017,8:00,40.663544,-73.86949,BROOKLYN,1.0,0.0,0,0,0,0,1,0,3775237,2017-10-21 08:00:00,2017-10-21T08:00,2017,10,14.5,0.0,Clear
07/21/2017,12:00,40.688,-73.99757,BROOKLYN,0.0,0.0,0,0,0,0,0,0,3715891,2017-07-21 12:00:00,2017-07-21T12:00,2017,7,30.5,0.0,Cloudy
04/17/2017,0:00,40.69728,-73.987045,BROOKLYN,1.0,0.0,0,0,1,0,0,0,3652510,2017-04-17 00:00:00,2017-04-17T00:00,2017,4,18.1,0.1,Drizzle
06/27/2017,0:00,40.675297,-73.87268,BROOKLYN,1.0,0.0,0,0,0,0,1,0,3703483,2017-06-27 00:00:00,2017-06-27T00:00,2017,6,16.7,0.0,Clear
06/11/2017,0:00,40.632954,-73.90416,BROOKLYN,2.0,0.0,0,0,0,0,2,0,3688476,2017-06-11 00:00:00,2017-06-11T00:00,2017,6,21.4,0.0,Clear
08/22/2017,12:00,40.66767,-73.92845,BROOKLYN,0.0,0.0,0,0,0,0,0,0,3736275,2017-08-22 12:00:00,2017-08-22T12:00,2017,8,29.4,0.0,Cloudy
09/10/2017,4:00,40.650703,-73.920586,BROOKLYN,2.0,0.0,0,0,0,0,2,0,3750204,2017-09-10 04:00:00,2017-09-10T04:00,2017,9,13.4,0.0,Clear
10/28/2017,0:00,40.66322,-73.893654,BROOKLYN,1.0,0.0,0,0,0,0,1,0,3779339,2017-10-28 00:00:00,2017-10-28T00:00,2017,10,13.3,0.0,Clear
11/22/2017,16:00,40.652954,-74.00215,BROOKLYN,1.0,0.0,0,0,1,0,0,0,3796206,2017-11-22 16:00:00,2017-11-22T16:00,2017,11,7.4,0.0,Clear
08/20/2017,16:00,40.690346,-73.9603,BROOKLYN,1.0,0.0,0,0,0,0,1,0,3734352,2017-08-20 16:00:00,2017-08-20T16:00,2017,8,28.1,0.0,Clear
08/04/2017,18:00,40.588737,-73.9642,BROOKLYN,0.0,0.0,0,0,0,0,0,0,3725916,2017-08-04 18:00:00,2017-08-04T18:00,2017,8,23.8,0.0,Clear
12/28/2017,21:00,40.699917,-73.9554,BROOKLYN,1.0,0.0,1,0,0,0,0,0,3816690,2017-12-28 21:00:00,2017-12-28T21:00,2017,12,-9.8,0.0,Clear
08/23/2017,21:00,40.63178,-73.945625,BROOKLYN,2.0,0.0,0,0,0,0,2,0,3736086,2017-08-23 21:00:00,2017-08-23T21:00,2017,8,21.1,0.0,Clear
03/13/2017,8:00,40.65594,-73.95515,BROOKLYN,1.0,0.0,0,0,0,0,1,0,3631356,2017-03-13 08:00:00,2017-03-13T08:00,2017,3,-5.2,0.0,Cloudy
06/21/2017,23:00,40.575428,-73.977875,BROOKLYN,2.0,0.0,0,0,0,0,2,0,3696567,2017-06-21 23:00:00,2017-06-21T23:00,2017,6,20.6,0.0,Clear
08/06/2017,2:00,40.681713,-73.91152,BROOKLYN,1.0,0.0,0,0,0,0,1,0,3726377,2017-08-06 02:00:00,2017-08-06T02:00,2017,8,18.2,0.0,Cloudy
08/20/2017,19:00,40.59938,-73.95141,BROOKLYN,0.0,0.0,0,0,0,0,0,0,3741810,2017-08-20 19:00:00,2017-08-20T19:00,2017,8,24.6,0.0,Clear
03/21/2017,18:00,40.60895,-73.95542,BROOKLYN,1.0,0.0,0,0,0,0,1,0,3636437,2017-03-21 18:00:00,2017-03-21T18:00,2017,3,10.1,0.0,Clear
06/14/2017,18:00,40.65121,-73.95893,BROOKLYN,1.0,0.0,0,0,1,0,0,0,3692151,2017-06-14 18:00:00,2017-06-14T18:00,2017,6,21.6,0.0,Clear
11/21/2017,8:00,40.656864,-73.9981,BROOKLYN,1.0,0.0,0,0,1,0,0,0,3794713,2017-11-21 08:00:00,2017-11-21T08:00,2017,11,7.2,0.0,Clear
04/02/2017,19:00,40.675106,-73.90438,BROOKLYN,1.0,0.0,1,0,0,0,0,0,3643720,2017-04-02 19:00:00,2017-04-02T19:00,2017,4,9.7,0.0,Cloudy
12/02/2017,0:00,40.697605,-73.92962,BROOKLYN,1.0,0.0,0,0,1,0,0,0,3803162,2017-12-02 00:00:00,2017-12-02T00:00,2017,12,2.1,0.0,Clear
06/26/2017,0:00,40.663555,-73.92136,BROOKLYN,1.0,0.0,0,0,0,0,1,0,3704769,2017-06-26 00:00:00,2017-06-26T00:00,2017,6,20.8,0.0,Clear
01/25/2017,20:00,40.63178,-73.945625,BROOKLYN,1.0,0.0,0,0,1,0,0,0,3606158,2017-01-25 20:00:00,2017-01-25T20:00,2017,1,5.8,0.0,Cloudy
10/21/2017,2:00,40.62877,-73.91825,BROOKLYN,1.0,0.0,0,0,0,0,1,0,3775620,2017-10-21 02:00:00,2017-10-21T02:00,2017,10,12.8,0.0,Cloudy
12/21/2017,17:00,40.705887,-73.94297,BROOKLYN,1.0,0.0,0,0,1,0,0,0,3816235,2017-12-21 17:00:00,2017-12-21T17:00,2017,12,3.1,0.0,Clear
09/30/2017,23:00,40.67052,-73.95725,BROOKLYN,0.0,0.0,0,0,0,0,0,0,3760524,2017-09-30 23:00:00,2017-09-30T23:00,2017,9,11.7,0.0,Clear
10/01/2017,15:00,40.62893,-73.971375,BROOKLYN,1.0,0.0,0,0,0,0,1,0,3762561,2017-10-01 15:00:00,2017-10-01T15:00,2017,10,18.7,0.0,Clear
07/21/2017,15:00,40.633152,-73.97762,BROOKLYN,1.0,0.0,1,0,0,0,0,0,3717510,2017-07-21 15:00:00,2017-07-21T15:00,2017,7,32.0,0.0,Cloudy
06/03/2017,21:00,40.682163,-73.889015,BROOKLYN,1.0,0.0,0,0,1,0,0,0,3683969,2017-06-03 21:00:00,2017-06-03T21:00,2017,6,15.3,0.0,Clear
01/17/2017,19:00,40.609886,-73.98556,BROOKLYN,1.0,0.0,1,0,0,0,0,0,3600256,2017-01-17 19:00:00,2017-01-17T19:00,2017,1,4.9,0.3,Drizzle
08/20/2017,17:00,40.6955,-73.94165,BROOKLYN,1.0,0.0,0,0,1,0,0,0,3734520,2017-08-20 17:00:00,2017-08-20T17:00,2017,8,27.4,0.0,Clear
07/12/2017,9:00,40.66955,-73.94497,BROOKLYN,1.0,0.0,0,0,0,0,1,0,3709879,2017-07-12 09:00:00,2017-07-12T09:00,2017,7,27.4,0.0,Clear
03/29/2017,23:00,40.674145,-73.93062,BROOKLYN,1.0,0.0,0,0,0,0,1,0,3642020,2017-03-29 23:00:00,2017-03-29T23:00,2017,3,3.8,0.0,Clear
01/22/2017,23:00,40.660988,-73.889206,BROOKLYN,1.0,0.0,0,0,0,0,1,0,3602501,2017-01-22 23:00:00,2017-01-22T23:00,2017,1,6.3,0.0,Cloudy
12/24/2017,13:00,40.6988,-73.92762,BROOKLYN,0.0,0.0,0,0,0,0,0,0,3817930,2017-12-24 13:00:00,2017-12-24T13:00,2017,12,4.9,0.0,Cloudy
09/21/2017,21:00,40.643677,-73.970726,BROOKLYN,1.0,0.0,0,0,1,0,0,0,3755070,2017-09-21 21:00:00,2017-09-21T21:00,2017,9,21.0,0.0,Cloudy
05/07/2017,12:00,40.694275,-73.99243,BROOKLYN,1.0,0.0,1,0,0,0,0,0,3664789,2017-05-07 12:00:00,2017-05-07T12:00,2017,5,12.9,0.1,Drizzle
04/27/2017,10:00,40.629505,-73.94416,BROOKLYN,1.0,0.0,0,0,0,0,1,0,3660650,2017-04-27 10:00:00,2017-04-27T10:00,2017,4,15.4,0.0,Cloudy
08/07/2017,0:00,40.649025,-73.89635,BROOKLYN,0.0,0.0,0,0,0,0,0,0,3726767,2017-08-07 00:00:00,2017-08-07T00:00,2017,8,18.3,0.0,Cloudy
03/02/2017,13:00,40.673237,-73.946884,BROOKLYN,1.0,0.0,1,0,0,0,0,0,3630523,2017-03-02 13:00:00,2017-03-02T13:00,2017,3,7.7,0.0,Clear
07/17/2017,9:00,40.65696,-73.89688,BROOKLYN,1.0,0.0,1,0,0,0,0,0,3712690,2017-07-17 09:00:00,2017-07-17T09:00,2017,7,26.1,0.0,Cloudy
01/25/2017,20:00,40.63115,-74.00846,BROOKLYN,1.0,0.0,1,0,0,0,0,0,3604847,2017-01-25 20:00:00,2017-01-25T20:00,2017,1,5.8,0.0,Cloudy
12/20/2017,23:00,40.635983,-74.01824,BROOKLYN,0.0,0.0,0,0,0,0,0,0,3815392,2017-12-20 23:00:00,2017-12-20T23:00,2017,12,-0.6,0.0,Clear
07/14/2017,16:00,40.679134,-73.94021,BROOKLYN,0.0,0.0,0,0,0,0,0,0,3712330,2017-07-14 16:00:00,2017-07-14T16:00,2017,7,23.1,0.0,Cloudy
04/29/2017,14:00,40.63267,-73.93102,BROOKLYN,1.0,0.0,0,0,1,0,0,0,3660431,2017-04-29 14:00:00,2017-04-29T14:00,2017,4,26.0,0.0,Cloudy
12/30/2017,21:00,40.68783,-73.93004,BROOKLYN,1.0,0.0,0,0,0,0,1,0,3820829,2017-12-30 21:00:00,2017-12-30T21:00,2017,12,-6.6,0.0,Clear
11/08/2017,8:00,40.67731,-73.89913,BROOKLYN,1.0,0.0,0,0,0,0,1,0,3785764,2017-11-08 08:00:00,2017-11-08T08:00,2017,11,4.7,0.0,Cloudy
06/25/2017,19:00,40.57986,-73.96233,BROOKLYN,0.0,0.0,0,0,0,0,0,0,3699183,2017-06-25 19:00:00,2017-06-25T19:00,2017,6,22.9,0.0,Clear
02/07/2017,14:00,40.701077,-73.94043,BROOKLYN,1.0,0.0,1,0,0,0,0,0,3611979,2017-02-07 14:00:00,2017-02-07T14:00,2017,2,5.3,0.3,Drizzle
01/07/2017,7:00,40.617287,-73.97786,BROOKLYN,5.0,0.0,0,0,0,0,5,0,3613775,2017-01-07 07:00:00,2017-01-07T07:00,2017,1,-5.0,0.2,Light Snow
09/10/2017,2:00,40.582718,-73.956116,BROOKLYN,1.0,0.0,0,0,1,0,0,0,3747456,2017-09-10 02:00:00,2017-09-10T02:00,2017,9,14.5,0.0,Clear
07/05/2017,16:00,40.60023,-73.9956,BROOKLYN,1.0,0.0,1,0,0,0,0,0,3706531,2017-07-05 16:00:00,2017-07-05T16:00,2017,7,23.5,0.0,Clear
01/12/2017,17:00,40.683506,-73.97594,BROOKLYN,1.0,0.0,1,0,0,0,0,0,3600795,2017-01-12 17:00:00,2017-01-12T17:00,2017,1,15.0,0.0,Cloudy
07/30/2017,13:00,40.65616,-73.962105,BROOKLYN,1.0,0.0,0,0,1,0,0,0,3721471,2017-07-30 13:00:00,2017-07-30T13:00,2017,7,24.9,0.0,Clear
05/22/2017,9:00,40.65215,-73.90412,BROOKLYN,2.0,0.0,0,0,0,0,2,0,3675823,2017-05-22 09:00:00,2017-05-22T09:00,2017,5,12.9,0.4,Drizzle
06/25/2017,14:00,40.67973,-73.9374,BROOKLYN,0.0,0.0,0,0,0,0,0,0,3698477,2017-06-25 14:00:00,2017-06-25T14:00,2017,6,24.4,0.0,Clear
11/19/2017,18:00,40.639305,-73.95898,BROOKLYN,0.0,0.0,0,0,0,0,0,0,3793113,2017-11-19 18:00:00,2017-11-19T18:00,2017,11,6.1,0.0,Cloudy
09/27/2017,18:00,40.644432,-73.9296,BROOKLYN,1.0,0.0,0,0,0,0,1,0,3759637,2017-09-27 18:00:00,2017-09-27T18:00,2017,9,23.4,0.0,Clear
01/03/2017,17:00,40.644634,-73.943115,BROOKLYN,1.0,0.0,1,0,0,0,0,0,3592462,2017-01-03 17:00:00,2017-01-03T17:00,2017,1,6.7,0.8,Drizzle
01/07/2017,10:00,40.64994,-74.00172,BROOKLYN,0.0,0.0,0,0,0,0,0,0,3593491,2017-01-07 10:00:00,2017-01-07T10:00,2017,1,-5.3,0.4,Heavy Snow
07/14/2017,8:00,40.68662,-73.86916,BROOKLYN,1.0,0.0,1,0,0,0,0,0,3712661,2017-07-14 08:00:00,2017-07-14T08:00,2017,7,18.5,0.6,Drizzle
04/13/2017,22:00,40.68954,-73.971146,BROOKLYN,1.0,0.0,1,0,0,0,0,0,3650487,2017-04-13 22:00:00,2017-04-13T22:00,2017,4,10.2,0.0,Cloudy
01/20/2017,18:00,40.66112,-73.920135,BROOKLYN,1.0,0.0,1,0,0,0,0,0,3602564,2017-01-20 18:00:00,2017-01-20T18:00,2017,1,4.8,0.5,Drizzle
05/12/2017,11:00,40.6338,-73.8897,BROOKLYN,1.0,0.0,0,0,0,0,1,0,3669571,2017-05-12 11:00:00,2017-05-12T11:00,2017,5,13.7,0.0,Cloudy
09/11/2017,8:00,40.625984,-74.001526,BROOKLYN,3.0,0.0,0,0,0,0,3,0,3753599,2017-09-11 08:00:00,2017-09-11T08:00,2017,9,16.4,0.0,Cloudy
07/11/2017,15:00,40.664097,-73.90932,BROOKLYN,1.0,0.0,1,0,0,0,0,0,3709540,2017-07-11 15:00:00,2017-07-11T15:00,2017,7,23.9,1.9,Light Rain
04/07/2017,7:00,40.682186,-73.86982,BROOKLYN,3.0,0.0,0,0,0,0,3,0,3646787,2017-04-07 07:00:00,2017-04-07T07:00,2017,4,7.7,0.0,Clear
05/20/2017,11:00,40.60594,-73.97929,BROOKLYN,1.0,0.0,0,0,0,0,1,0,3673933,2017-05-20 11:00:00,2017-05-20T11:00,2017,5,14.9,0.0,Cloudy
08/22/2017,18:00,40.580105,-73.96078,BROOKLYN,1.0,0.0,0,0,1,0,0,0,3735767,2017-08-22 18:00:00,2017-08-22T18:00,2017,8,27.9,0.0,Cloudy
05/07/2017,15:00,40.693703,-73.955986,BROOKLYN,0.0,0.0,0,0,0,0,0,0,3664921,2017-05-07 15:00:00,2017-05-07T15:00,2017,5,12.3,0.0,Cloudy
07/18/2017,17:00,40.579197,-73.98195,BROOKLYN,1.0,0.0,1,0,0,0,0,0,3726216,2017-07-18 17:00:00,2017-07-18T17:00,2017,7,25.0,0.0,Clear
12/17/2017,21:00,40.6481,-73.91474,BROOKLYN,1.0,0.0,0,0,0,0,1,0,3811751,2017-12-17 21:00:00,2017-12-17T21:00,2017,12,0.4,0.0,Cloudy
10/15/2017,0:00,40.66843,-73.91919,BROOKLYN,1.0,0.0,1,0,0,0,0,0,3770498,2017-10-15 00:00:00,2017-10-15T00:00,2017,10,18.8,0.0,Cloudy
01/17/2017,11:00,40.668377,-73.92012,BROOKLYN,1.0,0.0,0,0,0,0,1,0,3599988,2017-01-17 11:00:00,2017-01-17T11:00,2017,1,4.7,0.0,Cloudy
07/28/2017,15:00,40.636078,-74.019714,BROOKLYN,1.0,0.0,0,0,0,0,1,0,3720078,2017-07-28 15:00:00,2017-07-28T15:00,2017,7,26.0,0.0,Cloudy
12/02/2017,19:00,40.711037,-73.96059,BROOKLYN,1.0,0.0,0,0,1,0,0,0,3802946,2017-12-02 19:00:00,2017-12-02T19:00,2017,12,4.8,0.0,Cloudy
01/11/2017,22:00,40.651466,-73.93618,BROOKLYN,1.0,0.0,1,0,0,0,0,0,3598311,2017-01-11 22:00:00,2017-01-11T22:00,2017,1,6.7,1.8,Light Rain
04/10/2017,8:00,40.643063,-73.95166,BROOKLYN,1.0,0.0,0,0,0,0,1,0,3650742,2017-04-10 08:00:00,2017-04-10T08:00,2017,4,12.1,0.0,Cloudy
01/24/2017,18:00,40.65487,-73.96191,BROOKLYN,1.0,0.0,1,0,0,0,0,0,3612817,2017-01-24 18:00:00,2017-01-24T18:00,2017,1,2.4,0.7,Drizzle
01/11/2017,15:00,40.66059,-73.931335,BROOKLYN,1.0,0.0,1,0,0,0,0,0,3600771,2017-01-11 15:00:00,2017-01-11T15:00,2017,1,10.3,0.0,Cloudy
10/19/2017,15:00,40.629166,-73.947334,BROOKLYN,1.0,0.0,1,0,0,0,0,0,3776625,2017-10-19 15:00:00,2017-10-19T15:00,2017,10,21.3,0.0,Clear
09/18/2017,7:00,40.664463,-73.88717,BROOKLYN,0.0,0.0,0,0,0,0,0,0,3752778,2017-09-18 07:00:00,2017-09-18T07:00,2017,9,20.5,0.0,Cloudy
01/07/2017,15:00,40.639633,-73.954185,BROOKLYN,3.0,0.0,0,0,0,0,3,0,3595779,2017-01-07 15:00:00,2017-01-07T15:00,2017,1,-5.3,0.8,Heavy Snow
07/12/2017,16:00,40.635372,-74.029144,BROOKLYN,0.0,0.0,0,0,0,0,0,0,3710462,2017-07-12 16:00:00,2017-07-12T16:00,2017,7,29.8,2.3,Light Rain
11/25/2017,1:00,40.5769,-73.962296,BROOKLYN,0.0,0.0,0,0,0,0,0,0,3797723,2017-11-25 01:00:00,2017-11-25T01:00,2017,11,5.4,0.0,Clear
08/30/2017,17:00,40.694622,-73.94038,BROOKLYN,1.0,0.0,1,0,0,0,0,0,3740854,2017-08-30 17:00:00,2017-08-30T17:00,2017,8,24.6,0.0,Clear
06/27/2017,16:00,40.6475,-73.943436,BROOKLYN,2.0,0.0,0,0,0,0,2,0,3700567,2017-06-27 16:00:00,2017-06-27T16:00,2017,6,20.9,0.0,Cloudy
01/28/2017,2:00,40.639614,-73.93202,BROOKLYN,1.0,0.0,0,0,0,0,1,0,3606193,2017-01-28 02:00:00,2017-01-28T02:00,2017,1,0.2,0.0,Clear
11/02/2017,18:00,40.68327,-73.95016,BROOKLYN,1.0,0.0,0,0,0,0,1,0,3782405,2017-11-02 18:00:00,2017-11-02T18:00,2017,11,18.6,0.0,Clear
11/15/2017,15:00,40.609352,-73.93194,BROOKLYN,0.0,0.0,0,0,0,0,0,0,3791722,2017-11-15 15:00:00,2017-11-15T15:00,2017,11,9.0,0.0,Cloudy
06/02/2017,10:00,40.639614,-73.93202,BROOKLYN,0.0,0.0,0,0,0,0,0,0,3687981,2017-06-02 10:00:00,2017-06-02T10:00,2017,6,20.1,0.0,Cloudy
02/16/2017,17:00,40.676342,-73.910934,BROOKLYN,0.0,0.0,0,0,0,0,0,0,3617327,2017-02-16 17:00:00,2017-02-16T17:00,2017,2,-0.3,0.0,Clear
11/10/2017,0:00,40.710785,-73.95995,BROOKLYN,1.0,0.0,0,0,1,0,0,0,3789566,2017-11-10 00:00:00,2017-11-10T00:00,2017,11,10.7,0.0,Cloudy
06/11/2017,20:00,40.64208,-73.91967,BROOKLYN,1.0,0.0,0,0,0,0,1,0,3688508,2017-06-11 20:00:00,2017-06-11T20:00,2017,6,27.4,0.0,Clear
11/24/2017,21:00,40.610523,-73.981186,BROOKLYN,0.0,0.0,0,0,0,0,0,0,3796699,2017-11-24 21:00:00,2017-11-24T21:00,2017,11,7.3,0.0,Clear
01/12/2017,13:00,40.681858,-73.87853,BROOKLYN,0.0,0.0,0,0,0,0,0,0,3597171,2017-01-12 13:00:00,2017-01-12T13:00,2017,1,15.5,0.3,Drizzle
08/23/2017,14:00,40.67255,-73.91024,BROOKLYN,1.0,0.0,0,0,0,0,1,0,3737698,2017-08-23 14:00:00,2017-08-23T14:00,2017,8,28.1,0.0,Cloudy
08/09/2017,0:00,40.644672,-73.92573,BROOKLYN,0.0,0.0,0,0,0,0,0,0,3728493,2017-08-09 00:00:00,2017-08-09T00:00,2017,8,19.5,0.0,Clear
05/07/2017,14:00,40.701527,-73.986755,BROOKLYN,1.0,0.0,0,0,1,0,0,0,3664857,2017-05-07 14:00:00,2017-05-07T14:00,2017,5,13.2,0.0,Cloudy
06/14/2017,18:00,40.654396,-73.95961,BROOKLYN,1.0,0.0,1,0,0,0,0,0,3691329,2017-06-14 18:00:00,2017-06-14T18:00,2017,6,21.6,0.0,Clear
10/30/2017,16:00,40.622013,-74.01641,BROOKLYN,1.0,0.0,0,0,1,0,0,0,3780228,2017-10-30 16:00:00,2017-10-30T16:00,2017,10,13.1,0.0,Clear
01/03/2017,18:00,40.63868,-73.91682,BROOKLYN,1.0,0.0,1,0,0,0,0,0,3591789,2017-01-03 18:00:00,2017-01-03T18:00,2017,1,6.5,0.0,Cloudy
03/09/2017,13:00,40.643253,-73.90132,BROOKLYN,1.0,0.0,1,0,0,0,0,0,3629276,2017-03-09 13:00:00,2017-03-09T13:00,2017,3,14.2,0.0,Clear
09/02/2017,22:00,40.673843,-73.92509,BROOKLYN,1.0,0.0,0,0,0,0,1,0,3744723,2017-09-02 22:00:00,2017-09-02T22:00,2017,9,15.7,1.4,Light Rain
05/23/2017,21:00,40.657753,-73.89612,BROOKLYN,3.0,0.0,0,0,0,0,3,0,3676685,2017-05-23 21:00:00,2017-05-23T21:00,2017,5,14.5,0.0,Cloudy
12/24/2017,17:00,40.593327,-73.964645,BROOKLYN,1.0,0.0,0,0,1,0,0,0,3817910,2017-12-24 17:00:00,2017-12-24T17:00,2017,12,3.7,0.0,Cloudy
09/30/2017,13:00,40.681103,-74.00584,BROOKLYN,0.0,0.0,0,0,0,0,0,0,3760473,2017-09-30 13:00:00,2017-09-30T13:00,2017,9,16.4,0.1,Drizzle
12/21/2017,17:00,40.621162,-73.939995,BROOKLYN,1.0,0.0,1,0,0,0,0,0,3815291,2017-12-21 17:00:00,2017-12-21T17:00,2017,12,3.1,0.0,Clear
08/23/2017,17:00,40.615894,-73.92947,BROOKLYN,2.0,0.0,0,0,0,0,2,0,3737020,2017-08-23 17:00:00,2017-08-23T17:00,2017,8,27.3,0.0,Clear
10/28/2017,10:00,40.65626,-73.950165,BROOKLYN,1.0,0.0,1,0,0,0,0,0,3787696,2017-10-28 10:00:00,2017-10-28T10:00,2017,10,18.0,0.0,Clear
03/22/2017,8:00,40.727962,-73.94918,BROOKLYN,0.0,0.0,0,0,0,0,0,0,3636895,2017-03-22 08:00:00,2017-03-22T08:00,2017,3,2.0,0.0,Clear
01/26/2017,10:00,40.724335,-73.94909,BROOKLYN,1.0,0.0,1,0,0,0,0,0,3604732,2017-01-26 10:00:00,2017-01-26T10:00,2017,1,7.0,0.8,Drizzle
12/01/2017,14:00,40.626457,-73.918,BROOKLYN,1.0,0.0,1,0,0,0,0,0,3802957,2017-12-01 14:00:00,2017-12-01T14:00,2017,12,10.9,0.0,Clear
12/28/2017,20:00,40.630096,-73.94476,BROOKLYN,0.0,0.0,0,0,0,0,0,0,3820570,2017-12-28 20:00:00,2017-12-28T20:00,2017,12,-8.9,0.0,Clear
08/23/2017,0:00,40.645485,-73.94321,BROOKLYN,1.0,0.0,1,0,0,0,0,0,3738164,2017-08-23 00:00:00,2017-08-23T00:00,2017,8,23.4,5.4,Heavy Rain
09/30/2017,14:00,40.69946,-73.944214,BROOKLYN,1.0,0.0,0,0,0,0,1,0,3773135,2017-09-30 14:00:00,2017-09-30T14:00,2017,9,16.2,0.1,Drizzle
06/23/2017,15:00,40.686085,-73.982666,BROOKLYN,1.0,0.0,0,0,0,0,1,0,3698199,2017-06-23 15:00:00,2017-06-23T15:00,2017,6,28.0,0.0,Cloudy
11/22/2017,11:00,40.6094,-73.967674,BROOKLYN,0.0,0.0,0,0,0,0,0,0,3797901,2017-11-22 11:00:00,2017-11-22T11:00,2017,11,11.0,0.0,Cloudy
07/25/2017,8:00,40.60507,-73.964355,BROOKLYN,0.0,0.0,0,0,0,0,0,0,3718279,2017-07-25 08:00:00,2017-07-25T08:00,2017,7,18.6,0.9,Drizzle
06/21/2017,17:00,40.61409,-73.95126,BROOKLYN,0.0,0.0,0,0,0,0,0,0,3698828,2017-06-21 17:00:00,2017-06-21T17:00,2017,6,25.0,0.0,Clear
04/29/2017,20:00,40.666695,-73.961624,BROOKLYN,0.0,0.0,0,0,0,0,0,0,3659734,2017-04-29 20:00:00,2017-04-29T20:00,2017,4,22.2,0.0,Cloudy
07/28/2017,15:00,40.726242,-73.9581,BROOKLYN,0.0,0.0,0,0,0,0,0,0,3721124,2017-07-28 15:00:00,2017-07-28T15:00,2017,7,26.1,0.0,Cloudy
01/16/2017,12:00,40.61977,-73.966194,BROOKLYN,0.0,0.0,0,0,0,0,0,0,3599282,2017-01-16 12:00:00,2017-01-16T12:00,2017,1,1.9,0.0,Clear
03/10/2017,16:00,40.650806,-73.94958,BROOKLYN,2.0,0.0,0,0,0,0,2,0,3630578,2017-03-10 16:00:00,2017-03-10T16:00,2017,3,4.0,0.0,Cloudy
09/28/2017,14:00,40.61403,-73.94931,BROOKLYN,2.0,0.0,0,0,0,0,2,0,3759707,2017-09-28 14:00:00,2017-09-28T14:00,2017,9,25.7,0.0,Clear
04/10/2017,0:00,40.73569,-73.95696,BROOKLYN,1.0,0.0,1,0,0,0,0,0,3648717,2017-04-10 00:00:00,2017-04-10T00:00,2017,4,7.4,0.0,Cloudy
10/13/2017,12:00,40.669273,-73.922554,BROOKLYN,1.0,0.0,1,0,0,0,0,0,3771037,2017-10-13 12:00:00,2017-10-13T12:00,2017,10,17.1,0.0,Cloudy
03/23/2017,20:00,40.65984,-73.866745,BROOKLYN,3.0,0.0,0,0,0,0,3,0,3638154,2017-03-23 20:00:00,2017-03-23T20:00,2017,3,1.7,0.0,Clear
01/03/2017,0:00,40.70621,-73.939606,BROOKLYN,1.0,0.0,0,0,1,0,0,0,3593006,2017-01-03 00:00:00,2017-01-03T00:00,2017,1,4.1,0.0,Cloudy
12/17/2017,10:00,40.646378,-73.97085,BROOKLYN,1.0,0.0,1,0,0,0,0,0,3810971,2017-12-17 10:00:00,2017-12-17T10:00,2017,12,0.9,0.0,Cloudy
03/31/2017,22:00,40.639305,-73.95898,BROOKLYN,2.0,0.0,0,0,0,0,2,0,3645552,2017-03-31 22:00:00,2017-03-31T22:00,2017,3,4.6,1.8,Light Rain
06/02/2017,14:00,40.670513,-73.97857,BROOKLYN,1.0,0.0,0,0,1,0,0,0,3684241,2017-06-02 14:00:00,2017-06-02T14:00,2017,6,22.6,0.0,Clear
04/25/2017,0:00,40.684227,-73.93531,BROOKLYN,1.0,0.0,1,0,0,0,0,0,3658111,2017-04-25 00:00:00,2017-04-25T00:00,2017,4,10.7,0.3,Drizzle
10/30/2017,17:00,40.643887,-73.92274,BROOKLYN,0.0,0.0,0,0,0,0,0,0,3780336,2017-10-30 17:00:00,2017-10-30T17:00,2017,10,12.2,0.0,Clear
03/20/2017,22:00,40.611603,-73.97138,BROOKLYN,2.0,0.0,2,0,0,0,0,0,3636985,2017-03-20 22:00:00,2017-03-20T22:00,2017,3,3.3,0.0,Cloudy
10/05/2017,16:00,40.674267,-73.87069,BROOKLYN,0.0,0.0,0,0,0,0,0,0,3764345,2017-10-05 16:00:00,2017-10-05T16:00,2017,10,26.5,0.0,Cloudy
03/16/2017,15:00,40.610046,-74.00162,BROOKLYN,2.0,0.0,0,0,0,0,2,0,3633804,2017-03-16 15:00:00,2017-03-16T15:00,2017,3,1.8,0.0,Cloudy
02/23/2017,0:00,40.645428,-73.944176,BROOKLYN,1.0,0.0,0,0,0,0,1,0,3622154,2017-02-23 00:00:00,2017-02-23T00:00,2017,2,6.2,0.0,Clear
07/06/2017,0:00,40.582775,-73.960014,BROOKLYN,1.0,0.0,0,0,0,0,1,0,3706320,2017-07-06 00:00:00,2017-07-06T00:00,2017,7,20.8,0.0,Cloudy
05/08/2017,19:00,40.599716,-74.00213,BROOKLYN,1.0,0.0,0,0,0,0,1,0,3665866,2017-05-08 19:00:00,2017-05-08T19:00,2017,5,11.9,0.0,Cloudy
12/08/2017,21:00,40.665512,-73.926384,BROOKLYN,4.0,0.0,0,0,0,0,4,0,3806756,2017-12-08 21:00:00,2017-12-08T21:00,2017,12,1.9,0.0,Cloudy
10/24/2017,19:00,40.65578,-73.943954,BROOKLYN,0.0,0.0,0,0,0,0,0,0,3776331,2017-10-24 19:00:00,2017-10-24T19:00,2017,10,18.9,4.2,Heavy Rain
01/05/2017,0:00,40.640625,-74.014984,BROOKLYN,0.0,0.0,0,0,0,0,0,0,3592465,2017-01-05 00:00:00,2017-01-05T00:00,2017,1,-0.3,0.0,Clear
02/02/2017,14:00,40.589348,-73.941765,BROOKLYN,1.0,0.0,0,0,0,0,1,0,3611995,2017-02-02 14:00:00,2017-02-02T14:00,2017,2,6.1,0.0,Cloudy
01/26/2017,16:00,40.590294,-73.952866,BROOKLYN,1.0,0.0,1,0,0,0,0,0,3604976,2017-01-26 16:00:00,2017-01-26T16:00,2017,1,8.5,0.0,Cloudy
07/09/2017,20:00,40.685406,-73.97525,BROOKLYN,1.0,0.0,0,0,1,0,0,0,3707842,2017-07-09 20:00:00,2017-07-09T20:00,2017,7,21.4,0.0,Clear
10/10/2017,12:00,40.65034,-73.97462,BROOKLYN,1.0,0.0,1,0,0,0,0,0,3767370,2017-10-10 12:00:00,2017-10-10T12:00,2017,10,25.3,0.0,Clear
01/10/2017,23:00,40.713306,-73.95835,BROOKLYN,1.0,0.0,0,0,0,0,1,0,3597317,2017-01-10 23:00:00,2017-01-10T23:00,2017,1,4.2,0.0,Cloudy
04/03/2017,16:00,40.64275,-73.90378,BROOKLYN,1.0,0.0,0,0,0,0,1,0,3644515,2017-04-03 16:00:00,2017-04-03T16:00,2017,4,10.4,0.0,Cloudy
04/09/2017,14:00,40.63524,-73.967636,BROOKLYN,2.0,0.0,2,0,0,0,0,0,3648410,2017-04-09 14:00:00,2017-04-09T14:00,2017,4,13.7,0.0,Clear
05/03/2017,16:00,40.70623,-73.95094,BROOKLYN,1.0,0.0,1,0,0,0,0,0,3667244,2017-05-03 16:00:00,2017-05-03T16:00,2017,5,16.5,0.0,Clear
05/02/2017,18:00,40.610588,-74.01274,BROOKLYN,0.0,0.0,0,0,0,0,0,0,3662391,2017-05-02 18:00:00,2017-05-02T18:00,2017,5,19.2,0.0,Clear
11/29/2017,13:00,40.725754,-73.94316,BROOKLYN,1.0,0.0,0,0,1,0,0,0,3800028,2017-11-29 13:00:00,2017-11-29T13:00,2017,11,15.5,0.0,Clear
01/05/2017,22:00,40.574287,-73.98869,BROOKLYN,0.0,0.0,0,0,0,0,0,0,3594578,2017-01-05 22:00:00,2017-01-05T22:00,2017,1,-0.6,0.1,Light Snow
03/31/2017,11:00,40.576572,-73.976494,BROOKLYN,0.0,0.0,0,0,0,0,0,0,3644907,2017-03-31 11:00:00,2017-03-31T11:00,2017,3,5.0,1.1,Drizzle
09/15/2017,13:00,40.591583,-73.90245,BROOKLYN,1.0,0.0,0,0,1,0,0,0,3752653,2017-09-15 13:00:00,2017-09-15T13:00,2017,9,24.8,0.0,Clear
02/05/2017,23:00,40.590305,-73.92232,BROOKLYN,2.0,0.0,0,0,0,0,2,0,3612793,2017-02-05 23:00:00,2017-02-05T23:00,2017,2,2.7,0.0,Clear
08/27/2017,16:00,40.620434,-74.024475,BROOKLYN,3.0,0.0,0,0,0,0,3,0,3738930,2017-08-27 16:00:00,2017-08-27T16:00,2017,8,22.3,0.0,Cloudy
07/20/2017,12:00,40.69529,-73.94339,BROOKLYN,1.0,0.0,0,0,1,0,0,0,3715533,2017-07-20 12:00:00,2017-07-20T12:00,2017,7,32.0,0.0,Clear
11/15/2017,9:00,40.699413,-73.95902,BROOKLYN,0.0,0.0,0,0,0,0,0,0,3790734,2017-11-15 09:00:00,2017-11-15T09:00,2017,11,4.9,0.0,Clear
05/31/2017,7:00,40.734337,-73.952354,BROOKLYN,1.0,0.0,0,0,0,0,1,0,3681648,2017-05-31 07:00:00,2017-05-31T07:00,2017,5,14.9,0.0,Cloudy
05/20/2017,10:00,40.603004,-73.93933,BROOKLYN,1.0,0.0,0,0,0,0,1,0,3676449,2017-05-20 10:00:00,2017-05-20T10:00,2017,5,15.4,0.0,Cloudy
06/13/2017,17:00,40.66919,-73.99682,BROOKLYN,1.0,0.0,0,0,0,0,1,0,3690460,2017-06-13 17:00:00,2017-06-13T17:00,2017,6,25.5,0.0,Cloudy
05/23/2017,17:00,40.680504,-73.92857,BROOKLYN,2.0,0.0,2,0,0,0,0,0,3680632,2017-05-23 17:00:00,2017-05-23T17:00,2017,5,18.1,0.0,Cloudy
10/17/2017,14:00,40.695827,-73.98199,BROOKLYN,0.0,0.0,0,0,0,0,0,0,3771208,2017-10-17 14:00:00,2017-10-17T14:00,2017,10,13.5,0.0,Clear
02/28/2017,9:00,40.662,-73.91657,BROOKLYN,0.0,0.0,0,0,0,0,0,0,3623619,2017-02-28 09:00:00,2017-02-28T09:00,2017,2,8.4,0.0,Cloudy
07/03/2017,0:00,40.592968,-73.9482,BROOKLYN,0.0,0.0,0,0,0,0,0,0,3703757,2017-07-03 00:00:00,2017-07-03T00:00,2017,7,23.7,0.0,Cloudy
12/22/2017,14:00,40.66919,-73.99682,BROOKLYN,0.0,0.0,0,0,0,0,0,0,3816428,2017-12-22 14:00:00,2017-12-22T14:00,2017,12,8.7,0.0,Cloudy
07/19/2017,13:00,40.604282,-73.97305,BROOKLYN,0.0,0.0,0,0,0,0,0,0,3714519,2017-07-19 13:00:00,2017-07-19T13:00,2017,7,28.5,0.0,Clear
08/18/2017,21:00,40.67174,-73.954704,BROOKLYN,4.0,0.0,0,0,0,0,4,0,3733191,2017-08-18 21:00:00,2017-08-18T21:00,2017,8,24.2,0.4,Drizzle
07/04/2017,19:00,40.66283,-73.92615,BROOKLYN,1.0,0.0,0,0,0,0,1,0,3705305,2017-07-04 19:00:00,2017-07-04T19:00,2017,7,24.7,0.0,Clear
04/08/2017,22:00,40.677357,-73.88687,BROOKLYN,0.0,0.0,0,0,0,0,0,0,3648536,2017-04-08 22:00:00,2017-04-08T22:00,2017,4,6.0,0.0,Clear
12/21/2017,15:00,40.61222,-73.918846,BROOKLYN,1.0,0.0,1,0,0,0,0,0,3818338,2017-12-21 15:00:00,2017-12-21T15:00,2017,12,3.9,0.0,Clear
05/19/2017,19:00,40.713078,-73.96408,BROOKLYN,1.0,0.0,0,0,0,0,1,0,3673460,2017-05-19 19:00:00,2017-05-19T19:00,2017,5,25.1,0.0,Cloudy
03/30/2017,0:00,40.70601,-73.935486,BROOKLYN,0.0,0.0,0,0,0,0,0,0,3642159,2017-03-30 00:00:00,2017-03-30T00:00,2017,3,2.9,0.0,Clear
08/01/2017,16:00,40.63447,-73.94012,BROOKLYN,2.0,0.0,0,0,0,0,2,0,3723180,2017-08-01 16:00:00,2017-08-01T16:00,2017,8,27.6,0.0,Clear
04/03/2017,16:00,40.60389,-73.95349,BROOKLYN,1.0,0.0,1,0,0,0,0,0,3645391,2017-04-03 16:00:00,2017-04-03T16:00,2017,4,9.4,0.0,Cloudy
10/16/2017,14:00,40.649254,-73.960846,BROOKLYN,1.0,0.0,1,0,0,0,0,0,3770839,2017-10-16 14:00:00,2017-10-16T14:00,2017,10,14.6,0.0,Cloudy
04/29/2017,20:00,40.690502,-73.92354,BROOKLYN,1.0,0.0,0,0,1,0,0,0,3661025,2017-04-29 20:00:00,2017-04-29T20:00,2017,4,22.4,0.0,Cloudy
12/15/2017,17:00,40.6545,-73.88222,BROOKLYN,4.0,0.0,0,0,0,0,4,0,3812479,2017-12-15 17:00:00,2017-12-15T17:00,2017,12,-3.1,0.7,Heavy Snow
04/16/2017,16:00,40.66916,-73.937904,BROOKLYN,0.0,0.0,0,0,0,0,0,0,3667594,2017-04-16 16:00:00,2017-04-16T16:00,2017,4,26.3,0.0,Cloudy
05/06/2017,5:00,40.642887,-73.95454,BROOKLYN,1.0,0.0,0,0,0,0,1,0,3664756,2017-05-06 05:00:00,2017-05-06T05:00,2017,5,14.3,0.0,Cloudy
03/16/2017,12:00,40.658234,-73.9321,BROOKLYN,0.0,0.0,0,0,0,0,0,0,3642264,2017-03-16 12:00:00,2017-03-16T12:00,2017,3,-0.4,0.0,Cloudy
12/29/2017,6:00,40.66575,-73.97923,BROOKLYN,2.0,0.0,0,0,0,0,2,0,3817066,2017-12-29 06:00:00,2017-12-29T06:00,2017,12,-10.6,0.0,Cloudy
02/12/2017,12:00,40.660633,-73.9308,BROOKLYN,1.0,0.0,1,0,0,0,0,0,3613970,2017-02-12 12:00:00,2017-02-12T12:00,2017,2,0.3,1.6,Heavy Snow
09/10/2017,6:00,40.679455,-73.91169,BROOKLYN,0.0,0.0,0,0,0,0,0,0,3746629,2017-09-10 06:00:00,2017-09-10T06:00,2017,9,13.0,0.0,Clear
09/17/2017,11:00,40.638172,-73.98526,BROOKLYN,0.0,0.0,0,0,0,0,0,0,3753349,2017-09-17 11:00:00,2017-09-17T11:00,2017,9,24.5,0.1,Drizzle
03/21/2017,16:00,40.708702,-73.960915,BROOKLYN,1.0,0.0,0,0,0,0,1,0,3637046,2017-03-21 16:00:00,2017-03-21T16:00,2017,3,13.7,0.0,Clear
08/16/2017,15:00,40.60961,-74.01258,BROOKLYN,1.0,0.0,0,0,0,0,1,0,3732062,2017-08-16 15:00:00,2017-08-16T15:00,2017,8,27.2,0.0,Cloudy
10/20/2017,14:00,40.650772,-74.01519,BROOKLYN,1.0,0.0,0,0,0,0,1,0,3773268,2017-10-20 14:00:00,2017-10-20T14:00,2017,10,22.0,0.0,Clear
08/29/2017,17:00,40.635983,-73.97411,BROOKLYN,1.0,0.0,0,0,0,0,1,0,3742404,2017-08-29 17:00:00,2017-08-29T17:00,2017,8,17.6,1.0,Drizzle
09/19/2017,16:00,40.612946,-73.943756,BROOKLYN,2.0,0.0,0,0,0,0,2,0,3753723,2017-09-19 16:00:00,2017-09-19T16:00,2017,9,25.6,0.0,Cloudy
03/22/2017,12:00,40.69535,-73.91632,BROOKLYN,1.0,0.0,0,0,0,0,1,0,3639816,2017-03-22 12:00:00,2017-03-22T12:00,2017,3,-0.2,0.0,Clear
07/16/2017,22:00,40.672825,-73.93908,BROOKLYN,1.0,0.0,0,0,0,0,1,0,3714018,2017-07-16 22:00:00,2017-07-16T22:00,2017,7,22.8,0.0,Clear
11/05/2017,8:00,40.69006,-73.867836,BROOKLYN,0.0,0.0,0,0,0,0,0,0,3783733,2017-11-05 08:00:00,2017-11-05T08:00,2017,11,13.0,0.0,Cloudy
11/12/2017,20:00,40.674885,-73.927765,BROOKLYN,1.0,0.0,0,0,0,0,1,0,3792199,2017-11-12 20:00:00,2017-11-12T20:00,2017,11,4.9,0.0,Cloudy
02/16/2017,19:00,40.643074,-73.987335,BROOKLYN,1.0,0.0,1,0,0,0,0,0,3618711,2017-02-16 19:00:00,2017-02-16T19:00,2017,2,-1.0,0.0,Clear
01/19/2017,3:00,40.65533,-73.91601,BROOKLYN,0.0,0.0,0,0,0,0,0,0,3606136,2017-01-19 03:00:00,2017-01-19T03:00,2017,1,2.4,0.0,Cloudy
12/12/2017,18:00,40.726414,-73.94881,BROOKLYN,0.0,0.0,0,0,0,0,0,0,3808045,2017-12-12 18:00:00,2017-12-12T18:00,2017,12,4.6,0.0,Cloudy
09/18/2017,11:00,40.641987,-74.01724,BROOKLYN,0.0,0.0,0,0,0,0,0,0,3752490,2017-09-18 11:00:00,2017-09-18T11:00,2017,9,22.8,0.1,Drizzle
06/30/2017,21:00,40.707333,-73.94321,BROOKLYN,1.0,0.0,0,0,1,0,0,0,3703877,2017-06-30 21:00:00,2017-06-30T21:00,2017,6,25.8,0.0,Cloudy
10/18/2017,12:00,40.6071,-73.97267,BROOKLYN,2.0,0.0,0,0,0,0,2,0,3772038,2017-10-18 12:00:00,2017-10-18T12:00,2017,10,18.2,0.0,Clear
10/08/2017,3:00,40.69977,-73.98294,BROOKLYN,1.0,0.0,0,0,1,0,0,0,3764807,2017-10-08 03:00:00,2017-10-08T03:00,2017,10,22.1,0.0,Cloudy
08/12/2017,15:00,40.651054,-74.01112,BROOKLYN,3.0,0.0,0,0,0,0,3,0,3729450,2017-08-12 15:00:00,2017-08-12T15:00,2017,8,23.6,0.0,Cloudy
10/04/2017,0:00,40.67312,-73.96072,BROOKLYN,0.0,0.0,0,0,0,0,0,0,3767735,2017-10-04 00:00:00,2017-10-04T00:00,2017,10,13.8,0.0,Cloudy
09/05/2017,18:00,40.685207,-73.939735,BROOKLYN,1.0,0.0,0,0,1,0,0,0,3744270,2017-09-05 18:00:00,2017-09-05T18:00,2017,9,24.2,0.0,Clear
06/01/2017,9:00,40.72189,-73.96002,BROOKLYN,0.0,0.0,0,0,0,0,0,0,3681737,2017-06-01 09:00:00,2017-06-01T09:00,2017,6,19.9,0.0,Clear
11/21/2017,13:00,40.61384,-73.981445,BROOKLYN,0.0,0.0,0,0,0,0,0,0,3795614,2017-11-21 13:00:00,2017-11-21T13:00,2017,11,13.5,0.0,Cloudy
12/09/2017,17:00,40.64419,-73.93349,BROOKLYN,0.0,0.0,0,0,0,0,0,0,3806800,2017-12-09 17:00:00,2017-12-09T17:00,2017,12,0.2,1.1,Heavy Snow
11/22/2017,12:00,40.670544,-73.97191,BROOKLYN,0.0,0.0,0,0,0,0,0,0,3796137,2017-11-22 12:00:00,2017-11-22T12:00,2017,11,10.4,0.0,Cloudy
10/23/2017,0:00,40.64703,-74.012,BROOKLYN,1.0,0.0,1,0,0,0,0,0,3775479,2017-10-23 00:00:00,2017-10-23T00:00,2017,10,12.7,0.0,Clear
04/16/2017,6:00,40.61026,-73.983475,BROOKLYN,1.0,0.0,0,0,0,0,1,0,3652823,2017-04-16 06:00:00,2017-04-16T06:00,2017,4,14.1,0.0,Clear
01/04/2017,13:00,40.635185,-73.92862,BROOKLYN,2.0,0.0,0,0,0,0,2,0,3594600,2017-01-04 13:00:00,2017-01-04T13:00,2017,1,9.6,0.1,Drizzle
03/05/2017,10:00,40.66036,-73.881546,BROOKLYN,0.0,0.0,0,0,0,0,0,0,3627302,2017-03-05 10:00:00,2017-03-05T10:00,2017,3,-4.3,0.0,Clear
05/10/2017,9:00,40.651783,-73.9301,BROOKLYN,1.0,0.0,1,0,0,0,0,0,3667665,2017-05-10 09:00:00,2017-05-10T09:00,2017,5,12.7,0.0,Clear
03/19/2017,14:00,40.65416,-73.91353,BROOKLYN,1.0,0.0,0,0,0,0,1,0,3637429,2017-03-19 14:00:00,2017-03-19T14:00,2017,3,7.4,0.0,Clear
07/07/2017,21:00,40.64332,-74.01945,BROOKLYN,1.0,0.0,1,0,0,0,0,0,3706955,2017-07-07 21:00:00,2017-07-07T21:00,2017,7,22.7,0.7,Drizzle
04/07/2017,19:00,40.637196,-73.89759,BROOKLYN,0.0,0.0,0,0,0,0,0,0,3647813,2017-04-07 19:00:00,2017-04-07T19:00,2017,4,6.3,0.0,Cloudy
05/15/2017,18:00,40.670895,-73.91405,BROOKLYN,0.0,0.0,0,0,0,0,0,0,3671337,2017-05-15 18:00:00,2017-05-15T18:00,2017,5,16.7,0.0,Clear
04/23/2017,11:00,40.683823,-73.91206,BROOKLYN,1.0,0.0,1,0,0,0,0,0,3656564,2017-04-23 11:00:00,2017-04-23T11:00,2017,4,13.9,0.0,Cloudy
08/08/2017,20:00,40.61996,-74.02366,BROOKLYN,1.0,0.0,0,0,0,0,1,0,3727521,2017-08-08 20:00:00,2017-08-08T20:00,2017,8,21.3,0.0,Clear
12/28/2017,16:00,40.691376,-73.920235,BROOKLYN,0.0,0.0,0,0,0,0,0,0,3819550,2017-12-28 16:00:00,2017-12-28T16:00,2017,12,-7.5,0.0,Clear
10/05/2017,9:00,40.673965,-73.98571,BROOKLYN,1.0,0.0,1,0,0,0,0,0,3763815,2017-10-05 09:00:00,2017-10-05T09:00,2017,10,20.9,0.0,Clear
10/20/2017,8:00,40.671787,-73.95311,BROOKLYN,1.0,0.0,0,0,0,0,1,0,3774536,2017-10-20 08:00:00,2017-10-20T08:00,2017,10,15.7,0.0,Clear
08/21/2017,19:00,40.70651,-73.93196,BROOKLYN,1.0,0.0,0,0,1,0,0,0,3735081,2017-08-21 19:00:00,2017-08-21T19:00,2017,8,25.3,0.0,Clear
04/02/2017,15:00,40.673843,-73.92509,BROOKLYN,1.0,0.0,0,0,1,0,0,0,3654152,2017-04-02 15:00:00,2017-04-02T15:00,2017,4,15.1,0.0,Cloudy
05/20/2017,17:00,40.70235,-73.920265,BROOKLYN,0.0,0.0,0,0,0,0,0,0,3675521,2017-05-20 17:00:00,2017-05-20T17:00,2017,5,14.6,0.0,Cloudy
06/13/2017,17:00,40.661182,-73.8926,BROOKLYN,1.0,0.0,0,0,1,0,0,0,3690329,2017-06-13 17:00:00,2017-06-13T17:00,2017,6,25.4,0.0,Cloudy
12/27/2017,8:00,40.703873,-73.91614,BROOKLYN,0.0,0.0,0,0,0,0,0,0,3818490,2017-12-27 08:00:00,2017-12-27T08:00,2017,12,-6.8,0.0,Cloudy
10/26/2017,13:00,40.61217,-73.971504,BROOKLYN,1.0,0.0,1,0,0,0,0,0,3781428,2017-10-26 13:00:00,2017-10-26T13:00,2017,10,13.0,1.2,Drizzle
04/26/2017,22:00,40.677197,-73.92533,BROOKLYN,0.0,0.0,0,0,0,0,0,0,3659399,2017-04-26 22:00:00,2017-04-26T22:00,2017,4,13.5,0.0,Cloudy
01/11/2017,10:00,40.70377,-73.93116,BROOKLYN,1.0,0.0,1,0,0,0,0,0,3596821,2017-01-11 10:00:00,2017-01-11T10:00,2017,1,4.2,0.0,Clear
01/28/2017,14:00,40.657,-73.91403,BROOKLYN,1.0,0.0,0,0,0,0,1,0,3606861,2017-01-28 14:00:00,2017-01-28T14:00,2017,1,4.0,0.0,Cloudy
10/04/2017,15:00,40.630787,-73.99568,BROOKLYN,3.0,0.0,0,0,0,0,3,0,3763791,2017-10-04 15:00:00,2017-10-04T15:00,2017,10,22.2,0.0,Clear
09/18/2017,17:00,40.61415,-73.97291,BROOKLYN,1.0,0.0,0,0,1,0,0,0,3753117,2017-09-18 17:00:00,2017-09-18T17:00,2017,9,22.2,0.0,Cloudy
11/08/2017,9:00,40.64832,-73.907234,BROOKLYN,3.0,0.0,0,0,0,0,3,0,3786206,2017-11-08 09:00:00,2017-11-08T09:00,2017,11,5.6,0.0,Cloudy
04/12/2017,11:00,40.67363,-73.95401,BROOKLYN,0.0,0.0,0,0,0,0,0,0,3650053,2017-04-12 11:00:00,2017-04-12T11:00,2017,4,21.5,0.3,Drizzle
03/31/2017,16:00,40.608932,-73.97192,BROOKLYN,0.0,0.0,0,0,0,0,0,0,3643312,2017-03-31 16:00:00,2017-03-31T16:00,2017,3,6.0,2.2,Light Rain
09/27/2017,5:00,40.69808,-73.92536,BROOKLYN,1.0,0.0,1,0,0,0,0,0,3758834,2017-09-27 05:00:00,2017-09-27T05:00,2017,9,21.4,0.0,Cloudy
12/19/2017,17:00,40.64437,-73.93061,BROOKLYN,1.0,0.0,0,0,1,0,0,0,3813839,2017-12-19 17:00:00,2017-12-19T17:00,2017,12,9.4,0.0,Cloudy
07/19/2017,19:00,40.636982,-74.004425,BROOKLYN,0.0,0.0,0,0,0,0,0,0,3715608,2017-07-19 19:00:00,2017-07-19T19:00,2017,7,28.4,0.0,Clear
10/26/2017,0:00,40.596607,-73.99453,BROOKLYN,0.0,0.0,0,0,0,0,0,0,3777830,2017-10-26 00:00:00,2017-10-26T00:00,2017,10,14.4,0.0,Cloudy
09/05/2017,13:00,40.658497,-73.89727,BROOKLYN,1.0,0.0,0,0,0,0,1,0,3743922,2017-09-05 13:00:00,2017-09-05T13:00,2017,9,26.4,0.0,Clear
03/12/2017,0:00,40.675434,-73.97797,BROOKLYN,1.0,0.0,0,0,0,0,1,0,3631075,2017-03-12 00:00:00,2017-03-12T00:00,2017,3,-5.6,0.0,Clear
05/06/2017,0:00,40.630627,-73.926186,BROOKLYN,1.0,0.0,0,0,0,0,1,0,3667615,2017-05-06 00:00:00,2017-05-06T00:00,2017,5,14.5,3.0,Heavy Rain
07/15/2017,15:00,40.594074,-73.979965,BROOKLYN,1.0,0.0,0,0,1,0,0,0,3712617,2017-07-15 15:00:00,2017-07-15T15:00,2017,7,26.9,0.0,Clear
07/10/2017,14:00,40.666008,-73.8886,BROOKLYN,0.0,0.0,0,0,0,0,0,0,3709257,2017-07-10 14:00:00,2017-07-10T14:00,2017,7,26.3,0.2,Drizzle
10/15/2017,4:00,40.669067,-73.86555,BROOKLYN,0.0,0.0,0,0,0,0,0,0,3769702,2017-10-15 04:00:00,2017-10-15T04:00,2017,10,18.7,0.0,Cloudy
11/18/2017,12:00,40.631485,-74.01373,BROOKLYN,1.0,0.0,1,0,0,0,0,0,3797938,2017-11-18 12:00:00,2017-11-18T12:00,2017,11,9.2,0.0,Cloudy
03/01/2017,18:00,40.70631,-73.938484,BROOKLYN,0.0,0.0,0,0,0,0,0,0,3637275,2017-03-01 18:00:00,2017-03-01T18:00,2017,3,18.2,0.0,Cloudy
09/28/2017,22:00,40.70123,-73.91994,BROOKLYN,1.0,0.0,1,0,0,0,0,0,3762898,2017-09-28 22:00:00,2017-09-28T22:00,2017,9,16.5,0.0,Clear
12/18/2017,3:00,40.638603,-73.94827,BROOKLYN,1.0,0.0,0,0,0,0,1,0,3812784,2017-12-18 03:00:00,2017-12-18T03:00,2017,12,1.0,0.2,Drizzle
07/25/2017,15:00,40.6772,-73.94147,BROOKLYN,0.0,0.0,0,0,0,0,0,0,3718788,2017-07-25 15:00:00,2017-07-25T15:00,2017,7,21.6,0.0,Cloudy
04/01/2017,10:00,40.590748,-73.94872,BROOKLYN,0.0,0.0,0,0,0,0,0,0,3643963,2017-04-01 10:00:00,2017-04-01T10:00,2017,4,4.9,0.0,Cloudy
08/04/2017,13:00,40.701942,-73.914536,BROOKLYN,0.0,0.0,0,0,0,0,0,0,3726885,2017-08-04 13:00:00,2017-08-04T13:00,2017,8,25.3,0.0,Clear
10/10/2017,17:00,40.705074,-73.962166,BROOKLYN,0.0,0.0,0,0,0,0,0,0,3768440,2017-10-10 17:00:00,2017-10-10T17:00,2017,10,23.7,0.0,Clear
12/17/2017,5:00,40.636616,-73.94807,BROOKLYN,1.0,0.0,0,0,0,0,1,0,3811219,2017-12-17 05:00:00,2017-12-17T05:00,2017,12,-1.3,0.0,Cloudy
04/06/2017,8:00,40.605328,-73.990295,BROOKLYN,1.0,0.0,0,0,0,0,1,0,3646465,2017-04-06 08:00:00,2017-04-06T08:00,2017,4,5.1,0.2,Drizzle
08/11/2017,16:00,40.652374,-73.95502,BROOKLYN,0.0,0.0,0,0,0,0,0,0,3730648,2017-08-11 16:00:00,2017-08-11T16:00,2017,8,23.4,0.0,Cloudy
06/30/2017,8:00,40.71807,-73.96414,BROOKLYN,0.0,0.0,0,0,0,0,0,0,3702842,2017-06-30 08:00:00,2017-06-30T08:00,2017,6,25.6,0.0,Clear
05/20/2017,10:00,40.61739,-73.99194,BROOKLYN,1.0,0.0,1,0,0,0,0,0,3674105,2017-05-20 10:00:00,2017-05-20T10:00,2017,5,15.4,0.0,Cloudy
01/15/2017,18:00,40.638577,-73.90414,BROOKLYN,2.0,0.0,0,0,0,0,2,0,3598488,2017-01-15 18:00:00,2017-01-15T18:00,2017,1,0.2,0.0,Clear
01/22/2017,15:00,40.673843,-73.92509,BROOKLYN,3.0,0.0,0,0,0,0,3,0,3608135,2017-01-22 15:00:00,2017-01-22T15:00,2017,1,7.8,0.0,Cloudy
01/30/2017,18:00,40.642204,-73.991936,BROOKLYN,0.0,0.0,0,0,0,0,0,0,3607016,2017-01-30 18:00:00,2017-01-30T18:00,2017,1,0.5,0.0,Clear
08/20/2017,13:00,40.668667,-73.868324,BROOKLYN,0.0,0.0,0,0,0,0,0,0,3882180,2017-08-20 13:00:00,2017-08-20T13:00,2017,8,27.6,0.0,Cloudy
11/13/2017,8:00,40.661983,-73.90198,BROOKLYN,2.0,0.0,0,0,0,0,2,0,3789829,2017-11-13 08:00:00,2017-11-13T08:00,2017,11,5.9,0.8,Drizzle
04/13/2017,13:00,40.68876,-73.98085,BROOKLYN,1.0,0.0,1,0,0,0,0,0,3650986,2017-04-13 13:00:00,2017-04-13T13:00,2017,4,15.4,0.0,Clear
11/27/2017,15:00,40.691704,-73.919914,BROOKLYN,0.0,0.0,0,0,0,0,0,0,3800956,2017-11-27 15:00:00,2017-11-27T15:00,2017,11,9.5,0.0,Clear
01/09/2017,18:00,40.708626,-73.94513,BROOKLYN,1.0,0.0,1,0,0,0,0,0,3597609,2017-01-09 18:00:00,2017-01-09T18:00,2017,1,-9.6,0.0,Cloudy
06/19/2017,21:00,40.666595,-73.87176,BROOKLYN,0.0,0.0,0,0,0,0,0,0,3694662,2017-06-19 21:00:00,2017-06-19T21:00,2017,6,21.2,2.0,Light Rain
07/17/2017,10:00,40.691,-73.989334,BROOKLYN,0.0,0.0,0,0,0,0,0,0,3713552,2017-07-17 10:00:00,2017-07-17T10:00,2017,7,26.8,0.0,Cloudy
07/21/2017,16:00,40.688614,-73.989174,BROOKLYN,1.0,0.0,0,0,1,0,0,0,3716000,2017-07-21 16:00:00,2017-07-21T16:00,2017,7,28.9,0.0,Cloudy
10/19/2017,21:00,40.591106,-73.96513,BROOKLYN,1.0,0.0,0,0,0,0,1,0,3772975,2017-10-19 21:00:00,2017-10-19T21:00,2017,10,16.6,0.0,Cloudy
11/01/2017,19:00,40.605797,-73.95773,BROOKLYN,1.0,0.0,0,0,0,0,1,0,3781655,2017-11-01 19:00:00,2017-11-01T19:00,2017,11,15.6,0.0,Clear
11/06/2017,15:00,40.626457,-73.918,BROOKLYN,1.0,0.0,0,0,1,0,0,0,3786746,2017-11-06 15:00:00,2017-11-06T15:00,2017,11,17.3,0.5,Drizzle
03/09/2017,0:00,40.63889,-73.91204,BROOKLYN,0.0,0.0,0,0,0,0,0,0,3629281,2017-03-09 00:00:00,2017-03-09T00:00,2017,3,10.9,0.0,Clear
02/20/2017,20:00,40.665245,-73.87513,BROOKLYN,3.0,0.0,0,0,0,0,3,0,3619059,2017-02-20 20:00:00,2017-02-20T20:00,2017,2,4.9,0.0,Clear
11/11/2017,6:00,40.697254,-73.91563,BROOKLYN,1.0,0.0,0,0,1,0,0,0,3787926,2017-11-11 06:00:00,2017-11-11T06:00,2017,11,-3.2,0.0,Clear
04/19/2017,7:00,40.692772,-73.939125,BROOKLYN,1.0,0.0,0,0,1,0,0,0,3654717,2017-04-19 07:00:00,2017-04-19T07:00,2017,4,7.5,0.0,Clear
12/13/2017,7:00,40.61642,-73.9469,BROOKLYN,0.0,0.0,0,0,0,0,0,0,3808186,2017-12-13 07:00:00,2017-12-13T07:00,2017,12,-5.7,0.0,Clear
03/01/2017,19:00,40.670956,-73.91107,BROOKLYN,0.0,0.0,0,0,0,0,0,0,3624305,2017-03-01 19:00:00,2017-03-01T19:00,2017,3,17.2,0.0,Cloudy
08/03/2017,13:00,40.665874,-73.93142,BROOKLYN,0.0,0.0,0,0,0,0,0,0,3724964,2017-08-03 13:00:00,2017-08-03T13:00,2017,8,26.6,0.0,Clear
02/06/2017,9:00,40.649525,-73.98072,BROOKLYN,0.0,0.0,0,0,0,0,0,0,3610818,2017-02-06 09:00:00,2017-02-06T09:00,2017,2,3.1,0.0,Clear
06/17/2017,14:00,40.6715,-73.91505,BROOKLYN,1.0,0.0,0,0,0,0,1,0,3697427,2017-06-17 14:00:00,2017-06-17T14:00,2017,6,20.9,0.5,Drizzle
05/02/2017,10:00,40.643574,-73.97166,BROOKLYN,0.0,0.0,0,0,0,0,0,0,3662161,2017-05-02 10:00:00,2017-05-02T10:00,2017,5,22.0,0.0,Clear
03/11/2017,2:00,40.604195,-73.97218,BROOKLYN,0.0,0.0,0,0,0,0,0,0,3630004,2017-03-11 02:00:00,2017-03-11T02:00,2017,3,-6.5,0.0,Clear
09/18/2017,8:00,40.688553,-73.949905,BROOKLYN,0.0,0.0,0,0,0,0,0,0,3754951,2017-09-18 08:00:00,2017-09-18T08:00,2017,9,21.3,0.0,Cloudy
04/08/2017,14:00,40.604767,-73.99088,BROOKLYN,1.0,0.0,0,0,1,0,0,0,3648125,2017-04-08 14:00:00,2017-04-08T14:00,2017,4,12.3,0.0,Clear
04/08/2017,0:00,40.662014,-73.886826,BROOKLYN,1.0,0.0,1,0,0,0,0,0,3648378,2017-04-08 00:00:00,2017-04-08T00:00,2017,4,3.5,0.0,Clear
10/14/2017,19:00,40.63574,-74.02605,BROOKLYN,1.0,0.0,0,0,1,0,0,0,3769605,2017-10-14 19:00:00,2017-10-14T19:00,2017,10,18.9,0.0,Clear
03/09/2017,16:00,40.622013,-74.01641,BROOKLYN,2.0,0.0,0,0,0,0,2,0,3629235,2017-03-09 16:00:00,2017-03-09T16:00,2017,3,13.0,0.0,Clear
02/27/2017,19:00,40.612213,-73.99718,BROOKLYN,1.0,0.0,1,0,0,0,0,0,3630641,2017-02-27 19:00:00,2017-02-27T19:00,2017,2,8.0,0.0,Clear
09/11/2017,18:00,40.651657,-73.96131,BROOKLYN,1.0,0.0,0,0,0,0,1,0,3748294,2017-09-11 18:00:00,2017-09-11T18:00,2017,9,21.9,0.0,Clear
04/10/2017,17:00,40.676342,-73.910934,BROOKLYN,1.0,0.0,0,0,0,0,1,0,3652966,2017-04-10 17:00:00,2017-04-10T17:00,2017,4,17.1,0.0,Cloudy
06/10/2017,18:00,40.67538,-73.9082,BROOKLYN,1.0,0.0,1,0,0,0,0,0,3689846,2017-06-10 18:00:00,2017-06-10T18:00,2017,6,23.3,0.0,Clear
07/19/2017,21:00,40.63682,-73.90218,BROOKLYN,1.0,0.0,0,0,0,0,1,0,3714661,2017-07-19 21:00:00,2017-07-19T21:00,2017,7,25.6,0.0,Clear
07/21/2017,19:00,40.61312,-73.9894,BROOKLYN,0.0,0.0,0,0,0,0,0,0,3716162,2017-07-21 19:00:00,2017-07-21T19:00,2017,7,27.9,0.0,Clear
08/01/2017,13:00,40.612164,-73.97595,BROOKLYN,0.0,0.0,0,0,0,0,0,0,3723264,2017-08-01 13:00:00,2017-08-01T13:00,2017,8,27.5,0.0,Clear
01/19/2017,9:00,40.689697,-73.97511,BROOKLYN,1.0,0.0,0,0,1,0,0,0,3600785,2017-01-19 09:00:00,2017-01-19T09:00,2017,1,5.6,0.0,Clear
08/11/2017,12:00,40.616047,-73.93464,BROOKLYN,0.0,0.0,0,0,0,0,0,0,3731093,2017-08-11 12:00:00,2017-08-11T12:00,2017,8,24.4,0.0,Cloudy
10/09/2017,16:00,40.646744,-73.95269,BROOKLYN,1.0,0.0,0,0,0,0,1,0,3767161,2017-10-09 16:00:00,2017-10-09T16:00,2017,10,22.9,0.2,Drizzle
12/11/2017,0:00,40.631836,-73.94463,BROOKLYN,1.0,0.0,0,0,0,0,1,0,3807209,2017-12-11 00:00:00,2017-12-11T00:00,2017,12,1.4,0.0,Cloudy
04/29/2017,15:00,40.660576,-73.99065,BROOKLYN,0.0,0.0,0,0,0,0,0,0,3659529,2017-04-29 15:00:00,2017-04-29T15:00,2017,4,27.5,0.0,Cloudy
06/21/2017,6:00,40.67597,-73.933235,BROOKLYN,1.0,0.0,0,0,0,0,1,0,3697088,2017-06-21 06:00:00,2017-06-21T06:00,2017,6,21.0,0.0,Clear
03/23/2017,23:00,40.66725,-73.99455,BROOKLYN,1.0,0.0,0,0,0,0,1,0,3638058,2017-03-23 23:00:00,2017-03-23T23:00,2017,3,-0.1,0.0,Clear
05/20/2017,23:00,40.605824,-73.96653,BROOKLYN,1.0,0.0,0,0,1,0,0,0,3675284,2017-05-20 23:00:00,2017-05-20T23:00,2017,5,12.3,0.0,Cloudy
01/01/2017,19:00,40.686615,-73.912,BROOKLYN,0.0,0.0,0,0,0,0,0,0,3591215,2017-01-01 19:00:00,2017-01-01T19:00,2017,1,1.5,0.0,Clear
06/04/2017,14:00,40.62202,-73.98726,BROOKLYN,1.0,0.0,1,0,0,0,0,0,3683838,2017-06-04 14:00:00,2017-06-04T14:00,2017,6,16.7,0.0,Cloudy
08/05/2017,23:00,40.66762,-73.89629,BROOKLYN,1.0,0.0,0,0,0,0,1,0,3726316,2017-08-05 23:00:00,2017-08-05T23:00,2017,8,20.2,0.0,Clear
12/05/2017,18:00,40.65318,-74.00561,BROOKLYN,1.0,0.0,1,0,0,0,0,0,3803611,2017-12-05 18:00:00,2017-12-05T18:00,2017,12,14.2,0.0,Cloudy
03/20/2017,4:00,40.678722,-73.952995,BROOKLYN,1.0,0.0,0,0,0,0,1,0,3636089,2017-03-20 04:00:00,2017-03-20T04:00,2017,3,-1.6,0.0,Clear
12/18/2017,11:00,40.720276,-73.94268,BROOKLYN,1.0,0.0,0,0,0,0,1,0,3812550,2017-12-18 11:00:00,2017-12-18T11:00,2017,12,5.3,0.0,Cloudy
07/26/2017,11:00,40.71396,-73.941086,BROOKLYN,0.0,0.0,0,0,0,0,0,0,3719981,2017-07-26 11:00:00,2017-07-26T11:00,2017,7,23.2,0.0,Cloudy
05/29/2017,16:00,40.625034,-74.0061,BROOKLYN,1.0,0.0,0,0,0,0,1,0,3680350,2017-05-29 16:00:00,2017-05-29T16:00,2017,5,14.1,0.0,Cloudy
11/02/2017,0:00,40.701004,-73.9374,BROOKLYN,0.0,0.0,0,0,0,0,0,0,3783948,2017-11-02 00:00:00,2017-11-02T00:00,2017,11,16.2,0.0,Cloudy
11/05/2017,0:00,40.696945,-73.91914,BROOKLYN,1.0,0.0,1,0,0,0,0,0,3784731,2017-11-05 00:00:00,2017-11-05T00:00,2017,11,12.5,0.4,Drizzle
08/17/2017,16:00,40.64777,-74.01474,BROOKLYN,1.0,0.0,0,0,0,0,1,0,3732754,2017-08-17 16:00:00,2017-08-17T16:00,2017,8,24.3,0.0,Clear
04/27/2017,0:00,40.619915,-74.01143,BROOKLYN,0.0,0.0,0,0,0,0,0,0,3658451,2017-04-27 00:00:00,2017-04-27T00:00,2017,4,12.9,0.0,Cloudy
02/10/2017,8:00,40.576626,-73.98478,BROOKLYN,0.0,0.0,0,0,0,0,0,0,3612915,2017-02-10 08:00:00,2017-02-10T08:00,2017,2,-5.9,0.0,Clear
11/15/2017,19:00,40.643063,-73.95166,BROOKLYN,1.0,0.0,0,0,0,0,1,0,3791775,2017-11-15 19:00:00,2017-11-15T19:00,2017,11,8.2,0.0,Cloudy
07/30/2017,13:00,40.6816,-73.95794,BROOKLYN,1.0,0.0,1,0,0,0,0,0,3723227,2017-07-30 13:00:00,2017-07-30T13:00,2017,7,24.9,0.0,Clear
11/18/2017,18:00,40.68969,-73.99237,BROOKLYN,1.0,0.0,1,0,0,0,0,0,3793291,2017-11-18 18:00:00,2017-11-18T18:00,2017,11,10.0,0.1,Drizzle
04/06/2017,18:00,40.644432,-73.9296,BROOKLYN,0.0,0.0,0,0,0,0,0,0,3648190,2017-04-06 18:00:00,2017-04-06T18:00,2017,4,13.5,0.0,Clear
02/09/2017,12:00,40.68798,-73.97576,BROOKLYN,0.0,0.0,0,0,0,0,0,0,3612368,2017-02-09 12:00:00,2017-02-09T12:00,2017,2,-3.1,1.7,Heavy Snow
10/06/2017,15:00,40.624657,-73.91698,BROOKLYN,0.0,0.0,0,0,0,0,0,0,3766721,2017-10-06 15:00:00,2017-10-06T15:00,2017,10,21.5,0.0,Cloudy
03/10/2017,15:00,40.645107,-73.97989,BROOKLYN,0.0,0.0,0,0,0,0,0,0,3630506,2017-03-10 15:00:00,2017-03-10T15:00,2017,3,3.4,0.1,Light Snow
12/07/2017,15:00,40.625435,-73.99135,BROOKLYN,0.0,0.0,0,0,0,0,0,0,3807172,2017-12-07 15:00:00,2017-12-07T15:00,2017,12,6.9,0.0,Clear
05/10/2017,11:00,40.65217,-73.96141,BROOKLYN,1.0,0.0,1,0,0,0,0,0,3669283,2017-05-10 11:00:00,2017-05-10T11:00,2017,5,13.9,0.1,Drizzle
07/27/2017,0:00,40.577812,-73.96448,BROOKLYN,1.0,0.0,0,0,1,0,0,0,3723349,2017-07-27 00:00:00,2017-07-27T00:00,2017,7,20.1,0.0,Cloudy
07/20/2017,21:00,40.644127,-74.00417,BROOKLYN,0.0,0.0,0,0,0,0,0,0,3715149,2017-07-20 21:00:00,2017-07-20T21:00,2017,7,26.5,0.0,Cloudy
02/10/2017,21:00,40.70032,-73.95996,BROOKLYN,0.0,0.0,0,0,0,0,0,0,3613543,2017-02-10 21:00:00,2017-02-10T21:00,2017,2,-2.7,0.1,Light Snow
02/28/2017,17:00,40.6228,-74.02836,BROOKLYN,0.0,0.0,0,0,0,0,0,0,3623582,2017-02-28 17:00:00,2017-02-28T17:00,2017,2,9.0,0.0,Cloudy
02/25/2017,22:00,40.634533,-73.89654,BROOKLYN,0.0,0.0,0,0,0,0,0,0,3622196,2017-02-25 22:00:00,2017-02-25T22:00,2017,2,8.7,0.0,Clear
05/23/2017,0:00,40.664955,-73.97933,BROOKLYN,1.0,0.0,0,0,0,0,1,0,3676833,2017-05-23 00:00:00,2017-05-23T00:00,2017,5,14.2,0.0,Cloudy
02/14/2017,0:00,40.670296,-73.9562,BROOKLYN,2.0,0.0,0,0,0,0,2,0,4023992,2017-02-14 00:00:00,2017-02-14T00:00,2017,2,-3.0,0.0,Clear
05/03/2017,8:00,40.668648,-73.92835,BROOKLYN,2.0,0.0,0,0,0,0,2,0,3667509,2017-05-03 08:00:00,2017-05-03T08:00,2017,5,15.6,0.0,Clear
12/15/2017,22:00,40.677498,-73.87149,BROOKLYN,1.0,0.0,0,0,0,0,1,0,3812491,2017-12-15 22:00:00,2017-12-15T22:00,2017,12,-4.0,0.0,Clear
10/16/2017,0:00,40.630512,-73.957306,BROOKLYN,2.0,0.0,0,0,0,0,2,0,3770833,2017-10-16 00:00:00,2017-10-16T00:00,2017,10,20.6,0.2,Drizzle
11/19/2017,16:00,40.669704,-73.94774,BROOKLYN,1.0,0.0,0,0,0,0,1,0,3793381,2017-11-19 16:00:00,2017-11-19T16:00,2017,11,8.3,0.0,Clear
08/23/2017,11:00,40.595795,-73.94585,BROOKLYN,1.0,0.0,0,0,1,0,0,0,3736589,2017-08-23 11:00:00,2017-08-23T11:00,2017,8,25.8,0.0,Cloudy
03/24/2017,0:00,40.60771,-73.95715,BROOKLYN,1.0,0.0,1,0,0,0,0,0,3639489,2017-03-24 00:00:00,2017-03-24T00:00,2017,3,-0.0,0.0,Clear
10/30/2017,7:00,40.695015,-73.98876,BROOKLYN,1.0,0.0,1,0,0,0,0,0,3779719,2017-10-30 07:00:00,2017-10-30T07:00,2017,10,8.6,0.9,Drizzle
07/19/2017,15:00,40.697933,-73.926796,BROOKLYN,3.0,0.0,0,0,0,0,3,0,3714711,2017-07-19 15:00:00,2017-07-19T15:00,2017,7,28.5,0.0,Cloudy
05/24/2017,12:00,40.656693,-73.89464,BROOKLYN,1.0,0.0,0,0,0,0,1,0,3677072,2017-05-24 12:00:00,2017-05-24T12:00,2017,5,16.2,0.0,Cloudy
07/29/2017,10:00,40.59731,-73.99381,BROOKLYN,0.0,0.0,0,0,0,0,0,0,3722036,2017-07-29 10:00:00,2017-07-29T10:00,2017,7,19.7,0.1,Drizzle
03/03/2017,17:00,40.682163,-73.889015,BROOKLYN,0.0,0.0,0,0,0,0,0,0,3626433,2017-03-03 17:00:00,2017-03-03T17:00,2017,3,2.6,0.0,Cloudy
07/15/2017,14:00,40.6179,-74.00992,BROOKLYN,0.0,0.0,0,0,0,0,0,0,3713013,2017-07-15 14:00:00,2017-07-15T14:00,2017,7,26.4,0.0,Clear
11/18/2017,17:00,40.638878,-73.95405,BROOKLYN,1.0,0.0,1,0,0,0,0,0,3793012,2017-11-18 17:00:00,2017-11-18T17:00,2017,11,10.4,0.8,Drizzle
05/22/2017,13:00,40.650898,-73.94766,BROOKLYN,0.0,0.0,0,0,0,0,0,0,3678862,2017-05-22 13:00:00,2017-05-22T13:00,2017,5,14.2,1.8,Light Rain
02/07/2017,9:00,40.675484,-73.90066,BROOKLYN,0.0,0.0,0,0,0,0,0,0,3611487,2017-02-07 09:00:00,2017-02-07T09:00,2017,2,4.7,0.0,Cloudy
10/16/2017,19:00,40.596977,-73.97324,BROOKLYN,1.0,0.0,1,0,0,0,0,0,3770663,2017-10-16 19:00:00,2017-10-16T19:00,2017,10,12.4,0.0,Clear
09/20/2017,16:00,40.634857,-73.967514,BROOKLYN,0.0,0.0,0,0,0,0,0,0,3754412,2017-09-20 16:00:00,2017-09-20T16:00,2017,9,24.8,0.0,Cloudy
10/06/2017,21:00,40.647995,-73.952774,BROOKLYN,1.0,0.0,0,0,0,0,1,0,3765807,2017-10-06 21:00:00,2017-10-06T21:00,2017,10,19.4,0.0,Cloudy
03/26/2017,4:00,40.676434,-73.86816,BROOKLYN,2.0,0.0,1,0,0,0,1,0,3639071,2017-03-26 04:00:00,2017-03-26T04:00,2017,3,4.1,0.1,Drizzle
08/16/2017,14:00,40.640762,-74.00767,BROOKLYN,0.0,0.0,0,0,0,0,0,0,3732112,2017-08-16 14:00:00,2017-08-16T14:00,2017,8,29.6,0.0,Cloudy
04/23/2017,17:00,40.61626,-73.99309,BROOKLYN,0.0,0.0,0,0,0,0,0,0,3655815,2017-04-23 17:00:00,2017-04-23T17:00,2017,4,11.3,0.0,Cloudy
01/01/2017,8:00,40.636627,-73.94226,BROOKLYN,1.0,0.0,0,0,0,0,1,0,3593027,2017-01-01 08:00:00,2017-01-01T08:00,2017,1,4.6,0.0,Clear
06/19/2017,17:00,40.656315,-73.93961,BROOKLYN,2.0,0.0,0,0,0,0,2,0,3694486,2017-06-19 17:00:00,2017-06-19T17:00,2017,6,25.1,0.2,Drizzle
12/07/2017,17:00,40.712395,-73.938896,BROOKLYN,2.0,0.0,0,0,0,0,2,0,3805643,2017-12-07 17:00:00,2017-12-07T17:00,2017,12,4.5,0.0,Clear
01/28/2017,16:00,40.655396,-73.92977,BROOKLYN,1.0,0.0,0,0,0,0,1,0,3607841,2017-01-28 16:00:00,2017-01-28T16:00,2017,1,3.7,0.0,Cloudy
02/08/2017,19:00,40.60981,-73.92251,BROOKLYN,1.0,0.0,1,0,0,0,0,0,3612066,2017-02-08 19:00:00,2017-02-08T19:00,2017,2,7.4,0.0,Clear
09/03/2017,11:00,40.68817,-73.98399,BROOKLYN,1.0,0.0,1,0,0,0,0,0,3748451,2017-09-03 11:00:00,2017-09-03T11:00,2017,9,18.9,0.8,Drizzle
07/14/2017,9:00,40.63592,-73.95247,BROOKLYN,0.0,0.0,0,0,0,0,0,0,3711760,2017-07-14 09:00:00,2017-07-14T09:00,2017,7,18.7,1.7,Light Rain
10/17/2017,8:00,40.610588,-74.01274,BROOKLYN,1.0,0.0,1,0,0,0,0,0,3784567,2017-10-17 08:00:00,2017-10-17T08:00,2017,10,8.4,0.0,Clear
05/03/2017,14:00,40.66843,-73.976,BROOKLYN,0.0,0.0,0,0,0,0,0,0,3662760,2017-05-03 14:00:00,2017-05-03T14:00,2017,5,15.3,0.0,Cloudy
01/03/2017,21:00,40.62332,-73.99713,BROOKLYN,0.0,0.0,0,0,0,0,0,0,3592581,2017-01-03 21:00:00,2017-01-03T21:00,2017,1,5.7,0.0,Cloudy
05/16/2017,17:00,40.68529,-73.976204,BROOKLYN,1.0,0.0,0,0,0,0,1,0,3671082,2017-05-16 17:00:00,2017-05-16T17:00,2017,5,23.5,0.0,Cloudy
09/08/2017,18:00,40.634354,-73.94202,BROOKLYN,1.0,0.0,0,0,0,0,1,0,3746130,2017-09-08 18:00:00,2017-09-08T18:00,2017,9,19.2,0.0,Clear
08/24/2017,17:00,40.641945,-73.916626,BROOKLYN,1.0,0.0,0,0,0,0,1,0,3737059,2017-08-24 17:00:00,2017-08-24T17:00,2017,8,25.7,0.0,Cloudy
09/15/2017,15:00,40.631798,-73.901596,BROOKLYN,2.0,0.0,1,0,1,0,0,0,3751290,2017-09-15 15:00:00,2017-09-15T15:00,2017,9,24.6,0.0,Clear
01/05/2017,8:00,40.62316,-74.02981,BROOKLYN,0.0,0.0,0,0,0,0,0,0,3592890,2017-01-05 08:00:00,2017-01-05T08:00,2017,1,-2.9,0.0,Cloudy
09/10/2017,2:00,40.664146,-73.88186,BROOKLYN,1.0,0.0,0,0,0,0,0,0,4025321,2017-09-10 02:00:00,2017-09-10T02:00,2017,9,14.0,0.0,Clear
09/08/2017,13:00,40.652885,-73.96156,BROOKLYN,1.0,0.0,0,0,0,0,1,0,3747744,2017-09-08 13:00:00,2017-09-08T13:00,2017,9,21.4,0.0,Clear
01/05/2017,23:00,40.625774,-74.016495,BROOKLYN,3.0,0.0,0,0,0,0,3,0,3593403,2017-01-05 23:00:00,2017-01-05T23:00,2017,1,-1.1,0.0,Cloudy
04/23/2017,14:00,40.69122,-73.93969,BROOKLYN,0.0,0.0,0,0,0,0,0,0,3655961,2017-04-23 14:00:00,2017-04-23T14:00,2017,4,15.2,0.0,Cloudy
04/11/2017,18:00,40.694534,-73.924416,BROOKLYN,1.0,0.0,0,0,0,0,1,0,3649919,2017-04-11 18:00:00,2017-04-11T18:00,2017,4,14.4,0.0,Cloudy
05/17/2017,9:00,40.631504,-74.00296,BROOKLYN,1.0,0.0,0,0,1,0,0,0,3673198,2017-05-17 09:00:00,2017-05-17T09:00,2017,5,21.4,0.0,Clear
05/20/2017,20:00,40.66384,-73.92166,BROOKLYN,1.0,0.0,0,0,0,0,1,0,3674037,2017-05-20 20:00:00,2017-05-20T20:00,2017,5,13.1,0.0,Cloudy
06/12/2017,21:00,40.65753,-73.89797,BROOKLYN,1.0,0.0,1,0,0,0,0,0,3689355,2017-06-12 21:00:00,2017-06-12T21:00,2017,6,27.0,0.0,Clear
10/27/2017,13:00,40.696228,-73.949394,BROOKLYN,0.0,0.0,0,0,0,0,0,0,3779382,2017-10-27 13:00:00,2017-10-27T13:00,2017,10,15.4,0.0,Clear
08/23/2017,5:00,40.61914,-74.02233,BROOKLYN,0.0,0.0,0,0,0,0,0,0,3735949,2017-08-23 05:00:00,2017-08-23T05:00,2017,8,23.2,0.0,Cloudy
09/03/2017,22:00,40.60164,-73.95184,BROOKLYN,2.0,0.0,0,0,0,0,2,0,3744134,2017-09-03 22:00:00,2017-09-03T22:00,2017,9,18.6,0.0,Clear
06/20/2017,17:00,40.71374,-73.93343,BROOKLYN,1.0,0.0,0,0,1,0,0,0,3695088,2017-06-20 17:00:00,2017-06-20T17:00,2017,6,26.7,0.0,Clear
12/08/2017,10:00,40.661396,-73.89277,BROOKLYN,0.0,0.0,0,0,0,0,0,0,3809602,2017-12-08 10:00:00,2017-12-08T10:00,2017,12,2.4,0.0,Cloudy
04/04/2017,20:00,40.677162,-73.97245,BROOKLYN,1.0,0.0,0,0,1,0,0,0,3645308,2017-04-04 20:00:00,2017-04-04T20:00,2017,4,8.7,0.0,Cloudy
01/26/2017,9:00,40.6224,-73.936646,BROOKLYN,3.0,0.0,0,0,0,0,3,0,3604881,2017-01-26 09:00:00,2017-01-26T09:00,2017,1,6.7,0.5,Drizzle
10/02/2017,8:00,40.714214,-73.96337,BROOKLYN,1.0,0.0,0,0,1,0,0,0,3761748,2017-10-02 08:00:00,2017-10-02T08:00,2017,10,13.8,0.0,Clear
09/12/2017,15:00,40.691013,-73.97043,BROOKLYN,1.0,0.0,1,0,0,0,0,0,3748805,2017-09-12 15:00:00,2017-09-12T15:00,2017,9,24.9,0.0,Cloudy
05/31/2017,18:00,40.626194,-73.92666,BROOKLYN,0.0,0.0,0,0,0,0,0,0,3681603,2017-05-31 18:00:00,2017-05-31T18:00,2017,5,16.4,0.0,Cloudy
11/23/2017,20:00,40.646286,-73.96918,BROOKLYN,0.0,0.0,0,0,0,0,0,0,3796279,2017-11-23 20:00:00,2017-11-23T20:00,2017,11,2.9,0.0,Clear
06/19/2017,16:00,40.707428,-73.924126,BROOKLYN,1.0,0.0,0,0,0,0,1,0,3694556,2017-06-19 16:00:00,2017-06-19T16:00,2017,6,26.1,0.1,Drizzle
01/13/2017,22:00,40.71498,-74.0167,MANHATTAN,2.0,0.0,2,0,0,0,0,0,3597759,2017-01-13 22:00:00,2017-01-13T22:00,2017,1,0.1,0.0,Cloudy
04/12/2017,8:00,40.806767,-73.937164,MANHATTAN,1.0,0.0,0,0,0,0,1,0,3649958,2017-04-12 08:00:00,2017-04-12T08:00,2017,4,16.5,0.0,Cloudy
08/06/2017,1:00,40.73636,-73.99449,MANHATTAN,1.0,0.0,0,0,0,0,1,0,3726176,2017-08-06 01:00:00,2017-08-06T01:00,2017,8,18.3,0.0,Clear
06/19/2017,20:00,40.788418,-73.97077,MANHATTAN,1.0,0.0,0,0,0,0,1,0,3695388,2017-06-19 20:00:00,2017-06-19T20:00,2017,6,21.5,3.4,Heavy Rain
02/02/2017,16:00,40.72428,-74.01138,MANHATTAN,1.0,0.0,0,0,0,0,1,0,3608854,2017-02-02 16:00:00,2017-02-02T16:00,2017,2,5.0,0.0,Cloudy
06/22/2017,14:00,40.788532,-73.95322,MANHATTAN,0.0,0.0,0,0,0,0,0,0,4024473,2017-06-22 14:00:00,2017-06-22T14:00,2017,6,26.5,0.0,Clear
04/20/2017,13:00,40.758327,-73.96894,MANHATTAN,1.0,0.0,1,0,0,0,0,0,3654272,2017-04-20 13:00:00,2017-04-20T13:00,2017,4,17.2,0.0,Cloudy
03/10/2017,10:00,40.76428,-73.97302,MANHATTAN,0.0,0.0,0,0,0,0,0,0,3630511,2017-03-10 10:00:00,2017-03-10T10:00,2017,3,0.8,1.5,Heavy Snow
08/24/2017,11:00,40.760807,-73.99617,MANHATTAN,1.0,0.0,0,0,0,0,1,0,3738885,2017-08-24 11:00:00,2017-08-24T11:00,2017,8,24.3,0.0,Clear
08/08/2017,16:00,40.719517,-73.994385,MANHATTAN,1.0,0.0,0,0,1,0,0,0,3728675,2017-08-08 16:00:00,2017-08-08T16:00,2017,8,24.2,0.0,Cloudy
05/24/2017,19:00,40.73669,-73.993126,MANHATTAN,0.0,0.0,0,0,0,0,0,0,3678693,2017-05-24 19:00:00,2017-05-24T19:00,2017,5,15.5,0.0,Cloudy
11/12/2017,19:00,40.72179,-73.99986,MANHATTAN,0.0,0.0,0,0,0,0,0,0,3788659,2017-11-12 19:00:00,2017-11-12T19:00,2017,11,5.5,0.0,Cloudy
01/30/2017,22:00,40.797943,-73.94003,MANHATTAN,1.0,0.0,1,0,0,0,0,0,3607047,2017-01-30 22:00:00,2017-01-30T22:00,2017,1,-3.0,0.0,Clear
08/13/2017,7:00,40.729332,-74.00523,MANHATTAN,1.0,0.0,0,0,0,0,1,0,3730157,2017-08-13 07:00:00,2017-08-13T07:00,2017,8,22.3,0.0,Clear
12/15/2017,10:00,40.818832,-73.93743,MANHATTAN,0.0,0.0,0,0,0,0,0,0,3811273,2017-12-15 10:00:00,2017-12-15T10:00,2017,12,-3.9,0.0,Cloudy
11/10/2017,9:00,40.71595,-73.97891,MANHATTAN,1.0,0.0,1,0,0,0,0,0,3788255,2017-11-10 09:00:00,2017-11-10T09:00,2017,11,3.0,0.0,Clear
03/10/2017,14:00,40.85196,-73.93482,MANHATTAN,1.0,0.0,1,0,0,0,0,0,3631134,2017-03-10 14:00:00,2017-03-10T14:00,2017,3,1.4,0.3,Light Snow
03/01/2017,13:00,40.75337,-73.974655,MANHATTAN,1.0,0.0,0,0,1,0,0,0,3624383,2017-03-01 13:00:00,2017-03-01T13:00,2017,3,18.2,0.0,Cloudy
05/22/2017,19:00,40.706375,-74.0057,MANHATTAN,1.0,0.0,0,0,1,0,0,0,3675861,2017-05-22 19:00:00,2017-05-22T19:00,2017,5,15.2,0.0,Cloudy
02/02/2017,11:00,40.80396,-73.94828,MANHATTAN,2.0,0.0,1,0,1,0,0,0,3609171,2017-02-02 11:00:00,2017-02-02T11:00,2017,2,5.1,0.0,Clear
08/01/2017,17:00,40.780853,-73.95672,MANHATTAN,0.0,0.0,0,0,0,0,0,0,3723722,2017-08-01 17:00:00,2017-08-01T17:00,2017,8,28.1,0.0,Clear
02/15/2017,20:00,40.764214,-73.97096,MANHATTAN,0.0,0.0,0,0,0,0,0,0,3616594,2017-02-15 20:00:00,2017-02-15T20:00,2017,2,1.7,0.0,Cloudy
03/16/2017,15:00,40.7476,-73.98462,MANHATTAN,0.0,0.0,0,0,0,0,0,0,3633898,2017-03-16 15:00:00,2017-03-16T15:00,2017,3,1.3,0.0,Cloudy
12/03/2017,23:00,40.82653,-73.94667,MANHATTAN,3.0,0.0,0,0,0,0,3,0,3804107,2017-12-03 23:00:00,2017-12-03T23:00,2017,12,3.8,0.0,Clear
01/17/2017,23:00,40.718197,-73.98714,MANHATTAN,0.0,0.0,0,0,0,0,0,0,3600180,2017-01-17 23:00:00,2017-01-17T23:00,2017,1,3.2,0.1,Drizzle
10/18/2017,5:00,40.7077,-74.0155,MANHATTAN,1.0,0.0,0,0,0,0,1,0,3772259,2017-10-18 05:00:00,2017-10-18T05:00,2017,10,8.7,0.0,Clear
07/10/2017,20:00,40.82007,-73.940216,MANHATTAN,1.0,0.0,0,0,0,0,1,0,3708691,2017-07-10 20:00:00,2017-07-10T20:00,2017,7,24.0,0.0,Cloudy
12/30/2017,18:00,40.74955,-74.00654,MANHATTAN,0.0,0.0,0,0,0,0,0,0,3820309,2017-12-30 18:00:00,2017-12-30T18:00,2017,12,-5.9,0.0,Clear
09/12/2017,11:00,40.816223,-73.94185,MANHATTAN,0.0,0.0,0,0,0,0,0,0,3748808,2017-09-12 11:00:00,2017-09-12T11:00,2017,9,23.2,0.0,Cloudy
01/15/2017,0:00,40.73389,-73.986465,MANHATTAN,0.0,0.0,0,0,0,0,0,0,3598283,2017-01-15 00:00:00,2017-01-15T00:00,2017,1,-0.4,0.0,Cloudy
10/27/2017,23:00,40.77593,-73.94713,MANHATTAN,1.0,0.0,0,0,0,0,1,0,3781717,2017-10-27 23:00:00,2017-10-27T23:00,2017,10,11.3,0.0,Clear
08/14/2017,15:00,40.730038,-73.99107,MANHATTAN,0.0,0.0,0,0,0,0,0,0,3733166,2017-08-14 15:00:00,2017-08-14T15:00,2017,8,24.8,0.0,Cloudy
04/01/2017,10:00,40.73988,-73.99872,MANHATTAN,1.0,0.0,1,0,0,0,0,0,3643444,2017-04-01 10:00:00,2017-04-01T10:00,2017,4,5.0,0.0,Cloudy
02/27/2017,19:00,40.84491,-73.93324,MANHATTAN,0.0,0.0,0,0,0,0,0,0,3623915,2017-02-27 19:00:00,2017-02-27T19:00,2017,2,6.6,0.0,Clear
07/19/2017,0:00,40.720707,-73.981316,MANHATTAN,1.0,0.0,1,0,0,0,0,0,3715528,2017-07-19 00:00:00,2017-07-19T00:00,2017,7,24.3,0.0,Clear
11/02/2017,19:00,40.741024,-73.97862,MANHATTAN,1.0,0.0,1,0,0,0,0,0,3790957,2017-11-02 19:00:00,2017-11-02T19:00,2017,11,17.4,0.0,Clear
06/05/2017,8:00,40.75519,-73.97122,MANHATTAN,1.0,0.0,0,0,1,0,0,0,3690748,2017-06-05 08:00:00,2017-06-05T08:00,2017,6,17.2,0.0,Cloudy
11/30/2017,10:00,40.72605,-73.98354,MANHATTAN,1.0,0.0,0,0,0,0,1,0,3801266,2017-11-30 10:00:00,2017-11-30T10:00,2017,11,4.8,0.0,Cloudy
04/02/2017,11:00,40.716454,-74.01306,MANHATTAN,0.0,0.0,0,0,0,0,0,0,3643365,2017-04-02 11:00:00,2017-04-02T11:00,2017,4,13.1,0.0,Clear
06/22/2017,15:00,40.86655,-73.91877,MANHATTAN,0.0,0.0,0,0,0,0,0,0,3697276,2017-06-22 15:00:00,2017-06-22T15:00,2017,6,26.6,0.0,Clear
02/08/2017,12:00,40.763657,-73.97347,MANHATTAN,0.0,0.0,0,0,0,0,0,0,3612387,2017-02-08 12:00:00,2017-02-08T12:00,2017,2,14.3,0.0,Cloudy
01/25/2017,14:00,40.757286,-73.97812,MANHATTAN,1.0,0.0,1,0,0,0,0,0,3604805,2017-01-25 14:00:00,2017-01-25T14:00,2017,1,9.7,0.0,Clear
04/23/2017,20:00,40.749527,-73.99305,MANHATTAN,1.0,0.0,1,0,0,0,0,0,3655901,2017-04-23 20:00:00,2017-04-23T20:00,2017,4,9.9,0.0,Cloudy
05/18/2017,11:00,40.86496,-73.92692,MANHATTAN,1.0,0.0,0,0,0,0,1,0,3672807,2017-05-18 11:00:00,2017-05-18T11:00,2017,5,30.4,0.0,Cloudy
03/17/2017,17:00,40.747917,-73.9736,MANHATTAN,1.0,0.0,0,0,0,0,1,0,3634020,2017-03-17 17:00:00,2017-03-17T17:00,2017,3,2.0,0.0,Clear
05/20/2017,20:00,40.769005,-73.992355,MANHATTAN,1.0,0.0,0,0,0,0,1,0,3694686,2017-05-20 20:00:00,2017-05-20T20:00,2017,5,13.3,0.0,Cloudy
05/07/2017,3:00,40.72301,-73.98576,MANHATTAN,0.0,0.0,0,0,0,0,0,0,3667128,2017-05-07 03:00:00,2017-05-07T03:00,2017,5,10.0,0.0,Clear
06/21/2017,16:00,40.730038,-73.99107,MANHATTAN,1.0,0.0,1,0,0,0,0,0,3701002,2017-06-21 16:00:00,2017-06-21T16:00,2017,6,24.5,2.0,Light Rain
04/25/2017,9:00,40.74708,-73.98135,MANHATTAN,1.0,0.0,0,0,0,0,1,0,3658409,2017-04-25 09:00:00,2017-04-25T09:00,2017,4,11.0,0.4,Drizzle
08/29/2017,19:00,40.714478,-74.01354,MANHATTAN,1.0,0.0,0,0,0,0,1,0,3740006,2017-08-29 19:00:00,2017-08-29T19:00,2017,8,17.7,0.5,Drizzle
03/15/2017,17:00,40.751656,-73.99014,MANHATTAN,0.0,0.0,0,0,0,0,0,0,3632743,2017-03-15 17:00:00,2017-03-15T17:00,2017,3,-4.1,0.0,Cloudy
03/19/2017,16:00,40.808395,-73.95296,MANHATTAN,1.0,0.0,0,0,0,0,1,0,3635251,2017-03-19 16:00:00,2017-03-19T16:00,2017,3,5.1,0.0,Clear
10/31/2017,17:00,40.720753,-73.98041,MANHATTAN,1.0,0.0,0,0,1,0,0,0,3781888,2017-10-31 17:00:00,2017-10-31T17:00,2017,10,10.2,0.0,Clear
09/10/2017,18:00,40.725136,-73.99959,MANHATTAN,1.0,0.0,0,0,1,0,0,0,3747230,2017-09-10 18:00:00,2017-09-10T18:00,2017,9,17.1,0.0,Clear
04/02/2017,12:00,40.784237,-73.947075,MANHATTAN,0.0,0.0,0,0,0,0,0,0,3644006,2017-04-02 12:00:00,2017-04-02T12:00,2017,4,14.2,0.0,Clear
05/06/2017,0:00,40.754795,-73.99156,MANHATTAN,0.0,0.0,0,0,0,0,0,0,3676744,2017-05-06 00:00:00,2017-05-06T00:00,2017,5,14.0,2.3,Light Rain
07/12/2017,0:00,40.755302,-73.97536,MANHATTAN,0.0,0.0,0,0,0,0,0,0,3709128,2017-07-12 00:00:00,2017-07-12T00:00,2017,7,22.0,0.0,Cloudy
01/08/2017,13:00,40.86155,-73.92472,MANHATTAN,0.0,0.0,0,0,0,0,0,0,3599048,2017-01-08 13:00:00,2017-01-08T13:00,2017,1,-5.6,0.0,Cloudy
08/30/2017,15:00,40.736004,-73.99362,MANHATTAN,1.0,0.0,0,0,1,0,0,0,3742771,2017-08-30 15:00:00,2017-08-30T15:00,2017,8,24.7,0.0,Cloudy
06/13/2017,23:00,40.75922,-73.98657,MANHATTAN,0.0,0.0,0,0,0,0,0,0,3691058,2017-06-13 23:00:00,2017-06-13T23:00,2017,6,23.9,0.2,Drizzle
06/26/2017,0:00,40.738903,-73.98731,MANHATTAN,1.0,0.0,0,0,0,0,1,0,3700048,2017-06-26 00:00:00,2017-06-26T00:00,2017,6,20.1,0.0,Clear
09/02/2017,11:00,40.82106,-73.93949,MANHATTAN,1.0,0.0,0,0,0,0,1,0,3750250,2017-09-02 11:00:00,2017-09-02T11:00,2017,9,18.3,0.0,Cloudy
09/11/2017,22:00,40.84912,-73.93015,MANHATTAN,1.0,0.0,0,0,0,0,1,0,3749917,2017-09-11 22:00:00,2017-09-11T22:00,2017,9,15.8,0.0,Cloudy
06/28/2017,0:00,40.802223,-73.946144,MANHATTAN,1.0,0.0,0,0,0,0,1,0,3702097,2017-06-28 00:00:00,2017-06-28T00:00,2017,6,16.2,0.0,Clear
08/24/2017,14:00,40.707546,-74.00996,MANHATTAN,0.0,0.0,0,0,0,0,0,0,3737066,2017-08-24 14:00:00,2017-08-24T14:00,2017,8,25.8,0.0,Cloudy
02/20/2017,0:00,40.829597,-73.94814,MANHATTAN,1.0,0.0,1,0,0,0,0,0,3624084,2017-02-20 00:00:00,2017-02-20T00:00,2017,2,7.1,0.0,Clear
01/26/2017,11:00,40.713684,-73.99454,MANHATTAN,0.0,0.0,0,0,0,0,0,0,3606755,2017-01-26 11:00:00,2017-01-26T11:00,2017,1,9.7,0.2,Drizzle
11/20/2017,8:00,40.74708,-73.98135,MANHATTAN,1.0,0.0,0,0,0,0,1,0,3794356,2017-11-20 08:00:00,2017-11-20T08:00,2017,11,2.8,0.0,Clear
05/23/2017,22:00,40.737877,-73.97689,MANHATTAN,1.0,0.0,0,0,0,0,1,0,3677142,2017-05-23 22:00:00,2017-05-23T22:00,2017,5,14.3,0.0,Cloudy
04/03/2017,9:00,40.72084,-73.99383,MANHATTAN,0.0,0.0,0,0,0,0,0,0,3644207,2017-04-03 09:00:00,2017-04-03T09:00,2017,4,12.2,0.0,Cloudy
05/13/2017,0:00,40.850906,-73.93829,MANHATTAN,1.0,0.0,1,0,0,0,0,0,3670846,2017-05-13 00:00:00,2017-05-13T00:00,2017,5,9.8,0.0,Cloudy
09/03/2017,0:00,40.75866,-73.98875,MANHATTAN,0.0,0.0,0,0,0,0,0,0,3740984,2017-09-03 00:00:00,2017-09-03T00:00,2017,9,15.1,1.4,Light Rain
03/18/2017,0:00,40.735535,-74.0017,MANHATTAN,1.0,0.0,0,0,1,0,0,0,3635259,2017-03-18 00:00:00,2017-03-18T00:00,2017,3,-5.3,0.0,Clear
08/03/2017,22:00,40.743156,-73.98174,MANHATTAN,0.0,0.0,0,0,0,0,0,0,3725226,2017-08-03 22:00:00,2017-08-03T22:00,2017,8,22.5,0.0,Cloudy
02/28/2017,21:00,40.787693,-73.94148,MANHATTAN,1.0,0.0,0,0,1,0,0,0,3624418,2017-02-28 21:00:00,2017-02-28T21:00,2017,2,9.7,0.1,Drizzle
12/19/2017,14:00,40.754684,-73.984245,MANHATTAN,0.0,0.0,0,0,0,0,0,0,3814092,2017-12-19 14:00:00,2017-12-19T14:00,2017,12,10.8,0.0,Cloudy
10/28/2017,0:00,40.851364,-73.94106,MANHATTAN,1.0,0.0,0,0,0,0,1,0,3780055,2017-10-28 00:00:00,2017-10-28T00:00,2017,10,10.9,0.0,Clear
09/17/2017,10:00,40.710175,-74.001144,MANHATTAN,0.0,0.0,0,0,0,0,0,0,3756178,2017-09-17 10:00:00,2017-09-17T10:00,2017,9,23.7,0.0,Cloudy
12/03/2017,20:00,40.76422,-73.98099,MANHATTAN,1.0,0.0,1,0,0,0,0,0,3804878,2017-12-03 20:00:00,2017-12-03T20:00,2017,12,5.6,0.0,Cloudy
07/06/2017,3:00,40.742706,-73.984535,MANHATTAN,0.0,0.0,0,0,0,0,0,0,3709995,2017-07-06 03:00:00,2017-07-06T03:00,2017,7,20.2,0.0,Cloudy
12/09/2017,20:00,40.75858,-73.98316,MANHATTAN,0.0,0.0,0,0,0,0,0,0,3807641,2017-12-09 20:00:00,2017-12-09T20:00,2017,12,-1.0,0.5,Heavy Snow
09/07/2017,15:00,40.84019,-73.94307,MANHATTAN,0.0,0.0,0,0,0,0,0,0,3745844,2017-09-07 15:00:00,2017-09-07T15:00,2017,9,21.3,0.0,Clear
11/14/2017,22:00,40.70605,-74.00746,MANHATTAN,1.0,0.0,0,0,1,0,0,0,3790174,2017-11-14 22:00:00,2017-11-14T22:00,2017,11,3.9,0.0,Cloudy
07/29/2017,10:00,40.853943,-73.929245,MANHATTAN,0.0,0.0,0,0,0,0,0,0,3720860,2017-07-29 10:00:00,2017-07-29T10:00,2017,7,19.7,0.0,Cloudy
10/03/2017,2:00,40.749443,-73.99285,MANHATTAN,2.0,0.0,0,0,0,0,2,0,3762557,2017-10-03 02:00:00,2017-10-03T02:00,2017,10,14.9,0.0,Clear
08/15/2017,17:00,40.778946,-73.96231,MANHATTAN,1.0,0.0,1,0,0,0,0,0,3732389,2017-08-15 17:00:00,2017-08-15T17:00,2017,8,23.3,0.0,Cloudy
02/07/2017,11:00,40.757828,-73.99308,MANHATTAN,1.0,0.0,0,0,0,0,1,0,3611878,2017-02-07 11:00:00,2017-02-07T11:00,2017,2,4.5,1.4,Light Rain
07/24/2017,18:00,40.747066,-73.97925,MANHATTAN,1.0,0.0,0,0,1,0,0,0,3718461,2017-07-24 18:00:00,2017-07-24T18:00,2017,7,21.8,0.0,Clear
09/23/2017,11:00,40.734837,-73.99076,MANHATTAN,1.0,0.0,1,0,0,0,0,0,3756326,2017-09-23 11:00:00,2017-09-23T11:00,2017,9,26.5,0.0,Clear
11/18/2017,21:00,40.759678,-73.97216,MANHATTAN,0.0,0.0,0,0,0,0,0,0,3793331,2017-11-18 21:00:00,2017-11-18T21:00,2017,11,9.1,0.4,Drizzle
04/23/2017,12:00,40.714478,-74.01354,MANHATTAN,0.0,0.0,0,0,0,0,0,0,3655652,2017-04-23 12:00:00,2017-04-23T12:00,2017,4,15.5,0.0,Cloudy
10/29/2017,1:00,40.72443,-73.99347,MANHATTAN,3.0,0.0,0,0,0,0,3,0,3781133,2017-10-29 01:00:00,2017-10-29T01:00,2017,10,17.9,0.1,Drizzle
04/28/2017,23:00,40.74044,-74.00203,MANHATTAN,1.0,0.0,0,0,1,0,0,0,3660765,2017-04-28 23:00:00,2017-04-28T23:00,2017,4,15.3,0.0,Cloudy
01/01/2017,21:00,40.746677,-73.98041,MANHATTAN,1.0,0.0,0,0,0,0,1,0,3590567,2017-01-01 21:00:00,2017-01-01T21:00,2017,1,-0.7,0.0,Clear
07/31/2017,7:00,40.841717,-73.94435,MANHATTAN,0.0,0.0,0,0,0,0,0,0,3723085,2017-07-31 07:00:00,2017-07-31T07:00,2017,7,19.4,0.0,Clear
09/08/2017,3:00,40.810173,-73.95117,MANHATTAN,0.0,0.0,0,0,0,0,0,0,3747582,2017-09-08 03:00:00,2017-09-08T03:00,2017,9,13.9,0.0,Clear
09/23/2017,19:00,40.805458,-73.94001,MANHATTAN,1.0,0.0,0,0,0,0,1,0,3756215,2017-09-23 19:00:00,2017-09-23T19:00,2017,9,22.9,0.0,Clear
12/15/2017,13:00,40.76547,-73.97005,MANHATTAN,1.0,0.0,1,0,0,0,0,0,3809686,2017-12-15 13:00:00,2017-12-15T13:00,2017,12,-2.7,0.0,Cloudy
06/08/2017,0:00,40.7268,-74.005615,MANHATTAN,1.0,0.0,0,0,1,0,0,0,3686694,2017-06-08 00:00:00,2017-06-08T00:00,2017,6,12.6,0.0,Clear
07/22/2017,12:00,40.70981,-74.01379,MANHATTAN,1.0,0.0,0,0,0,0,1,0,3716678,2017-07-22 12:00:00,2017-07-22T12:00,2017,7,30.1,0.0,Cloudy
05/17/2017,22:00,40.721935,-73.987404,MANHATTAN,0.0,0.0,0,0,0,0,0,0,3675763,2017-05-17 22:00:00,2017-05-17T22:00,2017,5,23.4,0.0,Cloudy
03/26/2017,0:00,40.759983,-73.964806,MANHATTAN,1.0,0.0,0,0,0,0,1,0,3640253,2017-03-26 00:00:00,2017-03-26T00:00,2017,3,4.3,0.0,Cloudy
02/26/2017,17:00,40.728474,-73.9757,MANHATTAN,0.0,0.0,0,0,0,0,0,0,4024055,2017-02-26 17:00:00,2017-02-26T17:00,2017,2,5.7,0.0,Cloudy
03/17/2017,0:00,40.745228,-74.00597,MANHATTAN,1.0,0.0,1,0,0,0,0,0,3634622,2017-03-17 00:00:00,2017-03-17T00:00,2017,3,-5.3,0.0,Clear
01/12/2017,8:00,40.823647,-73.943855,MANHATTAN,0.0,0.0,0,0,0,0,0,0,3606871,2017-01-12 08:00:00,2017-01-12T08:00,2017,1,10.5,0.2,Drizzle
01/18/2017,0:00,40.757828,-73.99308,MANHATTAN,1.0,0.0,1,0,0,0,0,0,3602241,2017-01-18 00:00:00,2017-01-18T00:00,2017,1,3.2,0.0,Cloudy
11/13/2017,21:00,40.74483,-73.98718,MANHATTAN,0.0,0.0,0,0,0,0,0,0,3789993,2017-11-13 21:00:00,2017-11-13T21:00,2017,11,3.8,0.0,Clear
03/16/2017,9:00,40.753666,-73.99241,MANHATTAN,0.0,0.0,0,0,0,0,0,0,3632832,2017-03-16 09:00:00,2017-03-16T09:00,2017,3,-4.1,0.0,Cloudy
08/24/2017,10:00,40.767494,-73.99345,MANHATTAN,0.0,0.0,0,0,0,0,0,0,3736495,2017-08-24 10:00:00,2017-08-24T10:00,2017,8,23.7,0.0,Clear
07/19/2017,12:00,40.760834,-73.98852,MANHATTAN,0.0,0.0,0,0,0,0,0,0,3715498,2017-07-19 12:00:00,2017-07-19T12:00,2017,7,31.3,0.0,Clear
06/11/2017,17:00,40.82134,-73.95721,MANHATTAN,0.0,0.0,0,0,0,0,0,0,3696380,2017-06-11 17:00:00,2017-06-11T17:00,2017,6,31.7,0.0,Clear
09/18/2017,13:00,40.737885,-73.98091,MANHATTAN,1.0,0.0,0,0,0,0,1,0,3753169,2017-09-18 13:00:00,2017-09-18T13:00,2017,9,23.3,0.0,Cloudy
03/02/2017,20:00,40.73855,-73.98043,MANHATTAN,1.0,0.0,1,0,0,0,0,0,3625535,2017-03-02 20:00:00,2017-03-02T20:00,2017,3,3.4,0.0,Clear
05/11/2017,17:00,40.75573,-73.990906,MANHATTAN,1.0,0.0,0,0,1,0,0,0,3669175,2017-05-11 17:00:00,2017-05-11T17:00,2017,5,13.8,0.0,Cloudy
07/06/2017,18:00,40.82773,-73.94952,MANHATTAN,1.0,0.0,0,0,1,0,0,0,3708212,2017-07-06 18:00:00,2017-07-06T18:00,2017,7,22.8,0.0,Cloudy
06/07/2017,23:00,40.7615,-73.997826,MANHATTAN,1.0,0.0,0,0,1,0,0,0,3686136,2017-06-07 23:00:00,2017-06-07T23:00,2017,6,13.5,0.0,Clear
10/20/2017,18:00,40.750706,-73.980835,MANHATTAN,0.0,0.0,0,0,0,0,0,0,3774324,2017-10-20 18:00:00,2017-10-20T18:00,2017,10,16.7,0.0,Clear
01/17/2017,10:00,40.807316,-73.93741,MANHATTAN,0.0,0.0,0,0,0,0,0,0,3599527,2017-01-17 10:00:00,2017-01-17T10:00,2017,1,4.9,0.0,Cloudy
02/13/2017,19:00,40.84215,-73.94228,MANHATTAN,1.0,0.0,1,0,0,0,0,0,3615985,2017-02-13 19:00:00,2017-02-13T19:00,2017,2,-1.0,0.0,Clear
12/23/2017,1:00,40.71981,-73.99617,MANHATTAN,1.0,0.0,0,0,1,0,0,0,3815999,2017-12-23 01:00:00,2017-12-23T01:00,2017,12,4.1,0.1,Drizzle
12/22/2017,0:00,40.81583,-73.94494,MANHATTAN,2.0,0.0,0,0,0,0,2,0,3816477,2017-12-22 00:00:00,2017-12-22T00:00,2017,12,-1.4,0.0,Cloudy
02/23/2017,4:00,40.71843,-74.000534,MANHATTAN,1.0,0.0,1,0,0,0,0,0,3621024,2017-02-23 04:00:00,2017-02-23T04:00,2017,2,4.8,0.0,Clear
09/27/2017,20:00,40.747246,-73.981224,MANHATTAN,1.0,0.0,1,0,0,0,0,0,3850079,2017-09-27 20:00:00,2017-09-27T20:00,2017,9,23.7,0.0,Clear
05/30/2017,13:00,40.719193,-73.99985,MANHATTAN,1.0,0.0,1,0,0,0,0,0,3681089,2017-05-30 13:00:00,2017-05-30T13:00,2017,5,15.1,0.0,Cloudy
12/23/2017,12:00,40.78257,-73.94522,MANHATTAN,1.0,0.0,0,0,1,0,0,0,3818280,2017-12-23 12:00:00,2017-12-23T12:00,2017,12,8.2,1.4,Light Rain
07/14/2017,0:00,40.809757,-73.94614,MANHATTAN,1.0,0.0,0,0,0,0,1,0,3712551,2017-07-14 00:00:00,2017-07-14T00:00,2017,7,21.2,0.0,Cloudy
05/12/2017,14:00,40.77043,-73.96012,MANHATTAN,0.0,0.0,0,0,0,0,0,0,3669805,2017-05-12 14:00:00,2017-05-12T14:00,2017,5,12.8,0.0,Cloudy
06/20/2017,16:00,40.814285,-73.94533,MANHATTAN,0.0,0.0,0,0,0,0,0,0,3695631,2017-06-20 16:00:00,2017-06-20T16:00,2017,6,27.2,0.0,Clear
03/27/2017,22:00,40.757908,-73.9893,MANHATTAN,1.0,0.0,1,0,0,0,0,0,3641254,2017-03-27 22:00:00,2017-03-27T22:00,2017,3,7.4,0.0,Cloudy
11/11/2017,12:00,40.722973,-74.01165,MANHATTAN,4.0,0.0,0,0,0,0,4,0,3788969,2017-11-11 12:00:00,2017-11-11T12:00,2017,11,2.0,0.0,Clear
09/19/2017,15:00,40.841076,-73.93977,MANHATTAN,1.0,0.0,1,0,0,0,0,0,3754511,2017-09-19 15:00:00,2017-09-19T15:00,2017,9,25.2,0.0,Cloudy
06/16/2017,16:00,40.782627,-73.97499,MANHATTAN,0.0,0.0,0,0,0,0,0,0,3692537,2017-06-16 16:00:00,2017-06-16T16:00,2017,6,21.4,0.0,Cloudy
04/10/2017,12:00,40.760536,-73.95836,MANHATTAN,0.0,0.0,0,0,0,0,0,0,3649288,2017-04-10 12:00:00,2017-04-10T12:00,2017,4,18.0,0.0,Cloudy
06/29/2017,17:00,40.797153,-73.93766,MANHATTAN,0.0,0.0,0,0,0,0,0,0,3701976,2017-06-29 17:00:00,2017-06-29T17:00,2017,6,23.6,0.0,Cloudy
08/17/2017,18:00,40.74469,-73.98923,MANHATTAN,1.0,0.0,1,0,0,0,0,0,3739715,2017-08-17 18:00:00,2017-08-17T18:00,2017,8,23.1,0.0,Cloudy
07/14/2017,16:00,40.75514,-73.99131,MANHATTAN,0.0,0.0,0,0,0,0,0,0,3712261,2017-07-14 16:00:00,2017-07-14T16:00,2017,7,23.0,0.1,Drizzle
07/05/2017,14:00,40.766556,-73.96294,MANHATTAN,1.0,0.0,0,0,1,0,0,0,3705622,2017-07-05 14:00:00,2017-07-05T14:00,2017,7,27.7,0.0,Clear
04/24/2017,13:00,40.72293,-73.98865,MANHATTAN,1.0,0.0,0,0,1,0,0,0,3657028,2017-04-24 13:00:00,2017-04-24T13:00,2017,4,12.9,0.0,Cloudy
03/22/2017,12:00,40.807945,-73.94592,MANHATTAN,1.0,0.0,0,0,0,0,1,0,3637623,2017-03-22 12:00:00,2017-03-22T12:00,2017,3,-0.5,0.0,Clear
02/28/2017,0:00,40.750706,-73.980835,MANHATTAN,0.0,0.0,0,0,0,0,0,0,3624394,2017-02-28 00:00:00,2017-02-28T00:00,2017,2,2.5,0.0,Clear
05/12/2017,0:00,40.75578,-74.00199,MANHATTAN,0.0,0.0,0,0,0,0,0,0,3670289,2017-05-12 00:00:00,2017-05-12T00:00,2017,5,10.6,0.0,Cloudy
09/27/2017,0:00,40.765892,-73.9809,MANHATTAN,0.0,0.0,0,0,0,0,0,0,3759109,2017-09-27 00:00:00,2017-09-27T00:00,2017,9,20.6,0.0,Clear
03/09/2017,7:00,40.788418,-73.97077,MANHATTAN,0.0,0.0,0,0,0,0,0,0,3629413,2017-03-09 07:00:00,2017-03-09T07:00,2017,3,9.0,0.0,Clear
11/16/2017,12:00,40.79356,-73.96702,MANHATTAN,0.0,0.0,0,0,0,0,0,0,3791800,2017-11-16 12:00:00,2017-11-16T12:00,2017,11,11.6,0.0,Clear
11/01/2017,13:00,40.846104,-73.93609,MANHATTAN,0.0,0.0,0,0,0,0,0,0,3782642,2017-11-01 13:00:00,2017-11-01T13:00,2017,11,11.7,0.0,Cloudy
05/17/2017,9:00,40.719837,-74.005196,MANHATTAN,1.0,0.0,0,0,1,0,0,0,3671660,2017-05-17 09:00:00,2017-05-17T09:00,2017,5,23.3,0.0,Clear
11/24/2017,15:00,40.728214,-73.987946,MANHATTAN,1.0,0.0,0,0,1,0,0,0,3797439,2017-11-24 15:00:00,2017-11-24T15:00,2017,11,8.9,0.0,Clear
04/21/2017,19:00,40.714092,-73.98715,MANHATTAN,1.0,0.0,1,0,0,0,0,0,3655120,2017-04-21 19:00:00,2017-04-21T19:00,2017,4,10.2,0.0,Cloudy
02/03/2017,7:00,40.718266,-74.00706,MANHATTAN,0.0,0.0,0,0,0,0,0,0,3612202,2017-02-03 07:00:00,2017-02-03T07:00,2017,2,-3.9,0.0,Cloudy
08/25/2017,18:00,40.751945,-73.99081,MANHATTAN,0.0,0.0,0,0,0,0,0,0,3737943,2017-08-25 18:00:00,2017-08-25T18:00,2017,8,22.3,0.0,Clear
10/16/2017,18:00,40.728447,-73.9818,MANHATTAN,1.0,0.0,1,0,0,0,0,0,3770768,2017-10-16 18:00:00,2017-10-16T18:00,2017,10,12.2,0.0,Cloudy
09/15/2017,19:00,40.750904,-73.98068,MANHATTAN,0.0,0.0,0,0,0,0,0,0,3849188,2017-09-15 19:00:00,2017-09-15T19:00,2017,9,21.3,0.0,Cloudy
07/08/2017,16:00,40.80034,-73.94789,MANHATTAN,1.0,0.0,0,0,1,0,0,0,3708319,2017-07-08 16:00:00,2017-07-08T16:00,2017,7,28.6,0.0,Cloudy
01/03/2017,13:00,40.74229,-73.974594,MANHATTAN,1.0,0.0,1,0,0,0,0,0,3591463,2017-01-03 13:00:00,2017-01-03T13:00,2017,1,5.6,0.7,Drizzle
03/24/2017,17:00,40.772984,-73.946205,MANHATTAN,1.0,0.0,1,0,0,0,0,0,3639726,2017-03-24 17:00:00,2017-03-24T17:00,2017,3,11.8,0.0,Clear
09/19/2017,11:00,40.72106,-73.99821,MANHATTAN,0.0,0.0,0,0,0,0,0,0,3754560,2017-09-19 11:00:00,2017-09-19T11:00,2017,9,23.3,0.0,Cloudy
06/01/2017,16:00,40.80144,-73.93288,MANHATTAN,1.0,0.0,1,0,0,0,0,0,3682502,2017-06-01 16:00:00,2017-06-01T16:00,2017,6,23.0,0.0,Clear
12/24/2017,17:00,40.75529,-73.99493,MANHATTAN,1.0,0.0,1,0,0,0,0,0,3816982,2017-12-24 17:00:00,2017-12-24T17:00,2017,12,2.7,0.0,Cloudy
10/03/2017,18:00,40.71137,-74.00862,MANHATTAN,0.0,0.0,0,0,0,0,0,0,3762506,2017-10-03 18:00:00,2017-10-03T18:00,2017,10,14.8,0.0,Cloudy
06/09/2017,22:00,40.752316,-73.985954,MANHATTAN,1.0,0.0,1,0,0,0,0,0,3690473,2017-06-09 22:00:00,2017-06-09T22:00,2017,6,17.7,0.0,Clear
10/27/2017,12:00,40.73991,-73.99153,MANHATTAN,1.0,0.0,0,0,1,0,0,0,3783560,2017-10-27 12:00:00,2017-10-27T12:00,2017,10,14.7,0.0,Clear
05/10/2017,14:00,40.76161,-73.99032,MANHATTAN,0.0,0.0,0,0,0,0,0,0,3667286,2017-05-10 14:00:00,2017-05-10T14:00,2017,5,16.8,0.0,Cloudy
06/22/2017,11:00,40.79814,-73.94051,MANHATTAN,0.0,0.0,0,0,0,0,0,0,3696774,2017-06-22 11:00:00,2017-06-22T11:00,2017,6,26.1,0.0,Cloudy
09/16/2017,18:00,40.81433,-73.937355,MANHATTAN,0.0,0.0,0,0,0,0,0,0,3752183,2017-09-16 18:00:00,2017-09-16T18:00,2017,9,21.7,0.0,Clear
04/28/2017,11:00,40.70722,-74.00747,MANHATTAN,0.0,0.0,0,0,0,0,0,0,3660330,2017-04-28 11:00:00,2017-04-28T11:00,2017,4,23.0,0.0,Clear
12/22/2017,0:00,40.759468,-73.989105,MANHATTAN,0.0,0.0,0,0,0,0,0,0,3817946,2017-12-22 00:00:00,2017-12-22T00:00,2017,12,-1.4,0.0,Cloudy
08/03/2017,0:00,40.701576,-74.01215,MANHATTAN,0.0,0.0,0,0,0,0,0,0,3725956,2017-08-03 00:00:00,2017-08-03T00:00,2017,8,20.3,0.0,Cloudy
04/08/2017,16:00,40.765553,-73.96787,MANHATTAN,1.0,0.0,1,0,0,0,0,0,3648605,2017-04-08 16:00:00,2017-04-08T16:00,2017,4,12.8,0.0,Clear
09/02/2017,20:00,40.74788,-73.97543,MANHATTAN,1.0,0.0,0,0,0,0,1,0,3742931,2017-09-02 20:00:00,2017-09-02T20:00,2017,9,15.7,2.7,Heavy Rain
08/23/2017,21:00,40.76155,-73.96659,MANHATTAN,0.0,0.0,0,0,0,0,0,0,3739097,2017-08-23 21:00:00,2017-08-23T21:00,2017,8,20.8,0.0,Clear
09/23/2017,8:00,40.73627,-73.990906,MANHATTAN,1.0,0.0,1,0,0,0,0,0,3755838,2017-09-23 08:00:00,2017-09-23T08:00,2017,9,21.8,0.0,Clear
10/20/2017,13:00,40.741615,-73.993744,MANHATTAN,0.0,0.0,0,0,0,0,0,0,3773380,2017-10-20 13:00:00,2017-10-20T13:00,2017,10,21.4,0.0,Clear
09/23/2017,16:00,40.7498,-73.993706,MANHATTAN,0.0,0.0,0,0,0,0,0,0,3755569,2017-09-23 16:00:00,2017-09-23T16:00,2017,9,27.6,0.0,Clear
12/11/2017,7:00,40.718456,-73.99482,MANHATTAN,0.0,0.0,0,0,0,0,0,0,3807112,2017-12-11 07:00:00,2017-12-11T07:00,2017,12,0.2,0.0,Cloudy
02/12/2017,12:00,40.759544,-73.97375,MANHATTAN,1.0,0.0,0,0,0,0,1,0,3614482,2017-02-12 12:00:00,2017-02-12T12:00,2017,2,-0.6,1.6,Heavy Snow
03/17/2017,10:00,40.785866,-73.950935,MANHATTAN,1.0,0.0,1,0,0,0,0,0,3635082,2017-03-17 10:00:00,2017-03-17T10:00,2017,3,-0.4,0.0,Clear
02/11/2017,8:00,40.75484,-73.98412,MANHATTAN,0.0,0.0,0,0,0,0,0,0,3613760,2017-02-11 08:00:00,2017-02-11T08:00,2017,2,-1.6,0.0,Cloudy
10/26/2017,22:00,40.757107,-73.997314,MANHATTAN,0.0,0.0,0,0,0,0,0,0,3781163,2017-10-26 22:00:00,2017-10-26T22:00,2017,10,10.1,0.0,Clear
11/06/2017,17:00,40.769222,-73.967316,MANHATTAN,0.0,0.0,0,0,0,0,0,0,3784794,2017-11-06 17:00:00,2017-11-06T17:00,2017,11,16.0,0.1,Drizzle
03/31/2017,5:00,40.71329,-73.998184,MANHATTAN,1.0,0.0,1,0,0,0,0,0,3642349,2017-03-31 05:00:00,2017-03-31T05:00,2017,3,3.8,0.6,Drizzle
04/25/2017,17:00,40.74044,-73.9946,MANHATTAN,1.0,0.0,0,0,0,0,1,0,3657679,2017-04-25 17:00:00,2017-04-25T17:00,2017,4,10.8,0.5,Drizzle
08/21/2017,0:00,40.756496,-73.988075,MANHATTAN,0.0,0.0,0,0,0,0,0,0,3734755,2017-08-21 00:00:00,2017-08-21T00:00,2017,8,19.6,0.0,Clear
06/16/2017,11:00,40.758533,-73.98885,MANHATTAN,1.0,0.0,1,0,0,0,0,0,3693828,2017-06-16 11:00:00,2017-06-16T11:00,2017,6,20.1,0.1,Drizzle
10/18/2017,15:00,40.75458,-73.99915,MANHATTAN,0.0,0.0,0,0,0,0,0,0,3773967,2017-10-18 15:00:00,2017-10-18T15:00,2017,10,21.1,0.0,Clear
03/28/2017,19:00,40.771782,-73.96544,MANHATTAN,1.0,0.0,1,0,0,0,0,0,3641054,2017-03-28 19:00:00,2017-03-28T19:00,2017,3,4.0,0.1,Drizzle
11/08/2017,12:00,40.774956,-73.96102,MANHATTAN,0.0,0.0,0,0,0,0,0,0,3786162,2017-11-08 12:00:00,2017-11-08T12:00,2017,11,7.8,0.0,Cloudy
05/04/2017,15:00,40.759624,-73.970085,MANHATTAN,1.0,0.0,0,0,1,0,0,0,3663498,2017-05-04 15:00:00,2017-05-04T15:00,2017,5,13.2,0.0,Cloudy
02/01/2017,8:00,40.759483,-73.99186,MANHATTAN,0.0,0.0,0,0,0,0,0,0,3608016,2017-02-01 08:00:00,2017-02-01T08:00,2017,2,3.0,0.0,Cloudy
01/03/2017,17:00,40.78519,-73.94934,MANHATTAN,1.0,0.0,1,0,0,0,0,0,3591820,2017-01-03 17:00:00,2017-01-03T17:00,2017,1,6.3,1.4,Light Rain
06/29/2017,17:00,40.71995,-74.00859,MANHATTAN,0.0,0.0,0,0,0,0,0,0,3702022,2017-06-29 17:00:00,2017-06-29T17:00,2017,6,24.6,0.0,Cloudy
12/23/2017,12:00,40.716278,-74.00454,MANHATTAN,0.0,0.0,0,0,0,0,0,0,3815866,2017-12-23 12:00:00,2017-12-23T12:00,2017,12,8.8,2.5,Heavy Rain
08/29/2017,0:00,40.776863,-73.94337,MANHATTAN,1.0,0.0,1,0,0,0,0,0,3740253,2017-08-29 00:00:00,2017-08-29T00:00,2017,8,16.8,0.0,Cloudy
08/04/2017,17:00,40.760017,-73.98405,MANHATTAN,1.0,0.0,1,0,0,0,0,0,3725107,2017-08-04 17:00:00,2017-08-04T17:00,2017,8,24.5,0.0,Clear
05/27/2017,12:00,40.735207,-74.00109,MANHATTAN,0.0,0.0,0,0,0,0,0,0,3680352,2017-05-27 12:00:00,2017-05-27T12:00,2017,5,21.2,0.0,Cloudy
06/14/2017,21:00,40.719593,-73.986755,MANHATTAN,2.0,0.0,0,0,0,0,2,0,3690727,2017-06-14 21:00:00,2017-06-14T21:00,2017,6,19.4,0.0,Cloudy
06/27/2017,15:00,40.812,-73.95509,MANHATTAN,1.0,0.0,1,0,0,0,0,0,3701415,2017-06-27 15:00:00,2017-06-27T15:00,2017,6,21.2,1.8,Light Rain
06/09/2017,10:00,40.77741,-73.978806,MANHATTAN,2.0,0.0,1,0,0,0,1,0,3690844,2017-06-09 10:00:00,2017-06-09T10:00,2017,6,22.2,0.0,Cloudy
11/20/2017,2:00,40.74822,-74.007484,MANHATTAN,0.0,0.0,0,0,0,0,0,0,3795352,2017-11-20 02:00:00,2017-11-20T02:00,2017,11,3.0,0.0,Clear
12/10/2017,20:00,40.745293,-73.9985,MANHATTAN,1.0,0.0,1,0,0,0,0,0,3809416,2017-12-10 20:00:00,2017-12-10T20:00,2017,12,0.1,0.0,Clear
10/16/2017,16:00,40.794735,-73.96988,MANHATTAN,2.0,0.0,0,0,0,0,2,0,3770931,2017-10-16 16:00:00,2017-10-16T16:00,2017,10,13.8,0.0,Cloudy
10/30/2017,16:00,40.73705,-73.98654,MANHATTAN,0.0,0.0,0,0,0,0,0,0,3782082,2017-10-30 16:00:00,2017-10-30T16:00,2017,10,12.8,0.0,Clear
04/28/2017,15:00,40.71913,-73.976364,MANHATTAN,1.0,0.0,0,0,0,0,1,0,3659313,2017-04-28 15:00:00,2017-04-28T15:00,2017,4,22.5,0.0,Clear
08/01/2017,10:00,40.823547,-73.95539,MANHATTAN,0.0,0.0,0,0,0,0,0,0,3723152,2017-08-01 10:00:00,2017-08-01T10:00,2017,8,27.5,0.0,Clear
04/27/2017,16:00,40.79021,-73.97504,MANHATTAN,1.0,0.0,0,0,0,0,1,0,3668757,2017-04-27 16:00:00,2017-04-27T16:00,2017,4,16.1,0.0,Cloudy
03/29/2017,14:00,40.71523,-74.01334,MANHATTAN,3.0,0.0,0,0,0,0,3,0,3642413,2017-03-29 14:00:00,2017-03-29T14:00,2017,3,14.7,0.0,Clear
04/17/2017,23:00,40.813095,-73.94161,MANHATTAN,1.0,0.0,0,0,1,0,0,0,3654091,2017-04-17 23:00:00,2017-04-17T23:00,2017,4,12.9,0.0,Cloudy
09/09/2017,15:00,40.79124,-73.9794,MANHATTAN,1.0,0.0,0,0,1,0,0,0,3746769,2017-09-09 15:00:00,2017-09-09T15:00,2017,9,19.5,0.0,Cloudy
01/26/2017,8:00,40.77723,-73.946175,MANHATTAN,2.0,0.0,0,0,0,0,2,0,3604902,2017-01-26 08:00:00,2017-01-26T08:00,2017,1,5.9,0.0,Cloudy
02/20/2017,17:00,40.81632,-73.95783,MANHATTAN,0.0,0.0,0,0,0,0,0,0,3619185,2017-02-20 17:00:00,2017-02-20T17:00,2017,2,7.1,0.0,Clear
03/24/2017,13:00,40.7501,-73.974945,MANHATTAN,0.0,0.0,0,0,0,0,0,0,3638188,2017-03-24 13:00:00,2017-03-24T13:00,2017,3,6.4,0.0,Cloudy
10/11/2017,22:00,40.797676,-73.93729,MANHATTAN,0.0,0.0,0,0,0,0,0,0,3767722,2017-10-11 22:00:00,2017-10-11T22:00,2017,10,17.2,0.0,Cloudy
11/27/2017,18:00,40.72125,-73.99224,MANHATTAN,1.0,0.0,1,0,0,0,0,0,3798930,2017-11-27 18:00:00,2017-11-27T18:00,2017,11,4.8,0.0,Cloudy
02/09/2017,9:00,40.717327,-73.99946,MANHATTAN,0.0,0.0,0,0,0,0,0,0,3613010,2017-02-09 09:00:00,2017-02-09T09:00,2017,2,-2.6,3.6,Heavy Snow
05/25/2017,13:00,40.802753,-73.93358,MANHATTAN,0.0,0.0,0,0,0,0,0,0,3678012,2017-05-25 13:00:00,2017-05-25T13:00,2017,5,14.6,0.1,Drizzle
06/14/2017,16:00,40.791084,-73.953445,MANHATTAN,1.0,0.0,0,0,0,0,1,0,3691744,2017-06-14 16:00:00,2017-06-14T16:00,2017,6,24.7,0.0,Cloudy
09/10/2017,13:00,40.758915,-73.9997,MANHATTAN,0.0,0.0,0,0,0,0,0,0,3748204,2017-09-10 13:00:00,2017-09-10T13:00,2017,9,21.3,0.0,Clear
06/24/2017,9:00,40.755756,-73.96479,MANHATTAN,0.0,0.0,0,0,0,0,0,0,3697732,2017-06-24 09:00:00,2017-06-24T09:00,2017,6,24.0,0.0,Clear
02/20/2017,13:00,40.79356,-73.96702,MANHATTAN,0.0,0.0,0,0,0,0,0,0,3619442,2017-02-20 13:00:00,2017-02-20T13:00,2017,2,10.8,0.0,Clear
04/29/2017,1:00,40.75578,-74.00199,MANHATTAN,0.0,0.0,0,0,0,0,0,0,3660759,2017-04-29 01:00:00,2017-04-29T01:00,2017,4,16.7,0.0,Cloudy
08/24/2017,17:00,40.73337,-74.00258,MANHATTAN,0.0,0.0,0,0,0,0,0,0,3736963,2017-08-24 17:00:00,2017-08-24T17:00,2017,8,24.9,0.0,Cloudy
01/07/2017,9:00,40.79398,-73.97229,MANHATTAN,1.0,0.0,0,0,0,0,1,0,3594398,2017-01-07 09:00:00,2017-01-07T09:00,2017,1,-5.2,0.3,Heavy Snow
02/13/2017,17:00,40.86449,-73.92025,MANHATTAN,0.0,0.0,0,0,0,0,0,0,3615317,2017-02-13 17:00:00,2017-02-13T17:00,2017,2,0.3,0.0,Cloudy
01/16/2017,2:00,40.86507,-73.92696,MANHATTAN,1.0,0.0,0,0,0,0,1,0,3598994,2017-01-16 02:00:00,2017-01-16T02:00,2017,1,-3.9,0.0,Clear
03/03/2017,16:00,40.783146,-73.97833,MANHATTAN,1.0,0.0,0,0,0,0,1,0,3625811,2017-03-03 16:00:00,2017-03-03T16:00,2017,3,3.1,0.0,Cloudy
04/14/2017,18:00,40.72235,-73.99327,MANHATTAN,1.0,0.0,0,0,0,0,1,0,3652660,2017-04-14 18:00:00,2017-04-14T18:00,2017,4,11.0,0.0,Clear
02/08/2017,13:00,40.813564,-73.951324,MANHATTAN,0.0,0.0,0,0,0,0,0,0,3611936,2017-02-08 13:00:00,2017-02-08T13:00,2017,2,14.7,0.0,Cloudy
05/03/2017,10:00,40.7224,-73.99165,MANHATTAN,1.0,0.0,0,0,1,0,0,0,3662934,2017-05-03 10:00:00,2017-05-03T10:00,2017,5,15.8,0.0,Cloudy
02/11/2017,19:00,40.823505,-73.94144,MANHATTAN,1.0,0.0,0,0,1,0,0,0,3615206,2017-02-11 19:00:00,2017-02-11T19:00,2017,2,0.2,0.0,Cloudy
01/17/2017,12:00,40.715996,-74.0071,MANHATTAN,1.0,0.0,1,0,0,0,0,0,3603634,2017-01-17 12:00:00,2017-01-17T12:00,2017,1,4.9,0.0,Cloudy
02/09/2017,12:00,40.713272,-73.98337,MANHATTAN,0.0,0.0,0,0,0,0,0,0,3612968,2017-02-09 12:00:00,2017-02-09T12:00,2017,2,-2.5,1.5,Heavy Snow
09/15/2017,16:00,40.75658,-73.98616,MANHATTAN,0.0,0.0,0,0,0,0,0,0,3751484,2017-09-15 16:00:00,2017-09-15T16:00,2017,9,24.5,0.0,Clear
03/16/2017,14:00,40.779476,-73.97358,MANHATTAN,2.0,0.0,0,0,0,0,2,0,3634534,2017-03-16 14:00:00,2017-03-16T14:00,2017,3,0.8,0.0,Cloudy
02/24/2017,9:00,40.748238,-73.98996,MANHATTAN,1.0,0.0,1,0,0,0,0,0,3621797,2017-02-24 09:00:00,2017-02-24T09:00,2017,2,14.3,0.0,Cloudy
06/29/2017,13:00,40.70211,-74.01125,MANHATTAN,1.0,0.0,1,0,0,0,0,0,3702428,2017-06-29 13:00:00,2017-06-29T13:00,2017,6,28.4,0.0,Cloudy
02/25/2017,9:00,40.822258,-73.95616,MANHATTAN,0.0,0.0,0,0,0,0,0,0,3623096,2017-02-25 09:00:00,2017-02-25T09:00,2017,2,11.7,0.0,Cloudy
07/07/2017,14:00,40.72605,-73.98354,MANHATTAN,1.0,0.0,0,0,1,0,0,0,3711010,2017-07-07 14:00:00,2017-07-07T14:00,2017,7,24.0,0.0,Clear
04/28/2017,21:00,40.757915,-73.99145,MANHATTAN,0.0,0.0,0,0,0,0,0,0,3659619,2017-04-28 21:00:00,2017-04-28T21:00,2017,4,18.7,0.0,Cloudy
03/29/2017,13:00,40.725796,-73.99762,MANHATTAN,0.0,0.0,0,0,0,0,0,0,3641501,2017-03-29 13:00:00,2017-03-29T13:00,2017,3,14.4,0.0,Clear
04/02/2017,18:00,40.778606,-73.98163,MANHATTAN,0.0,0.0,0,0,0,0,0,0,3643915,2017-04-02 18:00:00,2017-04-02T18:00,2017,4,11.1,0.0,Cloudy
02/20/2017,7:00,40.73058,-74.00169,MANHATTAN,0.0,0.0,0,0,0,0,0,0,3619350,2017-02-20 07:00:00,2017-02-20T07:00,2017,2,4.6,0.0,Clear
08/23/2017,0:00,40.754154,-73.9804,MANHATTAN,1.0,0.0,0,0,1,0,0,0,3737356,2017-08-23 00:00:00,2017-08-23T00:00,2017,8,22.9,3.8,Heavy Rain
07/09/2017,3:00,40.759575,-73.96803,MANHATTAN,2.0,0.0,0,0,0,0,2,0,3707208,2017-07-09 03:00:00,2017-07-09T03:00,2017,7,18.9,0.0,Clear
02/16/2017,0:00,40.867283,-73.91685,MANHATTAN,0.0,0.0,0,0,0,0,0,0,3617103,2017-02-16 00:00:00,2017-02-16T00:00,2017,2,-0.2,0.0,Clear
07/28/2017,0:00,40.726185,-73.98943,MANHATTAN,1.0,0.0,1,0,0,0,0,0,3721551,2017-07-28 00:00:00,2017-07-28T00:00,2017,7,22.2,0.1,Drizzle
03/09/2017,14:00,40.729095,-74.00524,MANHATTAN,1.0,0.0,1,0,0,0,0,0,3632103,2017-03-09 14:00:00,2017-03-09T14:00,2017,3,14.1,0.0,Clear
11/14/2017,19:00,40.84322,-73.939186,MANHATTAN,1.0,0.0,1,0,0,0,0,0,3791128,2017-11-14 19:00:00,2017-11-14T19:00,2017,11,4.9,0.0,Clear
06/11/2017,3:00,40.73978,-73.98543,MANHATTAN,5.0,0.0,0,0,0,0,5,0,3688632,2017-06-11 03:00:00,2017-06-11T03:00,2017,6,19.7,0.0,Clear
08/04/2017,20:00,40.74715,-73.985504,MANHATTAN,1.0,0.0,1,0,0,0,0,0,3725569,2017-08-04 20:00:00,2017-08-04T20:00,2017,8,23.2,0.0,Clear
09/12/2017,16:00,40.777092,-73.98211,MANHATTAN,1.0,0.0,0,0,1,0,0,0,3750344,2017-09-12 16:00:00,2017-09-12T16:00,2017,9,25.2,0.0,Cloudy
07/25/2017,4:00,40.754677,-73.975815,MANHATTAN,1.0,0.0,1,0,0,0,0,0,3717996,2017-07-25 04:00:00,2017-07-25T04:00,2017,7,15.9,0.0,Cloudy
01/17/2017,16:00,40.748657,-73.99232,MANHATTAN,0.0,0.0,0,0,0,0,0,0,3602136,2017-01-17 16:00:00,2017-01-17T16:00,2017,1,4.2,0.1,Drizzle
10/15/2017,21:00,40.743595,-74.00029,MANHATTAN,1.0,0.0,1,0,0,0,0,0,3772171,2017-10-15 21:00:00,2017-10-15T21:00,2017,10,19.9,0.0,Clear
02/19/2017,0:00,40.784237,-73.947075,MANHATTAN,4.0,0.0,0,0,0,0,4,0,3617969,2017-02-19 00:00:00,2017-02-19T00:00,2017,2,9.3,0.0,Cloudy
02/23/2017,12:00,40.76781,-73.96202,MANHATTAN,0.0,0.0,0,0,0,0,0,0,3620606,2017-02-23 12:00:00,2017-02-23T12:00,2017,2,11.7,0.0,Cloudy
02/24/2017,10:00,40.75595,-73.99074,MANHATTAN,0.0,0.0,0,0,0,0,0,0,3622067,2017-02-24 10:00:00,2017-02-24T10:00,2017,2,16.5,0.0,Cloudy
08/14/2017,11:00,40.720432,-74.00675,MANHATTAN,1.0,0.0,0,0,0,0,1,0,3732029,2017-08-14 11:00:00,2017-08-14T11:00,2017,8,25.7,0.0,Cloudy
05/04/2017,7:00,40.75578,-74.00199,MANHATTAN,0.0,0.0,0,0,0,0,0,0,3663713,2017-05-04 07:00:00,2017-05-04T07:00,2017,5,11.0,0.0,Clear
06/23/2017,20:00,40.8166,-73.942764,MANHATTAN,1.0,0.0,0,0,1,0,0,0,3698916,2017-06-23 20:00:00,2017-06-23T20:00,2017,6,24.8,1.3,Light Rain
11/29/2017,20:00,40.763058,-73.98182,MANHATTAN,0.0,0.0,0,0,0,0,0,0,3799912,2017-11-29 20:00:00,2017-11-29T20:00,2017,11,6.0,0.0,Clear
01/23/2017,17:00,40.73722,-73.9814,MANHATTAN,0.0,0.0,0,0,0,0,0,0,3604284,2017-01-23 17:00:00,2017-01-23T17:00,2017,1,2.2,0.4,Drizzle
02/03/2017,9:00,40.735798,-73.976105,MANHATTAN,1.0,0.0,1,0,0,0,0,0,3610729,2017-02-03 09:00:00,2017-02-03T09:00,2017,2,-2.6,0.0,Cloudy
01/27/2017,22:00,40.733826,-74.00137,MANHATTAN,1.0,0.0,1,0,0,0,0,0,3606662,2017-01-27 22:00:00,2017-01-27T22:00,2017,1,1.6,0.0,Clear
01/01/2017,0:00,40.74311,-73.992676,MANHATTAN,2.0,0.0,2,0,0,0,0,0,3593809,2017-01-01 00:00:00,2017-01-01T00:00,2017,1,5.8,0.0,Cloudy
03/09/2017,20:00,40.718006,-73.9866,MANHATTAN,1.0,0.0,0,0,0,0,1,0,3629932,2017-03-09 20:00:00,2017-03-09T20:00,2017,3,9.4,0.0,Cloudy
05/19/2017,22:00,40.71629,-73.98783,MANHATTAN,1.0,0.0,0,0,1,0,0,0,3675843,2017-05-19 22:00:00,2017-05-19T22:00,2017,5,19.7,0.0,Cloudy
09/06/2017,14:00,40.716267,-74.00132,MANHATTAN,0.0,0.0,0,0,0,0,0,0,3744766,2017-09-06 14:00:00,2017-09-06T14:00,2017,9,18.6,1.0,Drizzle
05/24/2017,13:00,40.76428,-73.97302,MANHATTAN,1.0,0.0,1,0,0,0,0,0,3677728,2017-05-24 13:00:00,2017-05-24T13:00,2017,5,17.3,0.0,Cloudy
04/01/2017,17:00,40.732346,-73.98495,MANHATTAN,1.0,0.0,1,0,0,0,0,0,3643150,2017-04-01 17:00:00,2017-04-01T17:00,2017,4,7.5,0.0,Cloudy
09/30/2017,20:00,40.852184,-73.941444,MANHATTAN,1.0,0.0,0,0,0,0,1,0,3761967,2017-09-30 20:00:00,2017-09-30T20:00,2017,9,13.0,0.0,Clear
05/24/2017,15:00,40.709503,-74.00167,MANHATTAN,1.0,0.0,1,0,0,0,0,0,3677770,2017-05-24 15:00:00,2017-05-24T15:00,2017,5,18.7,0.0,Cloudy
06/27/2017,23:00,40.783325,-73.9587,MANHATTAN,0.0,0.0,0,0,0,0,0,0,3701411,2017-06-27 23:00:00,2017-06-27T23:00,2017,6,17.1,0.0,Clear
01/10/2017,15:00,40.87122,-73.91416,MANHATTAN,0.0,0.0,0,0,0,0,0,0,3596208,2017-01-10 15:00:00,2017-01-10T15:00,2017,1,1.5,0.0,Cloudy
03/12/2017,13:00,40.706657,-74.015915,MANHATTAN,1.0,0.0,0,0,0,0,1,0,3633145,2017-03-12 13:00:00,2017-03-12T13:00,2017,3,-0.4,0.0,Clear
04/17/2017,21:00,40.75458,-73.99915,MANHATTAN,0.0,0.0,0,0,0,0,0,0,3653537,2017-04-17 21:00:00,2017-04-17T21:00,2017,4,15.0,0.0,Cloudy
01/03/2017,18:00,40.796642,-73.96848,MANHATTAN,1.0,0.0,1,0,0,0,0,0,3593290,2017-01-03 18:00:00,2017-01-03T18:00,2017,1,6.1,0.3,Drizzle
09/19/2017,12:00,40.7222,-74.010445,MANHATTAN,0.0,0.0,0,0,0,0,0,0,3753499,2017-09-19 12:00:00,2017-09-19T12:00,2017,9,24.8,0.0,Cloudy
10/21/2017,22:00,40.716587,-74.008385,MANHATTAN,1.0,0.0,0,0,1,0,0,0,3774473,2017-10-21 22:00:00,2017-10-21T22:00,2017,10,13.4,0.0,Clear
05/13/2017,10:00,40.7171,-73.9986,MANHATTAN,0.0,0.0,0,0,0,0,0,0,3670549,2017-05-13 10:00:00,2017-05-13T10:00,2017,5,9.9,1.7,Light Rain
09/16/2017,21:00,40.825108,-73.940254,MANHATTAN,1.0,0.0,1,0,0,0,0,0,3752182,2017-09-16 21:00:00,2017-09-16T21:00,2017,9,20.6,0.0,Clear
10/08/2017,17:00,40.74766,-73.99304,MANHATTAN,0.0,0.0,0,0,0,0,0,0,3766406,2017-10-08 17:00:00,2017-10-08T17:00,2017,10,23.7,0.0,Cloudy
03/31/2017,21:00,40.860046,-73.92685,MANHATTAN,1.0,0.0,0,0,0,0,1,0,3648741,2017-03-31 21:00:00,2017-03-31T21:00,2017,3,2.8,2.0,Light Rain
09/13/2017,18:00,40.797676,-73.93729,MANHATTAN,1.0,0.0,0,0,0,0,1,0,3749292,2017-09-13 18:00:00,2017-09-13T18:00,2017,9,21.8,0.0,Clear
09/08/2017,15:00,40.82335,-73.94913,MANHATTAN,1.0,0.0,0,0,0,0,1,0,3746367,2017-09-08 15:00:00,2017-09-08T15:00,2017,9,20.9,0.0,Cloudy
05/04/2017,21:00,40.732983,-73.99118,MANHATTAN,1.0,0.0,0,0,1,0,0,0,3665401,2017-05-04 21:00:00,2017-05-04T21:00,2017,5,10.3,0.0,Cloudy
07/16/2017,2:00,40.846153,-73.932335,MANHATTAN,0.0,0.0,0,0,0,0,0,0,3712862,2017-07-16 02:00:00,2017-07-16T02:00,2017,7,19.5,0.0,Clear
06/06/2017,11:00,40.766712,-73.98289,MANHATTAN,1.0,0.0,1,0,0,0,0,0,3685281,2017-06-06 11:00:00,2017-06-06T11:00,2017,6,13.7,0.0,Cloudy
07/20/2017,16:00,40.75671,-73.986465,MANHATTAN,0.0,0.0,0,0,0,0,0,0,3716882,2017-07-20 16:00:00,2017-07-20T16:00,2017,7,32.1,0.0,Cloudy
12/09/2017,14:00,40.747295,-73.97405,MANHATTAN,1.0,0.0,0,0,0,0,1,0,3805673,2017-12-09 14:00:00,2017-12-09T14:00,2017,12,0.1,0.7,Heavy Snow
04/02/2017,0:00,40.74708,-73.98135,MANHATTAN,4.0,0.0,0,0,0,0,4,0,3643551,2017-04-02 00:00:00,2017-04-02T00:00,2017,4,4.9,0.0,Clear
03/31/2017,15:00,40.73975,-74.00253,MANHATTAN,1.0,0.0,1,0,0,0,0,0,3644051,2017-03-31 15:00:00,2017-03-31T15:00,2017,3,5.0,1.1,Drizzle
04/12/2017,0:00,40.74063,-73.9789,MANHATTAN,1.0,0.0,1,0,0,0,0,0,3654591,2017-04-12 00:00:00,2017-04-12T00:00,2017,4,14.1,0.0,Clear
07/24/2017,1:00,40.72543,-73.99678,MANHATTAN,1.0,0.0,0,0,0,0,1,0,4024540,2017-07-24 01:00:00,2017-07-24T01:00,2017,7,21.4,1.3,Light Rain
04/05/2017,11:00,40.70745,-74.011955,MANHATTAN,1.0,0.0,1,0,0,0,0,0,3646401,2017-04-05 11:00:00,2017-04-05T11:00,2017,4,13.6,0.0,Cloudy
08/26/2017,23:00,40.708378,-74.01121,MANHATTAN,2.0,0.0,1,0,0,0,1,0,3738842,2017-08-26 23:00:00,2017-08-26T23:00,2017,8,16.1,0.0,Clear
03/14/2017,19:00,40.74769,-74.00417,MANHATTAN,0.0,0.0,0,0,0,0,0,0,3632226,2017-03-14 19:00:00,2017-03-14T19:00,2017,3,-0.6,0.0,Cloudy
02/24/2017,13:00,40.806786,-73.94318,MANHATTAN,1.0,0.0,0,0,1,0,0,0,3622883,2017-02-24 13:00:00,2017-02-24T13:00,2017,2,17.9,0.0,Clear
08/30/2017,20:00,40.762184,-73.993614,MANHATTAN,1.0,0.0,0,0,0,0,1,0,3740356,2017-08-30 20:00:00,2017-08-30T20:00,2017,8,20.8,0.0,Clear
10/03/2017,13:00,40.821117,-73.957466,MANHATTAN,0.0,0.0,0,0,0,0,0,0,3766583,2017-10-03 13:00:00,2017-10-03T13:00,2017,10,19.4,0.0,Cloudy
08/29/2017,10:00,40.82298,-73.94636,MANHATTAN,0.0,0.0,0,0,0,0,0,0,3739598,2017-08-29 10:00:00,2017-08-29T10:00,2017,8,19.4,0.0,Cloudy
01/20/2017,0:00,40.77178,-73.9792,MANHATTAN,1.0,0.0,0,0,1,0,0,0,3602264,2017-01-20 00:00:00,2017-01-20T00:00,2017,1,0.3,0.0,Clear
05/12/2017,13:00,40.723976,-74.00831,MANHATTAN,1.0,0.0,0,0,0,0,1,0,3669239,2017-05-12 13:00:00,2017-05-12T13:00,2017,5,13.5,0.0,Cloudy
01/17/2017,15:00,40.705612,-74.01333,MANHATTAN,1.0,0.0,0,0,0,0,1,0,3600819,2017-01-17 15:00:00,2017-01-17T15:00,2017,1,4.2,0.2,Drizzle
07/24/2017,21:00,40.709305,-74.01194,MANHATTAN,0.0,0.0,0,0,0,0,0,0,3718029,2017-07-24 21:00:00,2017-07-24T21:00,2017,7,18.7,0.0,Cloudy
08/08/2017,18:00,40.73696,-73.98451,MANHATTAN,2.0,0.0,0,0,0,0,2,0,3727865,2017-08-08 18:00:00,2017-08-08T18:00,2017,8,23.6,0.0,Clear
08/01/2017,21:00,40.75991,-73.95882,MANHATTAN,1.0,0.0,1,0,0,0,0,0,3726200,2017-08-01 21:00:00,2017-08-01T21:00,2017,8,23.8,0.0,Cloudy
02/04/2017,9:00,40.824703,-73.944275,MANHATTAN,0.0,0.0,0,0,0,0,0,0,3610828,2017-02-04 09:00:00,2017-02-04T09:00,2017,2,-4.3,0.0,Clear
11/20/2017,14:00,40.721252,-74.00146,MANHATTAN,1.0,0.0,0,0,1,0,0,0,3794120,2017-11-20 14:00:00,2017-11-20T14:00,2017,11,7.7,0.0,Cloudy
08/27/2017,17:00,40.72388,-73.996956,MANHATTAN,1.0,0.0,0,0,0,0,1,0,3738861,2017-08-27 17:00:00,2017-08-27T17:00,2017,8,21.7,0.0,Cloudy
11/10/2017,8:00,40.80864,-73.93964,MANHATTAN,1.0,0.0,0,0,1,0,0,0,3798212,2017-11-10 08:00:00,2017-11-10T08:00,2017,11,3.5,0.0,Clear
03/20/2017,13:00,40.75638,-73.98779,MANHATTAN,0.0,0.0,0,0,0,0,0,0,3635887,2017-03-20 13:00:00,2017-03-20T13:00,2017,3,8.6,0.0,Clear
06/05/2017,23:00,40.784943,-73.946594,MANHATTAN,0.0,0.0,0,0,0,0,0,0,3686902,2017-06-05 23:00:00,2017-06-05T23:00,2017,6,15.3,0.0,Cloudy
05/11/2017,17:00,40.71851,-73.9881,MANHATTAN,1.0,0.0,1,0,0,0,0,0,3668086,2017-05-11 17:00:00,2017-05-11T17:00,2017,5,13.9,0.0,Cloudy
04/20/2017,0:00,40.7599,-73.98043,MANHATTAN,1.0,0.0,1,0,0,0,0,0,3654625,2017-04-20 00:00:00,2017-04-20T00:00,2017,4,9.1,0.1,Drizzle
04/26/2017,16:00,40.717926,-73.98568,MANHATTAN,0.0,0.0,0,0,0,0,0,0,3658124,2017-04-26 16:00:00,2017-04-26T16:00,2017,4,16.2,0.0,Cloudy
01/20/2017,0:00,40.803486,-73.93529,MANHATTAN,0.0,0.0,0,0,0,0,0,0,3601532,2017-01-20 00:00:00,2017-01-20T00:00,2017,1,1.3,0.0,Cloudy
06/15/2017,17:00,40.7923,-73.95046,MANHATTAN,0.0,0.0,0,0,0,0,0,0,3694271,2017-06-15 17:00:00,2017-06-15T17:00,2017,6,20.5,0.0,Cloudy
12/23/2017,0:00,40.797478,-73.9488,MANHATTAN,1.0,0.0,0,0,0,0,1,0,3825154,2017-12-23 00:00:00,2017-12-23T00:00,2017,12,4.1,0.0,Cloudy
10/31/2017,0:00,40.759727,-73.99169,MANHATTAN,1.0,0.0,1,0,0,0,0,0,3781009,2017-10-31 00:00:00,2017-10-31T00:00,2017,10,10.1,0.0,Clear
02/14/2017,0:00,40.75887,-73.96428,MANHATTAN,1.0,0.0,0,0,1,0,0,0,3616130,2017-02-14 00:00:00,2017-02-14T00:00,2017,2,-3.4,0.0,Clear
01/24/2017,7:00,40.762634,-73.97423,MANHATTAN,1.0,0.0,0,0,0,0,1,0,3603643,2017-01-24 07:00:00,2017-01-24T07:00,2017,1,2.1,0.1,Drizzle
09/03/2017,3:00,40.835308,-73.94398,MANHATTAN,1.0,0.0,1,0,0,0,0,0,3741622,2017-09-03 03:00:00,2017-09-03T03:00,2017,9,17.0,0.0,Cloudy
09/16/2017,9:00,40.74112,-73.97856,MANHATTAN,1.0,0.0,0,0,0,0,1,0,3751162,2017-09-16 09:00:00,2017-09-16T09:00,2017,9,23.6,0.0,Cloudy
06/29/2017,9:00,40.719933,-73.97876,MANHATTAN,1.0,0.0,0,0,0,0,1,0,3701783,2017-06-29 09:00:00,2017-06-29T09:00,2017,6,23.8,0.0,Cloudy
04/28/2017,0:00,40.743484,-73.99422,MANHATTAN,0.0,0.0,0,0,0,0,0,0,3665297,2017-04-28 00:00:00,2017-04-28T00:00,2017,4,12.3,0.0,Cloudy
03/17/2017,13:00,40.749516,-73.96932,MANHATTAN,0.0,0.0,0,0,0,0,0,0,3634024,2017-03-17 13:00:00,2017-03-17T13:00,2017,3,3.1,0.0,Clear
04/13/2017,19:00,40.782516,-73.97686,MANHATTAN,1.0,0.0,1,0,0,0,0,0,3650882,2017-04-13 19:00:00,2017-04-13T19:00,2017,4,13.3,0.0,Cloudy
03/25/2017,10:00,40.717407,-73.987885,MANHATTAN,0.0,0.0,0,0,0,0,0,0,3639144,2017-03-25 10:00:00,2017-03-25T10:00,2017,3,13.1,0.0,Cloudy
05/18/2017,4:00,40.85894,-73.922935,MANHATTAN,1.0,0.0,0,0,0,0,1,0,3676966,2017-05-18 04:00:00,2017-05-18T04:00,2017,5,20.1,0.0,Cloudy
01/18/2017,22:00,40.82314,-73.938644,MANHATTAN,1.0,0.0,0,0,0,0,1,0,3600622,2017-01-18 22:00:00,2017-01-18T22:00,2017,1,3.6,0.0,Cloudy
03/22/2017,11:00,40.867107,-73.92083,MANHATTAN,0.0,0.0,0,0,0,0,0,0,3637696,2017-03-22 11:00:00,2017-03-22T11:00,2017,3,-0.5,0.0,Clear
12/22/2017,14:00,40.746857,-74.008,MANHATTAN,1.0,0.0,0,0,0,0,1,0,3816315,2017-12-22 14:00:00,2017-12-22T14:00,2017,12,8.0,0.0,Cloudy
05/20/2017,15:00,40.800793,-73.93492,MANHATTAN,1.0,0.0,0,0,0,0,1,0,3680246,2017-05-20 15:00:00,2017-05-20T15:00,2017,5,15.9,0.0,Cloudy
03/10/2017,21:00,40.756996,-73.96698,MANHATTAN,1.0,0.0,0,0,1,0,0,0,3629686,2017-03-10 21:00:00,2017-03-10T21:00,2017,3,-2.4,0.0,Clear
12/08/2017,13:00,40.79546,-73.969635,MANHATTAN,0.0,0.0,0,0,0,0,0,0,3806206,2017-12-08 13:00:00,2017-12-08T13:00,2017,12,2.8,0.0,Cloudy
09/08/2017,23:00,40.733166,-74.01014,MANHATTAN,2.0,0.0,0,0,0,0,2,0,3750286,2017-09-08 23:00:00,2017-09-08T23:00,2017,9,14.6,0.0,Clear
05/15/2017,16:00,40.719517,-73.994385,MANHATTAN,1.0,0.0,0,0,0,0,1,0,3673335,2017-05-15 16:00:00,2017-05-15T16:00,2017,5,18.0,0.0,Cloudy
02/21/2017,7:00,40.75671,-73.986465,MANHATTAN,1.0,0.0,1,0,0,0,0,0,3619357,2017-02-21 07:00:00,2017-02-21T07:00,2017,2,-2.4,0.0,Cloudy
07/06/2017,8:00,40.714645,-74.00737,MANHATTAN,1.0,0.0,0,0,0,0,1,0,3705984,2017-07-06 08:00:00,2017-07-06T08:00,2017,7,22.1,0.1,Drizzle
11/26/2017,13:00,40.70605,-74.00746,MANHATTAN,1.0,0.0,0,0,1,0,0,0,3798420,2017-11-26 13:00:00,2017-11-26T13:00,2017,11,7.7,0.0,Clear
06/09/2017,1:00,40.75022,-73.979065,MANHATTAN,1.0,0.0,0,0,0,0,1,0,3686762,2017-06-09 01:00:00,2017-06-09T01:00,2017,6,11.1,0.0,Cloudy
07/30/2017,17:00,40.810318,-73.943634,MANHATTAN,1.0,0.0,1,0,0,0,0,0,3721916,2017-07-30 17:00:00,2017-07-30T17:00,2017,7,25.3,0.0,Clear
12/23/2017,0:00,40.866447,-73.9305,MANHATTAN,1.0,0.0,0,0,0,0,1,0,3817220,2017-12-23 00:00:00,2017-12-23T00:00,2017,12,3.9,0.0,Cloudy
04/22/2017,16:00,40.749096,-73.980194,MANHATTAN,1.0,0.0,0,0,0,0,1,0,3655231,2017-04-22 16:00:00,2017-04-22T16:00,2017,4,11.8,0.2,Drizzle
10/17/2017,21:00,40.865547,-73.92728,MANHATTAN,2.0,0.0,0,0,0,0,2,0,3772382,2017-10-17 21:00:00,2017-10-17T21:00,2017,10,11.1,0.0,Clear
08/08/2017,11:00,40.757362,-73.96068,MANHATTAN,1.0,0.0,0,0,0,0,1,0,3727073,2017-08-08 11:00:00,2017-08-08T11:00,2017,8,22.2,0.0,Cloudy
11/14/2017,9:00,40.71436,-74.00839,MANHATTAN,0.0,0.0,0,0,0,0,0,0,3790169,2017-11-14 09:00:00,2017-11-14T09:00,2017,11,4.5,0.0,Cloudy
04/13/2017,4:00,40.719666,-73.99187,MANHATTAN,1.0,0.0,1,0,0,0,0,0,3650419,2017-04-13 04:00:00,2017-04-13T04:00,2017,4,7.1,0.0,Clear
02/09/2017,20:00,40.769848,-73.98432,MANHATTAN,1.0,0.0,1,0,0,0,0,0,3612858,2017-02-09 20:00:00,2017-02-09T20:00,2017,2,-7.2,0.0,Cloudy
08/03/2017,0:00,40.720753,-74.01008,MANHATTAN,1.0,0.0,0,0,0,0,1,0,3724217,2017-08-03 00:00:00,2017-08-03T00:00,2017,8,20.0,0.0,Cloudy
05/16/2017,20:00,40.739243,-73.99919,MANHATTAN,1.0,0.0,0,0,1,0,0,0,3671606,2017-05-16 20:00:00,2017-05-16T20:00,2017,5,18.2,0.0,Clear
07/11/2017,22:00,40.754505,-73.965706,MANHATTAN,1.0,0.0,1,0,0,0,0,0,3709209,2017-07-11 22:00:00,2017-07-11T22:00,2017,7,24.1,0.0,Cloudy
01/19/2017,21:00,40.723938,-73.987976,MANHATTAN,2.0,0.0,1,0,0,0,1,0,3602175,2017-01-19 21:00:00,2017-01-19T21:00,2017,1,3.2,0.0,Cloudy
12/15/2017,22:00,40.728844,-73.98152,MANHATTAN,1.0,0.0,0,0,1,0,0,0,3836432,2017-12-15 22:00:00,2017-12-15T22:00,2017,12,-4.6,0.0,Clear
01/24/2017,0:00,40.77753,-73.975006,MANHATTAN,0.0,0.0,0,0,0,0,0,0,3605113,2017-01-24 00:00:00,2017-01-24T00:00,2017,1,2.9,3.7,Heavy Rain
07/14/2017,22:00,40.763546,-73.969345,MANHATTAN,1.0,0.0,1,0,0,0,0,0,3712039,2017-07-14 22:00:00,2017-07-14T22:00,2017,7,20.2,0.0,Cloudy
10/10/2017,12:00,40.813946,-73.93675,MANHATTAN,1.0,0.0,0,0,0,0,1,0,3766865,2017-10-10 12:00:00,2017-10-10T12:00,2017,10,25.3,0.0,Clear
04/21/2017,0:00,40.726013,-74.009415,MANHATTAN,1.0,0.0,0,0,0,0,1,0,3655304,2017-04-21 00:00:00,2017-04-21T00:00,2017,4,10.6,0.7,Drizzle
02/07/2017,18:00,40.7429,-73.99281,MANHATTAN,1.0,0.0,0,0,1,0,0,0,3611595,2017-02-07 18:00:00,2017-02-07T18:00,2017,2,4.0,0.0,Cloudy
01/20/2017,9:00,40.74959,-74.00279,MANHATTAN,0.0,0.0,0,0,0,0,0,0,3602250,2017-01-20 09:00:00,2017-01-20T09:00,2017,1,4.4,0.0,Cloudy
05/23/2017,13:00,40.75163,-73.988174,MANHATTAN,1.0,0.0,0,0,0,0,1,0,3701598,2017-05-23 13:00:00,2017-05-23T13:00,2017,5,20.0,0.0,Cloudy
06/27/2017,16:00,40.848118,-73.93089,MANHATTAN,1.0,0.0,0,0,0,0,1,0,3705330,2017-06-27 16:00:00,2017-06-27T16:00,2017,6,21.8,0.0,Cloudy
07/07/2017,9:00,40.748993,-73.9995,MANHATTAN,1.0,0.0,0,0,0,0,1,0,3707700,2017-07-07 09:00:00,2017-07-07T09:00,2017,7,21.2,6.9,Heavy Rain
01/03/2017,13:00,40.759575,-73.96803,MANHATTAN,1.0,0.0,0,0,0,0,1,0,3834874,2017-01-03 13:00:00,2017-01-03T13:00,2017,1,5.5,0.7,Drizzle
12/07/2017,4:00,40.721447,-73.997406,MANHATTAN,1.0,0.0,1,0,0,0,0,0,3804997,2017-12-07 04:00:00,2017-12-07T04:00,2017,12,2.6,0.0,Clear
06/08/2017,10:00,40.7189,-73.988045,MANHATTAN,1.0,0.0,0,0,1,0,0,0,3694730,2017-06-08 10:00:00,2017-06-08T10:00,2017,6,19.8,0.0,Cloudy
07/07/2017,17:00,40.864525,-73.92663,MANHATTAN,0.0,0.0,0,0,0,0,0,0,3710561,2017-07-07 17:00:00,2017-07-07T17:00,2017,7,25.1,0.0,Cloudy
04/03/2017,12:00,40.75645,-73.97032,MANHATTAN,0.0,0.0,0,0,0,0,0,0,3644724,2017-04-03 12:00:00,2017-04-03T12:00,2017,4,14.7,0.0,Cloudy
02/11/2017,17:00,40.72679,-74.00351,MANHATTAN,0.0,0.0,0,0,0,0,0,0,3613663,2017-02-11 17:00:00,2017-02-11T17:00,2017,2,3.8,0.0,Cloudy
01/03/2017,11:00,40.86955,-73.91519,MANHATTAN,1.0,0.0,0,0,0,0,1,0,3822356,2017-01-03 11:00:00,2017-01-03T11:00,2017,1,5.0,0.7,Drizzle
10/24/2017,3:00,40.711105,-74.000404,MANHATTAN,0.0,0.0,0,0,0,0,0,0,3778840,2017-10-24 03:00:00,2017-10-24T03:00,2017,10,19.7,0.0,Cloudy
12/09/2017,20:00,40.818947,-73.95221,MANHATTAN,1.0,0.0,0,0,0,0,1,0,3808716,2017-12-09 20:00:00,2017-12-09T20:00,2017,12,-0.5,0.5,Heavy Snow
02/22/2017,19:00,40.867012,-73.92312,MANHATTAN,1.0,0.0,0,0,0,0,1,0,3623568,2017-02-22 19:00:00,2017-02-22T19:00,2017,2,7.1,0.0,Cloudy
01/06/2017,14:00,40.757698,-73.9694,MANHATTAN,1.0,0.0,0,0,1,0,0,0,3593138,2017-01-06 14:00:00,2017-01-06T14:00,2017,1,0.2,0.0,Cloudy
04/13/2017,16:00,40.73923,-73.9782,MANHATTAN,1.0,0.0,1,0,0,0,0,0,3650874,2017-04-13 16:00:00,2017-04-13T16:00,2017,4,16.9,0.0,Cloudy
12/04/2017,21:00,40.77496,-73.9589,MANHATTAN,1.0,0.0,0,0,0,0,1,0,3813564,2017-12-04 21:00:00,2017-12-04T21:00,2017,12,8.1,0.0,Cloudy
07/01/2017,4:00,40.86241,-73.9225,MANHATTAN,1.0,0.0,1,0,0,0,0,0,3708080,2017-07-01 04:00:00,2017-07-01T04:00,2017,7,23.1,0.0,Clear
07/16/2017,19:00,40.721233,-73.98778,MANHATTAN,0.0,0.0,0,0,0,0,0,0,3712460,2017-07-16 19:00:00,2017-07-16T19:00,2017,7,25.1,0.0,Clear
11/04/2017,15:00,40.763226,-73.97378,MANHATTAN,0.0,0.0,0,0,0,0,0,0,3783387,2017-11-04 15:00:00,2017-11-04T15:00,2017,11,12.3,0.0,Cloudy
09/13/2017,17:00,40.775562,-73.95035,MANHATTAN,1.0,0.0,0,0,0,0,1,0,3752606,2017-09-13 17:00:00,2017-09-13T17:00,2017,9,23.0,0.0,Clear
05/24/2017,7:00,40.71843,-74.000534,MANHATTAN,2.0,0.0,0,0,0,0,2,0,3681320,2017-05-24 07:00:00,2017-05-24T07:00,2017,5,14.7,0.1,Drizzle
07/12/2017,17:00,40.791084,-73.953445,MANHATTAN,0.0,0.0,0,0,0,0,0,0,3710113,2017-07-12 17:00:00,2017-07-12T17:00,2017,7,26.1,2.3,Light Rain
10/05/2017,23:00,40.75843,-73.973076,MANHATTAN,1.0,0.0,1,0,0,0,0,0,3763884,2017-10-05 23:00:00,2017-10-05T23:00,2017,10,19.6,0.5,Drizzle
06/20/2017,19:00,40.73191,-73.9966,MANHATTAN,0.0,0.0,0,0,0,0,1,0,4024435,2017-06-20 19:00:00,2017-06-20T19:00,2017,6,24.8,0.0,Clear
06/15/2017,21:00,40.729584,-73.86084,QUEENS,1.0,0.0,0,0,0,0,1,0,3691692,2017-06-15 21:00:00,2017-06-15T21:00,2017,6,17.5,0.0,Cloudy
05/16/2017,8:00,40.68645,-73.81583,QUEENS,1.0,0.0,1,0,0,0,0,0,3670829,2017-05-16 08:00:00,2017-05-16T08:00,2017,5,16.9,0.0,Clear
09/22/2017,16:00,40.71307,-73.75362,QUEENS,1.0,0.0,0,0,0,0,1,0,3755442,2017-09-22 16:00:00,2017-09-22T16:00,2017,9,25.3,0.0,Clear
08/27/2017,0:00,40.753708,-73.90299,QUEENS,2.0,0.0,0,0,0,0,2,0,3738925,2017-08-27 00:00:00,2017-08-27T00:00,2017,8,16.6,0.0,Clear
11/23/2017,17:00,40.736927,-73.895966,QUEENS,1.0,0.0,1,0,0,0,0,0,3796659,2017-11-23 17:00:00,2017-11-23T17:00,2017,11,3.0,0.0,Clear
07/24/2017,0:00,40.744453,-73.92983,QUEENS,1.0,0.0,0,0,0,0,1,0,3718625,2017-07-24 00:00:00,2017-07-24T00:00,2017,7,22.0,0.9,Drizzle
01/15/2017,17:00,40.733315,-73.80786,QUEENS,1.0,0.0,1,0,0,0,0,0,3598297,2017-01-15 17:00:00,2017-01-15T17:00,2017,1,0.6,0.0,Clear
05/12/2017,12:00,40.704178,-73.89481,QUEENS,1.0,0.0,0,0,0,0,1,0,3676920,2017-05-12 12:00:00,2017-05-12T12:00,2017,5,14.1,0.0,Cloudy
04/25/2017,12:00,40.66542,-73.745995,QUEENS,1.0,0.0,0,0,0,0,1,0,3656910,2017-04-25 12:00:00,2017-04-25T12:00,2017,4,12.1,0.8,Drizzle
12/14/2017,11:00,40.685947,-73.758385,QUEENS,0.0,0.0,0,0,0,0,0,0,3809863,2017-12-14 11:00:00,2017-12-14T11:00,2017,12,-0.8,0.0,Clear
07/26/2017,18:00,40.73725,-73.91799,QUEENS,1.0,0.0,0,0,0,0,1,0,3719261,2017-07-26 18:00:00,2017-07-26T18:00,2017,7,21.4,0.0,Cloudy
01/04/2017,15:00,40.58735,-73.81937,QUEENS,1.0,0.0,0,0,0,0,1,0,3595085,2017-01-04 15:00:00,2017-01-04T15:00,2017,1,9.5,0.0,Clear
11/04/2017,9:00,40.738068,-73.861046,QUEENS,0.0,0.0,0,0,0,0,0,0,3784038,2017-11-04 09:00:00,2017-11-04T09:00,2017,11,9.5,0.0,Cloudy
06/22/2017,13:00,40.73555,-73.934784,QUEENS,1.0,0.0,0,0,1,0,0,0,3696644,2017-06-22 13:00:00,2017-06-22T13:00,2017,6,26.3,0.0,Cloudy
10/21/2017,0:00,40.766064,-73.92208,QUEENS,1.0,0.0,0,0,0,0,1,0,3773860,2017-10-21 00:00:00,2017-10-21T00:00,2017,10,12.4,0.0,Clear
01/30/2017,1:00,40.675964,-73.8182,QUEENS,1.0,0.0,1,0,0,0,0,0,3607045,2017-01-30 01:00:00,2017-01-30T01:00,2017,1,-1.9,0.0,Cloudy
11/03/2017,0:00,40.605335,-73.75528,QUEENS,0.0,0.0,0,0,0,0,0,0,3783066,2017-11-03 00:00:00,2017-11-03T00:00,2017,11,17.4,0.0,Cloudy
01/26/2017,5:00,40.743046,-73.91776,QUEENS,1.0,0.0,0,0,0,0,1,0,3604524,2017-01-26 05:00:00,2017-01-26T05:00,2017,1,5.1,0.0,Cloudy
01/02/2017,8:00,40.586475,-73.804405,QUEENS,0.0,0.0,0,0,0,0,0,0,3590803,2017-01-02 08:00:00,2017-01-02T08:00,2017,1,4.4,0.7,Drizzle
10/23/2017,8:00,40.66549,-73.75236,QUEENS,1.0,0.0,0,0,0,0,1,0,3774977,2017-10-23 08:00:00,2017-10-23T08:00,2017,10,18.7,0.0,Cloudy
12/13/2017,8:00,40.70645,-73.80337,QUEENS,1.0,0.0,1,0,0,0,0,0,3810409,2017-12-13 08:00:00,2017-12-13T08:00,2017,12,-6.1,0.0,Clear
10/27/2017,9:00,40.711994,-73.86073,QUEENS,1.0,0.0,0,0,0,0,1,0,3778668,2017-10-27 09:00:00,2017-10-27T09:00,2017,10,11.0,0.0,Clear
10/14/2017,4:00,40.74389,-73.8849,QUEENS,1.0,0.0,1,0,0,0,0,0,3770076,2017-10-14 04:00:00,2017-10-14T04:00,2017,10,16.8,0.0,Cloudy
04/22/2017,18:00,40.7243,-73.84517,QUEENS,1.0,0.0,0,0,0,0,1,0,3655319,2017-04-22 18:00:00,2017-04-22T18:00,2017,4,11.2,0.2,Drizzle
01/16/2017,6:00,40.731087,-73.85327,QUEENS,0.0,0.0,0,0,0,0,0,0,3598432,2017-01-16 06:00:00,2017-01-16T06:00,2017,1,-5.4,0.0,Clear
08/09/2017,15:00,40.715343,-73.74845,QUEENS,2.0,0.0,0,0,0,0,2,0,3728128,2017-08-09 15:00:00,2017-08-09T15:00,2017,8,26.3,0.0,Clear
07/16/2017,18:00,40.714157,-73.74774,QUEENS,0.0,0.0,0,0,0,0,0,0,3712043,2017-07-16 18:00:00,2017-07-16T18:00,2017,7,23.8,0.0,Clear
04/06/2017,8:00,40.716015,-73.90389,QUEENS,0.0,0.0,0,0,0,0,0,0,3646790,2017-04-06 08:00:00,2017-04-06T08:00,2017,4,4.6,0.1,Drizzle
11/26/2017,19:00,40.71083,-73.90475,QUEENS,0.0,0.0,0,0,0,0,0,0,3797856,2017-11-26 19:00:00,2017-11-26T19:00,2017,11,3.5,0.0,Clear
02/08/2017,13:00,40.725506,-73.73766,QUEENS,1.0,0.0,0,0,0,0,1,0,3612183,2017-02-08 13:00:00,2017-02-08T13:00,2017,2,14.7,0.0,Cloudy
11/20/2017,3:00,40.689827,-73.81291,QUEENS,0.0,0.0,0,0,0,0,0,0,3793883,2017-11-20 03:00:00,2017-11-20T03:00,2017,11,2.7,0.0,Clear
09/27/2017,0:00,40.690685,-73.78161,QUEENS,1.0,0.0,0,0,0,0,1,0,3759738,2017-09-27 00:00:00,2017-09-27T00:00,2017,9,20.4,0.0,Clear
01/10/2017,18:00,40.697556,-73.852776,QUEENS,2.0,0.0,0,0,0,0,2,0,3596318,2017-01-10 18:00:00,2017-01-10T18:00,2017,1,3.1,0.0,Cloudy
07/25/2017,10:00,40.790855,-73.82215,QUEENS,3.0,0.0,0,0,0,0,3,0,3718684,2017-07-25 10:00:00,2017-07-25T10:00,2017,7,19.2,0.0,Cloudy
12/22/2017,14:00,40.67465,-73.75457,QUEENS,1.0,0.0,0,0,0,0,1,0,3817358,2017-12-22 14:00:00,2017-12-22T14:00,2017,12,8.8,0.0,Cloudy
09/25/2017,13:00,40.7636,-73.77098,QUEENS,1.0,0.0,1,0,0,0,0,0,3757109,2017-09-25 13:00:00,2017-09-25T13:00,2017,9,29.2,0.0,Clear
03/29/2017,16:00,40.762978,-73.83198,QUEENS,1.0,0.0,0,0,0,0,1,0,3641456,2017-03-29 16:00:00,2017-03-29T16:00,2017,3,13.9,0.0,Clear
12/16/2017,12:00,40.78463,-73.846794,QUEENS,0.0,0.0,0,0,0,0,0,0,3810901,2017-12-16 12:00:00,2017-12-16T12:00,2017,12,2.6,0.0,Clear
03/12/2017,20:00,40.767063,-73.82111,QUEENS,1.0,0.0,1,0,0,0,0,0,3631066,2017-03-12 20:00:00,2017-03-12T20:00,2017,3,-4.6,0.0,Clear
11/22/2017,19:00,40.708717,-73.79927,QUEENS,1.0,0.0,0,0,0,0,1,0,3800333,2017-11-22 19:00:00,2017-11-22T19:00,2017,11,4.4,0.0,Clear
02/07/2017,22:00,40.6722,-73.734604,QUEENS,1.0,0.0,0,0,0,0,1,0,3611622,2017-02-07 22:00:00,2017-02-07T22:00,2017,2,4.7,0.0,Cloudy
12/20/2017,20:00,40.731968,-73.88478,QUEENS,1.0,0.0,0,0,0,0,1,0,3813703,2017-12-20 20:00:00,2017-12-20T20:00,2017,12,0.9,0.0,Cloudy
01/21/2017,17:00,40.70861,-73.817,QUEENS,0.0,0.0,0,0,0,0,0,0,3602022,2017-01-21 17:00:00,2017-01-21T17:00,2017,1,9.1,0.0,Clear
11/11/2017,9:00,40.766785,-73.895,QUEENS,1.0,0.0,0,0,0,0,1,0,3787985,2017-11-11 09:00:00,2017-11-11T09:00,2017,11,-1.7,0.0,Clear
09/08/2017,20:00,40.760414,-73.83191,QUEENS,0.0,0.0,0,0,0,0,0,0,3746008,2017-09-08 20:00:00,2017-09-08T20:00,2017,9,16.5,0.0,Clear
08/15/2017,10:00,40.739616,-73.78612,QUEENS,1.0,0.0,0,0,0,0,1,0,3732716,2017-08-15 10:00:00,2017-08-15T10:00,2017,8,22.4,1.3,Light Rain
04/29/2017,17:00,40.782978,-73.84314,QUEENS,1.0,0.0,1,0,0,0,0,0,3659655,2017-04-29 17:00:00,2017-04-29T17:00,2017,4,25.3,0.0,Cloudy
08/28/2017,8:00,40.68704,-73.84301,QUEENS,0.0,0.0,0,0,0,0,0,0,3738876,2017-08-28 08:00:00,2017-08-28T08:00,2017,8,19.9,0.0,Cloudy
01/03/2017,14:00,40.68489,-73.82148,QUEENS,1.0,0.0,0,0,0,0,1,0,3591899,2017-01-03 14:00:00,2017-01-03T14:00,2017,1,6.8,0.8,Drizzle
06/25/2017,4:00,40.753593,-73.86777,QUEENS,1.0,0.0,1,0,0,0,0,0,3706605,2017-06-25 04:00:00,2017-06-25T04:00,2017,6,18.5,0.0,Clear
07/28/2017,14:00,40.703335,-73.73783,QUEENS,0.0,0.0,0,0,0,0,0,0,3720597,2017-07-28 14:00:00,2017-07-28T14:00,2017,7,27.2,0.0,Cloudy
12/07/2017,20:00,40.75866,-73.876465,QUEENS,0.0,0.0,0,0,0,0,0,0,3804924,2017-12-07 20:00:00,2017-12-07T20:00,2017,12,3.1,0.0,Cloudy
06/13/2017,22:00,40.70377,-73.727806,QUEENS,0.0,0.0,0,0,0,0,0,0,3690206,2017-06-13 22:00:00,2017-06-13T22:00,2017,6,24.9,0.5,Drizzle
10/01/2017,20:00,40.76862,-73.871574,QUEENS,2.0,0.0,0,0,0,0,2,0,3760725,2017-10-01 20:00:00,2017-10-01T20:00,2017,10,15.3,0.0,Clear
08/01/2017,21:00,40.741863,-73.90751,QUEENS,0.0,0.0,0,0,0,0,0,0,3722874,2017-08-01 21:00:00,2017-08-01T21:00,2017,8,23.7,0.0,Cloudy
01/30/2017,0:00,40.695835,-73.85525,QUEENS,0.0,0.0,0,0,0,0,0,0,3607107,2017-01-30 00:00:00,2017-01-30T00:00,2017,1,-1.5,0.0,Cloudy
08/09/2017,21:00,40.78534,-73.843925,QUEENS,0.0,0.0,0,0,0,0,0,0,3728189,2017-08-09 21:00:00,2017-08-09T21:00,2017,8,21.5,0.0,Clear
06/17/2017,17:00,40.748276,-73.93918,QUEENS,1.0,0.0,0,0,0,0,1,0,3693009,2017-06-17 17:00:00,2017-06-17T17:00,2017,6,21.1,0.0,Cloudy
11/25/2017,18:00,40.681007,-73.81957,QUEENS,0.0,0.0,0,0,0,0,0,0,3797010,2017-11-25 18:00:00,2017-11-25T18:00,2017,11,10.3,0.0,Cloudy
06/04/2017,15:00,40.702908,-73.76096,QUEENS,1.0,0.0,0,0,0,0,1,0,3683448,2017-06-04 15:00:00,2017-06-04T15:00,2017,6,17.0,0.0,Cloudy
12/22/2017,23:00,40.715015,-73.741646,QUEENS,5.0,0.0,0,0,0,0,5,0,3817357,2017-12-22 23:00:00,2017-12-22T23:00,2017,12,4.1,0.0,Cloudy
01/24/2017,9:00,40.73887,-73.932846,QUEENS,1.0,0.0,0,0,0,0,1,0,3603724,2017-01-24 09:00:00,2017-01-24T09:00,2017,1,2.9,0.4,Drizzle
04/08/2017,13:00,40.66611,-73.82712,QUEENS,1.0,0.0,0,0,0,0,1,0,3647620,2017-04-08 13:00:00,2017-04-08T13:00,2017,4,11.5,0.0,Clear
10/12/2017,19:00,40.76112,-73.860245,QUEENS,0.0,0.0,0,0,0,0,0,0,3768522,2017-10-12 19:00:00,2017-10-12T19:00,2017,10,14.7,0.0,Cloudy
03/18/2017,8:00,40.69895,-73.78332,QUEENS,0.0,0.0,0,0,0,0,0,0,3635575,2017-03-18 08:00:00,2017-03-18T08:00,2017,3,0.3,0.0,Cloudy
07/29/2017,21:00,40.691666,-73.76239,QUEENS,0.0,0.0,0,0,0,0,0,0,3720433,2017-07-29 21:00:00,2017-07-29T21:00,2017,7,20.4,0.0,Clear
06/29/2017,8:00,40.679947,-73.84973,QUEENS,0.0,0.0,0,0,0,0,0,0,3701470,2017-06-29 08:00:00,2017-06-29T08:00,2017,6,22.2,0.0,Clear
06/27/2017,9:00,40.713146,-73.84654,QUEENS,3.0,0.0,0,0,0,0,3,0,3700053,2017-06-27 09:00:00,2017-06-27T09:00,2017,6,21.3,0.0,Cloudy
10/29/2017,18:00,40.748615,-73.8952,QUEENS,0.0,0.0,0,0,0,0,0,0,3779264,2017-10-29 18:00:00,2017-10-29T18:00,2017,10,18.2,3.6,Heavy Rain
02/01/2017,15:00,40.58539,-73.81466,QUEENS,2.0,0.0,0,0,0,0,2,0,3609314,2017-02-01 15:00:00,2017-02-01T15:00,2017,2,7.8,0.0,Cloudy
06/01/2017,16:00,40.769787,-73.91842,QUEENS,1.0,0.0,0,0,0,0,1,0,3682349,2017-06-01 16:00:00,2017-06-01T16:00,2017,6,23.5,0.0,Clear
07/31/2017,12:00,40.719612,-73.87822,QUEENS,1.0,0.0,0,0,0,0,1,0,3723729,2017-07-31 12:00:00,2017-07-31T12:00,2017,7,27.6,0.0,Cloudy
12/08/2017,17:00,40.7541,-73.82672,QUEENS,2.0,0.0,0,0,0,0,2,0,3805594,2017-12-08 17:00:00,2017-12-08T17:00,2017,12,2.3,0.0,Cloudy
02/03/2017,9:00,40.65705,-73.76746,QUEENS,1.0,0.0,0,0,0,0,1,0,3609370,2017-02-03 09:00:00,2017-02-03T09:00,2017,2,-2.4,0.0,Cloudy
09/07/2017,0:00,40.7056,-73.85822,QUEENS,1.0,0.0,0,0,0,0,1,0,3745881,2017-09-07 00:00:00,2017-09-07T00:00,2017,9,17.3,0.7,Drizzle
01/09/2017,16:00,40.666393,-73.764465,QUEENS,0.0,0.0,0,0,0,0,0,0,3595224,2017-01-09 16:00:00,2017-01-09T16:00,2017,1,-8.4,0.0,Cloudy
06/05/2017,13:00,40.666393,-73.75177,QUEENS,1.0,0.0,0,0,0,0,1,0,3684429,2017-06-05 13:00:00,2017-06-05T13:00,2017,6,20.3,0.0,Cloudy
06/29/2017,10:00,40.76066,-73.801834,QUEENS,0.0,0.0,0,0,0,0,0,0,3701520,2017-06-29 10:00:00,2017-06-29T10:00,2017,6,24.2,0.0,Cloudy
02/01/2017,9:00,40.66939,-73.825134,QUEENS,0.0,0.0,0,0,0,0,0,0,3608191,2017-02-01 09:00:00,2017-02-01T09:00,2017,2,4.8,0.0,Cloudy
01/05/2017,8:00,40.706944,-73.79286,QUEENS,1.0,0.0,0,0,0,0,1,0,3601221,2017-01-05 08:00:00,2017-01-05T08:00,2017,1,-3.3,0.0,Cloudy
02/24/2017,18:00,40.667778,-73.780846,QUEENS,0.0,0.0,0,0,0,0,0,0,3621488,2017-02-24 18:00:00,2017-02-24T18:00,2017,2,10.6,0.0,Cloudy
11/24/2017,13:00,40.66645,-73.75764,QUEENS,0.0,0.0,0,0,0,0,0,0,3796428,2017-11-24 13:00:00,2017-11-24T13:00,2017,11,7.9,0.0,Clear
05/01/2017,0:00,40.72994,-73.74481,QUEENS,0.0,0.0,0,0,0,0,0,0,3661122,2017-05-01 00:00:00,2017-05-01T00:00,2017,5,10.8,0.0,Cloudy
02/08/2017,10:00,40.586746,-73.81712,QUEENS,0.0,0.0,0,0,0,0,0,0,3612111,2017-02-08 10:00:00,2017-02-08T10:00,2017,2,12.7,0.0,Cloudy
04/17/2017,0:00,40.66561,-73.73568,QUEENS,1.0,0.0,0,0,0,0,1,0,3652813,2017-04-17 00:00:00,2017-04-17T00:00,2017,4,17.9,0.1,Drizzle
03/13/2017,9:00,40.673443,-73.728905,QUEENS,0.0,0.0,0,0,0,0,0,0,3631274,2017-03-13 09:00:00,2017-03-13T09:00,2017,3,-3.9,0.0,Cloudy
09/29/2017,8:00,40.785595,-73.856895,QUEENS,1.0,0.0,1,0,0,0,0,0,3760351,2017-09-29 08:00:00,2017-09-29T08:00,2017,9,15.1,0.0,Clear
06/21/2017,18:00,40.7209,-73.86605,QUEENS,1.0,0.0,0,0,0,0,1,0,3712509,2017-06-21 18:00:00,2017-06-21T18:00,2017,6,23.0,0.2,Drizzle
03/04/2017,17:00,40.703537,-73.81497,QUEENS,1.0,0.0,0,0,0,0,1,0,3626646,2017-03-04 17:00:00,2017-03-04T17:00,2017,3,-2.8,0.0,Clear
02/07/2017,17:00,40.68747,-73.794785,QUEENS,0.0,0.0,0,0,0,0,0,0,3611369,2017-02-07 17:00:00,2017-02-07T17:00,2017,2,6.3,0.0,Cloudy
02/15/2017,10:00,40.743645,-73.94045,QUEENS,1.0,0.0,0,0,0,0,1,0,3615837,2017-02-15 10:00:00,2017-02-15T10:00,2017,2,2.2,0.0,Cloudy
02/28/2017,22:00,40.744026,-73.717636,QUEENS,5.0,0.0,0,0,0,0,5,0,3624311,2017-02-28 22:00:00,2017-02-28T22:00,2017,2,9.1,0.3,Drizzle
10/24/2017,19:00,40.59567,-73.775734,QUEENS,1.0,0.0,0,0,0,0,1,0,3776971,2017-10-24 19:00:00,2017-10-24T19:00,2017,10,19.0,4.5,Heavy Rain
04/07/2017,17:00,40.737827,-73.734,QUEENS,0.0,0.0,0,0,0,0,0,0,3647099,2017-04-07 17:00:00,2017-04-07T17:00,2017,4,8.6,0.0,Cloudy
01/03/2017,0:00,40.671406,-73.79942,QUEENS,1.0,0.0,0,0,0,0,1,0,3591624,2017-01-03 00:00:00,2017-01-03T00:00,2017,1,4.8,0.1,Drizzle
09/29/2017,15:00,40.740192,-73.85335,QUEENS,2.0,0.0,2,0,0,0,0,0,3761074,2017-09-29 15:00:00,2017-09-29T15:00,2017,9,20.0,0.0,Cloudy
07/28/2017,11:00,40.767754,-73.83193,QUEENS,1.0,0.0,0,0,0,0,1,0,3720252,2017-07-28 11:00:00,2017-07-28T11:00,2017,7,26.6,0.1,Drizzle
11/22/2017,17:00,40.738598,-73.87744,QUEENS,0.0,0.0,0,0,0,0,0,0,3797743,2017-11-22 17:00:00,2017-11-22T17:00,2017,11,6.0,0.0,Clear
05/24/2017,15:00,40.66615,-73.80575,QUEENS,1.0,0.0,0,0,0,0,1,0,3677118,2017-05-24 15:00:00,2017-05-24T15:00,2017,5,18.9,0.0,Cloudy
06/16/2017,9:00,40.67045,-73.793335,QUEENS,0.0,0.0,0,0,0,0,0,0,3692159,2017-06-16 09:00:00,2017-06-16T09:00,2017,6,19.0,0.1,Drizzle
01/23/2017,10:00,40.765224,-73.9317,QUEENS,2.0,0.0,2,0,0,0,0,0,3603413,2017-01-23 10:00:00,2017-01-23T10:00,2017,1,3.5,0.0,Cloudy
05/26/2017,15:00,40.68767,-73.84075,QUEENS,0.0,0.0,0,0,0,0,0,0,4024344,2017-05-26 15:00:00,2017-05-26T15:00,2017,5,21.6,0.3,Drizzle
03/31/2017,20:00,40.752136,-73.92564,QUEENS,0.0,0.0,0,0,0,0,0,0,3645314,2017-03-31 20:00:00,2017-03-31T20:00,2017,3,3.8,1.9,Light Rain
11/22/2017,13:00,40.75292,-73.88775,QUEENS,2.0,0.0,0,0,0,0,2,0,3799467,2017-11-22 13:00:00,2017-11-22T13:00,2017,11,10.2,0.0,Clear
05/16/2017,16:00,40.76518,-73.88807,QUEENS,1.0,0.0,0,0,0,0,1,0,3671438,2017-05-16 16:00:00,2017-05-16T16:00,2017,5,24.4,0.0,Clear
06/07/2017,12:00,40.685513,-73.84162,QUEENS,0.0,0.0,0,0,0,0,0,0,3685453,2017-06-07 12:00:00,2017-06-07T12:00,2017,6,17.6,0.0,Cloudy
10/15/2017,16:00,40.673847,-73.753975,QUEENS,1.0,0.0,0,0,0,0,1,0,3769482,2017-10-15 16:00:00,2017-10-15T16:00,2017,10,22.2,0.0,Clear
01/11/2017,20:00,40.74831,-73.82599,QUEENS,1.0,0.0,0,0,0,0,1,0,3596582,2017-01-11 20:00:00,2017-01-11T20:00,2017,1,6.6,0.0,Cloudy
12/14/2017,7:00,40.762703,-73.788284,QUEENS,0.0,0.0,0,0,0,0,0,0,3808913,2017-12-14 07:00:00,2017-12-14T07:00,2017,12,-3.1,0.2,Light Snow
10/16/2017,0:00,40.680496,-73.821365,QUEENS,0.0,0.0,0,0,0,0,0,0,3770193,2017-10-16 00:00:00,2017-10-16T00:00,2017,10,20.5,0.1,Drizzle
04/07/2017,16:00,40.733295,-73.7078,QUEENS,1.0,0.0,0,0,0,0,1,0,3647097,2017-04-07 16:00:00,2017-04-07T16:00,2017,4,9.1,0.0,Cloudy
10/11/2017,7:00,40.70001,-73.830894,QUEENS,1.0,0.0,1,0,0,0,0,0,3767309,2017-10-11 07:00:00,2017-10-11T07:00,2017,10,18.5,0.0,Cloudy
09/08/2017,9:00,40.66741,-73.82479,QUEENS,2.0,0.0,0,0,0,0,2,0,3745807,2017-09-08 09:00:00,2017-09-08T09:00,2017,9,18.3,0.0,Clear
10/17/2017,19:00,40.742973,-73.814316,QUEENS,1.0,0.0,0,0,0,0,1,0,3771410,2017-10-17 19:00:00,2017-10-17T19:00,2017,10,11.2,0.0,Clear
08/25/2017,7:00,40.77674,-73.79996,QUEENS,1.0,0.0,1,0,0,0,0,0,3737347,2017-08-25 07:00:00,2017-08-25T07:00,2017,8,18.9,0.0,Cloudy
12/04/2017,1:00,40.752777,-73.86627,QUEENS,1.0,0.0,1,0,0,0,0,0,3806794,2017-12-04 01:00:00,2017-12-04T01:00,2017,12,2.0,0.0,Cloudy
07/23/2017,15:00,40.586746,-73.81712,QUEENS,4.0,0.0,0,0,0,0,4,0,3717090,2017-07-23 15:00:00,2017-07-23T15:00,2017,7,24.1,0.0,Cloudy
07/11/2017,8:00,40.73023,-73.81258,QUEENS,0.0,0.0,0,0,0,0,0,0,3710234,2017-07-11 08:00:00,2017-07-11T08:00,2017,7,25.5,0.0,Cloudy
06/30/2017,7:00,40.714306,-73.91403,QUEENS,0.0,0.0,0,0,0,0,0,0,3702307,2017-06-30 07:00:00,2017-06-30T07:00,2017,6,23.9,0.0,Clear
05/11/2017,21:00,40.722343,-73.80986,QUEENS,2.0,0.0,0,0,0,0,2,0,3668410,2017-05-11 21:00:00,2017-05-11T21:00,2017,5,9.1,0.0,Cloudy
08/23/2017,10:00,40.586315,-73.80653,QUEENS,0.0,0.0,0,0,0,0,0,0,3735957,2017-08-23 10:00:00,2017-08-23T10:00,2017,8,24.9,0.0,Clear
10/01/2017,11:00,40.741295,-73.88029,QUEENS,1.0,0.0,1,0,0,0,0,0,3761086,2017-10-01 11:00:00,2017-10-01T11:00,2017,10,17.0,0.0,Clear
05/14/2017,20:00,40.733612,-73.84737,QUEENS,0.0,0.0,0,0,0,0,0,0,3670662,2017-05-14 20:00:00,2017-05-14T20:00,2017,5,13.0,0.5,Drizzle
06/10/2017,20:00,40.695335,-73.89821,QUEENS,0.0,0.0,0,0,0,0,0,0,3688351,2017-06-10 20:00:00,2017-06-10T20:00,2017,6,22.2,0.0,Clear
09/29/2017,7:00,40.753338,-73.88876,QUEENS,1.0,0.0,0,0,1,0,0,0,3760650,2017-09-29 07:00:00,2017-09-29T07:00,2017,9,14.0,0.0,Clear
04/18/2017,9:00,40.73018,-73.86246,QUEENS,0.0,0.0,0,0,0,0,0,0,3654396,2017-04-18 09:00:00,2017-04-18T09:00,2017,4,12.7,0.0,Clear
05/16/2017,0:00,40.6778,-73.823845,QUEENS,2.0,0.0,0,0,0,0,2,0,3672483,2017-05-16 00:00:00,2017-05-16T00:00,2017,5,12.6,0.0,Clear
12/19/2017,9:00,40.769688,-73.736305,QUEENS,1.0,0.0,0,0,0,0,1,0,3812890,2017-12-19 09:00:00,2017-12-19T09:00,2017,12,7.5,0.0,Clear
03/07/2017,9:00,40.68605,-73.831726,QUEENS,0.0,0.0,0,0,0,0,0,0,3628039,2017-03-07 09:00:00,2017-03-07T09:00,2017,3,7.9,0.4,Drizzle
09/02/2017,7:00,40.73903,-73.700584,QUEENS,2.0,0.0,0,0,0,0,2,0,3742700,2017-09-02 07:00:00,2017-09-02T07:00,2017,9,14.0,0.0,Cloudy
08/24/2017,16:00,40.7216,-73.75868,QUEENS,0.0,0.0,0,0,0,0,0,0,3737008,2017-08-24 16:00:00,2017-08-24T16:00,2017,8,26.0,0.0,Cloudy
03/03/2017,15:00,40.672253,-73.78559,QUEENS,1.0,0.0,1,0,0,0,0,0,3627039,2017-03-03 15:00:00,2017-03-03T15:00,2017,3,3.6,0.0,Cloudy
10/17/2017,0:00,40.73448,-73.82238,QUEENS,1.0,0.0,1,0,0,0,0,0,3770994,2017-10-17 00:00:00,2017-10-17T00:00,2017,10,8.3,0.0,Clear
04/06/2017,0:00,40.740067,-73.935455,QUEENS,1.0,0.0,0,0,0,0,1,0,3646466,2017-04-06 00:00:00,2017-04-06T00:00,2017,4,6.2,0.0,Cloudy
04/22/2017,9:00,40.70698,-73.89208,QUEENS,0.0,0.0,0,0,0,0,0,0,3655396,2017-04-22 09:00:00,2017-04-22T09:00,2017,4,11.5,0.3,Drizzle
03/17/2017,13:00,40.664192,-73.841125,QUEENS,0.0,0.0,0,0,0,0,0,0,3633579,2017-03-17 13:00:00,2017-03-17T13:00,2017,3,3.2,0.0,Clear
06/18/2017,20:00,40.704334,-73.82452,QUEENS,0.0,0.0,0,0,0,0,0,0,3694100,2017-06-18 20:00:00,2017-06-18T20:00,2017,6,22.2,0.0,Cloudy
03/26/2017,18:00,40.70361,-73.82232,QUEENS,0.0,0.0,0,0,0,0,0,0,3639693,2017-03-26 18:00:00,2017-03-26T18:00,2017,3,5.4,0.0,Cloudy
07/08/2017,13:00,40.764545,-73.792076,QUEENS,1.0,0.0,0,0,0,0,1,0,3706899,2017-07-08 13:00:00,2017-07-08T13:00,2017,7,29.3,0.0,Cloudy
03/09/2017,17:00,40.71769,-73.811295,QUEENS,0.0,0.0,0,0,0,0,0,0,3628911,2017-03-09 17:00:00,2017-03-09T17:00,2017,3,12.2,0.0,Clear
01/20/2017,19:00,40.75333,-73.70682,QUEENS,1.0,0.0,1,0,0,0,0,0,3601590,2017-01-20 19:00:00,2017-01-20T19:00,2017,1,4.2,0.3,Drizzle
07/21/2017,10:00,40.76092,-73.8892,QUEENS,2.0,0.0,0,0,0,0,2,0,3732985,2017-07-21 10:00:00,2017-07-21T10:00,2017,7,28.8,0.0,Clear
10/18/2017,8:00,40.73406,-73.82533,QUEENS,2.0,0.0,0,0,0,0,2,0,3771764,2017-10-18 08:00:00,2017-10-18T08:00,2017,10,11.7,0.0,Clear
05/30/2017,14:00,40.755013,-73.93434,QUEENS,1.0,0.0,0,0,0,0,1,0,3681104,2017-05-30 14:00:00,2017-05-30T14:00,2017,5,15.3,0.1,Drizzle
04/27/2017,21:00,40.780712,-73.82509,QUEENS,0.0,0.0,0,0,0,0,0,0,3658479,2017-04-27 21:00:00,2017-04-27T21:00,2017,4,13.9,0.0,Cloudy
08/07/2017,17:00,40.695995,-73.782776,QUEENS,0.0,0.0,0,0,0,0,0,0,3729323,2017-08-07 17:00:00,2017-08-07T17:00,2017,8,20.5,1.5,Light Rain
03/29/2017,14:00,40.75421,-73.810486,QUEENS,1.0,0.0,1,0,0,0,0,0,3641487,2017-03-29 14:00:00,2017-03-29T14:00,2017,3,14.5,0.0,Clear
07/28/2017,15:00,40.673298,-73.789894,QUEENS,1.0,0.0,1,0,0,0,0,0,3736190,2017-07-28 15:00:00,2017-07-28T15:00,2017,7,25.3,0.3,Drizzle
12/18/2017,17:00,40.756397,-73.804535,QUEENS,1.0,0.0,1,0,0,0,0,0,3812530,2017-12-18 17:00:00,2017-12-18T17:00,2017,12,4.8,0.0,Clear
11/20/2017,17:00,40.702736,-73.80229,QUEENS,0.0,0.0,0,0,0,0,0,0,3794382,2017-11-20 17:00:00,2017-11-20T17:00,2017,11,6.6,0.0,Clear
10/05/2017,12:00,40.66528,-73.735596,QUEENS,0.0,0.0,0,0,0,0,0,0,3763608,2017-10-05 12:00:00,2017-10-05T12:00,2017,10,23.5,0.0,Clear
08/17/2017,11:00,40.73249,-73.89914,QUEENS,1.0,0.0,0,0,0,0,1,0,3732854,2017-08-17 11:00:00,2017-08-17T11:00,2017,8,24.8,0.0,Clear
10/20/2017,11:00,40.72062,-73.81377,QUEENS,1.0,0.0,0,0,0,0,1,0,3773350,2017-10-20 11:00:00,2017-10-20T11:00,2017,10,19.7,0.0,Clear
10/13/2017,14:00,40.724792,-73.722916,QUEENS,1.0,0.0,0,0,0,0,1,0,3768894,2017-10-13 14:00:00,2017-10-13T14:00,2017,10,17.6,0.0,Cloudy
03/10/2017,15:00,40.704403,-73.88202,QUEENS,1.0,0.0,1,0,0,0,0,0,3630398,2017-03-10 15:00:00,2017-03-10T15:00,2017,3,3.4,0.1,Light Snow
09/09/2017,16:00,40.70269,-73.839485,QUEENS,0.0,0.0,0,0,0,0,0,0,3747567,2017-09-09 16:00:00,2017-09-09T16:00,2017,9,18.9,0.0,Cloudy
11/05/2017,0:00,40.72743,-73.925545,QUEENS,1.0,0.0,1,0,0,0,0,0,3783295,2017-11-05 00:00:00,2017-11-05T00:00,2017,11,11.7,0.3,Drizzle
07/25/2017,1:00,40.69336,-73.75207,QUEENS,2.0,0.0,0,0,0,0,2,0,3718208,2017-07-25 01:00:00,2017-07-25T01:00,2017,7,17.4,0.0,Cloudy
03/10/2017,21:00,40.659172,-73.839874,QUEENS,1.0,0.0,1,0,0,0,0,0,3631022,2017-03-10 21:00:00,2017-03-10T21:00,2017,3,-2.0,0.0,Clear
08/13/2017,0:00,40.778614,-73.83887,QUEENS,2.0,0.0,0,0,0,0,2,0,3729955,2017-08-13 00:00:00,2017-08-13T00:00,2017,8,21.4,0.0,Clear
08/21/2017,14:00,40.74244,-73.72174,QUEENS,0.0,0.0,0,0,0,0,0,0,3735410,2017-08-21 14:00:00,2017-08-21T14:00,2017,8,27.4,0.0,Clear
01/30/2017,9:00,40.77388,-73.936485,QUEENS,1.0,0.0,0,0,0,0,1,0,3607322,2017-01-30 09:00:00,2017-01-30T09:00,2017,1,0.3,0.0,Cloudy
07/01/2017,4:00,40.677654,-73.82866,QUEENS,0.0,0.0,0,0,0,0,0,0,3702610,2017-07-01 04:00:00,2017-07-01T04:00,2017,7,22.2,0.0,Clear
09/16/2017,15:00,40.676296,-73.74648,QUEENS,1.0,0.0,0,0,0,0,1,0,3751352,2017-09-16 15:00:00,2017-09-16T15:00,2017,9,23.3,0.2,Drizzle
02/10/2017,0:00,40.712864,-73.904625,QUEENS,0.0,0.0,0,0,0,0,0,0,3614253,2017-02-10 00:00:00,2017-02-10T00:00,2017,2,-9.6,0.0,Clear
03/11/2017,19:00,40.71641,-73.88115,QUEENS,0.0,0.0,0,0,0,0,0,0,3629827,2017-03-11 19:00:00,2017-03-11T19:00,2017,3,-4.3,0.0,Clear
06/22/2017,12:00,40.7547,-73.89349,QUEENS,0.0,0.0,0,0,0,0,0,0,3697032,2017-06-22 12:00:00,2017-06-22T12:00,2017,6,25.3,0.0,Cloudy
03/28/2017,22:00,40.67481,-73.79511,QUEENS,2.0,0.0,2,0,0,0,0,0,3641470,2017-03-28 22:00:00,2017-03-28T22:00,2017,3,5.5,0.2,Drizzle
03/22/2017,15:00,40.753166,-73.89048,QUEENS,1.0,0.0,0,0,0,0,1,0,3637020,2017-03-22 15:00:00,2017-03-22T15:00,2017,3,-1.1,0.0,Clear
12/24/2017,4:00,40.760372,-73.815094,QUEENS,2.0,0.0,0,0,0,0,2,0,3815424,2017-12-24 04:00:00,2017-12-24T04:00,2017,12,0.9,0.0,Cloudy
06/03/2017,12:00,40.711014,-73.7977,QUEENS,1.0,0.0,0,0,0,0,1,0,3683063,2017-06-03 12:00:00,2017-06-03T12:00,2017,6,19.1,0.0,Clear
07/25/2017,9:00,40.769405,-73.80356,QUEENS,0.0,0.0,0,0,0,0,0,0,3718661,2017-07-25 09:00:00,2017-07-25T09:00,2017,7,18.8,0.0,Cloudy
02/22/2017,21:00,40.748928,-73.91375,QUEENS,1.0,0.0,0,0,0,0,1,0,3620030,2017-02-22 21:00:00,2017-02-22T21:00,2017,2,6.6,0.0,Cloudy
10/05/2017,0:00,40.766346,-73.86468,QUEENS,0.0,0.0,0,0,0,0,0,0,3764280,2017-10-05 00:00:00,2017-10-05T00:00,2017,10,17.3,0.0,Clear
01/01/2017,8:00,40.72613,-73.75658,QUEENS,1.0,0.0,0,0,0,0,1,0,3590137,2017-01-01 08:00:00,2017-01-01T08:00,2017,1,4.1,0.0,Clear
06/25/2017,15:00,40.789017,-73.80213,QUEENS,1.0,0.0,0,0,0,0,1,0,3698602,2017-06-25 15:00:00,2017-06-25T15:00,2017,6,25.6,0.0,Clear
01/05/2017,23:00,40.733,-73.85989,QUEENS,1.0,0.0,0,0,0,0,1,0,3600460,2017-01-05 23:00:00,2017-01-05T23:00,2017,1,-1.6,0.1,Light Snow
05/11/2017,8:00,40.702595,-73.8553,QUEENS,0.0,0.0,0,0,0,0,0,0,3668318,2017-05-11 08:00:00,2017-05-11T08:00,2017,5,12.2,0.0,Cloudy
02/16/2017,16:00,40.71991,-73.809044,QUEENS,1.0,0.0,0,0,0,0,1,0,3616957,2017-02-16 16:00:00,2017-02-16T16:00,2017,2,0.8,0.0,Cloudy
08/19/2017,17:00,40.70773,-73.89469,QUEENS,1.0,0.0,1,0,0,0,0,0,3735213,2017-08-19 17:00:00,2017-08-19T17:00,2017,8,26.1,0.0,Cloudy
12/05/2017,21:00,40.68325,-73.81869,QUEENS,2.0,0.0,0,0,0,0,2,0,3803944,2017-12-05 21:00:00,2017-12-05T21:00,2017,12,14.1,1.4,Light Rain
10/26/2017,22:00,40.75084,-73.87384,QUEENS,0.0,0.0,0,0,0,0,0,0,3777755,2017-10-26 22:00:00,2017-10-26T22:00,2017,10,9.9,0.0,Clear
10/08/2017,16:00,40.793552,-73.821465,QUEENS,2.0,0.0,0,0,0,0,2,0,3765386,2017-10-08 16:00:00,2017-10-08T16:00,2017,10,24.6,0.1,Drizzle
05/14/2017,11:00,40.767204,-73.910095,QUEENS,2.0,0.0,0,0,0,0,2,0,3674224,2017-05-14 11:00:00,2017-05-14T11:00,2017,5,15.5,0.0,Cloudy
04/14/2017,17:00,40.70523,-73.80358,QUEENS,1.0,0.0,0,0,1,0,0,0,3652327,2017-04-14 17:00:00,2017-04-14T17:00,2017,4,12.7,0.0,Clear
07/20/2017,17:00,40.749897,-73.868835,QUEENS,1.0,0.0,0,0,0,0,1,0,3717501,2017-07-20 17:00:00,2017-07-20T17:00,2017,7,29.9,0.0,Clear
04/04/2017,8:00,40.678364,-73.77949,QUEENS,3.0,0.0,0,0,0,0,3,0,3644966,2017-04-04 08:00:00,2017-04-04T08:00,2017,4,10.5,0.6,Drizzle
12/14/2017,18:00,40.7228,-73.90182,QUEENS,0.0,0.0,0,0,0,0,0,0,3809925,2017-12-14 18:00:00,2017-12-14T18:00,2017,12,-4.1,0.0,Cloudy
04/13/2017,18:00,40.70297,-73.86825,QUEENS,1.0,0.0,1,0,0,0,0,0,3650981,2017-04-13 18:00:00,2017-04-13T18:00,2017,4,14.4,0.0,Cloudy
04/02/2017,15:00,40.761444,-73.87602,QUEENS,2.0,0.0,0,0,0,0,2,0,3644249,2017-04-02 15:00:00,2017-04-02T15:00,2017,4,14.8,0.0,Cloudy
08/16/2017,4:00,40.750416,-73.897736,QUEENS,1.0,0.0,0,0,0,0,1,0,3731772,2017-08-16 04:00:00,2017-08-16T04:00,2017,8,20.6,0.0,Cloudy
11/10/2017,7:00,40.607037,-73.760765,QUEENS,0.0,0.0,0,0,0,0,0,0,3787826,2017-11-10 07:00:00,2017-11-10T07:00,2017,11,6.0,0.0,Clear
05/24/2017,22:00,40.765358,-73.817215,QUEENS,1.0,0.0,0,0,0,0,1,0,3677574,2017-05-24 22:00:00,2017-05-24T22:00,2017,5,13.5,0.0,Cloudy
11/26/2017,0:00,40.720516,-73.82028,QUEENS,1.0,0.0,0,0,0,0,1,0,3797584,2017-11-26 00:00:00,2017-11-26T00:00,2017,11,7.2,0.0,Cloudy
01/18/2017,10:00,40.75333,-73.70682,QUEENS,1.0,0.0,0,0,0,0,1,0,3601027,2017-01-18 10:00:00,2017-01-18T10:00,2017,1,3.6,0.0,Cloudy
02/28/2017,20:00,40.739914,-73.94722,QUEENS,0.0,0.0,0,0,0,0,0,0,3623662,2017-02-28 20:00:00,2017-02-28T20:00,2017,2,9.4,0.3,Drizzle
12/16/2017,19:00,40.774357,-73.908195,QUEENS,0.0,0.0,0,0,0,0,0,0,3810805,2017-12-16 19:00:00,2017-12-16T19:00,2017,12,1.1,0.0,Cloudy
10/20/2017,1:00,40.749374,-73.86752,QUEENS,1.0,0.0,0,0,1,0,0,0,3772828,2017-10-20 01:00:00,2017-10-20T01:00,2017,10,13.7,0.0,Clear
03/17/2017,22:00,40.76758,-73.83185,QUEENS,1.0,0.0,1,0,0,0,0,0,3634219,2017-03-17 22:00:00,2017-03-17T22:00,2017,3,-2.3,0.0,Cloudy
12/01/2017,14:00,40.7488,-73.92043,QUEENS,1.0,0.0,0,0,0,0,1,0,3800858,2017-12-01 14:00:00,2017-12-01T14:00,2017,12,10.7,0.0,Clear
04/16/2017,9:00,40.73744,-73.79575,QUEENS,1.0,0.0,1,0,0,0,0,0,3651696,2017-04-16 09:00:00,2017-04-16T09:00,2017,4,20.8,0.0,Clear
04/22/2017,17:00,40.753284,-73.90691,QUEENS,3.0,0.0,0,0,0,0,3,0,3655627,2017-04-22 17:00:00,2017-04-22T17:00,2017,4,11.8,0.2,Drizzle
05/21/2017,12:00,40.666885,-73.790405,QUEENS,1.0,0.0,0,0,0,0,1,0,3674850,2017-05-21 12:00:00,2017-05-21T12:00,2017,5,16.4,0.0,Cloudy
12/27/2017,19:00,40.7293,-73.862854,QUEENS,0.0,0.0,0,0,0,0,0,0,3818096,2017-12-27 19:00:00,2017-12-27T19:00,2017,12,-6.3,0.0,Clear
10/24/2017,0:00,40.712902,-73.90608,QUEENS,1.0,0.0,0,0,0,0,1,0,3776121,2017-10-24 00:00:00,2017-10-24T00:00,2017,10,19.3,0.0,Cloudy
03/01/2017,7:00,40.667713,-73.77792,QUEENS,1.0,0.0,0,0,0,0,1,0,3624012,2017-03-01 07:00:00,2017-03-01T07:00,2017,3,10.9,0.0,Cloudy
02/27/2017,10:00,40.72171,-73.76822,QUEENS,0.0,0.0,0,0,0,0,0,0,3623010,2017-02-27 10:00:00,2017-02-27T10:00,2017,2,5.8,0.0,Cloudy
02/18/2017,17:00,40.66317,-73.77001,QUEENS,0.0,0.0,0,0,0,0,0,0,3618032,2017-02-18 17:00:00,2017-02-18T17:00,2017,2,13.6,0.0,Clear
06/20/2017,13:00,40.69049,-73.816086,QUEENS,1.0,0.0,0,0,0,0,1,0,3695235,2017-06-20 13:00:00,2017-06-20T13:00,2017,6,27.2,0.0,Clear
09/16/2017,13:00,40.76242,-73.82752,QUEENS,1.0,0.0,1,0,0,0,0,0,3751456,2017-09-16 13:00:00,2017-09-16T13:00,2017,9,25.7,0.1,Drizzle
09/04/2017,19:00,40.700592,-73.85457,QUEENS,1.0,0.0,0,0,0,0,1,0,3753807,2017-09-04 19:00:00,2017-09-04T19:00,2017,9,21.0,0.0,Clear
06/01/2017,15:00,40.74169,-73.941826,QUEENS,0.0,0.0,0,0,0,0,0,0,3682803,2017-06-01 15:00:00,2017-06-01T15:00,2017,6,23.8,0.0,Clear
02/15/2017,20:00,40.65616,-73.76736,QUEENS,0.0,0.0,0,0,0,0,0,0,3616094,2017-02-15 20:00:00,2017-02-15T20:00,2017,2,2.3,0.0,Cloudy
11/27/2017,11:00,40.741276,-73.86378,QUEENS,1.0,0.0,0,0,0,0,1,0,3798603,2017-11-27 11:00:00,2017-11-27T11:00,2017,11,8.6,0.0,Cloudy
01/19/2017,12:00,40.70406,-73.82445,QUEENS,0.0,0.0,0,0,0,0,0,0,3601190,2017-01-19 12:00:00,2017-01-19T12:00,2017,1,9.0,0.0,Cloudy
06/15/2017,16:00,40.728653,-73.86111,QUEENS,1.0,0.0,0,0,0,0,1,0,3691585,2017-06-15 16:00:00,2017-06-15T16:00,2017,6,21.2,0.0,Clear
05/03/2017,23:00,40.780457,-73.91684,QUEENS,1.0,0.0,0,0,0,0,1,0,3662753,2017-05-03 23:00:00,2017-05-03T23:00,2017,5,8.6,0.0,Cloudy
12/21/2017,11:00,40.704178,-73.88953,QUEENS,0.0,0.0,0,0,0,0,0,0,3814631,2017-12-21 11:00:00,2017-12-21T11:00,2017,12,2.2,0.0,Clear
11/19/2017,13:00,40.76501,-73.8871,QUEENS,2.0,0.0,0,0,0,0,2,0,3800925,2017-11-19 13:00:00,2017-11-19T13:00,2017,11,11.3,0.0,Clear
08/25/2017,21:00,40.767204,-73.910095,QUEENS,1.0,0.0,0,0,1,0,0,0,3738472,2017-08-25 21:00:00,2017-08-25T21:00,2017,8,20.2,0.0,Clear
02/16/2017,10:00,40.73578,-73.746544,QUEENS,1.0,0.0,0,0,0,0,1,0,3617283,2017-02-16 10:00:00,2017-02-16T10:00,2017,2,0.3,0.0,Cloudy
10/12/2017,20:00,40.74168,-73.8697,QUEENS,1.0,0.0,1,0,0,0,0,0,3770124,2017-10-12 20:00:00,2017-10-12T20:00,2017,10,13.9,0.0,Cloudy
03/13/2017,22:00,40.742527,-73.85454,QUEENS,1.0,0.0,0,0,0,0,1,0,3631639,2017-03-13 22:00:00,2017-03-13T22:00,2017,3,-1.3,0.1,Light Snow
12/05/2017,19:00,40.669643,-73.7794,QUEENS,3.0,0.0,0,0,0,0,3,0,3803571,2017-12-05 19:00:00,2017-12-05T19:00,2017,12,13.7,0.0,Cloudy
04/23/2017,16:00,40.755882,-73.798,QUEENS,1.0,0.0,0,0,0,0,1,0,3655967,2017-04-23 16:00:00,2017-04-23T16:00,2017,4,13.8,0.0,Cloudy
09/27/2017,19:00,40.731907,-73.77839,QUEENS,0.0,0.0,0,0,0,0,0,0,3758743,2017-09-27 19:00:00,2017-09-27T19:00,2017,9,24.0,0.0,Clear
08/20/2017,8:00,40.66796,-73.77155,QUEENS,0.0,0.0,0,0,0,0,0,0,3733967,2017-08-20 08:00:00,2017-08-20T08:00,2017,8,22.4,0.0,Clear
08/04/2017,10:00,40.666702,-73.76731,QUEENS,1.0,0.0,0,0,0,0,1,0,3724526,2017-08-04 10:00:00,2017-08-04T10:00,2017,8,25.1,0.0,Cloudy
04/16/2017,19:00,40.667786,-73.79968,QUEENS,1.0,0.0,0,0,0,0,1,0,3652208,2017-04-16 19:00:00,2017-04-16T19:00,2017,4,21.5,0.0,Cloudy
11/03/2017,17:00,40.683754,-73.83979,QUEENS,1.0,0.0,0,0,0,0,1,0,3784341,2017-11-03 17:00:00,2017-11-03T17:00,2017,11,19.9,0.0,Cloudy
10/03/2017,15:00,40.655254,-73.76568,QUEENS,3.0,0.0,0,0,0,0,3,0,3762508,2017-10-03 15:00:00,2017-10-03T15:00,2017,10,18.0,0.0,Cloudy
08/18/2017,20:00,40.70284,-73.90529,QUEENS,1.0,0.0,1,0,0,0,0,0,3738418,2017-08-18 20:00:00,2017-08-18T20:00,2017,8,24.3,0.4,Drizzle
05/26/2017,12:00,40.70503,-73.83601,QUEENS,1.0,0.0,0,0,0,0,1,0,3678276,2017-05-26 12:00:00,2017-05-26T12:00,2017,5,21.1,0.0,Cloudy
10/08/2017,23:00,40.710598,-73.85175,QUEENS,1.0,0.0,0,0,0,0,1,0,3765350,2017-10-08 23:00:00,2017-10-08T23:00,2017,10,22.7,0.1,Drizzle
10/30/2017,22:00,40.743538,-73.86136,QUEENS,1.0,0.0,1,0,0,0,0,0,3780312,2017-10-30 22:00:00,2017-10-30T22:00,2017,10,10.5,0.0,Clear
03/07/2017,20:00,40.71438,-73.822914,QUEENS,0.0,0.0,0,0,0,0,0,0,3627827,2017-03-07 20:00:00,2017-03-07T20:00,2017,3,10.0,0.0,Cloudy
12/25/2017,20:00,40.745247,-73.87325,QUEENS,0.0,0.0,0,0,0,0,0,0,3818513,2017-12-25 20:00:00,2017-12-25T20:00,2017,12,-2.0,0.0,Clear
07/20/2017,18:00,40.706646,-73.79802,QUEENS,0.0,0.0,0,0,0,0,0,0,3715965,2017-07-20 18:00:00,2017-07-20T18:00,2017,7,28.9,0.0,Clear
11/29/2017,15:00,40.677654,-73.82866,QUEENS,5.0,0.0,0,0,0,0,5,0,3800580,2017-11-29 15:00:00,2017-11-29T15:00,2017,11,14.4,0.0,Clear
06/24/2017,1:00,40.7666,-73.89117,QUEENS,1.0,0.0,0,0,1,0,0,0,3698944,2017-06-24 01:00:00,2017-06-24T01:00,2017,6,24.2,0.3,Drizzle
12/15/2017,19:00,40.758694,-73.93426,QUEENS,1.0,0.0,0,0,0,0,1,0,3811206,2017-12-15 19:00:00,2017-12-15T19:00,2017,12,-4.3,0.3,Heavy Snow
10/03/2017,18:00,40.75482,-73.84499,QUEENS,1.0,0.0,0,0,0,0,1,0,3762662,2017-10-03 18:00:00,2017-10-03T18:00,2017,10,13.9,0.0,Cloudy
11/06/2017,19:00,40.676792,-73.737946,QUEENS,0.0,0.0,0,0,0,0,0,0,3785372,2017-11-06 19:00:00,2017-11-06T19:00,2017,11,14.4,0.0,Clear
10/24/2017,9:00,40.721783,-73.736595,QUEENS,1.0,0.0,0,0,0,0,1,0,3775831,2017-10-24 09:00:00,2017-10-24T09:00,2017,10,21.3,0.7,Drizzle
02/21/2017,0:00,40.755566,-73.79172,QUEENS,1.0,0.0,0,0,0,0,1,0,3619209,2017-02-21 00:00:00,2017-02-21T00:00,2017,2,0.6,0.0,Clear
09/07/2017,9:00,40.651405,-73.758896,QUEENS,6.0,0.0,0,0,0,0,6,0,3745054,2017-09-07 09:00:00,2017-09-07T09:00,2017,9,18.4,0.0,Clear
12/20/2017,8:00,40.66406,-73.73846,QUEENS,2.0,0.0,0,0,0,0,2,0,3813763,2017-12-20 08:00:00,2017-12-20T08:00,2017,12,5.5,0.0,Cloudy
12/06/2017,20:00,40.740772,-73.89867,QUEENS,1.0,0.0,0,0,0,0,1,0,3816302,2017-12-06 20:00:00,2017-12-06T20:00,2017,12,4.2,0.0,Cloudy
03/23/2017,16:00,40.67493,-73.78796,QUEENS,0.0,0.0,0,0,0,0,0,0,3637797,2017-03-23 16:00:00,2017-03-23T16:00,2017,3,5.4,0.0,Clear
12/02/2017,0:00,40.768017,-73.92536,QUEENS,0.0,0.0,0,0,0,0,0,0,3801499,2017-12-02 00:00:00,2017-12-02T00:00,2017,12,1.7,0.0,Clear
06/19/2017,9:00,40.689472,-73.86154,QUEENS,0.0,0.0,0,0,0,0,0,0,3694342,2017-06-19 09:00:00,2017-06-19T09:00,2017,6,25.8,0.0,Cloudy
07/17/2017,8:00,40.77369,-73.741875,QUEENS,1.0,0.0,0,0,0,0,1,0,3712919,2017-07-17 08:00:00,2017-07-17T08:00,2017,7,25.5,0.0,Cloudy
10/07/2017,8:00,40.682404,-73.75181,QUEENS,3.0,0.0,0,0,0,0,3,0,3764727,2017-10-07 08:00:00,2017-10-07T08:00,2017,10,21.1,0.0,Clear
07/19/2017,15:00,40.763958,-73.82814,QUEENS,1.0,0.0,0,0,0,0,1,0,3714643,2017-07-19 15:00:00,2017-07-19T15:00,2017,7,29.0,0.0,Cloudy
04/01/2017,18:00,40.7525,-73.88954,QUEENS,0.0,0.0,0,0,0,0,0,0,3644236,2017-04-01 18:00:00,2017-04-01T18:00,2017,4,5.8,0.0,Cloudy
01/28/2017,12:00,40.746902,-73.834694,QUEENS,2.0,0.0,0,0,0,0,2,0,3605557,2017-01-28 12:00:00,2017-01-28T12:00,2017,1,4.3,0.0,Cloudy
12/03/2017,4:00,40.758972,-73.91901,QUEENS,1.0,0.0,1,0,0,0,0,0,3802105,2017-12-03 04:00:00,2017-12-03T04:00,2017,12,1.6,0.0,Cloudy
05/10/2017,21:00,40.589638,-73.79902,QUEENS,1.0,0.0,0,0,0,0,1,0,3677894,2017-05-10 21:00:00,2017-05-10T21:00,2017,5,9.4,0.0,Clear
11/06/2017,22:00,40.704384,-73.901825,QUEENS,1.0,0.0,0,0,1,0,0,0,3951765,2017-11-06 22:00:00,2017-11-06T22:00,2017,11,9.0,0.0,Clear
02/13/2017,19:00,40.760254,-73.76935,QUEENS,1.0,0.0,1,0,0,0,0,0,3614964,2017-02-13 19:00:00,2017-02-13T19:00,2017,2,-0.8,0.0,Clear
06/05/2017,8:00,40.68766,-73.85058,QUEENS,2.0,0.0,0,0,0,0,2,0,3684218,2017-06-05 08:00:00,2017-06-05T08:00,2017,6,17.7,0.0,Cloudy
08/07/2017,21:00,40.71042,-73.85964,QUEENS,2.0,0.0,0,0,0,0,2,0,3727283,2017-08-07 21:00:00,2017-08-07T21:00,2017,8,18.9,0.0,Cloudy
11/16/2017,21:00,40.744232,-73.861275,QUEENS,0.0,0.0,0,0,0,0,0,0,3791614,2017-11-16 21:00:00,2017-11-16T21:00,2017,11,7.0,0.0,Clear
04/19/2017,5:00,40.65732,-73.738716,QUEENS,0.0,0.0,0,0,0,0,0,0,3653747,2017-04-19 05:00:00,2017-04-19T05:00,2017,4,6.5,0.0,Cloudy
06/10/2017,8:00,40.69703,-73.768585,QUEENS,0.0,0.0,0,0,0,0,0,0,3687496,2017-06-10 08:00:00,2017-06-10T08:00,2017,6,22.5,0.0,Clear
03/09/2017,7:00,40.694107,-73.89737,QUEENS,0.0,0.0,0,0,0,0,0,0,3859823,2017-03-09 07:00:00,2017-03-09T07:00,2017,3,9.3,0.0,Clear
04/03/2017,17:00,40.69691,-73.815125,QUEENS,0.0,0.0,0,0,0,0,0,0,3644628,2017-04-03 17:00:00,2017-04-03T17:00,2017,4,9.2,0.0,Cloudy
03/02/2017,21:00,40.665497,-73.75573,QUEENS,2.0,0.0,0,0,0,0,2,0,3624713,2017-03-02 21:00:00,2017-03-02T21:00,2017,3,3.0,0.0,Clear
06/17/2017,0:00,40.690044,-73.81481,QUEENS,1.0,0.0,0,0,0,0,1,0,3693969,2017-06-17 00:00:00,2017-06-17T00:00,2017,6,18.8,0.0,Cloudy
02/14/2017,9:00,40.667522,-73.78063,QUEENS,0.0,0.0,0,0,0,0,0,0,3615380,2017-02-14 09:00:00,2017-02-14T09:00,2017,2,-2.0,0.0,Cloudy
04/02/2017,12:00,40.5971,-73.794876,QUEENS,0.0,0.0,0,0,0,0,0,0,3643729,2017-04-02 12:00:00,2017-04-02T12:00,2017,4,13.6,0.0,Clear
06/12/2017,15:00,40.78557,-73.81362,QUEENS,0.0,0.0,0,0,0,0,0,0,3689164,2017-06-12 15:00:00,2017-06-12T15:00,2017,6,31.1,0.0,Clear
02/04/2017,21:00,40.712936,-73.73451,QUEENS,1.0,0.0,0,0,0,0,1,0,3609611,2017-02-04 21:00:00,2017-02-04T21:00,2017,2,-1.9,0.0,Cloudy
03/26/2017,21:00,40.77386,-73.90749,QUEENS,1.0,0.0,1,0,0,0,0,0,3639616,2017-03-26 21:00:00,2017-03-26T21:00,2017,3,4.3,0.0,Cloudy
11/28/2017,16:00,40.65268,-73.73985,QUEENS,1.0,0.0,1,0,0,0,0,0,3799110,2017-11-28 16:00:00,2017-11-28T16:00,2017,11,10.8,0.0,Cloudy
08/16/2017,19:00,40.690975,-73.792755,QUEENS,0.0,0.0,0,0,0,0,0,0,3737362,2017-08-16 19:00:00,2017-08-16T19:00,2017,8,24.5,0.0,Clear
06/10/2017,10:00,40.70919,-73.91186,QUEENS,1.0,0.0,0,0,0,0,1,0,3688371,2017-06-10 10:00:00,2017-06-10T10:00,2017,6,26.5,0.0,Clear
07/16/2017,21:00,40.713303,-73.73586,QUEENS,1.0,0.0,0,0,1,0,0,0,3712067,2017-07-16 21:00:00,2017-07-16T21:00,2017,7,22.6,0.0,Clear
05/25/2017,17:00,40.685936,-73.82594,QUEENS,1.0,0.0,1,0,0,0,0,0,3678621,2017-05-25 17:00:00,2017-05-25T17:00,2017,5,15.7,0.0,Cloudy
12/08/2017,0:00,40.70177,-73.9007,QUEENS,1.0,0.0,0,0,0,0,1,0,3805192,2017-12-08 00:00:00,2017-12-08T00:00,2017,12,3.0,0.0,Cloudy
02/06/2017,15:00,40.743935,-73.85749,QUEENS,0.0,0.0,0,0,0,0,0,0,3611028,2017-02-06 15:00:00,2017-02-06T15:00,2017,2,8.0,0.0,Clear
09/10/2017,17:00,40.67633,-73.7411,QUEENS,0.0,0.0,0,0,0,0,0,0,3748404,2017-09-10 17:00:00,2017-09-10T17:00,2017,9,20.1,0.0,Clear
06/27/2017,16:00,40.736042,-73.87671,QUEENS,1.0,0.0,0,0,0,0,1,0,3700401,2017-06-27 16:00:00,2017-06-27T16:00,2017,6,21.8,0.0,Cloudy
10/05/2017,17:00,40.70197,-73.8019,QUEENS,1.0,0.0,0,0,0,0,1,0,3763837,2017-10-05 17:00:00,2017-10-05T17:00,2017,10,24.5,0.0,Cloudy
06/18/2017,22:00,40.75349,-73.86359,QUEENS,1.0,0.0,0,0,1,0,0,0,3695266,2017-06-18 22:00:00,2017-06-18T22:00,2017,6,23.6,0.0,Cloudy
02/16/2017,0:00,40.749718,-73.86419,QUEENS,1.0,0.0,1,0,0,0,0,0,4024006,2017-02-16 00:00:00,2017-02-16T00:00,2017,2,-0.1,0.0,Clear
05/09/2017,17:00,40.74766,-73.88257,QUEENS,1.0,0.0,1,0,0,0,0,0,3666609,2017-05-09 17:00:00,2017-05-09T17:00,2017,5,14.1,0.0,Cloudy
03/05/2017,13:00,40.666695,-73.767136,QUEENS,1.0,0.0,0,0,0,0,1,0,3626376,2017-03-05 13:00:00,2017-03-05T13:00,2017,3,0.1,0.0,Clear
07/29/2017,18:00,40.752766,-73.79132,QUEENS,1.0,0.0,0,0,0,0,1,0,3720399,2017-07-29 18:00:00,2017-07-29T18:00,2017,7,23.0,0.0,Cloudy
10/18/2017,4:00,0.0,0.0,QUEENS,1.0,0.0,0,0,0,0,1,0,3771385,2017-10-18 04:00:00,2017-10-18T04:00,2017,10,25.9,0.0,Cloudy
07/15/2017,16:00,40.725212,-73.76661,QUEENS,1.0,0.0,0,0,0,0,1,0,3711550,2017-07-15 16:00:00,2017-07-15T16:00,2017,7,28.1,0.0,Cloudy
09/27/2017,2:00,40.695137,-73.74014,QUEENS,0.0,0.0,0,0,0,0,0,0,3758952,2017-09-27 02:00:00,2017-09-27T02:00,2017,9,20.3,0.0,Cloudy
06/17/2017,14:00,40.764694,-73.82304,QUEENS,0.0,0.0,0,0,0,0,0,0,3692503,2017-06-17 14:00:00,2017-06-17T14:00,2017,6,21.8,0.1,Drizzle
02/05/2017,12:00,40.753246,-73.88684,QUEENS,0.0,0.0,0,0,0,0,0,0,3610255,2017-02-05 12:00:00,2017-02-05T12:00,2017,2,2.9,0.0,Cloudy
03/27/2017,20:00,40.68022,-73.775505,QUEENS,0.0,0.0,0,0,0,0,0,0,3640072,2017-03-27 20:00:00,2017-03-27T20:00,2017,3,7.5,0.0,Cloudy
07/17/2017,17:00,40.66708,-73.81033,QUEENS,0.0,0.0,0,0,0,0,0,0,3713030,2017-07-17 17:00:00,2017-07-17T17:00,2017,7,24.6,0.0,Cloudy
04/23/2017,5:00,40.688496,-73.8548,QUEENS,1.0,0.0,0,0,0,0,1,0,3656068,2017-04-23 05:00:00,2017-04-23T05:00,2017,4,6.2,0.0,Clear
11/10/2017,15:00,40.666145,-73.77783,QUEENS,1.0,0.0,0,0,0,0,1,0,3787457,2017-11-10 15:00:00,2017-11-10T15:00,2017,11,0.6,0.0,Clear
11/10/2017,18:00,40.68302,-73.81248,QUEENS,1.0,0.0,1,0,0,0,0,0,3788858,2017-11-10 18:00:00,2017-11-10T18:00,2017,11,-2.0,0.0,Clear
04/11/2017,17:00,40.74646,-73.91709,QUEENS,1.0,0.0,1,0,0,0,0,0,3649545,2017-04-11 17:00:00,2017-04-11T17:00,2017,4,15.9,0.0,Cloudy
09/07/2017,8:00,40.747864,-73.873985,QUEENS,0.0,0.0,0,0,0,0,0,0,3745177,2017-09-07 08:00:00,2017-09-07T08:00,2017,9,17.2,0.0,Clear
03/23/2017,16:00,40.746143,-73.94174,QUEENS,0.0,0.0,0,0,0,0,0,0,3637987,2017-03-23 16:00:00,2017-03-23T16:00,2017,3,5.6,0.0,Clear
01/09/2017,9:00,40.766705,-73.89024,QUEENS,1.0,0.0,0,0,0,0,1,0,3595346,2017-01-09 09:00:00,2017-01-09T09:00,2017,1,-15.2,0.0,Cloudy
09/21/2017,15:00,40.75496,-73.86412,QUEENS,0.0,0.0,0,0,0,0,0,0,3755187,2017-09-21 15:00:00,2017-09-21T15:00,2017,9,26.9,0.0,Cloudy
09/08/2017,15:00,40.76573,-73.926445,QUEENS,0.0,0.0,0,0,0,0,0,0,3746580,2017-09-08 15:00:00,2017-09-08T15:00,2017,9,21.6,0.0,Clear
09/12/2017,17:00,40.71153,-73.85293,QUEENS,0.0,0.0,0,0,0,0,0,0,3748558,2017-09-12 17:00:00,2017-09-12T17:00,2017,9,22.3,0.0,Cloudy
03/10/2017,20:00,40.67447,-73.802605,QUEENS,0.0,0.0,0,0,0,0,0,0,3629941,2017-03-10 20:00:00,2017-03-10T20:00,2017,3,-0.9,0.0,Clear
06/22/2017,9:00,40.761246,-73.76294,QUEENS,0.0,0.0,0,0,0,0,0,0,3696363,2017-06-22 09:00:00,2017-06-22T09:00,2017,6,25.0,0.0,Clear
11/24/2017,16:00,40.759407,-73.85713,QUEENS,0.0,0.0,0,0,0,0,0,0,3796954,2017-11-24 16:00:00,2017-11-24T16:00,2017,11,7.2,0.0,Clear
04/06/2017,17:00,40.74747,-73.8839,QUEENS,1.0,0.0,1,0,0,0,0,0,3648234,2017-04-06 17:00:00,2017-04-06T17:00,2017,4,12.7,0.1,Drizzle
11/21/2017,16:00,40.74456,-73.93076,QUEENS,1.0,0.0,0,0,0,0,1,0,3794935,2017-11-21 16:00:00,2017-11-21T16:00,2017,11,11.2,0.0,Cloudy
08/05/2017,12:00,40.676193,-73.74748,QUEENS,1.0,0.0,0,0,0,0,1,0,3725095,2017-08-05 12:00:00,2017-08-05T12:00,2017,8,25.3,0.1,Drizzle
08/01/2017,8:00,40.69383,-73.82888,QUEENS,1.0,0.0,0,0,0,0,1,0,3722527,2017-08-01 08:00:00,2017-08-01T08:00,2017,8,24.8,0.0,Clear
05/26/2017,19:00,40.762257,-73.92597,QUEENS,1.0,0.0,0,0,0,0,1,0,3679125,2017-05-26 19:00:00,2017-05-26T19:00,2017,5,19.1,0.0,Clear
05/29/2017,0:00,40.70948,-73.80088,QUEENS,0.0,0.0,0,0,0,0,0,0,3680593,2017-05-29 00:00:00,2017-05-29T00:00,2017,5,14.2,0.0,Cloudy
01/22/2017,14:00,40.71501,-73.80982,QUEENS,0.0,0.0,0,0,0,0,0,0,3602257,2017-01-22 14:00:00,2017-01-22T14:00,2017,1,7.9,0.0,Cloudy
08/10/2017,18:00,40.70953,-73.7964,QUEENS,1.0,0.0,0,0,1,0,0,0,3728547,2017-08-10 18:00:00,2017-08-10T18:00,2017,8,22.9,0.0,Cloudy
05/09/2017,19:00,40.757236,-73.860886,QUEENS,1.0,0.0,0,0,0,0,1,0,3666769,2017-05-09 19:00:00,2017-05-09T19:00,2017,5,11.1,0.0,Cloudy
10/16/2017,8:00,40.746304,-73.83122,QUEENS,0.0,0.0,0,0,0,0,0,0,3770710,2017-10-16 08:00:00,2017-10-16T08:00,2017,10,14.2,0.0,Cloudy
06/22/2017,13:00,40.732784,-73.79677,QUEENS,1.0,0.0,1,0,0,0,0,0,3697390,2017-06-22 13:00:00,2017-06-22T13:00,2017,6,26.1,0.0,Cloudy
05/02/2017,0:00,40.705826,-73.79397,QUEENS,2.0,0.0,0,0,0,0,2,0,3661695,2017-05-02 00:00:00,2017-05-02T00:00,2017,5,17.6,0.2,Drizzle
07/07/2017,21:00,40.74897,-73.870346,QUEENS,1.0,0.0,1,0,0,0,0,0,3708622,2017-07-07 21:00:00,2017-07-07T21:00,2017,7,22.7,0.7,Drizzle
07/14/2017,5:00,40.667084,-73.78698,QUEENS,1.0,0.0,1,0,0,0,0,0,3711330,2017-07-14 05:00:00,2017-07-14T05:00,2017,7,19.3,0.0,Cloudy
12/19/2017,17:00,40.735497,-73.869705,QUEENS,1.0,0.0,0,0,1,0,0,0,3813308,2017-12-19 17:00:00,2017-12-19T17:00,2017,12,8.9,0.0,Cloudy
11/09/2017,15:00,40.724308,-73.72474,QUEENS,0.0,0.0,0,0,0,0,0,0,3786900,2017-11-09 15:00:00,2017-11-09T15:00,2017,11,10.9,0.0,Cloudy
02/15/2017,23:00,40.70985,-73.917145,QUEENS,1.0,0.0,0,0,0,0,1,0,3616686,2017-02-15 23:00:00,2017-02-15T23:00,2017,2,0.5,0.0,Clear
09/03/2017,2:00,40.679855,-73.846756,QUEENS,0.0,0.0,0,0,0,0,0,0,3741620,2017-09-03 02:00:00,2017-09-03T02:00,2017,9,17.9,0.1,Drizzle
10/26/2017,15:00,40.711468,-73.7315,QUEENS,1.0,0.0,0,0,0,0,1,0,3777608,2017-10-26 15:00:00,2017-10-26T15:00,2017,10,11.6,1.1,Drizzle
05/23/2017,14:00,40.70519,-73.91478,QUEENS,1.0,0.0,1,0,0,0,0,0,3676894,2017-05-23 14:00:00,2017-05-23T14:00,2017,5,20.3,0.0,Cloudy
03/21/2017,15:00,40.700478,-73.902145,QUEENS,0.0,0.0,0,0,0,0,0,0,3636563,2017-03-21 15:00:00,2017-03-21T15:00,2017,3,13.7,0.0,Clear
05/06/2017,21:00,40.75226,-73.86822,QUEENS,1.0,0.0,1,0,0,0,0,0,3664439,2017-05-06 21:00:00,2017-05-06T21:00,2017,5,12.7,0.1,Drizzle
12/02/2017,10:00,40.72442,-73.89819,QUEENS,0.0,0.0,0,0,0,0,0,0,3802136,2017-12-02 10:00:00,2017-12-02T10:00,2017,12,5.4,0.0,Cloudy
01/02/2017,16:00,40.761314,-73.885475,QUEENS,1.0,0.0,0,0,0,0,1,0,3591309,2017-01-02 16:00:00,2017-01-02T16:00,2017,1,4.3,0.3,Drizzle
02/22/2017,18:00,40.69588,-73.84944,QUEENS,1.0,0.0,1,0,0,0,0,0,3620986,2017-02-22 18:00:00,2017-02-22T18:00,2017,2,5.7,0.0,Cloudy
02/20/2017,12:00,40.765266,-73.81517,QUEENS,1.0,0.0,0,0,0,0,1,0,3619120,2017-02-20 12:00:00,2017-02-20T12:00,2017,2,9.9,0.0,Clear
07/14/2017,11:00,40.75895,-73.83192,QUEENS,0.0,0.0,0,0,0,0,0,0,3710906,2017-07-14 11:00:00,2017-07-14T11:00,2017,7,19.4,0.9,Drizzle
08/11/2017,8:00,40.665634,-73.758156,QUEENS,0.0,0.0,0,0,0,0,0,0,3733375,2017-08-11 08:00:00,2017-08-11T08:00,2017,8,23.0,0.0,Cloudy
02/13/2017,12:00,40.76501,-73.8871,QUEENS,1.0,0.0,0,0,0,0,1,0,3615368,2017-02-13 12:00:00,2017-02-13T12:00,2017,2,2.0,0.0,Cloudy
10/09/2017,19:00,40.755013,-73.93434,QUEENS,3.0,0.0,0,0,0,0,3,0,3766443,2017-10-09 19:00:00,2017-10-09T19:00,2017,10,23.5,0.0,Cloudy
01/09/2017,11:00,40.760048,-73.92806,QUEENS,1.0,0.0,1,0,0,0,0,0,3595651,2017-01-09 11:00:00,2017-01-09T11:00,2017,1,-11.2,0.0,Cloudy
04/07/2017,13:00,40.748245,-73.87821,QUEENS,1.0,0.0,1,0,0,0,0,0,3646716,2017-04-07 13:00:00,2017-04-07T13:00,2017,4,7.9,0.3,Drizzle
10/19/2017,1:00,40.72229,-73.86732,QUEENS,0.0,0.0,0,0,0,0,0,0,3772184,2017-10-19 01:00:00,2017-10-19T01:00,2017,10,12.0,0.0,Clear
10/05/2017,21:00,40.672222,-73.80746,QUEENS,1.0,0.0,0,0,0,0,1,0,3764238,2017-10-05 21:00:00,2017-10-05T21:00,2017,10,22.3,0.2,Drizzle
09/14/2017,8:00,40.71512,-73.77358,QUEENS,0.0,0.0,0,0,0,0,0,0,3750090,2017-09-14 08:00:00,2017-09-14T08:00,2017,9,22.1,0.0,Cloudy
01/27/2017,16:00,40.712936,-73.78263,QUEENS,0.0,0.0,0,0,0,0,0,0,3608002,2017-01-27 16:00:00,2017-01-27T16:00,2017,1,5.2,0.1,Drizzle
12/07/2017,7:00,40.780407,-73.81211,QUEENS,0.0,0.0,0,0,0,0,0,0,3804455,2017-12-07 07:00:00,2017-12-07T07:00,2017,12,1.7,0.0,Clear
08/10/2017,6:00,40.727894,-73.83287,QUEENS,1.0,0.0,0,0,0,0,1,0,3728363,2017-08-10 06:00:00,2017-08-10T06:00,2017,8,19.1,0.0,Clear
01/18/2017,13:00,40.67736,-73.74493,QUEENS,2.0,0.0,0,0,0,0,2,0,3601026,2017-01-18 13:00:00,2017-01-18T13:00,2017,1,4.2,0.0,Cloudy
12/01/2017,11:00,40.740875,-73.89962,QUEENS,0.0,0.0,0,0,0,0,0,0,3800888,2017-12-01 11:00:00,2017-12-01T11:00,2017,12,9.5,0.0,Clear
05/19/2017,13:00,40.768993,-73.83364,QUEENS,1.0,0.0,1,0,0,0,0,0,3673748,2017-05-19 13:00:00,2017-05-19T13:00,2017,5,28.2,0.0,Cloudy
07/27/2017,9:00,40.703987,-73.79855,QUEENS,1.0,0.0,0,0,1,0,0,0,3731286,2017-07-27 09:00:00,2017-07-27T09:00,2017,7,22.2,0.2,Drizzle
02/24/2017,7:00,40.665558,-73.72985,QUEENS,1.0,0.0,1,0,0,0,0,0,3621356,2017-02-24 07:00:00,2017-02-24T07:00,2017,2,9.5,0.0,Cloudy
09/10/2017,21:00,40.675884,-73.75577,QUEENS,1.0,0.0,0,0,0,0,1,0,3747213,2017-09-10 21:00:00,2017-09-10T21:00,2017,9,15.0,0.0,Clear
03/14/2017,16:00,40.762074,-73.861145,QUEENS,0.0,0.0,0,0,0,0,0,0,3633777,2017-03-14 16:00:00,2017-03-14T16:00,2017,3,-1.2,0.4,Heavy Snow
03/11/2017,22:00,40.755398,-73.86918,QUEENS,1.0,0.0,0,0,0,0,1,0,3629820,2017-03-11 22:00:00,2017-03-11T22:00,2017,3,-5.6,0.0,Clear
11/28/2017,0:00,40.701237,-73.79465,QUEENS,1.0,0.0,0,0,0,0,1,0,3799185,2017-11-28 00:00:00,2017-11-28T00:00,2017,11,1.8,0.0,Cloudy
07/08/2017,15:00,40.680023,-73.794624,QUEENS,1.0,0.0,0,0,0,0,1,0,3707094,2017-07-08 15:00:00,2017-07-08T15:00,2017,7,28.2,0.0,Cloudy
12/28/2017,19:00,40.757847,-73.89922,QUEENS,2.0,0.0,0,0,0,0,2,0,3820496,2017-12-28 19:00:00,2017-12-28T19:00,2017,12,-9.1,0.0,Clear
08/30/2017,19:00,40.700893,-73.813225,QUEENS,0.0,0.0,0,0,0,0,0,0,3743499,2017-08-30 19:00:00,2017-08-30T19:00,2017,8,21.6,0.0,Clear
11/17/2017,10:00,40.718136,-73.79191,QUEENS,2.0,0.0,0,0,0,0,2,0,3796542,2017-11-17 10:00:00,2017-11-17T10:00,2017,11,5.6,0.0,Clear
11/03/2017,9:00,40.707714,-73.802795,QUEENS,1.0,0.0,1,0,0,0,0,0,3782688,2017-11-03 09:00:00,2017-11-03T09:00,2017,11,18.3,0.0,Clear
12/04/2017,23:00,40.764347,-73.92347,QUEENS,1.0,0.0,0,0,0,0,1,0,3802877,2017-12-04 23:00:00,2017-12-04T23:00,2017,12,8.8,0.0,Cloudy
07/27/2017,16:00,40.670864,-73.81207,QUEENS,0.0,0.0,0,0,0,0,0,0,3719933,2017-07-27 16:00:00,2017-07-27T16:00,2017,7,23.7,0.0,Cloudy
12/21/2017,7:00,40.745766,-73.86421,QUEENS,0.0,0.0,0,0,0,0,0,0,3813453,2017-12-21 07:00:00,2017-12-21T07:00,2017,12,-1.7,0.0,Clear
12/26/2017,19:00,40.700592,-73.85457,QUEENS,0.0,0.0,0,0,0,0,0,0,3818392,2017-12-26 19:00:00,2017-12-26T19:00,2017,12,-3.9,0.0,Clear
03/27/2017,23:00,40.674255,-73.75318,QUEENS,0.0,0.0,0,0,0,0,0,0,3640282,2017-03-27 23:00:00,2017-03-27T23:00,2017,3,8.1,0.0,Cloudy
03/28/2017,19:00,40.749744,-73.884315,QUEENS,1.0,0.0,1,0,0,0,0,0,3641075,2017-03-28 19:00:00,2017-03-28T19:00,2017,3,4.1,0.1,Drizzle
04/09/2017,13:00,40.74906,-73.89083,QUEENS,0.0,0.0,0,0,0,0,0,0,3648690,2017-04-09 13:00:00,2017-04-09T13:00,2017,4,16.3,0.0,Clear
01/10/2017,22:00,40.668304,-73.74712,QUEENS,1.0,0.0,0,0,0,0,1,0,3595923,2017-01-10 22:00:00,2017-01-10T22:00,2017,1,5.6,0.0,Cloudy
08/27/2017,15:00,40.65973,-73.74174,QUEENS,0.0,0.0,0,0,0,0,0,0,3739203,2017-08-27 15:00:00,2017-08-27T15:00,2017,8,22.2,0.0,Cloudy
10/11/2017,21:00,40.68753,-73.78495,QUEENS,1.0,0.0,1,0,0,0,0,0,3768017,2017-10-11 21:00:00,2017-10-11T21:00,2017,10,17.9,0.0,Cloudy
06/04/2017,19:00,40.691395,-73.82093,QUEENS,1.0,0.0,1,0,0,0,0,0,3685849,2017-06-04 19:00:00,2017-06-04T19:00,2017,6,16.1,0.0,Cloudy
08/06/2017,19:00,40.660946,-73.73888,QUEENS,1.0,0.0,0,0,1,0,0,0,3726472,2017-08-06 19:00:00,2017-08-06T19:00,2017,8,21.2,0.0,Cloudy
09/20/2017,19:00,40.66549,-73.75236,QUEENS,0.0,0.0,0,0,0,0,0,0,3754490,2017-09-20 19:00:00,2017-09-20T19:00,2017,9,23.6,0.0,Cloudy
12/04/2017,21:00,40.715954,-73.74567,QUEENS,1.0,0.0,0,0,0,0,1,0,3802912,2017-12-04 21:00:00,2017-12-04T21:00,2017,12,8.5,0.0,Cloudy
05/17/2017,22:00,40.738796,-73.80799,QUEENS,1.0,0.0,0,0,0,0,1,0,3672161,2017-05-17 22:00:00,2017-05-17T22:00,2017,5,23.3,0.0,Cloudy
01/05/2017,5:00,40.713303,-73.73586,QUEENS,0.0,0.0,0,0,0,0,0,0,3592285,2017-01-05 05:00:00,2017-01-05T05:00,2017,1,-3.6,0.0,Clear
03/13/2017,17:00,40.760464,-73.826546,QUEENS,1.0,0.0,1,0,0,0,0,0,3631471,2017-03-13 17:00:00,2017-03-13T17:00,2017,3,-1.4,0.0,Cloudy
01/12/2017,13:00,40.78167,-73.829216,QUEENS,1.0,0.0,0,0,0,0,1,0,3597139,2017-01-12 13:00:00,2017-01-12T13:00,2017,1,15.2,0.0,Cloudy
07/13/2017,15:00,40.697556,-73.852776,QUEENS,0.0,0.0,0,0,0,0,0,0,3710536,2017-07-13 15:00:00,2017-07-13T15:00,2017,7,30.9,0.0,Cloudy
01/15/2017,9:00,40.768997,-73.83362,QUEENS,1.0,0.0,1,0,0,0,0,0,3598703,2017-01-15 09:00:00,2017-01-15T09:00,2017,1,-1.0,0.0,Clear
07/08/2017,10:00,40.7008,-73.907364,QUEENS,0.0,0.0,0,0,0,0,0,0,3708001,2017-07-08 10:00:00,2017-07-08T10:00,2017,7,26.1,0.0,Cloudy
05/11/2017,19:00,40.679916,-73.73942,QUEENS,1.0,0.0,0,0,0,0,1,0,3667759,2017-05-11 19:00:00,2017-05-11T19:00,2017,5,10.3,0.0,Cloudy
08/22/2017,21:00,40.737156,-73.87941,QUEENS,2.0,0.0,0,0,0,0,2,0,3735512,2017-08-22 21:00:00,2017-08-22T21:00,2017,8,26.8,0.0,Cloudy
06/04/2017,0:00,40.666893,-73.80546,QUEENS,0.0,0.0,0,0,0,0,0,0,3683587,2017-06-04 00:00:00,2017-06-04T00:00,2017,6,13.9,0.0,Clear
06/21/2017,8:00,40.71241,-73.826454,QUEENS,1.0,0.0,0,0,0,0,1,0,3695778,2017-06-21 08:00:00,2017-06-21T08:00,2017,6,24.8,0.0,Clear
12/21/2017,13:00,40.710762,-73.89961,QUEENS,0.0,0.0,0,0,0,0,0,0,3826147,2017-12-21 13:00:00,2017-12-21T13:00,2017,12,3.1,0.0,Clear
04/12/2017,16:00,40.746185,-73.92949,QUEENS,0.0,0.0,0,0,0,0,0,0,3649725,2017-04-12 16:00:00,2017-04-12T16:00,2017,4,22.1,0.0,Clear
07/07/2017,15:00,40.774746,-73.79291,QUEENS,0.0,0.0,0,0,0,0,0,0,3706694,2017-07-07 15:00:00,2017-07-07T15:00,2017,7,24.2,0.0,Cloudy
01/03/2017,17:00,40.721054,-73.8552,QUEENS,1.0,0.0,1,0,0,0,0,0,3591715,2017-01-03 17:00:00,2017-01-03T17:00,2017,1,6.4,1.0,Drizzle
11/03/2017,19:00,40.70874,-73.78603,QUEENS,2.0,0.0,0,0,0,0,2,0,3782925,2017-11-03 19:00:00,2017-11-03T19:00,2017,11,16.6,0.0,Clear
04/17/2017,18:00,40.778774,-73.80053,QUEENS,0.0,0.0,0,0,0,0,0,0,3652907,2017-04-17 18:00:00,2017-04-17T18:00,2017,4,17.7,0.0,Clear
07/06/2017,17:00,40.76465,-73.823494,QUEENS,0.0,0.0,0,0,0,0,0,0,3706073,2017-07-06 17:00:00,2017-07-06T17:00,2017,7,23.4,0.0,Cloudy
07/09/2017,17:00,40.748722,-73.75776,QUEENS,0.0,0.0,0,0,0,0,0,0,3709229,2017-07-09 17:00:00,2017-07-09T17:00,2017,7,24.1,0.0,Clear
04/05/2017,15:00,40.675842,-73.7586,QUEENS,1.0,0.0,0,0,0,0,1,0,3645602,2017-04-05 15:00:00,2017-04-05T15:00,2017,4,13.9,0.0,Cloudy
04/25/2017,17:00,40.711426,-73.905396,QUEENS,0.0,0.0,0,0,0,0,0,0,3657575,2017-04-25 17:00:00,2017-04-25T17:00,2017,4,10.9,0.3,Drizzle
03/16/2017,23:00,40.595444,-73.779045,QUEENS,0.0,0.0,0,0,0,0,0,0,3634380,2017-03-16 23:00:00,2017-03-16T23:00,2017,3,-2.6,0.0,Clear
09/30/2017,10:00,40.749825,-73.818275,QUEENS,0.0,0.0,0,0,0,0,0,0,3760324,2017-09-30 10:00:00,2017-09-30T10:00,2017,9,15.5,1.4,Light Rain
03/23/2017,18:00,40.768913,-73.88873,QUEENS,2.0,0.0,0,0,0,0,2,0,3638309,2017-03-23 18:00:00,2017-03-23T18:00,2017,3,2.8,0.0,Clear
11/16/2017,8:00,40.745834,-73.880295,QUEENS,2.0,0.0,2,0,0,0,0,0,3791129,2017-11-16 08:00:00,2017-11-16T08:00,2017,11,9.8,0.9,Drizzle
04/28/2017,9:00,40.75361,-73.83398,QUEENS,0.0,0.0,0,0,0,0,0,0,3658981,2017-04-28 09:00:00,2017-04-28T09:00,2017,4,20.1,0.0,Cloudy
10/15/2017,13:00,40.69832,-73.90011,QUEENS,2.0,0.0,0,0,0,0,2,0,3769810,2017-10-15 13:00:00,2017-10-15T13:00,2017,10,23.2,0.0,Cloudy
11/20/2017,2:00,40.67546,-73.73385,QUEENS,1.0,0.0,0,0,0,0,1,0,3793302,2017-11-20 02:00:00,2017-11-20T02:00,2017,11,3.5,0.0,Clear
04/07/2017,10:00,40.691948,-73.730675,QUEENS,1.0,0.0,0,0,0,0,1,0,3646873,2017-04-07 10:00:00,2017-04-07T10:00,2017,4,7.2,0.0,Cloudy
05/20/2017,8:00,40.68511,-73.79811,QUEENS,0.0,0.0,0,0,0,0,0,0,3673956,2017-05-20 08:00:00,2017-05-20T08:00,2017,5,15.5,0.1,Drizzle
08/11/2017,9:00,40.7201,-73.79038,QUEENS,1.0,0.0,0,0,0,0,1,0,3728874,2017-08-11 09:00:00,2017-08-11T09:00,2017,8,23.9,0.0,Cloudy
05/19/2017,9:00,40.784515,-73.818596,QUEENS,0.0,0.0,0,0,0,0,0,0,3673123,2017-05-19 09:00:00,2017-05-19T09:00,2017,5,28.2,0.0,Clear
04/22/2017,23:00,40.716843,-73.8167,QUEENS,1.0,0.0,0,0,0,0,1,0,3655870,2017-04-22 23:00:00,2017-04-22T23:00,2017,4,9.6,0.0,Cloudy
10/18/2017,22:00,40.65965,-73.773834,QUEENS,4.0,0.0,0,0,0,0,4,0,3772374,2017-10-18 22:00:00,2017-10-18T22:00,2017,10,14.8,0.0,Clear
11/17/2017,19:00,40.735634,-73.93671,QUEENS,0.0,0.0,0,0,0,0,0,0,3792179,2017-11-17 19:00:00,2017-11-17T19:00,2017,11,4.0,0.0,Clear
08/03/2017,11:00,40.69546,-73.85271,QUEENS,1.0,0.0,0,0,1,0,0,0,3725428,2017-08-03 11:00:00,2017-08-03T11:00,2017,8,26.3,0.0,Clear
10/13/2017,18:00,40.760563,-73.76707,QUEENS,0.0,0.0,0,0,0,0,0,0,3769193,2017-10-13 18:00:00,2017-10-13T18:00,2017,10,16.5,0.0,Cloudy
06/05/2017,16:00,40.75207,-73.926476,QUEENS,1.0,0.0,0,0,0,0,1,0,3684648,2017-06-05 16:00:00,2017-06-05T16:00,2017,6,20.3,0.2,Drizzle
10/17/2017,19:00,40.702957,-73.74332,QUEENS,1.0,0.0,1,0,0,0,0,0,3772365,2017-10-17 19:00:00,2017-10-17T19:00,2017,10,11.8,0.0,Clear
11/20/2017,8:00,40.728027,-73.80309,QUEENS,0.0,0.0,0,0,0,0,0,0,3798967,2017-11-20 08:00:00,2017-11-20T08:00,2017,11,2.7,0.0,Clear
05/01/2017,17:00,40.68636,-73.810036,QUEENS,0.0,0.0,0,0,0,0,0,0,3661605,2017-05-01 17:00:00,2017-05-01T17:00,2017,5,17.6,0.0,Clear
07/03/2017,13:00,40.720055,-73.761856,QUEENS,0.0,0.0,0,0,0,0,0,0,3704376,2017-07-03 13:00:00,2017-07-03T13:00,2017,7,31.1,0.0,Clear
02/28/2017,15:00,40.75251,-73.86727,QUEENS,1.0,0.0,1,0,0,0,0,0,3624103,2017-02-28 15:00:00,2017-02-28T15:00,2017,2,12.7,0.0,Cloudy
11/16/2017,6:00,40.745438,-73.923,QUEENS,0.0,0.0,0,0,0,0,0,0,3791227,2017-11-16 06:00:00,2017-11-16T06:00,2017,11,10.7,0.6,Drizzle
07/17/2017,18:00,40.713814,-73.92058,QUEENS,0.0,0.0,0,0,0,0,0,0,3713215,2017-07-17 18:00:00,2017-07-17T18:00,2017,7,24.9,0.0,Cloudy
12/08/2017,11:00,40.658657,-73.771996,QUEENS,0.0,0.0,0,0,0,0,0,0,3805537,2017-12-08 11:00:00,2017-12-08T11:00,2017,12,2.7,0.0,Cloudy
05/25/2017,7:00,40.746895,-73.89643,QUEENS,1.0,0.0,1,0,0,0,0,0,3677809,2017-05-25 07:00:00,2017-05-25T07:00,2017,5,13.1,1.9,Light Rain
09/17/2017,1:00,40.69143,-73.830536,QUEENS,2.0,0.0,0,0,0,0,2,0,3751938,2017-09-17 01:00:00,2017-09-17T01:00,2017,9,20.1,0.0,Cloudy
05/24/2017,14:00,40.72375,-73.72649,QUEENS,0.0,0.0,0,0,0,0,0,0,3677080,2017-05-24 14:00:00,2017-05-24T14:00,2017,5,17.9,0.0,Cloudy
12/02/2017,9:00,40.692783,-73.74511,QUEENS,0.0,0.0,0,0,0,0,0,0,3801162,2017-12-02 09:00:00,2017-12-02T09:00,2017,12,4.7,0.0,Cloudy
07/19/2017,7:00,40.73155,-73.77132,QUEENS,1.0,0.0,0,0,0,0,1,0,3714352,2017-07-19 07:00:00,2017-07-19T07:00,2017,7,25.6,0.0,Cloudy
11/04/2017,19:00,40.75732,-73.834015,QUEENS,0.0,0.0,0,0,0,0,0,0,3783257,2017-11-04 19:00:00,2017-11-04T19:00,2017,11,9.3,0.0,Cloudy
06/08/2017,9:00,40.6843,-73.79228,QUEENS,0.0,0.0,0,0,0,0,0,0,3686459,2017-06-08 09:00:00,2017-06-08T09:00,2017,6,18.2,0.0,Cloudy
05/19/2017,3:00,40.754307,-73.86689,QUEENS,0.0,0.0,0,0,0,0,0,0,3673124,2017-05-19 03:00:00,2017-05-19T03:00,2017,5,21.6,0.0,Clear
01/17/2017,8:00,40.664597,-73.76331,QUEENS,1.0,0.0,0,0,0,0,1,0,3599654,2017-01-17 08:00:00,2017-01-17T08:00,2017,1,4.0,0.0,Cloudy
12/02/2017,19:00,40.725647,-73.7917,QUEENS,0.0,0.0,0,0,0,0,0,0,3803458,2017-12-02 19:00:00,2017-12-02T19:00,2017,12,4.1,0.0,Cloudy
06/19/2017,7:00,40.76615,-73.919785,QUEENS,1.0,0.0,1,0,0,0,0,0,3694243,2017-06-19 07:00:00,2017-06-19T07:00,2017,6,25.5,0.0,Clear
11/30/2017,8:00,40.745865,-73.926704,QUEENS,1.0,0.0,0,0,0,0,1,0,3800443,2017-11-30 08:00:00,2017-11-30T08:00,2017,11,2.3,0.0,Cloudy
01/30/2017,20:00,40.71189,-73.78743,QUEENS,0.0,0.0,0,0,0,0,0,0,3607114,2017-01-30 20:00:00,2017-01-30T20:00,2017,1,-2.5,0.0,Clear
12/07/2017,15:00,40.755398,-73.75439,QUEENS,0.0,0.0,0,0,0,0,0,0,3805474,2017-12-07 15:00:00,2017-12-07T15:00,2017,12,5.6,0.0,Clear
08/16/2017,11:00,40.724434,-73.8693,QUEENS,1.0,0.0,1,0,0,0,0,0,3731887,2017-08-16 11:00:00,2017-08-16T11:00,2017,8,27.3,0.1,Drizzle
01/27/2017,0:00,40.76758,-73.93596,QUEENS,1.0,0.0,1,0,0,0,0,0,3605293,2017-01-27 00:00:00,2017-01-27T00:00,2017,1,4.0,0.0,Clear
03/21/2017,0:00,40.7002,-73.89417,QUEENS,1.0,0.0,1,0,0,0,0,0,3636558,2017-03-21 00:00:00,2017-03-21T00:00,2017,3,3.6,0.0,Cloudy
11/18/2017,19:00,40.75285,-73.89341,QUEENS,1.0,0.0,1,0,0,0,0,0,3794068,2017-11-18 19:00:00,2017-11-18T19:00,2017,11,8.6,0.1,Drizzle
12/22/2017,0:00,40.737595,-73.89414,QUEENS,0.0,0.0,0,0,0,0,0,0,3816307,2017-12-22 00:00:00,2017-12-22T00:00,2017,12,-1.3,0.0,Cloudy
10/06/2017,8:00,40.70237,-73.83612,QUEENS,0.0,0.0,0,0,0,0,0,0,3766417,2017-10-06 08:00:00,2017-10-06T08:00,2017,10,20.2,0.0,Clear
06/24/2017,0:00,40.66454,-73.82276,QUEENS,0.0,0.0,0,0,0,0,0,0,3697797,2017-06-24 00:00:00,2017-06-24T00:00,2017,6,24.3,0.2,Drizzle
04/20/2017,8:00,40.662357,-73.73517,QUEENS,2.0,0.0,0,0,0,0,2,0,3654252,2017-04-20 08:00:00,2017-04-20T08:00,2017,4,10.3,0.5,Drizzle
09/01/2017,13:00,40.75798,-73.778275,QUEENS,1.0,0.0,0,0,0,0,1,0,3742130,2017-09-01 13:00:00,2017-09-01T13:00,2017,9,20.2,0.0,Cloudy
09/25/2017,19:00,40.690918,-73.7623,QUEENS,0.0,0.0,0,0,0,0,0,0,3758322,2017-09-25 19:00:00,2017-09-25T19:00,2017,9,20.8,0.0,Clear
08/25/2017,11:00,40.711727,-73.91729,QUEENS,1.0,0.0,0,0,1,0,0,0,3813404,2017-08-25 11:00:00,2017-08-25T11:00,2017,8,22.9,0.1,Drizzle
06/26/2017,14:00,40.586746,-73.81712,QUEENS,1.0,0.0,0,0,1,0,0,0,3700948,2017-06-26 14:00:00,2017-06-26T14:00,2017,6,23.5,0.0,Cloudy
09/08/2017,13:00,40.71639,-73.74376,QUEENS,1.0,0.0,0,0,0,0,1,0,3745971,2017-09-08 13:00:00,2017-09-08T13:00,2017,9,21.4,0.1,Drizzle
03/11/2017,18:00,40.71927,-73.86797,QUEENS,2.0,0.0,0,0,0,0,2,0,3630085,2017-03-11 18:00:00,2017-03-11T18:00,2017,3,-2.4,0.0,Clear
04/28/2017,7:00,40.70417,-73.81538,QUEENS,0.0,0.0,0,0,0,0,0,0,3658888,2017-04-28 07:00:00,2017-04-28T07:00,2017,4,15.5,0.0,Clear
03/22/2017,22:00,40.781685,-73.825424,QUEENS,0.0,0.0,0,0,0,0,0,0,3637343,2017-03-22 22:00:00,2017-03-22T22:00,2017,3,-4.9,0.0,Clear
02/06/2017,23:00,40.727627,-73.84173,QUEENS,2.0,0.0,0,0,0,0,2,0,3610872,2017-02-06 23:00:00,2017-02-06T23:00,2017,2,3.2,0.0,Cloudy
01/24/2017,9:00,40.683453,-73.855606,QUEENS,1.0,0.0,0,0,0,0,1,0,3604566,2017-01-24 09:00:00,2017-01-24T09:00,2017,1,3.2,0.5,Drizzle
02/03/2017,16:00,40.707554,-73.7503,QUEENS,0.0,0.0,0,0,0,0,0,0,3609251,2017-02-03 16:00:00,2017-02-03T16:00,2017,2,0.8,0.0,Cloudy
09/23/2017,13:00,40.768345,-73.89528,QUEENS,2.0,0.0,0,0,0,0,2,0,3755646,2017-09-23 13:00:00,2017-09-23T13:00,2017,9,28.5,0.0,Clear
01/15/2017,13:00,40.54468,-74.195145,STATEN ISLAND,1.0,0.0,0,0,0,0,1,0,3598777,2017-01-15 13:00:00,2017-01-15T13:00,2017,1,3.6,0.0,Clear
03/23/2017,13:00,40.645576,-74.087906,STATEN ISLAND,1.0,0.0,0,0,0,0,1,0,3638371,2017-03-23 13:00:00,2017-03-23T13:00,2017,3,4.4,0.0,Clear
02/07/2017,15:00,40.581627,-74.1057,STATEN ISLAND,1.0,0.0,0,0,0,0,1,0,3611389,2017-02-07 15:00:00,2017-02-07T15:00,2017,2,5.9,0.0,Cloudy
04/11/2017,7:00,40.613525,-74.11685,STATEN ISLAND,1.0,0.0,0,0,0,0,1,0,3649630,2017-04-11 07:00:00,2017-04-11T07:00,2017,4,13.5,0.0,Cloudy
05/08/2017,8:00,40.613525,-74.11685,STATEN ISLAND,0.0,0.0,0,0,0,0,0,0,3665894,2017-05-08 08:00:00,2017-05-08T08:00,2017,5,8.9,0.0,Clear
02/16/2017,22:00,40.545036,-74.17278,STATEN ISLAND,0.0,0.0,0,0,0,0,0,0,3617390,2017-02-16 22:00:00,2017-02-16T22:00,2017,2,-2.0,0.0,Clear
12/21/2017,15:00,40.549084,-74.1621,STATEN ISLAND,1.0,0.0,0,0,0,0,1,0,3815927,2017-12-21 15:00:00,2017-12-21T15:00,2017,12,4.4,0.0,Clear
09/29/2017,16:00,40.616413,-74.103516,STATEN ISLAND,1.0,0.0,0,0,0,0,1,0,3761401,2017-09-29 16:00:00,2017-09-29T16:00,2017,9,20.0,0.0,Clear
02/16/2017,15:00,40.63277,-74.09004,STATEN ISLAND,0.0,0.0,0,0,0,0,0,0,3618313,2017-02-16 15:00:00,2017-02-16T15:00,2017,2,1.7,0.0,Cloudy
12/04/2017,11:00,40.643215,-74.098305,STATEN ISLAND,2.0,0.0,0,0,0,0,2,0,3803643,2017-12-04 11:00:00,2017-12-04T11:00,2017,12,6.2,0.0,Cloudy
12/15/2017,18:00,40.59703,-74.09337,STATEN ISLAND,0.0,0.0,0,0,0,0,0,0,3810750,2017-12-15 18:00:00,2017-12-15T18:00,2017,12,-3.0,0.6,Heavy Snow
06/29/2017,18:00,40.636578,-74.11357,STATEN ISLAND,0.0,0.0,0,0,0,0,0,0,3701993,2017-06-29 18:00:00,2017-06-29T18:00,2017,6,23.2,0.0,Cloudy
11/28/2017,18:00,40.61148,-74.098595,STATEN ISLAND,2.0,0.0,0,0,0,0,2,0,3799072,2017-11-28 18:00:00,2017-11-28T18:00,2017,11,9.8,0.0,Clear
08/12/2017,20:00,40.545216,-74.14241,STATEN ISLAND,1.0,0.0,0,0,0,0,1,0,3730343,2017-08-12 20:00:00,2017-08-12T20:00,2017,8,22.9,0.0,Cloudy
04/27/2017,18:00,40.542965,-74.21845,STATEN ISLAND,1.0,0.0,0,0,0,0,1,0,3660324,2017-04-27 18:00:00,2017-04-27T18:00,2017,4,13.8,0.0,Cloudy
04/21/2017,14:00,40.569973,-74.11025,STATEN ISLAND,0.0,0.0,0,0,0,0,0,0,3655618,2017-04-21 14:00:00,2017-04-21T14:00,2017,4,12.9,0.0,Cloudy
10/07/2017,12:00,40.616413,-74.103516,STATEN ISLAND,1.0,0.0,0,0,0,0,1,0,3765924,2017-10-07 12:00:00,2017-10-07T12:00,2017,10,22.6,0.1,Drizzle
09/25/2017,17:00,40.563446,-74.169754,STATEN ISLAND,0.0,0.0,0,0,0,0,0,0,3759244,2017-09-25 17:00:00,2017-09-25T17:00,2017,9,24.7,0.0,Clear
09/09/2017,14:00,40.59791,-74.08361,STATEN ISLAND,1.0,0.0,0,0,0,0,1,0,3746726,2017-09-09 14:00:00,2017-09-09T14:00,2017,9,20.6,0.0,Cloudy
04/27/2017,15:00,40.63172,-74.095924,STATEN ISLAND,3.0,0.0,0,0,0,0,3,0,3658818,2017-04-27 15:00:00,2017-04-27T15:00,2017,4,14.6,0.0,Cloudy
11/16/2017,2:00,40.544735,-74.14359,STATEN ISLAND,1.0,0.0,0,0,0,0,1,0,3791531,2017-11-16 02:00:00,2017-11-16T02:00,2017,11,10.4,0.0,Cloudy
01/02/2017,18:00,40.645126,-74.10873,STATEN ISLAND,1.0,0.0,0,0,1,0,0,0,3591641,2017-01-02 18:00:00,2017-01-02T18:00,2017,1,4.3,0.9,Drizzle
11/07/2017,0:00,40.633858,-74.12596,STATEN ISLAND,1.0,0.0,1,0,0,0,0,0,3785537,2017-11-07 00:00:00,2017-11-07T00:00,2017,11,7.5,0.0,Clear
08/19/2017,19:00,40.637207,-74.0814,STATEN ISLAND,0.0,0.0,0,0,0,0,0,0,3734744,2017-08-19 19:00:00,2017-08-19T19:00,2017,8,25.2,0.0,Clear
04/24/2017,15:00,40.57548,-74.11489,STATEN ISLAND,1.0,0.0,0,0,0,0,1,0,3657075,2017-04-24 15:00:00,2017-04-24T15:00,2017,4,10.5,0.2,Drizzle
01/05/2017,8:00,40.561512,-74.171844,STATEN ISLAND,0.0,0.0,0,0,0,0,0,0,3594260,2017-01-05 08:00:00,2017-01-05T08:00,2017,1,-3.1,0.0,Cloudy
01/14/2017,9:00,40.608124,-74.09019,STATEN ISLAND,1.0,0.0,1,0,0,0,0,0,3598162,2017-01-14 09:00:00,2017-01-14T09:00,2017,1,-2.0,0.0,Cloudy
02/02/2017,20:00,40.561512,-74.171844,STATEN ISLAND,2.0,0.0,0,0,0,0,2,0,3611779,2017-02-02 20:00:00,2017-02-02T20:00,2017,2,1.2,0.0,Clear
01/11/2017,9:00,40.613213,-74.06989,STATEN ISLAND,0.0,0.0,0,0,0,0,0,0,3596441,2017-01-11 09:00:00,2017-01-11T09:00,2017,1,4.7,0.0,Clear
11/19/2017,17:00,40.6094,-74.09011,STATEN ISLAND,1.0,0.0,0,0,0,0,1,0,3793405,2017-11-19 17:00:00,2017-11-19T17:00,2017,11,7.3,0.0,Clear
12/04/2017,17:00,40.62782,-74.12126,STATEN ISLAND,1.0,0.0,0,0,0,0,1,0,3803636,2017-12-04 17:00:00,2017-12-04T17:00,2017,12,8.1,0.0,Cloudy
03/30/2017,17:00,40.63197,-74.075966,STATEN ISLAND,0.0,0.0,0,0,0,0,0,0,3643920,2017-03-30 17:00:00,2017-03-30T17:00,2017,3,6.9,0.0,Cloudy
06/18/2017,9:00,40.533833,-74.194885,STATEN ISLAND,1.0,0.0,0,0,0,0,1,0,3692759,2017-06-18 09:00:00,2017-06-18T09:00,2017,6,25.4,0.3,Drizzle
04/13/2017,13:00,40.61242,-74.09936,STATEN ISLAND,1.0,0.0,0,0,0,0,1,0,3652130,2017-04-13 13:00:00,2017-04-13T13:00,2017,4,15.4,0.0,Clear
08/15/2017,14:00,40.570465,-74.10977,STATEN ISLAND,2.0,0.0,0,0,0,0,2,0,3731441,2017-08-15 14:00:00,2017-08-15T14:00,2017,8,23.6,0.1,Drizzle
12/15/2017,21:00,40.58524,-74.093414,STATEN ISLAND,1.0,0.0,0,0,0,0,1,0,3810752,2017-12-15 21:00:00,2017-12-15T21:00,2017,12,-3.7,0.0,Clear
05/18/2017,12:00,40.636955,-74.11755,STATEN ISLAND,11.0,0.0,0,0,0,0,11,0,3673645,2017-05-18 12:00:00,2017-05-18T12:00,2017,5,29.8,0.0,Clear
10/03/2017,0:00,40.549305,-74.1747,STATEN ISLAND,0.0,0.0,0,0,0,0,0,0,3763343,2017-10-03 00:00:00,2017-10-03T00:00,2017,10,16.0,0.0,Clear
03/05/2017,17:00,40.624332,-74.09396,STATEN ISLAND,2.0,0.0,0,0,0,0,2,0,3627010,2017-03-05 17:00:00,2017-03-05T17:00,2017,3,1.7,0.0,Clear
02/13/2017,11:00,40.624367,-74.08033,STATEN ISLAND,1.0,0.0,0,0,0,0,1,0,3615101,2017-02-13 11:00:00,2017-02-13T11:00,2017,2,2.9,0.0,Cloudy
10/14/2017,14:00,40.572502,-74.11358,STATEN ISLAND,0.0,0.0,0,0,0,0,0,0,3769666,2017-10-14 14:00:00,2017-10-14T14:00,2017,10,20.6,0.0,Clear
11/03/2017,8:00,40.570465,-74.10977,STATEN ISLAND,0.0,0.0,0,0,0,0,0,0,3785255,2017-11-03 08:00:00,2017-11-03T08:00,2017,11,16.6,0.0,Cloudy
04/21/2017,16:00,40.642773,-74.11403,STATEN ISLAND,0.0,0.0,0,0,0,0,0,0,3655996,2017-04-21 16:00:00,2017-04-21T16:00,2017,4,13.8,0.0,Cloudy
03/23/2017,8:00,40.535168,-74.196175,STATEN ISLAND,3.0,0.0,0,0,0,0,3,0,3637861,2017-03-23 08:00:00,2017-03-23T08:00,2017,3,-3.1,0.0,Clear
02/17/2017,6:00,40.556973,-74.16901,STATEN ISLAND,1.0,0.0,0,0,0,0,1,0,3617374,2017-02-17 06:00:00,2017-02-17T06:00,2017,2,-3.9,0.0,Clear
02/07/2017,18:00,40.565914,-74.13082,STATEN ISLAND,1.0,0.0,0,0,0,0,1,0,3611916,2017-02-07 18:00:00,2017-02-07T18:00,2017,2,5.3,0.0,Cloudy
10/25/2017,17:00,40.527924,-74.21649,STATEN ISLAND,0.0,0.0,0,0,0,0,0,0,3777348,2017-10-25 17:00:00,2017-10-25T17:00,2017,10,16.2,0.1,Drizzle
09/11/2017,9:00,40.640198,-74.08504,STATEN ISLAND,0.0,0.0,0,0,0,0,0,0,3748423,2017-09-11 09:00:00,2017-09-11T09:00,2017,9,18.1,0.0,Clear
09/12/2017,18:00,40.588387,-74.09965,STATEN ISLAND,0.0,0.0,0,0,0,0,0,0,3748751,2017-09-12 18:00:00,2017-09-12T18:00,2017,9,20.2,0.0,Cloudy
12/02/2017,7:00,40.587074,-74.10393,STATEN ISLAND,0.0,0.0,0,0,0,0,0,0,3801198,2017-12-02 07:00:00,2017-12-02T07:00,2017,12,2.9,0.0,Cloudy
04/20/2017,17:00,40.59075,-74.08837,STATEN ISLAND,0.0,0.0,0,0,0,0,0,0,3654486,2017-04-20 17:00:00,2017-04-20T17:00,2017,4,15.5,0.0,Cloudy
08/23/2017,15:00,40.613743,-74.11415,STATEN ISLAND,0.0,0.0,0,0,0,0,0,0,3736619,2017-08-23 15:00:00,2017-08-23T15:00,2017,8,27.6,0.0,Cloudy
03/23/2017,15:00,40.642273,-74.0764,STATEN ISLAND,0.0,0.0,0,0,0,0,0,0,3639555,2017-03-23 15:00:00,2017-03-23T15:00,2017,3,5.9,0.0,Clear
11/29/2017,15:00,40.575653,-74.10455,STATEN ISLAND,2.0,0.0,0,0,0,0,2,0,3799702,2017-11-29 15:00:00,2017-11-29T15:00,2017,11,14.5,0.0,Clear
01/04/2017,8:00,40.639175,-74.121826,STATEN ISLAND,1.0,0.0,0,0,0,0,1,0,3592254,2017-01-04 08:00:00,2017-01-04T08:00,2017,1,6.0,0.0,Cloudy
09/19/2017,10:00,40.60363,-74.07703,STATEN ISLAND,1.0,0.0,0,0,0,0,1,0,3753330,2017-09-19 10:00:00,2017-09-19T10:00,2017,9,23.4,0.0,Cloudy
07/17/2017,10:00,40.59567,-74.08596,STATEN ISLAND,0.0,0.0,0,0,0,0,0,0,3713036,2017-07-17 10:00:00,2017-07-17T10:00,2017,7,26.1,0.0,Cloudy
10/13/2017,15:00,40.572422,-74.14111,STATEN ISLAND,1.0,0.0,1,0,0,0,0,0,3771358,2017-10-13 15:00:00,2017-10-13T15:00,2017,10,18.0,0.0,Cloudy
07/13/2017,16:00,40.634735,-74.11023,STATEN ISLAND,1.0,0.0,0,0,0,0,1,0,3711562,2017-07-13 16:00:00,2017-07-13T16:00,2017,7,27.0,0.5,Drizzle
08/02/2017,10:00,40.58004,-74.11396,STATEN ISLAND,2.0,0.0,0,0,0,0,2,0,3723459,2017-08-02 10:00:00,2017-08-02T10:00,2017,8,22.6,1.1,Drizzle
01/27/2017,0:00,40.5353,-74.14848,STATEN ISLAND,1.0,0.0,0,0,0,0,1,0,3605154,2017-01-27 00:00:00,2017-01-27T00:00,2017,1,4.5,0.0,Clear
07/18/2017,19:00,40.6143,-74.08475,STATEN ISLAND,1.0,0.0,0,0,0,0,1,0,3715334,2017-07-18 19:00:00,2017-07-18T19:00,2017,7,25.8,0.0,Clear
05/21/2017,16:00,40.614086,-74.06614,STATEN ISLAND,1.0,0.0,0,0,0,0,1,0,3675189,2017-05-21 16:00:00,2017-05-21T16:00,2017,5,14.7,0.0,Cloudy
08/25/2017,11:00,40.53635,-74.151596,STATEN ISLAND,0.0,0.0,0,0,0,0,0,0,3741542,2017-08-25 11:00:00,2017-08-25T11:00,2017,8,24.2,0.0,Clear
04/25/2017,13:00,40.629787,-74.07669,STATEN ISLAND,0.0,0.0,0,0,0,0,0,0,3657654,2017-04-25 13:00:00,2017-04-25T13:00,2017,4,11.9,0.2,Drizzle
05/22/2017,13:00,40.527668,-74.230225,STATEN ISLAND,0.0,0.0,0,0,0,0,0,0,3677793,2017-05-22 13:00:00,2017-05-22T13:00,2017,5,14.1,2.1,Light Rain
10/08/2017,13:00,40.57323,-74.14702,STATEN ISLAND,0.0,0.0,0,0,0,0,0,0,3765729,2017-10-08 13:00:00,2017-10-08T13:00,2017,10,24.7,0.0,Cloudy
05/03/2017,15:00,40.631134,-74.12794,STATEN ISLAND,1.0,0.0,1,0,0,0,0,0,3662792,2017-05-03 15:00:00,2017-05-03T15:00,2017,5,15.9,0.0,Cloudy
12/13/2017,16:00,40.57473,-74.12915,STATEN ISLAND,2.0,0.0,0,0,0,0,2,0,3808890,2017-12-13 16:00:00,2017-12-13T16:00,2017,12,-0.9,0.0,Clear
06/05/2017,8:00,40.587067,-74.09162,STATEN ISLAND,3.0,0.0,0,0,0,0,3,0,3684535,2017-06-05 08:00:00,2017-06-05T08:00,2017,6,17.1,0.0,Cloudy
10/20/2017,19:00,40.580616,-74.152534,STATEN ISLAND,3.0,0.0,0,0,0,0,3,0,3773643,2017-10-20 19:00:00,2017-10-20T19:00,2017,10,16.6,0.0,Clear
07/30/2017,13:00,40.596905,-74.111244,STATEN ISLAND,1.0,0.0,1,0,0,0,0,0,3721612,2017-07-30 13:00:00,2017-07-30T13:00,2017,7,25.0,0.0,Clear
06/14/2017,6:00,40.58781,-74.09851,STATEN ISLAND,0.0,0.0,0,0,0,0,0,0,3690865,2017-06-14 06:00:00,2017-06-14T06:00,2017,6,21.2,0.4,Drizzle
05/08/2017,17:00,40.57969,-74.100395,STATEN ISLAND,1.0,0.0,0,0,0,0,1,0,3666478,2017-05-08 17:00:00,2017-05-08T17:00,2017,5,13.6,0.0,Cloudy
04/06/2017,9:00,40.546688,-74.18591,STATEN ISLAND,1.0,0.0,0,0,0,0,1,0,3646426,2017-04-06 09:00:00,2017-04-06T09:00,2017,4,5.4,0.2,Drizzle
10/30/2017,8:00,40.603615,-74.06931,STATEN ISLAND,1.0,0.0,0,0,0,0,1,0,3780693,2017-10-30 08:00:00,2017-10-30T08:00,2017,10,8.8,0.4,Drizzle
03/31/2017,15:00,40.61494,-74.09796,STATEN ISLAND,1.0,0.0,0,0,0,0,1,0,3643862,2017-03-31 15:00:00,2017-03-31T15:00,2017,3,5.3,1.4,Light Rain
11/21/2017,14:00,40.560474,-74.16689,STATEN ISLAND,1.0,0.0,0,0,0,0,1,0,3795043,2017-11-21 14:00:00,2017-11-21T14:00,2017,11,13.5,0.0,Cloudy
03/29/2017,10:00,40.612286,-74.0697,STATEN ISLAND,0.0,0.0,0,0,0,0,0,0,3641681,2017-03-29 10:00:00,2017-03-29T10:00,2017,3,9.6,0.0,Cloudy
