CRASH DATE,CRASH TIME,LATITUDE,LONGITUDE,BOROUGH,NUMBER OF PERSONS INJURED,NUMBER OF PERSONS KILLED,NUMBER OF PEDESTRIANS INJURED,NUMBER OF PEDESTRIANS KILLED,NUMBER OF CYCLIST INJURED,NUMBER OF CYCLIST KILLED,NUMBER OF MOTORIST INJURED,NUMBER OF MOTORIST KILLED,COLLISION_ID,datetime,iso_datetime,year,month,temperature,precipitation,weather_condition
09/11/2019,0:00,40.88163,-73.86188,BRONX,1.0,0.0,0,0,0,0,1,0,4204296,2019-09-11 00:00:00,2019-09-11T00:00,2019,9,19.9,0.0,Clear
02/28/2019,5:00,40.867912,-73.8344,BRONX,1.0,0.0,0,0,0,0,1,0,4088460,2019-02-28 05:00:00,2019-02-28T05:00,2019,2,-1.6,0.0,Cloudy
03/11/2019,12:00,40.846657,-73.89619,BRONX,1.0,0.0,0,0,0,0,1,0,4095395,2019-03-11 12:00:00,2019-03-11T12:00,2019,3,10.1,0.0,Cloudy
08/24/2019,12:00,40.804344,-73.92158,BRONX,0.0,0.0,0,0,0,0,0,0,4194943,2019-08-24 12:00:00,2019-08-24T12:00,2019,8,23.2,0.0,Clear
04/12/2019,21:00,40.877457,-73.9072,BRONX,1.0,0.0,1,0,0,0,0,0,4113800,2019-04-12 21:00:00,2019-04-12T21:00,2019,4,13.9,4.2,Heavy Rain
06/07/2019,14:00,40.895195,-73.88012,BRONX,0.0,0.0,0,0,0,0,0,0,4151029,2019-06-07 14:00:00,2019-06-07T14:00,2019,6,23.5,0.0,Cloudy
10/15/2019,9:00,40.816532,-73.92822,BRONX,1.0,0.0,1,0,0,0,0,0,4223471,2019-10-15 09:00:00,2019-10-15T09:00,2019,10,13.3,0.0,Clear
02/11/2019,11:00,40.808918,-73.92825,BRONX,0.0,0.0,0,0,0,0,0,0,4079144,2019-02-11 11:00:00,2019-02-11T11:00,2019,2,1.2,0.0,Cloudy
06/07/2019,18:00,40.848255,-73.90976,BRONX,1.0,0.0,0,0,0,0,1,0,4147300,2019-06-07 18:00:00,2019-06-07T18:00,2019,6,21.1,0.0,Cloudy
06/16/2019,11:00,40.878742,-73.87255,BRONX,1.0,0.0,1,0,0,0,0,0,4153025,2019-06-16 11:00:00,2019-06-16T11:00,2019,6,24.5,0.0,Cloudy
09/11/2019,5:00,40.820972,-73.89217,BRONX,0.0,0.0,0,0,0,0,0,0,4205430,2019-09-11 05:00:00,2019-09-11T05:00,2019,9,19.1,0.0,Cloudy
04/29/2019,19:00,40.812317,-73.900604,BRONX,0.0,0.0,0,0,0,0,0,0,4123307,2019-04-29 19:00:00,2019-04-29T19:00,2019,4,9.5,0.0,Cloudy
02/12/2019,12:00,40.823902,-73.87451,BRONX,1.0,0.0,0,0,0,0,1,0,4079739,2019-02-12 12:00:00,2019-02-12T12:00,2019,2,-2.1,1.5,Heavy Snow
09/23/2019,0:00,40.8283,-73.88296,BRONX,0.0,0.0,0,0,0,0,0,0,4210762,2019-09-23 00:00:00,2019-09-23T00:00,2019,9,21.9,0.0,Cloudy
10/21/2019,14:00,40.83887,-73.87811,BRONX,1.0,0.0,0,0,0,0,1,0,4228667,2019-10-21 14:00:00,2019-10-21T14:00,2019,10,18.9,0.0,Clear
09/29/2019,0:00,40.877567,-73.82809,BRONX,1.0,0.0,0,0,0,0,1,0,4215554,2019-09-29 00:00:00,2019-09-29T00:00,2019,9,20.6,0.0,Cloudy
05/22/2019,16:00,40.906384,-73.85167,BRONX,0.0,0.0,0,0,0,0,0,0,4138047,2019-05-22 16:00:00,2019-05-22T16:00,2019,5,21.5,0.0,Clear
05/08/2019,16:00,40.854588,-73.90187,BRONX,0.0,0.0,0,0,0,0,0,0,4128136,2019-05-08 16:00:00,2019-05-08T16:00,2019,5,18.9,0.0,Cloudy
12/16/2019,19:00,40.873947,-73.88341,BRONX,0.0,0.0,0,0,0,0,0,0,4260000,2019-12-16 19:00:00,2019-12-16T19:00,2019,12,1.9,0.0,Cloudy
09/19/2019,16:00,40.8995,-73.857,BRONX,1.0,0.0,0,0,0,0,1,0,4209350,2019-09-19 16:00:00,2019-09-19T16:00,2019,9,20.0,0.0,Clear
08/22/2019,10:00,40.816532,-73.92822,BRONX,1.0,0.0,0,0,0,0,1,0,4192918,2019-08-22 10:00:00,2019-08-22T10:00,2019,8,28.5,0.0,Clear
08/02/2019,15:00,40.84698,-73.91065,BRONX,1.0,0.0,0,0,1,0,0,0,4182353,2019-08-02 15:00:00,2019-08-02T15:00,2019,8,28.5,0.0,Clear
01/30/2019,12:00,0.0,0.0,BRONX,0.0,0.0,0,0,0,0,0,0,4072693,2019-01-30 12:00:00,2019-01-30T12:00,2019,1,28.1,0.0,Clear
11/07/2019,0:00,40.853813,-73.90734,BRONX,1.0,0.0,1,0,0,0,0,0,4237613,2019-11-07 00:00:00,2019-11-07T00:00,2019,11,4.9,0.0,Clear
03/15/2019,18:00,40.81925,-73.91785,BRONX,0.0,0.0,0,0,0,0,0,0,4097691,2019-03-15 18:00:00,2019-03-15T18:00,2019,3,13.9,3.2,Heavy Rain
07/19/2019,14:00,40.86786,-73.84123,BRONX,1.0,0.0,0,0,0,0,1,0,4174619,2019-07-19 14:00:00,2019-07-19T14:00,2019,7,30.7,0.0,Clear
04/09/2019,11:00,40.825905,-73.87951,BRONX,1.0,0.0,0,0,0,0,1,0,4111639,2019-04-09 11:00:00,2019-04-09T11:00,2019,4,13.0,0.0,Cloudy
11/29/2019,15:00,40.87831,-73.870155,BRONX,1.0,0.0,1,0,0,0,0,0,4249513,2019-11-29 15:00:00,2019-11-29T15:00,2019,11,4.8,0.0,Cloudy
04/06/2019,14:00,40.895374,-73.86356,BRONX,0.0,0.0,0,0,0,0,0,0,4111517,2019-04-06 14:00:00,2019-04-06T14:00,2019,4,18.9,0.0,Cloudy
07/01/2019,14:00,40.817223,-73.88418,BRONX,0.0,0.0,0,0,0,0,0,0,4162958,2019-07-01 14:00:00,2019-07-01T14:00,2019,7,29.2,0.0,Clear
09/24/2019,17:00,40.826733,-73.861374,BRONX,0.0,0.0,0,0,0,0,0,0,4213089,2019-09-24 17:00:00,2019-09-24T17:00,2019,9,23.1,0.0,Clear
08/25/2019,11:00,40.852863,-73.90093,BRONX,0.0,0.0,0,0,0,0,0,0,4194847,2019-08-25 11:00:00,2019-08-25T11:00,2019,8,22.7,0.0,Clear
11/21/2019,0:00,40.847004,-73.83229,BRONX,1.0,0.0,1,0,0,0,0,0,4245300,2019-11-21 00:00:00,2019-11-21T00:00,2019,11,3.5,0.0,Clear
09/03/2019,0:00,40.844654,-73.889626,BRONX,1.0,0.0,1,0,0,0,0,0,4199428,2019-09-03 00:00:00,2019-09-03T00:00,2019,9,20.2,0.0,Clear
06/21/2019,0:00,40.876583,-73.90266,BRONX,0.0,0.0,0,0,0,0,0,0,4156348,2019-06-21 00:00:00,2019-06-21T00:00,2019,6,21.5,0.1,Drizzle
07/28/2019,16:00,40.882385,-73.90408,BRONX,1.0,0.0,0,0,1,0,0,0,4178474,2019-07-28 16:00:00,2019-07-28T16:00,2019,7,30.1,0.4,Drizzle
07/14/2019,14:00,40.864254,-73.88813,BRONX,2.0,0.0,0,0,0,0,2,0,4169773,2019-07-14 14:00:00,2019-07-14T14:00,2019,7,30.7,0.0,Clear
04/25/2019,8:00,40.82226,-73.911705,BRONX,2.0,0.0,0,0,0,0,2,0,4121004,2019-04-25 08:00:00,2019-04-25T08:00,2019,4,11.2,0.0,Clear
03/07/2019,19:00,40.8816,-73.90484,BRONX,1.0,0.0,0,0,0,0,1,0,4093076,2019-03-07 19:00:00,2019-03-07T19:00,2019,3,-5.0,0.0,Cloudy
01/16/2019,15:00,40.864674,-73.896835,BRONX,1.0,0.0,1,0,0,0,0,0,4060375,2019-01-16 15:00:00,2019-01-16T15:00,2019,1,4.5,0.0,Cloudy
10/03/2019,8:00,40.85232,-73.86301,BRONX,1.0,0.0,1,0,0,0,0,0,4216942,2019-10-03 08:00:00,2019-10-03T08:00,2019,10,12.6,0.9,Drizzle
02/05/2019,8:00,40.833416,-73.90709,BRONX,1.0,0.0,0,0,0,0,1,0,4075141,2019-02-05 08:00:00,2019-02-05T08:00,2019,2,5.3,0.0,Clear
10/08/2019,12:00,40.8617,-73.89139,BRONX,1.0,0.0,0,0,0,0,1,0,4220278,2019-10-08 12:00:00,2019-10-08T12:00,2019,10,17.3,0.0,Cloudy
08/17/2019,8:00,40.80556,-73.914505,BRONX,2.0,0.0,0,0,0,0,2,0,4189987,2019-08-17 08:00:00,2019-08-17T08:00,2019,8,23.5,0.1,Drizzle
03/04/2019,14:00,40.84434,-73.91475,BRONX,1.0,0.0,1,0,0,0,0,0,4091012,2019-03-04 14:00:00,2019-03-04T14:00,2019,3,2.9,0.0,Clear
11/09/2019,16:00,40.859184,-73.88663,BRONX,0.0,0.0,0,0,0,0,0,0,4238246,2019-11-09 16:00:00,2019-11-09T16:00,2019,11,3.8,0.0,Clear
09/17/2019,18:00,40.81536,-73.915955,BRONX,1.0,0.0,0,0,0,0,1,0,4207699,2019-09-17 18:00:00,2019-09-17T18:00,2019,9,19.8,0.0,Clear
04/13/2019,18:00,40.823902,-73.87451,BRONX,3.0,0.0,0,0,0,0,3,0,4114121,2019-04-13 18:00:00,2019-04-13T18:00,2019,4,16.3,0.0,Cloudy
11/01/2019,15:00,40.834187,-73.909584,BRONX,1.0,0.0,1,0,0,0,0,0,4233963,2019-11-01 15:00:00,2019-11-01T15:00,2019,11,11.9,0.0,Clear
10/12/2019,0:00,40.875935,-73.86191,BRONX,1.0,0.0,0,0,1,0,0,0,4222884,2019-10-12 00:00:00,2019-10-12T00:00,2019,10,13.1,0.0,Clear
11/26/2019,18:00,40.874702,-73.85803,BRONX,2.0,0.0,0,0,0,0,2,0,4255608,2019-11-26 18:00:00,2019-11-26T18:00,2019,11,7.8,0.0,Cloudy
06/11/2019,18:00,40.861073,-73.90768,BRONX,2.0,0.0,2,0,0,0,0,0,4155077,2019-06-11 18:00:00,2019-06-11T18:00,2019,6,20.7,0.0,Clear
07/08/2019,7:00,40.83354,-73.89631,BRONX,1.0,0.0,0,0,0,0,1,0,4167420,2019-07-08 07:00:00,2019-07-08T07:00,2019,7,21.3,0.4,Drizzle
02/27/2019,17:00,40.856323,-73.87244,BRONX,1.0,0.0,0,0,0,0,1,0,4088110,2019-02-27 17:00:00,2019-02-27T17:00,2019,2,-2.8,0.0,Cloudy
10/23/2019,0:00,40.861347,-73.897736,BRONX,1.0,0.0,1,0,0,0,0,0,4228449,2019-10-23 00:00:00,2019-10-23T00:00,2019,10,17.1,2.3,Light Rain
04/16/2019,19:00,40.89466,-73.86137,BRONX,1.0,0.0,0,0,0,0,1,0,4116213,2019-04-16 19:00:00,2019-04-16T19:00,2019,4,12.9,0.0,Cloudy
06/02/2019,20:00,40.812664,-73.906334,BRONX,1.0,0.0,1,0,0,0,0,0,4145923,2019-06-02 20:00:00,2019-06-02T20:00,2019,6,21.0,0.0,Clear
03/11/2019,9:00,40.879055,-73.851875,BRONX,2.0,0.0,0,0,0,0,2,0,4096598,2019-03-11 09:00:00,2019-03-11T09:00,2019,3,6.4,0.0,Clear
04/12/2019,23:00,40.836754,-73.875084,BRONX,2.0,0.0,0,0,0,0,2,0,4114110,2019-04-12 23:00:00,2019-04-12T23:00,2019,4,15.1,1.5,Light Rain
09/18/2019,13:00,40.825565,-73.84878,BRONX,0.0,0.0,0,0,0,0,0,0,4208880,2019-09-18 13:00:00,2019-09-18T13:00,2019,9,19.6,0.0,Cloudy
08/08/2019,10:00,40.859642,-73.90534,BRONX,0.0,0.0,0,0,0,0,0,0,4185545,2019-08-08 10:00:00,2019-08-08T10:00,2019,8,25.7,0.0,Cloudy
06/23/2019,21:00,40.8217,-73.870804,BRONX,3.0,0.0,0,0,0,0,3,0,4157648,2019-06-23 21:00:00,2019-06-23T21:00,2019,6,21.5,0.0,Clear
09/27/2019,13:00,40.835884,-73.88341,BRONX,1.0,0.0,0,0,1,0,0,0,4214217,2019-09-27 13:00:00,2019-09-27T13:00,2019,9,22.0,0.0,Clear
03/25/2019,0:00,40.82463,-73.91059,BRONX,6.0,0.0,0,0,0,0,6,0,4103223,2019-03-25 00:00:00,2019-03-25T00:00,2019,3,7.9,0.0,Cloudy
09/26/2019,16:00,40.862732,-73.90333,BRONX,3.0,0.0,2,0,0,0,1,0,4213364,2019-09-26 16:00:00,2019-09-26T16:00,2019,9,22.0,3.0,Heavy Rain
11/22/2019,11:00,40.877033,-73.846375,BRONX,1.0,0.0,1,0,0,0,0,0,4250480,2019-11-22 11:00:00,2019-11-22T11:00,2019,11,10.8,0.0,Cloudy
11/15/2019,0:00,40.892128,-73.84719,BRONX,1.0,0.0,0,0,0,0,1,0,4242893,2019-11-15 00:00:00,2019-11-15T00:00,2019,11,1.2,0.0,Cloudy
12/16/2019,20:00,40.820877,-73.8667,BRONX,2.0,0.0,0,0,2,0,0,0,4260293,2019-12-16 20:00:00,2019-12-16T20:00,2019,12,1.6,0.1,Light Snow
09/06/2019,18:00,40.853973,-73.830315,BRONX,2.0,0.0,0,0,0,0,2,0,4202221,2019-09-06 18:00:00,2019-09-06T18:00,2019,9,19.3,0.0,Cloudy
07/01/2019,13:00,40.879997,-73.84834,BRONX,1.0,0.0,0,0,0,0,1,0,4172576,2019-07-01 13:00:00,2019-07-01T13:00,2019,7,28.3,0.0,Clear
11/03/2019,17:00,40.810726,-73.92465,BRONX,1.0,0.0,0,0,0,0,1,0,4234303,2019-11-03 17:00:00,2019-11-03T17:00,2019,11,9.4,0.0,Cloudy
12/20/2019,15:00,40.82429,-73.83896,BRONX,1.0,0.0,0,0,0,0,1,0,4263250,2019-12-20 15:00:00,2019-12-20T15:00,2019,12,1.6,0.0,Clear
06/12/2019,18:00,40.885014,-73.830215,BRONX,1.0,0.0,0,0,0,0,1,0,4150682,2019-06-12 18:00:00,2019-06-12T18:00,2019,6,18.6,0.0,Cloudy
10/10/2019,20:00,40.87167,-73.8486,BRONX,0.0,0.0,0,0,0,0,0,0,4222872,2019-10-10 20:00:00,2019-10-10T20:00,2019,10,16.7,0.0,Cloudy
06/04/2019,7:00,40.83933,-73.89904,BRONX,0.0,0.0,0,0,0,0,0,0,4145170,2019-06-04 07:00:00,2019-06-04T07:00,2019,6,14.4,0.0,Clear
12/22/2019,10:00,40.855396,-73.88576,BRONX,0.0,0.0,0,0,0,0,0,0,4264578,2019-12-22 10:00:00,2019-12-22T10:00,2019,12,1.5,0.0,Cloudy
08/13/2019,12:00,40.81676,-73.917465,BRONX,1.0,0.0,0,0,1,0,0,0,4188322,2019-08-13 12:00:00,2019-08-13T12:00,2019,8,24.0,1.0,Drizzle
09/27/2019,0:00,40.826424,-73.82195,BRONX,1.0,0.0,0,0,0,0,1,0,4213442,2019-09-27 00:00:00,2019-09-27T00:00,2019,9,16.1,0.0,Clear
12/14/2019,0:00,40.89608,-73.86692,BRONX,1.0,0.0,0,0,0,0,1,0,4258842,2019-12-14 00:00:00,2019-12-14T00:00,2019,12,9.1,3.8,Heavy Rain
08/16/2019,13:00,40.898632,-73.8548,BRONX,2.0,0.0,0,0,0,0,2,0,4190729,2019-08-16 13:00:00,2019-08-16T13:00,2019,8,25.6,0.0,Cloudy
03/31/2019,4:00,40.85554,-73.91413,BRONX,0.0,0.0,0,0,0,0,0,0,4106004,2019-03-31 04:00:00,2019-03-31T04:00,2019,3,9.8,0.0,Clear
07/19/2019,13:00,40.826855,-73.922676,BRONX,1.0,0.0,0,0,1,0,0,0,4173454,2019-07-19 13:00:00,2019-07-19T13:00,2019,7,31.3,0.0,Cloudy
05/17/2019,10:00,40.871254,-73.84355,BRONX,2.0,0.0,0,0,0,0,2,0,4135964,2019-05-17 10:00:00,2019-05-17T10:00,2019,5,22.1,0.0,Cloudy
10/16/2019,17:00,40.847755,-73.832375,BRONX,0.0,0.0,0,0,0,0,0,0,4228374,2019-10-16 17:00:00,2019-10-16T17:00,2019,10,16.2,3.9,Heavy Rain
07/24/2019,16:00,40.83554,-73.818054,BRONX,1.0,0.0,0,0,0,0,1,0,4176478,2019-07-24 16:00:00,2019-07-24T16:00,2019,7,25.8,0.1,Drizzle
08/25/2019,21:00,40.876022,-73.862144,BRONX,3.0,0.0,0,0,0,0,3,0,4194633,2019-08-25 21:00:00,2019-08-25T21:00,2019,8,19.2,0.0,Clear
09/01/2019,14:00,40.873474,-73.84914,BRONX,1.0,0.0,0,0,0,0,1,0,4202175,2019-09-01 14:00:00,2019-09-01T14:00,2019,9,24.8,0.0,Cloudy
10/27/2019,4:00,40.865635,-73.86735,BRONX,0.0,0.0,0,0,0,0,0,0,4239663,2019-10-27 04:00:00,2019-10-27T04:00,2019,10,13.0,0.0,Cloudy
05/23/2019,18:00,40.89339,-73.857376,BRONX,1.0,0.0,0,0,0,0,1,0,4138030,2019-05-23 18:00:00,2019-05-23T18:00,2019,5,21.3,0.0,Cloudy
01/10/2019,20:00,40.874653,-73.86269,BRONX,1.0,0.0,1,0,0,0,0,0,4057055,2019-01-10 20:00:00,2019-01-10T20:00,2019,1,-1.5,0.0,Cloudy
09/26/2019,15:00,40.869656,-73.898926,BRONX,1.0,0.0,1,0,0,0,0,0,4213074,2019-09-26 15:00:00,2019-09-26T15:00,2019,9,23.5,2.7,Heavy Rain
10/22/2019,7:00,40.83917,-73.83629,BRONX,1.0,0.0,0,0,1,0,0,0,4228356,2019-10-22 07:00:00,2019-10-22T07:00,2019,10,12.6,0.0,Cloudy
05/11/2019,22:00,40.873394,-73.90671,BRONX,1.0,0.0,0,0,0,0,1,0,4130184,2019-05-11 22:00:00,2019-05-11T22:00,2019,5,14.8,0.0,Cloudy
01/07/2019,0:00,40.8057,-73.92475,BRONX,1.0,0.0,0,0,0,0,1,0,4063026,2019-01-07 00:00:00,2019-01-07T00:00,2019,1,-1.7,0.0,Clear
09/18/2019,20:00,40.84413,-73.89445,BRONX,3.0,0.0,3,0,0,0,0,0,4208668,2019-09-18 20:00:00,2019-09-18T20:00,2019,9,15.2,0.0,Clear
09/24/2019,11:00,40.889755,-73.850914,BRONX,0.0,0.0,0,0,0,0,0,0,4215097,2019-09-24 11:00:00,2019-09-24T11:00,2019,9,22.6,0.0,Cloudy
05/30/2019,0:00,40.84286,-73.893486,BRONX,0.0,0.0,0,0,0,0,0,0,4143374,2019-05-30 00:00:00,2019-05-30T00:00,2019,5,13.0,0.0,Cloudy
10/17/2019,13:00,40.861343,-73.90991,BRONX,0.0,0.0,0,0,0,0,0,0,4224743,2019-10-17 13:00:00,2019-10-17T13:00,2019,10,13.3,0.0,Cloudy
03/03/2019,18:00,40.808407,-73.908844,BRONX,1.0,0.0,0,0,0,0,1,0,4090466,2019-03-03 18:00:00,2019-03-03T18:00,2019,3,1.5,0.7,Heavy Snow
05/22/2019,16:00,40.825333,-73.84485,BRONX,0.0,0.0,0,0,0,0,0,0,4137379,2019-05-22 16:00:00,2019-05-22T16:00,2019,5,22.2,0.0,Cloudy
05/21/2019,10:00,40.880466,-73.88384,BRONX,1.0,0.0,0,0,0,0,1,0,4136104,2019-05-21 10:00:00,2019-05-21T10:00,2019,5,15.9,0.0,Clear
03/21/2019,21:00,40.839245,-73.8701,BRONX,1.0,0.0,1,0,0,0,0,0,4101027,2019-03-21 21:00:00,2019-03-21T21:00,2019,3,5.3,0.3,Drizzle
11/08/2019,22:00,40.816532,-73.92822,BRONX,1.0,0.0,0,0,0,0,1,0,4238549,2019-11-08 22:00:00,2019-11-08T22:00,2019,11,-0.9,0.0,Clear
12/14/2019,18:00,40.826622,-73.88811,BRONX,1.0,0.0,1,0,0,0,0,0,4257972,2019-12-14 18:00:00,2019-12-14T18:00,2019,12,10.7,0.0,Cloudy
10/11/2019,0:00,40.831287,-73.88173,BRONX,0.0,0.0,0,0,0,0,0,0,4222638,2019-10-11 00:00:00,2019-10-11T00:00,2019,10,14.4,0.0,Cloudy
04/25/2019,18:00,40.832397,-73.85115,BRONX,1.0,0.0,0,0,0,0,1,0,4121816,2019-04-25 18:00:00,2019-04-25T18:00,2019,4,10.8,0.7,Drizzle
03/29/2019,0:00,40.881504,-73.879364,BRONX,1.0,0.0,0,0,0,0,1,0,4105555,2019-03-29 00:00:00,2019-03-29T00:00,2019,3,5.2,0.0,Cloudy
07/14/2019,21:00,40.843193,-73.890045,BRONX,1.0,0.0,0,0,0,0,1,0,4170738,2019-07-14 21:00:00,2019-07-14T21:00,2019,7,25.1,0.0,Cloudy
05/22/2019,16:00,40.81291,-73.90424,BRONX,0.0,0.0,0,0,0,0,0,0,4138692,2019-05-22 16:00:00,2019-05-22T16:00,2019,5,22.1,0.0,Cloudy
05/10/2019,7:00,40.833195,-73.895134,BRONX,2.0,0.0,0,0,0,0,2,0,4129742,2019-05-10 07:00:00,2019-05-10T07:00,2019,5,15.0,0.0,Cloudy
08/10/2019,11:00,40.87538,-73.883446,BRONX,1.0,0.0,0,0,0,0,1,0,4187253,2019-08-10 11:00:00,2019-08-10T11:00,2019,8,25.9,0.0,Clear
07/18/2019,13:00,40.82751,-73.92495,BRONX,0.0,0.0,0,0,0,0,0,0,4172994,2019-07-18 13:00:00,2019-07-18T13:00,2019,7,26.3,0.0,Cloudy
10/17/2019,14:00,40.844368,-73.88902,BRONX,1.0,0.0,0,0,0,0,1,0,4225160,2019-10-17 14:00:00,2019-10-17T14:00,2019,10,12.9,0.0,Cloudy
07/31/2019,20:00,40.846687,-73.905594,BRONX,0.0,0.0,0,0,0,0,0,0,4180696,2019-07-31 20:00:00,2019-07-31T20:00,2019,7,23.0,0.0,Cloudy
04/24/2019,0:00,40.852562,-73.883286,BRONX,0.0,0.0,0,0,0,0,0,0,4120845,2019-04-24 00:00:00,2019-04-24T00:00,2019,4,16.5,0.0,Cloudy
06/23/2019,9:00,40.82986,-73.90638,BRONX,2.0,0.0,0,0,0,0,2,0,4157219,2019-06-23 09:00:00,2019-06-23T09:00,2019,6,23.2,0.0,Clear
05/20/2019,21:00,40.841442,-73.851425,BRONX,0.0,0.0,0,0,0,0,0,0,4136074,2019-05-20 21:00:00,2019-05-20T21:00,2019,5,20.8,0.0,Clear
08/25/2019,14:00,40.87595,-73.86189,BRONX,0.0,0.0,0,0,0,0,0,0,4209433,2019-08-25 14:00:00,2019-08-25T14:00,2019,8,23.3,0.0,Clear
04/26/2019,16:00,40.804226,-73.91713,BRONX,0.0,0.0,0,0,0,0,0,0,4121190,2019-04-26 16:00:00,2019-04-26T16:00,2019,4,15.8,1.7,Light Rain
04/24/2019,21:00,40.838554,-73.864655,BRONX,0.0,0.0,0,0,0,0,0,0,4120455,2019-04-24 21:00:00,2019-04-24T21:00,2019,4,11.7,0.0,Clear
07/10/2019,20:00,40.85437,-73.88437,BRONX,0.0,0.0,0,0,0,0,0,0,4168754,2019-07-10 20:00:00,2019-07-10T20:00,2019,7,25.7,0.0,Clear
01/15/2019,9:00,40.828125,-73.84105,BRONX,1.0,0.0,0,0,0,0,1,0,4058190,2019-01-15 09:00:00,2019-01-15T09:00,2019,1,-2.9,0.0,Cloudy
09/30/2019,0:00,40.884575,-73.89889,BRONX,1.0,0.0,1,0,0,0,0,0,4215827,2019-09-30 00:00:00,2019-09-30T00:00,2019,9,16.5,0.0,Cloudy
12/05/2019,16:00,40.884342,-73.886765,BRONX,2.0,0.0,0,0,0,0,2,0,4252697,2019-12-05 16:00:00,2019-12-05T16:00,2019,12,3.5,0.0,Cloudy
07/21/2019,0:00,40.810253,-73.91434,BRONX,1.0,0.0,0,0,1,0,0,0,4174614,2019-07-21 00:00:00,2019-07-21T00:00,2019,7,27.1,0.0,Clear
03/07/2019,8:00,40.87395,-73.85278,BRONX,1.0,0.0,1,0,0,0,0,0,4092732,2019-03-07 08:00:00,2019-03-07T08:00,2019,3,-6.4,0.0,Clear
04/12/2019,20:00,40.814266,-73.912964,BRONX,1.0,0.0,1,0,0,0,0,0,4115402,2019-04-12 20:00:00,2019-04-12T20:00,2019,4,13.7,3.5,Heavy Rain
12/19/2019,22:00,40.879055,-73.87439,BRONX,1.0,0.0,0,0,0,0,1,0,4261376,2019-12-19 22:00:00,2019-12-19T22:00,2019,12,-6.2,0.0,Clear
10/27/2019,11:00,40.83354,-73.89631,BRONX,1.0,0.0,1,0,0,0,0,0,4230362,2019-10-27 11:00:00,2019-10-27T11:00,2019,10,16.8,6.9,Heavy Rain
06/06/2019,16:00,40.89608,-73.86692,BRONX,2.0,0.0,0,0,0,0,2,0,4146820,2019-06-06 16:00:00,2019-06-06T16:00,2019,6,26.2,0.0,Clear
12/13/2019,3:00,40.857605,-73.89124,BRONX,0.0,0.0,0,0,0,0,0,0,4257239,2019-12-13 03:00:00,2019-12-13T03:00,2019,12,0.3,0.0,Cloudy
03/21/2019,18:00,40.842625,-73.87818,BRONX,0.0,0.0,0,0,0,0,0,0,4101986,2019-03-21 18:00:00,2019-03-21T18:00,2019,3,6.4,0.8,Drizzle
11/04/2019,9:00,40.893665,-73.85827,BRONX,1.0,0.0,0,0,0,0,1,0,4235157,2019-11-04 09:00:00,2019-11-04T09:00,2019,11,8.3,0.0,Clear
06/23/2019,10:00,40.82507,-73.91438,BRONX,0.0,0.0,0,0,0,0,0,0,4157237,2019-06-23 10:00:00,2019-06-23T10:00,2019,6,24.9,0.0,Clear
05/16/2019,18:00,40.862755,-73.901085,BRONX,1.0,0.0,1,0,0,0,0,0,4133435,2019-05-16 18:00:00,2019-05-16T18:00,2019,5,18.2,0.0,Clear
11/06/2019,13:00,40.807556,-73.919235,BRONX,1.0,0.0,1,0,0,0,0,0,4236547,2019-11-06 13:00:00,2019-11-06T13:00,2019,11,11.2,0.0,Clear
01/03/2019,16:00,40.88482,-73.90273,BRONX,0.0,0.0,0,0,0,0,0,0,4061621,2019-01-03 16:00:00,2019-01-03T16:00,2019,1,4.8,0.0,Clear
04/13/2019,16:00,40.8566,-73.82646,BRONX,2.0,0.0,0,0,0,0,2,0,4118680,2019-04-13 16:00:00,2019-04-13T16:00,2019,4,21.4,0.0,Cloudy
08/09/2019,13:00,40.88452,-73.87762,BRONX,0.0,0.0,0,0,0,0,0,0,4186081,2019-08-09 13:00:00,2019-08-09T13:00,2019,8,27.5,0.0,Clear
07/18/2019,0:00,40.866383,-73.88515,BRONX,1.0,0.0,0,0,0,0,1,0,4172913,2019-07-18 00:00:00,2019-07-18T00:00,2019,7,23.6,1.3,Light Rain
08/21/2019,0:00,40.882374,-73.88642,BRONX,0.0,0.0,0,0,0,0,0,0,4192393,2019-08-21 00:00:00,2019-08-21T00:00,2019,8,23.0,0.0,Clear
11/18/2019,8:00,40.82727,-73.86932,BRONX,1.0,0.0,0,0,0,0,1,0,4253252,2019-11-18 08:00:00,2019-11-18T08:00,2019,11,3.3,0.1,Drizzle
02/28/2019,11:00,40.845413,-73.865204,BRONX,1.0,0.0,0,0,0,0,1,0,4089796,2019-02-28 11:00:00,2019-02-28T11:00,2019,2,0.9,0.0,Clear
02/26/2019,15:00,40.83115,-73.82236,BRONX,1.0,0.0,1,0,0,0,0,0,4087519,2019-02-26 15:00:00,2019-02-26T15:00,2019,2,2.6,0.0,Clear
11/16/2019,17:00,40.8283,-73.88296,BRONX,0.0,1.0,0,1,0,0,0,0,4242570,2019-11-16 17:00:00,2019-11-16T17:00,2019,11,1.7,0.0,Clear
07/14/2019,17:00,40.888203,-73.861755,BRONX,0.0,0.0,0,0,0,0,0,0,4170399,2019-07-14 17:00:00,2019-07-14T17:00,2019,7,29.7,0.0,Cloudy
05/20/2019,9:00,40.838158,-73.88514,BRONX,0.0,0.0,0,0,0,0,0,0,4135706,2019-05-20 09:00:00,2019-05-20T09:00,2019,5,24.8,0.0,Cloudy
01/17/2019,22:00,40.88754,-73.86501,BRONX,0.0,0.0,0,0,0,0,0,0,4057040,2019-01-17 22:00:00,2019-01-17T22:00,2019,1,-2.2,0.1,Light Snow
03/01/2019,6:00,40.837124,-73.882645,BRONX,0.0,0.0,0,0,0,0,0,0,4089167,2019-03-01 06:00:00,2019-03-01T06:00,2019,3,-2.9,0.7,Heavy Snow
12/25/2019,15:00,40.881687,-73.90283,BRONX,1.0,0.0,0,0,0,0,1,0,4264654,2019-12-25 15:00:00,2019-12-25T15:00,2019,12,6.1,0.0,Cloudy
04/08/2019,0:00,40.87262,-73.904686,BRONX,4.0,0.0,0,0,0,0,4,0,4111941,2019-04-08 00:00:00,2019-04-08T00:00,2019,4,10.9,0.3,Drizzle
11/08/2019,18:00,40.860264,-73.90164,BRONX,1.0,0.0,0,0,1,0,0,0,4237933,2019-11-08 18:00:00,2019-11-08T18:00,2019,11,1.3,0.0,Clear
09/27/2019,0:00,40.81888,-73.916504,BRONX,1.0,0.0,0,0,0,0,1,0,4214021,2019-09-27 00:00:00,2019-09-27T00:00,2019,9,15.6,0.0,Clear
08/28/2019,0:00,40.816513,-73.86656,BRONX,1.0,0.0,1,0,0,0,0,0,4197204,2019-08-28 00:00:00,2019-08-28T00:00,2019,8,18.5,0.0,Cloudy
09/05/2019,18:00,40.820988,-73.89491,BRONX,1.0,0.0,0,0,0,0,1,0,4200972,2019-09-05 18:00:00,2019-09-05T18:00,2019,9,20.9,0.0,Cloudy
01/05/2019,9:00,40.86201,-73.903885,BRONX,0.0,0.0,0,0,0,0,0,0,4061989,2019-01-05 09:00:00,2019-01-05T09:00,2019,1,5.8,2.3,Light Rain
07/16/2019,19:00,40.90104,-73.89689,BRONX,0.0,0.0,0,0,0,0,0,0,4171789,2019-07-16 19:00:00,2019-07-16T19:00,2019,7,27.2,0.0,Cloudy
10/24/2019,0:00,40.839798,-73.873604,BRONX,1.0,0.0,1,0,0,0,0,0,4229100,2019-10-24 00:00:00,2019-10-24T00:00,2019,10,9.8,0.0,Clear
03/29/2019,19:00,40.885098,-73.90066,BRONX,1.0,0.0,0,0,1,0,0,0,4107889,2019-03-29 19:00:00,2019-03-29T19:00,2019,3,11.2,0.0,Cloudy
09/25/2019,21:00,40.819878,-73.85777,BRONX,1.0,0.0,0,0,0,0,1,0,4213116,2019-09-25 21:00:00,2019-09-25T21:00,2019,9,17.9,0.0,Clear
01/25/2019,10:00,40.846863,-73.90142,BRONX,1.0,0.0,0,0,0,0,1,0,4070905,2019-01-25 10:00:00,2019-01-25T10:00,2019,1,1.9,0.0,Cloudy
08/30/2019,15:00,40.893593,-73.8468,BRONX,0.0,0.0,0,0,0,0,0,0,4202126,2019-08-30 15:00:00,2019-08-30T15:00,2019,8,30.1,0.0,Cloudy
01/17/2019,19:00,40.84237,-73.86676,BRONX,0.0,0.0,0,0,0,0,0,0,4058155,2019-01-17 19:00:00,2019-01-17T19:00,2019,1,-2.7,0.0,Cloudy
06/26/2019,22:00,40.842075,-73.834724,BRONX,1.0,0.0,0,0,1,0,0,0,4159546,2019-06-26 22:00:00,2019-06-26T22:00,2019,6,22.6,0.0,Clear
08/09/2019,0:00,40.847324,-73.90375,BRONX,0.0,0.0,0,0,0,0,0,0,4185789,2019-08-09 00:00:00,2019-08-09T00:00,2019,8,21.5,0.0,Clear
06/01/2019,1:00,40.84637,-73.78619,BRONX,2.0,0.0,0,0,0,0,2,0,4143722,2019-06-01 01:00:00,2019-06-01T01:00,2019,6,16.3,0.0,Clear
04/15/2019,9:00,40.83632,-73.92748,BRONX,0.0,0.0,0,0,0,0,0,0,4115184,2019-04-15 09:00:00,2019-04-15T09:00,2019,4,18.8,0.1,Drizzle
09/11/2019,12:00,40.83877,-73.87791,BRONX,1.0,0.0,1,0,0,0,0,0,4206921,2019-09-11 12:00:00,2019-09-11T12:00,2019,9,29.8,0.0,Cloudy
03/25/2019,4:00,40.846577,-73.913155,BRONX,1.0,0.0,0,0,0,0,1,0,4102647,2019-03-25 04:00:00,2019-03-25T04:00,2019,3,7.2,0.0,Cloudy
07/09/2019,15:00,40.82141,-73.88463,BRONX,1.0,0.0,0,0,0,0,1,0,4170741,2019-07-09 15:00:00,2019-07-09T15:00,2019,7,31.5,0.0,Cloudy
05/06/2019,16:00,40.86927,-73.82881,BRONX,0.0,0.0,0,0,0,0,0,0,4127024,2019-05-06 16:00:00,2019-05-06T16:00,2019,5,19.0,0.0,Cloudy
08/29/2019,7:00,40.87883,-73.837395,BRONX,1.0,0.0,1,0,0,0,0,0,4202255,2019-08-29 07:00:00,2019-08-29T07:00,2019,8,19.3,0.0,Clear
07/22/2019,13:00,40.816917,-73.90952,BRONX,1.0,0.0,1,0,0,0,0,0,4175207,2019-07-22 13:00:00,2019-07-22T13:00,2019,7,30.0,0.1,Drizzle
09/12/2019,0:00,40.858673,-73.899216,BRONX,3.0,0.0,0,0,0,0,3,0,4204974,2019-09-12 00:00:00,2019-09-12T00:00,2019,9,23.1,0.0,Clear
08/20/2019,18:00,40.863125,-73.863106,BRONX,1.0,0.0,0,0,0,0,1,0,4192722,2019-08-20 18:00:00,2019-08-20T18:00,2019,8,26.4,0.0,Cloudy
06/17/2019,10:00,40.857365,-73.84657,BRONX,1.0,0.0,0,0,0,0,1,0,4154150,2019-06-17 10:00:00,2019-06-17T10:00,2019,6,22.0,0.0,Cloudy
07/19/2019,18:00,40.819977,-73.86467,BRONX,1.0,0.0,0,0,0,0,1,0,4173446,2019-07-19 18:00:00,2019-07-19T18:00,2019,7,32.2,0.0,Cloudy
09/17/2019,10:00,40.864674,-73.896835,BRONX,0.0,0.0,0,0,0,0,0,0,4208280,2019-09-17 10:00:00,2019-09-17T10:00,2019,9,20.9,0.0,Clear
08/26/2019,13:00,40.85814,-73.895744,BRONX,1.0,0.0,0,0,0,0,1,0,4195616,2019-08-26 13:00:00,2019-08-26T13:00,2019,8,21.9,0.0,Clear
01/15/2019,15:00,40.849003,-73.90905,BRONX,2.0,0.0,0,0,0,0,2,0,4067710,2019-01-15 15:00:00,2019-01-15T15:00,2019,1,3.3,0.0,Cloudy
10/29/2019,10:00,40.85681,-73.89818,BRONX,0.0,0.0,0,0,0,0,0,0,4232034,2019-10-29 10:00:00,2019-10-29T10:00,2019,10,14.5,0.1,Drizzle
04/18/2019,15:00,40.833855,-73.82464,BRONX,0.0,0.0,0,0,0,0,0,0,4117254,2019-04-18 15:00:00,2019-04-18T15:00,2019,4,16.5,0.0,Cloudy
10/03/2019,13:00,40.88845,-73.841965,BRONX,1.0,0.0,0,0,0,0,1,0,4219068,2019-10-03 13:00:00,2019-10-03T13:00,2019,10,14.2,0.6,Drizzle
03/21/2019,13:00,40.81702,-73.91935,BRONX,1.0,0.0,1,0,0,0,0,0,4100943,2019-03-21 13:00:00,2019-03-21T13:00,2019,3,8.1,0.6,Drizzle
12/18/2019,0:00,40.89285,-73.85567,BRONX,1.0,0.0,0,0,0,0,1,0,4261111,2019-12-18 00:00:00,2019-12-18T00:00,2019,12,-0.3,0.0,Cloudy
10/22/2019,7:00,40.832623,-73.92537,BRONX,0.0,0.0,0,0,0,0,0,0,4229084,2019-10-22 07:00:00,2019-10-22T07:00,2019,10,12.5,0.0,Cloudy
05/21/2019,15:00,40.861107,-73.89028,BRONX,1.0,0.0,0,0,1,0,0,0,4137884,2019-05-21 15:00:00,2019-05-21T15:00,2019,5,19.7,0.0,Clear
04/26/2019,15:00,40.882664,-73.85995,BRONX,1.0,0.0,1,0,0,0,0,0,4123051,2019-04-26 15:00:00,2019-04-26T15:00,2019,4,15.6,1.0,Drizzle
08/17/2019,3:00,40.838997,-73.91073,BRONX,0.0,0.0,0,0,0,0,0,0,4189952,2019-08-17 03:00:00,2019-08-17T03:00,2019,8,21.8,0.0,Cloudy
05/26/2019,13:00,40.85401,-73.87187,BRONX,1.0,0.0,1,0,0,0,0,0,4140949,2019-05-26 13:00:00,2019-05-26T13:00,2019,5,28.9,0.0,Cloudy
07/22/2019,21:00,40.88944,-73.85781,BRONX,2.0,0.0,0,0,0,0,2,0,4175547,2019-07-22 21:00:00,2019-07-22T21:00,2019,7,22.7,0.5,Drizzle
07/30/2019,0:00,40.8411,-73.78496,BRONX,1.0,0.0,0,0,0,0,1,0,4180045,2019-07-30 00:00:00,2019-07-30T00:00,2019,7,25.0,0.0,Clear
05/10/2019,0:00,40.880196,-73.907265,BRONX,1.0,0.0,0,0,0,0,1,0,4129193,2019-05-10 00:00:00,2019-05-10T00:00,2019,5,12.1,0.0,Cloudy
09/17/2019,9:00,40.853462,-73.88939,BRONX,1.0,0.0,1,0,0,0,0,0,4207268,2019-09-17 09:00:00,2019-09-17T09:00,2019,9,19.7,0.0,Clear
02/28/2019,18:00,40.836178,-73.884254,BRONX,0.0,0.0,0,0,0,0,0,0,4088670,2019-02-28 18:00:00,2019-02-28T18:00,2019,2,-1.7,0.0,Clear
08/02/2019,18:00,40.83144,-73.872055,BRONX,1.0,0.0,0,0,0,0,1,0,4183771,2019-08-02 18:00:00,2019-08-02T18:00,2019,8,26.1,0.0,Cloudy
04/09/2019,16:00,40.818012,-73.92519,BRONX,1.0,0.0,0,0,0,0,1,0,4111776,2019-04-09 16:00:00,2019-04-09T16:00,2019,4,9.7,0.0,Cloudy
05/29/2019,17:00,40.840347,-73.84241,BRONX,0.0,0.0,0,0,0,0,0,0,4141524,2019-05-29 17:00:00,2019-05-29T17:00,2019,5,16.1,0.7,Drizzle
03/20/2019,9:00,40.83787,-73.9197,BRONX,1.0,0.0,0,0,0,0,1,0,4105092,2019-03-20 09:00:00,2019-03-20T09:00,2019,3,4.8,0.0,Clear
05/31/2019,16:00,40.817307,-73.88838,BRONX,0.0,0.0,0,0,0,0,0,0,4144034,2019-05-31 16:00:00,2019-05-31T16:00,2019,5,24.9,0.0,Cloudy
08/10/2019,19:00,40.837242,-73.88736,BRONX,0.0,0.0,0,0,0,0,0,0,4187201,2019-08-10 19:00:00,2019-08-10T19:00,2019,8,23.2,0.0,Clear
02/27/2019,0:00,40.856323,-73.87244,BRONX,1.0,0.0,0,0,0,0,1,0,4195874,2019-02-27 00:00:00,2019-02-27T00:00,2019,2,-4.2,0.0,Cloudy
04/20/2019,14:00,40.845642,-73.90211,BRONX,1.0,0.0,0,0,0,0,1,0,4118848,2019-04-20 14:00:00,2019-04-20T14:00,2019,4,16.3,0.0,Cloudy
01/10/2019,4:00,40.832203,-73.86519,BRONX,1.0,0.0,0,0,0,0,1,0,4064611,2019-01-10 04:00:00,2019-01-10T04:00,2019,1,-0.2,0.0,Cloudy
05/22/2019,15:00,40.821274,-73.91743,BRONX,1.0,0.0,1,0,0,0,0,0,4137172,2019-05-22 15:00:00,2019-05-22T15:00,2019,5,22.1,0.0,Cloudy
01/18/2019,20:00,40.884647,-73.82662,BRONX,1.0,0.0,0,0,0,0,1,0,4058302,2019-01-18 20:00:00,2019-01-18T20:00,2019,1,-0.6,0.0,Cloudy
06/03/2019,15:00,40.84459,-73.88278,BRONX,1.0,0.0,1,0,0,0,0,0,4144917,2019-06-03 15:00:00,2019-06-03T15:00,2019,6,20.5,0.0,Clear
12/18/2019,15:00,40.81427,-73.91535,BRONX,4.0,0.0,0,0,0,0,4,0,4260655,2019-12-18 15:00:00,2019-12-18T15:00,2019,12,2.7,0.0,Clear
11/07/2019,10:00,40.80452,-73.90648,BRONX,0.0,0.0,0,0,0,0,0,0,4237539,2019-11-07 10:00:00,2019-11-07T10:00,2019,11,11.4,0.0,Cloudy
04/10/2019,20:00,40.83451,-73.88526,BRONX,4.0,0.0,0,0,0,0,4,0,4112478,2019-04-10 20:00:00,2019-04-10T20:00,2019,4,7.5,0.0,Cloudy
01/23/2019,10:00,40.817513,-73.91712,BRONX,2.0,0.0,0,0,0,0,2,0,4059598,2019-01-23 10:00:00,2019-01-23T10:00,2019,1,1.5,0.0,Cloudy
06/23/2019,22:00,40.841087,-73.86447,BRONX,2.0,0.0,0,0,0,0,2,0,4157637,2019-06-23 22:00:00,2019-06-23T22:00,2019,6,20.5,0.0,Clear
02/18/2019,18:00,40.81608,-73.917694,BRONX,0.0,0.0,0,0,0,0,0,0,4083093,2019-02-18 18:00:00,2019-02-18T18:00,2019,2,-0.3,0.0,Clear
12/06/2019,13:00,40.80393,-73.90547,BRONX,0.0,0.0,0,0,0,0,0,0,4255072,2019-12-06 13:00:00,2019-12-06T13:00,2019,12,7.5,0.0,Cloudy
09/12/2019,16:00,40.84921,-73.90011,BRONX,1.0,0.0,0,0,0,0,1,0,4205306,2019-09-12 16:00:00,2019-09-12T16:00,2019,9,21.7,0.1,Drizzle
05/17/2019,13:00,40.842625,-73.87818,BRONX,1.0,0.0,0,0,0,0,1,0,4134525,2019-05-17 13:00:00,2019-05-17T13:00,2019,5,20.4,0.2,Drizzle
07/24/2019,16:00,40.83028,-73.87575,BRONX,1.0,0.0,1,0,0,0,0,0,4176386,2019-07-24 16:00:00,2019-07-24T16:00,2019,7,26.0,0.0,Clear
11/20/2019,21:00,40.824066,-73.908714,BRONX,2.0,0.0,0,0,0,0,2,0,4244714,2019-11-20 21:00:00,2019-11-20T21:00,2019,11,3.8,0.0,Clear
08/30/2019,0:00,40.817017,-73.916214,BRONX,1.0,0.0,0,0,1,0,0,0,4198253,2019-08-30 00:00:00,2019-08-30T00:00,2019,8,16.5,0.0,Clear
10/14/2019,10:00,40.892475,-73.8545,BRONX,1.0,0.0,0,0,0,0,1,0,4223385,2019-10-14 10:00:00,2019-10-14T10:00,2019,10,17.6,0.0,Clear
02/22/2019,16:00,40.82742,-73.90477,BRONX,0.0,0.0,0,0,0,0,0,0,4085284,2019-02-22 16:00:00,2019-02-22T16:00,2019,2,6.6,0.0,Cloudy
06/27/2019,13:00,40.835857,-73.87213,BRONX,0.0,0.0,0,0,0,0,0,0,4160593,2019-06-27 13:00:00,2019-06-27T13:00,2019,6,30.5,0.0,Clear
12/07/2019,13:00,40.834106,-73.852486,BRONX,0.0,0.0,0,0,0,0,0,0,4254568,2019-12-07 13:00:00,2019-12-07T13:00,2019,12,2.7,0.0,Cloudy
04/04/2019,7:00,40.882427,-73.8237,BRONX,1.0,0.0,0,0,0,0,1,0,4111637,2019-04-04 07:00:00,2019-04-04T07:00,2019,4,5.5,0.0,Clear
08/28/2019,9:00,40.842587,-73.85232,BRONX,1.0,0.0,1,0,0,0,0,0,4195976,2019-08-28 09:00:00,2019-08-28T09:00,2019,8,22.8,0.2,Drizzle
01/18/2019,15:00,40.832706,-73.90506,BRONX,0.0,0.0,0,0,0,0,0,0,4057175,2019-01-18 15:00:00,2019-01-18T15:00,2019,1,3.6,0.0,Cloudy
03/15/2019,0:00,40.837406,-73.840996,BRONX,1.0,0.0,1,0,0,0,0,0,4099089,2019-03-15 00:00:00,2019-03-15T00:00,2019,3,9.6,0.0,Cloudy
07/20/2019,18:00,40.84782,-73.90756,BRONX,4.0,0.0,0,0,0,0,4,0,4173951,2019-07-20 18:00:00,2019-07-20T18:00,2019,7,32.5,0.0,Cloudy
07/09/2019,15:00,40.840424,-73.92239,BRONX,1.0,0.0,0,0,1,0,0,0,4167620,2019-07-09 15:00:00,2019-07-09T15:00,2019,7,31.3,0.0,Cloudy
12/10/2019,12:00,40.858383,-73.89112,BRONX,0.0,0.0,0,0,0,0,0,0,4255991,2019-12-10 12:00:00,2019-12-10T12:00,2019,12,13.4,0.0,Cloudy
09/28/2019,19:00,40.87946,-73.863594,BRONX,1.0,0.0,0,0,0,0,1,0,4215058,2019-09-28 19:00:00,2019-09-28T19:00,2019,9,21.1,0.0,Cloudy
09/05/2019,10:00,40.86759,-73.85095,BRONX,1.0,0.0,0,0,0,0,1,0,4204087,2019-09-05 10:00:00,2019-09-05T10:00,2019,9,21.1,0.0,Cloudy
11/25/2019,20:00,40.826786,-73.890915,BRONX,0.0,0.0,0,0,0,0,0,0,4252776,2019-11-25 20:00:00,2019-11-25T20:00,2019,11,5.4,0.0,Clear
09/06/2019,20:00,40.824066,-73.908714,BRONX,2.0,0.0,0,0,0,0,2,0,4201405,2019-09-06 20:00:00,2019-09-06T20:00,2019,9,15.7,0.0,Cloudy
11/03/2019,15:00,40.88532,-73.91009,BRONX,0.0,0.0,0,0,0,0,0,0,4234376,2019-11-03 15:00:00,2019-11-03T15:00,2019,11,10.5,0.0,Cloudy
08/22/2019,15:00,40.843857,-73.83044,BRONX,1.0,0.0,0,0,1,0,0,0,4195315,2019-08-22 15:00:00,2019-08-22T15:00,2019,8,31.5,0.0,Clear
10/09/2019,13:00,40.845985,-73.884476,BRONX,1.0,0.0,0,0,0,0,1,0,4220896,2019-10-09 13:00:00,2019-10-09T13:00,2019,10,12.9,1.0,Drizzle
12/26/2019,13:00,40.8759,-73.83292,BRONX,1.0,0.0,1,0,0,0,0,0,4264993,2019-12-26 13:00:00,2019-12-26T13:00,2019,12,6.1,0.0,Cloudy
08/15/2019,14:00,40.835915,-73.8731,BRONX,0.0,0.0,0,0,0,0,0,0,4190326,2019-08-15 14:00:00,2019-08-15T14:00,2019,8,26.0,0.3,Drizzle
05/12/2019,0:00,40.82215,-73.91139,BRONX,1.0,0.0,0,0,0,0,1,0,4130609,2019-05-12 00:00:00,2019-05-12T00:00,2019,5,12.8,1.9,Light Rain
11/08/2019,8:00,40.8108,-73.9189,BRONX,0.0,0.0,0,0,0,0,0,0,4238859,2019-11-08 08:00:00,2019-11-08T08:00,2019,11,1.3,0.0,Clear
03/16/2019,0:00,40.811733,-73.9267,BRONX,1.0,0.0,0,0,0,0,1,0,4097667,2019-03-16 00:00:00,2019-03-16T00:00,2019,3,11.1,0.0,Clear
09/19/2019,15:00,40.89063,-73.85892,BRONX,1.0,0.0,0,0,1,0,0,0,4215104,2019-09-19 15:00:00,2019-09-19T15:00,2019,9,20.0,0.0,Clear
10/30/2019,5:00,40.895374,-73.86356,BRONX,0.0,0.0,0,0,0,0,0,0,4232115,2019-10-30 05:00:00,2019-10-30T05:00,2019,10,13.0,0.0,Cloudy
08/18/2019,14:00,40.814266,-73.912964,BRONX,1.0,0.0,0,0,1,0,0,0,4191795,2019-08-18 14:00:00,2019-08-18T14:00,2019,8,28.5,0.0,Cloudy
12/30/2019,10:00,40.832706,-73.90506,BRONX,0.0,0.0,0,0,0,0,0,0,4266774,2019-12-30 10:00:00,2019-12-30T10:00,2019,12,4.4,0.4,Drizzle
08/09/2019,8:00,40.826786,-73.890915,BRONX,0.0,0.0,0,0,0,0,0,0,4185909,2019-08-09 08:00:00,2019-08-09T08:00,2019,8,23.7,0.0,Clear
12/06/2019,9:00,40.86539,-73.88684,BRONX,0.0,0.0,0,0,0,0,0,0,4253261,2019-12-06 09:00:00,2019-12-06T09:00,2019,12,1.8,0.0,Cloudy
10/14/2019,19:00,40.86823,-73.88956,BRONX,0.0,0.0,0,0,0,0,0,0,4223361,2019-10-14 19:00:00,2019-10-14T19:00,2019,10,16.2,0.0,Clear
06/06/2019,16:00,40.84541,-73.891136,BRONX,1.0,0.0,0,0,0,0,1,0,4146748,2019-06-06 16:00:00,2019-06-06T16:00,2019,6,26.4,0.0,Clear
06/16/2019,17:00,40.829426,-73.86969,BRONX,0.0,0.0,0,0,0,0,0,0,4153700,2019-06-16 17:00:00,2019-06-16T17:00,2019,6,25.0,0.3,Drizzle
11/29/2019,17:00,40.816826,-73.92056,BRONX,1.0,0.0,0,0,1,0,0,0,4250625,2019-11-29 17:00:00,2019-11-29T17:00,2019,11,1.7,0.0,Clear
05/13/2019,16:00,40.817966,-73.91891,BRONX,1.0,0.0,1,0,0,0,0,0,4131349,2019-05-13 16:00:00,2019-05-13T16:00,2019,5,9.1,0.7,Drizzle
02/06/2019,1:00,40.806114,-73.91797,BRONX,1.0,0.0,0,0,0,0,1,0,4075597,2019-02-06 01:00:00,2019-02-06T01:00,2019,2,1.4,0.0,Clear
02/27/2019,19:00,40.828125,-73.84105,BRONX,0.0,0.0,0,0,0,0,0,0,4087990,2019-02-27 19:00:00,2019-02-27T19:00,2019,2,-4.0,0.0,Cloudy
02/07/2019,7:00,40.912468,-73.902596,BRONX,0.0,0.0,0,0,0,0,0,0,4076308,2019-02-07 07:00:00,2019-02-07T07:00,2019,2,2.1,0.0,Cloudy
04/30/2019,14:00,40.828125,-73.84105,BRONX,1.0,0.0,0,0,0,0,1,0,4123361,2019-04-30 14:00:00,2019-04-30T14:00,2019,4,16.2,0.0,Cloudy
11/24/2019,14:00,40.894207,-73.848946,BRONX,1.0,0.0,0,0,0,0,1,0,4246997,2019-11-24 14:00:00,2019-11-24T14:00,2019,11,5.2,0.7,Drizzle
05/09/2019,11:00,40.80719,-73.92431,BRONX,0.0,0.0,0,0,0,0,0,0,4128784,2019-05-09 11:00:00,2019-05-09T11:00,2019,5,15.4,0.0,Cloudy
11/16/2019,3:00,40.880955,-73.90151,BRONX,1.0,0.0,0,0,0,0,1,0,4242295,2019-11-16 03:00:00,2019-11-16T03:00,2019,11,2.5,0.0,Cloudy
09/13/2019,10:00,40.805367,-73.9219,BRONX,0.0,0.0,0,0,0,0,0,0,4205308,2019-09-13 10:00:00,2019-09-13T10:00,2019,9,18.9,0.0,Cloudy
02/23/2019,7:00,40.8281,-73.92021,BRONX,1.0,0.0,0,0,0,0,1,0,4087822,2019-02-23 07:00:00,2019-02-23T07:00,2019,2,-2.3,0.0,Cloudy
12/03/2019,14:00,40.87573,-73.87956,BRONX,1.0,0.0,0,0,0,0,1,0,4251557,2019-12-03 14:00:00,2019-12-03T14:00,2019,12,2.0,0.0,Clear
05/18/2019,14:00,40.847176,-73.89876,BRONX,1.0,0.0,1,0,0,0,0,0,4134544,2019-05-18 14:00:00,2019-05-18T14:00,2019,5,22.3,0.0,Cloudy
03/22/2019,0:00,40.880257,-73.876785,BRONX,1.0,0.0,0,0,0,0,1,0,4101606,2019-03-22 00:00:00,2019-03-22T00:00,2019,3,4.9,2.5,Heavy Rain
08/06/2019,15:00,40.82628,-73.843414,BRONX,1.0,0.0,0,0,0,0,1,0,4184039,2019-08-06 15:00:00,2019-08-06T15:00,2019,8,27.6,0.0,Clear
05/20/2019,13:00,40.835014,-73.89964,BRONX,2.0,0.0,0,0,0,0,2,0,4135703,2019-05-20 13:00:00,2019-05-20T13:00,2019,5,28.0,0.0,Clear
05/28/2019,17:00,40.80853,-73.90497,BRONX,2.0,0.0,0,0,0,0,2,0,4140852,2019-05-28 17:00:00,2019-05-28T17:00,2019,5,19.4,0.1,Drizzle
07/01/2019,15:00,40.83887,-73.87811,BRONX,1.0,0.0,0,0,0,0,1,0,4162977,2019-07-01 15:00:00,2019-07-01T15:00,2019,7,29.7,0.0,Clear
01/08/2019,14:00,40.818893,-73.89229,BRONX,0.0,0.0,0,0,0,0,0,0,4071718,2019-01-08 14:00:00,2019-01-08T14:00,2019,1,7.8,0.0,Cloudy
03/13/2019,10:00,40.82463,-73.91059,BRONX,0.0,0.0,0,0,0,0,0,0,4096482,2019-03-13 10:00:00,2019-03-13T10:00,2019,3,3.8,0.0,Cloudy
03/04/2019,20:00,40.84921,-73.83056,BRONX,0.0,0.0,0,0,0,0,0,0,4094335,2019-03-04 20:00:00,2019-03-04T20:00,2019,3,-5.3,0.0,Clear
09/10/2019,13:00,40.86231,-73.909874,BRONX,0.0,0.0,0,0,0,0,0,0,4204847,2019-09-10 13:00:00,2019-09-10T13:00,2019,9,22.9,0.2,Drizzle
12/17/2019,15:00,40.719746,-73.93941,BROOKLYN,0.0,0.0,0,0,0,0,0,0,4261660,2019-12-17 15:00:00,2019-12-17T15:00,2019,12,1.0,1.2,Drizzle
05/22/2019,14:00,40.641033,-73.913155,BROOKLYN,1.0,0.0,0,0,0,0,1,0,4138298,2019-05-22 14:00:00,2019-05-22T14:00,2019,5,22.2,0.0,Cloudy
01/03/2019,9:00,40.637203,-74.0222,BROOKLYN,3.0,0.0,0,0,0,0,3,0,4061386,2019-01-03 09:00:00,2019-01-03T09:00,2019,1,5.0,0.0,Cloudy
10/29/2019,23:00,40.59017,-73.97357,BROOKLYN,0.0,0.0,0,0,0,0,0,0,4231876,2019-10-29 23:00:00,2019-10-29T23:00,2019,10,15.0,0.0,Cloudy
08/26/2019,23:00,40.647297,-73.9803,BROOKLYN,1.0,0.0,0,0,1,0,0,0,4199052,2019-08-26 23:00:00,2019-08-26T23:00,2019,8,18.3,0.0,Cloudy
11/14/2019,12:00,40.653442,-73.93639,BROOKLYN,0.0,0.0,0,0,0,0,0,0,4241670,2019-11-14 12:00:00,2019-11-14T12:00,2019,11,4.2,0.0,Cloudy
03/05/2019,23:00,40.717354,-73.953995,BROOKLYN,1.0,0.0,0,0,1,0,0,0,4093219,2019-03-05 23:00:00,2019-03-05T23:00,2019,3,-5.1,0.0,Clear
01/17/2019,7:00,40.65434,-73.94704,BROOKLYN,3.0,0.0,0,0,0,0,3,0,4057119,2019-01-17 07:00:00,2019-01-17T07:00,2019,1,-4.2,0.0,Cloudy
10/21/2019,17:00,40.653873,-74.008156,BROOKLYN,0.0,0.0,0,0,0,0,0,0,4227154,2019-10-21 17:00:00,2019-10-21T17:00,2019,10,13.9,0.0,Clear
08/23/2019,23:00,40.726814,-73.95355,BROOKLYN,1.0,0.0,0,0,1,0,0,0,4194173,2019-08-23 23:00:00,2019-08-23T23:00,2019,8,19.3,0.0,Clear
08/09/2019,19:00,40.651157,-73.918144,BROOKLYN,0.0,0.0,0,0,0,0,0,0,4187087,2019-08-09 19:00:00,2019-08-09T19:00,2019,8,23.9,0.0,Clear
02/07/2019,0:00,40.671616,-73.89775,BROOKLYN,0.0,0.0,0,0,0,0,0,0,4076896,2019-02-07 00:00:00,2019-02-07T00:00,2019,2,4.8,1.9,Light Rain
06/24/2019,21:00,40.66827,-73.90263,BROOKLYN,1.0,0.0,0,0,0,0,1,0,4160172,2019-06-24 21:00:00,2019-06-24T21:00,2019,6,21.4,0.0,Cloudy
10/22/2019,0:00,40.664104,-73.88199,BROOKLYN,0.0,0.0,0,0,0,0,0,0,4229874,2019-10-22 00:00:00,2019-10-22T00:00,2019,10,12.0,0.0,Cloudy
02/26/2019,14:00,40.623295,-73.934845,BROOKLYN,0.0,0.0,0,0,0,0,0,0,4087298,2019-02-26 14:00:00,2019-02-26T14:00,2019,2,3.4,0.0,Clear
03/09/2019,12:00,40.61477,-74.01194,BROOKLYN,0.0,0.0,0,0,0,0,0,0,4094139,2019-03-09 12:00:00,2019-03-09T12:00,2019,3,5.5,0.0,Clear
12/21/2019,11:00,40.67156,-73.9755,BROOKLYN,0.0,0.0,0,0,0,0,0,0,4262951,2019-12-21 11:00:00,2019-12-21T11:00,2019,12,-1.8,0.0,Cloudy
05/28/2019,13:00,40.65753,-73.89797,BROOKLYN,0.0,0.0,0,0,0,0,0,0,4140936,2019-05-28 13:00:00,2019-05-28T13:00,2019,5,18.9,0.0,Cloudy
10/16/2019,14:00,40.595028,-73.95474,BROOKLYN,1.0,0.0,1,0,0,0,0,0,4224590,2019-10-16 14:00:00,2019-10-16T14:00,2019,10,18.1,0.9,Drizzle
06/22/2019,0:00,40.62539,-73.95951,BROOKLYN,1.0,0.0,1,0,0,0,0,0,4156460,2019-06-22 00:00:00,2019-06-22T00:00,2019,6,18.3,0.0,Clear
04/04/2019,10:00,40.69977,-73.98294,BROOKLYN,1.0,0.0,0,0,0,0,1,0,4108558,2019-04-04 10:00:00,2019-04-04T10:00,2019,4,9.0,0.0,Cloudy
04/16/2019,14:00,40.70683,-73.9684,BROOKLYN,0.0,0.0,0,0,0,0,0,0,4118685,2019-04-16 14:00:00,2019-04-16T14:00,2019,4,16.8,0.0,Clear
08/05/2019,10:00,40.675434,-73.97797,BROOKLYN,1.0,0.0,0,0,0,0,1,0,4183800,2019-08-05 10:00:00,2019-08-05T10:00,2019,8,25.7,0.0,Cloudy
05/14/2019,11:00,40.625816,-73.99812,BROOKLYN,3.0,0.0,0,0,0,0,3,0,4132226,2019-05-14 11:00:00,2019-05-14T11:00,2019,5,10.7,0.0,Cloudy
03/23/2019,18:00,40.66727,-73.894684,BROOKLYN,2.0,0.0,0,0,0,0,2,0,4102795,2019-03-23 18:00:00,2019-03-23T18:00,2019,3,6.1,0.0,Clear
11/25/2019,16:00,40.669147,-73.98973,BROOKLYN,1.0,0.0,0,0,1,0,0,0,4247688,2019-11-25 16:00:00,2019-11-25T16:00,2019,11,9.3,0.0,Clear
05/26/2019,1:00,40.649254,-73.960846,BROOKLYN,0.0,0.0,0,0,0,0,0,0,4138920,2019-05-26 01:00:00,2019-05-26T01:00,2019,5,14.6,0.4,Drizzle
01/11/2019,13:00,40.613377,-73.955284,BROOKLYN,1.0,0.0,1,0,0,0,0,0,4065869,2019-01-11 13:00:00,2019-01-11T13:00,2019,1,-1.2,0.0,Clear
10/16/2019,15:00,40.60711,-73.96086,BROOKLYN,0.0,0.0,0,0,0,0,0,0,4224161,2019-10-16 15:00:00,2019-10-16T15:00,2019,10,18.2,1.9,Light Rain
07/13/2019,19:00,40.68223,-73.90928,BROOKLYN,1.0,0.0,0,0,0,0,1,0,4170081,2019-07-13 19:00:00,2019-07-13T19:00,2019,7,24.3,0.0,Clear
02/07/2019,13:00,40.628796,-73.98785,BROOKLYN,2.0,0.0,2,0,0,0,0,0,4078444,2019-02-07 13:00:00,2019-02-07T13:00,2019,2,7.1,0.0,Cloudy
09/25/2019,8:00,40.671852,-74.00325,BROOKLYN,1.0,0.0,0,0,1,0,0,0,4212847,2019-09-25 08:00:00,2019-09-25T08:00,2019,9,17.5,0.0,Clear
10/20/2019,21:00,40.677654,-73.89631,BROOKLYN,2.0,0.0,0,0,0,0,2,0,4226351,2019-10-20 21:00:00,2019-10-20T21:00,2019,10,12.2,0.5,Drizzle
07/11/2019,9:00,40.653843,-73.961716,BROOKLYN,0.0,0.0,0,0,0,0,0,0,4168230,2019-07-11 09:00:00,2019-07-11T09:00,2019,7,26.3,0.0,Cloudy
12/16/2019,17:00,40.68993,-73.98148,BROOKLYN,1.0,0.0,0,0,0,0,1,0,4259275,2019-12-16 17:00:00,2019-12-16T17:00,2019,12,2.1,0.0,Cloudy
06/04/2019,20:00,40.582542,-73.957214,BROOKLYN,0.0,0.0,0,0,0,0,0,0,4145176,2019-06-04 20:00:00,2019-06-04T20:00,2019,6,18.1,0.0,Clear
05/03/2019,15:00,40.676243,-73.90923,BROOKLYN,0.0,0.0,0,0,0,0,0,0,4125017,2019-05-03 15:00:00,2019-05-03T15:00,2019,5,12.9,0.0,Cloudy
05/21/2019,8:00,40.618977,-73.951225,BROOKLYN,2.0,0.0,0,0,0,0,2,0,4135898,2019-05-21 08:00:00,2019-05-21T08:00,2019,5,14.4,0.0,Cloudy
12/21/2019,18:00,40.661446,-73.92829,BROOKLYN,1.0,0.0,1,0,0,0,0,0,4262845,2019-12-21 18:00:00,2019-12-21T18:00,2019,12,-0.9,0.0,Clear
06/02/2019,14:00,40.617176,-73.92087,BROOKLYN,2.0,0.0,0,0,0,0,2,0,4143685,2019-06-02 14:00:00,2019-06-02T14:00,2019,6,22.3,0.0,Clear
08/28/2019,12:00,40.630283,-74.01635,BROOKLYN,1.0,0.0,0,0,0,0,1,0,4196161,2019-08-28 12:00:00,2019-08-28T12:00,2019,8,21.6,1.6,Light Rain
12/16/2019,20:00,40.684395,-73.97835,BROOKLYN,1.0,0.0,1,0,0,0,0,0,4259426,2019-12-16 20:00:00,2019-12-16T20:00,2019,12,1.4,0.4,Drizzle
10/26/2019,22:00,40.574005,-73.98969,BROOKLYN,3.0,0.0,3,0,0,0,0,0,4230417,2019-10-26 22:00:00,2019-10-26T22:00,2019,10,14.3,0.0,Cloudy
11/01/2019,18:00,40.67464,-73.9739,BROOKLYN,1.0,0.0,0,0,0,0,1,0,4234554,2019-11-01 18:00:00,2019-11-01T18:00,2019,11,9.1,0.0,Clear
02/24/2019,22:00,40.675735,-73.89686,BROOKLYN,0.0,0.0,0,0,0,0,0,0,4086307,2019-02-24 22:00:00,2019-02-24T22:00,2019,2,6.8,0.0,Clear
01/14/2019,8:00,40.577007,-73.961334,BROOKLYN,0.0,0.0,0,0,0,0,0,0,4067172,2019-01-14 08:00:00,2019-01-14T08:00,2019,1,-5.3,0.0,Cloudy
06/27/2019,16:00,40.716778,-73.93635,BROOKLYN,0.0,0.0,0,0,0,0,0,0,4160307,2019-06-27 16:00:00,2019-06-27T16:00,2019,6,30.8,0.0,Clear
06/09/2019,9:00,40.630276,-73.92614,BROOKLYN,0.0,0.0,0,0,0,0,0,0,4148376,2019-06-09 09:00:00,2019-06-09T09:00,2019,6,20.3,0.0,Cloudy
11/01/2019,16:00,40.661457,-73.87448,BROOKLYN,1.0,0.0,0,0,0,0,1,0,4243960,2019-11-01 16:00:00,2019-11-01T16:00,2019,11,11.4,0.0,Clear
04/07/2019,4:00,40.70392,-73.91553,BROOKLYN,1.0,0.0,0,0,0,0,1,0,4110495,2019-04-07 04:00:00,2019-04-07T04:00,2019,4,4.7,0.0,Clear
11/15/2019,11:00,40.68306,-73.973785,BROOKLYN,0.0,0.0,0,0,0,0,0,0,4242907,2019-11-15 11:00:00,2019-11-15T11:00,2019,11,7.6,0.0,Clear
01/09/2019,12:00,40.578434,-73.96176,BROOKLYN,0.0,0.0,0,0,0,0,0,0,4064472,2019-01-09 12:00:00,2019-01-09T12:00,2019,1,7.1,0.0,Cloudy
03/23/2019,15:00,40.595413,-73.983055,BROOKLYN,1.0,0.0,0,0,0,0,1,0,4102624,2019-03-23 15:00:00,2019-03-23T15:00,2019,3,8.7,0.0,Clear
02/06/2019,19:00,40.612736,-74.01172,BROOKLYN,1.0,0.0,1,0,0,0,0,0,4076063,2019-02-06 19:00:00,2019-02-06T19:00,2019,2,4.2,0.5,Drizzle
09/12/2019,6:00,40.66767,-73.87045,BROOKLYN,1.0,0.0,1,0,0,0,0,0,4205155,2019-09-12 06:00:00,2019-09-12T06:00,2019,9,22.2,0.0,Cloudy
10/09/2019,12:00,40.631836,-73.94463,BROOKLYN,1.0,0.0,1,0,0,0,0,0,4231956,2019-10-09 12:00:00,2019-10-09T12:00,2019,10,12.3,1.8,Light Rain
04/22/2019,16:00,40.628593,-73.947235,BROOKLYN,0.0,0.0,0,0,0,0,0,0,4119293,2019-04-22 16:00:00,2019-04-22T16:00,2019,4,15.6,0.4,Drizzle
08/30/2019,7:00,40.628643,-74.005936,BROOKLYN,5.0,0.0,0,0,0,0,5,0,4197553,2019-08-30 07:00:00,2019-08-30T07:00,2019,8,20.5,0.0,Clear
03/23/2019,17:00,40.724636,-73.94818,BROOKLYN,1.0,0.0,1,0,0,0,0,0,4102762,2019-03-23 17:00:00,2019-03-23T17:00,2019,3,7.4,0.0,Clear
06/24/2019,20:00,40.64165,-73.90378,BROOKLYN,0.0,1.0,0,0,0,0,0,1,4158497,2019-06-24 20:00:00,2019-06-24T20:00,2019,6,22.0,0.0,Cloudy
08/05/2019,23:00,40.689297,-73.87406,BROOKLYN,1.0,0.0,0,0,0,0,1,0,4184432,2019-08-05 23:00:00,2019-08-05T23:00,2019,8,23.0,0.0,Cloudy
12/19/2019,0:00,40.7059,-73.960144,BROOKLYN,1.0,0.0,0,0,0,0,1,0,4260850,2019-12-19 00:00:00,2019-12-19T00:00,2019,12,-6.0,0.0,Clear
07/03/2019,13:00,40.690468,-73.9879,BROOKLYN,2.0,0.0,0,0,0,0,2,0,4163890,2019-07-03 13:00:00,2019-07-03T13:00,2019,7,27.9,0.0,Cloudy
04/30/2019,13:00,40.71053,-73.92075,BROOKLYN,2.0,0.0,0,0,0,0,2,0,4123975,2019-04-30 13:00:00,2019-04-30T13:00,2019,4,15.3,0.0,Cloudy
01/09/2019,10:00,40.67357,-73.95294,BROOKLYN,1.0,0.0,0,0,0,0,1,0,4066059,2019-01-09 10:00:00,2019-01-09T10:00,2019,1,6.2,0.0,Clear
07/14/2019,0:00,40.632664,-73.93128,BROOKLYN,2.0,0.0,0,0,0,0,2,0,4172582,2019-07-14 00:00:00,2019-07-14T00:00,2019,7,23.6,0.0,Clear
05/26/2019,23:00,40.61701,-73.969124,BROOKLYN,1.0,0.0,0,0,0,0,1,0,4141058,2019-05-26 23:00:00,2019-05-26T23:00,2019,5,20.8,0.0,Cloudy
12/30/2019,17:00,40.64477,-73.954735,BROOKLYN,1.0,0.0,0,0,1,0,0,0,4267695,2019-12-30 17:00:00,2019-12-30T17:00,2019,12,5.6,1.7,Light Rain
12/20/2019,15:00,40.687542,-73.9677,BROOKLYN,1.0,0.0,0,0,0,0,1,0,4265810,2019-12-20 15:00:00,2019-12-20T15:00,2019,12,1.3,0.0,Clear
11/06/2019,17:00,40.634865,-74.02639,BROOKLYN,1.0,0.0,0,0,0,0,1,0,4236543,2019-11-06 17:00:00,2019-11-06T17:00,2019,11,8.1,0.0,Clear
04/21/2019,6:00,40.649593,-73.93841,BROOKLYN,1.0,0.0,0,0,0,0,1,0,4118420,2019-04-21 06:00:00,2019-04-21T06:00,2019,4,10.9,0.0,Cloudy
11/02/2019,10:00,40.595097,-74.00092,BROOKLYN,0.0,0.0,0,0,0,0,0,0,4233686,2019-11-02 10:00:00,2019-11-02T10:00,2019,11,8.4,0.0,Cloudy
04/18/2019,15:00,40.62948,-73.94447,BROOKLYN,1.0,0.0,0,0,0,0,1,0,4121197,2019-04-18 15:00:00,2019-04-18T15:00,2019,4,14.0,0.0,Cloudy
10/01/2019,10:00,40.581116,-73.9599,BROOKLYN,1.0,0.0,0,0,0,0,1,0,4215739,2019-10-01 10:00:00,2019-10-01T10:00,2019,10,21.6,0.0,Clear
11/18/2019,6:00,40.616043,-73.94484,BROOKLYN,1.0,0.0,0,0,0,0,1,0,4244254,2019-11-18 06:00:00,2019-11-18T06:00,2019,11,3.8,0.0,Cloudy
07/29/2019,22:00,40.61913,-73.99019,BROOKLYN,1.0,0.0,0,0,0,0,1,0,4179314,2019-07-29 22:00:00,2019-07-29T22:00,2019,7,26.0,0.0,Clear
01/31/2019,6:00,40.58525,-73.98728,BROOKLYN,1.0,0.0,0,0,0,0,1,0,4072612,2019-01-31 06:00:00,2019-01-31T06:00,2019,1,-15.4,0.0,Clear
10/27/2019,10:00,40.681538,-73.91297,BROOKLYN,0.0,0.0,0,0,0,0,0,0,4240473,2019-10-27 10:00:00,2019-10-27T10:00,2019,10,16.5,5.0,Heavy Rain
04/27/2019,13:00,40.617653,-74.00659,BROOKLYN,1.0,0.0,0,0,0,0,1,0,4121676,2019-04-27 13:00:00,2019-04-27T13:00,2019,4,12.8,0.0,Cloudy
03/14/2019,9:00,40.6087,-73.97404,BROOKLYN,1.0,0.0,1,0,0,0,0,0,4096698,2019-03-14 09:00:00,2019-03-14T09:00,2019,3,6.8,0.0,Cloudy
09/25/2019,10:00,40.625774,-74.016495,BROOKLYN,1.0,0.0,0,0,0,0,1,0,4212363,2019-09-25 10:00:00,2019-09-25T10:00,2019,9,20.6,0.0,Clear
12/22/2019,18:00,40.649982,-73.91183,BROOKLYN,2.0,0.0,0,0,0,0,2,0,4266058,2019-12-22 18:00:00,2019-12-22T18:00,2019,12,3.1,0.0,Clear
05/01/2019,14:00,40.58667,-73.966156,BROOKLYN,1.0,0.0,0,0,0,0,1,0,4124034,2019-05-01 14:00:00,2019-05-01T14:00,2019,5,11.2,0.0,Cloudy
02/13/2019,17:00,40.723854,-73.950516,BROOKLYN,0.0,0.0,0,0,0,0,0,0,4080605,2019-02-13 17:00:00,2019-02-13T17:00,2019,2,1.9,0.0,Cloudy
01/13/2019,12:00,40.608562,-73.99414,BROOKLYN,1.0,0.0,0,0,1,0,0,0,4066198,2019-01-13 12:00:00,2019-01-13T12:00,2019,1,-0.8,0.0,Clear
07/19/2019,14:00,40.5805,-73.96692,BROOKLYN,1.0,0.0,0,0,1,0,0,0,4176740,2019-07-19 14:00:00,2019-07-19T14:00,2019,7,28.1,0.0,Clear
11/20/2019,18:00,40.700073,-73.99454,BROOKLYN,0.0,0.0,0,0,0,0,0,0,4248670,2019-11-20 18:00:00,2019-11-20T18:00,2019,11,4.5,0.0,Clear
01/31/2019,22:00,40.612286,-74.01098,BROOKLYN,0.0,0.0,0,0,0,0,0,0,4072844,2019-01-31 22:00:00,2019-01-31T22:00,2019,1,-9.4,0.0,Clear
11/03/2019,1:00,0.0,0.0,BROOKLYN,2.0,0.0,0,0,0,0,2,0,4234358,2019-11-03 01:00:00,2019-11-03T01:00,2019,11,26.4,0.1,Drizzle
04/19/2019,18:00,40.628387,-73.92431,BROOKLYN,1.0,0.0,0,0,0,0,1,0,4118817,2019-04-19 18:00:00,2019-04-19T18:00,2019,4,16.1,0.5,Drizzle
08/19/2019,13:00,40.71076,-73.95314,BROOKLYN,1.0,0.0,0,0,0,0,1,0,4191455,2019-08-19 13:00:00,2019-08-19T13:00,2019,8,30.6,0.1,Drizzle
03/25/2019,18:00,40.58369,-73.94808,BROOKLYN,2.0,0.0,0,0,0,0,2,0,4103194,2019-03-25 18:00:00,2019-03-25T18:00,2019,3,7.0,0.3,Drizzle
01/15/2019,0:00,40.587826,-73.93468,BROOKLYN,1.0,0.0,0,0,0,0,1,0,4067305,2019-01-15 00:00:00,2019-01-15T00:00,2019,1,-3.6,0.0,Clear
09/28/2019,11:00,40.6104,-73.9586,BROOKLYN,1.0,0.0,1,0,0,0,0,0,4215290,2019-09-28 11:00:00,2019-09-28T11:00,2019,9,24.3,0.0,Clear
05/01/2019,23:00,40.66636,-73.92445,BROOKLYN,1.0,0.0,1,0,0,0,0,0,4125003,2019-05-01 23:00:00,2019-05-01T23:00,2019,5,10.4,0.0,Cloudy
01/28/2019,18:00,40.68174,-73.95859,BROOKLYN,1.0,0.0,1,0,0,0,0,0,4070676,2019-01-28 18:00:00,2019-01-28T18:00,2019,1,-2.8,0.0,Clear
05/24/2019,22:00,40.643776,-74.008125,BROOKLYN,2.0,0.0,0,0,0,0,2,0,4138523,2019-05-24 22:00:00,2019-05-24T22:00,2019,5,15.6,0.0,Clear
01/22/2019,0:00,40.678406,-73.88955,BROOKLYN,0.0,0.0,0,0,0,0,0,0,4059246,2019-01-22 00:00:00,2019-01-22T00:00,2019,1,-11.0,0.0,Clear
07/17/2019,13:00,40.620876,-73.96443,BROOKLYN,0.0,0.0,0,0,0,0,0,0,4172133,2019-07-17 13:00:00,2019-07-17T13:00,2019,7,29.5,0.1,Drizzle
12/29/2019,20:00,40.703182,-73.95382,BROOKLYN,1.0,0.0,1,0,0,0,0,0,4266162,2019-12-29 20:00:00,2019-12-29T20:00,2019,12,4.6,1.2,Drizzle
03/26/2019,18:00,40.654408,-73.946075,BROOKLYN,0.0,0.0,0,0,0,0,0,0,4103931,2019-03-26 18:00:00,2019-03-26T18:00,2019,3,5.0,0.0,Clear
05/28/2019,0:00,40.663586,-73.932976,BROOKLYN,2.0,0.0,0,0,0,0,2,0,4140989,2019-05-28 00:00:00,2019-05-28T00:00,2019,5,17.5,0.0,Cloudy
06/27/2019,13:00,40.663284,-73.96096,BROOKLYN,1.0,0.0,0,0,0,0,1,0,4160407,2019-06-27 13:00:00,2019-06-27T13:00,2019,6,30.4,0.0,Clear
02/09/2019,0:00,40.705017,-73.94948,BROOKLYN,1.0,0.0,0,0,0,0,1,0,4078490,2019-02-09 00:00:00,2019-02-09T00:00,2019,2,-1.9,0.0,Clear
09/29/2019,13:00,40.673927,-73.87059,BROOKLYN,0.0,0.0,0,0,0,0,0,0,4216042,2019-09-29 13:00:00,2019-09-29T13:00,2019,9,25.8,0.0,Clear
06/04/2019,15:00,40.5778,-73.96057,BROOKLYN,1.0,0.0,1,0,0,0,0,0,4145204,2019-06-04 15:00:00,2019-06-04T15:00,2019,6,19.5,0.0,Cloudy
03/15/2019,14:00,40.627186,-73.9431,BROOKLYN,0.0,0.0,0,0,0,0,0,0,4097619,2019-03-15 14:00:00,2019-03-15T14:00,2019,3,19.0,0.0,Cloudy
06/03/2019,0:00,40.696953,-73.92645,BROOKLYN,0.0,0.0,0,0,0,0,0,0,4144778,2019-06-03 00:00:00,2019-06-03T00:00,2019,6,16.5,0.0,Clear
07/26/2019,0:00,40.627094,-73.94161,BROOKLYN,1.0,0.0,0,0,1,0,0,0,4177559,2019-07-26 00:00:00,2019-07-26T00:00,2019,7,21.9,0.0,Clear
05/12/2019,12:00,40.641747,-74.013824,BROOKLYN,1.0,0.0,0,0,0,0,1,0,4130213,2019-05-12 12:00:00,2019-05-12T12:00,2019,5,8.9,2.0,Light Rain
09/04/2019,16:00,40.62507,-73.94021,BROOKLYN,0.0,0.0,0,0,0,0,0,0,4199939,2019-09-04 16:00:00,2019-09-04T16:00,2019,9,29.1,0.2,Drizzle
07/27/2019,13:00,40.632027,-73.90439,BROOKLYN,1.0,0.0,0,0,0,0,1,0,4183083,2019-07-27 13:00:00,2019-07-27T13:00,2019,7,26.1,0.0,Clear
06/20/2019,20:00,40.593075,-73.966934,BROOKLYN,2.0,0.0,2,0,0,0,0,0,4155585,2019-06-20 20:00:00,2019-06-20T20:00,2019,6,22.6,0.1,Drizzle
07/05/2019,0:00,40.665344,-73.933815,BROOKLYN,2.0,0.0,0,0,0,0,2,0,4164986,2019-07-05 00:00:00,2019-07-05T00:00,2019,7,20.9,0.0,Cloudy
08/09/2019,8:00,40.63692,-73.93752,BROOKLYN,0.0,0.0,0,0,0,0,0,0,4185795,2019-08-09 08:00:00,2019-08-09T08:00,2019,8,24.2,0.0,Clear
08/30/2019,19:00,40.65136,-73.86971,BROOKLYN,1.0,0.0,1,0,0,0,0,0,4197612,2019-08-30 19:00:00,2019-08-30T19:00,2019,8,23.6,0.0,Clear
04/29/2019,9:00,40.63255,-73.93318,BROOKLYN,2.0,0.0,0,0,0,0,2,0,4122463,2019-04-29 09:00:00,2019-04-29T09:00,2019,4,9.8,0.0,Clear
03/26/2019,0:00,40.65055,-73.902245,BROOKLYN,0.0,0.0,0,0,0,0,0,0,4111733,2019-03-26 00:00:00,2019-03-26T00:00,2019,3,3.2,0.0,Cloudy
11/03/2019,15:00,40.652473,-73.920395,BROOKLYN,0.0,0.0,0,0,0,0,0,0,4234359,2019-11-03 15:00:00,2019-11-03T15:00,2019,11,10.8,0.0,Cloudy
06/25/2019,19:00,40.62451,-73.98831,BROOKLYN,1.0,0.0,0,0,0,0,1,0,4159845,2019-06-25 19:00:00,2019-06-25T19:00,2019,6,24.0,0.0,Cloudy
12/01/2019,18:00,40.68693,-73.95089,BROOKLYN,1.0,0.0,1,0,0,0,0,0,4251465,2019-12-01 18:00:00,2019-12-01T18:00,2019,12,4.9,3.9,Heavy Rain
12/21/2019,21:00,40.64789,-73.91072,BROOKLYN,0.0,0.0,0,0,0,0,0,0,4265886,2019-12-21 21:00:00,2019-12-21T21:00,2019,12,-0.0,0.0,Clear
09/03/2019,10:00,40.642445,-74.00592,BROOKLYN,1.0,0.0,0,0,1,0,0,0,4199664,2019-09-03 10:00:00,2019-09-03T10:00,2019,9,23.4,0.0,Clear
05/01/2019,20:00,40.620964,-73.98707,BROOKLYN,0.0,0.0,0,0,0,0,0,0,4128410,2019-05-01 20:00:00,2019-05-01T20:00,2019,5,9.8,0.0,Cloudy
07/23/2019,12:00,40.656693,-73.89464,BROOKLYN,1.0,0.0,0,0,1,0,0,0,4186864,2019-07-23 12:00:00,2019-07-23T12:00,2019,7,23.6,0.0,Cloudy
02/11/2019,13:00,40.64891,-73.89256,BROOKLYN,1.0,0.0,0,0,0,0,1,0,4079318,2019-02-11 13:00:00,2019-02-11T13:00,2019,2,2.5,0.0,Cloudy
03/24/2019,10:00,40.60416,-73.99752,BROOKLYN,1.0,0.0,0,0,0,0,1,0,4102185,2019-03-24 10:00:00,2019-03-24T10:00,2019,3,6.8,0.0,Clear
05/03/2019,5:00,40.69816,-73.92528,BROOKLYN,1.0,0.0,1,0,0,0,0,0,4124691,2019-05-03 05:00:00,2019-05-03T05:00,2019,5,9.3,0.0,Cloudy
10/15/2019,15:00,40.686504,-73.874954,BROOKLYN,1.0,0.0,0,0,0,0,1,0,4224738,2019-10-15 15:00:00,2019-10-15T15:00,2019,10,16.8,0.0,Clear
12/20/2019,9:00,40.623104,-73.95809,BROOKLYN,3.0,0.0,0,0,0,0,3,0,4262346,2019-12-20 09:00:00,2019-12-20T09:00,2019,12,-3.6,0.0,Clear
02/17/2019,23:00,40.667168,-73.88087,BROOKLYN,1.0,0.0,1,0,0,0,0,0,4082410,2019-02-17 23:00:00,2019-02-17T23:00,2019,2,1.1,1.0,Drizzle
04/18/2019,13:00,40.628403,-74.02553,BROOKLYN,1.0,0.0,1,0,0,0,0,0,4116940,2019-04-18 13:00:00,2019-04-18T13:00,2019,4,14.9,0.0,Cloudy
12/02/2019,0:00,40.65342,-73.93056,BROOKLYN,2.0,0.0,0,0,0,0,2,0,4251705,2019-12-02 00:00:00,2019-12-02T00:00,2019,12,3.1,0.3,Drizzle
11/06/2019,10:00,40.643772,-73.958755,BROOKLYN,0.0,0.0,0,0,0,0,0,0,4236860,2019-11-06 10:00:00,2019-11-06T10:00,2019,11,10.0,0.0,Clear
09/30/2019,21:00,40.67628,-73.892166,BROOKLYN,0.0,0.0,0,0,0,0,0,0,4216043,2019-09-30 21:00:00,2019-09-30T21:00,2019,9,18.7,0.0,Cloudy
08/17/2019,18:00,40.721603,-73.95785,BROOKLYN,0.0,0.0,0,0,0,0,0,0,4190817,2019-08-17 18:00:00,2019-08-17T18:00,2019,8,25.1,0.0,Clear
01/05/2019,18:00,40.700977,-73.91782,BROOKLYN,1.0,0.0,1,0,0,0,0,0,4062778,2019-01-05 18:00:00,2019-01-05T18:00,2019,1,5.1,0.9,Drizzle
07/26/2019,0:00,40.623775,-73.93032,BROOKLYN,1.0,0.0,0,0,0,0,1,0,4181461,2019-07-26 00:00:00,2019-07-26T00:00,2019,7,21.9,0.0,Clear
11/14/2019,8:00,40.640553,-73.91633,BROOKLYN,0.0,0.0,0,0,0,0,0,0,4242970,2019-11-14 08:00:00,2019-11-14T08:00,2019,11,-0.6,0.0,Cloudy
06/27/2019,14:00,40.714535,-73.9373,BROOKLYN,1.0,0.0,0,0,0,0,1,0,4160553,2019-06-27 14:00:00,2019-06-27T14:00,2019,6,30.8,0.0,Cloudy
11/17/2019,17:00,40.682106,-73.909065,BROOKLYN,1.0,0.0,0,0,1,0,0,0,4243928,2019-11-17 17:00:00,2019-11-17T17:00,2019,11,4.2,0.0,Cloudy
03/26/2019,13:00,40.668167,-73.97721,BROOKLYN,0.0,0.0,0,0,0,0,0,0,4103843,2019-03-26 13:00:00,2019-03-26T13:00,2019,3,6.8,0.0,Clear
04/26/2019,13:00,40.64043,-73.95624,BROOKLYN,2.0,0.0,0,0,0,0,2,0,4121073,2019-04-26 13:00:00,2019-04-26T13:00,2019,4,14.4,1.6,Light Rain
08/26/2019,8:00,40.610523,-73.981186,BROOKLYN,1.0,0.0,1,0,0,0,0,0,4194924,2019-08-26 08:00:00,2019-08-26T08:00,2019,8,17.7,0.0,Cloudy
07/08/2019,11:00,40.71147,-73.9439,BROOKLYN,1.0,0.0,1,0,0,0,0,0,4166848,2019-07-08 11:00:00,2019-07-08T11:00,2019,7,20.8,0.6,Drizzle
12/15/2019,0:00,40.61584,-73.95749,BROOKLYN,0.0,0.0,0,0,0,0,0,0,4258309,2019-12-15 00:00:00,2019-12-15T00:00,2019,12,6.0,0.0,Cloudy
09/30/2019,18:00,40.670254,-73.992035,BROOKLYN,1.0,0.0,0,0,0,0,1,0,4215595,2019-09-30 18:00:00,2019-09-30T18:00,2019,9,18.4,0.0,Cloudy
05/07/2019,9:00,40.632095,-73.91861,BROOKLYN,1.0,0.0,0,0,0,0,1,0,4145770,2019-05-07 09:00:00,2019-05-07T09:00,2019,5,13.1,0.0,Cloudy
12/11/2019,10:00,40.608814,-73.973,BROOKLYN,0.0,0.0,0,0,0,0,0,0,4256208,2019-12-11 10:00:00,2019-12-11T10:00,2019,12,1.3,0.3,Heavy Snow
04/15/2019,12:00,40.57992,-73.9751,BROOKLYN,0.0,0.0,0,0,0,0,0,0,4115462,2019-04-15 12:00:00,2019-04-15T12:00,2019,4,12.1,0.8,Drizzle
04/06/2019,9:00,40.66223,-73.93997,BROOKLYN,1.0,0.0,1,0,0,0,0,0,4110256,2019-04-06 09:00:00,2019-04-06T09:00,2019,4,7.9,0.0,Cloudy
07/31/2019,17:00,40.647675,-73.95217,BROOKLYN,2.0,0.0,0,0,0,0,2,0,4180559,2019-07-31 17:00:00,2019-07-31T17:00,2019,7,25.7,0.0,Cloudy
08/20/2019,8:00,40.620464,-73.93589,BROOKLYN,0.0,0.0,0,0,0,0,0,0,4194468,2019-08-20 08:00:00,2019-08-20T08:00,2019,8,25.9,0.0,Cloudy
10/01/2019,17:00,40.61417,-73.97269,BROOKLYN,0.0,0.0,0,0,0,0,0,0,4216853,2019-10-01 17:00:00,2019-10-01T17:00,2019,10,22.9,0.0,Clear
01/28/2019,9:00,40.686115,-73.86992,BROOKLYN,1.0,0.0,0,0,0,0,1,0,4070579,2019-01-28 09:00:00,2019-01-28T09:00,2019,1,-3.1,0.0,Cloudy
10/18/2019,9:00,40.67379,-73.98587,BROOKLYN,1.0,0.0,0,0,1,0,0,0,4226475,2019-10-18 09:00:00,2019-10-18T09:00,2019,10,12.4,0.0,Cloudy
05/13/2019,12:00,40.72736,-73.94883,BROOKLYN,0.0,0.0,0,0,0,0,0,0,4130987,2019-05-13 12:00:00,2019-05-13T12:00,2019,5,10.4,0.2,Drizzle
02/22/2019,0:00,40.576385,-73.96718,BROOKLYN,1.0,0.0,1,0,0,0,0,0,4086530,2019-02-22 00:00:00,2019-02-22T00:00,2019,2,3.3,0.0,Cloudy
05/25/2019,21:00,40.671898,-73.92231,BROOKLYN,2.0,0.0,0,0,0,0,2,0,4138971,2019-05-25 21:00:00,2019-05-25T21:00,2019,5,14.6,0.9,Drizzle
12/18/2019,22:00,40.667835,-73.89484,BROOKLYN,3.0,0.0,0,0,0,0,3,0,4260911,2019-12-18 22:00:00,2019-12-18T22:00,2019,12,-4.0,0.0,Clear
06/22/2019,22:00,40.640167,-73.95713,BROOKLYN,0.0,0.0,0,0,0,0,0,0,4156461,2019-06-22 22:00:00,2019-06-22T22:00,2019,6,18.9,0.0,Clear
07/28/2019,11:00,40.655987,-74.002686,BROOKLYN,1.0,0.0,0,0,1,0,0,0,4179276,2019-07-28 11:00:00,2019-07-28T11:00,2019,7,29.5,0.0,Clear
08/18/2019,3:00,40.691742,-73.9287,BROOKLYN,1.0,0.0,0,0,0,0,1,0,4191327,2019-08-18 03:00:00,2019-08-18T03:00,2019,8,23.5,0.0,Cloudy
08/30/2019,15:00,40.66617,-73.988815,BROOKLYN,0.0,0.0,0,0,0,0,0,0,4198180,2019-08-30 15:00:00,2019-08-30T15:00,2019,8,28.6,0.0,Cloudy
12/18/2019,21:00,40.643642,-73.94882,BROOKLYN,0.0,0.0,0,0,0,0,0,0,4262103,2019-12-18 21:00:00,2019-12-18T21:00,2019,12,-2.7,0.1,Light Snow
07/30/2019,8:00,40.664516,-73.93152,BROOKLYN,1.0,0.0,0,0,0,0,1,0,4181792,2019-07-30 08:00:00,2019-07-30T08:00,2019,7,27.4,0.0,Clear
07/01/2019,13:00,40.67684,-73.8942,BROOKLYN,0.0,0.0,0,0,0,0,0,0,4164733,2019-07-01 13:00:00,2019-07-01T13:00,2019,7,28.3,0.0,Clear
03/05/2019,14:00,40.694687,-73.95521,BROOKLYN,0.0,0.0,0,0,0,0,0,0,4092123,2019-03-05 14:00:00,2019-03-05T14:00,2019,3,-0.5,0.0,Clear
03/15/2019,10:00,40.655106,-73.955246,BROOKLYN,0.0,0.0,0,0,0,0,0,0,4108112,2019-03-15 10:00:00,2019-03-15T10:00,2019,3,16.0,0.0,Cloudy
03/01/2019,12:00,40.578983,-73.95842,BROOKLYN,1.0,0.0,1,0,0,0,0,0,4090564,2019-03-01 12:00:00,2019-03-01T12:00,2019,3,1.4,0.0,Cloudy
09/28/2019,17:00,40.667027,-73.9952,BROOKLYN,0.0,0.0,0,0,0,0,0,0,4214106,2019-09-28 17:00:00,2019-09-28T17:00,2019,9,24.6,0.0,Clear
07/05/2019,17:00,40.69461,-73.94269,BROOKLYN,0.0,0.0,0,0,0,0,0,0,4165937,2019-07-05 17:00:00,2019-07-05T17:00,2019,7,25.6,0.0,Cloudy
05/19/2019,12:00,40.69286,-73.95157,BROOKLYN,0.0,0.0,0,0,0,0,0,0,4134863,2019-05-19 12:00:00,2019-05-19T12:00,2019,5,19.2,0.0,Cloudy
06/04/2019,18:00,40.720444,-73.942726,BROOKLYN,0.0,0.0,0,0,0,0,0,0,4145587,2019-06-04 18:00:00,2019-06-04T18:00,2019,6,18.6,0.0,Cloudy
11/01/2019,17:00,40.63969,-73.95321,BROOKLYN,0.0,0.0,0,0,0,0,0,0,4234336,2019-11-01 17:00:00,2019-11-01T17:00,2019,11,10.2,0.0,Clear
10/14/2019,13:00,40.677773,-73.93587,BROOKLYN,1.0,0.0,0,0,0,0,1,0,4223557,2019-10-14 13:00:00,2019-10-14T13:00,2019,10,20.9,0.0,Clear
08/07/2019,0:00,40.657665,-73.89705,BROOKLYN,1.0,0.0,0,0,0,0,1,0,4186650,2019-08-07 00:00:00,2019-08-07T00:00,2019,8,23.7,0.0,Clear
10/29/2019,11:00,40.717068,-73.96309,BROOKLYN,2.0,0.0,0,0,0,0,2,0,4231910,2019-10-29 11:00:00,2019-10-29T11:00,2019,10,15.0,0.1,Drizzle
05/29/2019,13:00,40.586414,-73.93921,BROOKLYN,1.0,0.0,0,0,0,0,1,0,4141373,2019-05-29 13:00:00,2019-05-29T13:00,2019,5,16.4,0.0,Cloudy
09/17/2019,19:00,40.60288,-73.95624,BROOKLYN,0.0,0.0,0,0,0,0,0,0,4208918,2019-09-17 19:00:00,2019-09-17T19:00,2019,9,20.0,0.0,Clear
02/02/2019,18:00,40.607258,-73.96727,BROOKLYN,1.0,0.0,0,0,1,0,0,0,4074177,2019-02-02 18:00:00,2019-02-02T18:00,2019,2,0.6,0.0,Clear
09/29/2019,2:00,40.712288,-73.92731,BROOKLYN,0.0,0.0,0,0,0,0,0,0,4215000,2019-09-29 02:00:00,2019-09-29T02:00,2019,9,20.8,0.0,Clear
03/11/2019,17:00,40.699863,-73.9559,BROOKLYN,1.0,0.0,0,0,0,0,1,0,4095176,2019-03-11 17:00:00,2019-03-11T17:00,2019,3,9.6,0.0,Clear
01/12/2019,6:00,40.652462,-73.92285,BROOKLYN,1.0,0.0,0,0,0,0,1,0,4066125,2019-01-12 06:00:00,2019-01-12T06:00,2019,1,-6.0,0.0,Cloudy
05/28/2019,15:00,40.59476,-73.98199,BROOKLYN,1.0,0.0,0,0,0,0,1,0,4141736,2019-05-28 15:00:00,2019-05-28T15:00,2019,5,19.0,0.0,Cloudy
12/03/2019,14:00,40.6379,-73.90085,BROOKLYN,2.0,0.0,0,0,0,0,2,0,4252189,2019-12-03 14:00:00,2019-12-03T14:00,2019,12,3.3,0.0,Clear
11/01/2019,6:00,40.698048,-73.95497,BROOKLYN,0.0,0.0,0,0,0,0,0,0,4234677,2019-11-01 06:00:00,2019-11-01T06:00,2019,11,7.3,0.0,Clear
03/22/2019,17:00,40.63175,-73.97737,BROOKLYN,0.0,0.0,0,0,0,0,0,0,4102551,2019-03-22 17:00:00,2019-03-22T17:00,2019,3,9.1,0.0,Clear
09/06/2019,12:00,40.673206,-73.86896,BROOKLYN,2.0,0.0,2,0,0,0,0,0,4203278,2019-09-06 12:00:00,2019-09-06T12:00,2019,9,19.8,0.7,Drizzle
07/06/2019,2:00,40.65661,-73.93091,BROOKLYN,1.0,0.0,0,0,0,0,1,0,4165642,2019-07-06 02:00:00,2019-07-06T02:00,2019,7,24.0,0.0,Cloudy
05/27/2019,16:00,40.652637,-73.96017,BROOKLYN,2.0,0.0,0,0,0,0,2,0,4141374,2019-05-27 16:00:00,2019-05-27T16:00,2019,5,24.9,0.0,Cloudy
08/06/2019,3:00,40.628845,-73.991394,BROOKLYN,1.0,0.0,0,0,1,0,0,0,4185105,2019-08-06 03:00:00,2019-08-06T03:00,2019,8,22.3,0.0,Cloudy
12/03/2019,17:00,40.677822,-73.91636,BROOKLYN,0.0,0.0,0,0,0,0,0,0,4251906,2019-12-03 17:00:00,2019-12-03T17:00,2019,12,1.6,0.0,Clear
07/16/2019,19:00,40.67195,-73.91693,BROOKLYN,0.0,0.0,0,0,0,0,0,0,4173546,2019-07-16 19:00:00,2019-07-16T19:00,2019,7,27.3,0.0,Cloudy
07/02/2019,21:00,40.702457,-73.98764,BROOKLYN,1.0,0.0,0,0,0,0,1,0,4163590,2019-07-02 21:00:00,2019-07-02T21:00,2019,7,24.5,0.0,Cloudy
06/05/2019,1:00,40.62595,-73.925674,BROOKLYN,1.0,0.0,0,0,0,0,1,0,4146721,2019-06-05 01:00:00,2019-06-05T01:00,2019,6,17.4,0.0,Clear
03/12/2019,0:00,40.676342,-73.910934,BROOKLYN,2.0,0.0,0,0,0,0,2,0,4095757,2019-03-12 00:00:00,2019-03-12T00:00,2019,3,2.1,0.0,Clear
06/19/2019,13:00,40.68432,-73.967064,BROOKLYN,1.0,0.0,0,0,0,0,1,0,4170724,2019-06-19 13:00:00,2019-06-19T13:00,2019,6,20.5,1.0,Drizzle
07/19/2019,14:00,40.63529,-73.958206,BROOKLYN,2.0,0.0,0,0,0,0,2,0,4173854,2019-07-19 14:00:00,2019-07-19T14:00,2019,7,29.2,0.0,Clear
01/06/2019,4:00,40.675434,-73.97797,BROOKLYN,0.0,0.0,0,0,0,0,0,0,4062783,2019-01-06 04:00:00,2019-01-06T04:00,2019,1,1.7,0.0,Clear
04/03/2019,17:00,40.63396,-74.01476,BROOKLYN,0.0,0.0,0,0,0,0,0,0,4108146,2019-04-03 17:00:00,2019-04-03T17:00,2019,4,15.1,0.0,Clear
07/25/2019,0:00,40.63811,-73.95467,BROOKLYN,1.0,0.0,0,0,0,0,1,0,4176969,2019-07-25 00:00:00,2019-07-25T00:00,2019,7,21.8,0.0,Clear
07/23/2019,0:00,40.676785,-73.975,BROOKLYN,1.0,0.0,0,0,0,0,1,0,4175924,2019-07-23 00:00:00,2019-07-23T00:00,2019,7,23.2,3.7,Heavy Rain
04/15/2019,17:00,40.677658,-73.89837,BROOKLYN,0.0,0.0,0,0,0,0,0,0,4115574,2019-04-15 17:00:00,2019-04-15T17:00,2019,4,10.6,0.0,Cloudy
10/21/2019,16:00,40.61879,-73.99426,BROOKLYN,2.0,0.0,0,0,0,0,2,0,4227157,2019-10-21 16:00:00,2019-10-21T16:00,2019,10,17.2,0.0,Clear
01/01/2019,19:00,40.589237,-73.96245,BROOKLYN,0.0,0.0,0,0,0,0,0,0,4060648,2019-01-01 19:00:00,2019-01-01T19:00,2019,1,6.0,0.0,Cloudy
10/11/2019,20:00,40.618324,-73.95719,BROOKLYN,1.0,0.0,1,0,0,0,0,0,4223040,2019-10-11 20:00:00,2019-10-11T20:00,2019,10,15.2,0.0,Cloudy
06/07/2019,0:00,40.669067,-73.86555,BROOKLYN,1.0,0.0,1,0,0,0,0,0,4148309,2019-06-07 00:00:00,2019-06-07T00:00,2019,6,18.9,0.0,Cloudy
09/28/2019,20:00,40.7086,-73.93768,BROOKLYN,0.0,0.0,0,0,0,0,0,0,4214978,2019-09-28 20:00:00,2019-09-28T20:00,2019,9,22.8,0.0,Cloudy
11/19/2019,10:00,40.613617,-73.95306,BROOKLYN,0.0,0.0,0,0,0,0,0,0,4243816,2019-11-19 10:00:00,2019-11-19T10:00,2019,11,7.3,0.0,Cloudy
04/16/2019,18:00,40.649654,-73.92047,BROOKLYN,1.0,0.0,0,0,1,0,0,0,4115973,2019-04-16 18:00:00,2019-04-16T18:00,2019,4,14.9,0.0,Clear
02/25/2019,12:00,40.669823,-73.90981,BROOKLYN,1.0,0.0,0,0,0,0,1,0,4087715,2019-02-25 12:00:00,2019-02-25T12:00,2019,2,2.5,0.0,Cloudy
05/25/2019,6:00,40.693382,-73.99946,BROOKLYN,0.0,0.0,0,0,0,0,0,0,4138474,2019-05-25 06:00:00,2019-05-25T06:00,2019,5,14.1,0.0,Clear
06/19/2019,18:00,40.708168,-73.95067,BROOKLYN,1.0,0.0,1,0,0,0,0,0,4154816,2019-06-19 18:00:00,2019-06-19T18:00,2019,6,20.5,2.4,Light Rain
08/03/2019,22:00,40.67745,-73.89884,BROOKLYN,1.0,0.0,0,0,0,0,1,0,4186372,2019-08-03 22:00:00,2019-08-03T22:00,2019,8,23.7,0.1,Drizzle
05/16/2019,0:00,40.659794,-73.98088,BROOKLYN,1.0,0.0,0,0,0,0,1,0,4133097,2019-05-16 00:00:00,2019-05-16T00:00,2019,5,11.6,0.0,Cloudy
11/20/2019,14:00,40.66925,-73.93944,BROOKLYN,1.0,0.0,0,0,0,0,1,0,4250166,2019-11-20 14:00:00,2019-11-20T14:00,2019,11,7.1,0.0,Cloudy
06/04/2019,19:00,40.588512,-73.949356,BROOKLYN,1.0,0.0,0,0,1,0,0,0,4145185,2019-06-04 19:00:00,2019-06-04T19:00,2019,6,18.8,0.0,Cloudy
07/02/2019,8:00,40.707973,-73.930855,BROOKLYN,1.0,0.0,0,0,0,0,1,0,4166846,2019-07-02 08:00:00,2019-07-02T08:00,2019,7,24.8,0.0,Clear
09/24/2019,19:00,40.622047,-74.03165,BROOKLYN,1.0,0.0,1,0,0,0,0,0,4211875,2019-09-24 19:00:00,2019-09-24T19:00,2019,9,20.1,0.0,Clear
02/14/2019,19:00,40.73068,-73.94923,BROOKLYN,1.0,0.0,0,0,0,0,1,0,4080996,2019-02-14 19:00:00,2019-02-14T19:00,2019,2,0.5,0.0,Cloudy
01/05/2019,18:00,40.624496,-73.945435,BROOKLYN,1.0,0.0,1,0,0,0,0,0,4062608,2019-01-05 18:00:00,2019-01-05T18:00,2019,1,5.4,0.8,Drizzle
06/28/2019,0:00,40.689243,-73.98873,BROOKLYN,1.0,0.0,0,0,0,0,1,0,4161578,2019-06-28 00:00:00,2019-06-28T00:00,2019,6,20.6,0.0,Cloudy
02/26/2019,23:00,40.701103,-73.92239,BROOKLYN,1.0,0.0,1,0,0,0,0,0,4087426,2019-02-26 23:00:00,2019-02-26T23:00,2019,2,-3.4,0.0,Cloudy
11/14/2019,0:00,40.595642,-73.99676,BROOKLYN,1.0,0.0,1,0,0,0,0,0,4241379,2019-11-14 00:00:00,2019-11-14T00:00,2019,11,-2.4,0.0,Cloudy
02/06/2019,17:00,40.634483,-74.02785,BROOKLYN,0.0,0.0,0,0,0,0,0,0,4076064,2019-02-06 17:00:00,2019-02-06T17:00,2019,2,3.8,0.0,Cloudy
10/25/2019,17:00,40.678566,-73.98778,BROOKLYN,1.0,0.0,1,0,0,0,0,0,4230290,2019-10-25 17:00:00,2019-10-25T17:00,2019,10,14.7,0.0,Cloudy
06/29/2019,18:00,40.578465,-74.00027,BROOKLYN,0.0,0.0,0,0,0,0,0,0,4162251,2019-06-29 18:00:00,2019-06-29T18:00,2019,6,26.4,0.0,Cloudy
02/24/2019,21:00,40.67189,-73.895874,BROOKLYN,0.0,0.0,0,0,0,0,0,0,4086339,2019-02-24 21:00:00,2019-02-24T21:00,2019,2,7.8,0.0,Clear
04/22/2019,17:00,40.675076,-73.98801,BROOKLYN,1.0,0.0,1,0,0,0,0,0,4119209,2019-04-22 17:00:00,2019-04-22T17:00,2019,4,14.9,0.8,Drizzle
02/25/2019,10:00,40.69926,-73.98854,BROOKLYN,0.0,0.0,0,0,0,0,0,0,4086922,2019-02-25 10:00:00,2019-02-25T10:00,2019,2,3.0,0.0,Cloudy
07/28/2019,17:00,40.64195,-73.932274,BROOKLYN,0.0,0.0,0,0,0,0,0,0,4178608,2019-07-28 17:00:00,2019-07-28T17:00,2019,7,29.6,0.0,Clear
02/26/2019,13:00,40.64777,-74.01474,BROOKLYN,0.0,0.0,0,0,0,0,0,0,4087251,2019-02-26 13:00:00,2019-02-26T13:00,2019,2,3.0,0.0,Clear
12/16/2019,21:00,40.69484,-73.98391,BROOKLYN,1.0,0.0,0,0,0,0,1,0,4259274,2019-12-16 21:00:00,2019-12-16T21:00,2019,12,0.7,0.5,Heavy Snow
03/31/2019,0:00,40.696198,-73.98869,BROOKLYN,0.0,0.0,0,0,0,0,0,0,4107782,2019-03-31 00:00:00,2019-03-31T00:00,2019,3,11.5,0.0,Cloudy
07/08/2019,15:00,40.59727,-73.99868,BROOKLYN,1.0,0.0,0,0,0,0,1,0,4167224,2019-07-08 15:00:00,2019-07-08T15:00,2019,7,22.4,0.0,Cloudy
11/18/2019,7:00,40.585575,-73.951675,BROOKLYN,1.0,0.0,0,0,1,0,0,0,4242926,2019-11-18 07:00:00,2019-11-18T07:00,2019,11,3.2,0.0,Cloudy
12/02/2019,12:00,40.64615,-73.93249,BROOKLYN,0.0,0.0,0,0,0,0,0,0,4251701,2019-12-02 12:00:00,2019-12-02T12:00,2019,12,1.3,1.1,Heavy Snow
09/27/2019,18:00,40.64353,-73.9796,BROOKLYN,1.0,0.0,0,0,0,0,1,0,4215025,2019-09-27 18:00:00,2019-09-27T18:00,2019,9,18.9,0.0,Clear
04/13/2019,2:00,40.643158,-73.91796,BROOKLYN,1.0,0.0,0,0,0,0,1,0,4114851,2019-04-13 02:00:00,2019-04-13T02:00,2019,4,14.3,0.8,Drizzle
04/12/2019,6:00,40.714066,-73.94938,BROOKLYN,0.0,0.0,0,0,0,0,0,0,4113983,2019-04-12 06:00:00,2019-04-12T06:00,2019,4,7.7,0.0,Cloudy
03/17/2019,0:00,40.57918,-73.95047,BROOKLYN,0.0,0.0,0,0,0,0,0,0,4098472,2019-03-17 00:00:00,2019-03-17T00:00,2019,3,1.6,0.0,Clear
02/01/2019,19:00,40.677414,-73.98305,BROOKLYN,0.0,0.0,0,0,0,0,0,0,4074068,2019-02-01 19:00:00,2019-02-01T19:00,2019,2,-7.2,0.0,Clear
06/04/2019,16:00,40.597595,-73.978745,BROOKLYN,0.0,0.0,0,0,0,0,0,0,4147893,2019-06-04 16:00:00,2019-06-04T16:00,2019,6,18.5,0.0,Cloudy
11/01/2019,17:00,40.67816,-73.897484,BROOKLYN,1.0,0.0,0,0,0,0,1,0,4234153,2019-11-01 17:00:00,2019-11-01T17:00,2019,11,10.1,0.0,Clear
06/27/2019,8:00,40.642113,-73.90307,BROOKLYN,0.0,0.0,0,0,0,0,0,0,4160423,2019-06-27 08:00:00,2019-06-27T08:00,2019,6,25.8,0.0,Cloudy
05/06/2019,20:00,40.686428,-73.935745,BROOKLYN,1.0,0.0,1,0,0,0,0,0,4126960,2019-05-06 20:00:00,2019-05-06T20:00,2019,5,11.7,0.0,Clear
04/03/2019,15:00,40.61684,-74.01239,BROOKLYN,1.0,0.0,0,0,0,0,1,0,4108138,2019-04-03 15:00:00,2019-04-03T15:00,2019,4,15.9,0.0,Clear
09/07/2019,23:00,40.688976,-73.9132,BROOKLYN,1.0,0.0,0,0,0,0,1,0,4210838,2019-09-07 23:00:00,2019-09-07T23:00,2019,9,17.8,0.0,Clear
06/28/2019,17:00,40.73046,-73.9515,BROOKLYN,0.0,0.0,0,0,0,0,0,0,4162445,2019-06-28 17:00:00,2019-06-28T17:00,2019,6,27.9,0.0,Clear
08/26/2019,13:00,40.659363,-73.93967,BROOKLYN,2.0,0.0,0,0,0,0,2,0,4195203,2019-08-26 13:00:00,2019-08-26T13:00,2019,8,22.4,0.0,Clear
03/24/2019,14:00,40.693634,-73.94469,BROOKLYN,0.0,0.0,0,0,0,0,0,0,4102482,2019-03-24 14:00:00,2019-03-24T14:00,2019,3,13.1,0.0,Cloudy
04/03/2019,15:00,40.59783,-73.965485,BROOKLYN,0.0,0.0,0,0,0,0,0,0,4109375,2019-04-03 15:00:00,2019-04-03T15:00,2019,4,16.0,0.0,Clear
07/29/2019,11:00,40.66278,-73.88086,BROOKLYN,1.0,0.0,1,0,0,0,0,0,4181488,2019-07-29 11:00:00,2019-07-29T11:00,2019,7,30.7,0.0,Clear
11/02/2019,0:00,40.69746,-73.99303,BROOKLYN,1.0,0.0,1,0,0,0,0,0,4244375,2019-11-02 00:00:00,2019-11-02T00:00,2019,11,6.0,0.0,Clear
09/24/2019,14:00,40.644615,-73.962166,BROOKLYN,1.0,0.0,0,0,1,0,0,0,4211721,2019-09-24 14:00:00,2019-09-24T14:00,2019,9,25.3,0.0,Cloudy
12/20/2019,10:00,40.632633,-74.01254,BROOKLYN,1.0,0.0,0,0,0,0,1,0,4261654,2019-12-20 10:00:00,2019-12-20T10:00,2019,12,-2.7,0.0,Clear
11/01/2019,13:00,40.615654,-74.031296,BROOKLYN,0.0,0.0,0,0,0,0,0,0,4233365,2019-11-01 13:00:00,2019-11-01T13:00,2019,11,12.0,0.0,Clear
10/29/2019,20:00,40.697075,-73.93185,BROOKLYN,1.0,0.0,0,0,1,0,0,0,4232185,2019-10-29 20:00:00,2019-10-29T20:00,2019,10,14.7,0.2,Drizzle
12/04/2019,7:00,40.626347,-73.95545,BROOKLYN,0.0,0.0,0,0,0,0,0,0,4252649,2019-12-04 07:00:00,2019-12-04T07:00,2019,12,2.0,0.0,Cloudy
01/02/2019,13:00,40.68459,-73.989136,BROOKLYN,1.0,0.0,0,0,1,0,0,0,4061110,2019-01-02 13:00:00,2019-01-02T13:00,2019,1,3.6,0.0,Cloudy
01/08/2019,14:00,40.6224,-73.936646,BROOKLYN,1.0,0.0,0,0,0,0,1,0,4064248,2019-01-08 14:00:00,2019-01-08T14:00,2019,1,7.3,0.0,Cloudy
09/03/2019,17:00,40.700733,-73.98974,BROOKLYN,1.0,0.0,0,0,0,0,1,0,4199590,2019-09-03 17:00:00,2019-09-03T17:00,2019,9,24.0,0.0,Clear
10/14/2019,20:00,40.583668,-73.94339,BROOKLYN,1.0,0.0,0,0,1,0,0,0,4223279,2019-10-14 20:00:00,2019-10-14T20:00,2019,10,17.1,0.0,Clear
09/16/2019,20:00,40.657,-73.91403,BROOKLYN,1.0,0.0,1,0,0,0,0,0,4207560,2019-09-16 20:00:00,2019-09-16T20:00,2019,9,20.9,0.4,Drizzle
11/06/2019,19:00,40.64664,-73.9246,BROOKLYN,1.0,0.0,1,0,0,0,0,0,4237162,2019-11-06 19:00:00,2019-11-06T19:00,2019,11,8.8,0.0,Clear
02/08/2019,15:00,40.650852,-73.95885,BROOKLYN,0.0,0.0,0,0,0,0,0,0,4077294,2019-02-08 15:00:00,2019-02-08T15:00,2019,2,10.8,0.0,Clear
09/22/2019,18:00,40.661995,-73.91959,BROOKLYN,1.0,0.0,1,0,0,0,0,0,4210345,2019-09-22 18:00:00,2019-09-22T18:00,2019,9,23.6,0.0,Cloudy
11/30/2019,19:00,40.68984,-73.945206,BROOKLYN,1.0,0.0,1,0,0,0,0,0,4250671,2019-11-30 19:00:00,2019-11-30T19:00,2019,11,0.6,0.0,Cloudy
05/22/2019,19:00,40.668636,-73.87028,BROOKLYN,2.0,0.0,0,0,0,0,2,0,4137141,2019-05-22 19:00:00,2019-05-22T19:00,2019,5,15.7,0.0,Cloudy
02/26/2019,17:00,40.586056,-73.97178,BROOKLYN,1.0,0.0,0,0,0,0,1,0,4087701,2019-02-26 17:00:00,2019-02-26T17:00,2019,2,2.5,0.0,Clear
10/23/2019,0:00,40.667603,-73.881836,BROOKLYN,1.0,0.0,1,0,0,0,0,0,4228534,2019-10-23 00:00:00,2019-10-23T00:00,2019,10,17.2,1.7,Light Rain
03/04/2019,12:00,40.682907,-73.99306,BROOKLYN,1.0,0.0,0,0,1,0,0,0,4095341,2019-03-04 12:00:00,2019-03-04T12:00,2019,3,1.7,0.0,Clear
02/12/2019,12:00,40.68821,-73.96583,BROOKLYN,1.0,0.0,0,0,0,0,1,0,4081624,2019-02-12 12:00:00,2019-02-12T12:00,2019,2,-1.8,1.7,Heavy Snow
04/03/2019,9:00,40.64604,-73.8819,BROOKLYN,0.0,0.0,0,0,0,0,0,0,4108248,2019-04-03 09:00:00,2019-04-03T09:00,2019,4,9.2,0.0,Clear
10/31/2019,0:00,40.594692,-73.94279,BROOKLYN,1.0,0.0,1,0,0,0,0,0,4232795,2019-10-31 00:00:00,2019-10-31T00:00,2019,10,16.1,0.3,Drizzle
02/12/2019,23:00,40.599697,-73.948524,BROOKLYN,1.0,0.0,1,0,0,0,0,0,4080327,2019-02-12 23:00:00,2019-02-12T23:00,2019,2,2.9,1.0,Drizzle
11/08/2019,21:00,40.647156,-73.95211,BROOKLYN,0.0,0.0,0,0,0,0,0,0,4238423,2019-11-08 21:00:00,2019-11-08T21:00,2019,11,-0.1,0.0,Clear
12/02/2019,18:00,40.652622,-73.95026,BROOKLYN,1.0,0.0,1,0,0,0,0,0,4251691,2019-12-02 18:00:00,2019-12-02T18:00,2019,12,0.6,0.7,Heavy Snow
06/17/2019,18:00,40.589153,-73.95071,BROOKLYN,1.0,0.0,0,0,0,0,1,0,4153548,2019-06-17 18:00:00,2019-06-17T18:00,2019,6,20.5,0.1,Drizzle
05/12/2019,8:00,40.63393,-73.89396,BROOKLYN,3.0,0.0,0,0,0,0,3,0,4130360,2019-05-12 08:00:00,2019-05-12T08:00,2019,5,9.4,1.4,Light Rain
03/20/2019,11:00,40.71196,-73.9407,BROOKLYN,0.0,0.0,0,0,0,0,0,0,4100405,2019-03-20 11:00:00,2019-03-20T11:00,2019,3,8.3,0.0,Clear
05/13/2019,15:00,40.687088,-73.962555,BROOKLYN,1.0,0.0,1,0,0,0,0,0,4131302,2019-05-13 15:00:00,2019-05-13T15:00,2019,5,10.5,0.9,Drizzle
09/21/2019,14:00,40.678917,-73.92462,BROOKLYN,0.0,0.0,0,0,0,0,0,0,4214159,2019-09-21 14:00:00,2019-09-21T14:00,2019,9,26.9,0.0,Clear
07/08/2019,18:00,40.698,-73.97479,BROOKLYN,2.0,0.0,0,0,0,0,2,0,4166628,2019-07-08 18:00:00,2019-07-08T18:00,2019,7,22.5,0.0,Clear
08/07/2019,10:00,40.656322,-73.91123,BROOKLYN,0.0,0.0,0,0,0,0,0,0,4189078,2019-08-07 10:00:00,2019-08-07T10:00,2019,8,23.5,5.3,Heavy Rain
06/29/2019,12:00,40.677162,-73.97245,BROOKLYN,0.0,0.0,0,0,0,0,0,0,4162082,2019-06-29 12:00:00,2019-06-29T12:00,2019,6,29.8,0.0,Cloudy
10/28/2019,19:00,40.607613,-74.00013,BROOKLYN,1.0,0.0,0,0,0,0,1,0,4233688,2019-10-28 19:00:00,2019-10-28T19:00,2019,10,14.2,0.0,Clear
07/31/2019,15:00,40.614788,-73.94658,BROOKLYN,2.0,0.0,0,0,0,0,2,0,4180629,2019-07-31 15:00:00,2019-07-31T15:00,2019,7,24.9,0.2,Drizzle
12/13/2019,3:00,40.64412,-73.98907,BROOKLYN,1.0,0.0,0,0,1,0,0,0,4258760,2019-12-13 03:00:00,2019-12-13T03:00,2019,12,1.7,0.0,Cloudy
07/29/2019,18:00,40.644405,-73.964096,BROOKLYN,1.0,0.0,0,0,1,0,0,0,4179649,2019-07-29 18:00:00,2019-07-29T18:00,2019,7,29.6,0.0,Clear
02/08/2019,10:00,40.66895,-73.9339,BROOKLYN,1.0,0.0,1,0,0,0,0,0,4077353,2019-02-08 10:00:00,2019-02-08T10:00,2019,2,6.5,0.4,Drizzle
09/17/2019,20:00,40.593227,-73.93276,BROOKLYN,0.0,0.0,0,0,0,0,0,0,4207697,2019-09-17 20:00:00,2019-09-17T20:00,2019,9,18.7,0.0,Clear
02/15/2019,8:00,40.634792,-74.032326,BROOKLYN,0.0,0.0,0,0,0,0,0,0,4081111,2019-02-15 08:00:00,2019-02-15T08:00,2019,2,6.6,0.0,Cloudy
06/19/2019,16:00,40.69119,-73.9978,BROOKLYN,1.0,0.0,0,0,0,0,1,0,4155355,2019-06-19 16:00:00,2019-06-19T16:00,2019,6,20.3,0.3,Drizzle
10/08/2019,8:00,40.643467,-74.02277,BROOKLYN,1.0,0.0,0,0,0,0,1,0,4219755,2019-10-08 08:00:00,2019-10-08T08:00,2019,10,15.2,0.2,Drizzle
08/11/2019,15:00,40.64884,-73.964584,BROOKLYN,1.0,0.0,1,0,0,0,0,0,4186938,2019-08-11 15:00:00,2019-08-11T15:00,2019,8,28.0,0.0,Cloudy
06/23/2019,16:00,40.62629,-74.023964,BROOKLYN,0.0,0.0,0,0,0,0,0,0,4156991,2019-06-23 16:00:00,2019-06-23T16:00,2019,6,26.4,0.0,Cloudy
03/23/2019,0:00,40.600594,-73.97275,BROOKLYN,1.0,0.0,0,0,0,0,1,0,4101846,2019-03-23 00:00:00,2019-03-23T00:00,2019,3,2.4,0.1,Drizzle
07/21/2019,0:00,40.670994,-73.95496,BROOKLYN,1.0,0.0,0,0,0,0,1,0,4174439,2019-07-21 00:00:00,2019-07-21T00:00,2019,7,27.3,0.0,Clear
01/29/2019,16:00,40.678867,-73.87087,BROOKLYN,0.0,0.0,0,0,0,0,0,0,4071538,2019-01-29 16:00:00,2019-01-29T16:00,2019,1,5.2,0.0,Cloudy
12/05/2019,6:00,40.596817,-73.955086,BROOKLYN,1.0,0.0,1,0,0,0,0,0,4252489,2019-12-05 06:00:00,2019-12-05T06:00,2019,12,1.7,0.0,Cloudy
02/22/2019,9:00,40.669655,-73.8614,BROOKLYN,1.0,0.0,0,0,0,0,1,0,4085153,2019-02-22 09:00:00,2019-02-22T09:00,2019,2,4.0,0.0,Cloudy
08/17/2019,8:00,40.676147,-73.98391,BROOKLYN,1.0,0.0,0,0,1,0,0,0,4190651,2019-08-17 08:00:00,2019-08-17T08:00,2019,8,24.1,0.0,Cloudy
10/17/2019,0:00,40.724804,-73.94937,BROOKLYN,1.0,0.0,0,0,0,0,1,0,4225021,2019-10-17 00:00:00,2019-10-17T00:00,2019,10,10.2,0.0,Clear
05/27/2019,20:00,40.666595,-73.87176,BROOKLYN,2.0,0.0,1,0,0,0,1,0,4140924,2019-05-27 20:00:00,2019-05-27T20:00,2019,5,18.7,0.0,Clear
12/12/2019,9:00,40.67897,-73.895706,BROOKLYN,0.0,0.0,0,0,0,0,0,0,4257225,2019-12-12 09:00:00,2019-12-12T09:00,2019,12,-2.0,0.0,Clear
07/01/2019,9:00,40.64544,-73.97685,BROOKLYN,1.0,0.0,0,0,0,0,1,0,4166045,2019-07-01 09:00:00,2019-07-01T09:00,2019,7,23.9,0.0,Clear
04/07/2019,14:00,40.633934,-73.93719,BROOKLYN,0.0,0.0,0,0,0,0,0,0,4110570,2019-04-07 14:00:00,2019-04-07T14:00,2019,4,13.4,0.0,Cloudy
03/15/2019,18:00,40.691948,-73.939835,BROOKLYN,1.0,0.0,0,0,0,0,1,0,4098596,2019-03-15 18:00:00,2019-03-15T18:00,2019,3,13.7,2.6,Heavy Rain
08/02/2019,20:00,40.68209,-73.94746,BROOKLYN,0.0,0.0,0,0,0,0,0,0,4200697,2019-08-02 20:00:00,2019-08-02T20:00,2019,8,23.9,0.0,Cloudy
06/25/2019,17:00,40.688152,-73.87653,BROOKLYN,3.0,0.0,0,0,0,0,3,0,4158994,2019-06-25 17:00:00,2019-06-25T17:00,2019,6,25.3,0.0,Cloudy
01/15/2019,19:00,40.666336,-73.89412,BROOKLYN,0.0,0.0,0,0,0,0,0,0,4068158,2019-01-15 19:00:00,2019-01-15T19:00,2019,1,0.2,0.0,Clear
04/03/2019,14:00,40.642864,-74.01266,BROOKLYN,0.0,0.0,0,0,0,0,0,0,4108174,2019-04-03 14:00:00,2019-04-03T14:00,2019,4,16.5,0.0,Clear
04/20/2019,0:00,40.68297,-73.97667,BROOKLYN,3.0,0.0,0,0,0,0,3,0,4117837,2019-04-20 00:00:00,2019-04-20T00:00,2019,4,15.7,0.2,Drizzle
07/05/2019,0:00,40.647694,-73.98037,BROOKLYN,1.0,0.0,0,0,0,0,1,0,4165802,2019-07-05 00:00:00,2019-07-05T00:00,2019,7,21.0,0.0,Cloudy
04/18/2019,15:00,40.578312,-73.96808,BROOKLYN,1.0,0.0,1,0,0,0,0,0,4117232,2019-04-18 15:00:00,2019-04-18T15:00,2019,4,14.1,0.0,Cloudy
01/10/2019,19:00,40.59758,-73.96778,BROOKLYN,1.0,0.0,1,0,0,0,0,0,4066494,2019-01-10 19:00:00,2019-01-10T19:00,2019,1,-0.3,0.0,Clear
08/31/2019,9:00,40.795055,-73.93317,MANHATTAN,0.0,0.0,0,0,0,0,0,0,4198141,2019-08-31 09:00:00,2019-08-31T09:00,2019,8,23.0,0.0,Clear
04/10/2019,0:00,40.757233,-73.97605,MANHATTAN,0.0,0.0,0,0,0,0,0,0,4112090,2019-04-10 00:00:00,2019-04-10T00:00,2019,4,4.2,0.0,Clear
03/03/2019,3:00,40.718018,-73.99996,MANHATTAN,2.0,0.0,0,0,0,0,2,0,4089866,2019-03-03 03:00:00,2019-03-03T03:00,2019,3,-1.2,0.0,Clear
04/27/2019,22:00,40.717197,-73.99071,MANHATTAN,0.0,0.0,0,0,0,0,0,0,4121519,2019-04-27 22:00:00,2019-04-27T22:00,2019,4,7.8,0.0,Clear
04/11/2019,0:00,40.74445,-73.97304,MANHATTAN,0.0,0.0,0,0,0,0,0,0,4112462,2019-04-11 00:00:00,2019-04-11T00:00,2019,4,4.0,0.0,Clear
01/28/2019,22:00,40.74967,-73.99531,MANHATTAN,1.0,0.0,1,0,0,0,0,0,4070885,2019-01-28 22:00:00,2019-01-28T22:00,2019,1,-5.5,0.0,Clear
04/23/2019,17:00,40.784527,-73.979485,MANHATTAN,1.0,0.0,1,0,0,0,0,0,4120854,2019-04-23 17:00:00,2019-04-23T17:00,2019,4,16.3,0.0,Cloudy
02/14/2019,14:00,40.726334,-73.98934,MANHATTAN,0.0,0.0,0,0,0,0,0,0,4080953,2019-02-14 14:00:00,2019-02-14T14:00,2019,2,6.8,0.0,Cloudy
02/24/2019,14:00,40.72224,-73.9863,MANHATTAN,1.0,0.0,1,0,0,0,0,0,4085958,2019-02-24 14:00:00,2019-02-24T14:00,2019,2,9.0,0.0,Cloudy
02/17/2019,0:00,40.725796,-73.986626,MANHATTAN,1.0,0.0,0,0,1,0,0,0,4087514,2019-02-17 00:00:00,2019-02-17T00:00,2019,2,-2.8,0.0,Cloudy
01/12/2019,13:00,40.760345,-73.98541,MANHATTAN,0.0,0.0,0,0,0,0,0,0,4066043,2019-01-12 13:00:00,2019-01-12T13:00,2019,1,0.7,0.0,Cloudy
08/11/2019,3:00,40.808956,-73.94041,MANHATTAN,1.0,0.0,0,0,1,0,0,0,4187006,2019-08-11 03:00:00,2019-08-11T03:00,2019,8,17.1,0.0,Clear
11/27/2019,10:00,40.80556,-73.93625,MANHATTAN,0.0,0.0,0,0,0,0,0,0,4248629,2019-11-27 10:00:00,2019-11-27T10:00,2019,11,11.5,0.0,Cloudy
02/11/2019,0:00,40.799664,-73.93812,MANHATTAN,0.0,0.0,0,0,0,0,0,0,4078761,2019-02-11 00:00:00,2019-02-11T00:00,2019,2,-1.4,0.1,Light Snow
09/11/2019,12:00,40.75643,-73.99189,MANHATTAN,0.0,0.0,0,0,0,0,0,0,4206001,2019-09-11 12:00:00,2019-09-11T12:00,2019,9,29.3,0.0,Cloudy
05/22/2019,0:00,40.76649,-73.95696,MANHATTAN,0.0,0.0,0,0,0,0,0,0,4137137,2019-05-22 00:00:00,2019-05-22T00:00,2019,5,12.4,0.0,Clear
02/26/2019,19:00,40.747627,-73.976746,MANHATTAN,0.0,0.0,0,0,0,0,0,0,4087723,2019-02-26 19:00:00,2019-02-26T19:00,2019,2,-2.0,0.0,Clear
07/18/2019,0:00,40.743782,-73.97352,MANHATTAN,0.0,0.0,0,0,0,0,0,0,4172242,2019-07-18 00:00:00,2019-07-18T00:00,2019,7,24.4,1.1,Drizzle
02/13/2019,18:00,40.757233,-73.9898,MANHATTAN,0.0,0.0,0,0,0,0,0,0,4080494,2019-02-13 18:00:00,2019-02-13T18:00,2019,2,-0.2,0.0,Clear
12/09/2019,8:00,40.744778,-73.97589,MANHATTAN,0.0,0.0,0,0,0,0,0,0,4254826,2019-12-09 08:00:00,2019-12-09T08:00,2019,12,5.6,4.7,Heavy Rain
01/21/2019,16:00,40.784515,-73.94983,MANHATTAN,1.0,0.0,0,0,0,0,1,0,4059969,2019-01-21 16:00:00,2019-01-21T16:00,2019,1,-12.0,0.0,Clear
08/31/2019,7:00,40.797306,-73.964294,MANHATTAN,1.0,0.0,1,0,0,0,0,0,4197948,2019-08-31 07:00:00,2019-08-31T07:00,2019,8,19.8,0.0,Cloudy
09/12/2019,20:00,40.787045,-73.97759,MANHATTAN,1.0,0.0,1,0,0,0,0,0,4204872,2019-09-12 20:00:00,2019-09-12T20:00,2019,9,17.9,1.1,Drizzle
07/29/2019,10:00,40.71793,-74.00099,MANHATTAN,2.0,0.0,0,0,0,0,2,0,4179496,2019-07-29 10:00:00,2019-07-29T10:00,2019,7,29.5,0.0,Clear
02/24/2019,4:00,40.725082,-73.99534,MANHATTAN,2.0,0.0,0,0,0,0,2,0,4085560,2019-02-24 04:00:00,2019-02-24T04:00,2019,2,4.4,1.4,Light Rain
10/04/2019,19:00,40.82523,-73.94761,MANHATTAN,1.0,0.0,0,0,0,0,1,0,4218159,2019-10-04 19:00:00,2019-10-04T19:00,2019,10,12.4,0.0,Clear
05/23/2019,11:00,40.755215,-73.99668,MANHATTAN,0.0,0.0,0,0,0,0,0,0,4138099,2019-05-23 11:00:00,2019-05-23T11:00,2019,5,19.2,0.0,Cloudy
12/02/2019,11:00,40.80937,-73.95301,MANHATTAN,0.0,0.0,0,0,0,0,0,0,4250869,2019-12-02 11:00:00,2019-12-02T11:00,2019,12,1.3,1.2,Heavy Snow
08/15/2019,11:00,40.723648,-73.99103,MANHATTAN,0.0,0.0,0,0,0,0,0,0,4190976,2019-08-15 11:00:00,2019-08-15T11:00,2019,8,26.4,0.0,Clear
01/21/2019,0:00,40.744873,-73.98966,MANHATTAN,0.0,0.0,0,0,0,0,0,0,4068346,2019-01-21 00:00:00,2019-01-21T00:00,2019,1,-11.7,0.0,Cloudy
09/26/2019,9:00,40.74281,-73.99659,MANHATTAN,0.0,0.0,0,0,0,0,0,0,4213916,2019-09-26 09:00:00,2019-09-26T09:00,2019,9,21.5,0.0,Clear
05/24/2019,0:00,40.76466,-73.99367,MANHATTAN,1.0,0.0,1,0,0,0,0,0,4139836,2019-05-24 00:00:00,2019-05-24T00:00,2019,5,20.8,0.0,Cloudy
04/06/2019,20:00,40.75337,-73.974655,MANHATTAN,0.0,0.0,0,0,0,0,0,0,4110126,2019-04-06 20:00:00,2019-04-06T20:00,2019,4,10.8,0.0,Clear
08/19/2019,6:00,40.762394,-73.97861,MANHATTAN,0.0,0.0,0,0,0,0,0,0,4190941,2019-08-19 06:00:00,2019-08-19T06:00,2019,8,22.5,0.0,Cloudy
12/03/2019,17:00,40.711697,-74.00088,MANHATTAN,1.0,0.0,0,0,0,0,1,0,4251725,2019-12-03 17:00:00,2019-12-03T17:00,2019,12,1.4,0.0,Clear
12/14/2019,0:00,40.76656,-73.99043,MANHATTAN,1.0,0.0,1,0,0,0,0,0,4258801,2019-12-14 00:00:00,2019-12-14T00:00,2019,12,9.8,4.0,Heavy Rain
12/13/2019,18:00,40.828297,-73.95087,MANHATTAN,0.0,0.0,0,0,0,0,0,0,4261957,2019-12-13 18:00:00,2019-12-13T18:00,2019,12,5.2,1.7,Light Rain
11/16/2019,11:00,40.750988,-73.99063,MANHATTAN,1.0,0.0,0,0,1,0,0,0,4242229,2019-11-16 11:00:00,2019-11-16T11:00,2019,11,2.8,0.0,Clear
09/24/2019,18:00,40.712646,-73.98998,MANHATTAN,1.0,0.0,1,0,0,0,0,0,4211861,2019-09-24 18:00:00,2019-09-24T18:00,2019,9,20.6,0.0,Clear
04/18/2019,12:00,40.78239,-73.9826,MANHATTAN,1.0,0.0,1,0,0,0,0,0,4117277,2019-04-18 12:00:00,2019-04-18T12:00,2019,4,13.5,0.2,Drizzle
07/19/2019,19:00,40.734657,-74.00475,MANHATTAN,1.0,0.0,0,0,0,0,1,0,4174653,2019-07-19 19:00:00,2019-07-19T19:00,2019,7,28.6,0.0,Cloudy
04/27/2019,17:00,40.71997,-73.992905,MANHATTAN,1.0,0.0,0,0,0,0,1,0,4122061,2019-04-27 17:00:00,2019-04-27T17:00,2019,4,11.7,0.0,Cloudy
12/17/2019,16:00,40.748825,-73.96984,MANHATTAN,2.0,0.0,0,0,0,0,2,0,4260367,2019-12-17 16:00:00,2019-12-17T16:00,2019,12,1.0,0.2,Drizzle
05/15/2019,19:00,40.74675,-73.98369,MANHATTAN,1.0,0.0,1,0,0,0,0,0,4132712,2019-05-15 19:00:00,2019-05-15T19:00,2019,5,14.8,0.0,Clear
01/04/2019,21:00,40.84984,-73.934975,MANHATTAN,1.0,0.0,0,0,0,0,1,0,4062775,2019-01-04 21:00:00,2019-01-04T21:00,2019,1,3.2,0.0,Cloudy
06/07/2019,0:00,40.79793,-73.934,MANHATTAN,1.0,0.0,0,0,0,0,1,0,4147243,2019-06-07 00:00:00,2019-06-07T00:00,2019,6,18.6,0.0,Cloudy
04/04/2019,10:00,40.723278,-73.98253,MANHATTAN,1.0,0.0,1,0,0,0,0,0,4108705,2019-04-04 10:00:00,2019-04-04T10:00,2019,4,9.1,0.0,Cloudy
04/06/2019,13:00,40.76698,-73.98756,MANHATTAN,1.0,0.0,0,0,0,0,1,0,4109783,2019-04-06 13:00:00,2019-04-06T13:00,2019,4,19.5,0.0,Cloudy
05/03/2019,1:00,40.73656,-74.0011,MANHATTAN,1.0,0.0,1,0,0,0,0,0,4124676,2019-05-03 01:00:00,2019-05-03T01:00,2019,5,10.0,0.0,Cloudy
09/17/2019,9:00,40.72192,-73.99004,MANHATTAN,1.0,0.0,1,0,0,0,0,0,4212397,2019-09-17 09:00:00,2019-09-17T09:00,2019,9,19.4,0.0,Clear
09/19/2019,4:00,40.793617,-73.94027,MANHATTAN,0.0,0.0,0,0,0,0,0,0,4211890,2019-09-19 04:00:00,2019-09-19T04:00,2019,9,10.6,0.0,Clear
01/11/2019,23:00,40.862923,-73.92777,MANHATTAN,0.0,0.0,0,0,0,0,0,0,4058092,2019-01-11 23:00:00,2019-01-11T23:00,2019,1,-5.6,0.0,Clear
09/23/2019,14:00,40.846764,-73.933784,MANHATTAN,0.0,0.0,0,0,0,0,0,0,4211722,2019-09-23 14:00:00,2019-09-23T14:00,2019,9,30.7,0.0,Cloudy
09/12/2019,22:00,40.75144,-73.97397,MANHATTAN,1.0,0.0,0,0,0,0,1,0,4204628,2019-09-12 22:00:00,2019-09-12T22:00,2019,9,16.5,0.0,Cloudy
12/10/2019,22:00,40.75831,-73.96294,MANHATTAN,1.0,0.0,1,0,0,0,0,0,4255773,2019-12-10 22:00:00,2019-12-10T22:00,2019,12,6.9,0.4,Drizzle
12/19/2019,6:00,40.744442,-73.979065,MANHATTAN,1.0,0.0,1,0,0,0,0,0,4269525,2019-12-19 06:00:00,2019-12-19T06:00,2019,12,-8.4,0.0,Cloudy
11/01/2019,19:00,40.770313,-73.99141,MANHATTAN,1.0,0.0,0,0,0,0,1,0,4234168,2019-11-01 19:00:00,2019-11-01T19:00,2019,11,9.0,0.0,Clear
12/17/2019,13:00,40.756527,-73.994026,MANHATTAN,1.0,0.0,1,0,0,0,0,0,4262897,2019-12-17 13:00:00,2019-12-17T13:00,2019,12,1.0,0.9,Drizzle
03/17/2019,19:00,40.75175,-73.99008,MANHATTAN,0.0,0.0,0,0,0,0,0,0,4098616,2019-03-17 19:00:00,2019-03-17T19:00,2019,3,1.8,0.0,Clear
07/11/2019,4:00,40.78722,-73.96793,MANHATTAN,1.0,0.0,0,0,0,0,1,0,4167995,2019-07-11 04:00:00,2019-07-11T04:00,2019,7,22.4,0.0,Clear
10/01/2019,22:00,40.790367,-73.949776,MANHATTAN,1.0,0.0,0,0,0,0,1,0,4217949,2019-10-01 22:00:00,2019-10-01T22:00,2019,10,23.2,0.0,Cloudy
02/25/2019,15:00,40.721367,-74.00891,MANHATTAN,1.0,0.0,0,0,0,0,1,0,4086714,2019-02-25 15:00:00,2019-02-25T15:00,2019,2,3.9,0.0,Clear
06/13/2019,0:00,40.757626,-73.97507,MANHATTAN,0.0,0.0,0,0,0,0,0,0,4151211,2019-06-13 00:00:00,2019-06-13T00:00,2019,6,15.7,0.0,Cloudy
09/19/2019,0:00,40.762405,-73.98248,MANHATTAN,0.0,0.0,0,0,0,0,0,0,4209194,2019-09-19 00:00:00,2019-09-19T00:00,2019,9,12.2,0.0,Clear
05/09/2019,17:00,40.74915,-73.98828,MANHATTAN,0.0,0.0,0,0,0,0,0,0,4130708,2019-05-09 17:00:00,2019-05-09T17:00,2019,5,12.0,0.0,Cloudy
08/04/2019,14:00,40.725796,-73.986626,MANHATTAN,1.0,0.0,0,0,1,0,0,0,4183736,2019-08-04 14:00:00,2019-08-04T14:00,2019,8,30.4,0.0,Clear
05/17/2019,22:00,40.761868,-73.96538,MANHATTAN,0.0,0.0,0,0,0,0,0,0,4135704,2019-05-17 22:00:00,2019-05-17T22:00,2019,5,18.1,0.0,Cloudy
10/03/2019,9:00,40.715233,-74.005424,MANHATTAN,0.0,0.0,0,0,0,0,0,0,4217059,2019-10-03 09:00:00,2019-10-03T09:00,2019,10,12.9,0.9,Drizzle
07/20/2019,7:00,40.86769,-73.92122,MANHATTAN,2.0,0.0,0,0,0,0,2,0,4174168,2019-07-20 07:00:00,2019-07-20T07:00,2019,7,28.3,0.0,Cloudy
04/07/2019,3:00,40.721443,-73.986725,MANHATTAN,0.0,0.0,0,0,0,0,0,0,4109983,2019-04-07 03:00:00,2019-04-07T03:00,2019,4,5.3,0.0,Clear
10/23/2019,21:00,40.760967,-73.984955,MANHATTAN,1.0,0.0,1,0,0,0,0,0,4229060,2019-10-23 21:00:00,2019-10-23T21:00,2019,10,11.2,0.0,Clear
04/08/2019,19:00,40.75831,-73.96294,MANHATTAN,0.0,0.0,0,0,0,0,0,0,4111292,2019-04-08 19:00:00,2019-04-08T19:00,2019,4,17.7,0.0,Cloudy
05/02/2019,21:00,40.800808,-73.967964,MANHATTAN,1.0,0.0,0,0,1,0,0,0,4125862,2019-05-02 21:00:00,2019-05-02T21:00,2019,5,11.1,1.0,Drizzle
06/26/2019,0:00,40.7163,-74.01097,MANHATTAN,1.0,0.0,0,0,0,0,1,0,4159760,2019-06-26 00:00:00,2019-06-26T00:00,2019,6,22.1,0.0,Clear
12/10/2019,14:00,40.71724,-74.00786,MANHATTAN,0.0,0.0,0,0,0,0,0,0,4256127,2019-12-10 14:00:00,2019-12-10T14:00,2019,12,12.6,0.9,Drizzle
07/20/2019,23:00,40.715984,-74.010254,MANHATTAN,1.0,0.0,0,0,0,0,1,0,4173926,2019-07-20 23:00:00,2019-07-20T23:00,2019,7,27.3,0.0,Clear
01/19/2019,6:00,40.723625,-74.00479,MANHATTAN,0.0,0.0,0,0,0,0,0,0,4058229,2019-01-19 06:00:00,2019-01-19T06:00,2019,1,-2.9,0.0,Cloudy
11/07/2019,10:00,40.75513,-73.96525,MANHATTAN,1.0,0.0,0,0,0,0,1,0,4236848,2019-11-07 10:00:00,2019-11-07T10:00,2019,11,11.4,0.0,Cloudy
09/19/2019,14:00,40.740643,-73.97581,MANHATTAN,1.0,0.0,0,0,0,0,1,0,4212305,2019-09-19 14:00:00,2019-09-19T14:00,2019,9,20.3,0.0,Clear
09/01/2019,15:00,40.76318,-73.98437,MANHATTAN,1.0,0.0,0,0,0,0,1,0,4198735,2019-09-01 15:00:00,2019-09-01T15:00,2019,9,23.4,0.0,Clear
09/28/2019,14:00,40.7591,-73.99215,MANHATTAN,1.0,0.0,1,0,0,0,0,0,4214718,2019-09-28 14:00:00,2019-09-28T14:00,2019,9,26.0,0.0,Clear
07/23/2019,2:00,40.779922,-73.98068,MANHATTAN,0.0,0.0,0,0,0,0,0,0,4175487,2019-07-23 02:00:00,2019-07-23T02:00,2019,7,23.3,1.8,Light Rain
06/09/2019,14:00,40.85206,-73.934784,MANHATTAN,0.0,0.0,0,0,0,0,0,0,4147839,2019-06-09 14:00:00,2019-06-09T14:00,2019,6,23.5,0.0,Cloudy
06/12/2019,0:00,40.802753,-73.93358,MANHATTAN,0.0,0.0,0,0,0,0,0,0,4150880,2019-06-12 00:00:00,2019-06-12T00:00,2019,6,15.2,0.0,Cloudy
02/01/2019,16:00,40.735348,-73.98992,MANHATTAN,1.0,0.0,0,0,0,0,1,0,4073893,2019-02-01 16:00:00,2019-02-01T16:00,2019,2,-4.9,0.0,Cloudy
02/14/2019,11:00,40.738243,-73.989395,MANHATTAN,0.0,0.0,0,0,0,0,0,0,4082679,2019-02-14 11:00:00,2019-02-14T11:00,2019,2,3.6,0.0,Clear
08/29/2019,8:00,40.764263,-73.983,MANHATTAN,0.0,0.0,0,0,0,0,0,0,4196525,2019-08-29 08:00:00,2019-08-29T08:00,2019,8,21.0,0.0,Clear
06/29/2019,0:00,40.8468,-73.931854,MANHATTAN,0.0,0.0,0,0,0,0,0,0,4161908,2019-06-29 00:00:00,2019-06-29T00:00,2019,6,22.4,0.0,Clear
12/21/2019,11:00,40.73883,-73.983154,MANHATTAN,1.0,0.0,0,0,0,0,1,0,4262026,2019-12-21 11:00:00,2019-12-21T11:00,2019,12,-1.9,0.0,Cloudy
07/03/2019,21:00,40.80587,-73.95281,MANHATTAN,0.0,0.0,0,0,0,0,0,0,4164664,2019-07-03 21:00:00,2019-07-03T21:00,2019,7,24.5,0.0,Cloudy
11/26/2019,19:00,40.720837,-73.997665,MANHATTAN,0.0,0.0,0,0,0,0,0,0,4248474,2019-11-26 19:00:00,2019-11-26T19:00,2019,11,7.6,0.0,Cloudy
09/15/2019,19:00,40.71908,-73.98508,MANHATTAN,1.0,0.0,1,0,0,0,0,0,4206212,2019-09-15 19:00:00,2019-09-15T19:00,2019,9,21.9,0.0,Cloudy
09/30/2019,11:00,40.725986,-74.0091,MANHATTAN,0.0,0.0,0,0,0,0,0,0,4215868,2019-09-30 11:00:00,2019-09-30T11:00,2019,9,19.4,0.0,Cloudy
05/11/2019,16:00,40.82465,-73.94623,MANHATTAN,1.0,0.0,0,0,1,0,0,0,4138131,2019-05-11 16:00:00,2019-05-11T16:00,2019,5,19.2,0.0,Cloudy
11/14/2019,12:00,40.711746,-74.006996,MANHATTAN,0.0,0.0,0,0,0,0,0,0,4242394,2019-11-14 12:00:00,2019-11-14T12:00,2019,11,4.4,0.0,Cloudy
05/31/2019,18:00,40.752598,-73.96702,MANHATTAN,5.0,0.0,0,0,0,0,5,0,4142637,2019-05-31 18:00:00,2019-05-31T18:00,2019,5,22.3,0.0,Clear
02/13/2019,12:00,40.77039,-73.954124,MANHATTAN,1.0,0.0,0,0,0,0,1,0,4080472,2019-02-13 12:00:00,2019-02-13T12:00,2019,2,5.4,0.0,Cloudy
09/20/2019,9:00,40.767838,-73.98137,MANHATTAN,0.0,0.0,0,0,0,0,0,0,4210003,2019-09-20 09:00:00,2019-09-20T09:00,2019,9,17.9,0.0,Clear
10/25/2019,16:00,40.839962,-73.93686,MANHATTAN,1.0,0.0,0,0,0,0,1,0,4230202,2019-10-25 16:00:00,2019-10-25T16:00,2019,10,15.6,0.0,Cloudy
05/16/2019,0:00,40.759624,-73.970085,MANHATTAN,0.0,0.0,0,0,0,0,0,0,4133021,2019-05-16 00:00:00,2019-05-16T00:00,2019,5,11.6,0.0,Cloudy
08/10/2019,0:00,40.729084,-73.98133,MANHATTAN,1.0,0.0,0,0,1,0,0,0,4189125,2019-08-10 00:00:00,2019-08-10T00:00,2019,8,22.1,0.0,Clear
11/19/2019,9:00,40.77235,-73.94666,MANHATTAN,1.0,0.0,0,0,0,0,1,0,4244093,2019-11-19 09:00:00,2019-11-19T09:00,2019,11,6.1,0.0,Cloudy
11/22/2019,18:00,40.81666,-73.938995,MANHATTAN,1.0,0.0,1,0,0,0,0,0,4247031,2019-11-22 18:00:00,2019-11-22T18:00,2019,11,4.8,0.0,Clear
11/19/2019,7:00,40.765053,-73.9927,MANHATTAN,0.0,0.0,0,0,0,0,0,0,4244182,2019-11-19 07:00:00,2019-11-19T07:00,2019,11,3.6,0.0,Clear
05/21/2019,14:00,40.716278,-74.00454,MANHATTAN,1.0,0.0,0,0,1,0,0,0,4137733,2019-05-21 14:00:00,2019-05-21T14:00,2019,5,19.8,0.0,Clear
03/03/2019,16:00,40.80098,-73.93178,MANHATTAN,1.0,0.0,0,0,0,0,1,0,4090850,2019-03-03 16:00:00,2019-03-03T16:00,2019,3,4.4,0.0,Cloudy
02/14/2019,12:00,40.711655,-74.00584,MANHATTAN,0.0,0.0,0,0,0,0,0,0,4080781,2019-02-14 12:00:00,2019-02-14T12:00,2019,2,4.9,0.0,Clear
09/21/2019,20:00,40.753513,-73.98879,MANHATTAN,1.0,0.0,1,0,0,0,0,0,4212870,2019-09-21 20:00:00,2019-09-21T20:00,2019,9,18.8,0.0,Clear
05/27/2019,23:00,40.704567,-74.010635,MANHATTAN,1.0,0.0,1,0,0,0,0,0,4140162,2019-05-27 23:00:00,2019-05-27T23:00,2019,5,17.1,0.0,Cloudy
06/29/2019,21:00,40.720848,-73.98883,MANHATTAN,0.0,0.0,0,0,0,0,0,0,4162662,2019-06-29 21:00:00,2019-06-29T21:00,2019,6,23.5,0.0,Cloudy
09/13/2019,12:00,40.77364,-73.95986,MANHATTAN,0.0,0.0,0,0,0,0,0,0,4205832,2019-09-13 12:00:00,2019-09-13T12:00,2019,9,19.6,0.0,Cloudy
09/30/2019,7:00,40.779495,-73.95771,MANHATTAN,1.0,0.0,0,0,0,0,1,0,4215338,2019-09-30 07:00:00,2019-09-30T07:00,2019,9,15.2,0.0,Cloudy
05/21/2019,7:00,40.789948,-73.94293,MANHATTAN,1.0,0.0,1,0,0,0,0,0,4149490,2019-05-21 07:00:00,2019-05-21T07:00,2019,5,13.8,0.0,Clear
11/23/2019,21:00,40.737328,-73.99266,MANHATTAN,1.0,0.0,0,0,0,0,1,0,4246567,2019-11-23 21:00:00,2019-11-23T21:00,2019,11,5.3,0.1,Drizzle
11/07/2019,19:00,40.75294,-73.99291,MANHATTAN,0.0,0.0,0,0,0,0,0,0,4237265,2019-11-07 19:00:00,2019-11-07T19:00,2019,11,9.3,1.3,Light Rain
12/21/2019,0:00,40.802544,-73.93668,MANHATTAN,2.0,0.0,0,0,0,0,2,0,4263137,2019-12-21 00:00:00,2019-12-21T00:00,2019,12,-5.0,0.0,Cloudy
04/27/2019,0:00,40.742798,-73.99466,MANHATTAN,0.0,0.0,0,0,0,0,0,0,4122021,2019-04-27 00:00:00,2019-04-27T00:00,2019,4,10.8,0.1,Drizzle
04/25/2019,20:00,40.723648,-73.99103,MANHATTAN,1.0,0.0,0,0,1,0,0,0,4122055,2019-04-25 20:00:00,2019-04-25T20:00,2019,4,11.0,0.1,Drizzle
09/19/2019,14:00,40.810276,-73.94738,MANHATTAN,0.0,0.0,0,0,0,0,0,0,4226426,2019-09-19 14:00:00,2019-09-19T14:00,2019,9,20.1,0.0,Clear
01/21/2019,0:00,40.786266,-73.94857,MANHATTAN,1.0,0.0,0,0,0,0,1,0,4070173,2019-01-21 00:00:00,2019-01-21T00:00,2019,1,-11.9,0.0,Cloudy
01/15/2019,0:00,40.808334,-73.940865,MANHATTAN,1.0,0.0,0,0,0,0,1,0,4067556,2019-01-15 00:00:00,2019-01-15T00:00,2019,1,-4.8,0.0,Clear
09/20/2019,21:00,40.765865,-73.95742,MANHATTAN,1.0,0.0,0,0,0,0,1,0,4210587,2019-09-20 21:00:00,2019-09-20T21:00,2019,9,19.1,0.0,Clear
08/19/2019,3:00,40.765358,-73.96007,MANHATTAN,0.0,0.0,0,0,0,0,0,0,4190970,2019-08-19 03:00:00,2019-08-19T03:00,2019,8,23.5,0.0,Cloudy
01/04/2019,20:00,40.806767,-73.937164,MANHATTAN,3.0,0.0,3,0,0,0,0,0,4063160,2019-01-04 20:00:00,2019-01-04T20:00,2019,1,4.1,0.0,Cloudy
10/26/2019,0:00,40.726185,-73.98943,MANHATTAN,1.0,0.0,0,0,1,0,0,0,4230420,2019-10-26 00:00:00,2019-10-26T00:00,2019,10,13.0,0.0,Cloudy
02/04/2019,8:00,40.744694,-73.98157,MANHATTAN,0.0,0.0,0,0,0,0,0,0,4074534,2019-02-04 08:00:00,2019-02-04T08:00,2019,2,0.6,0.0,Clear
02/21/2019,20:00,40.758373,-73.971,MANHATTAN,1.0,0.0,1,0,0,0,0,0,4084555,2019-02-21 20:00:00,2019-02-21T20:00,2019,2,3.6,0.0,Cloudy
03/21/2019,22:00,40.72032,-73.99404,MANHATTAN,0.0,0.0,0,0,0,0,0,0,4101226,2019-03-21 22:00:00,2019-03-21T22:00,2019,3,5.4,2.0,Light Rain
04/08/2019,18:00,40.716892,-73.99971,MANHATTAN,1.0,0.0,1,0,0,0,0,0,4111570,2019-04-08 18:00:00,2019-04-08T18:00,2019,4,20.6,0.0,Cloudy
04/15/2019,9:00,40.77205,-73.961975,MANHATTAN,0.0,0.0,0,0,0,0,0,0,4115455,2019-04-15 09:00:00,2019-04-15T09:00,2019,4,18.6,0.0,Clear
11/14/2019,0:00,40.745823,-74.001816,MANHATTAN,1.0,0.0,0,0,1,0,0,0,4242505,2019-11-14 00:00:00,2019-11-14T00:00,2019,11,-2.2,0.0,Cloudy
03/14/2019,8:00,40.716858,-74.00819,MANHATTAN,0.0,0.0,0,0,0,0,0,0,4096659,2019-03-14 08:00:00,2019-03-14T08:00,2019,3,5.7,0.0,Cloudy
12/21/2019,15:00,40.764896,-73.97256,MANHATTAN,0.0,0.0,0,0,0,0,0,0,4262476,2019-12-21 15:00:00,2019-12-21T15:00,2019,12,0.3,0.0,Cloudy
10/02/2019,20:00,40.780437,-73.94989,MANHATTAN,0.0,0.0,0,0,0,0,0,0,4216612,2019-10-02 20:00:00,2019-10-02T20:00,2019,10,22.5,0.6,Drizzle
02/01/2019,20:00,40.779583,-73.961845,MANHATTAN,0.0,0.0,0,0,0,0,0,0,4074475,2019-02-01 20:00:00,2019-02-01T20:00,2019,2,-7.7,0.0,Clear
09/27/2019,8:00,40.748177,-73.96835,MANHATTAN,1.0,0.0,0,0,0,0,1,0,4213678,2019-09-27 08:00:00,2019-09-27T08:00,2019,9,17.0,0.0,Clear
02/23/2019,5:00,40.798992,-73.96678,MANHATTAN,1.0,0.0,0,0,0,0,1,0,4085922,2019-02-23 05:00:00,2019-02-23T05:00,2019,2,-2.4,0.0,Cloudy
03/04/2019,16:00,40.71207,-73.996956,MANHATTAN,1.0,0.0,1,0,0,0,0,0,4091082,2019-03-04 16:00:00,2019-03-04T16:00,2019,3,1.2,0.0,Clear
06/22/2019,11:00,40.742813,-73.98865,MANHATTAN,1.0,0.0,0,0,1,0,0,0,4160659,2019-06-22 11:00:00,2019-06-22T11:00,2019,6,23.9,0.0,Clear
07/02/2019,10:00,40.778522,-73.98742,MANHATTAN,1.0,0.0,1,0,0,0,0,0,4163796,2019-07-02 10:00:00,2019-07-02T10:00,2019,7,28.5,0.0,Cloudy
08/29/2019,19:00,40.848682,-73.939224,MANHATTAN,1.0,0.0,0,0,0,0,1,0,4197010,2019-08-29 19:00:00,2019-08-29T19:00,2019,8,20.8,0.0,Clear
04/04/2019,14:00,40.80256,-73.943,MANHATTAN,1.0,0.0,0,0,0,0,1,0,4109175,2019-04-04 14:00:00,2019-04-04T14:00,2019,4,13.6,0.0,Cloudy
02/19/2019,15:00,40.75524,-73.97328,MANHATTAN,0.0,0.0,0,0,0,0,0,0,4087861,2019-02-19 15:00:00,2019-02-19T15:00,2019,2,1.9,0.0,Clear
04/15/2019,13:00,40.744175,-73.98345,MANHATTAN,1.0,0.0,0,0,1,0,0,0,4121199,2019-04-15 13:00:00,2019-04-15T13:00,2019,4,12.3,0.2,Drizzle
06/06/2019,0:00,40.761173,-73.95789,MANHATTAN,0.0,0.0,0,0,0,0,0,0,4148037,2019-06-06 00:00:00,2019-06-06T00:00,2019,6,20.4,5.8,Heavy Rain
05/14/2019,20:00,40.750015,-73.991356,MANHATTAN,0.0,0.0,0,0,0,0,0,0,4131995,2019-05-14 20:00:00,2019-05-14T20:00,2019,5,8.2,0.6,Drizzle
09/20/2019,17:00,40.72063,-73.98953,MANHATTAN,1.0,0.0,0,0,0,0,1,0,4209614,2019-09-20 17:00:00,2019-09-20T17:00,2019,9,23.2,0.0,Clear
02/25/2019,14:00,40.752117,-73.983536,MANHATTAN,1.0,0.0,1,0,0,0,0,0,4087771,2019-02-25 14:00:00,2019-02-25T14:00,2019,2,3.3,0.0,Clear
04/05/2019,11:00,40.79499,-73.94091,MANHATTAN,0.0,0.0,0,0,0,0,0,0,4110962,2019-04-05 11:00:00,2019-04-05T11:00,2019,4,5.3,0.5,Drizzle
04/30/2019,20:00,40.741024,-73.97862,MANHATTAN,1.0,0.0,1,0,0,0,0,0,4123811,2019-04-30 20:00:00,2019-04-30T20:00,2019,4,11.4,0.0,Cloudy
12/02/2019,9:00,40.797,-73.93778,MANHATTAN,1.0,0.0,1,0,0,0,0,0,4252202,2019-12-02 09:00:00,2019-12-02T09:00,2019,12,1.3,0.7,Heavy Snow
02/26/2019,18:00,40.848625,-73.93425,MANHATTAN,0.0,0.0,0,0,0,0,0,0,4087610,2019-02-26 18:00:00,2019-02-26T18:00,2019,2,-2.2,0.0,Clear
09/18/2019,1:00,40.741547,-73.98958,MANHATTAN,1.0,0.0,0,0,0,0,1,0,4207783,2019-09-18 01:00:00,2019-09-18T01:00,2019,9,15.4,0.0,Clear
05/29/2019,0:00,40.803024,-73.93632,MANHATTAN,0.0,0.0,0,0,0,0,0,0,4141865,2019-05-29 00:00:00,2019-05-29T00:00,2019,5,20.5,0.0,Cloudy
07/29/2019,14:00,40.758915,-73.9997,MANHATTAN,1.0,0.0,0,0,1,0,0,0,4179788,2019-07-29 14:00:00,2019-07-29T14:00,2019,7,31.8,0.0,Clear
10/04/2019,15:00,40.84103,-73.94463,MANHATTAN,1.0,0.0,0,0,0,0,1,0,4218686,2019-10-04 15:00:00,2019-10-04T15:00,2019,10,15.9,0.0,Clear
09/27/2019,13:00,40.71587,-73.99921,MANHATTAN,0.0,0.0,0,0,0,0,0,0,4216255,2019-09-27 13:00:00,2019-09-27T13:00,2019,9,21.6,0.0,Clear
04/26/2019,15:00,40.70909,-74.005516,MANHATTAN,1.0,0.0,0,0,0,0,1,0,4122508,2019-04-26 15:00:00,2019-04-26T15:00,2019,4,15.7,0.8,Drizzle
02/01/2019,0:00,40.71523,-74.01334,MANHATTAN,1.0,0.0,1,0,0,0,0,0,4072833,2019-02-01 00:00:00,2019-02-01T00:00,2019,2,-10.1,0.0,Clear
08/29/2019,5:00,40.852474,-73.92961,MANHATTAN,2.0,0.0,0,0,0,0,2,0,4200111,2019-08-29 05:00:00,2019-08-29T05:00,2019,8,18.7,0.0,Clear
04/13/2019,19:00,40.785378,-73.95186,MANHATTAN,0.0,0.0,0,0,0,0,0,0,4117285,2019-04-13 19:00:00,2019-04-13T19:00,2019,4,16.6,0.0,Cloudy
01/02/2019,18:00,40.77622,-73.97596,MANHATTAN,1.0,0.0,0,0,0,0,1,0,4061037,2019-01-02 18:00:00,2019-01-02T18:00,2019,1,1.6,0.0,Cloudy
10/23/2019,14:00,40.766624,-73.98179,MANHATTAN,0.0,0.0,0,0,0,0,0,0,4230156,2019-10-23 14:00:00,2019-10-23T14:00,2019,10,17.5,0.0,Clear
08/29/2019,12:00,40.755836,-73.97708,MANHATTAN,1.0,0.0,0,0,0,0,1,0,4196603,2019-08-29 12:00:00,2019-08-29T12:00,2019,8,26.4,0.0,Clear
01/26/2019,19:00,40.757145,-73.99357,MANHATTAN,0.0,0.0,0,0,0,0,0,0,4069599,2019-01-26 19:00:00,2019-01-26T19:00,2019,1,-1.2,0.0,Clear
01/18/2019,14:00,40.7194,-73.99099,MANHATTAN,1.0,0.0,0,0,0,0,1,0,4058126,2019-01-18 14:00:00,2019-01-18T14:00,2019,1,3.2,0.0,Cloudy
10/08/2019,12:00,40.833237,-73.94178,MANHATTAN,1.0,0.0,1,0,0,0,0,0,4220317,2019-10-08 12:00:00,2019-10-08T12:00,2019,10,17.1,0.0,Cloudy
12/02/2019,0:00,40.732914,-74.00398,MANHATTAN,0.0,0.0,0,0,0,0,0,0,4250877,2019-12-02 00:00:00,2019-12-02T00:00,2019,12,2.4,0.4,Drizzle
02/23/2019,0:00,40.76229,-73.986115,MANHATTAN,1.0,0.0,1,0,0,0,0,0,4085535,2019-02-23 00:00:00,2019-02-23T00:00,2019,2,-0.6,0.0,Cloudy
10/23/2019,11:00,40.844246,-73.93372,MANHATTAN,1.0,0.0,1,0,0,0,0,0,4228012,2019-10-23 11:00:00,2019-10-23T11:00,2019,10,17.1,0.0,Clear
03/18/2019,15:00,40.718273,-74.00533,MANHATTAN,1.0,0.0,0,0,1,0,0,0,4100424,2019-03-18 15:00:00,2019-03-18T15:00,2019,3,7.1,0.0,Cloudy
07/19/2019,0:00,40.75262,-74.0023,MANHATTAN,0.0,0.0,0,0,0,0,0,0,4174058,2019-07-19 00:00:00,2019-07-19T00:00,2019,7,22.4,0.0,Cloudy
04/27/2019,23:00,40.86155,-73.92472,MANHATTAN,4.0,0.0,0,0,0,0,4,0,4123234,2019-04-27 23:00:00,2019-04-27T23:00,2019,4,8.3,0.0,Cloudy
06/02/2019,19:00,40.84168,-73.93934,MANHATTAN,2.0,0.0,0,0,0,0,2,0,4143596,2019-06-02 19:00:00,2019-06-02T19:00,2019,6,21.4,0.0,Cloudy
10/29/2019,21:00,40.74468,-73.987305,MANHATTAN,1.0,0.0,0,0,1,0,0,0,4231940,2019-10-29 21:00:00,2019-10-29T21:00,2019,10,14.1,0.1,Drizzle
02/22/2019,9:00,40.84103,-73.94463,MANHATTAN,0.0,0.0,0,0,0,0,0,0,4084886,2019-02-22 09:00:00,2019-02-22T09:00,2019,2,3.9,0.0,Cloudy
07/03/2019,18:00,40.729332,-74.00523,MANHATTAN,0.0,0.0,0,0,0,0,0,0,4164164,2019-07-03 18:00:00,2019-07-03T18:00,2019,7,28.2,0.0,Cloudy
08/29/2019,23:00,40.79094,-73.947235,MANHATTAN,4.0,0.0,0,0,0,0,4,0,4197652,2019-08-29 23:00:00,2019-08-29T23:00,2019,8,17.6,0.0,Clear
10/11/2019,0:00,40.754154,-73.9804,MANHATTAN,1.0,0.0,1,0,0,0,0,0,4223004,2019-10-11 00:00:00,2019-10-11T00:00,2019,10,14.0,0.0,Cloudy
06/13/2019,14:00,40.737705,-73.99172,MANHATTAN,1.0,0.0,0,0,1,0,0,0,4151372,2019-06-13 14:00:00,2019-06-13T14:00,2019,6,18.0,0.0,Clear
06/07/2019,13:00,40.814144,-73.95571,MANHATTAN,1.0,0.0,0,0,0,0,1,0,4153724,2019-06-07 13:00:00,2019-06-07T13:00,2019,6,24.4,0.0,Cloudy
11/15/2019,16:00,40.788532,-73.95322,MANHATTAN,1.0,0.0,1,0,0,0,0,0,4263462,2019-11-15 16:00:00,2019-11-15T16:00,2019,11,8.2,0.0,Cloudy
03/02/2019,14:00,40.84691,-73.93824,MANHATTAN,0.0,0.0,0,0,0,0,0,0,4090239,2019-03-02 14:00:00,2019-03-02T14:00,2019,3,3.4,0.0,Cloudy
09/13/2019,9:00,40.797943,-73.94213,MANHATTAN,0.0,0.0,0,0,0,0,0,0,4205020,2019-09-13 09:00:00,2019-09-13T09:00,2019,9,18.0,0.0,Cloudy
06/03/2019,16:00,40.74026,-74.005875,MANHATTAN,1.0,0.0,0,0,0,0,1,0,4144814,2019-06-03 16:00:00,2019-06-03T16:00,2019,6,20.5,0.0,Clear
05/26/2019,9:00,40.859898,-73.91985,MANHATTAN,0.0,0.0,0,0,0,0,0,0,4139869,2019-05-26 09:00:00,2019-05-26T09:00,2019,5,23.7,0.0,Cloudy
06/04/2019,17:00,40.82747,-73.94505,MANHATTAN,0.0,0.0,0,0,0,0,0,0,4155482,2019-06-04 17:00:00,2019-06-04T17:00,2019,6,19.1,0.0,Cloudy
09/19/2019,14:00,40.735794,-74.00156,MANHATTAN,0.0,0.0,0,0,0,0,0,0,4209054,2019-09-19 14:00:00,2019-09-19T14:00,2019,9,19.6,0.0,Clear
05/06/2019,16:00,40.73883,-73.983154,MANHATTAN,0.0,0.0,0,0,0,0,0,0,4127683,2019-05-06 16:00:00,2019-05-06T16:00,2019,5,17.4,0.0,Clear
05/21/2019,11:00,40.824562,-73.948105,MANHATTAN,1.0,0.0,1,0,0,0,0,0,4136388,2019-05-21 11:00:00,2019-05-21T11:00,2019,5,17.1,0.0,Clear
08/12/2019,22:00,40.72038,-73.98822,MANHATTAN,0.0,0.0,0,0,0,0,0,0,4188059,2019-08-12 22:00:00,2019-08-12T22:00,2019,8,24.1,0.0,Cloudy
01/28/2019,0:00,40.721024,-73.981094,MANHATTAN,0.0,0.0,0,0,0,0,0,0,4071529,2019-01-28 00:00:00,2019-01-28T00:00,2019,1,1.7,0.0,Cloudy
09/26/2019,16:00,40.74649,-74.001335,MANHATTAN,1.0,0.0,0,0,0,0,1,0,4213911,2019-09-26 16:00:00,2019-09-26T16:00,2019,9,22.4,0.5,Drizzle
03/31/2019,6:00,40.83923,-73.94555,MANHATTAN,0.0,0.0,0,0,0,0,0,0,4106286,2019-03-31 06:00:00,2019-03-31T06:00,2019,3,10.3,0.0,Cloudy
11/11/2019,0:00,40.7371,-73.98302,MANHATTAN,0.0,0.0,0,0,0,0,0,0,4239098,2019-11-11 00:00:00,2019-11-11T00:00,2019,11,4.9,0.0,Clear
02/27/2019,16:00,40.711777,-73.99971,MANHATTAN,0.0,0.0,0,0,0,0,0,0,4087799,2019-02-27 16:00:00,2019-02-27T16:00,2019,2,-2.0,0.0,Cloudy
09/12/2019,0:00,40.75738,-73.966705,MANHATTAN,1.0,0.0,1,0,0,0,0,0,4204493,2019-09-12 00:00:00,2019-09-12T00:00,2019,9,23.7,0.0,Clear
12/09/2019,20:00,40.74608,-73.974945,MANHATTAN,1.0,0.0,1,0,0,0,0,0,4255025,2019-12-09 20:00:00,2019-12-09T20:00,2019,12,11.6,4.2,Heavy Rain
09/24/2019,14:00,40.76326,-73.9747,MANHATTAN,1.0,0.0,0,0,0,0,1,0,4212100,2019-09-24 14:00:00,2019-09-24T14:00,2019,9,25.0,0.0,Cloudy
04/25/2019,0:00,40.84168,-73.9375,MANHATTAN,1.0,0.0,1,0,0,0,0,0,4121010,2019-04-25 00:00:00,2019-04-25T00:00,2019,4,8.8,0.0,Clear
11/29/2019,14:00,40.759987,-73.980354,MANHATTAN,0.0,0.0,0,0,0,0,0,0,4250077,2019-11-29 14:00:00,2019-11-29T14:00,2019,11,4.8,0.0,Clear
06/23/2019,13:00,40.738686,-73.99588,MANHATTAN,1.0,0.0,0,0,1,0,0,0,4157006,2019-06-23 13:00:00,2019-06-23T13:00,2019,6,26.5,0.0,Clear
05/21/2019,11:00,40.77537,-73.98772,MANHATTAN,1.0,0.0,0,0,0,0,1,0,4137071,2019-05-21 11:00:00,2019-05-21T11:00,2019,5,17.0,0.0,Clear
12/29/2019,17:00,40.769848,-73.98432,MANHATTAN,1.0,0.0,1,0,0,0,0,0,4266479,2019-12-29 17:00:00,2019-12-29T17:00,2019,12,3.8,0.3,Drizzle
11/22/2019,16:00,40.756565,-73.99028,MANHATTAN,0.0,0.0,0,0,0,0,0,0,4247334,2019-11-22 16:00:00,2019-11-22T16:00,2019,11,6.8,0.0,Cloudy
09/18/2019,13:00,40.7528,-73.979294,MANHATTAN,0.0,0.0,0,0,0,0,0,0,4209214,2019-09-18 13:00:00,2019-09-18T13:00,2019,9,18.9,0.0,Cloudy
01/21/2019,21:00,40.751583,-73.98807,MANHATTAN,0.0,0.0,0,0,0,0,0,0,4070431,2019-01-21 21:00:00,2019-01-21T21:00,2019,1,-12.1,0.0,Clear
10/31/2019,16:00,40.775246,-73.94763,MANHATTAN,1.0,0.0,1,0,0,0,0,0,4232994,2019-10-31 16:00:00,2019-10-31T16:00,2019,10,19.7,0.9,Drizzle
04/28/2019,15:00,40.759785,-73.976295,MANHATTAN,0.0,0.0,0,0,0,0,0,0,4121890,2019-04-28 15:00:00,2019-04-28T15:00,2019,4,10.0,0.1,Drizzle
09/04/2019,14:00,40.710888,-74.00907,MANHATTAN,0.0,0.0,0,0,0,0,0,0,4199530,2019-09-04 14:00:00,2019-09-04T14:00,2019,9,31.0,0.0,Clear
11/17/2019,0:00,40.717724,-73.98579,MANHATTAN,1.0,0.0,0,0,0,0,1,0,4242011,2019-11-17 00:00:00,2019-11-17T00:00,2019,11,-1.5,0.0,Clear
09/05/2019,13:00,40.767803,-73.95601,MANHATTAN,0.0,0.0,0,0,0,0,0,0,4200479,2019-09-05 13:00:00,2019-09-05T13:00,2019,9,23.3,0.0,Cloudy
11/11/2019,9:00,40.738686,-73.99588,MANHATTAN,0.0,0.0,0,0,0,0,0,0,4239238,2019-11-11 09:00:00,2019-11-11T09:00,2019,11,8.6,0.0,Clear
04/17/2019,8:00,40.71918,-73.99029,MANHATTAN,1.0,0.0,1,0,0,0,0,0,4116567,2019-04-17 08:00:00,2019-04-17T08:00,2019,4,10.2,0.0,Cloudy
03/27/2019,16:00,40.801193,-73.95179,MANHATTAN,1.0,0.0,1,0,0,0,0,0,4104623,2019-03-27 16:00:00,2019-03-27T16:00,2019,3,4.8,0.0,Cloudy
09/18/2019,11:00,40.715477,-73.998604,MANHATTAN,0.0,0.0,0,0,0,0,0,0,4211547,2019-09-18 11:00:00,2019-09-18T11:00,2019,9,19.0,0.0,Cloudy
05/31/2019,18:00,40.799458,-73.94357,MANHATTAN,0.0,0.0,0,0,0,0,0,0,4143127,2019-05-31 18:00:00,2019-05-31T18:00,2019,5,23.2,0.0,Clear
02/05/2019,14:00,40.76199,-73.97957,MANHATTAN,0.0,0.0,0,0,0,0,0,0,4075242,2019-02-05 14:00:00,2019-02-05T14:00,2019,2,16.7,0.0,Clear
06/24/2019,9:00,40.72443,-73.99347,MANHATTAN,0.0,0.0,0,0,0,0,0,0,4158086,2019-06-24 09:00:00,2019-06-24T09:00,2019,6,24.7,0.0,Cloudy
05/03/2019,11:00,40.847355,-73.93518,MANHATTAN,1.0,0.0,0,0,1,0,0,0,4124808,2019-05-03 11:00:00,2019-05-03T11:00,2019,5,12.3,0.0,Cloudy
06/04/2019,11:00,40.753475,-73.99254,MANHATTAN,0.0,0.0,0,0,0,0,0,0,4145478,2019-06-04 11:00:00,2019-06-04T11:00,2019,6,18.1,0.0,Clear
07/17/2019,14:00,40.720646,-73.997185,MANHATTAN,1.0,0.0,1,0,0,0,0,0,4172753,2019-07-17 14:00:00,2019-07-17T14:00,2019,7,30.5,0.4,Drizzle
09/23/2019,22:00,40.800068,-73.94056,MANHATTAN,1.0,0.0,0,0,0,0,1,0,4211781,2019-09-23 22:00:00,2019-09-23T22:00,2019,9,25.3,0.0,Cloudy
11/16/2019,17:00,40.754314,-73.99068,MANHATTAN,0.0,0.0,0,0,0,0,0,0,4247333,2019-11-16 17:00:00,2019-11-16T17:00,2019,11,1.8,0.0,Clear
05/01/2019,9:00,40.80698,-73.95351,MANHATTAN,3.0,0.0,0,0,0,0,3,0,4124260,2019-05-01 09:00:00,2019-05-01T09:00,2019,5,12.4,0.0,Cloudy
08/30/2019,17:00,40.76023,-73.961525,MANHATTAN,0.0,0.0,0,0,0,0,0,0,4197767,2019-08-30 17:00:00,2019-08-30T17:00,2019,8,29.2,0.0,Clear
11/18/2019,7:00,40.738316,-73.98773,MANHATTAN,1.0,0.0,0,0,0,0,1,0,4243682,2019-11-18 07:00:00,2019-11-18T07:00,2019,11,2.4,0.0,Cloudy
09/20/2019,16:00,40.70468,-74.01414,MANHATTAN,2.0,0.0,2,0,0,0,0,0,4211688,2019-09-20 16:00:00,2019-09-20T16:00,2019,9,24.7,0.0,Clear
11/02/2019,3:00,40.70541,-74.01369,MANHATTAN,1.0,0.0,0,0,0,0,1,0,4235181,2019-11-02 03:00:00,2019-11-02T03:00,2019,11,4.2,0.0,Clear
07/13/2019,19:00,40.784237,-73.947075,MANHATTAN,0.0,0.0,0,0,0,0,0,0,4218880,2019-07-13 19:00:00,2019-07-13T19:00,2019,7,25.3,0.0,Clear
11/27/2019,18:00,40.722584,-74.00636,MANHATTAN,0.0,0.0,0,0,0,0,0,0,4250765,2019-11-27 18:00:00,2019-11-27T18:00,2019,11,11.1,0.9,Drizzle
12/23/2019,16:00,40.7276,-73.98531,MANHATTAN,1.0,0.0,0,0,0,0,1,0,4263803,2019-12-23 16:00:00,2019-12-23T16:00,2019,12,9.1,0.0,Clear
05/21/2019,10:00,40.74209,-73.984985,MANHATTAN,0.0,0.0,0,0,0,0,0,0,4137440,2019-05-21 10:00:00,2019-05-21T10:00,2019,5,16.1,0.0,Cloudy
12/26/2019,9:00,40.779964,-73.94421,MANHATTAN,1.0,0.0,0,0,0,0,1,0,4265014,2019-12-26 09:00:00,2019-12-26T09:00,2019,12,2.6,0.0,Cloudy
01/10/2019,23:00,40.759525,-73.96205,MANHATTAN,1.0,0.0,0,0,0,0,1,0,4065025,2019-01-10 23:00:00,2019-01-10T23:00,2019,1,-1.8,0.0,Cloudy
07/03/2019,9:00,40.754433,-73.98019,MANHATTAN,1.0,0.0,0,0,0,0,1,0,4163696,2019-07-03 09:00:00,2019-07-03T09:00,2019,7,26.6,0.1,Drizzle
01/21/2019,15:00,40.84787,-73.93641,MANHATTAN,0.0,0.0,0,0,0,0,0,0,4069800,2019-01-21 15:00:00,2019-01-21T15:00,2019,1,-12.0,0.0,Clear
03/06/2019,0:00,40.749046,-73.98203,MANHATTAN,0.0,0.0,0,0,0,0,0,0,4092161,2019-03-06 00:00:00,2019-03-06T00:00,2019,3,-5.6,0.0,Clear
05/21/2019,8:00,40.71445,-73.9996,MANHATTAN,1.0,0.0,1,0,0,0,0,0,4136722,2019-05-21 08:00:00,2019-05-21T08:00,2019,5,14.1,0.0,Clear
02/21/2019,22:00,40.76172,-73.98281,MANHATTAN,1.0,0.0,1,0,0,0,0,0,4084995,2019-02-21 22:00:00,2019-02-21T22:00,2019,2,2.0,0.0,Cloudy
09/05/2019,11:00,40.72089,-73.99576,MANHATTAN,0.0,0.0,0,0,0,0,0,0,4201618,2019-09-05 11:00:00,2019-09-05T11:00,2019,9,21.8,0.0,Cloudy
04/16/2019,17:00,40.73848,-73.98343,MANHATTAN,0.0,0.0,0,0,0,0,0,0,4116347,2019-04-16 17:00:00,2019-04-16T17:00,2019,4,16.5,0.0,Clear
02/01/2019,4:00,40.719395,-74.00189,MANHATTAN,1.0,0.0,0,0,0,0,1,0,4072846,2019-02-01 04:00:00,2019-02-01T04:00,2019,2,-11.3,0.0,Clear
06/17/2019,15:00,40.776318,-73.962135,MANHATTAN,1.0,0.0,0,0,1,0,0,0,4153545,2019-06-17 15:00:00,2019-06-17T15:00,2019,6,22.5,0.5,Drizzle
08/01/2019,7:00,40.75355,-73.98505,MANHATTAN,0.0,0.0,0,0,0,0,0,0,4180918,2019-08-01 07:00:00,2019-08-01T07:00,2019,8,23.2,0.0,Cloudy
07/20/2019,22:00,40.761486,-73.96062,MANHATTAN,0.0,0.0,0,0,0,0,0,0,4174109,2019-07-20 22:00:00,2019-07-20T22:00,2019,7,27.8,0.0,Cloudy
03/14/2019,8:00,40.709145,-74.01492,MANHATTAN,0.0,0.0,0,0,0,0,0,0,4096538,2019-03-14 08:00:00,2019-03-14T08:00,2019,3,5.7,0.0,Cloudy
08/18/2019,16:00,40.75159,-73.99207,MANHATTAN,1.0,0.0,1,0,0,0,0,0,4190454,2019-08-18 16:00:00,2019-08-18T16:00,2019,8,27.0,0.0,Cloudy
09/13/2019,15:00,40.753925,-73.99761,MANHATTAN,0.0,0.0,0,0,0,0,0,0,4205405,2019-09-13 15:00:00,2019-09-13T15:00,2019,9,19.3,0.0,Cloudy
06/18/2019,16:00,40.8234,-73.95311,MANHATTAN,0.0,0.0,0,0,0,0,0,0,4159465,2019-06-18 16:00:00,2019-06-18T16:00,2019,6,23.8,1.5,Light Rain
05/07/2019,9:00,40.80202,-73.94969,MANHATTAN,1.0,0.0,0,0,1,0,0,0,4127761,2019-05-07 09:00:00,2019-05-07T09:00,2019,5,14.7,0.0,Cloudy
03/10/2019,16:00,40.81027,-73.951385,MANHATTAN,1.0,0.0,0,0,0,0,1,0,4095379,2019-03-10 16:00:00,2019-03-10T16:00,2019,3,8.4,0.0,Cloudy
06/21/2019,18:00,40.76286,-73.98941,MANHATTAN,1.0,0.0,1,0,0,0,0,0,4159063,2019-06-21 18:00:00,2019-06-21T18:00,2019,6,22.6,0.0,Clear
12/17/2019,23:00,40.813457,-73.93933,MANHATTAN,1.0,0.0,0,0,0,0,1,0,4260169,2019-12-17 23:00:00,2019-12-17T23:00,2019,12,0.6,0.0,Cloudy
11/23/2019,22:00,40.748615,-73.979065,MANHATTAN,1.0,0.0,0,0,0,0,1,0,4246017,2019-11-23 22:00:00,2019-11-23T22:00,2019,11,4.9,1.1,Drizzle
07/15/2019,21:00,40.824017,-73.95265,MANHATTAN,1.0,0.0,0,0,0,0,1,0,4171211,2019-07-15 21:00:00,2019-07-15T21:00,2019,7,24.0,0.0,Cloudy
06/07/2019,2:00,40.70991,-74.006096,MANHATTAN,1.0,0.0,1,0,0,0,0,0,4147798,2019-06-07 02:00:00,2019-06-07T02:00,2019,6,18.0,0.0,Cloudy
06/04/2019,9:00,40.74662,-73.99193,MANHATTAN,0.0,0.0,0,0,0,0,0,0,4145653,2019-06-04 09:00:00,2019-06-04T09:00,2019,6,16.1,0.0,Clear
09/13/2019,19:00,40.795677,-73.941666,MANHATTAN,1.0,0.0,0,0,0,0,1,0,4211888,2019-09-13 19:00:00,2019-09-13T19:00,2019,9,17.2,0.0,Clear
10/18/2019,9:00,40.736004,-73.99362,MANHATTAN,2.0,0.0,1,0,1,0,0,0,4225614,2019-10-18 09:00:00,2019-10-18T09:00,2019,10,12.0,0.0,Cloudy
01/17/2019,6:00,40.713135,-74.00407,MANHATTAN,0.0,0.0,0,0,0,0,0,0,4060377,2019-01-17 06:00:00,2019-01-17T06:00,2019,1,-5.5,0.0,Cloudy
10/19/2019,14:00,40.804688,-73.95707,MANHATTAN,1.0,0.0,0,0,0,0,1,0,4227872,2019-10-19 14:00:00,2019-10-19T14:00,2019,10,15.0,0.0,Clear
11/11/2019,17:00,40.84787,-73.93641,MANHATTAN,1.0,0.0,1,0,0,0,0,0,4239770,2019-11-11 17:00:00,2019-11-11T17:00,2019,11,9.5,0.0,Cloudy
12/10/2019,0:00,40.77428,-73.957306,MANHATTAN,0.0,0.0,0,0,0,0,0,0,4255497,2019-12-10 00:00:00,2019-12-10T00:00,2019,12,11.0,0.5,Drizzle
10/05/2019,14:00,40.75937,-73.97916,MANHATTAN,1.0,0.0,0,0,0,0,1,0,4219006,2019-10-05 14:00:00,2019-10-05T14:00,2019,10,13.9,0.0,Clear
04/04/2019,18:00,40.799427,-73.95341,MANHATTAN,0.0,0.0,0,0,0,0,0,0,4109137,2019-04-04 18:00:00,2019-04-04T18:00,2019,4,9.9,0.0,Cloudy
04/16/2019,7:00,40.798306,-73.93683,MANHATTAN,1.0,0.0,0,0,0,0,1,0,4115869,2019-04-16 07:00:00,2019-04-16T07:00,2019,4,7.2,0.0,Clear
08/31/2019,6:00,40.743027,-73.97952,MANHATTAN,0.0,0.0,0,0,0,0,0,0,4197428,2019-08-31 06:00:00,2019-08-31T06:00,2019,8,19.1,0.0,Cloudy
08/17/2019,6:00,40.81847,-73.9414,MANHATTAN,0.0,0.0,0,0,0,0,0,0,4198099,2019-08-17 06:00:00,2019-08-17T06:00,2019,8,22.1,0.0,Clear
07/30/2019,12:00,40.82152,-73.95448,MANHATTAN,1.0,0.0,0,0,0,0,1,0,4179916,2019-07-30 12:00:00,2019-07-30T12:00,2019,7,31.9,0.0,Clear
04/27/2019,13:00,40.740696,-73.983574,MANHATTAN,0.0,0.0,0,0,0,0,0,0,4122007,2019-04-27 13:00:00,2019-04-27T13:00,2019,4,12.2,0.0,Cloudy
06/12/2019,3:00,40.776897,-73.97547,MANHATTAN,1.0,0.0,0,0,1,0,0,0,4151197,2019-06-12 03:00:00,2019-06-12T03:00,2019,6,13.7,0.0,Clear
10/31/2019,11:00,40.718143,-73.993835,MANHATTAN,1.0,0.0,1,0,0,0,0,0,4236252,2019-10-31 11:00:00,2019-10-31T11:00,2019,10,20.3,0.7,Drizzle
05/11/2019,21:00,40.77264,-73.967575,MANHATTAN,1.0,0.0,0,0,1,0,0,0,4136300,2019-05-11 21:00:00,2019-05-11T21:00,2019,5,15.9,0.0,Cloudy
02/24/2019,7:00,40.841717,-73.94435,MANHATTAN,0.0,0.0,0,0,0,0,0,0,4085651,2019-02-24 07:00:00,2019-02-24T07:00,2019,2,5.6,4.7,Heavy Rain
07/26/2019,21:00,40.74188,-74.00546,MANHATTAN,1.0,0.0,0,0,1,0,0,0,4179090,2019-07-26 21:00:00,2019-07-26T21:00,2019,7,24.0,0.0,Clear
02/09/2019,16:00,40.752537,-74.002144,MANHATTAN,0.0,0.0,0,0,0,0,0,0,4077740,2019-02-09 16:00:00,2019-02-09T16:00,2019,2,0.4,0.0,Clear
11/11/2019,17:00,40.76248,-73.98465,MANHATTAN,1.0,0.0,0,0,0,0,1,0,4244821,2019-11-11 17:00:00,2019-11-11T17:00,2019,11,9.5,0.0,Cloudy
12/26/2019,23:00,40.762394,-73.97861,MANHATTAN,1.0,0.0,1,0,0,0,0,0,4265305,2019-12-26 23:00:00,2019-12-26T23:00,2019,12,5.6,0.0,Cloudy
08/05/2019,14:00,40.751305,-73.98353,MANHATTAN,0.0,0.0,0,0,0,0,0,0,4183478,2019-08-05 14:00:00,2019-08-05T14:00,2019,8,26.7,0.0,Cloudy
04/26/2019,18:00,40.718525,-73.98536,MANHATTAN,1.0,0.0,0,0,0,0,1,0,4121212,2019-04-26 18:00:00,2019-04-26T18:00,2019,4,15.6,1.1,Drizzle
12/12/2019,7:00,40.712597,-73.99889,MANHATTAN,0.0,0.0,0,0,0,0,0,0,4256693,2019-12-12 07:00:00,2019-12-12T07:00,2019,12,-3.1,0.0,Clear
06/28/2019,21:00,40.733715,-73.98822,MANHATTAN,0.0,0.0,0,0,0,0,0,0,4162269,2019-06-28 21:00:00,2019-06-28T21:00,2019,6,24.2,0.0,Cloudy
11/16/2019,15:00,40.762184,-73.993614,MANHATTAN,1.0,0.0,1,0,0,0,0,0,4243855,2019-11-16 15:00:00,2019-11-16T15:00,2019,11,4.0,0.0,Clear
07/30/2019,18:00,40.837765,-73.94759,MANHATTAN,0.0,0.0,0,0,0,0,0,0,4180123,2019-07-30 18:00:00,2019-07-30T18:00,2019,7,28.5,0.0,Clear
05/24/2019,7:00,40.762043,-73.96971,MANHATTAN,0.0,0.0,0,0,0,0,0,0,4137867,2019-05-24 07:00:00,2019-05-24T07:00,2019,5,19.6,0.0,Clear
05/29/2019,19:00,40.718555,-73.988205,MANHATTAN,2.0,0.0,0,0,0,0,2,0,4141928,2019-05-29 19:00:00,2019-05-29T19:00,2019,5,14.4,0.0,Cloudy
09/03/2019,20:00,40.823887,-73.95232,MANHATTAN,1.0,0.0,1,0,0,0,0,0,4199786,2019-09-03 20:00:00,2019-09-03T20:00,2019,9,20.4,0.0,Clear
11/19/2019,9:00,40.707966,-74.013596,MANHATTAN,1.0,0.0,0,0,0,0,1,0,4244391,2019-11-19 09:00:00,2019-11-19T09:00,2019,11,6.2,0.0,Cloudy
11/25/2019,9:00,40.724693,-73.7541,QUEENS,1.0,0.0,0,0,0,0,1,0,4247270,2019-11-25 09:00:00,2019-11-25T09:00,2019,11,5.8,0.0,Clear
01/01/2019,11:00,40.689842,-73.850075,QUEENS,1.0,0.0,0,0,0,0,1,0,4061133,2019-01-01 11:00:00,2019-01-01T11:00,2019,1,14.6,0.0,Cloudy
10/23/2019,10:00,40.74561,-73.887474,QUEENS,1.0,0.0,1,0,0,0,0,0,4229820,2019-10-23 10:00:00,2019-10-23T10:00,2019,10,16.6,0.0,Clear
10/03/2019,9:00,40.757988,-73.897934,QUEENS,0.0,0.0,0,0,0,0,0,0,4216982,2019-10-03 09:00:00,2019-10-03T09:00,2019,10,13.4,1.0,Drizzle
11/24/2019,17:00,40.714935,-73.81636,QUEENS,0.0,0.0,0,0,0,0,0,0,4246619,2019-11-24 17:00:00,2019-11-24T17:00,2019,11,4.9,0.2,Drizzle
12/11/2019,5:00,40.770126,-73.89738,QUEENS,1.0,0.0,0,0,1,0,0,0,4256036,2019-12-11 05:00:00,2019-12-11T05:00,2019,12,1.3,1.3,Heavy Snow
05/16/2019,14:00,40.747055,-73.71194,QUEENS,1.0,0.0,0,0,0,0,1,0,4133064,2019-05-16 14:00:00,2019-05-16T14:00,2019,5,20.0,0.0,Clear
11/25/2019,16:00,40.769886,-73.92781,QUEENS,1.0,0.0,0,0,0,0,1,0,4248468,2019-11-25 16:00:00,2019-11-25T16:00,2019,11,9.2,0.0,Clear
11/20/2019,1:00,40.687862,-73.78393,QUEENS,1.0,0.0,0,0,0,0,1,0,4244580,2019-11-20 01:00:00,2019-11-20T01:00,2019,11,4.7,0.0,Cloudy
10/02/2019,19:00,40.725918,-73.89535,QUEENS,1.0,0.0,1,0,0,0,0,0,4217374,2019-10-02 19:00:00,2019-10-02T19:00,2019,10,24.7,0.0,Cloudy
06/22/2019,1:00,40.69317,-73.74483,QUEENS,1.0,0.0,0,0,0,0,1,0,4156177,2019-06-22 01:00:00,2019-06-22T01:00,2019,6,17.4,0.0,Clear
02/11/2019,21:00,40.667038,-73.757324,QUEENS,1.0,0.0,0,0,0,0,1,0,4079386,2019-02-11 21:00:00,2019-02-11T21:00,2019,2,0.3,0.0,Cloudy
11/07/2019,8:00,40.71343,-73.780594,QUEENS,0.0,0.0,0,0,0,0,0,0,4238495,2019-11-07 08:00:00,2019-11-07T08:00,2019,11,11.0,0.0,Cloudy
10/04/2019,16:00,40.668476,-73.73274,QUEENS,2.0,0.0,0,0,0,0,2,0,4217752,2019-10-04 16:00:00,2019-10-04T16:00,2019,10,15.5,0.0,Clear
01/31/2019,16:00,40.66487,-73.77235,QUEENS,1.0,0.0,0,0,0,0,1,0,4072562,2019-01-31 16:00:00,2019-01-31T16:00,2019,1,-8.4,0.0,Clear
08/24/2019,13:00,40.77965,-73.775444,QUEENS,0.0,0.0,0,0,0,0,0,0,4193936,2019-08-24 13:00:00,2019-08-24T13:00,2019,8,24.1,0.0,Clear
06/10/2019,21:00,40.740704,-73.931526,QUEENS,0.0,0.0,0,0,0,0,0,0,4153815,2019-06-10 21:00:00,2019-06-10T21:00,2019,6,19.8,1.1,Drizzle
11/12/2019,16:00,40.712204,-73.88638,QUEENS,1.0,0.0,0,0,0,0,1,0,4240215,2019-11-12 16:00:00,2019-11-12T16:00,2019,11,0.9,0.0,Cloudy
01/15/2019,16:00,40.70417,-73.81538,QUEENS,1.0,0.0,1,0,0,0,0,0,4067633,2019-01-15 16:00:00,2019-01-15T16:00,2019,1,1.2,0.0,Cloudy
11/15/2019,14:00,40.73478,-73.80102,QUEENS,3.0,0.0,0,0,0,0,3,0,4241631,2019-11-15 14:00:00,2019-11-15T14:00,2019,11,9.8,0.0,Clear
05/18/2019,11:00,40.716244,-73.88149,QUEENS,0.0,0.0,0,0,0,0,0,0,4134313,2019-05-18 11:00:00,2019-05-18T11:00,2019,5,20.1,0.0,Clear
12/24/2019,0:00,40.57143,-73.85622,QUEENS,2.0,0.0,0,0,0,0,2,0,4264229,2019-12-24 00:00:00,2019-12-24T00:00,2019,12,4.9,0.0,Clear
11/16/2019,12:00,40.76536,-73.82787,QUEENS,1.0,0.0,1,0,0,0,0,0,4242004,2019-11-16 12:00:00,2019-11-16T12:00,2019,11,3.5,0.0,Clear
08/14/2019,21:00,40.784565,-73.82141,QUEENS,2.0,0.0,0,0,0,0,2,0,4188778,2019-08-14 21:00:00,2019-08-14T21:00,2019,8,22.1,0.0,Cloudy
12/20/2019,11:00,40.713,-73.78237,QUEENS,1.0,0.0,0,0,0,0,1,0,4261795,2019-12-20 11:00:00,2019-12-20T11:00,2019,12,-1.4,0.0,Clear
12/10/2019,14:00,40.674885,-73.839386,QUEENS,0.0,0.0,0,0,0,0,0,0,4256202,2019-12-10 14:00:00,2019-12-10T14:00,2019,12,12.8,0.7,Drizzle
03/06/2019,18:00,40.71446,-73.77634,QUEENS,0.0,0.0,0,0,0,0,0,0,4092299,2019-03-06 18:00:00,2019-03-06T18:00,2019,3,-5.0,0.0,Cloudy
03/15/2019,17:00,40.693733,-73.78811,QUEENS,3.0,0.0,0,0,0,0,3,0,4097469,2019-03-15 17:00:00,2019-03-15T17:00,2019,3,10.4,0.0,Cloudy
05/17/2019,8:00,40.66549,-73.75236,QUEENS,3.0,0.0,0,0,0,0,3,0,4133471,2019-05-17 08:00:00,2019-05-17T08:00,2019,5,18.5,0.0,Cloudy
12/18/2019,18:00,40.73091,-73.86084,QUEENS,1.0,0.0,1,0,0,0,0,0,4285070,2019-12-18 18:00:00,2019-12-18T18:00,2019,12,-0.3,0.0,Clear
07/17/2019,1:00,40.687447,-73.748856,QUEENS,4.0,0.0,0,0,0,0,4,0,4172062,2019-07-17 01:00:00,2019-07-17T01:00,2019,7,25.5,0.0,Clear
01/24/2019,12:00,40.7185,-73.73531,QUEENS,1.0,0.0,1,0,0,0,0,0,4068550,2019-01-24 12:00:00,2019-01-24T12:00,2019,1,12.1,3.4,Heavy Rain
08/20/2019,15:00,40.72658,-73.82176,QUEENS,0.0,0.0,0,0,0,0,0,0,4191881,2019-08-20 15:00:00,2019-08-20T15:00,2019,8,28.7,0.0,Clear
02/16/2019,4:00,40.721004,-73.7511,QUEENS,1.0,0.0,0,0,0,0,1,0,4081575,2019-02-16 04:00:00,2019-02-16T04:00,2019,2,0.8,0.0,Cloudy
03/07/2019,16:00,40.738804,-73.87384,QUEENS,1.0,0.0,1,0,0,0,0,0,4098947,2019-03-07 16:00:00,2019-03-07T16:00,2019,3,0.6,0.0,Cloudy
09/14/2019,20:00,40.69908,-73.758255,QUEENS,1.0,0.0,0,0,0,0,1,0,4205902,2019-09-14 20:00:00,2019-09-14T20:00,2019,9,21.6,0.4,Drizzle
01/30/2019,6:00,0.0,0.0,QUEENS,0.0,0.0,0,0,0,0,0,0,4071873,2019-01-30 06:00:00,2019-01-30T06:00,2019,1,27.9,0.0,Cloudy
10/30/2019,15:00,40.65616,-73.76736,QUEENS,0.0,0.0,0,0,0,0,0,0,4232320,2019-10-30 15:00:00,2019-10-30T15:00,2019,10,19.1,0.0,Cloudy
10/02/2019,13:00,40.673008,-73.81334,QUEENS,0.0,0.0,0,0,0,0,0,0,4217497,2019-10-02 13:00:00,2019-10-02T13:00,2019,10,32.3,0.0,Clear
10/11/2019,9:00,40.75813,-73.85696,QUEENS,2.0,0.0,0,0,0,0,2,0,4221438,2019-10-11 09:00:00,2019-10-11T09:00,2019,10,14.5,0.0,Clear
04/03/2019,0:00,40.685905,-73.73484,QUEENS,3.0,0.0,0,0,0,0,3,0,4108218,2019-04-03 00:00:00,2019-04-03T00:00,2019,4,4.5,0.5,Drizzle
11/01/2019,21:00,40.757008,-73.83025,QUEENS,1.0,0.0,0,0,1,0,0,0,4233875,2019-11-01 21:00:00,2019-11-01T21:00,2019,11,7.3,0.0,Clear
04/15/2019,18:00,40.680687,-73.84459,QUEENS,1.0,0.0,0,0,0,0,1,0,4115296,2019-04-15 18:00:00,2019-04-15T18:00,2019,4,9.5,0.0,Cloudy
02/25/2019,20:00,40.755486,-73.82472,QUEENS,1.0,0.0,1,0,0,0,0,0,4086769,2019-02-25 20:00:00,2019-02-25T20:00,2019,2,0.3,0.0,Clear
06/30/2019,15:00,40.76959,-73.872696,QUEENS,0.0,0.0,0,0,0,0,0,0,4165497,2019-06-30 15:00:00,2019-06-30T15:00,2019,6,26.5,0.0,Clear
02/13/2019,15:00,40.734993,-73.936295,QUEENS,1.0,0.0,0,0,0,0,1,0,4080181,2019-02-13 15:00:00,2019-02-13T15:00,2019,2,3.5,0.0,Cloudy
07/12/2019,15:00,40.708183,-73.877045,QUEENS,0.0,0.0,0,0,0,0,0,0,4169508,2019-07-12 15:00:00,2019-07-12T15:00,2019,7,30.0,0.0,Cloudy
02/16/2019,14:00,40.714584,-73.84831,QUEENS,1.0,0.0,0,0,0,0,1,0,4081720,2019-02-16 14:00:00,2019-02-16T14:00,2019,2,5.3,0.0,Clear
06/26/2019,19:00,40.708908,-73.76631,QUEENS,2.0,0.0,0,0,0,0,2,0,4159408,2019-06-26 19:00:00,2019-06-26T19:00,2019,6,24.4,0.0,Clear
07/11/2019,13:00,40.71051,-73.87234,QUEENS,1.0,0.0,0,0,1,0,0,0,4168251,2019-07-11 13:00:00,2019-07-11T13:00,2019,7,26.4,0.0,Cloudy
11/20/2019,11:00,40.749897,-73.93782,QUEENS,1.0,0.0,0,0,1,0,0,0,4244629,2019-11-20 11:00:00,2019-11-20T11:00,2019,11,6.1,0.0,Cloudy
01/10/2019,17:00,40.66671,-73.78039,QUEENS,1.0,0.0,0,0,0,0,1,0,4064948,2019-01-10 17:00:00,2019-01-10T17:00,2019,1,-0.8,0.0,Clear
04/01/2019,11:00,40.756287,-73.860725,QUEENS,1.0,0.0,0,0,0,0,1,0,4106877,2019-04-01 11:00:00,2019-04-01T11:00,2019,4,5.5,0.0,Cloudy
02/11/2019,8:00,40.74499,-73.764336,QUEENS,1.0,0.0,1,0,0,0,0,0,4078722,2019-02-11 08:00:00,2019-02-11T08:00,2019,2,-1.0,0.0,Cloudy
12/23/2019,15:00,40.718266,-73.87715,QUEENS,0.0,0.0,0,0,0,0,0,0,4263847,2019-12-23 15:00:00,2019-12-23T15:00,2019,12,10.4,0.0,Clear
09/25/2019,14:00,40.743973,-73.8851,QUEENS,1.0,0.0,1,0,0,0,0,0,4212463,2019-09-25 14:00:00,2019-09-25T14:00,2019,9,25.0,0.0,Clear
01/26/2019,14:00,40.76229,-73.75711,QUEENS,4.0,0.0,0,0,0,0,4,0,4069313,2019-01-26 14:00:00,2019-01-26T14:00,2019,1,0.2,0.0,Clear
09/11/2019,22:00,40.70601,-73.76912,QUEENS,0.0,0.0,0,0,0,0,0,0,4204465,2019-09-11 22:00:00,2019-09-11T22:00,2019,9,25.4,0.0,Cloudy
09/06/2019,23:00,40.748924,-73.937386,QUEENS,1.0,0.0,0,0,0,0,1,0,4202382,2019-09-06 23:00:00,2019-09-06T23:00,2019,9,15.7,0.8,Drizzle
10/03/2019,19:00,40.769543,-73.7924,QUEENS,1.0,0.0,0,0,1,0,0,0,4217313,2019-10-03 19:00:00,2019-10-03T19:00,2019,10,14.2,0.2,Drizzle
01/09/2019,20:00,40.695026,-73.75643,QUEENS,1.0,0.0,0,0,0,0,1,0,4064703,2019-01-09 20:00:00,2019-01-09T20:00,2019,1,2.4,0.0,Clear
03/08/2019,17:00,40.665474,-73.74751,QUEENS,3.0,0.0,0,0,0,0,3,0,4093456,2019-03-08 17:00:00,2019-03-08T17:00,2019,3,2.4,0.0,Cloudy
05/08/2019,18:00,40.76635,-73.873024,QUEENS,4.0,0.0,0,0,0,0,4,0,4128890,2019-05-08 18:00:00,2019-05-08T18:00,2019,5,14.3,0.0,Clear
04/17/2019,16:00,40.755875,-73.882454,QUEENS,1.0,0.0,1,0,0,0,0,0,4117111,2019-04-17 16:00:00,2019-04-17T16:00,2019,4,12.2,0.0,Cloudy
11/21/2019,9:00,40.721626,-73.90312,QUEENS,1.0,0.0,0,0,0,0,1,0,4245113,2019-11-21 09:00:00,2019-11-21T09:00,2019,11,5.4,0.0,Clear
05/24/2019,16:00,40.739986,-73.86093,QUEENS,0.0,0.0,0,0,0,0,0,0,4139082,2019-05-24 16:00:00,2019-05-24T16:00,2019,5,22.5,0.0,Cloudy
09/15/2019,19:00,40.768734,-73.89156,QUEENS,2.0,0.0,0,0,0,0,2,0,4206257,2019-09-15 19:00:00,2019-09-15T19:00,2019,9,22.1,0.0,Cloudy
09/08/2019,16:00,40.774933,-73.92916,QUEENS,0.0,0.0,0,0,0,0,0,0,4201932,2019-09-08 16:00:00,2019-09-08T16:00,2019,9,24.7,0.0,Cloudy
08/24/2019,19:00,40.748466,-73.87352,QUEENS,0.0,0.0,0,0,0,0,0,0,4193984,2019-08-24 19:00:00,2019-08-24T19:00,2019,8,21.2,0.0,Clear
06/04/2019,12:00,40.67943,-73.83829,QUEENS,0.0,0.0,0,0,0,0,0,0,4145319,2019-06-04 12:00:00,2019-06-04T12:00,2019,6,19.2,0.0,Cloudy
06/26/2019,18:00,40.75669,-73.808266,QUEENS,1.0,0.0,0,0,0,0,1,0,4159557,2019-06-26 18:00:00,2019-06-26T18:00,2019,6,25.8,0.0,Clear
12/30/2019,16:00,40.706314,-73.91363,QUEENS,0.0,0.0,0,0,0,0,0,0,4281313,2019-12-30 16:00:00,2019-12-30T16:00,2019,12,5.5,0.6,Drizzle
10/21/2019,7:00,40.67229,-73.79391,QUEENS,4.0,0.0,0,0,0,0,4,0,4226955,2019-10-21 07:00:00,2019-10-21T07:00,2019,10,10.5,0.0,Clear
09/04/2019,11:00,40.74192,-73.81646,QUEENS,1.0,0.0,0,0,0,0,1,0,4199802,2019-09-04 11:00:00,2019-09-04T11:00,2019,9,27.7,0.0,Cloudy
01/18/2019,8:00,40.67573,-73.81926,QUEENS,1.0,0.0,0,0,0,0,1,0,4057077,2019-01-18 08:00:00,2019-01-18T08:00,2019,1,-0.8,0.1,Light Snow
09/29/2019,9:00,40.67267,-73.77738,QUEENS,0.0,0.0,0,0,0,0,0,0,4215390,2019-09-29 09:00:00,2019-09-29T09:00,2019,9,22.8,0.0,Clear
02/28/2019,15:00,40.695683,-73.741875,QUEENS,2.0,0.0,0,0,0,0,2,0,4089305,2019-02-28 15:00:00,2019-02-28T15:00,2019,2,2.3,0.0,Cloudy
09/06/2019,11:00,40.717686,-73.793526,QUEENS,1.0,0.0,0,0,0,0,1,0,4200785,2019-09-06 11:00:00,2019-09-06T11:00,2019,9,19.7,0.7,Drizzle
09/25/2019,8:00,40.776806,-73.800804,QUEENS,1.0,0.0,0,0,1,0,0,0,4212181,2019-09-25 08:00:00,2019-09-25T08:00,2019,9,17.6,0.0,Clear
01/27/2019,22:00,40.677654,-73.82866,QUEENS,0.0,0.0,0,0,0,0,0,0,4070261,2019-01-27 22:00:00,2019-01-27T22:00,2019,1,2.8,0.0,Cloudy
05/26/2019,8:00,40.71639,-73.80299,QUEENS,0.0,0.0,0,0,0,0,0,0,4142299,2019-05-26 08:00:00,2019-05-26T08:00,2019,5,20.9,0.0,Clear
11/01/2019,0:00,40.66546,-73.747284,QUEENS,2.0,0.0,0,0,0,0,2,0,4233590,2019-11-01 00:00:00,2019-11-01T00:00,2019,11,20.3,0.8,Drizzle
02/16/2019,0:00,40.739338,-73.7081,QUEENS,1.0,0.0,0,0,0,0,1,0,4081673,2019-02-16 00:00:00,2019-02-16T00:00,2019,2,6.3,0.0,Cloudy
09/19/2019,21:00,40.67632,-73.79835,QUEENS,0.0,0.0,0,0,0,0,0,0,4211807,2019-09-19 21:00:00,2019-09-19T21:00,2019,9,15.5,0.0,Clear
08/23/2019,20:00,40.666855,-73.80425,QUEENS,0.0,0.0,0,0,0,0,0,0,4193673,2019-08-23 20:00:00,2019-08-23T20:00,2019,8,21.0,0.0,Clear
05/31/2019,16:00,40.723755,-73.89948,QUEENS,1.0,0.0,0,0,1,0,0,0,4143041,2019-05-31 16:00:00,2019-05-31T16:00,2019,5,25.4,0.0,Cloudy
05/15/2019,8:00,40.74467,-73.8951,QUEENS,0.0,0.0,0,0,0,0,0,0,4132684,2019-05-15 08:00:00,2019-05-15T08:00,2019,5,11.0,0.0,Clear
11/27/2019,18:00,40.723995,-73.90864,QUEENS,1.0,0.0,1,0,0,0,0,0,4248745,2019-11-27 18:00:00,2019-11-27T18:00,2019,11,11.0,0.5,Drizzle
05/18/2019,18:00,40.691208,-73.813545,QUEENS,1.0,0.0,1,0,0,0,0,0,4139740,2019-05-18 18:00:00,2019-05-18T18:00,2019,5,15.5,0.0,Cloudy
01/24/2019,8:00,40.609535,-73.75372,QUEENS,1.0,0.0,1,0,0,0,0,0,4060121,2019-01-24 08:00:00,2019-01-24T08:00,2019,1,9.5,1.8,Light Rain
03/17/2019,18:00,40.774284,-73.84183,QUEENS,1.0,0.0,0,0,1,0,0,0,4098407,2019-03-17 18:00:00,2019-03-17T18:00,2019,3,3.1,0.0,Clear
01/02/2019,22:00,40.750916,-73.87317,QUEENS,1.0,0.0,0,0,1,0,0,0,4060962,2019-01-02 22:00:00,2019-01-02T22:00,2019,1,2.6,0.0,Cloudy
10/16/2019,0:00,40.676075,-73.74577,QUEENS,1.0,0.0,0,0,0,0,1,0,4224219,2019-10-16 00:00:00,2019-10-16T00:00,2019,10,13.5,0.0,Clear
03/18/2019,17:00,40.724113,-73.79676,QUEENS,1.0,0.0,1,0,0,0,0,0,4102070,2019-03-18 17:00:00,2019-03-18T17:00,2019,3,3.5,0.0,Cloudy
12/13/2019,13:00,40.73856,-73.85524,QUEENS,0.0,0.0,0,0,0,0,0,0,4257699,2019-12-13 13:00:00,2019-12-13T13:00,2019,12,7.6,0.4,Drizzle
12/15/2019,7:00,40.753456,-73.941414,QUEENS,1.0,0.0,0,0,0,0,1,0,4258466,2019-12-15 07:00:00,2019-12-15T07:00,2019,12,5.3,0.0,Cloudy
09/11/2019,13:00,40.66549,-73.819534,QUEENS,0.0,0.0,0,0,0,0,0,0,4204147,2019-09-11 13:00:00,2019-09-11T13:00,2019,9,26.9,0.0,Cloudy
12/23/2019,15:00,40.69444,-73.75868,QUEENS,1.0,0.0,1,0,0,0,0,0,4263440,2019-12-23 15:00:00,2019-12-23T15:00,2019,12,10.5,0.0,Clear
09/04/2019,17:00,40.715145,-73.74935,QUEENS,1.0,0.0,0,0,0,0,1,0,4199685,2019-09-04 17:00:00,2019-09-04T17:00,2019,9,26.6,0.5,Drizzle
11/09/2019,8:00,40.694107,-73.89737,QUEENS,1.0,0.0,0,0,0,0,1,0,4239537,2019-11-09 08:00:00,2019-11-09T08:00,2019,11,-0.7,0.0,Clear
12/01/2019,18:00,40.69068,-73.727295,QUEENS,1.0,0.0,1,0,0,0,0,0,4251044,2019-12-01 18:00:00,2019-12-01T18:00,2019,12,6.4,2.4,Light Rain
02/13/2019,18:00,40.7522,-73.89236,QUEENS,0.0,0.0,0,0,0,0,0,0,4080170,2019-02-13 18:00:00,2019-02-13T18:00,2019,2,0.0,0.0,Clear
06/12/2019,10:00,40.605274,-73.75516,QUEENS,0.0,0.0,0,0,0,0,0,0,4150043,2019-06-12 10:00:00,2019-06-12T10:00,2019,6,18.2,0.0,Cloudy
09/09/2019,5:00,40.697525,-73.746826,QUEENS,5.0,0.0,0,0,0,0,5,0,4202060,2019-09-09 05:00:00,2019-09-09T05:00,2019,9,17.1,0.0,Cloudy
02/01/2019,12:00,40.78025,-73.819176,QUEENS,1.0,0.0,0,0,0,0,1,0,4073006,2019-02-01 12:00:00,2019-02-01T12:00,2019,2,-7.7,0.0,Cloudy
09/20/2019,23:00,40.68325,-73.81869,QUEENS,0.0,0.0,0,0,0,0,0,0,4209672,2019-09-20 23:00:00,2019-09-20T23:00,2019,9,17.3,0.0,Clear
01/22/2019,10:00,40.680687,-73.84459,QUEENS,1.0,0.0,0,0,0,0,1,0,4059198,2019-01-22 10:00:00,2019-01-22T10:00,2019,1,-7.1,0.0,Clear
01/12/2019,0:00,40.70705,-73.79693,QUEENS,1.0,0.0,0,0,0,0,1,0,4065615,2019-01-12 00:00:00,2019-01-12T00:00,2019,1,-6.0,0.0,Clear
05/16/2019,10:00,40.711628,-73.729385,QUEENS,2.0,0.0,0,0,0,0,2,0,4133206,2019-05-16 10:00:00,2019-05-16T10:00,2019,5,18.4,0.0,Clear
04/27/2019,17:00,40.673145,-73.77551,QUEENS,1.0,0.0,1,0,0,0,0,0,4121514,2019-04-27 17:00:00,2019-04-27T17:00,2019,4,11.5,0.0,Clear
04/02/2019,18:00,40.73661,-73.81473,QUEENS,0.0,0.0,0,0,0,0,0,0,4107650,2019-04-02 18:00:00,2019-04-02T18:00,2019,4,5.7,0.1,Drizzle
08/05/2019,12:00,40.75199,-73.931274,QUEENS,0.0,0.0,0,0,0,0,0,0,4183557,2019-08-05 12:00:00,2019-08-05T12:00,2019,8,27.6,0.0,Cloudy
01/23/2019,8:00,40.657406,-73.74507,QUEENS,2.0,0.0,0,0,0,0,2,0,4059602,2019-01-23 08:00:00,2019-01-23T08:00,2019,1,0.6,0.0,Cloudy
06/22/2019,4:00,40.72416,-73.754974,QUEENS,1.0,0.0,0,0,0,0,1,0,4156179,2019-06-22 04:00:00,2019-06-22T04:00,2019,6,15.6,0.0,Clear
01/23/2019,20:00,40.77369,-73.741875,QUEENS,1.0,0.0,1,0,0,0,0,0,4069705,2019-01-23 20:00:00,2019-01-23T20:00,2019,1,7.3,0.0,Cloudy
03/05/2019,21:00,40.67452,-73.736084,QUEENS,1.0,0.0,0,0,0,0,1,0,4091707,2019-03-05 21:00:00,2019-03-05T21:00,2019,3,-3.3,0.0,Clear
02/14/2019,13:00,40.691277,-73.746254,QUEENS,5.0,0.0,0,0,0,0,5,0,4081557,2019-02-14 13:00:00,2019-02-14T13:00,2019,2,5.3,0.0,Clear
03/06/2019,7:00,40.66796,-73.77155,QUEENS,1.0,0.0,0,0,0,0,1,0,4091995,2019-03-06 07:00:00,2019-03-06T07:00,2019,3,-7.6,0.0,Clear
07/07/2019,14:00,40.72033,-73.76115,QUEENS,1.0,0.0,0,0,0,0,1,0,4166995,2019-07-07 14:00:00,2019-07-07T14:00,2019,7,26.2,0.3,Drizzle
05/02/2019,9:00,40.69366,-73.85217,QUEENS,1.0,0.0,0,0,0,0,1,0,4124219,2019-05-02 09:00:00,2019-05-02T09:00,2019,5,15.4,0.0,Cloudy
12/19/2019,9:00,40.666492,-73.76536,QUEENS,1.0,0.0,0,0,0,0,1,0,4261032,2019-12-19 09:00:00,2019-12-19T09:00,2019,12,-7.3,0.0,Clear
01/07/2019,9:00,40.592793,-73.77788,QUEENS,1.0,0.0,0,0,0,0,1,0,4063366,2019-01-07 09:00:00,2019-01-07T09:00,2019,1,-2.7,0.0,Cloudy
06/26/2019,16:00,40.741364,-73.92096,QUEENS,1.0,0.0,0,0,1,0,0,0,4159669,2019-06-26 16:00:00,2019-06-26T16:00,2019,6,29.5,0.0,Clear
10/03/2019,8:00,40.67045,-73.793335,QUEENS,2.0,0.0,0,0,0,0,2,0,4217756,2019-10-03 08:00:00,2019-10-03T08:00,2019,10,13.2,0.3,Drizzle
09/24/2019,22:00,40.73602,-73.87954,QUEENS,2.0,0.0,0,0,0,0,2,0,4212454,2019-09-24 22:00:00,2019-09-24T22:00,2019,9,16.7,0.0,Cloudy
09/07/2019,16:00,40.754208,-73.812225,QUEENS,0.0,0.0,0,0,0,0,0,0,4201418,2019-09-07 16:00:00,2019-09-07T16:00,2019,9,23.6,0.0,Clear
03/25/2019,10:00,40.767853,-73.934235,QUEENS,0.0,0.0,0,0,0,0,0,0,4102910,2019-03-25 10:00:00,2019-03-25T10:00,2019,3,8.9,0.0,Cloudy
10/23/2019,8:00,40.792076,-73.80447,QUEENS,1.0,0.0,0,0,0,0,1,0,4228414,2019-10-23 08:00:00,2019-10-23T08:00,2019,10,14.5,0.0,Clear
11/14/2019,8:00,40.724255,-73.91251,QUEENS,1.0,0.0,1,0,0,0,0,0,4240960,2019-11-14 08:00:00,2019-11-14T08:00,2019,11,-1.5,0.0,Cloudy
01/08/2019,23:00,40.66535,-73.73071,QUEENS,2.0,0.0,0,0,0,0,2,0,4064428,2019-01-08 23:00:00,2019-01-08T23:00,2019,1,5.4,0.0,Cloudy
06/22/2019,18:00,40.67252,-73.8106,QUEENS,1.0,0.0,0,0,0,0,1,0,4156350,2019-06-22 18:00:00,2019-06-22T18:00,2019,6,22.7,0.0,Clear
07/28/2019,13:00,40.692135,-73.83485,QUEENS,1.0,0.0,0,0,0,0,1,0,4178720,2019-07-28 13:00:00,2019-07-28T13:00,2019,7,29.0,0.0,Clear
05/22/2019,16:00,40.704044,-73.79839,QUEENS,0.0,0.0,0,0,0,0,0,0,4137015,2019-05-22 16:00:00,2019-05-22T16:00,2019,5,22.0,0.0,Cloudy
11/14/2019,18:00,40.740837,-73.7583,QUEENS,0.0,0.0,0,0,0,0,0,0,4241158,2019-11-14 18:00:00,2019-11-14T18:00,2019,11,3.8,0.0,Cloudy
06/11/2019,17:00,40.719852,-73.73573,QUEENS,1.0,0.0,0,0,0,0,1,0,4149687,2019-06-11 17:00:00,2019-06-11T17:00,2019,6,22.5,0.0,Clear
10/18/2019,14:00,40.665096,-73.81663,QUEENS,0.0,0.0,0,0,0,0,0,0,4225382,2019-10-18 14:00:00,2019-10-18T14:00,2019,10,15.2,0.0,Cloudy
06/14/2019,21:00,40.68779,-73.820175,QUEENS,1.0,0.0,0,0,0,0,1,0,4151678,2019-06-14 21:00:00,2019-06-14T21:00,2019,6,17.1,0.0,Clear
10/20/2019,4:00,40.76464,-73.88499,QUEENS,0.0,0.0,0,0,0,0,0,0,4226289,2019-10-20 04:00:00,2019-10-20T04:00,2019,10,9.4,0.0,Cloudy
10/11/2019,14:00,40.740784,-73.89893,QUEENS,0.0,0.0,0,0,0,0,0,0,4222414,2019-10-11 14:00:00,2019-10-11T14:00,2019,10,15.1,0.0,Cloudy
06/20/2019,22:00,40.767555,-73.91203,QUEENS,1.0,0.0,1,0,0,0,0,0,4157765,2019-06-20 22:00:00,2019-06-20T22:00,2019,6,22.4,0.0,Cloudy
02/05/2019,0:00,40.663788,-73.734024,QUEENS,1.0,0.0,0,0,0,0,1,0,4075503,2019-02-05 00:00:00,2019-02-05T00:00,2019,2,1.9,0.0,Cloudy
08/28/2019,19:00,40.695156,-73.761765,QUEENS,1.0,0.0,1,0,0,0,0,0,4198565,2019-08-28 19:00:00,2019-08-28T19:00,2019,8,22.1,0.7,Drizzle
06/28/2019,12:00,40.738857,-73.816086,QUEENS,1.0,0.0,1,0,0,0,0,0,4160876,2019-06-28 12:00:00,2019-06-28T12:00,2019,6,30.3,0.0,Cloudy
07/17/2019,15:00,40.756145,-73.8798,QUEENS,2.0,0.0,0,0,0,0,2,0,4172098,2019-07-17 15:00:00,2019-07-17T15:00,2019,7,29.6,0.0,Cloudy
08/24/2019,10:00,40.67699,-73.74308,QUEENS,1.0,0.0,0,0,0,0,1,0,4193757,2019-08-24 10:00:00,2019-08-24T10:00,2019,8,22.2,0.0,Clear
05/22/2019,22:00,40.707947,-73.78331,QUEENS,1.0,0.0,1,0,0,0,0,0,4138624,2019-05-22 22:00:00,2019-05-22T22:00,2019,5,15.4,0.0,Cloudy
08/12/2019,9:00,40.708313,-73.87218,QUEENS,1.0,0.0,0,0,0,0,1,0,4187419,2019-08-12 09:00:00,2019-08-12T09:00,2019,8,25.8,0.0,Clear
02/15/2019,10:00,40.748108,-73.947365,QUEENS,1.0,0.0,1,0,0,0,0,0,4083163,2019-02-15 10:00:00,2019-02-15T10:00,2019,2,11.4,0.0,Cloudy
10/07/2019,8:00,40.764053,-73.8422,QUEENS,0.0,0.0,0,0,0,0,0,0,4219523,2019-10-07 08:00:00,2019-10-07T08:00,2019,10,22.1,0.0,Cloudy
08/05/2019,19:00,40.73395,-73.87178,QUEENS,1.0,0.0,0,0,1,0,0,0,4184070,2019-08-05 19:00:00,2019-08-05T19:00,2019,8,25.2,0.0,Cloudy
11/26/2019,18:00,40.753143,-73.75645,QUEENS,1.0,0.0,1,0,0,0,0,0,4248071,2019-11-26 18:00:00,2019-11-26T18:00,2019,11,8.9,0.0,Cloudy
10/25/2019,22:00,40.740875,-73.89962,QUEENS,0.0,0.0,0,0,0,0,0,0,4229565,2019-10-25 22:00:00,2019-10-25T22:00,2019,10,13.8,0.0,Cloudy
12/12/2019,10:00,40.758617,-73.89197,QUEENS,0.0,0.0,0,0,0,0,0,0,4256950,2019-12-12 10:00:00,2019-12-12T10:00,2019,12,-1.2,0.0,Cloudy
06/16/2019,7:00,40.764126,-73.92776,QUEENS,0.0,0.0,0,0,0,0,0,0,4154023,2019-06-16 07:00:00,2019-06-16T07:00,2019,6,20.8,0.0,Clear
03/18/2019,16:00,40.747234,-73.709045,QUEENS,1.0,0.0,0,0,0,0,1,0,4099046,2019-03-18 16:00:00,2019-03-18T16:00,2019,3,4.7,0.0,Cloudy
04/17/2019,18:00,40.75613,-73.81559,QUEENS,1.0,0.0,0,0,0,0,1,0,4116629,2019-04-17 18:00:00,2019-04-17T18:00,2019,4,9.1,0.0,Cloudy
08/06/2019,17:00,40.666393,-73.764465,QUEENS,1.0,0.0,0,0,0,0,1,0,4184056,2019-08-06 17:00:00,2019-08-06T17:00,2019,8,25.4,0.0,Cloudy
04/25/2019,17:00,40.743454,-73.91484,QUEENS,1.0,0.0,0,0,1,0,0,0,4121037,2019-04-25 17:00:00,2019-04-25T17:00,2019,4,11.4,0.5,Drizzle
03/11/2019,17:00,40.724674,-73.79513,QUEENS,1.0,0.0,0,0,0,0,1,0,4095114,2019-03-11 17:00:00,2019-03-11T17:00,2019,3,9.5,0.0,Clear
08/22/2019,11:00,40.751785,-73.82878,QUEENS,1.0,0.0,0,0,1,0,0,0,4192941,2019-08-22 11:00:00,2019-08-22T11:00,2019,8,29.9,0.1,Drizzle
06/14/2019,14:00,40.671825,-73.774506,QUEENS,1.0,0.0,1,0,0,0,0,0,4151706,2019-06-14 14:00:00,2019-06-14T14:00,2019,6,21.0,0.0,Clear
11/25/2019,17:00,40.72994,-73.74481,QUEENS,0.0,0.0,0,0,0,0,0,0,4247449,2019-11-25 17:00:00,2019-11-25T17:00,2019,11,7.4,0.0,Clear
07/21/2019,0:00,40.744316,-73.86226,QUEENS,1.0,0.0,0,0,1,0,0,0,4175139,2019-07-21 00:00:00,2019-07-21T00:00,2019,7,27.3,0.0,Clear
05/19/2019,19:00,40.760094,-73.91448,QUEENS,0.0,0.0,0,0,0,0,0,0,4134822,2019-05-19 19:00:00,2019-05-19T19:00,2019,5,17.7,0.0,Cloudy
01/14/2019,9:00,40.719486,-73.908264,QUEENS,0.0,0.0,0,0,0,0,0,0,4066709,2019-01-14 09:00:00,2019-01-14T09:00,2019,1,-5.0,0.0,Clear
06/09/2019,7:00,40.657974,-73.75202,QUEENS,1.0,0.0,0,0,0,0,1,0,4147656,2019-06-09 07:00:00,2019-06-09T07:00,2019,6,18.1,0.0,Clear
12/05/2019,19:00,40.60426,-73.75286,QUEENS,1.0,0.0,1,0,0,0,0,0,4253544,2019-12-05 19:00:00,2019-12-05T19:00,2019,12,4.5,0.0,Cloudy
11/27/2019,13:00,40.7244,-73.84981,QUEENS,0.0,0.0,0,0,0,0,0,0,4248548,2019-11-27 13:00:00,2019-11-27T13:00,2019,11,13.1,0.0,Cloudy
03/30/2019,12:00,40.72201,-73.853485,QUEENS,1.0,0.0,1,0,0,0,0,0,4105637,2019-03-30 12:00:00,2019-03-30T12:00,2019,3,14.1,0.0,Cloudy
03/07/2019,20:00,40.739956,-73.89421,QUEENS,0.0,0.0,0,0,0,0,0,0,4093646,2019-03-07 20:00:00,2019-03-07T20:00,2019,3,-3.4,0.0,Cloudy
01/10/2019,9:00,40.73025,-73.887314,QUEENS,1.0,0.0,0,0,0,0,1,0,4065797,2019-01-10 09:00:00,2019-01-10T09:00,2019,1,-0.3,0.0,Cloudy
07/02/2019,22:00,40.719913,-73.79108,QUEENS,2.0,0.0,0,0,0,0,2,0,4163439,2019-07-02 22:00:00,2019-07-02T22:00,2019,7,23.9,0.0,Cloudy
01/14/2019,8:00,40.715805,-73.887924,QUEENS,1.0,0.0,0,0,0,0,1,0,4066706,2019-01-14 08:00:00,2019-01-14T08:00,2019,1,-6.3,0.0,Cloudy
09/28/2019,7:00,40.75895,-73.83192,QUEENS,1.0,0.0,1,0,0,0,0,0,4214811,2019-09-28 07:00:00,2019-09-28T07:00,2019,9,18.7,0.0,Clear
07/26/2019,19:00,40.716072,-73.90352,QUEENS,0.0,0.0,0,0,0,0,0,0,4178057,2019-07-26 19:00:00,2019-07-26T19:00,2019,7,24.9,0.0,Clear
11/29/2019,22:00,40.75706,-73.75535,QUEENS,1.0,0.0,0,0,0,0,1,0,4252212,2019-11-29 22:00:00,2019-11-29T22:00,2019,11,-0.2,0.0,Cloudy
12/11/2019,9:00,40.728832,-73.82476,QUEENS,0.0,0.0,0,0,0,0,0,0,4257749,2019-12-11 09:00:00,2019-12-11T09:00,2019,12,0.5,0.7,Heavy Snow
08/28/2019,0:00,40.773808,-73.8929,QUEENS,0.0,0.0,0,0,0,0,0,0,4196477,2019-08-28 00:00:00,2019-08-28T00:00,2019,8,18.4,0.0,Cloudy
11/14/2019,11:00,40.781677,-73.83871,QUEENS,0.0,0.0,0,0,0,0,0,0,4240992,2019-11-14 11:00:00,2019-11-14T11:00,2019,11,3.4,0.0,Cloudy
03/31/2019,3:00,40.750977,-73.934746,QUEENS,1.0,0.0,0,0,0,0,1,0,4106389,2019-03-31 03:00:00,2019-03-31T03:00,2019,3,10.3,0.0,Cloudy
01/04/2019,16:00,40.681477,-73.83471,QUEENS,0.0,0.0,0,0,0,0,0,0,4061850,2019-01-04 16:00:00,2019-01-04T16:00,2019,1,7.2,0.0,Cloudy
05/28/2019,7:00,40.69407,-73.82802,QUEENS,1.0,0.0,0,0,0,0,1,0,4142156,2019-05-28 07:00:00,2019-05-28T07:00,2019,5,17.8,0.0,Cloudy
08/06/2019,12:00,40.75855,-73.82964,QUEENS,1.0,0.0,1,0,0,0,0,0,4184297,2019-08-06 12:00:00,2019-08-06T12:00,2019,8,24.4,0.7,Drizzle
09/26/2019,12:00,40.604317,-73.81987,QUEENS,1.0,0.0,0,0,1,0,0,0,4213267,2019-09-26 12:00:00,2019-09-26T12:00,2019,9,25.5,0.0,Clear
02/09/2019,14:00,40.74348,-73.921486,QUEENS,1.0,0.0,0,0,0,0,1,0,4077829,2019-02-09 14:00:00,2019-02-09T14:00,2019,2,0.5,0.0,Clear
10/17/2019,9:00,40.595802,-73.764656,QUEENS,1.0,0.0,1,0,0,0,0,0,4229281,2019-10-17 09:00:00,2019-10-17T09:00,2019,10,12.4,0.1,Drizzle
12/07/2019,11:00,40.66696,-73.77078,QUEENS,1.0,0.0,0,0,0,0,1,0,4253583,2019-12-07 11:00:00,2019-12-07T11:00,2019,12,2.2,0.0,Cloudy
03/22/2019,0:00,40.692066,-73.7654,QUEENS,1.0,0.0,1,0,0,0,0,0,4103993,2019-03-22 00:00:00,2019-03-22T00:00,2019,3,7.4,1.6,Light Rain
09/26/2019,8:00,40.598087,-73.758385,QUEENS,1.0,0.0,0,0,0,0,1,0,4215208,2019-09-26 08:00:00,2019-09-26T08:00,2019,9,20.2,0.0,Clear
09/10/2019,17:00,40.71781,-73.80358,QUEENS,0.0,0.0,0,0,0,0,0,0,4203344,2019-09-10 17:00:00,2019-09-10T17:00,2019,9,22.4,0.0,Clear
04/08/2019,9:00,40.763958,-73.82814,QUEENS,0.0,0.0,0,0,0,0,0,0,4111010,2019-04-08 09:00:00,2019-04-08T09:00,2019,4,16.0,0.0,Cloudy
03/05/2019,7:00,40.755424,-73.94525,QUEENS,0.0,0.0,0,0,0,0,0,0,4094396,2019-03-05 07:00:00,2019-03-05T07:00,2019,3,-8.8,0.0,Clear
05/17/2019,10:00,40.71245,-73.91853,QUEENS,0.0,0.0,0,0,0,0,0,0,4134297,2019-05-17 10:00:00,2019-05-17T10:00,2019,5,22.2,0.0,Cloudy
05/30/2019,20:00,40.755512,-73.820305,QUEENS,1.0,0.0,1,0,0,0,0,0,4142045,2019-05-30 20:00:00,2019-05-30T20:00,2019,5,16.1,1.0,Drizzle
04/05/2019,0:00,40.768955,-73.82669,QUEENS,1.0,0.0,0,0,1,0,0,0,4109462,2019-04-05 00:00:00,2019-04-05T00:00,2019,4,3.4,0.0,Cloudy
09/03/2019,0:00,40.671932,-73.85165,QUEENS,1.0,0.0,0,0,0,0,1,0,4198845,2019-09-03 00:00:00,2019-09-03T00:00,2019,9,20.9,0.0,Clear
05/28/2019,9:00,40.677258,-73.81873,QUEENS,1.0,0.0,0,0,0,0,1,0,4140541,2019-05-28 09:00:00,2019-05-28T09:00,2019,5,18.0,0.0,Cloudy
10/08/2019,8:00,40.670364,-73.7528,QUEENS,2.0,0.0,0,0,0,0,2,0,4219884,2019-10-08 08:00:00,2019-10-08T08:00,2019,10,15.3,0.1,Drizzle
02/25/2019,15:00,40.76213,-73.82494,QUEENS,0.0,0.0,0,0,0,0,0,0,4086767,2019-02-25 15:00:00,2019-02-25T15:00,2019,2,3.2,0.0,Clear
08/29/2019,16:00,40.74348,-73.921486,QUEENS,1.0,0.0,0,0,0,0,1,0,4197196,2019-08-29 16:00:00,2019-08-29T16:00,2019,8,27.7,0.0,Clear
04/04/2019,15:00,40.675682,-73.816,QUEENS,1.0,0.0,1,0,0,0,0,0,4109093,2019-04-04 15:00:00,2019-04-04T15:00,2019,4,13.0,0.0,Clear
07/02/2019,15:00,40.748993,-73.89687,QUEENS,1.0,0.0,0,0,0,0,1,0,4163637,2019-07-02 15:00:00,2019-07-02T15:00,2019,7,30.2,0.0,Clear
06/17/2019,15:00,40.701786,-73.807,QUEENS,0.0,0.0,0,0,0,0,0,0,4153382,2019-06-17 15:00:00,2019-06-17T15:00,2019,6,22.3,0.8,Drizzle
08/30/2019,19:00,40.774277,-73.9081,QUEENS,1.0,0.0,1,0,0,0,0,0,4198205,2019-08-30 19:00:00,2019-08-30T19:00,2019,8,25.1,0.0,Clear
11/20/2019,10:00,40.768547,-73.87235,QUEENS,1.0,0.0,1,0,0,0,0,0,4244373,2019-11-20 10:00:00,2019-11-20T10:00,2019,11,5.5,0.0,Cloudy
04/26/2019,20:00,40.754208,-73.812225,QUEENS,0.0,0.0,0,0,0,0,0,0,4121400,2019-04-26 20:00:00,2019-04-26T20:00,2019,4,13.9,1.6,Light Rain
10/23/2019,0:00,40.71735,-73.821686,QUEENS,0.0,0.0,0,0,0,0,0,0,4228542,2019-10-23 00:00:00,2019-10-23T00:00,2019,10,17.5,2.0,Light Rain
05/16/2019,16:00,40.670277,-73.75257,QUEENS,1.0,0.0,0,0,0,0,1,0,4133078,2019-05-16 16:00:00,2019-05-16T16:00,2019,5,16.8,0.0,Cloudy
03/15/2019,9:00,40.745026,-73.950775,QUEENS,1.0,0.0,1,0,0,0,0,0,4100319,2019-03-15 09:00:00,2019-03-15T09:00,2019,3,15.9,0.1,Drizzle
08/24/2019,13:00,40.78587,-73.84955,QUEENS,1.0,0.0,0,0,1,0,0,0,4193935,2019-08-24 13:00:00,2019-08-24T13:00,2019,8,23.8,0.0,Cloudy
05/20/2019,13:00,40.730095,-73.82317,QUEENS,0.0,0.0,0,0,0,0,0,0,4135370,2019-05-20 13:00:00,2019-05-20T13:00,2019,5,28.0,0.0,Cloudy
09/06/2019,18:00,40.73136,-73.788216,QUEENS,3.0,0.0,0,0,0,0,3,0,4200962,2019-09-06 18:00:00,2019-09-06T18:00,2019,9,19.0,0.0,Cloudy
11/17/2019,10:00,40.720005,-73.81321,QUEENS,1.0,0.0,0,0,0,0,1,0,4242176,2019-11-17 10:00:00,2019-11-17T10:00,2019,11,2.7,0.0,Cloudy
11/16/2019,5:00,40.695995,-73.782776,QUEENS,1.0,0.0,0,0,0,0,1,0,4241950,2019-11-16 05:00:00,2019-11-16T05:00,2019,11,0.9,0.0,Clear
09/22/2019,12:00,40.670887,-73.76078,QUEENS,1.0,0.0,0,0,0,0,1,0,4211119,2019-09-22 12:00:00,2019-09-22T12:00,2019,9,25.3,0.0,Clear
04/08/2019,12:00,40.65218,-73.73006,QUEENS,0.0,0.0,0,0,0,0,0,0,4111135,2019-04-08 12:00:00,2019-04-08T12:00,2019,4,16.4,0.0,Cloudy
12/09/2019,16:00,40.70638,-73.79998,QUEENS,1.0,0.0,0,0,1,0,0,0,4256922,2019-12-09 16:00:00,2019-12-09T16:00,2019,12,11.1,0.5,Drizzle
04/18/2019,0:00,40.733536,-73.87035,QUEENS,2.0,0.0,0,0,0,0,2,0,4118185,2019-04-18 00:00:00,2019-04-18T00:00,2019,4,8.6,0.0,Cloudy
12/24/2019,14:00,40.77613,-73.910706,QUEENS,1.0,0.0,1,0,0,0,0,0,4265082,2019-12-24 14:00:00,2019-12-24T14:00,2019,12,7.2,0.0,Clear
04/24/2019,7:00,40.696934,-73.80358,QUEENS,0.0,0.0,0,0,0,0,0,0,4122690,2019-04-24 07:00:00,2019-04-24T07:00,2019,4,16.9,0.0,Cloudy
02/15/2019,14:00,40.71976,-73.84369,QUEENS,2.0,0.0,0,0,0,0,2,0,4081863,2019-02-15 14:00:00,2019-02-15T14:00,2019,2,10.6,0.0,Cloudy
04/17/2019,5:00,40.676826,-73.728325,QUEENS,0.0,0.0,0,0,0,0,0,0,4116394,2019-04-17 05:00:00,2019-04-17T05:00,2019,4,7.9,0.0,Cloudy
09/26/2019,18:00,40.70617,-73.808174,QUEENS,0.0,0.0,0,0,0,0,0,0,4213732,2019-09-26 18:00:00,2019-09-26T18:00,2019,9,21.3,0.0,Cloudy
06/18/2019,0:00,40.680122,-73.8429,QUEENS,2.0,0.0,0,0,0,0,2,0,4154040,2019-06-18 00:00:00,2019-06-18T00:00,2019,6,18.3,0.2,Drizzle
10/08/2019,1:00,40.743107,-73.86751,QUEENS,1.0,0.0,0,0,0,0,1,0,4219551,2019-10-08 01:00:00,2019-10-08T01:00,2019,10,15.4,0.0,Cloudy
11/14/2019,13:00,40.762566,-73.81859,QUEENS,1.0,0.0,1,0,0,0,0,0,4241192,2019-11-14 13:00:00,2019-11-14T13:00,2019,11,5.3,0.0,Cloudy
02/22/2019,14:00,40.688564,-73.81687,QUEENS,0.0,0.0,0,0,0,0,0,0,4085143,2019-02-22 14:00:00,2019-02-22T14:00,2019,2,6.7,0.0,Cloudy
05/09/2019,8:00,40.66696,-73.77078,QUEENS,1.0,0.0,0,0,0,0,1,0,4128509,2019-05-09 08:00:00,2019-05-09T08:00,2019,5,12.5,0.0,Cloudy
04/18/2019,9:00,40.714912,-73.7503,QUEENS,0.0,0.0,0,0,0,0,0,0,4116843,2019-04-18 09:00:00,2019-04-18T09:00,2019,4,11.0,0.2,Drizzle
09/15/2019,12:00,40.710747,-73.75066,QUEENS,2.0,0.0,0,0,0,0,2,0,4205865,2019-09-15 12:00:00,2019-09-15T12:00,2019,9,25.7,0.0,Clear
11/30/2019,23:00,40.70914,-73.77589,QUEENS,2.0,0.0,0,0,0,0,2,0,4250879,2019-11-30 23:00:00,2019-11-30T23:00,2019,11,-1.7,0.0,Clear
05/17/2019,9:00,40.71859,-73.91317,QUEENS,1.0,0.0,0,0,0,0,1,0,4133550,2019-05-17 09:00:00,2019-05-17T09:00,2019,5,20.8,0.0,Cloudy
08/29/2019,12:00,40.75858,-73.91931,QUEENS,0.0,0.0,0,0,0,0,0,0,4197554,2019-08-29 12:00:00,2019-08-29T12:00,2019,8,26.8,0.0,Clear
04/04/2019,15:00,40.762108,-73.90652,QUEENS,1.0,0.0,1,0,0,0,0,0,4109236,2019-04-04 15:00:00,2019-04-04T15:00,2019,4,14.3,0.0,Clear
05/21/2019,7:00,40.657776,-73.77031,QUEENS,3.0,0.0,0,0,0,0,3,0,4136034,2019-05-21 07:00:00,2019-05-21T07:00,2019,5,14.6,0.0,Clear
05/29/2019,12:00,40.717285,-73.792274,QUEENS,0.0,0.0,0,0,0,0,0,0,4144179,2019-05-29 12:00:00,2019-05-29T12:00,2019,5,20.6,0.0,Cloudy
03/26/2019,18:00,40.7603,-73.80682,QUEENS,3.0,0.0,0,0,0,0,3,0,4103691,2019-03-26 18:00:00,2019-03-26T18:00,2019,3,4.6,0.0,Clear
10/03/2019,16:00,40.712227,-73.88436,QUEENS,1.0,0.0,0,0,0,0,1,0,4217108,2019-10-03 16:00:00,2019-10-03T16:00,2019,10,15.1,0.1,Drizzle
10/13/2019,20:00,40.72595,-73.72148,QUEENS,0.0,0.0,0,0,0,0,0,0,4223213,2019-10-13 20:00:00,2019-10-13T20:00,2019,10,13.4,0.0,Cloudy
08/02/2019,7:00,40.710297,-73.89647,QUEENS,0.0,0.0,0,0,0,0,0,0,4181650,2019-08-02 07:00:00,2019-08-02T07:00,2019,8,24.1,0.0,Clear
11/25/2019,14:00,40.72353,-73.79848,QUEENS,1.0,0.0,1,0,0,0,0,0,4248051,2019-11-25 14:00:00,2019-11-25T14:00,2019,11,9.9,0.0,Cloudy
11/11/2019,10:00,40.685608,-73.79636,QUEENS,1.0,0.0,0,0,0,0,1,0,4239199,2019-11-11 10:00:00,2019-11-11T10:00,2019,11,11.7,0.0,Cloudy
05/17/2019,8:00,40.78959,-73.81954,QUEENS,1.0,0.0,0,0,0,0,1,0,4133534,2019-05-17 08:00:00,2019-05-17T08:00,2019,5,19.4,0.0,Cloudy
11/07/2019,18:00,40.74624,-73.89723,QUEENS,1.0,0.0,0,0,0,0,1,0,4237080,2019-11-07 18:00:00,2019-11-07T18:00,2019,11,10.2,0.8,Drizzle
04/29/2019,14:00,40.717674,-73.81713,QUEENS,0.0,0.0,0,0,0,0,0,0,4122666,2019-04-29 14:00:00,2019-04-29T14:00,2019,4,12.4,0.0,Cloudy
06/17/2019,13:00,40.721466,-73.804535,QUEENS,2.0,0.0,0,0,0,0,2,0,4153450,2019-06-17 13:00:00,2019-06-17T13:00,2019,6,23.0,0.8,Drizzle
06/06/2019,10:00,40.711,-73.79625,QUEENS,2.0,0.0,0,0,0,0,2,0,4146958,2019-06-06 10:00:00,2019-06-06T10:00,2019,6,26.0,0.0,Clear
08/30/2019,11:00,40.700512,-73.796776,QUEENS,1.0,0.0,0,0,0,0,1,0,4198508,2019-08-30 11:00:00,2019-08-30T11:00,2019,8,26.5,0.0,Clear
10/03/2019,10:00,40.73093,-73.864586,QUEENS,1.0,0.0,0,0,0,0,1,0,4217021,2019-10-03 10:00:00,2019-10-03T10:00,2019,10,13.1,1.5,Light Rain
01/07/2019,16:00,40.704845,-73.80928,QUEENS,0.0,0.0,0,0,0,0,0,0,4063560,2019-01-07 16:00:00,2019-01-07T16:00,2019,1,-0.5,0.0,Cloudy
03/17/2019,16:00,40.716682,-73.80806,QUEENS,0.0,0.0,0,0,0,0,0,0,4098384,2019-03-17 16:00:00,2019-03-17T16:00,2019,3,5.3,0.0,Cloudy
06/09/2019,5:00,40.65965,-73.773834,QUEENS,1.0,0.0,1,0,0,0,0,0,4147650,2019-06-09 05:00:00,2019-06-09T05:00,2019,6,13.7,0.0,Cloudy
05/20/2019,17:00,40.59601,-73.74267,QUEENS,2.0,0.0,0,0,1,0,1,0,4136657,2019-05-20 17:00:00,2019-05-20T17:00,2019,5,17.9,0.0,Clear
02/03/2019,2:00,40.665558,-73.72985,QUEENS,2.0,0.0,0,0,0,0,2,0,4073726,2019-02-03 02:00:00,2019-02-03T02:00,2019,2,-1.3,0.0,Clear
06/08/2019,11:00,40.770676,-73.77182,QUEENS,1.0,0.0,0,0,1,0,0,0,4147303,2019-06-08 11:00:00,2019-06-08T11:00,2019,6,25.2,0.0,Cloudy
07/02/2019,0:00,40.700268,-73.90644,QUEENS,1.0,0.0,0,0,0,0,1,0,4163968,2019-07-02 00:00:00,2019-07-02T00:00,2019,7,21.0,0.0,Clear
09/11/2019,23:00,40.694042,-73.73665,QUEENS,2.0,0.0,0,0,0,0,2,0,4204056,2019-09-11 23:00:00,2019-09-11T23:00,2019,9,24.4,0.0,Cloudy
08/05/2019,22:00,40.71814,-73.91665,QUEENS,0.0,0.0,0,0,0,0,0,0,4183686,2019-08-05 22:00:00,2019-08-05T22:00,2019,8,23.4,0.0,Cloudy
02/14/2019,14:00,40.68302,-73.81248,QUEENS,0.0,0.0,0,0,0,0,0,0,4080759,2019-02-14 14:00:00,2019-02-14T14:00,2019,2,6.3,0.0,Clear
03/01/2019,8:00,40.671932,-73.85165,QUEENS,1.0,0.0,0,0,0,0,1,0,4089147,2019-03-01 08:00:00,2019-03-01T08:00,2019,3,-1.8,0.1,Light Snow
11/22/2019,13:00,40.761223,-73.9238,QUEENS,1.0,0.0,1,0,0,0,0,0,4247814,2019-11-22 13:00:00,2019-11-22T13:00,2019,11,10.5,0.8,Drizzle
12/17/2019,18:00,40.669342,-73.78559,QUEENS,1.0,0.0,0,0,0,0,1,0,4260209,2019-12-17 18:00:00,2019-12-17T18:00,2019,12,1.0,0.3,Drizzle
08/04/2019,19:00,40.691875,-73.80401,QUEENS,1.0,0.0,0,0,0,0,1,0,4182766,2019-08-04 19:00:00,2019-08-04T19:00,2019,8,25.6,0.0,Clear
05/12/2019,19:00,40.636787,-73.74057,QUEENS,0.0,0.0,0,0,0,0,0,0,4130212,2019-05-12 19:00:00,2019-05-12T19:00,2019,5,7.1,0.2,Drizzle
12/18/2019,19:00,40.781647,-73.8367,QUEENS,1.0,0.0,0,0,0,0,1,0,4260744,2019-12-18 19:00:00,2019-12-18T19:00,2019,12,-1.3,0.0,Clear
06/13/2019,9:00,40.759296,-73.91968,QUEENS,1.0,0.0,0,0,1,0,0,0,4152747,2019-06-13 09:00:00,2019-06-13T09:00,2019,6,15.2,5.5,Heavy Rain
06/26/2019,0:00,40.75667,-73.828804,QUEENS,0.0,0.0,0,0,0,0,0,0,4159517,2019-06-26 00:00:00,2019-06-26T00:00,2019,6,21.3,0.0,Clear
06/26/2019,21:00,40.763596,-73.90972,QUEENS,0.0,0.0,0,0,0,0,0,0,4160712,2019-06-26 21:00:00,2019-06-26T21:00,2019,6,23.2,0.0,Clear
08/07/2019,7:00,40.678505,-73.735,QUEENS,0.0,0.0,0,0,0,0,0,0,4184388,2019-08-07 07:00:00,2019-08-07T07:00,2019,8,22.5,0.0,Cloudy
03/18/2019,14:00,40.73988,-73.92431,QUEENS,1.0,0.0,0,0,0,0,1,0,4099396,2019-03-18 14:00:00,2019-03-18T14:00,2019,3,6.2,0.0,Cloudy
09/15/2019,10:00,40.740025,-73.786316,QUEENS,0.0,0.0,0,0,0,0,0,0,4206175,2019-09-15 10:00:00,2019-09-15T10:00,2019,9,24.2,0.0,Cloudy
02/20/2019,10:00,40.724693,-73.7541,QUEENS,0.0,0.0,0,0,0,0,0,0,4083827,2019-02-20 10:00:00,2019-02-20T10:00,2019,2,-2.2,0.0,Cloudy
06/29/2019,13:00,40.749752,-73.88418,QUEENS,1.0,0.0,0,0,1,0,0,0,4161654,2019-06-29 13:00:00,2019-06-29T13:00,2019,6,30.5,0.1,Drizzle
10/07/2019,19:00,40.724125,-73.86905,QUEENS,1.0,0.0,0,0,0,0,1,0,4219471,2019-10-07 19:00:00,2019-10-07T19:00,2019,10,20.3,0.5,Drizzle
10/25/2019,11:00,40.712685,-73.78371,QUEENS,1.0,0.0,0,0,0,0,1,0,4229269,2019-10-25 11:00:00,2019-10-25T11:00,2019,10,16.1,0.0,Cloudy
03/15/2019,10:00,40.766308,-73.8197,QUEENS,0.0,0.0,0,0,0,0,0,0,4097182,2019-03-15 10:00:00,2019-03-15T10:00,2019,3,15.5,0.0,Cloudy
07/03/2019,20:00,40.674694,-73.78435,QUEENS,1.0,0.0,0,0,0,0,1,0,4164396,2019-07-03 20:00:00,2019-07-03T20:00,2019,7,23.6,0.0,Cloudy
06/27/2019,17:00,40.671074,-73.754776,QUEENS,1.0,0.0,0,0,0,0,1,0,4160124,2019-06-27 17:00:00,2019-06-27T17:00,2019,6,27.5,0.0,Clear
09/24/2019,9:00,40.78905,-73.81294,QUEENS,0.0,0.0,0,0,0,0,0,0,4211940,2019-09-24 09:00:00,2019-09-24T09:00,2019,9,21.4,0.0,Clear
03/31/2019,20:00,40.78679,-73.823425,QUEENS,2.0,0.0,0,0,0,0,2,0,4106210,2019-03-31 20:00:00,2019-03-31T20:00,2019,3,4.9,0.0,Clear
11/06/2019,9:00,40.658188,-73.73193,QUEENS,2.0,0.0,2,0,0,0,0,0,4236461,2019-11-06 09:00:00,2019-11-06T09:00,2019,11,9.6,0.0,Clear
04/01/2019,20:00,40.743267,-73.874664,QUEENS,1.0,0.0,0,0,0,0,1,0,4107019,2019-04-01 20:00:00,2019-04-01T20:00,2019,4,2.5,0.0,Clear
07/12/2019,23:00,40.724308,-73.72474,QUEENS,1.0,0.0,0,0,0,0,1,0,4169132,2019-07-12 23:00:00,2019-07-12T23:00,2019,7,22.1,0.0,Clear
08/12/2019,13:00,40.66873,-73.85585,QUEENS,0.0,0.0,0,0,0,0,0,0,4187846,2019-08-12 13:00:00,2019-08-12T13:00,2019,8,27.9,0.0,Clear
10/06/2019,4:00,40.666164,-73.819336,QUEENS,1.0,0.0,0,0,0,0,1,0,4219074,2019-10-06 04:00:00,2019-10-06T04:00,2019,10,16.8,0.0,Cloudy
09/25/2019,15:00,40.764168,-73.74844,QUEENS,1.0,0.0,0,0,1,0,0,0,4212473,2019-09-25 15:00:00,2019-09-25T15:00,2019,9,22.8,0.0,Clear
05/19/2019,14:00,40.741512,-73.85053,QUEENS,0.0,0.0,0,0,0,0,0,0,4134650,2019-05-19 14:00:00,2019-05-19T14:00,2019,5,20.4,0.0,Clear
12/16/2019,14:00,40.727634,-73.82112,QUEENS,0.0,0.0,0,0,0,0,0,0,4261867,2019-12-16 14:00:00,2019-12-16T14:00,2019,12,2.1,0.0,Cloudy
09/16/2019,21:00,40.72202,-73.81936,QUEENS,1.0,0.0,0,0,1,0,0,0,4207425,2019-09-16 21:00:00,2019-09-16T21:00,2019,9,20.3,0.0,Clear
08/16/2019,16:00,40.720684,-73.81868,QUEENS,7.0,0.0,0,0,0,0,7,0,4189736,2019-08-16 16:00:00,2019-08-16T16:00,2019,8,25.0,0.0,Clear
01/30/2019,9:00,40.761623,-73.82208,QUEENS,1.0,0.0,0,0,1,0,0,0,4071780,2019-01-30 09:00:00,2019-01-30T09:00,2019,1,-6.0,0.0,Clear
09/23/2019,6:00,40.78169,-73.841415,QUEENS,1.0,0.0,0,0,0,0,1,0,4211275,2019-09-23 06:00:00,2019-09-23T06:00,2019,9,20.8,0.0,Cloudy
02/02/2019,10:00,40.707817,-73.91923,QUEENS,0.0,0.0,0,0,0,0,0,0,4073665,2019-02-02 10:00:00,2019-02-02T10:00,2019,2,-5.2,0.0,Cloudy
05/19/2019,21:00,40.66564,-73.77896,QUEENS,3.0,0.0,0,0,0,0,3,0,4134691,2019-05-19 21:00:00,2019-05-19T21:00,2019,5,16.5,0.0,Cloudy
06/02/2019,16:00,40.71327,-73.91191,QUEENS,0.0,0.0,0,0,0,0,0,0,4144045,2019-06-02 16:00:00,2019-06-02T16:00,2019,6,22.9,0.8,Drizzle
09/03/2019,5:00,40.666985,-73.78015,QUEENS,2.0,0.0,0,0,0,0,2,0,4198946,2019-09-03 05:00:00,2019-09-03T05:00,2019,9,18.6,0.0,Clear
02/05/2019,9:00,40.70947,-73.74581,QUEENS,1.0,0.0,0,0,0,0,1,0,4075815,2019-02-05 09:00:00,2019-02-05T09:00,2019,2,7.3,0.0,Cloudy
05/31/2019,1:00,40.75357,-73.85539,QUEENS,1.0,0.0,0,0,0,0,1,0,4142764,2019-05-31 01:00:00,2019-05-31T01:00,2019,5,18.7,0.0,Clear
09/22/2019,17:00,40.76399,-73.80891,QUEENS,0.0,0.0,0,0,0,0,0,0,4210515,2019-09-22 17:00:00,2019-09-22T17:00,2019,9,23.5,0.0,Clear
03/16/2019,5:00,40.785732,-73.79561,QUEENS,1.0,0.0,0,0,0,0,1,0,4097633,2019-03-16 05:00:00,2019-03-16T05:00,2019,3,5.1,0.0,Clear
06/18/2019,15:00,40.774094,-73.90853,QUEENS,1.0,0.0,0,0,0,0,1,0,4154011,2019-06-18 15:00:00,2019-06-18T15:00,2019,6,24.7,0.2,Drizzle
04/22/2019,18:00,40.76002,-73.85927,QUEENS,1.0,0.0,0,0,0,0,1,0,4119075,2019-04-22 18:00:00,2019-04-22T18:00,2019,4,14.7,0.5,Drizzle
01/27/2019,15:00,40.673374,-73.8565,QUEENS,0.0,0.0,0,0,0,0,0,0,4069742,2019-01-27 15:00:00,2019-01-27T15:00,2019,1,7.3,0.0,Cloudy
04/30/2019,20:00,40.703434,-73.74051,QUEENS,1.0,0.0,1,0,0,0,0,0,4123332,2019-04-30 20:00:00,2019-04-30T20:00,2019,4,11.0,0.0,Cloudy
05/05/2019,16:00,40.65616,-73.76736,QUEENS,1.0,0.0,0,0,0,0,1,0,4126897,2019-05-05 16:00:00,2019-05-05T16:00,2019,5,11.7,0.4,Drizzle
08/12/2019,15:00,40.71214,-73.80952,QUEENS,0.0,0.0,0,0,0,0,0,0,4187620,2019-08-12 15:00:00,2019-08-12T15:00,2019,8,27.2,0.0,Clear
05/03/2019,18:00,40.746704,-73.944214,QUEENS,1.0,0.0,1,0,0,0,0,0,4125650,2019-05-03 18:00:00,2019-05-03T18:00,2019,5,13.5,0.3,Drizzle
07/12/2019,16:00,40.709663,-73.786606,QUEENS,0.0,0.0,0,0,0,0,0,0,4170114,2019-07-12 16:00:00,2019-07-12T16:00,2019,7,29.0,0.0,Clear
07/17/2019,23:00,40.754707,-73.87575,QUEENS,0.0,0.0,0,0,0,0,0,0,4174174,2019-07-17 23:00:00,2019-07-17T23:00,2019,7,24.3,4.0,Heavy Rain
11/12/2019,14:00,40.66698,-73.75488,QUEENS,0.0,0.0,0,0,0,0,0,0,4240026,2019-11-12 14:00:00,2019-11-12T14:00,2019,11,1.0,0.4,Heavy Snow
04/30/2019,17:00,40.772655,-73.830444,QUEENS,0.0,0.0,0,0,0,0,0,0,4123372,2019-04-30 17:00:00,2019-04-30T17:00,2019,4,16.3,0.0,Clear
01/07/2019,12:00,40.767757,-73.774185,QUEENS,0.0,0.0,0,0,0,0,0,0,4063061,2019-01-07 12:00:00,2019-01-07T12:00,2019,1,-1.2,0.0,Cloudy
07/22/2019,18:00,40.763496,-73.80734,QUEENS,0.0,0.0,0,0,0,0,0,0,4175083,2019-07-22 18:00:00,2019-07-22T18:00,2019,7,24.7,3.7,Heavy Rain
04/13/2019,15:00,40.684746,-73.83112,QUEENS,1.0,0.0,0,0,0,0,1,0,4115726,2019-04-13 15:00:00,2019-04-13T15:00,2019,4,18.0,0.0,Cloudy
07/16/2019,16:00,40.7426,-73.78752,QUEENS,1.0,0.0,0,0,0,0,1,0,4171569,2019-07-16 16:00:00,2019-07-16T16:00,2019,7,29.1,0.0,Cloudy
09/17/2019,9:00,40.601322,-73.75788,QUEENS,0.0,0.0,0,0,0,0,0,0,4208078,2019-09-17 09:00:00,2019-09-17T09:00,2019,9,19.4,0.0,Clear
10/24/2019,8:00,40.73136,-73.788216,QUEENS,0.0,0.0,0,0,0,0,0,0,4228675,2019-10-24 08:00:00,2019-10-24T08:00,2019,10,11.1,0.0,Clear
07/25/2019,16:00,40.745327,-73.833435,QUEENS,1.0,0.0,0,0,0,0,1,0,4177203,2019-07-25 16:00:00,2019-07-25T16:00,2019,7,28.0,0.0,Cloudy
05/26/2019,14:00,40.708992,-73.764725,QUEENS,0.0,0.0,0,0,0,0,0,0,4139072,2019-05-26 14:00:00,2019-05-26T14:00,2019,5,29.7,0.0,Cloudy
01/11/2019,21:00,40.758236,-73.93702,QUEENS,2.0,0.0,0,0,0,0,2,0,4066332,2019-01-11 21:00:00,2019-01-11T21:00,2019,1,-4.6,0.0,Clear
11/12/2019,10:00,40.755646,-73.939415,QUEENS,0.0,0.0,0,0,0,0,0,0,4240136,2019-11-12 10:00:00,2019-11-12T10:00,2019,11,4.1,0.7,Drizzle
04/22/2019,13:00,40.689075,-73.80401,QUEENS,1.0,0.0,0,0,1,0,0,0,4122708,2019-04-22 13:00:00,2019-04-22T13:00,2019,4,16.6,0.3,Drizzle
11/25/2019,20:00,40.746353,-73.91617,QUEENS,1.0,0.0,0,0,1,0,0,0,4247484,2019-11-25 20:00:00,2019-11-25T20:00,2019,11,5.7,0.0,Clear
12/10/2019,0:00,40.654957,-73.72802,QUEENS,0.0,0.0,0,0,0,0,0,0,4255061,2019-12-10 00:00:00,2019-12-10T00:00,2019,12,12.5,0.9,Drizzle
07/10/2019,19:00,40.688534,-73.831,QUEENS,1.0,0.0,1,0,0,0,0,0,4172901,2019-07-10 19:00:00,2019-07-10T19:00,2019,7,25.3,0.0,Clear
11/16/2019,15:00,40.67903,-73.77843,QUEENS,2.0,0.0,0,0,0,0,2,0,4244558,2019-11-16 15:00:00,2019-11-16T15:00,2019,11,3.6,0.0,Clear
10/06/2019,14:00,40.789783,-73.81419,QUEENS,0.0,0.0,0,0,0,0,0,0,4218538,2019-10-06 14:00:00,2019-10-06T14:00,2019,10,19.6,0.1,Drizzle
03/04/2019,7:00,40.720562,-73.78922,QUEENS,0.0,0.0,0,0,0,0,0,0,4093558,2019-03-04 07:00:00,2019-03-04T07:00,2019,3,0.8,0.0,Cloudy
02/06/2019,20:00,40.78593,-73.84777,QUEENS,2.0,0.0,0,0,0,0,2,0,4076220,2019-02-06 20:00:00,2019-02-06T20:00,2019,2,4.0,1.3,Light Rain
07/02/2019,20:00,40.700592,-73.85457,QUEENS,1.0,0.0,0,0,1,0,0,0,4167311,2019-07-02 20:00:00,2019-07-02T20:00,2019,7,23.7,0.0,Cloudy
02/01/2019,17:00,40.738453,-73.722496,QUEENS,1.0,0.0,0,0,0,0,1,0,4073213,2019-02-01 17:00:00,2019-02-01T17:00,2019,2,-6.2,0.0,Cloudy
08/14/2019,11:00,40.73453,-73.873886,QUEENS,0.0,0.0,0,0,0,0,0,0,4189081,2019-08-14 11:00:00,2019-08-14T11:00,2019,8,25.1,0.6,Drizzle
07/21/2019,14:00,40.711784,-73.75307,QUEENS,0.0,0.0,0,0,0,0,0,0,4174445,2019-07-21 14:00:00,2019-07-21T14:00,2019,7,34.3,0.5,Drizzle
12/09/2019,20:00,40.711845,-73.859764,QUEENS,2.0,0.0,0,0,0,0,2,0,4255173,2019-12-09 20:00:00,2019-12-09T20:00,2019,12,11.6,4.2,Heavy Rain
01/23/2019,17:00,40.724953,-73.79137,QUEENS,1.0,0.0,0,0,0,0,1,0,4059941,2019-01-23 17:00:00,2019-01-23T17:00,2019,1,6.6,0.0,Cloudy
02/03/2019,12:00,40.72739,-73.81942,QUEENS,0.0,0.0,0,0,0,0,0,0,4073709,2019-02-03 12:00:00,2019-02-03T12:00,2019,2,8.1,0.0,Clear
10/11/2019,10:00,40.695015,-73.85794,QUEENS,0.0,0.0,0,0,0,0,0,0,4222607,2019-10-11 10:00:00,2019-10-11T10:00,2019,10,16.0,0.0,Cloudy
05/10/2019,19:00,40.66563,-73.73921,QUEENS,1.0,0.0,0,0,0,0,1,0,4129309,2019-05-10 19:00:00,2019-05-10T19:00,2019,5,16.5,0.0,Cloudy
10/11/2019,23:00,40.761692,-73.91789,QUEENS,1.0,0.0,0,0,0,0,1,0,4226458,2019-10-11 23:00:00,2019-10-11T23:00,2019,10,13.3,0.0,Cloudy
08/01/2019,19:00,40.66774,-73.757,QUEENS,0.0,0.0,0,0,0,0,0,0,4182056,2019-08-01 19:00:00,2019-08-01T19:00,2019,8,25.8,0.0,Clear
11/02/2019,9:00,40.678177,-73.74342,QUEENS,1.0,0.0,1,0,0,0,0,0,4233711,2019-11-02 09:00:00,2019-11-02T09:00,2019,11,7.8,0.0,Clear
04/12/2019,22:00,40.686234,-73.82418,QUEENS,1.0,0.0,1,0,0,0,0,0,4114874,2019-04-12 22:00:00,2019-04-12T22:00,2019,4,13.4,1.7,Light Rain
07/08/2019,16:00,40.760098,-73.72276,QUEENS,0.0,0.0,0,0,0,0,0,0,4166749,2019-07-08 16:00:00,2019-07-08T16:00,2019,7,23.3,0.0,Clear
02/18/2019,9:00,40.713985,-73.73812,QUEENS,0.0,0.0,0,0,0,0,0,0,4083601,2019-02-18 09:00:00,2019-02-18T09:00,2019,2,1.3,0.0,Cloudy
01/12/2019,17:00,40.688564,-73.81819,QUEENS,1.0,0.0,0,0,0,0,1,0,4066141,2019-01-12 17:00:00,2019-01-12T17:00,2019,1,-1.1,0.0,Cloudy
12/07/2019,14:00,40.742065,-73.87422,QUEENS,4.0,0.0,0,0,0,0,4,0,4254505,2019-12-07 14:00:00,2019-12-07T14:00,2019,12,2.5,0.0,Cloudy
06/03/2019,17:00,40.733974,-73.757126,QUEENS,0.0,0.0,0,0,0,0,0,0,4144364,2019-06-03 17:00:00,2019-06-03T17:00,2019,6,19.4,0.0,Clear
08/15/2019,0:00,40.778614,-73.83887,QUEENS,3.0,0.0,0,0,0,0,3,0,4189056,2019-08-15 00:00:00,2019-08-15T00:00,2019,8,21.9,0.0,Cloudy
03/03/2019,14:00,40.713593,-73.74142,QUEENS,1.0,0.0,0,0,0,0,1,0,4090086,2019-03-03 14:00:00,2019-03-03T14:00,2019,3,6.0,0.0,Cloudy
01/07/2019,15:00,40.7622,-73.77032,QUEENS,0.0,0.0,0,0,0,0,0,0,4063170,2019-01-07 15:00:00,2019-01-07T15:00,2019,1,-0.3,0.0,Cloudy
06/28/2019,13:00,40.719757,-73.809685,QUEENS,1.0,0.0,0,0,0,0,1,0,4160878,2019-06-28 13:00:00,2019-06-28T13:00,2019,6,30.4,0.0,Cloudy
04/04/2019,9:00,40.67447,-73.8027,QUEENS,0.0,0.0,0,0,0,0,0,0,4108596,2019-04-04 09:00:00,2019-04-04T09:00,2019,4,7.9,0.0,Cloudy
02/02/2019,13:00,40.719357,-73.81799,QUEENS,0.0,0.0,0,0,0,0,0,0,4074600,2019-02-02 13:00:00,2019-02-02T13:00,2019,2,-0.3,0.0,Cloudy
02/12/2019,15:00,40.750557,-73.7024,QUEENS,1.0,0.0,0,0,0,0,1,0,4079606,2019-02-12 15:00:00,2019-02-12T15:00,2019,2,-0.6,1.5,Heavy Snow
10/11/2019,15:00,40.757755,-73.79304,QUEENS,0.0,0.0,0,0,0,0,0,0,4221641,2019-10-11 15:00:00,2019-10-11T15:00,2019,10,14.5,0.0,Cloudy
05/06/2019,12:00,40.69612,-73.74619,QUEENS,0.0,0.0,0,0,0,0,0,0,4127489,2019-05-06 12:00:00,2019-05-06T12:00,2019,5,18.0,0.0,Cloudy
08/12/2019,3:00,40.671062,-73.731125,QUEENS,0.0,0.0,0,0,0,0,0,0,4187102,2019-08-12 03:00:00,2019-08-12T03:00,2019,8,18.7,0.0,Clear
02/06/2019,0:00,40.703247,-73.90844,QUEENS,1.0,0.0,1,0,0,0,0,0,4076119,2019-02-06 00:00:00,2019-02-06T00:00,2019,2,2.9,0.0,Clear
04/15/2019,10:00,40.764507,-73.88416,QUEENS,1.0,0.0,1,0,0,0,0,0,4115396,2019-04-15 10:00:00,2019-04-15T10:00,2019,4,18.3,0.7,Drizzle
03/20/2019,8:00,40.74377,-73.91383,QUEENS,0.0,0.0,0,0,0,0,0,0,4100580,2019-03-20 08:00:00,2019-03-20T08:00,2019,3,2.6,0.0,Clear
06/25/2019,10:00,40.6982,-73.7688,QUEENS,2.0,0.0,0,0,0,0,2,0,4158487,2019-06-25 10:00:00,2019-06-25T10:00,2019,6,21.2,4.2,Heavy Rain
08/14/2019,0:00,40.760166,-73.83262,QUEENS,2.0,0.0,1,0,0,0,1,0,4188669,2019-08-14 00:00:00,2019-08-14T00:00,2019,8,22.3,0.4,Drizzle
12/23/2019,22:00,40.71776,-73.761375,QUEENS,3.0,0.0,0,0,0,0,3,0,4264712,2019-12-23 22:00:00,2019-12-23T22:00,2019,12,4.6,0.0,Clear
03/17/2019,4:00,40.68484,-73.83596,QUEENS,0.0,0.0,0,0,0,0,0,0,4098629,2019-03-17 04:00:00,2019-03-17T04:00,2019,3,-1.1,0.0,Clear
01/08/2019,18:00,40.680305,-73.844536,QUEENS,0.0,0.0,0,0,0,0,0,0,4064661,2019-01-08 18:00:00,2019-01-08T18:00,2019,1,6.4,0.1,Drizzle
07/15/2019,11:00,40.77079,-73.92079,QUEENS,1.0,0.0,0,0,0,0,1,0,4171783,2019-07-15 11:00:00,2019-07-15T11:00,2019,7,27.8,0.0,Cloudy
08/21/2019,15:00,40.736774,-73.80475,QUEENS,2.0,0.0,0,0,0,0,2,0,4192554,2019-08-21 15:00:00,2019-08-21T15:00,2019,8,28.6,0.1,Drizzle
05/23/2019,12:00,40.777016,-73.79336,QUEENS,1.0,0.0,0,0,0,0,1,0,4137779,2019-05-23 12:00:00,2019-05-23T12:00,2019,5,20.1,0.0,Cloudy
06/05/2019,17:00,40.729134,-73.931015,QUEENS,2.0,0.0,0,0,0,0,2,0,4145737,2019-06-05 17:00:00,2019-06-05T17:00,2019,6,25.3,0.0,Cloudy
11/20/2019,12:00,40.60957,-73.81905,QUEENS,1.0,0.0,0,0,0,0,1,0,4245206,2019-11-20 12:00:00,2019-11-20T12:00,2019,11,6.9,0.0,Cloudy
12/29/2019,21:00,40.66763,-73.76098,QUEENS,0.0,0.0,0,0,0,0,0,0,4266384,2019-12-29 21:00:00,2019-12-29T21:00,2019,12,6.0,0.8,Drizzle
02/06/2019,15:00,40.705032,-73.909,QUEENS,3.0,0.0,3,0,0,0,0,0,4076120,2019-02-06 15:00:00,2019-02-06T15:00,2019,2,5.9,0.0,Cloudy
01/12/2019,15:00,40.677498,-73.8276,QUEENS,1.0,0.0,0,0,0,0,1,0,4066024,2019-01-12 15:00:00,2019-01-12T15:00,2019,1,1.1,0.0,Cloudy
09/12/2019,15:00,40.70089,-73.75708,QUEENS,1.0,0.0,0,0,0,0,1,0,4204634,2019-09-12 15:00:00,2019-09-12T15:00,2019,9,24.2,0.3,Drizzle
12/21/2019,18:00,40.73093,-73.864586,QUEENS,2.0,0.0,0,0,0,0,2,0,4262260,2019-12-21 18:00:00,2019-12-21T18:00,2019,12,-0.7,0.0,Clear
09/17/2019,11:00,40.757946,-73.78671,QUEENS,1.0,0.0,1,0,0,0,0,0,4207459,2019-09-17 11:00:00,2019-09-17T11:00,2019,9,22.1,0.0,Clear
03/30/2019,17:00,40.753708,-73.90299,QUEENS,1.0,0.0,1,0,0,0,0,0,4107440,2019-03-30 17:00:00,2019-03-30T17:00,2019,3,12.6,0.0,Clear
10/03/2019,12:00,40.69687,-73.78072,QUEENS,0.0,0.0,0,0,0,0,0,0,4219214,2019-10-03 12:00:00,2019-10-03T12:00,2019,10,13.4,0.4,Drizzle
08/20/2019,15:00,40.713898,-73.7488,QUEENS,1.0,0.0,0,0,0,0,1,0,4191994,2019-08-20 15:00:00,2019-08-20T15:00,2019,8,28.7,0.0,Clear
04/08/2019,6:00,40.66645,-73.75764,QUEENS,0.0,0.0,0,0,0,0,0,0,4111040,2019-04-08 06:00:00,2019-04-08T06:00,2019,4,9.9,0.0,Cloudy
07/29/2019,17:00,40.713303,-73.73586,QUEENS,0.0,0.0,0,0,0,0,0,0,4180351,2019-07-29 17:00:00,2019-07-29T17:00,2019,7,29.7,0.0,Clear
11/13/2019,19:00,40.699013,-73.79573,QUEENS,1.0,0.0,1,0,0,0,0,0,4241685,2019-11-13 19:00:00,2019-11-13T19:00,2019,11,-1.6,0.0,Clear
03/24/2019,12:00,40.666695,-73.767136,QUEENS,1.0,0.0,1,0,0,0,0,0,4102117,2019-03-24 12:00:00,2019-03-24T12:00,2019,3,10.6,0.0,Cloudy
03/13/2019,19:00,40.680676,-73.734856,QUEENS,1.0,0.0,0,0,0,0,1,0,4096623,2019-03-13 19:00:00,2019-03-13T19:00,2019,3,3.5,0.0,Cloudy
11/05/2019,11:00,40.760677,-73.74407,QUEENS,0.0,0.0,0,0,0,0,0,0,4235836,2019-11-05 11:00:00,2019-11-05T11:00,2019,11,16.3,0.0,Cloudy
12/02/2019,15:00,40.75208,-73.881905,QUEENS,1.0,0.0,1,0,0,0,0,0,4252561,2019-12-02 15:00:00,2019-12-02T15:00,2019,12,0.6,1.4,Heavy Snow
01/15/2019,8:00,40.66421,-73.76026,QUEENS,1.0,0.0,1,0,0,0,0,0,4067516,2019-01-15 08:00:00,2019-01-15T08:00,2019,1,-4.2,0.0,Cloudy
10/10/2019,11:00,40.64912,-73.83737,QUEENS,0.0,0.0,0,0,0,0,0,0,4220851,2019-10-10 11:00:00,2019-10-10T11:00,2019,10,18.3,0.0,Clear
07/23/2019,10:00,40.691948,-73.730675,QUEENS,2.0,0.0,0,0,0,0,2,0,4175605,2019-07-23 10:00:00,2019-07-23T10:00,2019,7,21.5,0.1,Drizzle
05/24/2019,18:00,40.71867,-73.807434,QUEENS,0.0,0.0,0,0,0,0,0,0,4143900,2019-05-24 18:00:00,2019-05-24T18:00,2019,5,20.4,0.0,Cloudy
06/29/2019,23:00,40.750095,-73.81855,QUEENS,0.0,0.0,0,0,0,0,0,0,4161324,2019-06-29 23:00:00,2019-06-29T23:00,2019,6,23.2,0.0,Cloudy
05/24/2019,12:00,40.677536,-73.75366,QUEENS,0.0,0.0,0,0,0,0,0,0,4140286,2019-05-24 12:00:00,2019-05-24T12:00,2019,5,23.0,0.0,Cloudy
05/13/2019,21:00,40.724735,-73.87982,QUEENS,2.0,0.0,0,0,0,0,2,0,4131693,2019-05-13 21:00:00,2019-05-13T21:00,2019,5,8.2,0.0,Cloudy
05/20/2019,17:00,40.669125,-73.74369,QUEENS,1.0,0.0,0,0,0,0,1,0,4135566,2019-05-20 17:00:00,2019-05-20T17:00,2019,5,23.2,0.0,Clear
10/31/2019,22:00,40.74427,-73.88581,QUEENS,1.0,0.0,1,0,0,0,0,0,4232962,2019-10-31 22:00:00,2019-10-31T22:00,2019,10,20.2,0.0,Cloudy
07/15/2019,12:00,40.764263,-73.77134,QUEENS,1.0,0.0,0,0,0,0,1,0,4170679,2019-07-15 12:00:00,2019-07-15T12:00,2019,7,28.3,0.0,Clear
06/05/2019,23:00,40.700687,-73.766815,QUEENS,1.0,0.0,0,0,0,0,1,0,4148088,2019-06-05 23:00:00,2019-06-05T23:00,2019,6,19.7,5.3,Heavy Rain
07/07/2019,18:00,40.71918,-73.769875,QUEENS,0.0,0.0,0,0,0,0,0,0,4165714,2019-07-07 18:00:00,2019-07-07T18:00,2019,7,23.0,0.0,Cloudy
08/11/2019,10:00,40.74552,-73.83544,QUEENS,2.0,0.0,0,0,0,0,2,0,4187117,2019-08-11 10:00:00,2019-08-11T10:00,2019,8,24.0,0.0,Clear
10/06/2019,15:00,40.688244,-73.82399,QUEENS,1.0,0.0,0,0,1,0,0,0,4219075,2019-10-06 15:00:00,2019-10-06T15:00,2019,10,20.4,0.0,Cloudy
07/29/2019,11:00,40.785595,-73.856895,QUEENS,0.0,0.0,0,0,0,0,0,0,4180030,2019-07-29 11:00:00,2019-07-29T11:00,2019,7,30.6,0.0,Clear
12/26/2019,2:00,40.747444,-73.88566,QUEENS,0.0,0.0,0,0,0,0,0,0,4264566,2019-12-26 02:00:00,2019-12-26T02:00,2019,12,-1.7,0.0,Cloudy
04/03/2019,8:00,40.70481,-73.78215,QUEENS,2.0,0.0,0,0,0,0,2,0,4108159,2019-04-03 08:00:00,2019-04-03T08:00,2019,4,6.6,0.0,Clear
07/26/2019,16:00,40.702374,-73.87544,QUEENS,2.0,0.0,0,0,0,0,2,0,4178053,2019-07-26 16:00:00,2019-07-26T16:00,2019,7,27.6,0.0,Clear
12/24/2019,0:00,40.760044,-73.89756,QUEENS,1.0,0.0,0,0,0,0,1,0,4264582,2019-12-24 00:00:00,2019-12-24T00:00,2019,12,2.8,0.0,Clear
04/16/2019,0:00,40.729404,-73.82282,QUEENS,0.0,0.0,0,0,0,0,0,0,4115808,2019-04-16 00:00:00,2019-04-16T00:00,2019,4,6.9,0.0,Clear
05/16/2019,0:00,40.71118,-73.74885,QUEENS,0.0,0.0,0,0,0,0,0,0,4132566,2019-05-16 00:00:00,2019-05-16T00:00,2019,5,11.9,0.0,Cloudy
11/22/2019,19:00,40.595203,-73.75603,QUEENS,1.0,0.0,1,0,0,0,0,0,4245778,2019-11-22 19:00:00,2019-11-22T19:00,2019,11,7.5,0.0,Clear
06/15/2019,16:00,40.763958,-73.82814,QUEENS,0.0,0.0,0,0,0,0,0,0,4151881,2019-06-15 16:00:00,2019-06-15T16:00,2019,6,22.5,0.0,Cloudy
05/24/2019,14:00,40.59595,-74.07282,STATEN ISLAND,4.0,0.0,0,0,0,0,4,0,4138386,2019-05-24 14:00:00,2019-05-24T14:00,2019,5,22.6,0.0,Cloudy
04/08/2019,20:00,40.625843,-74.11077,STATEN ISLAND,2.0,0.0,0,0,0,0,2,0,4111482,2019-04-08 20:00:00,2019-04-08T20:00,2019,4,18.2,0.0,Cloudy
04/16/2019,8:00,40.62016,-74.076965,STATEN ISLAND,1.0,0.0,1,0,0,0,0,0,4116191,2019-04-16 08:00:00,2019-04-16T08:00,2019,4,8.3,0.0,Clear
01/07/2019,8:00,40.58414,-74.08913,STATEN ISLAND,1.0,0.0,0,0,0,0,1,0,4063166,2019-01-07 08:00:00,2019-01-07T08:00,2019,1,-3.2,0.0,Cloudy
12/22/2019,7:00,40.616413,-74.103516,STATEN ISLAND,2.0,0.0,0,0,0,0,2,0,4262578,2019-12-22 07:00:00,2019-12-22T07:00,2019,12,-2.9,0.0,Clear
07/30/2019,17:00,40.55331,-74.15123,STATEN ISLAND,3.0,0.0,0,0,0,0,3,0,4180177,2019-07-30 17:00:00,2019-07-30T17:00,2019,7,31.7,0.0,Clear
01/22/2019,8:00,40.58414,-74.08913,STATEN ISLAND,1.0,0.0,0,0,0,0,1,0,4059216,2019-01-22 08:00:00,2019-01-22T08:00,2019,1,-9.4,0.0,Clear
12/11/2019,7:00,40.503757,-74.24703,STATEN ISLAND,1.0,0.0,0,0,0,0,1,0,4256054,2019-12-11 07:00:00,2019-12-11T07:00,2019,12,1.4,0.8,Heavy Snow
04/03/2019,21:00,40.551563,-74.1453,STATEN ISLAND,1.0,0.0,0,0,0,0,1,0,4108949,2019-04-03 21:00:00,2019-04-03T21:00,2019,4,11.6,0.0,Clear
01/20/2019,4:00,40.607525,-74.076294,STATEN ISLAND,1.0,0.0,0,0,0,0,1,0,4057802,2019-01-20 04:00:00,2019-01-20T04:00,2019,1,7.3,2.6,Heavy Rain
02/13/2019,16:00,40.560905,-74.18572,STATEN ISLAND,0.0,0.0,0,0,0,0,0,0,4080184,2019-02-13 16:00:00,2019-02-13T16:00,2019,2,3.1,0.0,Cloudy
07/03/2019,13:00,40.631535,-74.09485,STATEN ISLAND,1.0,0.0,1,0,0,0,0,0,4167479,2019-07-03 13:00:00,2019-07-03T13:00,2019,7,26.2,0.0,Cloudy
09/22/2019,1:00,40.576504,-74.1037,STATEN ISLAND,1.0,0.0,0,0,0,0,1,0,4210431,2019-09-22 01:00:00,2019-09-22T01:00,2019,9,18.1,0.0,Clear
04/24/2019,15:00,40.574894,-74.108444,STATEN ISLAND,0.0,0.0,0,0,0,0,0,0,4120086,2019-04-24 15:00:00,2019-04-24T15:00,2019,4,20.0,0.0,Clear
09/30/2019,13:00,40.560863,-74.12085,STATEN ISLAND,1.0,0.0,0,0,0,0,1,0,4215511,2019-09-30 13:00:00,2019-09-30T13:00,2019,9,19.4,0.0,Cloudy
07/08/2019,15:00,40.545353,-74.1781,STATEN ISLAND,1.0,0.0,0,0,0,0,1,0,4166797,2019-07-08 15:00:00,2019-07-08T15:00,2019,7,22.4,0.0,Cloudy
12/28/2019,0:00,40.599777,-74.061226,STATEN ISLAND,0.0,0.0,0,0,0,0,0,0,4265591,2019-12-28 00:00:00,2019-12-28T00:00,2019,12,6.3,0.0,Cloudy
06/07/2019,18:00,40.566715,-74.13769,STATEN ISLAND,1.0,0.0,0,0,1,0,0,0,4147353,2019-06-07 18:00:00,2019-06-07T18:00,2019,6,18.8,0.0,Cloudy
09/22/2019,1:00,40.61965,-74.09969,STATEN ISLAND,0.0,0.0,0,0,0,0,0,0,4212001,2019-09-22 01:00:00,2019-09-22T01:00,2019,9,17.7,0.0,Clear
11/24/2019,7:00,40.637527,-74.1128,STATEN ISLAND,1.0,0.0,0,0,0,0,1,0,4256484,2019-11-24 07:00:00,2019-11-24T07:00,2019,11,7.6,0.9,Drizzle
12/15/2019,21:00,40.623554,-74.11353,STATEN ISLAND,2.0,0.0,0,0,0,0,2,0,4259345,2019-12-15 21:00:00,2019-12-15T21:00,2019,12,2.8,0.0,Clear
07/24/2019,3:00,40.538334,-74.15956,STATEN ISLAND,1.0,0.0,0,0,0,0,1,0,4176648,2019-07-24 03:00:00,2019-07-24T03:00,2019,7,20.4,0.0,Cloudy
01/17/2019,9:00,40.64297,-74.07992,STATEN ISLAND,0.0,0.0,0,0,0,0,0,0,4056753,2019-01-17 09:00:00,2019-01-17T09:00,2019,1,-3.6,0.0,Clear
01/07/2019,13:00,40.611427,-74.116844,STATEN ISLAND,1.0,0.0,0,0,0,0,1,0,4063441,2019-01-07 13:00:00,2019-01-07T13:00,2019,1,-0.4,0.0,Cloudy
11/25/2019,9:00,40.57253,-74.14024,STATEN ISLAND,1.0,0.0,0,0,0,0,1,0,4247431,2019-11-25 09:00:00,2019-11-25T09:00,2019,11,5.5,0.0,Clear
07/21/2019,12:00,40.569775,-74.09368,STATEN ISLAND,0.0,0.0,0,0,0,0,0,0,4174158,2019-07-21 12:00:00,2019-07-21T12:00,2019,7,34.0,0.0,Clear
07/30/2019,14:00,40.612286,-74.0697,STATEN ISLAND,1.0,0.0,0,0,0,0,1,0,4180094,2019-07-30 14:00:00,2019-07-30T14:00,2019,7,29.6,0.0,Clear
10/15/2019,17:00,40.61274,-74.06876,STATEN ISLAND,0.0,0.0,0,0,0,0,0,0,4224451,2019-10-15 17:00:00,2019-10-15T17:00,2019,10,14.7,0.0,Clear
10/10/2019,11:00,40.639175,-74.121826,STATEN ISLAND,1.0,0.0,0,0,0,0,1,0,4222939,2019-10-10 11:00:00,2019-10-10T11:00,2019,10,18.3,0.0,Clear
06/18/2019,9:00,40.584106,-74.08723,STATEN ISLAND,0.0,0.0,0,0,0,0,0,0,4153937,2019-06-18 09:00:00,2019-06-18T09:00,2019,6,21.6,0.3,Drizzle
05/03/2019,15:00,40.560432,-74.122536,STATEN ISLAND,1.0,0.0,1,0,0,0,0,0,4125024,2019-05-03 15:00:00,2019-05-03T15:00,2019,5,12.4,0.0,Cloudy
07/12/2019,3:00,40.57925,-74.07781,STATEN ISLAND,2.0,0.0,0,0,0,0,2,0,4169089,2019-07-12 03:00:00,2019-07-12T03:00,2019,7,23.2,0.0,Cloudy
02/05/2019,8:00,40.62782,-74.12126,STATEN ISLAND,1.0,0.0,1,0,0,0,0,0,4076938,2019-02-05 08:00:00,2019-02-05T08:00,2019,2,4.1,0.0,Clear
01/19/2019,0:00,40.626328,-74.13132,STATEN ISLAND,1.0,0.0,1,0,0,0,0,0,4057353,2019-01-19 00:00:00,2019-01-19T00:00,2019,1,-0.6,0.0,Clear
10/23/2019,20:00,40.54011,-74.17722,STATEN ISLAND,0.0,0.0,0,0,0,0,0,0,4229155,2019-10-23 20:00:00,2019-10-23T20:00,2019,10,12.0,0.0,Clear
05/31/2019,15:00,40.586033,-74.08962,STATEN ISLAND,1.0,0.0,1,0,0,0,0,0,4142552,2019-05-31 15:00:00,2019-05-31T15:00,2019,5,25.1,0.0,Cloudy
05/06/2019,5:00,40.634,-74.097275,STATEN ISLAND,2.0,0.0,0,0,0,0,2,0,4127048,2019-05-06 05:00:00,2019-05-06T05:00,2019,5,9.1,0.0,Clear
08/05/2019,4:00,40.581264,-74.11221,STATEN ISLAND,1.0,0.0,0,0,0,0,1,0,4187913,2019-08-05 04:00:00,2019-08-05T04:00,2019,8,22.0,0.0,Cloudy
11/11/2019,23:00,40.634533,-74.0867,STATEN ISLAND,1.0,0.0,0,0,0,0,1,0,4240194,2019-11-11 23:00:00,2019-11-11T23:00,2019,11,8.0,0.0,Cloudy
09/26/2019,22:00,40.635933,-74.07585,STATEN ISLAND,1.0,0.0,1,0,0,0,0,0,4215022,2019-09-26 22:00:00,2019-09-26T22:00,2019,9,15.7,0.0,Clear
09/27/2019,18:00,40.62016,-74.076965,STATEN ISLAND,1.0,0.0,0,0,0,0,1,0,4215604,2019-09-27 18:00:00,2019-09-27T18:00,2019,9,19.2,0.0,Clear
07/16/2019,15:00,40.643524,-74.07615,STATEN ISLAND,0.0,0.0,0,0,0,0,0,0,4174918,2019-07-16 15:00:00,2019-07-16T15:00,2019,7,30.1,0.0,Cloudy
04/24/2019,16:00,40.53718,-74.20257,STATEN ISLAND,1.0,0.0,0,0,0,0,1,0,4120371,2019-04-24 16:00:00,2019-04-24T16:00,2019,4,20.1,0.0,Clear
08/11/2019,11:00,40.58004,-74.11396,STATEN ISLAND,1.0,0.0,0,0,0,0,1,0,4187034,2019-08-11 11:00:00,2019-08-11T11:00,2019,8,24.8,0.0,Clear
06/24/2019,14:00,40.63732,-74.08056,STATEN ISLAND,0.0,0.0,0,0,0,0,0,0,4158216,2019-06-24 14:00:00,2019-06-24T14:00,2019,6,28.3,0.0,Cloudy
10/27/2019,21:00,40.570465,-74.10977,STATEN ISLAND,1.0,0.0,0,0,0,0,1,0,4230224,2019-10-27 21:00:00,2019-10-27T21:00,2019,10,16.1,0.0,Clear
10/10/2019,13:00,40.560394,-74.120056,STATEN ISLAND,1.0,0.0,0,0,0,0,1,0,4221249,2019-10-10 13:00:00,2019-10-10T13:00,2019,10,19.7,0.0,Clear
03/24/2019,14:00,40.55896,-74.17675,STATEN ISLAND,2.0,0.0,0,0,0,0,2,0,4104072,2019-03-24 14:00:00,2019-03-24T14:00,2019,3,13.7,0.0,Cloudy
03/10/2019,18:00,40.57094,-74.12218,STATEN ISLAND,1.0,0.0,0,0,0,0,1,0,4094690,2019-03-10 18:00:00,2019-03-10T18:00,2019,3,6.5,0.0,Cloudy
08/14/2019,19:00,40.611156,-74.085915,STATEN ISLAND,0.0,0.0,0,0,0,0,0,0,4190731,2019-08-14 19:00:00,2019-08-14T19:00,2019,8,22.6,0.1,Drizzle
08/29/2019,15:00,40.60363,-74.07703,STATEN ISLAND,0.0,0.0,0,0,0,0,0,0,4196990,2019-08-29 15:00:00,2019-08-29T15:00,2019,8,27.2,0.0,Clear
05/26/2019,0:00,40.537437,-74.205444,STATEN ISLAND,1.0,0.0,0,0,0,0,1,0,4139700,2019-05-26 00:00:00,2019-05-26T00:00,2019,5,15.2,0.0,Cloudy
03/08/2019,18:00,40.616524,-74.06446,STATEN ISLAND,0.0,0.0,0,0,0,0,0,0,4094807,2019-03-08 18:00:00,2019-03-08T18:00,2019,3,1.4,0.0,Cloudy
08/27/2019,14:00,40.611427,-74.116844,STATEN ISLAND,4.0,0.0,0,0,0,0,4,0,4195876,2019-08-27 14:00:00,2019-08-27T14:00,2019,8,20.5,0.0,Cloudy
02/28/2019,18:00,40.55156,-74.14019,STATEN ISLAND,1.0,0.0,1,0,0,0,0,0,4088666,2019-02-28 18:00:00,2019-02-28T18:00,2019,2,-1.4,0.0,Clear
08/17/2019,17:00,40.60257,-74.07597,STATEN ISLAND,1.0,0.0,0,0,0,0,1,0,4192517,2019-08-17 17:00:00,2019-08-17T17:00,2019,8,24.3,0.0,Cloudy
01/29/2019,18:00,40.62722,-74.115456,STATEN ISLAND,1.0,0.0,1,0,0,0,0,0,4071602,2019-01-29 18:00:00,2019-01-29T18:00,2019,1,4.7,0.3,Drizzle
07/03/2019,20:00,40.608727,-74.08839,STATEN ISLAND,1.0,0.0,1,0,0,0,0,0,4168606,2019-07-03 20:00:00,2019-07-03T20:00,2019,7,25.2,0.0,Cloudy
02/07/2019,8:00,40.54326,-74.19731,STATEN ISLAND,0.0,0.0,0,0,0,0,0,0,4076749,2019-02-07 08:00:00,2019-02-07T08:00,2019,2,3.2,0.0,Cloudy
10/15/2019,19:00,40.586494,-74.092125,STATEN ISLAND,1.0,0.0,0,0,0,0,1,0,4223754,2019-10-15 19:00:00,2019-10-15T19:00,2019,10,14.3,0.0,Clear
08/24/2019,15:00,40.624523,-74.11702,STATEN ISLAND,1.0,0.0,0,0,0,0,1,0,4195300,2019-08-24 15:00:00,2019-08-24T15:00,2019,8,23.3,0.0,Clear
06/11/2019,18:00,40.502396,-74.246574,STATEN ISLAND,1.0,0.0,0,0,0,0,1,0,4150112,2019-06-11 18:00:00,2019-06-11T18:00,2019,6,21.4,0.0,Clear
12/08/2019,1:00,40.631863,-74.07734,STATEN ISLAND,0.0,0.0,0,0,0,0,0,0,4254717,2019-12-08 01:00:00,2019-12-08T01:00,2019,12,-2.4,0.0,Clear
12/16/2019,11:00,40.61931,-74.12552,STATEN ISLAND,0.0,0.0,0,0,0,0,0,0,4259348,2019-12-16 11:00:00,2019-12-16T11:00,2019,12,1.7,0.0,Cloudy
10/15/2019,23:00,40.617294,-74.08048,STATEN ISLAND,0.0,0.0,0,0,0,0,0,0,4223810,2019-10-15 23:00:00,2019-10-15T23:00,2019,10,13.4,0.0,Clear
07/23/2019,12:00,40.633858,-74.12596,STATEN ISLAND,0.0,1.0,0,0,0,1,0,0,4175816,2019-07-23 12:00:00,2019-07-23T12:00,2019,7,23.6,0.0,Cloudy
04/02/2019,5:00,40.623253,-74.08383,STATEN ISLAND,0.0,0.0,0,0,0,0,0,0,4108023,2019-04-02 05:00:00,2019-04-02T05:00,2019,4,3.9,0.0,Cloudy
03/05/2019,13:00,40.628563,-74.11322,STATEN ISLAND,2.0,0.0,0,0,0,0,2,0,4091946,2019-03-05 13:00:00,2019-03-05T13:00,2019,3,-2.1,0.0,Clear
03/05/2019,11:00,40.598934,-74.06377,STATEN ISLAND,1.0,0.0,1,0,0,0,0,0,4092580,2019-03-05 11:00:00,2019-03-05T11:00,2019,3,-3.4,0.0,Clear
09/01/2019,19:00,40.556973,-74.16901,STATEN ISLAND,1.0,0.0,0,0,0,0,1,0,4198164,2019-09-01 19:00:00,2019-09-01T19:00,2019,9,21.3,0.0,Clear
11/16/2019,16:00,40.575275,-74.09183,STATEN ISLAND,3.0,0.0,0,0,0,0,3,0,4241904,2019-11-16 16:00:00,2019-11-16T16:00,2019,11,3.2,0.0,Clear
10/30/2019,17:00,40.541885,-74.19385,STATEN ISLAND,2.0,0.0,0,0,0,0,2,0,4235688,2019-10-30 17:00:00,2019-10-30T17:00,2019,10,16.1,0.0,Cloudy
12/10/2019,7:00,40.615837,-74.08473,STATEN ISLAND,2.0,0.0,0,0,0,0,2,0,4256483,2019-12-10 07:00:00,2019-12-10T07:00,2019,12,10.7,0.1,Drizzle
11/13/2019,12:00,40.637794,-74.07699,STATEN ISLAND,1.0,0.0,1,0,0,0,0,0,4247038,2019-11-13 12:00:00,2019-11-13T12:00,2019,11,0.0,0.0,Clear
02/12/2019,15:00,40.618134,-74.09899,STATEN ISLAND,0.0,0.0,0,0,0,0,0,0,4079885,2019-02-12 15:00:00,2019-02-12T15:00,2019,2,0.3,1.5,Heavy Snow
10/25/2019,0:00,40.60398,-74.11539,STATEN ISLAND,1.0,0.0,0,0,0,0,1,0,4229400,2019-10-25 00:00:00,2019-10-25T00:00,2019,10,9.6,0.0,Clear
09/01/2019,13:00,40.549374,-74.152664,STATEN ISLAND,0.0,0.0,0,0,0,0,0,0,4197939,2019-09-01 13:00:00,2019-09-01T13:00,2019,9,23.9,0.0,Cloudy
