CRASH DATE,CRASH TIME,LATITUDE,LONGITUDE,BOROUGH,NUMBER OF PERSONS INJURED,NUMBER OF PERSONS KILLED,NUMBER OF PEDESTRIANS INJURED,NUMBER OF PEDESTRIANS KILLED,NUMBER OF CYCLIST INJURED,NUMBER OF CYCLIST KILLED,NUMBER OF MOTORIST INJURED,NUMBER OF MOTORIST KILLED,COLLISION_ID,datetime,iso_datetime,year,month,temperature,precipitation,weather_condition
12/25/2021,22:00,40.823284,-73.88762,BRONX,0.0,0.0,0,0,0,0,0,0,4489845,2021-12-25 22:00:00,2021-12-25T22:00,2021,12,8.0,0.0,Cloudy
07/06/2021,17:00,40.82444,-73.8979,BRONX,1.0,0.0,0,0,0,0,0,0,4434698,2021-07-06 17:00:00,2021-07-06T17:00,2021,7,28.4,0.2,Drizzle
01/21/2021,18:00,40.87462,-73.8804,BRONX,0.0,0.0,0,0,0,0,0,0,4385746,2021-01-21 18:00:00,2021-01-21T18:00,2021,1,0.5,0.0,Clear
05/13/2021,5:00,40.81006,-73.90313,BRONX,2.0,0.0,0,0,0,0,2,0,4416118,2021-05-13 05:00:00,2021-05-13T05:00,2021,5,6.9,0.0,Clear
08/08/2021,0:00,40.870823,-73.86708,BRONX,1.0,0.0,0,0,0,0,1,0,4444786,2021-08-08 00:00:00,2021-08-08T00:00,2021,8,22.0,0.0,Cloudy
02/15/2021,23:00,40.872395,-73.8508,BRONX,1.0,0.0,1,0,0,0,0,0,4393121,2021-02-15 23:00:00,2021-02-15T23:00,2021,2,0.4,0.4,Drizzle
05/25/2021,9:00,40.815166,-73.90641,BRONX,1.0,0.0,0,0,0,0,1,0,4420415,2021-05-25 09:00:00,2021-05-25T09:00,2021,5,17.5,0.0,Cloudy
08/30/2021,14:00,40.82929,-73.91642,BRONX,1.0,0.0,0,0,0,0,1,0,4452409,2021-08-30 14:00:00,2021-08-30T14:00,2021,8,28.3,0.1,Drizzle
01/12/2021,13:00,40.850132,-73.91162,BRONX,0.0,0.0,0,0,0,0,0,0,4383543,2021-01-12 13:00:00,2021-01-12T13:00,2021,1,5.8,0.0,Clear
06/13/2021,10:00,40.86158,-73.85491,BRONX,0.0,0.0,0,0,0,0,0,0,4426598,2021-06-13 10:00:00,2021-06-13T10:00,2021,6,22.9,0.0,Cloudy
04/19/2021,0:00,40.823112,-73.8679,BRONX,1.0,0.0,1,0,0,0,0,0,4408846,2021-04-19 00:00:00,2021-04-19T00:00,2021,4,6.4,0.0,Clear
12/10/2021,0:00,40.879894,-73.82377,BRONX,1.0,0.0,1,0,0,0,0,0,4485181,2021-12-10 00:00:00,2021-12-10T00:00,2021,12,1.7,0.0,Cloudy
11/15/2021,18:00,40.871117,-73.87683,BRONX,1.0,0.0,0,0,0,0,1,0,4477898,2021-11-15 18:00:00,2021-11-15T18:00,2021,11,6.2,0.0,Clear
09/19/2021,0:00,40.816067,-73.91765,BRONX,1.0,0.0,0,0,1,0,0,0,4460376,2021-09-19 00:00:00,2021-09-19T00:00,2021,9,21.3,0.0,Clear
09/12/2021,4:00,40.855553,-73.88757,BRONX,0.0,0.0,0,0,0,0,0,0,4456405,2021-09-12 04:00:00,2021-09-12T04:00,2021,9,18.4,0.0,Clear
08/04/2021,9:00,40.885303,-73.89826,BRONX,0.0,0.0,0,0,0,0,0,0,4448159,2021-08-04 09:00:00,2021-08-04T09:00,2021,8,22.8,0.0,Cloudy
03/18/2021,15:00,40.87016,-73.89098,BRONX,1.0,0.0,0,0,0,0,1,0,4400884,2021-03-18 15:00:00,2021-03-18T15:00,2021,3,5.5,1.6,Light Rain
04/06/2021,19:00,40.820545,-73.917755,BRONX,0.0,0.0,0,0,0,0,0,0,4405667,2021-04-06 19:00:00,2021-04-06T19:00,2021,4,11.0,0.0,Clear
02/18/2021,14:00,40.813213,-73.89098,BRONX,0.0,0.0,0,0,0,0,0,0,4393508,2021-02-18 14:00:00,2021-02-18T14:00,2021,2,-2.5,2.5,Heavy Snow
07/08/2021,9:00,40.86094,-73.822586,BRONX,1.0,0.0,0,0,0,0,1,0,4456584,2021-07-08 09:00:00,2021-07-08T09:00,2021,7,25.7,0.0,Cloudy
01/18/2021,14:00,40.83874,-73.913765,BRONX,0.0,0.0,0,0,0,0,0,0,4384936,2021-01-18 14:00:00,2021-01-18T14:00,2021,1,6.7,0.0,Clear
08/25/2021,19:00,40.873837,-73.86707,BRONX,1.0,0.0,0,0,0,0,1,0,4450657,2021-08-25 19:00:00,2021-08-25T19:00,2021,8,28.0,0.0,Cloudy
08/13/2021,11:00,40.892944,-73.85599,BRONX,1.0,0.0,0,0,0,0,1,0,4447193,2021-08-13 11:00:00,2021-08-13T11:00,2021,8,31.9,0.0,Clear
01/16/2021,19:00,40.84835,-73.88864,BRONX,1.0,0.0,0,0,0,0,1,0,4384363,2021-01-16 19:00:00,2021-01-16T19:00,2021,1,3.5,0.0,Clear
04/01/2021,15:00,40.84849,-73.83094,BRONX,1.0,0.0,0,0,0,0,1,0,4403743,2021-04-01 15:00:00,2021-04-01T15:00,2021,4,11.2,0.0,Cloudy
03/30/2021,18:00,40.81464,-73.88557,BRONX,1.0,0.0,1,0,0,0,0,0,4403667,2021-03-30 18:00:00,2021-03-30T18:00,2021,3,9.1,0.0,Cloudy
05/14/2021,7:00,40.83923,-73.92579,BRONX,0.0,0.0,0,0,0,0,0,0,4416603,2021-05-14 07:00:00,2021-05-14T07:00,2021,5,13.1,0.0,Clear
12/22/2021,17:00,40.816856,-73.92076,BRONX,0.0,0.0,0,0,0,0,0,0,4488968,2021-12-22 17:00:00,2021-12-22T17:00,2021,12,4.3,0.0,Clear
09/13/2021,11:00,40.84636,-73.84463,BRONX,1.0,0.0,1,0,0,0,0,0,4457115,2021-09-13 11:00:00,2021-09-13T11:00,2021,9,27.8,0.0,Clear
11/01/2021,19:00,40.883755,-73.898285,BRONX,1.0,0.0,0,0,0,0,1,0,4473443,2021-11-01 19:00:00,2021-11-01T19:00,2021,11,10.3,0.0,Clear
09/22/2021,11:00,40.851078,-73.84862,BRONX,1.0,0.0,0,0,0,0,0,0,4461476,2021-09-22 11:00:00,2021-09-22T11:00,2021,9,24.8,0.1,Drizzle
10/09/2021,23:00,40.888115,-73.831314,BRONX,0.0,0.0,0,0,0,0,0,0,4465840,2021-10-09 23:00:00,2021-10-09T23:00,2021,10,17.3,0.0,Cloudy
11/29/2021,9:00,40.81706,-73.921524,BRONX,0.0,0.0,0,0,0,0,0,0,4482126,2021-11-29 09:00:00,2021-11-29T09:00,2021,11,3.0,0.0,Clear
05/14/2021,19:00,40.8913,-73.8507,BRONX,1.0,0.0,0,0,0,0,1,0,4419245,2021-05-14 19:00:00,2021-05-14T19:00,2021,5,16.5,0.0,Clear
05/16/2021,6:00,40.82886,-73.86185,BRONX,0.0,0.0,0,0,0,0,0,0,4417345,2021-05-16 06:00:00,2021-05-16T06:00,2021,5,12.8,0.0,Clear
01/12/2021,21:00,40.879612,-73.86736,BRONX,1.0,0.0,1,0,0,0,0,0,4383537,2021-01-12 21:00:00,2021-01-12T21:00,2021,1,-1.6,0.0,Clear
06/23/2021,0:00,40.81666,-73.888,BRONX,1.0,0.0,0,0,0,0,0,0,4430165,2021-06-23 00:00:00,2021-06-23T00:00,2021,6,14.1,0.0,Cloudy
06/15/2021,0:00,40.831333,-73.92167,BRONX,1.0,0.0,1,0,0,0,0,0,4427734,2021-06-15 00:00:00,2021-06-15T00:00,2021,6,17.8,0.0,Cloudy
05/04/2021,4:00,40.822456,-73.92692,BRONX,0.0,0.0,0,0,0,0,0,0,4414164,2021-05-04 04:00:00,2021-05-04T04:00,2021,5,11.1,0.1,Drizzle
08/14/2021,16:00,40.86179,-73.85765,BRONX,6.0,0.0,0,0,0,0,6,0,4447281,2021-08-14 16:00:00,2021-08-14T16:00,2021,8,28.6,0.0,Cloudy
09/15/2021,16:00,40.83228,-73.90963,BRONX,1.0,0.0,0,0,0,0,1,0,4457723,2021-09-15 16:00:00,2021-09-15T16:00,2021,9,26.8,0.0,Cloudy
03/12/2021,0:00,40.805557,-73.91047,BRONX,0.0,0.0,0,0,0,0,0,0,4398248,2021-03-12 00:00:00,2021-03-12T00:00,2021,3,12.3,0.0,Cloudy
08/30/2021,0:00,40.87637,-73.88286,BRONX,1.0,0.0,0,0,0,0,1,0,4452434,2021-08-30 00:00:00,2021-08-30T00:00,2021,8,22.0,0.0,Cloudy
04/28/2021,0:00,40.818146,-73.89929,BRONX,1.0,0.0,0,0,1,0,0,0,4412121,2021-04-28 00:00:00,2021-04-28T00:00,2021,4,9.5,0.0,Cloudy
05/07/2021,20:00,40.81909,-73.90087,BRONX,1.0,0.0,1,0,0,0,0,0,4414322,2021-05-07 20:00:00,2021-05-07T20:00,2021,5,10.8,0.0,Cloudy
10/20/2021,9:00,40.8812664,-73.8387425,BRONX,1.0,0.0,0,0,1,0,0,0,4469565,2021-10-20 09:00:00,2021-10-20T09:00,2021,10,18.2,0.0,Cloudy
03/22/2021,16:00,40.871365,-73.8632,BRONX,2.0,0.0,0,0,0,0,2,0,4404492,2021-03-22 16:00:00,2021-03-22T16:00,2021,3,13.0,0.0,Clear
05/17/2021,0:00,40.8485,-73.820496,BRONX,1.0,0.0,0,0,1,0,0,0,4417635,2021-05-17 00:00:00,2021-05-17T00:00,2021,5,12.7,0.0,Cloudy
03/22/2021,20:00,0.0,0.0,BRONX,1.0,0.0,0,0,0,0,1,0,4401107,2021-03-22 20:00:00,2021-03-22T20:00,2021,3,25.6,1.5,Light Rain
09/27/2021,15:00,40.80906,-73.90755,BRONX,1.0,0.0,1,0,0,0,0,0,4461721,2021-09-27 15:00:00,2021-09-27T15:00,2021,9,26.0,0.0,Cloudy
06/11/2021,9:00,40.904957,-73.85371,BRONX,1.0,0.0,0,0,0,0,1,0,4426731,2021-06-11 09:00:00,2021-06-11T09:00,2021,6,18.4,0.0,Cloudy
08/26/2021,10:00,40.879948,-73.82339,BRONX,1.0,0.0,0,0,0,0,1,0,4450775,2021-08-26 10:00:00,2021-08-26T10:00,2021,8,30.0,0.0,Clear
03/19/2021,15:00,40.87719,-73.88958,BRONX,0.0,0.0,0,0,0,0,0,0,4400643,2021-03-19 15:00:00,2021-03-19T15:00,2021,3,5.1,0.0,Clear
12/06/2021,9:00,40.880947,-73.85456,BRONX,2.0,0.0,0,0,0,0,2,0,4483955,2021-12-06 09:00:00,2021-12-06T09:00,2021,12,11.0,0.0,Cloudy
12/15/2021,8:00,40.892475,-73.8545,BRONX,2.0,0.0,2,0,0,0,0,0,4488866,2021-12-15 08:00:00,2021-12-15T08:00,2021,12,2.8,0.0,Cloudy
04/20/2021,14:00,40.81608,-73.917694,BRONX,2.0,0.0,0,0,0,0,2,0,4410495,2021-04-20 14:00:00,2021-04-20T14:00,2021,4,21.5,0.0,Clear
05/27/2021,14:00,40.822712,-73.903145,BRONX,1.0,0.0,1,0,0,0,0,0,4421656,2021-05-27 14:00:00,2021-05-27T14:00,2021,5,27.4,0.0,Clear
04/12/2021,20:00,40.895374,-73.86356,BRONX,1.0,0.0,0,0,0,0,1,0,4407557,2021-04-12 20:00:00,2021-04-12T20:00,2021,4,7.7,1.7,Light Rain
02/09/2021,0:00,40.892513,-73.84543,BRONX,1.0,0.0,1,0,0,0,0,0,4390762,2021-02-09 00:00:00,2021-02-09T00:00,2021,2,-8.7,0.0,Cloudy
08/30/2021,0:00,40.847027,-73.89807,BRONX,1.0,0.0,0,0,0,0,1,0,4453043,2021-08-30 00:00:00,2021-08-30T00:00,2021,8,22.1,0.0,Cloudy
12/22/2021,14:00,40.822838,-73.928764,BRONX,1.0,0.0,1,0,0,0,0,0,4489305,2021-12-22 14:00:00,2021-12-22T14:00,2021,12,8.3,0.0,Clear
10/22/2021,15:00,40.8323232,-73.9167529,BRONX,1.0,0.0,1,0,0,0,0,0,4470194,2021-10-22 15:00:00,2021-10-22T15:00,2021,10,20.0,0.0,Cloudy
03/19/2021,19:00,0.0,0.0,BRONX,1.0,0.0,1,0,0,0,0,0,4401629,2021-03-19 19:00:00,2021-03-19T19:00,2021,3,28.2,0.0,Cloudy
10/05/2021,10:00,40.821,-73.8969,BRONX,1.0,0.0,0,0,1,0,0,0,4464554,2021-10-05 10:00:00,2021-10-05T10:00,2021,10,16.5,0.0,Cloudy
01/26/2021,10:00,40.8262,-73.821686,BRONX,1.0,0.0,0,0,0,0,1,0,4386841,2021-01-26 10:00:00,2021-01-26T10:00,2021,1,0.8,0.0,Cloudy
02/16/2021,15:00,40.885014,-73.830215,BRONX,0.0,0.0,0,0,0,0,0,0,4392563,2021-02-16 15:00:00,2021-02-16T15:00,2021,2,10.9,0.0,Cloudy
09/21/2021,15:00,40.90348,-73.85035,BRONX,1.0,0.0,0,0,0,0,1,0,4462614,2021-09-21 15:00:00,2021-09-21T15:00,2021,9,23.2,0.0,Cloudy
11/02/2021,7:00,40.884346,-73.88706,BRONX,0.0,0.0,0,0,0,0,0,0,4473628,2021-11-02 07:00:00,2021-11-02T07:00,2021,11,8.0,0.0,Clear
02/10/2021,11:00,40.837425,-73.92037,BRONX,1.0,0.0,0,0,0,0,1,0,4391104,2021-02-10 11:00:00,2021-02-10T11:00,2021,2,-2.4,0.0,Clear
09/08/2021,10:00,40.80715,-73.90821,BRONX,1.0,0.0,0,0,0,0,1,0,4455514,2021-09-08 10:00:00,2021-09-08T10:00,2021,9,25.4,0.0,Cloudy
01/14/2021,0:00,40.822105,-73.90062,BRONX,1.0,0.0,1,0,0,0,0,0,4385793,2021-01-14 00:00:00,2021-01-14T00:00,2021,1,-0.5,0.0,Cloudy
03/28/2021,0:00,40.854973,-73.89251,BRONX,0.0,0.0,0,0,0,0,0,0,4402773,2021-03-28 00:00:00,2021-03-28T00:00,2021,3,8.2,0.0,Clear
01/26/2021,12:00,40.862755,-73.901085,BRONX,1.0,0.0,0,0,1,0,0,0,4387029,2021-01-26 12:00:00,2021-01-26T12:00,2021,1,0.8,0.1,Light Snow
07/18/2021,0:00,40.859875,-73.89323,BRONX,1.0,0.0,0,0,0,0,1,0,4438967,2021-07-18 00:00:00,2021-07-18T00:00,2021,7,23.1,5.2,Heavy Rain
04/03/2021,20:00,40.83018,-73.83265,BRONX,0.0,0.0,0,0,0,0,0,0,4404122,2021-04-03 20:00:00,2021-04-03T20:00,2021,4,5.7,0.0,Cloudy
07/31/2021,18:00,40.813046,-73.86007,BRONX,2.0,0.0,0,0,0,0,2,0,4442954,2021-07-31 18:00:00,2021-07-31T18:00,2021,7,22.5,0.0,Clear
09/07/2021,15:00,40.81198,-73.90434,BRONX,1.0,0.0,0,0,0,0,1,0,4454824,2021-09-07 15:00:00,2021-09-07T15:00,2021,9,26.0,0.0,Clear
08/15/2021,0:00,40.820187,-73.890686,BRONX,1.0,0.0,1,0,0,0,0,0,4447822,2021-08-15 00:00:00,2021-08-15T00:00,2021,8,23.3,0.0,Clear
09/09/2021,18:00,40.815754,-73.89529,BRONX,2.0,0.0,0,0,0,0,2,0,4455572,2021-09-09 18:00:00,2021-09-09T18:00,2021,9,20.7,0.0,Cloudy
07/14/2021,16:00,40.86558,-73.89888,BRONX,1.0,0.0,0,0,0,0,0,0,4437000,2021-07-14 16:00:00,2021-07-14T16:00,2021,7,29.3,0.8,Drizzle
02/08/2021,22:00,40.82344,-73.85537,BRONX,0.0,0.0,0,0,0,0,0,0,4390599,2021-02-08 22:00:00,2021-02-08T22:00,2021,2,-9.1,0.0,Cloudy
02/16/2021,13:00,40.885303,-73.82954,BRONX,3.0,0.0,0,0,0,0,3,0,4392874,2021-02-16 13:00:00,2021-02-16T13:00,2021,2,9.1,0.0,Clear
03/19/2021,0:00,40.83932,-73.91503,BRONX,1.0,0.0,0,0,0,0,1,0,4401038,2021-03-19 00:00:00,2021-03-19T00:00,2021,3,4.0,1.0,Drizzle
12/25/2021,13:00,40.911236,-73.90009,BRONX,3.0,0.0,0,0,0,0,3,0,4490897,2021-12-25 13:00:00,2021-12-25T13:00,2021,12,6.1,0.5,Drizzle
04/19/2021,18:00,40.84428,-73.88886,BRONX,1.0,0.0,0,0,1,0,0,0,4409504,2021-04-19 18:00:00,2021-04-19T18:00,2021,4,13.4,0.0,Clear
08/09/2021,19:00,40.88643,-73.84784,BRONX,1.0,0.0,0,0,0,0,1,0,4449197,2021-08-09 19:00:00,2021-08-09T19:00,2021,8,22.9,0.0,Clear
09/11/2021,14:00,40.841087,-73.86449,BRONX,3.0,0.0,0,0,0,0,3,0,4456476,2021-09-11 14:00:00,2021-09-11T14:00,2021,9,23.3,0.1,Drizzle
08/02/2021,18:00,40.86514,-73.801544,BRONX,1.0,0.0,0,0,0,0,0,0,4443371,2021-08-02 18:00:00,2021-08-02T18:00,2021,8,24.5,0.0,Clear
12/25/2021,17:00,40.849308,-73.88481,BRONX,1.0,0.0,0,0,1,0,0,0,4490857,2021-12-25 17:00:00,2021-12-25T17:00,2021,12,7.8,0.0,Cloudy
02/09/2021,19:00,40.838017,-73.8297,BRONX,1.0,0.0,1,0,0,0,0,0,4391005,2021-02-09 19:00:00,2021-02-09T19:00,2021,2,-2.9,0.0,Cloudy
05/31/2021,21:00,40.841347,-73.9169,BRONX,0.0,0.0,0,0,0,0,0,0,4424173,2021-05-31 21:00:00,2021-05-31T21:00,2021,5,13.6,0.0,Cloudy
08/07/2021,15:00,40.89493,-73.84825,BRONX,1.0,0.0,1,0,0,0,0,0,4445152,2021-08-07 15:00:00,2021-08-07T15:00,2021,8,28.5,0.0,Cloudy
11/09/2021,10:00,40.813663,-73.931244,BRONX,1.0,0.0,0,0,0,0,1,0,4475698,2021-11-09 10:00:00,2021-11-09T10:00,2021,11,15.0,0.0,Clear
01/22/2021,14:00,40.861923,-73.89357,BRONX,0.0,0.0,0,0,0,0,0,0,4385795,2021-01-22 14:00:00,2021-01-22T14:00,2021,1,6.7,0.0,Clear
05/24/2021,0:00,40.823135,-73.89489,BRONX,1.0,0.0,0,0,0,0,1,0,4420476,2021-05-24 00:00:00,2021-05-24T00:00,2021,5,18.3,0.0,Cloudy
07/30/2021,13:00,40.81881,-73.92828,BRONX,1.0,0.0,0,0,0,0,1,0,4443533,2021-07-30 13:00:00,2021-07-30T13:00,2021,7,27.8,0.0,Clear
11/13/2021,0:00,40.813663,-73.931244,BRONX,2.0,0.0,0,0,0,0,2,0,4476860,2021-11-13 00:00:00,2021-11-13T00:00,2021,11,7.3,0.0,Clear
02/15/2021,10:00,40.839676,-73.871216,BRONX,1.0,0.0,0,0,0,0,1,0,4392222,2021-02-15 10:00:00,2021-02-15T10:00,2021,2,-0.2,0.0,Cloudy
06/22/2021,19:00,40.885433,-73.82924,BRONX,1.0,0.0,1,0,0,0,0,0,4430068,2021-06-22 19:00:00,2021-06-22T19:00,2021,6,17.4,0.0,Cloudy
09/22/2021,8:00,40.814934,-73.89765,BRONX,2.0,0.0,0,0,0,0,2,0,4461466,2021-09-22 08:00:00,2021-09-22T08:00,2021,9,22.6,0.1,Drizzle
02/19/2021,23:00,40.864662,-73.90084,BRONX,1.0,0.0,0,0,1,0,0,0,4393119,2021-02-19 23:00:00,2021-02-19T23:00,2021,2,-1.5,0.0,Cloudy
11/06/2021,15:00,40.845985,-73.884476,BRONX,1.0,0.0,0,0,0,0,0,0,4476257,2021-11-06 15:00:00,2021-11-06T15:00,2021,11,10.3,0.0,Clear
06/27/2021,16:00,40.837654,-73.89997,BRONX,3.0,0.0,0,0,0,0,3,0,4431620,2021-06-27 16:00:00,2021-06-27T16:00,2021,6,27.4,0.0,Cloudy
04/17/2021,21:00,40.82099,-73.89181,BRONX,2.0,0.0,0,0,0,0,2,0,4408319,2021-04-17 21:00:00,2021-04-17T21:00,2021,4,8.9,0.0,Cloudy
11/12/2021,5:00,40.84987,-73.88991,BRONX,2.0,0.0,0,0,0,0,2,0,4483221,2021-11-12 05:00:00,2021-11-12T05:00,2021,11,16.7,0.0,Cloudy
08/18/2021,22:00,0.0,0.0,BRONX,1.0,0.0,1,0,0,0,0,0,4448520,2021-08-18 22:00:00,2021-08-18T22:00,2021,8,25.0,0.0,Cloudy
04/30/2021,0:00,40.853813,-73.90734,BRONX,1.0,0.0,0,0,0,0,1,0,4412968,2021-04-30 00:00:00,2021-04-30T00:00,2021,4,19.4,0.2,Drizzle
09/27/2021,0:00,40.854015,-73.88149,BRONX,0.0,0.0,0,0,0,0,0,0,4461838,2021-09-27 00:00:00,2021-09-27T00:00,2021,9,15.3,0.0,Clear
02/18/2021,22:00,40.834423,-73.879265,BRONX,1.0,0.0,1,0,0,0,0,0,4393989,2021-02-18 22:00:00,2021-02-18T22:00,2021,2,-3.1,0.3,Heavy Snow
04/23/2021,13:00,40.8617,-73.89139,BRONX,2.0,0.0,0,0,0,0,2,0,4409800,2021-04-23 13:00:00,2021-04-23T13:00,2021,4,14.6,0.0,Cloudy
10/27/2021,10:00,40.861862,-73.91275,BRONX,1.0,0.0,0,0,0,0,1,0,4473388,2021-10-27 10:00:00,2021-10-27T10:00,2021,10,14.3,0.0,Cloudy
08/19/2021,10:00,40.89155,-73.86179,BRONX,1.0,0.0,0,0,0,0,1,0,4449191,2021-08-19 10:00:00,2021-08-19T10:00,2021,8,26.9,0.3,Drizzle
10/04/2021,16:00,40.87451,-73.85745,BRONX,1.0,0.0,0,0,0,0,1,0,4464412,2021-10-04 16:00:00,2021-10-04T16:00,2021,10,18.7,0.7,Drizzle
08/20/2021,12:00,40.857327,-73.904526,BRONX,1.0,0.0,0,0,0,0,1,0,4449650,2021-08-20 12:00:00,2021-08-20T12:00,2021,8,27.2,0.0,Cloudy
11/23/2021,17:00,40.828236,-73.88602,BRONX,0.0,0.0,0,0,0,0,0,0,4481871,2021-11-23 17:00:00,2021-11-23T17:00,2021,11,3.3,0.0,Clear
08/26/2021,21:00,40.834667,-73.88936,BRONX,1.0,0.0,1,0,0,0,0,0,4451023,2021-08-26 21:00:00,2021-08-26T21:00,2021,8,25.6,0.0,Clear
03/17/2021,17:00,40.867996,-73.83134,BRONX,1.0,0.0,1,0,0,0,0,0,4399836,2021-03-17 17:00:00,2021-03-17T17:00,2021,3,7.2,0.0,Cloudy
11/24/2021,14:00,40.867676,-73.89855,BRONX,1.0,0.0,0,0,0,0,1,0,4480751,2021-11-24 14:00:00,2021-11-24T14:00,2021,11,6.1,0.0,Clear
07/27/2021,13:00,40.842514,-73.871544,BRONX,1.0,0.0,0,0,0,0,1,0,4441043,2021-07-27 13:00:00,2021-07-27T13:00,2021,7,30.5,0.0,Clear
09/13/2021,18:00,40.875874,-73.84989,BRONX,2.0,0.0,0,0,0,0,2,0,4458772,2021-09-13 18:00:00,2021-09-13T18:00,2021,9,24.9,0.0,Cloudy
12/30/2021,0:00,40.865467,-73.86541,BRONX,1.0,0.0,1,0,0,0,0,0,4490735,2021-12-30 00:00:00,2021-12-30T00:00,2021,12,5.8,0.3,Drizzle
02/02/2021,11:00,40.855244,-73.89314,BRONX,2.0,0.0,0,0,0,0,2,0,4388852,2021-02-02 11:00:00,2021-02-02T11:00,2021,2,-1.2,0.3,Heavy Snow
03/05/2021,8:00,40.899815,-73.85781,BRONX,1.0,0.0,0,0,0,0,1,0,4396418,2021-03-05 08:00:00,2021-03-05T08:00,2021,3,-4.3,0.0,Clear
01/21/2021,1:00,40.845684,-73.909294,BRONX,1.0,0.0,0,0,0,0,1,0,4385587,2021-01-21 01:00:00,2021-01-21T01:00,2021,1,-3.7,0.0,Clear
12/15/2021,22:00,40.891422,-73.8551,BRONX,3.0,0.0,0,0,0,0,3,0,4487804,2021-12-15 22:00:00,2021-12-15T22:00,2021,12,10.0,0.5,Drizzle
09/25/2021,10:00,40.862297,-73.89842,BRONX,1.0,0.0,1,0,0,0,0,0,4461507,2021-09-25 10:00:00,2021-09-25T10:00,2021,9,20.8,0.0,Clear
09/08/2021,19:00,40.851852,-73.83376,BRONX,1.0,0.0,0,0,0,0,1,0,4456008,2021-09-08 19:00:00,2021-09-08T19:00,2021,9,23.4,0.0,Clear
01/02/2021,0:00,40.847317,-73.911476,BRONX,1.0,0.0,0,0,1,0,0,0,4381093,2021-01-02 00:00:00,2021-01-02T00:00,2021,1,3.5,0.4,Drizzle
07/17/2021,10:00,40.862988,-73.84342,BRONX,0.0,0.0,0,0,0,0,0,0,4438273,2021-07-17 10:00:00,2021-07-17T10:00,2021,7,30.0,0.0,Cloudy
09/02/2021,17:00,40.834515,-73.91771,BRONX,0.0,0.0,0,0,0,0,0,0,4457868,2021-09-02 17:00:00,2021-09-02T17:00,2021,9,22.2,0.0,Clear
03/12/2021,0:00,40.84271,-73.885666,BRONX,1.0,0.0,1,0,0,0,0,0,4398431,2021-03-12 00:00:00,2021-03-12T00:00,2021,3,12.2,0.0,Cloudy
08/12/2021,17:00,40.831383,-73.906845,BRONX,1.0,0.0,0,0,0,0,0,0,4446650,2021-08-12 17:00:00,2021-08-12T17:00,2021,8,31.4,0.0,Clear
06/30/2021,0:00,40.832428,-73.905205,BRONX,0.0,0.0,0,0,0,0,0,0,4432874,2021-06-30 00:00:00,2021-06-30T00:00,2021,6,27.2,0.0,Clear
06/26/2021,12:00,40.844013,-73.8619,BRONX,0.0,0.0,0,0,0,0,0,0,4431574,2021-06-26 12:00:00,2021-06-26T12:00,2021,6,25.4,0.9,Drizzle
06/18/2021,14:00,40.860287,-73.90494,BRONX,1.0,0.0,0,0,0,0,1,0,4428455,2021-06-18 14:00:00,2021-06-18T14:00,2021,6,26.1,0.0,Clear
09/14/2021,18:00,40.85543,-73.855354,BRONX,0.0,0.0,0,0,0,0,0,0,4457387,2021-09-14 18:00:00,2021-09-14T18:00,2021,9,22.4,0.0,Clear
06/20/2021,22:00,40.8382,-73.92371,BRONX,1.0,0.0,0,0,0,0,0,0,4429229,2021-06-20 22:00:00,2021-06-20T22:00,2021,6,23.8,0.0,Cloudy
03/07/2021,18:00,40.869656,-73.864334,BRONX,0.0,0.0,0,0,0,0,0,0,4396996,2021-03-07 18:00:00,2021-03-07T18:00,2021,3,1.0,0.0,Clear
12/10/2021,18:00,40.855217,-73.865746,BRONX,2.0,0.0,0,0,0,0,2,0,4485940,2021-12-10 18:00:00,2021-12-10T18:00,2021,12,4.7,0.0,Clear
07/20/2021,9:00,40.809628,-73.890045,BRONX,3.0,0.0,0,0,0,0,3,0,4443398,2021-07-20 09:00:00,2021-07-20T09:00,2021,7,26.6,0.0,Clear
12/09/2021,11:00,40.839832,-73.84217,BRONX,1.0,0.0,0,0,0,0,1,0,4484995,2021-12-09 11:00:00,2021-12-09T11:00,2021,12,2.9,0.0,Cloudy
04/19/2021,13:00,40.824997,-73.89296,BRONX,0.0,0.0,0,0,0,0,0,0,4408779,2021-04-19 13:00:00,2021-04-19T13:00,2021,4,16.6,0.0,Cloudy
10/14/2021,15:00,40.843767,-73.8655934,BRONX,1.0,0.0,1,0,0,0,0,0,4467287,2021-10-14 15:00:00,2021-10-14T15:00,2021,10,24.8,0.0,Clear
12/07/2021,16:00,40.823082,-73.86722,BRONX,0.0,0.0,0,0,0,0,0,0,4486728,2021-12-07 16:00:00,2021-12-07T16:00,2021,12,4.4,0.0,Cloudy
03/20/2021,22:00,0.0,0.0,BRONX,1.0,0.0,0,0,0,0,1,0,4400372,2021-03-20 22:00:00,2021-03-20T22:00,2021,3,26.0,0.8,Drizzle
11/21/2021,15:00,40.824066,-73.908714,BRONX,1.0,0.0,0,0,0,0,0,0,4479949,2021-11-21 15:00:00,2021-11-21T15:00,2021,11,11.4,0.0,Cloudy
01/28/2021,16:00,40.84319,-73.89313,BRONX,1.0,0.0,0,0,1,0,0,0,4387754,2021-01-28 16:00:00,2021-01-28T16:00,2021,1,-1.9,0.0,Clear
01/02/2021,6:00,40.837757,-73.8595,BRONX,0.0,0.0,0,0,0,0,0,0,4381473,2021-01-02 06:00:00,2021-01-02T06:00,2021,1,5.0,0.0,Cloudy
12/14/2021,0:00,40.856136,-73.85146,BRONX,1.0,0.0,0,0,0,0,1,0,4487232,2021-12-14 00:00:00,2021-12-14T00:00,2021,12,5.3,0.0,Clear
02/28/2021,21:00,40.843376,-73.8369,BRONX,1.0,0.0,1,0,0,0,0,0,4395301,2021-02-28 21:00:00,2021-02-28T21:00,2021,2,5.3,0.3,Drizzle
01/05/2021,0:00,40.88623,-73.9068,BRONX,1.0,0.0,1,0,0,0,0,0,4383059,2021-01-05 00:00:00,2021-01-05T00:00,2021,1,1.2,0.0,Cloudy
02/17/2021,16:00,40.885952,-73.8279,BRONX,2.0,0.0,0,0,0,0,2,0,4392570,2021-02-17 16:00:00,2021-02-17T16:00,2021,2,-0.0,0.0,Cloudy
11/09/2021,7:00,40.888985,-73.821846,BRONX,0.0,0.0,0,0,0,0,0,0,4478353,2021-11-09 07:00:00,2021-11-09T07:00,2021,11,7.4,0.0,Clear
04/04/2021,0:00,40.819904,-73.91211,BRONX,1.0,0.0,1,0,0,0,0,0,4404453,2021-04-04 00:00:00,2021-04-04T00:00,2021,4,3.2,0.0,Cloudy
01/24/2021,8:00,40.868282,-73.90107,BRONX,1.0,0.0,1,0,0,0,0,0,4386409,2021-01-24 08:00:00,2021-01-24T08:00,2021,1,-6.0,0.0,Clear
05/03/2021,12:00,40.895912,-73.84863,BRONX,0.0,0.0,0,0,0,0,0,0,4415812,2021-05-03 12:00:00,2021-05-03T12:00,2021,5,15.2,0.0,Cloudy
12/11/2021,11:00,40.839268,-73.903824,BRONX,1.0,0.0,0,0,0,0,0,0,4486807,2021-12-11 11:00:00,2021-12-11T11:00,2021,12,15.3,0.2,Drizzle
06/06/2021,23:00,40.90104,-73.89689,BRONX,1.0,0.0,0,0,1,0,0,0,4426007,2021-06-06 23:00:00,2021-06-06T23:00,2021,6,23.8,0.0,Cloudy
01/21/2021,19:00,40.885345,-73.89433,BRONX,1.0,0.0,0,0,1,0,0,0,4392050,2021-01-21 19:00:00,2021-01-21T19:00,2021,1,1.9,0.0,Clear
10/17/2021,18:00,40.8483123,-73.9184353,BRONX,1.0,0.0,1,0,0,0,0,0,4469672,2021-10-17 18:00:00,2021-10-17T18:00,2021,10,13.4,0.0,Clear
03/30/2021,10:00,40.86551,-73.85909,BRONX,0.0,0.0,0,0,0,0,0,0,4403165,2021-03-30 10:00:00,2021-03-30T10:00,2021,3,11.0,0.0,Clear
10/15/2021,6:00,40.8661815,-73.8226314,BRONX,1.0,0.0,0,0,0,0,1,0,4467396,2021-10-15 06:00:00,2021-10-15T06:00,2021,10,16.4,0.0,Cloudy
02/18/2021,21:00,40.85396,-73.90944,BRONX,1.0,0.0,1,0,0,0,0,0,4392954,2021-02-18 21:00:00,2021-02-18T21:00,2021,2,-3.2,0.0,Cloudy
07/18/2021,17:00,40.82602,-73.87098,BRONX,0.0,0.0,0,0,0,0,0,0,4438543,2021-07-18 17:00:00,2021-07-18T17:00,2021,7,27.7,0.0,Cloudy
06/06/2021,19:00,40.88302,-73.85325,BRONX,1.0,0.0,0,0,0,0,1,0,4431385,2021-06-06 19:00:00,2021-06-06T19:00,2021,6,24.2,0.0,Clear
08/13/2021,14:00,40.85192,-73.89694,BRONX,1.0,0.0,0,0,0,0,0,0,4447839,2021-08-13 14:00:00,2021-08-13T14:00,2021,8,33.4,0.0,Clear
01/29/2021,1:00,40.881958,-73.86034,BRONX,3.0,0.0,0,0,0,0,3,0,4387995,2021-01-29 01:00:00,2021-01-29T01:00,2021,1,-7.3,0.0,Clear
04/03/2021,19:00,40.87467,-73.90623,BRONX,1.0,0.0,0,0,0,0,1,0,4404707,2021-04-03 19:00:00,2021-04-03T19:00,2021,4,6.1,0.0,Cloudy
08/07/2021,18:00,40.832073,-73.87905,BRONX,0.0,0.0,0,0,0,0,0,0,4445244,2021-08-07 18:00:00,2021-08-07T18:00,2021,8,24.7,0.0,Cloudy
04/06/2021,15:00,40.868668,-73.822495,BRONX,1.0,0.0,0,0,0,0,1,0,4405143,2021-04-06 15:00:00,2021-04-06T15:00,2021,4,18.6,0.0,Clear
01/08/2021,19:00,40.830624,-73.90451,BRONX,1.0,0.0,0,0,0,0,1,0,4382668,2021-01-08 19:00:00,2021-01-08T19:00,2021,1,0.3,0.0,Cloudy
07/09/2021,13:00,40.854374,-73.89441,BRONX,1.0,0.0,1,0,0,0,0,0,4435475,2021-07-09 13:00:00,2021-07-09T13:00,2021,7,27.8,0.0,Clear
03/13/2021,5:00,40.850243,-73.89314,BRONX,1.0,0.0,0,0,0,0,1,0,4398421,2021-03-13 05:00:00,2021-03-13T05:00,2021,3,-0.9,0.0,Clear
11/05/2021,12:00,40.83501,-73.90353,BRONX,0.0,0.0,0,0,0,0,0,0,4475275,2021-11-05 12:00:00,2021-11-05T12:00,2021,11,10.1,0.0,Clear
02/08/2021,17:00,40.879097,-73.83247,BRONX,2.0,0.0,0,0,0,0,2,0,4390460,2021-02-08 17:00:00,2021-02-08T17:00,2021,2,-5.2,0.0,Clear
06/27/2021,10:00,40.81247,-73.88884,BRONX,0.0,0.0,0,0,0,0,0,0,4436571,2021-06-27 10:00:00,2021-06-27T10:00,2021,6,26.9,0.0,Cloudy
03/21/2021,13:00,0.0,0.0,BRONX,0.0,0.0,0,0,0,0,0,0,4400880,2021-03-21 13:00:00,2021-03-21T13:00,2021,3,27.5,0.0,Cloudy
02/23/2021,0:00,40.822754,-73.911476,BRONX,0.0,0.0,0,0,0,0,0,0,4393932,2021-02-23 00:00:00,2021-02-23T00:00,2021,2,1.0,0.0,Clear
06/10/2021,15:00,40.81455,-73.92917,BRONX,1.0,0.0,1,0,0,0,0,0,4428674,2021-06-10 15:00:00,2021-06-10T15:00,2021,6,25.9,0.0,Cloudy
08/02/2021,7:00,40.853626,-73.894356,BRONX,0.0,0.0,0,0,0,0,0,0,4442866,2021-08-02 07:00:00,2021-08-02T07:00,2021,8,18.4,0.0,Clear
06/22/2021,13:00,40.830048,-73.86983,BRONX,0.0,0.0,0,0,0,0,0,0,4430054,2021-06-22 13:00:00,2021-06-22T13:00,2021,6,20.1,2.3,Light Rain
11/27/2021,19:00,40.877476,-73.83661,BRONX,1.0,0.0,0,0,0,0,1,0,4481535,2021-11-27 19:00:00,2021-11-27T19:00,2021,11,0.4,0.0,Cloudy
07/23/2021,21:00,40.889126,-73.843994,BRONX,1.0,0.0,1,0,0,0,0,0,4440327,2021-07-23 21:00:00,2021-07-23T21:00,2021,7,21.1,0.0,Clear
05/12/2021,16:00,40.799255,-73.91206,BRONX,0.0,0.0,0,0,0,0,0,0,4415977,2021-05-12 16:00:00,2021-05-12T16:00,2021,5,18.1,0.0,Clear
03/19/2021,0:00,40.848423,-73.91925,BRONX,0.0,0.0,0,0,0,0,0,0,4400231,2021-03-19 00:00:00,2021-03-19T00:00,2021,3,3.6,0.8,Drizzle
05/02/2021,6:00,40.84551,-73.83422,BRONX,2.0,0.0,0,0,0,0,2,0,4412789,2021-05-02 06:00:00,2021-05-02T06:00,2021,5,12.6,0.0,Clear
07/30/2021,9:00,40.834724,-73.89609,BRONX,0.0,0.0,0,0,0,0,0,0,4442282,2021-07-30 09:00:00,2021-07-30T09:00,2021,7,23.4,0.0,Clear
01/30/2021,23:00,40.84307,-73.848076,BRONX,2.0,0.0,0,0,0,0,2,0,4388654,2021-01-30 23:00:00,2021-01-30T23:00,2021,1,-5.6,0.0,Clear
05/23/2021,22:00,40.8337,-73.879845,BRONX,1.0,0.0,0,0,0,0,1,0,4419832,2021-05-23 22:00:00,2021-05-23T22:00,2021,5,20.7,0.0,Cloudy
07/30/2021,16:00,40.854504,-73.867714,BRONX,0.0,0.0,0,0,0,0,0,0,4441867,2021-07-30 16:00:00,2021-07-30T16:00,2021,7,26.2,0.0,Clear
01/28/2021,15:00,40.865303,-73.89006,BRONX,1.0,0.0,0,0,0,0,1,0,4387605,2021-01-28 15:00:00,2021-01-28T15:00,2021,1,-0.6,0.0,Clear
06/01/2021,9:00,40.849743,-73.89837,BRONX,0.0,0.0,0,0,0,0,0,0,4422508,2021-06-01 09:00:00,2021-06-01T09:00,2021,6,19.0,0.0,Cloudy
07/08/2021,11:00,40.823257,-73.84902,BRONX,1.0,0.0,0,0,0,0,1,0,4435221,2021-07-08 11:00:00,2021-07-08T11:00,2021,7,28.7,0.1,Drizzle
05/26/2021,21:00,40.809105,-73.9229,BRONX,4.0,0.0,0,0,0,0,4,0,4420770,2021-05-26 21:00:00,2021-05-26T21:00,2021,5,23.7,0.2,Drizzle
10/15/2021,11:00,40.8321436,-73.9272832,BRONX,1.0,0.0,0,0,0,0,1,0,4468616,2021-10-15 11:00:00,2021-10-15T11:00,2021,10,23.6,0.0,Clear
07/20/2021,2:00,40.84869,-73.90329,BRONX,1.0,0.0,0,0,0,0,1,0,4439004,2021-07-20 02:00:00,2021-07-20T02:00,2021,7,21.4,0.0,Clear
09/11/2021,21:00,40.810387,-73.91521,BRONX,1.0,0.0,0,0,0,0,0,0,4456465,2021-09-11 21:00:00,2021-09-11T21:00,2021,9,19.3,0.0,Clear
02/26/2021,18:00,40.804344,-73.92158,BRONX,1.0,0.0,0,0,0,0,1,0,4394904,2021-02-26 18:00:00,2021-02-26T18:00,2021,2,2.1,0.0,Cloudy
04/29/2021,21:00,40.861275,-73.86366,BRONX,2.0,0.0,0,0,0,0,2,0,4412357,2021-04-29 21:00:00,2021-04-29T21:00,2021,4,19.7,0.0,Cloudy
11/19/2021,21:00,40.845493,-73.883484,BRONX,1.0,0.0,1,0,0,0,0,0,4479862,2021-11-19 21:00:00,2021-11-19T21:00,2021,11,3.9,0.0,Clear
03/20/2021,13:00,40.879948,-73.82339,BRONX,1.0,0.0,0,0,0,0,1,0,4400388,2021-03-20 13:00:00,2021-03-20T13:00,2021,3,12.1,0.0,Clear
12/12/2021,14:00,40.82419,-73.91385,BRONX,1.0,0.0,0,0,0,0,0,0,4486806,2021-12-12 14:00:00,2021-12-12T14:00,2021,12,8.3,0.0,Clear
06/10/2021,13:00,40.81417,-73.92122,BRONX,1.0,0.0,1,0,0,0,0,0,4426082,2021-06-10 13:00:00,2021-06-10T13:00,2021,6,26.7,0.0,Cloudy
09/04/2021,7:00,40.878696,-73.8576,BRONX,1.0,0.0,1,0,0,0,0,0,4453910,2021-09-04 07:00:00,2021-09-04T07:00,2021,9,16.3,0.0,Clear
11/19/2021,16:00,40.83,-73.93173,BRONX,0.0,0.0,0,0,0,0,0,0,4479458,2021-11-19 16:00:00,2021-11-19T16:00,2021,11,8.1,0.0,Clear
03/19/2021,16:00,40.818493,-73.88467,BRONX,1.0,0.0,0,0,0,0,1,0,4400213,2021-03-19 16:00:00,2021-03-19T16:00,2021,3,5.4,0.0,Clear
07/09/2021,16:00,40.893597,-73.907166,BRONX,1.0,0.0,1,0,0,0,0,0,4436259,2021-07-09 16:00:00,2021-07-09T16:00,2021,7,29.1,0.0,Clear
10/21/2021,23:00,40.8451887,-73.9007254,BRONX,1.0,0.0,0,0,0,0,1,0,4470218,2021-10-21 23:00:00,2021-10-21T23:00,2021,10,16.2,0.0,Clear
11/29/2021,9:00,40.84869,-73.90329,BRONX,1.0,0.0,0,0,0,0,1,0,4481938,2021-11-29 09:00:00,2021-11-29T09:00,2021,11,2.9,0.0,Clear
12/20/2021,7:00,40.853523,-73.90273,BRONX,1.0,0.0,0,0,0,0,1,0,4488331,2021-12-20 07:00:00,2021-12-20T07:00,2021,12,-3.9,0.0,Clear
06/21/2021,18:00,40.818336,-73.907005,BRONX,1.0,0.0,0,0,1,0,0,0,4429637,2021-06-21 18:00:00,2021-06-21T18:00,2021,6,24.8,0.0,Clear
09/27/2021,16:00,40.830338,-73.82401,BRONX,2.0,0.0,0,0,0,0,2,0,4461739,2021-09-27 16:00:00,2021-09-27T16:00,2021,9,25.0,0.0,Cloudy
03/09/2021,12:00,40.846733,-73.90649,BRONX,1.0,0.0,0,0,0,0,1,0,4397932,2021-03-09 12:00:00,2021-03-09T12:00,2021,3,15.0,0.0,Clear
12/31/2021,16:00,40.81014,-73.908226,BRONX,1.0,0.0,0,0,0,0,1,0,4491083,2021-12-31 16:00:00,2021-12-31T16:00,2021,12,10.2,0.0,Cloudy
09/10/2021,15:00,40.8733,-73.853645,BRONX,1.0,0.0,1,0,0,0,0,0,4457018,2021-09-10 15:00:00,2021-09-10T15:00,2021,9,22.8,0.0,Clear
02/26/2021,1:00,40.819004,-73.89479,BRONX,0.0,0.0,0,0,0,0,0,0,4395169,2021-02-26 01:00:00,2021-02-26T01:00,2021,2,-2.0,0.0,Cloudy
11/03/2021,15:00,40.84299,-73.91099,BRONX,0.0,0.0,0,0,0,0,0,0,4473850,2021-11-03 15:00:00,2021-11-03T15:00,2021,11,10.6,0.0,Clear
05/25/2021,18:00,40.87167,-73.8486,BRONX,1.0,0.0,0,0,0,0,0,0,4420664,2021-05-25 18:00:00,2021-05-25T18:00,2021,5,18.6,0.0,Cloudy
06/16/2021,14:00,0.0,0.0,BRONX,1.0,0.0,0,0,0,0,1,0,4428336,2021-06-16 14:00:00,2021-06-16T14:00,2021,6,26.5,0.0,Cloudy
02/28/2021,23:00,40.82328,-73.91245,BRONX,0.0,0.0,0,0,0,0,0,0,4395902,2021-02-28 23:00:00,2021-02-28T23:00,2021,2,5.3,0.4,Drizzle
05/23/2021,16:00,40.82399,-73.85876,BRONX,2.0,0.0,0,0,0,0,2,0,4419971,2021-05-23 16:00:00,2021-05-23T16:00,2021,5,31.1,0.0,Cloudy
12/18/2021,21:00,40.87686,-73.87974,BRONX,2.0,0.0,2,0,0,0,0,0,4488223,2021-12-18 21:00:00,2021-12-18T21:00,2021,12,6.5,0.0,Cloudy
03/15/2021,15:00,40.862785,-73.84445,BRONX,2.0,0.0,0,0,0,0,2,0,4399208,2021-03-15 15:00:00,2021-03-15T15:00,2021,3,2.3,0.0,Clear
05/11/2021,0:00,40.84827,-73.88312,BRONX,1.0,0.0,0,0,1,0,0,0,4416120,2021-05-11 00:00:00,2021-05-11T00:00,2021,5,8.5,0.0,Cloudy
07/26/2021,0:00,40.818012,-73.92519,BRONX,1.0,0.0,0,0,0,0,1,0,4441241,2021-07-26 00:00:00,2021-07-26T00:00,2021,7,23.7,0.0,Cloudy
01/20/2021,18:00,40.81608,-73.917694,BRONX,1.0,0.0,0,0,1,0,0,0,4385936,2021-01-20 18:00:00,2021-01-20T18:00,2021,1,-1.0,0.0,Clear
04/14/2021,18:00,40.817627,-73.92366,BRONX,0.0,0.0,0,0,0,0,0,0,4407683,2021-04-14 18:00:00,2021-04-14T18:00,2021,4,15.0,0.0,Cloudy
01/06/2021,9:00,40.82378,-73.836426,BRONX,0.0,0.0,0,0,0,0,0,0,4382007,2021-01-06 09:00:00,2021-01-06T09:00,2021,1,2.3,0.0,Clear
08/07/2021,17:00,40.878464,-73.88168,BRONX,0.0,0.0,0,0,0,0,0,0,4444609,2021-08-07 17:00:00,2021-08-07T17:00,2021,8,26.1,0.0,Cloudy
08/20/2021,1:00,40.899246,-73.84609,BRONX,1.0,0.0,0,0,0,0,0,0,4449200,2021-08-20 01:00:00,2021-08-20T01:00,2021,8,22.5,0.0,Cloudy
06/26/2021,0:00,40.826775,-73.87877,BRONX,1.0,0.0,1,0,0,0,0,0,4434517,2021-06-26 00:00:00,2021-06-26T00:00,2021,6,19.0,0.0,Cloudy
02/01/2021,0:00,40.856743,-73.89527,BRONX,1.0,0.0,0,0,0,0,1,0,4388425,2021-02-01 00:00:00,2021-02-01T00:00,2021,2,-4.3,0.9,Heavy Snow
07/04/2021,19:00,40.8211,-73.90676,BRONX,0.0,0.0,0,0,0,0,0,0,4434197,2021-07-04 19:00:00,2021-07-04T19:00,2021,7,21.7,0.0,Clear
11/27/2021,18:00,40.866047,-73.87207,BRONX,0.0,0.0,0,0,0,0,0,0,4481863,2021-11-27 18:00:00,2021-11-27T18:00,2021,11,0.9,0.0,Clear
03/21/2021,23:00,0.0,0.0,BRONX,4.0,0.0,0,0,0,0,4,0,4400705,2021-03-21 23:00:00,2021-03-21T23:00,2021,3,27.9,0.1,Drizzle
07/23/2021,14:00,40.825848,-73.90993,BRONX,2.0,0.0,0,0,0,0,2,0,4440084,2021-07-23 14:00:00,2021-07-23T14:00,2021,7,26.1,0.0,Clear
07/04/2021,8:00,40.822456,-73.868065,BRONX,0.0,0.0,0,0,0,0,0,0,4456619,2021-07-04 08:00:00,2021-07-04T08:00,2021,7,20.0,0.1,Drizzle
06/21/2021,6:00,40.90348,-73.85035,BRONX,2.0,0.0,0,0,0,0,2,0,4429731,2021-06-21 06:00:00,2021-06-21T06:00,2021,6,22.8,0.0,Clear
05/14/2021,12:00,40.81768,-73.92975,BRONX,2.0,0.0,0,0,0,0,2,0,4416624,2021-05-14 12:00:00,2021-05-14T12:00,2021,5,21.4,0.0,Clear
08/23/2021,21:00,40.837513,-73.91478,BRONX,1.0,0.0,0,0,0,0,1,0,4451231,2021-08-23 21:00:00,2021-08-23T21:00,2021,8,23.1,0.0,Clear
10/03/2021,0:00,40.804695,-73.92239,BRONX,2.0,0.0,0,0,0,0,2,0,4463881,2021-10-03 00:00:00,2021-10-03T00:00,2021,10,14.8,0.0,Cloudy
05/27/2021,23:00,40.832607,-73.91762,BRONX,1.0,0.0,1,0,0,0,0,0,4421222,2021-05-27 23:00:00,2021-05-27T23:00,2021,5,17.3,0.0,Cloudy
06/14/2021,18:00,40.84518,-73.91417,BRONX,1.0,0.0,0,0,1,0,0,0,4427726,2021-06-14 18:00:00,2021-06-14T18:00,2021,6,20.4,0.0,Clear
07/25/2021,17:00,40.8477,-73.90097,BRONX,2.0,0.0,0,0,0,0,2,0,4443888,2021-07-25 17:00:00,2021-07-25T17:00,2021,7,26.8,0.2,Drizzle
12/09/2021,4:00,40.863647,-73.8918,BRONX,1.0,0.0,0,0,0,0,1,0,4484889,2021-12-09 04:00:00,2021-12-09T04:00,2021,12,-1.4,0.0,Clear
02/12/2021,12:00,40.817875,-73.89333,BRONX,0.0,0.0,0,0,0,0,0,0,4391865,2021-02-12 12:00:00,2021-02-12T12:00,2021,2,-4.4,0.0,Cloudy
02/05/2021,21:00,40.865368,-73.88824,BRONX,0.0,0.0,0,0,0,0,0,0,4390027,2021-02-05 21:00:00,2021-02-05T21:00,2021,2,1.3,0.0,Clear
02/20/2021,10:00,40.88259,-73.8899,BRONX,0.0,0.0,0,0,0,0,0,0,4393361,2021-02-20 10:00:00,2021-02-20T10:00,2021,2,-0.6,0.0,Clear
10/28/2021,9:00,40.87869,-73.86165,BRONX,0.0,0.0,0,0,0,0,0,0,4472409,2021-10-28 09:00:00,2021-10-28T09:00,2021,10,11.5,0.0,Clear
05/23/2021,0:00,40.81707,-73.88525,BRONX,1.0,0.0,0,0,0,0,1,0,4421340,2021-05-23 00:00:00,2021-05-23T00:00,2021,5,21.5,0.0,Clear
09/03/2021,0:00,40.861862,-73.91275,BRONX,0.0,0.0,0,0,0,0,0,0,4453370,2021-09-03 00:00:00,2021-09-03T00:00,2021,9,15.9,0.0,Clear
10/23/2021,11:00,40.8544106,-73.862933,BRONX,1.0,0.0,0,0,0,0,1,0,4470647,2021-10-23 11:00:00,2021-10-23T11:00,2021,10,12.2,0.0,Cloudy
08/07/2021,21:00,40.880825,-73.85158,BRONX,3.0,0.0,0,0,0,0,3,0,4445163,2021-08-07 21:00:00,2021-08-07T21:00,2021,8,23.8,0.0,Cloudy
08/08/2021,11:00,40.87492,-73.83836,BRONX,1.0,0.0,0,0,0,0,1,0,4445074,2021-08-08 11:00:00,2021-08-08T11:00,2021,8,22.9,0.3,Drizzle
12/08/2021,7:00,40.677166,-73.87775,BROOKLYN,1.0,0.0,0,0,1,0,0,0,4486088,2021-12-08 07:00:00,2021-12-08T07:00,2021,12,2.6,0.0,Cloudy
04/15/2021,16:00,40.66725,-73.88799,BROOKLYN,1.0,0.0,0,0,0,0,1,0,4407729,2021-04-15 16:00:00,2021-04-15T16:00,2021,4,10.5,2.5,Heavy Rain
05/22/2021,13:00,40.63544,-73.97912,BROOKLYN,1.0,0.0,0,0,0,0,1,0,4419335,2021-05-22 13:00:00,2021-05-22T13:00,2021,5,31.0,0.0,Cloudy
07/01/2021,23:00,40.64926,-73.90551,BROOKLYN,2.0,0.0,0,0,0,0,2,0,4433164,2021-07-01 23:00:00,2021-07-01T23:00,2021,7,21.9,0.5,Drizzle
03/31/2021,21:00,40.586308,-73.96943,BROOKLYN,1.0,0.0,1,0,0,0,0,0,4404809,2021-03-31 21:00:00,2021-03-31T21:00,2021,3,10.5,2.8,Heavy Rain
07/06/2021,0:00,40.643894,-73.96873,BROOKLYN,3.0,0.0,0,0,0,0,3,0,4434761,2021-07-06 00:00:00,2021-07-06T00:00,2021,7,22.7,0.0,Clear
12/17/2021,14:00,40.613102,-74.035736,BROOKLYN,1.0,0.0,1,0,0,0,0,0,4488406,2021-12-17 14:00:00,2021-12-17T14:00,2021,12,13.3,0.0,Cloudy
04/14/2021,15:00,0.0,0.0,BROOKLYN,0.0,0.0,0,0,0,0,0,0,4408054,2021-04-14 15:00:00,2021-04-14T15:00,2021,4,27.4,0.0,Cloudy
04/11/2021,21:00,40.681725,-73.996216,BROOKLYN,1.0,0.0,1,0,0,0,0,0,4412741,2021-04-11 21:00:00,2021-04-11T21:00,2021,4,9.0,1.3,Light Rain
04/02/2021,13:00,40.60648,-73.96462,BROOKLYN,1.0,0.0,0,0,1,0,0,0,4403821,2021-04-02 13:00:00,2021-04-02T13:00,2021,4,2.2,0.0,Cloudy
04/11/2021,0:00,40.619484,-73.918274,BROOKLYN,3.0,0.0,0,0,0,0,3,0,4407555,2021-04-11 00:00:00,2021-04-11T00:00,2021,4,11.6,0.0,Cloudy
08/05/2021,10:00,40.696033,-73.984535,BROOKLYN,0.0,0.0,0,0,0,0,0,0,4445348,2021-08-05 10:00:00,2021-08-05T10:00,2021,8,21.7,0.0,Cloudy
01/15/2021,0:00,40.71044,-73.95904,BROOKLYN,0.0,0.0,0,0,0,0,0,0,4384173,2021-01-15 00:00:00,2021-01-15T00:00,2021,1,-0.5,0.0,Clear
03/14/2021,14:00,40.657654,-73.87917,BROOKLYN,1.0,0.0,0,0,0,0,1,0,4399056,2021-03-14 14:00:00,2021-03-14T14:00,2021,3,10.0,0.0,Clear
05/20/2021,20:00,40.671608,-73.91695,BROOKLYN,1.0,0.0,0,0,1,0,0,0,4419145,2021-05-20 20:00:00,2021-05-20T20:00,2021,5,13.8,0.0,Clear
02/08/2021,22:00,40.644253,-73.93252,BROOKLYN,2.0,0.0,0,0,0,0,2,0,4390596,2021-02-08 22:00:00,2021-02-08T22:00,2021,2,-8.0,0.0,Cloudy
04/09/2021,12:00,40.69119,-73.9978,BROOKLYN,1.0,0.0,0,0,0,0,1,0,4406170,2021-04-09 12:00:00,2021-04-09T12:00,2021,4,10.6,0.0,Cloudy
01/01/2021,1:00,40.657524,-73.91055,BROOKLYN,0.0,0.0,0,0,0,0,0,0,4381669,2021-01-01 01:00:00,2021-01-01T01:00,2021,1,-0.9,0.0,Clear
03/30/2021,16:00,40.61377,-74.02315,BROOKLYN,1.0,0.0,0,0,0,0,1,0,4403049,2021-03-30 16:00:00,2021-03-30T16:00,2021,3,10.3,0.0,Clear
11/18/2021,5:00,40.681946,-73.96836,BROOKLYN,1.0,0.0,0,0,0,0,1,0,4478921,2021-11-18 05:00:00,2021-11-18T05:00,2021,11,11.1,0.0,Clear
11/07/2021,1:00,40.65011,-73.930214,BROOKLYN,3.0,0.0,0,0,0,0,3,0,4474874,2021-11-07 01:00:00,2021-11-07T01:00,2021,11,3.2,0.0,Clear
01/10/2021,19:00,40.653774,-73.95617,BROOKLYN,2.0,0.0,2,0,0,0,0,0,4382902,2021-01-10 19:00:00,2021-01-10T19:00,2021,1,-1.6,0.0,Clear
02/14/2021,8:00,40.615185,-73.98367,BROOKLYN,1.0,0.0,0,0,1,0,0,0,4393322,2021-02-14 08:00:00,2021-02-14T08:00,2021,2,-1.9,0.0,Cloudy
11/24/2021,0:00,40.652508,-73.92164,BROOKLYN,6.0,0.0,0,0,1,0,5,0,4480574,2021-11-24 00:00:00,2021-11-24T00:00,2021,11,-0.0,0.0,Clear
12/10/2021,16:00,40.639217,-73.968796,BROOKLYN,2.0,0.0,0,0,0,0,2,0,4485354,2021-12-10 16:00:00,2021-12-10T16:00,2021,12,8.3,0.0,Cloudy
11/22/2021,19:00,40.643005,-73.95263,BROOKLYN,1.0,0.0,0,0,0,0,1,0,4480204,2021-11-22 19:00:00,2021-11-22T19:00,2021,11,4.7,0.0,Clear
04/28/2021,17:00,40.67264,-73.87281,BROOKLYN,1.0,0.0,0,0,1,0,0,0,4411511,2021-04-28 17:00:00,2021-04-28T17:00,2021,4,17.1,0.0,Cloudy
06/27/2021,15:00,40.708675,-73.956314,BROOKLYN,0.0,0.0,0,0,0,0,0,0,4433941,2021-06-27 15:00:00,2021-06-27T15:00,2021,6,27.5,0.1,Drizzle
03/15/2021,14:00,40.632847,-73.928375,BROOKLYN,0.0,0.0,0,0,0,0,0,0,4399861,2021-03-15 14:00:00,2021-03-15T14:00,2021,3,2.2,0.0,Clear
03/07/2021,19:00,40.636074,-74.00896,BROOKLYN,1.0,0.0,0,0,1,0,0,0,4396953,2021-03-07 19:00:00,2021-03-07T19:00,2021,3,-0.4,0.0,Clear
01/28/2021,19:00,40.608807,-73.9532,BROOKLYN,1.0,0.0,1,0,0,0,0,0,4388231,2021-01-28 19:00:00,2021-01-28T19:00,2021,1,-4.1,0.0,Clear
08/17/2021,23:00,40.630913,-74.01433,BROOKLYN,1.0,0.0,0,0,0,0,0,0,4448207,2021-08-17 23:00:00,2021-08-17T23:00,2021,8,23.5,0.0,Cloudy
05/07/2021,13:00,40.68866,-73.97096,BROOKLYN,0.0,0.0,0,0,0,0,0,0,4416473,2021-05-07 13:00:00,2021-05-07T13:00,2021,5,15.1,0.0,Cloudy
12/20/2021,11:00,40.66855,-73.990234,BROOKLYN,1.0,0.0,0,0,1,0,0,0,4488289,2021-12-20 11:00:00,2021-12-20T11:00,2021,12,-0.6,0.0,Clear
10/15/2021,9:00,40.5982911,-74.000036,BROOKLYN,1.0,0.0,1,0,0,0,0,0,4467781,2021-10-15 09:00:00,2021-10-15T09:00,2021,10,20.3,0.0,Clear
12/25/2021,2:00,40.674767,-73.88536,BROOKLYN,0.0,0.0,0,0,0,0,0,0,4491261,2021-12-25 02:00:00,2021-12-25T02:00,2021,12,4.2,0.0,Cloudy
01/31/2021,20:00,40.67379,-73.90801,BROOKLYN,0.0,0.0,0,0,0,0,0,0,4388292,2021-01-31 20:00:00,2021-01-31T20:00,2021,1,-5.0,0.6,Heavy Snow
01/13/2021,7:00,40.62192,-73.936134,BROOKLYN,1.0,0.0,0,0,0,0,1,0,4384038,2021-01-13 07:00:00,2021-01-13T07:00,2021,1,-0.4,0.0,Cloudy
04/18/2021,8:00,40.712864,-73.94013,BROOKLYN,0.0,0.0,0,0,0,0,0,0,4408444,2021-04-18 08:00:00,2021-04-18T08:00,2021,4,10.7,0.0,Clear
09/18/2021,0:00,40.6333,-73.94812,BROOKLYN,1.0,0.0,0,0,0,0,1,0,4458450,2021-09-18 00:00:00,2021-09-18T00:00,2021,9,20.7,0.0,Clear
04/18/2021,0:00,40.674603,-73.98178,BROOKLYN,1.0,0.0,1,0,0,0,0,0,4409227,2021-04-18 00:00:00,2021-04-18T00:00,2021,4,7.7,0.0,Cloudy
08/16/2021,21:00,40.674374,-73.97555,BROOKLYN,1.0,0.0,0,0,1,0,0,0,4447702,2021-08-16 21:00:00,2021-08-16T21:00,2021,8,23.1,0.0,Cloudy
07/16/2021,0:00,40.699627,-73.923836,BROOKLYN,0.0,0.0,0,0,0,0,0,0,4438439,2021-07-16 00:00:00,2021-07-16T00:00,2021,7,24.9,0.0,Clear
04/28/2021,11:00,40.608143,-74.00412,BROOKLYN,1.0,0.0,0,0,0,0,1,0,4411752,2021-04-28 11:00:00,2021-04-28T11:00,2021,4,19.6,0.0,Cloudy
04/15/2021,3:00,40.667377,-73.880394,BROOKLYN,0.0,0.0,0,0,0,0,0,0,4407744,2021-04-15 03:00:00,2021-04-15T03:00,2021,4,11.7,0.0,Cloudy
05/20/2021,18:00,40.657276,-73.914345,BROOKLYN,2.0,0.0,0,0,0,0,2,0,4419352,2021-05-20 18:00:00,2021-05-20T18:00,2021,5,15.5,0.0,Clear
01/24/2021,18:00,40.58904,-73.94458,BROOKLYN,1.0,0.0,1,0,0,0,0,0,4388253,2021-01-24 18:00:00,2021-01-24T18:00,2021,1,-1.0,0.0,Cloudy
01/15/2021,16:00,40.63071,-74.021454,BROOKLYN,0.0,0.0,0,0,0,0,0,0,4385740,2021-01-15 16:00:00,2021-01-15T16:00,2021,1,7.3,0.0,Cloudy
06/18/2021,8:00,40.676144,-73.893074,BROOKLYN,2.0,0.0,0,0,0,0,2,0,4428605,2021-06-18 08:00:00,2021-06-18T08:00,2021,6,20.8,0.0,Clear
02/11/2021,20:00,40.723003,-73.94502,BROOKLYN,1.0,0.0,0,0,1,0,0,0,4391497,2021-02-11 20:00:00,2021-02-11T20:00,2021,2,-3.6,0.0,Cloudy
06/24/2021,16:00,40.671967,-73.96395,BROOKLYN,3.0,0.0,0,0,0,0,3,0,4431335,2021-06-24 16:00:00,2021-06-24T16:00,2021,6,20.8,0.0,Clear
04/05/2021,13:00,40.66529,-73.95095,BROOKLYN,1.0,0.0,0,0,0,0,1,0,4405529,2021-04-05 13:00:00,2021-04-05T13:00,2021,4,16.9,0.0,Clear
04/15/2021,8:00,40.608204,-73.920715,BROOKLYN,1.0,0.0,0,0,0,0,1,0,4408524,2021-04-15 08:00:00,2021-04-15T08:00,2021,4,12.0,0.1,Drizzle
05/14/2021,16:00,40.65432,-73.91788,BROOKLYN,0.0,0.0,0,0,0,0,0,0,4416952,2021-05-14 16:00:00,2021-05-14T16:00,2021,5,19.8,0.0,Clear
07/07/2021,11:00,40.697895,-73.97234,BROOKLYN,0.0,0.0,0,0,0,0,0,0,4434980,2021-07-07 11:00:00,2021-07-07T11:00,2021,7,29.2,0.0,Clear
02/05/2021,20:00,40.58317,-73.953445,BROOKLYN,1.0,0.0,0,0,0,0,1,0,4391902,2021-02-05 20:00:00,2021-02-05T20:00,2021,2,3.1,0.0,Clear
09/29/2021,8:00,40.636074,-73.92191,BROOKLYN,2.0,0.0,0,0,0,0,2,0,4462319,2021-09-29 08:00:00,2021-09-29T08:00,2021,9,14.2,0.0,Clear
09/28/2021,14:00,40.633335,-74.021065,BROOKLYN,2.0,0.0,2,0,0,0,0,0,4462111,2021-09-28 14:00:00,2021-09-28T14:00,2021,9,23.2,0.1,Drizzle
09/17/2021,15:00,40.62806,-74.02029,BROOKLYN,1.0,0.0,0,0,1,0,0,0,4458236,2021-09-17 15:00:00,2021-09-17T15:00,2021,9,24.0,0.2,Drizzle
11/24/2021,12:00,40.637913,-73.992714,BROOKLYN,1.0,0.0,1,0,0,0,0,0,4480880,2021-11-24 12:00:00,2021-11-24T12:00,2021,11,5.1,0.0,Clear
01/24/2021,21:00,40.71709,-73.94024,BROOKLYN,1.0,0.0,1,0,0,0,0,0,4386766,2021-01-24 21:00:00,2021-01-24T21:00,2021,1,-3.0,0.0,Clear
03/26/2021,12:00,40.660492,-73.8921,BROOKLYN,1.0,0.0,0,0,0,0,1,0,4402615,2021-03-26 12:00:00,2021-03-26T12:00,2021,3,21.3,0.0,Clear
03/12/2021,0:00,40.71786,-73.96223,BROOKLYN,1.0,0.0,1,0,0,0,0,0,4400738,2021-03-12 00:00:00,2021-03-12T00:00,2021,3,12.2,0.0,Cloudy
04/28/2021,17:00,40.678543,-73.96855,BROOKLYN,1.0,0.0,0,0,1,0,0,0,4413130,2021-04-28 17:00:00,2021-04-28T17:00,2021,4,16.8,0.0,Cloudy
08/14/2021,19:00,40.699482,-73.96104,BROOKLYN,1.0,0.0,0,0,0,0,1,0,4448240,2021-08-14 19:00:00,2021-08-14T19:00,2021,8,26.0,0.0,Cloudy
05/20/2021,0:00,40.686287,-73.9695,BROOKLYN,1.0,0.0,0,0,0,0,1,0,4418629,2021-05-20 00:00:00,2021-05-20T00:00,2021,5,14.3,0.0,Cloudy
12/10/2021,13:00,40.67127,-73.900024,BROOKLYN,0.0,0.0,0,0,0,0,0,0,4486094,2021-12-10 13:00:00,2021-12-10T13:00,2021,12,8.6,0.0,Cloudy
06/04/2021,13:00,40.68545,-73.96934,BROOKLYN,0.0,0.0,0,0,0,0,0,0,4425767,2021-06-04 13:00:00,2021-06-04T13:00,2021,6,22.9,0.1,Drizzle
09/27/2021,12:00,40.63252,-73.99702,BROOKLYN,0.0,0.0,0,0,0,0,0,0,4463393,2021-09-27 12:00:00,2021-09-27T12:00,2021,9,24.3,0.0,Clear
09/19/2021,22:00,40.728416,-73.943085,BROOKLYN,0.0,0.0,0,0,0,0,0,0,4461018,2021-09-19 22:00:00,2021-09-19T22:00,2021,9,19.8,0.0,Clear
05/08/2021,19:00,40.71493,-73.93874,BROOKLYN,0.0,0.0,0,0,0,0,0,0,4414971,2021-05-08 19:00:00,2021-05-08T19:00,2021,5,9.6,0.0,Cloudy
12/08/2021,5:00,40.6082,-73.920715,BROOKLYN,2.0,0.0,0,0,0,0,2,0,4484705,2021-12-08 05:00:00,2021-12-08T05:00,2021,12,1.9,0.0,Cloudy
06/22/2021,22:00,40.64556,-73.931694,BROOKLYN,1.0,0.0,0,0,0,0,1,0,4429906,2021-06-22 22:00:00,2021-06-22T22:00,2021,6,15.8,0.0,Cloudy
12/07/2021,0:00,40.681026,-73.90866,BROOKLYN,1.0,0.0,1,0,0,0,0,0,4484494,2021-12-07 00:00:00,2021-12-07T00:00,2021,12,7.2,0.0,Cloudy
09/01/2021,19:00,40.577244,-74.00004,BROOKLYN,1.0,0.0,1,0,0,0,0,0,4453207,2021-09-01 19:00:00,2021-09-01T19:00,2021,9,21.8,6.9,Heavy Rain
11/18/2021,23:00,40.657036,-73.89383,BROOKLYN,2.0,0.0,0,0,0,0,2,0,4478979,2021-11-18 23:00:00,2021-11-18T23:00,2021,11,10.7,1.0,Drizzle
03/12/2021,8:00,40.63825,-73.91766,BROOKLYN,2.0,0.0,0,0,0,0,2,0,4398241,2021-03-12 08:00:00,2021-03-12T08:00,2021,3,13.1,0.0,Cloudy
08/02/2021,16:00,40.67538,-73.9082,BROOKLYN,1.0,0.0,0,0,1,0,0,0,4444707,2021-08-02 16:00:00,2021-08-02T16:00,2021,8,26.5,0.0,Clear
01/28/2021,18:00,40.670532,-73.91488,BROOKLYN,1.0,0.0,1,0,0,0,0,0,4388024,2021-01-28 18:00:00,2021-01-28T18:00,2021,1,-4.9,0.0,Clear
07/26/2021,20:00,40.708717,-73.96419,BROOKLYN,3.0,0.0,0,0,0,0,3,0,4443004,2021-07-26 20:00:00,2021-07-26T20:00,2021,7,25.0,0.0,Clear
02/03/2021,13:00,40.660934,-73.89599,BROOKLYN,0.0,0.0,0,0,0,0,0,0,4388978,2021-02-03 13:00:00,2021-02-03T13:00,2021,2,1.2,0.0,Cloudy
12/25/2021,11:00,40.64374,-73.9598,BROOKLYN,0.0,0.0,0,0,0,0,0,0,4489658,2021-12-25 11:00:00,2021-12-25T11:00,2021,12,7.2,0.3,Drizzle
09/04/2021,19:00,40.636387,-73.94611,BROOKLYN,2.0,0.0,0,0,0,0,2,0,4453938,2021-09-04 19:00:00,2021-09-04T19:00,2021,9,20.7,0.0,Clear
03/03/2021,11:00,40.68966,-74.00047,BROOKLYN,1.0,0.0,0,0,0,0,1,0,4397219,2021-03-03 11:00:00,2021-03-03T11:00,2021,3,7.1,0.0,Clear
10/14/2021,19:00,40.6615359,-73.8788354,BROOKLYN,1.0,0.0,1,0,0,0,0,0,4467255,2021-10-14 19:00:00,2021-10-14T19:00,2021,10,19.1,0.0,Clear
04/15/2021,0:00,40.675632,-73.89878,BROOKLYN,1.0,0.0,0,0,0,0,1,0,4408834,2021-04-15 00:00:00,2021-04-15T00:00,2021,4,11.8,0.0,Cloudy
02/06/2021,23:00,40.58993,-73.90059,BROOKLYN,1.0,0.0,0,0,0,0,1,0,4390744,2021-02-06 23:00:00,2021-02-06T23:00,2021,2,0.7,0.0,Cloudy
12/01/2021,19:00,40.707752,-73.96842,BROOKLYN,1.0,0.0,0,0,1,0,0,0,4482710,2021-12-01 19:00:00,2021-12-01T19:00,2021,12,5.1,0.0,Cloudy
09/07/2021,14:00,40.60461,-73.99826,BROOKLYN,1.0,0.0,0,0,1,0,0,0,4454846,2021-09-07 14:00:00,2021-09-07T14:00,2021,9,25.5,0.0,Clear
02/12/2021,12:00,40.63693,-73.93725,BROOKLYN,1.0,0.0,0,0,0,0,1,0,4391721,2021-02-12 12:00:00,2021-02-12T12:00,2021,2,-5.4,0.0,Cloudy
05/19/2021,14:00,40.67165,-73.9176,BROOKLYN,0.0,0.0,0,0,0,0,0,0,4418393,2021-05-19 14:00:00,2021-05-19T14:00,2021,5,28.6,0.0,Clear
01/08/2021,13:00,40.68789,-73.90724,BROOKLYN,1.0,0.0,0,0,0,0,1,0,4386638,2021-01-08 13:00:00,2021-01-08T13:00,2021,1,3.9,0.0,Cloudy
02/08/2021,14:00,40.703976,-73.92309,BROOKLYN,0.0,0.0,0,0,0,0,0,0,4390681,2021-02-08 14:00:00,2021-02-08T14:00,2021,2,-4.3,0.0,Clear
03/14/2021,19:00,40.69341,-73.976906,BROOKLYN,1.0,0.0,0,0,0,0,1,0,4399209,2021-03-14 19:00:00,2021-03-14T19:00,2021,3,2.0,0.0,Clear
10/17/2021,0:00,40.6781627,-73.8974769,BROOKLYN,3.0,0.0,0,0,0,0,3,0,4468171,2021-10-17 00:00:00,2021-10-17T00:00,2021,10,14.4,0.0,Clear
07/18/2021,16:00,40.681297,-73.93472,BROOKLYN,1.0,0.0,0,0,1,0,0,0,4442509,2021-07-18 16:00:00,2021-07-18T16:00,2021,7,28.3,0.0,Cloudy
04/29/2021,14:00,40.6397,-74.019615,BROOKLYN,0.0,0.0,0,0,0,0,0,0,4416666,2021-04-29 14:00:00,2021-04-29T14:00,2021,4,21.7,0.7,Drizzle
06/26/2021,12:00,40.66531,-73.890305,BROOKLYN,1.0,0.0,1,0,0,0,0,0,4432064,2021-06-26 12:00:00,2021-06-26T12:00,2021,6,24.5,0.0,Cloudy
02/05/2021,16:00,40.588306,-73.94811,BROOKLYN,0.0,0.0,0,0,0,0,0,0,4389549,2021-02-05 16:00:00,2021-02-05T16:00,2021,2,5.1,0.0,Clear
01/14/2021,15:00,40.64727,-73.99731,BROOKLYN,1.0,0.0,0,0,1,0,0,0,4384910,2021-01-14 15:00:00,2021-01-14T15:00,2021,1,8.4,0.0,Cloudy
07/24/2021,22:00,40.68632,-73.869095,BROOKLYN,2.0,0.0,0,0,0,0,2,0,4440548,2021-07-24 22:00:00,2021-07-24T22:00,2021,7,22.8,0.0,Cloudy
04/19/2021,0:00,40.659485,-73.918304,BROOKLYN,3.0,0.0,0,0,0,0,3,0,4408913,2021-04-19 00:00:00,2021-04-19T00:00,2021,4,6.2,0.0,Clear
05/03/2021,23:00,40.66849,-73.88645,BROOKLYN,0.0,0.0,0,0,0,0,0,0,4413493,2021-05-03 23:00:00,2021-05-03T23:00,2021,5,11.8,2.9,Heavy Rain
07/05/2021,18:00,40.653908,-73.95381,BROOKLYN,1.0,0.0,0,0,0,0,1,0,4434336,2021-07-05 18:00:00,2021-07-05T18:00,2021,7,24.3,0.0,Clear
04/29/2021,0:00,40.635506,-73.913284,BROOKLYN,1.0,0.0,0,0,0,0,1,0,4411806,2021-04-29 00:00:00,2021-04-29T00:00,2021,4,13.9,0.0,Cloudy
06/18/2021,0:00,40.654278,-73.92292,BROOKLYN,2.0,0.0,0,0,0,0,2,0,4428763,2021-06-18 00:00:00,2021-06-18T00:00,2021,6,15.9,0.0,Clear
08/13/2021,14:00,40.651512,-74.00734,BROOKLYN,1.0,0.0,0,0,0,0,0,0,4446975,2021-08-13 14:00:00,2021-08-13T14:00,2021,8,33.3,0.0,Clear
09/29/2021,19:00,40.708782,-73.94344,BROOKLYN,1.0,0.0,0,0,0,0,1,0,4466070,2021-09-29 19:00:00,2021-09-29T19:00,2021,9,17.5,0.0,Clear
08/17/2021,0:00,40.62731,-73.941826,BROOKLYN,1.0,0.0,0,0,1,0,0,0,4448549,2021-08-17 00:00:00,2021-08-17T00:00,2021,8,23.3,0.0,Cloudy
12/16/2021,14:00,40.693264,-73.91268,BROOKLYN,1.0,0.0,1,0,0,0,0,0,4488404,2021-12-16 14:00:00,2021-12-16T14:00,2021,12,14.9,0.0,Cloudy
07/25/2021,0:00,40.683514,-73.97596,BROOKLYN,1.0,0.0,1,0,0,0,0,0,4440656,2021-07-25 00:00:00,2021-07-25T00:00,2021,7,22.6,0.0,Cloudy
08/06/2021,14:00,40.665825,-73.94811,BROOKLYN,1.0,0.0,0,0,0,0,1,0,4444322,2021-08-06 14:00:00,2021-08-06T14:00,2021,8,28.0,0.0,Clear
11/30/2021,5:00,40.68405,-73.97746,BROOKLYN,0.0,0.0,0,0,0,0,0,0,4482514,2021-11-30 05:00:00,2021-11-30T05:00,2021,11,-1.3,0.0,Clear
09/24/2021,16:00,40.68192,-73.86603,BROOKLYN,3.0,0.0,0,0,0,0,3,0,4461077,2021-09-24 16:00:00,2021-09-24T16:00,2021,9,22.0,0.0,Clear
11/30/2021,11:00,40.612732,-74.01172,BROOKLYN,1.0,0.0,0,0,0,0,1,0,4482331,2021-11-30 11:00:00,2021-11-30T11:00,2021,11,4.7,0.0,Cloudy
09/14/2021,22:00,40.642384,-73.92539,BROOKLYN,1.0,0.0,0,0,0,0,1,0,4457550,2021-09-14 22:00:00,2021-09-14T22:00,2021,9,21.8,0.0,Cloudy
07/31/2021,8:00,40.590355,-73.971886,BROOKLYN,1.0,0.0,0,0,1,0,0,0,4442246,2021-07-31 08:00:00,2021-07-31T08:00,2021,7,19.3,0.0,Clear
03/15/2021,20:00,40.62636,-73.91901,BROOKLYN,1.0,0.0,0,0,0,0,1,0,4399884,2021-03-15 20:00:00,2021-03-15T20:00,2021,3,0.6,0.0,Cloudy
04/03/2021,14:00,40.69012,-73.92318,BROOKLYN,1.0,0.0,1,0,0,0,0,0,4406627,2021-04-03 14:00:00,2021-04-03T14:00,2021,4,9.8,0.0,Clear
05/25/2021,0:00,40.680016,-73.87743,BROOKLYN,2.0,0.0,0,0,0,0,2,0,4420872,2021-05-25 00:00:00,2021-05-25T00:00,2021,5,14.5,0.0,Cloudy
07/18/2021,19:00,40.686478,-73.926796,BROOKLYN,1.0,0.0,0,0,0,0,0,0,4442641,2021-07-18 19:00:00,2021-07-18T19:00,2021,7,24.6,0.0,Clear
07/07/2021,14:00,40.66785,-73.92103,BROOKLYN,1.0,0.0,0,0,0,0,1,0,4436112,2021-07-07 14:00:00,2021-07-07T14:00,2021,7,28.5,0.0,Clear
04/30/2021,19:00,40.62432,-74.02476,BROOKLYN,3.0,0.0,0,0,0,0,3,0,4412089,2021-04-30 19:00:00,2021-04-30T19:00,2021,4,13.5,0.0,Cloudy
06/05/2021,17:00,40.680237,-73.96425,BROOKLYN,1.0,0.0,0,0,1,0,0,0,4424915,2021-06-05 17:00:00,2021-06-05T17:00,2021,6,28.9,0.0,Clear
05/22/2021,15:00,40.711536,-73.94494,BROOKLYN,1.0,0.0,0,0,1,0,0,0,4419804,2021-05-22 15:00:00,2021-05-22T15:00,2021,5,31.0,0.0,Cloudy
11/10/2021,13:00,40.601696,-73.93508,BROOKLYN,1.0,0.0,1,0,0,0,0,0,4476546,2021-11-10 13:00:00,2021-11-10T13:00,2021,11,17.5,0.0,Clear
07/04/2021,6:00,40.6921,-73.95754,BROOKLYN,5.0,0.0,0,0,0,0,5,0,4441600,2021-07-04 06:00:00,2021-07-04T06:00,2021,7,17.5,0.0,Clear
05/20/2021,12:00,40.59055,-73.98891,BROOKLYN,1.0,0.0,1,0,0,0,0,0,4419550,2021-05-20 12:00:00,2021-05-20T12:00,2021,5,18.0,0.0,Cloudy
12/12/2021,18:00,40.614433,-73.92725,BROOKLYN,1.0,0.0,0,0,0,0,1,0,4485796,2021-12-12 18:00:00,2021-12-12T18:00,2021,12,6.3,0.0,Clear
01/29/2021,13:00,40.676937,-73.8704,BROOKLYN,1.0,0.0,0,0,0,0,1,0,4387791,2021-01-29 13:00:00,2021-01-29T13:00,2021,1,-5.0,0.0,Clear
06/06/2021,20:00,40.58525,-73.98728,BROOKLYN,1.0,0.0,0,0,0,0,1,0,4424209,2021-06-06 20:00:00,2021-06-06T20:00,2021,6,25.4,0.0,Clear
05/17/2021,18:00,40.711903,-73.96295,BROOKLYN,1.0,0.0,0,0,1,0,0,0,4417659,2021-05-17 18:00:00,2021-05-17T18:00,2021,5,18.5,0.0,Clear
08/25/2021,9:00,40.646626,-73.98308,BROOKLYN,1.0,0.0,0,0,0,0,1,0,4450389,2021-08-25 09:00:00,2021-08-25T09:00,2021,8,26.8,0.0,Clear
03/08/2021,15:00,40.668686,-73.95063,BROOKLYN,1.0,0.0,0,0,0,0,1,0,4397300,2021-03-08 15:00:00,2021-03-08T15:00,2021,3,5.6,0.0,Clear
06/23/2021,17:00,40.712406,-73.966,BROOKLYN,1.0,0.0,0,0,1,0,0,0,4430524,2021-06-23 17:00:00,2021-06-23T17:00,2021,6,23.2,0.0,Clear
04/29/2021,22:00,40.668655,-73.94585,BROOKLYN,0.0,0.0,0,0,0,0,0,0,4413041,2021-04-29 22:00:00,2021-04-29T22:00,2021,4,18.7,0.0,Cloudy
09/24/2021,7:00,40.663334,-73.960236,BROOKLYN,0.0,0.0,0,0,0,0,0,0,4462338,2021-09-24 07:00:00,2021-09-24T07:00,2021,9,16.7,0.4,Drizzle
11/16/2021,22:00,40.718792,-73.93726,BROOKLYN,0.0,0.0,0,0,0,0,0,0,4478237,2021-11-16 22:00:00,2021-11-16T22:00,2021,11,2.9,0.0,Clear
05/18/2021,17:00,40.654312,-73.91759,BROOKLYN,2.0,0.0,0,0,0,0,2,0,4418240,2021-05-18 17:00:00,2021-05-18T17:00,2021,5,20.6,0.0,Cloudy
04/15/2021,20:00,40.601128,-73.997086,BROOKLYN,1.0,0.0,1,0,0,0,0,0,4407642,2021-04-15 20:00:00,2021-04-15T20:00,2021,4,8.9,0.0,Cloudy
07/05/2021,22:00,40.629047,-73.94369,BROOKLYN,2.0,0.0,0,0,0,0,2,0,4434556,2021-07-05 22:00:00,2021-07-05T22:00,2021,7,23.6,0.0,Clear
02/11/2021,16:00,40.711903,-73.96295,BROOKLYN,0.0,0.0,0,0,0,0,0,0,4392673,2021-02-11 16:00:00,2021-02-11T16:00,2021,2,-1.0,0.0,Cloudy
07/24/2021,22:00,40.703373,-73.93764,BROOKLYN,1.0,0.0,1,0,0,0,0,0,4442966,2021-07-24 22:00:00,2021-07-24T22:00,2021,7,22.7,0.0,Cloudy
07/31/2021,10:00,40.61458,-74.022804,BROOKLYN,1.0,0.0,0,0,0,0,1,0,4442094,2021-07-31 10:00:00,2021-07-31T10:00,2021,7,21.4,0.0,Clear
06/01/2021,20:00,40.68457,-73.91919,BROOKLYN,0.0,0.0,0,0,0,0,0,0,4424501,2021-06-01 20:00:00,2021-06-01T20:00,2021,6,17.1,0.0,Cloudy
12/18/2021,12:00,40.62094,-74.01037,BROOKLYN,2.0,0.0,0,0,0,0,2,0,4487433,2021-12-18 12:00:00,2021-12-18T12:00,2021,12,6.3,0.1,Drizzle
04/21/2021,23:00,40.631706,-73.94649,BROOKLYN,2.0,0.0,0,0,0,0,2,0,4409414,2021-04-21 23:00:00,2021-04-21T23:00,2021,4,3.9,0.0,Clear
03/21/2021,15:00,40.637833,-73.95381,BROOKLYN,1.0,0.0,0,0,1,0,0,0,4400683,2021-03-21 15:00:00,2021-03-21T15:00,2021,3,11.7,0.0,Clear
09/26/2021,17:00,40.633278,-73.983185,BROOKLYN,1.0,0.0,0,0,0,0,1,0,4462126,2021-09-26 17:00:00,2021-09-26T17:00,2021,9,20.4,0.0,Clear
10/13/2021,18:00,40.6802223,-73.8712013,BROOKLYN,1.0,0.0,0,0,0,0,0,0,4467260,2021-10-13 18:00:00,2021-10-13T18:00,2021,10,18.6,0.0,Clear
02/08/2021,0:00,40.6754,-73.9887,BROOKLYN,0.0,0.0,0,0,0,0,0,0,4390667,2021-02-08 00:00:00,2021-02-08T00:00,2021,2,-4.4,0.0,Clear
11/09/2021,0:00,40.67066,-73.904205,BROOKLYN,1.0,0.0,0,0,0,0,1,0,4475688,2021-11-09 00:00:00,2021-11-09T00:00,2021,11,8.0,0.0,Clear
01/17/2021,18:00,40.70914,-73.950836,BROOKLYN,1.0,0.0,0,0,0,0,1,0,4384586,2021-01-17 18:00:00,2021-01-17T18:00,2021,1,4.1,0.0,Cloudy
08/24/2021,17:00,40.693195,-73.92859,BROOKLYN,1.0,0.0,1,0,0,0,0,0,4459968,2021-08-24 17:00:00,2021-08-24T17:00,2021,8,29.8,0.0,Clear
12/19/2021,11:00,40.640553,-74.0043,BROOKLYN,1.0,0.0,1,0,0,0,0,0,4488171,2021-12-19 11:00:00,2021-12-19T11:00,2021,12,3.9,0.0,Cloudy
08/18/2021,0:00,40.657524,-73.91055,BROOKLYN,2.0,0.0,0,0,0,0,2,0,4448223,2021-08-18 00:00:00,2021-08-18T00:00,2021,8,23.2,0.0,Cloudy
05/08/2021,20:00,40.69365,-73.98333,BROOKLYN,1.0,0.0,0,0,0,0,1,0,4414776,2021-05-08 20:00:00,2021-05-08T20:00,2021,5,9.0,0.0,Clear
06/24/2021,16:00,40.685318,-73.958305,BROOKLYN,1.0,0.0,1,0,0,0,0,0,4431310,2021-06-24 16:00:00,2021-06-24T16:00,2021,6,21.0,0.0,Clear
11/29/2021,9:00,40.668797,-73.93113,BROOKLYN,1.0,0.0,1,0,0,0,0,0,4482067,2021-11-29 09:00:00,2021-11-29T09:00,2021,11,3.1,0.0,Clear
07/30/2021,14:00,40.67695,-73.91367,BROOKLYN,1.0,0.0,0,0,0,0,1,0,4444813,2021-07-30 14:00:00,2021-07-30T14:00,2021,7,28.5,0.0,Clear
05/07/2021,17:00,40.64803,-73.966675,BROOKLYN,4.0,0.0,0,0,0,0,4,0,4414524,2021-05-07 17:00:00,2021-05-07T17:00,2021,5,12.8,0.0,Cloudy
01/29/2021,12:00,40.653805,-73.93061,BROOKLYN,1.0,0.0,0,0,1,0,0,0,4389862,2021-01-29 12:00:00,2021-01-29T12:00,2021,1,-5.5,0.0,Clear
06/14/2021,16:00,40.713123,-73.95351,BROOKLYN,1.0,0.0,0,0,0,0,1,0,4428802,2021-06-14 16:00:00,2021-06-14T16:00,2021,6,21.0,0.0,Clear
01/28/2021,5:00,40.6338,-73.8897,BROOKLYN,1.0,0.0,0,0,0,0,1,0,4387434,2021-01-28 05:00:00,2021-01-28T05:00,2021,1,-3.0,0.0,Cloudy
04/05/2021,18:00,40.696014,-73.92153,BROOKLYN,1.0,0.0,0,0,0,0,1,0,4405485,2021-04-05 18:00:00,2021-04-05T18:00,2021,4,14.7,0.0,Clear
09/18/2021,14:00,40.649982,-73.91183,BROOKLYN,0.0,0.0,0,0,0,0,0,0,4459561,2021-09-18 14:00:00,2021-09-18T14:00,2021,9,27.4,0.1,Drizzle
08/28/2021,22:00,40.6732,-73.88709,BROOKLYN,1.0,0.0,0,0,0,0,1,0,4451397,2021-08-28 22:00:00,2021-08-28T22:00,2021,8,19.7,0.0,Cloudy
02/04/2021,16:00,40.651054,-74.01112,BROOKLYN,1.0,0.0,0,0,0,0,1,0,4389282,2021-02-04 16:00:00,2021-02-04T16:00,2021,2,2.6,0.0,Clear
02/26/2021,22:00,40.64404,-73.91021,BROOKLYN,2.0,0.0,0,0,0,0,2,0,4394811,2021-02-26 22:00:00,2021-02-26T22:00,2021,2,3.2,0.0,Cloudy
03/19/2021,12:00,40.72699,-73.95299,BROOKLYN,1.0,0.0,1,0,0,0,0,0,4400106,2021-03-19 12:00:00,2021-03-19T12:00,2021,3,3.2,0.0,Cloudy
04/20/2021,9:00,40.597282,-73.99626,BROOKLYN,0.0,0.0,0,0,0,0,0,0,4408958,2021-04-20 09:00:00,2021-04-20T09:00,2021,4,14.5,0.0,Cloudy
07/07/2021,10:00,40.678265,-73.89724,BROOKLYN,1.0,0.0,1,0,0,0,0,0,4435231,2021-07-07 10:00:00,2021-07-07T10:00,2021,7,28.2,0.0,Clear
09/08/2021,7:00,40.7242,-73.93765,BROOKLYN,1.0,0.0,0,0,0,0,0,0,4454891,2021-09-08 07:00:00,2021-09-08T07:00,2021,9,22.0,0.0,Clear
10/18/2021,17:00,40.6643433,-73.9315393,BROOKLYN,1.0,0.0,1,0,0,0,0,0,4468491,2021-10-18 17:00:00,2021-10-18T17:00,2021,10,13.0,0.0,Clear
10/30/2021,10:00,40.67649,-73.89508,BROOKLYN,2.0,0.0,1,0,0,0,1,0,4472761,2021-10-30 10:00:00,2021-10-30T10:00,2021,10,17.2,0.1,Drizzle
07/11/2021,22:00,40.649513,-73.93984,BROOKLYN,1.0,0.0,0,0,0,0,0,0,4435865,2021-07-11 22:00:00,2021-07-11T22:00,2021,7,22.2,1.3,Light Rain
10/12/2021,8:00,40.6895615,-73.9671143,BROOKLYN,1.0,0.0,0,0,0,0,1,0,4466822,2021-10-12 08:00:00,2021-10-12T08:00,2021,10,17.3,0.0,Cloudy
10/02/2021,19:00,40.65743,-73.9451,BROOKLYN,1.0,0.0,1,0,0,0,0,0,4464090,2021-10-02 19:00:00,2021-10-02T19:00,2021,10,17.6,0.0,Cloudy
07/06/2021,14:00,40.669636,-73.96195,BROOKLYN,1.0,0.0,0,0,1,0,0,0,4442706,2021-07-06 14:00:00,2021-07-06T14:00,2021,7,31.9,0.0,Cloudy
03/08/2021,14:00,40.599247,-74.00146,BROOKLYN,0.0,0.0,0,0,0,0,0,0,4398279,2021-03-08 14:00:00,2021-03-08T14:00,2021,3,4.7,0.0,Clear
11/05/2021,0:00,40.682037,-73.87788,BROOKLYN,1.0,0.0,1,0,0,0,0,0,4475330,2021-11-05 00:00:00,2021-11-05T00:00,2021,11,4.5,0.0,Clear
08/02/2021,14:00,40.701275,-73.98075,BROOKLYN,1.0,0.0,0,0,0,0,1,0,4443037,2021-08-02 14:00:00,2021-08-02T14:00,2021,8,27.2,0.0,Clear
10/12/2021,17:00,40.6061132,-73.9548711,BROOKLYN,1.0,0.0,0,0,0,0,1,0,4468248,2021-10-12 17:00:00,2021-10-12T17:00,2021,10,18.4,0.0,Clear
11/16/2021,20:00,40.633083,-74.00558,BROOKLYN,0.0,0.0,0,0,0,0,0,0,4478617,2021-11-16 20:00:00,2021-11-16T20:00,2021,11,2.7,0.0,Cloudy
03/18/2021,21:00,40.639774,-73.91942,BROOKLYN,0.0,0.0,0,0,0,0,0,0,4400187,2021-03-18 21:00:00,2021-03-18T21:00,2021,3,6.1,0.6,Drizzle
08/11/2021,20:00,40.59654,-73.93538,BROOKLYN,1.0,0.0,0,0,0,0,1,0,4446166,2021-08-11 20:00:00,2021-08-11T20:00,2021,8,26.5,0.3,Drizzle
09/03/2021,19:00,40.677414,-73.93033,BROOKLYN,1.0,0.0,0,0,0,0,1,0,4454013,2021-09-03 19:00:00,2021-09-03T19:00,2021,9,19.9,0.0,Clear
07/13/2021,20:00,40.583656,-73.98656,BROOKLYN,1.0,0.0,0,0,0,0,1,0,4437021,2021-07-13 20:00:00,2021-07-13T20:00,2021,7,21.6,0.0,Cloudy
09/13/2021,21:00,40.68096,-73.93765,BROOKLYN,1.0,0.0,1,0,0,0,0,0,4458832,2021-09-13 21:00:00,2021-09-13T21:00,2021,9,22.7,0.5,Drizzle
04/05/2021,14:00,40.665962,-73.91811,BROOKLYN,0.0,0.0,0,0,0,0,0,0,4404830,2021-04-05 14:00:00,2021-04-05T14:00,2021,4,18.0,0.0,Clear
05/22/2021,15:00,40.60817,-73.96745,BROOKLYN,1.0,0.0,0,0,0,0,0,0,4419649,2021-05-22 15:00:00,2021-05-22T15:00,2021,5,29.5,0.0,Cloudy
11/19/2021,2:00,40.700554,-73.93422,BROOKLYN,0.0,0.0,0,0,0,0,0,0,4479262,2021-11-19 02:00:00,2021-11-19T02:00,2021,11,8.2,0.0,Cloudy
05/11/2021,15:00,40.605072,-73.92988,BROOKLYN,1.0,0.0,0,0,0,0,1,0,4416047,2021-05-11 15:00:00,2021-05-11T15:00,2021,5,15.8,0.0,Cloudy
09/09/2021,18:00,40.700768,-73.990944,BROOKLYN,1.0,0.0,0,0,0,0,1,0,4455478,2021-09-09 18:00:00,2021-09-09T18:00,2021,9,20.9,0.0,Cloudy
03/22/2021,0:00,40.6277,-73.99974,BROOKLYN,1.0,0.0,0,0,0,0,1,0,4401185,2021-03-22 00:00:00,2021-03-22T00:00,2021,3,3.1,0.0,Clear
05/11/2021,15:00,40.657677,-73.96235,BROOKLYN,0.0,0.0,0,0,0,0,0,0,4417849,2021-05-11 15:00:00,2021-05-11T15:00,2021,5,16.3,0.0,Cloudy
08/11/2021,23:00,40.68978,-73.98139,BROOKLYN,1.0,0.0,0,0,0,0,1,0,4450247,2021-08-11 23:00:00,2021-08-11T23:00,2021,8,24.8,0.0,Cloudy
09/19/2021,16:00,40.655216,-73.96194,BROOKLYN,1.0,0.0,1,0,0,0,0,0,4458886,2021-09-19 16:00:00,2021-09-19T16:00,2021,9,23.5,0.0,Clear
05/19/2021,17:00,40.68039,-73.94956,BROOKLYN,1.0,0.0,0,0,0,0,1,0,4428563,2021-05-19 17:00:00,2021-05-19T17:00,2021,5,28.2,0.0,Clear
10/19/2021,8:00,40.6630685,-73.8692135,BROOKLYN,1.0,0.0,0,0,0,0,0,0,4469243,2021-10-19 08:00:00,2021-10-19T08:00,2021,10,10.8,0.0,Clear
06/09/2021,14:00,40.62547,-74.00383,BROOKLYN,0.0,0.0,0,0,0,0,0,0,4426873,2021-06-09 14:00:00,2021-06-09T14:00,2021,6,28.0,0.0,Cloudy
10/05/2021,8:00,40.637234,-73.94811,BROOKLYN,0.0,0.0,0,0,0,0,0,0,4464323,2021-10-05 08:00:00,2021-10-05T08:00,2021,10,16.1,0.1,Drizzle
12/08/2021,9:00,40.616886,-73.970146,BROOKLYN,1.0,0.0,0,0,0,0,1,0,4484865,2021-12-08 09:00:00,2021-12-08T09:00,2021,12,4.0,0.0,Cloudy
05/17/2021,13:00,40.688614,-73.989174,BROOKLYN,2.0,0.0,0,0,1,0,1,0,4417532,2021-05-17 13:00:00,2021-05-17T13:00,2021,5,22.3,0.0,Clear
03/07/2021,8:00,40.647263,-73.9188,BROOKLYN,0.0,0.0,0,0,0,0,0,0,4398646,2021-03-07 08:00:00,2021-03-07T08:00,2021,3,-1.2,0.0,Clear
03/20/2021,14:00,40.641407,-73.91229,BROOKLYN,1.0,0.0,0,0,0,0,1,0,4400456,2021-03-20 14:00:00,2021-03-20T14:00,2021,3,10.7,0.0,Clear
09/19/2021,0:00,40.63311,-73.97217,BROOKLYN,2.0,0.0,0,0,0,0,2,0,4458858,2021-09-19 00:00:00,2021-09-19T00:00,2021,9,21.8,0.0,Clear
12/02/2021,20:00,40.654316,-73.922165,BROOKLYN,1.0,0.0,0,0,0,0,1,0,4484651,2021-12-02 20:00:00,2021-12-02T20:00,2021,12,12.9,0.0,Clear
02/22/2021,17:00,40.695274,-73.95817,BROOKLYN,0.0,0.0,0,0,0,0,0,0,4394287,2021-02-22 17:00:00,2021-02-22T17:00,2021,2,3.4,0.8,Drizzle
01/18/2021,15:00,40.626545,-74.020905,BROOKLYN,1.0,0.0,0,0,0,0,1,0,4384896,2021-01-18 15:00:00,2021-01-18T15:00,2021,1,6.5,0.0,Clear
05/27/2021,19:00,40.671432,-73.88718,BROOKLYN,1.0,0.0,1,0,0,0,0,0,4422239,2021-05-27 19:00:00,2021-05-27T19:00,2021,5,21.8,0.0,Cloudy
08/09/2021,10:00,40.711693,-73.935814,BROOKLYN,0.0,0.0,0,0,0,0,0,0,4446111,2021-08-09 10:00:00,2021-08-09T10:00,2021,8,24.5,0.1,Drizzle
08/18/2021,12:00,40.710625,-73.96678,BROOKLYN,1.0,0.0,0,0,0,0,1,0,4451537,2021-08-18 12:00:00,2021-08-18T12:00,2021,8,27.0,0.1,Drizzle
10/28/2021,18:00,40.640835,-74.01844,BROOKLYN,1.0,0.0,1,0,0,0,0,0,4472134,2021-10-28 18:00:00,2021-10-28T18:00,2021,10,12.6,0.0,Cloudy
06/29/2021,11:00,40.64882,-74.00288,BROOKLYN,1.0,0.0,1,0,0,0,0,0,4434339,2021-06-29 11:00:00,2021-06-29T11:00,2021,6,32.8,0.0,Clear
10/09/2021,0:00,40.681888,-73.9654882,BROOKLYN,1.0,0.0,0,0,0,0,1,0,4466705,2021-10-09 00:00:00,2021-10-09T00:00,2021,10,17.4,0.0,Cloudy
06/26/2021,7:00,40.68275,-73.922,BROOKLYN,0.0,0.0,0,0,0,0,0,0,4431519,2021-06-26 07:00:00,2021-06-26T07:00,2021,6,22.0,0.2,Drizzle
05/23/2021,23:00,40.690563,-73.94536,BROOKLYN,1.0,0.0,0,0,1,0,0,0,4420570,2021-05-23 23:00:00,2021-05-23T23:00,2021,5,20.0,0.0,Cloudy
02/13/2021,17:00,40.621292,-73.928154,BROOKLYN,1.0,0.0,0,0,0,0,1,0,4391912,2021-02-13 17:00:00,2021-02-13T17:00,2021,2,-3.1,0.3,Heavy Snow
06/21/2021,12:00,40.683582,-73.922844,BROOKLYN,0.0,0.0,0,0,0,0,0,0,4429891,2021-06-21 12:00:00,2021-06-21T12:00,2021,6,26.1,0.0,Cloudy
12/28/2021,12:00,40.668102,-73.980576,BROOKLYN,1.0,0.0,0,0,0,0,1,0,4491425,2021-12-28 12:00:00,2021-12-28T12:00,2021,12,7.1,0.0,Cloudy
03/16/2021,7:00,40.69484,-73.98391,BROOKLYN,1.0,0.0,1,0,0,0,0,0,4399468,2021-03-16 07:00:00,2021-03-16T07:00,2021,3,-2.5,0.0,Cloudy
06/11/2021,13:00,40.703053,-73.942505,BROOKLYN,1.0,0.0,0,0,1,0,0,0,4426417,2021-06-11 13:00:00,2021-06-11T13:00,2021,6,19.9,0.0,Cloudy
02/10/2021,10:00,40.660927,-73.98669,BROOKLYN,1.0,0.0,1,0,0,0,0,0,4391249,2021-02-10 10:00:00,2021-02-10T10:00,2021,2,-3.9,0.0,Cloudy
07/16/2021,13:00,40.699776,-73.98246,BROOKLYN,1.0,0.0,0,0,1,0,0,0,4439676,2021-07-16 13:00:00,2021-07-16T13:00,2021,7,30.5,0.0,Clear
06/16/2021,17:00,40.624798,-73.94265,BROOKLYN,1.0,0.0,0,0,0,0,0,0,4430509,2021-06-16 17:00:00,2021-06-16T17:00,2021,6,23.1,0.0,Clear
10/26/2021,21:00,40.667095,-73.92276,BROOKLYN,1.0,0.0,1,0,0,0,0,0,4472394,2021-10-26 21:00:00,2021-10-26T21:00,2021,10,14.5,6.6,Heavy Rain
06/26/2021,19:00,40.625652,-73.930534,BROOKLYN,1.0,0.0,0,0,0,0,1,0,4431522,2021-06-26 19:00:00,2021-06-26T19:00,2021,6,23.0,0.0,Cloudy
10/18/2021,0:00,40.7070105,-73.9465215,BROOKLYN,1.0,0.0,0,0,0,0,0,0,4468204,2021-10-18 00:00:00,2021-10-18T00:00,2021,10,10.9,0.0,Clear
11/16/2021,13:00,40.63701,-73.91495,BROOKLYN,1.0,0.0,0,0,0,0,1,0,4478421,2021-11-16 13:00:00,2021-11-16T13:00,2021,11,9.3,0.0,Clear
09/22/2021,7:00,40.683304,-73.917274,BROOKLYN,0.0,0.0,0,0,0,0,0,0,4459975,2021-09-22 07:00:00,2021-09-22T07:00,2021,9,22.3,0.2,Drizzle
09/18/2021,14:00,40.666134,-73.99224,BROOKLYN,1.0,0.0,0,0,1,0,0,0,4458517,2021-09-18 14:00:00,2021-09-18T14:00,2021,9,27.3,0.1,Drizzle
05/10/2021,9:00,40.664192,-73.87759,BROOKLYN,1.0,0.0,0,0,0,0,1,0,4415332,2021-05-10 09:00:00,2021-05-10T09:00,2021,5,11.9,0.0,Cloudy
02/20/2021,0:00,40.6711,-73.883575,BROOKLYN,1.0,0.0,0,0,0,0,1,0,4393440,2021-02-20 00:00:00,2021-02-20T00:00,2021,2,-1.1,0.0,Cloudy
07/30/2021,18:00,40.692623,-73.93398,BROOKLYN,1.0,0.0,1,0,0,0,0,0,4442628,2021-07-30 18:00:00,2021-07-30T18:00,2021,7,24.3,0.0,Clear
07/31/2021,20:00,40.654163,-73.91154,BROOKLYN,1.0,0.0,0,0,0,0,1,0,4442219,2021-07-31 20:00:00,2021-07-31T20:00,2021,7,21.0,0.0,Clear
01/28/2021,10:00,40.71893,-73.943436,BROOKLYN,0.0,0.0,0,0,0,0,0,0,4387397,2021-01-28 10:00:00,2021-01-28T10:00,2021,1,-0.9,0.0,Cloudy
08/02/2021,16:00,40.658577,-73.89063,BROOKLYN,0.0,0.0,0,0,0,0,0,0,4443217,2021-08-02 16:00:00,2021-08-02T16:00,2021,8,26.6,0.0,Clear
09/12/2021,11:00,40.65545,-73.863335,BROOKLYN,0.0,0.0,0,0,0,0,0,0,4456301,2021-09-12 11:00:00,2021-09-12T11:00,2021,9,25.4,0.0,Clear
02/18/2021,12:00,40.67135,-73.96134,BROOKLYN,1.0,0.0,0,0,0,0,1,0,4392923,2021-02-18 12:00:00,2021-02-18T12:00,2021,2,-3.2,2.4,Heavy Snow
12/21/2021,14:00,40.600735,-73.98218,BROOKLYN,1.0,0.0,0,0,1,0,0,0,4489589,2021-12-21 14:00:00,2021-12-21T14:00,2021,12,5.4,0.0,Cloudy
07/21/2021,8:00,40.638306,-73.8947,BROOKLYN,2.0,0.0,0,0,0,0,2,0,4439167,2021-07-21 08:00:00,2021-07-21T08:00,2021,7,25.9,0.0,Clear
05/10/2021,14:00,40.697243,-73.967636,BROOKLYN,0.0,0.0,0,0,0,0,0,0,4415217,2021-05-10 14:00:00,2021-05-10T14:00,2021,5,14.9,0.0,Cloudy
02/26/2021,23:00,40.579052,-73.98415,BROOKLYN,0.0,0.0,0,0,0,0,0,0,4395161,2021-02-26 23:00:00,2021-02-26T23:00,2021,2,3.7,0.0,Cloudy
09/20/2021,16:00,40.68984,-73.97863,BROOKLYN,1.0,0.0,0,0,1,0,0,0,4460282,2021-09-20 16:00:00,2021-09-20T16:00,2021,9,21.5,0.0,Clear
07/01/2021,15:00,40.717022,-73.96527,BROOKLYN,0.0,0.0,0,0,0,0,0,0,4435047,2021-07-01 15:00:00,2021-07-01T15:00,2021,7,26.3,0.9,Drizzle
08/11/2021,21:00,40.645042,-73.99965,BROOKLYN,1.0,0.0,1,0,0,0,0,0,4446283,2021-08-11 21:00:00,2021-08-11T21:00,2021,8,25.0,0.1,Drizzle
04/13/2021,16:00,40.63595,-73.944115,BROOKLYN,0.0,0.0,0,0,0,0,0,0,4407023,2021-04-13 16:00:00,2021-04-13T16:00,2021,4,17.5,0.0,Cloudy
12/11/2021,13:00,40.577995,-73.95964,BROOKLYN,1.0,0.0,1,0,0,0,0,0,4485544,2021-12-11 13:00:00,2021-12-11T13:00,2021,12,15.2,0.0,Cloudy
03/03/2021,9:00,40.656273,-73.90731,BROOKLYN,1.0,0.0,1,0,0,0,0,0,4395935,2021-03-03 09:00:00,2021-03-03T09:00,2021,3,3.0,0.0,Clear
12/03/2021,23:00,40.7,-73.94843,BROOKLYN,0.0,0.0,0,0,0,0,0,0,4483926,2021-12-03 23:00:00,2021-12-03T23:00,2021,12,1.9,0.0,Clear
10/23/2021,8:00,40.6728582,-73.871302,BROOKLYN,1.0,0.0,0,0,0,0,0,0,4470465,2021-10-23 08:00:00,2021-10-23T08:00,2021,10,11.1,0.1,Drizzle
05/04/2021,17:00,40.625015,-73.94073,BROOKLYN,1.0,0.0,0,0,1,0,0,0,4414171,2021-05-04 17:00:00,2021-05-04T17:00,2021,5,13.8,0.0,Cloudy
05/03/2021,21:00,40.666134,-73.88492,BROOKLYN,1.0,0.0,0,0,0,0,1,0,4413429,2021-05-03 21:00:00,2021-05-03T21:00,2021,5,12.2,0.3,Drizzle
04/30/2021,6:00,40.61051,-73.923294,BROOKLYN,1.0,0.0,0,0,0,0,1,0,4412465,2021-04-30 06:00:00,2021-04-30T06:00,2021,4,14.4,0.0,Clear
02/19/2021,10:00,40.66822,-73.97383,BROOKLYN,0.0,0.0,0,0,0,0,0,0,4393098,2021-02-19 10:00:00,2021-02-19T10:00,2021,2,-1.6,0.3,Heavy Snow
06/16/2021,21:00,40.60915,-73.96998,BROOKLYN,1.0,0.0,0,0,1,0,0,0,4429266,2021-06-16 21:00:00,2021-06-16T21:00,2021,6,18.7,0.0,Clear
10/02/2021,14:00,40.603058,-73.98261,BROOKLYN,1.0,0.0,0,0,1,0,0,0,4463300,2021-10-02 14:00:00,2021-10-02T14:00,2021,10,23.6,0.0,Cloudy
04/04/2021,18:00,40.716976,-73.98229,MANHATTAN,1.0,0.0,0,0,1,0,0,0,4405660,2021-04-04 18:00:00,2021-04-04T18:00,2021,4,13.0,0.0,Clear
03/11/2021,13:00,40.774338,-73.95338,MANHATTAN,1.0,0.0,0,0,0,0,1,0,4398234,2021-03-11 13:00:00,2021-03-11T13:00,2021,3,17.9,0.0,Clear
03/30/2021,19:00,40.74279,-73.982376,MANHATTAN,1.0,0.0,1,0,0,0,0,0,4403263,2021-03-30 19:00:00,2021-03-30T19:00,2021,3,9.0,0.0,Clear
08/16/2021,0:00,40.839176,-73.94114,MANHATTAN,1.0,0.0,0,0,0,0,1,0,4448596,2021-08-16 00:00:00,2021-08-16T00:00,2021,8,20.1,0.0,Clear
09/28/2021,21:00,40.73722,-73.9814,MANHATTAN,1.0,0.0,0,0,1,0,0,0,4462259,2021-09-28 21:00:00,2021-09-28T21:00,2021,9,17.8,0.0,Cloudy
02/28/2021,15:00,40.75484,-73.98412,MANHATTAN,1.0,0.0,0,0,0,0,1,0,4395540,2021-02-28 15:00:00,2021-02-28T15:00,2021,2,5.4,0.7,Drizzle
02/15/2021,23:00,40.82664,-73.94306,MANHATTAN,1.0,0.0,0,0,0,0,1,0,4392736,2021-02-15 23:00:00,2021-02-15T23:00,2021,2,0.4,0.4,Drizzle
03/12/2021,11:00,40.74763,-73.986664,MANHATTAN,2.0,0.0,0,0,0,0,2,0,4398576,2021-03-12 11:00:00,2021-03-12T11:00,2021,3,16.1,0.0,Cloudy
09/29/2021,14:00,40.7509,-73.98449,MANHATTAN,1.0,0.0,0,0,1,0,0,0,4464098,2021-09-29 14:00:00,2021-09-29T14:00,2021,9,20.1,0.0,Cloudy
04/08/2021,3:00,40.822834,-73.941925,MANHATTAN,1.0,0.0,0,0,1,0,0,0,4405934,2021-04-08 03:00:00,2021-04-08T03:00,2021,4,7.9,0.0,Clear
06/01/2021,17:00,40.840748,-73.93545,MANHATTAN,1.0,0.0,0,0,1,0,0,0,4424219,2021-06-01 17:00:00,2021-06-01T17:00,2021,6,19.8,0.0,Cloudy
12/09/2021,15:00,40.80777,-73.94549,MANHATTAN,2.0,0.0,0,0,2,0,0,0,4486673,2021-12-09 15:00:00,2021-12-09T15:00,2021,12,3.6,0.0,Cloudy
06/04/2021,15:00,40.732845,-73.995926,MANHATTAN,1.0,0.0,0,0,1,0,0,0,4425630,2021-06-04 15:00:00,2021-06-04T15:00,2021,6,25.5,0.1,Drizzle
02/26/2021,19:00,40.762226,-73.96819,MANHATTAN,1.0,0.0,1,0,0,0,0,0,4394867,2021-02-26 19:00:00,2021-02-26T19:00,2021,2,1.7,0.0,Cloudy
11/09/2021,2:00,40.787693,-73.94148,MANHATTAN,1.0,0.0,0,0,1,0,0,0,4475891,2021-11-09 02:00:00,2021-11-09T02:00,2021,11,6.3,0.0,Clear
10/30/2021,0:00,40.752895,-73.98925,MANHATTAN,3.0,0.0,0,0,0,0,3,0,4472585,2021-10-30 00:00:00,2021-10-30T00:00,2021,10,13.7,0.1,Drizzle
11/02/2021,14:00,40.757492,-73.98057,MANHATTAN,1.0,0.0,0,0,0,0,1,0,4473528,2021-11-02 14:00:00,2021-11-02T14:00,2021,11,11.2,0.0,Cloudy
06/04/2021,9:00,40.766624,-73.98179,MANHATTAN,1.0,0.0,0,0,1,0,0,0,4424275,2021-06-04 09:00:00,2021-06-04T09:00,2021,6,22.1,0.1,Drizzle
04/22/2021,18:00,40.747894,-73.989174,MANHATTAN,1.0,0.0,0,0,1,0,0,0,4410046,2021-04-22 18:00:00,2021-04-22T18:00,2021,4,7.5,0.0,Cloudy
08/06/2021,21:00,40.81119,-73.95044,MANHATTAN,1.0,0.0,0,0,0,0,0,0,4446230,2021-08-06 21:00:00,2021-08-06T21:00,2021,8,24.2,0.0,Cloudy
10/27/2021,21:00,40.756763,-73.96716,MANHATTAN,1.0,0.0,0,0,1,0,0,0,4471548,2021-10-27 21:00:00,2021-10-27T21:00,2021,10,12.9,0.0,Clear
01/26/2021,18:00,40.86769,-73.92122,MANHATTAN,1.0,0.0,1,0,0,0,0,0,4387084,2021-01-26 18:00:00,2021-01-26T18:00,2021,1,1.1,0.7,Heavy Snow
09/15/2021,15:00,40.80506,-73.94117,MANHATTAN,1.0,0.0,1,0,0,0,0,0,4458440,2021-09-15 15:00:00,2021-09-15T15:00,2021,9,27.7,0.0,Clear
01/30/2021,19:00,40.790928,-73.96893,MANHATTAN,1.0,0.0,0,0,1,0,0,0,4387935,2021-01-30 19:00:00,2021-01-30T19:00,2021,1,-3.9,0.0,Clear
10/30/2021,4:00,40.755516,-73.994774,MANHATTAN,0.0,0.0,0,0,0,0,0,0,4472392,2021-10-30 04:00:00,2021-10-30T04:00,2021,10,16.0,0.2,Drizzle
09/30/2021,17:00,40.72032,-73.99405,MANHATTAN,1.0,0.0,1,0,0,0,0,0,4463451,2021-09-30 17:00:00,2021-09-30T17:00,2021,9,17.2,0.0,Cloudy
12/11/2021,0:00,40.753624,-73.96944,MANHATTAN,1.0,0.0,0,0,1,0,0,0,4485439,2021-12-11 00:00:00,2021-12-11T00:00,2021,12,5.5,0.0,Cloudy
03/29/2021,20:00,40.817543,-73.95694,MANHATTAN,1.0,0.0,0,0,0,0,1,0,4404232,2021-03-29 20:00:00,2021-03-29T20:00,2021,3,5.8,0.0,Clear
12/08/2021,0:00,40.841152,-73.942696,MANHATTAN,1.0,0.0,1,0,0,0,0,0,4484928,2021-12-08 00:00:00,2021-12-08T00:00,2021,12,0.4,0.0,Cloudy
02/28/2021,15:00,40.769268,-73.96937,MANHATTAN,1.0,0.0,1,0,0,0,0,0,4395269,2021-02-28 15:00:00,2021-02-28T15:00,2021,2,6.3,0.5,Drizzle
02/17/2021,22:00,40.797676,-73.93729,MANHATTAN,2.0,0.0,0,0,0,0,2,0,4392758,2021-02-17 22:00:00,2021-02-17T22:00,2021,2,-4.0,0.0,Cloudy
05/14/2021,15:00,40.74357,-73.976715,MANHATTAN,1.0,0.0,1,0,0,0,0,0,4416470,2021-05-14 15:00:00,2021-05-14T15:00,2021,5,22.1,0.0,Clear
10/23/2021,22:00,40.7180039,-73.986584,MANHATTAN,3.0,0.0,2,0,0,0,1,0,4470365,2021-10-23 22:00:00,2021-10-23T22:00,2021,10,12.3,0.0,Clear
08/11/2021,20:00,40.7537,-73.99309,MANHATTAN,1.0,0.0,0,0,1,0,0,0,4446312,2021-08-11 20:00:00,2021-08-11T20:00,2021,8,25.7,0.8,Drizzle
08/04/2021,14:00,40.86485,-73.9226,MANHATTAN,0.0,0.0,0,0,0,0,0,0,4444370,2021-08-04 14:00:00,2021-08-04T14:00,2021,8,23.3,0.0,Cloudy
06/17/2021,22:00,40.84554,-73.93278,MANHATTAN,0.0,0.0,0,0,0,0,0,0,4428825,2021-06-17 22:00:00,2021-06-17T22:00,2021,6,15.9,0.0,Clear
03/25/2021,9:00,40.77425,-73.945274,MANHATTAN,0.0,0.0,0,0,0,0,0,0,4401853,2021-03-25 09:00:00,2021-03-25T09:00,2021,3,12.9,0.0,Cloudy
06/24/2021,13:00,40.725582,-73.989876,MANHATTAN,1.0,0.0,0,0,0,0,1,0,4433899,2021-06-24 13:00:00,2021-06-24T13:00,2021,6,22.4,0.0,Clear
02/21/2021,16:00,40.78085,-73.96093,MANHATTAN,1.0,0.0,1,0,0,0,0,0,4393615,2021-02-21 16:00:00,2021-02-21T16:00,2021,2,0.2,0.0,Clear
09/15/2021,22:00,40.757828,-73.99308,MANHATTAN,1.0,0.0,0,0,0,0,1,0,4457694,2021-09-15 22:00:00,2021-09-15T22:00,2021,9,23.1,0.0,Cloudy
11/19/2021,0:00,40.745796,-73.982285,MANHATTAN,2.0,0.0,0,0,0,0,2,0,4479444,2021-11-19 00:00:00,2021-11-19T00:00,2021,11,7.8,1.1,Drizzle
09/13/2021,14:00,40.71997,-73.992905,MANHATTAN,2.0,0.0,0,0,0,0,2,0,4458549,2021-09-13 14:00:00,2021-09-13T14:00,2021,9,28.5,0.0,Cloudy
12/31/2021,17:00,40.838207,-73.93723,MANHATTAN,0.0,0.0,0,0,0,0,0,0,4492472,2021-12-31 17:00:00,2021-12-31T17:00,2021,12,9.1,0.0,Cloudy
12/29/2021,0:00,40.765724,-73.959,MANHATTAN,1.0,0.0,1,0,0,0,0,0,4490538,2021-12-29 00:00:00,2021-12-29T00:00,2021,12,4.8,1.4,Light Rain
11/07/2021,0:00,40.775246,-73.94763,MANHATTAN,0.0,0.0,0,0,0,0,0,0,4475449,2021-11-07 00:00:00,2021-11-07T00:00,2021,11,2.5,0.0,Clear
06/15/2021,9:00,40.75991,-73.95882,MANHATTAN,1.0,0.0,0,0,0,0,1,0,4427911,2021-06-15 09:00:00,2021-06-15T09:00,2021,6,22.6,0.0,Clear
07/29/2021,22:00,40.78175,-73.98107,MANHATTAN,3.0,0.0,0,0,0,0,3,0,4442135,2021-07-29 22:00:00,2021-07-29T22:00,2021,7,21.7,0.0,Clear
05/16/2021,23:00,40.76542,-73.98383,MANHATTAN,1.0,0.0,0,0,0,0,1,0,4417698,2021-05-16 23:00:00,2021-05-16T23:00,2021,5,13.8,0.0,Cloudy
03/21/2021,15:00,0.0,0.0,MANHATTAN,2.0,0.0,0,0,0,0,2,0,4400741,2021-03-21 15:00:00,2021-03-21T15:00,2021,3,27.2,0.2,Drizzle
12/17/2021,0:00,40.748512,-73.98872,MANHATTAN,1.0,0.0,0,0,0,0,1,0,4489610,2021-12-17 00:00:00,2021-12-17T00:00,2021,12,13.0,0.0,Cloudy
07/16/2021,16:00,40.826237,-73.94508,MANHATTAN,1.0,0.0,1,0,0,0,0,0,4439107,2021-07-16 16:00:00,2021-07-16T16:00,2021,7,30.2,0.0,Clear
12/23/2021,11:00,40.718544,-74.00072,MANHATTAN,3.0,0.0,0,0,0,0,3,0,4489241,2021-12-23 11:00:00,2021-12-23T11:00,2021,12,1.4,0.0,Cloudy
01/23/2021,16:00,40.84202,-73.940125,MANHATTAN,0.0,0.0,0,0,0,0,0,0,4386356,2021-01-23 16:00:00,2021-01-23T16:00,2021,1,-2.1,0.0,Clear
01/02/2021,15:00,40.785866,-73.950935,MANHATTAN,0.0,0.0,0,0,0,0,0,0,4381986,2021-01-02 15:00:00,2021-01-02T15:00,2021,1,7.6,0.0,Clear
06/16/2021,9:00,40.78031,-73.98569,MANHATTAN,1.0,0.0,0,0,1,0,0,0,4430540,2021-06-16 09:00:00,2021-06-16T09:00,2021,6,21.4,0.0,Clear
11/30/2021,0:00,40.71589,-73.986496,MANHATTAN,1.0,0.0,0,0,0,0,1,0,4482470,2021-11-30 00:00:00,2021-11-30T00:00,2021,11,-1.1,0.0,Clear
05/26/2021,20:00,40.760857,-73.961075,MANHATTAN,1.0,0.0,0,0,1,0,0,0,4420824,2021-05-26 20:00:00,2021-05-26T20:00,2021,5,24.8,0.0,Cloudy
05/08/2021,15:00,40.798622,-73.94163,MANHATTAN,1.0,0.0,1,0,0,0,0,0,4415387,2021-05-08 15:00:00,2021-05-08T15:00,2021,5,11.4,0.0,Cloudy
05/21/2021,22:00,40.76163,-73.959015,MANHATTAN,1.0,0.0,0,0,0,0,1,0,4423945,2021-05-21 22:00:00,2021-05-21T22:00,2021,5,18.4,0.0,Cloudy
07/28/2021,0:00,40.755554,-73.98982,MANHATTAN,1.0,0.0,1,0,0,0,0,0,4441514,2021-07-28 00:00:00,2021-07-28T00:00,2021,7,22.0,0.3,Drizzle
05/18/2021,11:00,40.75906,-73.97262,MANHATTAN,1.0,0.0,0,0,0,0,1,0,4417766,2021-05-18 11:00:00,2021-05-18T11:00,2021,5,24.0,0.0,Cloudy
10/15/2021,16:00,40.7305484,-73.9833786,MANHATTAN,1.0,0.0,0,0,1,0,0,0,4467611,2021-10-15 16:00:00,2021-10-15T16:00,2021,10,22.5,0.0,Clear
10/05/2021,14:00,40.804672,-73.93816,MANHATTAN,0.0,0.0,0,0,0,0,0,0,4465203,2021-10-05 14:00:00,2021-10-05T14:00,2021,10,19.9,0.0,Cloudy
12/14/2021,20:00,40.718536,-73.9844,MANHATTAN,1.0,0.0,1,0,0,0,0,0,4486760,2021-12-14 20:00:00,2021-12-14T20:00,2021,12,4.6,0.0,Cloudy
07/02/2021,0:00,40.81261,-73.95683,MANHATTAN,1.0,0.0,0,0,1,0,0,0,4435027,2021-07-02 00:00:00,2021-07-02T00:00,2021,7,22.6,1.2,Drizzle
12/07/2021,20:00,40.72495,-73.99492,MANHATTAN,0.0,0.0,0,0,0,0,0,0,4484826,2021-12-07 20:00:00,2021-12-07T20:00,2021,12,2.6,0.0,Cloudy
05/24/2021,8:00,40.82394,-73.94856,MANHATTAN,0.0,0.0,0,0,0,0,0,0,4426986,2021-05-24 08:00:00,2021-05-24T08:00,2021,5,16.8,0.0,Cloudy
12/14/2021,18:00,40.746536,-73.985954,MANHATTAN,1.0,0.0,0,0,1,0,0,0,4486901,2021-12-14 18:00:00,2021-12-14T18:00,2021,12,5.0,0.0,Clear
07/09/2021,15:00,40.77981,-73.95035,MANHATTAN,0.0,0.0,0,0,0,0,0,0,4436355,2021-07-09 15:00:00,2021-07-09T15:00,2021,7,29.5,0.0,Clear
05/15/2021,16:00,40.72797,-73.98437,MANHATTAN,1.0,0.0,0,0,1,0,0,0,4416881,2021-05-15 16:00:00,2021-05-15T16:00,2021,5,21.8,0.0,Clear
01/29/2021,10:00,40.838894,-73.93831,MANHATTAN,0.0,0.0,0,0,0,0,0,0,4388180,2021-01-29 10:00:00,2021-01-29T10:00,2021,1,-8.1,0.0,Clear
03/09/2021,12:00,40.815502,-73.93562,MANHATTAN,0.0,0.0,0,0,0,0,0,0,4398964,2021-03-09 12:00:00,2021-03-09T12:00,2021,3,15.4,0.0,Clear
08/20/2021,17:00,40.773872,-73.98223,MANHATTAN,1.0,0.0,1,0,0,0,0,0,4449381,2021-08-20 17:00:00,2021-08-20T17:00,2021,8,25.6,0.1,Drizzle
07/09/2021,19:00,40.71162,-74.007225,MANHATTAN,0.0,0.0,0,0,0,0,0,0,4435477,2021-07-09 19:00:00,2021-07-09T19:00,2021,7,25.8,0.7,Drizzle
07/07/2021,15:00,40.763115,-73.99966,MANHATTAN,0.0,0.0,0,0,0,0,0,0,4435401,2021-07-07 15:00:00,2021-07-07T15:00,2021,7,29.4,0.0,Clear
02/24/2021,22:00,40.865364,-73.92439,MANHATTAN,1.0,0.0,1,0,0,0,0,0,4405184,2021-02-24 22:00:00,2021-02-24T22:00,2021,2,6.1,0.0,Cloudy
04/24/2021,3:00,40.821815,-73.94266,MANHATTAN,1.0,0.0,1,0,0,0,0,0,4410697,2021-04-24 03:00:00,2021-04-24T03:00,2021,4,7.0,0.0,Clear
05/05/2021,22:00,40.72508,-73.997086,MANHATTAN,1.0,0.0,1,0,0,0,0,0,4414188,2021-05-05 22:00:00,2021-05-05T22:00,2021,5,12.3,0.0,Clear
08/03/2021,14:00,40.753475,-73.99254,MANHATTAN,1.0,0.0,0,0,0,0,1,0,4443610,2021-08-03 14:00:00,2021-08-03T14:00,2021,8,24.0,0.0,Cloudy
10/07/2021,0:00,40.75898,-73.96244,MANHATTAN,1.0,0.0,0,0,0,0,0,0,4464837,2021-10-07 00:00:00,2021-10-07T00:00,2021,10,16.6,0.0,Cloudy
08/31/2021,0:00,40.70684,-74.017586,MANHATTAN,1.0,0.0,1,0,0,0,0,0,4453067,2021-08-31 00:00:00,2021-08-31T00:00,2021,8,23.2,0.0,Cloudy
03/22/2021,12:00,40.722683,-73.98601,MANHATTAN,1.0,0.0,0,0,1,0,0,0,4401340,2021-03-22 12:00:00,2021-03-22T12:00,2021,3,13.3,0.0,Clear
10/10/2021,15:00,40.7215899,-74.0031956,MANHATTAN,4.0,0.0,0,0,0,0,4,0,4466379,2021-10-10 15:00:00,2021-10-10T15:00,2021,10,18.6,0.5,Drizzle
09/11/2021,21:00,40.751442,-73.97606,MANHATTAN,1.0,0.0,0,0,0,0,1,0,4456058,2021-09-11 21:00:00,2021-09-11T21:00,2021,9,19.0,0.0,Clear
07/01/2021,16:00,40.742275,-73.989235,MANHATTAN,1.0,0.0,0,0,0,0,1,0,4433651,2021-07-01 16:00:00,2021-07-01T16:00,2021,7,25.0,1.5,Light Rain
07/01/2021,12:00,40.806652,-73.939995,MANHATTAN,0.0,0.0,0,0,0,0,0,0,4433006,2021-07-01 12:00:00,2021-07-01T12:00,2021,7,28.0,0.1,Drizzle
05/21/2021,10:00,40.732605,-74.00883,MANHATTAN,0.0,0.0,0,0,0,0,0,0,4421634,2021-05-21 10:00:00,2021-05-21T10:00,2021,5,21.5,0.0,Clear
12/29/2021,4:00,40.76428,-73.9921,MANHATTAN,0.0,0.0,0,0,0,0,0,0,4491825,2021-12-29 04:00:00,2021-12-29T04:00,2021,12,5.4,0.0,Cloudy
07/08/2021,0:00,40.820095,-73.955086,MANHATTAN,0.0,0.0,0,0,0,0,0,0,4443958,2021-07-08 00:00:00,2021-07-08T00:00,2021,7,21.9,3.8,Heavy Rain
12/03/2021,18:00,40.80117,-73.961464,MANHATTAN,1.0,0.0,0,0,1,0,0,0,4483345,2021-12-03 18:00:00,2021-12-03T18:00,2021,12,2.9,0.0,Clear
12/08/2021,21:00,40.74959,-74.00279,MANHATTAN,1.0,0.0,0,0,1,0,0,0,4487551,2021-12-08 21:00:00,2021-12-08T21:00,2021,12,2.3,0.2,Drizzle
05/10/2021,18:00,40.767918,-73.985725,MANHATTAN,0.0,0.0,0,0,0,0,0,0,4415255,2021-05-10 18:00:00,2021-05-10T18:00,2021,5,13.8,0.0,Cloudy
10/21/2021,18:00,40.7216783,-73.9806054,MANHATTAN,1.0,0.0,0,0,0,0,1,0,4470203,2021-10-21 18:00:00,2021-10-21T18:00,2021,10,18.1,0.0,Clear
09/13/2021,8:00,40.77161,-73.99046,MANHATTAN,0.0,0.0,0,0,0,0,0,0,4456763,2021-09-13 08:00:00,2021-09-13T08:00,2021,9,25.1,0.0,Clear
03/07/2021,15:00,40.790363,-73.965645,MANHATTAN,1.0,0.0,1,0,0,0,0,0,4399868,2021-03-07 15:00:00,2021-03-07T15:00,2021,3,4.3,0.0,Clear
05/13/2021,14:00,40.727867,-73.99315,MANHATTAN,1.0,0.0,0,0,1,0,0,0,4416875,2021-05-13 14:00:00,2021-05-13T14:00,2021,5,19.3,0.0,Clear
10/11/2021,16:00,40.7344895,-73.9907722,MANHATTAN,2.0,0.0,0,0,0,0,2,0,4466837,2021-10-11 16:00:00,2021-10-11T16:00,2021,10,21.3,0.0,Clear
02/17/2021,12:00,40.808113,-73.94633,MANHATTAN,1.0,0.0,0,0,0,0,1,0,4394514,2021-02-17 12:00:00,2021-02-17T12:00,2021,2,-2.2,0.0,Cloudy
08/29/2021,0:00,40.8116,-73.9349,MANHATTAN,0.0,0.0,0,0,0,0,0,0,4451873,2021-08-29 00:00:00,2021-08-29T00:00,2021,8,20.2,0.0,Cloudy
12/15/2021,12:00,40.704937,-74.00707,MANHATTAN,0.0,0.0,0,0,0,0,0,0,4486733,2021-12-15 12:00:00,2021-12-15T12:00,2021,12,10.0,0.0,Cloudy
09/13/2021,16:00,40.72369,-73.97604,MANHATTAN,1.0,0.0,0,0,1,0,0,0,4458868,2021-09-13 16:00:00,2021-09-13T16:00,2021,9,29.2,0.0,Cloudy
02/19/2021,19:00,40.758392,-73.981544,MANHATTAN,0.0,0.0,0,0,0,0,0,0,4393106,2021-02-19 19:00:00,2021-02-19T19:00,2021,2,-1.1,0.3,Heavy Snow
01/06/2021,7:00,40.776016,-73.98724,MANHATTAN,1.0,0.0,1,0,0,0,0,0,4382106,2021-01-06 07:00:00,2021-01-06T07:00,2021,1,0.8,0.0,Cloudy
02/05/2021,10:00,40.747856,-73.98718,MANHATTAN,1.0,0.0,0,0,0,0,1,0,4389770,2021-02-05 10:00:00,2021-02-05T10:00,2021,2,2.1,0.4,Drizzle
08/24/2021,9:00,40.718792,-73.98902,MANHATTAN,1.0,0.0,0,0,1,0,0,0,4449995,2021-08-24 09:00:00,2021-08-24T09:00,2021,8,27.5,0.0,Clear
11/18/2021,10:00,40.762917,-73.98566,MANHATTAN,1.0,0.0,0,0,1,0,0,0,4481054,2021-11-18 10:00:00,2021-11-18T10:00,2021,11,13.4,0.0,Clear
04/13/2021,5:00,40.74788,-73.97543,MANHATTAN,1.0,0.0,0,0,0,0,1,0,4406786,2021-04-13 05:00:00,2021-04-13T05:00,2021,4,5.8,0.0,Clear
07/14/2021,13:00,40.789623,-73.94007,MANHATTAN,1.0,0.0,0,0,0,0,1,0,4436859,2021-07-14 13:00:00,2021-07-14T13:00,2021,7,29.1,0.0,Clear
09/16/2021,8:00,40.714745,-73.98261,MANHATTAN,1.0,0.0,0,0,0,0,0,0,4457939,2021-09-16 08:00:00,2021-09-16T08:00,2021,9,20.9,0.1,Drizzle
06/17/2021,17:00,40.775246,-73.94763,MANHATTAN,1.0,0.0,1,0,0,0,0,0,4429233,2021-06-17 17:00:00,2021-06-17T17:00,2021,6,23.5,0.0,Clear
12/25/2021,21:00,40.80882,-73.948,MANHATTAN,0.0,0.0,0,0,0,0,0,0,4491445,2021-12-25 21:00:00,2021-12-25T21:00,2021,12,8.6,0.0,Cloudy
04/10/2021,21:00,40.86446,-73.91895,MANHATTAN,1.0,0.0,0,0,0,0,1,0,4406231,2021-04-10 21:00:00,2021-04-10T21:00,2021,4,11.7,0.0,Cloudy
08/19/2021,9:00,40.801235,-73.941826,MANHATTAN,1.0,0.0,0,0,0,0,1,0,4448563,2021-08-19 09:00:00,2021-08-19T09:00,2021,8,26.3,0.4,Drizzle
09/09/2021,1:00,40.852726,-73.93443,MANHATTAN,1.0,0.0,0,0,0,0,0,0,4456165,2021-09-09 01:00:00,2021-09-09T01:00,2021,9,21.3,0.5,Drizzle
10/29/2021,16:00,40.821636,-73.93909,MANHATTAN,1.0,0.0,0,0,1,0,0,0,4472273,2021-10-29 16:00:00,2021-10-29T16:00,2021,10,13.2,0.0,Cloudy
01/15/2021,6:00,40.745426,-74.00825,MANHATTAN,0.0,0.0,0,0,0,0,0,0,4384058,2021-01-15 06:00:00,2021-01-15T06:00,2021,1,-0.7,0.0,Cloudy
08/03/2021,19:00,40.766712,-73.98289,MANHATTAN,1.0,0.0,0,0,0,0,0,0,4443596,2021-08-03 19:00:00,2021-08-03T19:00,2021,8,22.3,0.0,Cloudy
07/12/2021,2:00,40.753242,-73.96662,MANHATTAN,0.0,0.0,0,0,0,0,0,0,4435882,2021-07-12 02:00:00,2021-07-12T02:00,2021,7,23.1,0.0,Cloudy
09/03/2021,11:00,40.706673,-74.01591,MANHATTAN,1.0,0.0,0,0,0,0,1,0,4453539,2021-09-03 11:00:00,2021-09-03T11:00,2021,9,21.6,0.0,Cloudy
01/02/2021,16:00,40.726257,-73.983406,MANHATTAN,1.0,0.0,0,0,1,0,0,0,4382683,2021-01-02 16:00:00,2021-01-02T16:00,2021,1,6.2,0.0,Cloudy
04/06/2021,13:00,40.82403,-73.94476,MANHATTAN,1.0,0.0,0,0,1,0,0,0,4405103,2021-04-06 13:00:00,2021-04-06T13:00,2021,4,17.0,0.0,Clear
07/01/2021,0:00,40.77088,-73.99286,MANHATTAN,1.0,0.0,0,0,0,0,1,0,4434108,2021-07-01 00:00:00,2021-07-01T00:00,2021,7,25.4,0.3,Drizzle
02/08/2021,15:00,40.764626,-73.99555,MANHATTAN,1.0,0.0,0,0,0,0,1,0,4390458,2021-02-08 15:00:00,2021-02-08T15:00,2021,2,-3.3,0.0,Clear
08/15/2021,19:00,40.761234,-73.96389,MANHATTAN,1.0,0.0,0,0,0,0,1,0,4447708,2021-08-15 19:00:00,2021-08-15T19:00,2021,8,25.5,0.0,Clear
08/02/2021,15:00,40.710697,-73.984634,MANHATTAN,1.0,0.0,0,0,1,0,0,0,4443056,2021-08-02 15:00:00,2021-08-02T15:00,2021,8,26.8,0.0,Cloudy
06/03/2021,17:00,40.805553,-73.93811,MANHATTAN,1.0,0.0,0,0,0,0,1,0,4424331,2021-06-03 17:00:00,2021-06-03T17:00,2021,6,20.7,1.0,Drizzle
01/06/2021,6:00,40.760387,-73.98933,MANHATTAN,1.0,0.0,0,0,0,0,1,0,4381841,2021-01-06 06:00:00,2021-01-06T06:00,2021,1,-1.0,0.0,Cloudy
11/18/2021,17:00,40.757065,-74.00106,MANHATTAN,1.0,0.0,1,0,0,0,0,0,4479459,2021-11-18 17:00:00,2021-11-18T17:00,2021,11,16.1,0.0,Cloudy
04/25/2021,0:00,40.73132,-73.98862,MANHATTAN,1.0,0.0,1,0,0,0,0,0,4412213,2021-04-25 00:00:00,2021-04-25T00:00,2021,4,11.1,0.0,Cloudy
10/04/2021,19:00,40.746536,-73.985954,MANHATTAN,2.0,0.0,2,0,0,0,0,0,4464249,2021-10-04 19:00:00,2021-10-04T19:00,2021,10,17.9,0.1,Drizzle
11/27/2021,21:00,40.839294,-73.93925,MANHATTAN,1.0,0.0,1,0,0,0,0,0,4481996,2021-11-27 21:00:00,2021-11-27T21:00,2021,11,-0.2,0.0,Cloudy
06/16/2021,11:00,40.745243,-73.9848,MANHATTAN,1.0,0.0,1,0,0,0,0,0,4429142,2021-06-16 11:00:00,2021-06-16T11:00,2021,6,22.2,0.0,Clear
07/05/2021,5:00,40.848118,-73.93089,MANHATTAN,1.0,0.0,0,0,0,0,1,0,4434613,2021-07-05 05:00:00,2021-07-05T05:00,2021,7,18.0,0.0,Cloudy
05/19/2021,12:00,40.71997,-73.992905,MANHATTAN,2.0,0.0,1,0,1,0,0,0,4419192,2021-05-19 12:00:00,2021-05-19T12:00,2021,5,27.5,0.0,Clear
07/17/2021,19:00,40.827103,-73.94996,MANHATTAN,0.0,0.0,0,0,0,0,0,0,4439103,2021-07-17 19:00:00,2021-07-17T19:00,2021,7,26.0,0.0,Cloudy
11/25/2021,15:00,40.865536,-73.92728,MANHATTAN,1.0,0.0,0,0,0,0,1,0,4483056,2021-11-25 15:00:00,2021-11-25T15:00,2021,11,11.1,0.0,Clear
06/01/2021,17:00,40.802753,-73.93358,MANHATTAN,2.0,0.0,0,0,0,0,2,0,4424323,2021-06-01 17:00:00,2021-06-01T17:00,2021,6,20.1,0.0,Cloudy
11/10/2021,16:00,40.79811,-73.95032,MANHATTAN,0.0,0.0,0,0,0,0,0,0,4477557,2021-11-10 16:00:00,2021-11-10T16:00,2021,11,15.1,0.0,Clear
07/30/2021,22:00,40.704548,-74.0143,MANHATTAN,1.0,0.0,1,0,0,0,0,0,4443705,2021-07-30 22:00:00,2021-07-30T22:00,2021,7,19.5,0.0,Clear
04/10/2021,19:00,40.848682,-73.939224,MANHATTAN,1.0,0.0,1,0,0,0,0,0,4406337,2021-04-10 19:00:00,2021-04-10T19:00,2021,4,12.4,0.0,Cloudy
10/31/2021,15:00,40.75524,-73.98102,MANHATTAN,1.0,0.0,1,0,0,0,0,0,4472605,2021-10-31 15:00:00,2021-10-31T15:00,2021,10,17.5,0.1,Drizzle
02/26/2021,13:00,40.783245,-73.94473,MANHATTAN,0.0,0.0,0,0,0,0,0,0,4394738,2021-02-26 13:00:00,2021-02-26T13:00,2021,2,6.7,0.0,Cloudy
08/01/2021,0:00,40.775146,-73.98047,MANHATTAN,0.0,0.0,0,0,0,0,0,0,4444570,2021-08-01 00:00:00,2021-08-01T00:00,2021,8,20.0,0.0,Clear
09/28/2021,17:00,40.80918,-73.93605,MANHATTAN,0.0,0.0,0,0,0,0,0,0,4462885,2021-09-28 17:00:00,2021-09-28T17:00,2021,9,19.8,1.2,Drizzle
07/11/2021,17:00,40.750603,-73.974045,MANHATTAN,3.0,0.0,0,0,0,0,3,0,4437174,2021-07-11 17:00:00,2021-07-11T17:00,2021,7,23.8,0.0,Cloudy
05/21/2021,6:00,40.758476,-73.98287,MANHATTAN,0.0,0.0,0,0,0,0,0,0,4420104,2021-05-21 06:00:00,2021-05-21T06:00,2021,5,13.9,0.0,Clear
11/30/2021,1:00,40.762287,-73.97027,MANHATTAN,1.0,0.0,0,0,0,0,1,0,4482173,2021-11-30 01:00:00,2021-11-30T01:00,2021,11,-1.6,0.0,Clear
11/08/2021,22:00,40.737915,-73.99223,MANHATTAN,1.0,0.0,0,0,0,0,1,0,4475904,2021-11-08 22:00:00,2021-11-08T22:00,2021,11,7.6,0.0,Clear
10/11/2021,20:00,40.78893,-73.9454215,MANHATTAN,0.0,0.0,0,0,0,0,0,0,4466632,2021-10-11 20:00:00,2021-10-11T20:00,2021,10,17.0,0.0,Cloudy
04/10/2021,19:00,40.761856,-73.96343,MANHATTAN,1.0,0.0,1,0,0,0,0,0,4406789,2021-04-10 19:00:00,2021-04-10T19:00,2021,4,11.9,0.0,Cloudy
04/19/2021,0:00,40.712063,-74.01016,MANHATTAN,1.0,0.0,0,0,1,0,0,0,4408733,2021-04-19 00:00:00,2021-04-19T00:00,2021,4,6.2,0.0,Clear
09/05/2021,4:00,40.759933,-73.991554,MANHATTAN,1.0,0.0,1,0,0,0,0,0,4454548,2021-09-05 04:00:00,2021-09-05T04:00,2021,9,17.1,0.0,Clear
09/26/2021,11:00,40.72293,-73.98865,MANHATTAN,1.0,0.0,0,0,1,0,0,0,4461302,2021-09-26 11:00:00,2021-09-26T11:00,2021,9,20.3,0.0,Clear
05/10/2021,5:00,0.0,0.0,MANHATTAN,0.0,0.0,0,0,0,0,0,0,4415467,2021-05-10 05:00:00,2021-05-10T05:00,2021,5,27.1,0.0,Clear
08/03/2021,0:00,40.821262,-73.94608,MANHATTAN,1.0,0.0,0,0,1,0,0,0,4443776,2021-08-03 00:00:00,2021-08-03T00:00,2021,8,17.4,0.0,Clear
06/07/2021,13:00,40.717342,-73.99118,MANHATTAN,1.0,0.0,0,0,1,0,0,0,4424572,2021-06-07 13:00:00,2021-06-07T13:00,2021,6,28.3,0.0,Cloudy
09/15/2021,9:00,40.76932,-73.98908,MANHATTAN,0.0,0.0,0,0,0,0,0,0,4457774,2021-09-15 09:00:00,2021-09-15T09:00,2021,9,25.8,0.0,Cloudy
02/12/2021,14:00,40.709152,-74.01055,MANHATTAN,1.0,0.0,1,0,0,0,0,0,4391417,2021-02-12 14:00:00,2021-02-12T14:00,2021,2,-3.6,0.0,Cloudy
08/06/2021,19:00,40.837513,-73.93865,MANHATTAN,1.0,0.0,0,0,1,0,0,0,4444985,2021-08-06 19:00:00,2021-08-06T19:00,2021,8,24.9,0.0,Clear
10/27/2021,0:00,40.719055,-74.01245,MANHATTAN,1.0,0.0,0,0,0,0,0,0,4471638,2021-10-27 00:00:00,2021-10-27T00:00,2021,10,12.8,0.9,Drizzle
06/28/2021,9:00,40.78389,-73.950294,MANHATTAN,1.0,0.0,1,0,0,0,0,0,4431840,2021-06-28 09:00:00,2021-06-28T09:00,2021,6,28.2,0.0,Clear
02/10/2021,19:00,40.72084,-74.00066,MANHATTAN,1.0,0.0,1,0,0,0,0,0,4391014,2021-02-10 19:00:00,2021-02-10T19:00,2021,2,-1.7,0.0,Cloudy
08/28/2021,10:00,40.761448,-73.98803,MANHATTAN,1.0,0.0,1,0,0,0,0,0,4452046,2021-08-28 10:00:00,2021-08-28T10:00,2021,8,23.6,0.0,Cloudy
01/22/2021,14:00,40.75031,-73.989044,MANHATTAN,1.0,0.0,0,0,1,0,0,0,4386341,2021-01-22 14:00:00,2021-01-22T14:00,2021,1,6.6,0.0,Clear
08/27/2021,17:00,40.747894,-73.989174,MANHATTAN,1.0,0.0,1,0,0,0,0,0,4454266,2021-08-27 17:00:00,2021-08-27T17:00,2021,8,29.0,0.0,Cloudy
11/18/2021,23:00,40.72255,-74.00631,MANHATTAN,2.0,0.0,0,0,0,0,2,0,4479226,2021-11-18 23:00:00,2021-11-18T23:00,2021,11,10.0,1.1,Drizzle
06/10/2021,18:00,40.801205,-73.95256,MANHATTAN,0.0,0.0,0,0,0,0,0,0,4430441,2021-06-10 18:00:00,2021-06-10T18:00,2021,6,20.6,0.0,Clear
11/19/2021,8:00,40.781025,-73.981316,MANHATTAN,1.0,0.0,0,0,0,0,1,0,4479624,2021-11-19 08:00:00,2021-11-19T08:00,2021,11,4.9,0.0,Clear
04/16/2021,10:00,40.800507,-73.938156,MANHATTAN,0.0,0.0,0,0,0,0,0,0,4408502,2021-04-16 10:00:00,2021-04-16T10:00,2021,4,9.7,0.0,Clear
12/09/2021,13:00,40.849308,-73.93192,MANHATTAN,1.0,0.0,0,0,0,0,1,0,4485747,2021-12-09 13:00:00,2021-12-09T13:00,2021,12,3.3,0.0,Cloudy
11/15/2021,15:00,40.759727,-73.99169,MANHATTAN,1.0,0.0,1,0,0,0,0,0,4477836,2021-11-15 15:00:00,2021-11-15T15:00,2021,11,8.8,0.0,Cloudy
04/16/2021,10:00,40.764626,-73.99555,MANHATTAN,1.0,0.0,0,0,1,0,0,0,4408438,2021-04-16 10:00:00,2021-04-16T10:00,2021,4,9.9,0.1,Drizzle
11/12/2021,20:00,40.748985,-73.979965,MANHATTAN,1.0,0.0,0,0,1,0,0,0,4477184,2021-11-12 20:00:00,2021-11-12T20:00,2021,11,10.8,0.0,Clear
12/17/2021,0:00,40.759983,-73.964806,MANHATTAN,1.0,0.0,0,0,1,0,0,0,4489208,2021-12-17 00:00:00,2021-12-17T00:00,2021,12,12.9,0.0,Cloudy
09/29/2021,0:00,40.719025,-73.98978,MANHATTAN,1.0,0.0,0,0,0,0,0,0,4462797,2021-09-29 00:00:00,2021-09-29T00:00,2021,9,14.3,0.0,Cloudy
04/13/2021,11:00,40.750988,-73.99063,MANHATTAN,1.0,0.0,1,0,0,0,0,0,4407047,2021-04-13 11:00:00,2021-04-13T11:00,2021,4,12.4,0.0,Cloudy
02/17/2021,19:00,40.72098,-73.98696,MANHATTAN,1.0,0.0,0,0,1,0,0,0,4392694,2021-02-17 19:00:00,2021-02-17T19:00,2021,2,-4.1,0.0,Cloudy
09/07/2021,20:00,40.763657,-73.97347,MANHATTAN,1.0,0.0,0,0,0,0,1,0,4454873,2021-09-07 20:00:00,2021-09-07T20:00,2021,9,20.8,0.0,Clear
05/07/2021,11:00,40.782833,-73.95948,MANHATTAN,1.0,0.0,1,0,0,0,0,0,4414198,2021-05-07 11:00:00,2021-05-07T11:00,2021,5,15.9,0.0,Cloudy
02/21/2021,0:00,40.720535,-73.994675,MANHATTAN,1.0,0.0,0,0,1,0,0,0,4393252,2021-02-21 00:00:00,2021-02-21T00:00,2021,2,-6.9,0.0,Clear
03/31/2021,17:00,40.724495,-73.98164,MANHATTAN,1.0,0.0,0,0,0,0,1,0,4403551,2021-03-31 17:00:00,2021-03-31T17:00,2021,3,12.7,1.4,Light Rain
02/05/2021,9:00,40.75398,-73.99373,MANHATTAN,0.0,0.0,0,0,0,0,0,0,4389768,2021-02-05 09:00:00,2021-02-05T09:00,2021,2,1.6,0.9,Heavy Snow
02/16/2021,0:00,40.84488,-73.93697,MANHATTAN,1.0,0.0,0,0,0,0,1,0,4392680,2021-02-16 00:00:00,2021-02-16T00:00,2021,2,0.3,0.4,Drizzle
05/17/2021,8:00,40.74044,-74.00203,MANHATTAN,1.0,0.0,0,0,0,0,1,0,4419344,2021-05-17 08:00:00,2021-05-17T08:00,2021,5,17.5,0.0,Clear
01/15/2021,16:00,40.717278,-73.99544,MANHATTAN,1.0,0.0,0,0,0,0,1,0,4385257,2021-01-15 16:00:00,2021-01-15T16:00,2021,1,7.2,0.0,Cloudy
10/24/2021,0:00,40.7974839,-73.9487856,MANHATTAN,1.0,0.0,0,0,0,0,1,0,4470702,2021-10-24 00:00:00,2021-10-24T00:00,2021,10,10.0,0.0,Clear
03/19/2021,0:00,40.8018,-73.96108,MANHATTAN,1.0,0.0,0,0,0,0,1,0,4401238,2021-03-19 00:00:00,2021-03-19T00:00,2021,3,3.4,0.9,Drizzle
05/03/2021,9:00,40.743782,-73.97352,MANHATTAN,1.0,0.0,0,0,1,0,0,0,4412984,2021-05-03 09:00:00,2021-05-03T09:00,2021,5,16.6,0.0,Cloudy
07/28/2021,0:00,40.820534,-73.94054,MANHATTAN,1.0,0.0,0,0,0,0,1,0,4442011,2021-07-28 00:00:00,2021-07-28T00:00,2021,7,22.3,0.2,Drizzle
11/23/2021,21:00,40.751892,-73.9676,MANHATTAN,1.0,0.0,0,0,0,0,1,0,4480845,2021-11-23 21:00:00,2021-11-23T21:00,2021,11,0.7,0.0,Clear
04/13/2021,8:00,40.812557,-73.935715,MANHATTAN,1.0,0.0,0,0,0,0,1,0,4406936,2021-04-13 08:00:00,2021-04-13T08:00,2021,4,8.9,0.0,Cloudy
12/12/2021,5:00,40.71997,-73.992905,MANHATTAN,1.0,0.0,0,0,0,0,1,0,4490587,2021-12-12 05:00:00,2021-12-12T05:00,2021,12,5.6,0.0,Cloudy
05/05/2021,18:00,40.744644,-73.988846,MANHATTAN,1.0,0.0,0,0,1,0,0,0,4414033,2021-05-05 18:00:00,2021-05-05T18:00,2021,5,15.4,0.0,Cloudy
07/05/2021,6:00,40.740395,-73.97909,MANHATTAN,0.0,0.0,0,0,0,0,0,0,4434354,2021-07-05 06:00:00,2021-07-05T06:00,2021,7,20.0,0.0,Clear
01/15/2021,13:00,40.797802,-73.94015,MANHATTAN,2.0,0.0,0,0,0,0,2,0,4384747,2021-01-15 13:00:00,2021-01-15T13:00,2021,1,6.3,0.0,Cloudy
07/05/2021,20:00,40.7083,-74.01125,MANHATTAN,1.0,0.0,0,0,0,0,0,0,4438806,2021-07-05 20:00:00,2021-07-05T20:00,2021,7,23.6,0.0,Clear
03/09/2021,16:00,40.72168,-73.98263,MANHATTAN,0.0,0.0,0,0,0,0,0,0,4397840,2021-03-09 16:00:00,2021-03-09T16:00,2021,3,15.4,0.0,Clear
11/05/2021,15:00,40.819206,-73.947044,MANHATTAN,1.0,0.0,0,0,0,0,1,0,4475082,2021-11-05 15:00:00,2021-11-05T15:00,2021,11,10.3,0.0,Clear
01/28/2021,8:00,40.769615,-73.98978,MANHATTAN,0.0,0.0,0,0,0,0,0,0,4387530,2021-01-28 08:00:00,2021-01-28T08:00,2021,1,-2.1,0.0,Cloudy
09/25/2021,21:00,40.73864,-73.98752,MANHATTAN,1.0,0.0,0,0,0,0,1,0,4460902,2021-09-25 21:00:00,2021-09-25T21:00,2021,9,18.8,0.0,Cloudy
06/19/2021,17:00,40.87225,-73.919464,MANHATTAN,0.0,0.0,0,0,0,0,0,0,4428937,2021-06-19 17:00:00,2021-06-19T17:00,2021,6,26.3,0.1,Drizzle
02/13/2021,16:00,40.71747,-73.978264,MANHATTAN,0.0,0.0,0,0,0,0,0,0,4391809,2021-02-13 16:00:00,2021-02-13T16:00,2021,2,-2.7,0.1,Light Snow
10/20/2021,12:00,40.7558074,-73.9864031,MANHATTAN,1.0,0.0,1,0,0,0,0,0,4469192,2021-10-20 12:00:00,2021-10-20T12:00,2021,10,23.1,0.0,Clear
04/13/2021,21:00,40.7591,-73.99215,MANHATTAN,1.0,0.0,0,0,1,0,0,0,4411563,2021-04-13 21:00:00,2021-04-13T21:00,2021,4,10.4,0.0,Cloudy
08/12/2021,19:00,40.813446,-73.93503,MANHATTAN,1.0,0.0,0,0,0,0,1,0,4447433,2021-08-12 19:00:00,2021-08-12T19:00,2021,8,27.6,0.0,Clear
10/04/2021,12:00,40.8221958,-73.9447134,MANHATTAN,0.0,0.0,0,0,0,0,0,0,4466894,2021-10-04 12:00:00,2021-10-04T12:00,2021,10,20.9,0.1,Drizzle
10/12/2021,15:00,40.7211721,-73.9965764,MANHATTAN,1.0,0.0,0,0,0,0,1,0,4466914,2021-10-12 15:00:00,2021-10-12T15:00,2021,10,20.6,0.0,Clear
10/07/2021,14:00,40.7592705,-73.9808868,MANHATTAN,1.0,0.0,0,0,1,0,0,0,4466466,2021-10-07 14:00:00,2021-10-07T14:00,2021,10,22.1,0.1,Drizzle
06/30/2021,21:00,40.780125,-73.95304,MANHATTAN,1.0,0.0,1,0,0,0,0,0,4737066,2021-06-30 21:00:00,2021-06-30T21:00,2021,6,27.4,0.0,Clear
10/10/2021,22:00,40.7416232,-73.9937353,MANHATTAN,1.0,0.0,0,0,1,0,0,0,4467783,2021-10-10 22:00:00,2021-10-10T22:00,2021,10,17.0,0.0,Cloudy
11/18/2021,22:00,40.751816,-73.97904,MANHATTAN,1.0,0.0,1,0,0,0,0,0,4479445,2021-11-18 22:00:00,2021-11-18T22:00,2021,11,12.4,1.9,Light Rain
05/08/2021,20:00,40.83016,-73.94167,MANHATTAN,1.0,0.0,0,0,1,0,0,0,4415507,2021-05-08 20:00:00,2021-05-08T20:00,2021,5,8.3,0.0,Clear
09/05/2021,0:00,40.74345,-73.9882,MANHATTAN,1.0,0.0,0,0,0,0,0,0,4455981,2021-09-05 00:00:00,2021-09-05T00:00,2021,9,18.1,0.0,Cloudy
12/31/2021,17:00,40.761375,-73.98781,MANHATTAN,1.0,0.0,1,0,0,0,0,0,4491635,2021-12-31 17:00:00,2021-12-31T17:00,2021,12,9.0,0.0,Cloudy
06/29/2021,12:00,40.802753,-73.93358,MANHATTAN,2.0,0.0,0,0,0,0,2,0,4432240,2021-06-29 12:00:00,2021-06-29T12:00,2021,6,33.5,0.0,Clear
12/06/2021,18:00,40.771996,-73.933304,QUEENS,1.0,0.0,1,0,0,0,0,0,4484551,2021-12-06 18:00:00,2021-12-06T18:00,2021,12,15.4,0.0,Cloudy
05/11/2021,22:00,40.74918,-73.869286,QUEENS,1.0,0.0,0,0,0,0,0,0,4415674,2021-05-11 22:00:00,2021-05-11T22:00,2021,5,9.8,0.0,Cloudy
04/30/2021,23:00,40.685184,-73.854225,QUEENS,1.0,0.0,0,0,0,0,1,0,4418887,2021-04-30 23:00:00,2021-04-30T23:00,2021,4,7.2,0.0,Clear
08/01/2021,14:00,40.704605,-73.9023,QUEENS,1.0,0.0,0,0,0,0,1,0,4442573,2021-08-01 14:00:00,2021-08-01T14:00,2021,8,24.4,0.0,Clear
07/13/2021,0:00,40.72296,-73.910446,QUEENS,0.0,0.0,0,0,0,0,0,0,4437736,2021-07-13 00:00:00,2021-07-13T00:00,2021,7,22.5,0.1,Drizzle
02/09/2021,8:00,40.733536,-73.87035,QUEENS,0.0,0.0,0,0,0,0,0,0,4390549,2021-02-09 08:00:00,2021-02-09T08:00,2021,2,-4.8,0.1,Light Snow
11/22/2021,10:00,40.683666,-73.76809,QUEENS,0.0,0.0,0,0,0,0,0,0,4481156,2021-11-22 10:00:00,2021-11-22T10:00,2021,11,9.4,0.0,Cloudy
04/23/2021,22:00,40.67602,-73.81613,QUEENS,0.0,0.0,0,0,0,0,0,0,4410231,2021-04-23 22:00:00,2021-04-23T22:00,2021,4,10.9,0.0,Cloudy
10/12/2021,19:00,40.66454,-73.8227505,QUEENS,1.0,0.0,0,0,0,0,1,0,4466642,2021-10-12 19:00:00,2021-10-12T19:00,2021,10,16.3,0.0,Clear
01/09/2021,16:00,40.704685,-73.73419,QUEENS,1.0,0.0,0,0,0,0,1,0,4382629,2021-01-09 16:00:00,2021-01-09T16:00,2021,1,0.5,0.0,Cloudy
06/30/2021,16:00,40.72147,-73.78444,QUEENS,1.0,0.0,0,0,0,0,1,0,4433444,2021-06-30 16:00:00,2021-06-30T16:00,2021,6,29.2,0.0,Clear
02/28/2021,21:00,40.683666,-73.82578,QUEENS,2.0,0.0,0,0,0,0,2,0,4395254,2021-02-28 21:00:00,2021-02-28T21:00,2021,2,5.8,0.4,Drizzle
08/11/2021,21:00,40.71116,-73.879074,QUEENS,0.0,0.0,0,0,0,0,0,0,4447929,2021-08-11 21:00:00,2021-08-11T21:00,2021,8,25.3,0.1,Drizzle
01/04/2021,18:00,40.680687,-73.84459,QUEENS,2.0,0.0,2,0,0,0,0,0,4381594,2021-01-04 18:00:00,2021-01-04T18:00,2021,1,4.0,0.0,Cloudy
02/23/2021,0:00,40.751637,-73.90985,QUEENS,1.0,0.0,0,0,0,0,1,0,4394015,2021-02-23 00:00:00,2021-02-23T00:00,2021,2,0.6,0.0,Clear
01/04/2021,21:00,40.749866,-73.86273,QUEENS,1.0,0.0,0,0,1,0,0,0,4387360,2021-01-04 21:00:00,2021-01-04T21:00,2021,1,1.7,0.0,Clear
10/07/2021,18:00,40.71186,-73.73554,QUEENS,1.0,0.0,0,0,0,0,1,0,4465021,2021-10-07 18:00:00,2021-10-07T18:00,2021,10,18.6,0.0,Clear
05/13/2021,23:00,40.665558,-73.72985,QUEENS,1.0,0.0,0,0,0,0,1,0,4416274,2021-05-13 23:00:00,2021-05-13T23:00,2021,5,11.4,0.0,Clear
06/05/2021,3:00,40.740913,-73.95226,QUEENS,1.0,0.0,0,0,0,0,1,0,4423533,2021-06-05 03:00:00,2021-06-05T03:00,2021,6,17.4,0.0,Clear
06/01/2021,8:00,40.762142,-73.86246,QUEENS,0.0,0.0,0,0,0,0,0,0,4422980,2021-06-01 08:00:00,2021-06-01T08:00,2021,6,16.4,0.0,Cloudy
04/02/2021,9:00,40.703033,-73.797134,QUEENS,1.0,0.0,1,0,0,0,0,0,4403991,2021-04-02 09:00:00,2021-04-02T09:00,2021,4,-0.5,0.0,Clear
02/15/2021,12:00,40.66561,-73.73568,QUEENS,2.0,0.0,0,0,0,0,2,0,4392035,2021-02-15 12:00:00,2021-02-15T12:00,2021,2,1.7,0.1,Drizzle
07/21/2021,22:00,40.677845,-73.729744,QUEENS,2.0,0.0,0,0,0,0,2,0,4439458,2021-07-21 22:00:00,2021-07-21T22:00,2021,7,21.3,0.0,Clear
08/23/2021,9:00,40.733486,-73.7069,QUEENS,1.0,0.0,0,0,0,0,1,0,4449804,2021-08-23 09:00:00,2021-08-23T09:00,2021,8,23.0,0.8,Drizzle
06/06/2021,5:00,40.68406,-73.75819,QUEENS,0.0,0.0,0,0,0,0,0,0,4423952,2021-06-06 05:00:00,2021-06-06T05:00,2021,6,20.6,0.0,Clear
12/05/2021,18:00,40.746296,-73.93041,QUEENS,1.0,0.0,0,0,1,0,0,0,4483716,2021-12-05 18:00:00,2021-12-05T18:00,2021,12,3.6,0.0,Cloudy
06/19/2021,20:00,40.67699,-73.74308,QUEENS,1.0,0.0,0,0,0,0,1,0,4428740,2021-06-19 20:00:00,2021-06-19T20:00,2021,6,21.7,0.2,Drizzle
04/05/2021,0:00,40.70537,-73.775826,QUEENS,1.0,0.0,1,0,0,0,0,0,4406647,2021-04-05 00:00:00,2021-04-05T00:00,2021,4,7.6,0.0,Clear
07/07/2021,13:00,40.69993,-73.90588,QUEENS,1.0,0.0,0,0,0,0,0,0,4440954,2021-07-07 13:00:00,2021-07-07T13:00,2021,7,29.9,0.0,Clear
07/04/2021,18:00,40.73595,-73.714745,QUEENS,1.0,0.0,0,0,0,0,1,0,4433882,2021-07-04 18:00:00,2021-07-04T18:00,2021,7,21.9,0.0,Clear
02/20/2021,17:00,40.69089,-73.794815,QUEENS,1.0,0.0,1,0,0,0,0,0,4393680,2021-02-20 17:00:00,2021-02-20T17:00,2021,2,-0.8,0.0,Cloudy
08/23/2021,20:00,40.7266,-73.789116,QUEENS,1.0,0.0,0,0,1,0,0,0,4450997,2021-08-23 20:00:00,2021-08-23T20:00,2021,8,24.5,0.0,Clear
03/07/2021,14:00,40.75707,-73.88848,QUEENS,0.0,0.0,0,0,0,0,0,0,4397432,2021-03-07 14:00:00,2021-03-07T14:00,2021,3,3.9,0.0,Clear
08/22/2021,0:00,40.736362,-73.79311,QUEENS,1.0,0.0,0,0,0,0,1,0,4449583,2021-08-22 00:00:00,2021-08-22T00:00,2021,8,23.8,0.0,Cloudy
12/23/2021,14:00,40.705704,-73.74437,QUEENS,2.0,0.0,0,0,0,0,2,0,4490047,2021-12-23 14:00:00,2021-12-23T14:00,2021,12,2.3,0.0,Cloudy
08/28/2021,12:00,40.705425,-73.78258,QUEENS,1.0,0.0,0,0,0,0,1,0,4452095,2021-08-28 12:00:00,2021-08-28T12:00,2021,8,23.8,0.6,Drizzle
06/24/2021,20:00,40.750706,-73.82322,QUEENS,1.0,0.0,0,0,1,0,0,0,4432784,2021-06-24 20:00:00,2021-06-24T20:00,2021,6,16.4,0.0,Clear
04/22/2021,12:00,40.715084,-73.75383,QUEENS,1.0,0.0,0,0,0,0,1,0,4409620,2021-04-22 12:00:00,2021-04-22T12:00,2021,4,7.2,0.0,Cloudy
08/06/2021,12:00,40.679344,-73.859535,QUEENS,0.0,0.0,0,0,0,0,0,0,4444373,2021-08-06 12:00:00,2021-08-06T12:00,2021,8,27.2,0.0,Clear
07/10/2021,23:00,40.66027,-73.7357,QUEENS,0.0,0.0,0,0,0,0,0,0,4435671,2021-07-10 23:00:00,2021-07-10T23:00,2021,7,20.9,0.0,Clear
03/22/2021,8:00,40.75333,-73.70682,QUEENS,1.0,0.0,1,0,0,0,0,0,4400906,2021-03-22 08:00:00,2021-03-22T08:00,2021,3,6.7,0.0,Clear
05/05/2021,15:00,40.727634,-73.8955,QUEENS,1.0,0.0,0,0,0,0,1,0,4420952,2021-05-05 15:00:00,2021-05-05T15:00,2021,5,14.4,0.0,Cloudy
02/19/2021,23:00,40.66205,-73.74605,QUEENS,1.0,0.0,0,0,0,0,1,0,4393088,2021-02-19 23:00:00,2021-02-19T23:00,2021,2,-1.2,0.0,Cloudy
01/26/2021,22:00,40.709038,-73.89846,QUEENS,1.0,0.0,1,0,0,0,0,0,4394541,2021-01-26 22:00:00,2021-01-26T22:00,2021,1,0.8,0.1,Drizzle
06/16/2021,15:00,40.755657,-73.884445,QUEENS,1.0,0.0,0,0,0,0,1,0,4428049,2021-06-16 15:00:00,2021-06-16T15:00,2021,6,23.5,0.0,Clear
09/15/2021,0:00,40.765137,-73.81944,QUEENS,0.0,0.0,0,0,0,0,0,0,4457530,2021-09-15 00:00:00,2021-09-15T00:00,2021,9,21.6,0.0,Cloudy
02/02/2021,22:00,40.71291,-73.79816,QUEENS,0.0,0.0,0,0,0,0,0,0,4388870,2021-02-02 22:00:00,2021-02-02T22:00,2021,2,-1.3,0.0,Cloudy
06/30/2021,20:00,40.653854,-73.834694,QUEENS,1.0,0.0,0,0,0,0,1,0,4432878,2021-06-30 20:00:00,2021-06-30T20:00,2021,6,27.9,0.0,Cloudy
11/30/2021,8:00,40.747887,-73.77485,QUEENS,1.0,0.0,0,0,0,0,1,0,4482462,2021-11-30 08:00:00,2021-11-30T08:00,2021,11,0.2,0.0,Cloudy
06/07/2021,15:00,40.710403,-73.77146,QUEENS,2.0,0.0,0,0,0,0,2,0,4424565,2021-06-07 15:00:00,2021-06-07T15:00,2021,6,23.8,0.0,Cloudy
08/17/2021,13:00,40.6764,-73.741325,QUEENS,2.0,0.0,0,0,0,0,2,0,4448047,2021-08-17 13:00:00,2021-08-17T13:00,2021,8,25.6,0.0,Cloudy
08/08/2021,15:00,40.75694,-73.93464,QUEENS,1.0,0.0,0,0,0,0,0,0,4445098,2021-08-08 15:00:00,2021-08-08T15:00,2021,8,21.5,0.1,Drizzle
12/31/2021,19:00,40.754116,-73.858536,QUEENS,1.0,0.0,1,0,0,0,0,0,4491168,2021-12-31 19:00:00,2021-12-31T19:00,2021,12,8.8,0.0,Cloudy
01/10/2021,17:00,40.760376,-73.866196,QUEENS,1.0,0.0,1,0,0,0,0,0,4383253,2021-01-10 17:00:00,2021-01-10T17:00,2021,1,0.3,0.0,Clear
01/31/2021,14:00,40.7171,-73.74077,QUEENS,1.0,0.0,0,0,0,0,1,0,4388085,2021-01-31 14:00:00,2021-01-31T14:00,2021,1,-2.7,0.1,Light Snow
05/08/2021,0:00,40.704803,-73.73808,QUEENS,3.0,0.0,0,0,0,0,3,0,4414586,2021-05-08 00:00:00,2021-05-08T00:00,2021,5,9.2,0.0,Cloudy
11/28/2021,20:00,40.72594,-73.8139,QUEENS,1.0,0.0,0,0,0,0,1,0,4482622,2021-11-28 20:00:00,2021-11-28T20:00,2021,11,2.3,0.0,Cloudy
01/05/2021,22:00,40.677685,-73.73231,QUEENS,3.0,0.0,0,0,0,0,3,0,4381869,2021-01-05 22:00:00,2021-01-05T22:00,2021,1,1.3,0.0,Clear
03/29/2021,15:00,40.695877,-73.742516,QUEENS,0.0,0.0,0,0,0,0,0,0,4402800,2021-03-29 15:00:00,2021-03-29T15:00,2021,3,11.3,0.0,Clear
01/19/2021,12:00,40.702335,-73.89073,QUEENS,1.0,0.0,0,0,0,0,1,0,4385129,2021-01-19 12:00:00,2021-01-19T12:00,2021,1,4.8,0.0,Cloudy
10/16/2021,21:00,40.7433116,-73.8745041,QUEENS,1.0,0.0,1,0,0,0,0,0,4468023,2021-10-16 21:00:00,2021-10-16T21:00,2021,10,16.0,2.4,Light Rain
03/28/2021,19:00,40.73312,-73.71856,QUEENS,0.0,0.0,0,0,0,0,0,0,4402450,2021-03-28 19:00:00,2021-03-28T19:00,2021,3,13.5,0.4,Drizzle
06/24/2021,16:00,40.65766,-73.83371,QUEENS,1.0,0.0,0,0,1,0,0,0,4430609,2021-06-24 16:00:00,2021-06-24T16:00,2021,6,20.9,0.0,Clear
02/26/2021,20:00,40.666695,-73.767136,QUEENS,1.0,0.0,0,0,0,0,1,0,4394795,2021-02-26 20:00:00,2021-02-26T20:00,2021,2,3.2,0.0,Cloudy
08/07/2021,18:00,40.732876,-73.89592,QUEENS,1.0,0.0,0,0,0,0,1,0,4447137,2021-08-07 18:00:00,2021-08-07T18:00,2021,8,24.9,0.0,Cloudy
11/23/2021,8:00,40.774513,-73.82188,QUEENS,0.0,0.0,0,0,0,0,0,0,4480218,2021-11-23 08:00:00,2021-11-23T08:00,2021,11,0.8,0.0,Clear
12/30/2021,21:00,40.686028,-73.82506,QUEENS,1.0,0.0,0,0,0,0,1,0,4490877,2021-12-30 21:00:00,2021-12-30T21:00,2021,12,7.2,0.0,Cloudy
10/03/2021,5:00,40.67812,-73.85828,QUEENS,1.0,0.0,0,0,0,0,1,0,4463685,2021-10-03 05:00:00,2021-10-03T05:00,2021,10,14.9,0.0,Clear
06/23/2021,8:00,40.767727,-73.78427,QUEENS,1.0,0.0,0,0,0,0,1,0,4434992,2021-06-23 08:00:00,2021-06-23T08:00,2021,6,17.4,0.0,Clear
11/28/2021,5:00,40.685596,-73.81886,QUEENS,2.0,0.0,0,0,0,0,2,0,4481697,2021-11-28 05:00:00,2021-11-28T05:00,2021,11,0.4,0.7,Heavy Snow
12/13/2021,9:00,40.72917,-73.93085,QUEENS,1.0,0.0,0,0,0,0,1,0,4486233,2021-12-13 09:00:00,2021-12-13T09:00,2021,12,4.4,0.0,Cloudy
04/01/2021,19:00,40.701237,-73.79465,QUEENS,1.0,0.0,0,0,0,0,1,0,4403990,2021-04-01 19:00:00,2021-04-01T19:00,2021,4,5.8,0.0,Clear
10/17/2021,5:00,40.7513969,-73.7031996,QUEENS,1.0,0.0,0,0,0,0,1,0,4467802,2021-10-17 05:00:00,2021-10-17T05:00,2021,10,11.2,0.0,Clear
09/14/2021,15:00,40.720413,-73.76095,QUEENS,0.0,0.0,0,0,0,0,0,0,4457634,2021-09-14 15:00:00,2021-09-14T15:00,2021,9,24.4,0.0,Cloudy
09/19/2021,15:00,40.776546,-73.92377,QUEENS,0.0,0.0,0,0,0,0,0,0,4459405,2021-09-19 15:00:00,2021-09-19T15:00,2021,9,23.6,0.0,Clear
07/14/2021,19:00,40.707336,-73.7961,QUEENS,1.0,0.0,1,0,0,0,0,0,4438296,2021-07-14 19:00:00,2021-07-14T19:00,2021,7,25.5,0.0,Clear
02/10/2021,18:00,40.666637,-73.78149,QUEENS,2.0,0.0,0,0,0,0,2,0,4390885,2021-02-10 18:00:00,2021-02-10T18:00,2021,2,-0.6,0.0,Cloudy
05/24/2021,18:00,40.76758,-73.83185,QUEENS,1.0,0.0,1,0,0,0,0,0,4420042,2021-05-24 18:00:00,2021-05-24T18:00,2021,5,14.9,0.0,Clear
07/20/2021,13:00,40.737537,-73.75674,QUEENS,0.0,0.0,0,0,0,0,0,0,4438816,2021-07-20 13:00:00,2021-07-20T13:00,2021,7,29.7,0.0,Clear
03/14/2021,14:00,40.747314,-73.86935,QUEENS,1.0,0.0,1,0,0,0,0,0,4398848,2021-03-14 14:00:00,2021-03-14T14:00,2021,3,9.7,0.0,Clear
04/24/2021,7:00,40.745285,-73.86911,QUEENS,0.0,0.0,0,0,0,0,0,0,4410295,2021-04-24 07:00:00,2021-04-24T07:00,2021,4,11.6,0.0,Clear
05/04/2021,23:00,40.76496,-73.90532,QUEENS,1.0,0.0,1,0,0,0,0,0,4413398,2021-05-04 23:00:00,2021-05-04T23:00,2021,5,11.1,0.6,Drizzle
07/06/2021,14:00,40.74958,-73.86541,QUEENS,1.0,0.0,0,0,0,0,1,0,4434728,2021-07-06 14:00:00,2021-07-06T14:00,2021,7,33.2,0.0,Cloudy
07/01/2021,11:00,40.700665,-73.8961,QUEENS,1.0,0.0,0,0,0,0,1,0,4447968,2021-07-01 11:00:00,2021-07-01T11:00,2021,7,29.0,0.0,Cloudy
10/04/2021,0:00,40.60702,-73.81943,QUEENS,1.0,0.0,0,0,1,0,0,0,4464078,2021-10-04 00:00:00,2021-10-04T00:00,2021,10,21.0,0.0,Cloudy
06/13/2021,3:00,40.67235,-73.75269,QUEENS,0.0,0.0,0,0,0,0,0,0,4427141,2021-06-13 03:00:00,2021-06-13T03:00,2021,6,15.0,0.0,Clear
06/24/2021,20:00,40.736893,-73.86494,QUEENS,1.0,0.0,0,0,0,0,0,0,4430744,2021-06-24 20:00:00,2021-06-24T20:00,2021,6,17.3,0.0,Clear
02/04/2021,11:00,40.72096,-73.84698,QUEENS,1.0,0.0,1,0,0,0,0,0,4389447,2021-02-04 11:00:00,2021-02-04T11:00,2021,2,1.4,0.0,Clear
01/06/2021,15:00,40.682285,-73.80805,QUEENS,1.0,0.0,0,0,0,0,1,0,4382062,2021-01-06 15:00:00,2021-01-06T15:00,2021,1,4.7,0.0,Clear
12/23/2021,14:00,40.755028,-73.872696,QUEENS,0.0,0.0,0,0,0,0,0,0,4489349,2021-12-23 14:00:00,2021-12-23T14:00,2021,12,2.1,0.0,Cloudy
01/17/2021,3:00,40.748993,-73.89687,QUEENS,0.0,0.0,0,0,0,0,0,0,4384500,2021-01-17 03:00:00,2021-01-17T03:00,2021,1,0.4,0.0,Clear
02/12/2021,11:00,40.77593,-73.910965,QUEENS,1.0,0.0,0,0,1,0,0,0,4391535,2021-02-12 11:00:00,2021-02-12T11:00,2021,2,-5.8,0.0,Cloudy
02/14/2021,8:00,40.76301,-73.87532,QUEENS,2.0,0.0,0,0,0,0,2,0,4391978,2021-02-14 08:00:00,2021-02-14T08:00,2021,2,-2.2,0.0,Cloudy
07/23/2021,18:00,40.66691,-73.822014,QUEENS,2.0,0.0,0,0,0,0,2,0,4440439,2021-07-23 18:00:00,2021-07-23T18:00,2021,7,25.1,0.0,Clear
08/08/2021,10:00,40.68259,-73.80614,QUEENS,1.0,0.0,1,0,0,0,0,0,4444792,2021-08-08 10:00:00,2021-08-08T10:00,2021,8,22.0,0.7,Drizzle
06/02/2021,0:00,40.667114,-73.834656,QUEENS,3.0,0.0,0,0,0,0,3,0,4423050,2021-06-02 00:00:00,2021-06-02T00:00,2021,6,15.4,0.0,Cloudy
01/13/2021,17:00,40.699757,-73.79359,QUEENS,0.0,0.0,0,0,0,0,0,0,4387658,2021-01-13 17:00:00,2021-01-13T17:00,2021,1,3.1,0.0,Clear
02/18/2021,17:00,40.695858,-73.81891,QUEENS,1.0,0.0,1,0,0,0,0,0,4392956,2021-02-18 17:00:00,2021-02-18T17:00,2021,2,-1.6,0.1,Light Snow
10/17/2021,16:00,40.7287817,-73.926144,QUEENS,0.0,0.0,0,0,0,0,0,0,4468152,2021-10-17 16:00:00,2021-10-17T16:00,2021,10,16.6,0.1,Drizzle
03/21/2021,0:00,40.686863,-73.757965,QUEENS,0.0,0.0,0,0,0,0,0,0,4400764,2021-03-21 00:00:00,2021-03-21T00:00,2021,3,0.3,0.0,Clear
04/20/2021,21:00,40.709633,-73.90223,QUEENS,1.0,0.0,0,0,0,0,1,0,4409303,2021-04-20 21:00:00,2021-04-20T21:00,2021,4,13.8,0.0,Clear
05/16/2021,21:00,40.74353,-73.85403,QUEENS,1.0,0.0,0,0,0,0,1,0,4417266,2021-05-16 21:00:00,2021-05-16T21:00,2021,5,15.1,0.0,Cloudy
09/06/2021,6:00,40.688362,-73.77663,QUEENS,1.0,0.0,0,0,0,0,1,0,4454355,2021-09-06 06:00:00,2021-09-06T06:00,2021,9,20.2,0.0,Cloudy
01/14/2021,19:00,40.696163,-73.76881,QUEENS,0.0,0.0,0,0,0,0,0,0,4384355,2021-01-14 19:00:00,2021-01-14T19:00,2021,1,2.2,0.0,Clear
07/23/2021,17:00,40.7515,-73.90276,QUEENS,1.0,0.0,0,0,0,0,1,0,4439854,2021-07-23 17:00:00,2021-07-23T17:00,2021,7,26.1,0.0,Clear
06/02/2021,22:00,40.753323,-73.868706,QUEENS,1.0,0.0,1,0,0,0,0,0,4423606,2021-06-02 22:00:00,2021-06-02T22:00,2021,6,14.5,0.0,Cloudy
12/18/2021,18:00,40.7272,-73.74922,QUEENS,1.0,0.0,1,0,0,0,0,0,4487792,2021-12-18 18:00:00,2021-12-18T18:00,2021,12,7.4,0.0,Cloudy
10/20/2021,5:00,40.6863048,-73.7939082,QUEENS,0.0,0.0,0,0,0,0,0,0,4469476,2021-10-20 05:00:00,2021-10-20T05:00,2021,10,13.9,0.0,Cloudy
01/13/2021,11:00,40.67784,-73.780266,QUEENS,0.0,0.0,0,0,0,0,0,0,4383621,2021-01-13 11:00:00,2021-01-13T11:00,2021,1,4.1,0.0,Cloudy
11/30/2021,18:00,40.742508,-73.91788,QUEENS,1.0,0.0,0,0,1,0,0,0,4482429,2021-11-30 18:00:00,2021-11-30T18:00,2021,11,3.1,0.0,Cloudy
05/25/2021,18:00,40.73787,-73.877075,QUEENS,1.0,0.0,1,0,0,0,0,0,4420789,2021-05-25 18:00:00,2021-05-25T18:00,2021,5,18.3,0.0,Cloudy
05/22/2021,0:00,40.71256,-73.732994,QUEENS,3.0,0.0,0,0,0,0,3,0,4419718,2021-05-22 00:00:00,2021-05-22T00:00,2021,5,17.1,0.0,Cloudy
09/02/2021,9:00,40.736267,-73.772865,QUEENS,1.0,0.0,0,0,1,0,0,0,4453185,2021-09-02 09:00:00,2021-09-02T09:00,2021,9,19.6,0.0,Clear
11/05/2021,13:00,40.74326,-73.8898,QUEENS,1.0,0.0,1,0,0,0,0,0,4474885,2021-11-05 13:00:00,2021-11-05T13:00,2021,11,10.3,0.0,Clear
10/04/2021,15:00,40.772346,-73.826584,QUEENS,1.0,0.0,1,0,0,0,0,0,4464187,2021-10-04 15:00:00,2021-10-04T15:00,2021,10,20.9,0.3,Drizzle
05/02/2021,21:00,40.74184,-73.88101,QUEENS,2.0,0.0,0,0,0,0,0,0,4412700,2021-05-02 21:00:00,2021-05-02T21:00,2021,5,17.6,0.0,Cloudy
04/12/2021,20:00,40.781715,-73.823845,QUEENS,1.0,0.0,1,0,0,0,0,0,4407990,2021-04-12 20:00:00,2021-04-12T20:00,2021,4,8.2,1.0,Drizzle
05/05/2021,0:00,40.660328,-73.72948,QUEENS,1.0,0.0,0,0,0,0,1,0,4413713,2021-05-05 00:00:00,2021-05-05T00:00,2021,5,10.5,2.4,Light Rain
08/31/2021,19:00,40.73388,-73.70509,QUEENS,1.0,0.0,0,0,0,0,1,0,4452573,2021-08-31 19:00:00,2021-08-31T19:00,2021,8,22.9,0.0,Cloudy
05/14/2021,18:00,40.6575,-73.839455,QUEENS,3.0,0.0,0,0,0,0,3,0,4416641,2021-05-14 18:00:00,2021-05-14T18:00,2021,5,15.8,0.0,Clear
07/19/2021,13:00,40.72558,-73.75262,QUEENS,1.0,0.0,0,0,0,0,1,0,4438531,2021-07-19 13:00:00,2021-07-19T13:00,2021,7,25.6,0.0,Cloudy
09/30/2021,14:00,40.596207,-73.768745,QUEENS,0.0,0.0,0,0,0,0,0,0,4462771,2021-09-30 14:00:00,2021-09-30T14:00,2021,9,18.3,0.0,Cloudy
01/28/2021,16:00,40.66609,-73.82809,QUEENS,1.0,0.0,0,0,0,0,1,0,4387515,2021-01-28 16:00:00,2021-01-28T16:00,2021,1,-1.4,0.0,Clear
05/28/2021,15:00,40.681087,-73.846344,QUEENS,1.0,0.0,0,0,1,0,0,0,4421534,2021-05-28 15:00:00,2021-05-28T15:00,2021,5,15.8,0.1,Drizzle
07/04/2021,23:00,40.702236,-73.75769,QUEENS,1.0,0.0,0,0,0,0,1,0,4434503,2021-07-04 23:00:00,2021-07-04T23:00,2021,7,21.0,0.0,Clear
11/02/2021,9:00,40.697468,-73.7442,QUEENS,0.0,0.0,0,0,0,0,0,0,4473839,2021-11-02 09:00:00,2021-11-02T09:00,2021,11,11.6,0.0,Cloudy
02/20/2021,15:00,40.787758,-73.83736,QUEENS,1.0,0.0,0,0,0,0,1,0,4393253,2021-02-20 15:00:00,2021-02-20T15:00,2021,2,0.1,0.0,Cloudy
04/03/2021,21:00,40.605934,-73.758286,QUEENS,1.0,0.0,1,0,0,0,0,0,4405430,2021-04-03 21:00:00,2021-04-03T21:00,2021,4,7.4,0.0,Clear
10/23/2021,11:00,40.7049936,-73.794385,QUEENS,2.0,0.0,0,0,0,0,2,0,4470568,2021-10-23 11:00:00,2021-10-23T11:00,2021,10,12.4,0.0,Cloudy
12/29/2021,13:00,40.745007,-73.91928,QUEENS,1.0,0.0,1,0,0,0,0,0,4490471,2021-12-29 13:00:00,2021-12-29T13:00,2021,12,7.2,0.0,Cloudy
10/12/2021,21:00,40.73477,-73.8745815,QUEENS,1.0,0.0,0,0,0,0,1,0,4466667,2021-10-12 21:00:00,2021-10-12T21:00,2021,10,16.5,0.0,Clear
10/25/2021,20:00,40.740257,-73.86532,QUEENS,0.0,0.0,0,0,0,0,0,0,4471026,2021-10-25 20:00:00,2021-10-25T20:00,2021,10,19.3,0.0,Cloudy
04/30/2021,0:00,40.694317,-73.737526,QUEENS,1.0,0.0,0,0,0,0,1,0,4412581,2021-04-30 00:00:00,2021-04-30T00:00,2021,4,17.8,0.1,Drizzle
09/02/2021,7:00,40.790165,-73.80753,QUEENS,0.0,0.0,0,0,0,0,0,0,4453086,2021-09-02 07:00:00,2021-09-02T07:00,2021,9,17.0,0.0,Clear
09/04/2021,17:00,40.681503,-73.81782,QUEENS,1.0,0.0,0,0,0,0,1,0,4454147,2021-09-04 17:00:00,2021-09-04T17:00,2021,9,21.7,0.0,Clear
10/01/2021,20:00,40.74413,-73.927055,QUEENS,1.0,0.0,0,0,0,0,1,0,4463054,2021-10-01 20:00:00,2021-10-01T20:00,2021,10,15.0,0.0,Clear
06/19/2021,21:00,40.71512,-73.83224,QUEENS,1.0,0.0,1,0,0,0,0,0,4428784,2021-06-19 21:00:00,2021-06-19T21:00,2021,6,20.3,0.6,Drizzle
08/03/2021,17:00,40.746143,-73.89812,QUEENS,1.0,0.0,0,0,1,0,0,0,4443506,2021-08-03 17:00:00,2021-08-03T17:00,2021,8,24.0,0.0,Cloudy
02/19/2021,6:00,40.74539,-73.90662,QUEENS,1.0,0.0,1,0,0,0,0,0,4392953,2021-02-19 06:00:00,2021-02-19T06:00,2021,2,-1.6,0.2,Light Snow
01/25/2021,16:00,40.704803,-73.73808,QUEENS,1.0,0.0,0,0,0,0,1,0,4386679,2021-01-25 16:00:00,2021-01-25T16:00,2021,1,2.5,0.0,Cloudy
11/13/2021,20:00,40.726814,-73.83846,QUEENS,2.0,0.0,0,0,0,0,2,0,4476927,2021-11-13 20:00:00,2021-11-13T20:00,2021,11,5.3,0.0,Clear
05/01/2021,15:00,40.681923,-73.831924,QUEENS,0.0,0.0,0,0,0,0,0,0,4412710,2021-05-01 15:00:00,2021-05-01T15:00,2021,5,17.5,0.0,Clear
05/01/2021,7:00,40.697433,-73.898605,QUEENS,0.0,0.0,0,0,0,0,0,0,4412481,2021-05-01 07:00:00,2021-05-01T07:00,2021,5,6.6,0.0,Clear
10/31/2021,14:00,40.752945,-73.89248,QUEENS,1.0,0.0,1,0,0,0,0,0,4473082,2021-10-31 14:00:00,2021-10-31T14:00,2021,10,18.0,0.1,Drizzle
07/30/2021,17:00,40.68297,-73.82824,QUEENS,1.0,0.0,0,0,1,0,0,0,4442165,2021-07-30 17:00:00,2021-07-30T17:00,2021,7,25.9,0.0,Clear
12/19/2021,21:00,40.673573,-73.79258,QUEENS,1.0,0.0,0,0,0,0,1,0,4487862,2021-12-19 21:00:00,2021-12-19T21:00,2021,12,-0.8,0.0,Clear
07/18/2021,12:00,40.68246,-73.830025,QUEENS,3.0,0.0,0,0,0,0,3,0,4437956,2021-07-18 12:00:00,2021-07-18T12:00,2021,7,26.8,0.2,Drizzle
10/25/2021,18:00,40.711246,-73.87095,QUEENS,1.0,0.0,0,0,0,0,1,0,4471074,2021-10-25 18:00:00,2021-10-25T18:00,2021,10,19.2,0.0,Cloudy
05/08/2021,20:00,40.743214,-73.907166,QUEENS,1.0,0.0,1,0,0,0,0,0,4414758,2021-05-08 20:00:00,2021-05-08T20:00,2021,5,9.1,0.0,Clear
07/31/2021,17:00,40.707306,-73.75122,QUEENS,1.0,0.0,0,0,0,0,1,0,4442217,2021-07-31 17:00:00,2021-07-31T17:00,2021,7,22.9,0.0,Clear
08/11/2021,12:00,40.6838,-73.72786,QUEENS,1.0,0.0,0,0,0,0,1,0,4446091,2021-08-11 12:00:00,2021-08-11T12:00,2021,8,27.8,0.0,Clear
07/22/2021,9:00,40.75221,-73.90443,QUEENS,1.0,0.0,0,0,1,0,0,0,4439529,2021-07-22 09:00:00,2021-07-22T09:00,2021,7,23.4,0.0,Clear
06/01/2021,18:00,40.743855,-73.82221,QUEENS,1.0,0.0,0,0,0,0,1,0,4422908,2021-06-01 18:00:00,2021-06-01T18:00,2021,6,17.8,0.0,Cloudy
02/22/2021,16:00,40.74879,-73.89348,QUEENS,1.0,0.0,0,0,0,0,1,0,4394077,2021-02-22 16:00:00,2021-02-22T16:00,2021,2,2.6,1.7,Light Rain
11/30/2021,11:00,40.78418,-73.83641,QUEENS,0.0,0.0,0,0,0,0,0,0,4482332,2021-11-30 11:00:00,2021-11-30T11:00,2021,11,3.9,0.0,Cloudy
11/01/2021,6:00,40.7515,-73.90276,QUEENS,1.0,0.0,0,0,0,0,1,0,4472996,2021-11-01 06:00:00,2021-11-01T06:00,2021,11,10.4,0.0,Clear
11/08/2021,22:00,40.692078,-73.810196,QUEENS,2.0,0.0,0,0,0,0,2,0,4476576,2021-11-08 22:00:00,2021-11-08T22:00,2021,11,8.8,0.0,Clear
11/18/2021,6:00,40.756287,-73.860725,QUEENS,0.0,0.0,0,0,0,0,0,0,4478587,2021-11-18 06:00:00,2021-11-18T06:00,2021,11,9.8,0.0,Clear
11/06/2021,7:00,40.75389,-73.91651,QUEENS,1.0,0.0,0,0,1,0,0,0,4474552,2021-11-06 07:00:00,2021-11-06T07:00,2021,11,3.1,0.0,Clear
01/12/2021,17:00,40.74657,-73.88375,QUEENS,0.0,0.0,0,0,0,0,0,0,4384958,2021-01-12 17:00:00,2021-01-12T17:00,2021,1,1.0,0.0,Clear
02/18/2021,11:00,40.69477,-73.8248,QUEENS,1.0,0.0,0,0,0,0,1,0,4392794,2021-02-18 11:00:00,2021-02-18T11:00,2021,2,-2.1,1.1,Heavy Snow
04/14/2021,15:00,40.72304,-73.8563,QUEENS,1.0,0.0,0,0,0,0,1,0,4407382,2021-04-14 15:00:00,2021-04-14T15:00,2021,4,18.1,0.0,Cloudy
11/29/2021,0:00,40.752995,-73.87053,QUEENS,0.0,0.0,0,0,0,0,0,0,4483129,2021-11-29 00:00:00,2021-11-29T00:00,2021,11,3.1,0.0,Cloudy
11/11/2021,22:00,40.76161,-73.760765,QUEENS,0.0,0.0,0,0,0,0,0,0,4477084,2021-11-11 22:00:00,2021-11-11T22:00,2021,11,15.5,0.1,Drizzle
08/17/2021,19:00,40.597954,-73.73919,QUEENS,2.0,0.0,0,0,0,0,2,0,4448181,2021-08-17 19:00:00,2021-08-17T19:00,2021,8,24.0,0.0,Cloudy
11/13/2021,6:00,40.75898,-73.87075,QUEENS,0.0,0.0,0,0,0,0,0,0,4480313,2021-11-13 06:00:00,2021-11-13T06:00,2021,11,8.6,0.0,Clear
10/11/2021,23:00,40.7103517,-73.7938951,QUEENS,1.0,0.0,1,0,0,0,0,0,4466547,2021-10-11 23:00:00,2021-10-11T23:00,2021,10,16.0,0.0,Clear
06/09/2021,16:00,40.74559,-73.87791,QUEENS,1.0,0.0,0,0,1,0,0,0,4426693,2021-06-09 16:00:00,2021-06-09T16:00,2021,6,29.2,0.7,Drizzle
03/23/2021,11:00,40.740273,-73.89586,QUEENS,2.0,0.0,0,0,0,0,2,0,4401155,2021-03-23 11:00:00,2021-03-23T11:00,2021,3,14.9,0.0,Cloudy
02/20/2021,15:00,40.702374,-73.87544,QUEENS,4.0,0.0,0,0,0,0,4,0,4393369,2021-02-20 15:00:00,2021-02-20T15:00,2021,2,-0.1,0.0,Cloudy
06/29/2021,0:00,40.658657,-73.771996,QUEENS,1.0,0.0,0,0,0,0,1,0,4432356,2021-06-29 00:00:00,2021-06-29T00:00,2021,6,25.5,0.0,Clear
05/22/2021,15:00,40.67576,-73.81,QUEENS,1.0,0.0,0,0,0,0,1,0,4419762,2021-05-22 15:00:00,2021-05-22T15:00,2021,5,30.4,0.0,Cloudy
11/13/2021,8:00,40.68636,-73.810036,QUEENS,0.0,0.0,0,0,0,0,0,0,4477465,2021-11-13 08:00:00,2021-11-13T08:00,2021,11,13.4,0.0,Clear
02/07/2021,15:00,40.676117,-73.74046,QUEENS,1.0,0.0,0,0,0,0,1,0,4390138,2021-02-07 15:00:00,2021-02-07T15:00,2021,2,-0.4,1.2,Heavy Snow
01/10/2021,18:00,40.665943,-73.81662,QUEENS,1.0,0.0,0,0,0,0,1,0,4383009,2021-01-10 18:00:00,2021-01-10T18:00,2021,1,-1.1,0.0,Clear
03/02/2021,14:00,40.735653,-73.851006,QUEENS,1.0,0.0,1,0,0,0,0,0,4395955,2021-03-02 14:00:00,2021-03-02T14:00,2021,3,-0.9,0.0,Clear
04/15/2021,8:00,40.73444,-73.72179,QUEENS,1.0,0.0,0,0,1,0,0,0,4407863,2021-04-15 08:00:00,2021-04-15T08:00,2021,4,12.3,0.1,Drizzle
06/10/2021,16:00,40.738438,-73.89988,QUEENS,2.0,0.0,0,0,0,0,2,0,4425620,2021-06-10 16:00:00,2021-06-10T16:00,2021,6,23.2,0.0,Cloudy
08/15/2021,13:00,40.696564,-73.856476,QUEENS,0.0,0.0,0,0,0,0,0,0,4447117,2021-08-15 13:00:00,2021-08-15T13:00,2021,8,26.6,0.0,Cloudy
04/22/2021,0:00,40.704845,-73.892136,QUEENS,0.0,0.0,0,0,0,0,0,0,4415440,2021-04-22 00:00:00,2021-04-22T00:00,2021,4,2.6,0.0,Clear
11/02/2021,19:00,40.60322,-73.74893,QUEENS,1.0,0.0,1,0,0,0,0,0,4473653,2021-11-02 19:00:00,2021-11-02T19:00,2021,11,10.4,0.2,Drizzle
10/31/2021,6:00,40.711548,-73.790726,QUEENS,1.0,0.0,0,0,0,0,1,0,4472562,2021-10-31 06:00:00,2021-10-31T06:00,2021,10,12.4,0.0,Clear
01/18/2021,9:00,40.686447,-73.85485,QUEENS,4.0,0.0,0,0,0,0,4,0,4384811,2021-01-18 09:00:00,2021-01-18T09:00,2021,1,3.1,0.0,Clear
08/20/2021,19:00,40.678417,-73.729225,QUEENS,0.0,0.0,0,0,0,0,0,0,4449291,2021-08-20 19:00:00,2021-08-20T19:00,2021,8,24.1,0.7,Drizzle
03/22/2021,0:00,40.715343,-73.74845,QUEENS,2.0,0.0,0,0,0,0,2,0,4401539,2021-03-22 00:00:00,2021-03-22T00:00,2021,3,4.6,0.0,Clear
05/28/2021,14:00,40.667114,-73.834656,QUEENS,3.0,0.0,0,0,0,0,3,0,4421372,2021-05-28 14:00:00,2021-05-28T14:00,2021,5,17.3,0.0,Cloudy
05/07/2021,10:00,40.75193,-73.808914,QUEENS,1.0,0.0,0,0,0,0,1,0,4414272,2021-05-07 10:00:00,2021-05-07T10:00,2021,5,15.8,0.0,Cloudy
08/10/2021,10:00,40.693264,-73.85324,QUEENS,1.0,0.0,0,0,1,0,0,0,4447882,2021-08-10 10:00:00,2021-08-10T10:00,2021,8,24.9,0.0,Clear
10/22/2021,14:00,40.6660852,-73.8280776,QUEENS,2.0,0.0,0,0,0,0,2,0,4470546,2021-10-22 14:00:00,2021-10-22T14:00,2021,10,20.3,0.0,Cloudy
09/24/2021,8:00,40.665127,-73.77703,QUEENS,0.0,0.0,0,0,0,0,0,0,4460612,2021-09-24 08:00:00,2021-09-24T08:00,2021,9,17.5,0.0,Cloudy
03/01/2021,8:00,40.76813,-73.87625,QUEENS,1.0,0.0,0,0,0,0,1,0,4395550,2021-03-01 08:00:00,2021-03-01T08:00,2021,3,4.6,0.7,Drizzle
02/05/2021,16:00,40.751045,-73.946465,QUEENS,0.0,0.0,0,0,0,0,0,0,4389496,2021-02-05 16:00:00,2021-02-05T16:00,2021,2,3.7,0.0,Clear
08/27/2021,6:00,40.681274,-73.81162,QUEENS,1.0,0.0,0,0,0,0,1,0,4451141,2021-08-27 06:00:00,2021-08-27T06:00,2021,8,24.4,0.0,Clear
09/26/2021,14:00,40.602276,-73.76554,QUEENS,0.0,0.0,0,0,0,0,0,0,4461567,2021-09-26 14:00:00,2021-09-26T14:00,2021,9,21.2,0.0,Cloudy
09/01/2021,19:00,40.74554,-73.7768,QUEENS,1.0,0.0,0,0,0,0,1,0,4452890,2021-09-01 19:00:00,2021-09-01T19:00,2021,9,21.3,5.0,Heavy Rain
08/30/2021,20:00,40.757717,-73.94126,QUEENS,1.0,0.0,1,0,0,0,0,0,4452470,2021-08-30 20:00:00,2021-08-30T20:00,2021,8,25.5,0.0,Clear
02/08/2021,16:00,40.69797,-73.753784,QUEENS,0.0,0.0,0,0,0,0,0,0,4390814,2021-02-08 16:00:00,2021-02-08T16:00,2021,2,-5.1,0.0,Clear
09/03/2021,19:00,40.71637,-73.74685,QUEENS,0.0,0.0,0,0,0,0,0,0,4453529,2021-09-03 19:00:00,2021-09-03T19:00,2021,9,18.5,0.0,Clear
07/28/2021,7:00,40.754707,-73.87575,QUEENS,1.0,0.0,0,0,1,0,0,0,4441392,2021-07-28 07:00:00,2021-07-28T07:00,2021,7,21.8,0.0,Clear
02/11/2021,17:00,40.717476,-73.75027,QUEENS,2.0,0.0,0,0,0,0,2,0,4391212,2021-02-11 17:00:00,2021-02-11T17:00,2021,2,-2.6,0.0,Cloudy
03/04/2021,13:00,40.748924,-73.937386,QUEENS,2.0,0.0,0,0,0,0,2,0,4396287,2021-03-04 13:00:00,2021-03-04T13:00,2021,3,5.7,0.0,Cloudy
04/24/2021,22:00,40.75184,-73.94806,QUEENS,1.0,0.0,0,0,0,0,1,0,4410028,2021-04-24 22:00:00,2021-04-24T22:00,2021,4,12.1,0.0,Cloudy
03/22/2021,7:00,40.665474,-73.74751,QUEENS,1.0,0.0,0,0,0,0,1,0,4400910,2021-03-22 07:00:00,2021-03-22T07:00,2021,3,2.2,0.0,Clear
07/26/2021,0:00,40.676796,-73.80634,QUEENS,1.0,0.0,0,0,0,0,1,0,4440614,2021-07-26 00:00:00,2021-07-26T00:00,2021,7,24.0,0.0,Cloudy
09/13/2021,7:00,40.691433,-73.89063,QUEENS,3.0,0.0,0,0,0,0,3,0,4458736,2021-09-13 07:00:00,2021-09-13T07:00,2021,9,23.2,0.0,Cloudy
09/20/2021,12:00,40.691433,-73.89063,QUEENS,1.0,0.0,0,0,0,0,1,0,4459440,2021-09-20 12:00:00,2021-09-20T12:00,2021,9,22.3,0.1,Drizzle
09/20/2021,20:00,40.74854,-73.94964,QUEENS,1.0,0.0,0,0,0,0,1,0,4459246,2021-09-20 20:00:00,2021-09-20T20:00,2021,9,18.2,0.0,Clear
07/06/2021,15:00,40.709953,-73.8014,QUEENS,0.0,0.0,0,0,0,0,0,0,4435207,2021-07-06 15:00:00,2021-07-06T15:00,2021,7,30.0,0.0,Cloudy
03/05/2021,5:00,40.684486,-73.74863,QUEENS,1.0,0.0,0,0,0,0,1,0,4396401,2021-03-05 05:00:00,2021-03-05T05:00,2021,3,-5.8,0.0,Clear
06/29/2021,0:00,40.67906,-73.81936,QUEENS,1.0,0.0,0,0,0,0,1,0,4431983,2021-06-29 00:00:00,2021-06-29T00:00,2021,6,25.5,0.0,Clear
07/22/2021,13:00,40.751637,-73.80518,QUEENS,0.0,0.0,0,0,0,0,0,0,4439500,2021-07-22 13:00:00,2021-07-22T13:00,2021,7,26.8,0.0,Cloudy
07/02/2021,21:00,40.76132,-73.9171,QUEENS,2.0,0.0,0,0,0,0,2,0,4434152,2021-07-02 21:00:00,2021-07-02T21:00,2021,7,20.5,5.7,Heavy Rain
11/07/2021,20:00,40.66544,-73.83519,QUEENS,1.0,0.0,0,0,0,0,1,0,4474985,2021-11-07 20:00:00,2021-11-07T20:00,2021,11,7.3,0.0,Cloudy
08/10/2021,7:00,40.601723,-73.74904,QUEENS,0.0,0.0,0,0,0,0,0,0,4446703,2021-08-10 07:00:00,2021-08-10T07:00,2021,8,22.7,0.0,Clear
07/24/2021,15:00,40.760853,-73.72294,QUEENS,3.0,0.0,0,0,0,0,3,0,4439933,2021-07-24 15:00:00,2021-07-24T15:00,2021,7,24.6,0.0,Cloudy
03/11/2021,21:00,40.69283,-73.795166,QUEENS,0.0,0.0,0,0,0,0,0,0,4399092,2021-03-11 21:00:00,2021-03-11T21:00,2021,3,11.3,0.0,Clear
06/22/2021,22:00,40.701046,-73.89153,QUEENS,1.0,0.0,0,0,0,0,1,0,4431503,2021-06-22 22:00:00,2021-06-22T22:00,2021,6,15.7,0.0,Cloudy
10/22/2021,19:00,40.7285596,-73.8285226,QUEENS,0.0,0.0,0,0,0,0,0,0,4470040,2021-10-22 19:00:00,2021-10-22T19:00,2021,10,16.0,0.0,Cloudy
07/10/2021,0:00,40.75564,-73.86697,QUEENS,1.0,0.0,0,0,1,0,0,0,4436885,2021-07-10 00:00:00,2021-07-10T00:00,2021,7,22.7,0.0,Clear
06/02/2021,14:00,40.76985,-73.92295,QUEENS,1.0,0.0,0,0,0,0,1,0,4423802,2021-06-02 14:00:00,2021-06-02T14:00,2021,6,20.1,0.0,Cloudy
04/07/2021,12:00,40.755737,-73.87687,QUEENS,0.0,0.0,0,0,0,0,0,0,4406345,2021-04-07 12:00:00,2021-04-07T12:00,2021,4,17.4,0.0,Cloudy
03/26/2021,10:00,40.745476,-73.90446,QUEENS,1.0,0.0,0,0,1,0,0,0,4402301,2021-03-26 10:00:00,2021-03-26T10:00,2021,3,17.7,0.1,Drizzle
11/19/2021,20:00,40.712708,-73.78357,QUEENS,4.0,0.0,0,0,0,0,4,0,4479689,2021-11-19 20:00:00,2021-11-19T20:00,2021,11,4.8,0.0,Clear
06/20/2021,12:00,40.67129,-73.838066,QUEENS,1.0,0.0,0,0,1,0,0,0,4429191,2021-06-20 12:00:00,2021-06-20T12:00,2021,6,26.4,0.0,Cloudy
11/25/2021,21:00,40.72469,-73.7541,QUEENS,0.0,0.0,0,0,0,0,0,0,4481108,2021-11-25 21:00:00,2021-11-25T21:00,2021,11,8.9,0.0,Cloudy
07/07/2021,11:00,40.743084,-73.9358,QUEENS,1.0,0.0,0,0,1,0,0,0,4434910,2021-07-07 11:00:00,2021-07-07T11:00,2021,7,30.0,0.0,Clear
07/09/2021,12:00,40.76407,-73.80914,QUEENS,1.0,0.0,1,0,0,0,0,0,4435807,2021-07-09 12:00:00,2021-07-09T12:00,2021,7,26.5,0.0,Cloudy
04/24/2021,14:00,40.669395,-73.80771,QUEENS,2.0,0.0,0,0,0,0,2,0,4410243,2021-04-24 14:00:00,2021-04-24T14:00,2021,4,15.8,0.0,Cloudy
08/15/2021,22:00,40.711468,-73.80919,QUEENS,2.0,0.0,0,0,0,0,2,0,4447885,2021-08-15 22:00:00,2021-08-15T22:00,2021,8,21.9,0.0,Cloudy
01/12/2021,8:00,40.76405,-73.88312,QUEENS,0.0,0.0,0,0,0,0,0,0,4384136,2021-01-12 08:00:00,2021-01-12T08:00,2021,1,-2.3,0.0,Clear
01/30/2021,14:00,40.7535,-73.90492,QUEENS,1.0,0.0,1,0,0,0,0,0,4387886,2021-01-30 14:00:00,2021-01-30T14:00,2021,1,0.2,0.0,Clear
07/07/2021,21:00,40.704178,-73.88953,QUEENS,1.0,0.0,0,0,0,0,1,0,4435771,2021-07-07 21:00:00,2021-07-07T21:00,2021,7,26.0,0.0,Clear
05/14/2021,6:00,40.760338,-73.89477,QUEENS,0.0,0.0,0,0,0,0,0,0,4417315,2021-05-14 06:00:00,2021-05-14T06:00,2021,5,10.0,0.0,Clear
06/15/2021,20:00,0.0,0.0,QUEENS,1.0,0.0,0,0,1,0,0,0,4428657,2021-06-15 20:00:00,2021-06-15T20:00,2021,6,26.6,0.1,Drizzle
05/28/2021,16:00,40.77075,-73.78581,QUEENS,1.0,0.0,0,0,0,0,1,0,4421417,2021-05-28 16:00:00,2021-05-28T16:00,2021,5,14.0,1.2,Drizzle
08/12/2021,19:00,40.68439,-73.83094,QUEENS,0.0,0.0,0,0,0,0,0,0,4446492,2021-08-12 19:00:00,2021-08-12T19:00,2021,8,26.7,0.0,Clear
07/26/2021,15:00,40.70576,-73.80167,QUEENS,1.0,0.0,1,0,0,0,0,0,4441017,2021-07-26 15:00:00,2021-07-26T15:00,2021,7,31.6,0.0,Clear
04/15/2021,11:00,40.681484,-73.85049,QUEENS,1.0,0.0,0,0,0,0,1,0,4407762,2021-04-15 11:00:00,2021-04-15T11:00,2021,4,10.2,1.3,Light Rain
07/18/2021,18:00,40.594955,-73.78627,QUEENS,0.0,0.0,0,0,0,0,0,0,4438258,2021-07-18 18:00:00,2021-07-18T18:00,2021,7,26.4,0.0,Cloudy
11/19/2021,23:00,40.755764,-73.91218,QUEENS,3.0,0.0,0,0,0,0,3,0,4480144,2021-11-19 23:00:00,2021-11-19T23:00,2021,11,3.0,0.0,Clear
09/06/2021,16:00,40.685276,-73.77241,QUEENS,2.0,0.0,0,0,0,0,2,0,4454348,2021-09-06 16:00:00,2021-09-06T16:00,2021,9,26.3,0.0,Clear
07/17/2021,20:00,40.746033,-73.93441,QUEENS,0.0,0.0,0,0,0,0,0,0,4437718,2021-07-17 20:00:00,2021-07-17T20:00,2021,7,25.0,1.8,Light Rain
11/15/2021,17:00,40.712284,-73.78536,QUEENS,1.0,0.0,1,0,0,0,0,0,4477717,2021-11-15 17:00:00,2021-11-15T17:00,2021,11,7.1,0.0,Clear
09/19/2021,23:00,40.67544,-73.85322,QUEENS,1.0,0.0,0,0,0,0,0,0,4458902,2021-09-19 23:00:00,2021-09-19T23:00,2021,9,18.9,0.0,Clear
01/17/2021,17:00,40.669323,-73.74998,QUEENS,1.0,0.0,1,0,0,0,0,0,4384581,2021-01-17 17:00:00,2021-01-17T17:00,2021,1,5.4,0.0,Clear
07/08/2021,12:00,40.671932,-73.85165,QUEENS,1.0,0.0,0,0,0,0,1,0,4435390,2021-07-08 12:00:00,2021-07-08T12:00,2021,7,26.4,0.0,Cloudy
11/17/2021,12:00,40.678078,-73.72602,QUEENS,3.0,0.0,0,0,0,0,3,0,4478599,2021-11-17 12:00:00,2021-11-17T12:00,2021,11,11.5,0.0,Cloudy
11/19/2021,0:00,40.745594,-73.9034,QUEENS,1.0,0.0,0,0,1,0,0,0,4479293,2021-11-19 00:00:00,2021-11-19T00:00,2021,11,8.4,0.6,Drizzle
01/09/2021,22:00,40.664192,-73.841125,QUEENS,4.0,0.0,0,0,0,0,4,0,4382798,2021-01-09 22:00:00,2021-01-09T22:00,2021,1,0.4,0.0,Clear
05/10/2021,6:00,40.68074,-73.76963,QUEENS,2.0,0.0,0,0,0,0,2,0,4415427,2021-05-10 06:00:00,2021-05-10T06:00,2021,5,9.1,0.0,Cloudy
04/03/2021,14:00,40.680115,-73.75324,QUEENS,1.0,0.0,0,0,0,0,1,0,4404062,2021-04-03 14:00:00,2021-04-03T14:00,2021,4,9.6,0.0,Clear
02/10/2021,17:00,40.67063,-73.75643,QUEENS,1.0,0.0,0,0,0,0,1,0,4391209,2021-02-10 17:00:00,2021-02-10T17:00,2021,2,-0.4,0.0,Cloudy
02/28/2021,15:00,40.764786,-73.746086,QUEENS,1.0,0.0,0,0,0,0,1,0,4395404,2021-02-28 15:00:00,2021-02-28T15:00,2021,2,6.5,0.5,Drizzle
07/06/2021,22:00,40.755234,-73.941246,QUEENS,1.0,0.0,1,0,0,0,0,0,4435701,2021-07-06 22:00:00,2021-07-06T22:00,2021,7,23.5,0.6,Drizzle
04/29/2021,1:00,40.673748,-73.84324,QUEENS,1.0,0.0,0,0,0,0,1,0,4411837,2021-04-29 01:00:00,2021-04-29T01:00,2021,4,12.9,0.0,Cloudy
11/22/2021,22:00,40.601204,-74.06509,STATEN ISLAND,0.0,0.0,0,0,0,0,0,0,4482270,2021-11-22 22:00:00,2021-11-22T22:00,2021,11,3.2,0.0,Cloudy
01/23/2021,23:00,40.506756,-74.23307,STATEN ISLAND,0.0,0.0,0,0,0,0,0,0,4386212,2021-01-23 23:00:00,2021-01-23T23:00,2021,1,-4.5,0.0,Clear
03/26/2021,14:00,40.56717,-74.113075,STATEN ISLAND,0.0,0.0,0,0,0,0,0,0,4402464,2021-03-26 14:00:00,2021-03-26T14:00,2021,3,24.5,0.0,Cloudy
05/02/2021,11:00,40.620686,-74.11002,STATEN ISLAND,2.0,0.0,0,0,0,0,2,0,4414512,2021-05-02 11:00:00,2021-05-02T11:00,2021,5,20.8,0.0,Cloudy
08/03/2021,19:00,40.633953,-74.085754,STATEN ISLAND,1.0,0.0,0,0,0,0,1,0,4444102,2021-08-03 19:00:00,2021-08-03T19:00,2021,8,21.1,0.0,Cloudy
04/04/2021,23:00,40.56763,-74.11263,STATEN ISLAND,1.0,0.0,0,0,0,0,1,0,4404687,2021-04-04 23:00:00,2021-04-04T23:00,2021,4,9.5,0.0,Clear
10/15/2021,17:00,40.5765659,-74.1066689,STATEN ISLAND,1.0,0.0,0,0,0,0,1,0,4467532,2021-10-15 17:00:00,2021-10-15T17:00,2021,10,21.5,0.0,Cloudy
05/15/2021,22:00,40.574627,-74.1056,STATEN ISLAND,1.0,0.0,0,0,0,0,1,0,4417452,2021-05-15 22:00:00,2021-05-15T22:00,2021,5,15.5,0.0,Cloudy
09/05/2021,23:00,40.624256,-74.080696,STATEN ISLAND,1.0,0.0,0,0,1,0,0,0,4454562,2021-09-05 23:00:00,2021-09-05T23:00,2021,9,21.1,0.0,Cloudy
04/14/2021,17:00,40.540833,-74.159386,STATEN ISLAND,0.0,0.0,0,0,0,0,0,0,4407343,2021-04-14 17:00:00,2021-04-14T17:00,2021,4,15.1,0.1,Drizzle
02/21/2021,8:00,40.637135,-74.08203,STATEN ISLAND,1.0,0.0,0,0,0,0,1,0,4394439,2021-02-21 08:00:00,2021-02-21T08:00,2021,2,-7.1,0.0,Clear
08/22/2021,0:00,40.608673,-74.0828,STATEN ISLAND,7.0,0.0,0,0,0,0,7,0,4449791,2021-08-22 00:00:00,2021-08-22T00:00,2021,8,23.2,0.0,Cloudy
06/30/2021,18:00,40.56146,-74.16097,STATEN ISLAND,2.0,0.0,0,0,0,0,2,0,4433076,2021-06-30 18:00:00,2021-06-30T18:00,2021,6,34.2,0.0,Clear
03/13/2021,19:00,40.605713,-74.09459,STATEN ISLAND,1.0,0.0,0,0,0,0,1,0,4398955,2021-03-13 19:00:00,2021-03-13T19:00,2021,3,5.5,0.0,Clear
11/13/2021,3:00,40.631447,-74.098885,STATEN ISLAND,0.0,0.0,0,0,0,0,0,0,4477068,2021-11-13 03:00:00,2021-11-13T03:00,2021,11,9.7,0.0,Clear
11/30/2021,13:00,40.529453,-74.211006,STATEN ISLAND,4.0,0.0,0,0,0,0,4,0,4482953,2021-11-30 13:00:00,2021-11-30T13:00,2021,11,4.8,0.0,Cloudy
12/15/2021,18:00,40.552784,-74.2119,STATEN ISLAND,0.0,0.0,0,0,0,0,0,0,4488027,2021-12-15 18:00:00,2021-12-15T18:00,2021,12,9.9,0.0,Cloudy
09/30/2021,10:00,40.549427,-74.16019,STATEN ISLAND,1.0,0.0,0,0,0,0,1,0,4464280,2021-09-30 10:00:00,2021-09-30T10:00,2021,9,16.8,0.0,Clear
04/22/2021,13:00,40.56709,-74.12167,STATEN ISLAND,0.0,0.0,0,0,0,0,0,0,4409712,2021-04-22 13:00:00,2021-04-22T13:00,2021,4,8.0,0.0,Cloudy
01/12/2021,18:00,40.582195,-74.1103,STATEN ISLAND,1.0,0.0,0,0,0,0,1,0,4383839,2021-01-12 18:00:00,2021-01-12T18:00,2021,1,0.1,0.0,Cloudy
11/30/2021,0:00,40.531918,-74.19175,STATEN ISLAND,1.0,0.0,1,0,0,0,0,0,4484161,2021-11-30 00:00:00,2021-11-30T00:00,2021,11,-1.4,0.0,Clear
12/28/2021,15:00,40.52418,-74.2348,STATEN ISLAND,1.0,0.0,0,0,0,0,1,0,4490247,2021-12-28 15:00:00,2021-12-28T15:00,2021,12,7.7,0.0,Cloudy
10/01/2021,16:00,40.56895,-74.12491,STATEN ISLAND,1.0,0.0,1,0,0,0,0,0,4463045,2021-10-01 16:00:00,2021-10-01T16:00,2021,10,19.5,0.0,Clear
03/24/2021,19:00,0.0,0.0,STATEN ISLAND,1.0,0.0,0,0,0,0,1,0,4401722,2021-03-24 19:00:00,2021-03-24T19:00,2021,3,24.8,2.1,Light Rain
06/27/2021,21:00,40.602135,-74.114876,STATEN ISLAND,1.0,0.0,0,0,0,0,1,0,4432537,2021-06-27 21:00:00,2021-06-27T21:00,2021,6,25.7,0.0,Cloudy
11/20/2021,15:00,40.634747,-74.11226,STATEN ISLAND,1.0,0.0,0,0,0,0,1,0,4479678,2021-11-20 15:00:00,2021-11-20T15:00,2021,11,6.9,0.0,Cloudy
05/11/2021,13:00,40.567455,-74.11279,STATEN ISLAND,0.0,0.0,0,0,0,0,0,0,4415561,2021-05-11 13:00:00,2021-05-11T13:00,2021,5,16.5,0.0,Cloudy
10/13/2021,14:00,40.5308713,-74.193986,STATEN ISLAND,1.0,0.0,0,0,0,0,1,0,4467325,2021-10-13 14:00:00,2021-10-13T14:00,2021,10,21.9,0.0,Cloudy
05/13/2021,16:00,40.564972,-74.13048,STATEN ISLAND,0.0,0.0,0,0,0,0,0,0,4416478,2021-05-13 16:00:00,2021-05-13T16:00,2021,5,17.1,0.0,Clear
07/09/2021,16:00,40.59142,-74.08471,STATEN ISLAND,2.0,0.0,0,0,0,0,2,0,4435495,2021-07-09 16:00:00,2021-07-09T16:00,2021,7,29.4,0.0,Clear
05/22/2021,0:00,40.51867,-74.22236,STATEN ISLAND,0.0,0.0,0,0,0,0,0,0,4532650,2021-05-22 00:00:00,2021-05-22T00:00,2021,5,20.3,0.0,Cloudy
08/21/2021,17:00,40.528,-74.23547,STATEN ISLAND,0.0,0.0,0,0,0,0,0,0,4449335,2021-08-21 17:00:00,2021-08-21T17:00,2021,8,25.1,0.3,Drizzle
06/06/2021,12:00,40.543728,-74.21876,STATEN ISLAND,1.0,0.0,0,0,0,0,1,0,4425667,2021-06-06 12:00:00,2021-06-06T12:00,2021,6,31.2,0.0,Clear
04/24/2021,14:00,40.606693,-74.07593,STATEN ISLAND,0.0,0.0,0,0,0,0,0,0,4410997,2021-04-24 14:00:00,2021-04-24T14:00,2021,4,17.1,0.0,Cloudy
04/01/2021,22:00,40.570465,-74.10977,STATEN ISLAND,2.0,0.0,0,0,0,0,2,0,4403951,2021-04-01 22:00:00,2021-04-01T22:00,2021,4,3.7,0.0,Clear
05/22/2021,23:00,40.60057,-74.11339,STATEN ISLAND,2.0,0.0,0,0,0,0,2,0,4419084,2021-05-22 23:00:00,2021-05-22T23:00,2021,5,22.1,0.0,Clear
07/17/2021,12:00,40.589066,-74.138626,STATEN ISLAND,0.0,0.0,0,0,0,0,0,0,4439376,2021-07-17 12:00:00,2021-07-17T12:00,2021,7,29.8,0.0,Cloudy
09/30/2021,13:00,40.616413,-74.103516,STATEN ISLAND,1.0,0.0,0,0,0,0,1,0,4463440,2021-09-30 13:00:00,2021-09-30T13:00,2021,9,18.3,0.0,Cloudy
09/27/2021,0:00,40.638103,-74.077934,STATEN ISLAND,1.0,0.0,0,0,0,0,1,0,4462144,2021-09-27 00:00:00,2021-09-27T00:00,2021,9,14.9,0.0,Clear
10/29/2021,19:00,40.58893,-74.09525,STATEN ISLAND,0.0,0.0,0,0,0,0,0,0,4474947,2021-10-29 19:00:00,2021-10-29T19:00,2021,10,12.7,1.3,Light Rain
02/07/2021,10:00,40.62278,-74.10475,STATEN ISLAND,1.0,0.0,0,0,0,0,1,0,4390724,2021-02-07 10:00:00,2021-02-07T10:00,2021,2,0.1,0.6,Heavy Snow
06/24/2021,18:00,40.5232,-74.234886,STATEN ISLAND,0.0,0.0,0,0,0,0,0,0,4430760,2021-06-24 18:00:00,2021-06-24T18:00,2021,6,19.5,0.0,Clear
07/20/2021,9:00,40.63951,-74.09775,STATEN ISLAND,1.0,0.0,0,0,0,0,1,0,4439086,2021-07-20 09:00:00,2021-07-20T09:00,2021,7,27.1,0.0,Clear
07/24/2021,2:00,40.551563,-74.1453,STATEN ISLAND,1.0,0.0,0,0,0,0,1,0,4440219,2021-07-24 02:00:00,2021-07-24T02:00,2021,7,18.8,0.0,Clear
08/14/2021,21:00,40.645775,-74.09168,STATEN ISLAND,1.0,0.0,0,0,0,0,1,0,4448378,2021-08-14 21:00:00,2021-08-14T21:00,2021,8,25.5,0.0,Cloudy
12/16/2021,15:00,40.54653,-74.180435,STATEN ISLAND,2.0,0.0,0,0,0,0,2,0,4490221,2021-12-16 15:00:00,2021-12-16T15:00,2021,12,14.7,0.0,Cloudy
03/10/2021,9:00,40.630302,-74.08141,STATEN ISLAND,1.0,0.0,0,0,0,0,1,0,4405359,2021-03-10 09:00:00,2021-03-10T09:00,2021,3,3.7,0.0,Clear
02/21/2021,0:00,40.561512,-74.171844,STATEN ISLAND,1.0,0.0,0,0,0,0,1,0,4395362,2021-02-21 00:00:00,2021-02-21T00:00,2021,2,-6.6,0.0,Clear
12/22/2021,9:00,40.59075,-74.08837,STATEN ISLAND,1.0,0.0,0,0,0,0,1,0,4489009,2021-12-22 09:00:00,2021-12-22T09:00,2021,12,5.1,0.0,Cloudy
12/30/2021,0:00,40.563663,-74.13252,STATEN ISLAND,1.0,0.0,1,0,0,0,0,0,4490665,2021-12-30 00:00:00,2021-12-30T00:00,2021,12,5.4,0.0,Cloudy
05/15/2021,1:00,40.619,-74.084785,STATEN ISLAND,0.0,0.0,0,0,0,0,0,0,4416860,2021-05-15 01:00:00,2021-05-15T01:00,2021,5,13.2,0.0,Clear
11/10/2021,13:00,40.570465,-74.10977,STATEN ISLAND,2.0,0.0,0,0,0,0,2,0,4476422,2021-11-10 13:00:00,2021-11-10T13:00,2021,11,17.2,0.0,Clear
04/09/2021,11:00,40.638023,-74.09387,STATEN ISLAND,0.0,0.0,0,0,0,0,0,0,4407058,2021-04-09 11:00:00,2021-04-09T11:00,2021,4,11.5,0.0,Cloudy
11/02/2021,19:00,40.61118,-74.105606,STATEN ISLAND,1.0,0.0,0,0,1,0,0,0,4473794,2021-11-02 19:00:00,2021-11-02T19:00,2021,11,9.0,0.1,Drizzle
11/08/2021,16:00,40.576504,-74.1037,STATEN ISLAND,0.0,0.0,0,0,0,0,0,0,4476419,2021-11-08 16:00:00,2021-11-08T16:00,2021,11,15.2,0.0,Clear
02/10/2021,9:00,40.64553,-74.07766,STATEN ISLAND,0.0,0.0,0,0,0,0,0,0,4392451,2021-02-10 09:00:00,2021-02-10T09:00,2021,2,-5.1,0.0,Cloudy
11/06/2021,10:00,40.55609,-74.1688,STATEN ISLAND,1.0,0.0,1,0,0,0,0,0,4476079,2021-11-06 10:00:00,2021-11-06T10:00,2021,11,9.1,0.0,Clear
12/17/2021,14:00,40.526894,-74.16728,STATEN ISLAND,1.0,0.0,0,0,0,0,1,0,4488395,2021-12-17 14:00:00,2021-12-17T14:00,2021,12,13.6,0.0,Cloudy
11/16/2021,10:00,40.609856,-74.07444,STATEN ISLAND,1.0,0.0,0,0,0,0,1,0,4478000,2021-11-16 10:00:00,2021-11-16T10:00,2021,11,6.2,0.0,Clear
03/10/2021,22:00,40.619728,-74.08358,STATEN ISLAND,1.0,0.0,0,0,0,0,1,0,4398320,2021-03-10 22:00:00,2021-03-10T22:00,2021,3,5.0,0.0,Cloudy
03/22/2021,19:00,40.5516,-74.190155,STATEN ISLAND,0.0,0.0,0,0,0,0,0,0,4401719,2021-03-22 19:00:00,2021-03-22T19:00,2021,3,5.2,0.0,Clear
02/03/2021,9:00,40.570465,-74.10977,STATEN ISLAND,1.0,0.0,0,0,0,0,1,0,4388973,2021-02-03 09:00:00,2021-02-03T09:00,2021,2,-0.7,0.1,Light Snow
07/12/2021,17:00,40.534267,-74.15398,STATEN ISLAND,1.0,0.0,0,0,0,0,1,0,4437063,2021-07-12 17:00:00,2021-07-12T17:00,2021,7,26.5,0.0,Cloudy
10/17/2021,14:00,40.6068651,-74.0880403,STATEN ISLAND,2.0,0.0,0,0,0,0,2,0,4467954,2021-10-17 14:00:00,2021-10-17T14:00,2021,10,17.2,0.0,Clear
08/03/2021,17:00,40.5426,-74.208336,STATEN ISLAND,2.0,0.0,0,0,0,0,2,0,4444020,2021-08-03 17:00:00,2021-08-03T17:00,2021,8,23.2,0.0,Cloudy
10/27/2021,16:00,40.594807,-74.08633,STATEN ISLAND,0.0,0.0,0,0,0,0,0,0,4473807,2021-10-27 16:00:00,2021-10-27T16:00,2021,10,15.2,0.0,Cloudy
06/23/2021,15:00,40.611423,-74.085655,STATEN ISLAND,2.0,0.0,0,0,0,0,2,0,4430583,2021-06-23 15:00:00,2021-06-23T15:00,2021,6,23.3,0.0,Cloudy
06/15/2021,12:00,40.563774,-74.15586,STATEN ISLAND,1.0,0.0,0,0,0,0,1,0,4427744,2021-06-15 12:00:00,2021-06-15T12:00,2021,6,25.6,0.0,Clear
04/21/2021,12:00,40.615753,-74.08754,STATEN ISLAND,1.0,0.0,0,0,0,0,1,0,4409346,2021-04-21 12:00:00,2021-04-21T12:00,2021,4,17.9,0.0,Cloudy
04/13/2021,19:00,40.628723,-74.08304,STATEN ISLAND,1.0,0.0,0,0,0,0,1,0,4408603,2021-04-13 19:00:00,2021-04-13T19:00,2021,4,11.4,0.0,Clear
11/03/2021,10:00,40.535892,-74.158485,STATEN ISLAND,0.0,0.0,0,0,0,0,0,0,4474282,2021-11-03 10:00:00,2021-11-03T10:00,2021,11,8.2,0.0,Clear
02/27/2021,22:00,40.553356,-74.18506,STATEN ISLAND,1.0,0.0,0,0,0,0,1,0,4395390,2021-02-27 22:00:00,2021-02-27T22:00,2021,2,3.3,0.0,Cloudy
11/01/2021,17:00,40.580727,-74.10757,STATEN ISLAND,1.0,0.0,0,0,0,0,1,0,4473819,2021-11-01 17:00:00,2021-11-01T17:00,2021,11,12.7,0.0,Clear
10/30/2021,22:00,40.590313,-74.09794,STATEN ISLAND,0.0,0.0,0,0,0,0,0,0,4472358,2021-10-30 22:00:00,2021-10-30T22:00,2021,10,14.2,0.6,Drizzle
02/21/2021,11:00,40.540657,-74.14739,STATEN ISLAND,1.0,0.0,0,0,0,0,1,0,4393474,2021-02-21 11:00:00,2021-02-21T11:00,2021,2,-1.2,0.0,Clear
06/23/2021,13:00,40.6315,-74.08775,STATEN ISLAND,2.0,0.0,0,0,0,0,2,0,4430582,2021-06-23 13:00:00,2021-06-23T13:00,2021,6,22.1,0.0,Cloudy
05/23/2021,3:00,40.54387,-74.14445,STATEN ISLAND,1.0,0.0,0,0,0,0,1,0,4419843,2021-05-23 03:00:00,2021-05-23T03:00,2021,5,20.6,0.0,Cloudy
11/22/2021,20:00,40.583572,-74.08621,STATEN ISLAND,0.0,0.0,0,0,0,0,0,0,4480163,2021-11-22 20:00:00,2021-11-22T20:00,2021,11,4.6,0.0,Cloudy
